aiter/ops/triton/configs/conv/gfx1200-CONV-1X1.json
{
    "shapes": {
        "N=1,C=1024,H=14,W=14,K=2048,R=1,S=1,sh=2,sw=2,ph=0,pw=0,dh=1,dw=1": {
            "BLOCK_M": 64,
            "BLOCK_N": 64,
            "BLOCK_K": 64,
            "GROUP_SIZE_M": 4,
            "num_warps": 4,
            "num_stages": 1
        },
        "N=1,C=1024,H=14,W=14,K=256,R=1,S=1,sh=1,sw=1,ph=0,pw=0,dh=1,dw=1": {
            "BLOCK_M": 64,
            "BLOCK_N": 64,
            "BLOCK_K": 64,
            "GROUP_SIZE_M": 4,
            "num_warps": 4,
            "num_stages": 1
        },
        "N=1,C=1024,H=14,W=14,K=512,R=1,S=1,sh=1,sw=1,ph=0,pw=0,dh=1,dw=1": {
            "BLOCK_M": 64,
            "BLOCK_N": 64,
            "BLOCK_K": 64,
            "GROUP_SIZE_M": 4,
            "num_warps": 4,
            "num_stages": 1
        },
        "N=1,C=128,H=256,W=256,K=256,R=1,S=1,sh=1,sw=1,ph=0,pw=0,dh=1,dw=1": {
            "BLOCK_M": 128,
            "BLOCK_N": 128,
            "BLOCK_K": 32,
            "GROUP_SIZE_M": 4,
            "num_warps": 8,
            "num_stages": 1
        },
        "N=1,C=128,H=28,W=28,K=512,R=1,S=1,sh=1,sw=1,ph=0,pw=0,dh=1,dw=1": {
            "BLOCK_M": 64,
            "BLOCK_N": 64,
            "BLOCK_K": 32,
            "GROUP_SIZE_M": 4,
            "num_warps": 4,
            "num_stages": 1
        },
        "N=1,C=2048,H=7,W=7,K=512,R=1,S=1,sh=1,sw=1,ph=0,pw=0,dh=1,dw=1": {
            "BLOCK_M": 64,
            "BLOCK_N": 64,
            "BLOCK_K": 64,
            "GROUP_SIZE_M": 4,
            "num_warps": 4,
            "num_stages": 1
        },
        "N=1,C=256,H=128,W=128,K=512,R=1,S=1,sh=1,sw=1,ph=0,pw=0,dh=1,dw=1": {
            "BLOCK_M": 128,
            "BLOCK_N": 128,
            "BLOCK_K": 64,
            "GROUP_SIZE_M": 8,
            "num_warps": 8,
            "num_stages": 1
        },
        "N=1,C=256,H=14,W=14,K=1024,R=1,S=1,sh=1,sw=1,ph=0,pw=0,dh=1,dw=1": {
            "BLOCK_M": 64,
            "BLOCK_N": 64,
            "BLOCK_K": 64,
            "GROUP_SIZE_M": 4,
            "num_warps": 4,
            "num_stages": 1
        },
        "N=1,C=256,H=512,W=512,K=128,R=1,S=1,sh=1,sw=1,ph=0,pw=0,dh=1,dw=1": {
            "BLOCK_M": 128,
            "BLOCK_N": 128,
            "BLOCK_K": 32,
            "GROUP_SIZE_M": 4,
            "num_warps": 8,
            "num_stages": 1
        },
        "N=1,C=256,H=56,W=56,K=128,R=1,S=1,sh=1,sw=1,ph=0,pw=0,dh=1,dw=1": {
            "BLOCK_M": 64,
            "BLOCK_N": 64,
            "BLOCK_K": 32,
            "GROUP_SIZE_M": 4,
            "num_warps": 4,
            "num_stages": 1
        },
        "N=1,C=256,H=56,W=56,K=512,R=1,S=1,sh=2,sw=2,ph=0,pw=0,dh=1,dw=1": {
            "BLOCK_M": 64,
            "BLOCK_N": 128,
            "BLOCK_K": 64,
            "GROUP_SIZE_M": 8,
            "num_warps": 4,
            "num_stages": 1
        },
        "N=1,C=256,H=56,W=56,K=64,R=1,S=1,sh=1,sw=1,ph=0,pw=0,dh=1,dw=1": {
            "BLOCK_M": 64,
            "BLOCK_N": 64,
            "BLOCK_K": 32,
            "GROUP_SIZE_M": 4,
            "num_warps": 4,
            "num_stages": 1
        },
        "N=1,C=32,H=64,W=64,K=32,R=1,S=1,sh=1,sw=1,ph=0,pw=0,dh=1,dw=1": {
            "BLOCK_M": 64,
            "BLOCK_N": 64,
            "BLOCK_K": 32,
            "GROUP_SIZE_M": 4,
            "num_warps": 4,
            "num_stages": 1
        },
        "N=1,C=512,H=256,W=256,K=256,R=1,S=1,sh=1,sw=1,ph=0,pw=0,dh=1,dw=1": {
            "BLOCK_M": 128,
            "BLOCK_N": 128,
            "BLOCK_K": 32,
            "GROUP_SIZE_M": 4,
            "num_warps": 8,
            "num_stages": 1
        },
        "N=1,C=512,H=28,W=28,K=1024,R=1,S=1,sh=2,sw=2,ph=0,pw=0,dh=1,dw=1": {
            "BLOCK_M": 64,
            "BLOCK_N": 64,
            "BLOCK_K": 64,
            "GROUP_SIZE_M": 4,
            "num_warps": 4,
            "num_stages": 1
        },
        "N=1,C=512,H=28,W=28,K=128,R=1,S=1,sh=1,sw=1,ph=0,pw=0,dh=1,dw=1": {
            "BLOCK_M": 64,
            "BLOCK_N": 64,
            "BLOCK_K": 64,
            "GROUP_SIZE_M": 4,
            "num_warps": 4,
            "num_stages": 1
        },
        "N=1,C=512,H=28,W=28,K=256,R=1,S=1,sh=1,sw=1,ph=0,pw=0,dh=1,dw=1": {
            "BLOCK_M": 64,
            "BLOCK_N": 64,
            "BLOCK_K": 64,
            "GROUP_SIZE_M": 4,
            "num_warps": 4,
            "num_stages": 1
        },
        "N=1,C=512,H=7,W=7,K=2048,R=1,S=1,sh=1,sw=1,ph=0,pw=0,dh=1,dw=1": {
            "BLOCK_M": 64,
            "BLOCK_N": 64,
            "BLOCK_K": 64,
            "GROUP_SIZE_M": 4,
            "num_warps": 4,
            "num_stages": 1
        },
        "N=1,C=64,H=56,W=56,K=256,R=1,S=1,sh=1,sw=1,ph=0,pw=0,dh=1,dw=1": {
            "BLOCK_M": 64,
            "BLOCK_N": 64,
            "BLOCK_K": 32,
            "GROUP_SIZE_M": 4,
            "num_warps": 4,
            "num_stages": 1
        },
        "N=1,C=64,H=56,W=56,K=64,R=1,S=1,sh=1,sw=1,ph=0,pw=0,dh=1,dw=1": {
            "BLOCK_M": 64,
            "BLOCK_N": 64,
            "BLOCK_K": 32,
            "GROUP_SIZE_M": 4,
            "num_warps": 4,
            "num_stages": 1
        },
        "N=1,C=64,H=64,W=64,K=64,R=1,S=1,sh=1,sw=1,ph=0,pw=0,dh=1,dw=1": {
            "BLOCK_M": 64,
            "BLOCK_N": 64,
            "BLOCK_K": 64,
            "GROUP_SIZE_M": 4,
            "num_warps": 4,
            "num_stages": 1
        }
    },
    "M_LEQ_1024": {
        "BLOCK_M": 64,
        "BLOCK_N": 64,
        "BLOCK_K": 64,
        "GROUP_SIZE_M": 4,
        "num_warps": 4,
        "num_stages": 1
    },
    "M_LEQ_4096": {
        "BLOCK_M": 64,
        "BLOCK_N": 64,
        "BLOCK_K": 32,
        "GROUP_SIZE_M": 4,
        "num_warps": 4,
        "num_stages": 1
    },
    "any": {
        "BLOCK_M": 64,
        "BLOCK_N": 128,
        "BLOCK_K": 64,
        "GROUP_SIZE_M": 8,
        "num_warps": 4,
        "num_stages": 1
    }
}
