aiter/ops/triton/configs/gemm/gluon/gfx1250-BATCHED_GEMM-A16W16-B=8-N=1024-K=4096.json
{
    "M_LEQ_16": {
        "BLOCK_SIZE_M": 16,
        "BLOCK_SIZE_N": 64,
        "BLOCK_SIZE_K": 128,
        "GROUP_SIZE_M": 1,
        "num_warps": 4,
        "NUM_BUFFERS": 3,
        "waves_per_eu": 2,
        "matrix_instr_nonkdim": 16,
        "NUM_KSPLIT": 4,
        "cache_modifier": null,
        "kernel_type": "bandwidth_bound"
    },
    "M_LEQ_32": {
        "BLOCK_SIZE_M": 32,
        "BLOCK_SIZE_N": 128,
        "BLOCK_SIZE_K": 128,
        "GROUP_SIZE_M": 1,
        "num_warps": 4,
        "NUM_BUFFERS": 3,
        "waves_per_eu": 1,
        "matrix_instr_nonkdim": 16,
        "NUM_KSPLIT": 4,
        "cache_modifier": null,
        "kernel_type": "bandwidth_bound"
    },
    "M_LEQ_64": {
        "BLOCK_SIZE_M": 64,
        "BLOCK_SIZE_N": 64,
        "BLOCK_SIZE_K": 128,
        "GROUP_SIZE_M": 1,
        "num_warps": 4,
        "NUM_BUFFERS": 3,
        "waves_per_eu": 2,
        "matrix_instr_nonkdim": 16,
        "NUM_KSPLIT": 4,
        "cache_modifier": null,
        "kernel_type": "bandwidth_bound"
    },
    "M_LEQ_128": {
        "BLOCK_SIZE_M": 128,
        "BLOCK_SIZE_N": 64,
        "BLOCK_SIZE_K": 128,
        "GROUP_SIZE_M": 1,
        "num_warps": 4,
        "NUM_BUFFERS": 3,
        "waves_per_eu": 2,
        "matrix_instr_nonkdim": 16,
        "NUM_KSPLIT": 4,
        "cache_modifier": null,
        "kernel_type": "bandwidth_bound"
    },
    "M_LEQ_256": {
        "BLOCK_SIZE_M": 64,
        "BLOCK_SIZE_N": 64,
        "BLOCK_SIZE_K": 128,
        "GROUP_SIZE_M": 1,
        "num_warps": 4,
        "NUM_BUFFERS": 3,
        "waves_per_eu": 1,
        "matrix_instr_nonkdim": 16,
        "NUM_KSPLIT": 1,
        "cache_modifier": null,
        "kernel_type": "bandwidth_bound"
    },
    "any": {
        "BLOCK_SIZE_M": 128,
        "BLOCK_SIZE_N": 128,
        "BLOCK_SIZE_K": 128,
        "GROUP_SIZE_M": 1,
        "num_warps": 8,
        "NUM_BUFFERS": 3,
        "waves_per_eu": 2,
        "matrix_instr_nonkdim": 16,
        "NUM_KSPLIT": 1,
        "cache_modifier": null,
        "kernel_type": "bandwidth_bound"
    }
}
