aiter/ops/triton/configs/gemm/gluon/gfx950-GEMM-A8W8_BLOCKSCALE-N=2112-K=7168.json
{
  "M_LEQ_16": {
    "BLOCK_SIZE_M": 16,
    "BLOCK_SIZE_N": 16,
    "BLOCK_SIZE_K": 128,
    "GROUP_SIZE_M": 1,
    "num_warps": 2,
    "num_stages": 1,
    "waves_per_eu": 1,
    "matrix_instr_nonkdim": 16,
    "cache_modifier": ".cg",
    "NUM_KSPLIT": 14
  },
  "M_LEQ_32": {
    "BLOCK_SIZE_M": 16,
    "BLOCK_SIZE_N": 32,
    "BLOCK_SIZE_K": 128,
    "GROUP_SIZE_M": 4,
    "num_warps": 2,
    "num_stages": 2,
    "waves_per_eu": 1,
    "matrix_instr_nonkdim": 16,
    "cache_modifier": null,
    "NUM_KSPLIT": 7
  },
  "M_LEQ_64": {
    "BLOCK_SIZE_M": 32,
    "BLOCK_SIZE_N": 32,
    "BLOCK_SIZE_K": 128,
    "GROUP_SIZE_M": 4,
    "num_warps": 2,
    "num_stages": 1,
    "waves_per_eu": 1,
    "matrix_instr_nonkdim": 16,
    "cache_modifier": null,
    "NUM_KSPLIT": 7
  },
  "M_LEQ_128": {
    "BLOCK_SIZE_M": 64,
    "BLOCK_SIZE_N": 32,
    "BLOCK_SIZE_K": 128,
    "GROUP_SIZE_M": 1,
    "num_warps": 2,
    "num_stages": 2,
    "waves_per_eu": 1,
    "matrix_instr_nonkdim": 16,
    "cache_modifier": ".ca",
    "NUM_KSPLIT": 7
  },
  "M_LEQ_2048": {
    "BLOCK_SIZE_M": 128,
    "BLOCK_SIZE_N": 128,
    "BLOCK_SIZE_K": 128,
    "GROUP_SIZE_M": 1,
    "num_warps": 4,
    "num_stages": 2,
    "waves_per_eu": 2,
    "matrix_instr_nonkdim": 16,
    "cache_modifier": ".ca",
    "NUM_KSPLIT": 1
  },
  "any": {
    "BLOCK_SIZE_M": 128,
    "BLOCK_SIZE_N": 256,
    "BLOCK_SIZE_K": 128,
    "GROUP_SIZE_M": 4,
    "num_warps": 4,
    "num_stages": 2,
    "waves_per_eu": 1,
    "matrix_instr_nonkdim": 16,
    "cache_modifier": ".ca",
    "NUM_KSPLIT": 1
  }
}