aiter/ops/triton/configs/gemm/gfx1250-GEMM-A16W16-N=2880-K=4096.json
{
    "M_LEQ_64": {
        "BLOCK_M": 16,
        "BLOCK_N": 32,
        "BLOCK_K": 256,
        "NUM_BUFFERS": 5,
        "num_warps": 2
    },
    "M_LEQ_256": {
        "BLOCK_M": 64,
        "BLOCK_N": 64,
        "BLOCK_K": 256,
        "NUM_BUFFERS": 4,
        "num_warps": 4
    },
    "M_LEQ_512": {
        "BLOCK_M": 64,
        "BLOCK_N": 64,
        "BLOCK_K": 64,
        "NUM_BUFFERS": 5,
        "num_warps": 2
    },
    "M_LEQ_1024": {
        "BLOCK_M": 64,
        "BLOCK_N": 128,
        "BLOCK_K": 64,
        "NUM_BUFFERS": 5,
        "num_warps": 4
    },
    "any": {
        "BLOCK_M": 128,
        "BLOCK_N": 128,
        "BLOCK_K": 64,
        "NUM_BUFFERS": 3,
        "num_warps": 8
    }
}
