aiter/ops/triton/configs/gemm/gfx1250-BATCHED_GEMM-A16WFP4.json
{
    "_note": "gfx1250 stopgap: cloned from gfx1250-GEMM-A16WFP4.json (same arch + same A16WFP4 dtype, non-batched). Created to satisfy aiter get_gemm_config() which requires a per-arch default tuning file. NOT tuned for the batched A16WFP4 kernel on gfx1250 -> potential perf and precision-validation risk; revisit if accuracy checks fail. See run_ds-r1.sh notes.",
    "M_LEQ_8": {
        "BLOCK_SIZE_M": 16,
        "BLOCK_SIZE_N": 128,
        "BLOCK_SIZE_K": 512,
        "GROUP_SIZE_M": 1,
        "num_warps": 4,
        "num_stages": 1,
        "waves_per_eu": 2,
        "matrix_instr_nonkdim": 16,
        "cache_modifier": ".cg",
        "NUM_KSPLIT": 1
    },
    "M_LEQ_16": {
        "BLOCK_SIZE_M": 16,
        "BLOCK_SIZE_N": 128,
        "BLOCK_SIZE_K": 512,
        "GROUP_SIZE_M": 1,
        "num_warps": 4,
        "num_stages": 1,
        "waves_per_eu": 2,
        "matrix_instr_nonkdim": 16,
        "cache_modifier": ".cg",
        "NUM_KSPLIT": 1
    },
    "M_LEQ_32": {
        "BLOCK_SIZE_M": 16,
        "BLOCK_SIZE_N": 128,
        "BLOCK_SIZE_K": 512,
        "GROUP_SIZE_M": 1,
        "num_warps": 8,
        "num_stages": 1,
        "waves_per_eu": 2,
        "matrix_instr_nonkdim": 16,
        "cache_modifier": ".cg",
        "NUM_KSPLIT": 1
    },
    "M_LEQ_64": {
        "BLOCK_SIZE_M": 16,
        "BLOCK_SIZE_N": 128,
        "BLOCK_SIZE_K": 512,
        "GROUP_SIZE_M": 1,
        "num_warps": 8,
        "num_stages": 1,
        "waves_per_eu": 2,
        "matrix_instr_nonkdim": 16,
        "cache_modifier": ".cg",
        "NUM_KSPLIT": 1
    },
    "M_LEQ_128": {
        "BLOCK_SIZE_M": 16,
        "BLOCK_SIZE_N": 128,
        "BLOCK_SIZE_K": 512,
        "GROUP_SIZE_M": 1,
        "num_warps": 8,
        "num_stages": 1,
        "waves_per_eu": 2,
        "matrix_instr_nonkdim": 16,
        "cache_modifier": ".cg",
        "NUM_KSPLIT": 1
    },
    "M_LEQ_256": {
        "BLOCK_SIZE_M": 16,
        "BLOCK_SIZE_N": 128,
        "BLOCK_SIZE_K": 512,
        "GROUP_SIZE_M": 1,
        "num_warps": 8,
        "num_stages": 1,
        "waves_per_eu": 2,
        "matrix_instr_nonkdim": 16,
        "cache_modifier": ".cg",
        "NUM_KSPLIT": 1
    },
    "any": {
        "BLOCK_SIZE_M": 16,
        "BLOCK_SIZE_N": 128,
        "BLOCK_SIZE_K": 512,
        "GROUP_SIZE_M": 1,
        "num_warps": 8,
        "num_stages": 1,
        "waves_per_eu": 2,
        "matrix_instr_nonkdim": 16,
        "cache_modifier": null,
        "NUM_KSPLIT": 1
    }
}
