aiter/ops/triton/configs/gemm/gfx950-FUSED-GEMM-AFP4WFP4-MUL_ADD-N=7168-K=256.json
{
  "M_LEQ_16": {
    "BLOCK_SIZE_M": 16,
    "BLOCK_SIZE_N": 64,
    "BLOCK_SIZE_K": 256,
    "GROUP_SIZE_M": 1,
    "num_warps": 4,
    "num_stages": 1,
    "waves_per_eu": 6,
    "matrix_instr_nonkdim": 16,
    "cache_modifier": ".cg",
    "NUM_KSPLIT": 1
  },
  "M_LEQ_32": {
    "BLOCK_SIZE_M": 32,
    "BLOCK_SIZE_N": 32,
    "BLOCK_SIZE_K": 256,
    "GROUP_SIZE_M": 1,
    "num_warps": 4,
    "num_stages": 3,
    "waves_per_eu": 1,
    "matrix_instr_nonkdim": 16,
    "cache_modifier": ".cg",
    "NUM_KSPLIT": 1
  },
  "M_LEQ_64": {
    "BLOCK_SIZE_M": 32,
    "BLOCK_SIZE_N": 64,
    "BLOCK_SIZE_K": 256,
    "GROUP_SIZE_M": 2,
    "num_warps": 4,
    "num_stages": 3,
    "waves_per_eu": 1,
    "matrix_instr_nonkdim": 16,
    "cache_modifier": ".cg",
    "NUM_KSPLIT": 1
  },
  "M_LEQ_128": {
    "BLOCK_SIZE_M": 64,
    "BLOCK_SIZE_N": 64,
    "BLOCK_SIZE_K": 256,
    "GROUP_SIZE_M": 2,
    "num_warps": 4,
    "num_stages": 1,
    "waves_per_eu": 4,
    "matrix_instr_nonkdim": 16,
    "cache_modifier": ".cg",
    "NUM_KSPLIT": 1
  },
  "M_LEQ_256": {
    "BLOCK_SIZE_M": 64,
    "BLOCK_SIZE_N": 128,
    "BLOCK_SIZE_K": 256,
    "GROUP_SIZE_M": 4,
    "num_warps": 4,
    "num_stages": 1,
    "waves_per_eu": 1,
    "matrix_instr_nonkdim": 16,
    "cache_modifier": ".cg",
    "NUM_KSPLIT": 1
  },
  "any": {
    "BLOCK_SIZE_M": 128,
    "BLOCK_SIZE_N": 128,
    "BLOCK_SIZE_K": 256,
    "GROUP_SIZE_M": 4,
    "num_warps": 4,
    "num_stages": 1,
    "waves_per_eu": 1,
    "matrix_instr_nonkdim": 16,
    "cache_modifier": ".cg",
    "NUM_KSPLIT": 1
  }
}
