aiter/ops/triton/configs/gemm/gfx950-GEMM-A8W8_BLOCKSCALE_PRESHUFFLED-N=8192-K=1536.json
{
  "M_LEQ_1": {
    "BLOCK_SIZE_M": 4,
    "BLOCK_SIZE_N": 16,
    "BLOCK_SIZE_K": 128,
    "GROUP_SIZE_M": 1,
    "num_warps": 1,
    "num_stages": 2,
    "waves_per_eu": 2,
    "matrix_instr_nonkdim": 16,
    "cache_modifier": ".cg",
    "NUM_KSPLIT": 1
  },
  "M_LEQ_4": {
    "BLOCK_SIZE_M": 4,
    "BLOCK_SIZE_N": 16,
    "BLOCK_SIZE_K": 128,
    "GROUP_SIZE_M": 1,
    "num_warps": 1,
    "num_stages": 2,
    "waves_per_eu": 2,
    "matrix_instr_nonkdim": 16,
    "cache_modifier": ".cg",
    "NUM_KSPLIT": 1
  },
  "M_LEQ_8": {
    "BLOCK_SIZE_M": 8,
    "BLOCK_SIZE_N": 16,
    "BLOCK_SIZE_K": 128,
    "GROUP_SIZE_M": 1,
    "num_warps": 1,
    "num_stages": 2,
    "waves_per_eu": 2,
    "matrix_instr_nonkdim": 16,
    "cache_modifier": ".cg",
    "NUM_KSPLIT": 4
  },
  "M_LEQ_16": {
    "BLOCK_SIZE_M": 16,
    "BLOCK_SIZE_N": 16,
    "BLOCK_SIZE_K": 128,
    "GROUP_SIZE_M": 1,
    "num_warps": 1,
    "num_stages": 2,
    "waves_per_eu": 2,
    "matrix_instr_nonkdim": 16,
    "cache_modifier": ".cg",
    "NUM_KSPLIT": 1
  },
  "M_LEQ_32": {
    "BLOCK_SIZE_M": 32,
    "BLOCK_SIZE_N": 16,
    "BLOCK_SIZE_K": 128,
    "GROUP_SIZE_M": 1,
    "num_warps": 1,
    "num_stages": 2,
    "waves_per_eu": 2,
    "matrix_instr_nonkdim": 16,
    "cache_modifier": ".cg",
    "NUM_KSPLIT": 1
  },
  "M_LEQ_64": {
    "BLOCK_SIZE_M": 32,
    "BLOCK_SIZE_N": 16,
    "BLOCK_SIZE_K": 128,
    "GROUP_SIZE_M": 1,
    "num_warps": 1,
    "num_stages": 2,
    "waves_per_eu": 2,
    "matrix_instr_nonkdim": 16,
    "cache_modifier": ".cg",
    "NUM_KSPLIT": 1
  },
  "M_LEQ_128": {
    "BLOCK_SIZE_M": 32,
    "BLOCK_SIZE_N": 32,
    "BLOCK_SIZE_K": 128,
    "GROUP_SIZE_M": 1,
    "num_warps": 1,
    "num_stages": 2,
    "waves_per_eu": 2,
    "matrix_instr_nonkdim": 16,
    "cache_modifier": ".cg",
    "NUM_KSPLIT": 1
  },
  "any": {
    "BLOCK_SIZE_M": 32,
    "BLOCK_SIZE_N": 32,
    "BLOCK_SIZE_K": 128,
    "GROUP_SIZE_M": 1,
    "num_warps": 1,
    "num_stages": 2,
    "waves_per_eu": 2,
    "matrix_instr_nonkdim": 16,
    "cache_modifier": ".cg",
    "NUM_KSPLIT": 1
  }
}