aiter/configs/model_configs/a8w8_blockscale_tuned_fmoe_glm5_1.csv
gfx,cu_num,token,model_dim,inter_dim,expert,topk,act_type,dtype,q_dtype_a,q_dtype_w,q_type,use_g1u1,doweight_stage1,block_m,ksplit,us1,kernelName1,err1,us2,kernelName2,err2,us,run_1stage,xbf16,flat,tflops,bw,_tag
gfx942,304,1,6144,256,257,9,ActivationType.Silu,torch.bfloat16,torch.float8_e4m3fnuz,torch.float8_e4m3fnuz,QuantType.per_1x128,1,0,32,0,67.3825,_ZN5aiter47fmoe_bf16_blockscaleFp8_g1u1_vs_silu_1tg_32x128E,0.0%,0.0,,0.0%,67.3825,1,0,0,1.26,17997.2,
gfx942,304,2,6144,256,257,9,ActivationType.Silu,torch.bfloat16,torch.float8_e4m3fnuz,torch.float8_e4m3fnuz,QuantType.per_1x128,1,0,32,0,71.1007,_ZN5aiter50fmoe_bf16_blockscaleFp8_g1u1_vs_silu_1tg_ps_32x128E,0.0%,0.0,,0.0%,71.1007,1,0,0,2.39,17056.3,
gfx942,80,4,6144,256,256,8,ActivationType.Silu,torch.bfloat16,torch.float8_e4m3fnuz,torch.float8_e4m3fnuz,QuantType.per_1x128,1,0,1,0,0.0,_ZN5aiter60fmoe_bf16_a16_blockscaleFp8_g1u1_vs_silu_1tg_16x128_flat_pf3E,0.0%,0.0,,0.0%,0.0,1,1,1,0.0,0.0,
gfx942,80,8,6144,256,256,8,ActivationType.Silu,torch.bfloat16,torch.float8_e4m3fnuz,torch.float8_e4m3fnuz,QuantType.per_1x128,1,0,1,0,0.0,_ZN5aiter60fmoe_bf16_a16_blockscaleFp8_g1u1_vs_silu_1tg_16x128_flat_pf3E,0.0%,0.0,,0.0%,0.0,1,1,1,0.0,0.0,
gfx942,80,4,6144,256,257,9,ActivationType.Silu,torch.bfloat16,torch.float8_e4m3fnuz,torch.float8_e4m3fnuz,QuantType.per_1x128,1,0,1,0,0.0,_ZN5aiter60fmoe_bf16_a16_blockscaleFp8_g1u1_vs_silu_1tg_16x128_flat_pf3E,0.0%,0.0,,0.0%,0.0,1,1,1,0.0,0.0,
gfx942,80,8,6144,256,257,9,ActivationType.Silu,torch.bfloat16,torch.float8_e4m3fnuz,torch.float8_e4m3fnuz,QuantType.per_1x128,1,0,1,0,0.0,_ZN5aiter60fmoe_bf16_a16_blockscaleFp8_g1u1_vs_silu_1tg_16x128_flat_pf3E,0.0%,0.0,,0.0%,0.0,1,1,1,0.0,0.0,
gfx942,304,4,6144,256,256,8,ActivationType.Silu,torch.bfloat16,torch.float8_e4m3fnuz,torch.float8_e4m3fnuz,QuantType.per_1x128,1,0,1,0,0.0,_ZN5aiter60fmoe_bf16_a16_blockscaleFp8_g1u1_vs_silu_1tg_16x128_flat_pf3E,0.0%,0.0,,0.0%,0.0,1,1,1,0.0,0.0,
gfx942,304,8,6144,256,256,8,ActivationType.Silu,torch.bfloat16,torch.float8_e4m3fnuz,torch.float8_e4m3fnuz,QuantType.per_1x128,1,0,1,0,0.0,_ZN5aiter60fmoe_bf16_a16_blockscaleFp8_g1u1_vs_silu_1tg_16x128_flat_pf3E,0.0%,0.0,,0.0%,0.0,1,1,1,0.0,0.0,
gfx942,304,4,6144,256,257,9,ActivationType.Silu,torch.bfloat16,torch.float8_e4m3fnuz,torch.float8_e4m3fnuz,QuantType.per_1x128,1,0,1,0,0.0,_ZN5aiter60fmoe_bf16_a16_blockscaleFp8_g1u1_vs_silu_1tg_16x128_flat_pf3E,0.0%,0.0,,0.0%,0.0,1,1,1,0.0,0.0,
gfx942,304,8,6144,256,257,9,ActivationType.Silu,torch.bfloat16,torch.float8_e4m3fnuz,torch.float8_e4m3fnuz,QuantType.per_1x128,1,0,1,0,0.0,_ZN5aiter60fmoe_bf16_a16_blockscaleFp8_g1u1_vs_silu_1tg_16x128_flat_pf3E,0.0%,0.0,,0.0%,0.0,1,1,1,0.0,0.0,
gfx942,304,16,6144,256,257,9,ActivationType.Silu,torch.bfloat16,torch.float8_e4m3fnuz,torch.float8_e4m3fnuz,QuantType.per_1x128,1,0,32,0,131.7166,_ZN5aiter47fmoe_bf16_blockscaleFp8_g1u1_vs_silu_1tg_32x256E,0.0%,0.0,,0.0%,131.7166,1,0,0,10.32,9208.96,
gfx942,304,32,6144,256,257,9,ActivationType.Silu,torch.bfloat16,torch.float8_e4m3fnuz,torch.float8_e4m3fnuz,QuantType.per_1x128,1,0,32,0,197.537,_ZN5aiter47fmoe_bf16_blockscaleFp8_g1u1_vs_silu_1tg_32x256E,0.0%,0.0,,0.0%,197.537,1,0,0,13.76,6141.98,
gfx942,304,64,6144,256,257,9,ActivationType.Silu,torch.bfloat16,torch.float8_e4m3fnuz,torch.float8_e4m3fnuz,QuantType.per_1x128,1,0,32,0,260.2586,_ZN5aiter49fmoe_bf16_blockscaleFp8_g1u1_novs_silu_1tg_32x256E,0.0%,0.0,,0.0%,260.2586,1,0,0,20.89,4664.04,
gfx942,304,128,6144,256,257,9,ActivationType.Silu,torch.bfloat16,torch.float8_e4m3fnuz,torch.float8_e4m3fnuz,QuantType.per_1x128,1,0,32,0,284.7976,_ZN5aiter50fmoe_bf16_blockscaleFp8_g1u1_vs_silu_1tg_ps_32x256E,0.0%,0.0,,0.0%,284.7976,1,0,0,38.17,4266.32,
gfx942,304,256,6144,256,257,9,ActivationType.Silu,torch.bfloat16,torch.float8_e4m3fnuz,torch.float8_e4m3fnuz,QuantType.per_1x128,1,0,32,0,299.6798,_ZN5aiter50fmoe_bf16_blockscaleFp8_g1u1_vs_silu_1tg_ps_32x256E,0.0%,0.0,,0.0%,299.6798,1,0,0,72.56,4062.32,
gfx942,304,512,6144,256,257,9,ActivationType.Silu,torch.bfloat16,torch.float8_e4m3fnuz,torch.float8_e4m3fnuz,QuantType.per_1x128,1,0,32,0,310.917,_ZN5aiter52fmoe_bf16_blockscaleFp8_g1u1_novs_silu_1tg_ps_32x256E,0.0%,0.0,,0.0%,310.917,1,0,0,139.87,3930.68,
gfx942,304,1024,6144,256,257,9,ActivationType.Silu,torch.bfloat16,torch.float8_e4m3fnuz,torch.float8_e4m3fnuz,QuantType.per_1x128,1,0,64,0,353.377,_ZN5aiter43fmoe_bf16_blockscaleFp8_g1u1_vs_silu_64x256E,0.0%,0.0,,0.0%,353.377,1,0,0,246.12,3485.1,
gfx942,304,2048,6144,256,257,9,ActivationType.Silu,torch.bfloat16,torch.float8_e4m3fnuz,torch.float8_e4m3fnuz,QuantType.per_1x128,1,0,64,0,547.545,_ZN5aiter46fmoe_bf16_blockscaleFp8_g1u1_vs_ps_silu_64x256E,0.0%,0.0,,0.0%,547.545,1,0,0,317.68,2283.7,
gfx942,304,4096,6144,256,257,9,ActivationType.Silu,torch.bfloat16,torch.float8_e4m3fnuz,torch.float8_e4m3fnuz,QuantType.per_1x128,1,0,64,0,809.3871,_ZN5aiter46fmoe_bf16_blockscaleFp8_g1u1_vs_ps_silu_64x256E,0.0%,0.0,,0.0%,809.3871,1,0,0,429.82,1591.54,
gfx942,304,8192,6144,256,257,9,ActivationType.Silu,torch.bfloat16,torch.float8_e4m3fnuz,torch.float8_e4m3fnuz,QuantType.per_1x128,1,0,64,0,1313.9702,_ZN5aiter46fmoe_bf16_blockscaleFp8_g1u1_vs_ps_silu_64x256E,0.0%,0.0,,0.0%,1313.9702,1,0,0,529.53,1037.83,
gfx942,304,16384,6144,256,257,9,ActivationType.Silu,torch.bfloat16,torch.float8_e4m3fnuz,torch.float8_e4m3fnuz,QuantType.per_1x128,1,0,64,0,2228.4179,_ZN5aiter46fmoe_bf16_blockscaleFp8_g1u1_vs_ps_silu_64x256E,0.0%,0.0,,0.0%,2228.4179,1,0,0,624.47,679.71,
gfx942,304,1,6144,2048,32,8,ActivationType.Silu,torch.bfloat16,torch.float8_e4m3fnuz,torch.float8_e4m3fnuz,QuantType.per_1x128,1,0,32,0,84.3147,_ZN5aiter47fmoe_bf16_blockscaleFp8_g1u1_vs_silu_1tg_32x128E,0.0%,0.0,,0.0%,84.3147,1,0,0,7.16,14327.02,
gfx942,304,2,6144,2048,32,8,ActivationType.Silu,torch.bfloat16,torch.float8_e4m3fnuz,torch.float8_e4m3fnuz,QuantType.per_1x128,1,0,32,0,139.3279,_ZN5aiter50fmoe_bf16_blockscaleFp8_g1u1_vs_silu_1tg_ps_32x256E,0.0%,0.0,,0.0%,139.3279,1,0,0,8.67,8670.17,
gfx942,304,4,6144,2048,32,8,ActivationType.Silu,torch.bfloat16,torch.float8_e4m3fnuz,torch.float8_e4m3fnuz,QuantType.per_1x128,1,0,32,0,207.6314,_ZN5aiter47fmoe_bf16_blockscaleFp8_g1u1_vs_silu_1tg_32x256E,0.0%,0.0,,0.0%,207.6314,1,0,0,11.64,5818.16,
gfx942,304,8,6144,2048,32,8,ActivationType.Silu,torch.bfloat16,torch.float8_e4m3fnuz,torch.float8_e4m3fnuz,QuantType.per_1x128,1,0,32,0,241.8714,_ZN5aiter47fmoe_bf16_blockscaleFp8_g1u1_vs_silu_1tg_32x256E,0.0%,0.0,,0.0%,241.8714,1,0,0,19.98,4994.83,
gfx942,304,16,6144,2048,32,8,ActivationType.Silu,torch.bfloat16,torch.float8_e4m3fnuz,torch.float8_e4m3fnuz,QuantType.per_1x128,1,0,32,0,279.8341,_ZN5aiter50fmoe_bf16_blockscaleFp8_g1u1_vs_silu_1tg_ps_32x256E,0.0%,0.0,,0.0%,279.8341,1,0,0,34.53,4317.75,
gfx942,304,32,6144,2048,32,8,ActivationType.Silu,torch.bfloat16,torch.float8_e4m3fnuz,torch.float8_e4m3fnuz,QuantType.per_1x128,1,0,32,0,293.5291,_ZN5aiter49fmoe_bf16_blockscaleFp8_g1u1_novs_silu_1tg_32x256E,0.0%,0.0,,0.0%,293.5291,1,0,0,65.84,4117.31,
gfx942,304,64,6144,2048,32,8,ActivationType.Silu,torch.bfloat16,torch.float8_e4m3fnuz,torch.float8_e4m3fnuz,QuantType.per_1x128,1,0,32,0,302.1429,_ZN5aiter52fmoe_bf16_blockscaleFp8_g1u1_novs_silu_1tg_ps_32x256E,0.0%,0.0,,0.0%,302.1429,1,0,0,127.94,4001.88,
gfx942,304,128,6144,2048,32,8,ActivationType.Silu,torch.bfloat16,torch.float8_e4m3fnuz,torch.float8_e4m3fnuz,QuantType.per_1x128,1,0,64,0,334.8752,_ZN5aiter43fmoe_bf16_blockscaleFp8_g1u1_vs_silu_64x256E,0.0%,0.0,,0.0%,334.8752,1,0,0,230.86,3614.24,
gfx942,304,256,6144,2048,32,8,ActivationType.Silu,torch.bfloat16,torch.float8_e4m3fnuz,torch.float8_e4m3fnuz,QuantType.per_1x128,1,0,32,0,447.7594,_ZN5aiter47fmoe_bf16_blockscaleFp8_g1u1_vs_silu_1tg_32x256E,0.0%,0.0,,0.0%,447.7594,1,0,0,345.32,2708.33,
gfx942,304,1024,6144,2048,32,8,ActivationType.Silu,torch.bfloat16,torch.float8_e4m3fnuz,torch.float8_e4m3fnuz,QuantType.per_1x128,1,0,64,0,986.9189,_ZN5aiter43fmoe_bf16_blockscaleFp8_g1u1_vs_silu_64x256E,0.0%,0.0,,0.0%,986.9189,1,0,0,626.67,1243.09,
gfx942,304,2048,6144,2048,32,8,ActivationType.Silu,torch.bfloat16,torch.float8_e4m3fnuz,torch.float8_e4m3fnuz,QuantType.per_1x128,1,0,64,0,1857.7443,_ZN5aiter43fmoe_bf16_blockscaleFp8_g1u1_vs_silu_64x256E,0.0%,0.0,,0.0%,1857.7443,1,0,0,665.83,670.55,
gfx942,304,4096,6144,2048,32,8,ActivationType.Silu,torch.bfloat16,torch.float8_e4m3fnuz,torch.float8_e4m3fnuz,QuantType.per_1x128,1,0,64,0,3378.2677,_ZN5aiter43fmoe_bf16_blockscaleFp8_g1u1_vs_silu_64x256E,0.0%,0.0,,0.0%,3378.2677,1,0,0,732.3,379.92,
gfx942,304,8192,6144,2048,32,8,ActivationType.Silu,torch.bfloat16,torch.float8_e4m3fnuz,torch.float8_e4m3fnuz,QuantType.per_1x128,1,0,64,0,6606.165,_ZN5aiter43fmoe_bf16_blockscaleFp8_g1u1_vs_silu_64x256E,0.0%,0.0,,0.0%,6606.165,1,0,0,748.97,205.71,
gfx942,304,16384,6144,2048,32,8,ActivationType.Silu,torch.bfloat16,torch.float8_e4m3fnuz,torch.float8_e4m3fnuz,QuantType.per_1x128,1,0,64,0,13155.6144,_ZN5aiter43fmoe_bf16_blockscaleFp8_g1u1_vs_silu_64x256E,0.0%,0.0,,0.0%,13155.6144,1,0,0,752.2,114.78,
