aiter/configs/model_configs/a8w8_blockscale_bpreshuffle_tuned_gemm_qwen3.5_397b.csv
gfx,cu_num,M,N,K,libtype,kernelId,splitK,us,kernelName,tflops,bw,errRatio
gfx950,256,1,16,4096,cktile,12,0,9.9757,a8w8_blockscale_cktile_16x128x256_1x4x1_16x16x128_intrawave_0x1x0_3,0.01,6.98,0.0
gfx950,256,1,32,4096,cktile,12,0,9.9923,a8w8_blockscale_cktile_16x128x256_1x4x1_16x16x128_intrawave_0x1x0_3,0.03,13.53,0.0
gfx950,256,1,256,512,ck,7,0,2.6477,a8w8_blockscale_bpreshuffle_1x128x128_256x16x64x256_16x16_16x16_16x16x1_16x16x1_1x16x1x16_4_1x1_intrawave_v1,0.1,49.89,0.0
gfx950,256,1,512,256,ck,5,0,2.7069,a8w8_blockscale_bpreshuffle_1x128x128_256x16x64x128_8x16_16x16_16x16x1_8x32x1_1x16x1x16_4_1x1_intrawave_v1,0.1,48.89,0.0
gfx950,256,1,512,512,ck,7,0,2.9061,a8w8_blockscale_bpreshuffle_1x128x128_256x16x64x256_16x16_16x16_16x16x1_16x16x1_1x16x1x16_4_1x1_intrawave_v1,0.18,90.73,0.0
gfx950,256,1,512,1024,ck,6,0,4.124,a8w8_blockscale_bpreshuffle_1x128x128_256x16x128x256_16x16_16x16_16x16x1_16x16x1_1x16x1x16_8_1x2_intrawave_v1,0.25,127.63,0.0
gfx950,256,1,512,2048,ck,6,0,5.2158,a8w8_blockscale_bpreshuffle_1x128x128_256x16x128x256_16x16_16x16_16x16x1_16x16x1_1x16x1x16_8_1x2_intrawave_v1,0.4,201.63,0.0
gfx950,256,1,1024,256,ck,5,0,2.7529,a8w8_blockscale_bpreshuffle_1x128x128_256x16x64x128_8x16_16x16_16x16x1_8x32x1_1x16x1x16_4_1x1_intrawave_v1,0.19,96.06,0.0
gfx950,256,1,1024,512,ck,7,0,2.9323,a8w8_blockscale_bpreshuffle_1x128x128_256x16x64x256_16x16_16x16_16x16x1_16x16x1_1x16x1x16_4_1x1_intrawave_v1,0.36,179.67,0.0
gfx950,256,1,1024,1024,cktile,1,0,4.3045,a8w8_blockscale_cktile_16x128x256_1x4x1_16x16x128_intrawave_0x1x0_2,0.49,244.31,0.0
gfx950,256,1,1024,2048,ck,7,0,5.17,a8w8_blockscale_bpreshuffle_1x128x128_256x16x64x256_16x16_16x16_16x16x1_16x16x1_1x16x1x16_4_1x1_intrawave_v1,0.81,406.43,0.0
gfx950,256,1,1024,4096,ck,7,0,11.8308,a8w8_blockscale_bpreshuffle_1x128x128_256x16x64x256_16x16_16x16_16x16x1_16x16x1_1x16x1x16_4_1x1_intrawave_v1,0.71,355.04,0.0
gfx950,256,1,1152,2048,ck,6,0,5.7928,a8w8_blockscale_bpreshuffle_1x128x128_256x16x128x256_16x16_16x16_16x16x1_16x16x1_1x16x1x16_8_1x2_intrawave_v1,0.81,408.03,0.0
gfx950,256,1,1536,2048,ck,6,0,7.6446,a8w8_blockscale_bpreshuffle_1x128x128_256x16x128x256_16x16_16x16_16x16x1_16x16x1_1x16x1x16_8_1x2_intrawave_v1,0.82,412.17,0.0
gfx950,256,1,2048,512,cktile,15,0,3.5207,a8w8_blockscale_cktile_16x128x256_1x4x1_16x16x64_intrawave_0x1x0_4,0.6,299.14,0.0
gfx950,256,1,2048,1024,ck,7,0,3.8919,a8w8_blockscale_bpreshuffle_1x128x128_256x16x64x256_16x16_16x16_16x16x1_16x16x1_1x16x1x16_4_1x1_intrawave_v1,1.08,540.17,0.0
gfx950,256,1,2048,2048,ck,7,0,7.1436,a8w8_blockscale_bpreshuffle_1x128x128_256x16x64x256_16x16_16x16_16x16x1_16x16x1_1x16x1x16_4_1x1_intrawave_v1,1.17,588.0,0.0
gfx950,256,1,2048,4096,ck,7,0,12.1487,a8w8_blockscale_bpreshuffle_1x128x128_256x16x64x256_16x16_16x16_16x16x1_16x16x1_1x16x1x16_4_1x1_intrawave_v1,1.38,691.17,0.0
gfx950,256,1,2176,4096,ck,7,0,12.8835,a8w8_blockscale_bpreshuffle_1x128x128_256x16x64x256_16x16_16x16_16x16x1_16x16x1_1x16x1x16_4_1x1_intrawave_v1,1.38,692.46,0.0
gfx950,256,1,2304,2048,ck,7,0,7.0303,a8w8_blockscale_bpreshuffle_1x128x128_256x16x64x256_16x16_16x16_16x16x1_16x16x1_1x16x1x16_4_1x1_intrawave_v1,1.34,672.13,0.0
gfx950,256,1,2560,4096,ck,7,0,12.3531,a8w8_blockscale_bpreshuffle_1x128x128_256x16x64x256_16x16_16x16_16x16x1_16x16x1_1x16x1x16_4_1x1_intrawave_v1,1.7,849.58,0.0
gfx950,256,1,3072,2048,ck,7,0,7.2249,a8w8_blockscale_bpreshuffle_1x128x128_256x16x64x256_16x16_16x16_16x16x1_16x16x1_1x16x1x16_4_1x1_intrawave_v1,1.74,871.94,0.0
gfx950,256,1,4096,2048,ck,7,0,7.6088,a8w8_blockscale_bpreshuffle_1x128x128_256x16x64x256_16x16_16x16_16x16x1_16x16x1_1x16x1x16_4_1x1_intrawave_v1,2.2,1103.83,0.0
gfx950,256,1,4352,4096,ck,7,0,12.4593,a8w8_blockscale_bpreshuffle_1x128x128_256x16x64x256_16x16_16x16_16x16x1_16x16x1_1x16x1x16_4_1x1_intrawave_v1,2.86,1431.75,0.0
gfx950,256,1,4608,2048,ck,7,0,7.2729,a8w8_blockscale_bpreshuffle_1x128x128_256x16x64x256_16x16_16x16_16x16x1_16x16x1_1x16x1x16_4_1x1_intrawave_v1,2.6,1299.13,0.0
gfx950,256,1,4608,4096,ck,7,0,12.6298,a8w8_blockscale_bpreshuffle_1x128x128_256x16x64x256_16x16_16x16_16x16x1_16x16x1_1x16x1x16_4_1x1_intrawave_v1,2.99,1495.49,0.0
gfx950,256,1,5120,4096,ck,7,0,12.8459,a8w8_blockscale_bpreshuffle_1x128x128_256x16x64x256_16x16_16x16_16x16x1_16x16x1_1x16x1x16_4_1x1_intrawave_v1,3.27,1633.66,0.0
gfx950,256,1,6144,2048,ck,7,0,7.9306,a8w8_blockscale_bpreshuffle_1x128x128_256x16x64x256_16x16_16x16_16x16x1_16x16x1_1x16x1x16_4_1x1_intrawave_v1,3.17,1588.44,0.0
gfx950,256,1,8704,4096,ck,7,0,14.0155,a8w8_blockscale_bpreshuffle_1x128x128_256x16x64x256_16x16_16x16_16x16x1_16x16x1_1x16x1x16_4_1x1_intrawave_v1,5.09,2545.26,0.0
gfx950,256,1,9216,2048,ck,7,0,7.7504,a8w8_blockscale_bpreshuffle_1x128x128_256x16x64x256_16x16_16x16_16x16x1_16x16x1_1x16x1x16_4_1x1_intrawave_v1,4.87,2437.92,0.0
gfx950,256,1,10240,4096,ck,7,0,14.125,a8w8_blockscale_bpreshuffle_1x128x128_256x16x64x256_16x16_16x16_16x16x1_16x16x1_1x16x1x16_4_1x1_intrawave_v1,5.94,2971.16,0.0
gfx950,256,1,12288,2048,ck,7,0,8.545,a8w8_blockscale_bpreshuffle_1x128x128_256x16x64x256_16x16_16x16_16x16x1_16x16x1_1x16x1x16_4_1x1_intrawave_v1,5.89,2948.21,0.0
gfx950,256,1,17408,4096,ck,7,0,17.2253,a8w8_blockscale_bpreshuffle_1x128x128_256x16x64x256_16x16_16x16_16x16x1_16x16x1_1x16x1x16_4_1x1_intrawave_v1,8.28,4141.7,0.0
gfx950,256,1,20480,4096,ck,7,0,17.7274,a8w8_blockscale_bpreshuffle_1x128x128_256x16x64x256_16x16_16x16_16x16x1_16x16x1_1x16x1x16_4_1x1_intrawave_v1,9.46,4734.54,0.0
gfx950,256,2,16,4096,cktile,12,0,13.9708,a8w8_blockscale_cktile_16x128x256_1x4x1_16x16x128_intrawave_0x1x0_3,0.02,5.28,0.0
gfx950,256,2,32,4096,cktile,1,0,13.9482,a8w8_blockscale_cktile_16x128x256_1x4x1_16x16x128_intrawave_0x1x0_2,0.04,9.99,0.0
gfx950,256,2,256,512,ck,7,0,2.6554,a8w8_blockscale_bpreshuffle_1x128x128_256x16x64x256_16x16_16x16_16x16x1_16x16x1_1x16x1x16_4_1x1_intrawave_v1,0.2,50.13,0.0
gfx950,256,2,512,256,ck,6,0,2.5406,a8w8_blockscale_bpreshuffle_1x128x128_256x16x128x256_16x16_16x16_16x16x1_16x16x1_1x16x1x16_8_1x2_intrawave_v1,0.21,52.6,0.0
gfx950,256,2,512,512,ck,6,0,2.7919,a8w8_blockscale_bpreshuffle_1x128x128_256x16x128x256_16x16_16x16_16x16x1_16x16x1_1x16x1x16_8_1x2_intrawave_v1,0.38,94.99,0.0
gfx950,256,2,512,1024,ck,6,0,3.8596,a8w8_blockscale_bpreshuffle_1x128x128_256x16x128x256_16x16_16x16_16x16x1_16x16x1_1x16x1x16_8_1x2_intrawave_v1,0.54,136.9,0.0
gfx950,256,2,512,2048,ck,6,0,5.4904,a8w8_blockscale_bpreshuffle_1x128x128_256x16x128x256_16x16_16x16_16x16x1_16x16x1_1x16x1x16_8_1x2_intrawave_v1,0.76,192.1,0.0
gfx950,256,2,1024,256,ck,5,0,2.7842,a8w8_blockscale_bpreshuffle_1x128x128_256x16x64x128_8x16_16x16_16x16x1_8x32x1_1x16x1x16_4_1x1_intrawave_v1,0.38,95.81,0.0
gfx950,256,2,1024,512,ck,7,0,2.9541,a8w8_blockscale_bpreshuffle_1x128x128_256x16x64x256_16x16_16x16_16x16x1_16x16x1_1x16x1x16_4_1x1_intrawave_v1,0.71,179.21,0.0
gfx950,256,2,1024,1024,ck,7,0,3.8918,a8w8_blockscale_bpreshuffle_1x128x128_256x16x64x256_16x16_16x16_16x16x1_16x16x1_1x16x1x16_4_1x1_intrawave_v1,1.08,271.01,0.0
gfx950,256,2,1024,2048,ck,7,0,5.2282,a8w8_blockscale_bpreshuffle_1x128x128_256x16x64x256_16x16_16x16_16x16x1_16x16x1_1x16x1x16_4_1x1_intrawave_v1,1.6,402.69,0.0
gfx950,256,2,1024,4096,ck,7,0,12.0383,a8w8_blockscale_bpreshuffle_1x128x128_256x16x64x256_16x16_16x16_16x16x1_16x16x1_1x16x1x16_4_1x1_intrawave_v1,1.39,349.43,0.0
gfx950,256,2,1152,2048,ck,7,0,5.8106,a8w8_blockscale_bpreshuffle_1x128x128_256x16x64x256_16x16_16x16_16x16x1_16x16x1_1x16x1x16_4_1x1_intrawave_v1,1.62,407.53,0.0
gfx950,256,2,1536,2048,ck,7,0,7.5211,a8w8_blockscale_bpreshuffle_1x128x128_256x16x64x256_16x16_16x16_16x16x1_16x16x1_1x16x1x16_4_1x1_intrawave_v1,1.67,419.62,0.0
gfx950,256,2,2048,512,ck,7,0,2.9658,a8w8_blockscale_bpreshuffle_1x128x128_256x16x64x256_16x16_16x16_16x16x1_16x16x1_1x16x1x16_4_1x1_intrawave_v1,1.41,356.66,0.0
gfx950,256,2,2048,1024,ck,7,0,3.9292,a8w8_blockscale_bpreshuffle_1x128x128_256x16x64x256_16x16_16x16_16x16x1_16x16x1_1x16x1x16_4_1x1_intrawave_v1,2.13,536.34,0.0
gfx950,256,2,2048,2048,ck,7,0,7.3283,a8w8_blockscale_bpreshuffle_1x128x128_256x16x64x256_16x16_16x16_16x16x1_16x16x1_1x16x1x16_4_1x1_intrawave_v1,2.29,574.02,0.0
gfx950,256,2,2048,4096,ck,7,0,12.2679,a8w8_blockscale_bpreshuffle_1x128x128_256x16x64x256_16x16_16x16_16x16x1_16x16x1_1x16x1x16_4_1x1_intrawave_v1,2.74,685.12,0.0
gfx950,256,2,2176,4096,ck,7,0,12.2827,a8w8_blockscale_bpreshuffle_1x128x128_256x16x64x256_16x16_16x16_16x16x1_16x16x1_1x16x1x16_4_1x1_intrawave_v1,2.9,727.02,0.0
gfx950,256,2,2304,2048,ck,7,0,7.4911,a8w8_blockscale_bpreshuffle_1x128x128_256x16x64x256_16x16_16x16_16x16x1_16x16x1_1x16x1x16_4_1x1_intrawave_v1,2.52,631.67,0.0
gfx950,256,2,2560,4096,ck,7,0,12.5047,a8w8_blockscale_bpreshuffle_1x128x128_256x16x64x256_16x16_16x16_16x16x1_16x16x1_1x16x1x16_4_1x1_intrawave_v1,3.35,840.02,0.0
gfx950,256,2,3072,2048,ck,7,0,7.4827,a8w8_blockscale_bpreshuffle_1x128x128_256x16x64x256_16x16_16x16_16x16x1_16x16x1_1x16x1x16_4_1x1_intrawave_v1,3.36,842.99,0.0
gfx950,256,2,4096,2048,ck,7,0,6.964,a8w8_blockscale_bpreshuffle_1x128x128_256x16x64x256_16x16_16x16_16x16x1_16x16x1_1x16x1x16_4_1x1_intrawave_v1,4.82,1207.51,0.0
gfx950,256,2,4352,4096,ck,7,0,12.4143,a8w8_blockscale_bpreshuffle_1x128x128_256x16x64x256_16x16_16x16_16x16x1_16x16x1_1x16x1x16_4_1x1_intrawave_v1,5.74,1437.97,0.0
gfx950,256,2,4608,2048,ck,7,0,7.1868,a8w8_blockscale_bpreshuffle_1x128x128_256x16x64x256_16x16_16x16_16x16x1_16x16x1_1x16x1x16_4_1x1_intrawave_v1,5.25,1316.26,0.0
gfx950,256,2,4608,4096,ck,7,0,12.6641,a8w8_blockscale_bpreshuffle_1x128x128_256x16x64x256_16x16_16x16_16x16x1_16x16x1_1x16x1x16_4_1x1_intrawave_v1,5.96,1492.49,0.0
gfx950,256,2,5120,4096,ck,7,0,12.7807,a8w8_blockscale_bpreshuffle_1x128x128_256x16x64x256_16x16_16x16_16x16x1_16x16x1_1x16x1x16_4_1x1_intrawave_v1,6.56,1643.12,0.0
gfx950,256,2,6144,2048,ck,7,0,7.8348,a8w8_blockscale_bpreshuffle_1x128x128_256x16x64x256_16x16_16x16_16x16x1_16x16x1_1x16x1x16_4_1x1_intrawave_v1,6.42,1609.69,0.0
gfx950,256,2,8704,4096,ck,7,0,13.6679,a8w8_blockscale_bpreshuffle_1x128x128_256x16x64x256_16x16_16x16_16x16x1_16x16x1_1x16x1x16_4_1x1_intrawave_v1,10.43,2611.56,0.0
gfx950,256,2,9216,2048,ck,7,0,7.4979,a8w8_blockscale_bpreshuffle_1x128x128_256x16x64x256_16x16_16x16_16x16x1_16x16x1_1x16x1x16_4_1x1_intrawave_v1,10.07,2522.75,0.0
gfx950,256,2,10240,4096,ck,7,0,14.5233,a8w8_blockscale_bpreshuffle_1x128x128_256x16x64x256_16x16_16x16_16x16x1_16x16x1_1x16x1x16_4_1x1_intrawave_v1,11.55,2891.37,0.0
gfx950,256,2,12288,2048,ck,7,0,8.9331,a8w8_blockscale_bpreshuffle_1x128x128_256x16x64x256_16x16_16x16_16x16x1_16x16x1_1x16x1x16_4_1x1_intrawave_v1,11.27,2823.1,0.0
gfx950,256,2,17408,4096,ck,7,0,16.4033,a8w8_blockscale_bpreshuffle_1x128x128_256x16x64x256_16x16_16x16_16x16x1_16x16x1_1x16x1x16_4_1x1_intrawave_v1,17.39,4351.62,0.0
gfx950,256,2,20480,4096,ck,7,0,17.4288,a8w8_blockscale_bpreshuffle_1x128x128_256x16x64x256_16x16_16x16_16x16x1_16x16x1_1x16x1x16_4_1x1_intrawave_v1,19.25,4818.24,0.0
gfx950,256,4,16,4096,cktile,0,0,14.2842,a8w8_blockscale_cktile_16x128x256_1x4x1_16x16x128_intrawave_0x1x0_1,0.04,5.74,0.0
gfx950,256,4,32,4096,cktile,2,0,14.2116,a8w8_blockscale_cktile_16x128x256_1x4x1_16x16x64_intrawave_0x1x0_1,0.07,10.39,0.0
gfx950,256,4,256,512,ck,7,0,2.4076,a8w8_blockscale_bpreshuffle_1x128x128_256x16x64x256_16x16_16x16_16x16x1_16x16x1_1x16x1x16_4_1x1_intrawave_v1,0.44,56.14,0.0
gfx950,256,4,512,256,ck,4,0,2.6362,a8w8_blockscale_bpreshuffle_1x128x128_256x16x128x128_8x16_16x16_16x16x1_8x32x1_1x16x1x16_8_1x2_intrawave_v1,0.4,51.66,0.0
gfx950,256,4,512,512,ck,6,0,3.0436,a8w8_blockscale_bpreshuffle_1x128x128_256x16x128x256_16x16_16x16_16x16x1_16x16x1_1x16x1x16_8_1x2_intrawave_v1,0.69,88.15,0.0
gfx950,256,4,512,1024,ck,7,0,3.8855,a8w8_blockscale_bpreshuffle_1x128x128_256x16x64x256_16x16_16x16_16x16x1_16x16x1_1x16x1x16_4_1x1_intrawave_v1,1.08,137.04,0.0
gfx950,256,4,512,2048,ck,7,0,5.2943,a8w8_blockscale_bpreshuffle_1x128x128_256x16x64x256_16x16_16x16_16x16x1_16x16x1_1x16x1x16_4_1x1_intrawave_v1,1.58,200.38,0.0
gfx950,256,4,1024,256,ck,5,0,2.7982,a8w8_blockscale_bpreshuffle_1x128x128_256x16x64x128_8x16_16x16_16x16x1_8x32x1_1x16x1x16_4_1x1_intrawave_v1,0.75,96.98,0.0
gfx950,256,4,1024,512,ck,7,0,3.5522,a8w8_blockscale_bpreshuffle_1x128x128_256x16x64x256_16x16_16x16_16x16x1_16x16x1_1x16x1x16_4_1x1_intrawave_v1,1.18,150.48,0.0
gfx950,256,4,1024,1024,ck,7,0,3.9714,a8w8_blockscale_bpreshuffle_1x128x128_256x16x64x256_16x16_16x16_16x16x1_16x16x1_1x16x1x16_4_1x1_intrawave_v1,2.11,267.13,0.0
gfx950,256,4,1024,2048,ck,7,0,5.2853,a8w8_blockscale_bpreshuffle_1x128x128_256x16x64x256_16x16_16x16_16x16x1_16x16x1_1x16x1x16_4_1x1_intrawave_v1,3.17,399.89,0.0
gfx950,256,4,1024,4096,ck,7,0,12.2115,a8w8_blockscale_bpreshuffle_1x128x128_256x16x64x256_16x16_16x16_16x16x1_16x16x1_1x16x1x16_4_1x1_intrawave_v1,2.75,345.48,0.0
gfx950,256,4,1152,2048,ck,7,0,5.8616,a8w8_blockscale_bpreshuffle_1x128x128_256x16x64x256_16x16_16x16_16x16x1_16x16x1_1x16x1x16_4_1x1_intrawave_v1,3.22,405.47,0.0
gfx950,256,4,1536,2048,ck,7,0,7.258,a8w8_blockscale_bpreshuffle_1x128x128_256x16x64x256_16x16_16x16_16x16x1_16x16x1_1x16x1x16_4_1x1_intrawave_v1,3.47,436.24,0.0
gfx950,256,4,2048,512,ck,7,0,2.9866,a8w8_blockscale_bpreshuffle_1x128x128_256x16x64x256_16x16_16x16_16x16x1_16x16x1_1x16x1x16_4_1x1_intrawave_v1,2.81,357.27,0.0
gfx950,256,4,2048,1024,ck,6,0,4.4419,a8w8_blockscale_bpreshuffle_1x128x128_256x16x128x256_16x16_16x16_16x16x1_16x16x1_1x16x1x16_8_1x2_intrawave_v1,3.78,476.74,0.0
gfx950,256,4,2048,2048,ck,7,0,7.2284,a8w8_blockscale_bpreshuffle_1x128x128_256x16x64x256_16x16_16x16_16x16x1_16x16x1_1x16x1x16_4_1x1_intrawave_v1,4.64,583.65,0.0
gfx950,256,4,2048,4096,ck,7,0,12.1475,a8w8_blockscale_bpreshuffle_1x128x128_256x16x64x256_16x16_16x16_16x16x1_16x16x1_1x16x1x16_4_1x1_intrawave_v1,5.52,693.26,0.0
gfx950,256,4,2176,4096,ck,7,0,12.2395,a8w8_blockscale_bpreshuffle_1x128x128_256x16x64x256_16x16_16x16_16x16x1_16x16x1_1x16x1x16_4_1x1_intrawave_v1,5.83,730.97,0.0
gfx950,256,4,2304,2048,ck,7,0,7.7175,a8w8_blockscale_bpreshuffle_1x128x128_256x16x64x256_16x16_16x16_16x16x1_16x16x1_1x16x1x16_4_1x1_intrawave_v1,4.89,614.86,0.0
gfx950,256,4,2560,4096,ck,7,0,12.124,a8w8_blockscale_bpreshuffle_1x128x128_256x16x64x256_16x16_16x16_16x16x1_16x16x1_1x16x1x16_4_1x1_intrawave_v1,6.92,867.92,0.0
gfx950,256,4,3072,2048,ck,7,0,7.7519,a8w8_blockscale_bpreshuffle_1x128x128_256x16x64x256_16x16_16x16_16x16x1_16x16x1_1x16x1x16_4_1x1_intrawave_v1,6.49,815.83,0.0
gfx950,256,4,4096,1024,ck,7,0,5.181,a8w8_blockscale_bpreshuffle_1x128x128_256x16x64x256_16x16_16x16_16x16x1_16x16x1_1x16x1x16_4_1x1_intrawave_v1,6.48,816.67,0.0
gfx950,256,4,4096,2048,ck,7,0,7.3066,a8w8_blockscale_bpreshuffle_1x128x128_256x16x64x256_16x16_16x16_16x16x1_16x16x1_1x16x1x16_4_1x1_intrawave_v1,9.18,1153.69,0.0
gfx950,256,4,4352,4096,ck,7,0,12.3497,a8w8_blockscale_bpreshuffle_1x128x128_256x16x64x256_16x16_16x16_16x16x1_16x16x1_1x16x1x16_4_1x1_intrawave_v1,11.55,1447.56,0.0
gfx950,256,4,4608,2048,ck,7,0,7.3386,a8w8_blockscale_bpreshuffle_1x128x128_256x16x64x256_16x16_16x16_16x16x1_16x16x1_1x16x1x16_4_1x1_intrawave_v1,10.29,1292.1,0.0
gfx950,256,4,4608,4096,ck,7,0,12.6152,a8w8_blockscale_bpreshuffle_1x128x128_256x16x64x256_16x16_16x16_16x16x1_16x16x1_1x16x1x16_4_1x1_intrawave_v1,11.97,1500.38,0.0
gfx950,256,4,5120,4096,ck,7,0,12.7897,a8w8_blockscale_bpreshuffle_1x128x128_256x16x64x256_16x16_16x16_16x16x1_16x16x1_1x16x1x16_4_1x1_intrawave_v1,13.12,1644.2,0.0
gfx950,256,4,6144,2048,ck,7,0,7.9327,a8w8_blockscale_bpreshuffle_1x128x128_256x16x64x256_16x16_16x16_16x16x1_16x16x1_1x16x1x16_4_1x1_intrawave_v1,12.69,1593.44,0.0
gfx950,256,4,8704,4096,ck,7,0,13.4692,a8w8_blockscale_bpreshuffle_1x128x128_256x16x64x256_16x16_16x16_16x16x1_16x16x1_1x16x1x16_4_1x1_intrawave_v1,21.18,2653.28,0.0
gfx950,256,4,9216,2048,ck,7,0,7.9418,a8w8_blockscale_bpreshuffle_1x128x128_256x16x64x256_16x16_16x16_16x16x1_16x16x1_1x16x1x16_4_1x1_intrawave_v1,19.01,2386.9,0.0
gfx950,256,4,10240,4096,ck,7,0,14.1213,a8w8_blockscale_bpreshuffle_1x128x128_256x16x64x256_16x16_16x16_16x16x1_16x16x1_1x16x1x16_4_1x1_intrawave_v1,23.76,2977.16,0.0
gfx950,256,4,12288,2048,ck,7,0,8.6807,a8w8_blockscale_bpreshuffle_1x128x128_256x16x64x256_16x16_16x16_16x16x1_16x16x1_1x16x1x16_4_1x1_intrawave_v1,23.19,2911.32,0.0
gfx950,256,4,17408,4096,ck,7,0,16.5658,a8w8_blockscale_bpreshuffle_1x128x128_256x16x64x256_16x16_16x16_16x16x1_16x16x1_1x16x1x16_4_1x1_intrawave_v1,34.43,4313.64,0.0
gfx950,256,4,20480,4096,ck,7,0,17.4998,a8w8_blockscale_bpreshuffle_1x128x128_256x16x64x256_16x16_16x16_16x16x1_16x16x1_1x16x1x16_4_1x1_intrawave_v1,38.35,4803.84,0.0
gfx950,256,8,16,4096,cktile,2,0,14.5794,a8w8_blockscale_cktile_16x128x256_1x4x1_16x16x64_intrawave_0x1x0_1,0.07,6.76,0.0
gfx950,256,8,32,4096,cktile,1,0,14.576,a8w8_blockscale_cktile_16x128x256_1x4x1_16x16x128_intrawave_0x1x0_2,0.14,11.28,0.0
gfx950,256,8,256,512,ck,7,0,2.6846,a8w8_blockscale_bpreshuffle_1x128x128_256x16x64x256_16x16_16x16_16x16x1_16x16x1_1x16x1x16_4_1x1_intrawave_v1,0.78,51.88,0.0
gfx950,256,8,512,256,ck,6,0,2.5849,a8w8_blockscale_bpreshuffle_1x128x128_256x16x128x256_16x16_16x16_16x16x1_16x16x1_1x16x1x16_8_1x2_intrawave_v1,0.81,54.67,0.0
gfx950,256,8,512,512,ck,6,0,2.8378,a8w8_blockscale_bpreshuffle_1x128x128_256x16x128x256_16x16_16x16_16x16x1_16x16x1_1x16x1x16_8_1x2_intrawave_v1,1.48,96.71,0.0
gfx950,256,8,512,1024,ck,6,0,4.1566,a8w8_blockscale_bpreshuffle_1x128x128_256x16x128x256_16x16_16x16_16x16x1_16x16x1_1x16x1x16_8_1x2_intrawave_v1,2.02,130.08,0.0
gfx950,256,8,512,2048,ck,6,0,5.404,a8w8_blockscale_bpreshuffle_1x128x128_256x16x128x256_16x16_16x16_16x16x1_16x16x1_1x16x1x16_8_1x2_intrawave_v1,3.1,198.58,0.0
gfx950,256,8,1024,256,ck,7,0,2.6714,a8w8_blockscale_bpreshuffle_1x128x128_256x16x64x256_16x16_16x16_16x16x1_16x16x1_1x16x1x16_4_1x1_intrawave_v1,1.57,105.03,0.0
gfx950,256,8,1024,512,ck,6,0,3.3901,a8w8_blockscale_bpreshuffle_1x128x128_256x16x128x256_16x16_16x16_16x16x1_16x16x1_1x16x1x16_8_1x2_intrawave_v1,2.47,160.69,0.0
gfx950,256,8,1024,1024,ck,6,0,4.5254,a8w8_blockscale_bpreshuffle_1x128x128_256x16x128x256_16x16_16x16_16x16x1_16x16x1_1x16x1x16_8_1x2_intrawave_v1,3.71,237.14,0.0
gfx950,256,8,1024,2048,ck,7,0,5.3151,a8w8_blockscale_bpreshuffle_1x128x128_256x16x64x256_16x16_16x16_16x16x1_16x16x1_1x16x1x16_4_1x1_intrawave_v1,6.31,400.73,0.0
gfx950,256,8,1024,4096,ck,7,0,11.9359,a8w8_blockscale_bpreshuffle_1x128x128_256x16x64x256_16x16_16x16_16x16x1_16x16x1_1x16x1x16_4_1x1_intrawave_v1,5.62,355.52,0.0
gfx950,256,8,1152,2048,ck,7,0,5.9408,a8w8_blockscale_bpreshuffle_1x128x128_256x16x64x256_16x16_16x16_16x16x1_16x16x1_1x16x1x16_4_1x1_intrawave_v1,6.35,402.99,0.0
gfx950,256,8,1536,2048,ck,7,0,7.2516,a8w8_blockscale_bpreshuffle_1x128x128_256x16x64x256_16x16_16x16_16x16x1_16x16x1_1x16x1x16_4_1x1_intrawave_v1,6.94,439.45,0.0
gfx950,256,8,2048,512,ck,7,0,3.0406,a8w8_blockscale_bpreshuffle_1x128x128_256x16x64x256_16x16_16x16_16x16x1_16x16x1_1x16x1x16_4_1x1_intrawave_v1,5.52,356.98,0.0
gfx950,256,8,2048,1024,ck,7,0,3.964,a8w8_blockscale_bpreshuffle_1x128x128_256x16x64x256_16x16_16x16_16x16x1_16x16x1_1x16x1x16_4_1x1_intrawave_v1,8.46,539.38,0.0
gfx950,256,8,2048,2048,ck,7,0,7.2237,a8w8_blockscale_bpreshuffle_1x128x128_256x16x64x256_16x16_16x16_16x16x1_16x16x1_1x16x1x16_4_1x1_intrawave_v1,9.29,587.44,0.0
gfx950,256,8,2048,4096,ck,7,0,12.0807,a8w8_blockscale_bpreshuffle_1x128x128_256x16x64x256_16x16_16x16_16x16x1_16x16x1_1x16x1x16_4_1x1_intrawave_v1,11.11,699.81,0.0
gfx950,256,8,2176,4096,ck,7,0,12.4327,a8w8_blockscale_bpreshuffle_1x128x128_256x16x64x256_16x16_16x16_16x16x1_16x16x1_1x16x1x16_4_1x1_intrawave_v1,11.47,722.33,0.0
gfx950,256,8,2304,2048,ck,7,0,7.2733,a8w8_blockscale_bpreshuffle_1x128x128_256x16x64x256_16x16_16x16_16x16x1_16x16x1_1x16x1x16_4_1x1_intrawave_v1,10.38,656.08,0.0
gfx950,256,8,2560,4096,ck,7,0,12.1307,a8w8_blockscale_bpreshuffle_1x128x128_256x16x64x256_16x16_16x16_16x16x1_16x16x1_1x16x1x16_4_1x1_intrawave_v1,13.83,870.48,0.0
gfx950,256,8,3072,2048,ck,7,0,7.6378,a8w8_blockscale_bpreshuffle_1x128x128_256x16x64x256_16x16_16x16_16x16x1_16x16x1_1x16x1x16_4_1x1_intrawave_v1,13.18,832.31,0.0
gfx950,256,8,4096,2048,ck,7,0,7.1699,a8w8_blockscale_bpreshuffle_1x128x128_256x16x64x256_16x16_16x16_16x16x1_16x16x1_1x16x1x16_4_1x1_intrawave_v1,18.72,1181.4,0.0
gfx950,256,8,4352,4096,ck,7,0,12.4303,a8w8_blockscale_bpreshuffle_1x128x128_256x16x64x256_16x16_16x16_16x16x1_16x16x1_1x16x1x16_4_1x1_intrawave_v1,22.94,1442.3,0.0
gfx950,256,8,4608,2048,ck,7,0,8.0515,a8w8_blockscale_bpreshuffle_1x128x128_256x16x64x256_16x16_16x16_16x16x1_16x16x1_1x16x1x16_4_1x1_intrawave_v1,18.75,1183.29,0.0
gfx950,256,8,4608,4096,ck,7,0,12.5023,a8w8_blockscale_bpreshuffle_1x128x128_256x16x64x256_16x16_16x16_16x16x1_16x16x1_1x16x1x16_4_1x1_intrawave_v1,24.15,1518.19,0.0
gfx950,256,8,5120,4096,ck,7,0,12.7339,a8w8_blockscale_bpreshuffle_1x128x128_256x16x64x256_16x16_16x16_16x16x1_16x16x1_1x16x1x16_4_1x1_intrawave_v1,26.35,1655.91,0.0
gfx950,256,8,6144,2048,ck,7,0,7.9833,a8w8_blockscale_bpreshuffle_1x128x128_256x16x64x256_16x16_16x16_16x16x1_16x16x1_1x16x1x16_4_1x1_intrawave_v1,25.22,1590.52,0.0
gfx950,256,8,8704,4096,ck,7,0,13.631,a8w8_blockscale_bpreshuffle_1x128x128_256x16x64x256_16x16_16x16_16x16x1_16x16x1_1x16x1x16_4_1x1_intrawave_v1,41.85,2628.1,0.0
gfx950,256,8,9216,2048,ck,7,0,7.4624,a8w8_blockscale_bpreshuffle_1x128x128_256x16x64x256_16x16_16x16_16x16x1_16x16x1_1x16x1x16_4_1x1_intrawave_v1,40.47,2551.22,0.0
gfx950,256,8,10240,4096,ck,7,0,14.1235,a8w8_blockscale_bpreshuffle_1x128x128_256x16x64x256_16x16_16x16_16x16x1_16x16x1_1x16x1x16_4_1x1_intrawave_v1,47.52,2983.65,0.0
gfx950,256,8,12288,2048,ck,7,0,8.4403,a8w8_blockscale_bpreshuffle_1x128x128_256x16x64x256_16x16_16x16_16x16x1_16x16x1_1x16x1x16_4_1x1_intrawave_v1,47.71,3006.86,0.0
gfx950,256,8,17408,4096,ck,7,0,16.643,a8w8_blockscale_bpreshuffle_1x128x128_256x16x64x256_16x16_16x16_16x16x1_16x16x1_1x16x1x16_4_1x1_intrawave_v1,68.55,4302.98,0.0
gfx950,256,8,20480,4096,ck,7,0,17.7101,a8w8_blockscale_bpreshuffle_1x128x128_256x16x64x256_16x16_16x16_16x16x1_16x16x1_1x16x1x16_4_1x1_intrawave_v1,75.79,4756.98,0.0
gfx950,256,16,16,4096,cktile,12,0,15.0983,a8w8_blockscale_cktile_16x128x256_1x4x1_16x16x128_intrawave_0x1x0_3,0.14,8.72,0.0
gfx950,256,16,32,4096,cktile,1,0,15.1038,a8w8_blockscale_cktile_16x128x256_1x4x1_16x16x128_intrawave_0x1x0_2,0.28,13.08,0.0
gfx950,256,16,256,512,ck,7,0,2.7194,a8w8_blockscale_bpreshuffle_1x128x128_256x16x64x256_16x16_16x16_16x16x1_16x16x1_1x16x1x16_4_1x1_intrawave_v1,1.54,54.22,0.0
gfx950,256,16,512,256,ck,6,0,2.6211,a8w8_blockscale_bpreshuffle_1x128x128_256x16x128x256_16x16_16x16_16x16x1_16x16x1_1x16x1x16_8_1x2_intrawave_v1,1.6,57.82,0.0
gfx950,256,16,512,512,ck,6,0,2.8905,a8w8_blockscale_bpreshuffle_1x128x128_256x16x128x256_16x16_16x16_16x16x1_16x16x1_1x16x1x16_8_1x2_intrawave_v1,2.9,99.19,0.0
gfx950,256,16,512,1024,ck,7,0,3.9659,a8w8_blockscale_bpreshuffle_1x128x128_256x16x64x256_16x16_16x16_16x16x1_16x16x1_1x16x1x16_4_1x1_intrawave_v1,4.23,140.46,0.0
gfx950,256,16,512,2048,ck,7,0,5.2571,a8w8_blockscale_bpreshuffle_1x128x128_256x16x64x256_16x16_16x16_16x16x1_16x16x1_1x16x1x16_4_1x1_intrawave_v1,6.38,208.81,0.0
gfx950,256,16,1024,256,ck,7,0,2.7287,a8w8_blockscale_bpreshuffle_1x128x128_256x16x64x256_16x16_16x16_16x16x1_16x16x1_1x16x1x16_4_1x1_intrawave_v1,3.07,109.58,0.0
gfx950,256,16,1024,512,ck,7,0,3.0314,a8w8_blockscale_bpreshuffle_1x128x128_256x16x64x256_16x16_16x16_16x16x1_16x16x1_1x16x1x16_4_1x1_intrawave_v1,5.53,186.46,0.0
gfx950,256,16,1024,1024,ck,7,0,4.569,a8w8_blockscale_bpreshuffle_1x128x128_256x16x64x256_16x16_16x16_16x16x1_16x16x1_1x16x1x16_4_1x1_intrawave_v1,7.34,240.26,0.0
gfx950,256,16,1024,2048,ck,7,0,5.1776,a8w8_blockscale_bpreshuffle_1x128x128_256x16x64x256_16x16_16x16_16x16x1_16x16x1_1x16x1x16_4_1x1_intrawave_v1,12.96,417.7,0.0
gfx950,256,16,1024,4096,ck,7,0,11.4238,a8w8_blockscale_bpreshuffle_1x128x128_256x16x64x256_16x16_16x16_16x16x1_16x16x1_1x16x1x16_4_1x1_intrawave_v1,11.75,375.76,0.0
gfx950,256,16,1152,2048,ck,7,0,5.5125,a8w8_blockscale_bpreshuffle_1x128x128_256x16x64x256_16x16_16x16_16x16x1_16x16x1_1x16x1x16_4_1x1_intrawave_v1,13.7,440.62,0.0
gfx950,256,16,1536,2048,ck,7,0,7.5651,a8w8_blockscale_bpreshuffle_1x128x128_256x16x64x256_16x16_16x16_16x16x1_16x16x1_1x16x1x16_4_1x1_intrawave_v1,13.31,426.65,0.0
gfx950,256,16,2048,512,ck,7,0,3.0452,a8w8_blockscale_bpreshuffle_1x128x128_256x16x64x256_16x16_16x16_16x16x1_16x16x1_1x16x1x16_4_1x1_intrawave_v1,11.02,368.55,0.0
gfx950,256,16,2048,1024,ck,7,0,3.9842,a8w8_blockscale_bpreshuffle_1x128x128_256x16x64x256_16x16_16x16_16x16x1_16x16x1_1x16x1x16_4_1x1_intrawave_v1,16.84,546.93,0.0
gfx950,256,16,2048,2048,ck,7,0,6.856,a8w8_blockscale_bpreshuffle_1x128x128_256x16x64x256_16x16_16x16_16x16x1_16x16x1_1x16x1x16_4_1x1_intrawave_v1,19.58,626.11,0.0
gfx950,256,16,2048,4096,ck,7,0,11.2919,a8w8_blockscale_bpreshuffle_1x128x128_256x16x64x256_16x16_16x16_16x16x1_16x16x1_1x16x1x16_4_1x1_intrawave_v1,23.77,754.49,0.0
gfx950,256,16,2176,4096,ck,7,0,11.3777,a8w8_blockscale_bpreshuffle_1x128x128_256x16x64x256_16x16_16x16_16x16x1_16x16x1_1x16x1x16_4_1x1_intrawave_v1,25.07,795.25,0.0
gfx950,256,16,2304,2048,ck,7,0,6.7265,a8w8_blockscale_bpreshuffle_1x128x128_256x16x64x256_16x16_16x16_16x16x1_16x16x1_1x16x1x16_4_1x1_intrawave_v1,22.45,717.33,0.0
gfx950,256,16,2560,4096,ck,7,0,12.0651,a8w8_blockscale_bpreshuffle_1x128x128_256x16x64x256_16x16_16x16_16x16x1_16x16x1_1x16x1x16_4_1x1_intrawave_v1,27.81,881.32,0.0
gfx950,256,16,3072,2048,ck,7,0,6.8232,a8w8_blockscale_bpreshuffle_1x128x128_256x16x64x256_16x16_16x16_16x16x1_16x16x1_1x16x1x16_4_1x1_intrawave_v1,29.51,941.28,0.0
gfx950,256,16,4096,1024,ck,7,0,5.1635,a8w8_blockscale_bpreshuffle_1x128x128_256x16x64x256_16x16_16x16_16x16x1_16x16x1_1x16x1x16_4_1x1_intrawave_v1,25.99,840.86,0.0
gfx950,256,16,4096,2048,ck,7,0,7.2391,a8w8_blockscale_bpreshuffle_1x128x128_256x16x64x256_16x16_16x16_16x16x1_16x16x1_1x16x1x16_4_1x1_intrawave_v1,37.08,1181.42,0.0
gfx950,256,16,4352,4096,ck,7,0,11.3916,a8w8_blockscale_bpreshuffle_1x128x128_256x16x64x256_16x16_16x16_16x16x1_16x16x1_1x16x1x16_4_1x1_intrawave_v1,50.07,1582.8,0.0
gfx950,256,16,4608,2048,ck,7,0,7.28,a8w8_blockscale_bpreshuffle_1x128x128_256x16x64x256_16x16_16x16_16x16x1_16x16x1_1x16x1x16_4_1x1_intrawave_v1,41.48,1321.07,0.0
gfx950,256,16,5120,4096,ck,7,0,11.8292,a8w8_blockscale_bpreshuffle_1x128x128_256x16x64x256_16x16_16x16_16x16x1_16x16x1_1x16x1x16_4_1x1_intrawave_v1,56.73,1792.25,0.0
gfx950,256,16,6144,2048,ck,7,0,7.3427,a8w8_blockscale_bpreshuffle_1x128x128_256x16x64x256_16x16_16x16_16x16x1_16x16x1_1x16x1x16_4_1x1_intrawave_v1,54.84,1744.9,0.0
gfx950,256,16,8704,4096,ck,7,0,12.8177,a8w8_blockscale_bpreshuffle_1x128x128_256x16x64x256_16x16_16x16_16x16x1_16x16x1_1x16x1x16_4_1x1_intrawave_v1,89.01,2808.28,0.0
gfx950,256,16,9216,2048,ck,7,0,7.5502,a8w8_blockscale_bpreshuffle_1x128x128_256x16x64x256_16x16_16x16_16x16x1_16x16x1_1x16x1x16_4_1x1_intrawave_v1,80.0,2543.25,0.0
gfx950,256,16,10240,4096,ck,7,0,13.1178,a8w8_blockscale_bpreshuffle_1x128x128_256x16x64x256_16x16_16x16_16x16x1_16x16x1_1x16x1x16_4_1x1_intrawave_v1,102.32,3227.39,0.0
gfx950,256,16,12288,2048,ck,7,0,7.8145,a8w8_blockscale_bpreshuffle_1x128x128_256x16x64x256_16x16_16x16_16x16x1_16x16x1_1x16x1x16_4_1x1_intrawave_v1,103.05,3274.91,0.0
gfx950,256,16,17408,4096,ck,7,0,16.8605,a8w8_blockscale_bpreshuffle_1x128x128_256x16x64x256_16x16_16x16_16x16x1_16x16x1_1x16x1x16_4_1x1_intrawave_v1,135.33,4265.93,0.0
gfx950,256,16,20480,4096,ck,7,0,18.2244,a8w8_blockscale_bpreshuffle_1x128x128_256x16x64x256_16x16_16x16_16x16x1_16x16x1_1x16x1x16_4_1x1_intrawave_v1,147.29,4642.51,0.0
gfx950,256,32,16,4096,cktile,2,0,15.196,a8w8_blockscale_cktile_16x128x256_1x4x1_16x16x64_intrawave_0x1x0_1,0.28,13.01,0.0
gfx950,256,32,32,4096,cktile,12,0,15.3304,a8w8_blockscale_cktile_16x128x256_1x4x1_16x16x128_intrawave_0x1x0_3,0.55,17.23,0.0
gfx950,256,32,256,512,ck,12,0,2.9842,a8w8_blockscale_bpreshuffle_1x128x128_256x32x64x256_16x16_16x16_16x16x1_16x16x1_1x32x1x8_8_2x1_intrawave_v1,2.81,54.9,0.0
gfx950,256,32,512,256,ck,7,0,2.9498,a8w8_blockscale_bpreshuffle_1x128x128_256x16x64x256_16x16_16x16_16x16x1_16x16x1_1x16x1x16_4_1x1_intrawave_v1,2.84,58.32,0.0
gfx950,256,32,512,512,ck,7,0,3.2402,a8w8_blockscale_bpreshuffle_1x128x128_256x16x64x256_16x16_16x16_16x16x1_16x16x1_1x16x1x16_4_1x1_intrawave_v1,5.18,96.07,0.0
gfx950,256,32,512,1024,ck,7,0,4.1647,a8w8_blockscale_bpreshuffle_1x128x128_256x16x64x256_16x16_16x16_16x16x1_16x16x1_1x16x1x16_4_1x1_intrawave_v1,8.06,141.62,0.0
gfx950,256,32,512,2048,ck,7,0,5.4239,a8w8_blockscale_bpreshuffle_1x128x128_256x16x64x256_16x16_16x16_16x16x1_16x16x1_1x16x1x16_4_1x1_intrawave_v1,12.37,211.45,0.0
gfx950,256,32,1024,256,ck,7,0,3.0511,a8w8_blockscale_bpreshuffle_1x128x128_256x16x64x256_16x16_16x16_16x16x1_16x16x1_1x16x1x16_4_1x1_intrawave_v1,5.5,110.08,0.0
gfx950,256,32,1024,512,ck,7,0,3.2677,a8w8_blockscale_bpreshuffle_1x128x128_256x16x64x256_16x16_16x16_16x16x1_16x16x1_1x16x1x16_4_1x1_intrawave_v1,10.27,185.52,0.0
gfx950,256,32,1024,1024,ck,7,0,4.8239,a8w8_blockscale_bpreshuffle_1x128x128_256x16x64x256_16x16_16x16_16x16x1_16x16x1_1x16x1x16_4_1x1_intrawave_v1,13.91,237.75,0.0
gfx950,256,32,1024,2048,ck,7,0,5.3868,a8w8_blockscale_bpreshuffle_1x128x128_256x16x64x256_16x16_16x16_16x16x1_16x16x1_1x16x1x16_4_1x1_intrawave_v1,24.92,413.65,0.0
gfx950,256,32,1024,4096,ck,7,0,11.2193,a8w8_blockscale_bpreshuffle_1x128x128_256x16x64x256_16x16_16x16_16x16x1_16x16x1_1x16x1x16_4_1x1_intrawave_v1,23.93,391.37,0.0
gfx950,256,32,1152,2048,ck,7,0,5.4689,a8w8_blockscale_bpreshuffle_1x128x128_256x16x64x256_16x16_16x16_16x16x1_16x16x1_1x16x1x16_4_1x1_intrawave_v1,27.61,456.87,0.0
gfx950,256,32,1536,2048,ck,12,0,7.6017,a8w8_blockscale_bpreshuffle_1x128x128_256x32x64x256_16x16_16x16_16x16x1_16x16x1_1x32x1x8_8_2x1_intrawave_v1,26.48,435.37,0.0
gfx950,256,32,2048,512,ck,7,0,3.2685,a8w8_blockscale_bpreshuffle_1x128x128_256x16x64x256_16x16_16x16_16x16x1_16x16x1_1x16x1x16_4_1x1_intrawave_v1,20.53,365.93,0.0
gfx950,256,32,2048,1024,ck,7,0,4.2361,a8w8_blockscale_bpreshuffle_1x128x128_256x16x64x256_16x16_16x16_16x16x1_16x16x1_1x16x1x16_4_1x1_intrawave_v1,31.68,533.74,0.0
gfx950,256,32,2048,2048,ck,7,0,7.1317,a8w8_blockscale_bpreshuffle_1x128x128_256x16x64x256_16x16_16x16_16x16x1_16x16x1_1x16x1x16_4_1x1_intrawave_v1,37.64,615.69,0.0
gfx950,256,32,2048,4096,ck,7,0,11.4391,a8w8_blockscale_bpreshuffle_1x128x128_256x16x64x256_16x16_16x16_16x16x1_16x16x1_1x16x1x16_4_1x1_intrawave_v1,46.93,756.24,0.0
gfx950,256,32,2176,4096,ck,7,0,11.4366,a8w8_blockscale_bpreshuffle_1x128x128_256x16x64x256_16x16_16x16_16x16x1_16x16x1_1x16x1x16_4_1x1_intrawave_v1,49.88,802.97,0.0
gfx950,256,32,2304,2048,ck,7,0,6.6844,a8w8_blockscale_bpreshuffle_1x128x128_256x16x64x256_16x16_16x16_16x16x1_16x16x1_1x16x1x16_4_1x1_intrawave_v1,45.18,737.78,0.0
gfx950,256,32,2560,4096,ck,7,0,11.1263,a8w8_blockscale_bpreshuffle_1x128x128_256x16x64x256_16x16_16x16_16x16x1_16x16x1_1x16x1x16_4_1x1_intrawave_v1,60.32,968.94,0.0
gfx950,256,32,3072,2048,ck,7,0,7.4069,a8w8_blockscale_bpreshuffle_1x128x128_256x16x64x256_16x16_16x16_16x16x1_16x16x1_1x16x1x16_4_1x1_intrawave_v1,54.36,884.8,0.0
gfx950,256,32,4096,2048,ck,7,0,7.7878,a8w8_blockscale_bpreshuffle_1x128x128_256x16x64x256_16x16_16x16_16x16x1_16x16x1_1x16x1x16_4_1x1_intrawave_v1,68.94,1119.22,0.0
gfx950,256,32,4352,4096,ck,7,0,11.4221,a8w8_blockscale_bpreshuffle_1x128x128_256x16x64x256_16x16_16x16_16x16x1_16x16x1_1x16x1x16_4_1x1_intrawave_v1,99.88,1596.5,0.0
gfx950,256,32,4608,2048,ck,7,0,7.7986,a8w8_blockscale_bpreshuffle_1x128x128_256x16x64x256_16x16_16x16_16x16x1_16x16x1_1x16x1x16_4_1x1_intrawave_v1,77.45,1256.33,0.0
gfx950,256,32,4608,4096,ck,7,0,11.6068,a8w8_blockscale_bpreshuffle_1x128x128_256x16x64x256_16x16_16x16_16x16x1_16x16x1_1x16x1x16_4_1x1_intrawave_v1,104.07,1662.85,0.0
gfx950,256,32,5120,4096,ck,7,0,11.7346,a8w8_blockscale_bpreshuffle_1x128x128_256x16x64x256_16x16_16x16_16x16x1_16x16x1_1x16x1x16_4_1x1_intrawave_v1,114.38,1826.25,0.0
gfx950,256,32,6144,2048,ck,7,0,7.54,a8w8_blockscale_bpreshuffle_1x128x128_256x16x64x256_16x16_16x16_16x16x1_16x16x1_1x16x1x16_4_1x1_intrawave_v1,106.8,1729.66,0.0
gfx950,256,32,8704,4096,ck,12,0,13.5796,a8w8_blockscale_bpreshuffle_1x128x128_256x32x64x256_16x16_16x16_16x16x1_16x16x1_1x32x1x8_8_2x1_intrawave_v1,168.02,2676.05,0.0
gfx950,256,32,9216,2048,ck,7,0,8.2702,a8w8_blockscale_bpreshuffle_1x128x128_256x16x64x256_16x16_16x16_16x16x1_16x16x1_1x16x1x16_4_1x1_intrawave_v1,146.06,2361.46,0.0
gfx950,256,32,10240,4096,ck,12,0,14.0676,a8w8_blockscale_bpreshuffle_1x128x128_256x32x64x256_16x16_16x16_16x16x1_16x16x1_1x32x1x8_8_2x1_intrawave_v1,190.82,3037.44,0.0
gfx950,256,32,12288,2048,ck,7,0,9.012,a8w8_blockscale_bpreshuffle_1x128x128_256x16x64x256_16x16_16x16_16x16x1_16x16x1_1x16x1x16_4_1x1_intrawave_v1,178.72,2887.02,0.0
gfx950,256,32,17408,4096,ck,12,0,19.4233,a8w8_blockscale_bpreshuffle_1x128x128_256x32x64x256_16x16_16x16_16x16x1_16x16x1_1x32x1x8_8_2x1_intrawave_v1,234.94,3735.12,0.0
gfx950,256,32,20480,4096,ck,12,0,20.1716,a8w8_blockscale_bpreshuffle_1x128x128_256x32x64x256_16x16_16x16_16x16x1_16x16x1_1x32x1x8_8_2x1_intrawave_v1,266.15,4230.1,0.0
gfx950,256,64,16,4096,cktile,2,0,15.3293,a8w8_blockscale_cktile_16x128x256_1x4x1_16x16x64_intrawave_0x1x0_1,0.55,21.51,0.0
gfx950,256,64,32,4096,cktile,1,0,15.251,a8w8_blockscale_cktile_16x128x256_1x4x1_16x16x128_intrawave_0x1x0_2,1.1,26.05,0.0
gfx950,256,64,256,512,ck,6,0,3.6491,a8w8_blockscale_bpreshuffle_1x128x128_256x16x128x256_16x16_16x16_16x16x1_16x16x1_1x16x1x16_8_1x2_intrawave_v1,4.6,53.88,0.0
gfx950,256,64,512,256,ck,7,0,2.9421,a8w8_blockscale_bpreshuffle_1x128x128_256x16x64x256_16x16_16x16_16x16x1_16x16x1_1x16x1x16_4_1x1_intrawave_v1,5.7,72.39,0.0
gfx950,256,64,512,512,ck,7,0,3.2447,a8w8_blockscale_bpreshuffle_1x128x128_256x16x64x256_16x16_16x16_16x16x1_16x16x1_1x16x1x16_4_1x1_intrawave_v1,10.34,111.09,0.0
gfx950,256,64,512,1024,ck,12,0,4.617,a8w8_blockscale_bpreshuffle_1x128x128_256x32x64x256_16x16_16x16_16x16x1_16x16x1_1x32x1x8_8_2x1_intrawave_v1,14.54,141.94,0.0
gfx950,256,64,512,2048,ck,12,0,6.0064,a8w8_blockscale_bpreshuffle_1x128x128_256x32x64x256_16x16_16x16_16x16x1_16x16x1_1x32x1x8_8_2x1_intrawave_v1,22.35,207.31,0.0
gfx950,256,64,1024,256,ck,5,0,3.0742,a8w8_blockscale_bpreshuffle_1x128x128_256x16x64x128_8x16_16x16_16x16x1_8x32x1_1x16x1x16_4_1x1_intrawave_v1,10.91,133.24,0.0
gfx950,256,64,1024,512,ck,6,0,3.6706,a8w8_blockscale_bpreshuffle_1x128x128_256x16x128x256_16x16_16x16_16x16x1_16x16x1_1x16x1x16_8_1x2_intrawave_v1,18.28,187.47,0.0
gfx950,256,64,1024,1024,ck,7,0,4.2391,a8w8_blockscale_bpreshuffle_1x128x128_256x16x64x256_16x16_16x16_16x16x1_16x16x1_1x16x1x16_4_1x1_intrawave_v1,31.66,293.74,0.0
gfx950,256,64,1024,2048,ck,7,0,5.3999,a8w8_blockscale_bpreshuffle_1x128x128_256x16x64x256_16x16_16x16_16x16x1_16x16x1_1x16x1x16_4_1x1_intrawave_v1,49.71,436.91,0.0
gfx950,256,64,1024,4096,ck,7,0,11.0075,a8w8_blockscale_bpreshuffle_1x128x128_256x16x64x256_16x16_16x16_16x16x1_16x16x1_1x16x1x16_4_1x1_intrawave_v1,48.77,416.76,0.0
gfx950,256,64,1152,2048,ck,7,0,6.1787,a8w8_blockscale_bpreshuffle_1x128x128_256x16x64x256_16x16_16x16_16x16x1_16x16x1_1x16x1x16_4_1x1_intrawave_v1,48.88,426.92,0.0
gfx950,256,64,1536,2048,ck,7,0,7.3449,a8w8_blockscale_bpreshuffle_1x128x128_256x16x64x256_16x16_16x16_16x16x1_16x16x1_1x16x1x16_4_1x1_intrawave_v1,54.82,472.9,0.0
gfx950,256,64,2048,512,ck,7,0,3.3002,a8w8_blockscale_bpreshuffle_1x128x128_256x16x64x256_16x16_16x16_16x16x1_16x16x1_1x16x1x16_4_1x1_intrawave_v1,40.67,407.09,0.0
gfx950,256,64,2048,1024,ck,7,0,4.3176,a8w8_blockscale_bpreshuffle_1x128x128_256x16x64x256_16x16_16x16_16x16x1_16x16x1_1x16x1x16_4_1x1_intrawave_v1,62.17,561.62,0.0
gfx950,256,64,2048,2048,ck,7,0,7.1316,a8w8_blockscale_bpreshuffle_1x128x128_256x16x64x256_16x16_16x16_16x16x1_16x16x1_1x16x1x16_4_1x1_intrawave_v1,75.28,643.27,0.0
gfx950,256,64,2048,4096,ck,7,0,11.2775,a8w8_blockscale_bpreshuffle_1x128x128_256x16x64x256_16x16_16x16_16x16x1_16x16x1_1x16x1x16_4_1x1_intrawave_v1,95.21,790.33,0.0
gfx950,256,64,2176,4096,ck,7,0,11.3644,a8w8_blockscale_bpreshuffle_1x128x128_256x16x64x256_16x16_16x16_16x16x1_16x16x1_1x16x1x16_4_1x1_intrawave_v1,100.39,831.86,0.0
gfx950,256,64,2304,2048,ck,7,0,6.8275,a8w8_blockscale_bpreshuffle_1x128x128_256x16x64x256_16x16_16x16_16x16x1_16x16x1_1x16x1x16_4_1x1_intrawave_v1,88.46,753.51,0.0
gfx950,256,64,2560,4096,ck,7,0,11.6227,a8w8_blockscale_bpreshuffle_1x128x128_256x16x64x256_16x16_16x16_16x16x1_16x16x1_1x16x1x16_4_1x1_intrawave_v1,115.48,952.93,0.0
gfx950,256,64,3072,2048,ck,7,0,7.9281,a8w8_blockscale_bpreshuffle_1x128x128_256x16x64x256_16x16_16x16_16x16x1_16x16x1_1x16x1x16_4_1x1_intrawave_v1,101.58,859.69,0.0
gfx950,256,64,4096,2048,ck,7,0,7.1537,a8w8_blockscale_bpreshuffle_1x128x128_256x16x64x256_16x16_16x16_16x16x1_16x16x1_1x16x1x16_4_1x1_intrawave_v1,150.1,1264.24,0.0
gfx950,256,64,4352,4096,ck,7,0,11.9047,a8w8_blockscale_bpreshuffle_1x128x128_256x16x64x256_16x16_16x16_16x16x1_16x16x1_1x16x1x16_4_1x1_intrawave_v1,191.66,1566.19,0.0
gfx950,256,64,4608,2048,ck,6,0,8.0492,a8w8_blockscale_bpreshuffle_1x128x128_256x16x128x256_16x16_16x16_16x16x1_16x16x1_1x16x1x16_8_1x2_intrawave_v1,150.07,1262.0,0.0
gfx950,256,64,4608,4096,ck,12,0,12.3488,a8w8_blockscale_bpreshuffle_1x128x128_256x32x64x256_16x16_16x16_16x16x1_16x16x1_1x32x1x8_8_2x1_intrawave_v1,195.64,1597.43,0.0
gfx950,256,64,5120,4096,ck,12,0,12.6157,a8w8_blockscale_bpreshuffle_1x128x128_256x32x64x256_16x16_16x16_16x16x1_16x16x1_1x32x1x8_8_2x1_intrawave_v1,212.78,1735.06,0.0
gfx950,256,64,6144,2048,ck,12,0,8.3389,a8w8_blockscale_bpreshuffle_1x128x128_256x32x64x256_16x16_16x16_16x16x1_16x16x1_1x32x1x8_8_2x1_intrawave_v1,193.14,1618.97,0.0
gfx950,256,64,8704,4096,ck,17,0,15.4234,a8w8_blockscale_bpreshuffle_1x128x128_256x64x64x256_16x16_16x16_16x16x1_16x16x1_1x32x1x8_8_2x1_intrawave_v1,295.88,2400.76,0.0
gfx950,256,64,9216,2048,ck,17,0,9.7695,a8w8_blockscale_bpreshuffle_1x128x128_256x64x64x256_16x16_16x16_16x16x1_16x16x1_1x32x1x8_8_2x1_intrawave_v1,247.29,2066.13,0.0
gfx950,256,64,10240,4096,ck,17,0,16.0505,a8w8_blockscale_bpreshuffle_1x128x128_256x64x64x256_16x16_16x16_16x16x1_16x16x1_1x32x1x8_8_2x1_intrawave_v1,334.49,2711.19,0.0
gfx950,256,64,12288,2048,ck,11,0,10.7084,a8w8_blockscale_bpreshuffle_1x128x128_256x32x128x256_16x16_16x16_16x16x1_16x16x1_1x32x1x8_8_2x1_intrawave_v1,300.81,2509.22,0.0
gfx950,256,64,17408,4096,ck,10,0,23.5642,a8w8_blockscale_bpreshuffle_1x128x128_256x32x64x128_16x16_16x16_8x32x1_8x32x1_1x32x1x8_8_2x1_intrawave_v1,387.32,3131.6,0.0206
gfx950,256,64,20480,4096,ck,10,0,24.8796,a8w8_blockscale_bpreshuffle_1x128x128_256x32x64x128_16x16_16x16_8x32x1_8x32x1_1x32x1x8_8_2x1_intrawave_v1,431.58,3487.58,0.021
gfx950,256,128,16,4096,cktile,2,0,15.5018,a8w8_blockscale_cktile_16x128x256_1x4x1_16x16x64_intrawave_0x1x0_1,1.08,38.31,0.0
gfx950,256,128,32,4096,cktile,12,0,15.6217,a8w8_blockscale_cktile_16x128x256_1x4x1_16x16x128_intrawave_0x1x0_3,2.15,42.48,0.0
gfx950,256,128,256,512,ck,7,0,3.2278,a8w8_blockscale_bpreshuffle_1x128x128_256x16x64x256_16x16_16x16_16x16x1_16x16x1_1x16x1x16_4_1x1_intrawave_v1,10.4,81.21,0.0
gfx950,256,128,512,256,ck,10,0,3.388,a8w8_blockscale_bpreshuffle_1x128x128_256x32x64x128_16x16_16x16_8x32x1_8x32x1_1x32x1x8_8_2x1_intrawave_v1,9.9,87.05,0.0
gfx950,256,128,512,512,ck,7,0,3.2281,a8w8_blockscale_bpreshuffle_1x128x128_256x16x64x256_16x16_16x16_16x16x1_16x16x1_1x16x1x16_4_1x1_intrawave_v1,20.79,142.11,0.0
gfx950,256,128,512,1024,ck,6,0,4.7301,a8w8_blockscale_bpreshuffle_1x128x128_256x16x128x256_16x16_16x16_16x16x1_16x16x1_1x16x1x16_8_1x2_intrawave_v1,28.38,166.26,0.0
gfx950,256,128,512,2048,ck,7,0,5.4576,a8w8_blockscale_bpreshuffle_1x128x128_256x16x64x256_16x16_16x16_16x16x1_16x16x1_1x16x1x16_4_1x1_intrawave_v1,49.19,264.18,0.0
gfx950,256,128,1024,256,ck,7,0,2.9858,a8w8_blockscale_bpreshuffle_1x128x128_256x16x64x256_16x16_16x16_16x16x1_16x16x1_1x16x1x16_4_1x1_intrawave_v1,22.48,186.57,0.0
gfx950,256,128,1024,512,ck,7,0,3.3077,a8w8_blockscale_bpreshuffle_1x128x128_256x16x64x256_16x16_16x16_16x16x1_16x16x1_1x16x1x16_4_1x1_intrawave_v1,40.58,257.57,0.0
gfx950,256,128,1024,1024,ck,7,0,4.2871,a8w8_blockscale_bpreshuffle_1x128x128_256x16x64x256_16x16_16x16_16x16x1_16x16x1_1x16x1x16_4_1x1_intrawave_v1,62.61,336.31,0.0
gfx950,256,128,1024,2048,ck,7,0,5.8742,a8w8_blockscale_bpreshuffle_1x128x128_256x16x64x256_16x16_16x16_16x16x1_16x16x1_1x16x1x16_4_1x1_intrawave_v1,91.39,446.26,0.0
gfx950,256,128,1024,4096,asm,5,6,7.7633,_ZN5aiter42fp8gemm_bf16_blockscale_BpreShuffle_32x128E,138.31,641.57,0.0001
gfx950,256,128,1152,2048,ck,7,0,6.7713,a8w8_blockscale_bpreshuffle_1x128x128_256x16x64x256_16x16_16x16_16x16x1_16x16x1_1x16x1x16_4_1x1_intrawave_v1,89.2,430.69,0.0
gfx950,256,128,1536,2048,ck,7,0,7.0358,a8w8_blockscale_bpreshuffle_1x128x128_256x16x64x256_16x16_16x16_16x16x1_16x16x1_1x16x1x16_4_1x1_intrawave_v1,114.46,540.25,0.0
gfx950,256,128,2048,512,ck,7,0,3.3974,a8w8_blockscale_bpreshuffle_1x128x128_256x16x64x256_16x16_16x16_16x16x1_16x16x1_1x16x1x16_4_1x1_intrawave_v1,79.01,482.25,0.0
gfx950,256,128,2048,1024,ck,7,0,5.065,a8w8_blockscale_bpreshuffle_1x128x128_256x16x64x256_16x16_16x16_16x16x1_16x16x1_1x16x1x16_4_1x1_intrawave_v1,106.0,543.44,0.0
gfx950,256,128,2048,2048,ck,7,0,7.0523,a8w8_blockscale_bpreshuffle_1x128x128_256x16x64x256_16x16_16x16_16x16x1_16x16x1_1x16x1x16_4_1x1_intrawave_v1,152.25,706.26,0.0
gfx950,256,128,2048,4096,ck,7,0,11.2291,a8w8_blockscale_bpreshuffle_1x128x128_256x16x64x256_16x16_16x16_16x16x1_16x16x1_1x16x1x16_4_1x1_intrawave_v1,191.24,840.42,0.0
gfx950,256,128,2176,4096,ck,7,0,11.9866,a8w8_blockscale_bpreshuffle_1x128x128_256x16x64x256_16x16_16x16_16x16x1_16x16x1_1x16x1x16_4_1x1_intrawave_v1,190.35,833.78,0.0
gfx950,256,128,2304,2048,ck,7,0,7.3232,a8w8_blockscale_bpreshuffle_1x128x128_256x16x64x256_16x16_16x16_16x16x1_16x16x1_1x16x1x16_4_1x1_intrawave_v1,164.95,760.67,0.0
gfx950,256,128,2560,4096,ck,7,0,12.3257,a8w8_blockscale_bpreshuffle_1x128x128_256x16x64x256_16x16_16x16_16x16x1_16x16x1_1x16x1x16_4_1x1_intrawave_v1,217.79,946.43,0.0
gfx950,256,128,3072,2048,ck,7,0,7.9906,a8w8_blockscale_bpreshuffle_1x128x128_256x16x64x256_16x16_16x16_16x16x1_16x16x1_1x16x1x16_4_1x1_intrawave_v1,201.56,918.58,0.0
gfx950,256,128,4096,1024,ck,7,0,5.6283,a8w8_blockscale_bpreshuffle_1x128x128_256x16x64x256_16x16_16x16_16x16x1_16x16x1_1x16x1x16_4_1x1_intrawave_v1,190.78,954.81,0.0
gfx950,256,128,4096,2048,ck,7,0,7.6378,a8w8_blockscale_bpreshuffle_1x128x128_256x16x64x256_16x16_16x16_16x16x1_16x16x1_1x16x1x16_4_1x1_intrawave_v1,281.17,1269.91,0.0
gfx950,256,128,4352,4096,ck,17,0,14.242,a8w8_blockscale_bpreshuffle_1x128x128_256x64x64x256_16x16_16x16_16x16x1_16x16x1_1x32x1x8_8_2x1_intrawave_v1,320.42,1366.68,0.0
gfx950,256,128,4608,2048,ck,12,0,9.9319,a8w8_blockscale_bpreshuffle_1x128x128_256x32x64x256_16x16_16x16_16x16x1_16x16x1_1x32x1x8_8_2x1_intrawave_v1,243.25,1095.36,0.0
gfx950,256,128,4608,4096,ck,17,0,14.28,a8w8_blockscale_bpreshuffle_1x128x128_256x64x64x256_16x16_16x16_16x16x1_16x16x1_1x32x1x8_8_2x1_intrawave_v1,338.36,1441.06,0.0
gfx950,256,128,5120,4096,ck,17,0,14.6196,a8w8_blockscale_bpreshuffle_1x128x128_256x64x64x256_16x16_16x16_16x16x1_16x16x1_1x32x1x8_8_2x1_intrawave_v1,367.23,1560.0,0.0
gfx950,256,128,6144,2048,ck,11,0,9.9764,a8w8_blockscale_bpreshuffle_1x128x128_256x32x128x256_16x16_16x16_16x16x1_16x16x1_1x32x1x8_8_2x1_intrawave_v1,322.88,1445.2,0.0
gfx950,256,128,8704,4096,ck,10,0,21.5622,a8w8_blockscale_bpreshuffle_1x128x128_256x32x64x128_16x16_16x16_8x32x1_8x32x1_1x32x1x8_8_2x1_intrawave_v1,423.28,1781.08,0.0226
gfx950,256,128,9216,2048,ck,12,0,12.5155,a8w8_blockscale_bpreshuffle_1x128x128_256x32x64x256_16x16_16x16_16x16x1_16x16x1_1x32x1x8_8_2x1_intrawave_v1,386.07,1717.53,0.0
gfx950,256,128,10240,4096,ck,17,0,22.1575,a8w8_blockscale_bpreshuffle_1x128x128_256x64x64x256_16x16_16x16_16x16x1_16x16x1_1x32x1x8_8_2x1_intrawave_v1,484.6,2034.92,0.0
gfx950,256,128,12288,2048,ck,12,0,13.0547,a8w8_blockscale_bpreshuffle_1x128x128_256x32x64x256_16x16_16x16_16x16x1_16x16x1_1x32x1x8_8_2x1_intrawave_v1,493.5,2188.77,0.0
gfx950,256,128,17408,4096,ck,2,0,30.9071,a8w8_blockscale_bpreshuffle_1x128x128_256x64x64x128_16x16_16x16_8x32x1_8x32x1_1x32x1x8_8_2x1_intrawave_v3,590.6,2468.17,0.0
gfx950,256,128,20480,4096,ck,2,0,32.1737,a8w8_blockscale_bpreshuffle_1x128x128_256x64x64x128_16x16_16x16_8x32x1_8x32x1_1x32x1x8_8_2x1_intrawave_v3,667.47,2786.54,0.0
gfx950,256,256,16,4096,cktile,0,0,15.5628,a8w8_blockscale_cktile_16x128x256_1x4x1_16x16x128_intrawave_0x1x0_1,2.16,72.11,0.0
gfx950,256,256,32,4096,cktile,0,0,15.6541,a8w8_blockscale_cktile_16x128x256_1x4x1_16x16x128_intrawave_0x1x0_1,4.29,76.4,0.0
gfx950,256,256,256,512,ck,7,0,3.2341,a8w8_blockscale_bpreshuffle_1x128x128_256x16x64x256_16x16_16x16_16x16x1_16x16x1_1x16x1x16_4_1x1_intrawave_v1,20.75,121.58,0.0
gfx950,256,256,512,256,ck,7,0,2.9734,a8w8_blockscale_bpreshuffle_1x128x128_256x16x64x256_16x16_16x16_16x16x1_16x16x1_1x16x1x16_4_1x1_intrawave_v1,22.57,154.29,0.0
gfx950,256,256,512,512,ck,7,0,3.2856,a8w8_blockscale_bpreshuffle_1x128x128_256x16x64x256_16x16_16x16_16x16x1_16x16x1_1x16x1x16_4_1x1_intrawave_v1,40.85,199.46,0.0
gfx950,256,256,512,1024,ck,7,0,4.2998,a8w8_blockscale_bpreshuffle_1x128x128_256x16x64x256_16x16_16x16_16x16x1_16x16x1_1x16x1x16_4_1x1_intrawave_v1,62.43,243.87,0.0
gfx950,256,256,512,2048,ck,12,0,6.0343,a8w8_blockscale_bpreshuffle_1x128x128_256x32x64x256_16x16_16x16_16x16x1_16x16x1_1x32x1x8_8_2x1_intrawave_v1,88.97,304.1,0.0
gfx950,256,256,1024,256,ck,7,0,3.0616,a8w8_blockscale_bpreshuffle_1x128x128_256x16x64x256_16x16_16x16_16x16x1_16x16x1_1x16x1x16_4_1x1_intrawave_v1,43.84,278.28,0.0
gfx950,256,256,1024,512,ck,7,0,3.4184,a8w8_blockscale_bpreshuffle_1x128x128_256x16x64x256_16x16_16x16_16x16x1_16x16x1_1x16x1x16_4_1x1_intrawave_v1,78.53,345.09,0.0
gfx950,256,256,1024,1024,ck,7,0,4.5507,a8w8_blockscale_bpreshuffle_1x128x128_256x16x64x256_16x16_16x16_16x16x1_16x16x1_1x16x1x16_4_1x1_intrawave_v1,117.98,403.24,0.0
gfx950,256,256,1024,2048,ck,7,0,6.8139,a8w8_blockscale_bpreshuffle_1x128x128_256x16x64x256_16x16_16x16_16x16x1_16x16x1_1x16x1x16_4_1x1_intrawave_v1,157.58,461.66,0.0
gfx950,256,256,1024,4096,ck,7,0,11.2167,a8w8_blockscale_bpreshuffle_1x128x128_256x16x64x256_16x16_16x16_16x16x1_16x16x1_1x16x1x16_4_1x1_intrawave_v1,191.45,514.16,0.0
gfx950,256,256,1152,2048,ck,7,0,6.8666,a8w8_blockscale_bpreshuffle_1x128x128_256x16x64x256_16x16_16x16_16x16x1_16x16x1_1x16x1x16_4_1x1_intrawave_v1,175.92,505.84,0.0
gfx950,256,256,1536,2048,ck,12,0,6.8003,a8w8_blockscale_bpreshuffle_1x128x128_256x32x64x256_16x16_16x16_16x16x1_16x16x1_1x32x1x8_8_2x1_intrawave_v1,236.84,655.33,0.0
gfx950,256,256,2048,512,ck,12,0,3.9772,a8w8_blockscale_bpreshuffle_1x128x128_256x32x64x256_16x16_16x16_16x16x1_16x16x1_1x32x1x8_8_2x1_intrawave_v1,134.99,560.25,0.0
gfx950,256,256,2048,1024,ck,12,0,5.3818,a8w8_blockscale_bpreshuffle_1x128x128_256x32x64x256_16x16_16x16_16x16x1_16x16x1_1x32x1x8_8_2x1_intrawave_v1,199.51,633.22,0.0
gfx950,256,256,2048,2048,ck,12,0,7.5893,a8w8_blockscale_bpreshuffle_1x128x128_256x32x64x256_16x16_16x16_16x16x1_16x16x1_1x32x1x8_8_2x1_intrawave_v1,282.96,759.91,0.0
gfx950,256,256,2048,4096,ck,12,0,12.1126,a8w8_blockscale_bpreshuffle_1x128x128_256x32x64x256_16x16_16x16_16x16x1_16x16x1_1x32x1x8_8_2x1_intrawave_v1,354.59,865.69,0.0
gfx950,256,256,2176,4096,ck,17,0,13.8813,a8w8_blockscale_bpreshuffle_1x128x128_256x64x64x256_16x16_16x16_16x16x1_16x16x1_1x32x1x8_8_2x1_intrawave_v1,328.74,797.88,0.0
gfx950,256,256,2304,2048,ck,17,0,9.3755,a8w8_blockscale_bpreshuffle_1x128x128_256x64x64x256_16x16_16x16_16x16x1_16x16x1_1x32x1x8_8_2x1_intrawave_v1,257.68,685.03,0.0
gfx950,256,256,2560,4096,ck,17,0,13.8476,a8w8_blockscale_bpreshuffle_1x128x128_256x64x64x256_16x16_16x16_16x16x1_16x16x1_1x32x1x8_8_2x1_intrawave_v1,387.7,927.6,0.0
gfx950,256,256,3072,2048,ck,11,0,9.3418,a8w8_blockscale_bpreshuffle_1x128x128_256x32x128x256_16x16_16x16_16x16x1_16x16x1_1x32x1x8_8_2x1_intrawave_v1,344.82,897.96,0.0
gfx950,256,256,4096,1024,ck,12,0,6.7543,a8w8_blockscale_bpreshuffle_1x128x128_256x32x64x256_16x16_16x16_16x16x1_16x16x1_1x32x1x8_8_2x1_intrawave_v1,317.94,970.29,0.0
gfx950,256,256,4096,2048,ck,11,0,9.726,a8w8_blockscale_bpreshuffle_1x128x128_256x32x128x256_16x16_16x16_16x16x1_16x16x1_1x32x1x8_8_2x1_intrawave_v1,441.6,1132.02,0.0
gfx950,256,256,4352,4096,ck,17,0,20.0387,a8w8_blockscale_bpreshuffle_1x128x128_256x64x64x256_16x16_16x16_16x16x1_16x16x1_1x32x1x8_8_2x1_intrawave_v1,455.46,1053.09,0.0
gfx950,256,256,4608,2048,ck,10,0,11.8567,a8w8_blockscale_bpreshuffle_1x128x128_256x32x64x128_16x16_16x16_8x32x1_8x32x1_1x32x1x8_8_2x1_intrawave_v1,407.52,1039.14,0.0214
gfx950,256,256,4608,4096,ck,10,0,20.4557,a8w8_blockscale_bpreshuffle_1x128x128_256x32x64x128_16x16_16x16_8x32x1_8x32x1_1x32x1x8_8_2x1_intrawave_v1,472.42,1089.29,0.0198
gfx950,256,256,5120,4096,ck,17,0,20.7969,a8w8_blockscale_bpreshuffle_1x128x128_256x64x64x256_16x16_16x16_16x16x1_16x16x1_1x32x1x8_8_2x1_intrawave_v1,516.3,1184.87,0.0
gfx950,256,256,6144,2048,ck,12,0,12.3901,a8w8_blockscale_bpreshuffle_1x128x128_256x32x64x256_16x16_16x16_16x16x1_16x16x1_1x32x1x8_8_2x1_intrawave_v1,519.97,1311.77,0.0
gfx950,256,256,8704,4096,ck,14,0,28.0912,a8w8_blockscale_bpreshuffle_1x128x128_256x64x128x128_16x16_16x16_8x32x1_8x32x1_1x32x1x8_8_2x1_intrawave_v1,649.8,1465.11,0.0
gfx950,256,256,9216,2048,ck,2,0,16.9832,a8w8_blockscale_bpreshuffle_1x128x128_256x64x64x128_16x16_16x16_8x32x1_8x32x1_1x32x1x8_8_2x1_intrawave_v3,569.01,1420.07,0.0
gfx950,256,256,10240,4096,ck,14,0,29.4165,a8w8_blockscale_bpreshuffle_1x128x128_256x64x128x128_16x16_16x16_8x32x1_8x32x1_1x32x1x8_8_2x1_intrawave_v1,730.03,1639.71,0.0
gfx950,256,256,12288,2048,ck,15,0,17.9751,a8w8_blockscale_bpreshuffle_1x128x128_256x64x64x128_16x16_16x16_8x32x1_8x32x1_1x32x1x8_8_2x1_intrawave_v1,716.82,1779.22,0.0022
gfx950,256,256,17408,4096,ck,14,0,41.891,a8w8_blockscale_bpreshuffle_1x128x128_256x64x128x128_16x16_16x16_8x32x1_8x32x1_1x32x1x8_8_2x1_intrawave_v1,871.48,1939.91,0.0002
gfx950,256,256,20480,4096,ck,14,0,44.3436,a8w8_blockscale_bpreshuffle_1x128x128_256x64x128x128_16x16_16x16_8x32x1_8x32x1_1x32x1x8_8_2x1_intrawave_v1,968.57,2151.84,0.0002
gfx950,256,512,16,4096,cktile,14,0,16.0332,a8w8_blockscale_cktile_16x128x256_1x4x1_16x16x64_intrawave_0x1x0_3,4.19,135.91,0.0
gfx950,256,512,32,4096,cktile,12,0,16.3069,a8w8_blockscale_cktile_16x128x256_1x4x1_16x16x128_intrawave_0x1x0_3,8.23,138.65,0.0
gfx950,256,512,256,512,ck,7,0,3.2978,a8w8_blockscale_bpreshuffle_1x128x128_256x16x64x256_16x16_16x16_16x16x1_16x16x1_1x16x1x16_4_1x1_intrawave_v1,40.7,198.73,0.0
gfx950,256,512,512,256,ck,12,0,3.3898,a8w8_blockscale_bpreshuffle_1x128x128_256x32x64x256_16x16_16x16_16x16x1_16x16x1_1x32x1x8_8_2x1_intrawave_v1,39.59,232.0,0.0
gfx950,256,512,512,512,ck,6,0,3.8003,a8w8_blockscale_bpreshuffle_1x128x128_256x16x128x256_16x16_16x16_16x16x1_16x16x1_1x16x1x16_8_1x2_intrawave_v1,70.64,275.92,0.0
gfx950,256,512,512,1024,ck,12,0,4.7538,a8w8_blockscale_bpreshuffle_1x128x128_256x32x64x256_16x16_16x16_16x16x1_16x16x1_1x32x1x8_8_2x1_intrawave_v1,112.94,330.86,0.0
gfx950,256,512,512,2048,ck,7,0,6.4199,a8w8_blockscale_bpreshuffle_1x128x128_256x16x64x256_16x16_16x16_16x16x1_16x16x1_1x16x1x16_4_1x1_intrawave_v1,167.25,408.33,0.0
gfx950,256,512,1024,256,ck,12,0,3.4576,a8w8_blockscale_bpreshuffle_1x128x128_256x32x64x256_16x16_16x16_16x16x1_16x16x1_1x32x1x8_8_2x1_intrawave_v1,77.64,416.99,0.0
gfx950,256,512,1024,512,ck,7,0,3.9003,a8w8_blockscale_bpreshuffle_1x128x128_256x16x64x256_16x16_16x16_16x16x1_16x16x1_1x16x1x16_4_1x1_intrawave_v1,137.65,470.48,0.0
gfx950,256,512,1024,1024,ck,12,0,5.1465,a8w8_blockscale_bpreshuffle_1x128x128_256x32x64x256_16x16_16x16_16x16x1_16x16x1_1x32x1x8_8_2x1_intrawave_v1,208.64,509.36,0.0
gfx950,256,512,1024,2048,ck,12,0,7.3305,a8w8_blockscale_bpreshuffle_1x128x128_256x32x64x256_16x16_16x16_16x16x1_16x16x1_1x32x1x8_8_2x1_intrawave_v1,292.95,572.17,0.0
gfx950,256,512,1024,4096,ck,12,0,11.9299,a8w8_blockscale_bpreshuffle_1x128x128_256x32x64x256_16x16_16x16_16x16x1_16x16x1_1x32x1x8_8_2x1_intrawave_v1,360.02,615.26,0.0
gfx950,256,512,1152,2048,ck,12,0,8.3546,a8w8_blockscale_bpreshuffle_1x128x128_256x32x64x256_16x16_16x16_16x16x1_16x16x1_1x32x1x8_8_2x1_intrawave_v1,289.17,549.1,0.0
gfx950,256,512,1536,2048,ck,12,0,8.9195,a8w8_blockscale_bpreshuffle_1x128x128_256x32x64x256_16x16_16x16_16x16x1_16x16x1_1x32x1x8_8_2x1_intrawave_v1,361.14,646.58,0.0
gfx950,256,512,2048,512,ck,11,0,5.0404,a8w8_blockscale_bpreshuffle_1x128x128_256x32x128x256_16x16_16x16_16x16x1_16x16x1_1x32x1x8_8_2x1_intrawave_v1,213.03,676.11,0.0
gfx950,256,512,2048,1024,ck,11,0,6.3963,a8w8_blockscale_bpreshuffle_1x128x128_256x32x128x256_16x16_16x16_16x16x1_16x16x1_1x32x1x8_8_2x1_intrawave_v1,335.74,737.71,0.0
gfx950,256,512,2048,2048,ck,17,0,9.7291,a8w8_blockscale_bpreshuffle_1x128x128_256x64x64x256_16x16_16x16_16x16x1_16x16x1_1x32x1x8_8_2x1_intrawave_v1,441.46,754.44,0.0
gfx950,256,512,2048,4096,ck,17,0,13.9323,a8w8_blockscale_bpreshuffle_1x128x128_256x64x64x256_16x16_16x16_16x16x1_16x16x1_1x32x1x8_8_2x1_intrawave_v1,616.55,903.15,0.0
gfx950,256,512,2176,4096,ck,15,0,19.7041,a8w8_blockscale_bpreshuffle_1x128x128_256x64x64x128_16x16_16x16_8x32x1_8x32x1_1x32x1x8_8_2x1_intrawave_v1,463.19,671.85,0.0002
gfx950,256,512,2304,2048,ck,12,0,12.0763,a8w8_blockscale_bpreshuffle_1x128x128_256x32x64x256_16x16_16x16_16x16x1_16x16x1_1x32x1x8_8_2x1_intrawave_v1,400.11,672.93,0.0
gfx950,256,512,2560,4096,ck,17,0,20.1587,a8w8_blockscale_bpreshuffle_1x128x128_256x64x64x256_16x16_16x16_16x16x1_16x16x1_1x32x1x8_8_2x1_intrawave_v1,532.64,754.23,0.0
gfx950,256,512,3072,2048,ck,12,0,12.7345,a8w8_blockscale_bpreshuffle_1x128x128_256x32x64x256_16x16_16x16_16x16x1_16x16x1_1x32x1x8_8_2x1_intrawave_v1,505.91,823.41,0.0
gfx950,256,512,4096,2048,ck,17,0,13.313,a8w8_blockscale_bpreshuffle_1x128x128_256x64x64x256_16x16_16x16_16x16x1_16x16x1_1x32x1x8_8_2x1_intrawave_v1,645.23,1023.92,0.0
gfx950,256,512,4352,4096,ck,14,0,26.8411,a8w8_blockscale_bpreshuffle_1x128x128_256x64x128x128_16x16_16x16_8x32x1_8x32x1_1x32x1x8_8_2x1_intrawave_v1,680.06,908.29,0.0
gfx950,256,512,4608,2048,ck,2,0,16.4601,a8w8_blockscale_bpreshuffle_1x128x128_256x64x64x128_16x16_16x16_8x32x1_8x32x1_1x32x1x8_8_2x1_intrawave_v3,587.1,923.71,0.0
gfx950,256,512,4608,4096,ck,2,0,27.5561,a8w8_blockscale_bpreshuffle_1x128x128_256x64x64x128_16x16_16x16_8x32x1_8x32x1_1x32x1x8_8_2x1_intrawave_v3,701.38,932.28,0.0
gfx950,256,512,5120,4096,ck,14,0,27.981,a8w8_blockscale_bpreshuffle_1x128x128_256x64x128x128_16x16_16x16_8x32x1_8x32x1_1x32x1x8_8_2x1_intrawave_v1,767.48,1011.81,0.0
gfx950,256,512,6144,2048,ck,14,0,17.6425,a8w8_blockscale_bpreshuffle_1x128x128_256x64x128x128_16x16_16x16_8x32x1_8x32x1_1x32x1x8_8_2x1_intrawave_v1,730.33,1129.26,0.0001
gfx950,256,512,8704,4096,ck,14,0,40.8265,a8w8_blockscale_bpreshuffle_1x128x128_256x64x128x128_16x16_16x16_8x32x1_8x32x1_1x32x1x8_8_2x1_intrawave_v1,894.2,1142.93,0.0002
gfx950,256,512,9216,2048,ck,14,0,23.8481,a8w8_blockscale_bpreshuffle_1x128x128_256x64x128x128_16x16_16x16_8x32x1_8x32x1_1x32x1x8_8_2x1_intrawave_v1,810.44,1231.13,0.0002
gfx950,256,512,10240,4096,ck,14,0,43.0694,a8w8_blockscale_bpreshuffle_1x128x128_256x64x128x128_16x16_16x16_8x32x1_8x32x1_1x32x1x8_8_2x1_intrawave_v1,997.22,1266.0,0.0002
gfx950,256,512,12288,2048,ck,14,0,25.1576,a8w8_blockscale_bpreshuffle_1x128x128_256x64x128x128_16x16_16x16_8x32x1_8x32x1_1x32x1x8_8_2x1_intrawave_v1,1024.33,1542.17,0.0002
gfx950,256,512,17408,4096,cktile,26,0,57.9873,a8w8_blockscale_cktile_192x256x128_4x2x1_16x16x128_intrawave_0x1x0_2,1259.15,1573.21,0.0
gfx950,256,512,20480,4096,cktile,26,0,58.6077,a8w8_blockscale_cktile_192x256x128_4x2x1_16x16x128_intrawave_0x1x0_2,1465.67,1824.93,0.0
gfx950,256,1024,16,4096,cktile,2,0,17.2261,a8w8_blockscale_cktile_16x128x256_1x4x1_16x16x64_intrawave_0x1x0_1,7.79,249.19,0.0
gfx950,256,1024,32,4096,cktile,2,0,17.4819,a8w8_blockscale_cktile_16x128x256_1x4x1_16x16x64_intrawave_0x1x0_1,15.36,251.17,0.0
gfx950,256,1024,256,512,ck,12,0,3.9174,a8w8_blockscale_bpreshuffle_1x128x128_256x32x64x256_16x16_16x16_16x16x1_16x16x1_1x32x1x8_8_2x1_intrawave_v1,68.52,301.13,0.0
gfx950,256,1024,512,256,ck,12,0,3.4621,a8w8_blockscale_bpreshuffle_1x128x128_256x32x64x256_16x16_16x16_16x16x1_16x16x1_1x32x1x8_8_2x1_intrawave_v1,77.54,416.45,0.0
gfx950,256,1024,512,512,ck,6,0,3.9298,a8w8_blockscale_bpreshuffle_1x128x128_256x16x128x256_16x16_16x16_16x16x1_16x16x1_1x16x1x16_8_1x2_intrawave_v1,136.62,466.95,0.0
gfx950,256,1024,512,1024,ck,12,0,5.4144,a8w8_blockscale_bpreshuffle_1x128x128_256x32x64x256_16x16_16x16_16x16x1_16x16x1_1x32x1x8_8_2x1_intrawave_v1,198.31,484.16,0.0
gfx950,256,1024,512,2048,ck,12,0,6.9139,a8w8_blockscale_bpreshuffle_1x128x128_256x32x64x256_16x16_16x16_16x16x1_16x16x1_1x32x1x8_8_2x1_intrawave_v1,310.6,606.65,0.0
gfx950,256,1024,1024,256,ck,12,0,4.2083,a8w8_blockscale_bpreshuffle_1x128x128_256x32x64x256_16x16_16x16_16x16x1_16x16x1_1x32x1x8_8_2x1_intrawave_v1,127.57,622.92,0.0
gfx950,256,1024,1024,512,ck,11,0,4.9934,a8w8_blockscale_bpreshuffle_1x128x128_256x32x128x256_16x16_16x16_16x16x1_16x16x1_1x32x1x8_8_2x1_intrawave_v1,215.03,629.98,0.0
gfx950,256,1024,1024,1024,ck,17,0,6.6739,a8w8_blockscale_bpreshuffle_1x128x128_256x64x64x256_16x16_16x16_16x16x1_16x16x1_1x32x1x8_8_2x1_intrawave_v1,321.77,628.46,0.0
gfx950,256,1024,1024,2048,ck,17,0,10.2081,a8w8_blockscale_bpreshuffle_1x128x128_256x64x64x256_16x16_16x16_16x16x1_16x16x1_1x32x1x8_8_2x1_intrawave_v1,420.74,616.32,0.0
gfx950,256,1024,1024,4096,ck,17,0,14.2436,a8w8_blockscale_bpreshuffle_1x128x128_256x64x64x256_16x16_16x16_16x16x1_16x16x1_1x32x1x8_8_2x1_intrawave_v1,603.07,736.17,0.0
gfx950,256,1024,1152,2048,ck,17,0,12.1623,a8w8_blockscale_bpreshuffle_1x128x128_256x64x64x256_16x16_16x16_16x16x1_16x16x1_1x32x1x8_8_2x1_intrawave_v1,397.28,560.4,0.0
gfx950,256,1024,1536,2048,ck,17,0,12.7918,a8w8_blockscale_bpreshuffle_1x128x128_256x64x64x256_16x16_16x16_16x16x1_16x16x1_1x32x1x8_8_2x1_intrawave_v1,503.64,655.78,0.0
gfx950,256,1024,2048,512,ck,17,0,6.2043,a8w8_blockscale_bpreshuffle_1x128x128_256x64x64x256_16x16_16x16_16x16x1_16x16x1_1x32x1x8_8_2x1_intrawave_v1,346.13,929.54,0.0
gfx950,256,1024,2048,1024,ck,15,0,9.4687,a8w8_blockscale_bpreshuffle_1x128x128_256x64x64x128_16x16_16x16_8x32x1_8x32x1_1x32x1x8_8_2x1_intrawave_v1,453.6,775.19,0.0005
gfx950,256,1024,2048,2048,ck,17,0,13.1692,a8w8_blockscale_bpreshuffle_1x128x128_256x64x64x256_16x16_16x16_16x16x1_16x16x1_1x32x1x8_8_2x1_intrawave_v1,652.27,796.23,0.0
gfx950,256,1024,2048,4096,ck,17,0,21.7907,a8w8_blockscale_bpreshuffle_1x128x128_256x64x64x256_16x16_16x16_16x16x1_16x16x1_1x32x1x8_8_2x1_intrawave_v1,788.4,769.93,0.0
gfx950,256,1024,2176,4096,ck,14,0,26.8779,a8w8_blockscale_bpreshuffle_1x128x128_256x64x128x128_16x16_16x16_8x32x1_8x32x1_1x32x1x8_8_2x1_intrawave_v1,679.13,653.46,0.0
gfx950,256,1024,2304,2048,ck,2,0,16.7332,a8w8_blockscale_bpreshuffle_1x128x128_256x64x64x128_16x16_16x16_8x32x1_8x32x1_1x32x1x8_8_2x1_intrawave_v3,577.52,689.31,0.0
gfx950,256,1024,2560,4096,ck,14,0,27.5173,a8w8_blockscale_bpreshuffle_1x128x128_256x64x128x128_16x16_16x16_8x32x1_8x32x1_1x32x1x8_8_2x1_intrawave_v1,780.41,724.02,0.0001
gfx950,256,1024,3072,2048,ck,14,0,17.6286,a8w8_blockscale_bpreshuffle_1x128x128_256x64x128x128_16x16_16x16_8x32x1_8x32x1_1x32x1x8_8_2x1_intrawave_v1,730.91,832.74,0.0001
gfx950,256,1024,4096,1024,ck,14,0,12.7825,a8w8_blockscale_bpreshuffle_1x128x128_256x64x128x128_16x16_16x16_8x32x1_8x32x1_1x32x1x8_8_2x1_intrawave_v1,672.01,1066.42,0.0
gfx950,256,1024,4096,2048,ck,14,0,18.6898,a8w8_blockscale_bpreshuffle_1x128x128_256x64x128x128_16x16_16x16_8x32x1_8x32x1_1x32x1x8_8_2x1_intrawave_v1,919.21,1009.88,0.0002
gfx950,256,1024,4352,4096,ck,14,0,40.6091,a8w8_blockscale_bpreshuffle_1x128x128_256x64x128x128_16x16_16x16_8x32x1_8x32x1_1x32x1x8_8_2x1_intrawave_v1,898.99,761.73,0.0001
gfx950,256,1024,4608,2048,ck,14,0,23.4479,a8w8_blockscale_bpreshuffle_1x128x128_256x64x128x128_16x16_16x16_8x32x1_8x32x1_1x32x1x8_8_2x1_intrawave_v1,824.27,894.39,0.0002
gfx950,256,1024,4608,4096,ck,14,0,40.7002,a8w8_blockscale_bpreshuffle_1x128x128_256x64x128x128_16x16_16x16_8x32x1_8x32x1_1x32x1x8_8_2x1_intrawave_v1,949.74,798.67,0.0001
gfx950,256,1024,5120,4096,ck,1,0,42.2835,a8w8_blockscale_bpreshuffle_1x128x128_256x64x128x128_16x16_16x16_8x32x1_8x32x1_1x32x1x8_8_2x1_intrawave_v3,1015.75,843.16,0.0
gfx950,256,1024,6144,2048,ck,14,0,24.9928,a8w8_blockscale_bpreshuffle_1x128x128_256x64x128x128_16x16_16x16_8x32x1_8x32x1_1x32x1x8_8_2x1_intrawave_v1,1031.09,1090.83,0.0002
gfx950,256,1024,8704,4096,cktile,26,0,58.5138,a8w8_blockscale_cktile_192x256x128_4x2x1_16x16x128_intrawave_0x1x0_2,1247.82,985.61,0.0
gfx950,256,1024,9216,2048,cktile,26,0,37.0071,a8w8_blockscale_cktile_192x256x128_4x2x1_16x16x128_intrawave_0x1x0_2,1044.52,1076.71,0.0
gfx950,256,1024,10240,4096,cktile,11,0,58.1448,a8w8_blockscale_cktile_192x256x128_4x2x1_16x16x128_intrawave_0x1x0_1,1477.33,1154.17,0.0
gfx950,256,1024,12288,2048,ck,13,0,45.3706,a8w8_blockscale_bpreshuffle_1x128x128_256x64x256x128_16x16_16x16_8x32x1_8x32x1_1x32x1x8_8_2x1_intrawave_v1,1135.97,1155.57,0.0
gfx950,256,1024,17408,4096,ck,13,0,109.526,a8w8_blockscale_bpreshuffle_1x128x128_256x64x256x128_16x16_16x16_8x32x1_8x32x1_1x32x1x8_8_2x1_intrawave_v1,1333.28,1014.82,0.0
gfx950,256,1024,20480,4096,cktile,11,0,112.2264,a8w8_blockscale_cktile_192x256x128_4x2x1_16x16x128_intrawave_0x1x0_1,1530.82,1158.58,0.0
gfx950,256,2048,16,4096,cktile,2,0,17.6907,a8w8_blockscale_cktile_16x128x256_1x4x1_16x16x64_intrawave_0x1x0_1,15.17,481.59,0.0
gfx950,256,2048,32,4096,cktile,1,0,17.7872,a8w8_blockscale_cktile_16x128x256_1x4x1_16x16x128_intrawave_0x1x0_2,30.18,486.35,0.0
gfx950,256,2048,256,512,ck,6,0,3.9969,a8w8_blockscale_bpreshuffle_1x128x128_256x16x128x256_16x16_16x16_16x16x1_16x16x1_1x16x1x16_8_1x2_intrawave_v1,134.32,557.49,0.0
gfx950,256,2048,512,256,ck,4,0,4.3267,a8w8_blockscale_bpreshuffle_1x128x128_256x16x128x128_8x16_16x16_16x16x1_8x32x1_1x16x1x16_8_1x2_intrawave_v1,124.08,636.17,0.0
gfx950,256,2048,512,512,ck,11,0,4.9635,a8w8_blockscale_bpreshuffle_1x128x128_256x32x128x256_16x16_16x16_16x16x1_16x16x1_1x32x1x8_8_2x1_intrawave_v1,216.33,686.59,0.0
gfx950,256,2048,512,1024,ck,9,0,7.2831,a8w8_blockscale_bpreshuffle_1x128x128_256x32x128x128_16x16_16x16_8x32x1_8x32x1_1x32x1x8_8_2x1_intrawave_v1,294.86,647.88,0.0
gfx950,256,2048,512,2048,ck,11,0,10.3233,a8w8_blockscale_bpreshuffle_1x128x128_256x32x128x256_16x16_16x16_16x16x1_16x16x1_1x32x1x8_8_2x1_intrawave_v1,416.05,711.02,0.0
gfx950,256,2048,1024,256,ck,17,0,5.7494,a8w8_blockscale_bpreshuffle_1x128x128_256x64x64x256_16x16_16x16_16x16x1_16x16x1_1x32x1x8_8_2x1_intrawave_v1,186.76,866.31,0.0
gfx950,256,2048,1024,512,ck,14,0,6.599,a8w8_blockscale_bpreshuffle_1x128x128_256x64x128x128_16x16_16x16_8x32x1_8x32x1_1x32x1x8_8_2x1_intrawave_v1,325.43,873.95,0.0
gfx950,256,2048,1024,1024,ck,17,0,9.7776,a8w8_blockscale_bpreshuffle_1x128x128_256x64x64x256_16x16_16x16_16x16x1_16x16x1_1x32x1x8_8_2x1_intrawave_v1,439.27,750.7,0.0
gfx950,256,2048,1024,2048,ck,17,0,13.7534,a8w8_blockscale_bpreshuffle_1x128x128_256x64x64x256_16x16_16x16_16x16x1_16x16x1_1x32x1x8_8_2x1_intrawave_v1,624.57,762.41,0.0
gfx950,256,2048,1024,4096,ck,17,0,21.6011,a8w8_blockscale_bpreshuffle_1x128x128_256x64x64x256_16x16_16x16_16x16x1_16x16x1_1x32x1x8_8_2x1_intrawave_v1,795.32,776.68,0.0
gfx950,256,2048,1152,2048,ck,15,0,16.8691,a8w8_blockscale_bpreshuffle_1x128x128_256x64x64x128_16x16_16x16_8x32x1_8x32x1_1x32x1x8_8_2x1_intrawave_v1,572.86,668.22,0.0011
gfx950,256,2048,1536,2048,ck,14,0,18.0163,a8w8_blockscale_bpreshuffle_1x128x128_256x64x128x128_16x16_16x16_8x32x1_8x32x1_1x32x1x8_8_2x1_intrawave_v1,715.18,756.62,0.0001
gfx950,256,2048,2048,512,ck,17,0,10.3309,a8w8_blockscale_bpreshuffle_1x128x128_256x64x64x256_16x16_16x16_16x16x1_16x16x1_1x32x1x8_8_2x1_intrawave_v1,415.74,1014.99,0.0
gfx950,256,2048,2048,1024,ck,14,0,13.6276,a8w8_blockscale_bpreshuffle_1x128x128_256x64x128x128_16x16_16x16_8x32x1_8x32x1_1x32x1x8_8_2x1_intrawave_v1,630.33,923.34,0.0
gfx950,256,2048,2048,2048,ck,14,0,18.8518,a8w8_blockscale_bpreshuffle_1x128x128_256x64x128x128_16x16_16x16_8x32x1_8x32x1_1x32x1x8_8_2x1_intrawave_v1,911.31,889.95,0.0002
gfx950,256,2048,2048,4096,ck,14,0,30.6689,a8w8_blockscale_bpreshuffle_1x128x128_256x64x128x128_16x16_16x16_8x32x1_8x32x1_1x32x1x8_8_2x1_intrawave_v1,1120.34,820.56,0.0002
gfx950,256,2048,2176,4096,ck,14,0,39.7142,a8w8_blockscale_bpreshuffle_1x128x128_256x64x128x128_16x16_16x16_8x32x1_8x32x1_1x32x1x8_8_2x1_intrawave_v1,919.25,660.08,0.0002
gfx950,256,2048,2304,2048,ck,14,0,23.6368,a8w8_blockscale_bpreshuffle_1x128x128_256x64x128x128_16x16_16x16_8x32x1_8x32x1_1x32x1x8_8_2x1_intrawave_v1,817.68,776.34,0.0001
gfx950,256,2048,2560,4096,ck,14,0,41.4725,a8w8_blockscale_bpreshuffle_1x128x128_256x64x128x128_16x16_16x16_8x32x1_8x32x1_1x32x1x8_8_2x1_intrawave_v1,1035.62,707.94,0.0002
gfx950,256,2048,3072,2048,ck,14,0,25.6421,a8w8_blockscale_bpreshuffle_1x128x128_256x64x128x128_16x16_16x16_8x32x1_8x32x1_1x32x1x8_8_2x1_intrawave_v1,1004.98,899.64,0.0003
gfx950,256,2048,4096,1024,ck,13,0,21.1184,a8w8_blockscale_bpreshuffle_1x128x128_256x64x256x128_16x16_16x16_8x32x1_8x32x1_1x32x1x8_8_2x1_intrawave_v1,813.5,1092.35,0.0
gfx950,256,2048,4096,2048,ck,13,0,29.6053,a8w8_blockscale_bpreshuffle_1x128x128_256x64x256x128_16x16_16x16_8x32x1_8x32x1_1x32x1x8_8_2x1_intrawave_v1,1160.59,991.72,0.0
gfx950,256,2048,4352,4096,cktile,26,0,58.3217,a8w8_blockscale_cktile_192x256x128_4x2x1_16x16x128_intrawave_0x1x0_2,1251.93,755.13,0.0
gfx950,256,2048,4608,2048,cktile,28,0,37.2525,a8w8_blockscale_cktile_192x256x128_4x2x1_16x16x128_intrawave_0x1x0_4,1037.64,872.58,0.0
gfx950,256,2048,4608,4096,cktile,26,0,57.5625,a8w8_blockscale_cktile_192x256x128_4x2x1_16x16x128_intrawave_0x1x0_2,1343.05,801.52,0.0
gfx950,256,2048,5120,4096,cktile,11,0,57.9764,a8w8_blockscale_cktile_192x256x128_4x2x1_16x16x128_intrawave_0x1x0_1,1481.63,868.14,0.0
gfx950,256,2048,6144,2048,ck,13,0,44.574,a8w8_blockscale_bpreshuffle_1x128x128_256x64x256x128_16x16_16x16_8x32x1_8x32x1_1x32x1x8_8_2x1_intrawave_v1,1156.27,940.98,0.0
gfx950,256,2048,8704,4096,ck,13,0,109.9061,a8w8_blockscale_bpreshuffle_1x128x128_256x64x256x128_16x16_16x16_8x32x1_8x32x1_1x32x1x8_8_2x1_intrawave_v1,1328.67,725.09,0.0
gfx950,256,2048,9216,2048,ck,13,0,66.817,a8w8_blockscale_bpreshuffle_1x128x128_256x64x256x128_16x16_16x16_8x32x1_8x32x1_1x32x1x8_8_2x1_intrawave_v1,1157.03,910.21,0.0
gfx950,256,2048,10240,4096,cktile,27,0,112.1256,a8w8_blockscale_cktile_192x256x128_4x2x1_16x16x128_intrawave_0x1x0_3,1532.2,822.96,0.0
gfx950,256,2048,12288,2048,ck,13,0,79.2269,a8w8_blockscale_bpreshuffle_1x128x128_256x64x256x128_16x16_16x16_8x32x1_8x32x1_1x32x1x8_8_2x1_intrawave_v1,1301.06,1005.87,0.0
gfx950,256,2048,17408,4096,cktile,26,0,171.9678,a8w8_blockscale_cktile_192x256x128_4x2x1_16x16x128_intrawave_0x1x0_2,1698.33,878.04,0.0
gfx950,256,2048,20480,4096,cktile,26,0,198.7021,a8w8_blockscale_cktile_192x256x128_4x2x1_16x16x128_intrawave_0x1x0_2,1729.21,886.56,0.0
gfx950,256,4096,16,4096,cktile,2,0,17.9746,a8w8_blockscale_cktile_16x128x256_1x4x1_16x16x64_intrawave_0x1x0_1,29.87,944.32,0.0
gfx950,256,4096,32,4096,cktile,0,0,18.2014,a8w8_blockscale_cktile_16x128x256_1x4x1_16x16x128_intrawave_0x1x0_1,58.99,943.36,0.0
gfx950,256,4096,256,512,ck,12,0,5.1797,a8w8_blockscale_bpreshuffle_1x128x128_256x32x64x256_16x16_16x16_16x16x1_16x16x1_1x32x1x8_8_2x1_intrawave_v1,207.3,835.06,0.0
gfx950,256,4096,512,256,ck,12,0,5.7231,a8w8_blockscale_bpreshuffle_1x128x128_256x32x64x256_16x16_16x16_16x16x1_16x16x1_1x32x1x8_8_2x1_intrawave_v1,187.62,938.99,0.0
gfx950,256,4096,512,512,ck,16,0,6.0313,a8w8_blockscale_bpreshuffle_1x128x128_256x64x128x256_16x16_16x16_16x16x1_16x16x1_1x32x1x8_8_2x1_intrawave_v1,356.06,1086.6,0.0
gfx950,256,4096,512,1024,ck,14,0,9.5983,a8w8_blockscale_bpreshuffle_1x128x128_256x64x128x128_16x16_16x16_8x32x1_8x32x1_1x32x1x8_8_2x1_intrawave_v1,447.47,928.59,0.0
gfx950,256,4096,512,2048,ck,15,0,13.5435,a8w8_blockscale_bpreshuffle_1x128x128_256x64x64x128_16x16_16x16_8x32x1_8x32x1_1x32x1x8_8_2x1_intrawave_v1,634.25,1006.5,0.0009
gfx950,256,4096,1024,256,ck,8,0,7.9335,a8w8_blockscale_bpreshuffle_1x128x128_256x32x256x128_16x16_16x16_8x32x1_8x32x1_1x32x1x8_8_2x1_intrawave_v1,270.69,1222.58,0.0
gfx950,256,4096,1024,512,ck,16,0,10.3882,a8w8_blockscale_bpreshuffle_1x128x128_256x64x128x256_16x16_16x16_16x16x1_16x16x1_1x32x1x8_8_2x1_intrawave_v1,413.45,1059.86,0.0
gfx950,256,4096,1024,1024,ck,14,0,13.1991,a8w8_blockscale_bpreshuffle_1x128x128_256x64x128x128_16x16_16x16_8x32x1_8x32x1_1x32x1x8_8_2x1_intrawave_v1,650.8,1032.76,0.0
gfx950,256,4096,1024,2048,ck,14,0,19.096,a8w8_blockscale_bpreshuffle_1x128x128_256x64x128x128_16x16_16x16_8x32x1_8x32x1_1x32x1x8_8_2x1_intrawave_v1,899.66,988.39,0.0001
gfx950,256,4096,1024,4096,ck,14,0,30.6367,a8w8_blockscale_bpreshuffle_1x128x128_256x64x128x128_16x16_16x16_8x32x1_8x32x1_1x32x1x8_8_2x1_intrawave_v1,1121.52,958.33,0.0002
gfx950,256,4096,1152,2048,ck,14,0,23.5712,a8w8_blockscale_bpreshuffle_1x128x128_256x64x128x128_16x16_16x16_8x32x1_8x32x1_1x32x1x8_8_2x1_intrawave_v1,819.96,856.35,0.0002
gfx950,256,4096,1536,2048,ck,14,0,25.2772,a8w8_blockscale_bpreshuffle_1x128x128_256x64x128x128_16x16_16x16_8x32x1_8x32x1_1x32x1x8_8_2x1_intrawave_v1,1019.49,954.11,0.0003
gfx950,256,4096,2048,512,ck,16,0,15.7595,a8w8_blockscale_bpreshuffle_1x128x128_256x64x128x256_16x16_16x16_16x16x1_16x16x1_1x32x1x8_8_2x1_intrawave_v1,545.06,1264.19,0.0
gfx950,256,4096,2048,1024,ck,13,0,20.6804,a8w8_blockscale_bpreshuffle_1x128x128_256x64x256x128_16x16_16x16_8x32x1_8x32x1_1x32x1x8_8_2x1_intrawave_v1,830.73,1115.48,0.0
gfx950,256,4096,2048,2048,ck,13,0,29.3797,a8w8_blockscale_bpreshuffle_1x128x128_256x64x256x128_16x16_16x16_8x32x1_8x32x1_1x32x1x8_8_2x1_intrawave_v1,1169.51,999.33,0.0
gfx950,256,4096,2048,4096,ck,13,0,49.1486,a8w8_blockscale_bpreshuffle_1x128x128_256x64x256x128_16x16_16x16_8x32x1_8x32x1_1x32x1x8_8_2x1_intrawave_v1,1398.2,853.39,0.0
gfx950,256,4096,2176,4096,ck,14,0,63.494,a8w8_blockscale_bpreshuffle_1x128x128_256x64x128x128_16x16_16x16_8x32x1_8x32x1_1x32x1x8_8_2x1_intrawave_v1,1149.94,685.35,0.0003
gfx950,256,4096,2304,2048,cktile,26,0,38.0636,a8w8_blockscale_cktile_192x256x128_4x2x1_16x16x128_intrawave_0x1x0_2,1015.53,840.21,0.0
gfx950,256,4096,2560,4096,cktile,28,0,59.7488,a8w8_blockscale_cktile_192x256x128_4x2x1_16x16x128_intrawave_0x1x0_4,1437.67,807.29,0.0
gfx950,256,4096,3072,2048,ck,13,0,41.8638,a8w8_blockscale_bpreshuffle_1x128x128_256x64x256x128_16x16_16x16_8x32x1_8x32x1_1x32x1x8_8_2x1_intrawave_v1,1231.13,951.8,0.0
gfx950,256,4096,4096,1024,ck,13,0,38.902,a8w8_blockscale_bpreshuffle_1x128x128_256x64x256x128_16x16_16x16_8x32x1_8x32x1_1x32x1x8_8_2x1_intrawave_v1,883.24,1078.17,0.0
gfx950,256,4096,4096,2048,ck,13,0,54.8859,a8w8_blockscale_bpreshuffle_1x128x128_256x64x256x128_16x16_16x16_8x32x1_8x32x1_1x32x1x8_8_2x1_intrawave_v1,1252.04,917.02,0.0
gfx950,256,4096,4352,4096,ck,13,0,106.0856,a8w8_blockscale_bpreshuffle_1x128x128_256x64x256x128_16x16_16x16_8x32x1_8x32x1_1x32x1x8_8_2x1_intrawave_v1,1376.52,662.24,0.0
gfx950,256,4096,4608,2048,ck,13,0,63.8104,a8w8_blockscale_bpreshuffle_1x128x128_256x64x256x128_16x16_16x16_8x32x1_8x32x1_1x32x1x8_8_2x1_intrawave_v1,1211.55,870.93,0.0
gfx950,256,4096,4608,4096,ck,13,0,107.8779,a8w8_blockscale_bpreshuffle_1x128x128_256x64x256x128_16x16_16x16_8x32x1_8x32x1_1x32x1x8_8_2x1_intrawave_v1,1433.28,680.4,0.0
gfx950,256,4096,5120,4096,cktile,28,0,113.4632,a8w8_blockscale_cktile_192x256x128_4x2x1_16x16x128_intrawave_0x1x0_4,1514.14,702.36,0.0
gfx950,256,4096,6144,2048,ck,13,0,77.4893,a8w8_blockscale_bpreshuffle_1x128x128_256x64x256x128_16x16_16x16_8x32x1_8x32x1_1x32x1x8_8_2x1_intrawave_v1,1330.24,920.17,0.0
gfx950,256,4096,8704,4096,cktile,26,0,174.8011,a8w8_blockscale_cktile_192x256x128_4x2x1_16x16x128_intrawave_0x1x0_2,1670.8,707.84,0.0
gfx950,256,4096,9216,2048,ck,13,0,112.9284,a8w8_blockscale_bpreshuffle_1x128x128_256x64x256x128_16x16_16x16_8x32x1_8x32x1_1x32x1x8_8_2x1_intrawave_v1,1369.18,909.96,0.0
gfx950,256,4096,10240,4096,ck,13,0,205.6209,a8w8_blockscale_bpreshuffle_1x128x128_256x64x256x128_16x16_16x16_8x32x1_8x32x1_1x32x1x8_8_2x1_intrawave_v1,1671.02,693.54,0.0
gfx950,256,4096,12288,2048,ck,13,0,143.8759,a8w8_blockscale_bpreshuffle_1x128x128_256x64x256x128_16x16_16x16_8x32x1_8x32x1_1x32x1x8_8_2x1_intrawave_v1,1432.89,932.87,0.0
gfx950,256,4096,17408,4096,ck,13,0,332.8382,a8w8_blockscale_bpreshuffle_1x128x128_256x64x256x128_16x16_16x16_8x32x1_8x32x1_1x32x1x8_8_2x1_intrawave_v1,1754.95,693.09,0.0
gfx950,256,4096,20480,4096,cktile,28,0,371.7097,a8w8_blockscale_cktile_192x256x128_4x2x1_16x16x128_intrawave_0x1x0_4,1848.74,722.16,0.0
gfx950,256,8192,16,4096,cktile,1,0,25.2013,a8w8_blockscale_cktile_16x128x256_1x4x1_16x16x128_intrawave_0x1x0_2,42.61,1344.46,0.0
gfx950,256,8192,32,4096,cktile,2,0,25.1674,a8w8_blockscale_cktile_16x128x256_1x4x1_16x16x64_intrawave_0x1x0_1,85.33,1359.29,0.0
gfx950,256,8192,256,512,ck,9,0,6.6634,a8w8_blockscale_bpreshuffle_1x128x128_256x32x128x128_16x16_16x16_8x32x1_8x32x1_1x32x1x8_8_2x1_intrawave_v1,322.28,1278.58,0.0
gfx950,256,8192,512,256,ck,14,0,7.7636,a8w8_blockscale_bpreshuffle_1x128x128_256x64x128x128_16x16_16x16_8x32x1_8x32x1_1x32x1x8_8_2x1_intrawave_v1,276.61,1367.51,0.0
gfx950,256,8192,512,512,ck,1,0,10.1629,a8w8_blockscale_bpreshuffle_1x128x128_256x64x128x128_16x16_16x16_8x32x1_8x32x1_1x32x1x8_8_2x1_intrawave_v3,422.61,1263.92,0.0
gfx950,256,8192,512,1024,ck,14,0,13.1835,a8w8_blockscale_bpreshuffle_1x128x128_256x64x128x128_16x16_16x16_8x32x1_8x32x1_1x32x1x8_8_2x1_intrawave_v1,651.57,1312.36,0.0
gfx950,256,8192,512,2048,ck,14,0,18.8774,a8w8_blockscale_bpreshuffle_1x128x128_256x64x128x128_16x16_16x16_8x32x1_8x32x1_1x32x1x8_8_2x1_intrawave_v1,910.08,1388.67,0.0
gfx950,256,8192,1024,256,ck,9,0,12.8029,a8w8_blockscale_bpreshuffle_1x128x128_256x32x128x128_16x16_16x16_8x32x1_8x32x1_1x32x1x8_8_2x1_intrawave_v1,335.47,1494.7,0.0
gfx950,256,8192,1024,512,ck,11,0,15.7794,a8w8_blockscale_bpreshuffle_1x128x128_256x32x128x256_16x16_16x16_16x16x1_16x16x1_1x32x1x8_8_2x1_intrawave_v1,544.38,1362.27,0.0
gfx950,256,8192,1024,1024,ck,13,0,20.8729,a8w8_blockscale_bpreshuffle_1x128x128_256x64x256x128_16x16_16x16_8x32x1_8x32x1_1x32x1x8_8_2x1_intrawave_v1,823.07,1255.91,0.0
gfx950,256,8192,1024,2048,ck,13,0,29.8301,a8w8_blockscale_bpreshuffle_1x128x128_256x64x256x128_16x16_16x16_8x32x1_8x32x1_1x32x1x8_8_2x1_intrawave_v1,1151.85,1195.15,0.0
gfx950,256,8192,1024,4096,ck,13,0,50.1691,a8w8_blockscale_bpreshuffle_1x128x128_256x64x256x128_16x16_16x16_8x32x1_8x32x1_1x32x1x8_8_2x1_intrawave_v1,1369.76,1086.84,0.0
gfx950,256,8192,1152,2048,ck,14,0,38.0618,a8w8_blockscale_bpreshuffle_1x128x128_256x64x128x128_16x16_16x16_8x32x1_8x32x1_1x32x1x8_8_2x1_intrawave_v1,1015.58,998.66,0.0003
gfx950,256,8192,1536,2048,ck,13,0,44.5696,a8w8_blockscale_bpreshuffle_1x128x128_256x64x256x128_16x16_16x16_8x32x1_8x32x1_1x32x1x8_8_2x1_intrawave_v1,1156.38,1011.65,0.0
gfx950,256,8192,2048,512,ck,16,0,25.8314,a8w8_blockscale_bpreshuffle_1x128x128_256x64x128x256_16x16_16x16_16x16x1_16x16x1_1x32x1x8_8_2x1_intrawave_v1,665.08,1501.94,0.0
gfx950,256,8192,2048,1024,ck,13,0,37.8569,a8w8_blockscale_bpreshuffle_1x128x128_256x64x256x128_16x16_16x16_8x32x1_8x32x1_1x32x1x8_8_2x1_intrawave_v1,907.62,1163.33,0.0
gfx950,256,8192,2048,2048,ck,13,0,54.7439,a8w8_blockscale_bpreshuffle_1x128x128_256x64x256x128_16x16_16x16_8x32x1_8x32x1_1x32x1x8_8_2x1_intrawave_v1,1255.29,996.02,0.0
gfx950,256,8192,2048,4096,ck,13,0,91.6649,a8w8_blockscale_bpreshuffle_1x128x128_256x64x256x128_16x16_16x16_8x32x1_8x32x1_1x32x1x8_8_2x1_intrawave_v1,1499.36,823.62,0.0
gfx950,256,8192,2176,4096,ck,14,0,111.4756,a8w8_blockscale_bpreshuffle_1x128x128_256x64x128x128_16x16_16x16_8x32x1_8x32x1_1x32x1x8_8_2x1_intrawave_v1,1309.96,700.77,0.0003
gfx950,256,8192,2304,2048,ck,13,0,64.5936,a8w8_blockscale_bpreshuffle_1x128x128_256x64x256x128_16x16_16x16_8x32x1_8x32x1_1x32x1x8_8_2x1_intrawave_v1,1196.86,917.19,0.0
gfx950,256,8192,2560,4096,ck,13,0,114.6292,a8w8_blockscale_bpreshuffle_1x128x128_256x64x256x128_16x16_16x16_8x32x1_8x32x1_1x32x1x8_8_2x1_intrawave_v1,1498.73,750.1,0.0
gfx950,256,8192,3072,2048,ck,13,0,76.4197,a8w8_blockscale_bpreshuffle_1x128x128_256x64x256x128_16x16_16x16_8x32x1_8x32x1_1x32x1x8_8_2x1_intrawave_v1,1348.86,960.49,0.0
gfx950,256,8192,4096,1024,ck,14,0,69.6632,a8w8_blockscale_bpreshuffle_1x128x128_256x64x128x128_16x16_16x16_8x32x1_8x32x1_1x32x1x8_8_2x1_intrawave_v1,986.45,1143.96,0.0003
gfx950,256,8192,4096,2048,ck,13,0,100.0583,a8w8_blockscale_bpreshuffle_1x128x128_256x64x256x128_16x16_16x16_8x32x1_8x32x1_1x32x1x8_8_2x1_intrawave_v1,1373.59,922.21,0.0
gfx950,256,8192,4352,4096,cktile,28,0,175.3808,a8w8_blockscale_cktile_192x256x128_4x2x1_16x16x128_intrawave_0x1x0_4,1665.28,699.53,0.0
gfx950,256,8192,4608,2048,ck,13,0,112.5915,a8w8_blockscale_bpreshuffle_1x128x128_256x64x256x128_16x16_16x16_8x32x1_8x32x1_1x32x1x8_8_2x1_intrawave_v1,1373.27,903.37,0.0
gfx950,256,8192,4608,4096,cktile,11,0,186.7698,a8w8_blockscale_cktile_192x256x128_4x2x1_16x16x128_intrawave_0x1x0_1,1655.72,684.94,0.0
gfx950,256,8192,5120,4096,ck,13,0,204.8152,a8w8_blockscale_bpreshuffle_1x128x128_256x64x256x128_16x16_16x16_8x32x1_8x32x1_1x32x1x8_8_2x1_intrawave_v1,1677.6,675.79,0.0
gfx950,256,8192,6144,2048,ck,13,0,141.6849,a8w8_blockscale_bpreshuffle_1x128x128_256x64x256x128_16x16_16x16_8x32x1_8x32x1_1x32x1x8_8_2x1_intrawave_v1,1455.05,917.69,0.0
gfx950,256,8192,8704,4096,ck,13,0,331.6284,a8w8_blockscale_bpreshuffle_1x128x128_256x64x256x128_16x16_16x16_8x32x1_8x32x1_1x32x1x8_8_2x1_intrawave_v1,1761.36,638.7,0.0
gfx950,256,8192,9216,2048,ck,13,0,206.2058,a8w8_blockscale_bpreshuffle_1x128x128_256x64x256x128_16x16_16x16_8x32x1_8x32x1_1x32x1x8_8_2x1_intrawave_v1,1499.66,905.15,0.0
gfx950,256,8192,10240,4096,cktile,26,0,376.1269,a8w8_blockscale_cktile_192x256x128_4x2x1_16x16x128_intrawave_0x1x0_2,1827.03,646.78,0.0
gfx950,256,8192,12288,2048,ck,13,0,266.9287,a8w8_blockscale_bpreshuffle_1x128x128_256x64x256x128_16x16_16x16_8x32x1_8x32x1_1x32x1x8_8_2x1_intrawave_v1,1544.67,911.37,0.0
gfx950,256,8192,17408,4096,cktile,11,0,617.9339,a8w8_blockscale_cktile_192x256x128_4x2x1_16x16x128_intrawave_0x1x0_1,1890.54,631.25,0.0
gfx950,256,8192,20480,4096,cktile,11,0,708.3984,a8w8_blockscale_cktile_192x256x128_4x2x1_16x16x128_intrawave_0x1x0_1,1940.14,639.45,0.0
gfx950,256,16384,16,4096,cktile,7,0,37.8328,a8w8_blockscale_cktile_32x128x128_1x4x1_16x16x64_intrawave_0x1x0_2,56.76,1789.42,0.0
gfx950,256,16384,32,4096,cktile,7,0,38.4387,a8w8_blockscale_cktile_32x128x128_1x4x1_16x16x64_intrawave_0x1x0_2,111.74,1776.56,0.0
gfx950,256,16384,256,512,ck,1,0,10.5907,a8w8_blockscale_bpreshuffle_1x128x128_256x64x128x128_16x16_16x16_8x32x1_8x32x1_1x32x1x8_8_2x1_intrawave_v3,405.54,1596.52,0.0
gfx950,256,16384,512,256,ck,9,0,12.9271,a8w8_blockscale_bpreshuffle_1x128x128_256x32x128x128_16x16_16x16_8x32x1_8x32x1_1x32x1x8_8_2x1_intrawave_v1,332.25,1632.43,0.0
gfx950,256,16384,512,512,ck,16,0,16.0509,a8w8_blockscale_bpreshuffle_1x128x128_256x64x128x256_16x16_16x16_16x16x1_16x16x1_1x32x1x8_8_2x1_intrawave_v1,535.17,1584.21,0.0
gfx950,256,16384,512,1024,ck,13,0,20.9235,a8w8_blockscale_bpreshuffle_1x128x128_256x64x256x128_16x16_16x16_8x32x1_8x32x1_1x32x1x8_8_2x1_intrawave_v1,821.08,1628.73,0.0
gfx950,256,16384,512,2048,ck,13,0,29.9784,a8w8_blockscale_bpreshuffle_1x128x128_256x64x256x128_16x16_16x16_8x32x1_8x32x1_1x32x1x8_8_2x1_intrawave_v1,1146.15,1713.91,0.0
gfx950,256,16384,1024,256,ck,16,0,21.154,a8w8_blockscale_bpreshuffle_1x128x128_256x64x128x256_16x16_16x16_16x16x1_16x16x1_1x32x1x8_8_2x1_intrawave_v1,406.07,1796.86,0.0
gfx950,256,16384,1024,512,ck,16,0,25.8117,a8w8_blockscale_bpreshuffle_1x128x128_256x64x128x256_16x16_16x16_16x16x1_16x16x1_1x32x1x8_8_2x1_intrawave_v1,665.58,1645.27,0.0
gfx950,256,16384,1024,1024,ck,14,0,38.251,a8w8_blockscale_bpreshuffle_1x128x128_256x64x128x128_16x16_16x16_8x32x1_8x32x1_1x32x1x8_8_2x1_intrawave_v1,898.27,1343.24,0.0003
gfx950,256,16384,1024,2048,ck,13,0,55.8164,a8w8_blockscale_bpreshuffle_1x128x128_256x64x256x128_16x16_16x16_8x32x1_8x32x1_1x32x1x8_8_2x1_intrawave_v1,1231.17,1239.89,0.0
gfx950,256,16384,1024,4096,ck,13,0,92.3826,a8w8_blockscale_bpreshuffle_1x128x128_256x64x256x128_16x16_16x16_8x32x1_8x32x1_1x32x1x8_8_2x1_intrawave_v1,1487.71,1135.04,0.0
gfx950,256,16384,1152,2048,ck,14,0,67.0848,a8w8_blockscale_bpreshuffle_1x128x128_256x64x128x128_16x16_16x16_8x32x1_8x32x1_1x32x1x8_8_2x1_intrawave_v1,1152.41,1098.05,0.0004
gfx950,256,16384,1536,2048,ck,13,0,78.1257,a8w8_blockscale_bpreshuffle_1x128x128_256x64x256x128_16x16_16x16_8x32x1_8x32x1_1x32x1x8_8_2x1_intrawave_v1,1319.4,1114.0,0.0
gfx950,256,16384,2048,512,ck,16,0,45.9039,a8w8_blockscale_bpreshuffle_1x128x128_256x64x128x256_16x16_16x16_16x16x1_16x16x1_1x32x1x8_8_2x1_intrawave_v1,748.51,1667.53,0.0
gfx950,256,16384,2048,1024,ck,13,0,67.9688,a8w8_blockscale_bpreshuffle_1x128x128_256x64x256x128_16x16_16x16_8x32x1_8x32x1_1x32x1x8_8_2x1_intrawave_v1,1011.04,1265.04,0.0
gfx950,256,16384,2048,2048,ck,13,0,100.8975,a8w8_blockscale_bpreshuffle_1x128x128_256x64x256x128_16x16_16x16_8x32x1_8x32x1_1x32x1x8_8_2x1_intrawave_v1,1362.16,1039.25,0.0
gfx950,256,16384,2048,4096,ck,13,0,172.1554,a8w8_blockscale_bpreshuffle_1x128x128_256x64x256x128_16x16_16x16_8x32x1_8x32x1_1x32x1x8_8_2x1_intrawave_v1,1596.68,828.36,0.0
gfx950,256,16384,2176,4096,ck,0,0,200.586,a8w8_blockscale_bpreshuffle_1x128x128_256x128x128x128_16x16_16x16_8x32x1_8x32x1_1x32x1x8_8_2x1_intrawave_v3,1456.02,734.47,0.0
gfx950,256,16384,2304,2048,ck,13,0,113.7928,a8w8_blockscale_bpreshuffle_1x128x128_256x64x256x128_16x16_16x16_8x32x1_8x32x1_1x32x1x8_8_2x1_intrawave_v1,1358.78,999.8,0.0
gfx950,256,16384,2560,4096,ck,13,0,207.1913,a8w8_blockscale_bpreshuffle_1x128x128_256x64x256x128_16x16_16x16_8x32x1_8x32x1_1x32x1x8_8_2x1_intrawave_v1,1658.36,779.38,0.0
gfx950,256,16384,3072,2048,ck,13,0,143.5179,a8w8_blockscale_bpreshuffle_1x128x128_256x64x256x128_16x16_16x16_8x32x1_8x32x1_1x32x1x8_8_2x1_intrawave_v1,1436.46,979.04,0.0
gfx950,256,16384,4096,1024,ck,13,0,131.4292,a8w8_blockscale_bpreshuffle_1x128x128_256x64x256x128_16x16_16x16_8x32x1_8x32x1_1x32x1x8_8_2x1_intrawave_v1,1045.73,1180.78,0.0
gfx950,256,16384,4096,2048,ck,13,0,187.6366,a8w8_blockscale_bpreshuffle_1x128x128_256x64x256x128_16x16_16x16_8x32x1_8x32x1_1x32x1x8_8_2x1_intrawave_v1,1464.95,938.84,0.0
gfx950,256,16384,4352,4096,ck,13,0,337.0876,a8w8_blockscale_bpreshuffle_1x128x128_256x64x256x128_16x16_16x16_8x32x1_8x32x1_1x32x1x8_8_2x1_intrawave_v1,1732.83,675.02,0.0
gfx950,256,16384,4608,2048,ck,13,0,201.776,a8w8_blockscale_bpreshuffle_1x128x128_256x64x256x128_16x16_16x16_8x32x1_8x32x1_1x32x1x8_8_2x1_intrawave_v1,1532.58,961.4,0.0
gfx950,256,16384,4608,4096,cktile,28,0,334.3939,a8w8_blockscale_cktile_192x256x128_4x2x1_16x16x128_intrawave_0x1x0_4,1849.54,708.68,0.0
gfx950,256,16384,5120,4096,cktile,27,0,385.5837,a8w8_blockscale_cktile_192x256x128_4x2x1_16x16x128_intrawave_0x1x0_3,1782.22,663.55,0.0
gfx950,256,16384,6144,2048,ck,13,0,269.0614,a8w8_blockscale_bpreshuffle_1x128x128_256x64x256x128_16x16_16x16_8x32x1_8x32x1_1x32x1x8_8_2x1_intrawave_v1,1532.43,919.73,0.0
gfx950,256,16384,8704,4096,cktile,26,0,625.4187,a8w8_blockscale_cktile_192x256x128_4x2x1_16x16x128_intrawave_0x1x0_2,1867.92,620.34,0.0
gfx950,256,16384,9216,2048,ck,13,0,387.8534,a8w8_blockscale_bpreshuffle_1x128x128_256x64x256x128_16x16_16x16_8x32x1_8x32x1_1x32x1x8_8_2x1_intrawave_v1,1594.61,913.8,0.0
gfx950,256,16384,10240,4096,cktile,27,0,704.2104,a8w8_blockscale_cktile_192x256x128_4x2x1_16x16x128_intrawave_0x1x0_3,1951.67,631.34,0.0
gfx950,256,16384,12288,2048,ck,13,0,504.5565,a8w8_blockscale_bpreshuffle_1x128x128_256x64x256x128_16x16_16x16_8x32x1_8x32x1_1x32x1x8_8_2x1_intrawave_v1,1634.37,914.41,0.0
gfx950,256,16384,17408,4096,ck,13,0,1208.8428,a8w8_blockscale_bpreshuffle_1x128x128_256x64x256x128_16x16_16x16_8x32x1_8x32x1_1x32x1x8_8_2x1_intrawave_v1,1932.81,586.38,0.0
gfx950,256,16384,20480,4096,cktile,27,0,1387.4271,a8w8_blockscale_cktile_192x256x128_4x2x1_16x16x128_intrawave_0x1x0_3,1981.21,592.52,0.0
gfx950,256,32768,16,4096,cktile,19,0,55.9249,a8w8_blockscale_cktile_32x128x128_1x4x1_16x16x64_intrawave_0x1x0_4,76.8,2419.89,0.0
gfx950,256,32768,32,4096,cktile,18,0,56.1714,a8w8_blockscale_cktile_32x128x128_1x4x1_16x16x64_intrawave_0x1x0_3,152.92,2429.1,0.0
gfx950,256,32768,256,512,ck,16,0,16.1398,a8w8_blockscale_bpreshuffle_1x128x128_256x64x128x256_16x16_16x16_16x16x1_16x16x1_1x32x1x8_8_2x1_intrawave_v1,532.22,2087.11,0.0
gfx950,256,32768,512,256,ck,16,0,21.12,a8w8_blockscale_bpreshuffle_1x128x128_256x64x128x256_16x16_16x16_16x16x1_16x16x1_1x32x1x8_8_2x1_intrawave_v1,406.72,1992.15,0.0
gfx950,256,32768,512,512,ck,16,0,27.1113,a8w8_blockscale_bpreshuffle_1x128x128_256x64x128x256_16x16_16x16_16x16x1_16x16x1_1x32x1x8_8_2x1_intrawave_v1,633.68,1866.15,0.0
gfx950,256,32768,512,1024,ck,14,0,38.8109,a8w8_blockscale_bpreshuffle_1x128x128_256x64x128x128_16x16_16x16_8x32x1_8x32x1_1x32x1x8_8_2x1_intrawave_v1,885.31,1742.63,0.0004
gfx950,256,32768,512,2048,ck,13,0,56.8603,a8w8_blockscale_bpreshuffle_1x128x128_256x64x256x128_16x16_16x16_8x32x1_8x32x1_1x32x1x8_8_2x1_intrawave_v1,1208.57,1788.8,0.0
gfx950,256,32768,1024,256,ck,14,0,36.5227,a8w8_blockscale_bpreshuffle_1x128x128_256x64x128x128_16x16_16x16_8x32x1_8x32x1_1x32x1x8_8_2x1_intrawave_v1,470.39,2074.32,0.0
gfx950,256,32768,1024,512,ck,16,0,46.8431,a8w8_blockscale_bpreshuffle_1x128x128_256x64x128x256_16x16_16x16_16x16x1_16x16x1_1x32x1x8_8_2x1_intrawave_v1,733.51,1801.98,0.0
gfx950,256,32768,1024,1024,ck,13,0,70.7661,a8w8_blockscale_bpreshuffle_1x128x128_256x64x256x128_16x16_16x16_8x32x1_8x32x1_1x32x1x8_8_2x1_intrawave_v1,971.08,1437.3,0.0
gfx950,256,32768,1024,2048,ck,13,0,103.0712,a8w8_blockscale_bpreshuffle_1x128x128_256x64x256x128_16x16_16x16_8x32x1_8x32x1_1x32x1x8_8_2x1_intrawave_v1,1333.44,1322.53,0.0
gfx950,256,32768,1024,4096,ck,13,0,172.4385,a8w8_blockscale_bpreshuffle_1x128x128_256x64x256x128_16x16_16x16_8x32x1_8x32x1_1x32x1x8_8_2x1_intrawave_v1,1594.06,1191.85,0.0
gfx950,256,32768,1152,2048,ck,14,0,122.1313,a8w8_blockscale_bpreshuffle_1x128x128_256x64x128x128_16x16_16x16_8x32x1_8x32x1_1x32x1x8_8_2x1_intrawave_v1,1266.0,1186.97,0.0004
gfx950,256,32768,1536,2048,ck,13,0,141.9473,a8w8_blockscale_bpreshuffle_1x128x128_256x64x256x128_16x16_16x16_8x32x1_8x32x1_1x32x1x8_8_2x1_intrawave_v1,1452.36,1204.09,0.0
gfx950,256,32768,2048,512,ck,16,0,85.8103,a8w8_blockscale_bpreshuffle_1x128x128_256x64x128x256_16x16_16x16_16x16x1_16x16x1_1x32x1x8_8_2x1_intrawave_v1,800.83,1771.86,0.0
gfx950,256,32768,2048,1024,ck,13,0,131.0786,a8w8_blockscale_bpreshuffle_1x128x128_256x64x256x128_16x16_16x16_8x32x1_8x32x1_1x32x1x8_8_2x1_intrawave_v1,1048.52,1295.93,0.0
gfx950,256,32768,2048,2048,ck,13,0,195.3896,a8w8_blockscale_bpreshuffle_1x128x128_256x64x256x128_16x16_16x16_8x32x1_8x32x1_1x32x1x8_8_2x1_intrawave_v1,1406.82,1051.85,0.0
gfx950,256,32768,2048,4096,ck,13,0,336.668,a8w8_blockscale_bpreshuffle_1x128x128_256x64x256x128_16x16_16x16_8x32x1_8x32x1_1x32x1x8_8_2x1_intrawave_v1,1632.93,822.25,0.0
gfx950,256,32768,2176,4096,ck,0,0,361.4039,a8w8_blockscale_bpreshuffle_1x128x128_256x128x128x128_16x16_16x16_8x32x1_8x32x1_1x32x1x8_8_2x1_intrawave_v3,1616.24,790.63,0.0
gfx950,256,32768,2304,2048,ck,13,0,210.3495,a8w8_blockscale_bpreshuffle_1x128x128_256x64x256x128_16x16_16x16_8x32x1_8x32x1_1x32x1x8_8_2x1_intrawave_v1,1470.11,1059.3,0.0
gfx950,256,32768,2560,4096,ck,13,0,392.3196,a8w8_blockscale_bpreshuffle_1x128x128_256x64x256x128_16x16_16x16_8x32x1_8x32x1_1x32x1x8_8_2x1_intrawave_v1,1751.62,796.48,0.0
gfx950,256,32768,3072,2048,ck,13,0,264.8182,a8w8_blockscale_bpreshuffle_1x128x128_256x64x256x128_16x16_16x16_8x32x1_8x32x1_1x32x1x8_8_2x1_intrawave_v1,1556.98,1037.42,0.0
gfx950,256,32768,4096,1024,ck,14,0,238.3201,a8w8_blockscale_bpreshuffle_1x128x128_256x64x128x128_16x16_16x16_8x32x1_8x32x1_1x32x1x8_8_2x1_intrawave_v1,1153.4,1284.76,0.0004
gfx950,256,32768,4096,2048,ck,13,1,345.9207,a8w8_blockscale_bpreshuffle_1x128x128_256x64x256x128_16x16_16x16_8x32x1_8x32x1_1x32x1x8_8_2x1_intrawave_v1,1589.25,994.25,0.0
gfx950,256,32768,4352,4096,cktile,28,0,623.3898,a8w8_blockscale_cktile_192x256x128_4x2x1_16x16x128_intrawave_0x1x0_4,1874.0,701.42,0.0
gfx950,256,32768,4608,2048,ck,13,0,393.975,a8w8_blockscale_bpreshuffle_1x128x128_256x64x256x128_16x16_16x16_8x32x1_8x32x1_1x32x1x8_8_2x1_intrawave_v1,1569.83,960.81,0.0
gfx950,256,32768,4608,4096,cktile,26,0,663.6484,a8w8_blockscale_cktile_192x256x128_4x2x1_16x16x128_intrawave_0x1x0_2,1863.86,685.73,0.0
gfx950,256,32768,5120,4096,ck,13,0,739.9087,a8w8_blockscale_bpreshuffle_1x128x128_256x64x256x128_16x16_16x16_8x32x1_8x32x1_1x32x1x8_8_2x1_intrawave_v1,1857.51,663.24,0.0
gfx950,256,32768,6144,2048,ck,13,0,513.6492,a8w8_blockscale_bpreshuffle_1x128x128_256x64x256x128_16x16_16x16_8x32x1_8x32x1_1x32x1x8_8_2x1_intrawave_v1,1605.44,939.06,0.0
gfx950,256,32768,8704,4096,cktile,26,0,1226.8874,a8w8_blockscale_cktile_192x256x128_4x2x1_16x16x128_intrawave_0x1x0_2,1904.38,603.39,0.0
gfx950,256,32768,9216,2048,ck,13,0,741.7658,a8w8_blockscale_bpreshuffle_1x128x128_256x64x256x128_16x16_16x16_8x32x1_8x32x1_1x32x1x8_8_2x1_intrawave_v1,1667.58,930.16,0.0
gfx950,256,32768,10240,4096,cktile,28,0,1404.9529,a8w8_blockscale_cktile_192x256x128_4x2x1_16x16x128_intrawave_0x1x0_4,1956.49,603.04,0.0
gfx950,256,32768,12288,2048,ck,13,0,990.9729,a8w8_blockscale_bpreshuffle_1x128x128_256x64x256x128_16x16_16x16_8x32x1_8x32x1_1x32x1x8_8_2x1_intrawave_v1,1664.29,905.76,0.0
gfx950,256,32768,17408,4096,cktile,27,0,2389.7849,a8w8_blockscale_cktile_192x256x128_4x2x1_16x16x128_intrawave_0x1x0_3,1955.37,563.39,0.0
gfx950,256,32768,20480,4096,cktile,28,0,2721.3003,a8w8_blockscale_cktile_192x256x128_4x2x1_16x16x128_intrawave_0x1x0_4,2020.2,573.36,0.0
gfx942,80,1,4096,2048,ck,7,0,7.6088,a8w8_blockscale_bpreshuffle_1x128x128_256x16x64x256_16x16_16x16_16x16x1_16x16x1_1x16x1x16_4_1x1_intrawave_v1,2.2,1103.83,0.0
gfx942,80,1,4608,4096,ck,7,0,12.6298,a8w8_blockscale_bpreshuffle_1x128x128_256x16x64x256_16x16_16x16_16x16x1_16x16x1_1x16x1x16_4_1x1_intrawave_v1,2.99,1495.49,0.0
gfx942,80,1,5120,4096,ck,7,0,12.8459,a8w8_blockscale_bpreshuffle_1x128x128_256x16x64x256_16x16_16x16_16x16x1_16x16x1_1x16x1x16_4_1x1_intrawave_v1,3.27,1633.66,0.0
gfx942,80,2,4096,2048,ck,7,0,6.964,a8w8_blockscale_bpreshuffle_1x128x128_256x16x64x256_16x16_16x16_16x16x1_16x16x1_1x16x1x16_4_1x1_intrawave_v1,4.82,1207.51,0.0
gfx942,80,2,4608,4096,ck,7,0,12.6641,a8w8_blockscale_bpreshuffle_1x128x128_256x16x64x256_16x16_16x16_16x16x1_16x16x1_1x16x1x16_4_1x1_intrawave_v1,5.96,1492.49,0.0
gfx942,80,2,5120,4096,ck,7,0,12.7807,a8w8_blockscale_bpreshuffle_1x128x128_256x16x64x256_16x16_16x16_16x16x1_16x16x1_1x16x1x16_4_1x1_intrawave_v1,6.56,1643.12,0.0
gfx942,80,4,4096,2048,ck,7,0,7.3066,a8w8_blockscale_bpreshuffle_1x128x128_256x16x64x256_16x16_16x16_16x16x1_16x16x1_1x16x1x16_4_1x1_intrawave_v1,9.18,1153.69,0.0
gfx942,80,4,4608,4096,ck,7,0,12.6152,a8w8_blockscale_bpreshuffle_1x128x128_256x16x64x256_16x16_16x16_16x16x1_16x16x1_1x16x1x16_4_1x1_intrawave_v1,11.97,1500.38,0.0
gfx942,80,4,5120,4096,ck,7,0,12.7897,a8w8_blockscale_bpreshuffle_1x128x128_256x16x64x256_16x16_16x16_16x16x1_16x16x1_1x16x1x16_4_1x1_intrawave_v1,13.12,1644.2,0.0
gfx942,80,8,4096,2048,ck,7,0,7.1699,a8w8_blockscale_bpreshuffle_1x128x128_256x16x64x256_16x16_16x16_16x16x1_16x16x1_1x16x1x16_4_1x1_intrawave_v1,18.72,1181.4,0.0
gfx942,80,8,4608,4096,ck,7,0,12.5023,a8w8_blockscale_bpreshuffle_1x128x128_256x16x64x256_16x16_16x16_16x16x1_16x16x1_1x16x1x16_4_1x1_intrawave_v1,24.15,1518.19,0.0
gfx942,80,8,5120,4096,ck,7,0,12.7339,a8w8_blockscale_bpreshuffle_1x128x128_256x16x64x256_16x16_16x16_16x16x1_16x16x1_1x16x1x16_4_1x1_intrawave_v1,26.35,1655.91,0.0
gfx942,80,16,4096,2048,ck,7,0,7.2391,a8w8_blockscale_bpreshuffle_1x128x128_256x16x64x256_16x16_16x16_16x16x1_16x16x1_1x16x1x16_4_1x1_intrawave_v1,37.08,1181.42,0.0
gfx942,80,16,5120,4096,ck,7,0,11.8292,a8w8_blockscale_bpreshuffle_1x128x128_256x16x64x256_16x16_16x16_16x16x1_16x16x1_1x16x1x16_4_1x1_intrawave_v1,56.73,1792.25,0.0
gfx942,80,32,4608,4096,ck,7,0,11.6068,a8w8_blockscale_bpreshuffle_1x128x128_256x16x64x256_16x16_16x16_16x16x1_16x16x1_1x16x1x16_4_1x1_intrawave_v1,104.07,1662.85,0.0
gfx942,80,32,5120,4096,ck,7,0,11.7346,a8w8_blockscale_bpreshuffle_1x128x128_256x16x64x256_16x16_16x16_16x16x1_16x16x1_1x16x1x16_4_1x1_intrawave_v1,114.38,1826.25,0.0
gfx942,80,64,4608,4096,ck,12,0,12.3488,a8w8_blockscale_bpreshuffle_1x128x128_256x32x64x256_16x16_16x16_16x16x1_16x16x1_1x32x1x8_8_2x1_intrawave_v1,195.64,1597.43,0.0
gfx942,80,64,5120,4096,ck,12,0,12.6157,a8w8_blockscale_bpreshuffle_1x128x128_256x32x64x256_16x16_16x16_16x16x1_16x16x1_1x32x1x8_8_2x1_intrawave_v1,212.78,1735.06,0.0
gfx942,80,128,4608,4096,ck,17,0,14.28,a8w8_blockscale_bpreshuffle_1x128x128_256x64x64x256_16x16_16x16_16x16x1_16x16x1_1x32x1x8_8_2x1_intrawave_v1,338.36,1441.06,0.0
gfx942,80,128,5120,4096,ck,17,0,14.6196,a8w8_blockscale_bpreshuffle_1x128x128_256x64x64x256_16x16_16x16_16x16x1_16x16x1_1x32x1x8_8_2x1_intrawave_v1,367.23,1560.0,0.0
gfx942,80,256,4608,4096,ck,10,0,20.4557,a8w8_blockscale_bpreshuffle_1x128x128_256x32x64x128_16x16_16x16_8x32x1_8x32x1_1x32x1x8_8_2x1_intrawave_v1,472.42,1089.29,0.0198
gfx942,80,256,5120,4096,ck,17,0,20.7969,a8w8_blockscale_bpreshuffle_1x128x128_256x64x64x256_16x16_16x16_16x16x1_16x16x1_1x32x1x8_8_2x1_intrawave_v1,516.3,1184.87,0.0
gfx942,80,512,4608,4096,ck,2,0,27.5561,a8w8_blockscale_bpreshuffle_1x128x128_256x64x64x128_16x16_16x16_8x32x1_8x32x1_1x32x1x8_8_2x1_intrawave_v3,701.38,932.28,0.0
gfx942,80,512,5120,4096,ck,14,0,27.981,a8w8_blockscale_bpreshuffle_1x128x128_256x64x128x128_16x16_16x16_8x32x1_8x32x1_1x32x1x8_8_2x1_intrawave_v1,767.48,1011.81,0.0
gfx942,80,1024,4096,2048,ck,14,0,18.6898,a8w8_blockscale_bpreshuffle_1x128x128_256x64x128x128_16x16_16x16_8x32x1_8x32x1_1x32x1x8_8_2x1_intrawave_v1,919.21,1009.88,0.0002
gfx942,80,1024,4608,4096,ck,14,0,40.7002,a8w8_blockscale_bpreshuffle_1x128x128_256x64x128x128_16x16_16x16_8x32x1_8x32x1_1x32x1x8_8_2x1_intrawave_v1,949.74,798.67,0.0001
gfx942,80,1024,5120,4096,ck,1,0,42.2835,a8w8_blockscale_bpreshuffle_1x128x128_256x64x128x128_16x16_16x16_8x32x1_8x32x1_1x32x1x8_8_2x1_intrawave_v3,1015.75,843.16,0.0
gfx942,80,4096,4096,2048,ck,13,0,54.8859,a8w8_blockscale_bpreshuffle_1x128x128_256x64x256x128_16x16_16x16_8x32x1_8x32x1_1x32x1x8_8_2x1_intrawave_v1,1252.04,917.02,0.0
gfx942,80,4096,4608,4096,ck,13,0,107.8779,a8w8_blockscale_bpreshuffle_1x128x128_256x64x256x128_16x16_16x16_8x32x1_8x32x1_1x32x1x8_8_2x1_intrawave_v1,1433.28,680.4,0.0
gfx942,80,8192,5120,4096,ck,13,0,204.8152,a8w8_blockscale_bpreshuffle_1x128x128_256x64x256x128_16x16_16x16_8x32x1_8x32x1_1x32x1x8_8_2x1_intrawave_v1,1677.6,675.79,0.0
gfx942,80,32768,4096,2048,ck,13,1,345.9207,a8w8_blockscale_bpreshuffle_1x128x128_256x64x256x128_16x16_16x16_8x32x1_8x32x1_1x32x1x8_8_2x1_intrawave_v1,1589.25,994.25,0.0
gfx942,80,32768,5120,4096,ck,13,0,739.9087,a8w8_blockscale_bpreshuffle_1x128x128_256x64x256x128_16x16_16x16_8x32x1_8x32x1_1x32x1x8_8_2x1_intrawave_v1,1857.51,663.24,0.0
