aiter/configs/model_configs/a8w8_blockscale_bpreshuffle_tuned_gemm_dsv3.csv
gfx,cu_num,M,N,K,libtype,kernelId,splitK,us,kernelName,tflops,bw,errRatio
gfx950,256,16,128,7168,asm,6,7,6.1485,_ZN5aiter42fp8gemm_bf16_blockscale_BpreShuffle_32x128E,4.78,0.16854,0.0073
gfx950,256,32,128,7168,asm,7,8,6.3047,_ZN5aiter42fp8gemm_bf16_blockscale_BpreShuffle_32x128E,9.31,0.18321,0.0012
gfx950,256,48,128,7168,asm,6,7,6.5243,_ZN5aiter42fp8gemm_bf16_blockscale_BpreShuffle_32x128E,13.5,0.19525,0.0073
gfx950,256,64,128,7168,asm,7,8,6.337,_ZN5aiter42fp8gemm_bf16_blockscale_BpreShuffle_32x128E,18.53,0.21976,0.0098
gfx950,256,80,128,7168,asm,7,8,8.0249,_ZN5aiter42fp8gemm_bf16_blockscale_BpreShuffle_32x128E,18.29,0.18834,0.0045
gfx950,256,96,128,7168,asm,15,8,8.8365,_ZN5aiter42fp8gemm_bf16_blockscale_BpreShuffle_48x128E,19.94,0.18449,0.0107
gfx950,256,112,128,7168,asm,6,7,7.6026,_ZN5aiter42fp8gemm_bf16_blockscale_BpreShuffle_32x128E,27.03,0.23005,0.0042
gfx950,256,128,128,7168,asm,6,7,8.8728,_ZN5aiter42fp8gemm_bf16_blockscale_BpreShuffle_32x128E,26.47,0.21051,0.0092
gfx950,256,144,128,7168,asm,7,8,8.0541,_ZN5aiter42fp8gemm_bf16_blockscale_BpreShuffle_32x128E,32.81,0.24665,0.0111
gfx950,256,160,128,7168,asm,7,8,8.4521,_ZN5aiter42fp8gemm_bf16_blockscale_BpreShuffle_32x128E,34.74,0.24909,0.0076
gfx950,256,176,128,7168,asm,23,8,7.9649,_ZN5aiter42fp8gemm_bf16_blockscale_BpreShuffle_64x128E,40.55,0.27924,0.0048
gfx950,256,192,128,7168,asm,7,8,8.7548,_ZN5aiter42fp8gemm_bf16_blockscale_BpreShuffle_32x128E,40.24,0.26761,0.0093
gfx950,256,208,128,7168,asm,7,8,7.5139,_ZN5aiter42fp8gemm_bf16_blockscale_BpreShuffle_32x128E,50.8,0.32762,0.0117
gfx950,256,224,128,7168,asm,30,7,9.2902,_ZN5aiter42fp8gemm_bf16_blockscale_BpreShuffle_80x128E,44.24,0.27776,0.0085
gfx950,256,240,128,7168,asm,7,8,9.2722,_ZN5aiter42fp8gemm_bf16_blockscale_BpreShuffle_32x128E,47.5,0.29111,0.0119
gfx950,256,256,128,7168,asm,15,8,9.4713,_ZN5aiter42fp8gemm_bf16_blockscale_BpreShuffle_48x128E,49.6,0.29754,0.0047
gfx950,256,288,128,7168,asm,15,8,8.3144,_ZN5aiter42fp8gemm_bf16_blockscale_BpreShuffle_48x128E,63.56,0.36751,0.0025
gfx950,256,320,128,7168,asm,7,8,9.8117,_ZN5aiter42fp8gemm_bf16_blockscale_BpreShuffle_32x128E,59.85,0.33564,0.0078
gfx950,256,352,128,7168,asm,7,8,9.4965,_ZN5aiter42fp8gemm_bf16_blockscale_BpreShuffle_32x128E,68.02,0.3718,0.0046
gfx950,256,384,128,7168,asm,7,8,10.0883,_ZN5aiter42fp8gemm_bf16_blockscale_BpreShuffle_32x128E,69.85,0.37353,0.0139
gfx950,256,416,128,7168,asm,7,8,10.1166,_ZN5aiter42fp8gemm_bf16_blockscale_BpreShuffle_32x128E,75.46,0.39597,0.0081
gfx950,256,448,128,7168,asm,5,6,10.0989,_ZN5aiter42fp8gemm_bf16_blockscale_BpreShuffle_32x128E,81.4,0.42019,0.0065
gfx950,256,480,128,7168,asm,31,8,9.5986,_ZN5aiter42fp8gemm_bf16_blockscale_BpreShuffle_80x128E,91.76,0.46684,0.0125
gfx950,256,512,128,7168,asm,7,8,10.208,_ZN5aiter42fp8gemm_bf16_blockscale_BpreShuffle_32x128E,92.04,0.46224,0.0076
gfx950,256,544,128,7168,asm,7,8,9.4877,_ZN5aiter42fp8gemm_bf16_blockscale_BpreShuffle_32x128E,105.21,0.52238,0.0042
gfx950,256,576,128,7168,asm,7,8,9.4869,_ZN5aiter42fp8gemm_bf16_blockscale_BpreShuffle_32x128E,111.41,0.54746,0.0102
gfx950,256,608,128,7168,asm,7,8,10.3885,_ZN5aiter42fp8gemm_bf16_blockscale_BpreShuffle_32x128E,107.4,0.52282,0.0071
gfx950,256,640,128,7168,asm,7,8,9.5917,_ZN5aiter42fp8gemm_bf16_blockscale_BpreShuffle_32x128E,122.44,0.59102,0.0014
gfx950,256,672,128,7168,asm,7,8,9.8577,_ZN5aiter42fp8gemm_bf16_blockscale_BpreShuffle_32x128E,125.09,0.59917,0.005
gfx950,256,704,128,7168,asm,7,8,10.3689,_ZN5aiter42fp8gemm_bf16_blockscale_BpreShuffle_32x128E,124.59,0.59254,0.0098
gfx950,256,736,128,7168,asm,7,8,10.5103,_ZN5aiter42fp8gemm_bf16_blockscale_BpreShuffle_32x128E,128.5,0.60717,0.0015
gfx950,256,768,128,7168,asm,15,8,10.7333,_ZN5aiter42fp8gemm_bf16_blockscale_BpreShuffle_48x128E,131.3,0.61669,0.002
gfx950,256,800,128,7168,asm,15,8,10.554,_ZN5aiter42fp8gemm_bf16_blockscale_BpreShuffle_48x128E,139.09,0.64968,0.0109
gfx950,256,832,128,7168,asm,7,8,9.7953,_ZN5aiter42fp8gemm_bf16_blockscale_BpreShuffle_32x128E,155.86,0.72425,0.0094
gfx950,256,864,128,7168,asm,7,8,10.7375,_ZN5aiter42fp8gemm_bf16_blockscale_BpreShuffle_32x128E,147.66,0.68283,0.0101
gfx950,256,896,128,7168,asm,7,8,10.8442,_ZN5aiter42fp8gemm_bf16_blockscale_BpreShuffle_32x128E,151.62,0.69801,0.0089
gfx950,256,928,128,7168,asm,15,8,11.0012,_ZN5aiter42fp8gemm_bf16_blockscale_BpreShuffle_48x128E,154.79,0.70965,0.0108
gfx950,256,960,128,7168,asm,7,8,10.8867,_ZN5aiter42fp8gemm_bf16_blockscale_BpreShuffle_32x128E,161.81,0.73893,0.0155
gfx950,256,992,128,7168,asm,7,8,11.0077,_ZN5aiter42fp8gemm_bf16_blockscale_BpreShuffle_32x128E,165.37,0.75239,0.0145
gfx950,256,1024,128,7168,asm,7,8,9.6737,_ZN5aiter42fp8gemm_bf16_blockscale_BpreShuffle_32x128E,194.24,0.88071,0.013
gfx950,256,1088,128,7168,asm,15,8,10.5533,_ZN5aiter42fp8gemm_bf16_blockscale_BpreShuffle_48x128E,189.18,0.85232,0.0056
gfx950,256,1152,128,7168,asm,15,8,11.1072,_ZN5aiter42fp8gemm_bf16_blockscale_BpreShuffle_48x128E,190.32,0.8526,0.0109
gfx950,256,1216,128,7168,asm,15,8,11.6079,_ZN5aiter42fp8gemm_bf16_blockscale_BpreShuffle_48x128E,192.23,0.85675,0.0121
gfx950,256,1280,128,7168,asm,31,8,10.9477,_ZN5aiter42fp8gemm_bf16_blockscale_BpreShuffle_80x128E,214.55,0.95182,0.0098
gfx950,256,1344,128,7168,asm,39,8,10.7369,_ZN5aiter42fp8gemm_bf16_blockscale_BpreShuffle_96x128E,229.7,1.01476,0.0017
gfx950,256,1408,128,7168,asm,15,8,10.2201,_ZN5aiter42fp8gemm_bf16_blockscale_BpreShuffle_48x128E,252.8,1.11256,0.009
gfx950,256,1472,128,7168,asm,14,7,11.8021,_ZN5aiter42fp8gemm_bf16_blockscale_BpreShuffle_48x128E,228.87,1.00369,0.0082
gfx950,256,1536,128,7168,asm,15,8,10.5213,_ZN5aiter42fp8gemm_bf16_blockscale_BpreShuffle_48x128E,267.89,1.17103,0.0109
gfx950,256,1600,128,7168,asm,22,7,12.0077,_ZN5aiter42fp8gemm_bf16_blockscale_BpreShuffle_64x128E,244.51,1.06564,0.0032
gfx950,256,1664,128,7168,asm,14,7,12.3669,_ZN5aiter42fp8gemm_bf16_blockscale_BpreShuffle_48x128E,246.91,1.07311,0.0067
gfx950,256,1728,128,7168,asm,31,8,12.5593,_ZN5aiter42fp8gemm_bf16_blockscale_BpreShuffle_80x128E,252.47,1.0945,0.0063
gfx950,256,1792,128,7168,asm,21,6,12.5025,_ZN5aiter42fp8gemm_bf16_blockscale_BpreShuffle_64x128E,263.01,1.13748,0.0064
gfx950,256,1856,128,7168,asm,13,6,12.1277,_ZN5aiter42fp8gemm_bf16_blockscale_BpreShuffle_48x128E,280.83,1.21181,0.0011
gfx950,256,1920,128,7168,asm,22,7,12.0941,_ZN5aiter42fp8gemm_bf16_blockscale_BpreShuffle_64x128E,291.32,1.25446,0.0058
gfx950,256,1984,128,7168,asm,29,6,12.2402,_ZN5aiter42fp8gemm_bf16_blockscale_BpreShuffle_80x128E,297.43,1.27831,0.0057
gfx950,256,2048,128,7168,asm,31,8,11.5875,_ZN5aiter42fp8gemm_bf16_blockscale_BpreShuffle_80x128E,324.32,1.39131,0.0105
gfx950,256,4096,128,7168,asm,18,3,16.9007,_ZN5aiter42fp8gemm_bf16_blockscale_BpreShuffle_64x128E,444.73,1.85355,0.0002
gfx950,256,8192,128,7168,ck,17,1,22.7549,a8w8_blockscale_bpreshuffle_1x128x128_256x64x64x256_16x16_16x16_16x16x1_16x16x1_1x32x1x8_8_2x1_intrawave_v1,660.62,2.71304,0.0
gfx950,256,16384,128,7168,asm,16,1,36.8278,_ZN5aiter42fp8gemm_bf16_blockscale_BpreShuffle_64x128E,816.36,3.32771,0.0
gfx950,256,32768,128,7168,asm,40,1,57.9434,_ZN5aiter43fp8gemm_bf16_blockscale_BpreShuffle_128x128E,1037.73,4.21424,0.0
gfx950,256,16,2112,7168,ck,7,3,17.369,a8w8_blockscale_bpreshuffle_1x128x128_256x16x64x256_16x16_16x16_16x16x1_16x16x1_1x16x1x16_4_1x1_intrawave_v1,27.89,0.88209,0.0
gfx950,256,32,2112,7168,ck,7,1,17.1099,a8w8_blockscale_bpreshuffle_1x128x128_256x16x64x256_16x16_16x16_16x16x1_16x16x1_1x16x1x16_4_1x1_intrawave_v1,56.63,0.9061,0.0
gfx950,256,48,2112,7168,ck,7,3,17.0967,a8w8_blockscale_bpreshuffle_1x128x128_256x16x64x256_16x16_16x16_16x16x1_16x16x1_1x16x1x16_4_1x1_intrawave_v1,85.01,0.91747,0.0
gfx950,256,64,2112,7168,ck,7,1,16.6867,a8w8_blockscale_bpreshuffle_1x128x128_256x16x64x256_16x16_16x16_16x16x1_16x16x1_1x16x1x16_4_1x1_intrawave_v1,116.13,0.95093,0.0
gfx950,256,80,2112,7168,ck,7,1,17.0679,a8w8_blockscale_bpreshuffle_1x128x128_256x16x64x256_16x16_16x16_16x16x1_16x16x1_1x16x1x16_4_1x1_intrawave_v1,141.92,0.94037,0.0
gfx950,256,96,2112,7168,ck,7,2,16.9001,a8w8_blockscale_bpreshuffle_1x128x128_256x16x64x256_16x16_16x16_16x16x1_16x16x1_1x16x1x16_4_1x1_intrawave_v1,171.99,0.96049,0.0
gfx950,256,112,2112,7168,ck,7,1,16.7774,a8w8_blockscale_bpreshuffle_1x128x128_256x16x64x256_16x16_16x16_16x16x1_16x16x1_1x16x1x16_4_1x1_intrawave_v1,202.12,0.97838,0.0
gfx950,256,128,2112,7168,ck,7,1,16.8979,a8w8_blockscale_bpreshuffle_1x128x128_256x16x64x256_16x16_16x16_16x16x1_16x16x1_1x16x1x16_4_1x1_intrawave_v1,229.35,0.98219,0.0
gfx950,256,144,2112,7168,ck,7,0,17.4362,a8w8_blockscale_bpreshuffle_1x128x128_256x16x64x256_16x16_16x16_16x16x1_16x16x1_1x16x1x16_4_1x1_intrawave_v1,250.05,0.96232,0.0
gfx950,256,160,2112,7168,ck,12,3,18.1582,a8w8_blockscale_bpreshuffle_1x128x128_256x32x64x256_16x16_16x16_16x16x1_16x16x1_1x32x1x8_8_2x1_intrawave_v1,266.79,0.9341,0.0
gfx950,256,176,2112,7168,ck,7,2,19.2838,a8w8_blockscale_bpreshuffle_1x128x128_256x16x64x256_16x16_16x16_16x16x1_16x16x1_1x16x1x16_4_1x1_intrawave_v1,276.34,0.88903,0.0
gfx950,256,192,2112,7168,ck,12,2,18.0709,a8w8_blockscale_bpreshuffle_1x128x128_256x32x64x256_16x16_16x16_16x16x1_16x16x1_1x32x1x8_8_2x1_intrawave_v1,321.69,0.95878,0.0
gfx950,256,208,2112,7168,ck,7,2,19.4853,a8w8_blockscale_bpreshuffle_1x128x128_256x16x64x256_16x16_16x16_16x16x1_16x16x1_1x16x1x16_4_1x1_intrawave_v1,323.21,0.89854,0.0
gfx950,256,224,2112,7168,ck,12,1,18.1425,a8w8_blockscale_bpreshuffle_1x128x128_256x32x64x256_16x16_16x16_16x16x1_16x16x1_1x32x1x8_8_2x1_intrawave_v1,373.83,0.97509,0.0
gfx950,256,240,2112,7168,ck,7,1,20.222,a8w8_blockscale_bpreshuffle_1x128x128_256x16x64x256_16x16_16x16_16x16x1_16x16x1_1x16x1x16_4_1x1_intrawave_v1,359.34,0.88383,0.0
gfx950,256,256,2112,7168,ck,12,3,19.3304,a8w8_blockscale_bpreshuffle_1x128x128_256x32x64x256_16x16_16x16_16x16x1_16x16x1_1x32x1x8_8_2x1_intrawave_v1,400.98,0.93403,0.0
gfx950,256,288,2112,7168,ck,12,0,19.761,a8w8_blockscale_bpreshuffle_1x128x128_256x32x64x256_16x16_16x16_16x16x1_16x16x1_1x32x1x8_8_2x1_intrawave_v1,441.27,0.93212,0.0
gfx950,256,320,2112,7168,ck,17,1,21.3295,a8w8_blockscale_bpreshuffle_1x128x128_256x64x64x256_16x16_16x16_16x16x1_16x16x1_1x32x1x8_8_2x1_intrawave_v1,454.25,0.88067,0.0
gfx950,256,352,2112,7168,ck,17,0,22.1299,a8w8_blockscale_bpreshuffle_1x128x128_256x64x64x256_16x16_16x16_16x16x1_16x16x1_1x32x1x8_8_2x1_intrawave_v1,481.6,0.86529,0.0
gfx950,256,384,2112,7168,ck,17,3,21.2294,a8w8_blockscale_bpreshuffle_1x128x128_256x64x64x256_16x16_16x16_16x16x1_16x16x1_1x32x1x8_8_2x1_intrawave_v1,547.67,0.91917,0.0
gfx950,256,416,2112,7168,ck,17,2,22.3197,a8w8_blockscale_bpreshuffle_1x128x128_256x64x64x256_16x16_16x16_16x16x1_16x16x1_1x32x1x8_8_2x1_intrawave_v1,564.32,0.8906,0.0
gfx950,256,448,2112,7168,ck,17,3,21.3596,a8w8_blockscale_bpreshuffle_1x128x128_256x64x64x256_16x16_16x16_16x16x1_16x16x1_1x32x1x8_8_2x1_intrawave_v1,635.05,0.9477,0.0
gfx950,256,480,2112,7168,ck,12,1,23.7782,a8w8_blockscale_bpreshuffle_1x128x128_256x32x64x256_16x16_16x16_16x16x1_16x16x1_1x32x1x8_8_2x1_intrawave_v1,611.2,0.86663,0.0
gfx950,256,512,2112,7168,ck,17,1,28.0778,a8w8_blockscale_bpreshuffle_1x128x128_256x64x64x256_16x16_16x16_16x16x1_16x16x1_1x32x1x8_8_2x1_intrawave_v1,552.11,0.74691,0.0
gfx950,256,544,2112,7168,ck,17,0,29.6478,a8w8_blockscale_bpreshuffle_1x128x128_256x64x64x256_16x16_16x16_16x16x1_16x16x1_1x32x1x8_8_2x1_intrawave_v1,555.56,0.71965,0.0
gfx950,256,576,2112,7168,ck,17,0,28.8581,a8w8_blockscale_bpreshuffle_1x128x128_256x64x64x256_16x16_16x16_16x16x1_16x16x1_1x32x1x8_8_2x1_intrawave_v1,604.33,0.75198,0.0
gfx950,256,608,2112,7168,ck,12,0,30.6611,a8w8_blockscale_bpreshuffle_1x128x128_256x32x64x256_16x16_16x16_16x16x1_16x16x1_1x32x1x8_8_2x1_intrawave_v1,600.4,0.71965,0.0
gfx950,256,640,2112,7168,ck,10,2,30.8536,a8w8_blockscale_bpreshuffle_1x128x128_256x32x64x128_16x16_16x16_8x32x1_8x32x1_1x32x1x8_8_2x1_intrawave_v1,628.05,0.72697,0.0201
gfx950,256,672,2112,7168,ck,17,0,32.1211,a8w8_blockscale_bpreshuffle_1x128x128_256x64x64x256_16x16_16x16_16x16x1_16x16x1_1x32x1x8_8_2x1_intrawave_v1,633.43,0.70963,0.0
gfx950,256,704,2112,7168,ck,17,0,31.5718,a8w8_blockscale_bpreshuffle_1x128x128_256x64x64x256_16x16_16x16_16x16x1_16x16x1_1x32x1x8_8_2x1_intrawave_v1,675.14,0.73353,0.0
gfx950,256,736,2112,7168,ck,17,1,31.4913,a8w8_blockscale_bpreshuffle_1x128x128_256x64x64x256_16x16_16x16_16x16x1_16x16x1_1x32x1x8_8_2x1_intrawave_v1,707.63,0.74698,0.0
gfx950,256,768,2112,7168,ck,17,3,31.0549,a8w8_blockscale_bpreshuffle_1x128x128_256x64x64x256_16x16_16x16_16x16x1_16x16x1_1x32x1x8_8_2x1_intrawave_v1,748.78,0.76921,0.0
gfx950,256,800,2112,7168,ck,17,3,32.8542,a8w8_blockscale_bpreshuffle_1x128x128_256x64x64x256_16x16_16x16_16x16x1_16x16x1_1x32x1x8_8_2x1_intrawave_v1,737.26,0.73818,0.0
gfx950,256,832,2112,7168,ck,17,0,32.1611,a8w8_blockscale_bpreshuffle_1x128x128_256x64x64x256_16x16_16x16_16x16x1_16x16x1_1x32x1x8_8_2x1_intrawave_v1,783.28,0.76543,0.0
gfx950,256,864,2112,7168,ck,17,0,33.1831,a8w8_blockscale_bpreshuffle_1x128x128_256x64x64x256_16x16_16x16_16x16x1_16x16x1_1x32x1x8_8_2x1_intrawave_v1,788.35,0.75284,0.0
gfx950,256,896,2112,7168,ck,17,3,32.5403,a8w8_blockscale_bpreshuffle_1x128x128_256x64x64x256_16x16_16x16_16x16x1_16x16x1_1x32x1x8_8_2x1_intrawave_v1,833.7,0.77891,0.0
gfx950,256,928,2112,7168,ck,17,1,34.0573,a8w8_blockscale_bpreshuffle_1x128x128_256x64x64x256_16x16_16x16_16x16x1_16x16x1_1x32x1x8_8_2x1_intrawave_v1,825.01,0.75492,0.0
gfx950,256,960,2112,7168,ck,17,0,33.349,a8w8_blockscale_bpreshuffle_1x128x128_256x64x64x256_16x16_16x16_16x16x1_16x16x1_1x32x1x8_8_2x1_intrawave_v1,871.59,0.78189,0.0
gfx950,256,992,2112,7168,ck,15,2,41.9166,a8w8_blockscale_bpreshuffle_1x128x128_256x64x64x128_16x16_16x16_8x32x1_8x32x1_1x32x1x8_8_2x1_intrawave_v1,716.55,0.63077,0.0175
gfx950,256,1024,2112,7168,ck,15,2,41.7085,a8w8_blockscale_bpreshuffle_1x128x128_256x64x64x128_16x16_16x16_8x32x1_8x32x1_1x32x1x8_8_2x1_intrawave_v1,743.36,0.64266,0.0022
gfx950,256,1088,2112,7168,ck,15,1,40.9809,a8w8_blockscale_bpreshuffle_1x128x128_256x64x64x128_16x16_16x16_8x32x1_8x32x1_1x32x1x8_8_2x1_intrawave_v1,803.84,0.67186,0.0036
gfx950,256,1152,2112,7168,ck,15,0,40.8235,a8w8_blockscale_bpreshuffle_1x128x128_256x64x64x128_16x16_16x16_8x32x1_8x32x1_1x32x1x8_8_2x1_intrawave_v1,854.41,0.69231,0.0036
gfx950,256,1216,2112,7168,ck,15,3,42.2342,a8w8_blockscale_bpreshuffle_1x128x128_256x64x64x128_16x16_16x16_8x32x1_8x32x1_1x32x1x8_8_2x1_intrawave_v1,871.75,0.68645,0.0044
gfx950,256,1280,2112,7168,ck,15,1,43.6734,a8w8_blockscale_bpreshuffle_1x128x128_256x64x64x128_16x16_16x16_8x32x1_8x32x1_1x32x1x8_8_2x1_intrawave_v1,887.39,0.68052,0.0042
gfx950,256,1344,2112,7168,ck,15,1,45.0358,a8w8_blockscale_bpreshuffle_1x128x128_256x64x64x128_16x16_16x16_8x32x1_8x32x1_1x32x1x8_8_2x1_intrawave_v1,903.57,0.67612,0.0055
gfx950,256,1408,2112,7168,ck,15,0,46.1981,a8w8_blockscale_bpreshuffle_1x128x128_256x64x64x128_16x16_16x16_8x32x1_8x32x1_1x32x1x8_8_2x1_intrawave_v1,922.78,0.67489,0.0058
gfx950,256,1472,2112,7168,ck,15,0,46.921,a8w8_blockscale_bpreshuffle_1x128x128_256x64x64x128_16x16_16x16_8x32x1_8x32x1_1x32x1x8_8_2x1_intrawave_v1,949.87,0.68003,0.0064
gfx950,256,1536,2112,7168,ck,17,0,55.8902,a8w8_blockscale_bpreshuffle_1x128x128_256x64x64x256_16x16_16x16_16x16x1_16x16x1_1x32x1x8_8_2x1_intrawave_v1,832.1,0.58395,0.0
gfx950,256,1600,2112,7168,ck,15,2,56.4283,a8w8_blockscale_bpreshuffle_1x128x128_256x64x64x128_16x16_16x16_8x32x1_8x32x1_1x32x1x8_8_2x1_intrawave_v1,858.51,0.5913,0.0067
gfx950,256,1664,2112,7168,ck,2,2,57.368,a8w8_blockscale_bpreshuffle_1x128x128_256x64x64x128_16x16_16x16_8x32x1_8x32x1_1x32x1x8_8_2x1_intrawave_v3,878.22,0.59432,0.0004
gfx950,256,1728,2112,7168,ck,15,1,57.7674,a8w8_blockscale_bpreshuffle_1x128x128_256x64x64x128_16x16_16x16_8x32x1_8x32x1_1x32x1x8_8_2x1_intrawave_v1,905.7,0.60283,0.0078
gfx950,256,1792,2112,7168,ck,2,1,59.3469,a8w8_blockscale_bpreshuffle_1x128x128_256x64x64x128_16x16_16x16_8x32x1_8x32x1_1x32x1x8_8_2x1_intrawave_v3,914.24,0.59908,0.0006
gfx950,256,1856,2112,7168,ck,15,3,60.2407,a8w8_blockscale_bpreshuffle_1x128x128_256x64x64x128_16x16_16x16_8x32x1_8x32x1_1x32x1x8_8_2x1_intrawave_v1,932.85,0.60229,0.0081
gfx950,256,1920,2112,7168,ck,15,1,62.5154,a8w8_blockscale_bpreshuffle_1x128x128_256x64x64x128_16x16_16x16_8x32x1_8x32x1_1x32x1x8_8_2x1_intrawave_v1,929.9,0.59204,0.008
gfx950,256,1984,2112,7168,ck,15,3,64.5853,a8w8_blockscale_bpreshuffle_1x128x128_256x64x64x128_16x16_16x16_8x32x1_8x32x1_1x32x1x8_8_2x1_intrawave_v1,930.1,0.58435,0.0082
gfx950,256,2048,2112,7168,ck,17,1,73.8185,a8w8_blockscale_bpreshuffle_1x128x128_256x64x64x256_16x16_16x16_16x16x1_16x16x1_1x32x1x8_8_2x1_intrawave_v1,840.01,0.52114,0.0
gfx950,256,4096,2112,7168,ck,15,0,122.5407,a8w8_blockscale_bpreshuffle_1x128x128_256x64x64x128_16x16_16x16_8x32x1_8x32x1_1x32x1x8_8_2x1_intrawave_v1,1012.05,0.50433,0.0085
gfx950,256,8192,2112,7168,ck,15,3,223.4002,a8w8_blockscale_bpreshuffle_1x128x128_256x64x64x128_16x16_16x16_8x32x1_8x32x1_1x32x1x8_8_2x1_intrawave_v1,1110.27,0.48551,0.0091
gfx950,256,16384,2112,7168,ck,15,1,411.1387,a8w8_blockscale_bpreshuffle_1x128x128_256x64x64x128_16x16_16x16_8x32x1_8x32x1_1x32x1x8_8_2x1_intrawave_v1,1206.57,0.4908,0.0095
gfx950,256,32768,2112,7168,ck,17,0,804.4843,a8w8_blockscale_bpreshuffle_1x128x128_256x64x64x256_16x16_16x16_16x16x1_16x16x1_1x32x1x8_8_2x1_intrawave_v1,1233.26,0.48283,0.0
gfx950,256,16,2240,7168,ck,7,2,17.3187,a8w8_blockscale_bpreshuffle_1x128x128_256x16x64x256_16x16_16x16_16x16x1_16x16x1_1x16x1x16_4_1x1_intrawave_v1,29.67,0.93787,0.0
gfx950,256,32,2240,7168,ck,7,1,17.2052,a8w8_blockscale_bpreshuffle_1x128x128_256x16x64x256_16x16_16x16_16x16x1_16x16x1_1x16x1x16_4_1x1_intrawave_v1,59.73,0.95489,0.0
gfx950,256,48,2240,7168,ck,7,0,17.1856,a8w8_blockscale_bpreshuffle_1x128x128_256x16x64x256_16x16_16x16_16x16x1_16x16x1_1x16x1x16_4_1x1_intrawave_v1,89.69,0.96682,0.0
gfx950,256,64,2240,7168,ck,7,2,17.1082,a8w8_blockscale_bpreshuffle_1x128x128_256x16x64x256_16x16_16x16_16x16x1_16x16x1_1x16x1x16_4_1x1_intrawave_v1,120.13,0.98209,0.0
gfx950,256,80,2240,7168,ck,7,1,17.1957,a8w8_blockscale_bpreshuffle_1x128x128_256x16x64x256_16x16_16x16_16x16x1_16x16x1_1x16x1x16_4_1x1_intrawave_v1,149.4,0.98793,0.0
gfx950,256,96,2240,7168,ck,7,0,17.0763,a8w8_blockscale_bpreshuffle_1x128x128_256x16x64x256_16x16_16x16_16x16x1_16x16x1_1x16x1x16_4_1x1_intrawave_v1,180.53,1.00575,0.0
gfx950,256,112,2240,7168,ck,7,2,17.0073,a8w8_blockscale_bpreshuffle_1x128x128_256x16x64x256_16x16_16x16_16x16x1_16x16x1_1x16x1x16_4_1x1_intrawave_v1,211.47,1.02079,0.0
gfx950,256,128,2240,7168,ck,12,3,18.3162,a8w8_blockscale_bpreshuffle_1x128x128_256x32x64x256_16x16_16x16_16x16x1_16x16x1_1x32x1x8_8_2x1_intrawave_v1,224.41,0.95802,0.0
gfx950,256,144,2240,7168,ck,7,1,17.4925,a8w8_blockscale_bpreshuffle_1x128x128_256x16x64x256_16x16_16x16_16x16x1_16x16x1_1x16x1x16_4_1x1_intrawave_v1,264.35,1.01378,0.0
gfx950,256,160,2240,7168,ck,12,0,18.2215,a8w8_blockscale_bpreshuffle_1x128x128_256x32x64x256_16x16_16x16_16x16x1_16x16x1_1x32x1x8_8_2x1_intrawave_v1,281.98,0.98345,0.0
gfx950,256,176,2240,7168,ck,7,0,19.5377,a8w8_blockscale_bpreshuffle_1x128x128_256x16x64x256_16x16_16x16_16x16x1_16x16x1_1x16x1x16_4_1x1_intrawave_v1,289.28,0.92674,0.0
gfx950,256,192,2240,7168,ck,12,3,18.244,a8w8_blockscale_bpreshuffle_1x128x128_256x32x64x256_16x16_16x16_16x16x1_16x16x1_1x32x1x8_8_2x1_intrawave_v1,337.95,1.00267,0.0
gfx950,256,208,2240,7168,ck,7,1,19.7375,a8w8_blockscale_bpreshuffle_1x128x128_256x16x64x256_16x16_16x16_16x16x1_16x16x1_1x16x1x16_4_1x1_intrawave_v1,338.41,0.93624,0.0
gfx950,256,224,2240,7168,ck,12,3,18.0754,a8w8_blockscale_bpreshuffle_1x128x128_256x32x64x256_16x16_16x16_16x16x1_16x16x1_1x32x1x8_8_2x1_intrawave_v1,397.96,1.03265,0.0
gfx950,256,240,2240,7168,ck,17,1,22.0355,a8w8_blockscale_bpreshuffle_1x128x128_256x64x64x256_16x16_16x16_16x16x1_16x16x1_1x32x1x8_8_2x1_intrawave_v1,349.76,0.85552,0.0
gfx950,256,256,2240,7168,ck,17,1,21.1511,a8w8_blockscale_bpreshuffle_1x128x128_256x64x64x256_16x16_16x16_16x16x1_16x16x1_1x32x1x8_8_2x1_intrawave_v1,388.67,0.9001,0.0
gfx950,256,288,2240,7168,ck,12,0,19.8488,a8w8_blockscale_bpreshuffle_1x128x128_256x32x64x256_16x16_16x16_16x16x1_16x16x1_1x32x1x8_8_2x1_intrawave_v1,465.94,0.97794,0.0
gfx950,256,320,2240,7168,ck,17,2,21.2632,a8w8_blockscale_bpreshuffle_1x128x128_256x64x64x256_16x16_16x16_16x16x1_16x16x1_1x32x1x8_8_2x1_intrawave_v1,483.28,0.93042,0.0
gfx950,256,352,2240,7168,ck,17,1,22.208,a8w8_blockscale_bpreshuffle_1x128x128_256x64x64x256_16x16_16x16_16x16x1_16x16x1_1x32x1x8_8_2x1_intrawave_v1,508.99,0.90762,0.0
gfx950,256,384,2240,7168,ck,17,2,21.4024,a8w8_blockscale_bpreshuffle_1x128x128_256x64x64x256_16x16_16x16_16x16x1_16x16x1_1x32x1x8_8_2x1_intrawave_v1,576.16,0.9592,0.0
gfx950,256,416,2240,7168,ck,17,1,22.4706,a8w8_blockscale_bpreshuffle_1x128x128_256x64x64x256_16x16_16x16_16x16x1_16x16x1_1x32x1x8_8_2x1_intrawave_v1,594.5,0.93019,0.0
gfx950,256,448,2240,7168,ck,17,2,21.5077,a8w8_blockscale_bpreshuffle_1x128x128_256x64x64x256_16x16_16x16_16x16x1_16x16x1_1x32x1x8_8_2x1_intrawave_v1,668.9,0.98916,0.0
gfx950,256,480,2240,7168,ck,10,3,29.6061,a8w8_blockscale_bpreshuffle_1x128x128_256x32x64x128_16x16_16x16_8x32x1_8x32x1_1x32x1x8_8_2x1_intrawave_v1,520.64,0.73118,0.0197
gfx950,256,512,2240,7168,ck,15,2,31.3316,a8w8_blockscale_bpreshuffle_1x128x128_256x64x64x128_16x16_16x16_8x32x1_8x32x1_1x32x1x8_8_2x1_intrawave_v1,524.76,0.70281,0.0005
gfx950,256,544,2240,7168,ck,17,2,29.8347,a8w8_blockscale_bpreshuffle_1x128x128_256x64x64x256_16x16_16x16_16x16x1_16x16x1_1x32x1x8_8_2x1_intrawave_v1,585.54,0.75056,0.0
gfx950,256,576,2240,7168,ck,17,0,29.2116,a8w8_blockscale_bpreshuffle_1x128x128_256x64x64x256_16x16_16x16_16x16x1_16x16x1_1x32x1x8_8_2x1_intrawave_v1,633.2,0.77933,0.0
gfx950,256,608,2240,7168,ck,12,3,31.1053,a8w8_blockscale_bpreshuffle_1x128x128_256x32x64x256_16x16_16x16_16x16x1_16x16x1_1x32x1x8_8_2x1_intrawave_v1,627.69,0.74387,0.0
gfx950,256,640,2240,7168,ck,17,3,31.3436,a8w8_blockscale_bpreshuffle_1x128x128_256x64x64x256_16x16_16x16_16x16x1_16x16x1_1x32x1x8_8_2x1_intrawave_v1,655.7,0.75011,0.0
gfx950,256,672,2240,7168,ck,17,2,32.4726,a8w8_blockscale_bpreshuffle_1x128x128_256x64x64x256_16x16_16x16_16x16x1_16x16x1_1x32x1x8_8_2x1_intrawave_v1,664.55,0.73551,0.0
gfx950,256,704,2240,7168,ck,17,3,31.5542,a8w8_blockscale_bpreshuffle_1x128x128_256x64x64x256_16x16_16x16_16x16x1_16x16x1_1x32x1x8_8_2x1_intrawave_v1,716.46,0.76873,0.0
gfx950,256,736,2240,7168,ck,17,1,32.7615,a8w8_blockscale_bpreshuffle_1x128x128_256x64x64x256_16x16_16x16_16x16x1_16x16x1_1x32x1x8_8_2x1_intrawave_v1,721.42,0.75177,0.0
gfx950,256,768,2240,7168,ck,17,0,31.996,a8w8_blockscale_bpreshuffle_1x128x128_256x64x64x256_16x16_16x16_16x16x1_16x16x1_1x32x1x8_8_2x1_intrawave_v1,770.8,0.78141,0.0
gfx950,256,800,2240,7168,ck,17,2,33.3508,a8w8_blockscale_bpreshuffle_1x128x128_256x64x64x256_16x16_16x16_16x16x1_16x16x1_1x32x1x8_8_2x1_intrawave_v1,770.3,0.76084,0.0
gfx950,256,832,2240,7168,ck,17,1,32.6843,a8w8_blockscale_bpreshuffle_1x128x128_256x64x64x256_16x16_16x16_16x16x1_16x16x1_1x32x1x8_8_2x1_intrawave_v1,817.45,0.78776,0.0
gfx950,256,864,2240,7168,ck,17,2,34.2322,a8w8_blockscale_bpreshuffle_1x128x128_256x64x64x256_16x16_16x16_16x16x1_16x16x1_1x32x1x8_8_2x1_intrawave_v1,810.5,0.76303,0.0
gfx950,256,896,2240,7168,ck,17,1,33.0197,a8w8_blockscale_bpreshuffle_1x128x128_256x64x64x256_16x16_16x16_16x16x1_16x16x1_1x32x1x8_8_2x1_intrawave_v1,871.39,0.80234,0.0
gfx950,256,928,2240,7168,ck,15,2,41.585,a8w8_blockscale_bpreshuffle_1x128x128_256x64x64x128_16x16_16x16_8x32x1_8x32x1_1x32x1x8_8_2x1_intrawave_v1,716.62,0.64604,0.0173
gfx950,256,960,2240,7168,ck,15,1,39.9713,a8w8_blockscale_bpreshuffle_1x128x128_256x64x64x128_16x16_16x16_8x32x1_8x32x1_1x32x1x8_8_2x1_intrawave_v1,771.26,0.68145,0.0025
gfx950,256,992,2240,7168,ck,15,1,43.5147,a8w8_blockscale_bpreshuffle_1x128x128_256x64x64x128_16x16_16x16_8x32x1_8x32x1_1x32x1x8_8_2x1_intrawave_v1,732.07,0.63452,0.0179
gfx950,256,1024,2240,7168,ck,2,2,44.5432,a8w8_blockscale_bpreshuffle_1x128x128_256x64x64x128_16x16_16x16_8x32x1_8x32x1_1x32x1x8_8_2x1_intrawave_v3,738.23,0.62824,0.0001
gfx950,256,1088,2240,7168,ck,15,2,41.8467,a8w8_blockscale_bpreshuffle_1x128x128_256x64x64x128_16x16_16x16_8x32x1_8x32x1_1x32x1x8_8_2x1_intrawave_v1,834.92,0.68654,0.0035
gfx950,256,1152,2240,7168,ck,15,1,42.3981,a8w8_blockscale_bpreshuffle_1x128x128_256x64x64x128_16x16_16x16_8x32x1_8x32x1_1x32x1x8_8_2x1_intrawave_v1,872.53,0.69519,0.0043
gfx950,256,1216,2240,7168,ck,15,1,44.3198,a8w8_blockscale_bpreshuffle_1x128x128_256x64x64x128_16x16_16x16_8x32x1_8x32x1_1x32x1x8_8_2x1_intrawave_v1,881.07,0.68187,0.0047
gfx950,256,1280,2240,7168,ck,15,0,46.0014,a8w8_blockscale_bpreshuffle_1x128x128_256x64x64x128_16x16_16x16_8x32x1_8x32x1_1x32x1x8_8_2x1_intrawave_v1,893.54,0.67315,0.0057
gfx950,256,1344,2240,7168,ck,15,3,46.7258,a8w8_blockscale_bpreshuffle_1x128x128_256x64x64x128_16x16_16x16_8x32x1_8x32x1_1x32x1x8_8_2x1_intrawave_v1,923.67,0.67867,0.006
gfx950,256,1408,2240,7168,ck,15,3,55.5671,a8w8_blockscale_bpreshuffle_1x128x128_256x64x64x128_16x16_16x16_8x32x1_8x32x1_1x32x1x8_8_2x1_intrawave_v1,813.69,0.5841,0.0061
gfx950,256,1472,2240,7168,ck,17,0,56.1099,a8w8_blockscale_bpreshuffle_1x128x128_256x64x64x256_16x16_16x16_16x16x1_16x16x1_1x32x1x8_8_2x1_intrawave_v1,842.45,0.59173,0.0
gfx950,256,1536,2240,7168,ck,15,0,57.0356,a8w8_blockscale_bpreshuffle_1x128x128_256x64x64x128_16x16_16x16_8x32x1_8x32x1_1x32x1x8_8_2x1_intrawave_v1,864.81,0.5952,0.0071
gfx950,256,1600,2240,7168,ck,15,0,57.9207,a8w8_blockscale_bpreshuffle_1x128x128_256x64x64x128_16x16_16x16_8x32x1_8x32x1_1x32x1x8_8_2x1_intrawave_v1,887.08,0.59898,0.0072
gfx950,256,1664,2240,7168,ck,15,0,58.3656,a8w8_blockscale_bpreshuffle_1x128x128_256x64x64x128_16x16_16x16_8x32x1_8x32x1_1x32x1x8_8_2x1_intrawave_v1,915.53,0.60718,0.008
gfx950,256,1728,2240,7168,ck,15,0,59.5866,a8w8_blockscale_bpreshuffle_1x128x128_256x64x64x128_16x16_16x16_8x32x1_8x32x1_1x32x1x8_8_2x1_intrawave_v1,931.26,0.60725,0.0078
gfx950,256,1792,2240,7168,ck,15,1,60.5927,a8w8_blockscale_bpreshuffle_1x128x128_256x64x64x128_16x16_16x16_8x32x1_8x32x1_1x32x1x8_8_2x1_intrawave_v1,949.72,0.60947,0.0083
gfx950,256,1856,2240,7168,ck,17,1,62.6283,a8w8_blockscale_bpreshuffle_1x128x128_256x64x64x256_16x16_16x16_16x16x1_16x16x1_1x32x1x8_8_2x1_intrawave_v1,951.66,0.60157,0.0
gfx950,256,1920,2240,7168,ck,17,2,69.6783,a8w8_blockscale_bpreshuffle_1x128x128_256x64x64x256_16x16_16x16_16x16x1_16x16x1_1x32x1x8_8_2x1_intrawave_v1,884.87,0.5514,0.0
gfx950,256,1984,2240,7168,ck,15,0,69.3874,a8w8_blockscale_bpreshuffle_1x128x128_256x64x64x128_16x16_16x16_8x32x1_8x32x1_1x32x1x8_8_2x1_intrawave_v1,918.2,0.56445,0.0079
gfx950,256,2048,2240,7168,ck,17,0,75.0354,a8w8_blockscale_bpreshuffle_1x128x128_256x64x64x256_16x16_16x16_16x16x1_16x16x1_1x32x1x8_8_2x1_intrawave_v1,876.48,0.5319,0.0
gfx950,256,4096,2240,7168,ck,15,0,125.1988,a8w8_blockscale_bpreshuffle_1x128x128_256x64x64x128_16x16_16x16_8x32x1_8x32x1_1x32x1x8_8_2x1_intrawave_v1,1050.6,0.50932,0.0092
gfx950,256,8192,2240,7168,ck,15,0,228.9556,a8w8_blockscale_bpreshuffle_1x128x128_256x64x64x128_16x16_16x16_8x32x1_8x32x1_1x32x1x8_8_2x1_intrawave_v1,1148.99,0.48689,0.0096
gfx950,256,16384,2240,7168,ck,15,3,434.2124,a8w8_blockscale_bpreshuffle_1x128x128_256x64x64x128_16x16_16x16_8x32x1_8x32x1_1x32x1x8_8_2x1_intrawave_v1,1211.7,0.47649,0.0095
gfx950,256,32768,2240,7168,ck,15,2,834.7736,a8w8_blockscale_bpreshuffle_1x128x128_256x64x64x128_16x16_16x16_8x32x1_8x32x1_1x32x1x8_8_2x1_intrawave_v1,1260.54,0.47646,0.0099
gfx950,256,16,3072,1536,ck,7,3,6.4633,a8w8_blockscale_bpreshuffle_1x128x128_256x16x64x256_16x16_16x16_16x16x1_16x16x1_1x16x1x16_4_1x1_intrawave_v1,23.36,0.74907,0.0
gfx950,256,16,3072,3072,asm,5,6,7.3727,_ZN5aiter42fp8gemm_bf16_blockscale_BpreShuffle_32x128E,40.96,1.30002,0.0003
gfx950,256,32,3072,1536,ck,7,3,6.5001,a8w8_blockscale_bpreshuffle_1x128x128_256x16x64x256_16x16_16x16_16x16x1_16x16x1_1x16x1x16_4_1x1_intrawave_v1,46.46,0.76373,0.0
gfx950,256,32,3072,3072,asm,15,8,8.2748,_ZN5aiter42fp8gemm_bf16_blockscale_BpreShuffle_48x128E,72.99,1.17611,0.0006
gfx950,256,48,3072,1536,ck,7,0,6.5182,a8w8_blockscale_bpreshuffle_1x128x128_256x16x64x256_16x16_16x16_16x16x1_16x16x1_1x16x1x16_4_1x1_intrawave_v1,69.5,0.78047,0.0
gfx950,256,48,3072,3072,asm,4,5,9.5269,_ZN5aiter42fp8gemm_bf16_blockscale_BpreShuffle_32x128E,95.1,1.03702,0.0001
gfx950,256,64,3072,1536,ck,6,3,6.4157,a8w8_blockscale_bpreshuffle_1x128x128_256x16x128x256_16x16_16x16_16x16x1_16x16x1_1x16x1x16_8_1x2_intrawave_v1,94.14,0.81209,0.0
gfx950,256,64,3072,3072,asm,3,4,9.2705,_ZN5aiter42fp8gemm_bf16_blockscale_BpreShuffle_32x128E,130.3,1.0816,0.0001
gfx950,256,80,3072,1536,ck,7,1,6.2015,a8w8_blockscale_bpreshuffle_1x128x128_256x16x64x256_16x16_16x16_16x16x1_16x16x1_1x16x1x16_4_1x1_intrawave_v1,121.74,0.85995,0.0
gfx950,256,80,3072,3072,asm,12,5,9.6381,_ZN5aiter42fp8gemm_bf16_blockscale_BpreShuffle_48x128E,156.66,1.05565,0.0001
gfx950,256,96,3072,1536,ck,7,1,6.1725,a8w8_blockscale_bpreshuffle_1x128x128_256x16x64x256_16x16_16x16_16x16x1_16x16x1_1x16x1x16_4_1x1_intrawave_v1,146.78,0.8839,0.0
gfx950,256,96,3072,3072,asm,19,4,9.2652,_ZN5aiter42fp8gemm_bf16_blockscale_BpreShuffle_64x128E,195.56,1.11405,0.0001
gfx950,256,112,3072,1536,ck,7,3,6.5959,a8w8_blockscale_bpreshuffle_1x128x128_256x16x64x256_16x16_16x16_16x16x1_16x16x1_1x16x1x16_4_1x1_intrawave_v1,160.25,0.84579,0.0
gfx950,256,112,3072,3072,ck,7,0,9.9923,a8w8_blockscale_bpreshuffle_1x128x128_256x16x64x256_16x16_16x16_16x16x1_16x16x1_1x16x1x16_4_1x1_intrawave_v1,211.56,1.04774,0.0
gfx950,256,128,3072,1536,ck,7,0,6.2613,a8w8_blockscale_bpreshuffle_1x128x128_256x16x64x256_16x16_16x16_16x16x1_16x16x1_1x16x1x16_4_1x1_intrawave_v1,192.92,0.91061,0.0
gfx950,256,128,3072,3072,ck,7,0,10.3718,a8w8_blockscale_bpreshuffle_1x128x128_256x16x64x256_16x16_16x16_16x16x1_16x16x1_1x16x1x16_4_1x1_intrawave_v1,232.93,1.02362,0.0
gfx950,256,144,3072,1536,ck,12,1,6.338,a8w8_blockscale_bpreshuffle_1x128x128_256x32x64x256_16x16_16x16_16x16x1_16x16x1_1x32x1x8_8_2x1_intrawave_v1,214.41,0.91898,0.0
gfx950,256,144,3072,3072,ck,7,0,10.2283,a8w8_blockscale_bpreshuffle_1x128x128_256x16x64x256_16x16_16x16_16x16x1_16x16x1_1x16x1x16_4_1x1_intrawave_v1,265.72,1.0524,0.0
gfx950,256,160,3072,1536,ck,12,0,6.0824,a8w8_blockscale_bpreshuffle_1x128x128_256x32x64x256_16x16_16x16_16x16x1_16x16x1_1x32x1x8_8_2x1_intrawave_v1,248.25,0.9778,0.0
gfx950,256,160,3072,3072,ck,12,1,9.8728,a8w8_blockscale_bpreshuffle_1x128x128_256x32x64x256_16x16_16x16_16x16x1_16x16x1_1x32x1x8_8_2x1_intrawave_v1,305.88,1.10523,0.0
gfx950,256,176,3072,1536,ck,6,3,7.3433,a8w8_blockscale_bpreshuffle_1x128x128_256x16x128x256_16x16_16x16_16x16x1_16x16x1_1x16x1x16_8_1x2_intrawave_v1,226.19,0.82664,0.0
gfx950,256,176,3072,3072,ck,12,1,11.0912,a8w8_blockscale_bpreshuffle_1x128x128_256x32x64x256_16x16_16x16_16x16x1_16x16x1_1x32x1x8_8_2x1_intrawave_v1,299.51,0.99711,0.0
gfx950,256,192,3072,1536,ck,6,0,6.9211,a8w8_blockscale_bpreshuffle_1x128x128_256x16x128x256_16x16_16x16_16x16x1_16x16x1_1x16x1x16_8_1x2_intrawave_v1,261.8,0.89482,0.0
gfx950,256,192,3072,3072,ck,12,3,10.5231,a8w8_blockscale_bpreshuffle_1x128x128_256x32x64x256_16x16_16x16_16x16x1_16x16x1_1x32x1x8_8_2x1_intrawave_v1,344.37,1.06496,0.0
gfx950,256,208,3072,1536,ck,12,1,7.2509,a8w8_blockscale_bpreshuffle_1x128x128_256x32x64x256_16x16_16x16_16x16x1_16x16x1_1x32x1x8_8_2x1_intrawave_v1,270.72,0.87107,0.0
gfx950,256,208,3072,3072,ck,17,2,11.654,a8w8_blockscale_bpreshuffle_1x128x128_256x64x64x256_16x16_16x16_16x16x1_16x16x1_1x32x1x8_8_2x1_intrawave_v1,336.87,0.97427,0.0
gfx950,256,224,3072,1536,ck,12,1,7.2036,a8w8_blockscale_bpreshuffle_1x128x128_256x32x64x256_16x16_16x16_16x16x1_16x16x1_1x32x1x8_8_2x1_intrawave_v1,293.45,0.89385,0.0
gfx950,256,224,3072,3072,ck,12,3,11.5304,a8w8_blockscale_bpreshuffle_1x128x128_256x32x64x256_16x16_16x16_16x16x1_16x16x1_1x32x1x8_8_2x1_intrawave_v1,366.67,0.9975,0.0
gfx950,256,240,3072,1536,ck,11,1,7.2241,a8w8_blockscale_bpreshuffle_1x128x128_256x32x128x256_16x16_16x16_16x16x1_16x16x1_1x32x1x8_8_2x1_intrawave_v1,313.52,0.90832,0.0
gfx950,256,240,3072,3072,ck,17,3,11.735,a8w8_blockscale_bpreshuffle_1x128x128_256x64x64x256_16x16_16x16_16x16x1_16x16x1_1x32x1x8_8_2x1_intrawave_v1,386.01,0.99267,0.0
gfx950,256,256,3072,1536,ck,11,3,7.3204,a8w8_blockscale_bpreshuffle_1x128x128_256x32x128x256_16x16_16x16_16x16x1_16x16x1_1x32x1x8_8_2x1_intrawave_v1,330.03,0.91316,0.0
gfx950,256,256,3072,3072,ck,17,2,11.4432,a8w8_blockscale_bpreshuffle_1x128x128_256x64x64x256_16x16_16x16_16x16x1_16x16x1_1x32x1x8_8_2x1_intrawave_v1,422.25,1.03087,0.0
gfx950,256,288,3072,1536,ck,12,3,7.4073,a8w8_blockscale_bpreshuffle_1x128x128_256x32x64x256_16x16_16x16_16x16x1_16x16x1_1x32x1x8_8_2x1_intrawave_v1,366.92,0.93562,0.0
gfx950,256,288,3072,3072,ck,12,0,11.9257,a8w8_blockscale_bpreshuffle_1x128x128_256x32x64x256_16x16_16x16_16x16x1_16x16x1_1x32x1x8_8_2x1_intrawave_v1,455.81,1.01389,0.0
gfx950,256,320,3072,1536,ck,17,0,7.4931,a8w8_blockscale_bpreshuffle_1x128x128_256x64x64x256_16x16_16x16_16x16x1_16x16x1_1x32x1x8_8_2x1_intrawave_v1,403.02,0.95771,0.0
gfx950,256,320,3072,3072,ck,17,0,11.7025,a8w8_blockscale_bpreshuffle_1x128x128_256x64x64x256_16x16_16x16_16x16x1_16x16x1_1x32x1x8_8_2x1_intrawave_v1,516.11,1.05843,0.0
gfx950,256,352,3072,1536,ck,10,0,9.4059,a8w8_blockscale_bpreshuffle_1x128x128_256x32x64x128_16x16_16x16_8x32x1_8x32x1_1x32x1x8_8_2x1_intrawave_v1,353.17,0.78907,0.0212
gfx950,256,352,3072,3072,asm,8,1,14.6095,_ZN5aiter42fp8gemm_bf16_blockscale_BpreShuffle_48x128E,454.76,0.86801,0.0
gfx950,256,384,3072,1536,ck,12,3,9.3019,a8w8_blockscale_bpreshuffle_1x128x128_256x32x64x256_16x16_16x16_16x16x1_16x16x1_1x32x1x8_8_2x1_intrawave_v1,389.58,0.82432,0.0
gfx950,256,384,3072,3072,asm,8,1,14.6577,_ZN5aiter42fp8gemm_bf16_blockscale_BpreShuffle_48x128E,494.47,0.88528,0.0
gfx950,256,416,3072,1536,asm,8,1,9.7878,_ZN5aiter42fp8gemm_bf16_blockscale_BpreShuffle_48x128E,401.1,0.8085,0.0
gfx950,256,416,3072,3072,asm,8,1,14.702,_ZN5aiter42fp8gemm_bf16_blockscale_BpreShuffle_48x128E,534.06,0.90267,0.0
gfx950,256,448,3072,1536,ck,12,1,9.7709,a8w8_blockscale_bpreshuffle_1x128x128_256x32x64x256_16x16_16x16_16x16x1_16x16x1_1x32x1x8_8_2x1_intrawave_v1,432.7,0.83505,0.0
gfx950,256,448,3072,3072,asm,8,1,14.7225,_ZN5aiter42fp8gemm_bf16_blockscale_BpreShuffle_48x128E,574.34,0.92144,0.0
gfx950,256,480,3072,1536,ck,12,3,10.0889,a8w8_blockscale_bpreshuffle_1x128x128_256x32x64x256_16x16_16x16_16x16x1_16x16x1_1x32x1x8_8_2x1_intrawave_v1,448.99,0.83309,0.0
gfx950,256,480,3072,3072,asm,8,1,14.8006,_ZN5aiter42fp8gemm_bf16_blockscale_BpreShuffle_48x128E,612.12,0.93651,0.0
gfx950,256,512,3072,1536,ck,12,2,10.3534,a8w8_blockscale_bpreshuffle_1x128x128_256x32x64x256_16x16_16x16_16x16x1_16x16x1_1x32x1x8_8_2x1_intrawave_v1,466.69,0.83555,0.0
gfx950,256,512,3072,3072,asm,16,1,15.8579,_ZN5aiter42fp8gemm_bf16_blockscale_BpreShuffle_64x128E,609.39,0.89266,0.0
gfx950,256,544,3072,1536,ck,11,3,10.5019,a8w8_blockscale_bpreshuffle_1x128x128_256x32x128x256_16x16_16x16_16x16x1_16x16x1_1x32x1x8_8_2x1_intrawave_v1,488.85,0.84713,0.0
gfx950,256,544,3072,3072,asm,16,1,15.8752,_ZN5aiter42fp8gemm_bf16_blockscale_BpreShuffle_64x128E,646.77,0.91027,0.0
gfx950,256,576,3072,1536,ck,17,1,10.5455,a8w8_blockscale_bpreshuffle_1x128x128_256x64x64x256_16x16_16x16_16x16x1_16x16x1_1x32x1x8_8_2x1_intrawave_v1,515.46,0.86694,0.0
gfx950,256,576,3072,3072,asm,16,1,15.9596,_ZN5aiter42fp8gemm_bf16_blockscale_BpreShuffle_64x128E,681.2,0.92393,0.0
gfx950,256,608,3072,1536,ck,11,0,10.6701,a8w8_blockscale_bpreshuffle_1x128x128_256x32x128x256_16x16_16x16_16x16x1_16x16x1_1x32x1x8_8_2x1_intrawave_v1,537.75,0.87984,0.0
gfx950,256,608,3072,3072,asm,16,1,16.0084,_ZN5aiter42fp8gemm_bf16_blockscale_BpreShuffle_64x128E,716.85,0.93954,0.0
gfx950,256,640,3072,1536,ck,17,1,10.7885,a8w8_blockscale_bpreshuffle_1x128x128_256x64x64x256_16x16_16x16_16x16x1_16x16x1_1x32x1x8_8_2x1_intrawave_v1,559.84,0.89297,0.0
gfx950,256,640,3072,3072,asm,16,1,16.2216,_ZN5aiter42fp8gemm_bf16_blockscale_BpreShuffle_64x128E,744.66,0.94537,0.0
gfx950,256,672,3072,1536,ck,11,3,10.9913,a8w8_blockscale_bpreshuffle_1x128x128_256x32x128x256_16x16_16x16_16x16x1_16x16x1_1x32x1x8_8_2x1_intrawave_v1,576.98,0.89885,0.0
gfx950,256,672,3072,3072,asm,24,1,17.2482,_ZN5aiter42fp8gemm_bf16_blockscale_BpreShuffle_80x128E,735.36,0.9062,0.0
gfx950,256,704,3072,1536,asm,24,1,12.1215,_ZN5aiter42fp8gemm_bf16_blockscale_BpreShuffle_80x128E,548.1,0.83532,0.0
gfx950,256,704,3072,3072,asm,24,1,17.5391,_ZN5aiter42fp8gemm_bf16_blockscale_BpreShuffle_80x128E,757.6,0.90799,0.0
gfx950,256,736,3072,1536,asm,24,1,11.7277,_ZN5aiter42fp8gemm_bf16_blockscale_BpreShuffle_80x128E,592.25,0.88432,0.0
gfx950,256,736,3072,3072,asm,24,1,17.5502,_ZN5aiter42fp8gemm_bf16_blockscale_BpreShuffle_80x128E,791.53,0.92422,0.0
gfx950,256,768,3072,1536,asm,24,1,11.8225,_ZN5aiter42fp8gemm_bf16_blockscale_BpreShuffle_80x128E,613.05,0.89802,0.0
gfx950,256,768,3072,3072,asm,24,1,17.4237,_ZN5aiter42fp8gemm_bf16_blockscale_BpreShuffle_80x128E,831.94,0.94785,0.0
gfx950,256,800,3072,1536,asm,24,1,12.0428,_ZN5aiter42fp8gemm_bf16_blockscale_BpreShuffle_80x128E,626.91,0.902,0.0
gfx950,256,800,3072,3072,asm,24,1,17.7973,_ZN5aiter42fp8gemm_bf16_blockscale_BpreShuffle_80x128E,848.41,0.94452,0.0
gfx950,256,832,3072,1536,asm,32,1,13.235,_ZN5aiter42fp8gemm_bf16_blockscale_BpreShuffle_96x128E,593.26,0.83932,0.0
gfx950,256,832,3072,3072,asm,32,1,19.303,_ZN5aiter42fp8gemm_bf16_blockscale_BpreShuffle_96x128E,813.53,0.88613,0.0
gfx950,256,864,3072,1536,asm,32,1,13.3818,_ZN5aiter42fp8gemm_bf16_blockscale_BpreShuffle_96x128E,609.31,0.84847,0.0
gfx950,256,864,3072,3072,asm,32,1,19.4672,_ZN5aiter42fp8gemm_bf16_blockscale_BpreShuffle_96x128E,837.69,0.8938,0.0
gfx950,256,896,3072,1536,asm,32,1,12.9966,_ZN5aiter42fp8gemm_bf16_blockscale_BpreShuffle_96x128E,650.61,0.89253,0.0
gfx950,256,896,3072,3072,asm,32,1,19.4031,_ZN5aiter42fp8gemm_bf16_blockscale_BpreShuffle_96x128E,871.58,0.91195,0.0
gfx950,256,928,3072,1536,asm,32,1,13.4375,_ZN5aiter42fp8gemm_bf16_blockscale_BpreShuffle_96x128E,651.74,0.88154,0.0
gfx950,256,928,3072,3072,asm,32,1,19.6687,_ZN5aiter42fp8gemm_bf16_blockscale_BpreShuffle_96x128E,890.52,0.91463,0.0
gfx950,256,960,3072,1536,asm,32,1,13.6336,_ZN5aiter42fp8gemm_bf16_blockscale_BpreShuffle_96x128E,664.51,0.88688,0.0
gfx950,256,960,3072,3072,asm,32,1,19.8975,_ZN5aiter42fp8gemm_bf16_blockscale_BpreShuffle_96x128E,910.64,0.91894,0.0
gfx950,256,992,3072,1536,ck,15,1,14.2672,a8w8_blockscale_bpreshuffle_1x128x128_256x64x64x128_16x16_16x16_8x32x1_8x32x1_1x32x1x8_8_2x1_intrawave_v1,656.17,0.86472,0.0137
gfx950,256,992,3072,3072,ck,14,3,22.8957,a8w8_blockscale_bpreshuffle_1x128x128_256x64x128x128_16x16_16x16_8x32x1_8x32x1_1x32x1x8_8_2x1_intrawave_v1,817.77,0.81148,0.0001
gfx950,256,1024,3072,1536,ck,15,3,14.2212,a8w8_blockscale_bpreshuffle_1x128x128_256x64x64x128_16x16_16x16_8x32x1_8x32x1_1x32x1x8_8_2x1_intrawave_v1,679.53,0.8848,0.0014
gfx950,256,1024,3072,3072,ck,14,3,22.9132,a8w8_blockscale_bpreshuffle_1x128x128_256x64x128x128_16x16_16x16_8x32x1_8x32x1_1x32x1x8_8_2x1_intrawave_v1,843.5,0.82373,0.0001
gfx950,256,1088,3072,1536,ck,14,0,14.3467,a8w8_blockscale_bpreshuffle_1x128x128_256x64x128x128_16x16_16x16_8x32x1_8x32x1_1x32x1x8_8_2x1_intrawave_v1,715.68,0.91132,0.0
gfx950,256,1088,3072,3072,ck,14,3,22.4901,a8w8_blockscale_bpreshuffle_1x128x128_256x64x128x128_16x16_16x16_8x32x1_8x32x1_1x32x1x8_8_2x1_intrawave_v1,913.08,0.86546,0.0001
gfx950,256,1152,3072,1536,ck,14,3,14.3806,a8w8_blockscale_bpreshuffle_1x128x128_256x64x128x128_16x16_16x16_8x32x1_8x32x1_1x32x1x8_8_2x1_intrawave_v1,755.99,0.94335,0.0
gfx950,256,1152,3072,3072,ck,14,0,22.6081,a8w8_blockscale_bpreshuffle_1x128x128_256x64x128x128_16x16_16x16_8x32x1_8x32x1_1x32x1x8_8_2x1_intrawave_v1,961.75,0.88703,0.0001
gfx950,256,1216,3072,1536,ck,14,3,14.6973,a8w8_blockscale_bpreshuffle_1x128x128_256x64x128x128_16x16_16x16_8x32x1_8x32x1_1x32x1x8_8_2x1_intrawave_v1,780.8,0.95647,0.0
gfx950,256,1216,3072,3072,ck,14,2,23.0364,a8w8_blockscale_bpreshuffle_1x128x128_256x64x128x128_16x16_16x16_8x32x1_8x32x1_1x32x1x8_8_2x1_intrawave_v1,996.3,0.89614,0.0001
gfx950,256,1280,3072,1536,ck,14,1,14.8836,a8w8_blockscale_bpreshuffle_1x128x128_256x64x128x128_16x16_16x16_8x32x1_8x32x1_1x32x1x8_8_2x1_intrawave_v1,811.6,0.97752,0.0
gfx950,256,1280,3072,3072,ck,14,1,23.4477,a8w8_blockscale_bpreshuffle_1x128x128_256x64x128x128_16x16_16x16_8x32x1_8x32x1_1x32x1x8_8_2x1_intrawave_v1,1030.34,0.90558,0.0001
gfx950,256,1344,3072,1536,ck,14,3,15.1183,a8w8_blockscale_bpreshuffle_1x128x128_256x64x128x128_16x16_16x16_8x32x1_8x32x1_1x32x1x8_8_2x1_intrawave_v1,838.96,0.99485,0.0
gfx950,256,1344,3072,3072,ck,14,0,23.8751,a8w8_blockscale_bpreshuffle_1x128x128_256x64x128x128_16x16_16x16_8x32x1_8x32x1_1x32x1x8_8_2x1_intrawave_v1,1062.49,0.91407,0.0001
gfx950,256,1408,3072,1536,ck,14,0,18.3176,a8w8_blockscale_bpreshuffle_1x128x128_256x64x128x128_16x16_16x16_8x32x1_8x32x1_1x32x1x8_8_2x1_intrawave_v1,725.4,0.84793,0.0
gfx950,256,1408,3072,3072,ck,14,3,29.2608,a8w8_blockscale_bpreshuffle_1x128x128_256x64x128x128_16x16_16x16_8x32x1_8x32x1_1x32x1x8_8_2x1_intrawave_v1,908.22,0.76598,0.0001
gfx950,256,1472,3072,1536,ck,14,1,18.5424,a8w8_blockscale_bpreshuffle_1x128x128_256x64x128x128_16x16_16x16_8x32x1_8x32x1_1x32x1x8_8_2x1_intrawave_v1,749.18,0.86416,0.0001
gfx950,256,1472,3072,3072,ck,14,3,29.6273,a8w8_blockscale_bpreshuffle_1x128x128_256x64x128x128_16x16_16x16_8x32x1_8x32x1_1x32x1x8_8_2x1_intrawave_v1,937.75,0.77642,0.0001
gfx950,256,1536,3072,1536,ck,14,0,18.6045,a8w8_blockscale_bpreshuffle_1x128x128_256x64x128x128_16x16_16x16_8x32x1_8x32x1_1x32x1x8_8_2x1_intrawave_v1,779.14,0.88769,0.0001
gfx950,256,1536,3072,3072,ck,14,1,29.4698,a8w8_blockscale_bpreshuffle_1x128x128_256x64x128x128_16x16_16x16_8x32x1_8x32x1_1x32x1x8_8_2x1_intrawave_v1,983.75,0.80058,0.0002
gfx950,256,1600,3072,1536,ck,14,2,18.8,a8w8_blockscale_bpreshuffle_1x128x128_256x64x128x128_16x16_16x16_8x32x1_8x32x1_1x32x1x8_8_2x1_intrawave_v1,803.16,0.90461,0.0001
gfx950,256,1600,3072,3072,ck,14,3,29.7895,a8w8_blockscale_bpreshuffle_1x128x128_256x64x128x128_16x16_16x16_8x32x1_8x32x1_1x32x1x8_8_2x1_intrawave_v1,1013.75,0.81179,0.0002
gfx950,256,1664,3072,1536,ck,14,0,18.9387,a8w8_blockscale_bpreshuffle_1x128x128_256x64x128x128_16x16_16x16_8x32x1_8x32x1_1x32x1x8_8_2x1_intrawave_v1,829.17,0.92393,0.0001
gfx950,256,1664,3072,3072,ck,14,0,30.0458,a8w8_blockscale_bpreshuffle_1x128x128_256x64x128x128_16x16_16x16_8x32x1_8x32x1_1x32x1x8_8_2x1_intrawave_v1,1045.3,0.82449,0.0001
gfx950,256,1728,3072,1536,ck,14,3,19.2012,a8w8_blockscale_bpreshuffle_1x128x128_256x64x128x128_16x16_16x16_8x32x1_8x32x1_1x32x1x8_8_2x1_intrawave_v1,849.29,0.9369,0.0002
gfx950,256,1728,3072,3072,ck,14,2,30.4353,a8w8_blockscale_bpreshuffle_1x128x128_256x64x128x128_16x16_16x16_8x32x1_8x32x1_1x32x1x8_8_2x1_intrawave_v1,1071.61,0.83332,0.0002
gfx950,256,1792,3072,1536,ck,14,1,19.3448,a8w8_blockscale_bpreshuffle_1x128x128_256x64x128x128_16x16_16x16_8x32x1_8x32x1_1x32x1x8_8_2x1_intrawave_v1,874.21,0.95536,0.0001
gfx950,256,1792,3072,3072,ck,14,0,30.8284,a8w8_blockscale_bpreshuffle_1x128x128_256x64x128x128_16x16_16x16_8x32x1_8x32x1_1x32x1x8_8_2x1_intrawave_v1,1097.13,0.84183,0.0002
gfx950,256,1856,3072,1536,ck,14,1,19.4996,a8w8_blockscale_bpreshuffle_1x128x128_256x64x128x128_16x16_16x16_8x32x1_8x32x1_1x32x1x8_8_2x1_intrawave_v1,898.24,0.97298,0.0002
gfx950,256,1856,3072,3072,ck,14,0,31.8273,a8w8_blockscale_bpreshuffle_1x128x128_256x64x128x128_16x16_16x16_8x32x1_8x32x1_1x32x1x8_8_2x1_intrawave_v1,1100.65,0.83394,0.0002
gfx950,256,1920,3072,1536,ck,14,2,19.5725,a8w8_blockscale_bpreshuffle_1x128x128_256x64x128x128_16x16_16x16_8x32x1_8x32x1_1x32x1x8_8_2x1_intrawave_v1,925.76,0.99447,0.0002
gfx950,256,1920,3072,3072,ck,14,0,31.7613,a8w8_blockscale_bpreshuffle_1x128x128_256x64x128x128_16x16_16x16_8x32x1_8x32x1_1x32x1x8_8_2x1_intrawave_v1,1140.97,0.85424,0.0002
gfx950,256,1984,3072,1536,ck,14,1,20.1808,a8w8_blockscale_bpreshuffle_1x128x128_256x64x128x128_16x16_16x16_8x32x1_8x32x1_1x32x1x8_8_2x1_intrawave_v1,927.78,0.98885,0.0002
gfx950,256,1984,3072,3072,ck,14,3,33.9609,a8w8_blockscale_bpreshuffle_1x128x128_256x64x128x128_16x16_16x16_8x32x1_8x32x1_1x32x1x8_8_2x1_intrawave_v1,1102.64,0.81628,0.0002
gfx950,256,2048,3072,1536,ck,14,2,20.3677,a8w8_blockscale_bpreshuffle_1x128x128_256x64x128x128_16x16_16x16_8x32x1_8x32x1_1x32x1x8_8_2x1_intrawave_v1,948.92,1.0039,0.0001
gfx950,256,2048,3072,3072,ck,14,3,33.9279,a8w8_blockscale_bpreshuffle_1x128x128_256x64x128x128_16x16_16x16_8x32x1_8x32x1_1x32x1x8_8_2x1_intrawave_v1,1139.32,0.83446,0.0002
gfx950,256,4096,3072,1536,ck,13,0,32.8903,a8w8_blockscale_bpreshuffle_1x128x128_256x64x256x128_16x16_16x16_8x32x1_8x32x1_1x32x1x8_8_2x1_intrawave_v1,1175.26,1.09989,0.0
gfx950,256,4096,3072,3072,ck,13,1,56.2027,a8w8_blockscale_bpreshuffle_1x128x128_256x64x256x128_16x16_16x16_8x32x1_8x32x1_1x32x1x8_8_2x1_intrawave_v1,1375.55,0.83957,0.0
gfx950,256,8192,3072,1536,ck,13,0,60.7603,a8w8_blockscale_bpreshuffle_1x128x128_256x64x256x128_16x16_16x16_8x32x1_8x32x1_1x32x1x8_8_2x1_intrawave_v1,1272.37,1.11311,0.0
gfx950,256,8192,3072,3072,ck,13,0,98.9536,a8w8_blockscale_bpreshuffle_1x128x128_256x64x256x128_16x16_16x16_8x32x1_8x32x1_1x32x1x8_8_2x1_intrawave_v1,1562.54,0.85833,0.0
gfx950,256,16384,3072,1536,ck,13,2,113.3639,a8w8_blockscale_bpreshuffle_1x128x128_256x64x256x128_16x16_16x16_8x32x1_8x32x1_1x32x1x8_8_2x1_intrawave_v1,1363.92,1.15158,0.0
gfx950,256,16384,3072,3072,ck,13,1,188.8317,a8w8_blockscale_bpreshuffle_1x128x128_256x64x256x128_16x16_16x16_8x32x1_8x32x1_1x32x1x8_8_2x1_intrawave_v1,1637.64,0.8496,0.0
gfx950,256,32768,3072,1536,ck,13,0,206.2023,a8w8_blockscale_bpreshuffle_1x128x128_256x64x256x128_16x16_16x16_8x32x1_8x32x1_1x32x1x8_8_2x1_intrawave_v1,1499.68,1.24333,0.0
gfx950,256,32768,3072,3072,ck,13,1,358.9075,a8w8_blockscale_bpreshuffle_1x128x128_256x64x256x128_16x16_16x16_8x32x1_8x32x1_1x32x1x8_8_2x1_intrawave_v1,1723.22,0.86771,0.0
gfx950,256,16,4096,512,ck,7,3,3.0553,a8w8_blockscale_bpreshuffle_1x128x128_256x16x64x256_16x16_16x16_16x16x1_16x16x1_1x16x1x16_4_1x1_intrawave_v1,21.96,0.73198,0.0
gfx950,256,16,4096,3072,asm,5,6,8.5265,_ZN5aiter42fp8gemm_bf16_blockscale_BpreShuffle_32x128E,47.22,1.49688,0.0001
gfx950,256,32,4096,512,ck,7,1,3.352,a8w8_blockscale_bpreshuffle_1x128x128_256x16x64x256_16x16_16x16_16x16x1_16x16x1_1x16x1x16_4_1x1_intrawave_v1,40.04,0.70874,0.0
gfx950,256,32,4096,3072,asm,5,6,9.3323,_ZN5aiter42fp8gemm_bf16_blockscale_BpreShuffle_32x128E,86.29,1.38694,0.0001
gfx950,256,48,4096,512,ck,7,2,3.4163,a8w8_blockscale_bpreshuffle_1x128x128_256x16x64x256_16x16_16x16_16x16x1_16x16x1_1x16x1x16_4_1x1_intrawave_v1,58.93,0.73616,0.0
gfx950,256,48,4096,3072,asm,13,6,9.3261,_ZN5aiter42fp8gemm_bf16_blockscale_BpreShuffle_48x128E,129.52,1.40719,0.0002
gfx950,256,64,4096,512,ck,7,0,3.5282,a8w8_blockscale_bpreshuffle_1x128x128_256x16x64x256_16x16_16x16_16x16x1_16x16x1_1x16x1x16_4_1x1_intrawave_v1,76.08,0.75228,0.0
gfx950,256,64,4096,3072,ck,12,0,9.8624,a8w8_blockscale_bpreshuffle_1x128x128_256x32x64x256_16x16_16x16_16x16x1_16x16x1_1x32x1x8_8_2x1_intrawave_v1,163.31,1.34894,0.0
gfx950,256,80,4096,512,ck,7,1,3.9461,a8w8_blockscale_bpreshuffle_1x128x128_256x16x64x256_16x16_16x16_16x16x1_16x16x1_1x16x1x16_4_1x1_intrawave_v1,85.03,0.70791,0.0
gfx950,256,80,4096,3072,asm,11,4,10.0921,_ZN5aiter42fp8gemm_bf16_blockscale_BpreShuffle_48x128E,199.49,1.3361,0.0001
gfx950,256,96,4096,512,ck,7,1,3.9483,a8w8_blockscale_bpreshuffle_1x128x128_256x16x64x256_16x16_16x16_16x16x1_16x16x1_1x16x1x16_4_1x1_intrawave_v1,101.98,0.74278,0.0
gfx950,256,96,4096,3072,ck,12,0,9.741,a8w8_blockscale_bpreshuffle_1x128x128_256x32x64x256_16x16_16x16_16x16x1_16x16x1_1x32x1x8_8_2x1_intrawave_v1,248.02,1.40276,0.0
gfx950,256,112,4096,512,ck,6,1,4.0039,a8w8_blockscale_bpreshuffle_1x128x128_256x16x128x256_16x16_16x16_16x16x1_16x16x1_1x16x1x16_8_1x2_intrawave_v1,117.33,0.76725,0.0
gfx950,256,112,4096,3072,ck,7,0,10.2261,a8w8_blockscale_bpreshuffle_1x128x128_256x16x64x256_16x16_16x16_16x16x1_16x16x1_1x16x1x16_4_1x1_intrawave_v1,275.63,1.35384,0.0
gfx950,256,128,4096,512,ck,7,0,3.933,a8w8_blockscale_bpreshuffle_1x128x128_256x16x64x256_16x16_16x16_16x16x1_16x16x1_1x16x1x16_4_1x1_intrawave_v1,136.5,0.81649,0.0
gfx950,256,128,4096,3072,ck,12,1,9.764,a8w8_blockscale_bpreshuffle_1x128x128_256x32x64x256_16x16_16x16_16x16x1_16x16x1_1x32x1x8_8_2x1_intrawave_v1,329.91,1.43637,0.0
gfx950,256,144,4096,512,ck,7,1,4.6145,a8w8_blockscale_bpreshuffle_1x128x128_256x16x64x256_16x16_16x16_16x16x1_16x16x1_1x16x1x16_4_1x1_intrawave_v1,130.89,0.72609,0.0
gfx950,256,144,4096,3072,ck,17,0,11.6095,a8w8_blockscale_bpreshuffle_1x128x128_256x64x64x256_16x16_16x16_16x16x1_16x16x1_1x32x1x8_8_2x1_intrawave_v1,312.15,1.22356,0.0
gfx950,256,160,4096,512,ck,7,0,4.7158,a8w8_blockscale_bpreshuffle_1x128x128_256x16x64x256_16x16_16x16_16x16x1_16x16x1_1x16x1x16_4_1x1_intrawave_v1,142.31,0.74002,0.0
gfx950,256,160,4096,3072,ck,17,0,11.648,a8w8_blockscale_bpreshuffle_1x128x128_256x64x64x256_16x16_16x16_16x16x1_16x16x1_1x32x1x8_8_2x1_intrawave_v1,345.68,1.23499,0.0
gfx950,256,176,4096,512,ck,7,1,4.6429,a8w8_blockscale_bpreshuffle_1x128x128_256x16x64x256_16x16_16x16_16x16x1_16x16x1_1x16x1x16_4_1x1_intrawave_v1,158.99,0.78164,0.0
gfx950,256,176,4096,3072,ck,17,1,11.723,a8w8_blockscale_bpreshuffle_1x128x128_256x64x64x256_16x16_16x16_16x16x1_16x16x1_1x32x1x8_8_2x1_intrawave_v1,377.82,1.24246,0.0
gfx950,256,192,4096,512,ck,7,0,4.6761,a8w8_blockscale_bpreshuffle_1x128x128_256x16x64x256_16x16_16x16_16x16x1_16x16x1_1x16x1x16_4_1x1_intrawave_v1,172.22,0.80587,0.0
gfx950,256,192,4096,3072,ck,17,0,11.4303,a8w8_blockscale_bpreshuffle_1x128x128_256x64x64x256_16x16_16x16_16x16x1_16x16x1_1x32x1x8_8_2x1_intrawave_v1,422.72,1.29004,0.0
gfx950,256,208,4096,512,ck,11,2,4.762,a8w8_blockscale_bpreshuffle_1x128x128_256x32x128x256_16x16_16x16_16x16x1_16x16x1_1x32x1x8_8_2x1_intrawave_v1,183.2,0.82058,0.0
gfx950,256,208,4096,3072,ck,17,2,11.7962,a8w8_blockscale_bpreshuffle_1x128x128_256x64x64x256_16x16_16x16_16x16x1_16x16x1_1x32x1x8_8_2x1_intrawave_v1,443.74,1.26531,0.0
gfx950,256,224,4096,512,ck,11,2,4.8073,a8w8_blockscale_bpreshuffle_1x128x128_256x32x128x256_16x16_16x16_16x16x1_16x16x1_1x32x1x8_8_2x1_intrawave_v1,195.44,0.84181,0.0
gfx950,256,224,4096,3072,ck,17,3,11.8189,a8w8_blockscale_bpreshuffle_1x128x128_256x64x64x256_16x16_16x16_16x16x1_16x16x1_1x32x1x8_8_2x1_intrawave_v1,476.96,1.27813,0.0
gfx950,256,240,4096,512,ck,11,1,4.7521,a8w8_blockscale_bpreshuffle_1x128x128_256x32x128x256_16x16_16x16_16x16x1_16x16x1_1x32x1x8_8_2x1_intrawave_v1,211.83,0.8809,0.0
gfx950,256,240,4096,3072,ck,17,1,11.8801,a8w8_blockscale_bpreshuffle_1x128x128_256x64x64x256_16x16_16x16_16x16x1_16x16x1_1x32x1x8_8_2x1_intrawave_v1,508.4,1.28671,0.0
gfx950,256,256,4096,512,ck,11,2,4.7337,a8w8_blockscale_bpreshuffle_1x128x128_256x32x128x256_16x16_16x16_16x16x1_16x16x1_1x32x1x8_8_2x1_intrawave_v1,226.83,0.91374,0.0
gfx950,256,256,4096,3072,ck,17,2,11.5786,a8w8_blockscale_bpreshuffle_1x128x128_256x64x64x256_16x16_16x16_16x16x1_16x16x1_1x32x1x8_8_2x1_intrawave_v1,556.41,1.33578,0.0
gfx950,256,288,4096,512,ck,12,2,5.7243,a8w8_blockscale_bpreshuffle_1x128x128_256x32x64x256_16x16_16x16_16x16x1_16x16x1_1x32x1x8_8_2x1_intrawave_v1,211.02,0.80427,0.0
gfx950,256,288,4096,3072,asm,8,1,14.4923,_ZN5aiter42fp8gemm_bf16_blockscale_BpreShuffle_48x128E,500.11,1.09209,0.0
gfx950,256,320,4096,512,ck,12,3,5.7755,a8w8_blockscale_bpreshuffle_1x128x128_256x32x64x256_16x16_16x16_16x16x1_16x16x1_1x32x1x8_8_2x1_intrawave_v1,232.39,0.84537,0.0
gfx950,256,320,4096,3072,asm,8,1,14.6266,_ZN5aiter42fp8gemm_bf16_blockscale_BpreShuffle_48x128E,550.58,1.10671,0.0
gfx950,256,352,4096,512,ck,12,0,5.8203,a8w8_blockscale_bpreshuffle_1x128x128_256x32x64x256_16x16_16x16_16x16x1_16x16x1_1x32x1x8_8_2x1_intrawave_v1,253.66,0.88672,0.0
gfx950,256,352,4096,3072,asm,8,1,14.722,_ZN5aiter42fp8gemm_bf16_blockscale_BpreShuffle_48x128E,601.71,1.12402,0.0
gfx950,256,384,4096,512,ck,12,0,5.8685,a8w8_blockscale_bpreshuffle_1x128x128_256x32x64x256_16x16_16x16_16x16x1_16x16x1_1x32x1x8_8_2x1_intrawave_v1,274.45,0.9269,0.0
gfx950,256,384,4096,3072,asm,8,1,14.8001,_ZN5aiter42fp8gemm_bf16_blockscale_BpreShuffle_48x128E,652.95,1.14244,0.0
gfx950,256,416,4096,512,ck,7,0,6.0603,a8w8_blockscale_bpreshuffle_1x128x128_256x16x64x256_16x16_16x16_16x16x1_16x16x1_1x16x1x16_4_1x1_intrawave_v1,287.91,0.94352,0.0
gfx950,256,416,4096,3072,asm,16,1,15.6767,_ZN5aiter42fp8gemm_bf16_blockscale_BpreShuffle_64x128E,667.81,1.10155,0.0
gfx950,256,448,4096,512,ck,15,0,6.0223,a8w8_blockscale_bpreshuffle_1x128x128_256x64x64x128_16x16_16x16_8x32x1_8x32x1_1x32x1x8_8_2x1_intrawave_v1,312.02,0.99572,0.0001
gfx950,256,448,4096,3072,asm,16,1,15.7201,_ZN5aiter42fp8gemm_bf16_blockscale_BpreShuffle_64x128E,717.19,1.12144,0.0
gfx950,256,480,4096,512,ck,15,1,6.0166,a8w8_blockscale_bpreshuffle_1x128x128_256x64x64x128_16x16_16x16_8x32x1_8x32x1_1x32x1x8_8_2x1_intrawave_v1,334.62,1.04296,0.0122
gfx950,256,480,4096,3072,asm,16,1,15.7477,_ZN5aiter42fp8gemm_bf16_blockscale_BpreShuffle_64x128E,767.07,1.14237,0.0
gfx950,256,512,4096,512,ck,9,2,6.0597,a8w8_blockscale_bpreshuffle_1x128x128_256x32x128x128_16x16_16x16_8x32x1_8x32x1_1x32x1x8_8_2x1_intrawave_v1,354.39,1.08151,0.0
gfx950,256,512,4096,3072,asm,16,1,15.937,_ZN5aiter42fp8gemm_bf16_blockscale_BpreShuffle_64x128E,808.49,1.15141,0.0
gfx950,256,544,4096,512,ck,11,2,6.3309,a8w8_blockscale_bpreshuffle_1x128x128_256x32x128x256_16x16_16x16_16x16x1_16x16x1_1x32x1x8_8_2x1_intrawave_v1,360.41,1.07917,0.0
gfx950,256,544,4096,3072,asm,24,1,17.1008,_ZN5aiter42fp8gemm_bf16_blockscale_BpreShuffle_80x128E,800.56,1.09413,0.0
gfx950,256,576,4096,512,ck,9,3,6.3106,a8w8_blockscale_bpreshuffle_1x128x128_256x32x128x128_16x16_16x16_8x32x1_8x32x1_1x32x1x8_8_2x1_intrawave_v1,382.84,1.12678,0.0
gfx950,256,576,4096,3072,asm,24,1,17.4405,_ZN5aiter42fp8gemm_bf16_blockscale_BpreShuffle_80x128E,831.14,1.09349,0.0
gfx950,256,608,4096,512,ck,9,3,6.3107,a8w8_blockscale_bpreshuffle_1x128x128_256x32x128x128_16x16_16x16_8x32x1_8x32x1_1x32x1x8_8_2x1_intrawave_v1,404.1,1.1709,0.0
gfx950,256,608,4096,3072,asm,24,1,17.2655,_ZN5aiter42fp8gemm_bf16_blockscale_BpreShuffle_80x128E,886.21,1.12545,0.0
gfx950,256,640,4096,512,ck,12,1,6.5354,a8w8_blockscale_bpreshuffle_1x128x128_256x32x64x256_16x16_16x16_16x16x1_16x16x1_1x32x1x8_8_2x1_intrawave_v1,410.74,1.17326,0.0
gfx950,256,640,4096,3072,asm,24,1,17.8108,_ZN5aiter42fp8gemm_bf16_blockscale_BpreShuffle_80x128E,904.29,1.11123,0.0
gfx950,256,672,4096,512,ck,9,2,6.5833,a8w8_blockscale_bpreshuffle_1x128x128_256x32x128x128_16x16_16x16_8x32x1_8x32x1_1x32x1x8_8_2x1_intrawave_v1,428.14,1.20703,0.0
gfx950,256,672,4096,3072,asm,32,1,19.4713,_ZN5aiter42fp8gemm_bf16_blockscale_BpreShuffle_96x128E,868.53,1.03498,0.0
gfx950,256,704,4096,512,ck,11,2,6.711,a8w8_blockscale_bpreshuffle_1x128x128_256x32x128x256_16x16_16x16_16x16x1_16x16x1_1x32x1x8_8_2x1_intrawave_v1,439.99,1.22557,0.0
gfx950,256,704,4096,3072,asm,32,1,19.1316,_ZN5aiter42fp8gemm_bf16_blockscale_BpreShuffle_96x128E,926.05,1.07219,0.0
gfx950,256,736,4096,512,ck,11,2,7.0987,a8w8_blockscale_bpreshuffle_1x128x128_256x32x128x256_16x16_16x16_16x16x1_16x16x1_1x32x1x8_8_2x1_intrawave_v1,434.87,1.19787,0.0
gfx950,256,736,4096,3072,asm,32,1,19.2547,_ZN5aiter42fp8gemm_bf16_blockscale_BpreShuffle_96x128E,961.95,1.08406,0.0
gfx950,256,768,4096,512,ck,9,0,6.8799,a8w8_blockscale_bpreshuffle_1x128x128_256x32x128x128_16x16_16x16_8x32x1_8x32x1_1x32x1x8_8_2x1_intrawave_v1,468.21,1.27645,0.0
gfx950,256,768,4096,3072,asm,32,1,19.3192,_ZN5aiter42fp8gemm_bf16_blockscale_BpreShuffle_96x128E,1000.42,1.0991,0.0
gfx950,256,800,4096,512,ck,9,3,8.1419,a8w8_blockscale_bpreshuffle_1x128x128_256x32x128x128_16x16_16x16_8x32x1_8x32x1_1x32x1x8_8_2x1_intrawave_v1,412.12,1.11281,0.0
gfx950,256,800,4096,3072,asm,40,1,23.1091,_ZN5aiter43fp8gemm_bf16_blockscale_BpreShuffle_128x128E,871.2,0.93444,0.0
gfx950,256,832,4096,512,ck,16,0,8.2291,a8w8_blockscale_bpreshuffle_1x128x128_256x64x128x256_16x16_16x16_16x16x1_16x16x1_1x32x1x8_8_2x1_intrawave_v1,424.06,1.13486,0.0
gfx950,256,832,4096,3072,ck,14,2,22.6787,a8w8_blockscale_bpreshuffle_1x128x128_256x64x128x128_16x16_16x16_8x32x1_8x32x1_1x32x1x8_8_2x1_intrawave_v1,923.24,0.96807,0.0001
gfx950,256,864,4096,512,ck,14,2,8.1323,a8w8_blockscale_bpreshuffle_1x128x128_256x64x128x128_16x16_16x16_8x32x1_8x32x1_1x32x1x8_8_2x1_intrawave_v1,445.62,1.18262,0.0
gfx950,256,864,4096,3072,ck,14,3,23.4387,a8w8_blockscale_bpreshuffle_1x128x128_256x64x128x128_16x16_16x16_8x32x1_8x32x1_1x32x1x8_8_2x1_intrawave_v1,927.67,0.95206,0.0001
gfx950,256,896,4096,512,ck,12,1,8.2695,a8w8_blockscale_bpreshuffle_1x128x128_256x32x64x256_16x16_16x16_16x16x1_16x16x1_1x32x1x8_8_2x1_intrawave_v1,454.45,1.19668,0.0
gfx950,256,896,4096,3072,ck,14,1,23.3659,a8w8_blockscale_bpreshuffle_1x128x128_256x64x128x128_16x16_16x16_8x32x1_8x32x1_1x32x1x8_8_2x1_intrawave_v1,965.02,0.97045,0.0001
gfx950,256,928,4096,512,ck,16,2,8.5579,a8w8_blockscale_bpreshuffle_1x128x128_256x64x128x256_16x16_16x16_16x16x1_16x16x1_1x32x1x8_8_2x1_intrawave_v1,454.82,1.1889,0.0
gfx950,256,928,4096,3072,asm,40,1,23.5093,_ZN5aiter43fp8gemm_bf16_blockscale_BpreShuffle_128x128E,993.39,0.97986,0.0
gfx950,256,960,4096,512,ck,16,1,8.4661,a8w8_blockscale_bpreshuffle_1x128x128_256x64x128x256_16x16_16x16_16x16x1_16x16x1_1x32x1x8_8_2x1_intrawave_v1,475.61,1.23469,0.0
gfx950,256,960,4096,3072,ck,14,3,23.7112,a8w8_blockscale_bpreshuffle_1x128x128_256x64x128x128_16x16_16x16_8x32x1_8x32x1_1x32x1x8_8_2x1_intrawave_v1,1018.89,0.98672,0.0001
gfx950,256,992,4096,512,ck,16,2,8.7551,a8w8_blockscale_bpreshuffle_1x128x128_256x64x128x256_16x16_16x16_16x16x1_16x16x1_1x32x1x8_8_2x1_intrawave_v1,475.24,1.22574,0.0
gfx950,256,992,4096,3072,asm,40,1,23.5538,_ZN5aiter43fp8gemm_bf16_blockscale_BpreShuffle_128x128E,1059.89,1.00862,0.0
gfx950,256,1024,4096,512,ck,16,3,8.7835,a8w8_blockscale_bpreshuffle_1x128x128_256x64x128x256_16x16_16x16_16x16x1_16x16x1_1x32x1x8_8_2x1_intrawave_v1,488.98,1.25349,0.0
gfx950,256,1024,4096,3072,asm,40,1,23.8252,_ZN5aiter43fp8gemm_bf16_blockscale_BpreShuffle_128x128E,1081.62,1.01226,0.0
gfx950,256,1088,4096,512,ck,11,3,10.1949,a8w8_blockscale_bpreshuffle_1x128x128_256x32x128x256_16x16_16x16_16x16x1_16x16x1_1x32x1x8_8_2x1_intrawave_v1,447.62,1.1346,0.0
gfx950,256,1088,4096,3072,ck,14,1,29.8181,a8w8_blockscale_bpreshuffle_1x128x128_256x64x128x128_16x16_16x16_8x32x1_8x32x1_1x32x1x8_8_2x1_intrawave_v1,918.25,0.83299,0.0002
gfx950,256,1152,4096,512,ck,11,1,10.1493,a8w8_blockscale_bpreshuffle_1x128x128_256x32x128x256_16x16_16x16_16x16x1_16x16x1_1x32x1x8_8_2x1_intrawave_v1,476.08,1.19458,0.0
gfx950,256,1152,4096,3072,ck,14,2,29.8302,a8w8_blockscale_bpreshuffle_1x128x128_256x64x128x128_16x16_16x16_8x32x1_8x32x1_1x32x1x8_8_2x1_intrawave_v1,971.87,0.85682,0.0002
gfx950,256,1216,4096,512,ck,9,0,10.3706,a8w8_blockscale_bpreshuffle_1x128x128_256x32x128x128_16x16_16x16_8x32x1_8x32x1_1x32x1x8_8_2x1_intrawave_v1,491.8,1.2228,0.0
gfx950,256,1216,4096,3072,ck,14,2,29.9089,a8w8_blockscale_bpreshuffle_1x128x128_256x64x128x128_16x16_16x16_8x32x1_8x32x1_1x32x1x8_8_2x1_intrawave_v1,1023.16,0.87867,0.0001
gfx950,256,1280,4096,512,ck,11,1,10.1941,a8w8_blockscale_bpreshuffle_1x128x128_256x32x128x256_16x16_16x16_16x16x1_16x16x1_1x32x1x8_8_2x1_intrawave_v1,526.65,1.29862,0.0
gfx950,256,1280,4096,3072,ck,14,0,30.2437,a8w8_blockscale_bpreshuffle_1x128x128_256x64x128x128_16x16_16x16_8x32x1_8x32x1_1x32x1x8_8_2x1_intrawave_v1,1065.09,0.89278,0.0002
gfx950,256,1344,4096,512,ck,11,3,10.9237,a8w8_blockscale_bpreshuffle_1x128x128_256x32x128x256_16x16_16x16_16x16x1_16x16x1_1x32x1x8_8_2x1_intrawave_v1,516.05,1.26288,0.0
gfx950,256,1344,4096,3072,ck,14,0,31.1831,a8w8_blockscale_bpreshuffle_1x128x128_256x64x128x128_16x16_16x16_8x32x1_8x32x1_1x32x1x8_8_2x1_intrawave_v1,1084.65,0.889,0.0001
gfx950,256,1408,4096,512,ck,14,3,11.0822,a8w8_blockscale_bpreshuffle_1x128x128_256x64x128x128_16x16_16x16_8x32x1_8x32x1_1x32x1x8_8_2x1_intrawave_v1,532.89,1.29508,0.0001
gfx950,256,1408,4096,3072,ck,14,1,31.7025,a8w8_blockscale_bpreshuffle_1x128x128_256x64x128x128_16x16_16x16_8x32x1_8x32x1_1x32x1x8_8_2x1_intrawave_v1,1117.69,0.89717,0.0002
gfx950,256,1472,4096,512,ck,14,1,11.2016,a8w8_blockscale_bpreshuffle_1x128x128_256x64x128x128_16x16_16x16_8x32x1_8x32x1_1x32x1x8_8_2x1_intrawave_v1,551.17,1.33101,0.0001
gfx950,256,1472,4096,3072,ck,14,1,31.8961,a8w8_blockscale_bpreshuffle_1x128x128_256x64x128x128_16x16_16x16_8x32x1_8x32x1_1x32x1x8_8_2x1_intrawave_v1,1161.4,0.91433,0.0002
gfx950,256,1536,4096,512,ck,14,3,11.3212,a8w8_blockscale_bpreshuffle_1x128x128_256x64x128x128_16x16_16x16_8x32x1_8x32x1_1x32x1x8_8_2x1_intrawave_v1,569.06,1.36615,0.0002
gfx950,256,1536,4096,3072,ck,13,1,32.3752,a8w8_blockscale_bpreshuffle_1x128x128_256x64x256x128_16x16_16x16_8x32x1_8x32x1_1x32x1x8_8_2x1_intrawave_v1,1193.96,0.92307,0.0
gfx950,256,1600,4096,512,ck,11,1,12.1644,a8w8_blockscale_bpreshuffle_1x128x128_256x32x128x256_16x16_16x16_16x16x1_16x16x1_1x32x1x8_8_2x1_intrawave_v1,551.68,1.31725,0.0
gfx950,256,1600,4096,3072,ck,13,3,33.1053,a8w8_blockscale_bpreshuffle_1x128x128_256x64x256x128_16x16_16x16_8x32x1_8x32x1_1x32x1x8_8_2x1_intrawave_v1,1216.28,0.92448,0.0
gfx950,256,1664,4096,512,ck,11,1,12.2937,a8w8_blockscale_bpreshuffle_1x128x128_256x32x128x256_16x16_16x16_16x16x1_16x16x1_1x32x1x8_8_2x1_intrawave_v1,567.72,1.34871,0.0
gfx950,256,1664,4096,3072,ck,13,3,33.6312,a8w8_blockscale_bpreshuffle_1x128x128_256x64x256x128_16x16_16x16_8x32x1_8x32x1_1x32x1x8_8_2x1_intrawave_v1,1245.15,0.93146,0.0
gfx950,256,1728,4096,512,ck,11,1,12.4573,a8w8_blockscale_bpreshuffle_1x128x128_256x32x128x256_16x16_16x16_16x16x1_16x16x1_1x32x1x8_8_2x1_intrawave_v1,581.81,1.37571,0.0
gfx950,256,1728,4096,3072,ck,13,3,33.2495,a8w8_blockscale_bpreshuffle_1x128x128_256x64x256x128_16x16_16x16_8x32x1_8x32x1_1x32x1x8_8_2x1_intrawave_v1,1307.89,0.96384,0.0
gfx950,256,1792,4096,512,ck,11,3,12.5727,a8w8_blockscale_bpreshuffle_1x128x128_256x32x128x256_16x16_16x16_16x16x1_16x16x1_1x32x1x8_8_2x1_intrawave_v1,597.82,1.40739,0.0
gfx950,256,1792,4096,3072,ck,13,3,33.6704,a8w8_blockscale_bpreshuffle_1x128x128_256x64x256x128_16x16_16x16_8x32x1_8x32x1_1x32x1x8_8_2x1_intrawave_v1,1339.37,0.9732,0.0
gfx950,256,1856,4096,512,ck,11,0,13.3033,a8w8_blockscale_bpreshuffle_1x128x128_256x32x128x256_16x16_16x16_16x16x1_16x16x1_1x32x1x8_8_2x1_intrawave_v1,585.17,1.37197,0.0
gfx950,256,1856,4096,3072,ck,13,2,35.6071,a8w8_blockscale_bpreshuffle_1x128x128_256x64x256x128_16x16_16x16_8x32x1_8x32x1_1x32x1x8_8_2x1_intrawave_v1,1311.75,0.94051,0.0
gfx950,256,1920,4096,512,ck,11,3,13.6155,a8w8_blockscale_bpreshuffle_1x128x128_256x32x128x256_16x16_16x16_16x16x1_16x16x1_1x32x1x8_8_2x1_intrawave_v1,591.46,1.38143,0.0
gfx950,256,1920,4096,3072,ck,13,3,37.0853,a8w8_blockscale_bpreshuffle_1x128x128_256x64x256x128_16x16_16x16_8x32x1_8x32x1_1x32x1x8_8_2x1_intrawave_v1,1302.9,0.92246,0.0
gfx950,256,1984,4096,512,ck,16,0,13.8619,a8w8_blockscale_bpreshuffle_1x128x128_256x64x128x256_16x16_16x16_16x16x1_16x16x1_1x32x1x8_8_2x1_intrawave_v1,600.31,1.39706,0.0
gfx950,256,1984,4096,3072,ck,13,3,38.9825,a8w8_blockscale_bpreshuffle_1x128x128_256x64x256x128_16x16_16x16_8x32x1_8x32x1_1x32x1x8_8_2x1_intrawave_v1,1280.81,0.89606,0.0
gfx950,256,2048,4096,512,ck,9,2,14.4383,a8w8_blockscale_bpreshuffle_1x128x128_256x32x128x128_16x16_16x16_8x32x1_8x32x1_1x32x1x8_8_2x1_intrawave_v1,594.94,1.37987,0.0
gfx950,256,2048,4096,3072,ck,13,1,39.4437,a8w8_blockscale_bpreshuffle_1x128x128_256x64x256x128_16x16_16x16_8x32x1_8x32x1_1x32x1x8_8_2x1_intrawave_v1,1306.66,0.90386,0.0
gfx950,256,4096,4096,512,ck,16,3,23.585,a8w8_blockscale_bpreshuffle_1x128x128_256x64x128x256_16x16_16x16_16x16x1_16x16x1_1x32x1x8_8_2x1_intrawave_v1,728.42,1.60054,0.0
gfx950,256,4096,4096,3072,ck,13,2,71.402,a8w8_blockscale_bpreshuffle_1x128x128_256x64x256x128_16x16_16x16_8x32x1_8x32x1_1x32x1x8_8_2x1_intrawave_v1,1443.65,0.82239,0.0
gfx950,256,8192,4096,512,ck,16,1,41.9105,a8w8_blockscale_bpreshuffle_1x128x128_256x64x128x256_16x16_16x16_16x16x1_16x16x1_1x32x1x8_8_2x1_intrawave_v1,819.84,1.75136,0.0
gfx950,256,8192,4096,3072,ck,13,2,132.4593,a8w8_blockscale_bpreshuffle_1x128x128_256x64x256x128_16x16_16x16_8x32x1_8x32x1_1x32x1x8_8_2x1_intrawave_v1,1556.39,0.79162,0.0
gfx950,256,16384,4096,512,ck,16,2,78.2029,a8w8_blockscale_bpreshuffle_1x128x128_256x64x128x256_16x16_16x16_16x16x1_16x16x1_1x32x1x8_8_2x1_intrawave_v1,878.73,1.85036,0.0
gfx950,256,16384,4096,3072,ck,13,3,248.0474,a8w8_blockscale_bpreshuffle_1x128x128_256x64x256x128_16x16_16x16_8x32x1_8x32x1_1x32x1x8_8_2x1_intrawave_v1,1662.25,0.79474,0.0
gfx950,256,32768,4096,512,ck,16,2,143.2204,a8w8_blockscale_bpreshuffle_1x128x128_256x64x128x256_16x16_16x16_16x16x1_16x16x1_1x32x1x8_8_2x1_intrawave_v1,959.63,2.00607,0.0
gfx950,256,32768,4096,3072,ck,13,3,481.3425,a8w8_blockscale_bpreshuffle_1x128x128_256x64x256x128_16x16_16x16_8x32x1_8x32x1_1x32x1x8_8_2x1_intrawave_v1,1713.2,0.79295,0.0
gfx950,256,16,4608,7168,asm,22,7,10.2718,_ZN5aiter42fp8gemm_bf16_blockscale_BpreShuffle_64x128E,102.9,3.24113,0.0059
gfx950,256,32,4608,7168,asm,29,6,11.6205,_ZN5aiter42fp8gemm_bf16_blockscale_BpreShuffle_80x128E,181.91,2.88752,0.004
gfx950,256,48,4608,7168,asm,13,6,13.7652,_ZN5aiter42fp8gemm_bf16_blockscale_BpreShuffle_48x128E,230.36,2.45667,0.0037
gfx950,256,64,4608,7168,asm,29,6,12.857,_ZN5aiter42fp8gemm_bf16_blockscale_BpreShuffle_80x128E,328.84,2.6506,0.0036
gfx950,256,80,4608,7168,asm,37,6,14.7725,_ZN5aiter42fp8gemm_bf16_blockscale_BpreShuffle_96x128E,357.75,2.32465,0.0047
gfx950,256,96,4608,7168,asm,37,6,15.4561,_ZN5aiter42fp8gemm_bf16_blockscale_BpreShuffle_96x128E,410.31,2.23879,0.0039
gfx950,256,112,4608,7168,asm,18,3,17.8925,_ZN5aiter42fp8gemm_bf16_blockscale_BpreShuffle_64x128E,413.51,1.94859,0.0004
gfx950,256,128,4608,7168,asm,18,3,18.0058,_ZN5aiter42fp8gemm_bf16_blockscale_BpreShuffle_64x128E,469.61,1.95089,0.0004
gfx950,256,144,4608,7168,asm,26,3,20.2285,_ZN5aiter42fp8gemm_bf16_blockscale_BpreShuffle_80x128E,470.26,1.74948,0.0004
gfx950,256,160,4608,7168,asm,26,3,20.8025,_ZN5aiter42fp8gemm_bf16_blockscale_BpreShuffle_80x128E,508.09,1.71381,0.0004
gfx950,256,176,4608,7168,asm,34,3,21.847,_ZN5aiter42fp8gemm_bf16_blockscale_BpreShuffle_96x128E,532.18,1.64387,0.0004
gfx950,256,192,4608,7168,ck,17,3,21.9076,a8w8_blockscale_bpreshuffle_1x128x128_256x64x64x256_16x16_16x16_16x16x1_16x16x1_1x32x1x8_8_2x1_intrawave_v1,578.96,1.65129,0.0
gfx950,256,208,4608,7168,asm,42,3,23.3806,_ZN5aiter43fp8gemm_bf16_blockscale_BpreShuffle_128x128E,587.69,1.55847,0.0004
gfx950,256,224,4608,7168,ck,11,3,23.044,a8w8_blockscale_bpreshuffle_1x128x128_256x32x128x256_16x16_16x16_16x16x1_16x16x1_1x32x1x8_8_2x1_intrawave_v1,642.14,1.59261,0.0
gfx950,256,240,4608,7168,asm,25,2,25.8285,_ZN5aiter42fp8gemm_bf16_blockscale_BpreShuffle_80x128E,613.84,1.43107,0.0
gfx950,256,256,4608,7168,asm,33,2,26.9625,_ZN5aiter42fp8gemm_bf16_blockscale_BpreShuffle_96x128E,627.22,1.3806,0.0
gfx950,256,288,4608,7168,asm,33,2,27.8307,_ZN5aiter42fp8gemm_bf16_blockscale_BpreShuffle_96x128E,683.61,1.35637,0.0
gfx950,256,320,4608,7168,asm,8,1,29.3886,_ZN5aiter42fp8gemm_bf16_blockscale_BpreShuffle_48x128E,719.3,1.30231,0.0
gfx950,256,352,4608,7168,asm,41,2,30.6762,_ZN5aiter43fp8gemm_bf16_blockscale_BpreShuffle_128x128E,758.02,1.26474,0.0
gfx950,256,384,4608,7168,asm,16,1,30.5188,_ZN5aiter42fp8gemm_bf16_blockscale_BpreShuffle_64x128E,831.2,1.28844,0.0
gfx950,256,416,4608,7168,asm,16,1,30.6272,_ZN5aiter42fp8gemm_bf16_blockscale_BpreShuffle_64x128E,897.28,1.301,0.0
gfx950,256,448,4608,7168,asm,16,1,31.1697,_ZN5aiter42fp8gemm_bf16_blockscale_BpreShuffle_64x128E,949.48,1.29517,0.0
gfx950,256,480,4608,7168,asm,24,1,33.299,_ZN5aiter42fp8gemm_bf16_blockscale_BpreShuffle_80x128E,952.25,1.2281,0.0
gfx950,256,512,4608,7168,asm,24,1,33.577,_ZN5aiter42fp8gemm_bf16_blockscale_BpreShuffle_80x128E,1007.32,1.23355,0.0
gfx950,256,544,4608,7168,asm,24,1,33.9623,_ZN5aiter42fp8gemm_bf16_blockscale_BpreShuffle_80x128E,1058.14,1.23499,0.0
gfx950,256,576,4608,7168,asm,32,1,36.4667,_ZN5aiter42fp8gemm_bf16_blockscale_BpreShuffle_96x128E,1043.44,1.16455,0.0
gfx950,256,608,4608,7168,asm,32,1,39.2737,_ZN5aiter42fp8gemm_bf16_blockscale_BpreShuffle_96x128E,1022.69,1.09467,0.0
gfx950,256,640,4608,7168,asm,32,1,37.7105,_ZN5aiter42fp8gemm_bf16_blockscale_BpreShuffle_96x128E,1121.14,1.15395,0.0
gfx950,256,672,4608,7168,asm,32,1,38.6714,_ZN5aiter42fp8gemm_bf16_blockscale_BpreShuffle_96x128E,1147.94,1.13883,0.0
gfx950,256,704,4608,7168,asm,40,1,45.5781,_ZN5aiter43fp8gemm_bf16_blockscale_BpreShuffle_128x128E,1020.37,0.97776,0.0
gfx950,256,736,4608,7168,asm,40,1,47.3086,_ZN5aiter43fp8gemm_bf16_blockscale_BpreShuffle_128x128E,1027.73,0.95308,0.0
gfx950,256,768,4608,7168,asm,40,1,46.0129,_ZN5aiter43fp8gemm_bf16_blockscale_BpreShuffle_128x128E,1102.61,0.99131,0.0
gfx950,256,800,4608,7168,asm,40,1,47.395,_ZN5aiter43fp8gemm_bf16_blockscale_BpreShuffle_128x128E,1115.06,0.97346,0.0
gfx950,256,832,4608,7168,ck,13,1,48.1976,a8w8_blockscale_bpreshuffle_1x128x128_256x64x256x128_16x16_16x16_8x32x1_8x32x1_1x32x1x8_8_2x1_intrawave_v1,1140.35,0.96813,0.0
gfx950,256,864,4608,7168,asm,40,1,49.4742,_ZN5aiter43fp8gemm_bf16_blockscale_BpreShuffle_128x128E,1153.65,0.95375,0.0
gfx950,256,896,4608,7168,ck,13,0,49.2493,a8w8_blockscale_bpreshuffle_1x128x128_256x64x256x128_16x16_16x16_8x32x1_8x32x1_1x32x1x8_8_2x1_intrawave_v1,1201.84,0.96875,0.0
gfx950,256,928,4608,7168,ck,14,2,61.0416,a8w8_blockscale_bpreshuffle_1x128x128_256x64x128x128_16x16_16x16_8x32x1_8x32x1_1x32x1x8_8_2x1_intrawave_v1,1004.3,0.79019,0.0001
gfx950,256,960,4608,7168,ck,13,2,60.7415,a8w8_blockscale_bpreshuffle_1x128x128_256x64x256x128_16x16_16x16_8x32x1_8x32x1_1x32x1x8_8_2x1_intrawave_v1,1044.06,0.80273,0.0
gfx950,256,992,4608,7168,ck,14,2,64.9887,a8w8_blockscale_bpreshuffle_1x128x128_256x64x128x128_16x16_16x16_8x32x1_8x32x1_1x32x1x8_8_2x1_intrawave_v1,1008.36,0.75833,0.0001
gfx950,256,1024,4608,7168,ck,14,3,64.9234,a8w8_blockscale_bpreshuffle_1x128x128_256x64x128x128_16x16_16x16_8x32x1_8x32x1_1x32x1x8_8_2x1_intrawave_v1,1041.93,0.76717,0.0001
gfx950,256,1088,4608,7168,ck,14,0,62.6762,a8w8_blockscale_bpreshuffle_1x128x128_256x64x128x128_16x16_16x16_8x32x1_8x32x1_1x32x1x8_8_2x1_intrawave_v1,1146.74,0.81141,0.0002
gfx950,256,1152,4608,7168,ck,13,2,63.8589,a8w8_blockscale_bpreshuffle_1x128x128_256x64x256x128_16x16_16x16_8x32x1_8x32x1_1x32x1x8_8_2x1_intrawave_v1,1191.71,0.8128,0.0
gfx950,256,1216,4608,7168,ck,14,3,64.0235,a8w8_blockscale_bpreshuffle_1x128x128_256x64x128x128_16x16_16x16_8x32x1_8x32x1_1x32x1x8_8_2x1_intrawave_v1,1254.68,0.82709,0.0001
gfx950,256,1280,4608,7168,ck,13,3,65.4649,a8w8_blockscale_bpreshuffle_1x128x128_256x64x256x128_16x16_16x16_8x32x1_8x32x1_1x32x1x8_8_2x1_intrawave_v1,1291.64,0.82489,0.0
gfx950,256,1344,4608,7168,ck,14,2,68.5828,a8w8_blockscale_bpreshuffle_1x128x128_256x64x128x128_16x16_16x16_8x32x1_8x32x1_1x32x1x8_8_2x1_intrawave_v1,1294.57,0.80268,0.0002
gfx950,256,1408,4608,7168,ck,13,1,65.8692,a8w8_blockscale_bpreshuffle_1x128x128_256x64x256x128_16x16_16x16_8x32x1_8x32x1_1x32x1x8_8_2x1_intrawave_v1,1412.08,0.85167,0.0
gfx950,256,1472,4608,7168,ck,13,3,69.1204,a8w8_blockscale_bpreshuffle_1x128x128_256x64x256x128_16x16_16x16_8x32x1_8x32x1_1x32x1x8_8_2x1_intrawave_v1,1406.83,0.82678,0.0
gfx950,256,1536,4608,7168,ck,13,3,73.8412,a8w8_blockscale_bpreshuffle_1x128x128_256x64x256x128_16x16_16x16_8x32x1_8x32x1_1x32x1x8_8_2x1_intrawave_v1,1374.15,0.78812,0.0
gfx950,256,1600,4608,7168,ck,13,2,74.9489,a8w8_blockscale_bpreshuffle_1x128x128_256x64x256x128_16x16_16x16_8x32x1_8x32x1_1x32x1x8_8_2x1_intrawave_v1,1410.25,0.79047,0.0
gfx950,256,1664,4608,7168,ck,13,0,76.3776,a8w8_blockscale_bpreshuffle_1x128x128_256x64x256x128_16x16_16x16_8x32x1_8x32x1_1x32x1x8_8_2x1_intrawave_v1,1439.22,0.78941,0.0
gfx950,256,1728,4608,7168,ck,13,1,77.1936,a8w8_blockscale_bpreshuffle_1x128x128_256x64x256x128_16x16_16x16_8x32x1_8x32x1_1x32x1x8_8_2x1_intrawave_v1,1478.78,0.79465,0.0
gfx950,256,1792,4608,7168,ck,13,0,78.3613,a8w8_blockscale_bpreshuffle_1x128x128_256x64x256x128_16x16_16x16_8x32x1_8x32x1_1x32x1x8_8_2x1_intrawave_v1,1510.7,0.79619,0.0
gfx950,256,1856,4608,7168,ck,14,1,99.0642,a8w8_blockscale_bpreshuffle_1x128x128_256x64x128x128_16x16_16x16_8x32x1_8x32x1_1x32x1x8_8_2x1_intrawave_v1,1237.66,0.64038,0.0002
gfx950,256,1920,4608,7168,ck,14,2,99.9722,a8w8_blockscale_bpreshuffle_1x128x128_256x64x128x128_16x16_16x16_8x32x1_8x32x1_1x32x1x8_8_2x1_intrawave_v1,1268.71,0.64505,0.0001
gfx950,256,1984,4608,7168,ck,13,3,101.9007,a8w8_blockscale_bpreshuffle_1x128x128_256x64x256x128_16x16_16x16_8x32x1_8x32x1_1x32x1x8_8_2x1_intrawave_v1,1286.19,0.64314,0.0
gfx950,256,2048,4608,7168,ck,14,2,105.2531,a8w8_blockscale_bpreshuffle_1x128x128_256x64x128x128_16x16_16x16_8x32x1_8x32x1_1x32x1x8_8_2x1_intrawave_v1,1285.39,0.63261,0.0002
gfx950,256,4096,4608,7168,ck,13,2,171.4096,a8w8_blockscale_bpreshuffle_1x128x128_256x64x256x128_16x16_16x16_8x32x1_8x32x1_1x32x1x8_8_2x1_intrawave_v1,1578.58,0.58421,0.0
gfx950,256,8192,4608,7168,ck,13,0,305.5678,a8w8_blockscale_bpreshuffle_1x128x128_256x64x256x128_16x16_16x16_8x32x1_8x32x1_1x32x1x8_8_2x1_intrawave_v1,1771.02,0.54733,0.0
gfx950,256,16384,4608,7168,ck,13,3,574.1814,a8w8_blockscale_bpreshuffle_1x128x128_256x64x256x128_16x16_16x16_8x32x1_8x32x1_1x32x1x8_8_2x1_intrawave_v1,1885.0,0.52504,0.0
gfx950,256,32768,4608,7168,ck,13,2,1114.2846,a8w8_blockscale_bpreshuffle_1x128x128_256x64x256x128_16x16_16x16_8x32x1_8x32x1_1x32x1x8_8_2x1_intrawave_v1,1942.65,0.51145,0.0
gfx950,256,16,7168,2048,ck,7,3,7.2132,a8w8_blockscale_bpreshuffle_1x128x128_256x16x64x256_16x16_16x16_16x16x1_16x16x1_1x16x1x16_4_1x1_intrawave_v1,65.13,2.07151,0.0
gfx950,256,16,7168,2304,ck,7,0,8.067,a8w8_blockscale_bpreshuffle_1x128x128_256x16x64x256_16x16_16x16_16x16x1_16x16x1_1x16x1x16_4_1x1_intrawave_v1,65.51,2.08024,0.0
gfx950,256,32,7168,2048,ck,7,0,7.222,a8w8_blockscale_bpreshuffle_1x128x128_256x16x64x256_16x16_16x16_16x16x1_16x16x1_1x16x1x16_4_1x1_intrawave_v1,130.09,2.10528,0.0
gfx950,256,32,7168,2304,ck,7,3,8.253,a8w8_blockscale_bpreshuffle_1x128x128_256x16x64x256_16x16_16x16_16x16x1_16x16x1_1x16x1x16_4_1x1_intrawave_v1,128.07,2.06562,0.0
gfx950,256,48,7168,2048,ck,6,3,7.9865,a8w8_blockscale_bpreshuffle_1x128x128_256x16x128x256_16x16_16x16_16x16x1_16x16x1_1x16x1x16_8_1x2_intrawave_v1,176.46,1.93658,0.0
gfx950,256,48,7168,2304,ck,7,0,9.4657,a8w8_blockscale_bpreshuffle_1x128x128_256x16x64x256_16x16_16x16_16x16x1_16x16x1_1x16x1x16_4_1x1_intrawave_v1,167.49,1.82911,0.0
gfx950,256,64,7168,2048,ck,6,1,8.335,a8w8_blockscale_bpreshuffle_1x128x128_256x16x128x256_16x16_16x16_16x16x1_16x16x1_1x16x1x16_8_1x2_intrawave_v1,225.44,1.88706,0.0
gfx950,256,64,7168,2304,ck,12,0,9.5781,a8w8_blockscale_bpreshuffle_1x128x128_256x32x64x256_16x16_16x16_16x16x1_16x16x1_1x32x1x8_8_2x1_intrawave_v1,220.7,1.83544,0.0
gfx950,256,80,7168,2048,ck,11,1,9.4105,a8w8_blockscale_bpreshuffle_1x128x128_256x32x128x256_16x16_16x16_16x16x1_16x16x1_1x32x1x8_8_2x1_intrawave_v1,249.59,1.69925,0.0
gfx950,256,80,7168,2304,ck,17,2,9.9321,a8w8_blockscale_bpreshuffle_1x128x128_256x64x64x256_16x16_16x16_16x16x1_16x16x1_1x32x1x8_8_2x1_intrawave_v1,266.05,1.79683,0.0
gfx950,256,96,7168,2048,ck,11,2,9.625,a8w8_blockscale_bpreshuffle_1x128x128_256x32x128x256_16x16_16x16_16x16x1_16x16x1_1x32x1x8_8_2x1_intrawave_v1,292.84,1.68862,0.0
gfx950,256,96,7168,2304,ck,17,1,9.9563,a8w8_blockscale_bpreshuffle_1x128x128_256x64x64x256_16x16_16x16_16x16x1_16x16x1_1x32x1x8_8_2x1_intrawave_v1,318.48,1.8192,0.0
gfx950,256,112,7168,2048,ck,11,1,9.4953,a8w8_blockscale_bpreshuffle_1x128x128_256x32x128x256_16x16_16x16_16x16x1_16x16x1_1x32x1x8_8_2x1_intrawave_v1,346.31,1.73929,0.0
gfx950,256,112,7168,2304,ck,17,0,10.0093,a8w8_blockscale_bpreshuffle_1x128x128_256x64x64x256_16x16_16x16_16x16x1_16x16x1_1x32x1x8_8_2x1_intrawave_v1,369.59,1.83617,0.0
gfx950,256,128,7168,2048,ck,11,0,9.471,a8w8_blockscale_bpreshuffle_1x128x128_256x32x128x256_16x16_16x16_16x16x1_16x16x1_1x32x1x8_8_2x1_intrawave_v1,396.8,1.77143,0.0
gfx950,256,128,7168,2304,ck,17,3,10.0901,a8w8_blockscale_bpreshuffle_1x128x128_256x64x64x256_16x16_16x16_16x16x1_16x16x1_1x32x1x8_8_2x1_intrawave_v1,419.01,1.84785,0.0
gfx950,256,144,7168,2048,asm,8,1,11.1728,_ZN5aiter42fp8gemm_bf16_blockscale_BpreShuffle_48x128E,378.41,1.52508,0.0
gfx950,256,144,7168,2304,asm,8,1,12.1844,_ZN5aiter42fp8gemm_bf16_blockscale_BpreShuffle_48x128E,390.36,1.55209,0.0
gfx950,256,160,7168,2048,asm,8,1,11.2214,_ZN5aiter42fp8gemm_bf16_blockscale_BpreShuffle_48x128E,418.63,1.54183,0.0
gfx950,256,160,7168,2304,asm,8,1,12.1653,_ZN5aiter42fp8gemm_bf16_blockscale_BpreShuffle_48x128E,434.42,1.57641,0.0
gfx950,256,176,7168,2048,asm,8,1,11.5129,_ZN5aiter42fp8gemm_bf16_blockscale_BpreShuffle_48x128E,448.83,1.52556,0.0
gfx950,256,176,7168,2304,asm,8,1,12.5851,_ZN5aiter42fp8gemm_bf16_blockscale_BpreShuffle_48x128E,461.92,1.54498,0.0
gfx950,256,192,7168,2048,asm,8,1,11.6453,_ZN5aiter42fp8gemm_bf16_blockscale_BpreShuffle_48x128E,484.07,1.53073,0.0
gfx950,256,192,7168,2304,asm,8,1,12.6184,_ZN5aiter42fp8gemm_bf16_blockscale_BpreShuffle_48x128E,502.58,1.562,0.0
gfx950,256,208,7168,2048,asm,16,1,12.0625,_ZN5aiter42fp8gemm_bf16_blockscale_BpreShuffle_64x128E,506.27,1.49952,0.0
gfx950,256,208,7168,2304,asm,16,1,13.1559,_ZN5aiter42fp8gemm_bf16_blockscale_BpreShuffle_64x128E,522.22,1.51842,0.0
gfx950,256,224,7168,2048,ck,17,0,12.3478,a8w8_blockscale_bpreshuffle_1x128x128_256x64x64x256_16x16_16x16_16x16x1_16x16x1_1x32x1x8_8_2x1_intrawave_v1,532.62,1.4861,0.0
gfx950,256,224,7168,2304,asm,16,1,13.3633,_ZN5aiter42fp8gemm_bf16_blockscale_BpreShuffle_64x128E,553.66,1.51478,0.0
gfx950,256,240,7168,2048,asm,16,1,12.4016,_ZN5aiter42fp8gemm_bf16_blockscale_BpreShuffle_64x128E,568.19,1.50079,0.0
gfx950,256,240,7168,2304,asm,16,1,13.2042,_ZN5aiter42fp8gemm_bf16_blockscale_BpreShuffle_64x128E,600.36,1.55319,0.0
gfx950,256,256,7168,2048,asm,16,1,12.2335,_ZN5aiter42fp8gemm_bf16_blockscale_BpreShuffle_64x128E,614.39,1.54284,0.0
gfx950,256,256,7168,2304,asm,16,1,13.6382,_ZN5aiter42fp8gemm_bf16_blockscale_BpreShuffle_64x128E,620.0,1.52329,0.0
gfx950,256,288,7168,2048,asm,24,1,13.7055,_ZN5aiter42fp8gemm_bf16_blockscale_BpreShuffle_80x128E,616.96,1.41539,0.0
gfx950,256,288,7168,2304,asm,24,1,14.4966,_ZN5aiter42fp8gemm_bf16_blockscale_BpreShuffle_80x128E,656.2,1.46982,0.0
gfx950,256,320,7168,2048,asm,24,1,13.4623,_ZN5aiter42fp8gemm_bf16_blockscale_BpreShuffle_80x128E,697.89,1.47991,0.0
gfx950,256,320,7168,2304,asm,24,1,14.5582,_ZN5aiter42fp8gemm_bf16_blockscale_BpreShuffle_80x128E,726.03,1.50018,0.0
gfx950,256,352,7168,2048,asm,32,1,14.96,_ZN5aiter42fp8gemm_bf16_blockscale_BpreShuffle_96x128E,690.83,1.36679,0.0
gfx950,256,352,7168,2304,asm,32,1,15.663,_ZN5aiter42fp8gemm_bf16_blockscale_BpreShuffle_96x128E,742.3,1.42836,0.0
gfx950,256,384,7168,2048,asm,32,1,14.6886,_ZN5aiter42fp8gemm_bf16_blockscale_BpreShuffle_96x128E,767.55,1.42774,0.0
gfx950,256,384,7168,2304,asm,32,1,16.4306,_ZN5aiter42fp8gemm_bf16_blockscale_BpreShuffle_96x128E,771.95,1.39404,0.0
gfx950,256,416,7168,2048,ck,14,3,16.8019,a8w8_blockscale_bpreshuffle_1x128x128_256x64x128x128_16x16_16x16_8x32x1_8x32x1_1x32x1x8_8_2x1_intrawave_v1,726.93,1.27937,0.0001
gfx950,256,416,7168,2304,ck,14,0,18.9316,a8w8_blockscale_bpreshuffle_1x128x128_256x64x128x128_16x16_16x16_8x32x1_8x32x1_1x32x1x8_8_2x1_intrawave_v1,725.8,1.238,0.0
gfx950,256,448,7168,2048,ck,14,0,16.6168,a8w8_blockscale_bpreshuffle_1x128x128_256x64x128x128_16x16_16x16_8x32x1_8x32x1_1x32x1x8_8_2x1_intrawave_v1,791.57,1.32517,0.0001
gfx950,256,448,7168,2304,ck,14,2,18.9489,a8w8_blockscale_bpreshuffle_1x128x128_256x64x128x128_16x16_16x16_8x32x1_8x32x1_1x32x1x8_8_2x1_intrawave_v1,780.92,1.26497,0.0
gfx950,256,480,7168,2048,ck,14,2,17.1416,a8w8_blockscale_bpreshuffle_1x128x128_256x64x128x128_16x16_16x16_8x32x1_8x32x1_1x32x1x8_8_2x1_intrawave_v1,822.14,1.31519,0.0001
gfx950,256,480,7168,2304,asm,40,1,19.1807,_ZN5aiter43fp8gemm_bf16_blockscale_BpreShuffle_128x128E,826.58,1.27744,0.0
gfx950,256,512,7168,2048,ck,14,0,17.088,a8w8_blockscale_bpreshuffle_1x128x128_256x64x128x128_16x16_16x16_8x32x1_8x32x1_1x32x1x8_8_2x1_intrawave_v1,879.7,1.34999,0.0002
gfx950,256,512,7168,2304,ck,14,0,19.4496,a8w8_blockscale_bpreshuffle_1x128x128_256x64x128x128_16x16_16x16_8x32x1_8x32x1_1x32x1x8_8_2x1_intrawave_v1,869.5,1.28716,0.0
gfx950,256,544,7168,2048,ck,14,1,17.8708,a8w8_blockscale_bpreshuffle_1x128x128_256x64x128x128_16x16_16x16_8x32x1_8x32x1_1x32x1x8_8_2x1_intrawave_v1,893.74,1.3202,0.0001
gfx950,256,544,7168,2304,ck,14,1,20.1182,a8w8_blockscale_bpreshuffle_1x128x128_256x64x128x128_16x16_16x16_8x32x1_8x32x1_1x32x1x8_8_2x1_intrawave_v1,893.14,1.27085,0.0
gfx950,256,576,7168,2048,ck,14,3,17.8731,a8w8_blockscale_bpreshuffle_1x128x128_256x64x128x128_16x16_16x16_8x32x1_8x32x1_1x32x1x8_8_2x1_intrawave_v1,946.19,1.34936,0.0002
gfx950,256,576,7168,2304,ck,14,2,20.0657,a8w8_blockscale_bpreshuffle_1x128x128_256x64x128x128_16x16_16x16_8x32x1_8x32x1_1x32x1x8_8_2x1_intrawave_v1,948.15,1.30071,0.0
gfx950,256,608,7168,2048,ck,14,0,21.9319,a8w8_blockscale_bpreshuffle_1x128x128_256x64x128x128_16x16_16x16_8x32x1_8x32x1_1x32x1x8_8_2x1_intrawave_v1,813.93,1.12355,0.0001
gfx950,256,608,7168,2304,ck,14,0,24.7891,a8w8_blockscale_bpreshuffle_1x128x128_256x64x128x128_16x16_16x16_8x32x1_8x32x1_1x32x1x8_8_2x1_intrawave_v1,810.13,1.07435,0.0001
gfx950,256,640,7168,2048,ck,14,3,21.8952,a8w8_blockscale_bpreshuffle_1x128x128_256x64x128x128_16x16_16x16_8x32x1_8x32x1_1x32x1x8_8_2x1_intrawave_v1,858.2,1.14938,0.0002
gfx950,256,640,7168,2304,ck,14,1,24.582,a8w8_blockscale_bpreshuffle_1x128x128_256x64x128x128_16x16_16x16_8x32x1_8x32x1_1x32x1x8_8_2x1_intrawave_v1,859.95,1.10506,0.0001
gfx950,256,672,7168,2048,ck,14,0,22.3856,a8w8_blockscale_bpreshuffle_1x128x128_256x64x128x128_16x16_16x16_8x32x1_8x32x1_1x32x1x8_8_2x1_intrawave_v1,881.37,1.14762,0.0001
gfx950,256,672,7168,2304,ck,14,0,25.3952,a8w8_blockscale_bpreshuffle_1x128x128_256x64x128x128_16x16_16x16_8x32x1_8x32x1_1x32x1x8_8_2x1_intrawave_v1,874.03,1.09065,0.0001
gfx950,256,704,7168,2048,ck,14,0,22.1673,a8w8_blockscale_bpreshuffle_1x128x128_256x64x128x128_16x16_16x16_8x32x1_8x32x1_1x32x1x8_8_2x1_intrawave_v1,932.43,1.18257,0.0001
gfx950,256,704,7168,2304,ck,14,2,24.9362,a8w8_blockscale_bpreshuffle_1x128x128_256x64x128x128_16x16_16x16_8x32x1_8x32x1_1x32x1x8_8_2x1_intrawave_v1,932.51,1.13207,0.0001
gfx950,256,736,7168,2048,ck,14,3,22.8087,a8w8_blockscale_bpreshuffle_1x128x128_256x64x128x128_16x16_16x16_8x32x1_8x32x1_1x32x1x8_8_2x1_intrawave_v1,947.4,1.1723,0.0002
gfx950,256,736,7168,2304,ck,14,3,25.8221,a8w8_blockscale_bpreshuffle_1x128x128_256x64x128x128_16x16_16x16_8x32x1_8x32x1_1x32x1x8_8_2x1_intrawave_v1,941.45,1.11386,0.0001
gfx950,256,768,7168,2048,ck,14,1,22.8406,a8w8_blockscale_bpreshuffle_1x128x128_256x64x128x128_16x16_16x16_8x32x1_8x32x1_1x32x1x8_8_2x1_intrawave_v1,987.21,1.19362,0.0002
gfx950,256,768,7168,2304,ck,14,0,25.4961,a8w8_blockscale_bpreshuffle_1x128x128_256x64x128x128_16x16_16x16_8x32x1_8x32x1_1x32x1x8_8_2x1_intrawave_v1,994.94,1.14898,0.0002
gfx950,256,800,7168,2048,ck,14,0,23.6361,a8w8_blockscale_bpreshuffle_1x128x128_256x64x128x128_16x16_16x16_8x32x1_8x32x1_1x32x1x8_8_2x1_intrawave_v1,993.74,1.17563,0.0002
gfx950,256,800,7168,2304,ck,14,1,26.6837,a8w8_blockscale_bpreshuffle_1x128x128_256x64x128x128_16x16_16x16_8x32x1_8x32x1_1x32x1x8_8_2x1_intrawave_v1,990.27,1.1178,0.0001
gfx950,256,832,7168,2048,ck,14,0,23.2242,a8w8_blockscale_bpreshuffle_1x128x128_256x64x128x128_16x16_16x16_8x32x1_8x32x1_1x32x1x8_8_2x1_intrawave_v1,1051.82,1.21905,0.0003
gfx950,256,832,7168,2304,ck,14,1,26.6718,a8w8_blockscale_bpreshuffle_1x128x128_256x64x128x128_16x16_16x16_8x32x1_8x32x1_1x32x1x8_8_2x1_intrawave_v1,1030.34,1.13826,0.0002
gfx950,256,864,7168,2048,ck,13,0,25.6049,a8w8_blockscale_bpreshuffle_1x128x128_256x64x256x128_16x16_16x16_8x32x1_8x32x1_1x32x1x8_8_2x1_intrawave_v1,990.71,1.12618,0.0
gfx950,256,864,7168,2304,ck,13,3,28.3077,a8w8_blockscale_bpreshuffle_1x128x128_256x64x256x128_16x16_16x16_8x32x1_8x32x1_1x32x1x8_8_2x1_intrawave_v1,1008.14,1.09129,0.0
gfx950,256,896,7168,2048,ck,13,0,25.6653,a8w8_blockscale_bpreshuffle_1x128x128_256x64x256x128_16x16_16x16_8x32x1_8x32x1_1x32x1x8_8_2x1_intrawave_v1,1024.99,1.14396,0.0
gfx950,256,896,7168,2304,ck,13,0,27.9433,a8w8_blockscale_bpreshuffle_1x128x128_256x64x256x128_16x16_16x16_8x32x1_8x32x1_1x32x1x8_8_2x1_intrawave_v1,1059.11,1.12458,0.0
gfx950,256,928,7168,2048,ck,13,3,26.5242,a8w8_blockscale_bpreshuffle_1x128x128_256x64x256x128_16x16_16x16_8x32x1_8x32x1_1x32x1x8_8_2x1_intrawave_v1,1027.22,1.12668,0.0
gfx950,256,928,7168,2304,ck,13,0,29.6559,a8w8_blockscale_bpreshuffle_1x128x128_256x64x256x128_16x16_16x16_8x32x1_8x32x1_1x32x1x8_8_2x1_intrawave_v1,1033.59,1.07759,0.0
gfx950,256,960,7168,2048,ck,13,1,26.7867,a8w8_blockscale_bpreshuffle_1x128x128_256x64x256x128_16x16_16x16_8x32x1_8x32x1_1x32x1x8_8_2x1_intrawave_v1,1052.23,1.13522,0.0
gfx950,256,960,7168,2304,ck,13,1,29.2621,a8w8_blockscale_bpreshuffle_1x128x128_256x64x256x128_16x16_16x16_8x32x1_8x32x1_1x32x1x8_8_2x1_intrawave_v1,1083.62,1.11029,0.0
gfx950,256,992,7168,2048,ck,13,2,27.1511,a8w8_blockscale_bpreshuffle_1x128x128_256x64x256x128_16x16_16x16_8x32x1_8x32x1_1x32x1x8_8_2x1_intrawave_v1,1072.71,1.13929,0.0
gfx950,256,992,7168,2304,ck,13,0,30.3926,a8w8_blockscale_bpreshuffle_1x128x128_256x64x256x128_16x16_16x16_8x32x1_8x32x1_1x32x1x8_8_2x1_intrawave_v1,1078.09,1.08651,0.0
gfx950,256,1024,7168,2048,ck,13,2,26.9597,a8w8_blockscale_bpreshuffle_1x128x128_256x64x256x128_16x16_16x16_8x32x1_8x32x1_1x32x1x8_8_2x1_intrawave_v1,1115.17,1.16683,0.0
gfx950,256,1024,7168,2304,ck,13,2,30.2979,a8w8_blockscale_bpreshuffle_1x128x128_256x64x256x128_16x16_16x16_8x32x1_8x32x1_1x32x1x8_8_2x1_intrawave_v1,1116.34,1.10748,0.0
gfx950,256,1088,7168,2048,ck,13,2,27.2805,a8w8_blockscale_bpreshuffle_1x128x128_256x64x256x128_16x16_16x16_8x32x1_8x32x1_1x32x1x8_8_2x1_intrawave_v1,1170.94,1.19154,0.0
gfx950,256,1088,7168,2304,ck,13,3,30.6045,a8w8_blockscale_bpreshuffle_1x128x128_256x64x256x128_16x16_16x16_8x32x1_8x32x1_1x32x1x8_8_2x1_intrawave_v1,1174.23,1.13119,0.0
gfx950,256,1152,7168,2048,ck,13,1,27.4994,a8w8_blockscale_bpreshuffle_1x128x128_256x64x256x128_16x16_16x16_8x32x1_8x32x1_1x32x1x8_8_2x1_intrawave_v1,1229.95,1.22019,0.0
gfx950,256,1152,7168,2304,ck,13,1,30.6421,a8w8_blockscale_bpreshuffle_1x128x128_256x64x256x128_16x16_16x16_8x32x1_8x32x1_1x32x1x8_8_2x1_intrawave_v1,1241.78,1.16455,0.0
gfx950,256,1216,7168,2048,ck,14,1,33.3229,a8w8_blockscale_bpreshuffle_1x128x128_256x64x128x128_16x16_16x16_8x32x1_8x32x1_1x32x1x8_8_2x1_intrawave_v1,1071.39,1.03842,0.0003
gfx950,256,1216,7168,2304,ck,14,1,38.9553,a8w8_blockscale_bpreshuffle_1x128x128_256x64x128x128_16x16_16x16_8x32x1_8x32x1_1x32x1x8_8_2x1_intrawave_v1,1031.04,0.94337,0.0002
gfx950,256,1280,7168,2048,ck,14,1,33.8453,a8w8_blockscale_bpreshuffle_1x128x128_256x64x128x128_16x16_16x16_8x32x1_8x32x1_1x32x1x8_8_2x1_intrawave_v1,1110.37,1.05337,0.0003
gfx950,256,1280,7168,2304,ck,14,1,38.5149,a8w8_blockscale_bpreshuffle_1x128x128_256x64x128x128_16x16_16x16_8x32x1_8x32x1_1x32x1x8_8_2x1_intrawave_v1,1097.72,0.98181,0.0003
gfx950,256,1344,7168,2048,ck,14,1,35.0697,a8w8_blockscale_bpreshuffle_1x128x128_256x64x128x128_16x16_16x16_8x32x1_8x32x1_1x32x1x8_8_2x1_intrawave_v1,1125.19,1.04649,0.0003
gfx950,256,1344,7168,2304,ck,14,1,39.8326,a8w8_blockscale_bpreshuffle_1x128x128_256x64x128x128_16x16_16x16_8x32x1_8x32x1_1x32x1x8_8_2x1_intrawave_v1,1114.48,0.97607,0.0002
gfx950,256,1408,7168,2048,ck,14,1,34.9055,a8w8_blockscale_bpreshuffle_1x128x128_256x64x128x128_16x16_16x16_8x32x1_8x32x1_1x32x1x8_8_2x1_intrawave_v1,1184.31,1.08146,0.0003
gfx950,256,1408,7168,2304,ck,14,0,40.0446,a8w8_blockscale_bpreshuffle_1x128x128_256x64x128x128_16x16_16x16_8x32x1_8x32x1_1x32x1x8_8_2x1_intrawave_v1,1161.37,0.99749,0.0002
gfx950,256,1472,7168,2048,ck,13,2,37.8797,a8w8_blockscale_bpreshuffle_1x128x128_256x64x256x128_16x16_16x16_8x32x1_8x32x1_1x32x1x8_8_2x1_intrawave_v1,1140.93,1.02422,0.0
gfx950,256,1472,7168,2304,ck,13,0,41.5178,a8w8_blockscale_bpreshuffle_1x128x128_256x64x256x128_16x16_16x16_8x32x1_8x32x1_1x32x1x8_8_2x1_intrawave_v1,1171.07,0.98775,0.0
gfx950,256,1536,7168,2048,ck,13,1,37.7413,a8w8_blockscale_bpreshuffle_1x128x128_256x64x256x128_16x16_16x16_8x32x1_8x32x1_1x32x1x8_8_2x1_intrawave_v1,1194.9,1.05576,0.0
gfx950,256,1536,7168,2304,ck,13,3,41.4718,a8w8_blockscale_bpreshuffle_1x128x128_256x64x256x128_16x16_16x16_8x32x1_8x32x1_1x32x1x8_8_2x1_intrawave_v1,1223.34,1.01452,0.0
gfx950,256,1600,7168,2048,ck,13,0,38.8337,a8w8_blockscale_bpreshuffle_1x128x128_256x64x256x128_16x16_16x16_8x32x1_8x32x1_1x32x1x8_8_2x1_intrawave_v1,1209.68,1.05307,0.0
gfx950,256,1600,7168,2304,ck,13,2,42.9042,a8w8_blockscale_bpreshuffle_1x128x128_256x64x256x128_16x16_16x16_8x32x1_8x32x1_1x32x1x8_8_2x1_intrawave_v1,1231.77,1.00547,0.0
gfx950,256,1664,7168,2048,ck,13,1,39.2573,a8w8_blockscale_bpreshuffle_1x128x128_256x64x256x128_16x16_16x16_8x32x1_8x32x1_1x32x1x8_8_2x1_intrawave_v1,1244.49,1.06841,0.0
gfx950,256,1664,7168,2304,ck,13,2,43.621,a8w8_blockscale_bpreshuffle_1x128x128_256x64x256x128_16x16_16x16_8x32x1_8x32x1_1x32x1x8_8_2x1_intrawave_v1,1259.99,1.01337,0.0
gfx950,256,1728,7168,2048,ck,13,0,39.8069,a8w8_blockscale_bpreshuffle_1x128x128_256x64x256x128_16x16_16x16_8x32x1_8x32x1_1x32x1x8_8_2x1_intrawave_v1,1274.51,1.08,0.0
gfx950,256,1728,7168,2304,ck,13,3,44.4322,a8w8_blockscale_bpreshuffle_1x128x128_256x64x256x128_16x16_16x16_8x32x1_8x32x1_1x32x1x8_8_2x1_intrawave_v1,1284.57,1.01883,0.0
gfx950,256,1792,7168,2048,ck,14,2,45.809,a8w8_blockscale_bpreshuffle_1x128x128_256x64x128x128_16x16_16x16_8x32x1_8x32x1_1x32x1x8_8_2x1_intrawave_v1,1148.54,0.96139,0.0003
gfx950,256,1792,7168,2304,ck,13,2,49.8498,a8w8_blockscale_bpreshuffle_1x128x128_256x64x256x128_16x16_16x16_8x32x1_8x32x1_1x32x1x8_8_2x1_intrawave_v1,1187.37,0.92947,0.0
gfx950,256,1856,7168,2048,ck,14,2,46.3162,a8w8_blockscale_bpreshuffle_1x128x128_256x64x128x128_16x16_16x16_8x32x1_8x32x1_1x32x1x8_8_2x1_intrawave_v1,1176.53,0.9735,0.0003
gfx950,256,1856,7168,2304,ck,14,1,52.4771,a8w8_blockscale_bpreshuffle_1x128x128_256x64x128x128_16x16_16x16_8x32x1_8x32x1_1x32x1x8_8_2x1_intrawave_v1,1168.2,0.90323,0.0003
gfx950,256,1920,7168,2048,ck,13,2,46.9258,a8w8_blockscale_bpreshuffle_1x128x128_256x64x256x128_16x16_16x16_8x32x1_8x32x1_1x32x1x8_8_2x1_intrawave_v1,1201.29,0.9832,0.0
gfx950,256,1920,7168,2304,ck,13,1,52.4563,a8w8_blockscale_bpreshuffle_1x128x128_256x64x256x128_16x16_16x16_8x32x1_8x32x1_1x32x1x8_8_2x1_intrawave_v1,1208.97,0.92389,0.0
gfx950,256,1984,7168,2048,ck,13,0,48.5366,a8w8_blockscale_bpreshuffle_1x128x128_256x64x256x128_16x16_16x16_8x32x1_8x32x1_1x32x1x8_8_2x1_intrawave_v1,1200.14,0.97217,0.0
gfx950,256,1984,7168,2304,ck,13,3,54.0152,a8w8_blockscale_bpreshuffle_1x128x128_256x64x256x128_16x16_16x16_8x32x1_8x32x1_1x32x1x8_8_2x1_intrawave_v1,1213.21,0.91694,0.0
gfx950,256,2048,7168,2048,ck,13,1,49.7429,a8w8_blockscale_bpreshuffle_1x128x128_256x64x256x128_16x16_16x16_8x32x1_8x32x1_1x32x1x8_8_2x1_intrawave_v1,1208.81,0.96968,0.0
gfx950,256,2048,7168,2304,ck,13,1,54.9991,a8w8_blockscale_bpreshuffle_1x128x128_256x64x256x128_16x16_16x16_8x32x1_8x32x1_1x32x1x8_8_2x1_intrawave_v1,1229.94,0.9199,0.0
gfx950,256,4096,7168,2048,ck,13,1,84.9609,a8w8_blockscale_bpreshuffle_1x128x128_256x64x256x128_16x16_16x16_8x32x1_8x32x1_1x32x1x8_8_2x1_intrawave_v1,1415.46,0.96267,0.0
gfx950,256,4096,7168,2304,ck,13,0,94.7138,a8w8_blockscale_bpreshuffle_1x128x128_256x64x256x128_16x16_16x16_8x32x1_8x32x1_1x32x1x8_8_2x1_intrawave_v1,1428.42,0.89398,0.0
gfx950,256,8192,7168,2048,ck,13,0,157.5272,a8w8_blockscale_bpreshuffle_1x128x128_256x64x256x128_16x16_16x16_8x32x1_8x32x1_1x32x1x8_8_2x1_intrawave_v1,1526.84,0.94522,0.0
gfx950,256,8192,7168,2304,ck,13,3,171.0665,a8w8_blockscale_bpreshuffle_1x128x128_256x64x256x128_16x16_16x16_8x32x1_8x32x1_1x32x1x8_8_2x1_intrawave_v1,1581.74,0.89339,0.0
gfx950,256,16384,7168,2048,ck,13,1,291.9559,a8w8_blockscale_bpreshuffle_1x128x128_256x64x256x128_16x16_16x16_8x32x1_8x32x1_1x32x1x8_8_2x1_intrawave_v1,1647.63,0.96972,0.0
gfx950,256,16384,7168,2304,ck,13,1,324.2426,a8w8_blockscale_bpreshuffle_1x128x128_256x64x256x128_16x16_16x16_8x32x1_8x32x1_1x32x1x8_8_2x1_intrawave_v1,1669.02,0.89175,0.0
gfx950,256,32768,7168,2048,ck,13,1,556.7794,a8w8_blockscale_bpreshuffle_1x128x128_256x64x256x128_16x16_16x16_8x32x1_8x32x1_1x32x1x8_8_2x1_intrawave_v1,1727.92,0.99061,0.0
gfx950,256,32768,7168,2304,ck,13,0,619.9048,a8w8_blockscale_bpreshuffle_1x128x128_256x64x256x128_16x16_16x16_8x32x1_8x32x1_1x32x1x8_8_2x1_intrawave_v1,1745.96,0.90623,0.0
gfx950,256,16,8192,1536,ck,7,2,6.4719,a8w8_blockscale_bpreshuffle_1x128x128_256x16x64x256_16x16_16x16_16x16x1_16x16x1_1x16x1x16_4_1x1_intrawave_v1,62.22,1.98854,0.0
gfx950,256,32,8192,1536,ck,7,2,6.2694,a8w8_blockscale_bpreshuffle_1x128x128_256x16x64x256_16x16_16x16_16x16x1_16x16x1_1x16x1x16_4_1x1_intrawave_v1,128.45,2.0985,0.0
gfx950,256,48,8192,1536,ck,6,0,6.7969,a8w8_blockscale_bpreshuffle_1x128x128_256x16x128x256_16x16_16x16_16x16x1_16x16x1_1x16x1x16_8_1x2_intrawave_v1,177.72,1.97782,0.0
gfx950,256,64,8192,1536,ck,12,1,6.8746,a8w8_blockscale_bpreshuffle_1x128x128_256x32x64x256_16x16_16x16_16x16x1_16x16x1_1x32x1x8_8_2x1_intrawave_v1,234.28,1.99718,0.0
gfx950,256,80,8192,1536,triton,0,0,6.459,triton,311.7,2.17,0.0
gfx950,256,96,8192,1536,triton,0,0,6.6554,triton,363.0,2.15,0.0
gfx950,256,112,8192,1536,triton,0,0,7.3219,triton,384.95,1.99,0.0
gfx950,256,128,8192,1536,ck,11,0,8.3009,a8w8_blockscale_bpreshuffle_1x128x128_256x32x128x256_16x16_16x16_16x16x1_16x16x1_1x32x1x8_8_2x1_intrawave_v1,388.06,1.79218,0.0
gfx950,256,144,8192,1536,triton,0,0,8.8321,triton,410.31,1.72,0.0
gfx950,256,160,8192,1536,asm,8,1,9.5079,_ZN5aiter42fp8gemm_bf16_blockscale_BpreShuffle_48x128E,423.49,1.62498,0.0
gfx950,256,176,8192,1536,asm,8,1,10.041,_ZN5aiter42fp8gemm_bf16_blockscale_BpreShuffle_48x128E,441.11,1.56726,0.0
gfx950,256,192,8192,1536,asm,8,1,9.735,_ZN5aiter42fp8gemm_bf16_blockscale_BpreShuffle_48x128E,496.34,1.64597,0.0
gfx950,256,208,8192,1536,ck,17,1,10.774,a8w8_blockscale_bpreshuffle_1x128x128_256x64x64x256_16x16_16x16_16x16x1_16x16x1_1x32x1x8_8_2x1_intrawave_v1,485.84,1.51385,0.0
gfx950,256,224,8192,1536,asm,16,1,10.472,_ZN5aiter42fp8gemm_bf16_blockscale_BpreShuffle_64x128E,538.31,1.58489,0.0
gfx950,256,240,8192,1536,ck,17,1,11.016,a8w8_blockscale_bpreshuffle_1x128x128_256x64x64x256_16x16_16x16_16x16x1_16x16x1_1x32x1x8_8_2x1_intrawave_v1,548.28,1.53265,0.0
gfx950,256,256,8192,1536,asm,16,1,10.6076,_ZN5aiter42fp8gemm_bf16_blockscale_BpreShuffle_64x128E,607.34,1.61869,0.0
gfx950,256,288,8192,1536,asm,24,1,11.5847,_ZN5aiter42fp8gemm_bf16_blockscale_BpreShuffle_80x128E,625.63,1.53166,0.0
gfx950,256,320,8192,1536,asm,24,1,11.8865,_ZN5aiter42fp8gemm_bf16_blockscale_BpreShuffle_80x128E,677.5,1.54102,0.0
gfx950,256,352,8192,1536,asm,32,1,13.3519,_ZN5aiter42fp8gemm_bf16_blockscale_BpreShuffle_96x128E,663.45,1.41484,0.0
gfx950,256,384,8192,1536,asm,32,1,13.0874,_ZN5aiter42fp8gemm_bf16_blockscale_BpreShuffle_96x128E,738.4,1.48725,0.0
gfx950,256,416,8192,1536,ck,14,0,15.0583,a8w8_blockscale_bpreshuffle_1x128x128_256x64x128x128_16x16_16x16_8x32x1_8x32x1_1x32x1x8_8_2x1_intrawave_v1,695.23,1.33067,0.0
gfx950,256,448,8192,1536,ck,14,2,14.9824,a8w8_blockscale_bpreshuffle_1x128x128_256x64x128x128_16x16_16x16_8x32x1_8x32x1_1x32x1x8_8_2x1_intrawave_v1,752.5,1.37569,0.0
gfx950,256,480,8192,1536,ck,14,3,15.2947,a8w8_blockscale_bpreshuffle_1x128x128_256x64x128x128_16x16_16x16_8x32x1_8x32x1_1x32x1x8_8_2x1_intrawave_v1,789.79,1.38509,0.0
gfx950,256,512,8192,1536,ck,14,3,15.175,a8w8_blockscale_bpreshuffle_1x128x128_256x64x128x128_16x16_16x16_8x32x1_8x32x1_1x32x1x8_8_2x1_intrawave_v1,849.09,1.4338,0.0
gfx950,256,544,8192,1536,ck,14,0,19.3452,a8w8_blockscale_bpreshuffle_1x128x128_256x64x128x128_16x16_16x16_8x32x1_8x32x1_1x32x1x8_8_2x1_intrawave_v1,707.68,1.15436,0.0001
gfx950,256,576,8192,1536,ck,14,3,19.3504,a8w8_blockscale_bpreshuffle_1x128x128_256x64x128x128_16x16_16x16_8x32x1_8x32x1_1x32x1x8_8_2x1_intrawave_v1,749.11,1.18369,0.0001
gfx950,256,608,8192,1536,ck,14,1,19.5196,a8w8_blockscale_bpreshuffle_1x128x128_256x64x128x128_16x16_16x16_8x32x1_8x32x1_1x32x1x8_8_2x1_intrawave_v1,783.87,1.2028,0.0001
gfx950,256,640,8192,1536,ck,14,0,19.295,a8w8_blockscale_bpreshuffle_1x128x128_256x64x128x128_16x16_16x16_8x32x1_8x32x1_1x32x1x8_8_2x1_intrawave_v1,834.73,1.24653,0.0001
gfx950,256,672,8192,1536,ck,14,2,19.9677,a8w8_blockscale_bpreshuffle_1x128x128_256x64x128x128_16x16_16x16_8x32x1_8x32x1_1x32x1x8_8_2x1_intrawave_v1,846.94,1.23325,0.0002
gfx950,256,704,8192,1536,ck,14,0,19.791,a8w8_blockscale_bpreshuffle_1x128x128_256x64x128x128_16x16_16x16_8x32x1_8x32x1_1x32x1x8_8_2x1_intrawave_v1,895.19,1.27323,0.0001
gfx950,256,736,8192,1536,ck,14,2,20.4392,a8w8_blockscale_bpreshuffle_1x128x128_256x64x128x128_16x16_16x16_8x32x1_8x32x1_1x32x1x8_8_2x1_intrawave_v1,906.2,1.26091,0.0002
gfx950,256,768,8192,1536,ck,14,0,20.2904,a8w8_blockscale_bpreshuffle_1x128x128_256x64x128x128_16x16_16x16_8x32x1_8x32x1_1x32x1x8_8_2x1_intrawave_v1,952.54,1.29842,0.0002
gfx950,256,800,8192,1536,ck,13,2,22.2979,a8w8_blockscale_bpreshuffle_1x128x128_256x64x256x128_16x16_16x16_8x32x1_8x32x1_1x32x1x8_8_2x1_intrawave_v1,902.89,1.20724,0.0
gfx950,256,832,8192,1536,ck,13,0,22.2371,a8w8_blockscale_bpreshuffle_1x128x128_256x64x256x128_16x16_16x16_8x32x1_8x32x1_1x32x1x8_8_2x1_intrawave_v1,941.58,1.23633,0.0
gfx950,256,864,8192,1536,ck,13,3,23.0882,a8w8_blockscale_bpreshuffle_1x128x128_256x64x256x128_16x16_16x16_8x32x1_8x32x1_1x32x1x8_8_2x1_intrawave_v1,941.75,1.21559,0.0
gfx950,256,896,8192,1536,ck,13,3,22.8541,a8w8_blockscale_bpreshuffle_1x128x128_256x64x256x128_16x16_16x16_8x32x1_8x32x1_1x32x1x8_8_2x1_intrawave_v1,986.63,1.25313,0.0
gfx950,256,928,8192,1536,ck,13,0,23.3637,a8w8_blockscale_bpreshuffle_1x128x128_256x64x256x128_16x16_16x16_8x32x1_8x32x1_1x32x1x8_8_2x1_intrawave_v1,999.58,1.25034,0.0
gfx950,256,960,8192,1536,ck,13,0,23.2165,a8w8_blockscale_bpreshuffle_1x128x128_256x64x256x128_16x16_16x16_8x32x1_8x32x1_1x32x1x8_8_2x1_intrawave_v1,1040.6,1.28297,0.0
gfx950,256,992,8192,1536,ck,13,3,24.0286,a8w8_blockscale_bpreshuffle_1x128x128_256x64x256x128_16x16_16x16_8x32x1_8x32x1_1x32x1x8_8_2x1_intrawave_v1,1038.95,1.26348,0.0
gfx950,256,1024,8192,1536,ck,13,0,23.849,a8w8_blockscale_bpreshuffle_1x128x128_256x64x256x128_16x16_16x16_8x32x1_8x32x1_1x32x1x8_8_2x1_intrawave_v1,1080.54,1.29704,0.0
gfx950,256,1088,8192,1536,ck,14,1,28.527,a8w8_blockscale_bpreshuffle_1x128x128_256x64x128x128_16x16_16x16_8x32x1_8x32x1_1x32x1x8_8_2x1_intrawave_v1,959.81,1.12454,0.0001
gfx950,256,1152,8192,1536,ck,14,2,28.3804,a8w8_blockscale_bpreshuffle_1x128x128_256x64x128x128_16x16_16x16_8x32x1_8x32x1_1x32x1x8_8_2x1_intrawave_v1,1021.52,1.17076,0.0002
gfx950,256,1216,8192,1536,ck,14,2,28.9229,a8w8_blockscale_bpreshuffle_1x128x128_256x64x128x128_16x16_16x16_8x32x1_8x32x1_1x32x1x8_8_2x1_intrawave_v1,1058.04,1.18846,0.0002
gfx950,256,1280,8192,1536,ck,14,1,30.0017,a8w8_blockscale_bpreshuffle_1x128x128_256x64x128x128_16x16_16x16_8x32x1_8x32x1_1x32x1x8_8_2x1_intrawave_v1,1073.68,1.18395,0.0002
gfx950,256,1344,8192,1536,ck,13,2,31.5777,a8w8_blockscale_bpreshuffle_1x128x128_256x64x256x128_16x16_16x16_8x32x1_8x32x1_1x32x1x8_8_2x1_intrawave_v1,1071.1,1.16118,0.0
gfx950,256,1408,8192,1536,ck,13,0,31.753,a8w8_blockscale_bpreshuffle_1x128x128_256x64x256x128_16x16_16x16_8x32x1_8x32x1_1x32x1x8_8_2x1_intrawave_v1,1115.91,1.19089,0.0
gfx950,256,1472,8192,1536,ck,13,1,32.3237,a8w8_blockscale_bpreshuffle_1x128x128_256x64x256x128_16x16_16x16_8x32x1_8x32x1_1x32x1x8_8_2x1_intrawave_v1,1146.04,1.20534,0.0
gfx950,256,1536,8192,1536,ck,13,3,32.6491,a8w8_blockscale_bpreshuffle_1x128x128_256x64x256x128_16x16_16x16_8x32x1_8x32x1_1x32x1x8_8_2x1_intrawave_v1,1183.94,1.22846,0.0
gfx950,256,1600,8192,1536,ck,14,3,38.1646,a8w8_blockscale_bpreshuffle_1x128x128_256x64x128x128_16x16_16x16_8x32x1_8x32x1_1x32x1x8_8_2x1_intrawave_v1,1055.04,1.08097,0.0002
gfx950,256,1664,8192,1536,ck,14,3,38.4425,a8w8_blockscale_bpreshuffle_1x128x128_256x64x128x128_16x16_16x16_8x32x1_8x32x1_1x32x1x8_8_2x1_intrawave_v1,1089.31,1.10299,0.0002
gfx950,256,1728,8192,1536,ck,14,3,38.6445,a8w8_blockscale_bpreshuffle_1x128x128_256x64x128x128_16x16_16x16_8x32x1_8x32x1_1x32x1x8_8_2x1_intrawave_v1,1125.3,1.1269,0.0002
gfx950,256,1792,8192,1536,ck,14,1,39.7512,a8w8_blockscale_bpreshuffle_1x128x128_256x64x128x128_16x16_16x16_8x32x1_8x32x1_1x32x1x8_8_2x1_intrawave_v1,1134.49,1.12438,0.0002
gfx950,256,1856,8192,1536,ck,13,2,41.175,a8w8_blockscale_bpreshuffle_1x128x128_256x64x256x128_16x16_16x16_8x32x1_8x32x1_1x32x1x8_8_2x1_intrawave_v1,1134.37,1.11336,0.0
gfx950,256,1920,8192,1536,ck,13,2,41.7573,a8w8_blockscale_bpreshuffle_1x128x128_256x64x256x128_16x16_16x16_8x32x1_8x32x1_1x32x1x8_8_2x1_intrawave_v1,1157.12,1.1253,0.0
gfx950,256,1984,8192,1536,ck,13,2,42.9929,a8w8_blockscale_bpreshuffle_1x128x128_256x64x256x128_16x16_16x16_8x32x1_8x32x1_1x32x1x8_8_2x1_intrawave_v1,1161.33,1.11963,0.0
gfx950,256,2048,8192,1536,ck,13,3,44.712,a8w8_blockscale_bpreshuffle_1x128x128_256x64x256x128_16x16_16x16_8x32x1_8x32x1_1x32x1x8_8_2x1_intrawave_v1,1152.7,1.10223,0.0
gfx950,256,4096,8192,1536,ck,13,1,79.2213,a8w8_blockscale_bpreshuffle_1x128x128_256x64x256x128_16x16_16x16_8x32x1_8x32x1_1x32x1x8_8_2x1_intrawave_v1,1301.16,1.08535,0.0
gfx950,256,8192,8192,1536,ck,13,2,146.3103,a8w8_blockscale_bpreshuffle_1x128x128_256x64x256x128_16x16_16x16_8x32x1_8x32x1_1x32x1x8_8_2x1_intrawave_v1,1409.05,1.08935,0.0
gfx950,256,16384,8192,1536,ck,13,3,271.6202,a8w8_blockscale_bpreshuffle_1x128x128_256x64x256x128_16x16_16x16_8x32x1_8x32x1_1x32x1x8_8_2x1_intrawave_v1,1517.99,1.12725,0.0
gfx950,256,32768,8192,1536,ck,13,1,513.6065,a8w8_blockscale_bpreshuffle_1x128x128_256x64x256x128_16x16_16x16_8x32x1_8x32x1_1x32x1x8_8_2x1_intrawave_v1,1605.57,1.16779,0.0
gfx950,256,16,11264,1536,ck,7,1,6.7619,a8w8_blockscale_bpreshuffle_1x128x128_256x16x64x256_16x16_16x16_16x16x1_16x16x1_1x16x1x16_4_1x1_intrawave_v1,81.88,2.61562,0.0
gfx950,256,32,11264,1536,ck,6,1,7.096,a8w8_blockscale_bpreshuffle_1x128x128_256x16x128x256_16x16_16x16_16x16x1_16x16x1_1x16x1x16_8_1x2_intrawave_v1,156.05,2.54672,0.0
gfx950,256,48,11264,1536,ck,7,0,7.5363,a8w8_blockscale_bpreshuffle_1x128x128_256x16x64x256_16x16_16x16_16x16x1_16x16x1_1x16x1x16_4_1x1_intrawave_v1,220.39,2.44902,0.0
gfx950,256,64,11264,1536,ck,17,2,8.3027,a8w8_blockscale_bpreshuffle_1x128x128_256x64x64x256_16x16_16x16_16x16x1_16x16x1_1x32x1x8_8_2x1_intrawave_v1,266.73,2.26933,0.0
gfx950,256,80,11264,1536,asm,8,1,9.794,_ZN5aiter42fp8gemm_bf16_blockscale_BpreShuffle_48x128E,282.65,1.9631,0.0
gfx950,256,96,11264,1536,asm,8,1,9.9361,_ZN5aiter42fp8gemm_bf16_blockscale_BpreShuffle_48x128E,334.33,1.97378,0.0
gfx950,256,112,11264,1536,ck,12,3,10.4055,a8w8_blockscale_bpreshuffle_1x128x128_256x32x64x256_16x16_16x16_16x16x1_16x16x1_1x32x1x8_8_2x1_intrawave_v1,372.45,1.92174,0.0
gfx950,256,128,11264,1536,ck,10,2,10.6475,a8w8_blockscale_bpreshuffle_1x128x128_256x32x64x128_16x16_16x16_8x32x1_8x32x1_1x32x1x8_8_2x1_intrawave_v1,415.98,1.91422,0.0227
gfx950,256,144,11264,1536,ck,9,2,11.863,a8w8_blockscale_bpreshuffle_1x128x128_256x32x128x128_16x16_16x16_8x32x1_8x32x1_1x32x1x8_8_2x1_intrawave_v1,420.03,1.75055,0.0
gfx950,256,160,11264,1536,ck,9,1,11.9836,a8w8_blockscale_bpreshuffle_1x128x128_256x32x128x128_16x16_16x16_8x32x1_8x32x1_1x32x1x8_8_2x1_intrawave_v1,462.0,1.76506,0.0
gfx950,256,176,11264,1536,ck,15,2,12.9368,a8w8_blockscale_bpreshuffle_1x128x128_256x64x64x128_16x16_16x16_8x32x1_8x32x1_1x32x1x8_8_2x1_intrawave_v1,470.76,1.66477,0.0091
gfx950,256,192,11264,1536,asm,32,1,12.7768,_ZN5aiter42fp8gemm_bf16_blockscale_BpreShuffle_96x128E,519.99,1.71575,0.0
gfx950,256,208,11264,1536,ck,15,3,13.6827,a8w8_blockscale_bpreshuffle_1x128x128_256x64x64x128_16x16_16x16_8x32x1_8x32x1_1x32x1x8_8_2x1_intrawave_v1,526.02,1.63029,0.0112
gfx950,256,224,11264,1536,ck,15,1,13.86,a8w8_blockscale_bpreshuffle_1x128x128_256x64x64x128_16x16_16x16_8x32x1_8x32x1_1x32x1x8_8_2x1_intrawave_v1,559.24,1.63722,0.0122
gfx950,256,240,11264,1536,ck,15,1,14.1955,a8w8_blockscale_bpreshuffle_1x128x128_256x64x64x128_16x16_16x16_8x32x1_8x32x1_1x32x1x8_8_2x1_intrawave_v1,585.02,1.62565,0.0107
gfx950,256,256,11264,1536,ck,15,3,14.3361,a8w8_blockscale_bpreshuffle_1x128x128_256x64x64x128_16x16_16x16_8x32x1_8x32x1_1x32x1x8_8_2x1_intrawave_v1,617.91,1.63656,0.0013
gfx950,256,288,11264,1536,ck,14,3,15.2132,a8w8_blockscale_bpreshuffle_1x128x128_256x64x128x128_16x16_16x16_8x32x1_8x32x1_1x32x1x8_8_2x1_intrawave_v1,655.07,1.59282,0.0
gfx950,256,320,11264,1536,ck,14,0,15.3302,a8w8_blockscale_bpreshuffle_1x128x128_256x64x128x128_16x16_16x16_8x32x1_8x32x1_1x32x1x8_8_2x1_intrawave_v1,722.3,1.6309,0.0
gfx950,256,352,11264,1536,ck,8,2,17.669,a8w8_blockscale_bpreshuffle_1x128x128_256x32x256x128_16x16_16x16_8x32x1_8x32x1_1x32x1x8_8_2x1_intrawave_v1,689.36,1.4586,0.0
gfx950,256,384,11264,1536,ck,14,2,18.7495,a8w8_blockscale_bpreshuffle_1x128x128_256x64x128x128_16x16_16x16_8x32x1_8x32x1_1x32x1x8_8_2x1_intrawave_v1,708.69,1.41562,0.0
gfx950,256,416,11264,1536,ck,14,0,19.4889,a8w8_blockscale_bpreshuffle_1x128x128_256x64x128x128_16x16_16x16_8x32x1_8x32x1_1x32x1x8_8_2x1_intrawave_v1,738.62,1.40142,0.0001
gfx950,256,448,11264,1536,ck,14,2,19.4734,a8w8_blockscale_bpreshuffle_1x128x128_256x64x128x128_16x16_16x16_8x32x1_8x32x1_1x32x1x8_8_2x1_intrawave_v1,796.07,1.44208,0.0001
gfx950,256,480,11264,1536,ck,14,1,19.9547,a8w8_blockscale_bpreshuffle_1x128x128_256x64x128x128_16x16_16x16_8x32x1_8x32x1_1x32x1x8_8_2x1_intrawave_v1,832.36,1.44589,0.0001
gfx950,256,512,11264,1536,ck,14,1,19.8498,a8w8_blockscale_bpreshuffle_1x128x128_256x64x128x128_16x16_16x16_8x32x1_8x32x1_1x32x1x8_8_2x1_intrawave_v1,892.54,1.49232,0.0001
gfx950,256,544,11264,1536,ck,13,0,22.6047,a8w8_blockscale_bpreshuffle_1x128x128_256x64x256x128_16x16_16x16_8x32x1_8x32x1_1x32x1x8_8_2x1_intrawave_v1,832.75,1.34451,0.0
gfx950,256,576,11264,1536,ck,13,2,22.3751,a8w8_blockscale_bpreshuffle_1x128x128_256x64x256x128_16x16_16x16_8x32x1_8x32x1_1x32x1x8_8_2x1_intrawave_v1,890.78,1.39273,0.0
gfx950,256,608,11264,1536,ck,13,0,23.0538,a8w8_blockscale_bpreshuffle_1x128x128_256x64x256x128_16x16_16x16_8x32x1_8x32x1_1x32x1x8_8_2x1_intrawave_v1,912.59,1.38513,0.0
gfx950,256,640,11264,1536,ck,13,2,23.2775,a8w8_blockscale_bpreshuffle_1x128x128_256x64x256x128_16x16_16x16_8x32x1_8x32x1_1x32x1x8_8_2x1_intrawave_v1,951.39,1.4049,0.0
gfx950,256,672,11264,1536,ck,13,2,23.5796,a8w8_blockscale_bpreshuffle_1x128x128_256x64x256x128_16x16_16x16_8x32x1_8x32x1_1x32x1x8_8_2x1_intrawave_v1,986.16,1.41955,0.0
gfx950,256,704,11264,1536,ck,13,1,23.4414,a8w8_blockscale_bpreshuffle_1x128x128_256x64x256x128_16x16_16x16_8x32x1_8x32x1_1x32x1x8_8_2x1_intrawave_v1,1039.21,1.46077,0.0
gfx950,256,736,11264,1536,ck,14,3,28.0696,a8w8_blockscale_bpreshuffle_1x128x128_256x64x128x128_16x16_16x16_8x32x1_8x32x1_1x32x1x8_8_2x1_intrawave_v1,907.31,1.24735,0.0002
gfx950,256,768,11264,1536,ck,14,2,27.9392,a8w8_blockscale_bpreshuffle_1x128x128_256x64x128x128_16x16_16x16_8x32x1_8x32x1_1x32x1x8_8_2x1_intrawave_v1,951.18,1.28073,0.0002
gfx950,256,800,11264,1536,ck,14,0,28.7283,a8w8_blockscale_bpreshuffle_1x128x128_256x64x128x128_16x16_16x16_8x32x1_8x32x1_1x32x1x8_8_2x1_intrawave_v1,963.59,1.27236,0.0002
gfx950,256,832,11264,1536,ck,14,3,29.2751,a8w8_blockscale_bpreshuffle_1x128x128_256x64x128x128_16x16_16x16_8x32x1_8x32x1_1x32x1x8_8_2x1_intrawave_v1,983.42,1.2749,0.0002
gfx950,256,864,11264,1536,ck,14,0,29.5972,a8w8_blockscale_bpreshuffle_1x128x128_256x64x128x128_16x16_16x16_8x32x1_8x32x1_1x32x1x8_8_2x1_intrawave_v1,1010.13,1.28704,0.0002
gfx950,256,896,11264,1536,ck,14,1,29.5197,a8w8_blockscale_bpreshuffle_1x128x128_256x64x128x128_16x16_16x16_8x32x1_8x32x1_1x32x1x8_8_2x1_intrawave_v1,1050.29,1.31651,0.0002
gfx950,256,928,11264,1536,ck,13,1,31.8538,a8w8_blockscale_bpreshuffle_1x128x128_256x64x256x128_16x16_16x16_8x32x1_8x32x1_1x32x1x8_8_2x1_intrawave_v1,1008.09,1.24421,0.0
gfx950,256,960,11264,1536,ck,13,3,31.3254,a8w8_blockscale_bpreshuffle_1x128x128_256x64x256x128_16x16_16x16_8x32x1_8x32x1_1x32x1x8_8_2x1_intrawave_v1,1060.45,1.28978,0.0
gfx950,256,992,11264,1536,ck,13,0,35.4472,a8w8_blockscale_bpreshuffle_1x128x128_256x64x256x128_16x16_16x16_8x32x1_8x32x1_1x32x1x8_8_2x1_intrawave_v1,968.38,1.16153,0.0
gfx950,256,1024,11264,1536,ck,13,0,35.0248,a8w8_blockscale_bpreshuffle_1x128x128_256x64x256x128_16x16_16x16_8x32x1_8x32x1_1x32x1x8_8_2x1_intrawave_v1,1011.67,1.19752,0.0
gfx950,256,1088,11264,1536,ck,13,0,33.7656,a8w8_blockscale_bpreshuffle_1x128x128_256x64x256x128_16x16_16x16_8x32x1_8x32x1_1x32x1x8_8_2x1_intrawave_v1,1114.98,1.28779,0.0
gfx950,256,1152,11264,1536,ck,14,2,36.3374,a8w8_blockscale_bpreshuffle_1x128x128_256x64x128x128_16x16_16x16_8x32x1_8x32x1_1x32x1x8_8_2x1_intrawave_v1,1097.01,1.23903,0.0002
gfx950,256,1216,11264,1536,ck,14,0,38.9925,a8w8_blockscale_bpreshuffle_1x128x128_256x64x128x128_16x16_16x16_8x32x1_8x32x1_1x32x1x8_8_2x1_intrawave_v1,1079.11,1.19416,0.0003
gfx950,256,1280,11264,1536,ck,13,1,39.6937,a8w8_blockscale_bpreshuffle_1x128x128_256x64x256x128_16x16_16x16_8x32x1_8x32x1_1x32x1x8_8_2x1_intrawave_v1,1115.84,1.21187,0.0
gfx950,256,1344,11264,1536,ck,13,1,42.2937,a8w8_blockscale_bpreshuffle_1x128x128_256x64x256x128_16x16_16x16_8x32x1_8x32x1_1x32x1x8_8_2x1_intrawave_v1,1099.61,1.17378,0.0
gfx950,256,1408,11264,1536,ck,13,3,41.3354,a8w8_blockscale_bpreshuffle_1x128x128_256x64x256x128_16x16_16x16_8x32x1_8x32x1_1x32x1x8_8_2x1_intrawave_v1,1178.68,1.23825,0.0
gfx950,256,1472,11264,1536,ck,13,3,41.1898,a8w8_blockscale_bpreshuffle_1x128x128_256x64x256x128_16x16_16x16_8x32x1_8x32x1_1x32x1x8_8_2x1_intrawave_v1,1236.61,1.28002,0.0
gfx950,256,1536,11264,1536,ck,13,3,46.8067,a8w8_blockscale_bpreshuffle_1x128x128_256x64x256x128_16x16_16x16_8x32x1_8x32x1_1x32x1x8_8_2x1_intrawave_v1,1135.53,1.15932,0.0
gfx950,256,1600,11264,1536,ck,13,2,48.4414,a8w8_blockscale_bpreshuffle_1x128x128_256x64x256x128_16x16_16x16_8x32x1_8x32x1_1x32x1x8_8_2x1_intrawave_v1,1142.92,1.15199,0.0
gfx950,256,1664,11264,1536,ck,13,2,48.8634,a8w8_blockscale_bpreshuffle_1x128x128_256x64x256x128_16x16_16x16_8x32x1_8x32x1_1x32x1x8_8_2x1_intrawave_v1,1178.37,1.17356,0.0
gfx950,256,1728,11264,1536,ck,13,3,48.7658,a8w8_blockscale_bpreshuffle_1x128x128_256x64x256x128_16x16_16x16_8x32x1_8x32x1_1x32x1x8_8_2x1_intrawave_v1,1226.15,1.20749,0.0
gfx950,256,1792,11264,1536,ck,13,0,49.6094,a8w8_blockscale_bpreshuffle_1x128x128_256x64x256x128_16x16_16x16_8x32x1_8x32x1_1x32x1x8_8_2x1_intrawave_v1,1249.94,1.218,0.0
gfx950,256,1856,11264,1536,ck,13,1,52.3927,a8w8_blockscale_bpreshuffle_1x128x128_256x64x256x128_16x16_16x16_8x32x1_8x32x1_1x32x1x8_8_2x1_intrawave_v1,1225.8,1.18269,0.0
gfx950,256,1920,11264,1536,ck,13,3,58.0171,a8w8_blockscale_bpreshuffle_1x128x128_256x64x256x128_16x16_16x16_8x32x1_8x32x1_1x32x1x8_8_2x1_intrawave_v1,1145.14,1.09458,0.0
gfx950,256,1984,11264,1536,ck,13,1,58.9391,a8w8_blockscale_bpreshuffle_1x128x128_256x64x256x128_16x16_16x16_8x32x1_8x32x1_1x32x1x8_8_2x1_intrawave_v1,1164.8,1.10359,0.0
gfx950,256,2048,11264,1536,ck,13,1,61.3891,a8w8_blockscale_bpreshuffle_1x128x128_256x64x256x128_16x16_16x16_8x32x1_8x32x1_1x32x1x8_8_2x1_intrawave_v1,1154.39,1.08463,0.0
gfx950,256,4096,11264,1536,ck,13,1,104.1395,a8w8_blockscale_bpreshuffle_1x128x128_256x64x256x128_16x16_16x16_8x32x1_8x32x1_1x32x1x8_8_2x1_intrawave_v1,1361.0,1.11262,0.0
gfx950,256,8192,11264,1536,ck,13,1,191.8263,a8w8_blockscale_bpreshuffle_1x128x128_256x64x256x128_16x16_16x16_8x32x1_8x32x1_1x32x1x8_8_2x1_intrawave_v1,1477.73,1.11785,0.0
gfx950,256,16384,11264,1536,ck,13,1,360.1565,a8w8_blockscale_bpreshuffle_1x128x128_256x64x256x128_16x16_16x16_8x32x1_8x32x1_1x32x1x8_8_2x1_intrawave_v1,1574.14,1.14274,0.0
gfx950,256,32768,11264,1536,ck,13,2,679.5554,a8w8_blockscale_bpreshuffle_1x128x128_256x64x256x128_16x16_16x16_8x32x1_8x32x1_1x32x1x8_8_2x1_intrawave_v1,1668.55,1.18582,0.0
gfx942,80,16,128,7168,asm,7,8,8.0571,_ZN5aiter42fp8gemm_bf16_blockscale_BpreShuffle_32x128E,3.64,0.12862,0.0063
gfx942,80,32,128,7168,asm,7,8,8.394,_ZN5aiter42fp8gemm_bf16_blockscale_BpreShuffle_32x128E,7.0,0.13761,0.0051
gfx942,80,48,128,7168,asm,7,8,8.4033,_ZN5aiter42fp8gemm_bf16_blockscale_BpreShuffle_32x128E,10.48,0.15159,0.0016
gfx942,80,64,128,7168,asm,7,8,8.4813,_ZN5aiter42fp8gemm_bf16_blockscale_BpreShuffle_32x128E,13.85,0.1642,0.0172
gfx942,80,80,128,7168,asm,7,8,8.4735,_ZN5aiter42fp8gemm_bf16_blockscale_BpreShuffle_32x128E,17.32,0.17837,0.0014
gfx942,80,96,128,7168,asm,7,8,8.5208,_ZN5aiter42fp8gemm_bf16_blockscale_BpreShuffle_32x128E,20.67,0.19132,0.0047
gfx942,80,112,128,7168,asm,7,8,8.5319,_ZN5aiter42fp8gemm_bf16_blockscale_BpreShuffle_32x128E,24.09,0.20499,0.0033
gfx942,80,128,128,7168,asm,7,8,8.521,_ZN5aiter42fp8gemm_bf16_blockscale_BpreShuffle_32x128E,27.56,0.2192,0.0119
gfx942,80,144,128,7168,asm,7,8,8.6312,_ZN5aiter42fp8gemm_bf16_blockscale_BpreShuffle_32x128E,30.61,0.23016,0.0096
gfx942,80,160,128,7168,asm,7,8,8.6426,_ZN5aiter42fp8gemm_bf16_blockscale_BpreShuffle_32x128E,33.97,0.2436,0.0078
gfx942,80,176,128,7168,asm,7,8,8.6266,_ZN5aiter42fp8gemm_bf16_blockscale_BpreShuffle_32x128E,37.44,0.25782,0.0008
gfx942,80,192,128,7168,asm,7,8,8.7605,_ZN5aiter42fp8gemm_bf16_blockscale_BpreShuffle_32x128E,40.22,0.26744,0.0091
gfx942,80,208,128,7168,asm,7,8,8.8638,_ZN5aiter42fp8gemm_bf16_blockscale_BpreShuffle_32x128E,43.06,0.27772,0.0007
gfx942,80,224,128,7168,asm,6,7,9.1649,_ZN5aiter42fp8gemm_bf16_blockscale_BpreShuffle_32x128E,44.85,0.28156,0.0091
gfx942,80,240,128,7168,asm,7,8,9.212,_ZN5aiter42fp8gemm_bf16_blockscale_BpreShuffle_32x128E,47.81,0.29302,0.0116
gfx942,80,256,128,7168,asm,7,8,9.6351,_ZN5aiter42fp8gemm_bf16_blockscale_BpreShuffle_32x128E,48.76,0.29248,0.0078
gfx942,80,288,128,7168,asm,7,8,9.458,_ZN5aiter42fp8gemm_bf16_blockscale_BpreShuffle_32x128E,55.88,0.32307,0.013
gfx942,80,320,128,7168,asm,7,8,9.5686,_ZN5aiter42fp8gemm_bf16_blockscale_BpreShuffle_32x128E,61.37,0.34417,0.0019
gfx942,80,352,128,7168,asm,6,7,10.284,_ZN5aiter42fp8gemm_bf16_blockscale_BpreShuffle_32x128E,62.81,0.34332,0.005
gfx942,80,384,128,7168,asm,15,8,10.7807,_ZN5aiter42fp8gemm_bf16_blockscale_BpreShuffle_48x128E,65.36,0.34954,0.0106
gfx942,80,416,128,7168,asm,15,8,10.5041,_ZN5aiter42fp8gemm_bf16_blockscale_BpreShuffle_48x128E,72.67,0.38136,0.0042
gfx942,80,448,128,7168,asm,15,8,10.5491,_ZN5aiter42fp8gemm_bf16_blockscale_BpreShuffle_48x128E,77.93,0.40226,0.0056
gfx942,80,480,128,7168,asm,15,8,10.718,_ZN5aiter42fp8gemm_bf16_blockscale_BpreShuffle_48x128E,82.18,0.41808,0.01
gfx942,80,512,128,7168,asm,14,7,11.1046,_ZN5aiter42fp8gemm_bf16_blockscale_BpreShuffle_48x128E,84.61,0.42492,0.0093
gfx942,80,544,128,7168,asm,23,8,11.8582,_ZN5aiter42fp8gemm_bf16_blockscale_BpreShuffle_64x128E,84.18,0.41795,0.0038
gfx942,80,576,128,7168,asm,23,8,12.066,_ZN5aiter42fp8gemm_bf16_blockscale_BpreShuffle_64x128E,87.6,0.43044,0.0058
gfx942,80,608,128,7168,asm,23,8,12.0352,_ZN5aiter42fp8gemm_bf16_blockscale_BpreShuffle_64x128E,92.7,0.45128,0.0094
gfx942,80,640,128,7168,asm,23,8,12.0049,_ZN5aiter42fp8gemm_bf16_blockscale_BpreShuffle_64x128E,97.83,0.47221,0.0069
gfx942,80,672,128,7168,asm,22,7,12.7084,_ZN5aiter42fp8gemm_bf16_blockscale_BpreShuffle_64x128E,97.03,0.46477,0.0015
gfx942,80,704,128,7168,asm,22,7,12.6384,_ZN5aiter42fp8gemm_bf16_blockscale_BpreShuffle_64x128E,102.22,0.48614,0.0063
gfx942,80,736,128,7168,asm,12,5,13.2313,_ZN5aiter42fp8gemm_bf16_blockscale_BpreShuffle_48x128E,102.07,0.48231,0.0051
gfx942,80,768,128,7168,asm,12,5,13.3449,_ZN5aiter42fp8gemm_bf16_blockscale_BpreShuffle_48x128E,105.6,0.496,0.003
gfx942,80,800,128,7168,asm,21,6,13.9341,_ZN5aiter42fp8gemm_bf16_blockscale_BpreShuffle_64x128E,105.35,0.49208,0.004
gfx942,80,832,128,7168,asm,21,6,14.0037,_ZN5aiter42fp8gemm_bf16_blockscale_BpreShuffle_64x128E,109.02,0.5066,0.0034
gfx942,80,864,128,7168,asm,30,7,14.2731,_ZN5aiter42fp8gemm_bf16_blockscale_BpreShuffle_80x128E,111.08,0.51368,0.0046
gfx942,80,896,128,7168,asm,11,4,14.4045,_ZN5aiter42fp8gemm_bf16_blockscale_BpreShuffle_48x128E,114.14,0.52549,0.0013
gfx942,80,928,128,7168,asm,11,4,14.7676,_ZN5aiter42fp8gemm_bf16_blockscale_BpreShuffle_48x128E,115.31,0.52866,0.0013
gfx942,80,960,128,7168,asm,11,4,14.5718,_ZN5aiter42fp8gemm_bf16_blockscale_BpreShuffle_48x128E,120.89,0.55206,0.0031
gfx942,80,992,128,7168,asm,20,5,15.1298,_ZN5aiter42fp8gemm_bf16_blockscale_BpreShuffle_64x128E,120.31,0.5474,0.0044
gfx942,80,1024,128,7168,asm,20,5,15.2061,_ZN5aiter42fp8gemm_bf16_blockscale_BpreShuffle_64x128E,123.57,0.56028,0.003
gfx942,80,1088,128,7168,asm,19,4,16.4949,_ZN5aiter42fp8gemm_bf16_blockscale_BpreShuffle_64x128E,121.04,0.54531,0.0004
gfx942,80,1152,128,7168,asm,19,4,16.6122,_ZN5aiter42fp8gemm_bf16_blockscale_BpreShuffle_64x128E,127.25,0.57006,0.0039
gfx942,80,1216,128,7168,asm,10,3,16.681,_ZN5aiter42fp8gemm_bf16_blockscale_BpreShuffle_48x128E,133.77,0.59619,0.0
gfx942,80,1280,128,7168,asm,19,4,16.0918,_ZN5aiter42fp8gemm_bf16_blockscale_BpreShuffle_64x128E,145.96,0.64755,0.001
gfx942,80,1344,128,7168,asm,27,4,18.0412,_ZN5aiter42fp8gemm_bf16_blockscale_BpreShuffle_80x128E,136.7,0.60392,0.0011
gfx942,80,1408,128,7168,asm,27,4,18.4539,_ZN5aiter42fp8gemm_bf16_blockscale_BpreShuffle_80x128E,140.01,0.61616,0.0026
gfx942,80,1472,128,7168,asm,18,3,18.7933,_ZN5aiter42fp8gemm_bf16_blockscale_BpreShuffle_64x128E,143.73,0.63031,0.0001
gfx942,80,1536,128,7168,asm,27,4,18.6511,_ZN5aiter42fp8gemm_bf16_blockscale_BpreShuffle_80x128E,151.12,0.66059,0.0025
gfx942,80,1600,128,7168,asm,18,3,18.6901,_ZN5aiter42fp8gemm_bf16_blockscale_BpreShuffle_64x128E,157.09,0.68464,0.0001
gfx942,80,1664,128,7168,asm,18,3,19.3259,_ZN5aiter42fp8gemm_bf16_blockscale_BpreShuffle_64x128E,158.0,0.6867,0.0006
gfx942,80,1728,128,7168,asm,35,4,20.3878,_ZN5aiter42fp8gemm_bf16_blockscale_BpreShuffle_96x128E,155.53,0.67424,0.0026
gfx942,80,1792,128,7168,asm,35,4,20.8178,_ZN5aiter42fp8gemm_bf16_blockscale_BpreShuffle_96x128E,157.96,0.68313,0.0013
gfx942,80,1856,128,7168,asm,35,4,20.613,_ZN5aiter42fp8gemm_bf16_blockscale_BpreShuffle_96x128E,165.22,0.71297,0.0031
gfx942,80,1920,128,7168,asm,9,2,20.9766,_ZN5aiter42fp8gemm_bf16_blockscale_BpreShuffle_48x128E,167.96,0.72326,0.0
gfx942,80,1984,128,7168,asm,26,3,22.512,_ZN5aiter42fp8gemm_bf16_blockscale_BpreShuffle_80x128E,161.72,0.69504,0.0002
gfx942,80,2048,128,7168,asm,26,3,22.3308,_ZN5aiter42fp8gemm_bf16_blockscale_BpreShuffle_80x128E,168.29,0.72196,0.0
gfx942,80,4096,128,7168,asm,16,1,39.0305,_ZN5aiter42fp8gemm_bf16_blockscale_BpreShuffle_64x128E,192.57,0.80261,0.0
gfx942,80,8192,128,7168,asm,40,1,67.5646,_ZN5aiter43fp8gemm_bf16_blockscale_BpreShuffle_128x128E,222.49,0.91372,0.0
gfx942,80,16384,128,7168,asm,24,1,131.5466,_ZN5aiter42fp8gemm_bf16_blockscale_BpreShuffle_80x128E,228.55,0.93163,0.0
gfx942,80,32768,128,7168,asm,32,1,253.8005,_ZN5aiter42fp8gemm_bf16_blockscale_BpreShuffle_96x128E,236.92,0.96212,0.0
gfx942,80,16,2112,7168,ck,7,3,18.7169,a8w8_blockscale_bpreshuffle_1x128x128_256x16x64x256_16x16_16x16_16x16x1_16x16x1_1x16x1x16_4_1x1_intrawave_v1,25.88,0.81857,0.0
gfx942,80,32,2112,7168,ck,7,1,18.94,a8w8_blockscale_bpreshuffle_1x128x128_256x16x64x256_16x16_16x16_16x16x1_16x16x1_1x16x1x16_4_1x1_intrawave_v1,51.16,0.81855,0.0
gfx942,80,48,2112,7168,ck,7,1,22.4739,a8w8_blockscale_bpreshuffle_1x128x128_256x16x64x256_16x16_16x16_16x16x1_16x16x1_1x16x1x16_4_1x1_intrawave_v1,64.67,0.69795,0.0
gfx942,80,64,2112,7168,ck,12,1,21.9372,a8w8_blockscale_bpreshuffle_1x128x128_256x32x64x256_16x16_16x16_16x16x1_16x16x1_1x32x1x8_8_2x1_intrawave_v1,88.33,0.72333,0.0
gfx942,80,80,2112,7168,ck,7,0,30.5042,a8w8_blockscale_bpreshuffle_1x128x128_256x16x64x256_16x16_16x16_16x16x1_16x16x1_1x16x1x16_4_1x1_intrawave_v1,79.41,0.52616,0.0
gfx942,80,96,2112,7168,ck,12,0,30.5276,a8w8_blockscale_bpreshuffle_1x128x128_256x32x64x256_16x16_16x16_16x16x1_16x16x1_1x32x1x8_8_2x1_intrawave_v1,95.21,0.53173,0.0
gfx942,80,112,2112,7168,ck,12,2,31.5745,a8w8_blockscale_bpreshuffle_1x128x128_256x32x64x256_16x16_16x16_16x16x1_16x16x1_1x32x1x8_8_2x1_intrawave_v1,107.4,0.51987,0.0
gfx942,80,128,2112,7168,ck,12,1,30.9656,a8w8_blockscale_bpreshuffle_1x128x128_256x32x64x256_16x16_16x16_16x16x1_16x16x1_1x32x1x8_8_2x1_intrawave_v1,125.16,0.53598,0.0
gfx942,80,144,2112,7168,ck,10,2,37.7796,a8w8_blockscale_bpreshuffle_1x128x128_256x32x64x128_16x16_16x16_8x32x1_8x32x1_1x32x1x8_8_2x1_intrawave_v1,115.41,0.44414,0.0
gfx942,80,160,2112,7168,ck,10,2,37.3673,a8w8_blockscale_bpreshuffle_1x128x128_256x32x64x128_16x16_16x16_8x32x1_8x32x1_1x32x1x8_8_2x1_intrawave_v1,129.64,0.45391,0.0
gfx942,80,176,2112,7168,ck,10,1,40.1955,a8w8_blockscale_bpreshuffle_1x128x128_256x32x64x128_16x16_16x16_8x32x1_8x32x1_1x32x1x8_8_2x1_intrawave_v1,132.57,0.42651,0.0
gfx942,80,192,2112,7168,ck,10,0,40.2833,a8w8_blockscale_bpreshuffle_1x128x128_256x32x64x128_16x16_16x16_8x32x1_8x32x1_1x32x1x8_8_2x1_intrawave_v1,144.31,0.43011,0.0
gfx942,80,208,2112,7168,ck,10,3,41.3091,a8w8_blockscale_bpreshuffle_1x128x128_256x32x64x128_16x16_16x16_8x32x1_8x32x1_1x32x1x8_8_2x1_intrawave_v1,152.45,0.42384,0.0
gfx942,80,224,2112,7168,ck,10,3,41.3449,a8w8_blockscale_bpreshuffle_1x128x128_256x32x64x128_16x16_16x16_8x32x1_8x32x1_1x32x1x8_8_2x1_intrawave_v1,164.04,0.42788,0.0
gfx942,80,240,2112,7168,ck,17,1,54.189,a8w8_blockscale_bpreshuffle_1x128x128_256x64x64x256_16x16_16x16_16x16x1_16x16x1_1x32x1x8_8_2x1_intrawave_v1,134.1,0.32983,0.0
gfx942,80,256,2112,7168,ck,15,3,53.1156,a8w8_blockscale_bpreshuffle_1x128x128_256x64x64x128_16x16_16x16_8x32x1_8x32x1_1x32x1x8_8_2x1_intrawave_v1,145.93,0.33992,0.0
gfx942,80,288,2112,7168,ck,10,0,55.9433,a8w8_blockscale_bpreshuffle_1x128x128_256x32x64x128_16x16_16x16_8x32x1_8x32x1_1x32x1x8_8_2x1_intrawave_v1,155.87,0.32926,0.0
gfx942,80,320,2112,7168,ck,12,2,67.0011,a8w8_blockscale_bpreshuffle_1x128x128_256x32x64x256_16x16_16x16_16x16x1_16x16x1_1x32x1x8_8_2x1_intrawave_v1,144.61,0.28036,0.0
gfx942,80,352,2112,7168,ck,12,2,67.6667,a8w8_blockscale_bpreshuffle_1x128x128_256x32x64x256_16x16_16x16_16x16x1_16x16x1_1x32x1x8_8_2x1_intrawave_v1,157.5,0.28299,0.0
gfx942,80,384,2112,7168,ck,10,3,67.7239,a8w8_blockscale_bpreshuffle_1x128x128_256x32x64x128_16x16_16x16_8x32x1_8x32x1_1x32x1x8_8_2x1_intrawave_v1,171.68,0.28813,0.0
gfx942,80,416,2112,7168,ck,15,1,75.6952,a8w8_blockscale_bpreshuffle_1x128x128_256x64x64x128_16x16_16x16_8x32x1_8x32x1_1x32x1x8_8_2x1_intrawave_v1,166.4,0.2626,0.0
gfx942,80,448,2112,7168,ck,15,2,73.6203,a8w8_blockscale_bpreshuffle_1x128x128_256x64x64x128_16x16_16x16_8x32x1_8x32x1_1x32x1x8_8_2x1_intrawave_v1,184.25,0.27496,0.0
gfx942,80,480,2112,7168,ck,10,2,90.1308,a8w8_blockscale_bpreshuffle_1x128x128_256x32x64x128_16x16_16x16_8x32x1_8x32x1_1x32x1x8_8_2x1_intrawave_v1,161.25,0.22863,0.0
gfx942,80,512,2112,7168,ck,10,3,90.865,a8w8_blockscale_bpreshuffle_1x128x128_256x32x64x128_16x16_16x16_8x32x1_8x32x1_1x32x1x8_8_2x1_intrawave_v1,170.61,0.2308,0.0
gfx942,80,544,2112,7168,ck,15,0,95.6856,a8w8_blockscale_bpreshuffle_1x128x128_256x64x64x128_16x16_16x16_8x32x1_8x32x1_1x32x1x8_8_2x1_intrawave_v1,172.14,0.22298,0.0
gfx942,80,576,2112,7168,ck,15,1,100.1244,a8w8_blockscale_bpreshuffle_1x128x128_256x64x64x128_16x16_16x16_8x32x1_8x32x1_1x32x1x8_8_2x1_intrawave_v1,174.18,0.21674,0.0
gfx942,80,608,2112,7168,ck,10,1,102.0844,a8w8_blockscale_bpreshuffle_1x128x128_256x32x64x128_16x16_16x16_8x32x1_8x32x1_1x32x1x8_8_2x1_intrawave_v1,180.33,0.21615,0.0
gfx942,80,640,2112,7168,ck,10,2,111.563,a8w8_blockscale_bpreshuffle_1x128x128_256x32x64x128_16x16_16x16_8x32x1_8x32x1_1x32x1x8_8_2x1_intrawave_v1,173.69,0.20105,0.0
gfx942,80,672,2112,7168,ck,10,1,114.1413,a8w8_blockscale_bpreshuffle_1x128x128_256x32x64x128_16x16_16x16_8x32x1_8x32x1_1x32x1x8_8_2x1_intrawave_v1,178.26,0.1997,0.0
gfx942,80,704,2112,7168,ck,15,2,118.6633,a8w8_blockscale_bpreshuffle_1x128x128_256x64x64x128_16x16_16x16_8x32x1_8x32x1_1x32x1x8_8_2x1_intrawave_v1,179.63,0.19516,0.0
gfx942,80,736,2112,7168,ck,15,3,121.8899,a8w8_blockscale_bpreshuffle_1x128x128_256x64x64x128_16x16_16x16_8x32x1_8x32x1_1x32x1x8_8_2x1_intrawave_v1,182.82,0.19299,0.0
gfx942,80,768,2112,7168,ck,15,3,119.5591,a8w8_blockscale_bpreshuffle_1x128x128_256x64x64x128_16x16_16x16_8x32x1_8x32x1_1x32x1x8_8_2x1_intrawave_v1,194.49,0.1998,0.0
gfx942,80,800,2112,7168,ck,10,0,135.3582,a8w8_blockscale_bpreshuffle_1x128x128_256x32x64x128_16x16_16x16_8x32x1_8x32x1_1x32x1x8_8_2x1_intrawave_v1,178.95,0.17917,0.0
gfx942,80,832,2112,7168,ck,10,1,136.6989,a8w8_blockscale_bpreshuffle_1x128x128_256x32x64x128_16x16_16x16_8x32x1_8x32x1_1x32x1x8_8_2x1_intrawave_v1,184.28,0.18008,0.0
gfx942,80,864,2112,7168,ck,15,1,141.6178,a8w8_blockscale_bpreshuffle_1x128x128_256x64x64x128_16x16_16x16_8x32x1_8x32x1_1x32x1x8_8_2x1_intrawave_v1,184.72,0.1764,0.0
gfx942,80,896,2112,7168,ck,15,0,140.1552,a8w8_blockscale_bpreshuffle_1x128x128_256x64x64x128_16x16_16x16_8x32x1_8x32x1_1x32x1x8_8_2x1_intrawave_v1,193.56,0.18084,0.0
gfx942,80,928,2112,7168,ck,10,0,148.9956,a8w8_blockscale_bpreshuffle_1x128x128_256x32x64x128_16x16_16x16_8x32x1_8x32x1_1x32x1x8_8_2x1_intrawave_v1,188.58,0.17256,0.0
gfx942,80,960,2112,7168,ck,10,0,161.2393,a8w8_blockscale_bpreshuffle_1x128x128_256x32x64x128_16x16_16x16_8x32x1_8x32x1_1x32x1x8_8_2x1_intrawave_v1,180.27,0.16172,0.0
gfx942,80,992,2112,7168,ck,15,1,157.7571,a8w8_blockscale_bpreshuffle_1x128x128_256x64x64x128_16x16_16x16_8x32x1_8x32x1_1x32x1x8_8_2x1_intrawave_v1,190.39,0.1676,0.0
gfx942,80,1024,2112,7168,ck,2,0,160.0913,a8w8_blockscale_bpreshuffle_1x128x128_256x64x64x128_16x16_16x16_8x32x1_8x32x1_1x32x1x8_8_2x1_intrawave_v3,193.67,0.16743,0.0
gfx942,80,1088,2112,7168,ck,2,0,177.2614,a8w8_blockscale_bpreshuffle_1x128x128_256x64x64x128_16x16_16x16_8x32x1_8x32x1_1x32x1x8_8_2x1_intrawave_v3,185.84,0.15533,0.0
gfx942,80,1152,2112,7168,ck,10,0,179.6506,a8w8_blockscale_bpreshuffle_1x128x128_256x32x64x128_16x16_16x16_8x32x1_8x32x1_1x32x1x8_8_2x1_intrawave_v1,194.15,0.15732,0.0
gfx942,80,1216,2112,7168,ck,15,1,184.2345,a8w8_blockscale_bpreshuffle_1x128x128_256x64x64x128_16x16_16x16_8x32x1_8x32x1_1x32x1x8_8_2x1_intrawave_v1,199.84,0.15736,0.0
gfx942,80,1280,2112,7168,ck,10,1,198.6922,a8w8_blockscale_bpreshuffle_1x128x128_256x32x64x128_16x16_16x16_8x32x1_8x32x1_1x32x1x8_8_2x1_intrawave_v1,195.05,0.14958,0.0
gfx942,80,1344,2112,7168,ck,15,3,205.2034,a8w8_blockscale_bpreshuffle_1x128x128_256x64x64x128_16x16_16x16_8x32x1_8x32x1_1x32x1x8_8_2x1_intrawave_v1,198.31,0.14839,0.0
gfx942,80,1408,2112,7168,ck,10,3,225.0839,a8w8_blockscale_bpreshuffle_1x128x128_256x32x64x128_16x16_16x16_8x32x1_8x32x1_1x32x1x8_8_2x1_intrawave_v1,189.4,0.13852,0.0
gfx942,80,1472,2112,7168,ck,15,3,227.0834,a8w8_blockscale_bpreshuffle_1x128x128_256x64x64x128_16x16_16x16_8x32x1_8x32x1_1x32x1x8_8_2x1_intrawave_v1,196.27,0.14051,0.0
gfx942,80,1536,2112,7168,ck,15,2,226.0578,a8w8_blockscale_bpreshuffle_1x128x128_256x64x64x128_16x16_16x16_8x32x1_8x32x1_1x32x1x8_8_2x1_intrawave_v1,205.73,0.14437,0.0
gfx942,80,1600,2112,7168,ck,15,3,247.6727,a8w8_blockscale_bpreshuffle_1x128x128_256x64x64x128_16x16_16x16_8x32x1_8x32x1_1x32x1x8_8_2x1_intrawave_v1,195.6,0.13472,0.0
gfx942,80,1664,2112,7168,ck,15,2,248.5469,a8w8_blockscale_bpreshuffle_1x128x128_256x64x64x128_16x16_16x16_8x32x1_8x32x1_1x32x1x8_8_2x1_intrawave_v1,202.71,0.13718,0.0
gfx942,80,1728,2112,7168,ck,15,2,267.4093,a8w8_blockscale_bpreshuffle_1x128x128_256x64x64x128_16x16_16x16_8x32x1_8x32x1_1x32x1x8_8_2x1_intrawave_v1,195.65,0.13023,0.0
gfx942,80,1792,2112,7168,ck,15,1,268.6836,a8w8_blockscale_bpreshuffle_1x128x128_256x64x64x128_16x16_16x16_8x32x1_8x32x1_1x32x1x8_8_2x1_intrawave_v1,201.94,0.13232,0.0
gfx942,80,1856,2112,7168,ck,15,0,270.6934,a8w8_blockscale_bpreshuffle_1x128x128_256x64x64x128_16x16_16x16_8x32x1_8x32x1_1x32x1x8_8_2x1_intrawave_v1,207.6,0.13403,0.0
gfx942,80,1920,2112,7168,ck,15,0,293.7054,a8w8_blockscale_bpreshuffle_1x128x128_256x64x64x128_16x16_16x16_8x32x1_8x32x1_1x32x1x8_8_2x1_intrawave_v1,197.93,0.12602,0.0
gfx942,80,1984,2112,7168,ck,15,3,294.7005,a8w8_blockscale_bpreshuffle_1x128x128_256x64x64x128_16x16_16x16_8x32x1_8x32x1_1x32x1x8_8_2x1_intrawave_v1,203.84,0.12806,0.0
gfx942,80,2048,2112,7168,ck,2,1,305.3982,a8w8_blockscale_bpreshuffle_1x128x128_256x64x64x128_16x16_16x16_8x32x1_8x32x1_1x32x1x8_8_2x1_intrawave_v3,203.04,0.12597,0.0
gfx942,80,4096,2112,7168,ck,2,3,579.3995,a8w8_blockscale_bpreshuffle_1x128x128_256x64x64x128_16x16_16x16_8x32x1_8x32x1_1x32x1x8_8_2x1_intrawave_v3,214.04,0.10666,0.0
gfx942,80,8192,2112,7168,ck,2,0,1138.7172,a8w8_blockscale_bpreshuffle_1x128x128_256x64x64x128_16x16_16x16_8x32x1_8x32x1_1x32x1x8_8_2x1_intrawave_v3,217.82,0.09525,0.0
gfx942,80,16384,2112,7168,ck,2,0,2251.4918,a8w8_blockscale_bpreshuffle_1x128x128_256x64x64x128_16x16_16x16_8x32x1_8x32x1_1x32x1x8_8_2x1_intrawave_v3,220.33,0.08962,0.0
gfx942,80,32768,2112,7168,ck,2,2,4481.4633,a8w8_blockscale_bpreshuffle_1x128x128_256x64x64x128_16x16_16x16_8x32x1_8x32x1_1x32x1x8_8_2x1_intrawave_v3,221.39,0.08668,0.0
gfx942,80,16,2240,7168,ck,7,1,18.6177,a8w8_blockscale_bpreshuffle_1x128x128_256x16x64x256_16x16_16x16_16x16x1_16x16x1_1x16x1x16_4_1x1_intrawave_v1,27.6,0.87243,0.0
gfx942,80,32,2240,7168,ck,7,2,18.9027,a8w8_blockscale_bpreshuffle_1x128x128_256x16x64x256_16x16_16x16_16x16x1_16x16x1_1x16x1x16_4_1x1_intrawave_v1,54.36,0.86914,0.0
gfx942,80,48,2240,7168,ck,7,3,22.74,a8w8_blockscale_bpreshuffle_1x128x128_256x16x64x256_16x16_16x16_16x16x1_16x16x1_1x16x1x16_4_1x1_intrawave_v1,67.78,0.73067,0.0
gfx942,80,64,2240,7168,ck,12,2,21.9491,a8w8_blockscale_bpreshuffle_1x128x128_256x32x64x256_16x16_16x16_16x16x1_16x16x1_1x32x1x8_8_2x1_intrawave_v1,93.64,0.76549,0.0
gfx942,80,80,2240,7168,ck,7,1,31.174,a8w8_blockscale_bpreshuffle_1x128x128_256x16x64x256_16x16_16x16_16x16x1_16x16x1_1x16x1x16_4_1x1_intrawave_v1,82.41,0.54495,0.0
gfx942,80,96,2240,7168,ck,12,1,30.9387,a8w8_blockscale_bpreshuffle_1x128x128_256x32x64x256_16x16_16x16_16x16x1_16x16x1_1x32x1x8_8_2x1_intrawave_v1,99.64,0.55511,0.0
gfx942,80,112,2240,7168,ck,12,2,31.9012,a8w8_blockscale_bpreshuffle_1x128x128_256x32x64x256_16x16_16x16_16x16x1_16x16x1_1x32x1x8_8_2x1_intrawave_v1,112.74,0.54421,0.0
gfx942,80,128,2240,7168,ck,12,1,31.1913,a8w8_blockscale_bpreshuffle_1x128x128_256x32x64x256_16x16_16x16_16x16x1_16x16x1_1x32x1x8_8_2x1_intrawave_v1,131.78,0.56257,0.0
gfx942,80,144,2240,7168,ck,10,0,38.293,a8w8_blockscale_bpreshuffle_1x128x128_256x32x64x128_16x16_16x16_8x32x1_8x32x1_1x32x1x8_8_2x1_intrawave_v1,120.76,0.4631,0.0
gfx942,80,160,2240,7168,ck,10,3,37.6075,a8w8_blockscale_bpreshuffle_1x128x128_256x32x64x128_16x16_16x16_8x32x1_8x32x1_1x32x1x8_8_2x1_intrawave_v1,136.62,0.4765,0.0
gfx942,80,176,2240,7168,ck,10,0,41.201,a8w8_blockscale_bpreshuffle_1x128x128_256x32x64x128_16x16_16x16_8x32x1_8x32x1_1x32x1x8_8_2x1_intrawave_v1,137.18,0.43946,0.0
gfx942,80,192,2240,7168,ck,10,3,41.0913,a8w8_blockscale_bpreshuffle_1x128x128_256x32x64x128_16x16_16x16_8x32x1_8x32x1_1x32x1x8_8_2x1_intrawave_v1,150.05,0.44517,0.0
gfx942,80,208,2240,7168,ck,10,1,52.7835,a8w8_blockscale_bpreshuffle_1x128x128_256x32x64x128_16x16_16x16_8x32x1_8x32x1_1x32x1x8_8_2x1_intrawave_v1,126.54,0.35009,0.0
gfx942,80,224,2240,7168,ck,10,1,53.3349,a8w8_blockscale_bpreshuffle_1x128x128_256x32x64x128_16x16_16x16_8x32x1_8x32x1_1x32x1x8_8_2x1_intrawave_v1,134.87,0.34997,0.0
gfx942,80,240,2240,7168,ck,17,0,54.4354,a8w8_blockscale_bpreshuffle_1x128x128_256x64x64x256_16x16_16x16_16x16x1_16x16x1_1x32x1x8_8_2x1_intrawave_v1,141.58,0.34632,0.0
gfx942,80,256,2240,7168,ck,15,1,53.2883,a8w8_blockscale_bpreshuffle_1x128x128_256x64x64x128_16x16_16x16_8x32x1_8x32x1_1x32x1x8_8_2x1_intrawave_v1,154.27,0.35727,0.0
gfx942,80,288,2240,7168,ck,12,2,56.8997,a8w8_blockscale_bpreshuffle_1x128x128_256x32x64x256_16x16_16x16_16x16x1_16x16x1_1x32x1x8_8_2x1_intrawave_v1,162.54,0.34114,0.0
gfx942,80,320,2240,7168,ck,12,3,67.6056,a8w8_blockscale_bpreshuffle_1x128x128_256x32x64x256_16x16_16x16_16x16x1_16x16x1_1x32x1x8_8_2x1_intrawave_v1,152.0,0.29263,0.0
gfx942,80,352,2240,7168,ck,12,0,68.2986,a8w8_blockscale_bpreshuffle_1x128x128_256x32x64x256_16x16_16x16_16x16x1_16x16x1_1x32x1x8_8_2x1_intrawave_v1,165.5,0.29512,0.0
gfx942,80,384,2240,7168,ck,15,1,72.8546,a8w8_blockscale_bpreshuffle_1x128x128_256x64x64x128_16x16_16x16_8x32x1_8x32x1_1x32x1x8_8_2x1_intrawave_v1,169.26,0.28178,0.0
gfx942,80,416,2240,7168,ck,12,3,79.5584,a8w8_blockscale_bpreshuffle_1x128x128_256x32x64x256_16x16_16x16_16x16x1_16x16x1_1x32x1x8_8_2x1_intrawave_v1,167.91,0.26272,0.0
gfx942,80,448,2240,7168,ck,2,2,90.1647,a8w8_blockscale_bpreshuffle_1x128x128_256x64x64x128_16x16_16x16_8x32x1_8x32x1_1x32x1x8_8_2x1_intrawave_v3,159.56,0.23595,0.0
gfx942,80,480,2240,7168,ck,10,1,92.0207,a8w8_blockscale_bpreshuffle_1x128x128_256x32x64x128_16x16_16x16_8x32x1_8x32x1_1x32x1x8_8_2x1_intrawave_v1,167.51,0.23524,0.0
gfx942,80,512,2240,7168,ck,10,1,92.456,a8w8_blockscale_bpreshuffle_1x128x128_256x32x64x128_16x16_16x16_8x32x1_8x32x1_1x32x1x8_8_2x1_intrawave_v1,177.83,0.23817,0.0
gfx942,80,544,2240,7168,ck,15,0,96.8123,a8w8_blockscale_bpreshuffle_1x128x128_256x64x64x128_16x16_16x16_8x32x1_8x32x1_1x32x1x8_8_2x1_intrawave_v1,180.44,0.2313,0.0
gfx942,80,576,2240,7168,ck,15,3,100.4176,a8w8_blockscale_bpreshuffle_1x128x128_256x64x64x128_16x16_16x16_8x32x1_8x32x1_1x32x1x8_8_2x1_intrawave_v1,184.2,0.22671,0.0
gfx942,80,608,2240,7168,ck,10,3,112.1569,a8w8_blockscale_bpreshuffle_1x128x128_256x32x64x128_16x16_16x16_8x32x1_8x32x1_1x32x1x8_8_2x1_intrawave_v1,174.08,0.2063,0.0
gfx942,80,640,2240,7168,ck,10,2,112.5448,a8w8_blockscale_bpreshuffle_1x128x128_256x32x64x128_16x16_16x16_8x32x1_8x32x1_1x32x1x8_8_2x1_intrawave_v1,182.61,0.2089,0.0
gfx942,80,672,2240,7168,ck,15,3,122.3143,a8w8_blockscale_bpreshuffle_1x128x128_256x64x64x128_16x16_16x16_8x32x1_8x32x1_1x32x1x8_8_2x1_intrawave_v1,176.43,0.19527,0.0
gfx942,80,704,2240,7168,ck,15,1,119.8154,a8w8_blockscale_bpreshuffle_1x128x128_256x64x64x128_16x16_16x16_8x32x1_8x32x1_1x32x1x8_8_2x1_intrawave_v1,188.68,0.20245,0.0
gfx942,80,736,2240,7168,ck,10,1,133.8018,a8w8_blockscale_bpreshuffle_1x128x128_256x32x64x128_16x16_16x16_8x32x1_8x32x1_1x32x1x8_8_2x1_intrawave_v1,176.64,0.18407,0.0
gfx942,80,768,2240,7168,ck,10,3,133.169,a8w8_blockscale_bpreshuffle_1x128x128_256x32x64x128_16x16_16x16_8x32x1_8x32x1_1x32x1x8_8_2x1_intrawave_v1,185.2,0.18775,0.0
gfx942,80,800,2240,7168,ck,10,2,137.4687,a8w8_blockscale_bpreshuffle_1x128x128_256x32x64x128_16x16_16x16_8x32x1_8x32x1_1x32x1x8_8_2x1_intrawave_v1,186.88,0.18459,0.0
gfx942,80,832,2240,7168,ck,15,2,140.8137,a8w8_blockscale_bpreshuffle_1x128x128_256x64x64x128_16x16_16x16_8x32x1_8x32x1_1x32x1x8_8_2x1_intrawave_v1,189.74,0.18285,0.0
gfx942,80,864,2240,7168,ck,10,3,147.5081,a8w8_blockscale_bpreshuffle_1x128x128_256x32x64x128_16x16_16x16_8x32x1_8x32x1_1x32x1x8_8_2x1_intrawave_v1,188.09,0.17708,0.0
gfx942,80,896,2240,7168,ck,10,2,157.4241,a8w8_blockscale_bpreshuffle_1x128x128_256x32x64x128_16x16_16x16_8x32x1_8x32x1_1x32x1x8_8_2x1_intrawave_v1,182.77,0.16829,0.0
gfx942,80,928,2240,7168,ck,10,1,159.8802,a8w8_blockscale_bpreshuffle_1x128x128_256x32x64x128_16x16_16x16_8x32x1_8x32x1_1x32x1x8_8_2x1_intrawave_v1,186.39,0.16804,0.0
gfx942,80,960,2240,7168,ck,15,2,164.5702,a8w8_blockscale_bpreshuffle_1x128x128_256x64x64x128_16x16_16x16_8x32x1_8x32x1_1x32x1x8_8_2x1_intrawave_v1,187.33,0.16551,0.0
gfx942,80,992,2240,7168,ck,15,3,159.0991,a8w8_blockscale_bpreshuffle_1x128x128_256x64x64x128_16x16_16x16_8x32x1_8x32x1_1x32x1x8_8_2x1_intrawave_v1,200.23,0.17355,0.0
gfx942,80,1024,2240,7168,ck,15,3,162.6083,a8w8_blockscale_bpreshuffle_1x128x128_256x64x64x128_16x16_16x16_8x32x1_8x32x1_1x32x1x8_8_2x1_intrawave_v1,202.22,0.17209,0.0
gfx942,80,1088,2240,7168,ck,15,2,184.6629,a8w8_blockscale_bpreshuffle_1x128x128_256x64x64x128_16x16_16x16_8x32x1_8x32x1_1x32x1x8_8_2x1_intrawave_v1,189.2,0.15558,0.0
gfx942,80,1152,2240,7168,ck,15,0,183.5025,a8w8_blockscale_bpreshuffle_1x128x128_256x64x64x128_16x16_16x16_8x32x1_8x32x1_1x32x1x8_8_2x1_intrawave_v1,201.6,0.16062,0.0
gfx942,80,1216,2240,7168,ck,10,0,202.4083,a8w8_blockscale_bpreshuffle_1x128x128_256x32x64x128_16x16_16x16_8x32x1_8x32x1_1x32x1x8_8_2x1_intrawave_v1,192.92,0.1493,0.0
gfx942,80,1280,2240,7168,ck,15,1,205.2885,a8w8_blockscale_bpreshuffle_1x128x128_256x64x64x128_16x16_16x16_8x32x1_8x32x1_1x32x1x8_8_2x1_intrawave_v1,200.23,0.15084,0.0
gfx942,80,1344,2240,7168,ck,10,2,224.9089,a8w8_blockscale_bpreshuffle_1x128x128_256x32x64x128_16x16_16x16_8x32x1_8x32x1_1x32x1x8_8_2x1_intrawave_v1,191.9,0.141,0.0
gfx942,80,1408,2240,7168,ck,15,3,227.9458,a8w8_blockscale_bpreshuffle_1x128x128_256x64x64x128_16x16_16x16_8x32x1_8x32x1_1x32x1x8_8_2x1_intrawave_v1,198.36,0.14239,0.0
gfx942,80,1472,2240,7168,ck,15,2,246.7014,a8w8_blockscale_bpreshuffle_1x128x128_256x64x64x128_16x16_16x16_8x32x1_8x32x1_1x32x1x8_8_2x1_intrawave_v1,191.61,0.13458,0.0
gfx942,80,1536,2240,7168,ck,15,0,245.175,a8w8_blockscale_bpreshuffle_1x128x128_256x64x64x128_16x16_16x16_8x32x1_8x32x1_1x32x1x8_8_2x1_intrawave_v1,201.18,0.13846,0.0
gfx942,80,1600,2240,7168,ck,15,0,248.837,a8w8_blockscale_bpreshuffle_1x128x128_256x64x64x128_16x16_16x16_8x32x1_8x32x1_1x32x1x8_8_2x1_intrawave_v1,206.48,0.13942,0.0
gfx942,80,1664,2240,7168,ck,15,0,270.2424,a8w8_blockscale_bpreshuffle_1x128x128_256x64x64x128_16x16_16x16_8x32x1_8x32x1_1x32x1x8_8_2x1_intrawave_v1,197.73,0.13114,0.0
gfx942,80,1728,2240,7168,ck,15,2,270.6398,a8w8_blockscale_bpreshuffle_1x128x128_256x64x64x128_16x16_16x16_8x32x1_8x32x1_1x32x1x8_8_2x1_intrawave_v1,205.04,0.1337,0.0
gfx942,80,1792,2240,7168,ck,10,2,288.2416,a8w8_blockscale_bpreshuffle_1x128x128_256x32x64x128_16x16_16x16_8x32x1_8x32x1_1x32x1x8_8_2x1_intrawave_v1,199.64,0.12812,0.0
gfx942,80,1856,2240,7168,ck,15,1,292.1765,a8w8_blockscale_bpreshuffle_1x128x128_256x64x64x128_16x16_16x16_8x32x1_8x32x1_1x32x1x8_8_2x1_intrawave_v1,203.99,0.12895,0.0
gfx942,80,1920,2240,7168,ck,2,3,314.4694,a8w8_blockscale_bpreshuffle_1x128x128_256x64x64x128_16x16_16x16_8x32x1_8x32x1_1x32x1x8_8_2x1_intrawave_v3,196.06,0.12218,0.0
gfx942,80,1984,2240,7168,ck,15,2,315.1684,a8w8_blockscale_bpreshuffle_1x128x128_256x64x64x128_16x16_16x16_8x32x1_8x32x1_1x32x1x8_8_2x1_intrawave_v1,202.15,0.12427,0.0
gfx942,80,2048,2240,7168,ck,2,1,309.6951,a8w8_blockscale_bpreshuffle_1x128x128_256x64x64x128_16x16_16x16_8x32x1_8x32x1_1x32x1x8_8_2x1_intrawave_v3,212.36,0.12887,0.0
gfx942,80,4096,2240,7168,ck,2,1,601.4605,a8w8_blockscale_bpreshuffle_1x128x128_256x64x64x128_16x16_16x16_8x32x1_8x32x1_1x32x1x8_8_2x1_intrawave_v3,218.69,0.10602,0.0
gfx942,80,8192,2240,7168,ck,2,1,1188.2527,a8w8_blockscale_bpreshuffle_1x128x128_256x64x64x128_16x16_16x16_8x32x1_8x32x1_1x32x1x8_8_2x1_intrawave_v3,221.39,0.09382,0.0
gfx942,80,16384,2240,7168,ck,2,1,2360.0542,a8w8_blockscale_bpreshuffle_1x128x128_256x64x64x128_16x16_16x16_8x32x1_8x32x1_1x32x1x8_8_2x1_intrawave_v3,222.93,0.08767,0.0
gfx942,80,32768,2240,7168,ck,2,3,4701.297,a8w8_blockscale_bpreshuffle_1x128x128_256x64x64x128_16x16_16x16_8x32x1_8x32x1_1x32x1x8_8_2x1_intrawave_v3,223.82,0.0846,0.0
gfx942,80,16,3072,7168,asm,2,3,14.7518,_ZN5aiter42fp8gemm_bf16_blockscale_BpreShuffle_32x128E,47.77,1.50714,0.0003
gfx942,80,32,3072,7168,asm,2,3,15.1746,_ZN5aiter42fp8gemm_bf16_blockscale_BpreShuffle_32x128E,92.87,1.47919,0.0005
gfx942,80,48,3072,7168,asm,10,3,16.3772,_ZN5aiter42fp8gemm_bf16_blockscale_BpreShuffle_48x128E,129.08,1.38357,0.0003
gfx942,80,64,3072,7168,asm,18,3,19.1366,_ZN5aiter42fp8gemm_bf16_blockscale_BpreShuffle_64x128E,147.29,1.1952,0.0003
gfx942,80,80,3072,7168,asm,26,3,21.3361,_ZN5aiter42fp8gemm_bf16_blockscale_BpreShuffle_80x128E,165.13,1.08197,0.0003
gfx942,80,96,3072,7168,asm,34,3,24.1384,_ZN5aiter42fp8gemm_bf16_blockscale_BpreShuffle_96x128E,175.15,0.96519,0.0004
gfx942,80,112,3072,7168,asm,42,3,30.6896,_ZN5aiter43fp8gemm_bf16_blockscale_BpreShuffle_128x128E,160.72,0.76609,0.0002
gfx942,80,128,3072,7168,asm,42,3,31.1104,_ZN5aiter43fp8gemm_bf16_blockscale_BpreShuffle_128x128E,181.2,0.76258,0.0003
gfx942,80,144,3072,7168,asm,8,1,32.2185,_ZN5aiter42fp8gemm_bf16_blockscale_BpreShuffle_48x128E,196.84,0.74296,0.0
gfx942,80,160,3072,7168,asm,16,1,37.4621,_ZN5aiter42fp8gemm_bf16_blockscale_BpreShuffle_64x128E,188.09,0.64465,0.0
gfx942,80,176,3072,7168,asm,16,1,37.5267,_ZN5aiter42fp8gemm_bf16_blockscale_BpreShuffle_64x128E,206.55,0.64922,0.0
gfx942,80,192,3072,7168,asm,16,1,38.8934,_ZN5aiter42fp8gemm_bf16_blockscale_BpreShuffle_64x128E,217.41,0.63188,0.0
gfx942,80,208,3072,7168,asm,24,1,44.877,_ZN5aiter42fp8gemm_bf16_blockscale_BpreShuffle_80x128E,204.12,0.55238,0.0
gfx942,80,224,3072,7168,asm,24,1,44.6339,_ZN5aiter42fp8gemm_bf16_blockscale_BpreShuffle_80x128E,221.02,0.56016,0.0
gfx942,80,240,3072,7168,asm,24,1,45.0432,_ZN5aiter42fp8gemm_bf16_blockscale_BpreShuffle_80x128E,234.66,0.5598,0.0
gfx942,80,256,3072,7168,asm,32,1,51.4846,_ZN5aiter42fp8gemm_bf16_blockscale_BpreShuffle_96x128E,218.98,0.49389,0.0
gfx942,80,288,3072,7168,asm,32,1,52.1175,_ZN5aiter42fp8gemm_bf16_blockscale_BpreShuffle_96x128E,243.36,0.49607,0.0
gfx942,80,320,3072,7168,asm,40,1,66.4841,_ZN5aiter43fp8gemm_bf16_blockscale_BpreShuffle_128x128E,211.97,0.39528,0.0
gfx942,80,352,3072,7168,asm,40,1,66.6063,_ZN5aiter43fp8gemm_bf16_blockscale_BpreShuffle_128x128E,232.74,0.40095,0.0
gfx942,80,384,3072,7168,asm,40,1,66.0279,_ZN5aiter43fp8gemm_bf16_blockscale_BpreShuffle_128x128E,256.13,0.41092,0.0
gfx942,80,416,3072,7168,ck,8,2,83.1534,a8w8_blockscale_bpreshuffle_1x128x128_256x32x256x128_16x16_16x16_8x32x1_8x32x1_1x32x1x8_8_2x1_intrawave_v1,220.32,0.33141,0.0
gfx942,80,448,3072,7168,asm,24,1,86.7783,_ZN5aiter42fp8gemm_bf16_blockscale_BpreShuffle_80x128E,227.36,0.32248,0.0
gfx942,80,480,3072,7168,asm,24,1,86.7924,_ZN5aiter42fp8gemm_bf16_blockscale_BpreShuffle_80x128E,243.56,0.32733,0.0
gfx942,80,512,3072,7168,asm,32,1,100.7868,_ZN5aiter42fp8gemm_bf16_blockscale_BpreShuffle_96x128E,223.73,0.28611,0.0
gfx942,80,544,3072,7168,asm,32,1,101.2355,_ZN5aiter42fp8gemm_bf16_blockscale_BpreShuffle_96x128E,236.65,0.28905,0.0
gfx942,80,576,3072,7168,asm,32,1,101.2702,_ZN5aiter42fp8gemm_bf16_blockscale_BpreShuffle_96x128E,250.49,0.29315,0.0
gfx942,80,608,3072,7168,asm,16,1,109.2248,_ZN5aiter42fp8gemm_bf16_blockscale_BpreShuffle_64x128E,245.15,0.2757,0.0
gfx942,80,640,3072,7168,asm,16,1,109.7489,_ZN5aiter42fp8gemm_bf16_blockscale_BpreShuffle_64x128E,256.82,0.27827,0.0
gfx942,80,672,3072,7168,asm,24,1,129.1709,_ZN5aiter42fp8gemm_bf16_blockscale_BpreShuffle_80x128E,229.12,0.23973,0.0
gfx942,80,704,3072,7168,asm,24,1,129.3467,_ZN5aiter42fp8gemm_bf16_blockscale_BpreShuffle_80x128E,239.7,0.24269,0.0
gfx942,80,736,3072,7168,asm,24,1,129.0532,_ZN5aiter42fp8gemm_bf16_blockscale_BpreShuffle_80x128E,251.16,0.24655,0.0
gfx942,80,768,3072,7168,asm,24,1,129.1372,_ZN5aiter42fp8gemm_bf16_blockscale_BpreShuffle_80x128E,261.91,0.24969,0.0
gfx942,80,800,3072,7168,asm,24,1,129.9978,_ZN5aiter42fp8gemm_bf16_blockscale_BpreShuffle_80x128E,271.02,0.25131,0.0
gfx942,80,832,3072,7168,ck,13,0,143.482,a8w8_blockscale_bpreshuffle_1x128x128_256x64x256x128_16x16_16x16_8x32x1_8x32x1_1x32x1x8_8_2x1_intrawave_v1,255.37,0.23066,0.0
gfx942,80,864,3072,7168,asm,32,1,150.7098,_ZN5aiter42fp8gemm_bf16_blockscale_BpreShuffle_96x128E,252.48,0.22243,0.0
gfx942,80,896,3072,7168,asm,32,1,151.3445,_ZN5aiter42fp8gemm_bf16_blockscale_BpreShuffle_96x128E,260.73,0.22431,0.0
gfx942,80,928,3072,7168,asm,32,1,150.9175,_ZN5aiter42fp8gemm_bf16_blockscale_BpreShuffle_96x128E,270.81,0.22776,0.0
gfx942,80,960,3072,7168,asm,32,1,151.8724,_ZN5aiter42fp8gemm_bf16_blockscale_BpreShuffle_96x128E,278.38,0.22914,0.0
gfx942,80,992,3072,7168,asm,24,1,171.2941,_ZN5aiter42fp8gemm_bf16_blockscale_BpreShuffle_80x128E,255.05,0.20564,0.0
gfx942,80,1024,3072,7168,asm,24,1,171.4075,_ZN5aiter42fp8gemm_bf16_blockscale_BpreShuffle_80x128E,263.1,0.20799,0.0
gfx942,80,1088,3072,7168,asm,40,1,193.1534,_ZN5aiter43fp8gemm_bf16_blockscale_BpreShuffle_128x128E,248.07,0.18899,0.0
gfx942,80,1152,3072,7168,asm,40,1,193.8971,_ZN5aiter43fp8gemm_bf16_blockscale_BpreShuffle_128x128E,261.66,0.19266,0.0
gfx942,80,1216,3072,7168,asm,40,1,194.3037,_ZN5aiter43fp8gemm_bf16_blockscale_BpreShuffle_128x128E,275.61,0.19664,0.0
gfx942,80,1280,3072,7168,asm,40,1,194.8454,_ZN5aiter43fp8gemm_bf16_blockscale_BpreShuffle_128x128E,289.31,0.20046,0.0
gfx942,80,1344,3072,7168,ck,14,0,240.2304,a8w8_blockscale_bpreshuffle_1x128x128_256x64x128x128_16x16_16x16_8x32x1_8x32x1_1x32x1x8_8_2x1_intrawave_v1,246.39,0.16614,0.0
gfx942,80,1408,3072,7168,ck,14,0,241.4383,a8w8_blockscale_bpreshuffle_1x128x128_256x64x128x128_16x16_16x16_8x32x1_8x32x1_1x32x1x8_8_2x1_intrawave_v1,256.83,0.16884,0.0
gfx942,80,1472,3072,7168,ck,14,0,242.5473,a8w8_blockscale_bpreshuffle_1x128x128_256x64x128x128_16x16_16x16_8x32x1_8x32x1_1x32x1x8_8_2x1_intrawave_v1,267.28,0.17158,0.0
gfx942,80,1536,3072,7168,asm,32,1,249.4324,_ZN5aiter42fp8gemm_bf16_blockscale_BpreShuffle_96x128E,271.2,0.17026,0.0
gfx942,80,1600,3072,7168,asm,24,1,255.5933,_ZN5aiter42fp8gemm_bf16_blockscale_BpreShuffle_80x128E,275.69,0.16949,0.0
gfx942,80,1664,3072,7168,asm,40,1,258.3348,_ZN5aiter43fp8gemm_bf16_blockscale_BpreShuffle_128x128E,283.67,0.17098,0.0
gfx942,80,1728,3072,7168,asm,24,1,296.3123,_ZN5aiter42fp8gemm_bf16_blockscale_BpreShuffle_80x128E,256.83,0.15195,0.0
gfx942,80,1792,3072,7168,asm,32,1,296.8403,_ZN5aiter42fp8gemm_bf16_blockscale_BpreShuffle_96x128E,265.87,0.15455,0.0
gfx942,80,1856,3072,7168,asm,32,1,299.4231,_ZN5aiter42fp8gemm_bf16_blockscale_BpreShuffle_96x128E,272.99,0.15606,0.0
gfx942,80,1920,3072,7168,asm,32,1,300.2875,_ZN5aiter42fp8gemm_bf16_blockscale_BpreShuffle_96x128E,281.59,0.15845,0.0
gfx942,80,1984,3072,7168,asm,40,1,320.1208,_ZN5aiter43fp8gemm_bf16_blockscale_BpreShuffle_128x128E,272.95,0.15129,0.0
gfx942,80,2048,3072,7168,asm,40,1,320.2291,_ZN5aiter43fp8gemm_bf16_blockscale_BpreShuffle_128x128E,281.66,0.1539,0.0
gfx942,80,4096,3072,7168,asm,40,1,636.3343,_ZN5aiter43fp8gemm_bf16_blockscale_BpreShuffle_128x128E,283.48,0.12029,0.0
gfx942,80,8192,3072,7168,asm,40,1,1275.0246,_ZN5aiter43fp8gemm_bf16_blockscale_BpreShuffle_128x128E,282.96,0.1028,0.0
gfx942,80,16384,3072,7168,asm,40,1,2479.218,_ZN5aiter43fp8gemm_bf16_blockscale_BpreShuffle_128x128E,291.04,0.09685,0.0
gfx942,80,32768,3072,7168,asm,40,1,4894.7436,_ZN5aiter43fp8gemm_bf16_blockscale_BpreShuffle_128x128E,294.83,0.09362,0.0
gfx942,80,16,4096,7168,ck,7,2,18.6898,a8w8_blockscale_bpreshuffle_1x128x128_256x16x64x256_16x16_16x16_16x16x1_16x16x1_1x16x1x16_4_1x1_intrawave_v1,50.27,1.58407,0.0
gfx942,80,32,4096,7168,asm,1,2,19.8485,_ZN5aiter42fp8gemm_bf16_blockscale_BpreShuffle_32x128E,94.67,1.50398,0.0
gfx942,80,48,4096,7168,asm,9,2,21.2654,_ZN5aiter42fp8gemm_bf16_blockscale_BpreShuffle_48x128E,132.54,1.41532,0.0
gfx942,80,64,4096,7168,asm,17,2,24.648,_ZN5aiter42fp8gemm_bf16_blockscale_BpreShuffle_64x128E,152.47,1.23106,0.0
gfx942,80,80,4096,7168,asm,25,2,27.8644,_ZN5aiter42fp8gemm_bf16_blockscale_BpreShuffle_80x128E,168.59,1.09778,0.0
gfx942,80,96,4096,7168,asm,33,2,31.9848,_ZN5aiter42fp8gemm_bf16_blockscale_BpreShuffle_96x128E,176.24,0.96404,0.0
gfx942,80,112,4096,7168,asm,16,1,37.6722,_ZN5aiter42fp8gemm_bf16_blockscale_BpreShuffle_64x128E,174.58,0.82502,0.0
gfx942,80,128,4096,7168,asm,16,1,38.5926,_ZN5aiter42fp8gemm_bf16_blockscale_BpreShuffle_64x128E,194.76,0.81172,0.0
gfx942,80,144,4096,7168,asm,24,1,44.6865,_ZN5aiter42fp8gemm_bf16_blockscale_BpreShuffle_80x128E,189.22,0.70652,0.0
gfx942,80,160,4096,7168,asm,24,1,45.084,_ZN5aiter42fp8gemm_bf16_blockscale_BpreShuffle_80x128E,208.39,0.70574,0.0
gfx942,80,176,4096,7168,asm,32,1,51.7128,_ZN5aiter42fp8gemm_bf16_blockscale_BpreShuffle_96x128E,199.85,0.62003,0.0
gfx942,80,192,4096,7168,asm,32,1,51.8181,_ZN5aiter42fp8gemm_bf16_blockscale_BpreShuffle_96x128E,217.57,0.62351,0.0
gfx942,80,208,4096,7168,asm,8,1,61.2001,_ZN5aiter42fp8gemm_bf16_blockscale_BpreShuffle_48x128E,199.57,0.53194,0.0
gfx942,80,224,4096,7168,asm,8,1,61.9614,_ZN5aiter42fp8gemm_bf16_blockscale_BpreShuffle_48x128E,212.28,0.52937,0.0
gfx942,80,240,4096,7168,asm,8,1,61.8393,_ZN5aiter42fp8gemm_bf16_blockscale_BpreShuffle_48x128E,227.89,0.53439,0.0
gfx942,80,256,4096,7168,asm,40,1,66.2085,_ZN5aiter43fp8gemm_bf16_blockscale_BpreShuffle_128x128E,227.05,0.50284,0.0
gfx942,80,288,4096,7168,asm,16,1,73.8928,_ZN5aiter42fp8gemm_bf16_blockscale_BpreShuffle_64x128E,228.86,0.4572,0.0
gfx942,80,320,4096,7168,asm,16,1,74.1163,_ZN5aiter42fp8gemm_bf16_blockscale_BpreShuffle_64x128E,253.53,0.46245,0.0
gfx942,80,352,4096,7168,asm,24,1,87.0854,_ZN5aiter42fp8gemm_bf16_blockscale_BpreShuffle_80x128E,237.35,0.39923,0.0
gfx942,80,384,4096,7168,asm,24,1,87.1334,_ZN5aiter42fp8gemm_bf16_blockscale_BpreShuffle_80x128E,258.78,0.40465,0.0
gfx942,80,416,4096,7168,asm,32,1,101.4157,_ZN5aiter42fp8gemm_bf16_blockscale_BpreShuffle_96x128E,240.87,0.35251,0.0
gfx942,80,448,4096,7168,asm,32,1,101.7786,_ZN5aiter42fp8gemm_bf16_blockscale_BpreShuffle_96x128E,258.47,0.35608,0.0
gfx942,80,480,4096,7168,asm,32,1,101.8047,_ZN5aiter42fp8gemm_bf16_blockscale_BpreShuffle_96x128E,276.86,0.36082,0.0
gfx942,80,512,4096,7168,asm,24,1,128.1009,_ZN5aiter42fp8gemm_bf16_blockscale_BpreShuffle_80x128E,234.7,0.29059,0.0
gfx942,80,544,4096,7168,asm,24,1,128.311,_ZN5aiter42fp8gemm_bf16_blockscale_BpreShuffle_80x128E,248.96,0.29394,0.0
gfx942,80,576,4096,7168,asm,40,1,130.2276,_ZN5aiter43fp8gemm_bf16_blockscale_BpreShuffle_128x128E,259.72,0.29339,0.0
gfx942,80,608,4096,7168,asm,40,1,130.2322,_ZN5aiter43fp8gemm_bf16_blockscale_BpreShuffle_128x128E,274.14,0.29715,0.0
gfx942,80,640,4096,7168,asm,40,1,131.0452,_ZN5aiter43fp8gemm_bf16_blockscale_BpreShuffle_128x128E,286.78,0.29906,0.0
gfx942,80,672,4096,7168,asm,32,1,150.7739,_ZN5aiter42fp8gemm_bf16_blockscale_BpreShuffle_96x128E,261.72,0.26319,0.0
gfx942,80,704,4096,7168,asm,24,1,170.3934,_ZN5aiter42fp8gemm_bf16_blockscale_BpreShuffle_80x128E,242.61,0.23577,0.0
gfx942,80,736,4096,7168,asm,24,1,171.4084,_ZN5aiter42fp8gemm_bf16_blockscale_BpreShuffle_80x128E,252.14,0.23724,0.0
gfx942,80,768,4096,7168,asm,24,1,171.238,_ZN5aiter42fp8gemm_bf16_blockscale_BpreShuffle_80x128E,263.36,0.24035,0.0
gfx942,80,800,4096,7168,asm,24,1,171.5517,_ZN5aiter42fp8gemm_bf16_blockscale_BpreShuffle_80x128E,273.83,0.24277,0.0
gfx942,80,832,4096,7168,asm,40,1,192.7565,_ZN5aiter43fp8gemm_bf16_blockscale_BpreShuffle_128x128E,253.46,0.21862,0.0
gfx942,80,864,4096,7168,asm,40,1,192.5909,_ZN5aiter43fp8gemm_bf16_blockscale_BpreShuffle_128x128E,263.43,0.22136,0.0
gfx942,80,896,4096,7168,asm,40,1,193.7788,_ZN5aiter43fp8gemm_bf16_blockscale_BpreShuffle_128x128E,271.51,0.22254,0.0
gfx942,80,928,4096,7168,asm,32,1,199.6437,_ZN5aiter42fp8gemm_bf16_blockscale_BpreShuffle_96x128E,272.95,0.21846,0.0
gfx942,80,960,4096,7168,asm,32,1,201.0278,_ZN5aiter42fp8gemm_bf16_blockscale_BpreShuffle_96x128E,280.42,0.2194,0.0
gfx942,80,992,4096,7168,asm,32,1,246.2115,_ZN5aiter42fp8gemm_bf16_blockscale_BpreShuffle_96x128E,236.59,0.18113,0.0
gfx942,80,1024,4096,7168,ck,14,0,239.8009,a8w8_blockscale_bpreshuffle_1x128x128_256x64x128x128_16x16_16x16_8x32x1_8x32x1_1x32x1x8_8_2x1_intrawave_v1,250.75,0.18803,0.0
gfx942,80,1088,4096,7168,ck,14,2,243.5167,a8w8_blockscale_bpreshuffle_1x128x128_256x64x128x128_16x16_16x16_8x32x1_8x32x1_1x32x1x8_8_2x1_intrawave_v1,262.35,0.18919,0.0
gfx942,80,1152,4096,7168,asm,32,1,249.4129,_ZN5aiter42fp8gemm_bf16_blockscale_BpreShuffle_96x128E,271.22,0.18866,0.0
gfx942,80,1216,4096,7168,asm,40,1,257.6608,_ZN5aiter43fp8gemm_bf16_blockscale_BpreShuffle_128x128E,277.12,0.18644,0.0
gfx942,80,1280,4096,7168,asm,40,1,257.7026,_ZN5aiter43fp8gemm_bf16_blockscale_BpreShuffle_128x128E,291.66,0.19022,0.0
gfx942,80,1344,4096,7168,asm,32,1,296.8003,_ZN5aiter42fp8gemm_bf16_blockscale_BpreShuffle_96x128E,265.9,0.16848,0.0
gfx942,80,1408,4096,7168,asm,32,1,299.1361,_ZN5aiter42fp8gemm_bf16_blockscale_BpreShuffle_96x128E,276.39,0.17045,0.0
gfx942,80,1472,4096,7168,asm,40,1,319.9213,_ZN5aiter43fp8gemm_bf16_blockscale_BpreShuffle_128x128E,270.18,0.16245,0.0
gfx942,80,1536,4096,7168,asm,40,1,319.9848,_ZN5aiter43fp8gemm_bf16_blockscale_BpreShuffle_128x128E,281.87,0.16549,0.0
gfx942,80,1600,4096,7168,asm,24,1,339.1142,_ZN5aiter42fp8gemm_bf16_blockscale_BpreShuffle_80x128E,277.05,0.15905,0.0
gfx942,80,1664,4096,7168,ck,14,0,370.7577,a8w8_blockscale_bpreshuffle_1x128x128_256x64x128x128_16x16_16x16_8x32x1_8x32x1_1x32x1x8_8_2x1_intrawave_v1,263.54,0.14813,0.0
gfx942,80,1728,4096,7168,ck,14,0,370.8495,a8w8_blockscale_bpreshuffle_1x128x128_256x64x128x128_16x16_16x16_8x32x1_8x32x1_1x32x1x8_8_2x1_intrawave_v1,273.61,0.15074,0.0
gfx942,80,1792,4096,7168,asm,40,1,382.9499,_ZN5aiter43fp8gemm_bf16_blockscale_BpreShuffle_128x128E,274.78,0.14854,0.0
gfx942,80,1856,4096,7168,asm,40,1,384.2988,_ZN5aiter43fp8gemm_bf16_blockscale_BpreShuffle_128x128E,283.59,0.15058,0.0
gfx942,80,1920,4096,7168,asm,40,1,384.5303,_ZN5aiter43fp8gemm_bf16_blockscale_BpreShuffle_128x128E,293.2,0.15305,0.0
gfx942,80,1984,4096,7168,asm,24,1,424.4586,_ZN5aiter42fp8gemm_bf16_blockscale_BpreShuffle_80x128E,274.47,0.14097,0.0
gfx942,80,2048,4096,7168,ck,14,3,434.8487,a8w8_blockscale_bpreshuffle_1x128x128_256x64x128x128_16x16_16x16_8x32x1_8x32x1_1x32x1x8_8_2x1_intrawave_v1,276.55,0.13986,0.0
gfx942,80,4096,4096,7168,asm,40,1,831.9918,_ZN5aiter43fp8gemm_bf16_blockscale_BpreShuffle_128x128E,289.09,0.11091,0.0
gfx942,80,8192,4096,7168,asm,40,1,1654.7731,_ZN5aiter43fp8gemm_bf16_blockscale_BpreShuffle_128x128E,290.7,0.09378,0.0
gfx942,80,16384,4096,7168,asm,40,1,3301.1914,_ZN5aiter43fp8gemm_bf16_blockscale_BpreShuffle_128x128E,291.43,0.08513,0.0
gfx942,80,32768,4096,7168,asm,40,1,6575.7339,_ZN5aiter43fp8gemm_bf16_blockscale_BpreShuffle_128x128E,292.61,0.08101,0.0
gfx942,80,16,4608,7168,ck,7,2,18.3748,a8w8_blockscale_bpreshuffle_1x128x128_256x16x64x256_16x16_16x16_16x16x1_16x16x1_1x16x1x16_4_1x1_intrawave_v1,57.52,1.81184,0.0
gfx942,80,32,4608,7168,asm,1,2,19.9503,_ZN5aiter42fp8gemm_bf16_blockscale_BpreShuffle_32x128E,105.96,1.6819,0.0
gfx942,80,48,4608,7168,asm,9,2,22.5876,_ZN5aiter42fp8gemm_bf16_blockscale_BpreShuffle_48x128E,140.38,1.49713,0.0
gfx942,80,64,4608,7168,asm,17,2,24.7553,_ZN5aiter42fp8gemm_bf16_blockscale_BpreShuffle_64x128E,170.79,1.37662,0.0
gfx942,80,80,4608,7168,asm,25,2,29.0883,_ZN5aiter42fp8gemm_bf16_blockscale_BpreShuffle_80x128E,181.68,1.18057,0.0
gfx942,80,96,4608,7168,asm,8,1,32.6468,_ZN5aiter42fp8gemm_bf16_blockscale_BpreShuffle_48x128E,194.25,1.05992,0.0
gfx942,80,112,4608,7168,asm,16,1,37.6447,_ZN5aiter42fp8gemm_bf16_blockscale_BpreShuffle_64x128E,196.54,0.92616,0.0
gfx942,80,128,4608,7168,asm,16,1,38.8654,_ZN5aiter42fp8gemm_bf16_blockscale_BpreShuffle_64x128E,217.56,0.90382,0.0
gfx942,80,144,4608,7168,asm,24,1,44.5431,_ZN5aiter42fp8gemm_bf16_blockscale_BpreShuffle_80x128E,213.56,0.7945,0.0
gfx942,80,160,4608,7168,asm,24,1,45.1457,_ZN5aiter42fp8gemm_bf16_blockscale_BpreShuffle_80x128E,234.12,0.7897,0.0
gfx942,80,176,4608,7168,asm,32,1,52.2426,_ZN5aiter42fp8gemm_bf16_blockscale_BpreShuffle_96x128E,222.55,0.68744,0.0
gfx942,80,192,4608,7168,asm,32,1,52.5274,_ZN5aiter42fp8gemm_bf16_blockscale_BpreShuffle_96x128E,241.47,0.6887,0.0
gfx942,80,208,4608,7168,asm,40,1,65.8725,_ZN5aiter43fp8gemm_bf16_blockscale_BpreShuffle_128x128E,208.59,0.55316,0.0
gfx942,80,224,4608,7168,asm,40,1,65.9301,_ZN5aiter43fp8gemm_bf16_blockscale_BpreShuffle_128x128E,224.44,0.55665,0.0
gfx942,80,240,4608,7168,asm,40,1,66.1437,_ZN5aiter43fp8gemm_bf16_blockscale_BpreShuffle_128x128E,239.7,0.55882,0.0
gfx942,80,256,4608,7168,asm,40,1,65.9222,_ZN5aiter43fp8gemm_bf16_blockscale_BpreShuffle_128x128E,256.54,0.56467,0.0
gfx942,80,288,4608,7168,asm,24,1,86.3585,_ZN5aiter42fp8gemm_bf16_blockscale_BpreShuffle_80x128E,220.31,0.43712,0.0
gfx942,80,320,4608,7168,asm,24,1,86.922,_ZN5aiter42fp8gemm_bf16_blockscale_BpreShuffle_80x128E,243.2,0.44031,0.0
gfx942,80,352,4608,7168,asm,32,1,100.9543,_ZN5aiter42fp8gemm_bf16_blockscale_BpreShuffle_96x128E,230.33,0.38431,0.0
gfx942,80,384,4608,7168,asm,32,1,101.3995,_ZN5aiter42fp8gemm_bf16_blockscale_BpreShuffle_96x128E,250.17,0.38779,0.0
gfx942,80,416,4608,7168,ck,8,0,125.3978,a8w8_blockscale_bpreshuffle_1x128x128_256x32x256x128_16x16_16x16_8x32x1_8x32x1_1x32x1x8_8_2x1_intrawave_v1,219.15,0.31776,0.0
gfx942,80,448,4608,7168,asm,24,1,128.0119,_ZN5aiter42fp8gemm_bf16_blockscale_BpreShuffle_80x128E,231.19,0.31536,0.0
gfx942,80,480,4608,7168,asm,24,1,128.4135,_ZN5aiter42fp8gemm_bf16_blockscale_BpreShuffle_80x128E,246.93,0.31846,0.0
gfx942,80,512,4608,7168,asm,40,1,129.7524,_ZN5aiter43fp8gemm_bf16_blockscale_BpreShuffle_128x128E,260.67,0.31921,0.0
gfx942,80,544,4608,7168,asm,32,1,149.63,_ZN5aiter42fp8gemm_bf16_blockscale_BpreShuffle_96x128E,240.17,0.28031,0.0
gfx942,80,576,4608,7168,asm,32,1,150.6801,_ZN5aiter42fp8gemm_bf16_blockscale_BpreShuffle_96x128E,252.53,0.28184,0.0
gfx942,80,608,4608,7168,asm,24,1,169.6501,_ZN5aiter42fp8gemm_bf16_blockscale_BpreShuffle_80x128E,236.75,0.25341,0.0
gfx942,80,640,4608,7168,asm,24,1,170.23,_ZN5aiter42fp8gemm_bf16_blockscale_BpreShuffle_80x128E,248.36,0.25563,0.0
gfx942,80,672,4608,7168,asm,16,1,178.1505,_ZN5aiter42fp8gemm_bf16_blockscale_BpreShuffle_64x128E,249.19,0.24721,0.0
gfx942,80,704,4608,7168,ck,14,0,177.5823,a8w8_blockscale_bpreshuffle_1x128x128_256x64x128x128_16x16_16x16_8x32x1_8x32x1_1x32x1x8_8_2x1_intrawave_v1,261.89,0.25095,0.0
gfx942,80,736,4608,7168,asm,40,1,192.5216,_ZN5aiter43fp8gemm_bf16_blockscale_BpreShuffle_128x128E,252.55,0.2342,0.0
gfx942,80,768,4608,7168,asm,40,1,193.3022,_ZN5aiter43fp8gemm_bf16_blockscale_BpreShuffle_128x128E,262.46,0.23597,0.0
gfx942,80,800,4608,7168,asm,24,1,212.45,_ZN5aiter42fp8gemm_bf16_blockscale_BpreShuffle_80x128E,248.76,0.21717,0.0
gfx942,80,832,4608,7168,ck,14,0,208.0825,a8w8_blockscale_bpreshuffle_1x128x128_256x64x128x128_16x16_16x16_8x32x1_8x32x1_1x32x1x8_8_2x1_intrawave_v1,264.14,0.22425,0.0
gfx942,80,864,4608,7168,asm,24,1,212.7137,_ZN5aiter42fp8gemm_bf16_blockscale_BpreShuffle_80x128E,268.32,0.22183,0.0
gfx942,80,896,4608,7168,ck,14,3,240.3365,a8w8_blockscale_bpreshuffle_1x128x128_256x64x128x128_16x16_16x16_8x32x1_8x32x1_1x32x1x8_8_2x1_intrawave_v1,246.28,0.19851,0.0
gfx942,80,928,4608,7168,asm,16,1,247.8788,_ZN5aiter42fp8gemm_bf16_blockscale_BpreShuffle_64x128E,247.31,0.19459,0.0
gfx942,80,960,4608,7168,ck,14,0,242.7414,a8w8_blockscale_bpreshuffle_1x128x128_256x64x128x128_16x16_16x16_8x32x1_8x32x1_1x32x1x8_8_2x1_intrawave_v1,261.26,0.20087,0.0
gfx942,80,992,4608,7168,asm,32,1,248.9262,_ZN5aiter42fp8gemm_bf16_blockscale_BpreShuffle_96x128E,263.26,0.19798,0.0
gfx942,80,1024,4608,7168,asm,32,1,248.6755,_ZN5aiter42fp8gemm_bf16_blockscale_BpreShuffle_96x128E,272.02,0.20029,0.0
gfx942,80,1088,4608,7168,ck,13,1,274.1862,a8w8_blockscale_bpreshuffle_1x128x128_256x64x256x128_16x16_16x16_8x32x1_8x32x1_1x32x1x8_8_2x1_intrawave_v1,262.13,0.18548,0.0
gfx942,80,1152,4608,7168,asm,24,1,295.49,_ZN5aiter42fp8gemm_bf16_blockscale_BpreShuffle_80x128E,257.54,0.17566,0.0
gfx942,80,1216,4608,7168,asm,32,1,298.0223,_ZN5aiter42fp8gemm_bf16_blockscale_BpreShuffle_96x128E,269.54,0.17768,0.0
gfx942,80,1280,4608,7168,ck,14,3,306.3953,a8w8_blockscale_bpreshuffle_1x128x128_256x64x128x128_16x16_16x16_8x32x1_8x32x1_1x32x1x8_8_2x1_intrawave_v1,275.97,0.17625,0.0
gfx942,80,1344,4608,7168,asm,40,1,320.2425,_ZN5aiter43fp8gemm_bf16_blockscale_BpreShuffle_128x128E,277.24,0.1719,0.0
gfx942,80,1408,4608,7168,asm,40,1,321.7264,_ZN5aiter43fp8gemm_bf16_blockscale_BpreShuffle_128x128E,289.11,0.17437,0.0
gfx942,80,1472,4608,7168,ck,14,0,369.7628,a8w8_blockscale_bpreshuffle_1x128x128_256x64x128x128_16x16_16x16_8x32x1_8x32x1_1x32x1x8_8_2x1_intrawave_v1,262.98,0.15455,0.0
gfx942,80,1536,4608,7168,ck,14,1,370.9982,a8w8_blockscale_bpreshuffle_1x128x128_256x64x128x128_16x16_16x16_8x32x1_8x32x1_1x32x1x8_8_2x1_intrawave_v1,273.5,0.15686,0.0
gfx942,80,1600,4608,7168,asm,24,1,382.6584,_ZN5aiter42fp8gemm_bf16_blockscale_BpreShuffle_80x128E,276.22,0.15482,0.0
gfx942,80,1664,4608,7168,asm,40,1,384.1595,_ZN5aiter43fp8gemm_bf16_blockscale_BpreShuffle_128x128E,286.14,0.15695,0.0
gfx942,80,1728,4608,7168,asm,24,1,422.292,_ZN5aiter42fp8gemm_bf16_blockscale_BpreShuffle_80x128E,270.32,0.14526,0.0
gfx942,80,1792,4608,7168,ck,14,0,435.1458,a8w8_blockscale_bpreshuffle_1x128x128_256x64x128x128_16x16_16x16_8x32x1_8x32x1_1x32x1x8_8_2x1_intrawave_v1,272.05,0.14338,0.0
gfx942,80,1856,4608,7168,asm,40,1,445.7352,_ZN5aiter43fp8gemm_bf16_blockscale_BpreShuffle_128x128E,275.07,0.14232,0.0
gfx942,80,1920,4608,7168,asm,32,1,444.8469,_ZN5aiter42fp8gemm_bf16_blockscale_BpreShuffle_96x128E,285.12,0.14497,0.0
gfx942,80,1984,4608,7168,ck,14,3,472.282,a8w8_blockscale_bpreshuffle_1x128x128_256x64x128x128_16x16_16x16_8x32x1_8x32x1_1x32x1x8_8_2x1_intrawave_v1,277.51,0.13876,0.0
gfx942,80,2048,4608,7168,asm,32,1,493.6704,_ZN5aiter42fp8gemm_bf16_blockscale_BpreShuffle_96x128E,274.05,0.13488,0.0
gfx942,80,4096,4608,7168,ck,14,0,951.778,a8w8_blockscale_bpreshuffle_1x128x128_256x64x128x128_16x16_16x16_8x32x1_8x32x1_1x32x1x8_8_2x1_intrawave_v1,284.29,0.10521,0.0
gfx942,80,8192,4608,7168,asm,40,1,1855.4833,_ZN5aiter43fp8gemm_bf16_blockscale_BpreShuffle_128x128E,291.66,0.09014,0.0
gfx942,80,16384,4608,7168,asm,40,1,3676.3795,_ZN5aiter43fp8gemm_bf16_blockscale_BpreShuffle_128x128E,294.4,0.082,0.0
gfx942,80,32768,4608,7168,asm,40,1,7356.9633,_ZN5aiter43fp8gemm_bf16_blockscale_BpreShuffle_128x128E,294.23,0.07746,0.0
gfx942,80,1,7168,7168,ck,6,1,23.6395,a8w8_blockscale_bpreshuffle_1x128x128_256x16x128x256_16x16_16x16_16x16x1_16x16x1_1x16x1x16_8_1x2_intrawave_v1,4.35,2.1744,0.0
gfx942,80,2,7168,7168,ck,6,0,23.6491,a8w8_blockscale_bpreshuffle_1x128x128_256x16x128x256_16x16_16x16_16x16x1_16x16x1_1x16x1x16_8_1x2_intrawave_v1,8.69,2.17443,0.0
gfx942,80,4,7168,7168,ck,6,1,23.6263,a8w8_blockscale_bpreshuffle_1x128x128_256x16x128x256_16x16_16x16_16x16x1_16x16x1_1x16x1x16_8_1x2_intrawave_v1,17.4,2.17835,0.0
gfx942,80,8,7168,7168,ck,6,0,23.772,a8w8_blockscale_bpreshuffle_1x128x128_256x16x128x256_16x16_16x16_16x16x1_16x16x1_1x16x1x16_8_1x2_intrawave_v1,34.58,2.16861,0.0
gfx942,80,16,7168,7168,ck,6,2,23.7442,a8w8_blockscale_bpreshuffle_1x128x128_256x16x128x256_16x16_16x16_16x16x1_16x16x1_1x16x1x16_8_1x2_intrawave_v1,69.25,2.1784,0.0
gfx942,80,32,7168,7168,asm,0,1,30.8535,_ZN5aiter42fp8gemm_bf16_blockscale_BpreShuffle_32x128E,106.58,1.6876,0.0
gfx942,80,48,7168,7168,asm,8,1,33.0883,_ZN5aiter42fp8gemm_bf16_blockscale_BpreShuffle_48x128E,149.07,1.58402,0.0
gfx942,80,64,7168,7168,asm,16,1,39.3916,_ZN5aiter42fp8gemm_bf16_blockscale_BpreShuffle_64x128E,166.96,1.33928,0.0
gfx942,80,80,7168,7168,asm,24,1,45.4763,_ZN5aiter42fp8gemm_bf16_blockscale_BpreShuffle_80x128E,180.77,1.16765,0.0
gfx942,80,96,7168,7168,asm,32,1,52.233,_ZN5aiter42fp8gemm_bf16_blockscale_BpreShuffle_96x128E,188.87,1.0232,0.0
gfx942,80,112,7168,7168,asm,43,4,65.4304,_ZN5aiter43fp8gemm_bf16_blockscale_BpreShuffle_128x128E,175.9,0.82207,0.0019
gfx942,80,128,7168,7168,asm,40,1,65.968,_ZN5aiter43fp8gemm_bf16_blockscale_BpreShuffle_128x128E,199.39,0.82059,0.0
gfx942,80,144,7168,7168,asm,25,2,77.7472,_ZN5aiter42fp8gemm_bf16_blockscale_BpreShuffle_80x128E,190.33,0.70069,0.0
gfx942,80,160,7168,7168,asm,25,2,78.0434,_ZN5aiter42fp8gemm_bf16_blockscale_BpreShuffle_80x128E,210.67,0.70244,0.0
gfx942,80,176,7168,7168,asm,33,2,89.5246,_ZN5aiter42fp8gemm_bf16_blockscale_BpreShuffle_96x128E,202.02,0.6162,0.0
gfx942,80,192,7168,7168,asm,33,2,89.943,_ZN5aiter42fp8gemm_bf16_blockscale_BpreShuffle_96x128E,219.36,0.61716,0.0
gfx942,80,208,7168,7168,asm,16,1,107.8854,_ZN5aiter42fp8gemm_bf16_blockscale_BpreShuffle_64x128E,198.12,0.51771,0.0
gfx942,80,224,7168,7168,asm,16,1,108.5348,_ZN5aiter42fp8gemm_bf16_blockscale_BpreShuffle_64x128E,212.08,0.51778,0.0
gfx942,80,240,7168,7168,asm,16,1,108.5439,_ZN5aiter42fp8gemm_bf16_blockscale_BpreShuffle_64x128E,227.21,0.52091,0.0
gfx942,80,256,7168,7168,asm,16,1,109.2241,_ZN5aiter42fp8gemm_bf16_blockscale_BpreShuffle_64x128E,240.85,0.52081,0.0
gfx942,80,288,7168,7168,asm,24,1,128.4263,_ZN5aiter42fp8gemm_bf16_blockscale_BpreShuffle_80x128E,230.44,0.4483,0.0
gfx942,80,320,7168,7168,asm,24,1,129.0346,_ZN5aiter42fp8gemm_bf16_blockscale_BpreShuffle_80x128E,254.84,0.45152,0.0
gfx942,80,352,7168,7168,asm,32,1,149.8962,_ZN5aiter42fp8gemm_bf16_blockscale_BpreShuffle_96x128E,241.31,0.39327,0.0
gfx942,80,384,7168,7168,asm,32,1,150.9894,_ZN5aiter42fp8gemm_bf16_blockscale_BpreShuffle_96x128E,261.34,0.39498,0.0
gfx942,80,416,7168,7168,asm,16,1,177.6743,_ZN5aiter42fp8gemm_bf16_blockscale_BpreShuffle_64x128E,240.6,0.33953,0.0
gfx942,80,448,7168,7168,ck,14,2,178.2073,a8w8_blockscale_bpreshuffle_1x128x128_256x64x128x128_16x16_16x16_8x32x1_8x32x1_1x32x1x8_8_2x1_intrawave_v1,258.33,0.34238,0.0
gfx942,80,480,7168,7168,asm,40,1,193.7218,_ZN5aiter43fp8gemm_bf16_blockscale_BpreShuffle_128x128E,254.62,0.31851,0.0
gfx942,80,512,7168,7168,asm,40,1,193.5094,_ZN5aiter43fp8gemm_bf16_blockscale_BpreShuffle_128x128E,271.89,0.32241,0.0
gfx942,80,544,7168,7168,asm,24,1,213.3035,_ZN5aiter42fp8gemm_bf16_blockscale_BpreShuffle_80x128E,262.08,0.29572,0.0
gfx942,80,576,7168,7168,ck,14,2,241.7168,a8w8_blockscale_bpreshuffle_1x128x128_256x64x128x128_16x16_16x16_8x32x1_8x32x1_1x32x1x8_8_2x1_intrawave_v1,244.87,0.26381,0.0
gfx942,80,608,7168,7168,asm,32,1,248.6084,_ZN5aiter42fp8gemm_bf16_blockscale_BpreShuffle_96x128E,251.31,0.25926,0.0
gfx942,80,640,7168,7168,ck,14,0,245.2711,a8w8_blockscale_bpreshuffle_1x128x128_256x64x128x128_16x16_16x16_8x32x1_8x32x1_1x32x1x8_8_2x1_intrawave_v1,268.14,0.2656,0.0
gfx942,80,672,7168,7168,asm,32,1,249.7764,_ZN5aiter42fp8gemm_bf16_blockscale_BpreShuffle_96x128E,276.47,0.26356,0.0
gfx942,80,704,7168,7168,ck,13,1,274.6188,a8w8_blockscale_bpreshuffle_1x128x128_256x64x256x128_16x16_16x16_8x32x1_8x32x1_1x32x1x8_8_2x1_intrawave_v1,263.43,0.24222,0.0
gfx942,80,736,7168,7168,asm,32,1,297.0058,_ZN5aiter42fp8gemm_bf16_blockscale_BpreShuffle_96x128E,254.65,0.22628,0.0
gfx942,80,768,7168,7168,asm,24,1,296.4665,_ZN5aiter42fp8gemm_bf16_blockscale_BpreShuffle_80x128E,266.2,0.22902,0.0
gfx942,80,800,7168,7168,asm,24,1,297.9262,_ZN5aiter42fp8gemm_bf16_blockscale_BpreShuffle_80x128E,275.94,0.2302,0.0
gfx942,80,832,7168,7168,asm,40,1,321.234,_ZN5aiter43fp8gemm_bf16_blockscale_BpreShuffle_128x128E,266.15,0.21564,0.0
gfx942,80,864,7168,7168,asm,40,1,321.5634,_ZN5aiter43fp8gemm_bf16_blockscale_BpreShuffle_128x128E,276.1,0.21756,0.0
gfx942,80,896,7168,7168,asm,40,1,320.216,_ZN5aiter43fp8gemm_bf16_blockscale_BpreShuffle_128x128E,287.54,0.22063,0.0
gfx942,80,928,7168,7168,asm,32,1,346.7691,_ZN5aiter42fp8gemm_bf16_blockscale_BpreShuffle_96x128E,275.0,0.20572,0.0
gfx942,80,960,7168,7168,asm,32,1,348.157,_ZN5aiter42fp8gemm_bf16_blockscale_BpreShuffle_96x128E,283.35,0.20687,0.0
gfx942,80,992,7168,7168,asm,40,1,382.4742,_ZN5aiter43fp8gemm_bf16_blockscale_BpreShuffle_128x128E,266.52,0.19011,0.0
gfx942,80,1024,7168,7168,asm,40,1,382.3258,_ZN5aiter43fp8gemm_bf16_blockscale_BpreShuffle_128x128E,275.23,0.19198,0.0
gfx942,80,1088,7168,7168,ck,14,2,407.4043,a8w8_blockscale_bpreshuffle_1x128x128_256x64x128x128_16x16_16x16_8x32x1_8x32x1_1x32x1x8_8_2x1_intrawave_v1,274.43,0.18354,0.0
gfx942,80,1152,7168,7168,ck,14,2,435.7381,a8w8_blockscale_bpreshuffle_1x128x128_256x64x128x128_16x16_16x16_8x32x1_8x32x1_1x32x1x8_8_2x1_intrawave_v1,271.68,0.17477,0.0
gfx942,80,1216,7168,7168,asm,40,1,446.9481,_ZN5aiter43fp8gemm_bf16_blockscale_BpreShuffle_128x128E,279.58,0.17346,0.0
gfx942,80,1280,7168,7168,asm,40,1,447.7131,_ZN5aiter43fp8gemm_bf16_blockscale_BpreShuffle_128x128E,293.79,0.17624,0.0
gfx942,80,1344,7168,7168,asm,32,1,494.6614,_ZN5aiter42fp8gemm_bf16_blockscale_BpreShuffle_96x128E,279.2,0.1623,0.0
gfx942,80,1408,7168,7168,asm,40,1,510.1749,_ZN5aiter43fp8gemm_bf16_blockscale_BpreShuffle_128x128E,283.6,0.16006,0.0
gfx942,80,1472,7168,7168,ck,14,0,563.8113,a8w8_blockscale_bpreshuffle_1x128x128_256x64x128x128_16x16_16x16_8x32x1_8x32x1_1x32x1x8_8_2x1_intrawave_v1,268.29,0.14727,0.0
gfx942,80,1536,7168,7168,ck,14,3,565.0521,a8w8_blockscale_bpreshuffle_1x128x128_256x64x128x128_16x16_16x16_8x32x1_8x32x1_1x32x1x8_8_2x1_intrawave_v1,279.34,0.14939,0.0
gfx942,80,1600,7168,7168,asm,32,1,591.6153,_ZN5aiter42fp8gemm_bf16_blockscale_BpreShuffle_96x128E,277.91,0.145,0.0
gfx942,80,1664,7168,7168,ck,14,1,630.2392,a8w8_blockscale_bpreshuffle_1x128x128_256x64x128x128_16x16_16x16_8x32x1_8x32x1_1x32x1x8_8_2x1_intrawave_v1,271.32,0.1383,0.0
gfx942,80,1728,7168,7168,ck,14,0,631.1466,a8w8_blockscale_bpreshuffle_1x128x128_256x64x128x128_16x16_16x16_8x32x1_8x32x1_1x32x1x8_8_2x1_intrawave_v1,281.35,0.14028,0.0
gfx942,80,1792,7168,7168,asm,40,1,640.0152,_ZN5aiter43fp8gemm_bf16_blockscale_BpreShuffle_128x128E,287.72,0.14049,0.0
gfx942,80,1856,7168,7168,asm,32,1,690.4563,_ZN5aiter42fp8gemm_bf16_blockscale_BpreShuffle_96x128E,276.23,0.13222,0.0
gfx942,80,1920,7168,7168,asm,32,1,691.8261,_ZN5aiter42fp8gemm_bf16_blockscale_BpreShuffle_96x128E,285.19,0.13395,0.0
gfx942,80,1984,7168,7168,ck,13,3,731.9962,a8w8_blockscale_bpreshuffle_1x128x128_256x64x256x128_16x16_16x16_8x32x1_8x32x1_1x32x1x8_8_2x1_intrawave_v1,278.52,0.12848,0.0
gfx942,80,2048,7168,7168,ck,14,2,756.6679,a8w8_blockscale_bpreshuffle_1x128x128_256x64x128x128_16x16_16x16_8x32x1_8x32x1_1x32x1x8_8_2x1_intrawave_v1,278.13,0.12611,0.0
gfx942,80,4096,7168,7168,asm,40,1,1458.1361,_ZN5aiter43fp8gemm_bf16_blockscale_BpreShuffle_128x128E,288.66,0.09564,0.0
gfx942,80,6144,7168,7168,asm,40,1,2159.5251,_ZN5aiter43fp8gemm_bf16_blockscale_BpreShuffle_128x128E,292.36,0.08497,0.0
gfx942,80,8120,7168,7168,asm,40,1,2871.579,_ZN5aiter43fp8gemm_bf16_blockscale_BpreShuffle_128x128E,290.58,0.0787,0.0
gfx942,80,8192,7168,7168,asm,40,1,2858.2589,_ZN5aiter43fp8gemm_bf16_blockscale_BpreShuffle_128x128E,294.52,0.07961,0.0
gfx942,80,10240,7168,7168,asm,40,1,3551.8819,_ZN5aiter43fp8gemm_bf16_blockscale_BpreShuffle_128x128E,296.26,0.07646,0.0
gfx942,80,12288,7168,7168,asm,40,1,4305.5894,_ZN5aiter43fp8gemm_bf16_blockscale_BpreShuffle_128x128E,293.27,0.07331,0.0
gfx942,80,14336,7168,7168,asm,40,1,5011.8657,_ZN5aiter43fp8gemm_bf16_blockscale_BpreShuffle_128x128E,293.94,0.07176,0.0
gfx942,80,16384,7168,7168,asm,40,1,5705.2513,_ZN5aiter43fp8gemm_bf16_blockscale_BpreShuffle_128x128E,295.1,0.07076,0.0
gfx942,80,32768,7168,7168,asm,40,1,11472.4167,_ZN5aiter43fp8gemm_bf16_blockscale_BpreShuffle_128x128E,293.51,0.0659,0.0
gfx942,80,16,8192,7168,ck,7,2,24.2065,a8w8_blockscale_bpreshuffle_1x128x128_256x16x64x256_16x16_16x16_16x16x1_16x16x1_1x16x1x16_4_1x1_intrawave_v1,77.63,2.44137,0.0
gfx942,80,32,8192,7168,asm,0,1,31.3091,_ZN5aiter42fp8gemm_bf16_blockscale_BpreShuffle_32x128E,120.03,1.89957,0.0
gfx942,80,48,8192,7168,asm,8,1,33.4746,_ZN5aiter42fp8gemm_bf16_blockscale_BpreShuffle_48x128E,168.4,1.78795,0.0
gfx942,80,64,8192,7168,asm,16,1,39.6166,_ZN5aiter42fp8gemm_bf16_blockscale_BpreShuffle_64x128E,189.72,1.52026,0.0
gfx942,80,80,8192,7168,asm,24,1,45.3459,_ZN5aiter42fp8gemm_bf16_blockscale_BpreShuffle_80x128E,207.19,1.33649,0.0
gfx942,80,96,8192,7168,asm,32,1,52.4788,_ZN5aiter42fp8gemm_bf16_blockscale_BpreShuffle_96x128E,214.84,1.16202,0.0
gfx942,80,112,8192,7168,asm,40,1,66.4438,_ZN5aiter43fp8gemm_bf16_blockscale_BpreShuffle_128x128E,197.96,0.92346,0.0
gfx942,80,128,8192,7168,asm,40,1,67.0671,_ZN5aiter43fp8gemm_bf16_blockscale_BpreShuffle_128x128E,224.14,0.92049,0.0
gfx942,80,144,8192,7168,asm,24,1,85.6711,_ZN5aiter42fp8gemm_bf16_blockscale_BpreShuffle_80x128E,197.4,0.725,0.0
gfx942,80,160,8192,7168,ck,8,1,84.9215,a8w8_blockscale_bpreshuffle_1x128x128_256x32x256x128_16x16_16x16_8x32x1_8x32x1_1x32x1x8_8_2x1_intrawave_v1,221.27,0.73584,0.0
gfx942,80,176,8192,7168,asm,32,1,100.3129,_ZN5aiter42fp8gemm_bf16_blockscale_BpreShuffle_96x128E,206.05,0.62669,0.0
gfx942,80,192,8192,7168,asm,32,1,101.2238,_ZN5aiter42fp8gemm_bf16_blockscale_BpreShuffle_96x128E,222.76,0.62478,0.0
gfx942,80,208,8192,7168,asm,8,1,117.6912,_ZN5aiter42fp8gemm_bf16_blockscale_BpreShuffle_48x128E,207.56,0.54056,0.0
gfx942,80,224,8192,7168,asm,8,1,118.2004,_ZN5aiter42fp8gemm_bf16_blockscale_BpreShuffle_48x128E,222.56,0.54142,0.0
gfx942,80,240,8192,7168,asm,8,1,119.0459,_ZN5aiter42fp8gemm_bf16_blockscale_BpreShuffle_48x128E,236.76,0.54074,0.0
gfx942,80,256,8192,7168,asm,40,1,129.2256,_ZN5aiter43fp8gemm_bf16_blockscale_BpreShuffle_128x128E,232.65,0.50106,0.0
gfx942,80,288,8192,7168,asm,16,1,143.8245,_ZN5aiter42fp8gemm_bf16_blockscale_BpreShuffle_64x128E,235.17,0.45544,0.0
gfx942,80,320,8192,7168,ck,13,2,144.5456,a8w8_blockscale_bpreshuffle_1x128x128_256x64x256x128_16x16_16x16_8x32x1_8x32x1_1x32x1x8_8_2x1_intrawave_v1,259.99,0.45838,0.0
gfx942,80,352,8192,7168,asm,24,1,170.7153,_ZN5aiter42fp8gemm_bf16_blockscale_BpreShuffle_80x128E,242.15,0.39253,0.0
gfx942,80,384,8192,7168,asm,24,1,171.3207,_ZN5aiter42fp8gemm_bf16_blockscale_BpreShuffle_80x128E,263.23,0.39554,0.0
gfx942,80,416,8192,7168,asm,32,1,199.349,_ZN5aiter42fp8gemm_bf16_blockscale_BpreShuffle_96x128E,245.07,0.34371,0.0
gfx942,80,448,8192,7168,asm,32,1,200.2177,_ZN5aiter42fp8gemm_bf16_blockscale_BpreShuffle_96x128E,262.78,0.34598,0.0
gfx942,80,480,8192,7168,asm,32,1,201.3145,_ZN5aiter42fp8gemm_bf16_blockscale_BpreShuffle_96x128E,280.02,0.34784,0.0
gfx942,80,512,8192,7168,ck,14,2,241.041,a8w8_blockscale_bpreshuffle_1x128x128_256x64x128x128_16x16_16x16_8x32x1_8x32x1_1x32x1x8_8_2x1_intrawave_v1,249.46,0.29364,0.0
gfx942,80,544,8192,7168,asm,32,1,248.299,_ZN5aiter42fp8gemm_bf16_blockscale_BpreShuffle_96x128E,257.3,0.28809,0.0
gfx942,80,576,8192,7168,asm,32,1,249.1733,_ZN5aiter42fp8gemm_bf16_blockscale_BpreShuffle_96x128E,271.48,0.2901,0.0
gfx942,80,608,8192,7168,asm,40,1,256.797,_ZN5aiter43fp8gemm_bf16_blockscale_BpreShuffle_128x128E,278.06,0.28443,0.0
gfx942,80,640,8192,7168,asm,40,1,257.5838,_ZN5aiter43fp8gemm_bf16_blockscale_BpreShuffle_128x128E,291.8,0.28648,0.0
gfx942,80,672,8192,7168,asm,32,1,297.5951,_ZN5aiter42fp8gemm_bf16_blockscale_BpreShuffle_96x128E,265.19,0.2505,0.0
gfx942,80,704,8192,7168,ck,14,3,309.2871,a8w8_blockscale_bpreshuffle_1x128x128_256x64x128x128_16x16_16x16_8x32x1_8x32x1_1x32x1x8_8_2x1_intrawave_v1,267.32,0.24347,0.0
gfx942,80,736,8192,7168,asm,40,1,318.5767,_ZN5aiter43fp8gemm_bf16_blockscale_BpreShuffle_128x128E,271.32,0.23873,0.0
gfx942,80,768,8192,7168,asm,40,1,319.9181,_ZN5aiter43fp8gemm_bf16_blockscale_BpreShuffle_128x128E,281.93,0.24009,0.0
gfx942,80,800,8192,7168,asm,24,1,339.0643,_ZN5aiter42fp8gemm_bf16_blockscale_BpreShuffle_80x128E,277.09,0.22875,0.0
gfx942,80,832,8192,7168,ck,14,0,371.899,a8w8_blockscale_bpreshuffle_1x128x128_256x64x128x128_16x16_16x16_8x32x1_8x32x1_1x32x1x8_8_2x1_intrawave_v1,262.73,0.21058,0.0
gfx942,80,864,8192,7168,asm,24,1,380.2466,_ZN5aiter42fp8gemm_bf16_blockscale_BpreShuffle_80x128E,266.85,0.20794,0.0
gfx942,80,896,8192,7168,asm,40,1,382.2342,_ZN5aiter43fp8gemm_bf16_blockscale_BpreShuffle_128x128E,275.29,0.20883,0.0
gfx942,80,928,8192,7168,asm,32,1,395.8668,_ZN5aiter42fp8gemm_bf16_blockscale_BpreShuffle_96x128E,275.31,0.20354,0.0
gfx942,80,960,8192,7168,asm,32,1,398.4166,_ZN5aiter42fp8gemm_bf16_blockscale_BpreShuffle_96x128E,282.98,0.20413,0.0
gfx942,80,992,8192,7168,asm,32,1,443.0065,_ZN5aiter42fp8gemm_bf16_blockscale_BpreShuffle_96x128E,262.98,0.18529,0.0
gfx942,80,1024,8192,7168,ck,14,1,435.471,a8w8_blockscale_bpreshuffle_1x128x128_256x64x128x128_16x16_16x16_8x32x1_8x32x1_1x32x1x8_8_2x1_intrawave_v1,276.16,0.19023,0.0
gfx942,80,1088,8192,7168,ck,13,1,471.9436,a8w8_blockscale_bpreshuffle_1x128x128_256x64x256x128_16x16_16x16_8x32x1_8x32x1_1x32x1x8_8_2x1_intrawave_v1,270.74,0.17872,0.0
gfx942,80,1152,8192,7168,asm,32,1,492.9177,_ZN5aiter42fp8gemm_bf16_blockscale_BpreShuffle_96x128E,274.47,0.17417,0.0
gfx942,80,1216,8192,7168,asm,40,1,510.309,_ZN5aiter43fp8gemm_bf16_blockscale_BpreShuffle_128x128E,279.85,0.17119,0.0
gfx942,80,1280,8192,7168,asm,40,1,511.1203,_ZN5aiter43fp8gemm_bf16_blockscale_BpreShuffle_128x128E,294.11,0.17387,0.0
gfx942,80,1344,8192,7168,ck,14,0,567.7539,a8w8_blockscale_bpreshuffle_1x128x128_256x64x128x128_16x16_16x16_8x32x1_8x32x1_1x32x1x8_8_2x1_intrawave_v1,278.01,0.15918,0.0
gfx942,80,1408,8192,7168,asm,40,1,572.9243,_ZN5aiter43fp8gemm_bf16_blockscale_BpreShuffle_128x128E,288.62,0.16037,0.0
gfx942,80,1472,8192,7168,ck,14,0,629.8821,a8w8_blockscale_bpreshuffle_1x128x128_256x64x128x128_16x16_16x16_8x32x1_8x32x1_1x32x1x8_8_2x1_intrawave_v1,274.45,0.14826,0.0
gfx942,80,1536,8192,7168,asm,40,1,639.584,_ZN5aiter43fp8gemm_bf16_blockscale_BpreShuffle_128x128E,282.04,0.14837,0.0
gfx942,80,1600,8192,7168,ck,13,0,663.1966,a8w8_blockscale_bpreshuffle_1x128x128_256x64x256x128_16x16_16x16_8x32x1_8x32x1_1x32x1x8_8_2x1_intrawave_v1,283.33,0.14536,0.0
gfx942,80,1664,8192,7168,ck,14,0,697.2274,a8w8_blockscale_bpreshuffle_1x128x128_256x64x128x128_16x16_16x16_8x32x1_8x32x1_1x32x1x8_8_2x1_intrawave_v1,280.28,0.14043,0.0
gfx942,80,1728,8192,7168,ck,14,1,727.7777,a8w8_blockscale_bpreshuffle_1x128x128_256x64x128x128_16x16_16x16_8x32x1_8x32x1_1x32x1x8_8_2x1_intrawave_v1,278.85,0.13661,0.0
gfx942,80,1792,8192,7168,ck,14,0,759.8229,a8w8_blockscale_bpreshuffle_1x128x128_256x64x128x128_16x16_16x16_8x32x1_8x32x1_1x32x1x8_8_2x1_intrawave_v1,276.98,0.13283,0.0
gfx942,80,1856,8192,7168,asm,40,1,762.465,_ZN5aiter43fp8gemm_bf16_blockscale_BpreShuffle_128x128E,285.87,0.13434,0.0
gfx942,80,1920,8192,7168,asm,40,1,763.1153,_ZN5aiter43fp8gemm_bf16_blockscale_BpreShuffle_128x128E,295.48,0.1362,0.0
gfx942,80,1984,8192,7168,asm,40,1,828.9178,_ZN5aiter43fp8gemm_bf16_blockscale_BpreShuffle_128x128E,281.09,0.12721,0.0
gfx942,80,2048,8192,7168,asm,40,1,831.5607,_ZN5aiter43fp8gemm_bf16_blockscale_BpreShuffle_128x128E,289.24,0.12862,0.0
gfx942,80,4096,8192,7168,asm,40,1,1655.8207,_ZN5aiter43fp8gemm_bf16_blockscale_BpreShuffle_128x128E,290.51,0.09372,0.0
gfx942,80,8192,8192,7168,asm,40,1,3315.7833,_ZN5aiter43fp8gemm_bf16_blockscale_BpreShuffle_128x128E,290.15,0.0759,0.0
gfx942,80,16384,8192,7168,asm,40,1,6533.0311,_ZN5aiter43fp8gemm_bf16_blockscale_BpreShuffle_128x128E,294.53,0.06805,0.0
gfx942,80,32768,8192,7168,asm,40,1,13047.6508,_ZN5aiter43fp8gemm_bf16_blockscale_BpreShuffle_128x128E,294.94,0.06365,0.0
gfx942,80,16,11264,7168,ck,7,2,36.5817,a8w8_blockscale_bpreshuffle_1x128x128_256x16x64x256_16x16_16x16_16x16x1_16x16x1_1x16x1x16_4_1x1_intrawave_v1,70.63,2.22011,0.0
gfx942,80,32,11264,7168,ck,10,3,45.2588,a8w8_blockscale_bpreshuffle_1x128x128_256x32x64x128_16x16_16x16_8x32x1_8x32x1_1x32x1x8_8_2x1_intrawave_v1,114.17,1.80497,0.0
gfx942,80,48,11264,7168,asm,10,3,53.3292,_ZN5aiter42fp8gemm_bf16_blockscale_BpreShuffle_48x128E,145.34,1.54073,0.0004
gfx942,80,64,11264,7168,asm,17,2,64.4544,_ZN5aiter42fp8gemm_bf16_blockscale_BpreShuffle_64x128E,160.34,1.28216,0.0
gfx942,80,80,11264,7168,asm,26,3,76.466,_ZN5aiter42fp8gemm_bf16_blockscale_BpreShuffle_80x128E,168.94,1.08697,0.0003
gfx942,80,96,11264,7168,ck,8,2,85.2489,a8w8_blockscale_bpreshuffle_1x128x128_256x32x256x128_16x16_16x16_8x32x1_8x32x1_1x32x1x8_8_2x1_intrawave_v1,181.85,0.98055,0.0
gfx942,80,112,11264,7168,asm,17,2,105.4022,_ZN5aiter42fp8gemm_bf16_blockscale_BpreShuffle_64x128E,171.59,0.79758,0.0
gfx942,80,128,11264,7168,asm,17,2,107.3202,_ZN5aiter42fp8gemm_bf16_blockscale_BpreShuffle_64x128E,192.6,0.78775,0.0
gfx942,80,144,11264,7168,asm,9,2,121.3708,_ZN5aiter42fp8gemm_bf16_blockscale_BpreShuffle_48x128E,191.59,0.70047,0.0
gfx942,80,160,11264,7168,asm,25,2,124.9313,_ZN5aiter42fp8gemm_bf16_blockscale_BpreShuffle_80x128E,206.81,0.68431,0.0
gfx942,80,176,11264,7168,asm,16,1,143.1091,_ZN5aiter42fp8gemm_bf16_blockscale_BpreShuffle_64x128E,198.59,0.60071,0.0
gfx942,80,192,11264,7168,ck,13,2,143.6915,a8w8_blockscale_bpreshuffle_1x128x128_256x64x256x128_16x16_16x16_8x32x1_8x32x1_1x32x1x8_8_2x1_intrawave_v1,215.77,0.60158,0.0
gfx942,80,208,11264,7168,ck,8,1,165.7113,a8w8_blockscale_bpreshuffle_1x128x128_256x32x256x128_16x16_16x16_8x32x1_8x32x1_1x32x1x8_8_2x1_intrawave_v1,202.69,0.52451,0.0
gfx942,80,224,11264,7168,ck,8,0,161.8971,a8w8_blockscale_bpreshuffle_1x128x128_256x32x256x128_16x16_16x16_8x32x1_8x32x1_1x32x1x8_8_2x1_intrawave_v1,223.42,0.5398,0.0
gfx942,80,240,11264,7168,asm,24,1,170.7373,_ZN5aiter42fp8gemm_bf16_blockscale_BpreShuffle_80x128E,226.99,0.51464,0.0
gfx942,80,256,11264,7168,ck,14,0,177.3668,a8w8_blockscale_bpreshuffle_1x128x128_256x64x128x128_16x16_16x16_8x32x1_8x32x1_1x32x1x8_8_2x1_intrawave_v1,233.07,0.49808,0.0
gfx942,80,288,11264,7168,asm,33,2,198.9007,_ZN5aiter42fp8gemm_bf16_blockscale_BpreShuffle_96x128E,233.82,0.44893,0.0
gfx942,80,320,11264,7168,ck,14,1,211.5644,a8w8_blockscale_bpreshuffle_1x128x128_256x64x128x128_16x16_16x16_8x32x1_8x32x1_1x32x1x8_8_2x1_intrawave_v1,244.25,0.42655,0.0
gfx942,80,352,11264,7168,asm,32,1,247.6447,_ZN5aiter42fp8gemm_bf16_blockscale_BpreShuffle_96x128E,229.53,0.36824,0.0
gfx942,80,384,11264,7168,ck,14,3,243.994,a8w8_blockscale_bpreshuffle_1x128x128_256x64x128x128_16x16_16x16_8x32x1_8x32x1_1x32x1x8_8_2x1_intrawave_v1,254.14,0.37765,0.0
gfx942,80,416,11264,7168,ck,14,2,284.365,a8w8_blockscale_bpreshuffle_1x128x128_256x64x128x128_16x16_16x16_8x32x1_8x32x1_1x32x1x8_8_2x1_intrawave_v1,236.23,0.32737,0.0
gfx942,80,448,11264,7168,ck,14,0,276.8844,a8w8_blockscale_bpreshuffle_1x128x128_256x64x128x128_16x16_16x16_8x32x1_8x32x1_1x32x1x8_8_2x1_intrawave_v1,261.28,0.33965,0.0
gfx942,80,480,11264,7168,asm,24,1,298.6939,_ZN5aiter42fp8gemm_bf16_blockscale_BpreShuffle_80x128E,259.5,0.31803,0.0
gfx942,80,512,11264,7168,ck,14,1,308.1192,a8w8_blockscale_bpreshuffle_1x128x128_256x64x128x128_16x16_16x16_8x32x1_8x32x1_1x32x1x8_8_2x1_intrawave_v1,268.33,0.31139,0.0
gfx942,80,544,11264,7168,asm,24,1,340.538,_ZN5aiter42fp8gemm_bf16_blockscale_BpreShuffle_80x128E,257.96,0.28453,0.0
gfx942,80,576,11264,7168,ck,14,2,342.5868,a8w8_blockscale_bpreshuffle_1x128x128_256x64x128x128_16x16_16x16_8x32x1_8x32x1_1x32x1x8_8_2x1_intrawave_v1,271.5,0.28561,0.0
gfx942,80,608,11264,7168,asm,24,1,381.5139,_ZN5aiter42fp8gemm_bf16_blockscale_BpreShuffle_80x128E,257.34,0.25896,0.0
gfx942,80,640,11264,7168,ck,14,3,376.9284,a8w8_blockscale_bpreshuffle_1x128x128_256x64x128x128_16x16_16x16_8x32x1_8x32x1_1x32x1x8_8_2x1_intrawave_v1,274.18,0.26463,0.0
gfx942,80,672,11264,7168,asm,32,1,398.956,_ZN5aiter42fp8gemm_bf16_blockscale_BpreShuffle_96x128E,272.0,0.2524,0.0
gfx942,80,704,11264,7168,asm,24,1,426.5683,_ZN5aiter42fp8gemm_bf16_blockscale_BpreShuffle_80x128E,266.5,0.23829,0.0
gfx942,80,736,11264,7168,asm,32,1,446.8656,_ZN5aiter42fp8gemm_bf16_blockscale_BpreShuffle_96x128E,265.96,0.22959,0.0
gfx942,80,768,11264,7168,asm,32,1,448.8617,_ZN5aiter42fp8gemm_bf16_blockscale_BpreShuffle_96x128E,276.29,0.23069,0.0
gfx942,80,800,11264,7168,asm,24,1,468.1587,_ZN5aiter42fp8gemm_bf16_blockscale_BpreShuffle_80x128E,275.94,0.22321,0.0
gfx942,80,832,11264,7168,asm,32,1,497.0687,_ZN5aiter42fp8gemm_bf16_blockscale_BpreShuffle_96x128E,270.29,0.21214,0.0
gfx942,80,864,11264,7168,asm,32,1,497.777,_ZN5aiter42fp8gemm_bf16_blockscale_BpreShuffle_96x128E,280.28,0.21375,0.0
gfx942,80,896,11264,7168,asm,40,1,512.9022,_ZN5aiter43fp8gemm_bf16_blockscale_BpreShuffle_128x128E,282.09,0.2093,0.0
gfx942,80,928,11264,7168,asm,32,1,544.6763,_ZN5aiter42fp8gemm_bf16_blockscale_BpreShuffle_96x128E,275.13,0.19883,0.0
gfx942,80,960,11264,7168,asm,32,1,548.2095,_ZN5aiter42fp8gemm_bf16_blockscale_BpreShuffle_96x128E,282.78,0.19928,0.0
gfx942,80,992,11264,7168,asm,40,1,575.1715,_ZN5aiter43fp8gemm_bf16_blockscale_BpreShuffle_128x128E,278.51,0.19159,0.0
gfx942,80,1024,11264,7168,asm,40,1,578.1058,_ZN5aiter43fp8gemm_bf16_blockscale_BpreShuffle_128x128E,286.03,0.19226,0.0
gfx942,80,1088,11264,7168,ck,14,0,637.3914,a8w8_blockscale_bpreshuffle_1x128x128_256x64x128x128_16x16_16x16_8x32x1_8x32x1_1x32x1x8_8_2x1_intrawave_v1,275.64,0.17736,0.0
gfx942,80,1152,11264,7168,asm,40,1,641.0348,_ZN5aiter43fp8gemm_bf16_blockscale_BpreShuffle_128x128E,290.2,0.17932,0.0
gfx942,80,1216,11264,7168,ck,14,2,695.9631,a8w8_blockscale_bpreshuffle_1x128x128_256x64x128x128_16x16_16x16_8x32x1_8x32x1_1x32x1x8_8_2x1_intrawave_v1,282.14,0.1679,0.0
gfx942,80,1280,11264,7168,asm,40,1,705.6929,_ZN5aiter43fp8gemm_bf16_blockscale_BpreShuffle_128x128E,292.9,0.16828,0.0
gfx942,80,1344,11264,7168,asm,32,1,789.0994,_ZN5aiter42fp8gemm_bf16_blockscale_BpreShuffle_96x128E,275.04,0.1529,0.0
gfx942,80,1408,11264,7168,ck,14,2,826.4833,a8w8_blockscale_bpreshuffle_1x128x128_256x64x128x128_16x16_16x16_8x32x1_8x32x1_1x32x1x8_8_2x1_intrawave_v1,275.1,0.14828,0.0
gfx942,80,1472,11264,7168,ck,14,2,857.699,a8w8_blockscale_bpreshuffle_1x128x128_256x64x128x128_16x16_16x16_8x32x1_8x32x1_1x32x1x8_8_2x1_intrawave_v1,277.14,0.1451,0.0
gfx942,80,1536,11264,7168,ck,14,3,888.838,a8w8_blockscale_bpreshuffle_1x128x128_256x64x128x128_16x16_16x16_8x32x1_8x32x1_1x32x1x8_8_2x1_intrawave_v1,279.05,0.14216,0.0
gfx942,80,1600,11264,7168,ck,14,1,922.651,a8w8_blockscale_bpreshuffle_1x128x128_256x64x128x128_16x16_16x16_8x32x1_8x32x1_1x32x1x8_8_2x1_intrawave_v1,280.03,0.13901,0.0
gfx942,80,1664,11264,7168,asm,40,1,952.6571,_ZN5aiter43fp8gemm_bf16_blockscale_BpreShuffle_128x128E,282.06,0.13662,0.0
gfx942,80,1728,11264,7168,ck,14,0,987.7767,a8w8_blockscale_bpreshuffle_1x128x128_256x64x128x128_16x16_16x16_8x32x1_8x32x1_1x32x1x8_8_2x1_intrawave_v1,282.49,0.13369,0.0
gfx942,80,1792,11264,7168,asm,40,1,1016.7702,_ZN5aiter43fp8gemm_bf16_blockscale_BpreShuffle_128x128E,284.6,0.13175,0.0
gfx942,80,1856,11264,7168,ck,14,1,1055.8714,a8w8_blockscale_bpreshuffle_1x128x128_256x64x128x128_16x16_16x16_8x32x1_8x32x1_1x32x1x8_8_2x1_intrawave_v1,283.85,0.12867,0.0
gfx942,80,1920,11264,7168,asm,40,1,1080.5188,_ZN5aiter43fp8gemm_bf16_blockscale_BpreShuffle_128x128E,286.94,0.12749,0.0
gfx942,80,1984,11264,7168,asm,40,1,1148.3802,_ZN5aiter43fp8gemm_bf16_blockscale_BpreShuffle_128x128E,278.98,0.12161,0.0
gfx942,80,2048,11264,7168,asm,40,1,1143.3801,_ZN5aiter43fp8gemm_bf16_blockscale_BpreShuffle_128x128E,289.24,0.12381,0.0
gfx942,80,4096,11264,7168,asm,40,1,2286.2033,_ZN5aiter43fp8gemm_bf16_blockscale_BpreShuffle_128x128E,289.31,0.08852,0.0
gfx942,80,8192,11264,7168,asm,40,1,4510.3929,_ZN5aiter43fp8gemm_bf16_blockscale_BpreShuffle_128x128E,293.29,0.07184,0.0
gfx942,80,16384,11264,7168,asm,40,1,8997.119,_ZN5aiter43fp8gemm_bf16_blockscale_BpreShuffle_128x128E,294.06,0.06305,0.0
gfx942,80,32768,11264,7168,asm,40,1,17903.6992,_ZN5aiter43fp8gemm_bf16_blockscale_BpreShuffle_128x128E,295.55,0.05886,0.0
gfx942,80,1,36864,7168,ck,3,3,80.2402,a8w8_blockscale_bpreshuffle_1x128x128_256x16x256x128_8x16_16x16_16x16x1_8x32x1_1x16x1x16_8_1x2_intrawave_v1,6.59,3.29413,0.0
gfx942,80,2,36864,7168,ck,3,3,80.6014,a8w8_blockscale_bpreshuffle_1x128x128_256x16x256x128_8x16_16x16_16x16x1_8x32x1_1x16x1x16_8_1x2_intrawave_v1,13.11,3.28038,0.0
gfx942,80,4,36864,7168,ck,3,2,80.9864,a8w8_blockscale_bpreshuffle_1x128x128_256x16x256x128_8x16_16x16_16x16x1_8x32x1_1x16x1x16_8_1x2_intrawave_v1,26.1,3.26678,0.0
gfx942,80,8,36864,7168,ck,3,2,82.1174,a8w8_blockscale_bpreshuffle_1x128x128_256x16x256x128_8x16_16x16_16x16x1_8x32x1_1x16x1x16_8_1x2_intrawave_v1,51.49,3.22573,0.0
gfx942,80,16,36864,7168,ck,3,0,86.0665,a8w8_blockscale_bpreshuffle_1x128x128_256x16x256x128_8x16_16x16_16x16x1_8x32x1_1x16x1x16_8_1x2_intrawave_v1,98.25,3.08524,0.0
gfx942,80,32,36864,7168,ck,8,2,100.6318,a8w8_blockscale_bpreshuffle_1x128x128_256x32x256x128_16x16_16x16_8x32x1_8x32x1_1x32x1x8_8_2x1_intrawave_v1,168.05,2.65155,0.0
gfx942,80,64,36864,7168,asm,16,1,151.3015,_ZN5aiter42fp8gemm_bf16_blockscale_BpreShuffle_64x128E,223.55,1.78067,0.0
gfx942,80,128,36864,7168,asm,40,1,258.7545,_ZN5aiter43fp8gemm_bf16_blockscale_BpreShuffle_128x128E,261.43,1.06122,0.0
gfx942,80,256,36864,7168,ck,14,1,509.2441,a8w8_blockscale_bpreshuffle_1x128x128_256x64x128x128_16x16_16x16_8x32x1_8x32x1_1x32x1x8_8_2x1_intrawave_v1,265.67,0.55956,0.0
gfx942,80,512,36864,7168,asm,40,1,955.6557,_ZN5aiter43fp8gemm_bf16_blockscale_BpreShuffle_128x128E,283.14,0.31984,0.0
gfx942,80,1024,36864,7168,asm,40,1,1847.0023,_ZN5aiter43fp8gemm_bf16_blockscale_BpreShuffle_128x128E,293.0,0.18791,0.0
gfx942,80,2048,36864,7168,asm,40,1,3690.7146,_ZN5aiter43fp8gemm_bf16_blockscale_BpreShuffle_128x128E,293.26,0.11649,0.0
gfx942,80,4096,36864,7168,asm,40,1,7390.514,_ZN5aiter43fp8gemm_bf16_blockscale_BpreShuffle_128x128E,292.9,0.08059,0.0
gfx942,80,6144,36864,7168,asm,40,1,10983.185,_ZN5aiter43fp8gemm_bf16_blockscale_BpreShuffle_128x128E,295.63,0.06931,0.0
gfx942,80,8120,36864,7168,asm,40,1,14679.9317,_ZN5aiter43fp8gemm_bf16_blockscale_BpreShuffle_128x128E,292.32,0.06275,0.0
gfx942,80,10240,36864,7168,asm,40,1,18403.5602,_ZN5aiter43fp8gemm_bf16_blockscale_BpreShuffle_128x128E,294.05,0.05937,0.0
gfx942,80,12288,36864,7168,asm,40,1,22128.6447,_ZN5aiter43fp8gemm_bf16_blockscale_BpreShuffle_128x128E,293.47,0.05686,0.0
gfx942,80,14336,36864,7168,asm,40,1,25659.6676,_ZN5aiter43fp8gemm_bf16_blockscale_BpreShuffle_128x128E,295.26,0.05549,0.0
gfx942,80,16384,36864,7168,asm,40,1,29295.594,_ZN5aiter43fp8gemm_bf16_blockscale_BpreShuffle_128x128E,295.56,0.05426,0.0
gfx950,256,1,128,7168,asm,6,7,5.8052,_ZN5aiter42fp8gemm_bf16_blockscale_BpreShuffle_32x128E,0.32,0.15933,0.0
gfx950,256,2,128,7168,asm,15,8,7.3741,_ZN5aiter42fp8gemm_bf16_blockscale_BpreShuffle_48x128E,0.5,0.12644,0.0039
gfx950,256,4,128,7168,asm,15,8,8.4244,_ZN5aiter42fp8gemm_bf16_blockscale_BpreShuffle_48x128E,0.87,0.11244,0.0098
gfx950,256,8,128,7168,asm,6,7,6.7585,_ZN5aiter42fp8gemm_bf16_blockscale_BpreShuffle_32x128E,2.17,0.14454,0.002
gfx950,256,1,2112,7168,ck,7,0,19.9968,a8w8_blockscale_bpreshuffle_1x128x128_256x16x64x256_16x16_16x16_16x16x1_16x16x1_1x16x1x16_4_1x1_intrawave_v1,1.51,0.75763,0.0
gfx950,256,2,2112,7168,ck,7,0,20.1127,a8w8_blockscale_bpreshuffle_1x128x128_256x16x64x256_16x16_16x16_16x16x1_16x16x1_1x16x1x16_4_1x1_intrawave_v1,3.01,0.75383,0.0
gfx950,256,4,2112,7168,ck,7,3,19.9479,a8w8_blockscale_bpreshuffle_1x128x128_256x16x64x256_16x16_16x16_16x16x1_16x16x1_1x16x1x16_4_1x1_intrawave_v1,6.07,0.7612,0.0
gfx950,256,8,2112,7168,ck,7,1,19.9138,a8w8_blockscale_bpreshuffle_1x128x128_256x16x64x256_16x16_16x16_16x16x1_16x16x1_1x16x1x16_4_1x1_intrawave_v1,12.16,0.76479,0.0
gfx950,256,1,2240,7168,ck,7,0,19.9854,a8w8_blockscale_bpreshuffle_1x128x128_256x16x64x256_16x16_16x16_16x16x1_16x16x1_1x16x1x16_4_1x1_intrawave_v1,1.61,0.80399,0.0
gfx950,256,2,2240,7168,ck,7,0,19.8625,a8w8_blockscale_bpreshuffle_1x128x128_256x16x64x256_16x16_16x16_16x16x1_16x16x1_1x16x1x16_4_1x1_intrawave_v1,3.23,0.80955,0.0
gfx950,256,4,2240,7168,ck,7,2,19.8362,a8w8_blockscale_bpreshuffle_1x128x128_256x16x64x256_16x16_16x16_16x16x1_16x16x1_1x16x1x16_4_1x1_intrawave_v1,6.48,0.81179,0.0
gfx950,256,8,2240,7168,ck,7,0,19.9288,a8w8_blockscale_bpreshuffle_1x128x128_256x16x64x256_16x16_16x16_16x16x1_16x16x1_1x16x1x16_4_1x1_intrawave_v1,12.89,0.81036,0.0
gfx950,256,1,3072,1536,asm,9,6,5.3852,_ZN5aiter42fp8gemm_bf16_blockscale_BpreShuffle_48x128E,1.75,0.87764,0.0
gfx950,256,2,3072,1536,asm,14,6,5.7319,_ZN5aiter42fp8gemm_bf16_blockscale_BpreShuffle_64x128E,3.29,0.8259,0.0
gfx950,256,4,3072,1536,asm,19,6,6.2851,_ZN5aiter42fp8gemm_bf16_blockscale_BpreShuffle_80x128E,6.01,0.75565,0.0
gfx950,256,8,3072,1536,ck,7,3,6.6967,a8w8_blockscale_bpreshuffle_1x128x128_256x16x64x256_16x16_16x16_16x16x1_16x16x1_1x16x1x16_4_1x1_intrawave_v1,11.27,0.71379,0.0
gfx950,256,1,4096,512,ck,7,0,3.0194,a8w8_blockscale_bpreshuffle_1x128x128_256x16x64x256_16x16_16x16_16x16x1_16x16x1_1x16x1x16_4_1x1_intrawave_v1,1.39,0.69744,0.0
gfx950,256,2,4096,512,ck,7,0,3.0615,a8w8_blockscale_bpreshuffle_1x128x128_256x16x64x256_16x16_16x16_16x16x1_16x16x1_1x16x1x16_4_1x1_intrawave_v1,2.74,0.69069,0.0
gfx950,256,4,4096,512,ck,6,2,3.406,a8w8_blockscale_bpreshuffle_1x128x128_256x16x128x256_16x16_16x16_16x16x1_16x16x1_1x16x1x16_8_1x2_intrawave_v1,4.93,0.62594,0.0
gfx950,256,8,4096,512,ck,7,2,3.5881,a8w8_blockscale_bpreshuffle_1x128x128_256x16x64x256_16x16_16x16_16x16x1_16x16x1_1x16x1x16_4_1x1_intrawave_v1,9.35,0.60388,0.0
gfx950,256,1,4608,7168,asm,6,7,9.2812,_ZN5aiter42fp8gemm_bf16_blockscale_BpreShuffle_32x128E,7.12,3.56059,0.0087
gfx950,256,2,4608,7168,asm,21,6,11.8666,_ZN5aiter42fp8gemm_bf16_blockscale_BpreShuffle_64x128E,11.13,2.78622,0.0056
gfx950,256,4,4608,7168,asm,14,7,13.1528,_ZN5aiter42fp8gemm_bf16_blockscale_BpreShuffle_48x128E,20.09,2.51625,0.0034
gfx950,256,8,4608,7168,asm,21,6,13.0018,_ZN5aiter42fp8gemm_bf16_blockscale_BpreShuffle_64x128E,40.65,2.55051,0.0044
gfx950,256,1,6144,1536,asm,3,4,6.6878,_ZN5aiter42fp8gemm_bf16_blockscale_BpreShuffle_32x128E,2.82,1.41317,0.0
gfx950,256,32768,6144,1536,ck,13,0,405.5337,a8w8_blockscale_bpreshuffle_1x128x128_256x64x256x128_16x16_16x16_8x32x1_8x32x1_1x32x1x8_8_2x1_intrawave_v1,1525.09,1.14028,0.0
gfx950,256,1,7168,2048,ck,7,0,7.5329,a8w8_blockscale_bpreshuffle_1x128x128_256x16x64x256_16x16_16x16_16x16x1_16x16x1_1x16x1x16_4_1x1_intrawave_v1,3.9,1.95097,0.0
gfx950,256,1,7168,2304,asm,3,4,7.7904,_ZN5aiter42fp8gemm_bf16_blockscale_BpreShuffle_32x128E,4.24,2.12206,0.0
gfx950,256,1,7168,4096,triton,0,0,10.41,triton,5.64,2.82,0.0
gfx950,256,1,7168,4608,asm,24,4,10.4376,_ZN5aiter42fp8gemm_bf16_blockscale_BpreShuffle_80x128E,6.33,3.16635,0.0
gfx950,256,2,7168,2048,ck,7,0,7.2902,a8w8_blockscale_bpreshuffle_1x128x128_256x16x64x256_16x16_16x16_16x16x1_16x16x1_1x16x1x16_4_1x1_intrawave_v1,8.05,2.01817,0.0
gfx950,256,2,7168,2304,ck,7,0,8.4682,a8w8_blockscale_bpreshuffle_1x128x128_256x16x64x256_16x16_16x16_16x16x1_16x16x1_1x16x1x16_4_1x1_intrawave_v1,7.8,1.95418,0.0
gfx950,256,2,7168,4096,triton,0,0,10.61,triton,11.07,2.77,0.0
gfx950,256,2,7168,4608,asm,31,4,10.8303,_ZN5aiter42fp8gemm_bf16_blockscale_BpreShuffle_96x128E,12.2,3.05329,0.0
gfx950,256,4,7168,2048,ck,7,1,8.0066,a8w8_blockscale_bpreshuffle_1x128x128_256x16x64x256_16x16_16x16_16x16x1_16x16x1_1x16x1x16_4_1x1_intrawave_v1,14.67,1.84168,0.0
gfx950,256,4,7168,2304,ck,7,2,8.1317,a8w8_blockscale_bpreshuffle_1x128x128_256x16x64x256_16x16_16x16_16x16x1_16x16x1_1x16x1x16_4_1x1_intrawave_v1,16.25,2.03913,0.0
gfx950,256,4,7168,4096,triton,0,0,10.76,triton,21.83,2.74,0.0
gfx950,256,4,7168,4608,asm,10,4,10.0523,_ZN5aiter42fp8gemm_bf16_blockscale_BpreShuffle_48x128E,26.29,3.29337,0.0
gfx950,256,8,7168,2048,ck,7,0,7.5331,a8w8_blockscale_bpreshuffle_1x128x128_256x16x64x256_16x16_16x16_16x16x1_16x16x1_1x16x1x16_4_1x1_intrawave_v1,31.18,1.96614,0.0
gfx950,256,8,7168,2304,ck,7,2,8.6815,a8w8_blockscale_bpreshuffle_1x128x128_256x16x64x256_16x16_16x16_16x16x1_16x16x1_1x16x1x16_4_1x1_intrawave_v1,30.44,1.91766,0.0
gfx950,256,8,7168,4096,triton,0,0,10.98,triton,42.78,2.69,0.0
gfx950,256,8,7168,4608,asm,24,4,10.3971,_ZN5aiter42fp8gemm_bf16_blockscale_BpreShuffle_80x128E,50.83,3.19144,0.0
gfx950,256,16,7168,4096,triton,0,0,11.69,triton,80.37,2.54,0.0
gfx950,256,16,7168,4608,asm,3,4,10.2031,_ZN5aiter42fp8gemm_bf16_blockscale_BpreShuffle_32x128E,103.59,3.26697,0.0
gfx950,256,32,7168,4096,triton,0,0,12.51,triton,150.2,2.39,0.0
gfx950,256,32,7168,4608,ck,7,0,13.32,a8w8_blockscale_bpreshuffle_1x128x128_256x16x64x256_16x16_16x16_16x16x1_16x16x1_1x16x1x16_4_1x1_intrawave_v1,158.7,2.52525,0.0
gfx950,256,64,7168,4096,ck,12,0,12.9143,a8w8_blockscale_bpreshuffle_1x128x128_256x32x64x256_16x16_16x16_16x16x1_16x16x1_1x32x1x8_8_2x1_intrawave_v1,291.0,2.3648,0.0
gfx950,256,64,7168,4608,ck,12,0,14.2952,a8w8_blockscale_bpreshuffle_1x128x128_256x32x64x256_16x16_16x16_16x16x1_16x16x1_1x32x1x8_8_2x1_intrawave_v1,295.75,2.39539,0.0
gfx950,256,128,7168,4096,ck,17,0,15.0349,a8w8_blockscale_bpreshuffle_1x128x128_256x64x64x256_16x16_16x16_16x16x1_16x16x1_1x32x1x8_8_2x1_intrawave_v1,499.92,2.10972,0.0
gfx950,256,128,7168,4608,asm,15,2,16.0682,_ZN5aiter42fp8gemm_bf16_blockscale_BpreShuffle_64x128E,526.24,2.20653,0.0
gfx950,256,256,7168,4096,asm,16,1,20.2801,_ZN5aiter42fp8gemm_bf16_blockscale_BpreShuffle_64x128E,741.24,1.6804,0.0
gfx950,256,256,7168,4608,asm,14,1,21.1215,_ZN5aiter42fp8gemm_bf16_blockscale_BpreShuffle_64x128E,800.67,1.79342,0.0
gfx950,256,512,7168,4096,asm,40,1,29.2137,_ZN5aiter43fp8gemm_bf16_blockscale_BpreShuffle_128x128E,1029.13,1.32805,0.0
gfx950,256,512,7168,4608,asm,35,1,32.581,_ZN5aiter43fp8gemm_bf16_blockscale_BpreShuffle_128x128E,1038.12,1.31148,0.0
gfx950,256,1024,7168,4096,ck,13,0,48.0948,a8w8_blockscale_bpreshuffle_1x128x128_256x64x256x128_16x16_16x16_8x32x1_8x32x1_1x32x1x8_8_2x1_intrawave_v1,1250.23,1.0029,0.0
gfx950,256,1024,7168,4608,ck,13,0,53.0917,a8w8_blockscale_bpreshuffle_1x128x128_256x64x256x128_16x16_16x16_8x32x1_8x32x1_1x32x1x8_8_2x1_intrawave_v1,1274.13,0.98751,0.0
gfx950,256,2048,7168,4096,ck,13,0,88.3336,a8w8_blockscale_bpreshuffle_1x128x128_256x64x256x128_16x16_16x16_8x32x1_8x32x1_1x32x1x8_8_2x1_intrawave_v1,1361.42,0.75972,0.0
gfx950,256,2048,7168,4608,ck,13,0,97.6953,a8w8_blockscale_bpreshuffle_1x128x128_256x64x256x128_16x16_16x16_8x32x1_8x32x1_1x32x1x8_8_2x1_intrawave_v1,1384.83,0.73522,0.0
gfx950,256,4096,7168,4096,ck,13,0,147.6995,a8w8_blockscale_bpreshuffle_1x128x128_256x64x256x128_16x16_16x16_8x32x1_8x32x1_1x32x1x8_8_2x1_intrawave_v1,1628.43,0.70994,0.0
gfx950,256,4096,7168,4608,ck,13,0,164.6321,a8w8_blockscale_bpreshuffle_1x128x128_256x64x256x128_16x16_16x16_8x32x1_8x32x1_1x32x1x8_8_2x1_intrawave_v1,1643.56,0.67195,0.0
gfx950,256,8192,7168,4096,ck,13,0,274.0381,a8w8_blockscale_bpreshuffle_1x128x128_256x64x256x128_16x16_16x16_8x32x1_8x32x1_1x32x1x8_8_2x1_intrawave_v1,1755.36,0.65814,0.0
gfx950,256,8192,7168,4608,cktile,27,0,299.1261,a8w8_blockscale_cktile_192x256x128_4x2x1_16x16x128_intrawave_0x1x0_2,1809.16,0.62923,0.0
gfx950,256,16384,7168,4096,cktile,29,0,499.9726,a8w8_blockscale_cktile_192x256x128_4x2x1_16x16x128_intrawave_0x1x0_4,1924.25,0.66274,0.0
gfx950,256,16384,7168,4608,cktile,28,0,544.5509,a8w8_blockscale_cktile_192x256x128_4x2x1_16x16x128_intrawave_0x1x0_3,1987.57,0.63063,0.0
gfx950,256,32768,7168,4096,cktile,11,0,984.4841,a8w8_blockscale_cktile_192x256x128_4x2x1_16x16x128_intrawave_0x1x0_1,1954.47,0.64332,0.0
gfx950,256,32768,7168,4608,cktile,11,0,1075.8943,a8w8_blockscale_cktile_192x256x128_4x2x1_16x16x128_intrawave_0x1x0_1,2011.97,0.60767,0.0
gfx950,256,1,8192,512,ck,7,0,4.2471,a8w8_blockscale_bpreshuffle_1x128x128_256x16x64x256_16x16_16x16_16x16x1_16x16x1_1x16x1x16_4_1x1_intrawave_v1,1.98,0.99155,0.0
gfx950,256,1,8192,1536,ck,7,0,6.9776,a8w8_blockscale_bpreshuffle_1x128x128_256x16x64x256_16x16_16x16_16x16x1_16x16x1_1x16x1x16_4_1x1_intrawave_v1,3.61,1.8059,0.0
gfx950,256,2,8192,512,ck,12,0,4.1143,a8w8_blockscale_bpreshuffle_1x128x128_256x32x64x256_16x16_16x16_16x16x1_16x16x1_1x32x1x8_8_2x1_intrawave_v1,4.08,1.02766,0.0
gfx950,256,2,8192,1536,triton,0,0,4.5918,triton,10.96,2.75,0.0
gfx950,256,4,8192,512,ck,6,0,4.1876,a8w8_blockscale_bpreshuffle_1x128x128_256x16x128x256_16x16_16x16_16x16x1_16x16x1_1x16x1x16_8_1x2_intrawave_v1,8.01,1.01774,0.0
gfx950,256,4,8192,1536,ck,7,3,6.8228,a8w8_blockscale_bpreshuffle_1x128x128_256x16x64x256_16x16_16x16_16x16x1_16x16x1_1x16x1x16_4_1x1_intrawave_v1,14.75,1.85475,0.0
gfx950,256,8,8192,512,ck,12,0,4.1498,a8w8_blockscale_bpreshuffle_1x128x128_256x32x64x256_16x16_16x16_16x16x1_16x16x1_1x32x1x8_8_2x1_intrawave_v1,16.17,1.0433,0.0
gfx950,256,8,8192,1536,ck,7,1,6.7869,a8w8_blockscale_bpreshuffle_1x128x128_256x16x64x256_16x16_16x16_16x16x1_16x16x1_1x16x1x16_4_1x1_intrawave_v1,29.66,1.87512,0.0
gfx950,256,16,8192,512,ck,7,0,3.7145,a8w8_blockscale_bpreshuffle_1x128x128_256x16x64x256_16x16_16x16_16x16x1_16x16x1_1x16x1x16_4_1x1_intrawave_v1,36.13,1.20195,0.0
gfx950,256,32,8192,512,ck,12,0,4.2856,a8w8_blockscale_bpreshuffle_1x128x128_256x32x64x256_16x16_16x16_16x16x1_16x16x1_1x32x1x8_8_2x1_intrawave_v1,62.64,1.10486,0.0
gfx950,256,64,8192,512,ck,7,0,4.8995,a8w8_blockscale_bpreshuffle_1x128x128_256x16x64x256_16x16_16x16_16x16x1_16x16x1_1x16x1x16_4_1x1_intrawave_v1,109.58,1.07677,0.0
gfx950,256,128,8192,512,ck,11,0,5.2963,a8w8_blockscale_bpreshuffle_1x128x128_256x32x128x256_16x16_16x16_16x16x1_16x16x1_1x32x1x8_8_2x1_intrawave_v1,202.73,1.20027,0.0
gfx950,256,256,8192,512,ck,16,0,7.0403,a8w8_blockscale_bpreshuffle_1x128x128_256x64x128x256_16x16_16x16_16x16x1_16x16x1_1x32x1x8_8_2x1_intrawave_v1,305.03,1.21013,0.0
gfx950,256,512,8192,512,asm,15,1,10.2061,_ZN5aiter43fp8gemm_bf16_blockscale_BpreShuffle_128x128E,420.82,1.25857,0.0
gfx950,256,1024,8192,512,ck,16,0,15.7842,a8w8_blockscale_bpreshuffle_1x128x128_256x64x128x256_16x16_16x16_16x16x1_16x16x1_1x32x1x8_8_2x1_intrawave_v1,544.21,1.36186,0.0
gfx950,256,2048,8192,512,ck,16,0,27.8537,a8w8_blockscale_bpreshuffle_1x128x128_256x64x128x256_16x16_16x16_16x16x1_16x16x1_1x32x1x8_8_2x1_intrawave_v1,616.79,1.3929,0.0
gfx950,256,4096,8192,512,ck,16,0,46.8605,a8w8_blockscale_bpreshuffle_1x128x128_256x64x128x256_16x16_16x16_16x16x1_16x16x1_1x32x1x8_8_2x1_intrawave_v1,733.23,1.56636,0.0
gfx950,256,8192,8192,512,ck,16,0,86.4464,a8w8_blockscale_bpreshuffle_1x128x128_256x64x128x256_16x16_16x16_16x16x1_16x16x1_1x32x1x8_8_2x1_intrawave_v1,794.94,1.64965,0.0
gfx950,256,16384,8192,512,ck,16,0,158.6056,a8w8_blockscale_bpreshuffle_1x128x128_256x64x128x256_16x16_16x16_16x16x1_16x16x1_1x32x1x8_8_2x1_intrawave_v1,866.55,1.77181,0.0
gfx950,256,32768,8192,512,ck,16,0,299.9883,a8w8_blockscale_bpreshuffle_1x128x128_256x64x128x256_16x16_16x16_16x16x1_16x16x1_1x32x1x8_8_2x1_intrawave_v1,916.3,1.85955,0.0
gfx950,256,1,9216,7168,asm,2,3,15.699,_ZN5aiter42fp8gemm_bf16_blockscale_BpreShuffle_32x128E,8.42,4.20956,0.0008
gfx950,256,2,9216,7168,asm,26,3,15.7816,_ZN5aiter42fp8gemm_bf16_blockscale_BpreShuffle_80x128E,16.74,4.18915,0.0001
gfx950,256,4,9216,7168,asm,2,3,15.3621,_ZN5aiter42fp8gemm_bf16_blockscale_BpreShuffle_32x128E,34.4,4.30688,0.0002
gfx950,256,8,9216,7168,asm,2,3,15.2391,_ZN5aiter42fp8gemm_bf16_blockscale_BpreShuffle_32x128E,69.36,4.34836,0.0002
gfx950,256,16,9216,7168,asm,26,3,16.0249,_ZN5aiter42fp8gemm_bf16_blockscale_BpreShuffle_80x128E,131.92,4.14791,0.0006
gfx950,256,32,9216,7168,asm,2,3,18.1937,_ZN5aiter42fp8gemm_bf16_blockscale_BpreShuffle_32x128E,232.38,3.67597,0.0003
gfx950,256,64,9216,7168,asm,26,3,19.0272,_ZN5aiter42fp8gemm_bf16_blockscale_BpreShuffle_80x128E,444.4,3.558,0.0003
gfx950,256,128,9216,7168,asm,42,3,27.1874,_ZN5aiter43fp8gemm_bf16_blockscale_BpreShuffle_128x128E,622.03,2.55034,0.0004
gfx950,256,256,9216,7168,asm,32,1,38.3694,_ZN5aiter42fp8gemm_bf16_blockscale_BpreShuffle_96x128E,881.51,1.89249,0.0
gfx950,256,512,9216,7168,asm,24,1,66.6022,_ZN5aiter42fp8gemm_bf16_blockscale_BpreShuffle_80x128E,1015.67,1.18866,0.0
gfx950,256,1024,9216,7168,cktile,28,0,87.8004,a8w8_blockscale_cktile_192x256x128_4x2x1_16x16x128_intrawave_0x1x0_3,1540.9,1.05096,0.0
gfx950,256,2048,9216,7168,cktile,27,0,169.1658,a8w8_blockscale_cktile_192x256x128_4x2x1_16x16x128_intrawave_0x1x0_2,1599.51,0.70043,0.0
gfx950,256,4096,9216,7168,cktile,29,0,279.3738,a8w8_blockscale_cktile_192x256x128_4x2x1_16x16x128_intrawave_0x1x0_4,1937.07,0.61179,0.0
gfx950,256,8192,9216,7168,cktile,29,0,512.4412,a8w8_blockscale_cktile_192x256x128_4x2x1_16x16x128_intrawave_0x1x0_4,2112.11,0.53816,0.0
gfx950,256,16384,9216,7168,cktile,29,0,1002.1305,a8w8_blockscale_cktile_192x256x128_4x2x1_16x16x128_intrawave_0x1x0_4,2160.06,0.48446,0.0
gfx950,256,32768,9216,7168,cktile,11,0,1946.3022,a8w8_blockscale_cktile_192x256x128_4x2x1_16x16x128_intrawave_0x1x0_1,2224.39,0.46494,0.0
gfx950,256,1,11264,1536,ck,6,0,7.2191,a8w8_blockscale_bpreshuffle_1x128x128_256x16x128x256_16x16_16x16_16x16x1_16x16x1_1x16x1x16_8_1x2_intrawave_v1,4.79,2.39996,0.0
gfx950,256,2,11264,1536,ck,7,0,6.8633,a8w8_blockscale_bpreshuffle_1x128x128_256x16x64x256_16x16_16x16_16x16x1_16x16x1_1x16x1x16_4_1x1_intrawave_v1,10.08,2.52788,0.0
gfx950,256,4,11264,1536,ck,7,0,6.7637,a8w8_blockscale_bpreshuffle_1x128x128_256x16x64x256_16x16_16x16_16x16x1_16x16x1_1x16x1x16_4_1x1_intrawave_v1,20.46,2.57223,0.0
gfx950,256,8,11264,1536,ck,7,1,6.9186,a8w8_blockscale_bpreshuffle_1x128x128_256x16x64x256_16x16_16x16_16x16x1_16x16x1_1x16x1x16_4_1x1_intrawave_v1,40.01,2.52855,0.0
gfx950,256,1,14336,1536,ck,7,0,7.3459,a8w8_blockscale_bpreshuffle_1x128x128_256x16x64x256_16x16_16x16_16x16x1_16x16x1_1x16x1x16_4_1x1_intrawave_v1,6.0,3.00172,0.0
gfx950,256,2,14336,1536,ck,7,0,7.5959,a8w8_blockscale_bpreshuffle_1x128x128_256x16x64x256_16x16_16x16_16x16x1_16x16x1_1x16x1x16_4_1x1_intrawave_v1,11.6,2.9069,0.0
gfx950,256,4,14336,1536,ck,7,0,7.2282,a8w8_blockscale_bpreshuffle_1x128x128_256x16x64x256_16x16_16x16_16x16x1_16x16x1_1x16x1x16_4_1x1_intrawave_v1,24.37,3.06313,0.0
gfx950,256,8,14336,1536,ck,6,0,7.5651,a8w8_blockscale_bpreshuffle_1x128x128_256x16x128x256_16x16_16x16_16x16x1_16x16x1_1x16x1x16_8_1x2_intrawave_v1,46.57,2.94269,0.0
gfx950,256,16,14336,1536,ck,7,0,6.7558,a8w8_blockscale_bpreshuffle_1x128x128_256x16x64x256_16x16_16x16_16x16x1_16x16x1_1x16x1x16_4_1x1_intrawave_v1,104.3,3.33098,0.0
gfx950,256,32,14336,1536,ck,6,0,8.0576,a8w8_blockscale_bpreshuffle_1x128x128_256x16x128x256_16x16_16x16_16x16x1_16x16x1_1x16x1x16_8_1x2_intrawave_v1,174.9,2.8528,0.0
gfx950,256,64,14336,1536,ck,11,0,9.5397,a8w8_blockscale_bpreshuffle_1x128x128_256x32x128x256_16x16_16x16_16x16x1_16x16x1_1x32x1x8_8_2x1_intrawave_v1,295.46,2.51092,0.0
gfx950,256,128,14336,1536,asm,10,1,11.7244,_ZN5aiter42fp8gemm_bf16_blockscale_BpreShuffle_64x128E,480.8,2.20794,0.0
gfx950,256,256,14336,1536,asm,25,1,15.6321,_ZN5aiter43fp8gemm_bf16_blockscale_BpreShuffle_128x128E,721.23,1.90335,0.0
gfx950,256,512,14336,1536,ck,13,0,24.7504,a8w8_blockscale_bpreshuffle_1x128x128_256x64x256x128_16x16_16x16_8x32x1_8x32x1_1x32x1x8_8_2x1_intrawave_v1,911.04,1.51459,0.0
gfx950,256,1024,14336,1536,ck,13,0,45.0403,a8w8_blockscale_bpreshuffle_1x128x128_256x64x256x128_16x16_16x16_8x32x1_8x32x1_1x32x1x8_8_2x1_intrawave_v1,1001.26,1.17568,0.0
gfx950,256,2048,14336,1536,ck,13,0,78.0351,a8w8_blockscale_bpreshuffle_1x128x128_256x64x256x128_16x16_16x16_8x32x1_8x32x1_1x32x1x8_8_2x1_intrawave_v1,1155.82,1.07498,0.0
gfx950,256,4096,14336,1536,ck,13,0,135.9374,a8w8_blockscale_bpreshuffle_1x128x128_256x64x256x128_16x16_16x16_8x32x1_8x32x1_1x32x1x8_8_2x1_intrawave_v1,1327.0,1.0722,0.0
gfx950,256,8192,14336,1536,ck,13,0,251.0783,a8w8_blockscale_bpreshuffle_1x128x128_256x64x256x128_16x16_16x16_8x32x1_8x32x1_1x32x1x8_8_2x1_intrawave_v1,1436.91,1.07331,0.0
gfx950,256,16384,14336,1536,ck,13,0,469.0133,a8w8_blockscale_bpreshuffle_1x128x128_256x64x256x128_16x16_16x16_8x32x1_8x32x1_1x32x1x8_8_2x1_intrawave_v1,1538.45,1.1022,0.0
gfx950,256,32768,14336,1536,ck,13,0,904.6637,a8w8_blockscale_bpreshuffle_1x128x128_256x64x256x128_16x16_16x16_8x32x1_8x32x1_1x32x1x8_8_2x1_intrawave_v1,1595.19,1.11851,0.0
