aiter/configs/model_configs/a8w8_blockscale_tuned_gemm_glm5_1.csv
gfx,cu_num,M,N,K,libtype,kernelId,splitK,us,kernelName,tflops,bw,errRatio
gfx942,304,1,512,6144,ck,8,3,6.2284,a8w8_blockscale_1x128x128_256x16x64x256_16x16_16x16_1x1_16x16x1_16x16x1_1x16x1x16_4_1x1_intrawave_v1,1.01,506.21,0.0
gfx942,304,2,512,6144,ck,8,3,4.9581,a8w8_blockscale_1x128x128_256x16x64x256_16x16_16x16_1x1_16x16x1_16x16x1_1x16x1x16_4_1x1_intrawave_v1,2.54,637.35,0.0
gfx942,304,4,512,6144,ck,8,3,6.0716,a8w8_blockscale_1x128x128_256x16x64x256_16x16_16x16_1x1_16x16x1_16x16x1_1x16x1x16_4_1x1_intrawave_v1,4.14,522.83,0.0
gfx942,304,8,512,6144,ck,8,3,4.9916,a8w8_blockscale_1x128x128_256x16x64x256_16x16_16x16_1x1_16x16x1_16x16x1_1x16x1x16_4_1x1_intrawave_v1,10.08,641.69,0.0
gfx942,304,16,512,6144,ck,8,3,5.1914,a8w8_blockscale_1x128x128_256x16x64x256_16x16_16x16_1x1_16x16x1_16x16x1_1x16x1x16_4_1x1_intrawave_v1,19.39,628.04,0.0
gfx942,304,32,512,6144,ck,8,3,6.4849,a8w8_blockscale_1x128x128_256x16x64x256_16x16_16x16_1x1_16x16x1_16x16x1_1x16x1x16_4_1x1_intrawave_v1,31.05,520.46,0.0001
gfx942,304,48,512,6144,ck,8,3,8.3615,a8w8_blockscale_1x128x128_256x16x64x256_16x16_16x16_1x1_16x16x1_16x16x1_1x16x1x16_4_1x1_intrawave_v1,36.12,417.36,0.0002
gfx942,304,64,512,6144,ck,8,3,7.6306,a8w8_blockscale_1x128x128_256x16x64x256_16x16_16x16_1x1_16x16x1_16x16x1_1x16x1x16_4_1x1_intrawave_v1,52.77,472.37,0.0001
gfx942,304,80,512,6144,ck,13,3,11.5358,a8w8_blockscale_1x128x128_256x32x64x256_16x16_16x16_2x1_16x16x1_16x16x1_1x32x1x8_8_2x1_intrawave_v1,43.63,322.4,0.0001
gfx942,304,96,512,6144,ck,8,3,11.5501,a8w8_blockscale_1x128x128_256x16x64x256_16x16_16x16_1x1_16x16x1_16x16x1_1x16x1x16_4_1x1_intrawave_v1,52.29,331.93,0.0001
gfx942,304,112,512,6144,ck,8,3,11.1315,a8w8_blockscale_1x128x128_256x16x64x256_16x16_16x16_1x1_16x16x1_16x16x1_1x16x1x16_4_1x1_intrawave_v1,63.3,354.72,0.0002
gfx942,304,128,512,6144,ck,8,3,10.8236,a8w8_blockscale_1x128x128_256x16x64x256_16x16_16x16_1x1_16x16x1_16x16x1_1x16x1x16_4_1x1_intrawave_v1,74.4,375.4,0.0002
gfx942,304,144,512,6144,ck,8,3,11.6566,a8w8_blockscale_1x128x128_256x16x64x256_16x16_16x16_1x1_16x16x1_16x16x1_1x16x1x16_4_1x1_intrawave_v1,77.72,358.42,0.0002
gfx942,304,160,512,6144,ck,8,3,11.8804,a8w8_blockscale_1x128x128_256x16x64x256_16x16_16x16_1x1_16x16x1_16x16x1_1x16x1x16_4_1x1_intrawave_v1,84.73,361.32,0.0002
gfx942,304,176,512,6144,ck,8,3,12.1368,a8w8_blockscale_1x128x128_256x16x64x256_16x16_16x16_1x1_16x16x1_16x16x1_1x16x1x16_4_1x1_intrawave_v1,91.23,363.13,0.0002
gfx942,304,192,512,6144,ck,8,3,12.2839,a8w8_blockscale_1x128x128_256x16x64x256_16x16_16x16_1x1_16x16x1_16x16x1_1x16x1x16_4_1x1_intrawave_v1,98.34,368.12,0.0002
gfx942,304,208,512,6144,ck,8,3,12.4624,a8w8_blockscale_1x128x128_256x16x64x256_16x16_16x16_1x1_16x16x1_16x16x1_1x16x1x16_4_1x1_intrawave_v1,105.01,372.05,0.0002
gfx942,304,224,512,6144,ck,8,3,12.4708,a8w8_blockscale_1x128x128_256x16x64x256_16x16_16x16_1x1_16x16x1_16x16x1_1x16x1x16_4_1x1_intrawave_v1,113.01,381.0,0.0002
gfx942,304,240,512,6144,ck,8,3,13.6432,a8w8_blockscale_1x128x128_256x16x64x256_16x16_16x16_1x1_16x16x1_16x16x1_1x16x1x16_4_1x1_intrawave_v1,110.67,356.66,0.0002
gfx942,304,256,512,6144,ck,8,3,13.6069,a8w8_blockscale_1x128x128_256x16x64x256_16x16_16x16_1x1_16x16x1_16x16x1_1x16x1x16_4_1x1_intrawave_v1,118.37,366.04,0.0002
gfx942,304,288,512,6144,ck,8,3,14.0531,a8w8_blockscale_1x128x128_256x16x64x256_16x16_16x16_1x1_16x16x1_16x16x1_1x16x1x16_4_1x1_intrawave_v1,128.94,370.74,0.0002
gfx942,304,320,512,6144,ck,8,3,15.6049,a8w8_blockscale_1x128x128_256x16x64x256_16x16_16x16_1x1_16x16x1_16x16x1_1x16x1x16_4_1x1_intrawave_v1,129.01,348.58,0.0002
gfx942,304,352,512,6144,ck,8,3,15.9463,a8w8_blockscale_1x128x128_256x16x64x256_16x16_16x16_1x1_16x16x1_16x16x1_1x16x1x16_4_1x1_intrawave_v1,138.88,355.5,0.0002
gfx942,304,384,512,6144,ck,8,3,17.2483,a8w8_blockscale_1x128x128_256x16x64x256_16x16_16x16_1x1_16x16x1_16x16x1_1x16x1x16_4_1x1_intrawave_v1,140.07,341.96,0.0001
gfx942,304,416,512,6144,ck,8,3,17.7247,a8w8_blockscale_1x128x128_256x16x64x256_16x16_16x16_1x1_16x16x1_16x16x1_1x16x1x16_4_1x1_intrawave_v1,147.66,345.71,0.0002
gfx942,304,448,512,6144,ck,8,3,17.9902,a8w8_blockscale_1x128x128_256x16x64x256_16x16_16x16_1x1_16x16x1_16x16x1_1x16x1x16_4_1x1_intrawave_v1,156.67,353.36,0.0003
gfx942,304,480,512,6144,ck,8,3,18.8023,a8w8_blockscale_1x128x128_256x16x64x256_16x16_16x16_1x1_16x16x1_16x16x1_1x16x1x16_4_1x1_intrawave_v1,160.61,350.3,0.0003
gfx942,304,512,512,6144,ck,18,2,19.1201,a8w8_blockscale_1x128x128_256x64x64x256_16x16_32x32_1x1_16x16x1_16x16x1_1x32x1x8_8_1x1_intrawave_v1,168.47,356.47,0.0
gfx942,304,544,512,6144,ck,18,2,20.0574,a8w8_blockscale_1x128x128_256x64x64x256_16x16_32x32_1x1_16x16x1_16x16x1_1x32x1x8_8_1x1_intrawave_v1,170.64,351.25,0.0
gfx942,304,576,512,6144,ck,18,2,19.9222,a8w8_blockscale_1x128x128_256x64x64x256_16x16_32x32_1x1_16x16x1_16x16x1_1x32x1x8_8_1x1_intrawave_v1,181.9,365.15,0.0
gfx942,304,608,512,6144,ck,8,0,20.5945,a8w8_blockscale_1x128x128_256x16x64x256_16x16_16x16_1x1_16x16x1_16x16x1_1x16x1x16_4_1x1_intrawave_v1,185.74,364.36,0.0
gfx942,304,640,512,6144,ck,18,1,22.6306,a8w8_blockscale_1x128x128_256x64x64x256_16x16_32x32_1x1_16x16x1_16x16x1_1x32x1x8_8_1x1_intrawave_v1,177.92,341.72,0.0
gfx942,304,672,512,6144,ck,8,3,23.495,a8w8_blockscale_1x128x128_256x16x64x256_16x16_16x16_1x1_16x16x1_16x16x1_1x16x1x16_4_1x1_intrawave_v1,179.95,338.91,0.0003
gfx942,304,704,512,6144,ck,18,1,22.7451,a8w8_blockscale_1x128x128_256x64x64x256_16x16_32x32_1x1_16x16x1_16x16x1_1x32x1x8_8_1x1_intrawave_v1,194.73,360.17,0.0
gfx942,304,736,512,6144,ck,18,1,24.2035,a8w8_blockscale_1x128x128_256x64x64x256_16x16_32x32_1x1_16x16x1_16x16x1_1x32x1x8_8_1x1_intrawave_v1,191.32,347.94,0.0
gfx942,304,768,512,6144,ck,18,1,23.1971,a8w8_blockscale_1x128x128_256x64x64x256_16x16_32x32_1x1_16x16x1_16x16x1_1x32x1x8_8_1x1_intrawave_v1,208.29,372.92,0.0
gfx942,304,800,512,6144,ck,18,1,24.7127,a8w8_blockscale_1x128x128_256x64x64x256_16x16_32x32_1x1_16x16x1_16x16x1_1x32x1x8_8_1x1_intrawave_v1,203.67,359.33,0.0
gfx942,304,832,512,6144,ck,18,1,23.7778,a8w8_blockscale_1x128x128_256x64x64x256_16x16_32x32_1x1_16x16x1_16x16x1_1x32x1x8_8_1x1_intrawave_v1,220.14,383.11,0.0
gfx942,304,864,512,6144,ck,18,1,25.0314,a8w8_blockscale_1x128x128_256x64x64x256_16x16_32x32_1x1_16x16x1_16x16x1_1x32x1x8_8_1x1_intrawave_v1,217.16,373.09,0.0
gfx942,304,896,512,6144,ck,18,1,24.5241,a8w8_blockscale_1x128x128_256x64x64x256_16x16_32x32_1x1_16x16x1_16x16x1_1x32x1x8_8_1x1_intrawave_v1,229.86,390.16,0.0
gfx942,304,928,512,6144,ck,18,1,25.5061,a8w8_blockscale_1x128x128_256x64x64x256_16x16_32x32_1x1_16x16x1_16x16x1_1x32x1x8_8_1x1_intrawave_v1,228.9,384.13,0.0
gfx942,304,960,512,6144,ck,18,1,24.1508,a8w8_blockscale_1x128x128_256x64x64x256_16x16_32x32_1x1_16x16x1_16x16x1_1x32x1x8_8_1x1_intrawave_v1,250.09,415.18,0.0
gfx942,304,992,512,6144,ck,18,1,26.0671,a8w8_blockscale_1x128x128_256x64x64x256_16x16_32x32_1x1_16x16x1_16x16x1_1x32x1x8_8_1x1_intrawave_v1,239.43,393.46,0.0
gfx942,304,1024,512,6144,ck,18,1,24.8106,a8w8_blockscale_1x128x128_256x64x64x256_16x16_32x32_1x1_16x16x1_16x16x1_1x32x1x8_8_1x1_intrawave_v1,259.67,422.63,0.0
gfx942,304,1088,512,6144,ck,18,1,25.5025,a8w8_blockscale_1x128x128_256x64x64x256_16x16_32x32_1x1_16x16x1_16x16x1_1x32x1x8_8_1x1_intrawave_v1,268.41,429.15,0.0
gfx942,304,1152,512,6144,ck,18,0,26.5383,a8w8_blockscale_1x128x128_256x64x64x256_16x16_32x32_1x1_16x16x1_16x16x1_1x32x1x8_8_1x1_intrawave_v1,273.11,429.69,0.0
gfx942,304,1216,512,6144,ck,18,1,26.3719,a8w8_blockscale_1x128x128_256x64x64x256_16x16_32x32_1x1_16x16x1_16x16x1_1x32x1x8_8_1x1_intrawave_v1,290.1,449.8,0.0
gfx942,304,1280,512,6144,ck,18,0,26.536,a8w8_blockscale_1x128x128_256x64x64x256_16x16_32x32_1x1_16x16x1_16x16x1_1x32x1x8_8_1x1_intrawave_v1,303.48,464.3,0.0
gfx942,304,1344,512,6144,ck,18,0,26.7042,a8w8_blockscale_1x128x128_256x64x64x256_16x16_32x32_1x1_16x16x1_16x16x1_1x32x1x8_8_1x1_intrawave_v1,316.64,478.56,0.0
gfx942,304,1408,512,6144,ck,18,0,27.2563,a8w8_blockscale_1x128x128_256x64x64x256_16x16_32x32_1x1_16x16x1_16x16x1_1x32x1x8_8_1x1_intrawave_v1,325.0,485.7,0.0
gfx942,304,1472,512,6144,ck,18,0,26.4864,a8w8_blockscale_1x128x128_256x64x64x256_16x16_32x32_1x1_16x16x1_16x16x1_1x32x1x8_8_1x1_intrawave_v1,349.65,517.13,0.0
gfx942,304,1536,512,6144,ck,18,0,26.5748,a8w8_blockscale_1x128x128_256x64x64x256_16x16_32x32_1x1_16x16x1_16x16x1_1x32x1x8_8_1x1_intrawave_v1,363.64,532.68,0.0
gfx942,304,1600,512,6144,ck,18,0,26.8053,a8w8_blockscale_1x128x128_256x64x64x256_16x16_32x32_1x1_16x16x1_16x16x1_1x32x1x8_8_1x1_intrawave_v1,375.54,545.21,0.0
gfx942,304,1664,512,6144,ck,18,0,27.8702,a8w8_blockscale_1x128x128_256x64x64x256_16x16_32x32_1x1_16x16x1_16x16x1_1x32x1x8_8_1x1_intrawave_v1,375.63,540.84,0.0
gfx942,304,1728,512,6144,ck,18,0,27.0385,a8w8_blockscale_1x128x128_256x64x64x256_16x16_32x32_1x1_16x16x1_16x16x1_1x32x1x8_8_1x1_intrawave_v1,402.08,574.44,0.0
gfx942,304,1792,512,6144,ck,18,0,26.6524,a8w8_blockscale_1x128x128_256x64x64x256_16x16_32x32_1x1_16x16x1_16x16x1_1x32x1x8_8_1x1_intrawave_v1,423.01,599.98,0.0
gfx942,304,1856,512,6144,ck,18,0,28.0235,a8w8_blockscale_1x128x128_256x64x64x256_16x16_32x32_1x1_16x16x1_16x16x1_1x32x1x8_8_1x1_intrawave_v1,416.68,586.99,0.0
gfx942,304,1920,512,6144,ck,18,0,28.6459,a8w8_blockscale_1x128x128_256x64x64x256_16x16_32x32_1x1_16x16x1_16x16x1_1x32x1x8_8_1x1_intrawave_v1,421.69,590.25,0.0
gfx942,304,1984,512,6144,ck,18,0,28.7595,a8w8_blockscale_1x128x128_256x64x64x256_16x16_32x32_1x1_16x16x1_16x16x1_1x32x1x8_8_1x1_intrawave_v1,434.02,603.87,0.0
gfx942,304,2048,512,6144,ck,18,0,27.7869,a8w8_blockscale_1x128x128_256x64x64x256_16x16_32x32_1x1_16x16x1_16x16x1_1x32x1x8_8_1x1_intrawave_v1,463.7,641.52,0.0
gfx942,304,2112,512,6144,ck,18,0,28.7995,a8w8_blockscale_1x128x128_256x64x64x256_16x16_32x32_1x1_16x16x1_16x16x1_1x32x1x8_8_1x1_intrawave_v1,461.38,634.89,0.0
gfx942,304,2176,512,6144,ck,18,0,28.9595,a8w8_blockscale_1x128x128_256x64x64x256_16x16_32x32_1x1_16x16x1_16x16x1_1x32x1x8_8_1x1_intrawave_v1,472.74,647.22,0.0
gfx942,304,2240,512,6144,ck,18,0,27.6234,a8w8_blockscale_1x128x128_256x64x64x256_16x16_32x32_1x1_16x16x1_16x16x1_1x32x1x8_8_1x1_intrawave_v1,510.18,695.14,0.0
gfx942,304,2304,512,6144,ck,18,0,29.284,a8w8_blockscale_1x128x128_256x64x64x256_16x16_32x32_1x1_16x16x1_16x16x1_1x32x1x8_8_1x1_intrawave_v1,495.0,671.38,0.0
gfx942,304,2368,512,6144,ck,18,0,29.0655,a8w8_blockscale_1x128x128_256x64x64x256_16x16_32x32_1x1_16x16x1_16x16x1_1x32x1x8_8_1x1_intrawave_v1,512.57,692.21,0.0
gfx942,304,2432,512,6144,ck,18,0,30.3614,a8w8_blockscale_1x128x128_256x64x64x256_16x16_32x32_1x1_16x16x1_16x16x1_1x32x1x8_8_1x1_intrawave_v1,503.96,677.78,0.0
gfx942,304,2496,512,6144,ck,3,0,48.4027,a8w8_blockscale_1x128x128_256x64x64x128_16x16_32x32_1x1_8x32x1_8x32x1_1x32x1x8_8_1x1_intrawave_v3,324.43,434.63,0.0
gfx942,304,2560,512,6144,ck,3,0,44.1162,a8w8_blockscale_1x128x128_256x64x64x128_16x16_32x32_1x1_8x32x1_8x32x1_1x32x1x8_8_1x1_intrawave_v3,365.08,487.25,0.0
gfx942,304,2624,512,6144,ck,3,0,49.2105,a8w8_blockscale_1x128x128_256x64x64x128_16x16_32x32_1x1_8x32x1_8x32x1_1x32x1x8_8_1x1_intrawave_v3,335.47,446.14,0.0
gfx942,304,2688,512,6144,ck,3,0,49.15,a8w8_blockscale_1x128x128_256x64x64x128_16x16_32x32_1x1_8x32x1_8x32x1_1x32x1x8_8_1x1_intrawave_v3,344.08,456.02,0.0
gfx942,304,2752,512,6144,ck,3,0,45.5627,a8w8_blockscale_1x128x128_256x64x64x128_16x16_32x32_1x1_8x32x1_8x32x1_1x32x1x8_8_1x1_intrawave_v3,380.01,501.99,0.0
gfx942,304,2816,512,6144,ck,3,0,46.5571,a8w8_blockscale_1x128x128_256x64x64x128_16x16_32x32_1x1_8x32x1_8x32x1_1x32x1x8_8_1x1_intrawave_v3,380.54,501.12,0.0
gfx942,304,2880,512,6144,ck,3,0,49.3003,a8w8_blockscale_1x128x128_256x64x64x128_16x16_32x32_1x1_8x32x1_8x32x1_1x32x1x8_8_1x1_intrawave_v3,367.53,482.54,0.0
gfx942,304,2944,512,6144,ck,3,0,48.1637,a8w8_blockscale_1x128x128_256x64x64x128_16x16_32x32_1x1_8x32x1_8x32x1_1x32x1x8_8_1x1_intrawave_v3,384.56,503.46,0.0
gfx942,304,3008,512,6144,ck,3,0,47.755,a8w8_blockscale_1x128x128_256x64x64x128_16x16_32x32_1x1_8x32x1_8x32x1_1x32x1x8_8_1x1_intrawave_v3,396.29,517.37,0.0
gfx942,304,3072,512,6144,ck,3,0,45.3576,a8w8_blockscale_1x128x128_256x64x64x128_16x16_32x32_1x1_8x32x1_8x32x1_1x32x1x8_8_1x1_intrawave_v3,426.11,554.83,0.0
gfx942,304,3136,512,6144,ck,3,0,50.8102,a8w8_blockscale_1x128x128_256x64x64x128_16x16_32x32_1x1_8x32x1_8x32x1_1x32x1x8_8_1x1_intrawave_v3,388.31,504.32,0.0
gfx942,304,3200,512,6144,ck,3,0,47.031,a8w8_blockscale_1x128x128_256x64x64x128_16x16_32x32_1x1_8x32x1_8x32x1_1x32x1x8_8_1x1_intrawave_v3,428.07,554.6,0.0
gfx942,304,3264,512,6144,ck,3,0,47.5616,a8w8_blockscale_1x128x128_256x64x64x128_16x16_32x32_1x1_8x32x1_8x32x1_1x32x1x8_8_1x1_intrawave_v3,431.76,558.06,0.0
gfx942,304,3328,512,6144,ck,3,0,48.0199,a8w8_blockscale_1x128x128_256x64x64x128_16x16_32x32_1x1_8x32x1_8x32x1_1x32x1x8_8_1x1_intrawave_v3,436.03,562.28,0.0
gfx942,304,3392,512,6144,ck,3,0,52.5058,a8w8_blockscale_1x128x128_256x64x64x128_16x16_32x32_1x1_8x32x1_8x32x1_1x32x1x8_8_1x1_intrawave_v3,406.44,522.98,0.0
gfx942,304,3456,512,6144,ck,3,0,51.3267,a8w8_blockscale_1x128x128_256x64x64x128_16x16_32x32_1x1_8x32x1_8x32x1_1x32x1x8_8_1x1_intrawave_v3,423.62,543.93,0.0
gfx942,304,3520,512,6144,ck,3,0,52.2744,a8w8_blockscale_1x128x128_256x64x64x128_16x16_32x32_1x1_8x32x1_8x32x1_1x32x1x8_8_1x1_intrawave_v3,423.65,542.85,0.0
gfx942,304,3584,512,6144,ck,3,0,52.4031,a8w8_blockscale_1x128x128_256x64x64x128_16x16_32x32_1x1_8x32x1_8x32x1_1x32x1x8_8_1x1_intrawave_v3,430.29,550.27,0.0
gfx942,304,3648,512,6144,ck,3,0,53.2572,a8w8_blockscale_1x128x128_256x64x64x128_16x16_32x32_1x1_8x32x1_8x32x1_1x32x1x8_8_1x1_intrawave_v3,430.95,550.06,0.0
gfx942,304,3712,512,6144,ck,3,0,53.1894,a8w8_blockscale_1x128x128_256x64x64x128_16x16_32x32_1x1_8x32x1_8x32x1_1x32x1x8_8_1x1_intrawave_v3,439.07,559.38,0.0
gfx942,304,3776,512,6144,ck,3,0,53.8374,a8w8_blockscale_1x128x128_256x64x64x128_16x16_32x32_1x1_8x32x1_8x32x1_1x32x1x8_8_1x1_intrawave_v3,441.26,561.17,0.0
gfx942,304,3840,512,6144,ck,3,0,53.201,a8w8_blockscale_1x128x128_256x64x64x128_16x16_32x32_1x1_8x32x1_8x32x1_1x32x1x8_8_1x1_intrawave_v3,454.11,576.51,0.0
gfx942,304,3904,512,6144,ck,3,0,54.3554,a8w8_blockscale_1x128x128_256x64x64x128_16x16_32x32_1x1_8x32x1_8x32x1_1x32x1x8_8_1x1_intrawave_v3,451.87,572.7,0.0
gfx942,304,3968,512,6144,ck,3,0,54.3651,a8w8_blockscale_1x128x128_256x64x64x128_16x16_32x32_1x1_8x32x1_8x32x1_1x32x1x8_8_1x1_intrawave_v3,459.2,581.04,0.0
gfx942,304,4032,512,6144,ck,3,0,54.5271,a8w8_blockscale_1x128x128_256x64x64x128_16x16_32x32_1x1_8x32x1_8x32x1_1x32x1x8_8_1x1_intrawave_v3,465.22,587.73,0.0
gfx942,304,4096,512,6144,ck,3,0,52.2081,a8w8_blockscale_1x128x128_256x64x64x128_16x16_32x32_1x1_8x32x1_8x32x1_1x32x1x8_8_1x1_intrawave_v3,493.6,622.62,0.0
gfx942,304,4224,512,6144,ck,3,0,55.2075,a8w8_blockscale_1x128x128_256x64x64x128_16x16_32x32_1x1_8x32x1_8x32x1_1x32x1x8_8_1x1_intrawave_v3,481.37,605.41,0.0
gfx942,304,4352,512,6144,ck,3,0,56.6019,a8w8_blockscale_1x128x128_256x64x64x128_16x16_32x32_1x1_8x32x1_8x32x1_1x32x1x8_8_1x1_intrawave_v3,483.74,606.71,0.0
gfx942,304,4480,512,6144,ck,3,0,57.3736,a8w8_blockscale_1x128x128_256x64x64x128_16x16_32x32_1x1_8x32x1_8x32x1_1x32x1x8_8_1x1_intrawave_v3,491.27,614.54,0.0
gfx942,304,4608,512,6144,ck,3,0,57.5802,a8w8_blockscale_1x128x128_256x64x64x128_16x16_32x32_1x1_8x32x1_8x32x1_1x32x1x8_8_1x1_intrawave_v3,503.49,628.27,0.0
gfx942,304,4736,512,6144,ck,3,0,58.8596,a8w8_blockscale_1x128x128_256x64x64x128_16x16_32x32_1x1_8x32x1_8x32x1_1x32x1x8_8_1x1_intrawave_v3,506.23,630.2,0.0
gfx942,304,4864,512,6144,ck,2,0,59.4702,a8w8_blockscale_1x128x128_256x64x128x128_16x16_32x32_1x2_8x32x1_8x32x1_1x32x1x8_8_1x1_intrawave_v3,514.57,639.16,0.0
gfx942,304,4992,512,6144,ck,2,0,74.8301,a8w8_blockscale_1x128x128_256x64x128x128_16x16_32x32_1x2_8x32x1_8x32x1_1x32x1x8_8_1x1_intrawave_v3,419.71,520.22,0.0
gfx942,304,5120,512,6144,ck,2,0,74.1366,a8w8_blockscale_1x128x128_256x64x128x128_16x16_32x32_1x2_8x32x1_8x32x1_1x32x1x8_8_1x1_intrawave_v3,434.5,537.47,0.0
gfx942,304,5248,512,6144,ck,2,0,74.2862,a8w8_blockscale_1x128x128_256x64x128x128_16x16_32x32_1x2_8x32x1_8x32x1_1x32x1x8_8_1x1_intrawave_v3,444.46,548.73,0.0
gfx942,304,5376,512,6144,ck,2,0,74.3009,a8w8_blockscale_1x128x128_256x64x128x128_16x16_32x32_1x2_8x32x1_8x32x1_1x32x1x8_8_1x1_intrawave_v3,455.21,560.97,0.0
gfx942,304,5504,512,6144,ck,2,0,75.1332,a8w8_blockscale_1x128x128_256x64x128x128_16x16_32x32_1x2_8x32x1_8x32x1_1x32x1x8_8_1x1_intrawave_v3,460.89,566.97,0.0
gfx942,304,5632,512,6144,ck,2,0,75.3854,a8w8_blockscale_1x128x128_256x64x128x128_16x16_32x32_1x2_8x32x1_8x32x1_1x32x1x8_8_1x1_intrawave_v3,470.03,577.25,0.0
gfx942,304,5760,512,6144,ck,2,0,76.0493,a8w8_blockscale_1x128x128_256x64x128x128_16x16_32x32_1x2_8x32x1_8x32x1_1x32x1x8_8_1x1_intrawave_v3,476.52,584.27,0.0
gfx942,304,5888,512,6144,ck,2,0,76.3548,a8w8_blockscale_1x128x128_256x64x128x128_16x16_32x32_1x2_8x32x1_8x32x1_1x32x1x8_8_1x1_intrawave_v3,485.16,593.95,0.0
gfx942,304,6016,512,6144,ck,2,0,77.3342,a8w8_blockscale_1x128x128_256x64x128x128_16x16_32x32_1x2_8x32x1_8x32x1_1x32x1x8_8_1x1_intrawave_v3,489.43,598.29,0.0
gfx942,304,6144,512,6144,ck,3,0,75.8132,a8w8_blockscale_1x128x128_256x64x64x128_16x16_32x32_1x1_8x32x1_8x32x1_1x32x1x8_8_1x1_intrawave_v3,509.87,622.4,0.0
gfx942,304,6272,512,6144,ck,2,0,77.1692,a8w8_blockscale_1x128x128_256x64x128x128_16x16_32x32_1x2_8x32x1_8x32x1_1x32x1x8_8_1x1_intrawave_v3,511.34,623.35,0.0
gfx942,304,6400,512,6144,ck,2,0,79.4125,a8w8_blockscale_1x128x128_256x64x128x128_16x16_32x32_1x2_8x32x1_8x32x1_1x32x1x8_8_1x1_intrawave_v3,507.04,617.29,0.0
gfx942,304,6528,512,6144,ck,2,0,78.6634,a8w8_blockscale_1x128x128_256x64x128x128_16x16_32x32_1x2_8x32x1_8x32x1_1x32x1x8_8_1x1_intrawave_v3,522.11,634.84,0.0
gfx942,304,6656,512,6144,ck,2,0,80.2823,a8w8_blockscale_1x128x128_256x64x128x128_16x16_32x32_1x2_8x32x1_8x32x1_1x32x1x8_8_1x1_intrawave_v3,521.61,633.46,0.0
gfx942,304,6784,512,6144,ck,2,0,81.9042,a8w8_blockscale_1x128x128_256x64x128x128_16x16_32x32_1x2_8x32x1_8x32x1_1x32x1x8_8_1x1_intrawave_v3,521.11,632.12,0.0
gfx942,304,6912,512,6144,ck,2,0,80.2779,a8w8_blockscale_1x128x128_256x64x128x128_16x16_32x32_1x2_8x32x1_8x32x1_1x32x1x8_8_1x1_intrawave_v3,541.7,656.36,0.0
gfx942,304,7040,512,6144,ck,2,0,80.0815,a8w8_blockscale_1x128x128_256x64x128x128_16x16_32x32_1x2_8x32x1_8x32x1_1x32x1x8_8_1x1_intrawave_v3,553.08,669.42,0.0
gfx942,304,7168,512,6144,ck,2,0,80.2624,a8w8_blockscale_1x128x128_256x64x128x128_16x16_32x32_1x2_8x32x1_8x32x1_1x32x1x8_8_1x1_intrawave_v3,561.87,679.35,0.0
gfx942,304,7296,512,6144,ck,2,0,81.7539,a8w8_blockscale_1x128x128_256x64x128x128_16x16_32x32_1x2_8x32x1_8x32x1_1x32x1x8_8_1x1_intrawave_v3,561.47,678.18,0.0
gfx942,304,7424,512,6144,ck,2,0,81.2182,a8w8_blockscale_1x128x128_256x64x128x128_16x16_32x32_1x2_8x32x1_8x32x1_1x32x1x8_8_1x1_intrawave_v3,575.09,693.94,0.0
gfx942,304,7552,512,6144,ck,2,0,82.6784,a8w8_blockscale_1x128x128_256x64x128x128_16x16_32x32_1x2_8x32x1_8x32x1_1x32x1x8_8_1x1_intrawave_v3,574.67,692.79,0.0
gfx942,304,7680,512,6144,ck,2,0,82.9325,a8w8_blockscale_1x128x128_256x64x128x128_16x16_32x32_1x2_8x32x1_8x32x1_1x32x1x8_8_1x1_intrawave_v3,582.62,701.73,0.0
gfx942,304,7808,512,6144,ck,2,0,82.9063,a8w8_blockscale_1x128x128_256x64x128x128_16x16_32x32_1x2_8x32x1_8x32x1_1x32x1x8_8_1x1_intrawave_v3,592.52,713.02,0.0
gfx942,304,7936,512,6144,ck,2,0,83.5625,a8w8_blockscale_1x128x128_256x64x128x128_16x16_32x32_1x2_8x32x1_8x32x1_1x32x1x8_8_1x1_intrawave_v3,597.5,718.4,0.0
gfx942,304,8064,512,6144,ck,2,0,85.3229,a8w8_blockscale_1x128x128_256x64x128x128_16x16_32x32_1x2_8x32x1_8x32x1_1x32x1x8_8_1x1_intrawave_v3,594.62,714.33,0.0
gfx942,304,8192,512,6144,ck,2,0,83.5113,a8w8_blockscale_1x128x128_256x64x128x128_16x16_32x32_1x2_8x32x1_8x32x1_1x32x1x8_8_1x1_intrawave_v3,617.16,740.81,0.0
gfx942,304,8320,512,6144,ck,2,0,84.999,a8w8_blockscale_1x128x128_256x64x128x128_16x16_32x32_1x2_8x32x1_8x32x1_1x32x1x8_8_1x1_intrawave_v3,615.83,738.64,0.0
gfx942,304,8448,512,6144,ck,2,0,84.1051,a8w8_blockscale_1x128x128_256x64x128x128_16x16_32x32_1x2_8x32x1_8x32x1_1x32x1x8_8_1x1_intrawave_v3,631.95,757.4,0.0
gfx942,304,8576,512,6144,ck,2,0,86.7599,a8w8_blockscale_1x128x128_256x64x128x128_16x16_32x32_1x2_8x32x1_8x32x1_1x32x1x8_8_1x1_intrawave_v3,621.89,744.8,0.0
gfx942,304,8704,512,6144,ck,2,0,85.1877,a8w8_blockscale_1x128x128_256x64x128x128_16x16_32x32_1x2_8x32x1_8x32x1_1x32x1x8_8_1x1_intrawave_v3,642.83,769.31,0.0
gfx942,304,8832,512,6144,ck,2,0,87.6477,a8w8_blockscale_1x128x128_256x64x128x128_16x16_32x32_1x2_8x32x1_8x32x1_1x32x1x8_8_1x1_intrawave_v3,633.97,758.19,0.0
gfx942,304,8960,512,6144,ck,2,0,87.0296,a8w8_blockscale_1x128x128_256x64x128x128_16x16_32x32_1x2_8x32x1_8x32x1_1x32x1x8_8_1x1_intrawave_v3,647.73,774.12,0.0
gfx942,304,9088,512,6144,ck,2,0,86.8532,a8w8_blockscale_1x128x128_256x64x128x128_16x16_32x32_1x2_8x32x1_8x32x1_1x32x1x8_8_1x1_intrawave_v3,658.31,786.25,0.0
gfx942,304,9216,512,6144,ck,0,0,88.0757,a8w8_blockscale_1x128x128_256x128x128x128_16x16_32x32_2x2_8x32x1_8x32x1_1x32x1x8_8_1x1_intrawave_v3,658.32,785.76,0.0
gfx942,304,9344,512,6144,ck,2,0,88.5148,a8w8_blockscale_1x128x128_256x64x128x128_16x16_32x32_1x2_8x32x1_8x32x1_1x32x1x8_8_1x1_intrawave_v3,664.15,792.22,0.0
gfx942,304,9472,512,6144,ck,0,0,88.5422,a8w8_blockscale_1x128x128_256x128x128x128_16x16_32x32_2x2_8x32x1_8x32x1_1x32x1x8_8_1x1_intrawave_v3,673.04,802.34,0.0
gfx942,304,9600,512,6144,ck,0,0,90.0629,a8w8_blockscale_1x128x128_256x128x128x128_16x16_32x32_2x2_8x32x1_8x32x1_1x32x1x8_8_1x1_intrawave_v3,670.62,798.98,0.0
gfx942,304,9728,512,6144,ck,0,0,90.6888,a8w8_blockscale_1x128x128_256x128x128x128_16x16_32x32_2x2_8x32x1_8x32x1_1x32x1x8_8_1x1_intrawave_v3,674.87,803.58,0.0
gfx942,304,9856,512,6144,ck,0,0,112.1574,a8w8_blockscale_1x128x128_256x128x128x128_16x16_32x32_2x2_8x32x1_8x32x1_1x32x1x8_8_1x1_intrawave_v3,552.87,657.95,0.0
gfx942,304,9984,512,6144,ck,0,0,114.695,a8w8_blockscale_1x128x128_256x128x128x128_16x16_32x32_2x2_8x32x1_8x32x1_1x32x1x8_8_1x1_intrawave_v3,547.66,651.39,0.0
gfx942,304,10112,512,6144,ck,0,0,113.383,a8w8_blockscale_1x128x128_256x128x128x128_16x16_32x32_2x2_8x32x1_8x32x1_1x32x1x8_8_1x1_intrawave_v3,561.1,667.02,0.0
gfx942,304,10240,512,6144,ck,0,0,113.2025,a8w8_blockscale_1x128x128_256x128x128x128_16x16_32x32_2x2_8x32x1_8x32x1_1x32x1x8_8_1x1_intrawave_v3,569.11,676.19,0.0
gfx942,304,10368,512,6144,ck,0,0,114.5152,a8w8_blockscale_1x128x128_256x128x128x128_16x16_32x32_2x2_8x32x1_8x32x1_1x32x1x8_8_1x1_intrawave_v3,569.62,676.45,0.0
gfx942,304,10496,512,6144,ck,0,0,115.6927,a8w8_blockscale_1x128x128_256x128x128x128_16x16_32x32_2x2_8x32x1_8x32x1_1x32x1x8_8_1x1_intrawave_v3,570.78,677.49,0.0
gfx942,304,10624,512,6144,ck,0,0,114.1632,a8w8_blockscale_1x128x128_256x128x128x128_16x16_32x32_2x2_8x32x1_8x32x1_1x32x1x8_8_1x1_intrawave_v3,585.48,694.61,0.0
gfx942,304,10752,512,6144,ck,0,0,115.8854,a8w8_blockscale_1x128x128_256x128x128x128_16x16_32x32_2x2_8x32x1_8x32x1_1x32x1x8_8_1x1_intrawave_v3,583.73,692.2,0.0
gfx942,304,10880,512,6144,ck,0,0,116.4719,a8w8_blockscale_1x128x128_256x128x128x128_16x16_32x32_2x2_8x32x1_8x32x1_1x32x1x8_8_1x1_intrawave_v3,587.7,696.59,0.0
gfx942,304,11008,512,6144,ck,0,0,113.5246,a8w8_blockscale_1x128x128_256x128x128x128_16x16_32x32_2x2_8x32x1_8x32x1_1x32x1x8_8_1x1_intrawave_v3,610.06,722.76,0.0
gfx942,304,11136,512,6144,ck,0,0,114.1797,a8w8_blockscale_1x128x128_256x128x128x128_16x16_32x32_2x2_8x32x1_8x32x1_1x32x1x8_8_1x1_intrawave_v3,613.61,726.65,0.0
gfx942,304,11264,512,6144,ck,0,0,113.4363,a8w8_blockscale_1x128x128_256x128x128x128_16x16_32x32_2x2_8x32x1_8x32x1_1x32x1x8_8_1x1_intrawave_v3,624.73,739.5,0.0
gfx942,304,11392,512,6144,ck,0,0,120.466,a8w8_blockscale_1x128x128_256x128x128x128_16x16_32x32_2x2_8x32x1_8x32x1_1x32x1x8_8_1x1_intrawave_v3,594.96,703.96,0.0
gfx942,304,11520,512,6144,ck,0,0,120.9229,a8w8_blockscale_1x128x128_256x128x128x128_16x16_32x32_2x2_8x32x1_8x32x1_1x32x1x8_8_1x1_intrawave_v3,599.37,708.89,0.0
gfx942,304,11648,512,6144,ck,0,0,123.3852,a8w8_blockscale_1x128x128_256x128x128x128_16x16_32x32_2x2_8x32x1_8x32x1_1x32x1x8_8_1x1_intrawave_v3,593.94,702.18,0.0
gfx942,304,11776,512,6144,ck,0,0,124.6739,a8w8_blockscale_1x128x128_256x128x128x128_16x16_32x32_2x2_8x32x1_8x32x1_1x32x1x8_8_1x1_intrawave_v3,594.26,702.28,0.0
gfx942,304,11904,512,6144,ck,0,0,124.434,a8w8_blockscale_1x128x128_256x128x128x128_16x16_32x32_2x2_8x32x1_8x32x1_1x32x1x8_8_1x1_intrawave_v3,601.87,711.01,0.0
gfx942,304,12032,512,6144,ck,2,0,124.9758,a8w8_blockscale_1x128x128_256x64x128x128_16x16_32x32_1x2_8x32x1_8x32x1_1x32x1x8_8_1x1_intrawave_v3,605.71,715.27,0.0
gfx942,304,12160,512,6144,ck,0,0,113.9636,a8w8_blockscale_1x128x128_256x128x128x128_16x16_32x32_2x2_8x32x1_8x32x1_1x32x1x8_8_1x1_intrawave_v3,671.3,792.43,0.0
gfx942,304,12288,512,6144,ck,0,0,113.9799,a8w8_blockscale_1x128x128_256x128x128x128_16x16_32x32_2x2_8x32x1_8x32x1_1x32x1x8_8_1x1_intrawave_v3,678.27,800.37,0.0
gfx942,304,12416,512,6144,ck,0,0,120.3982,a8w8_blockscale_1x128x128_256x128x128x128_16x16_32x32_2x2_8x32x1_8x32x1_1x32x1x8_8_1x1_intrawave_v3,648.8,765.32,0.0
gfx942,304,12544,512,6144,ck,0,0,125.1084,a8w8_blockscale_1x128x128_256x128x128x128_16x16_32x32_2x2_8x32x1_8x32x1_1x32x1x8_8_1x1_intrawave_v3,630.81,743.84,0.0
gfx942,304,12672,512,6144,ck,0,0,125.4603,a8w8_blockscale_1x128x128_256x128x128x128_16x16_32x32_2x2_8x32x1_8x32x1_1x32x1x8_8_1x1_intrawave_v3,635.46,749.07,0.0
gfx942,304,12800,512,6144,ck,0,0,128.1781,a8w8_blockscale_1x128x128_256x128x128x128_16x16_32x32_2x2_8x32x1_8x32x1_1x32x1x8_8_1x1_intrawave_v3,628.27,740.35,0.0
gfx942,304,12928,512,6144,ck,0,0,127.2578,a8w8_blockscale_1x128x128_256x128x128x128_16x16_32x32_2x2_8x32x1_8x32x1_1x32x1x8_8_1x1_intrawave_v3,639.14,752.91,0.0
gfx942,304,13056,512,6144,ck,2,0,128.0755,a8w8_blockscale_1x128x128_256x64x128x128_16x16_32x32_1x2_8x32x1_8x32x1_1x32x1x8_8_1x1_intrawave_v3,641.35,755.27,0.0
gfx942,304,13184,512,6144,ck,2,0,129.1509,a8w8_blockscale_1x128x128_256x64x128x128_16x16_32x32_1x2_8x32x1_8x32x1_1x32x1x8_8_1x1_intrawave_v3,642.25,756.08,0.0
gfx942,304,13312,512,6144,ck,2,0,130.5397,a8w8_blockscale_1x128x128_256x64x128x128_16x16_32x32_1x2_8x32x1_8x32x1_1x32x1x8_8_1x1_intrawave_v3,641.58,755.07,0.0
gfx942,304,13440,512,6144,ck,0,0,129.9004,a8w8_blockscale_1x128x128_256x128x128x128_16x16_32x32_2x2_8x32x1_8x32x1_1x32x1x8_8_1x1_intrawave_v3,650.94,765.85,0.0
gfx942,304,13568,512,6144,ck,0,0,128.2781,a8w8_blockscale_1x128x128_256x128x128x128_16x16_32x32_2x2_8x32x1_8x32x1_1x32x1x8_8_1x1_intrawave_v3,665.45,782.68,0.0
gfx942,304,13696,512,6144,ck,0,0,131.4656,a8w8_blockscale_1x128x128_256x128x128x128_16x16_32x32_2x2_8x32x1_8x32x1_1x32x1x8_8_1x1_intrawave_v3,655.44,770.69,0.0
gfx942,304,13824,512,6144,ck,0,0,130.5988,a8w8_blockscale_1x128x128_256x128x128x128_16x16_32x32_2x2_8x32x1_8x32x1_1x32x1x8_8_1x1_intrawave_v3,665.96,782.83,0.0
gfx942,304,13952,512,6144,ck,0,0,129.2895,a8w8_blockscale_1x128x128_256x128x128x128_16x16_32x32_2x2_8x32x1_8x32x1_1x32x1x8_8_1x1_intrawave_v3,678.93,797.85,0.0
gfx942,304,14080,512,6144,ck,0,0,131.1621,a8w8_blockscale_1x128x128_256x128x128x128_16x16_32x32_2x2_8x32x1_8x32x1_1x32x1x8_8_1x1_intrawave_v3,675.38,793.45,0.0
gfx942,304,14208,512,6144,ck,0,0,128.9028,a8w8_blockscale_1x128x128_256x128x128x128_16x16_32x32_2x2_8x32x1_8x32x1_1x32x1x8_8_1x1_intrawave_v3,693.46,814.48,0.0
gfx942,304,14336,512,6144,ck,0,0,128.2604,a8w8_blockscale_1x128x128_256x128x128x128_16x16_32x32_2x2_8x32x1_8x32x1_1x32x1x8_8_1x1_intrawave_v3,703.21,825.71,0.0
gfx942,304,14464,512,6144,ck,0,0,129.4974,a8w8_blockscale_1x128x128_256x128x128x128_16x16_32x32_2x2_8x32x1_8x32x1_1x32x1x8_8_1x1_intrawave_v3,702.71,824.91,0.0
gfx942,304,14592,512,6144,ck,0,0,131.1975,a8w8_blockscale_1x128x128_256x128x128x128_16x16_32x32_2x2_8x32x1_8x32x1_1x32x1x8_8_1x1_intrawave_v3,699.75,821.21,0.0
gfx942,304,14720,512,6144,ck,0,0,130.7587,a8w8_blockscale_1x128x128_256x128x128x128_16x16_32x32_2x2_8x32x1_8x32x1_1x32x1x8_8_1x1_intrawave_v3,708.25,830.99,0.0
gfx942,304,14848,512,6144,ck,0,0,131.463,a8w8_blockscale_1x128x128_256x128x128x128_16x16_32x32_2x2_8x32x1_8x32x1_1x32x1x8_8_1x1_intrawave_v3,710.58,833.51,0.0
gfx942,304,14976,512,6144,ck,0,0,131.2449,a8w8_blockscale_1x128x128_256x128x128x128_16x16_32x32_2x2_8x32x1_8x32x1_1x32x1x8_8_1x1_intrawave_v3,717.9,841.89,0.0
gfx942,304,15104,512,6144,ck,0,0,130.2186,a8w8_blockscale_1x128x128_256x128x128x128_16x16_32x32_2x2_8x32x1_8x32x1_1x32x1x8_8_1x1_intrawave_v3,729.74,855.57,0.0
gfx942,304,15232,512,6144,ck,0,0,131.6868,a8w8_blockscale_1x128x128_256x128x128x128_16x16_32x32_2x2_8x32x1_8x32x1_1x32x1x8_8_1x1_intrawave_v3,727.72,853.0,0.0
gfx942,304,15360,512,6144,ck,0,0,132.3948,a8w8_blockscale_1x128x128_256x128x128x128_16x16_32x32_2x2_8x32x1_8x32x1_1x32x1x8_8_1x1_intrawave_v3,729.91,855.37,0.0
gfx942,304,15488,512,6144,ck,0,0,134.0863,a8w8_blockscale_1x128x128_256x128x128x128_16x16_32x32_2x2_8x32x1_8x32x1_1x32x1x8_8_1x1_intrawave_v3,726.71,851.42,0.0
gfx942,304,15616,512,6144,ck,0,0,133.2933,a8w8_blockscale_1x128x128_256x128x128x128_16x16_32x32_2x2_8x32x1_8x32x1_1x32x1x8_8_1x1_intrawave_v3,737.08,863.37,0.0
gfx942,304,15744,512,6144,ck,0,0,134.597,a8w8_blockscale_1x128x128_256x128x128x128_16x16_32x32_2x2_8x32x1_8x32x1_1x32x1x8_8_1x1_intrawave_v3,735.92,861.82,0.0
gfx942,304,15872,512,6144,ck,0,0,133.3137,a8w8_blockscale_1x128x128_256x128x128x128_16x16_32x32_2x2_8x32x1_8x32x1_1x32x1x8_8_1x1_intrawave_v3,749.05,877.0,0.0
gfx942,304,16000,512,6144,ck,0,0,135.3521,a8w8_blockscale_1x128x128_256x128x128x128_16x16_32x32_2x2_8x32x1_8x32x1_1x32x1x8_8_1x1_intrawave_v3,743.71,870.57,0.0
gfx942,304,16128,512,6144,ck,0,0,136.2899,a8w8_blockscale_1x128x128_256x128x128x128_16x16_32x32_2x2_8x32x1_8x32x1_1x32x1x8_8_1x1_intrawave_v3,744.51,871.31,0.0
gfx942,304,16256,512,6144,ck,0,0,134.5086,a8w8_blockscale_1x128x128_256x128x128x128_16x16_32x32_2x2_8x32x1_8x32x1_1x32x1x8_8_1x1_intrawave_v3,760.35,889.67,0.0
gfx942,304,16384,512,6144,ck,0,0,128.6837,a8w8_blockscale_1x128x128_256x128x128x128_16x16_32x32_2x2_8x32x1_8x32x1_1x32x1x8_8_1x1_intrawave_v3,801.03,937.07,0.0
gfx942,304,16512,512,6144,ck,0,0,132.4158,a8w8_blockscale_1x128x128_256x128x128x128_16x16_32x32_2x2_8x32x1_8x32x1_1x32x1x8_8_1x1_intrawave_v3,784.53,917.59,0.0
gfx942,304,1,2048,2048,ck,8,2,5.2213,a8w8_blockscale_1x128x128_256x16x64x256_16x16_16x16_1x1_16x16x1_16x16x1_1x16x1x16_4_1x1_intrawave_v1,1.61,804.48,0.0
gfx942,304,2,2048,2048,ck,8,3,4.2168,a8w8_blockscale_1x128x128_256x16x64x256_16x16_16x16_1x1_16x16x1_16x16x1_1x16x1x16_4_1x1_intrawave_v1,3.98,997.58,0.0
gfx942,304,4,2048,2048,ck,6,3,6.5547,a8w8_blockscale_1x128x128_256x16x64x128_8x16_16x16_1x1_16x16x1_8x32x1_1x16x1x16_4_1x1_intrawave_v1,5.12,643.64,0.0
gfx942,304,8,2048,2048,ck,8,3,6.0754,a8w8_blockscale_1x128x128_256x16x64x256_16x16_16x16_1x1_16x16x1_16x16x1_1x16x1x16_4_1x1_intrawave_v1,11.05,698.47,0.0
gfx942,304,16,2048,2048,ck,6,3,6.7277,a8w8_blockscale_1x128x128_256x16x64x128_8x16_16x16_1x1_16x16x1_8x32x1_1x16x1x16_4_1x1_intrawave_v1,19.95,638.05,0.0
gfx942,304,32,2048,2048,ck,8,2,7.4262,a8w8_blockscale_1x128x128_256x16x64x256_16x16_16x16_1x1_16x16x1_16x16x1_1x16x1x16_4_1x1_intrawave_v1,36.15,591.27,0.0
gfx942,304,48,2048,2048,ck,8,2,7.2953,a8w8_blockscale_1x128x128_256x16x64x256_16x16_16x16_1x1_16x16x1_16x16x1_1x16x1x16_4_1x1_intrawave_v1,55.19,615.36,0.0
gfx942,304,64,2048,2048,ck,8,2,7.7236,a8w8_blockscale_1x128x128_256x16x64x256_16x16_16x16_1x1_16x16x1_16x16x1_1x16x1x16_4_1x1_intrawave_v1,69.51,593.96,0.0
gfx942,304,80,2048,2048,ck,8,0,8.3529,a8w8_blockscale_1x128x128_256x16x64x256_16x16_16x16_1x1_16x16x1_16x16x1_1x16x1x16_4_1x1_intrawave_v1,80.34,560.98,0.0
gfx942,304,96,2048,2048,ck,8,0,8.3788,a8w8_blockscale_1x128x128_256x16x64x256_16x16_16x16_1x1_16x16x1_16x16x1_1x16x1x16_4_1x1_intrawave_v1,96.11,570.98,0.0
gfx942,304,112,2048,2048,ck,8,0,8.3482,a8w8_blockscale_1x128x128_256x16x64x256_16x16_16x16_1x1_16x16x1_16x16x1_1x16x1x16_4_1x1_intrawave_v1,112.54,584.85,0.0
gfx942,304,128,2048,2048,ck,8,0,8.4088,a8w8_blockscale_1x128x128_256x16x64x256_16x16_16x16_1x1_16x16x1_16x16x1_1x16x1x16_4_1x1_intrawave_v1,127.69,592.32,0.0
gfx942,304,144,2048,2048,ck,8,0,8.7269,a8w8_blockscale_1x128x128_256x16x64x256_16x16_16x16_1x1_16x16x1_16x16x1_1x16x1x16_4_1x1_intrawave_v1,138.42,582.0,0.0
gfx942,304,160,2048,2048,ck,13,0,10.8718,a8w8_blockscale_1x128x128_256x32x64x256_16x16_16x16_2x1_16x16x1_16x16x1_1x32x1x8_8_2x1_intrawave_v1,123.45,476.22,0.0
gfx942,304,176,2048,2048,ck,13,0,10.974,a8w8_blockscale_1x128x128_256x32x64x256_16x16_16x16_2x1_16x16x1_16x16x1_1x32x1x8_8_2x1_intrawave_v1,134.54,480.74,0.0
gfx942,304,192,2048,2048,ck,13,0,10.9284,a8w8_blockscale_1x128x128_256x32x64x256_16x16_16x16_2x1_16x16x1_16x16x1_1x32x1x8_8_2x1_intrawave_v1,147.38,491.74,0.0
gfx942,304,208,2048,2048,ck,13,0,10.9881,a8w8_blockscale_1x128x128_256x32x64x256_16x16_16x16_2x1_16x16x1_16x16x1_1x32x1x8_8_2x1_intrawave_v1,158.79,498.02,0.0
gfx942,304,224,2048,2048,ck,13,0,10.7316,a8w8_blockscale_1x128x128_256x32x64x256_16x16_16x16_2x1_16x16x1_16x16x1_1x32x1x8_8_2x1_intrawave_v1,175.09,519.08,0.0
gfx942,304,240,2048,2048,ck,13,0,10.7019,a8w8_blockscale_1x128x128_256x32x64x256_16x16_16x16_2x1_16x16x1_16x16x1_1x32x1x8_8_2x1_intrawave_v1,188.12,529.71,0.0
gfx942,304,256,2048,2048,ck,13,0,10.6421,a8w8_blockscale_1x128x128_256x32x64x256_16x16_16x16_2x1_16x16x1_16x16x1_1x32x1x8_8_2x1_intrawave_v1,201.79,541.92,0.0
gfx942,304,288,2048,2048,ck,13,0,11.0703,a8w8_blockscale_1x128x128_256x32x64x256_16x16_16x16_2x1_16x16x1_16x16x1_1x32x1x8_8_2x1_intrawave_v1,218.23,538.72,0.0
gfx942,304,320,2048,2048,ck,18,0,11.0619,a8w8_blockscale_1x128x128_256x64x64x256_16x16_32x32_1x1_16x16x1_16x16x1_1x32x1x8_8_1x1_intrawave_v1,242.67,556.9,0.0
gfx942,304,352,2048,2048,ck,18,0,11.9698,a8w8_blockscale_1x128x128_256x64x64x256_16x16_32x32_1x1_16x16x1_16x16x1_1x32x1x8_8_1x1_intrawave_v1,246.69,531.09,0.0
gfx942,304,384,2048,2048,ck,18,0,11.1774,a8w8_blockscale_1x128x128_256x64x64x256_16x16_32x32_1x1_16x16x1_16x16x1_1x32x1x8_8_1x1_intrawave_v1,288.19,586.33,0.0
gfx942,304,416,2048,2048,ck,18,0,12.0233,a8w8_blockscale_1x128x128_256x64x64x256_16x16_32x32_1x1_16x16x1_16x16x1_1x32x1x8_8_1x1_intrawave_v1,290.24,561.43,0.0
gfx942,304,448,2048,2048,ck,18,0,11.3023,a8w8_blockscale_1x128x128_256x64x64x256_16x16_32x32_1x1_16x16x1_16x16x1_1x32x1x8_8_1x1_intrawave_v1,332.51,614.64,0.0
gfx942,304,480,2048,2048,ck,18,0,12.2256,a8w8_blockscale_1x128x128_256x64x64x256_16x16_32x32_1x1_16x16x1_16x16x1_1x32x1x8_8_1x1_intrawave_v1,329.35,584.3,0.0
gfx942,304,512,2048,2048,ck,18,0,11.3952,a8w8_blockscale_1x128x128_256x64x64x256_16x16_32x32_1x1_16x16x1_16x16x1_1x32x1x8_8_1x1_intrawave_v1,376.91,644.13,0.0
gfx942,304,544,2048,2048,ck,18,0,12.5661,a8w8_blockscale_1x128x128_256x64x64x256_16x16_32x32_1x1_16x16x1_16x16x1_1x32x1x8_8_1x1_intrawave_v1,363.15,599.76,0.0
gfx942,304,576,2048,2048,ck,18,0,11.9321,a8w8_blockscale_1x128x128_256x64x64x256_16x16_32x32_1x1_16x16x1_16x16x1_1x32x1x8_8_1x1_intrawave_v1,404.94,648.1,0.0
gfx942,304,608,2048,2048,ck,12,0,14.5566,a8w8_blockscale_1x128x128_256x32x128x256_16x16_32x32_1x1_16x16x1_16x16x1_1x32x1x8_8_1x1_intrawave_v1,350.38,544.76,0.0
gfx942,304,640,2048,2048,ck,3,0,17.7006,a8w8_blockscale_1x128x128_256x64x64x128_16x16_32x32_1x1_8x32x1_8x32x1_1x32x1x8_8_1x1_intrawave_v3,303.31,459.11,0.0
gfx942,304,672,2048,2048,ck,3,0,18.0632,a8w8_blockscale_1x128x128_256x64x64x128_16x16_32x32_1x1_8x32x1_8x32x1_1x32x1x8_8_1x1_intrawave_v3,312.08,460.78,0.0
gfx942,304,704,2048,2048,ck,3,0,17.9226,a8w8_blockscale_1x128x128_256x64x64x128_16x16_32x32_1x1_8x32x1_8x32x1_1x32x1x8_8_1x1_intrawave_v3,329.5,475.36,0.0
gfx942,304,736,2048,2048,ck,3,0,17.226,a8w8_blockscale_1x128x128_256x64x64x128_16x16_32x32_1x1_8x32x1_8x32x1_1x32x1x8_8_1x1_intrawave_v3,358.41,506.0,0.0
gfx942,304,768,2048,2048,ck,3,0,17.4101,a8w8_blockscale_1x128x128_256x64x64x128_16x16_32x32_1x1_8x32x1_8x32x1_1x32x1x8_8_1x1_intrawave_v3,370.04,511.94,0.0
gfx942,304,800,2048,2048,ck,3,0,18.7027,a8w8_blockscale_1x128x128_256x64x64x128_16x16_32x32_1x1_8x32x1_8x32x1_1x32x1x8_8_1x1_intrawave_v3,358.82,487.07,0.0
gfx942,304,832,2048,2048,ck,3,0,18.4544,a8w8_blockscale_1x128x128_256x64x64x128_16x16_32x32_1x1_8x32x1_8x32x1_1x32x1x8_8_1x1_intrawave_v3,378.19,504.28,0.0
gfx942,304,864,2048,2048,ck,3,0,18.2412,a8w8_blockscale_1x128x128_256x64x64x128_16x16_32x32_1x1_8x32x1_8x32x1_1x32x1x8_8_1x1_intrawave_v3,397.33,520.95,0.0
gfx942,304,896,2048,2048,ck,3,0,18.9905,a8w8_blockscale_1x128x128_256x64x64x128_16x16_32x32_1x1_8x32x1_8x32x1_1x32x1x8_8_1x1_intrawave_v3,395.79,510.75,0.0
gfx942,304,928,2048,2048,ck,3,0,19.3498,a8w8_blockscale_1x128x128_256x64x64x128_16x16_32x32_1x1_8x32x1_8x32x1_1x32x1x8_8_1x1_intrawave_v3,402.31,511.42,0.0
gfx942,304,960,2048,2048,ck,3,0,19.6618,a8w8_blockscale_1x128x128_256x64x64x128_16x16_32x32_1x1_8x32x1_8x32x1_1x32x1x8_8_1x1_intrawave_v3,409.58,513.31,0.0
gfx942,304,992,2048,2048,ck,3,0,19.7498,a8w8_blockscale_1x128x128_256x64x64x128_16x16_32x32_1x1_8x32x1_8x32x1_1x32x1x8_8_1x1_intrawave_v3,421.35,520.97,0.0
gfx942,304,1024,2048,2048,ck,18,0,19.5379,a8w8_blockscale_1x128x128_256x64x64x256_16x16_32x32_1x1_16x16x1_16x16x1_1x32x1x8_8_1x1_intrawave_v1,439.65,536.69,0.0
gfx942,304,1088,2048,2048,ck,18,0,19.6166,a8w8_blockscale_1x128x128_256x64x64x256_16x16_32x32_1x1_16x16x1_16x16x1_1x32x1x8_8_1x1_intrawave_v1,465.26,554.58,0.0
gfx942,304,1152,2048,2048,ck,18,0,20.1501,a8w8_blockscale_1x128x128_256x64x64x256_16x16_32x32_1x1_16x16x1_16x16x1_1x32x1x8_8_1x1_intrawave_v1,479.58,559.41,0.0
gfx942,304,1216,2048,2048,ck,18,0,20.6321,a8w8_blockscale_1x128x128_256x64x64x256_16x16_32x32_1x1_16x16x1_16x16x1_1x32x1x8_8_1x1_intrawave_v1,494.4,565.4,0.0
gfx942,304,1280,2048,2048,ck,3,0,27.3172,a8w8_blockscale_1x128x128_256x64x64x128_16x16_32x32_1x1_8x32x1_8x32x1_1x32x1x8_8_1x1_intrawave_v3,393.06,441.43,0.0
gfx942,304,1344,2048,2048,ck,3,0,27.719,a8w8_blockscale_1x128x128_256x64x64x128_16x16_32x32_1x1_8x32x1_8x32x1_1x32x1x8_8_1x1_intrawave_v3,406.74,449.22,0.0
gfx942,304,1408,2048,2048,ck,3,0,27.5769,a8w8_blockscale_1x128x128_256x64x64x128_16x16_32x32_1x1_8x32x1_8x32x1_1x32x1x8_8_1x1_intrawave_v3,428.3,465.79,0.0
gfx942,304,1472,2048,2048,ck,3,0,28.42,a8w8_blockscale_1x128x128_256x64x64x128_16x16_32x32_1x1_8x32x1_8x32x1_1x32x1x8_8_1x1_intrawave_v3,434.48,465.81,0.0
gfx942,304,1536,2048,2048,ck,18,0,27.6044,a8w8_blockscale_1x128x128_256x64x64x256_16x16_32x32_1x1_16x16x1_16x16x1_1x32x1x8_8_1x1_intrawave_v1,466.77,493.82,0.0
gfx942,304,1600,2048,2048,ck,18,0,28.9864,a8w8_blockscale_1x128x128_256x64x64x256_16x16_32x32_1x1_16x16x1_16x16x1_1x32x1x8_8_1x1_intrawave_v1,463.04,483.84,0.0
gfx942,304,1664,2048,2048,ck,18,0,28.8656,a8w8_blockscale_1x128x128_256x64x64x256_16x16_32x32_1x1_16x16x1_16x16x1_1x32x1x8_8_1x1_intrawave_v1,483.57,499.48,0.0
gfx942,304,1728,2048,2048,ck,18,0,28.6633,a8w8_blockscale_1x128x128_256x64x64x256_16x16_32x32_1x1_16x16x1_16x16x1_1x32x1x8_8_1x1_intrawave_v1,505.72,516.73,0.0
gfx942,304,1792,2048,2048,ck,18,0,28.8497,a8w8_blockscale_1x128x128_256x64x64x256_16x16_32x32_1x1_16x16x1_16x16x1_1x32x1x8_8_1x1_intrawave_v1,521.06,527.02,0.0
gfx942,304,1856,2048,2048,ck,0,0,29.7619,a8w8_blockscale_1x128x128_256x128x128x128_16x16_32x32_2x2_8x32x1_8x32x1_1x32x1x8_8_1x1_intrawave_v3,523.13,524.08,0.0
gfx942,304,1920,2048,2048,ck,0,0,30.9739,a8w8_blockscale_1x128x128_256x128x128x128_16x16_32x32_2x2_8x32x1_8x32x1_1x32x1x8_8_1x1_intrawave_v3,519.99,516.27,0.0
gfx942,304,1984,2048,2048,ck,0,0,30.4482,a8w8_blockscale_1x128x128_256x128x128x128_16x16_32x32_2x2_8x32x1_8x32x1_1x32x1x8_8_1x1_intrawave_v3,546.6,538.09,0.0
gfx942,304,2048,2048,2048,ck,0,0,31.8266,a8w8_blockscale_1x128x128_256x128x128x128_16x16_32x32_2x2_8x32x1_8x32x1_1x32x1x8_8_1x1_intrawave_v3,539.8,527.14,0.0
gfx942,304,2112,2048,2048,ck,0,0,30.79,a8w8_blockscale_1x128x128_256x128x128x128_16x16_32x32_2x2_8x32x1_8x32x1_1x32x1x8_8_1x1_intrawave_v3,575.41,557.66,0.0
gfx942,304,2176,2048,2048,ck,0,0,31.9047,a8w8_blockscale_1x128x128_256x128x128x128_16x16_32x32_2x2_8x32x1_8x32x1_1x32x1x8_8_1x1_intrawave_v3,572.13,550.5,0.0
gfx942,304,2240,2048,2048,ck,0,0,30.9804,a8w8_blockscale_1x128x128_256x128x128x128_16x16_32x32_2x2_8x32x1_8x32x1_1x32x1x8_8_1x1_intrawave_v3,606.53,579.62,0.0
gfx942,304,2304,2048,2048,ck,2,0,32.4758,a8w8_blockscale_1x128x128_256x64x128x128_16x16_32x32_1x2_8x32x1_8x32x1_1x32x1x8_8_1x1_intrawave_v3,595.13,565.04,0.0
gfx942,304,2368,2048,2048,ck,0,0,31.9897,a8w8_blockscale_1x128x128_256x128x128x128_16x16_32x32_2x2_8x32x1_8x32x1_1x32x1x8_8_1x1_intrawave_v3,620.96,585.92,0.0
gfx942,304,2432,2048,2048,ck,0,0,33.3838,a8w8_blockscale_1x128x128_256x128x128x128_16x16_32x32_2x2_8x32x1_8x32x1_1x32x1x8_8_1x1_intrawave_v3,611.11,573.23,0.0
gfx942,304,2496,2048,2048,ck,0,0,41.3049,a8w8_blockscale_1x128x128_256x128x128x128_16x16_32x32_2x2_8x32x1_8x32x1_1x32x1x8_8_1x1_intrawave_v3,506.91,472.82,0.0
gfx942,304,2560,2048,2048,ck,0,0,43.7947,a8w8_blockscale_1x128x128_256x128x128x128_16x16_32x32_2x2_8x32x1_8x32x1_1x32x1x8_8_1x1_intrawave_v3,490.35,454.92,0.0
gfx942,304,2624,2048,2048,ck,0,0,43.2238,a8w8_blockscale_1x128x128_256x128x128x128_16x16_32x32_2x2_8x32x1_8x32x1_1x32x1x8_8_1x1_intrawave_v3,509.25,470.02,0.0
gfx942,304,2688,2048,2048,ck,0,0,44.8575,a8w8_blockscale_1x128x128_256x128x128x128_16x16_32x32_2x2_8x32x1_8x32x1_1x32x1x8_8_1x1_intrawave_v3,502.67,461.67,0.0
gfx942,304,2752,2048,2048,ck,0,0,42.1687,a8w8_blockscale_1x128x128_256x128x128x128_16x16_32x32_2x2_8x32x1_8x32x1_1x32x1x8_8_1x1_intrawave_v3,547.45,500.43,0.0
gfx942,304,2816,2048,2048,ck,0,0,44.3223,a8w8_blockscale_1x128x128_256x128x128x128_16x16_32x32_2x2_8x32x1_8x32x1_1x32x1x8_8_1x1_intrawave_v3,532.97,484.99,0.0
gfx942,304,2880,2048,2048,ck,0,0,43.5825,a8w8_blockscale_1x128x128_256x128x128x128_16x16_32x32_2x2_8x32x1_8x32x1_1x32x1x8_8_1x1_intrawave_v3,554.33,502.24,0.0
gfx942,304,2944,2048,2048,ck,0,0,45.2506,a8w8_blockscale_1x128x128_256x128x128x128_16x16_32x32_2x2_8x32x1_8x32x1_1x32x1x8_8_1x1_intrawave_v3,545.76,492.42,0.0
gfx942,304,3008,2048,2048,ck,0,0,44.4137,a8w8_blockscale_1x128x128_256x128x128x128_16x16_32x32_2x2_8x32x1_8x32x1_1x32x1x8_8_1x1_intrawave_v3,568.13,510.55,0.0
gfx942,304,3072,2048,2048,ck,0,0,45.5693,a8w8_blockscale_1x128x128_256x128x128x128_16x16_32x32_2x2_8x32x1_8x32x1_1x32x1x8_8_1x1_intrawave_v3,565.51,506.23,0.0
gfx942,304,3136,2048,2048,ck,0,0,45.1376,a8w8_blockscale_1x128x128_256x128x128x128_16x16_32x32_2x2_8x32x1_8x32x1_1x32x1x8_8_1x1_intrawave_v3,582.81,519.79,0.0
gfx942,304,3200,2048,2048,ck,0,0,46.4694,a8w8_blockscale_1x128x128_256x128x128x128_16x16_32x32_2x2_8x32x1_8x32x1_1x32x1x8_8_1x1_intrawave_v3,577.66,513.35,0.0
gfx942,304,3264,2048,2048,ck,0,0,46.415,a8w8_blockscale_1x128x128_256x128x128x128_16x16_32x32_2x2_8x32x1_8x32x1_1x32x1x8_8_1x1_intrawave_v3,589.9,522.42,0.0
gfx942,304,3328,2048,2048,ck,0,0,46.9253,a8w8_blockscale_1x128x128_256x128x128x128_16x16_32x32_2x2_8x32x1_8x32x1_1x32x1x8_8_1x1_intrawave_v3,594.93,525.12,0.0
gfx942,304,3392,2048,2048,ck,0,0,46.2099,a8w8_blockscale_1x128x128_256x128x128x128_16x16_32x32_2x2_8x32x1_8x32x1_1x32x1x8_8_1x1_intrawave_v3,615.76,541.76,0.0
gfx942,304,3456,2048,2048,ck,0,0,47.3652,a8w8_blockscale_1x128x128_256x128x128x128_16x16_32x32_2x2_8x32x1_8x32x1_1x32x1x8_8_1x1_intrawave_v3,612.07,536.85,0.0
gfx942,304,3520,2048,2048,ck,0,0,46.7424,a8w8_blockscale_1x128x128_256x128x128x128_16x16_32x32_2x2_8x32x1_8x32x1_1x32x1x8_8_1x1_intrawave_v3,631.72,552.41,0.0
gfx942,304,3584,2048,2048,ck,0,0,47.2791,a8w8_blockscale_1x128x128_256x128x128x128_16x16_32x32_2x2_8x32x1_8x32x1_1x32x1x8_8_1x1_intrawave_v3,635.9,554.46,0.0
gfx942,304,3648,2048,2048,ck,0,0,47.3593,a8w8_blockscale_1x128x128_256x128x128x128_16x16_32x32_2x2_8x32x1_8x32x1_1x32x1x8_8_1x1_intrawave_v3,646.16,561.82,0.0
gfx942,304,3712,2048,2048,ck,0,0,47.5985,a8w8_blockscale_1x128x128_256x128x128x128_16x16_32x32_2x2_8x32x1_8x32x1_1x32x1x8_8_1x1_intrawave_v3,654.19,567.26,0.0
gfx942,304,3776,2048,2048,ck,0,0,47.5768,a8w8_blockscale_1x128x128_256x128x128x128_16x16_32x32_2x2_8x32x1_8x32x1_1x32x1x8_8_1x1_intrawave_v3,665.77,575.79,0.0
gfx942,304,3840,2048,2048,ck,0,0,49.8031,a8w8_blockscale_1x128x128_256x128x128x128_16x16_32x32_2x2_8x32x1_8x32x1_1x32x1x8_8_1x1_intrawave_v3,646.79,557.94,0.0
gfx942,304,3904,2048,2048,ck,0,0,49.5573,a8w8_blockscale_1x128x128_256x128x128x128_16x16_32x32_2x2_8x32x1_8x32x1_1x32x1x8_8_1x1_intrawave_v3,660.83,568.64,0.0
gfx942,304,3968,2048,2048,ck,0,0,49.7307,a8w8_blockscale_1x128x128_256x128x128x128_16x16_32x32_2x2_8x32x1_8x32x1_1x32x1x8_8_1x1_intrawave_v3,669.32,574.57,0.0
gfx942,304,4032,2048,2048,ck,0,0,48.6695,a8w8_blockscale_1x128x128_256x128x128x128_16x16_32x32_2x2_8x32x1_8x32x1_1x32x1x8_8_1x1_intrawave_v3,694.95,595.18,0.0
gfx942,304,4096,2048,2048,ck,0,0,49.1869,a8w8_blockscale_1x128x128_256x128x128x128_16x16_32x32_2x2_8x32x1_8x32x1_1x32x1x8_8_1x1_intrawave_v3,698.55,596.91,0.0
gfx942,304,4224,2048,2048,ck,0,0,50.7145,a8w8_blockscale_1x128x128_256x128x128x128_16x16_32x32_2x2_8x32x1_8x32x1_1x32x1x8_8_1x1_intrawave_v3,698.69,594.44,0.0
gfx942,304,4352,2048,2048,ck,0,0,51.6016,a8w8_blockscale_1x128x128_256x128x128x128_16x16_32x32_2x2_8x32x1_8x32x1_1x32x1x8_8_1x1_intrawave_v3,707.48,599.46,0.0
gfx942,304,4480,2048,2048,ck,0,0,51.4466,a8w8_blockscale_1x128x128_256x128x128x128_16x16_32x32_2x2_8x32x1_8x32x1_1x32x1x8_8_1x1_intrawave_v3,730.48,616.55,0.0
gfx942,304,4608,2048,2048,ck,0,0,53.5085,a8w8_blockscale_1x128x128_256x128x128x128_16x16_32x32_2x2_8x32x1_8x32x1_1x32x1x8_8_1x1_intrawave_v3,722.4,607.49,0.0
gfx942,304,4736,2048,2048,ck,0,0,54.3708,a8w8_blockscale_1x128x128_256x128x128x128_16x16_32x32_2x2_8x32x1_8x32x1_1x32x1x8_8_1x1_intrawave_v3,730.69,612.32,0.0
gfx942,304,4864,2048,2048,ck,0,0,57.0255,a8w8_blockscale_1x128x128_256x128x128x128_16x16_32x32_2x2_8x32x1_8x32x1_1x32x1x8_8_1x1_intrawave_v3,715.51,597.6,0.0
gfx942,304,4992,2048,2048,ck,0,0,69.8402,a8w8_blockscale_1x128x128_256x128x128x128_16x16_32x32_2x2_8x32x1_8x32x1_1x32x1x8_8_1x1_intrawave_v3,599.6,499.21,0.0
gfx942,304,5120,2048,2048,ck,0,0,68.9805,a8w8_blockscale_1x128x128_256x128x128x128_16x16_32x32_2x2_8x32x1_8x32x1_1x32x1x8_8_1x1_intrawave_v3,622.63,516.84,0.0
gfx942,304,5248,2048,2048,ck,0,0,70.2296,a8w8_blockscale_1x128x128_256x128x128x128_16x16_32x32_2x2_8x32x1_8x32x1_1x32x1x8_8_1x1_intrawave_v3,626.85,518.84,0.0
gfx942,304,5376,2048,2048,ck,0,0,69.3516,a8w8_blockscale_1x128x128_256x128x128x128_16x16_32x32_2x2_8x32x1_8x32x1_1x32x1x8_8_1x1_intrawave_v3,650.27,536.75,0.0
gfx942,304,5504,2048,2048,ck,0,0,70.7098,a8w8_blockscale_1x128x128_256x128x128x128_16x16_32x32_2x2_8x32x1_8x32x1_1x32x1x8_8_1x1_intrawave_v3,652.96,537.56,0.0
gfx942,304,5632,2048,2048,ck,0,0,70.8371,a8w8_blockscale_1x128x128_256x128x128x128_16x16_32x32_2x2_8x32x1_8x32x1_1x32x1x8_8_1x1_intrawave_v3,666.95,547.7,0.0
gfx942,304,5760,2048,2048,ck,0,0,72.5048,a8w8_blockscale_1x128x128_256x128x128x128_16x16_32x32_2x2_8x32x1_8x32x1_1x32x1x8_8_1x1_intrawave_v3,666.42,545.95,0.0
gfx942,304,5888,2048,2048,ck,0,0,72.4528,a8w8_blockscale_1x128x128_256x128x128x128_16x16_32x32_2x2_8x32x1_8x32x1_1x32x1x8_8_1x1_intrawave_v3,681.71,557.19,0.0
gfx942,304,6016,2048,2048,ck,0,0,71.6364,a8w8_blockscale_1x128x128_256x128x128x128_16x16_32x32_2x2_8x32x1_8x32x1_1x32x1x8_8_1x1_intrawave_v3,704.47,574.52,0.0
gfx942,304,6144,2048,2048,ck,0,0,71.8224,a8w8_blockscale_1x128x128_256x128x128x128_16x16_32x32_2x2_8x32x1_8x32x1_1x32x1x8_8_1x1_intrawave_v3,717.6,583.98,0.0
gfx942,304,6272,2048,2048,ck,0,0,74.1718,a8w8_blockscale_1x128x128_256x128x128x128_16x16_32x32_2x2_8x32x1_8x32x1_1x32x1x8_8_1x1_intrawave_v3,709.34,576.09,0.0
gfx942,304,6400,2048,2048,ck,0,0,73.4973,a8w8_blockscale_1x128x128_256x128x128x128_16x16_32x32_2x2_8x32x1_8x32x1_1x32x1x8_8_1x1_intrawave_v3,730.46,592.07,0.0
gfx942,304,6528,2048,2048,ck,0,0,74.3222,a8w8_blockscale_1x128x128_256x128x128x128_16x16_32x32_2x2_8x32x1_8x32x1_1x32x1x8_8_1x1_intrawave_v3,736.8,596.08,0.0
gfx942,304,6656,2048,2048,ck,0,0,73.8022,a8w8_blockscale_1x128x128_256x128x128x128_16x16_32x32_2x2_8x32x1_8x32x1_1x32x1x8_8_1x1_intrawave_v3,756.54,610.94,0.0
gfx942,304,6784,2048,2048,ck,0,0,77.7558,a8w8_blockscale_1x128x128_256x128x128x128_16x16_32x32_2x2_8x32x1_8x32x1_1x32x1x8_8_1x1_intrawave_v3,731.89,589.99,0.0
gfx942,304,6912,2048,2048,ck,0,0,81.6693,a8w8_blockscale_1x128x128_256x128x128x128_16x16_32x32_2x2_8x32x1_8x32x1_1x32x1x8_8_1x1_intrawave_v3,709.96,571.35,0.0
gfx942,304,7040,2048,2048,ck,0,0,76.5275,a8w8_blockscale_1x128x128_256x128x128x128_16x16_32x32_2x2_8x32x1_8x32x1_1x32x1x8_8_1x1_intrawave_v3,771.69,620.01,0.0
gfx942,304,7168,2048,2048,ck,0,0,77.5276,a8w8_blockscale_1x128x128_256x128x128x128_16x16_32x32_2x2_8x32x1_8x32x1_1x32x1x8_8_1x1_intrawave_v3,775.59,622.16,0.0
gfx942,304,7296,2048,2048,ck,0,0,79.2692,a8w8_blockscale_1x128x128_256x128x128x128_16x16_32x32_2x2_8x32x1_8x32x1_1x32x1x8_8_1x1_intrawave_v3,772.09,618.41,0.0
gfx942,304,7424,2048,2048,ck,0,0,91.3364,a8w8_blockscale_1x128x128_256x128x128x128_16x16_32x32_2x2_8x32x1_8x32x1_1x32x1x8_8_1x1_intrawave_v3,681.84,545.32,0.0
gfx942,304,7552,2048,2048,ck,0,0,89.3041,a8w8_blockscale_1x128x128_256x128x128x128_16x16_32x32_2x2_8x32x1_8x32x1_1x32x1x8_8_1x1_intrawave_v3,709.38,566.53,0.0
gfx942,304,7680,2048,2048,ck,0,0,89.7012,a8w8_blockscale_1x128x128_256x128x128x128_16x16_32x32_2x2_8x32x1_8x32x1_1x32x1x8_8_1x1_intrawave_v3,718.21,572.79,0.0
gfx942,304,7808,2048,2048,ck,0,0,92.9136,a8w8_blockscale_1x128x128_256x128x128x128_16x16_32x32_2x2_8x32x1_8x32x1_1x32x1x8_8_1x1_intrawave_v3,704.94,561.45,0.0
gfx942,304,7936,2048,2048,ck,0,0,91.6649,a8w8_blockscale_1x128x128_256x128x128x128_16x16_32x32_2x2_8x32x1_8x32x1_1x32x1x8_8_1x1_intrawave_v3,726.25,577.68,0.0
gfx942,304,8064,2048,2048,ck,0,0,92.4847,a8w8_blockscale_1x128x128_256x128x128x128_16x16_32x32_2x2_8x32x1_8x32x1_1x32x1x8_8_1x1_intrawave_v3,731.43,581.06,0.0
gfx942,304,8192,2048,2048,ck,0,0,93.2993,a8w8_blockscale_1x128x128_256x128x128x128_16x16_32x32_2x2_8x32x1_8x32x1_1x32x1x8_8_1x1_intrawave_v3,736.55,584.42,0.0
gfx942,304,8320,2048,2048,ck,0,0,94.8463,a8w8_blockscale_1x128x128_256x128x128x128_16x16_32x32_2x2_8x32x1_8x32x1_1x32x1x8_8_1x1_intrawave_v3,735.86,583.18,0.0
gfx942,304,8448,2048,2048,ck,0,0,95.2042,a8w8_blockscale_1x128x128_256x128x128x128_16x16_32x32_2x2_8x32x1_8x32x1_1x32x1x8_8_1x1_intrawave_v3,744.37,589.25,0.0
gfx942,304,8576,2048,2048,ck,0,0,94.104,a8w8_blockscale_1x128x128_256x128x128x128_16x16_32x32_2x2_8x32x1_8x32x1_1x32x1x8_8_1x1_intrawave_v3,764.48,604.49,0.0
gfx942,304,8704,2048,2048,ck,0,0,95.3203,a8w8_blockscale_1x128x128_256x128x128x128_16x16_32x32_2x2_8x32x1_8x32x1_1x32x1x8_8_1x1_intrawave_v3,765.99,605.03,0.0
gfx942,304,8832,2048,2048,ck,0,0,98.4033,a8w8_blockscale_1x128x128_256x128x128x128_16x16_32x32_2x2_8x32x1_8x32x1_1x32x1x8_8_1x1_intrawave_v3,752.9,594.07,0.0
gfx942,304,8960,2048,2048,ck,0,0,97.9682,a8w8_blockscale_1x128x128_256x128x128x128_16x16_32x32_2x2_8x32x1_8x32x1_1x32x1x8_8_1x1_intrawave_v3,767.21,604.73,0.0
gfx942,304,9088,2048,2048,ck,0,0,97.7221,a8w8_blockscale_1x128x128_256x128x128x128_16x16_32x32_2x2_8x32x1_8x32x1_1x32x1x8_8_1x1_intrawave_v3,780.13,614.3,0.0
gfx942,304,9216,2048,2048,ck,0,0,98.6998,a8w8_blockscale_1x128x128_256x128x128x128_16x16_32x32_2x2_8x32x1_8x32x1_1x32x1x8_8_1x1_intrawave_v3,783.28,616.19,0.0
gfx942,304,9344,2048,2048,ck,0,0,101.0106,a8w8_blockscale_1x128x128_256x128x128x128_16x16_32x32_2x2_8x32x1_8x32x1_1x32x1x8_8_1x1_intrawave_v3,775.99,609.88,0.0
gfx942,304,9472,2048,2048,ck,0,0,99.1601,a8w8_blockscale_1x128x128_256x128x128x128_16x16_32x32_2x2_8x32x1_8x32x1_1x32x1x8_8_1x1_intrawave_v3,801.3,629.19,0.0
gfx942,304,9600,2048,2048,ck,0,0,100.4214,a8w8_blockscale_1x128x128_256x128x128x128_16x16_32x32_2x2_8x32x1_8x32x1_1x32x1x8_8_1x1_intrawave_v3,801.93,629.12,0.0
gfx942,304,9728,2048,2048,ck,0,0,101.9378,a8w8_blockscale_1x128x128_256x128x128x128_16x16_32x32_2x2_8x32x1_8x32x1_1x32x1x8_8_1x1_intrawave_v3,800.53,627.47,0.0
gfx942,304,9856,2048,2048,ck,0,0,111.6954,a8w8_blockscale_1x128x128_256x128x128x128_16x16_32x32_2x2_8x32x1_8x32x1_1x32x1x8_8_1x1_intrawave_v3,740.21,579.7,0.0
gfx942,304,9984,2048,2048,ck,0,0,111.6934,a8w8_blockscale_1x128x128_256x128x128x128_16x16_32x32_2x2_8x32x1_8x32x1_1x32x1x8_8_1x1_intrawave_v3,749.84,586.75,0.0
gfx942,304,10112,2048,2048,ck,0,0,113.0169,a8w8_blockscale_1x128x128_256x128x128x128_16x16_32x32_2x2_8x32x1_8x32x1_1x32x1x8_8_1x1_intrawave_v3,750.56,586.84,0.0
gfx942,304,10240,2048,2048,ck,0,0,111.8737,a8w8_blockscale_1x128x128_256x128x128x128_16x16_32x32_2x2_8x32x1_8x32x1_1x32x1x8_8_1x1_intrawave_v3,767.82,599.86,0.0
gfx942,304,10368,2048,2048,ck,0,0,116.0893,a8w8_blockscale_1x128x128_256x128x128x128_16x16_32x32_2x2_8x32x1_8x32x1_1x32x1x8_8_1x1_intrawave_v3,749.19,584.85,0.0
gfx942,304,10496,2048,2048,ck,0,0,115.8657,a8w8_blockscale_1x128x128_256x128x128x128_16x16_32x32_2x2_8x32x1_8x32x1_1x32x1x8_8_1x1_intrawave_v3,759.9,592.77,0.0
gfx942,304,10624,2048,2048,ck,0,0,116.4235,a8w8_blockscale_1x128x128_256x128x128x128_16x16_32x32_2x2_8x32x1_8x32x1_1x32x1x8_8_1x1_intrawave_v3,765.49,596.69,0.0
gfx942,304,10752,2048,2048,ck,0,0,115.311,a8w8_blockscale_1x128x128_256x128x128x128_16x16_32x32_2x2_8x32x1_8x32x1_1x32x1x8_8_1x1_intrawave_v3,782.18,609.26,0.0
gfx942,304,10880,2048,2048,ck,0,0,115.1026,a8w8_blockscale_1x128x128_256x128x128x128_16x16_32x32_2x2_8x32x1_8x32x1_1x32x1x8_8_1x1_intrawave_v3,792.93,617.2,0.0
gfx942,304,11008,2048,2048,ck,0,0,116.7691,a8w8_blockscale_1x128x128_256x128x128x128_16x16_32x32_2x2_8x32x1_8x32x1_1x32x1x8_8_1x1_intrawave_v3,790.81,615.12,0.0
gfx942,304,11136,2048,2048,ck,0,0,118.4316,a8w8_blockscale_1x128x128_256x128x128x128_16x16_32x32_2x2_8x32x1_8x32x1_1x32x1x8_8_1x1_intrawave_v3,788.77,613.13,0.0
gfx942,304,11264,2048,2048,ck,0,0,118.1432,a8w8_blockscale_1x128x128_256x128x128x128_16x16_32x32_2x2_8x32x1_8x32x1_1x32x1x8_8_1x1_intrawave_v3,799.79,621.28,0.0
gfx942,304,11392,2048,2048,ck,0,0,119.9721,a8w8_blockscale_1x128x128_256x128x128x128_16x16_32x32_2x2_8x32x1_8x32x1_1x32x1x8_8_1x1_intrawave_v3,796.54,618.37,0.0
gfx942,304,11520,2048,2048,ck,0,0,118.9792,a8w8_blockscale_1x128x128_256x128x128x128_16x16_32x32_2x2_8x32x1_8x32x1_1x32x1x8_8_1x1_intrawave_v3,812.22,630.14,0.0
gfx942,304,11648,2048,2048,ck,0,0,122.6031,a8w8_blockscale_1x128x128_256x128x128x128_16x16_32x32_2x2_8x32x1_8x32x1_1x32x1x8_8_1x1_intrawave_v3,796.97,617.93,0.0
gfx942,304,11776,2048,2048,ck,0,0,120.3011,a8w8_blockscale_1x128x128_256x128x128x128_16x16_32x32_2x2_8x32x1_8x32x1_1x32x1x8_8_1x1_intrawave_v3,821.14,636.29,0.0
gfx942,304,11904,2048,2048,ck,0,0,125.033,a8w8_blockscale_1x128x128_256x128x128x128_16x16_32x32_2x2_8x32x1_8x32x1_1x32x1x8_8_1x1_intrawave_v3,798.65,618.5,0.0
gfx942,304,12032,2048,2048,ck,0,0,121.7998,a8w8_blockscale_1x128x128_256x128x128x128_16x16_32x32_2x2_8x32x1_8x32x1_1x32x1x8_8_1x1_intrawave_v3,828.67,641.37,0.0
gfx942,304,12160,2048,2048,ck,0,0,127.032,a8w8_blockscale_1x128x128_256x128x128x128_16x16_32x32_2x2_8x32x1_8x32x1_1x32x1x8_8_1x1_intrawave_v3,802.99,621.15,0.0
gfx942,304,12288,2048,2048,ck,0,0,130.7824,a8w8_blockscale_1x128x128_256x128x128x128_16x16_32x32_2x2_8x32x1_8x32x1_1x32x1x8_8_1x1_intrawave_v3,788.17,609.35,0.0
gfx942,304,12416,2048,2048,ck,0,0,135.3733,a8w8_blockscale_1x128x128_256x128x128x128_16x16_32x32_2x2_8x32x1_8x32x1_1x32x1x8_8_1x1_intrawave_v3,769.38,594.49,0.0
gfx942,304,12544,2048,2048,ck,0,0,133.6405,a8w8_blockscale_1x128x128_256x128x128x128_16x16_32x32_2x2_8x32x1_8x32x1_1x32x1x8_8_1x1_intrawave_v3,787.39,608.08,0.0
gfx942,304,12672,2048,2048,ck,0,0,135.932,a8w8_blockscale_1x128x128_256x128x128x128_16x16_32x32_2x2_8x32x1_8x32x1_1x32x1x8_8_1x1_intrawave_v3,782.01,603.62,0.0
gfx942,304,12800,2048,2048,ck,0,0,132.8503,a8w8_blockscale_1x128x128_256x128x128x128_16x16_32x32_2x2_8x32x1_8x32x1_1x32x1x8_8_1x1_intrawave_v3,808.23,623.54,0.0
gfx942,304,12928,2048,2048,ck,0,0,135.803,a8w8_blockscale_1x128x128_256x128x128x128_16x16_32x32_2x2_8x32x1_8x32x1_1x32x1x8_8_1x1_intrawave_v3,798.57,615.77,0.0
gfx942,304,13056,2048,2048,ck,0,0,135.3356,a8w8_blockscale_1x128x128_256x128x128x128_16x16_32x32_2x2_8x32x1_8x32x1_1x32x1x8_8_1x1_intrawave_v3,809.26,623.71,0.0
gfx942,304,13184,2048,2048,ck,0,0,138.8741,a8w8_blockscale_1x128x128_256x128x128x128_16x16_32x32_2x2_8x32x1_8x32x1_1x32x1x8_8_1x1_intrawave_v3,796.37,613.48,0.0
gfx942,304,13312,2048,2048,ck,0,0,137.483,a8w8_blockscale_1x128x128_256x128x128x128_16x16_32x32_2x2_8x32x1_8x32x1_1x32x1x8_8_1x1_intrawave_v3,812.24,625.41,0.0
gfx942,304,13440,2048,2048,ck,0,0,139.5917,a8w8_blockscale_1x128x128_256x128x128x128_16x16_32x32_2x2_8x32x1_8x32x1_1x32x1x8_8_1x1_intrawave_v3,807.66,621.6,0.0
gfx942,304,13568,2048,2048,ck,0,0,139.8479,a8w8_blockscale_1x128x128_256x128x128x128_16x16_32x32_2x2_8x32x1_8x32x1_1x32x1x8_8_1x1_intrawave_v3,813.86,626.08,0.0
gfx942,304,13696,2048,2048,ck,0,0,138.7305,a8w8_blockscale_1x128x128_256x128x128x128_16x16_32x32_2x2_8x32x1_8x32x1_1x32x1x8_8_1x1_intrawave_v3,828.16,636.79,0.0
gfx942,304,13824,2048,2048,ck,0,0,141.418,a8w8_blockscale_1x128x128_256x128x128x128_16x16_32x32_2x2_8x32x1_8x32x1_1x32x1x8_8_1x1_intrawave_v3,820.01,630.25,0.0
gfx942,304,13952,2048,2048,ck,0,0,142.7226,a8w8_blockscale_1x128x128_256x128x128x128_16x16_32x32_2x2_8x32x1_8x32x1_1x32x1x8_8_1x1_intrawave_v3,820.04,630.0,0.0
gfx942,304,14080,2048,2048,ck,0,0,144.8448,a8w8_blockscale_1x128x128_256x128x128x128_16x16_32x32_2x2_8x32x1_8x32x1_1x32x1x8_8_1x1_intrawave_v3,815.44,626.2,0.0
gfx942,304,14208,2048,2048,ck,0,0,142.2142,a8w8_blockscale_1x128x128_256x128x128x128_16x16_32x32_2x2_8x32x1_8x32x1_1x32x1x8_8_1x1_intrawave_v3,838.07,643.31,0.0
gfx942,304,14336,2048,2048,ck,0,0,144.0792,a8w8_blockscale_1x128x128_256x128x128x128_16x16_32x32_2x2_8x32x1_8x32x1_1x32x1x8_8_1x1_intrawave_v3,834.67,640.44,0.0
gfx942,304,14464,2048,2048,ck,0,0,147.5935,a8w8_blockscale_1x128x128_256x128x128x128_16x16_32x32_2x2_8x32x1_8x32x1_1x32x1x8_8_1x1_intrawave_v3,822.07,630.52,0.0
gfx942,304,14592,2048,2048,ck,0,0,146.5646,a8w8_blockscale_1x128x128_256x128x128x128_16x16_32x32_2x2_8x32x1_8x32x1_1x32x1x8_8_1x1_intrawave_v3,835.17,640.32,0.0
gfx942,304,14720,2048,2048,ck,0,0,152.5174,a8w8_blockscale_1x128x128_256x128x128x128_16x16_32x32_2x2_8x32x1_8x32x1_1x32x1x8_8_1x1_intrawave_v3,809.61,620.48,0.0
gfx942,304,14848,2048,2048,ck,0,0,155.845,a8w8_blockscale_1x128x128_256x128x128x128_16x16_32x32_2x2_8x32x1_8x32x1_1x32x1x8_8_1x1_intrawave_v3,799.22,612.28,0.0
gfx942,304,14976,2048,2048,ck,0,0,156.2632,a8w8_blockscale_1x128x128_256x128x128x128_16x16_32x32_2x2_8x32x1_8x32x1_1x32x1x8_8_1x1_intrawave_v3,803.95,615.67,0.0
gfx942,304,15104,2048,2048,ck,0,0,155.2062,a8w8_blockscale_1x128x128_256x128x128x128_16x16_32x32_2x2_8x32x1_8x32x1_1x32x1x8_8_1x1_intrawave_v3,816.34,624.93,0.0
gfx942,304,15232,2048,2048,ck,0,0,157.3354,a8w8_blockscale_1x128x128_256x128x128x128_16x16_32x32_2x2_8x32x1_8x32x1_1x32x1x8_8_1x1_intrawave_v3,812.12,621.47,0.0
gfx942,304,15360,2048,2048,ck,0,0,155.2404,a8w8_blockscale_1x128x128_256x128x128x128_16x16_32x32_2x2_8x32x1_8x32x1_1x32x1x8_8_1x1_intrawave_v3,830.0,634.93,0.0
gfx942,304,15488,2048,2048,ck,0,0,159.8736,a8w8_blockscale_1x128x128_256x128x128x128_16x16_32x32_2x2_8x32x1_8x32x1_1x32x1x8_8_1x1_intrawave_v3,812.66,621.44,0.0
gfx942,304,15616,2048,2048,ck,0,0,157.7166,a8w8_blockscale_1x128x128_256x128x128x128_16x16_32x32_2x2_8x32x1_8x32x1_1x32x1x8_8_1x1_intrawave_v3,830.58,634.93,0.0
gfx942,304,15744,2048,2048,ck,0,0,162.0473,a8w8_blockscale_1x128x128_256x128x128x128_16x16_32x32_2x2_8x32x1_8x32x1_1x32x1x8_8_1x1_intrawave_v3,815.01,622.81,0.0
gfx942,304,15872,2048,2048,ck,0,0,159.2481,a8w8_blockscale_1x128x128_256x128x128x128_16x16_32x32_2x2_8x32x1_8x32x1_1x32x1x8_8_1x1_intrawave_v3,836.08,638.7,0.0
gfx942,304,16000,2048,2048,ck,0,0,160.3159,a8w8_blockscale_1x128x128_256x128x128x128_16x16_32x32_2x2_8x32x1_8x32x1_1x32x1x8_8_1x1_intrawave_v3,837.21,639.35,0.0
gfx942,304,16128,2048,2048,ck,0,0,162.546,a8w8_blockscale_1x128x128_256x128x128x128_16x16_32x32_2x2_8x32x1_8x32x1_1x32x1x8_8_1x1_intrawave_v3,832.33,635.42,0.0
gfx942,304,16256,2048,2048,ck,0,0,161.2638,a8w8_blockscale_1x128x128_256x128x128x128_16x16_32x32_2x2_8x32x1_8x32x1_1x32x1x8_8_1x1_intrawave_v3,845.6,645.35,0.0
gfx942,304,16384,2048,2048,ck,0,0,161.5953,a8w8_blockscale_1x128x128_256x128x128x128_16x16_32x32_2x2_8x32x1_8x32x1_1x32x1x8_8_1x1_intrawave_v3,850.51,648.89,0.0
gfx942,304,16512,2048,2048,ck,0,0,167.0629,a8w8_blockscale_1x128x128_256x128x128x128_16x16_32x32_2x2_8x32x1_8x32x1_1x32x1x8_8_1x1_intrawave_v3,829.11,632.36,0.0
gfx942,304,1,2624,6144,ck,8,2,11.8199,a8w8_blockscale_1x128x128_256x16x64x256_16x16_16x16_1x1_16x16x1_16x16x1_1x16x1x16_4_1x1_intrawave_v1,2.73,1364.92,0.0
gfx942,304,2,2624,6144,ck,8,2,11.8206,a8w8_blockscale_1x128x128_256x16x64x256_16x16_16x16_1x1_16x16x1_16x16x1_1x16x1x16_4_1x1_intrawave_v1,5.46,1365.81,0.0
gfx942,304,4,2624,6144,ck,8,2,11.8985,a8w8_blockscale_1x128x128_256x16x64x256_16x16_16x16_1x1_16x16x1_16x16x1_1x16x1x16_4_1x1_intrawave_v1,10.84,1358.78,0.0
gfx942,304,8,2624,6144,ck,8,2,11.8867,a8w8_blockscale_1x128x128_256x16x64x256_16x16_16x16_1x1_16x16x1_16x16x1_1x16x1x16_4_1x1_intrawave_v1,21.7,1363.96,0.0
gfx942,304,16,2624,6144,ck,8,2,11.952,a8w8_blockscale_1x128x128_256x16x64x256_16x16_16x16_1x1_16x16x1_16x16x1_1x16x1x16_4_1x1_intrawave_v1,43.16,1364.13,0.0
gfx942,304,32,2624,6144,ck,8,3,13.255,a8w8_blockscale_1x128x128_256x16x64x256_16x16_16x16_1x1_16x16x1_16x16x1_1x16x1x16_4_1x1_intrawave_v1,77.84,1243.79,0.0001
gfx942,304,48,2624,6144,ck,8,3,14.4974,a8w8_blockscale_1x128x128_256x16x64x256_16x16_16x16_1x1_16x16x1_16x16x1_1x16x1x16_4_1x1_intrawave_v1,106.76,1149.77,0.0002
gfx942,304,64,2624,6144,ck,8,3,16.2843,a8w8_blockscale_1x128x128_256x16x64x256_16x16_16x16_1x1_16x16x1_16x16x1_1x16x1x16_4_1x1_intrawave_v1,126.72,1034.8,0.0002
gfx942,304,80,2624,6144,ck,8,3,18.6607,a8w8_blockscale_1x128x128_256x16x64x256_16x16_16x16_1x1_16x16x1_16x16x1_1x16x1x16_4_1x1_intrawave_v1,138.23,912.79,0.0002
gfx942,304,96,2624,6144,ck,8,3,19.7785,a8w8_blockscale_1x128x128_256x16x64x256_16x16_16x16_1x1_16x16x1_16x16x1_1x16x1x16_4_1x1_intrawave_v1,156.5,870.41,0.0002
gfx942,304,112,2624,6144,ck,8,0,21.158,a8w8_blockscale_1x128x128_256x16x64x256_16x16_16x16_1x1_16x16x1_16x16x1_1x16x1x16_4_1x1_intrawave_v1,170.68,822.28,0.0
gfx942,304,128,2624,6144,ck,18,1,22.8853,a8w8_blockscale_1x128x128_256x64x64x256_16x16_32x32_1x1_16x16x1_16x16x1_1x32x1x8_8_1x1_intrawave_v1,180.34,768.18,0.0
gfx942,304,144,2624,6144,ck,18,1,24.8386,a8w8_blockscale_1x128x128_256x64x64x256_16x16_32x32_1x1_16x16x1_16x16x1_1x32x1x8_8_1x1_intrawave_v1,186.93,715.11,0.0
gfx942,304,160,2624,6144,ck,18,1,24.9709,a8w8_blockscale_1x128x128_256x64x64x256_16x16_32x32_1x1_16x16x1_16x16x1_1x32x1x8_8_1x1_intrawave_v1,206.6,718.62,0.0
gfx942,304,176,2624,6144,ck,18,1,26.056,a8w8_blockscale_1x128x128_256x64x64x256_16x16_32x32_1x1_16x16x1_16x16x1_1x32x1x8_8_1x1_intrawave_v1,217.8,695.69,0.0
gfx942,304,192,2624,6144,ck,18,1,25.107,a8w8_blockscale_1x128x128_256x64x64x256_16x16_32x32_1x1_16x16x1_16x16x1_1x32x1x8_8_1x1_intrawave_v1,246.58,729.24,0.0
gfx942,304,208,2624,6144,ck,18,0,28.4744,a8w8_blockscale_1x128x128_256x64x64x256_16x16_32x32_1x1_16x16x1_16x16x1_1x32x1x8_8_1x1_intrawave_v1,235.53,649.4,0.0
gfx942,304,224,2624,6144,ck,18,0,28.6319,a8w8_blockscale_1x128x128_256x64x64x256_16x16_32x32_1x1_16x16x1_16x16x1_1x32x1x8_8_1x1_intrawave_v1,252.26,652.2,0.0
gfx942,304,240,2624,6144,ck,18,0,29.6245,a8w8_blockscale_1x128x128_256x64x64x256_16x16_32x32_1x1_16x16x1_16x16x1_1x32x1x8_8_1x1_intrawave_v1,261.22,636.5,0.0
gfx942,304,256,2624,6144,ck,18,0,26.9639,a8w8_blockscale_1x128x128_256x64x64x256_16x16_32x32_1x1_16x16x1_16x16x1_1x32x1x8_8_1x1_intrawave_v1,306.13,706.06,0.0
gfx942,304,288,2624,6144,ck,18,0,29.4503,a8w8_blockscale_1x128x128_256x64x64x256_16x16_32x32_1x1_16x16x1_16x16x1_1x32x1x8_8_1x1_intrawave_v1,315.32,658.83,0.0
gfx942,304,320,2624,6144,ck,18,0,27.7782,a8w8_blockscale_1x128x128_256x64x64x256_16x16_32x32_1x1_16x16x1_16x16x1_1x32x1x8_8_1x1_intrawave_v1,371.44,711.61,0.0
gfx942,304,352,2624,6144,ck,18,0,30.2849,a8w8_blockscale_1x128x128_256x64x64x256_16x16_32x32_1x1_16x16x1_16x16x1_1x32x1x8_8_1x1_intrawave_v1,374.77,664.75,0.0
gfx942,304,384,2624,6144,ck,18,0,28.6325,a8w8_blockscale_1x128x128_256x64x64x256_16x16_32x32_1x1_16x16x1_16x16x1_1x32x1x8_8_1x1_intrawave_v1,432.43,715.84,0.0
gfx942,304,416,2624,6144,ck,18,0,31.439,a8w8_blockscale_1x128x128_256x64x64x256_16x16_32x32_1x1_16x16x1_16x16x1_1x32x1x8_8_1x1_intrawave_v1,426.65,663.54,0.0
gfx942,304,448,2624,6144,ck,18,0,28.0697,a8w8_blockscale_1x128x128_256x64x64x256_16x16_32x32_1x1_16x16x1_16x16x1_1x32x1x8_8_1x1_intrawave_v1,514.62,756.17,0.0
gfx942,304,480,2624,6144,ck,3,0,49.0241,a8w8_blockscale_1x128x128_256x64x64x128_16x16_32x32_1x1_8x32x1_8x32x1_1x32x1x8_8_1x1_intrawave_v3,315.7,440.4,0.0
gfx942,304,512,2624,6144,ck,18,0,48.9594,a8w8_blockscale_1x128x128_256x64x64x256_16x16_32x32_1x1_16x16x1_16x16x1_1x32x1x8_8_1x1_intrawave_v1,337.19,448.42,0.0
gfx942,304,544,2624,6144,ck,3,0,48.4888,a8w8_blockscale_1x128x128_256x64x64x128_16x16_32x32_1x1_8x32x1_8x32x1_1x32x1x8_8_1x1_intrawave_v3,361.74,460.29,0.0
gfx942,304,576,2624,6144,ck,18,0,51.5078,a8w8_blockscale_1x128x128_256x64x64x256_16x16_32x32_1x1_16x16x1_16x16x1_1x32x1x8_8_1x1_intrawave_v1,360.57,440.39,0.0
gfx942,304,608,2624,6144,ck,2,0,51.0797,a8w8_blockscale_1x128x128_256x64x128x128_16x16_32x32_1x2_8x32x1_8x32x1_1x32x1x8_8_1x1_intrawave_v3,383.8,451.22,0.0
gfx942,304,640,2624,6144,ck,3,0,52.1084,a8w8_blockscale_1x128x128_256x64x64x128_16x16_32x32_1x1_8x32x1_8x32x1_1x32x1x8_8_1x1_intrawave_v3,396.02,449.31,0.0
gfx942,304,672,2624,6144,ck,3,0,51.9155,a8w8_blockscale_1x128x128_256x64x64x128_16x16_32x32_1x1_8x32x1_8x32x1_1x32x1x8_8_1x1_intrawave_v3,417.37,458.0,0.0
gfx942,304,704,2624,6144,ck,3,0,53.0887,a8w8_blockscale_1x128x128_256x64x64x128_16x16_32x32_1x1_8x32x1_8x32x1_1x32x1x8_8_1x1_intrawave_v3,427.58,454.75,0.0
gfx942,304,736,2624,6144,ck,3,0,51.5788,a8w8_blockscale_1x128x128_256x64x64x128_16x16_32x32_1x1_8x32x1_8x32x1_1x32x1x8_8_1x1_intrawave_v3,460.1,475.12,0.0
gfx942,304,768,2624,6144,ck,3,0,52.6897,a8w8_blockscale_1x128x128_256x64x64x128_16x16_32x32_1x1_8x32x1_8x32x1_1x32x1x8_8_1x1_intrawave_v3,469.98,472.03,0.0
gfx942,304,800,2624,6144,ck,2,0,53.3503,a8w8_blockscale_1x128x128_256x64x128x128_16x16_32x32_1x2_8x32x1_8x32x1_1x32x1x8_8_1x1_intrawave_v3,483.5,473.01,0.0
gfx942,304,832,2624,6144,ck,2,0,54.7653,a8w8_blockscale_1x128x128_256x64x128x128_16x16_32x32_1x2_8x32x1_8x32x1_1x32x1x8_8_1x1_intrawave_v3,489.85,467.45,0.0
gfx942,304,864,2624,6144,ck,2,0,54.1227,a8w8_blockscale_1x128x128_256x64x128x128_16x16_32x32_1x2_8x32x1_8x32x1_1x32x1x8_8_1x1_intrawave_v3,514.73,479.73,0.0
gfx942,304,896,2624,6144,ck,2,0,55.2218,a8w8_blockscale_1x128x128_256x64x128x128_16x16_32x32_1x2_8x32x1_8x32x1_1x32x1x8_8_1x1_intrawave_v3,523.17,476.79,0.0
gfx942,304,928,2624,6144,ck,0,0,67.0022,a8w8_blockscale_1x128x128_256x128x128x128_16x16_32x32_2x2_8x32x1_8x32x1_1x32x1x8_8_1x1_intrawave_v3,446.58,398.4,0.0
gfx942,304,960,2624,6144,ck,0,0,68.1496,a8w8_blockscale_1x128x128_256x128x128x128_16x16_32x32_2x2_8x32x1_8x32x1_1x32x1x8_8_1x1_intrawave_v3,454.21,397.04,0.0
gfx942,304,992,2624,6144,ck,0,0,68.6092,a8w8_blockscale_1x128x128_256x128x128x128_16x16_32x32_2x2_8x32x1_8x32x1_1x32x1x8_8_1x1_intrawave_v3,466.2,399.69,0.0
gfx942,304,1024,2624,6144,ck,0,0,73.5759,a8w8_blockscale_1x128x128_256x128x128x128_16x16_32x32_2x2_8x32x1_8x32x1_1x32x1x8_8_1x1_intrawave_v3,448.76,377.67,0.0
gfx942,304,1088,2624,6144,ck,0,0,68.4377,a8w8_blockscale_1x128x128_256x128x128x128_16x16_32x32_2x2_8x32x1_8x32x1_1x32x1x8_8_1x1_intrawave_v3,512.6,416.68,0.0
gfx942,304,1152,2624,6144,ck,0,0,73.7898,a8w8_blockscale_1x128x128_256x128x128x128_16x16_32x32_2x2_8x32x1_8x32x1_1x32x1x8_8_1x1_intrawave_v3,503.39,396.33,0.0
gfx942,304,1216,2624,6144,ck,0,0,70.2808,a8w8_blockscale_1x128x128_256x128x128x128_16x16_32x32_2x2_8x32x1_8x32x1_1x32x1x8_8_1x1_intrawave_v3,557.88,426.5,0.0
gfx942,304,1280,2624,6144,ck,0,0,73.987,a8w8_blockscale_1x128x128_256x128x128x128_16x16_32x32_2x2_8x32x1_8x32x1_1x32x1x8_8_1x1_intrawave_v3,557.83,414.99,0.0
gfx942,304,1344,2624,6144,ck,0,0,70.4504,a8w8_blockscale_1x128x128_256x128x128x128_16x16_32x32_2x2_8x32x1_8x32x1_1x32x1x8_8_1x1_intrawave_v3,615.12,446.17,0.0
gfx942,304,1408,2624,6144,ck,0,0,74.418,a8w8_blockscale_1x128x128_256x128x128x128_16x16_32x32_2x2_8x32x1_8x32x1_1x32x1x8_8_1x1_intrawave_v3,610.06,432.18,0.0
gfx942,304,1472,2624,6144,ck,0,0,72.2665,a8w8_blockscale_1x128x128_256x128x128x128_16x16_32x32_2x2_8x32x1_8x32x1_1x32x1x8_8_1x1_intrawave_v3,656.77,455.13,0.0
gfx942,304,1536,2624,6144,ck,0,0,74.8913,a8w8_blockscale_1x128x128_256x128x128x128_16x16_32x32_2x2_8x32x1_8x32x1_1x32x1x8_8_1x1_intrawave_v3,661.31,448.92,0.0
gfx942,304,1600,2624,6144,ck,0,0,73.358,a8w8_blockscale_1x128x128_256x128x128x128_16x16_32x32_2x2_8x32x1_8x32x1_1x32x1x8_8_1x1_intrawave_v3,703.26,468.24,0.0
gfx942,304,1664,2624,6144,ck,0,0,79.5274,a8w8_blockscale_1x128x128_256x128x128x128_16x16_32x32_2x2_8x32x1_8x32x1_1x32x1x8_8_1x1_intrawave_v3,674.65,441.08,0.0
gfx942,304,1728,2624,6144,ck,0,0,75.3071,a8w8_blockscale_1x128x128_256x128x128x128_16x16_32x32_2x2_8x32x1_8x32x1_1x32x1x8_8_1x1_intrawave_v3,739.87,475.48,0.0
gfx942,304,1792,2624,6144,ck,0,0,78.7028,a8w8_blockscale_1x128x128_256x128x128x128_16x16_32x32_2x2_8x32x1_8x32x1_1x32x1x8_8_1x1_intrawave_v3,734.16,464.23,0.0
gfx942,304,1856,2624,6144,ck,3,0,112.1911,a8w8_blockscale_1x128x128_256x64x64x128_16x16_32x32_1x1_8x32x1_8x32x1_1x32x1x8_8_1x1_intrawave_v3,533.41,332.16,0.0
gfx942,304,1920,2624,6144,ck,0,0,113.1564,a8w8_blockscale_1x128x128_256x128x128x128_16x16_32x32_2x2_8x32x1_8x32x1_1x32x1x8_8_1x1_intrawave_v3,547.1,335.77,0.0
gfx942,304,1984,2624,6144,ck,0,0,108.3358,a8w8_blockscale_1x128x128_256x128x128x128_16x16_32x32_2x2_8x32x1_8x32x1_1x32x1x8_8_1x1_intrawave_v3,590.49,357.44,0.0
gfx942,304,2048,2624,6144,ck,0,0,111.778,a8w8_blockscale_1x128x128_256x128x128x128_16x16_32x32_2x2_8x32x1_8x32x1_1x32x1x8_8_1x1_intrawave_v3,590.77,352.96,0.0
gfx942,304,2112,2624,6144,ck,0,0,109.0513,a8w8_blockscale_1x128x128_256x128x128x128_16x16_32x32_2x2_8x32x1_8x32x1_1x32x1x8_8_1x1_intrawave_v3,624.46,368.47,0.0
gfx942,304,2176,2624,6144,ck,0,0,112.3357,a8w8_blockscale_1x128x128_256x128x128x128_16x16_32x32_2x2_8x32x1_8x32x1_1x32x1x8_8_1x1_intrawave_v3,624.58,364.18,0.0
gfx942,304,2240,2624,6144,ck,0,0,111.5873,a8w8_blockscale_1x128x128_256x128x128x128_16x16_32x32_2x2_8x32x1_8x32x1_1x32x1x8_8_1x1_intrawave_v3,647.26,373.16,0.0
gfx942,304,2304,2624,6144,ck,0,0,113.1729,a8w8_blockscale_1x128x128_256x128x128x128_16x16_32x32_2x2_8x32x1_8x32x1_1x32x1x8_8_1x1_intrawave_v3,656.42,374.37,0.0
gfx942,304,2368,2624,6144,ck,0,0,112.3188,a8w8_blockscale_1x128x128_256x128x128x128_16x16_32x32_2x2_8x32x1_8x32x1_1x32x1x8_8_1x1_intrawave_v3,679.79,383.71,0.0
gfx942,304,2432,2624,6144,ck,0,0,114.7127,a8w8_blockscale_1x128x128_256x128x128x128_16x16_32x32_2x2_8x32x1_8x32x1_1x32x1x8_8_1x1_intrawave_v3,683.59,382.06,0.0
gfx942,304,2496,2624,6144,ck,0,0,111.796,a8w8_blockscale_1x128x128_256x128x128x128_16x16_32x32_2x2_8x32x1_8x32x1_1x32x1x8_8_1x1_intrawave_v3,719.89,398.55,0.0
gfx942,304,2560,2624,6144,ck,0,0,118.9273,a8w8_blockscale_1x128x128_256x128x128x128_16x16_32x32_2x2_8x32x1_8x32x1_1x32x1x8_8_1x1_intrawave_v3,694.07,380.78,0.0
gfx942,304,2624,2624,6144,ck,0,0,119.0862,a8w8_blockscale_1x128x128_256x128x128x128_16x16_32x32_2x2_8x32x1_8x32x1_1x32x1x8_8_1x1_intrawave_v3,710.47,386.4,0.0
gfx942,304,2688,2624,6144,ck,0,0,120.259,a8w8_blockscale_1x128x128_256x128x128x128_16x16_32x32_2x2_8x32x1_8x32x1_1x32x1x8_8_1x1_intrawave_v3,720.7,388.69,0.0
gfx942,304,2752,2624,6144,ck,0,0,119.1024,a8w8_blockscale_1x128x128_256x128x128x128_16x16_32x32_2x2_8x32x1_8x32x1_1x32x1x8_8_1x1_intrawave_v3,745.03,398.59,0.0
gfx942,304,2816,2624,6144,ck,0,0,118.9704,a8w8_blockscale_1x128x128_256x128x128x128_16x16_32x32_2x2_8x32x1_8x32x1_1x32x1x8_8_1x1_intrawave_v3,763.2,405.16,0.0
gfx942,304,2880,2624,6144,ck,0,0,120.5075,a8w8_blockscale_1x128x128_256x128x128x128_16x16_32x32_2x2_8x32x1_8x32x1_1x32x1x8_8_1x1_intrawave_v3,770.59,406.04,0.0
gfx942,304,2944,2624,6144,ck,0,0,122.6916,a8w8_blockscale_1x128x128_256x128x128x128_16x16_32x32_2x2_8x32x1_8x32x1_1x32x1x8_8_1x1_intrawave_v3,773.69,404.75,0.0
gfx942,304,3008,2624,6144,ck,0,0,123.592,a8w8_blockscale_1x128x128_256x128x128x128_16x16_32x32_2x2_8x32x1_8x32x1_1x32x1x8_8_1x1_intrawave_v3,784.75,407.7,0.0
gfx942,304,3072,2624,6144,ck,0,0,127.6259,a8w8_blockscale_1x128x128_256x128x128x128_16x16_32x32_2x2_8x32x1_8x32x1_1x32x1x8_8_1x1_intrawave_v3,776.12,400.53,0.0
gfx942,304,3136,2624,6144,ck,0,0,123.2975,a8w8_blockscale_1x128x128_256x128x128x128_16x16_32x32_2x2_8x32x1_8x32x1_1x32x1x8_8_1x1_intrawave_v3,820.1,420.5,0.0
gfx942,304,3200,2624,6144,ck,0,0,128.1358,a8w8_blockscale_1x128x128_256x128x128x128_16x16_32x32_2x2_8x32x1_8x32x1_1x32x1x8_8_1x1_intrawave_v3,805.24,410.32,0.0
gfx942,304,3264,2624,6144,ck,0,0,130.2543,a8w8_blockscale_1x128x128_256x128x128x128_16x16_32x32_2x2_8x32x1_8x32x1_1x32x1x8_8_1x1_intrawave_v3,807.98,409.24,0.0
gfx942,304,3328,2624,6144,ck,0,0,130.1081,a8w8_blockscale_1x128x128_256x128x128x128_16x16_32x32_2x2_8x32x1_8x32x1_1x32x1x8_8_1x1_intrawave_v3,824.75,415.3,0.0
gfx942,304,3392,2624,6144,ck,0,0,130.2315,a8w8_blockscale_1x128x128_256x128x128x128_16x16_32x32_2x2_8x32x1_8x32x1_1x32x1x8_8_1x1_intrawave_v3,839.82,420.51,0.0
gfx942,304,3456,2624,6144,ck,0,0,130.2469,a8w8_blockscale_1x128x128_256x128x128x128_16x16_32x32_2x2_8x32x1_8x32x1_1x32x1x8_8_1x1_intrawave_v3,855.56,426.06,0.0
gfx942,304,3520,2624,6144,ck,0,0,135.8045,a8w8_blockscale_1x128x128_256x128x128x128_16x16_32x32_2x2_8x32x1_8x32x1_1x32x1x8_8_1x1_intrawave_v3,835.74,413.99,0.0
gfx942,304,3584,2624,6144,ck,0,0,134.6016,a8w8_blockscale_1x128x128_256x128x128x128_16x16_32x32_2x2_8x32x1_8x32x1_1x32x1x8_8_1x1_intrawave_v3,858.54,423.11,0.0
gfx942,304,3648,2624,6144,ck,2,0,169.6795,a8w8_blockscale_1x128x128_256x64x128x128_16x16_32x32_1x2_8x32x1_8x32x1_1x32x1x8_8_1x1_intrawave_v3,693.22,339.93,0.0
gfx942,304,3712,2624,6144,ck,0,0,178.0245,a8w8_blockscale_1x128x128_256x128x128x128_16x16_32x32_2x2_8x32x1_8x32x1_1x32x1x8_8_1x1_intrawave_v3,672.32,328.1,0.0
gfx942,304,3776,2624,6144,ck,0,0,182.3288,a8w8_blockscale_1x128x128_256x128x128x128_16x16_32x32_2x2_8x32x1_8x32x1_1x32x1x8_8_1x1_intrawave_v3,667.76,324.35,0.0
gfx942,304,3840,2624,6144,ck,0,0,186.9925,a8w8_blockscale_1x128x128_256x128x128x128_16x16_32x32_2x2_8x32x1_8x32x1_1x32x1x8_8_1x1_intrawave_v3,662.14,320.16,0.0
gfx942,304,3904,2624,6144,ck,0,0,174.6057,a8w8_blockscale_1x128x128_256x128x128x128_16x16_32x32_2x2_8x32x1_8x32x1_1x32x1x8_8_1x1_intrawave_v3,720.94,347.05,0.0
gfx942,304,3968,2624,6144,ck,0,0,182.9351,a8w8_blockscale_1x128x128_256x128x128x128_16x16_32x32_2x2_8x32x1_8x32x1_1x32x1x8_8_1x1_intrawave_v3,699.39,335.23,0.0
gfx942,304,4032,2624,6144,ck,0,0,181.0025,a8w8_blockscale_1x128x128_256x128x128x128_16x16_32x32_2x2_8x32x1_8x32x1_1x32x1x8_8_1x1_intrawave_v3,718.26,342.84,0.0
gfx942,304,4096,2624,6144,ck,0,0,181.032,a8w8_blockscale_1x128x128_256x128x128x128_16x16_32x32_2x2_8x32x1_8x32x1_1x32x1x8_8_1x1_intrawave_v3,729.54,346.81,0.0
gfx942,304,4224,2624,6144,ck,0,0,184.801,a8w8_blockscale_1x128x128_256x128x128x128_16x16_32x32_2x2_8x32x1_8x32x1_1x32x1x8_8_1x1_intrawave_v3,737.0,347.63,0.0
gfx942,304,4352,2624,6144,ck,0,0,190.8708,a8w8_blockscale_1x128x128_256x128x128x128_16x16_32x32_2x2_8x32x1_8x32x1_1x32x1x8_8_1x1_intrawave_v3,735.18,344.21,0.0
gfx942,304,4480,2624,6144,ck,0,0,184.1807,a8w8_blockscale_1x128x128_256x128x128x128_16x16_32x32_2x2_8x32x1_8x32x1_1x32x1x8_8_1x1_intrawave_v3,784.29,364.63,0.0
gfx942,304,4608,2624,6144,ck,0,0,191.5994,a8w8_blockscale_1x128x128_256x128x128x128_16x16_32x32_2x2_8x32x1_8x32x1_1x32x1x8_8_1x1_intrawave_v3,775.47,358.12,0.0
gfx942,304,4736,2624,6144,ck,0,0,192.8626,a8w8_blockscale_1x128x128_256x128x128x128_16x16_32x32_2x2_8x32x1_8x32x1_1x32x1x8_8_1x1_intrawave_v3,791.79,363.34,0.0
gfx942,304,4864,2624,6144,ck,0,0,194.1251,a8w8_blockscale_1x128x128_256x128x128x128_16x16_32x32_2x2_8x32x1_8x32x1_1x32x1x8_8_1x1_intrawave_v3,807.9,368.49,0.0
gfx942,304,4992,2624,6144,ck,0,0,195.997,a8w8_blockscale_1x128x128_256x128x128x128_16x16_32x32_2x2_8x32x1_8x32x1_1x32x1x8_8_1x1_intrawave_v3,821.24,372.41,0.0
gfx942,304,5120,2624,6144,ck,0,0,202.0139,a8w8_blockscale_1x128x128_256x128x128x128_16x16_32x32_2x2_8x32x1_8x32x1_1x32x1x8_8_1x1_intrawave_v3,817.21,368.53,0.0
gfx942,304,5248,2624,6144,ck,0,0,206.5297,a8w8_blockscale_1x128x128_256x128x128x128_16x16_32x32_2x2_8x32x1_8x32x1_1x32x1x8_8_1x1_intrawave_v3,819.33,367.54,0.0
gfx942,304,5376,2624,6144,ck,0,0,221.4349,a8w8_blockscale_1x128x128_256x128x128x128_16x16_32x32_2x2_8x32x1_8x32x1_1x32x1x8_8_1x1_intrawave_v3,782.81,349.38,0.0
gfx942,304,5504,2624,6144,ck,0,0,229.4274,a8w8_blockscale_1x128x128_256x128x128x128_16x16_32x32_2x2_8x32x1_8x32x1_1x32x1x8_8_1x1_intrawave_v3,773.53,343.57,0.0
gfx942,304,5632,2624,6144,ck,0,0,240.8513,a8w8_blockscale_1x128x128_256x128x128x128_16x16_32x32_2x2_8x32x1_8x32x1_1x32x1x8_8_1x1_intrawave_v3,753.98,333.32,0.0
gfx942,304,5760,2624,6144,ck,0,0,242.1612,a8w8_blockscale_1x128x128_256x128x128x128_16x16_32x32_2x2_8x32x1_8x32x1_1x32x1x8_8_1x1_intrawave_v3,766.94,337.54,0.0
gfx942,304,5888,2624,6144,ck,0,0,239.3171,a8w8_blockscale_1x128x128_256x128x128x128_16x16_32x32_2x2_8x32x1_8x32x1_1x32x1x8_8_1x1_intrawave_v3,793.3,347.65,0.0
gfx942,304,6016,2624,6144,ck,0,0,245.1366,a8w8_blockscale_1x128x128_256x128x128x128_16x16_32x32_2x2_8x32x1_8x32x1_1x32x1x8_8_1x1_intrawave_v3,791.31,345.34,0.0
gfx942,304,6144,2624,6144,ck,0,0,246.8329,a8w8_blockscale_1x128x128_256x128x128x128_16x16_32x32_2x2_8x32x1_8x32x1_1x32x1x8_8_1x1_intrawave_v3,802.59,348.88,0.0
gfx942,304,6272,2624,6144,ck,0,0,250.3388,a8w8_blockscale_1x128x128_256x128x128x128_16x16_32x32_2x2_8x32x1_8x32x1_1x32x1x8_8_1x1_intrawave_v3,807.84,349.82,0.0
gfx942,304,6400,2624,6144,ck,0,0,245.8891,a8w8_blockscale_1x128x128_256x128x128x128_16x16_32x32_2x2_8x32x1_8x32x1_1x32x1x8_8_1x1_intrawave_v3,839.24,362.08,0.0
gfx942,304,6528,2624,6144,ck,0,0,250.558,a8w8_blockscale_1x128x128_256x128x128x128_16x16_32x32_2x2_8x32x1_8x32x1_1x32x1x8_8_1x1_intrawave_v3,840.07,361.15,0.0
gfx942,304,6656,2624,6144,ck,0,0,252.5943,a8w8_blockscale_1x128x128_256x128x128x128_16x16_32x32_2x2_8x32x1_8x32x1_1x32x1x8_8_1x1_intrawave_v3,849.64,364.01,0.0
gfx942,304,6784,2624,6144,ck,0,0,252.8563,a8w8_blockscale_1x128x128_256x128x128x128_16x16_32x32_2x2_8x32x1_8x32x1_1x32x1x8_8_1x1_intrawave_v3,865.08,369.4,0.0
gfx942,304,6912,2624,6144,ck,0,0,253.5402,a8w8_blockscale_1x128x128_256x128x128x128_16x16_32x32_2x2_8x32x1_8x32x1_1x32x1x8_8_1x1_intrawave_v3,879.03,374.16,0.0
gfx942,304,7040,2624,6144,ck,0,0,257.1717,a8w8_blockscale_1x128x128_256x128x128x128_16x16_32x32_2x2_8x32x1_8x32x1_1x32x1x8_8_1x1_intrawave_v3,882.66,374.54,0.0
gfx942,304,7168,2624,6144,ck,0,0,259.9662,a8w8_blockscale_1x128x128_256x128x128x128_16x16_32x32_2x2_8x32x1_8x32x1_1x32x1x8_8_1x1_intrawave_v3,889.05,376.12,0.0
gfx942,304,7296,2624,6144,ck,0,0,263.2927,a8w8_blockscale_1x128x128_256x128x128x128_16x16_32x32_2x2_8x32x1_8x32x1_1x32x1x8_8_1x1_intrawave_v3,893.49,376.91,0.0
gfx942,304,7424,2624,6144,ck,0,0,289.8903,a8w8_blockscale_1x128x128_256x128x128x128_16x16_32x32_2x2_8x32x1_8x32x1_1x32x1x8_8_1x1_intrawave_v3,825.75,347.36,0.0
gfx942,304,7552,2624,6144,ck,0,0,297.397,a8w8_blockscale_1x128x128_256x128x128x128_16x16_32x32_2x2_8x32x1_8x32x1_1x32x1x8_8_1x1_intrawave_v3,818.79,343.49,0.0
gfx942,304,7680,2624,6144,ck,0,0,303.1133,a8w8_blockscale_1x128x128_256x128x128x128_16x16_32x32_2x2_8x32x1_8x32x1_1x32x1x8_8_1x1_intrawave_v3,816.96,341.83,0.0
gfx942,304,7808,2624,6144,ck,0,0,299.3755,a8w8_blockscale_1x128x128_256x128x128x128_16x16_32x32_2x2_8x32x1_8x32x1_1x32x1x8_8_1x1_intrawave_v3,840.95,350.97,0.0
gfx942,304,7936,2624,6144,ck,0,0,298.5098,a8w8_blockscale_1x128x128_256x128x128x128_16x16_32x32_2x2_8x32x1_8x32x1_1x32x1x8_8_1x1_intrawave_v3,857.21,356.87,0.0
gfx942,304,8064,2624,6144,ck,0,0,302.5687,a8w8_blockscale_1x128x128_256x128x128x128_16x16_32x32_2x2_8x32x1_8x32x1_1x32x1x8_8_1x1_intrawave_v3,859.35,356.9,0.0
gfx942,304,8192,2624,6144,ck,0,0,314.982,a8w8_blockscale_1x128x128_256x128x128x128_16x16_32x32_2x2_8x32x1_8x32x1_1x32x1x8_8_1x1_intrawave_v3,838.59,347.46,0.0
gfx942,304,8320,2624,6144,ck,0,0,311.8614,a8w8_blockscale_1x128x128_256x128x128x128_16x16_32x32_2x2_8x32x1_8x32x1_1x32x1x8_8_1x1_intrawave_v3,860.21,355.62,0.0
gfx942,304,8448,2624,6144,ck,0,0,313.1576,a8w8_blockscale_1x128x128_256x128x128x128_16x16_32x32_2x2_8x32x1_8x32x1_1x32x1x8_8_1x1_intrawave_v3,869.83,358.8,0.0
gfx942,304,8576,2624,6144,ck,0,0,317.8539,a8w8_blockscale_1x128x128_256x128x128x128_16x16_32x32_2x2_8x32x1_8x32x1_1x32x1x8_8_1x1_intrawave_v3,869.97,358.09,0.0
gfx942,304,8704,2624,6144,ck,0,0,323.1469,a8w8_blockscale_1x128x128_256x128x128x128_16x16_32x32_2x2_8x32x1_8x32x1_1x32x1x8_8_1x1_intrawave_v3,868.49,356.74,0.0
gfx942,304,8832,2624,6144,ck,0,0,324.4414,a8w8_blockscale_1x128x128_256x128x128x128_16x16_32x32_2x2_8x32x1_8x32x1_1x32x1x8_8_1x1_intrawave_v3,877.74,359.81,0.0
gfx942,304,8960,2624,6144,ck,0,0,325.4218,a8w8_blockscale_1x128x128_256x128x128x128_16x16_32x32_2x2_8x32x1_8x32x1_1x32x1x8_8_1x1_intrawave_v3,887.78,363.2,0.0
gfx942,304,9088,2624,6144,ck,0,0,340.7727,a8w8_blockscale_1x128x128_256x128x128x128_16x16_32x32_2x2_8x32x1_8x32x1_1x32x1x8_8_1x1_intrawave_v3,859.9,351.12,0.0
gfx942,304,9216,2624,6144,ck,0,0,341.011,a8w8_blockscale_1x128x128_256x128x128x128_16x16_32x32_2x2_8x32x1_8x32x1_1x32x1x8_8_1x1_intrawave_v3,871.4,355.15,0.0
gfx942,304,9344,2624,6144,ck,0,0,353.8024,a8w8_blockscale_1x128x128_256x128x128x128_16x16_32x32_2x2_8x32x1_8x32x1_1x32x1x8_8_1x1_intrawave_v3,851.56,346.43,0.0
gfx942,304,9472,2624,6144,ck,0,0,352.7135,a8w8_blockscale_1x128x128_256x128x128x128_16x16_32x32_2x2_8x32x1_8x32x1_1x32x1x8_8_1x1_intrawave_v3,865.89,351.64,0.0
gfx942,304,9600,2624,6144,ck,0,0,351.4768,a8w8_blockscale_1x128x128_256x128x128x128_16x16_32x32_2x2_8x32x1_8x32x1_1x32x1x8_8_1x1_intrawave_v3,880.68,357.02,0.0
gfx942,304,9728,2624,6144,ck,0,0,358.8334,a8w8_blockscale_1x128x128_256x128x128x128_16x16_32x32_2x2_8x32x1_8x32x1_1x32x1x8_8_1x1_intrawave_v3,874.13,353.77,0.0
gfx942,304,9856,2624,6144,ck,0,0,365.5212,a8w8_blockscale_1x128x128_256x128x128x128_16x16_32x32_2x2_8x32x1_8x32x1_1x32x1x8_8_1x1_intrawave_v3,869.43,351.28,0.0
gfx942,304,9984,2624,6144,ck,0,0,361.088,a8w8_blockscale_1x128x128_256x128x128x128_16x16_32x32_2x2_8x32x1_8x32x1_1x32x1x8_8_1x1_intrawave_v3,891.53,359.63,0.0
gfx942,304,10112,2624,6144,ck,0,0,365.3563,a8w8_blockscale_1x128x128_256x128x128x128_16x16_32x32_2x2_8x32x1_8x32x1_1x32x1x8_8_1x1_intrawave_v3,892.41,359.42,0.0
gfx942,304,10240,2624,6144,ck,0,0,368.7216,a8w8_blockscale_1x128x128_256x128x128x128_16x16_32x32_2x2_8x32x1_8x32x1_1x32x1x8_8_1x1_intrawave_v3,895.46,360.1,0.0
gfx942,304,10368,2624,6144,ck,0,0,378.4951,a8w8_blockscale_1x128x128_256x128x128x128_16x16_32x32_2x2_8x32x1_8x32x1_1x32x1x8_8_1x1_intrawave_v3,883.24,354.65,0.0
gfx942,304,10496,2624,6144,ck,0,0,369.5186,a8w8_blockscale_1x128x128_256x128x128x128_16x16_32x32_2x2_8x32x1_8x32x1_1x32x1x8_8_1x1_intrawave_v3,915.87,367.21,0.0
gfx942,304,10624,2624,6144,ck,0,0,377.7577,a8w8_blockscale_1x128x128_256x128x128x128_16x16_32x32_2x2_8x32x1_8x32x1_1x32x1x8_8_1x1_intrawave_v3,906.82,363.06,0.0
gfx942,304,10752,2624,6144,ck,0,0,380.2019,a8w8_blockscale_1x128x128_256x128x128x128_16x16_32x32_2x2_8x32x1_8x32x1_1x32x1x8_8_1x1_intrawave_v3,911.84,364.57,0.0
gfx942,304,10880,2624,6144,ck,0,0,387.5552,a8w8_blockscale_1x128x128_256x128x128x128_16x16_32x32_2x2_8x32x1_8x32x1_1x32x1x8_8_1x1_intrawave_v3,905.19,361.41,0.0
gfx942,304,11008,2624,6144,ck,0,0,385.2521,a8w8_blockscale_1x128x128_256x128x128x128_16x16_32x32_2x2_8x32x1_8x32x1_1x32x1x8_8_1x1_intrawave_v3,921.32,367.36,0.0
gfx942,304,11136,2624,6144,ck,0,0,411.302,a8w8_blockscale_1x128x128_256x128x128x128_16x16_32x32_2x2_8x32x1_8x32x1_1x32x1x8_8_1x1_intrawave_v3,873.0,347.64,0.0
gfx942,304,11264,2624,6144,ck,0,0,413.3692,a8w8_blockscale_1x128x128_256x128x128x128_16x16_32x32_2x2_8x32x1_8x32x1_1x32x1x8_8_1x1_intrawave_v3,878.62,349.42,0.0
gfx942,304,11392,2624,6144,ck,0,0,419.2651,a8w8_blockscale_1x128x128_256x128x128x128_16x16_32x32_2x2_8x32x1_8x32x1_1x32x1x8_8_1x1_intrawave_v3,876.11,347.99,0.0
gfx942,304,11520,2624,6144,ck,0,0,417.2677,a8w8_blockscale_1x128x128_256x128x128x128_16x16_32x32_2x2_8x32x1_8x32x1_1x32x1x8_8_1x1_intrawave_v3,890.19,353.15,0.0
gfx942,304,11648,2624,6144,ck,0,0,422.2024,a8w8_blockscale_1x128x128_256x128x128x128_16x16_32x32_2x2_8x32x1_8x32x1_1x32x1x8_8_1x1_intrawave_v3,889.56,352.48,0.0
gfx942,304,11776,2624,6144,ck,0,0,425.3018,a8w8_blockscale_1x128x128_256x128x128x128_16x16_32x32_2x2_8x32x1_8x32x1_1x32x1x8_8_1x1_intrawave_v3,892.78,353.34,0.0
gfx942,304,11904,2624,6144,ck,0,0,446.5562,a8w8_blockscale_1x128x128_256x128x128x128_16x16_32x32_2x2_8x32x1_8x32x1_1x32x1x8_8_1x1_intrawave_v3,859.53,339.78,0.0
gfx942,304,12032,2624,6144,ck,0,0,430.1322,a8w8_blockscale_1x128x128_256x128x128x128_16x16_32x32_2x2_8x32x1_8x32x1_1x32x1x8_8_1x1_intrawave_v3,901.95,356.15,0.0
gfx942,304,12160,2624,6144,ck,0,0,436.5972,a8w8_blockscale_1x128x128_256x128x128x128_16x16_32x32_2x2_8x32x1_8x32x1_1x32x1x8_8_1x1_intrawave_v3,898.04,354.21,0.0
gfx942,304,12288,2624,6144,ck,0,0,439.6498,a8w8_blockscale_1x128x128_256x128x128x128_16x16_32x32_2x2_8x32x1_8x32x1_1x32x1x8_8_1x1_intrawave_v3,901.2,355.07,0.0
gfx942,304,12416,2624,6144,ck,0,0,440.3912,a8w8_blockscale_1x128x128_256x128x128x128_16x16_32x32_2x2_8x32x1_8x32x1_1x32x1x8_8_1x1_intrawave_v3,909.05,357.78,0.0
gfx942,304,12544,2624,6144,ck,0,0,438.7643,a8w8_blockscale_1x128x128_256x128x128x128_16x16_32x32_2x2_8x32x1_8x32x1_1x32x1x8_8_1x1_intrawave_v3,921.83,362.43,0.0
gfx942,304,12672,2624,6144,ck,0,0,444.2515,a8w8_blockscale_1x128x128_256x128x128x128_16x16_32x32_2x2_8x32x1_8x32x1_1x32x1x8_8_1x1_intrawave_v3,919.73,361.24,0.0
gfx942,304,12800,2624,6144,ck,0,0,456.5606,a8w8_blockscale_1x128x128_256x128x128x128_16x16_32x32_2x2_8x32x1_8x32x1_1x32x1x8_8_1x1_intrawave_v3,903.98,354.69,0.0
gfx942,304,12928,2624,6144,ck,0,0,475.4226,a8w8_blockscale_1x128x128_256x128x128x128_16x16_32x32_2x2_8x32x1_8x32x1_1x32x1x8_8_1x1_intrawave_v3,876.79,343.69,0.0
gfx942,304,13056,2624,6144,ck,0,0,471.4742,a8w8_blockscale_1x128x128_256x128x128x128_16x16_32x32_2x2_8x32x1_8x32x1_1x32x1x8_8_1x1_intrawave_v3,892.89,349.66,0.0
gfx942,304,13184,2624,6144,ck,0,0,481.6731,a8w8_blockscale_1x128x128_256x128x128x128_16x16_32x32_2x2_8x32x1_8x32x1_1x32x1x8_8_1x1_intrawave_v3,882.55,345.28,0.0
gfx942,304,13312,2624,6144,ck,0,0,482.0684,a8w8_blockscale_1x128x128_256x128x128x128_16x16_32x32_2x2_8x32x1_8x32x1_1x32x1x8_8_1x1_intrawave_v3,890.39,348.03,0.0
gfx942,304,13440,2624,6144,ck,0,0,482.8459,a8w8_blockscale_1x128x128_256x128x128x128_16x16_32x32_2x2_8x32x1_8x32x1_1x32x1x8_8_1x1_intrawave_v3,897.5,350.49,0.0
gfx942,304,13568,2624,6144,ck,0,0,478.0791,a8w8_blockscale_1x128x128_256x128x128x128_16x16_32x32_2x2_8x32x1_8x32x1_1x32x1x8_8_1x1_intrawave_v3,915.08,357.03,0.0
gfx942,304,13696,2624,6144,ck,0,0,487.731,a8w8_blockscale_1x128x128_256x128x128x128_16x16_32x32_2x2_8x32x1_8x32x1_1x32x1x8_8_1x1_intrawave_v3,905.44,352.95,0.0
gfx942,304,13824,2624,6144,ck,0,0,485.5631,a8w8_blockscale_1x128x128_256x128x128x128_16x16_32x32_2x2_8x32x1_8x32x1_1x32x1x8_8_1x1_intrawave_v3,917.98,357.53,0.0
gfx942,304,13952,2624,6144,ck,0,0,495.6988,a8w8_blockscale_1x128x128_256x128x128x128_16x16_32x32_2x2_8x32x1_8x32x1_1x32x1x8_8_1x1_intrawave_v3,907.54,353.16,0.0
gfx942,304,14080,2624,6144,ck,0,0,496.121,a8w8_blockscale_1x128x128_256x128x128x128_16x16_32x32_2x2_8x32x1_8x32x1_1x32x1x8_8_1x1_intrawave_v3,915.08,355.8,0.0
gfx942,304,14208,2624,6144,ck,0,0,494.0744,a8w8_blockscale_1x128x128_256x128x128x128_16x16_32x32_2x2_8x32x1_8x32x1_1x32x1x8_8_1x1_intrawave_v3,927.23,360.23,0.0
gfx942,304,14336,2624,6144,ck,0,0,501.3434,a8w8_blockscale_1x128x128_256x128x128x128_16x16_32x32_2x2_8x32x1_8x32x1_1x32x1x8_8_1x1_intrawave_v3,922.01,357.91,0.0
gfx942,304,14464,2624,6144,ck,0,0,500.3954,a8w8_blockscale_1x128x128_256x128x128x128_16x16_32x32_2x2_8x32x1_8x32x1_1x32x1x8_8_1x1_intrawave_v3,932.01,361.51,0.0
gfx942,304,14592,2624,6144,ck,0,0,502.8699,a8w8_blockscale_1x128x128_256x128x128x128_16x16_32x32_2x2_8x32x1_8x32x1_1x32x1x8_8_1x1_intrawave_v3,935.63,362.63,0.0
gfx942,304,14720,2624,6144,ck,0,0,547.7355,a8w8_blockscale_1x128x128_256x128x128x128_16x16_32x32_2x2_8x32x1_8x32x1_1x32x1x8_8_1x1_intrawave_v3,866.53,335.59,0.0
gfx942,304,14848,2624,6144,ck,0,0,549.0064,a8w8_blockscale_1x128x128_256x128x128x128_16x16_32x32_2x2_8x32x1_8x32x1_1x32x1x8_8_1x1_intrawave_v3,872.04,337.46,0.0
gfx942,304,14976,2624,6144,ck,0,0,539.4852,a8w8_blockscale_1x128x128_256x128x128x128_16x16_32x32_2x2_8x32x1_8x32x1_1x32x1x8_8_1x1_intrawave_v3,895.08,346.12,0.0
gfx942,304,15104,2624,6144,ck,0,0,539.5971,a8w8_blockscale_1x128x128_256x128x128x128_16x16_32x32_2x2_8x32x1_8x32x1_1x32x1x8_8_1x1_intrawave_v3,902.54,348.75,0.0
gfx942,304,15232,2624,6144,ck,0,0,547.4502,a8w8_blockscale_1x128x128_256x128x128x128_16x16_32x32_2x2_8x32x1_8x32x1_1x32x1x8_8_1x1_intrawave_v3,897.13,346.41,0.0
gfx942,304,15360,2624,6144,ck,0,0,547.7255,a8w8_blockscale_1x128x128_256x128x128x128_16x16_32x32_2x2_8x32x1_8x32x1_1x32x1x8_8_1x1_intrawave_v3,904.22,348.9,0.0
gfx942,304,15488,2624,6144,ck,0,0,538.8109,a8w8_blockscale_1x128x128_256x128x128x128_16x16_32x32_2x2_8x32x1_8x32x1_1x32x1x8_8_1x1_intrawave_v3,926.84,357.38,0.0
gfx942,304,15616,2624,6144,ck,0,0,545.3694,a8w8_blockscale_1x128x128_256x128x128x128_16x16_32x32_2x2_8x32x1_8x32x1_1x32x1x8_8_1x1_intrawave_v3,923.26,355.76,0.0
gfx942,304,15744,2624,6144,ck,0,0,552.415,a8w8_blockscale_1x128x128_256x128x128x128_16x16_32x32_2x2_8x32x1_8x32x1_1x32x1x8_8_1x1_intrawave_v3,918.96,353.86,0.0
gfx942,304,15872,2624,6144,ck,0,0,557.3385,a8w8_blockscale_1x128x128_256x128x128x128_16x16_32x32_2x2_8x32x1_8x32x1_1x32x1x8_8_1x1_intrawave_v3,918.24,353.35,0.0
gfx942,304,16000,2624,6144,ck,0,0,560.3546,a8w8_blockscale_1x128x128_256x128x128x128_16x16_32x32_2x2_8x32x1_8x32x1_1x32x1x8_8_1x1_intrawave_v3,920.67,354.05,0.0
gfx942,304,16128,2624,6144,ck,0,0,559.7786,a8w8_blockscale_1x128x128_256x128x128x128_16x16_32x32_2x2_8x32x1_8x32x1_1x32x1x8_8_1x1_intrawave_v3,928.99,357.02,0.0
gfx942,304,16256,2624,6144,ck,0,0,572.5714,a8w8_blockscale_1x128x128_256x128x128x128_16x16_32x32_2x2_8x32x1_8x32x1_1x32x1x8_8_1x1_intrawave_v3,915.44,351.59,0.0
gfx942,304,16384,2624,6144,ck,0,0,582.3619,a8w8_blockscale_1x128x128_256x128x128x128_16x16_32x32_2x2_8x32x1_8x32x1_1x32x1x8_8_1x1_intrawave_v3,907.14,348.18,0.0
gfx942,304,16512,2624,6144,ck,0,0,574.2823,a8w8_blockscale_1x128x128_256x128x128x128_16x16_32x32_2x2_8x32x1_8x32x1_1x32x1x8_8_1x1_intrawave_v3,927.08,355.62,0.0
gfx942,304,1,3072,6144,ck,7,3,12.1829,a8w8_blockscale_1x128x128_256x16x128x256_16x16_16x16_1x2_16x16x1_16x16x1_1x16x1x16_8_1x2_intrawave_v1,3.1,1550.26,0.0
gfx942,304,2,3072,6144,ck,7,3,12.0629,a8w8_blockscale_1x128x128_256x16x128x256_16x16_16x16_1x2_16x16x1_16x16x1_1x16x1x16_8_1x2_intrawave_v1,6.26,1566.7,0.0003
gfx942,304,4,3072,6144,ck,7,3,12.1159,a8w8_blockscale_1x128x128_256x16x128x256_16x16_16x16_1x2_16x16x1_16x16x1_1x16x1x16_8_1x2_intrawave_v1,12.46,1561.87,0.0001
gfx942,304,8,3072,6144,ck,8,2,12.3263,a8w8_blockscale_1x128x128_256x16x64x256_16x16_16x16_1x1_16x16x1_16x16x1_1x16x1x16_4_1x1_intrawave_v1,24.5,1539.2,0.0
gfx942,304,16,3072,6144,ck,8,2,12.4817,a8w8_blockscale_1x128x128_256x16x64x256_16x16_16x16_1x1_16x16x1_16x16x1_1x16x1x16_4_1x1_intrawave_v1,48.39,1527.91,0.0
gfx942,304,32,3072,6144,ck,8,3,13.3783,a8w8_blockscale_1x128x128_256x16x64x256_16x16_16x16_1x1_16x16x1_16x16x1_1x16x1x16_4_1x1_intrawave_v1,90.29,1440.21,0.0001
gfx942,304,48,3072,6144,ck,8,3,14.6789,a8w8_blockscale_1x128x128_256x16x64x256_16x16_16x16_1x1_16x16x1_16x16x1_1x16x1x16_4_1x1_intrawave_v1,123.44,1326.0,0.0002
gfx942,304,64,3072,6144,ck,8,3,17.5008,a8w8_blockscale_1x128x128_256x16x64x256_16x16_16x16_1x1_16x16x1_16x16x1_1x16x1x16_4_1x1_intrawave_v1,138.05,1123.42,0.0001
gfx942,304,80,3072,6144,ck,13,2,20.8184,a8w8_blockscale_1x128x128_256x32x64x256_16x16_16x16_2x1_16x16x1_16x16x1_1x32x1x8_8_2x1_intrawave_v1,145.06,953.84,0.0
gfx942,304,96,3072,6144,ck,8,0,21.4501,a8w8_blockscale_1x128x128_256x16x64x256_16x16_16x16_1x1_16x16x1_16x16x1_1x16x1x16_4_1x1_intrawave_v1,168.94,934.91,0.0
gfx942,304,112,3072,6144,ck,18,1,23.7604,a8w8_blockscale_1x128x128_256x64x64x256_16x16_32x32_1x1_16x16x1_16x16x1_1x32x1x8_8_1x1_intrawave_v1,177.94,852.28,0.0
gfx942,304,128,3072,6144,ck,18,1,23.6732,a8w8_blockscale_1x128x128_256x64x64x256_16x16_32x32_1x1_16x16x1_16x16x1_1x32x1x8_8_1x1_intrawave_v1,204.11,863.73,0.0
gfx942,304,144,3072,6144,ck,18,1,25.67,a8w8_blockscale_1x128x128_256x64x64x256_16x16_32x32_1x1_16x16x1_16x16x1_1x32x1x8_8_1x1_intrawave_v1,211.76,804.2,0.0
gfx942,304,160,3072,6144,ck,18,1,26.0946,a8w8_blockscale_1x128x128_256x64x64x256_16x16_32x32_1x1_16x16x1_16x16x1_1x32x1x8_8_1x1_intrawave_v1,231.46,798.65,0.0
gfx942,304,176,3072,6144,ck,18,1,26.9084,a8w8_blockscale_1x128x128_256x64x64x256_16x16_32x32_1x1_16x16x1_16x16x1_1x32x1x8_8_1x1_intrawave_v1,246.9,781.8,0.0
gfx942,304,192,3072,6144,ck,18,0,26.3168,a8w8_blockscale_1x128x128_256x64x64x256_16x16_32x32_1x1_16x16x1_16x16x1_1x32x1x8_8_1x1_intrawave_v1,275.4,806.85,0.0
gfx942,304,208,3072,6144,ck,18,0,29.3077,a8w8_blockscale_1x128x128_256x64x64x256_16x16_32x32_1x1_16x16x1_16x16x1_1x32x1x8_8_1x1_intrawave_v1,267.91,731.22,0.0
gfx942,304,224,3072,6144,ck,18,0,29.1889,a8w8_blockscale_1x128x128_256x64x64x256_16x16_32x32_1x1_16x16x1_16x16x1_1x32x1x8_8_1x1_intrawave_v1,289.69,740.93,0.0
gfx942,304,240,3072,6144,ck,18,0,29.7903,a8w8_blockscale_1x128x128_256x64x64x256_16x16_32x32_1x1_16x16x1_16x16x1_1x32x1x8_8_1x1_intrawave_v1,304.12,732.57,0.0
gfx942,304,256,3072,6144,ck,18,0,27.0334,a8w8_blockscale_1x128x128_256x64x64x256_16x16_32x32_1x1_16x16x1_16x16x1_1x32x1x8_8_1x1_intrawave_v1,357.47,814.55,0.0
gfx942,304,288,3072,6144,ck,18,0,31.5174,a8w8_blockscale_1x128x128_256x64x64x256_16x16_32x32_1x1_16x16x1_16x16x1_1x32x1x8_8_1x1_intrawave_v1,344.94,711.14,0.0
gfx942,304,320,3072,6144,ck,18,0,28.0497,a8w8_blockscale_1x128x128_256x64x64x256_16x16_32x32_1x1_16x16x1_16x16x1_1x32x1x8_8_1x1_intrawave_v1,430.65,813.08,0.0
gfx942,304,352,3072,6144,ck,18,0,32.7299,a8w8_blockscale_1x128x128_256x64x64x256_16x16_32x32_1x1_16x16x1_16x16x1_1x32x1x8_8_1x1_intrawave_v1,405.98,708.82,0.0
gfx942,304,384,3072,6144,ck,18,0,29.3823,a8w8_blockscale_1x128x128_256x64x64x256_16x16_32x32_1x1_16x16x1_16x16x1_1x32x1x8_8_1x1_intrawave_v1,493.34,802.97,0.0
gfx942,304,416,3072,6144,ck,3,0,47.1161,a8w8_blockscale_1x128x128_256x64x64x128_16x16_32x32_1x1_8x32x1_8x32x1_1x32x1x8_8_1x1_intrawave_v3,333.29,509.09,0.0
gfx942,304,448,3072,6144,ck,3,0,48.7426,a8w8_blockscale_1x128x128_256x64x64x128_16x16_32x32_1x1_8x32x1_8x32x1_1x32x1x8_8_1x1_intrawave_v3,346.95,500.17,0.0
gfx942,304,480,3072,6144,ck,2,0,49.962,a8w8_blockscale_1x128x128_256x64x128x128_16x16_32x32_1x2_8x32x1_8x32x1_1x32x1x8_8_1x1_intrawave_v3,362.66,495.83,0.0
gfx942,304,512,3072,6144,ck,18,0,51.472,a8w8_blockscale_1x128x128_256x64x64x256_16x16_32x32_1x1_16x16x1_16x16x1_1x32x1x8_8_1x1_intrawave_v1,375.49,488.92,0.0
gfx942,304,544,3072,6144,ck,3,0,50.9666,a8w8_blockscale_1x128x128_256x64x64x128_16x16_32x32_1x1_8x32x1_8x32x1_1x32x1x8_8_1x1_intrawave_v3,402.92,501.49,0.0
gfx942,304,576,3072,6144,ck,18,0,53.1325,a8w8_blockscale_1x128x128_256x64x64x256_16x16_32x32_1x1_16x16x1_16x16x1_1x32x1x8_8_1x1_intrawave_v1,409.23,488.44,0.0
gfx942,304,608,3072,6144,ck,2,0,52.3653,a8w8_blockscale_1x128x128_256x64x128x128_16x16_32x32_1x2_8x32x1_8x32x1_1x32x1x8_8_1x1_intrawave_v3,438.29,503.11,0.0
gfx942,304,640,3072,6144,ck,3,0,53.7792,a8w8_blockscale_1x128x128_256x64x64x128_16x16_32x32_1x1_8x32x1_8x32x1_1x32x1x8_8_1x1_intrawave_v3,449.23,497.19,0.0
gfx942,304,672,3072,6144,ck,2,0,54.0048,a8w8_blockscale_1x128x128_256x64x128x128_16x16_32x32_1x2_8x32x1_8x32x1_1x32x1x8_8_1x1_intrawave_v3,469.72,502.4,0.0
gfx942,304,704,3072,6144,ck,3,0,55.244,a8w8_blockscale_1x128x128_256x64x64x128_16x16_32x32_1x1_8x32x1_8x32x1_1x32x1x8_8_1x1_intrawave_v3,481.05,498.25,0.0
gfx942,304,736,3072,6144,ck,2,0,53.8002,a8w8_blockscale_1x128x128_256x64x128x128_16x16_32x32_1x2_8x32x1_8x32x1_1x32x1x8_8_1x1_intrawave_v3,516.41,518.93,0.0
gfx942,304,768,3072,6144,ck,3,0,56.5124,a8w8_blockscale_1x128x128_256x64x64x128_16x16_32x32_1x1_8x32x1_8x32x1_1x32x1x8_8_1x1_intrawave_v3,513.0,500.98,0.0
gfx942,304,800,3072,6144,ck,0,0,69.3917,a8w8_blockscale_1x128x128_256x128x128x128_16x16_32x32_2x2_8x32x1_8x32x1_1x32x1x8_8_1x1_intrawave_v3,435.2,413.66,0.0
gfx942,304,832,3072,6144,ck,0,0,70.0916,a8w8_blockscale_1x128x128_256x128x128x128_16x16_32x32_2x2_8x32x1_8x32x1_1x32x1x8_8_1x1_intrawave_v3,448.08,415.14,0.0
gfx942,304,864,3072,6144,ck,0,0,71.6718,a8w8_blockscale_1x128x128_256x128x128x128_16x16_32x32_2x2_8x32x1_8x32x1_1x32x1x8_8_1x1_intrawave_v3,455.06,411.48,0.0
gfx942,304,896,3072,6144,ck,2,0,74.7588,a8w8_blockscale_1x128x128_256x64x128x128_16x16_32x32_1x2_8x32x1_8x32x1_1x32x1x8_8_1x1_intrawave_v3,452.43,399.74,0.0
gfx942,304,928,3072,6144,ck,0,0,70.8336,a8w8_blockscale_1x128x128_256x128x128x128_16x16_32x32_2x2_8x32x1_8x32x1_1x32x1x8_8_1x1_intrawave_v3,494.55,427.45,0.0
gfx942,304,960,3072,6144,ck,0,0,69.4043,a8w8_blockscale_1x128x128_256x128x128x128_16x16_32x32_2x2_8x32x1_8x32x1_1x32x1x8_8_1x1_intrawave_v3,522.14,441.92,0.0
gfx942,304,992,3072,6144,ck,0,0,75.2132,a8w8_blockscale_1x128x128_256x128x128x128_16x16_32x32_2x2_8x32x1_8x32x1_1x32x1x8_8_1x1_intrawave_v3,497.87,413.01,0.0
gfx942,304,1024,3072,6144,ck,3,0,77.2639,a8w8_blockscale_1x128x128_256x64x64x128_16x16_32x32_1x1_8x32x1_8x32x1_1x32x1x8_8_1x1_intrawave_v3,500.29,407.14,0.0
gfx942,304,1088,3072,6144,ck,0,0,73.5788,a8w8_blockscale_1x128x128_256x128x128x128_16x16_32x32_2x2_8x32x1_8x32x1_1x32x1x8_8_1x1_intrawave_v3,558.19,438.22,0.0
gfx942,304,1152,3072,6144,ck,2,0,78.757,a8w8_blockscale_1x128x128_256x64x128x128_16x16_32x32_1x2_8x32x1_8x32x1_1x32x1x8_8_1x1_intrawave_v3,552.16,419.39,0.0
gfx942,304,1216,3072,6144,ck,0,0,73.261,a8w8_blockscale_1x128x128_256x128x128x128_16x16_32x32_2x2_8x32x1_8x32x1_1x32x1x8_8_1x1_intrawave_v3,626.56,461.59,0.0
gfx942,304,1280,3072,6144,ck,2,0,79.5858,a8w8_blockscale_1x128x128_256x64x128x128_16x16_32x32_1x2_8x32x1_8x32x1_1x32x1x8_8_1x1_intrawave_v3,607.12,434.79,0.0
gfx942,304,1344,3072,6144,ck,0,0,75.0412,a8w8_blockscale_1x128x128_256x128x128x128_16x16_32x32_2x2_8x32x1_8x32x1_1x32x1x8_8_1x1_intrawave_v3,676.09,471.6,0.0
gfx942,304,1408,3072,6144,ck,0,0,84.8075,a8w8_blockscale_1x128x128_256x128x128x128_16x16_32x32_2x2_8x32x1_8x32x1_1x32x1x8_8_1x1_intrawave_v3,626.72,426.56,0.0
gfx942,304,1472,3072,6144,ck,0,0,75.9631,a8w8_blockscale_1x128x128_256x128x128x128_16x16_32x32_2x2_8x32x1_8x32x1_1x32x1x8_8_1x1_intrawave_v3,731.49,486.58,0.0
gfx942,304,1536,3072,6144,ck,0,0,86.9162,a8w8_blockscale_1x128x128_256x128x128x128_16x16_32x32_2x2_8x32x1_8x32x1_1x32x1x8_8_1x1_intrawave_v3,667.1,434.31,0.0
gfx942,304,1600,3072,6144,ck,2,0,91.5775,a8w8_blockscale_1x128x128_256x64x128x128_16x16_32x32_1x2_8x32x1_8x32x1_1x32x1x8_8_1x1_intrawave_v3,659.53,420.79,0.0
gfx942,304,1664,3072,6144,ck,0,0,118.0044,a8w8_blockscale_1x128x128_256x128x128x128_16x16_32x32_2x2_8x32x1_8x32x1_1x32x1x8_8_1x1_intrawave_v3,532.3,333.22,0.0
gfx942,304,1728,3072,6144,ck,0,0,113.527,a8w8_blockscale_1x128x128_256x128x128x128_16x16_32x32_2x2_8x32x1_8x32x1_1x32x1x8_8_1x1_intrawave_v3,574.58,353.29,0.0
gfx942,304,1792,3072,6144,ck,0,0,111.6058,a8w8_blockscale_1x128x128_256x128x128x128_16x16_32x32_2x2_8x32x1_8x32x1_1x32x1x8_8_1x1_intrawave_v3,606.11,366.42,0.0
gfx942,304,1856,3072,6144,ck,0,0,111.7307,a8w8_blockscale_1x128x128_256x128x128x128_16x16_32x32_2x2_8x32x1_8x32x1_1x32x1x8_8_1x1_intrawave_v3,627.06,373.05,0.0
gfx942,304,1920,3072,6144,ck,0,0,113.7785,a8w8_blockscale_1x128x128_256x128x128x128_16x16_32x32_2x2_8x32x1_8x32x1_1x32x1x8_8_1x1_intrawave_v3,637.01,373.25,0.0
gfx942,304,1984,3072,6144,ck,0,0,113.0474,a8w8_blockscale_1x128x128_256x128x128x128_16x16_32x32_2x2_8x32x1_8x32x1_1x32x1x8_8_1x1_intrawave_v3,662.5,382.62,0.0
gfx942,304,2048,3072,6144,ck,0,0,114.2355,a8w8_blockscale_1x128x128_256x128x128x128_16x16_32x32_2x2_8x32x1_8x32x1_1x32x1x8_8_1x1_intrawave_v3,676.75,385.52,0.0
gfx942,304,2112,3072,6144,ck,0,0,119.9588,a8w8_blockscale_1x128x128_256x128x128x128_16x16_32x32_2x2_8x32x1_8x32x1_1x32x1x8_8_1x1_intrawave_v3,664.61,373.68,0.0
gfx942,304,2176,3072,6144,ck,0,0,119.1578,a8w8_blockscale_1x128x128_256x128x128x128_16x16_32x32_2x2_8x32x1_8x32x1_1x32x1x8_8_1x1_intrawave_v3,689.35,382.8,0.0
gfx942,304,2240,3072,6144,ck,0,0,118.5062,a8w8_blockscale_1x128x128_256x128x128x128_16x16_32x32_2x2_8x32x1_8x32x1_1x32x1x8_8_1x1_intrawave_v3,713.53,391.54,0.0
gfx942,304,2304,3072,6144,ck,0,0,117.1821,a8w8_blockscale_1x128x128_256x128x128x128_16x16_32x32_2x2_8x32x1_8x32x1_1x32x1x8_8_1x1_intrawave_v3,742.2,402.67,0.0
gfx942,304,2368,3072,6144,ck,0,0,121.6514,a8w8_blockscale_1x128x128_256x128x128x128_16x16_32x32_2x2_8x32x1_8x32x1_1x32x1x8_8_1x1_intrawave_v3,734.8,394.34,0.0
gfx942,304,2432,3072,6144,ck,0,0,122.2534,a8w8_blockscale_1x128x128_256x128x128x128_16x16_32x32_2x2_8x32x1_8x32x1_1x32x1x8_8_1x1_intrawave_v3,750.94,398.83,0.0
gfx942,304,2496,3072,6144,ck,0,0,121.0637,a8w8_blockscale_1x128x128_256x128x128x128_16x16_32x32_2x2_8x32x1_8x32x1_1x32x1x8_8_1x1_intrawave_v3,778.27,409.25,0.0
gfx942,304,2560,3072,6144,ck,0,0,122.4772,a8w8_blockscale_1x128x128_256x128x128x128_16x16_32x32_2x2_8x32x1_8x32x1_1x32x1x8_8_1x1_intrawave_v3,789.02,410.95,0.0
gfx942,304,2624,3072,6144,ck,0,0,126.887,a8w8_blockscale_1x128x128_256x128x128x128_16x16_32x32_2x2_8x32x1_8x32x1_1x32x1x8_8_1x1_intrawave_v3,780.64,402.86,0.0
gfx942,304,2688,3072,6144,ck,0,0,127.6177,a8w8_blockscale_1x128x128_256x128x128x128_16x16_32x32_2x2_8x32x1_8x32x1_1x32x1x8_8_1x1_intrawave_v3,795.1,406.72,0.0
gfx942,304,2752,3072,6144,ck,0,0,131.9857,a8w8_blockscale_1x128x128_256x128x128x128_16x16_32x32_2x2_8x32x1_8x32x1_1x32x1x8_8_1x1_intrawave_v3,787.09,399.22,0.0
gfx942,304,2816,3072,6144,ck,0,0,128.6639,a8w8_blockscale_1x128x128_256x128x128x128_16x16_32x32_2x2_8x32x1_8x32x1_1x32x1x8_8_1x1_intrawave_v3,826.19,415.64,0.0
gfx942,304,2880,3072,6144,ck,0,0,131.6894,a8w8_blockscale_1x128x128_256x128x128x128_16x16_32x32_2x2_8x32x1_8x32x1_1x32x1x8_8_1x1_intrawave_v3,825.55,412.06,0.0
gfx942,304,2944,3072,6144,ck,0,0,134.8239,a8w8_blockscale_1x128x128_256x128x128x128_16x16_32x32_2x2_8x32x1_8x32x1_1x32x1x8_8_1x1_intrawave_v3,824.28,408.31,0.0
gfx942,304,3008,3072,6144,ck,0,0,133.6875,a8w8_blockscale_1x128x128_256x128x128x128_16x16_32x32_2x2_8x32x1_8x32x1_1x32x1x8_8_1x1_intrawave_v3,849.36,417.67,0.0
gfx942,304,3072,3072,6144,ck,0,0,135.7249,a8w8_blockscale_1x128x128_256x128x128x128_16x16_32x32_2x2_8x32x1_8x32x1_1x32x1x8_8_1x1_intrawave_v3,854.41,417.19,0.0
gfx942,304,3136,3072,6144,ck,0,0,134.8282,a8w8_blockscale_1x128x128_256x128x128x128_16x16_32x32_2x2_8x32x1_8x32x1_1x32x1x8_8_1x1_intrawave_v3,878.01,425.8,0.0
gfx942,304,3200,3072,6144,ck,0,0,138.0679,a8w8_blockscale_1x128x128_256x128x128x128_16x16_32x32_2x2_8x32x1_8x32x1_1x32x1x8_8_1x1_intrawave_v3,874.9,421.5,0.0
gfx942,304,3264,3072,6144,ck,0,0,179.3568,a8w8_blockscale_1x128x128_256x128x128x128_16x16_32x32_2x2_8x32x1_8x32x1_1x32x1x8_8_1x1_intrawave_v3,686.97,328.86,0.0
gfx942,304,3328,3072,6144,ck,0,0,184.8753,a8w8_blockscale_1x128x128_256x128x128x128_16x16_32x32_2x2_8x32x1_8x32x1_1x32x1x8_8_1x1_intrawave_v3,679.53,323.29,0.0
gfx942,304,3392,3072,6144,ck,0,0,181.0991,a8w8_blockscale_1x128x128_256x128x128x128_16x16_32x32_2x2_8x32x1_8x32x1_1x32x1x8_8_1x1_intrawave_v3,707.04,334.38,0.0
gfx942,304,3456,3072,6144,ck,0,0,187.4272,a8w8_blockscale_1x128x128_256x128x128x128_16x16_32x32_2x2_8x32x1_8x32x1_1x32x1x8_8_1x1_intrawave_v3,696.05,327.28,0.0
gfx942,304,3520,3072,6144,ck,0,0,185.4431,a8w8_blockscale_1x128x128_256x128x128x128_16x16_32x32_2x2_8x32x1_8x32x1_1x32x1x8_8_1x1_intrawave_v3,716.53,335.03,0.0
gfx942,304,3584,3072,6144,ck,0,0,179.0989,a8w8_blockscale_1x128x128_256x128x128x128_16x16_32x32_2x2_8x32x1_8x32x1_1x32x1x8_8_1x1_intrawave_v3,755.4,351.28,0.0
gfx942,304,3648,3072,6144,ck,0,0,190.0365,a8w8_blockscale_1x128x128_256x128x128x128_16x16_32x32_2x2_8x32x1_8x32x1_1x32x1x8_8_1x1_intrawave_v3,724.64,335.2,0.0
gfx942,304,3712,3072,6144,ck,0,0,191.3664,a8w8_blockscale_1x128x128_256x128x128x128_16x16_32x32_2x2_8x32x1_8x32x1_1x32x1x8_8_1x1_intrawave_v3,732.23,336.98,0.0
gfx942,304,3776,3072,6144,ck,0,0,185.6248,a8w8_blockscale_1x128x128_256x128x128x128_16x16_32x32_2x2_8x32x1_8x32x1_1x32x1x8_8_1x1_intrawave_v3,767.89,351.64,0.0
gfx942,304,3840,3072,6144,ck,0,0,188.3957,a8w8_blockscale_1x128x128_256x128x128x128_16x16_32x32_2x2_8x32x1_8x32x1_1x32x1x8_8_1x1_intrawave_v3,769.42,350.65,0.0
gfx942,304,3904,3072,6144,ck,0,0,191.4594,a8w8_blockscale_1x128x128_256x128x128x128_16x16_32x32_2x2_8x32x1_8x32x1_1x32x1x8_8_1x1_intrawave_v3,769.72,349.14,0.0
gfx942,304,3968,3072,6144,ck,0,0,191.6575,a8w8_blockscale_1x128x128_256x128x128x128_16x16_32x32_2x2_8x32x1_8x32x1_1x32x1x8_8_1x1_intrawave_v3,781.53,352.89,0.0
gfx942,304,4032,3072,6144,ck,0,0,191.5597,a8w8_blockscale_1x128x128_256x128x128x128_16x16_32x32_2x2_8x32x1_8x32x1_1x32x1x8_8_1x1_intrawave_v3,794.55,357.17,0.0
gfx942,304,4096,3072,6144,ck,0,0,197.0929,a8w8_blockscale_1x128x128_256x128x128x128_16x16_32x32_2x2_8x32x1_8x32x1_1x32x1x8_8_1x1_intrawave_v3,784.5,351.13,0.0
gfx942,304,4224,3072,6144,ck,0,0,204.2533,a8w8_blockscale_1x128x128_256x128x128x128_16x16_32x32_2x2_8x32x1_8x32x1_1x32x1x8_8_1x1_intrawave_v3,780.65,346.53,0.0
gfx942,304,4352,3072,6144,ck,0,0,205.6802,a8w8_blockscale_1x128x128_256x128x128x128_16x16_32x32_2x2_8x32x1_8x32x1_1x32x1x8_8_1x1_intrawave_v3,798.73,351.77,0.0
gfx942,304,4480,3072,6144,ck,0,0,199.0632,a8w8_blockscale_1x128x128_256x128x128x128_16x16_32x32_2x2_8x32x1_8x32x1_1x32x1x8_8_1x1_intrawave_v3,849.55,371.36,0.0
gfx942,304,4608,3072,6144,ck,0,0,207.7598,a8w8_blockscale_1x128x128_256x128x128x128_16x16_32x32_2x2_8x32x1_8x32x1_1x32x1x8_8_1x1_intrawave_v3,837.25,363.39,0.0
gfx942,304,4736,3072,6144,ck,0,0,205.7444,a8w8_blockscale_1x128x128_256x128x128x128_16x16_32x32_2x2_8x32x1_8x32x1_1x32x1x8_8_1x1_intrawave_v3,868.93,374.59,0.0
gfx942,304,4864,3072,6144,ck,0,0,212.5485,a8w8_blockscale_1x128x128_256x128x128x128_16x16_32x32_2x2_8x32x1_8x32x1_1x32x1x8_8_1x1_intrawave_v3,863.85,370.0,0.0
gfx942,304,4992,3072,6144,ck,0,0,249.1175,a8w8_blockscale_1x128x128_256x128x128x128_16x16_32x32_2x2_8x32x1_8x32x1_1x32x1x8_8_1x1_intrawave_v3,756.44,322.0,0.0
gfx942,304,5120,3072,6144,ck,0,0,246.8982,a8w8_blockscale_1x128x128_256x128x128x128_16x16_32x32_2x2_8x32x1_8x32x1_1x32x1x8_8_1x1_intrawave_v3,782.81,331.27,0.0
gfx942,304,5248,3072,6144,ck,0,0,240.2025,a8w8_blockscale_1x128x128_256x128x128x128_16x16_32x32_2x2_8x32x1_8x32x1_1x32x1x8_8_1x1_intrawave_v3,824.74,347.05,0.0
gfx942,304,5376,3072,6144,ck,0,0,240.6751,a8w8_blockscale_1x128x128_256x128x128x128_16x16_32x32_2x2_8x32x1_8x32x1_1x32x1x8_8_1x1_intrawave_v3,843.2,352.9,0.0
gfx942,304,5504,3072,6144,ck,0,0,244.1155,a8w8_blockscale_1x128x128_256x128x128x128_16x16_32x32_2x2_8x32x1_8x32x1_1x32x1x8_8_1x1_intrawave_v3,851.11,354.37,0.0
gfx942,304,5632,3072,6144,ck,0,0,246.793,a8w8_blockscale_1x128x128_256x128x128x128_16x16_32x32_2x2_8x32x1_8x32x1_1x32x1x8_8_1x1_intrawave_v3,861.45,356.9,0.0
gfx942,304,5760,3072,6144,ck,0,0,255.8113,a8w8_blockscale_1x128x128_256x128x128x128_16x16_32x32_2x2_8x32x1_8x32x1_1x32x1x8_8_1x1_intrawave_v3,849.97,350.47,0.0
gfx942,304,5888,3072,6144,ck,0,0,252.8939,a8w8_blockscale_1x128x128_256x128x128x128_16x16_32x32_2x2_8x32x1_8x32x1_1x32x1x8_8_1x1_intrawave_v3,878.88,360.73,0.0
gfx942,304,6016,3072,6144,ck,0,0,256.5599,a8w8_blockscale_1x128x128_256x128x128x128_16x16_32x32_2x2_8x32x1_8x32x1_1x32x1x8_8_1x1_intrawave_v3,885.16,361.7,0.0
gfx942,304,6144,3072,6144,ck,0,0,259.0825,a8w8_blockscale_1x128x128_256x128x128x128_16x16_32x32_2x2_8x32x1_8x32x1_1x32x1x8_8_1x1_intrawave_v3,895.19,364.25,0.0
gfx942,304,6272,3072,6144,ck,0,0,265.8097,a8w8_blockscale_1x128x128_256x128x128x128_16x16_32x32_2x2_8x32x1_8x32x1_1x32x1x8_8_1x1_intrawave_v3,890.71,360.95,0.0
gfx942,304,6400,3072,6144,ck,0,0,264.7142,a8w8_blockscale_1x128x128_256x128x128x128_16x16_32x32_2x2_8x32x1_8x32x1_1x32x1x8_8_1x1_intrawave_v3,912.65,368.39,0.0
gfx942,304,6528,3072,6144,ck,0,0,297.6898,a8w8_blockscale_1x128x128_256x128x128x128_16x16_32x32_2x2_8x32x1_8x32x1_1x32x1x8_8_1x1_intrawave_v3,827.79,332.86,0.0
gfx942,304,6656,3072,6144,ck,0,0,296.0357,a8w8_blockscale_1x128x128_256x128x128x128_16x16_32x32_2x2_8x32x1_8x32x1_1x32x1x8_8_1x1_intrawave_v3,848.73,340.04,0.0
gfx942,304,6784,3072,6144,ck,0,0,303.0922,a8w8_blockscale_1x128x128_256x128x128x128_16x16_32x32_2x2_8x32x1_8x32x1_1x32x1x8_8_1x1_intrawave_v3,844.92,337.31,0.0
gfx942,304,6912,3072,6144,ck,0,0,300.227,a8w8_blockscale_1x128x128_256x128x128x128_16x16_32x32_2x2_8x32x1_8x32x1_1x32x1x8_8_1x1_intrawave_v3,869.07,345.77,0.0
gfx942,304,7040,3072,6144,ck,0,0,302.5125,a8w8_blockscale_1x128x128_256x128x128x128_16x16_32x32_2x2_8x32x1_8x32x1_1x32x1x8_8_1x1_intrawave_v3,878.48,348.36,0.0
gfx942,304,7168,3072,6144,ck,0,0,302.7833,a8w8_blockscale_1x128x128_256x128x128x128_16x16_32x32_2x2_8x32x1_8x32x1_1x32x1x8_8_1x1_intrawave_v3,893.65,353.24,0.0
gfx942,304,7296,3072,6144,ck,0,0,307.7112,a8w8_blockscale_1x128x128_256x128x128x128_16x16_32x32_2x2_8x32x1_8x32x1_1x32x1x8_8_1x1_intrawave_v3,895.04,352.69,0.0
gfx942,304,7424,3072,6144,ck,0,0,313.9218,a8w8_blockscale_1x128x128_256x128x128x128_16x16_32x32_2x2_8x32x1_8x32x1_1x32x1x8_8_1x1_intrawave_v3,892.73,350.73,0.0
gfx942,304,7552,3072,6144,ck,0,0,315.3009,a8w8_blockscale_1x128x128_256x128x128x128_16x16_32x32_2x2_8x32x1_8x32x1_1x32x1x8_8_1x1_intrawave_v3,904.15,354.18,0.0
gfx942,304,7680,3072,6144,ck,0,0,315.015,a8w8_blockscale_1x128x128_256x128x128x128_16x16_32x32_2x2_8x32x1_8x32x1_1x32x1x8_8_1x1_intrawave_v3,920.31,359.49,0.0
gfx942,304,7808,3072,6144,ck,0,0,325.148,a8w8_blockscale_1x128x128_256x128x128x128_16x16_32x32_2x2_8x32x1_8x32x1_1x32x1x8_8_1x1_intrawave_v3,906.49,353.13,0.0
gfx942,304,7936,3072,6144,ck,0,0,324.2196,a8w8_blockscale_1x128x128_256x128x128x128_16x16_32x32_2x2_8x32x1_8x32x1_1x32x1x8_8_1x1_intrawave_v3,923.98,358.99,0.0
gfx942,304,8064,3072,6144,ck,0,0,332.8522,a8w8_blockscale_1x128x128_256x128x128x128_16x16_32x32_2x2_8x32x1_8x32x1_1x32x1x8_8_1x1_intrawave_v3,914.54,354.41,0.0
gfx942,304,8192,3072,6144,ck,0,0,352.2831,a8w8_blockscale_1x128x128_256x128x128x128_16x16_32x32_2x2_8x32x1_8x32x1_1x32x1x8_8_1x1_intrawave_v3,877.81,339.32,0.0
gfx942,304,8320,3072,6144,ck,0,0,356.19,a8w8_blockscale_1x128x128_256x128x128x128_16x16_32x32_2x2_8x32x1_8x32x1_1x32x1x8_8_1x1_intrawave_v3,881.75,340.02,0.0
gfx942,304,8448,3072,6144,ck,0,0,361.9907,a8w8_blockscale_1x128x128_256x128x128x128_16x16_32x32_2x2_8x32x1_8x32x1_1x32x1x8_8_1x1_intrawave_v3,880.97,338.91,0.0
gfx942,304,8576,3072,6144,ck,0,0,355.6487,a8w8_blockscale_1x128x128_256x128x128x128_16x16_32x32_2x2_8x32x1_8x32x1_1x32x1x8_8_1x1_intrawave_v3,910.26,349.38,0.0
gfx942,304,8704,3072,6144,ck,0,0,361.578,a8w8_blockscale_1x128x128_256x128x128x128_16x16_32x32_2x2_8x32x1_8x32x1_1x32x1x8_8_1x1_intrawave_v3,908.7,348.0,0.0
gfx942,304,8832,3072,6144,ck,0,0,369.065,a8w8_blockscale_1x128x128_256x128x128x128_16x16_32x32_2x2_8x32x1_8x32x1_1x32x1x8_8_1x1_intrawave_v3,903.36,345.2,0.0
gfx942,304,8960,3072,6144,ck,0,0,370.0548,a8w8_blockscale_1x128x128_256x128x128x128_16x16_32x32_2x2_8x32x1_8x32x1_1x32x1x8_8_1x1_intrawave_v3,914.0,348.53,0.0
gfx942,304,9088,3072,6144,ck,0,0,371.0281,a8w8_blockscale_1x128x128_256x128x128x128_16x16_32x32_2x2_8x32x1_8x32x1_1x32x1x8_8_1x1_intrawave_v3,924.62,351.85,0.0
gfx942,304,9216,3072,6144,ck,0,0,376.5416,a8w8_blockscale_1x128x128_256x128x128x128_16x16_32x32_2x2_8x32x1_8x32x1_1x32x1x8_8_1x1_intrawave_v3,923.91,350.88,0.0
gfx942,304,9344,3072,6144,ck,0,0,378.9833,a8w8_blockscale_1x128x128_256x128x128x128_16x16_32x32_2x2_8x32x1_8x32x1_1x32x1x8_8_1x1_intrawave_v3,930.71,352.77,0.0
gfx942,304,9472,3072,6144,ck,0,0,391.5048,a8w8_blockscale_1x128x128_256x128x128x128_16x16_32x32_2x2_8x32x1_8x32x1_1x32x1x8_8_1x1_intrawave_v3,913.29,345.5,0.0
gfx942,304,9600,3072,6144,ck,0,0,412.7032,a8w8_blockscale_1x128x128_256x128x128x128_16x16_32x32_2x2_8x32x1_8x32x1_1x32x1x8_8_1x1_intrawave_v3,878.08,331.57,0.0
gfx942,304,9728,3072,6144,ck,0,0,400.6584,a8w8_blockscale_1x128x128_256x128x128x128_16x16_32x32_2x2_8x32x1_8x32x1_1x32x1x8_8_1x1_intrawave_v3,916.54,345.46,0.0
gfx942,304,9856,3072,6144,ck,0,0,417.387,a8w8_blockscale_1x128x128_256x128x128x128_16x16_32x32_2x2_8x32x1_8x32x1_1x32x1x8_8_1x1_intrawave_v3,891.38,335.38,0.0
gfx942,304,9984,3072,6144,ck,0,0,443.9232,a8w8_blockscale_1x128x128_256x128x128x128_16x16_32x32_2x2_8x32x1_8x32x1_1x32x1x8_8_1x1_intrawave_v3,848.98,318.88,0.0
gfx942,304,10112,3072,6144,ck,0,0,426.4669,a8w8_blockscale_1x128x128_256x128x128x128_16x16_32x32_2x2_8x32x1_8x32x1_1x32x1x8_8_1x1_intrawave_v3,895.06,335.62,0.0
gfx942,304,10240,3072,6144,ck,0,0,423.4021,a8w8_blockscale_1x128x128_256x128x128x128_16x16_32x32_2x2_8x32x1_8x32x1_1x32x1x8_8_1x1_intrawave_v3,912.95,341.76,0.0
gfx942,304,10368,3072,6144,ck,0,0,434.677,a8w8_blockscale_1x128x128_256x128x128x128_16x16_32x32_2x2_8x32x1_8x32x1_1x32x1x8_8_1x1_intrawave_v3,900.39,336.52,0.0
gfx942,304,10496,3072,6144,ck,0,0,428.7945,a8w8_blockscale_1x128x128_256x128x128x128_16x16_32x32_2x2_8x32x1_8x32x1_1x32x1x8_8_1x1_intrawave_v3,924.01,344.8,0.0
gfx942,304,10624,3072,6144,ck,0,0,430.6463,a8w8_blockscale_1x128x128_256x128x128x128_16x16_32x32_2x2_8x32x1_8x32x1_1x32x1x8_8_1x1_intrawave_v3,931.26,346.97,0.0
gfx942,304,10752,3072,6144,ck,0,0,434.5615,a8w8_blockscale_1x128x128_256x128x128x128_16x16_32x32_2x2_8x32x1_8x32x1_1x32x1x8_8_1x1_intrawave_v3,933.99,347.47,0.0
gfx942,304,10880,3072,6144,ck,0,0,436.5745,a8w8_blockscale_1x128x128_256x128x128x128_16x16_32x32_2x2_8x32x1_8x32x1_1x32x1x8_8_1x1_intrawave_v3,940.75,349.47,0.0
gfx942,304,11008,3072,6144,ck,0,0,435.2975,a8w8_blockscale_1x128x128_256x128x128x128_16x16_32x32_2x2_8x32x1_8x32x1_1x32x1x8_8_1x1_intrawave_v3,954.61,354.1,0.0
gfx942,304,11136,3072,6144,ck,0,0,442.7299,a8w8_blockscale_1x128x128_256x128x128x128_16x16_32x32_2x2_8x32x1_8x32x1_1x32x1x8_8_1x1_intrawave_v3,949.5,351.71,0.0
gfx942,304,11264,3072,6144,ck,0,0,452.7091,a8w8_blockscale_1x128x128_256x128x128x128_16x16_32x32_2x2_8x32x1_8x32x1_1x32x1x8_8_1x1_intrawave_v3,939.24,347.43,0.0
gfx942,304,11392,3072,6144,ck,0,0,473.5069,a8w8_blockscale_1x128x128_256x128x128x128_16x16_32x32_2x2_8x32x1_8x32x1_1x32x1x8_8_1x1_intrawave_v3,908.19,335.5,0.0
gfx942,304,11520,3072,6144,ck,0,0,461.4732,a8w8_blockscale_1x128x128_256x128x128x128_16x16_32x32_2x2_8x32x1_8x32x1_1x32x1x8_8_1x1_intrawave_v3,942.34,347.65,0.0
gfx942,304,11648,3072,6144,ck,0,0,479.233,a8w8_blockscale_1x128x128_256x128x128x128_16x16_32x32_2x2_8x32x1_8x32x1_1x32x1x8_8_1x1_intrawave_v3,917.5,338.05,0.0
gfx942,304,11776,3072,6144,ck,0,0,481.3634,a8w8_blockscale_1x128x128_256x128x128x128_16x16_32x32_2x2_8x32x1_8x32x1_1x32x1x8_8_1x1_intrawave_v3,923.48,339.82,0.0
gfx942,304,11904,3072,6144,ck,0,0,481.4114,a8w8_blockscale_1x128x128_256x128x128x128_16x16_32x32_2x2_8x32x1_8x32x1_1x32x1x8_8_1x1_intrawave_v3,933.42,343.06,0.0
gfx942,304,12032,3072,6144,ck,0,0,475.6681,a8w8_blockscale_1x128x128_256x128x128x128_16x16_32x32_2x2_8x32x1_8x32x1_1x32x1x8_8_1x1_intrawave_v3,954.85,350.5,0.0
gfx942,304,12160,3072,6144,ck,0,0,485.615,a8w8_blockscale_1x128x128_256x128x128x128_16x16_32x32_2x2_8x32x1_8x32x1_1x32x1x8_8_1x1_intrawave_v3,945.24,346.56,0.0
gfx942,304,12288,3072,6144,ck,0,0,485.1901,a8w8_blockscale_1x128x128_256x128x128x128_16x16_32x32_2x2_8x32x1_8x32x1_1x32x1x8_8_1x1_intrawave_v3,956.03,350.11,0.0
gfx942,304,12416,3072,6144,ck,0,0,498.5895,a8w8_blockscale_1x128x128_256x128x128x128_16x16_32x32_2x2_8x32x1_8x32x1_1x32x1x8_8_1x1_intrawave_v3,940.03,343.85,0.0
gfx942,304,12544,3072,6144,ck,0,0,500.0308,a8w8_blockscale_1x128x128_256x128x128x128_16x16_32x32_2x2_8x32x1_8x32x1_1x32x1x8_8_1x1_intrawave_v3,946.98,346.01,0.0
gfx942,304,12672,3072,6144,ck,0,0,510.6952,a8w8_blockscale_1x128x128_256x128x128x128_16x16_32x32_2x2_8x32x1_8x32x1_1x32x1x8_8_1x1_intrawave_v3,936.67,341.86,0.0
gfx942,304,12800,3072,6144,ck,0,0,510.0149,a8w8_blockscale_1x128x128_256x128x128x128_16x16_32x32_2x2_8x32x1_8x32x1_1x32x1x8_8_1x1_intrawave_v3,947.39,345.4,0.0
gfx942,304,12928,3072,6144,ck,0,0,529.0693,a8w8_blockscale_1x128x128_256x128x128x128_16x16_32x32_2x2_8x32x1_8x32x1_1x32x1x8_8_1x1_intrawave_v3,922.4,335.94,0.0
gfx942,304,13056,3072,6144,ck,0,0,531.2552,a8w8_blockscale_1x128x128_256x128x128x128_16x16_32x32_2x2_8x32x1_8x32x1_1x32x1x8_8_1x1_intrawave_v3,927.7,337.51,0.0
gfx942,304,13184,3072,6144,ck,0,0,535.8461,a8w8_blockscale_1x128x128_256x128x128x128_16x16_32x32_2x2_8x32x1_8x32x1_1x32x1x8_8_1x1_intrawave_v3,928.77,337.56,0.0
gfx942,304,13312,3072,6144,ck,0,0,530.6259,a8w8_blockscale_1x128x128_256x128x128x128_16x16_32x32_2x2_8x32x1_8x32x1_1x32x1x8_8_1x1_intrawave_v3,947.02,343.84,0.0
gfx942,304,13440,3072,6144,ck,0,0,543.4364,a8w8_blockscale_1x128x128_256x128x128x128_16x16_32x32_2x2_8x32x1_8x32x1_1x32x1x8_8_1x1_intrawave_v3,933.58,338.63,0.0
gfx942,304,13568,3072,6144,ck,0,0,554.2862,a8w8_blockscale_1x128x128_256x128x128x128_16x16_32x32_2x2_8x32x1_8x32x1_1x32x1x8_8_1x1_intrawave_v3,924.03,334.84,0.0
gfx942,304,13696,3072,6144,ck,0,0,549.2008,a8w8_blockscale_1x128x128_256x128x128x128_16x16_32x32_2x2_8x32x1_8x32x1_1x32x1x8_8_1x1_intrawave_v3,941.38,340.81,0.0
gfx942,304,13824,3072,6144,ck,0,0,552.8078,a8w8_blockscale_1x128x128_256x128x128x128_16x16_32x32_2x2_8x32x1_8x32x1_1x32x1x8_8_1x1_intrawave_v3,943.98,341.43,0.0
gfx942,304,13952,3072,6144,ck,0,0,556.1211,a8w8_blockscale_1x128x128_256x128x128x128_16x16_32x32_2x2_8x32x1_8x32x1_1x32x1x8_8_1x1_intrawave_v3,947.04,342.22,0.0
gfx942,304,14080,3072,6144,ck,0,0,554.2661,a8w8_blockscale_1x128x128_256x128x128x128_16x16_32x32_2x2_8x32x1_8x32x1_1x32x1x8_8_1x1_intrawave_v3,958.93,346.2,0.0
gfx942,304,14208,3072,6144,ck,0,0,555.5714,a8w8_blockscale_1x128x128_256x128x128x128_16x16_32x32_2x2_8x32x1_8x32x1_1x32x1x8_8_1x1_intrawave_v3,965.37,348.22,0.0
gfx942,304,14336,3072,6144,ck,0,0,571.4306,a8w8_blockscale_1x128x128_256x128x128x128_16x16_32x32_2x2_8x32x1_8x32x1_1x32x1x8_8_1x1_intrawave_v3,947.04,341.31,0.0
gfx942,304,14464,3072,6144,ck,0,0,578.7275,a8w8_blockscale_1x128x128_256x128x128x128_16x16_32x32_2x2_8x32x1_8x32x1_1x32x1x8_8_1x1_intrawave_v3,943.45,339.72,0.0
gfx942,304,14592,3072,6144,ck,0,0,588.727,a8w8_blockscale_1x128x128_256x128x128x128_16x16_32x32_2x2_8x32x1_8x32x1_1x32x1x8_8_1x1_intrawave_v3,935.63,336.63,0.0
gfx942,304,14720,3072,6144,ck,0,0,591.3726,a8w8_blockscale_1x128x128_256x128x128x128_16x16_32x32_2x2_8x32x1_8x32x1_1x32x1x8_8_1x1_intrawave_v3,939.61,337.78,0.0
gfx942,304,14848,3072,6144,ck,0,0,597.6206,a8w8_blockscale_1x128x128_256x128x128x128_16x16_32x32_2x2_8x32x1_8x32x1_1x32x1x8_8_1x1_intrawave_v3,937.87,336.88,0.0
gfx942,304,14976,3072,6144,ck,0,0,595.8028,a8w8_blockscale_1x128x128_256x128x128x128_16x16_32x32_2x2_8x32x1_8x32x1_1x32x1x8_8_1x1_intrawave_v3,948.85,340.55,0.0
gfx942,304,15104,3072,6144,ck,0,0,606.9859,a8w8_blockscale_1x128x128_256x128x128x128_16x16_32x32_2x2_8x32x1_8x32x1_1x32x1x8_8_1x1_intrawave_v3,939.32,336.87,0.0
gfx942,304,15232,3072,6144,ck,0,0,618.1413,a8w8_blockscale_1x128x128_256x128x128x128_16x16_32x32_2x2_8x32x1_8x32x1_1x32x1x8_8_1x1_intrawave_v3,930.19,333.33,0.0
gfx942,304,15360,3072,6144,ck,0,0,608.5896,a8w8_blockscale_1x128x128_256x128x128x128_16x16_32x32_2x2_8x32x1_8x32x1_1x32x1x8_8_1x1_intrawave_v3,952.73,341.15,0.0
gfx942,304,15488,3072,6144,ck,0,0,630.3562,a8w8_blockscale_1x128x128_256x128x128x128_16x16_32x32_2x2_8x32x1_8x32x1_1x32x1x8_8_1x1_intrawave_v3,927.5,331.86,0.0
gfx942,304,15616,3072,6144,ck,0,0,617.534,a8w8_blockscale_1x128x128_256x128x128x128_16x16_32x32_2x2_8x32x1_8x32x1_1x32x1x8_8_1x1_intrawave_v3,954.58,341.3,0.0
gfx942,304,15744,3072,6144,ck,0,0,629.3032,a8w8_blockscale_1x128x128_256x128x128x128_16x16_32x32_2x2_8x32x1_8x32x1_1x32x1x8_8_1x1_intrawave_v3,944.4,337.42,0.0
gfx942,304,15872,3072,6144,ck,0,0,642.3407,a8w8_blockscale_1x128x128_256x128x128x128_16x16_32x32_2x2_8x32x1_8x32x1_1x32x1x8_8_1x1_intrawave_v3,932.76,333.02,0.0
gfx942,304,16000,3072,6144,ck,0,0,628.3054,a8w8_blockscale_1x128x128_256x128x128x128_16x16_32x32_2x2_8x32x1_8x32x1_1x32x1x8_8_1x1_intrawave_v3,961.28,342.96,0.0
gfx942,304,16128,3072,6144,ck,0,0,632.8436,a8w8_blockscale_1x128x128_256x128x128x128_16x16_32x32_2x2_8x32x1_8x32x1_1x32x1x8_8_1x1_intrawave_v3,962.03,342.98,0.0
gfx942,304,16256,3072,6144,ck,0,0,658.8442,a8w8_blockscale_1x128x128_256x128x128x128_16x16_32x32_2x2_8x32x1_8x32x1_1x32x1x8_8_1x1_intrawave_v3,931.39,331.84,0.0
gfx942,304,16384,3072,6144,ck,0,0,649.8336,a8w8_blockscale_1x128x128_256x128x128x128_16x16_32x32_2x2_8x32x1_8x32x1_1x32x1x8_8_1x1_intrawave_v3,951.74,338.86,0.0
gfx942,304,16512,3072,6144,ck,0,0,664.7514,a8w8_blockscale_1x128x128_256x128x128x128_16x16_32x32_2x2_8x32x1_8x32x1_1x32x1x8_8_1x1_intrawave_v3,937.65,333.62,0.0
gfx942,304,1,4096,2048,ck,8,2,6.9533,a8w8_blockscale_1x128x128_256x16x64x256_16x16_16x16_1x1_16x16x1_16x16x1_1x16x1x16_4_1x1_intrawave_v1,2.41,1207.89,0.0
gfx942,304,2,4096,2048,ck,8,2,8.2156,a8w8_blockscale_1x128x128_256x16x64x256_16x16_16x16_1x1_16x16x1_16x16x1_1x16x1x16_4_1x1_intrawave_v1,4.08,1023.55,0.0
gfx942,304,4,4096,2048,ck,6,3,8.1519,a8w8_blockscale_1x128x128_256x16x64x128_8x16_16x16_1x1_16x16x1_8x32x1_1x16x1x16_4_1x1_intrawave_v1,8.23,1034.06,0.0
gfx942,304,8,4096,2048,ck,8,0,8.4613,a8w8_blockscale_1x128x128_256x16x64x256_16x16_16x16_1x1_16x16x1_16x16x1_1x16x1x16_4_1x1_intrawave_v1,15.86,1001.09,0.0
gfx942,304,16,4096,2048,ck,8,2,8.3749,a8w8_blockscale_1x128x128_256x16x64x256_16x16_16x16_1x1_16x16x1_16x16x1_1x16x1x16_4_1x1_intrawave_v1,32.05,1021.2,0.0
gfx942,304,32,4096,2048,ck,8,0,8.7313,a8w8_blockscale_1x128x128_256x16x64x256_16x16_16x16_1x1_16x16x1_16x16x1_1x16x1x16_4_1x1_intrawave_v1,61.49,998.28,0.0
gfx942,304,48,4096,2048,ck,8,0,8.725,a8w8_blockscale_1x128x128_256x16x64x256_16x16_16x16_1x1_16x16x1_16x16x1_1x16x1x16_4_1x1_intrawave_v1,92.3,1017.78,0.0
gfx942,304,64,4096,2048,ck,8,0,8.8145,a8w8_blockscale_1x128x128_256x16x64x256_16x16_16x16_1x1_16x16x1_16x16x1_1x16x1x16_4_1x1_intrawave_v1,121.82,1026.03,0.0
gfx942,304,80,4096,2048,ck,13,0,11.3748,a8w8_blockscale_1x128x128_256x32x64x256_16x16_16x16_2x1_16x16x1_16x16x1_1x32x1x8_8_2x1_intrawave_v1,118.0,809.49,0.0
gfx942,304,96,4096,2048,ck,13,0,11.3002,a8w8_blockscale_1x128x128_256x32x64x256_16x16_16x16_2x1_16x16x1_16x16x1_1x32x1x8_8_2x1_intrawave_v1,142.53,829.33,0.0
gfx942,304,128,4096,2048,ck,13,0,11.2858,a8w8_blockscale_1x128x128_256x32x64x256_16x16_16x16_2x1_16x16x1_16x16x1_1x32x1x8_8_2x1_intrawave_v1,190.28,859.43,0.0
gfx942,304,144,4096,2048,ck,18,0,11.9845,a8w8_blockscale_1x128x128_256x64x64x256_16x16_32x32_1x1_16x16x1_16x16x1_1x32x1x8_8_1x1_intrawave_v1,201.59,822.99,0.0
gfx942,304,176,4096,2048,ck,18,0,12.0218,a8w8_blockscale_1x128x128_256x64x64x256_16x16_32x32_1x1_16x16x1_16x16x1_1x32x1x8_8_1x1_intrawave_v1,245.62,847.7,0.0
gfx942,304,192,4096,2048,ck,18,0,11.4583,a8w8_blockscale_1x128x128_256x64x64x256_16x16_32x32_1x1_16x16x1_16x16x1_1x32x1x8_8_1x1_intrawave_v1,281.13,903.68,0.0
gfx942,304,208,4096,2048,ck,18,0,12.1923,a8w8_blockscale_1x128x128_256x64x64x256_16x16_32x32_1x1_16x16x1_16x16x1_1x32x1x8_8_1x1_intrawave_v1,286.22,862.72,0.0
gfx942,304,224,4096,2048,ck,18,0,12.2096,a8w8_blockscale_1x128x128_256x64x64x256_16x16_32x32_1x1_16x16x1_16x16x1_1x32x1x8_8_1x1_intrawave_v1,307.8,874.92,0.0
gfx942,304,240,4096,2048,ck,18,0,12.2404,a8w8_blockscale_1x128x128_256x64x64x256_16x16_32x32_1x1_16x16x1_16x16x1_1x32x1x8_8_1x1_intrawave_v1,328.95,886.1,0.0
gfx942,304,256,4096,2048,ck,18,0,11.6597,a8w8_blockscale_1x128x128_256x64x64x256_16x16_32x32_1x1_16x16x1_16x16x1_1x32x1x8_8_1x1_intrawave_v1,368.36,944.28,0.0
gfx942,304,288,4096,2048,ck,12,0,15.1924,a8w8_blockscale_1x128x128_256x32x128x256_16x16_32x32_1x1_16x16x1_16x16x1_1x32x1x8_8_1x1_intrawave_v1,318.04,746.28,0.0
gfx942,304,320,4096,2048,ck,18,0,19.4906,a8w8_blockscale_1x128x128_256x64x64x256_16x16_32x32_1x1_16x16x1_16x16x1_1x32x1x8_8_1x1_intrawave_v1,275.45,598.51,0.0
gfx942,304,352,4096,2048,ck,3,0,19.2524,a8w8_blockscale_1x128x128_256x64x64x128_16x16_32x32_1x1_8x32x1_8x32x1_1x32x1x8_8_1x1_intrawave_v3,306.75,622.94,0.0
gfx942,304,384,4096,2048,ck,18,0,19.2057,a8w8_blockscale_1x128x128_256x64x64x256_16x16_32x32_1x1_16x16x1_16x16x1_1x32x1x8_8_1x1_intrawave_v1,335.44,641.52,0.0
gfx942,304,416,4096,2048,ck,3,0,19.871,a8w8_blockscale_1x128x128_256x64x64x128_16x16_32x32_1x1_8x32x1_8x32x1_1x32x1x8_8_1x1_intrawave_v3,351.23,636.53,0.0
gfx942,304,448,4096,2048,ck,18,0,19.2197,a8w8_blockscale_1x128x128_256x64x64x256_16x16_32x32_1x1_16x16x1_16x16x1_1x32x1x8_8_1x1_intrawave_v1,391.07,675.15,0.0
gfx942,304,480,4096,2048,ck,3,0,20.1837,a8w8_blockscale_1x128x128_256x64x64x128_16x16_32x32_1x1_8x32x1_8x32x1_1x32x1x8_8_1x1_intrawave_v3,398.99,659.14,0.0
gfx942,304,512,4096,2048,ck,18,0,19.5264,a8w8_blockscale_1x128x128_256x64x64x256_16x16_32x32_1x1_16x16x1_16x16x1_1x32x1x8_8_1x1_intrawave_v1,439.91,698.11,0.0
gfx942,304,544,4096,2048,ck,18,0,21.2111,a8w8_blockscale_1x128x128_256x64x64x256_16x16_32x32_1x1_16x16x1_16x16x1_1x32x1x8_8_1x1_intrawave_v1,430.28,658.11,0.0
gfx942,304,576,4096,2048,ck,18,0,21.0706,a8w8_blockscale_1x128x128_256x64x64x256_16x16_32x32_1x1_16x16x1_16x16x1_1x32x1x8_8_1x1_intrawave_v1,458.63,678.05,0.0
gfx942,304,608,4096,2048,ck,3,0,26.355,a8w8_blockscale_1x128x128_256x64x64x128_16x16_32x32_1x1_8x32x1_8x32x1_1x32x1x8_8_1x1_intrawave_v3,387.04,554.53,0.0
gfx942,304,640,4096,2048,ck,3,0,28.08,a8w8_blockscale_1x128x128_256x64x64x128_16x16_32x32_1x1_8x32x1_8x32x1_1x32x1x8_8_1x1_intrawave_v3,382.39,532.13,0.0
gfx942,304,672,4096,2048,ck,3,0,27.418,a8w8_blockscale_1x128x128_256x64x64x128_16x16_32x32_1x1_8x32x1_8x32x1_1x32x1x8_8_1x1_intrawave_v3,411.2,556.93,0.0
gfx942,304,704,4096,2048,ck,0,0,27.7731,a8w8_blockscale_1x128x128_256x128x128x128_16x16_32x32_2x2_8x32x1_8x32x1_1x32x1x8_8_1x1_intrawave_v3,425.27,561.61,0.0
gfx942,304,736,4096,2048,ck,3,0,28.192,a8w8_blockscale_1x128x128_256x64x64x128_16x16_32x32_1x1_8x32x1_8x32x1_1x32x1x8_8_1x1_intrawave_v3,438.0,564.89,0.0
gfx942,304,768,4096,2048,ck,3,0,28.7885,a8w8_blockscale_1x128x128_256x64x64x128_16x16_32x32_1x1_8x32x1_8x32x1_1x32x1x8_8_1x1_intrawave_v3,447.57,564.56,0.0
gfx942,304,800,4096,2048,ck,0,0,28.1123,a8w8_blockscale_1x128x128_256x128x128x128_16x16_32x32_2x2_8x32x1_8x32x1_1x32x1x8_8_1x1_intrawave_v3,477.43,589.8,0.0
gfx942,304,832,4096,2048,ck,0,0,28.0961,a8w8_blockscale_1x128x128_256x128x128x128_16x16_32x32_2x2_8x32x1_8x32x1_1x32x1x8_8_1x1_intrawave_v3,496.82,601.8,0.0
gfx942,304,864,4096,2048,ck,3,0,30.2668,a8w8_blockscale_1x128x128_256x64x64x128_16x16_32x32_1x1_8x32x1_8x32x1_1x32x1x8_8_1x1_intrawave_v3,478.92,569.47,0.0
gfx942,304,896,4096,2048,ck,18,0,30.1366,a8w8_blockscale_1x128x128_256x64x64x256_16x16_32x32_1x1_16x16x1_16x16x1_1x32x1x8_8_1x1_intrawave_v1,498.81,582.8,0.0
gfx942,304,928,4096,2048,ck,0,0,28.3812,a8w8_blockscale_1x128x128_256x128x128x128_16x16_32x32_2x2_8x32x1_8x32x1_1x32x1x8_8_1x1_intrawave_v3,548.58,630.39,0.0
gfx942,304,960,4096,2048,ck,0,0,28.6915,a8w8_blockscale_1x128x128_256x128x128x128_16x16_32x32_2x2_8x32x1_8x32x1_1x32x1x8_8_1x1_intrawave_v3,561.36,635.0,0.0
gfx942,304,992,4096,2048,ck,0,0,30.3831,a8w8_blockscale_1x128x128_256x128x128x128_16x16_32x32_2x2_8x32x1_8x32x1_1x32x1x8_8_1x1_intrawave_v3,547.77,610.43,0.0
gfx942,304,1024,4096,2048,ck,0,0,32.8949,a8w8_blockscale_1x128x128_256x128x128x128_16x16_32x32_2x2_8x32x1_8x32x1_1x32x1x8_8_1x1_intrawave_v3,522.27,573.78,0.0
gfx942,304,1088,4096,2048,ck,0,0,30.4951,a8w8_blockscale_1x128x128_256x128x128x128_16x16_32x32_2x2_8x32x1_8x32x1_1x32x1x8_8_1x1_intrawave_v3,598.58,640.42,0.0
gfx942,304,1152,4096,2048,ck,0,0,32.8288,a8w8_blockscale_1x128x128_256x128x128x128_16x16_32x32_2x2_8x32x1_8x32x1_1x32x1x8_8_1x1_intrawave_v3,588.73,614.86,0.0
gfx942,304,1216,4096,2048,ck,2,0,34.5781,a8w8_blockscale_1x128x128_256x64x128x128_16x16_32x32_1x2_8x32x1_8x32x1_1x32x1x8_8_1x1_intrawave_v3,590.0,602.71,0.0
gfx942,304,1280,4096,2048,ck,0,0,44.2788,a8w8_blockscale_1x128x128_256x128x128x128_16x16_32x32_2x2_8x32x1_8x32x1_1x32x1x8_8_1x1_intrawave_v3,484.99,485.47,0.0
gfx942,304,1344,4096,2048,ck,0,0,42.4402,a8w8_blockscale_1x128x128_256x128x128x128_16x16_32x32_2x2_8x32x1_8x32x1_1x32x1x8_8_1x1_intrawave_v3,531.3,521.94,0.0
gfx942,304,1408,4096,2048,ck,0,0,44.4802,a8w8_blockscale_1x128x128_256x128x128x128_16x16_32x32_2x2_8x32x1_8x32x1_1x32x1x8_8_1x1_intrawave_v3,531.07,512.73,0.0
gfx942,304,1472,4096,2048,ck,0,0,42.8999,a8w8_blockscale_1x128x128_256x128x128x128_16x16_32x32_2x2_8x32x1_8x32x1_1x32x1x8_8_1x1_intrawave_v3,575.67,546.9,0.0
gfx942,304,1536,4096,2048,ck,0,0,46.0229,a8w8_blockscale_1x128x128_256x128x128x128_16x16_32x32_2x2_8x32x1_8x32x1_1x32x1x8_8_1x1_intrawave_v3,559.93,524.03,0.0
gfx942,304,1600,4096,2048,ck,0,0,45.5655,a8w8_blockscale_1x128x128_256x128x128x128_16x16_32x32_2x2_8x32x1_8x32x1_1x32x1x8_8_1x1_intrawave_v3,589.12,543.67,0.0
gfx942,304,1664,4096,2048,ck,0,0,46.4877,a8w8_blockscale_1x128x128_256x128x128x128_16x16_32x32_2x2_8x32x1_8x32x1_1x32x1x8_8_1x1_intrawave_v3,600.53,546.98,0.0
gfx942,304,1728,4096,2048,ck,0,0,46.5556,a8w8_blockscale_1x128x128_256x128x128x128_16x16_32x32_2x2_8x32x1_8x32x1_1x32x1x8_8_1x1_intrawave_v3,622.72,560.26,0.0
gfx942,304,1792,4096,2048,ck,0,0,46.6199,a8w8_blockscale_1x128x128_256x128x128x128_16x16_32x32_2x2_8x32x1_8x32x1_1x32x1x8_8_1x1_intrawave_v3,644.89,573.55,0.0
gfx942,304,1856,4096,2048,ck,0,0,48.9829,a8w8_blockscale_1x128x128_256x128x128x128_16x16_32x32_2x2_8x32x1_8x32x1_1x32x1x8_8_1x1_intrawave_v3,635.7,559.26,0.0
gfx942,304,1920,4096,2048,ck,0,0,50.1231,a8w8_blockscale_1x128x128_256x128x128x128_16x16_32x32_2x2_8x32x1_8x32x1_1x32x1x8_8_1x1_intrawave_v3,642.66,559.61,0.0
gfx942,304,1984,4096,2048,ck,0,0,50.2021,a8w8_blockscale_1x128x128_256x128x128x128_16x16_32x32_2x2_8x32x1_8x32x1_1x32x1x8_8_1x1_intrawave_v3,663.04,571.78,0.0
gfx942,304,2048,4096,2048,ck,0,0,49.2441,a8w8_blockscale_1x128x128_256x128x128x128_16x16_32x32_2x2_8x32x1_8x32x1_1x32x1x8_8_1x1_intrawave_v3,697.74,596.22,0.0
gfx942,304,2112,4096,2048,ck,0,0,50.833,a8w8_blockscale_1x128x128_256x128x128x128_16x16_32x32_2x2_8x32x1_8x32x1_1x32x1x8_8_1x1_intrawave_v3,697.06,590.47,0.0
gfx942,304,2176,4096,2048,ck,0,0,51.7248,a8w8_blockscale_1x128x128_256x128x128x128_16x16_32x32_2x2_8x32x1_8x32x1_1x32x1x8_8_1x1_intrawave_v3,705.8,592.96,0.0
gfx942,304,2240,4096,2048,ck,0,0,51.8375,a8w8_blockscale_1x128x128_256x128x128x128_16x16_32x32_2x2_8x32x1_8x32x1_1x32x1x8_8_1x1_intrawave_v3,724.98,604.32,0.0
gfx942,304,2304,4096,2048,ck,0,0,53.2967,a8w8_blockscale_1x128x128_256x128x128x128_16x16_32x32_2x2_8x32x1_8x32x1_1x32x1x8_8_1x1_intrawave_v3,725.27,600.07,0.0
gfx942,304,2368,4096,2048,ck,0,0,54.7761,a8w8_blockscale_1x128x128_256x128x128x128_16x16_32x32_2x2_8x32x1_8x32x1_1x32x1x8_8_1x1_intrawave_v3,725.29,595.82,0.0
gfx942,304,2432,4096,2048,ck,0,0,56.1802,a8w8_blockscale_1x128x128_256x128x128x128_16x16_32x32_2x2_8x32x1_8x32x1_1x32x1x8_8_1x1_intrawave_v3,726.27,592.6,0.0
gfx942,304,2496,4096,2048,ck,0,0,71.2959,a8w8_blockscale_1x128x128_256x128x128x128_16x16_32x32_2x2_8x32x1_8x32x1_1x32x1x8_8_1x1_intrawave_v3,587.35,476.15,0.0
gfx942,304,2560,4096,2048,ck,0,0,68.7496,a8w8_blockscale_1x128x128_256x128x128x128_16x16_32x32_2x2_8x32x1_8x32x1_1x32x1x8_8_1x1_intrawave_v3,624.73,503.32,0.0
gfx942,304,2624,4096,2048,ck,0,0,69.8843,a8w8_blockscale_1x128x128_256x128x128x128_16x16_32x32_2x2_8x32x1_8x32x1_1x32x1x8_8_1x1_intrawave_v3,629.95,504.52,0.0
gfx942,304,2688,4096,2048,ck,0,0,70.0742,a8w8_blockscale_1x128x128_256x128x128x128_16x16_32x32_2x2_8x32x1_8x32x1_1x32x1x8_8_1x1_intrawave_v3,643.56,512.51,0.0
gfx942,304,2752,4096,2048,ck,0,0,70.265,a8w8_blockscale_1x128x128_256x128x128x128_16x16_32x32_2x2_8x32x1_8x32x1_1x32x1x8_8_1x1_intrawave_v3,657.1,520.45,0.0
gfx942,304,2816,4096,2048,ck,0,0,70.2488,a8w8_blockscale_1x128x128_256x128x128x128_16x16_32x32_2x2_8x32x1_8x32x1_1x32x1x8_8_1x1_intrawave_v3,672.53,529.89,0.0
gfx942,304,2880,4096,2048,ck,0,0,73.0731,a8w8_blockscale_1x128x128_256x128x128x128_16x16_32x32_2x2_8x32x1_8x32x1_1x32x1x8_8_1x1_intrawave_v3,661.23,518.38,0.0
gfx942,304,2944,4096,2048,ck,0,0,70.1906,a8w8_blockscale_1x128x128_256x128x128x128_16x16_32x32_2x2_8x32x1_8x32x1_1x32x1x8_8_1x1_intrawave_v3,703.69,549.01,0.0
gfx942,304,3008,4096,2048,ck,0,0,74.1669,a8w8_blockscale_1x128x128_256x128x128x128_16x16_32x32_2x2_8x32x1_8x32x1_1x32x1x8_8_1x1_intrawave_v3,680.44,528.41,0.0
gfx942,304,3072,4096,2048,ck,0,0,75.0055,a8w8_blockscale_1x128x128_256x128x128x128_16x16_32x32_2x2_8x32x1_8x32x1_1x32x1x8_8_1x1_intrawave_v3,687.14,531.24,0.0
gfx942,304,3136,4096,2048,ck,0,0,76.3471,a8w8_blockscale_1x128x128_256x128x128x128_16x16_32x32_2x2_8x32x1_8x32x1_1x32x1x8_8_1x1_intrawave_v3,689.13,530.49,0.0
gfx942,304,3200,4096,2048,ck,0,0,73.1662,a8w8_blockscale_1x128x128_256x128x128x128_16x16_32x32_2x2_8x32x1_8x32x1_1x32x1x8_8_1x1_intrawave_v3,733.77,562.51,0.0
gfx942,304,3264,4096,2048,ck,0,0,76.4116,a8w8_blockscale_1x128x128_256x128x128x128_16x16_32x32_2x2_8x32x1_8x32x1_1x32x1x8_8_1x1_intrawave_v3,716.66,547.19,0.0
gfx942,304,3328,4096,2048,ck,0,0,78.6403,a8w8_blockscale_1x128x128_256x128x128x128_16x16_32x32_2x2_8x32x1_8x32x1_1x32x1x8_8_1x1_intrawave_v3,710.0,540.02,0.0
gfx942,304,3392,4096,2048,ck,0,0,75.3615,a8w8_blockscale_1x128x128_256x128x128x128_16x16_32x32_2x2_8x32x1_8x32x1_1x32x1x8_8_1x1_intrawave_v3,755.14,572.21,0.0
gfx942,304,3456,4096,2048,ck,0,0,76.7723,a8w8_blockscale_1x128x128_256x128x128x128_16x16_32x32_2x2_8x32x1_8x32x1_1x32x1x8_8_1x1_intrawave_v3,755.25,570.23,0.0
gfx942,304,3520,4096,2048,ck,0,0,78.0315,a8w8_blockscale_1x128x128_256x128x128x128_16x16_32x32_2x2_8x32x1_8x32x1_1x32x1x8_8_1x1_intrawave_v3,756.82,569.43,0.0
gfx942,304,3584,4096,2048,ck,0,0,78.7742,a8w8_blockscale_1x128x128_256x128x128x128_16x16_32x32_2x2_8x32x1_8x32x1_1x32x1x8_8_1x1_intrawave_v3,763.32,572.38,0.0
gfx942,304,3648,4096,2048,ck,0,0,87.449,a8w8_blockscale_1x128x128_256x128x128x128_16x16_32x32_2x2_8x32x1_8x32x1_1x32x1x8_8_1x1_intrawave_v3,699.87,523.09,0.0
gfx942,304,3712,4096,2048,ck,0,0,91.1239,a8w8_blockscale_1x128x128_256x128x128x128_16x16_32x32_2x2_8x32x1_8x32x1_1x32x1x8_8_1x1_intrawave_v3,683.43,509.19,0.0
gfx942,304,3776,4096,2048,ck,0,0,90.9968,a8w8_blockscale_1x128x128_256x128x128x128_16x16_32x32_2x2_8x32x1_8x32x1_1x32x1x8_8_1x1_intrawave_v3,696.19,517.1,0.0
gfx942,304,3840,4096,2048,ck,0,0,90.5183,a8w8_blockscale_1x128x128_256x128x128x128_16x16_32x32_2x2_8x32x1_8x32x1_1x32x1x8_8_1x1_intrawave_v3,711.73,527.08,0.0
gfx942,304,3904,4096,2048,ck,0,0,91.2044,a8w8_blockscale_1x128x128_256x128x128x128_16x16_32x32_2x2_8x32x1_8x32x1_1x32x1x8_8_1x1_intrawave_v3,718.15,530.3,0.0
gfx942,304,3968,4096,2048,ck,0,0,91.9821,a8w8_blockscale_1x128x128_256x128x128x128_16x16_32x32_2x2_8x32x1_8x32x1_1x32x1x8_8_1x1_intrawave_v3,723.75,532.94,0.0
gfx942,304,4032,4096,2048,ck,0,0,91.9725,a8w8_blockscale_1x128x128_256x128x128x128_16x16_32x32_2x2_8x32x1_8x32x1_1x32x1x8_8_1x1_intrawave_v3,735.5,540.12,0.0
gfx942,304,4096,4096,2048,ck,0,0,94.7199,a8w8_blockscale_1x128x128_256x128x128x128_16x16_32x32_2x2_8x32x1_8x32x1_1x32x1x8_8_1x1_intrawave_v3,725.5,531.37,0.0
gfx942,304,4224,4096,2048,ck,0,0,95.8283,a8w8_blockscale_1x128x128_256x128x128x128_16x16_32x32_2x2_8x32x1_8x32x1_1x32x1x8_8_1x1_intrawave_v3,739.52,538.91,0.0
gfx942,304,4352,4096,2048,ck,0,0,94.5916,a8w8_blockscale_1x128x128_256x128x128x128_16x16_32x32_2x2_8x32x1_8x32x1_1x32x1x8_8_1x1_intrawave_v3,771.89,559.81,0.0
gfx942,304,4480,4096,2048,ck,0,0,96.4331,a8w8_blockscale_1x128x128_256x128x128x128_16x16_32x32_2x2_8x32x1_8x32x1_1x32x1x8_8_1x1_intrawave_v3,779.42,562.71,0.0
gfx942,304,4608,4096,2048,ck,0,0,96.3142,a8w8_blockscale_1x128x128_256x128x128x128_16x16_32x32_2x2_8x32x1_8x32x1_1x32x1x8_8_1x1_intrawave_v3,802.68,577.01,0.0
gfx942,304,4736,4096,2048,ck,0,0,97.7984,a8w8_blockscale_1x128x128_256x128x128x128_16x16_32x32_2x2_8x32x1_8x32x1_1x32x1x8_8_1x1_intrawave_v3,812.46,581.66,0.0
gfx942,304,4864,4096,2048,ck,0,0,99.8721,a8w8_blockscale_1x128x128_256x128x128x128_16x16_32x32_2x2_8x32x1_8x32x1_1x32x1x8_8_1x1_intrawave_v3,817.09,582.7,0.0
gfx942,304,4992,4096,2048,ck,0,0,107.8465,a8w8_blockscale_1x128x128_256x128x128x128_16x16_32x32_2x2_8x32x1_8x32x1_1x32x1x8_8_1x1_intrawave_v3,776.58,551.77,0.0
gfx942,304,5120,4096,2048,ck,0,0,112.0749,a8w8_blockscale_1x128x128_256x128x128x128_16x16_32x32_2x2_8x32x1_8x32x1_1x32x1x8_8_1x1_intrawave_v3,766.45,542.65,0.0
gfx942,304,5248,4096,2048,ck,0,0,115.1061,a8w8_blockscale_1x128x128_256x128x128x128_16x16_32x32_2x2_8x32x1_8x32x1_1x32x1x8_8_1x1_intrawave_v3,764.92,539.75,0.0
gfx942,304,5376,4096,2048,ck,0,0,115.0947,a8w8_blockscale_1x128x128_256x128x128x128_16x16_32x32_2x2_8x32x1_8x32x1_1x32x1x8_8_1x1_intrawave_v3,783.65,551.19,0.0
gfx942,304,5504,4096,2048,ck,0,0,119.0899,a8w8_blockscale_1x128x128_256x128x128x128_16x16_32x32_2x2_8x32x1_8x32x1_1x32x1x8_8_1x1_intrawave_v3,775.4,543.7,0.0
gfx942,304,5632,4096,2048,ck,0,0,116.9648,a8w8_blockscale_1x128x128_256x128x128x128_16x16_32x32_2x2_8x32x1_8x32x1_1x32x1x8_8_1x1_intrawave_v3,807.84,564.79,0.0
gfx942,304,5760,4096,2048,ck,0,0,119.9934,a8w8_blockscale_1x128x128_256x128x128x128_16x16_32x32_2x2_8x32x1_8x32x1_1x32x1x8_8_1x1_intrawave_v3,805.35,561.46,0.0
gfx942,304,5888,4096,2048,ck,0,0,119.017,a8w8_blockscale_1x128x128_256x128x128x128_16x16_32x32_2x2_8x32x1_8x32x1_1x32x1x8_8_1x1_intrawave_v3,830.0,577.07,0.0
gfx942,304,6016,4096,2048,ck,0,0,122.039,a8w8_blockscale_1x128x128_256x128x128x128_16x16_32x32_2x2_8x32x1_8x32x1_1x32x1x8_8_1x1_intrawave_v3,827.04,573.53,0.0
gfx942,304,6144,4096,2048,ck,0,0,133.1934,a8w8_blockscale_1x128x128_256x128x128x128_16x16_32x32_2x2_8x32x1_8x32x1_1x32x1x8_8_1x1_intrawave_v3,773.91,535.34,0.0
gfx942,304,6272,4096,2048,ck,0,0,135.3495,a8w8_blockscale_1x128x128_256x128x128x128_16x16_32x32_2x2_8x32x1_8x32x1_1x32x1x8_8_1x1_intrawave_v3,777.44,536.49,0.0
gfx942,304,6400,4096,2048,ck,0,0,135.8436,a8w8_blockscale_1x128x128_256x128x128x128_16x16_32x32_2x2_8x32x1_8x32x1_1x32x1x8_8_1x1_intrawave_v3,790.43,544.19,0.0
gfx942,304,6528,4096,2048,ck,0,0,134.2159,a8w8_blockscale_1x128x128_256x128x128x128_16x16_32x32_2x2_8x32x1_8x32x1_1x32x1x8_8_1x1_intrawave_v3,816.01,560.55,0.0
gfx942,304,6656,4096,2048,ck,0,0,136.2808,a8w8_blockscale_1x128x128_256x128x128x128_16x16_32x32_2x2_8x32x1_8x32x1_1x32x1x8_8_1x1_intrawave_v3,819.4,561.68,0.0
gfx942,304,6784,4096,2048,ck,0,0,139.8751,a8w8_blockscale_1x128x128_256x128x128x128_16x16_32x32_2x2_8x32x1_8x32x1_1x32x1x8_8_1x1_intrawave_v3,813.7,556.62,0.0
gfx942,304,6912,4096,2048,ck,0,0,136.7639,a8w8_blockscale_1x128x128_256x128x128x128_16x16_32x32_2x2_8x32x1_8x32x1_1x32x1x8_8_1x1_intrawave_v3,847.91,578.86,0.0
gfx942,304,7040,4096,2048,ck,0,0,139.7784,a8w8_blockscale_1x128x128_256x128x128x128_16x16_32x32_2x2_8x32x1_8x32x1_1x32x1x8_8_1x1_intrawave_v3,844.99,575.76,0.0
gfx942,304,7168,4096,2048,ck,0,0,143.2374,a8w8_blockscale_1x128x128_256x128x128x128_16x16_32x32_2x2_8x32x1_8x32x1_1x32x1x8_8_1x1_intrawave_v3,839.58,571.0,0.0
gfx942,304,7296,4096,2048,ck,0,0,144.6711,a8w8_blockscale_1x128x128_256x128x128x128_16x16_32x32_2x2_8x32x1_8x32x1_1x32x1x8_8_1x1_intrawave_v3,846.1,574.4,0.0
gfx942,304,7424,4096,2048,ck,0,0,152.7927,a8w8_blockscale_1x128x128_256x128x128x128_16x16_32x32_2x2_8x32x1_8x32x1_1x32x1x8_8_1x1_intrawave_v3,815.18,552.45,0.0
gfx942,304,7552,4096,2048,ck,0,0,153.3006,a8w8_blockscale_1x128x128_256x128x128x128_16x16_32x32_2x2_8x32x1_8x32x1_1x32x1x8_8_1x1_intrawave_v3,826.49,559.17,0.0
gfx942,304,7680,4096,2048,ck,0,0,158.1844,a8w8_blockscale_1x128x128_256x128x128x128_16x16_32x32_2x2_8x32x1_8x32x1_1x32x1x8_8_1x1_intrawave_v3,814.55,550.19,0.0
gfx942,304,7808,4096,2048,ck,0,0,159.7086,a8w8_blockscale_1x128x128_256x128x128x128_16x16_32x32_2x2_8x32x1_8x32x1_1x32x1x8_8_1x1_intrawave_v3,820.22,553.15,0.0
gfx942,304,7936,4096,2048,ck,0,0,156.2588,a8w8_blockscale_1x128x128_256x128x128x128_16x16_32x32_2x2_8x32x1_8x32x1_1x32x1x8_8_1x1_intrawave_v3,852.07,573.75,0.0
gfx942,304,8064,4096,2048,ck,0,0,160.3526,a8w8_blockscale_1x128x128_256x128x128x128_16x16_32x32_2x2_8x32x1_8x32x1_1x32x1x8_8_1x1_intrawave_v3,843.71,567.27,0.0
gfx942,304,8192,4096,2048,ck,0,0,163.9345,a8w8_blockscale_1x128x128_256x128x128x128_16x16_32x32_2x2_8x32x1_8x32x1_1x32x1x8_8_1x1_intrawave_v3,838.38,562.88,0.0
gfx942,304,8320,4096,2048,ck,0,0,163.6248,a8w8_blockscale_1x128x128_256x128x128x128_16x16_32x32_2x2_8x32x1_8x32x1_1x32x1x8_8_1x1_intrawave_v3,853.09,571.95,0.0
gfx942,304,8448,4096,2048,ck,0,0,165.6705,a8w8_blockscale_1x128x128_256x128x128x128_16x16_32x32_2x2_8x32x1_8x32x1_1x32x1x8_8_1x1_intrawave_v3,855.52,572.8,0.0
gfx942,304,8576,4096,2048,ck,0,0,173.4449,a8w8_blockscale_1x128x128_256x128x128x128_16x16_32x32_2x2_8x32x1_8x32x1_1x32x1x8_8_1x1_intrawave_v3,829.55,554.68,0.0
gfx942,304,8704,4096,2048,ck,0,0,176.8896,a8w8_blockscale_1x128x128_256x128x128x128_16x16_32x32_2x2_8x32x1_8x32x1_1x32x1x8_8_1x1_intrawave_v3,825.54,551.29,0.0
gfx942,304,8832,4096,2048,ck,0,0,177.569,a8w8_blockscale_1x128x128_256x128x128x128_16x16_32x32_2x2_8x32x1_8x32x1_1x32x1x8_8_1x1_intrawave_v3,834.47,556.56,0.0
gfx942,304,8960,4096,2048,ck,0,0,175.2639,a8w8_blockscale_1x128x128_256x128x128x128_16x16_32x32_2x2_8x32x1_8x32x1_1x32x1x8_8_1x1_intrawave_v3,857.7,571.36,0.0
gfx942,304,9088,4096,2048,ck,0,0,178.1101,a8w8_blockscale_1x128x128_256x128x128x128_16x16_32x32_2x2_8x32x1_8x32x1_1x32x1x8_8_1x1_intrawave_v3,856.05,569.59,0.0
gfx942,304,9216,4096,2048,ck,0,0,182.6057,a8w8_blockscale_1x128x128_256x128x128x128_16x16_32x32_2x2_8x32x1_8x32x1_1x32x1x8_8_1x1_intrawave_v3,846.74,562.75,0.0
gfx942,304,9344,4096,2048,ck,0,0,182.5377,a8w8_blockscale_1x128x128_256x128x128x128_16x16_32x32_2x2_8x32x1_8x32x1_1x32x1x8_8_1x1_intrawave_v3,858.82,570.14,0.0
gfx942,304,9472,4096,2048,ck,0,0,182.0433,a8w8_blockscale_1x128x128_256x128x128x128_16x16_32x32_2x2_8x32x1_8x32x1_1x32x1x8_8_1x1_intrawave_v3,872.95,578.88,0.0
gfx942,304,9600,4096,2048,ck,0,0,183.1956,a8w8_blockscale_1x128x128_256x128x128x128_16x16_32x32_2x2_8x32x1_8x32x1_1x32x1x8_8_1x1_intrawave_v3,879.18,582.4,0.0
gfx942,304,9728,4096,2048,ck,0,0,185.4447,a8w8_blockscale_1x128x128_256x128x128x128_16x16_32x32_2x2_8x32x1_8x32x1_1x32x1x8_8_1x1_intrawave_v3,880.09,582.4,0.0
gfx942,304,9856,4096,2048,ck,0,0,193.7706,a8w8_blockscale_1x128x128_256x128x128x128_16x16_32x32_2x2_8x32x1_8x32x1_1x32x1x8_8_1x1_intrawave_v3,853.36,564.14,0.0
gfx942,304,9984,4096,2048,ck,0,0,194.6644,a8w8_blockscale_1x128x128_256x128x128x128_16x16_32x32_2x2_8x32x1_8x32x1_1x32x1x8_8_1x1_intrawave_v3,860.47,568.28,0.0
gfx942,304,10112,4096,2048,ck,0,0,196.9147,a8w8_blockscale_1x128x128_256x128x128x128_16x16_32x32_2x2_8x32x1_8x32x1_1x32x1x8_8_1x1_intrawave_v3,861.55,568.45,0.0
gfx942,304,10240,4096,2048,ck,0,0,201.7732,a8w8_blockscale_1x128x128_256x128x128x128_16x16_32x32_2x2_8x32x1_8x32x1_1x32x1x8_8_1x1_intrawave_v3,851.44,561.25,0.0
gfx942,304,10368,4096,2048,ck,0,0,202.8792,a8w8_blockscale_1x128x128_256x128x128x128_16x16_32x32_2x2_8x32x1_8x32x1_1x32x1x8_8_1x1_intrawave_v3,857.39,564.66,0.0
gfx942,304,10496,4096,2048,ck,0,0,201.557,a8w8_blockscale_1x128x128_256x128x128x128_16x16_32x32_2x2_8x32x1_8x32x1_1x32x1x8_8_1x1_intrawave_v3,873.67,574.86,0.0
gfx942,304,10624,4096,2048,ck,0,0,202.252,a8w8_blockscale_1x128x128_256x128x128x128_16x16_32x32_2x2_8x32x1_8x32x1_1x32x1x8_8_1x1_intrawave_v3,881.28,579.37,0.0
gfx942,304,10752,4096,2048,ck,0,0,202.7332,a8w8_blockscale_1x128x128_256x128x128x128_16x16_32x32_2x2_8x32x1_8x32x1_1x32x1x8_8_1x1_intrawave_v3,889.78,584.46,0.0
gfx942,304,10880,4096,2048,ck,0,0,206.1535,a8w8_blockscale_1x128x128_256x128x128x128_16x16_32x32_2x2_8x32x1_8x32x1_1x32x1x8_8_1x1_intrawave_v3,885.44,581.12,0.0
gfx942,304,11008,4096,2048,ck,0,0,212.0883,a8w8_blockscale_1x128x128_256x128x128x128_16x16_32x32_2x2_8x32x1_8x32x1_1x32x1x8_8_1x1_intrawave_v3,870.79,571.04,0.0
gfx942,304,11136,4096,2048,ck,0,0,219.2499,a8w8_blockscale_1x128x128_256x128x128x128_16x16_32x32_2x2_8x32x1_8x32x1_1x32x1x8_8_1x1_intrawave_v3,852.14,558.36,0.0
gfx942,304,11264,4096,2048,ck,0,0,216.8645,a8w8_blockscale_1x128x128_256x128x128x128_16x16_32x32_2x2_8x32x1_8x32x1_1x32x1x8_8_1x1_intrawave_v3,871.41,570.55,0.0
gfx942,304,11392,4096,2048,ck,0,0,223.1431,a8w8_blockscale_1x128x128_256x128x128x128_16x16_32x32_2x2_8x32x1_8x32x1_1x32x1x8_8_1x1_intrawave_v3,856.52,560.37,0.0
gfx942,304,11520,4096,2048,ck,0,0,220.5022,a8w8_blockscale_1x128x128_256x128x128x128_16x16_32x32_2x2_8x32x1_8x32x1_1x32x1x8_8_1x1_intrawave_v3,876.52,573.03,0.0
gfx942,304,11648,4096,2048,ck,0,0,223.6377,a8w8_blockscale_1x128x128_256x128x128x128_16x16_32x32_2x2_8x32x1_8x32x1_1x32x1x8_8_1x1_intrawave_v3,873.83,570.85,0.0
gfx942,304,11776,4096,2048,ck,0,0,223.9282,a8w8_blockscale_1x128x128_256x128x128x128_16x16_32x32_2x2_8x32x1_8x32x1_1x32x1x8_8_1x1_intrawave_v3,882.29,575.97,0.0
gfx942,304,11904,4096,2048,ck,0,0,228.7399,a8w8_blockscale_1x128x128_256x128x128x128_16x16_32x32_2x2_8x32x1_8x32x1_1x32x1x8_8_1x1_intrawave_v3,873.11,569.58,0.0
gfx942,304,12032,4096,2048,ck,0,0,229.9278,a8w8_blockscale_1x128x128_256x128x128x128_16x16_32x32_2x2_8x32x1_8x32x1_1x32x1x8_8_1x1_intrawave_v3,877.94,572.34,0.0
gfx942,304,12160,4096,2048,ck,0,0,227.1935,a8w8_blockscale_1x128x128_256x128x128x128_16x16_32x32_2x2_8x32x1_8x32x1_1x32x1x8_8_1x1_intrawave_v3,897.96,584.99,0.0
gfx942,304,12288,4096,2048,ck,0,0,235.0305,a8w8_blockscale_1x128x128_256x128x128x128_16x16_32x32_2x2_8x32x1_8x32x1_1x32x1x8_8_1x1_intrawave_v3,877.16,571.07,0.0
gfx942,304,12416,4096,2048,ck,0,0,238.8948,a8w8_blockscale_1x128x128_256x128x128x128_16x16_32x32_2x2_8x32x1_8x32x1_1x32x1x8_8_1x1_intrawave_v3,871.96,567.31,0.0
gfx942,304,12544,4096,2048,ck,0,0,236.28,a8w8_blockscale_1x128x128_256x128x128x128_16x16_32x32_2x2_8x32x1_8x32x1_1x32x1x8_8_1x1_intrawave_v3,890.69,579.14,0.0
gfx942,304,12672,4096,2048,ck,0,0,238.4353,a8w8_blockscale_1x128x128_256x128x128x128_16x16_32x32_2x2_8x32x1_8x32x1_1x32x1x8_8_1x1_intrawave_v3,891.65,579.4,0.0
gfx942,304,12800,4096,2048,ck,0,0,244.6115,a8w8_blockscale_1x128x128_256x128x128x128_16x16_32x32_2x2_8x32x1_8x32x1_1x32x1x8_8_1x1_intrawave_v3,877.92,570.13,0.0
gfx942,304,12928,4096,2048,ck,0,0,244.2339,a8w8_blockscale_1x128x128_256x128x128x128_16x16_32x32_2x2_8x32x1_8x32x1_1x32x1x8_8_1x1_intrawave_v3,888.07,576.38,0.0
gfx942,304,13056,4096,2048,ck,0,0,241.8564,a8w8_blockscale_1x128x128_256x128x128x128_16x16_32x32_2x2_8x32x1_8x32x1_1x32x1x8_8_1x1_intrawave_v3,905.68,587.46,0.0
gfx942,304,13184,4096,2048,ck,0,0,244.0478,a8w8_blockscale_1x128x128_256x128x128x128_16x16_32x32_2x2_8x32x1_8x32x1_1x32x1x8_8_1x1_intrawave_v3,906.34,587.56,0.0
gfx942,304,13312,4096,2048,ck,0,0,247.4819,a8w8_blockscale_1x128x128_256x128x128x128_16x16_32x32_2x2_8x32x1_8x32x1_1x32x1x8_8_1x1_intrawave_v3,902.44,584.7,0.0
gfx942,304,13440,4096,2048,ck,0,0,253.8464,a8w8_blockscale_1x128x128_256x128x128x128_16x16_32x32_2x2_8x32x1_8x32x1_1x32x1x8_8_1x1_intrawave_v3,888.28,575.21,0.0
gfx942,304,13568,4096,2048,ck,0,0,256.3125,a8w8_blockscale_1x128x128_256x128x128x128_16x16_32x32_2x2_8x32x1_8x32x1_1x32x1x8_8_1x1_intrawave_v3,888.11,574.79,0.0
gfx942,304,13696,4096,2048,ck,0,0,254.7023,a8w8_blockscale_1x128x128_256x128x128x128_16x16_32x32_2x2_8x32x1_8x32x1_1x32x1x8_8_1x1_intrawave_v3,902.15,583.57,0.0
gfx942,304,13824,4096,2048,ck,0,0,264.2141,a8w8_blockscale_1x128x128_256x128x128x128_16x16_32x32_2x2_8x32x1_8x32x1_1x32x1x8_8_1x1_intrawave_v3,877.8,567.52,0.0
gfx942,304,13952,4096,2048,ck,0,0,260.2663,a8w8_blockscale_1x128x128_256x128x128x128_16x16_32x32_2x2_8x32x1_8x32x1_1x32x1x8_8_1x1_intrawave_v3,899.37,581.16,0.0
gfx942,304,14080,4096,2048,ck,0,0,260.2775,a8w8_blockscale_1x128x128_256x128x128x128_16x16_32x32_2x2_8x32x1_8x32x1_1x32x1x8_8_1x1_intrawave_v3,907.58,586.17,0.0
gfx942,304,14208,4096,2048,ck,0,0,263.2374,a8w8_blockscale_1x128x128_256x128x128x128_16x16_32x32_2x2_8x32x1_8x32x1_1x32x1x8_8_1x1_intrawave_v3,905.54,584.56,0.0
gfx942,304,14336,4096,2048,ck,0,0,263.9213,a8w8_blockscale_1x128x128_256x128x128x128_16x16_32x32_2x2_8x32x1_8x32x1_1x32x1x8_8_1x1_intrawave_v3,911.33,588.01,0.0
gfx942,304,14464,4096,2048,ck,0,0,268.2571,a8w8_blockscale_1x128x128_256x128x128x128_16x16_32x32_2x2_8x32x1_8x32x1_1x32x1x8_8_1x1_intrawave_v3,904.6,583.4,0.0
gfx942,304,14592,4096,2048,ck,0,0,272.1626,a8w8_blockscale_1x128x128_256x128x128x128_16x16_32x32_2x2_8x32x1_8x32x1_1x32x1x8_8_1x1_intrawave_v3,899.51,579.84,0.0
gfx942,304,14720,4096,2048,ck,0,0,269.6011,a8w8_blockscale_1x128x128_256x128x128x128_16x16_32x32_2x2_8x32x1_8x32x1_1x32x1x8_8_1x1_intrawave_v3,916.02,590.21,0.0
gfx942,304,14848,4096,2048,ck,0,0,279.5618,a8w8_blockscale_1x128x128_256x128x128x128_16x16_32x32_2x2_8x32x1_8x32x1_1x32x1x8_8_1x1_intrawave_v3,891.07,573.87,0.0
gfx942,304,14976,4096,2048,ck,0,0,280.0521,a8w8_blockscale_1x128x128_256x128x128x128_16x16_32x32_2x2_8x32x1_8x32x1_1x32x1x8_8_1x1_intrawave_v3,897.17,577.55,0.0
gfx942,304,15104,4096,2048,ck,0,0,281.2903,a8w8_blockscale_1x128x128_256x128x128x128_16x16_32x32_2x2_8x32x1_8x32x1_1x32x1x8_8_1x1_intrawave_v3,900.86,579.66,0.0
gfx942,304,15232,4096,2048,ck,0,0,283.626,a8w8_blockscale_1x128x128_256x128x128x128_16x16_32x32_2x2_8x32x1_8x32x1_1x32x1x8_8_1x1_intrawave_v3,901.01,579.51,0.0
gfx942,304,15360,4096,2048,ck,0,0,282.2942,a8w8_blockscale_1x128x128_256x128x128x128_16x16_32x32_2x2_8x32x1_8x32x1_1x32x1x8_8_1x1_intrawave_v3,912.87,586.89,0.0
gfx942,304,15488,4096,2048,ck,0,0,286.6674,a8w8_blockscale_1x128x128_256x128x128x128_16x16_32x32_2x2_8x32x1_8x32x1_1x32x1x8_8_1x1_intrawave_v3,906.44,582.51,0.0
gfx942,304,15616,4096,2048,ck,0,0,291.7742,a8w8_blockscale_1x128x128_256x128x128x128_16x16_32x32_2x2_8x32x1_8x32x1_1x32x1x8_8_1x1_intrawave_v3,897.93,576.8,0.0
gfx942,304,15744,4096,2048,ck,0,0,287.1733,a8w8_blockscale_1x128x128_256x128x128x128_16x16_32x32_2x2_8x32x1_8x32x1_1x32x1x8_8_1x1_intrawave_v3,919.79,590.61,0.0
gfx942,304,15872,4096,2048,ck,0,0,301.2079,a8w8_blockscale_1x128x128_256x128x128x128_16x16_32x32_2x2_8x32x1_8x32x1_1x32x1x8_8_1x1_intrawave_v3,884.07,567.44,0.0
gfx942,304,16000,4096,2048,ck,0,0,300.4507,a8w8_blockscale_1x128x128_256x128x128x128_16x16_32x32_2x2_8x32x1_8x32x1_1x32x1x8_8_1x1_intrawave_v3,893.44,573.23,0.0
gfx942,304,16128,4096,2048,ck,0,0,294.1734,a8w8_blockscale_1x128x128_256x128x128x128_16x16_32x32_2x2_8x32x1_8x32x1_1x32x1x8_8_1x1_intrawave_v3,919.81,589.92,0.0
gfx942,304,16256,4096,2048,ck,0,0,303.6899,a8w8_blockscale_1x128x128_256x128x128x128_16x16_32x32_2x2_8x32x1_8x32x1_1x32x1x8_8_1x1_intrawave_v3,898.06,575.75,0.0
gfx942,304,16384,4096,2048,ck,0,0,305.2849,a8w8_blockscale_1x128x128_256x128x128x128_16x16_32x32_2x2_8x32x1_8x32x1_1x32x1x8_8_1x1_intrawave_v3,900.4,577.04,0.0
gfx942,304,16512,4096,2048,ck,0,0,306.7808,a8w8_blockscale_1x128x128_256x128x128x128_16x16_32x32_2x2_8x32x1_8x32x1_1x32x1x8_8_1x1_intrawave_v3,903.01,578.5,0.0
gfx942,304,1,6144,256,ck,8,0,3.0403,a8w8_blockscale_1x128x128_256x16x64x256_16x16_16x16_1x1_16x16x1_16x16x1_1x16x1x16_4_1x1_intrawave_v1,1.03,521.46,0.0
gfx942,304,2,6144,256,ck,8,0,3.0108,a8w8_blockscale_1x128x128_256x16x64x256_16x16_16x16_1x1_16x16x1_16x16x1_1x16x1x16_4_1x1_intrawave_v1,2.09,530.74,0.0
gfx942,304,4,6144,256,ck,8,0,3.5625,a8w8_blockscale_1x128x128_256x16x64x256_16x16_16x16_1x1_16x16x1_16x16x1_1x16x1x16_4_1x1_intrawave_v1,3.53,455.59,0.0
gfx942,304,8,6144,256,ck,8,0,3.0758,a8w8_blockscale_1x128x128_256x16x64x256_16x16_16x16_1x1_16x16x1_16x16x1_1x16x1x16_4_1x1_intrawave_v1,8.18,543.99,0.0
gfx942,304,16,6144,256,ck,6,0,3.1518,a8w8_blockscale_1x128x128_256x16x64x128_8x16_16x16_1x1_16x16x1_8x32x1_1x16x1x16_4_1x1_intrawave_v1,15.97,562.72,0.0
gfx942,304,32,6144,256,ck,8,0,3.3471,a8w8_blockscale_1x128x128_256x16x64x256_16x16_16x16_1x1_16x16x1_16x16x1_1x16x1x16_4_1x1_intrawave_v1,30.07,589.85,0.0
gfx942,304,48,6144,256,ck,6,0,3.3991,a8w8_blockscale_1x128x128_256x16x64x128_8x16_16x16_1x1_16x16x1_8x32x1_1x16x1x16_4_1x1_intrawave_v1,44.42,639.87,0.0
gfx942,304,64,6144,256,ck,8,0,3.8124,a8w8_blockscale_1x128x128_256x16x64x256_16x16_16x16_1x1_16x16x1_16x16x1_1x16x1x16_4_1x1_intrawave_v1,52.81,623.15,0.0
gfx942,304,80,6144,256,cktile,1,0,3.9871,a8w8_blockscale_cktile_16x128x256_1x4x1_16x16x64_intrawave_0x1x0_1,63.12,646.18,0.0
gfx942,304,96,6144,256,ck,13,0,4.3825,a8w8_blockscale_1x128x128_256x32x64x256_16x16_16x16_2x1_16x16x1_16x16x1_1x32x1x8_8_2x1_intrawave_v1,68.91,633.68,0.0
gfx942,304,112,6144,256,ck,11,0,3.9743,a8w8_blockscale_1x128x128_256x32x64x128_16x16_16x16_2x1_8x32x1_8x32x1_1x32x1x8_8_2x1_intrawave_v1,88.65,749.26,0.0
gfx942,304,128,6144,256,ck,6,0,3.7879,a8w8_blockscale_1x128x128_256x16x64x128_8x16_16x16_1x1_16x16x1_8x32x1_1x16x1x16_4_1x1_intrawave_v1,106.3,839.12,0.0
gfx942,304,144,6144,256,ck,10,0,4.3137,a8w8_blockscale_1x128x128_256x32x128x128_16x16_32x32_1x1_8x32x1_8x32x1_1x32x1x8_8_1x1_intrawave_v1,105.01,783.36,0.0
gfx942,304,160,6144,256,ck,16,0,4.4635,a8w8_blockscale_1x128x128_256x64x64x128_16x16_32x32_1x1_8x32x1_8x32x1_1x32x1x8_8_1x1_intrawave_v1,112.76,802.04,0.0
gfx942,304,176,6144,256,ck,6,0,4.5009,a8w8_blockscale_1x128x128_256x16x64x128_8x16_16x16_1x1_16x16x1_8x32x1_1x16x1x16_4_1x1_intrawave_v1,123.01,839.97,0.0
gfx942,304,192,6144,256,ck,13,0,4.0313,a8w8_blockscale_1x128x128_256x32x64x256_16x16_16x16_2x1_16x16x1_16x16x1_1x32x1x8_8_2x1_intrawave_v1,149.82,987.6,0.0
gfx942,304,208,6144,256,ck,11,0,5.1621,a8w8_blockscale_1x128x128_256x32x64x128_16x16_16x16_2x1_8x32x1_8x32x1_1x32x1x8_8_2x1_intrawave_v1,126.75,810.14,0.0
gfx942,304,224,6144,256,ck,6,0,4.6986,a8w8_blockscale_1x128x128_256x16x64x128_8x16_16x16_1x1_16x16x1_8x32x1_1x16x1x16_4_1x1_intrawave_v1,149.97,932.77,0.0
gfx942,304,240,6144,256,ck,11,0,5.4867,a8w8_blockscale_1x128x128_256x32x64x128_16x16_16x16_2x1_8x32x1_8x32x1_1x32x1x8_8_2x1_intrawave_v1,137.6,835.37,0.0
gfx942,304,256,6144,256,ck,11,0,4.9512,a8w8_blockscale_1x128x128_256x32x64x128_16x16_16x16_2x1_8x32x1_8x32x1_1x32x1x8_8_2x1_intrawave_v1,162.65,966.26,0.0
gfx942,304,288,6144,256,ck,11,0,5.3401,a8w8_blockscale_1x128x128_256x32x64x128_16x16_16x16_2x1_8x32x1_8x32x1_1x32x1x8_8_2x1_intrawave_v1,169.65,971.06,0.0
gfx942,304,320,6144,256,ck,10,0,6.8548,a8w8_blockscale_1x128x128_256x32x128x128_16x16_32x32_1x1_8x32x1_8x32x1_1x32x1x8_8_1x1_intrawave_v1,146.85,815.04,0.0
gfx942,304,352,6144,256,ck,18,0,6.383,a8w8_blockscale_1x128x128_256x64x64x256_16x16_32x32_1x1_16x16x1_16x16x1_1x32x1x8_8_1x1_intrawave_v1,173.48,938.17,0.0
gfx942,304,384,6144,256,ck,11,0,6.1237,a8w8_blockscale_1x128x128_256x32x64x128_16x16_16x16_2x1_8x32x1_8x32x1_1x32x1x8_8_2x1_intrawave_v1,197.26,1043.45,0.0
gfx942,304,416,6144,256,ck,11,0,7.9009,a8w8_blockscale_1x128x128_256x32x64x128_16x16_16x16_2x1_8x32x1_8x32x1_1x32x1x8_8_2x1_intrawave_v1,165.63,859.54,0.0
gfx942,304,448,6144,256,ck,11,0,7.3589,a8w8_blockscale_1x128x128_256x32x64x128_16x16_16x16_2x1_8x32x1_8x32x1_1x32x1x8_8_2x1_intrawave_v1,191.51,977.4,0.0
gfx942,304,480,6144,256,ck,11,0,7.2831,a8w8_blockscale_1x128x128_256x32x64x128_16x16_16x16_2x1_8x32x1_8x32x1_1x32x1x8_8_2x1_intrawave_v1,207.32,1042.69,0.0
gfx942,304,512,6144,256,ck,16,0,7.8486,a8w8_blockscale_1x128x128_256x64x64x128_16x16_32x32_1x1_8x32x1_8x32x1_1x32x1x8_8_1x1_intrawave_v1,205.21,1018.7,0.0
gfx942,304,544,6144,256,ck,16,0,8.0527,a8w8_blockscale_1x128x128_256x64x64x128_16x16_32x32_1x1_8x32x1_8x32x1_1x32x1x8_8_1x1_intrawave_v1,212.51,1042.73,0.0
gfx942,304,576,6144,256,ck,16,0,8.0717,a8w8_blockscale_1x128x128_256x64x64x128_16x16_32x32_1x1_8x32x1_8x32x1_1x32x1x8_8_1x1_intrawave_v1,224.48,1090.01,0.0
gfx942,304,608,6144,256,ck,11,0,8.456,a8w8_blockscale_1x128x128_256x32x64x128_16x16_16x16_2x1_8x32x1_8x32x1_1x32x1x8_8_2x1_intrawave_v1,226.18,1087.94,0.0
gfx942,304,640,6144,256,ck,11,0,9.0505,a8w8_blockscale_1x128x128_256x32x64x128_16x16_16x16_2x1_8x32x1_8x32x1_1x32x1x8_8_2x1_intrawave_v1,222.45,1060.83,0.0
gfx942,304,672,6144,256,ck,11,0,9.076,a8w8_blockscale_1x128x128_256x32x64x128_16x16_16x16_2x1_8x32x1_8x32x1_1x32x1x8_8_2x1_intrawave_v1,232.91,1102.07,0.0
gfx942,304,704,6144,256,ck,11,0,9.2523,a8w8_blockscale_1x128x128_256x32x64x128_16x16_16x16_2x1_8x32x1_8x32x1_1x32x1x8_8_2x1_intrawave_v1,239.36,1124.46,0.0
gfx942,304,736,6144,256,ck,16,0,9.6234,a8w8_blockscale_1x128x128_256x64x64x128_16x16_32x32_1x1_8x32x1_8x32x1_1x32x1x8_8_1x1_intrawave_v1,240.59,1122.81,0.0
gfx942,304,768,6144,256,ck,16,0,9.7074,a8w8_blockscale_1x128x128_256x64x64x128_16x16_32x32_1x1_8x32x1_8x32x1_1x32x1x8_8_1x1_intrawave_v1,248.87,1154.44,0.0
gfx942,304,800,6144,256,ck,11,0,10.2132,a8w8_blockscale_1x128x128_256x32x64x128_16x16_16x16_2x1_8x32x1_8x32x1_1x32x1x8_8_2x1_intrawave_v1,246.4,1136.57,0.0
gfx942,304,832,6144,256,ck,16,0,10.7539,a8w8_blockscale_1x128x128_256x64x64x128_16x16_32x32_1x1_8x32x1_8x32x1_1x32x1x8_8_1x1_intrawave_v1,243.38,1116.76,0.0
gfx942,304,864,6144,256,ck,11,0,10.9599,a8w8_blockscale_1x128x128_256x32x64x128_16x16_16x16_2x1_8x32x1_8x32x1_1x32x1x8_8_2x1_intrawave_v1,247.99,1132.39,0.0
gfx942,304,896,6144,256,ck,16,0,11.0562,a8w8_blockscale_1x128x128_256x64x64x128_16x16_32x32_1x1_8x32x1_8x32x1_1x32x1x8_8_1x1_intrawave_v1,254.93,1158.83,0.0
gfx942,304,928,6144,256,ck,16,0,11.2193,a8w8_blockscale_1x128x128_256x64x64x128_16x16_32x32_1x1_8x32x1_8x32x1_1x32x1x8_8_1x1_intrawave_v1,260.2,1177.76,0.0
gfx942,304,960,6144,256,ck,16,0,11.2793,a8w8_blockscale_1x128x128_256x64x64x128_16x16_32x32_1x1_8x32x1_8x32x1_1x32x1x8_8_1x1_intrawave_v1,267.74,1207.09,0.0
gfx942,304,992,6144,256,ck,11,0,11.8446,a8w8_blockscale_1x128x128_256x32x64x128_16x16_16x16_2x1_8x32x1_8x32x1_1x32x1x8_8_2x1_intrawave_v1,263.46,1183.37,0.0
gfx942,304,1024,6144,256,ck,11,0,12.251,a8w8_blockscale_1x128x128_256x32x64x128_16x16_16x16_2x1_8x32x1_8x32x1_1x32x1x8_8_2x1_intrawave_v1,262.94,1176.88,0.0
gfx942,304,1088,6144,256,ck,11,0,12.4143,a8w8_blockscale_1x128x128_256x32x64x128_16x16_16x16_2x1_8x32x1_8x32x1_1x32x1x8_8_2x1_intrawave_v1,275.69,1226.06,0.0
gfx942,304,1152,6144,256,ck,16,0,12.7838,a8w8_blockscale_1x128x128_256x64x64x128_16x16_32x32_1x1_8x32x1_8x32x1_1x32x1x8_8_1x1_intrawave_v1,283.47,1253.43,0.0
gfx942,304,1216,6144,256,ck,16,0,12.9768,a8w8_blockscale_1x128x128_256x64x64x128_16x16_32x32_1x1_8x32x1_8x32x1_1x32x1x8_8_1x1_intrawave_v1,294.77,1296.65,0.0
gfx942,304,1280,6144,256,ck,16,0,13.9881,a8w8_blockscale_1x128x128_256x64x64x128_16x16_32x32_1x1_8x32x1_8x32x1_1x32x1x8_8_1x1_intrawave_v1,287.85,1260.3,0.0
gfx942,304,1344,6144,256,ck,16,0,13.9008,a8w8_blockscale_1x128x128_256x64x64x128_16x16_32x32_1x1_8x32x1_8x32x1_1x32x1x8_8_1x1_intrawave_v1,304.14,1325.97,0.0
gfx942,304,1408,6144,256,ck,16,0,14.1757,a8w8_blockscale_1x128x128_256x64x64x128_16x16_32x32_1x1_8x32x1_8x32x1_1x32x1x8_8_1x1_intrawave_v1,312.45,1356.89,0.0
gfx942,304,1472,6144,256,ck,16,0,15.1637,a8w8_blockscale_1x128x128_256x64x64x128_16x16_32x32_1x1_8x32x1_8x32x1_1x32x1x8_8_1x1_intrawave_v1,305.37,1321.42,0.0
gfx942,304,1536,6144,256,ck,16,0,15.1413,a8w8_blockscale_1x128x128_256x64x64x128_16x16_32x32_1x1_8x32x1_8x32x1_1x32x1x8_8_1x1_intrawave_v1,319.12,1376.4,0.0
gfx942,304,1600,6144,256,ck,16,0,15.3879,a8w8_blockscale_1x128x128_256x64x64x128_16x16_32x32_1x1_8x32x1_8x32x1_1x32x1x8_8_1x1_intrawave_v1,327.09,1406.51,0.0
gfx942,304,1664,6144,256,ck,16,0,16.3364,a8w8_blockscale_1x128x128_256x64x64x128_16x16_32x32_1x1_8x32x1_8x32x1_1x32x1x8_8_1x1_intrawave_v1,320.42,1373.99,0.0
gfx942,304,1728,6144,256,ck,16,0,16.5018,a8w8_blockscale_1x128x128_256x64x64x128_16x16_32x32_1x1_8x32x1_8x32x1_1x32x1x8_8_1x1_intrawave_v1,329.41,1408.87,0.0
gfx942,304,1792,6144,256,ck,16,0,16.6192,a8w8_blockscale_1x128x128_256x64x64x128_16x16_32x32_1x1_8x32x1_8x32x1_1x32x1x8_8_1x1_intrawave_v1,339.19,1447.22,0.0
gfx942,304,1856,6144,256,ck,16,0,17.4317,a8w8_blockscale_1x128x128_256x64x64x128_16x16_32x32_1x1_8x32x1_8x32x1_1x32x1x8_8_1x1_intrawave_v1,334.93,1425.82,0.0
gfx942,304,1920,6144,256,ck,16,0,17.6272,a8w8_blockscale_1x128x128_256x64x64x128_16x16_32x32_1x1_8x32x1_8x32x1_1x32x1x8_8_1x1_intrawave_v1,342.64,1455.55,0.0
gfx942,304,1984,6144,256,ck,16,0,17.6126,a8w8_blockscale_1x128x128_256x64x64x128_16x16_32x32_1x1_8x32x1_8x32x1_1x32x1x8_8_1x1_intrawave_v1,354.36,1502.34,0.0
gfx942,304,2048,6144,256,ck,16,0,19.1399,a8w8_blockscale_1x128x128_256x64x64x128_16x16_32x32_1x1_8x32x1_8x32x1_1x32x1x8_8_1x1_intrawave_v1,336.6,1424.41,0.0
gfx942,304,2112,6144,256,ck,16,0,19.2206,a8w8_blockscale_1x128x128_256x64x64x128_16x16_32x32_1x1_8x32x1_8x32x1_1x32x1x8_8_1x1_intrawave_v1,345.66,1460.19,0.0
gfx942,304,2176,6144,256,ck,16,0,18.8403,a8w8_blockscale_1x128x128_256x64x64x128_16x16_32x32_1x1_8x32x1_8x32x1_1x32x1x8_8_1x1_intrawave_v1,363.32,1532.28,0.0
gfx942,304,2240,6144,256,ck,16,0,20.9274,a8w8_blockscale_1x128x128_256x64x64x128_16x16_32x32_1x1_8x32x1_8x32x1_1x32x1x8_8_1x1_intrawave_v1,336.71,1417.83,0.0
gfx942,304,2304,6144,256,ck,16,0,20.5861,a8w8_blockscale_1x128x128_256x64x64x128_16x16_32x32_1x1_8x32x1_8x32x1_1x32x1x8_8_1x1_intrawave_v1,352.07,1480.33,0.0
gfx942,304,2368,6144,256,ck,16,0,20.8071,a8w8_blockscale_1x128x128_256x64x64x128_16x16_32x32_1x1_8x32x1_8x32x1_1x32x1x8_8_1x1_intrawave_v1,358.01,1503.19,0.0
gfx942,304,2432,6144,256,ck,16,0,20.7806,a8w8_blockscale_1x128x128_256x64x64x128_16x16_32x32_1x1_8x32x1_8x32x1_1x32x1x8_8_1x1_intrawave_v1,368.15,1543.74,0.0
gfx942,304,2496,6144,256,ck,16,0,21.7084,a8w8_blockscale_1x128x128_256x64x64x128_16x16_32x32_1x1_8x32x1_8x32x1_1x32x1x8_8_1x1_intrawave_v1,361.69,1514.74,0.0
gfx942,304,2560,6144,256,ck,16,0,21.8681,a8w8_blockscale_1x128x128_256x64x64x128_16x16_32x32_1x1_8x32x1_8x32x1_1x32x1x8_8_1x1_intrawave_v1,368.26,1540.39,0.0
gfx942,304,2624,6144,256,ck,16,0,23.0531,a8w8_blockscale_1x128x128_256x64x64x128_16x16_32x32_1x1_8x32x1_8x32x1_1x32x1x8_8_1x1_intrawave_v1,358.06,1496.04,0.0
gfx942,304,2688,6144,256,ck,16,0,23.3831,a8w8_blockscale_1x128x128_256x64x64x128_16x16_32x32_1x1_8x32x1_8x32x1_1x32x1x8_8_1x1_intrawave_v1,361.62,1509.26,0.0
gfx942,304,2752,6144,256,ck,16,0,22.5824,a8w8_blockscale_1x128x128_256x64x64x128_16x16_32x32_1x1_8x32x1_8x32x1_1x32x1x8_8_1x1_intrawave_v1,383.35,1598.32,0.0
gfx942,304,2816,6144,256,ck,16,0,23.4936,a8w8_blockscale_1x128x128_256x64x64x128_16x16_32x32_1x1_8x32x1_8x32x1_1x32x1x8_8_1x1_intrawave_v1,377.05,1570.5,0.0
gfx942,304,2880,6144,256,ck,16,0,24.7474,a8w8_blockscale_1x128x128_256x64x64x128_16x16_32x32_1x1_8x32x1_8x32x1_1x32x1x8_8_1x1_intrawave_v1,366.09,1523.38,0.0
gfx942,304,2944,6144,256,ck,16,0,23.8468,a8w8_blockscale_1x128x128_256x64x64x128_16x16_32x32_1x1_8x32x1_8x32x1_1x32x1x8_8_1x1_intrawave_v1,388.35,1614.57,0.0
gfx942,304,3008,6144,256,ck,16,0,25.3767,a8w8_blockscale_1x128x128_256x64x64x128_16x16_32x32_1x1_8x32x1_8x32x1_1x32x1x8_8_1x1_intrawave_v1,372.88,1548.87,0.0
gfx942,304,3072,6144,256,ck,16,0,25.1597,a8w8_blockscale_1x128x128_256x64x64x128_16x16_32x32_1x1_8x32x1_8x32x1_1x32x1x8_8_1x1_intrawave_v1,384.09,1594.14,0.0
gfx942,304,3136,6144,256,ck,16,0,27.4861,a8w8_blockscale_1x128x128_256x64x64x128_16x16_32x32_1x1_8x32x1_8x32x1_1x32x1x8_8_1x1_intrawave_v1,358.91,1488.42,0.0
gfx942,304,3200,6144,256,ck,16,0,26.9367,a8w8_blockscale_1x128x128_256x64x64x128_16x16_32x32_1x1_8x32x1_8x32x1_1x32x1x8_8_1x1_intrawave_v1,373.7,1548.58,0.0
gfx942,304,3264,6144,256,ck,16,0,28.4125,a8w8_blockscale_1x128x128_256x64x64x128_16x16_32x32_1x1_8x32x1_8x32x1_1x32x1x8_8_1x1_intrawave_v1,361.38,1496.4,0.0
gfx942,304,3328,6144,256,ck,16,0,27.7498,a8w8_blockscale_1x128x128_256x64x64x128_16x16_32x32_1x1_8x32x1_8x32x1_1x32x1x8_8_1x1_intrawave_v1,377.26,1561.07,0.0
gfx942,304,3392,6144,256,ck,16,0,26.6366,a8w8_blockscale_1x128x128_256x64x64x128_16x16_32x32_1x1_8x32x1_8x32x1_1x32x1x8_8_1x1_intrawave_v1,400.59,1656.45,0.0
gfx942,304,3456,6144,256,ck,16,0,29.4579,a8w8_blockscale_1x128x128_256x64x64x128_16x16_32x32_1x1_8x32x1_8x32x1_1x32x1x8_8_1x1_intrawave_v1,369.06,1525.06,0.0
gfx942,304,3520,6144,256,ck,16,0,29.1548,a8w8_blockscale_1x128x128_256x64x64x128_16x16_32x32_1x1_8x32x1_8x32x1_1x32x1x8_8_1x1_intrawave_v1,379.8,1568.45,0.0
gfx942,304,3584,6144,256,ck,16,0,29.9226,a8w8_blockscale_1x128x128_256x64x64x128_16x16_32x32_1x1_8x32x1_8x32x1_1x32x1x8_8_1x1_intrawave_v1,376.78,1555.03,0.0
gfx942,304,3648,6144,256,ck,16,0,31.8971,a8w8_blockscale_1x128x128_256x64x64x128_16x16_32x32_1x1_8x32x1_8x32x1_1x32x1x8_8_1x1_intrawave_v1,359.77,1483.94,0.0
gfx942,304,3712,6144,256,ck,16,0,30.9266,a8w8_blockscale_1x128x128_256x64x64x128_16x16_32x32_1x1_8x32x1_8x32x1_1x32x1x8_8_1x1_intrawave_v1,377.57,1556.47,0.0
gfx942,304,3776,6144,256,ck,16,0,32.5219,a8w8_blockscale_1x128x128_256x64x64x128_16x16_32x32_1x1_8x32x1_8x32x1_1x32x1x8_8_1x1_intrawave_v1,365.24,1504.8,0.0
gfx942,304,3840,6144,256,ck,16,0,32.2404,a8w8_blockscale_1x128x128_256x64x64x128_16x16_32x32_1x1_8x32x1_8x32x1_1x32x1x8_8_1x1_intrawave_v1,374.67,1542.84,0.0
gfx942,304,3904,6144,256,ck,16,0,33.1958,a8w8_blockscale_1x128x128_256x64x64x128_16x16_32x32_1x1_8x32x1_8x32x1_1x32x1x8_8_1x1_intrawave_v1,369.95,1522.62,0.0
gfx942,304,3968,6144,256,ck,16,0,33.6189,a8w8_blockscale_1x128x128_256x64x64x128_16x16_32x32_1x1_8x32x1_8x32x1_1x32x1x8_8_1x1_intrawave_v1,371.29,1527.34,0.0
gfx942,304,4032,6144,256,ck,16,0,32.4029,a8w8_blockscale_1x128x128_256x64x64x128_16x16_32x32_1x1_8x32x1_8x32x1_1x32x1x8_8_1x1_intrawave_v1,391.43,1609.43,0.0
gfx942,304,4096,6144,256,ck,16,0,32.439,a8w8_blockscale_1x128x128_256x64x64x128_16x16_32x32_1x1_8x32x1_8x32x1_1x32x1x8_8_1x1_intrawave_v1,397.2,1632.39,0.0
gfx942,304,4224,6144,256,ck,16,0,34.9348,a8w8_blockscale_1x128x128_256x64x64x128_16x16_32x32_1x1_8x32x1_8x32x1_1x32x1x8_8_1x1_intrawave_v1,380.35,1561.73,0.0
gfx942,304,4352,6144,256,ck,16,0,36.6622,a8w8_blockscale_1x128x128_256x64x64x128_16x16_32x32_1x1_8x32x1_8x32x1_1x32x1x8_8_1x1_intrawave_v1,373.41,1531.94,0.0
gfx942,304,4480,6144,256,ck,16,0,37.1721,a8w8_blockscale_1x128x128_256x64x64x128_16x16_32x32_1x1_8x32x1_8x32x1_1x32x1x8_8_1x1_intrawave_v1,379.12,1554.12,0.0
gfx942,304,4608,6144,256,ck,16,0,37.7519,a8w8_blockscale_1x128x128_256x64x64x128_16x16_32x32_1x1_8x32x1_8x32x1_1x32x1x8_8_1x1_intrawave_v1,383.97,1572.78,0.0
gfx942,304,4736,6144,256,ck,16,0,39.5365,a8w8_blockscale_1x128x128_256x64x64x128_16x16_32x32_1x1_8x32x1_8x32x1_1x32x1x8_8_1x1_intrawave_v1,376.82,1542.4,0.0
gfx942,304,4864,6144,256,ck,16,0,40.1527,a8w8_blockscale_1x128x128_256x64x64x128_16x16_32x32_1x1_8x32x1_8x32x1_1x32x1x8_8_1x1_intrawave_v1,381.07,1558.72,0.0
gfx942,304,4992,6144,256,ck,16,0,40.3582,a8w8_blockscale_1x128x128_256x64x64x128_16x16_32x32_1x1_8x32x1_8x32x1_1x32x1x8_8_1x1_intrawave_v1,389.1,1590.57,0.0
gfx942,304,5120,6144,256,ck,16,0,42.3562,a8w8_blockscale_1x128x128_256x64x64x128_16x16_32x32_1x1_8x32x1_8x32x1_1x32x1x8_8_1x1_intrawave_v1,380.25,1553.45,0.0
gfx942,304,5248,6144,256,ck,16,0,42.4899,a8w8_blockscale_1x128x128_256x64x64x128_16x16_32x32_1x1_8x32x1_8x32x1_1x32x1x8_8_1x1_intrawave_v1,388.53,1586.35,0.0
gfx942,304,5376,6144,256,ck,16,0,45.1075,a8w8_blockscale_1x128x128_256x64x64x128_16x16_32x32_1x1_8x32x1_8x32x1_1x32x1x8_8_1x1_intrawave_v1,374.91,1529.89,0.0
gfx942,304,5504,6144,256,ck,16,0,44.7131,a8w8_blockscale_1x128x128_256x64x64x128_16x16_32x32_1x1_8x32x1_8x32x1_1x32x1x8_8_1x1_intrawave_v1,387.23,1579.29,0.0
gfx942,304,5632,6144,256,ck,16,0,47.4471,a8w8_blockscale_1x128x128_256x64x64x128_16x16_32x32_1x1_8x32x1_8x32x1_1x32x1x8_8_1x1_intrawave_v1,373.4,1522.13,0.0
gfx942,304,5760,6144,256,ck,16,0,46.9814,a8w8_blockscale_1x128x128_256x64x64x128_16x16_32x32_1x1_8x32x1_8x32x1_1x32x1x8_8_1x1_intrawave_v1,385.67,1571.39,0.0
gfx942,304,5888,6144,256,ck,16,0,48.8487,a8w8_blockscale_1x128x128_256x64x64x128_16x16_32x32_1x1_8x32x1_8x32x1_1x32x1x8_8_1x1_intrawave_v1,379.17,1544.2,0.0
gfx942,304,6016,6144,256,ck,16,0,49.9368,a8w8_blockscale_1x128x128_256x64x64x128_16x16_32x32_1x1_8x32x1_8x32x1_1x32x1x8_8_1x1_intrawave_v1,378.97,1542.7,0.0
gfx942,304,6144,6144,256,ck,16,0,50.9672,a8w8_blockscale_1x128x128_256x64x64x128_16x16_32x32_1x1_8x32x1_8x32x1_1x32x1x8_8_1x1_intrawave_v1,379.21,1543.02,0.0
gfx942,304,6272,6144,256,ck,16,0,51.2692,a8w8_blockscale_1x128x128_256x64x64x128_16x16_32x32_1x1_8x32x1_8x32x1_1x32x1x8_8_1x1_intrawave_v1,384.83,1565.24,0.0
gfx942,304,6400,6144,256,ck,16,0,52.0988,a8w8_blockscale_1x128x128_256x64x64x128_16x16_32x32_1x1_8x32x1_8x32x1_1x32x1x8_8_1x1_intrawave_v1,386.43,1571.14,0.0
gfx942,304,6528,6144,256,ck,16,0,54.7123,a8w8_blockscale_1x128x128_256x64x64x128_16x16_32x32_1x1_8x32x1_8x32x1_1x32x1x8_8_1x1_intrawave_v1,375.33,1525.44,0.0
gfx942,304,6656,6144,256,ck,16,0,54.5711,a8w8_blockscale_1x128x128_256x64x64x128_16x16_32x32_1x1_8x32x1_8x32x1_1x32x1x8_8_1x1_intrawave_v1,383.68,1558.81,0.0
gfx942,304,6784,6144,256,ck,16,0,54.9139,a8w8_blockscale_1x128x128_256x64x64x128_16x16_32x32_1x1_8x32x1_8x32x1_1x32x1x8_8_1x1_intrawave_v1,388.62,1578.31,0.0
gfx942,304,6912,6144,256,ck,16,0,55.3559,a8w8_blockscale_1x128x128_256x64x64x128_16x16_32x32_1x1_8x32x1_8x32x1_1x32x1x8_8_1x1_intrawave_v1,392.79,1594.72,0.0
gfx942,304,7040,6144,256,ck,16,0,56.5422,a8w8_blockscale_1x128x128_256x64x64x128_16x16_32x32_1x1_8x32x1_8x32x1_1x32x1x8_8_1x1_intrawave_v1,391.67,1589.66,0.0
gfx942,304,7168,6144,256,ck,16,0,59.6531,a8w8_blockscale_1x128x128_256x64x64x128_16x16_32x32_1x1_8x32x1_8x32x1_1x32x1x8_8_1x1_intrawave_v1,378.0,1533.67,0.0
gfx942,304,7296,6144,256,ck,16,0,59.0561,a8w8_blockscale_1x128x128_256x64x64x128_16x16_32x32_1x1_8x32x1_8x32x1_1x32x1x8_8_1x1_intrawave_v1,388.63,1576.36,0.0
gfx942,304,7424,6144,256,ck,16,0,60.6328,a8w8_blockscale_1x128x128_256x64x64x128_16x16_32x32_1x1_8x32x1_8x32x1_1x32x1x8_8_1x1_intrawave_v1,385.17,1561.85,0.0
gfx942,304,7552,6144,256,ck,16,0,60.7498,a8w8_blockscale_1x128x128_256x64x64x128_16x16_32x32_1x1_8x32x1_8x32x1_1x32x1x8_8_1x1_intrawave_v1,391.06,1585.28,0.0
gfx942,304,7680,6144,256,ck,16,0,62.9099,a8w8_blockscale_1x128x128_256x64x64x128_16x16_32x32_1x1_8x32x1_8x32x1_1x32x1x8_8_1x1_intrawave_v1,384.03,1556.37,0.0
gfx942,304,7808,6144,256,ck,16,0,62.173,a8w8_blockscale_1x128x128_256x64x64x128_16x16_32x32_1x1_8x32x1_8x32x1_1x32x1x8_8_1x1_intrawave_v1,395.06,1600.64,0.0
gfx942,304,7936,6144,256,ck,16,0,64.2282,a8w8_blockscale_1x128x128_256x64x64x128_16x16_32x32_1x1_8x32x1_8x32x1_1x32x1x8_8_1x1_intrawave_v1,388.68,1574.42,0.0
gfx942,304,8064,6144,256,ck,16,0,65.3674,a8w8_blockscale_1x128x128_256x64x64x128_16x16_32x32_1x1_8x32x1_8x32x1_1x32x1x8_8_1x1_intrawave_v1,388.07,1571.54,0.0
gfx942,304,8192,6144,256,ck,16,0,66.9198,a8w8_blockscale_1x128x128_256x64x64x128_16x16_32x32_1x1_8x32x1_8x32x1_1x32x1x8_8_1x1_intrawave_v1,385.08,1559.08,0.0
gfx942,304,8320,6144,256,ck,16,0,67.0767,a8w8_blockscale_1x128x128_256x64x64x128_16x16_32x32_1x1_8x32x1_8x32x1_1x32x1x8_8_1x1_intrawave_v1,390.19,1579.37,0.0
gfx942,304,8448,6144,256,ck,16,0,68.5218,a8w8_blockscale_1x128x128_256x64x64x128_16x16_32x32_1x1_8x32x1_8x32x1_1x32x1x8_8_1x1_intrawave_v1,387.83,1569.49,0.0
gfx942,304,8576,6144,256,ck,16,0,69.1395,a8w8_blockscale_1x128x128_256x64x64x128_16x16_32x32_1x1_8x32x1_8x32x1_1x32x1x8_8_1x1_intrawave_v1,390.19,1578.7,0.0
gfx942,304,8704,6144,256,ck,16,0,72.3992,a8w8_blockscale_1x128x128_256x64x64x128_16x16_32x32_1x1_8x32x1_8x32x1_1x32x1x8_8_1x1_intrawave_v1,378.19,1529.79,0.0
gfx942,304,8832,6144,256,ck,16,0,70.788,a8w8_blockscale_1x128x128_256x64x64x128_16x16_32x32_1x1_8x32x1_8x32x1_1x32x1x8_8_1x1_intrawave_v1,392.48,1587.3,0.0
gfx942,304,8960,6144,256,ck,16,0,72.6107,a8w8_blockscale_1x128x128_256x64x64x128_16x16_32x32_1x1_8x32x1_8x32x1_1x32x1x8_8_1x1_intrawave_v1,388.18,1569.56,0.0
gfx942,304,9088,6144,256,ck,16,0,75.9432,a8w8_blockscale_1x128x128_256x64x64x128_16x16_32x32_1x1_8x32x1_8x32x1_1x32x1x8_8_1x1_intrawave_v1,376.44,1521.83,0.0
gfx942,304,9216,6144,256,ck,16,0,74.0812,a8w8_blockscale_1x128x128_256x64x64x128_16x16_32x32_1x1_8x32x1_8x32x1_1x32x1x8_8_1x1_intrawave_v1,391.34,1581.76,0.0
gfx942,304,9344,6144,256,ck,16,0,74.7627,a8w8_blockscale_1x128x128_256x64x64x128_16x16_32x32_1x1_8x32x1_8x32x1_1x32x1x8_8_1x1_intrawave_v1,393.16,1588.81,0.0
gfx942,304,9472,6144,256,ck,16,0,76.4345,a8w8_blockscale_1x128x128_256x64x64x128_16x16_32x32_1x1_8x32x1_8x32x1_1x32x1x8_8_1x1_intrawave_v1,389.83,1575.07,0.0
gfx942,304,9600,6144,256,ck,16,0,76.8953,a8w8_blockscale_1x128x128_256x64x64x128_16x16_32x32_1x1_8x32x1_8x32x1_1x32x1x8_8_1x1_intrawave_v1,392.73,1586.51,0.0
gfx942,304,9728,6144,256,ck,16,0,77.0299,a8w8_blockscale_1x128x128_256x64x64x128_16x16_32x32_1x1_8x32x1_8x32x1_1x32x1x8_8_1x1_intrawave_v1,397.27,1604.58,0.0
gfx942,304,9856,6144,256,ck,16,0,78.8293,a8w8_blockscale_1x128x128_256x64x64x128_16x16_32x32_1x1_8x32x1_8x32x1_1x32x1x8_8_1x1_intrawave_v1,393.31,1588.32,0.0
gfx942,304,9984,6144,256,ck,16,0,80.521,a8w8_blockscale_1x128x128_256x64x64x128_16x16_32x32_1x1_8x32x1_8x32x1_1x32x1x8_8_1x1_intrawave_v1,390.05,1574.9,0.0
gfx942,304,10112,6144,256,ck,16,0,80.3013,a8w8_blockscale_1x128x128_256x64x64x128_16x16_32x32_1x1_8x32x1_8x32x1_1x32x1x8_8_1x1_intrawave_v1,396.13,1599.2,0.0
gfx942,304,10240,6144,256,ck,16,0,81.3519,a8w8_blockscale_1x128x128_256x64x64x128_16x16_32x32_1x1_8x32x1_8x32x1_1x32x1x8_8_1x1_intrawave_v1,395.96,1598.28,0.0
gfx942,304,10368,6144,256,ck,16,0,81.9323,a8w8_blockscale_1x128x128_256x64x64x128_16x16_32x32_1x1_8x32x1_8x32x1_1x32x1x8_8_1x1_intrawave_v1,398.07,1606.56,0.0
gfx942,304,10496,6144,256,ck,16,0,83.4663,a8w8_blockscale_1x128x128_256x64x64x128_16x16_32x32_1x1_8x32x1_8x32x1_1x32x1x8_8_1x1_intrawave_v1,395.58,1596.27,0.0
gfx942,304,10624,6144,256,ck,16,0,84.7861,a8w8_blockscale_1x128x128_256x64x64x128_16x16_32x32_1x1_8x32x1_8x32x1_1x32x1x8_8_1x1_intrawave_v1,394.17,1590.36,0.0
gfx942,304,10752,6144,256,ck,16,0,87.3793,a8w8_blockscale_1x128x128_256x64x64x128_16x16_32x32_1x1_8x32x1_8x32x1_1x32x1x8_8_1x1_intrawave_v1,387.08,1561.54,0.0
gfx942,304,10880,6144,256,ck,16,0,88.4444,a8w8_blockscale_1x128x128_256x64x64x128_16x16_32x32_1x1_8x32x1_8x32x1_1x32x1x8_8_1x1_intrawave_v1,386.97,1560.89,0.0
gfx942,304,11008,6144,256,ck,16,0,88.1047,a8w8_blockscale_1x128x128_256x64x64x128_16x16_32x32_1x1_8x32x1_8x32x1_1x32x1x8_8_1x1_intrawave_v1,393.03,1585.13,0.0
gfx942,304,11136,6144,256,ck,16,0,91.156,a8w8_blockscale_1x128x128_256x64x64x128_16x16_32x32_1x1_8x32x1_8x32x1_1x32x1x8_8_1x1_intrawave_v1,384.3,1549.68,0.0
gfx942,304,11264,6144,256,ck,16,0,89.1755,a8w8_blockscale_1x128x128_256x64x64x128_16x16_32x32_1x1_8x32x1_8x32x1_1x32x1x8_8_1x1_intrawave_v1,397.35,1602.1,0.0
gfx942,304,11392,6144,256,ck,16,0,90.5644,a8w8_blockscale_1x128x128_256x64x64x128_16x16_32x32_1x1_8x32x1_8x32x1_1x32x1x8_8_1x1_intrawave_v1,395.7,1595.26,0.0
gfx942,304,11520,6144,256,ck,16,0,94.5314,a8w8_blockscale_1x128x128_256x64x64x128_16x16_32x32_1x1_8x32x1_8x32x1_1x32x1x8_8_1x1_intrawave_v1,383.35,1545.3,0.0
gfx942,304,11648,6144,256,ck,16,0,93.9141,a8w8_blockscale_1x128x128_256x64x64x128_16x16_32x32_1x1_8x32x1_8x32x1_1x32x1x8_8_1x1_intrawave_v1,390.16,1572.56,0.0
gfx942,304,11776,6144,256,ck,16,0,93.3693,a8w8_blockscale_1x128x128_256x64x64x128_16x16_32x32_1x1_8x32x1_8x32x1_1x32x1x8_8_1x1_intrawave_v1,396.75,1598.93,0.0
gfx942,304,11904,6144,256,ck,16,0,94.7668,a8w8_blockscale_1x128x128_256x64x64x128_16x16_32x32_1x1_8x32x1_8x32x1_1x32x1x8_8_1x1_intrawave_v1,395.15,1592.29,0.0
gfx942,304,12032,6144,256,ck,16,0,99.3597,a8w8_blockscale_1x128x128_256x64x64x128_16x16_32x32_1x1_8x32x1_8x32x1_1x32x1x8_8_1x1_intrawave_v1,380.93,1534.85,0.0
gfx942,304,12160,6144,256,ck,16,0,97.6795,a8w8_blockscale_1x128x128_256x64x64x128_16x16_32x32_1x1_8x32x1_8x32x1_1x32x1x8_8_1x1_intrawave_v1,391.61,1577.69,0.0
gfx942,304,12288,6144,256,ck,16,0,96.4757,a8w8_blockscale_1x128x128_256x64x64x128_16x16_32x32_1x1_8x32x1_8x32x1_1x32x1x8_8_1x1_intrawave_v1,400.67,1614.02,0.0
gfx942,304,12416,6144,256,ck,16,0,99.135,a8w8_blockscale_1x128x128_256x64x64x128_16x16_32x32_1x1_8x32x1_8x32x1_1x32x1x8_8_1x1_intrawave_v1,393.98,1586.92,0.0
gfx942,304,12544,6144,256,ck,16,0,98.8456,a8w8_blockscale_1x128x128_256x64x64x128_16x16_32x32_1x1_8x32x1_8x32x1_1x32x1x8_8_1x1_intrawave_v1,399.21,1607.81,0.0
gfx942,304,12672,6144,256,ck,16,0,99.9186,a8w8_blockscale_1x128x128_256x64x64x128_16x16_32x32_1x1_8x32x1_8x32x1_1x32x1x8_8_1x1_intrawave_v1,398.95,1606.61,0.0
gfx942,304,12800,6144,256,ck,16,0,103.5537,a8w8_blockscale_1x128x128_256x64x64x128_16x16_32x32_1x1_8x32x1_8x32x1_1x32x1x8_8_1x1_intrawave_v1,388.84,1565.72,0.0
gfx942,304,12928,6144,256,ck,16,0,103.5639,a8w8_blockscale_1x128x128_256x64x64x128_16x16_32x32_1x1_8x32x1_8x32x1_1x32x1x8_8_1x1_intrawave_v1,392.68,1581.07,0.0
gfx942,304,13056,6144,256,ck,16,0,104.4524,a8w8_blockscale_1x128x128_256x64x64x128_16x16_32x32_1x1_8x32x1_8x32x1_1x32x1x8_8_1x1_intrawave_v1,393.2,1582.99,0.0
gfx942,304,13184,6144,256,ck,16,0,103.5685,a8w8_blockscale_1x128x128_256x64x64x128_16x16_32x32_1x1_8x32x1_8x32x1_1x32x1x8_8_1x1_intrawave_v1,400.44,1612.01,0.0
gfx942,304,13312,6144,256,ck,16,0,105.8399,a8w8_blockscale_1x128x128_256x64x64x128_16x16_32x32_1x1_8x32x1_8x32x1_1x32x1x8_8_1x1_intrawave_v1,395.65,1592.58,0.0
gfx942,304,13440,6144,256,ck,16,0,105.7,a8w8_blockscale_1x128x128_256x64x64x128_16x16_32x32_1x1_8x32x1_8x32x1_1x32x1x8_8_1x1_intrawave_v1,399.99,1609.88,0.0
gfx942,304,13568,6144,256,ck,16,0,106.5711,a8w8_blockscale_1x128x128_256x64x64x128_16x16_32x32_1x1_8x32x1_8x32x1_1x32x1x8_8_1x1_intrawave_v1,400.5,1611.79,0.0
gfx942,304,13696,6144,256,ck,16,0,108.9656,a8w8_blockscale_1x128x128_256x64x64x128_16x16_32x32_1x1_8x32x1_8x32x1_1x32x1x8_8_1x1_intrawave_v1,395.39,1591.1,0.0
gfx942,304,13824,6144,256,ck,16,0,107.838,a8w8_blockscale_1x128x128_256x64x64x128_16x16_32x32_1x1_8x32x1_8x32x1_1x32x1x8_8_1x1_intrawave_v1,403.26,1622.63,0.0
gfx942,304,13952,6144,256,ck,16,0,110.8245,a8w8_blockscale_1x128x128_256x64x64x128_16x16_32x32_1x1_8x32x1_8x32x1_1x32x1x8_8_1x1_intrawave_v1,396.02,1593.39,0.0
gfx942,304,14080,6144,256,ck,16,0,111.2216,a8w8_blockscale_1x128x128_256x64x64x128_16x16_32x32_1x1_8x32x1_8x32x1_1x32x1x8_8_1x1_intrawave_v1,398.23,1602.14,0.0
gfx942,304,14208,6144,256,ck,16,0,110.3949,a8w8_blockscale_1x128x128_256x64x64x128_16x16_32x32_1x1_8x32x1_8x32x1_1x32x1x8_8_1x1_intrawave_v1,404.86,1628.68,0.0
gfx942,304,14336,6144,256,ck,16,0,113.2748,a8w8_blockscale_1x128x128_256x64x64x128_16x16_32x32_1x1_8x32x1_8x32x1_1x32x1x8_8_1x1_intrawave_v1,398.12,1601.45,0.0
gfx942,304,14464,6144,256,ck,16,0,113.7574,a8w8_blockscale_1x128x128_256x64x64x128_16x16_32x32_1x1_8x32x1_8x32x1_1x32x1x8_8_1x1_intrawave_v1,399.97,1608.77,0.0
gfx942,304,14592,6144,256,ck,16,0,114.9394,a8w8_blockscale_1x128x128_256x64x64x128_16x16_32x32_1x1_8x32x1_8x32x1_1x32x1x8_8_1x1_intrawave_v1,399.36,1606.19,0.0
gfx942,304,14720,6144,256,ck,16,0,117.7375,a8w8_blockscale_1x128x128_256x64x64x128_16x16_32x32_1x1_8x32x1_8x32x1_1x32x1x8_8_1x1_intrawave_v1,393.29,1581.66,0.0
gfx942,304,14848,6144,256,ck,16,0,118.5198,a8w8_blockscale_1x128x128_256x64x64x128_16x16_32x32_1x1_8x32x1_8x32x1_1x32x1x8_8_1x1_intrawave_v1,394.09,1584.77,0.0
gfx942,304,14976,6144,256,ck,16,0,118.2894,a8w8_blockscale_1x128x128_256x64x64x128_16x16_32x32_1x1_8x32x1_8x32x1_1x32x1x8_8_1x1_intrawave_v1,398.26,1601.43,0.0
gfx942,304,15104,6144,256,ck,16,0,116.0431,a8w8_blockscale_1x128x128_256x64x64x128_16x16_32x32_1x1_8x32x1_8x32x1_1x32x1x8_8_1x1_intrawave_v1,409.44,1646.26,0.0
gfx942,304,15232,6144,256,ck,16,0,119.2848,a8w8_blockscale_1x128x128_256x64x64x128_16x16_32x32_1x1_8x32x1_8x32x1_1x32x1x8_8_1x1_intrawave_v1,401.69,1614.98,0.0
gfx942,304,15360,6144,256,ck,16,0,121.2806,a8w8_blockscale_1x128x128_256x64x64x128_16x16_32x32_1x1_8x32x1_8x32x1_1x32x1x8_8_1x1_intrawave_v1,398.4,1601.65,0.0
gfx942,304,15488,6144,256,ck,16,0,122.0511,a8w8_blockscale_1x128x128_256x64x64x128_16x16_32x32_1x1_8x32x1_8x32x1_1x32x1x8_8_1x1_intrawave_v1,399.19,1604.69,0.0
gfx942,304,15616,6144,256,ck,16,0,121.9193,a8w8_blockscale_1x128x128_256x64x64x128_16x16_32x32_1x1_8x32x1_8x32x1_1x32x1x8_8_1x1_intrawave_v1,402.92,1619.6,0.0
gfx942,304,15744,6144,256,ck,16,0,125.678,a8w8_blockscale_1x128x128_256x64x64x128_16x16_32x32_1x1_8x32x1_8x32x1_1x32x1x8_8_1x1_intrawave_v1,394.07,1583.93,0.0
gfx942,304,15872,6144,256,ck,16,0,124.9859,a8w8_blockscale_1x128x128_256x64x64x128_16x16_32x32_1x1_8x32x1_8x32x1_1x32x1x8_8_1x1_intrawave_v1,399.48,1605.55,0.0
gfx942,304,16000,6144,256,ck,16,0,125.5306,a8w8_blockscale_1x128x128_256x64x64x128_16x16_32x32_1x1_8x32x1_8x32x1_1x32x1x8_8_1x1_intrawave_v1,400.95,1611.37,0.0
gfx942,304,16128,6144,256,ck,16,0,127.8252,a8w8_blockscale_1x128x128_256x64x64x128_16x16_32x32_1x1_8x32x1_8x32x1_1x32x1x8_8_1x1_intrawave_v1,396.9,1595.01,0.0
gfx942,304,16256,6144,256,ck,16,0,127.1014,a8w8_blockscale_1x128x128_256x64x64x128_16x16_32x32_1x1_8x32x1_8x32x1_1x32x1x8_8_1x1_intrawave_v1,402.33,1616.73,0.0
gfx942,304,16384,6144,256,ck,16,0,128.422,a8w8_blockscale_1x128x128_256x64x64x128_16x16_32x32_1x1_8x32x1_8x32x1_1x32x1x8_8_1x1_intrawave_v1,401.33,1612.6,0.0
gfx942,304,16512,6144,256,ck,16,0,129.3881,a8w8_blockscale_1x128x128_256x64x64x128_16x16_32x32_1x1_8x32x1_8x32x1_1x32x1x8_8_1x1_intrawave_v1,401.45,1612.97,0.0
gfx942,304,1,6144,1536,ck,8,0,7.3828,a8w8_blockscale_1x128x128_256x16x64x256_16x16_16x16_1x1_16x16x1_16x16x1_1x16x1x16_4_1x1_intrawave_v1,2.56,1280.14,0.0
gfx942,304,2,6144,1536,ck,8,0,7.2869,a8w8_blockscale_1x128x128_256x16x64x256_16x16_16x16_1x1_16x16x1_16x16x1_1x16x1x16_4_1x1_intrawave_v1,5.18,1298.88,0.0
gfx942,304,4,6144,1536,ck,8,0,7.5384,a8w8_blockscale_1x128x128_256x16x64x256_16x16_16x16_1x1_16x16x1_16x16x1_1x16x1x16_4_1x1_intrawave_v1,10.02,1259.22,0.0
gfx942,304,8,6144,1536,ck,8,0,7.4414,a8w8_blockscale_1x128x128_256x16x64x256_16x16_16x16_1x1_16x16x1_16x16x1_1x16x1x16_4_1x1_intrawave_v1,20.29,1283.06,0.0
gfx942,304,16,6144,1536,ck,8,0,7.3719,a8w8_blockscale_1x128x128_256x16x64x256_16x16_16x16_1x1_16x16x1_16x16x1_1x16x1x16_4_1x1_intrawave_v1,40.97,1310.16,0.0
gfx942,304,32,6144,1536,ck,8,0,7.5019,a8w8_blockscale_1x128x128_256x16x64x256_16x16_16x16_1x1_16x16x1_16x16x1_1x16x1x16_4_1x1_intrawave_v1,80.51,1316.94,0.0
gfx942,304,48,6144,1536,ck,8,0,7.5468,a8w8_blockscale_1x128x128_256x16x64x256_16x16_16x16_1x1_16x16x1_16x16x1_1x16x1x16_4_1x1_intrawave_v1,120.05,1338.41,0.0
gfx942,304,64,6144,1536,ck,13,0,9.1028,a8w8_blockscale_1x128x128_256x32x64x256_16x16_16x16_2x1_16x16x1_16x16x1_1x32x1x8_8_2x1_intrawave_v1,132.7,1133.93,0.0
gfx942,304,80,6144,1536,ck,13,0,9.2667,a8w8_blockscale_1x128x128_256x32x64x256_16x16_16x16_2x1_16x16x1_16x16x1_1x32x1x8_8_2x1_intrawave_v1,162.94,1137.74,0.0
gfx942,304,96,6144,1536,ck,13,0,9.1262,a8w8_blockscale_1x128x128_256x32x64x256_16x16_16x16_2x1_16x16x1_16x16x1_1x32x1x8_8_2x1_intrawave_v1,198.54,1179.49,0.0
gfx942,304,112,6144,1536,ck,18,0,10.3437,a8w8_blockscale_1x128x128_256x64x64x256_16x16_32x32_1x1_16x16x1_16x16x1_1x32x1x8_8_1x1_intrawave_v1,204.37,1062.04,0.0
gfx942,304,128,6144,1536,ck,18,0,9.9208,a8w8_blockscale_1x128x128_256x64x64x256_16x16_32x32_1x1_16x16x1_16x16x1_1x32x1x8_8_1x1_intrawave_v1,243.52,1129.61,0.0
gfx942,304,144,6144,1536,ck,18,0,10.4436,a8w8_blockscale_1x128x128_256x64x64x256_16x16_32x32_1x1_16x16x1_16x16x1_1x32x1x8_8_1x1_intrawave_v1,260.25,1094.24,0.0
gfx942,304,160,6144,1536,ck,18,0,10.4211,a8w8_blockscale_1x128x128_256x64x64x256_16x16_32x32_1x1_16x16x1_16x16x1_1x32x1x8_8_1x1_intrawave_v1,289.79,1117.83,0.0
gfx942,304,176,6144,1536,ck,18,0,10.7264,a8w8_blockscale_1x128x128_256x64x64x256_16x16_32x32_1x1_16x16x1_16x16x1_1x32x1x8_8_1x1_intrawave_v1,309.69,1106.63,0.0
gfx942,304,192,6144,1536,ck,18,0,10.2638,a8w8_blockscale_1x128x128_256x64x64x256_16x16_32x32_1x1_16x16x1_16x16x1_1x32x1x8_8_1x1_intrawave_v1,353.07,1178.06,0.0
gfx942,304,208,6144,1536,ck,3,0,14.5344,a8w8_blockscale_1x128x128_256x64x64x128_16x16_32x32_1x1_8x32x1_8x32x1_1x32x1x8_8_1x1_intrawave_v3,270.11,847.13,0.0
gfx942,304,224,6144,1536,ck,3,0,14.7591,a8w8_blockscale_1x128x128_256x64x64x128_16x16_32x32_1x1_8x32x1_8x32x1_1x32x1x8_8_1x1_intrawave_v3,286.46,849.22,0.0
gfx942,304,240,6144,1536,ck,3,0,15.0758,a8w8_blockscale_1x128x128_256x64x64x128_16x16_32x32_1x1_8x32x1_8x32x1_1x32x1x8_8_1x1_intrawave_v3,300.47,846.05,0.0
gfx942,304,256,6144,1536,ck,3,0,15.5631,a8w8_blockscale_1x128x128_256x64x64x128_16x16_32x32_1x1_8x32x1_8x32x1_1x32x1x8_8_1x1_intrawave_v3,310.47,833.78,0.0
gfx942,304,288,6144,1536,ck,18,0,16.3441,a8w8_blockscale_1x128x128_256x64x64x256_16x16_32x32_1x1_16x16x1_16x16x1_1x32x1x8_8_1x1_intrawave_v1,332.59,821.0,0.0
gfx942,304,320,6144,1536,ck,18,0,16.174,a8w8_blockscale_1x128x128_256x64x64x256_16x16_32x32_1x1_16x16x1_16x16x1_1x32x1x8_8_1x1_intrawave_v1,373.43,856.98,0.0
gfx942,304,352,6144,1536,ck,3,0,16.4404,a8w8_blockscale_1x128x128_256x64x64x128_16x16_32x32_1x1_8x32x1_8x32x1_1x32x1x8_8_1x1_intrawave_v3,404.11,870.01,0.0
gfx942,304,384,6144,1536,ck,18,0,16.492,a8w8_blockscale_1x128x128_256x64x64x256_16x16_32x32_1x1_16x16x1_16x16x1_1x32x1x8_8_1x1_intrawave_v1,439.47,894.11,0.0
gfx942,304,416,6144,1536,ck,3,0,20.9955,a8w8_blockscale_1x128x128_256x64x64x128_16x16_32x32_1x1_8x32x1_8x32x1_1x32x1x8_8_1x1_intrawave_v3,373.97,723.39,0.0
gfx942,304,448,6144,1536,ck,3,0,21.1116,a8w8_blockscale_1x128x128_256x64x64x128_16x16_32x32_1x1_8x32x1_8x32x1_1x32x1x8_8_1x1_intrawave_v3,400.52,740.37,0.0
gfx942,304,480,6144,1536,ck,3,0,21.7711,a8w8_blockscale_1x128x128_256x64x64x128_16x16_32x32_1x1_8x32x1_8x32x1_1x32x1x8_8_1x1_intrawave_v3,416.13,738.26,0.0
gfx942,304,512,6144,1536,ck,18,0,22.2694,a8w8_blockscale_1x128x128_256x64x64x256_16x16_32x32_1x1_16x16x1_16x16x1_1x32x1x8_8_1x1_intrawave_v1,433.94,741.6,0.0
gfx942,304,544,6144,1536,ck,3,0,22.8028,a8w8_blockscale_1x128x128_256x64x64x128_16x16_32x32_1x1_8x32x1_8x32x1_1x32x1x8_8_1x1_intrawave_v3,450.28,743.66,0.0
gfx942,304,576,6144,1536,ck,18,0,22.3515,a8w8_blockscale_1x128x128_256x64x64x256_16x16_32x32_1x1_16x16x1_16x16x1_1x32x1x8_8_1x1_intrawave_v1,486.39,778.46,0.0
gfx942,304,608,6144,1536,ck,0,0,24.8345,a8w8_blockscale_1x128x128_256x128x128x128_16x16_32x32_2x2_8x32x1_8x32x1_1x32x1x8_8_1x1_intrawave_v3,462.08,718.44,0.0
gfx942,304,640,6144,1536,ck,1,0,26.6143,a8w8_blockscale_1x128x128_256x128x64x128_16x16_32x32_2x1_8x32x1_8x32x1_1x32x1x8_8_1x1_intrawave_v3,453.88,687.02,0.0
gfx942,304,672,6144,1536,ck,0,0,24.578,a8w8_blockscale_1x128x128_256x128x128x128_16x16_32x32_2x2_8x32x1_8x32x1_1x32x1x8_8_1x1_intrawave_v3,516.05,761.94,0.0
gfx942,304,704,6144,1536,ck,0,0,24.9735,a8w8_blockscale_1x128x128_256x128x128x128_16x16_32x32_2x2_8x32x1_8x32x1_1x32x1x8_8_1x1_intrawave_v3,532.07,767.58,0.0
gfx942,304,736,6144,1536,ck,0,0,25.4038,a8w8_blockscale_1x128x128_256x128x128x128_16x16_32x32_2x2_8x32x1_8x32x1_1x32x1x8_8_1x1_intrawave_v3,546.83,772.0,0.0
gfx942,304,768,6144,1536,ck,0,0,26.8535,a8w8_blockscale_1x128x128_256x128x128x128_16x16_32x32_2x2_8x32x1_8x32x1_1x32x1x8_8_1x1_intrawave_v3,539.8,746.79,0.0
gfx942,304,800,6144,1536,ck,0,0,32.8399,a8w8_blockscale_1x128x128_256x128x128x128_16x16_32x32_2x2_8x32x1_8x32x1_1x32x1x8_8_1x1_intrawave_v3,459.79,624.13,0.0
gfx942,304,832,6144,1536,ck,0,0,33.5559,a8w8_blockscale_1x128x128_256x128x128x128_16x16_32x32_2x2_8x32x1_8x32x1_1x32x1x8_8_1x1_intrawave_v3,467.98,624.0,0.0
gfx942,304,864,6144,1536,ck,3,0,34.8277,a8w8_blockscale_1x128x128_256x64x64x128_16x16_32x32_1x1_8x32x1_8x32x1_1x32x1x8_8_1x1_intrawave_v3,468.23,613.91,0.0
gfx942,304,896,6144,1536,ck,18,0,33.1398,a8w8_blockscale_1x128x128_256x64x64x256_16x16_32x32_1x1_16x16x1_16x16x1_1x32x1x8_8_1x1_intrawave_v1,510.31,658.53,0.0
gfx942,304,928,6144,1536,ck,0,0,34.3084,a8w8_blockscale_1x128x128_256x128x128x128_16x16_32x32_2x2_8x32x1_8x32x1_1x32x1x8_8_1x1_intrawave_v3,510.53,648.99,0.0
gfx942,304,960,6144,1536,ck,18,0,35.1072,a8w8_blockscale_1x128x128_256x64x64x256_16x16_32x32_1x1_16x16x1_16x16x1_1x32x1x8_8_1x1_intrawave_v1,516.12,646.83,0.0
gfx942,304,992,6144,1536,ck,0,0,35.3093,a8w8_blockscale_1x128x128_256x128x128x128_16x16_32x32_2x2_8x32x1_8x32x1_1x32x1x8_8_1x1_intrawave_v3,530.27,655.65,0.0
gfx942,304,1024,6144,1536,ck,0,0,36.2039,a8w8_blockscale_1x128x128_256x128x128x128_16x16_32x32_2x2_8x32x1_8x32x1_1x32x1x8_8_1x1_intrawave_v3,533.85,651.67,0.0
gfx942,304,1088,6144,1536,ck,0,0,36.6019,a8w8_blockscale_1x128x128_256x128x128x128_16x16_32x32_2x2_8x32x1_8x32x1_1x32x1x8_8_1x1_intrawave_v3,561.04,668.75,0.0
gfx942,304,1152,6144,1536,ck,0,0,37.2483,a8w8_blockscale_1x128x128_256x128x128x128_16x16_32x32_2x2_8x32x1_8x32x1_1x32x1x8_8_1x1_intrawave_v3,583.74,680.9,0.0
gfx942,304,1216,6144,1536,ck,0,0,38.2424,a8w8_blockscale_1x128x128_256x128x128x128_16x16_32x32_2x2_8x32x1_8x32x1_1x32x1x8_8_1x1_intrawave_v3,600.15,686.34,0.0
gfx942,304,1280,6144,1536,ck,0,0,38.7441,a8w8_blockscale_1x128x128_256x128x128x128_16x16_32x32_2x2_8x32x1_8x32x1_1x32x1x8_8_1x1_intrawave_v3,623.56,700.28,0.0
gfx942,304,1344,6144,1536,ck,0,0,39.7244,a8w8_blockscale_1x128x128_256x128x128x128_16x16_32x32_2x2_8x32x1_8x32x1_1x32x1x8_8_1x1_intrawave_v3,638.58,705.28,0.0
gfx942,304,1408,6144,1536,ck,0,0,40.7549,a8w8_blockscale_1x128x128_256x128x128x128_16x16_32x32_2x2_8x32x1_8x32x1_1x32x1x8_8_1x1_intrawave_v3,652.07,709.15,0.0
gfx942,304,1472,6144,1536,ck,0,0,41.7513,a8w8_blockscale_1x128x128_256x128x128x128_16x16_32x32_2x2_8x32x1_8x32x1_1x32x1x8_8_1x1_intrawave_v3,665.44,713.42,0.0
gfx942,304,1536,6144,1536,ck,0,0,43.0498,a8w8_blockscale_1x128x128_256x128x128x128_16x16_32x32_2x2_8x32x1_8x32x1_1x32x1x8_8_1x1_intrawave_v3,673.43,712.45,0.0
gfx942,304,1600,6144,1536,ck,2,0,53.0046,a8w8_blockscale_1x128x128_256x64x128x128_16x16_32x32_1x2_8x32x1_8x32x1_1x32x1x8_8_1x1_intrawave_v3,569.74,595.34,0.0
gfx942,304,1664,6144,1536,ck,0,0,56.1479,a8w8_blockscale_1x128x128_256x128x128x128_16x16_32x32_2x2_8x32x1_8x32x1_1x32x1x8_8_1x1_intrawave_v3,559.36,577.77,0.0
gfx942,304,1728,6144,1536,ck,0,0,55.8741,a8w8_blockscale_1x128x128_256x128x128x128_16x16_32x32_2x2_8x32x1_8x32x1_1x32x1x8_8_1x1_intrawave_v3,583.72,596.43,0.0
gfx942,304,1792,6144,1536,ck,0,0,55.178,a8w8_blockscale_1x128x128_256x128x128x128_16x16_32x32_2x2_8x32x1_8x32x1_1x32x1x8_8_1x1_intrawave_v3,612.98,619.99,0.0
gfx942,304,1856,6144,1536,ck,0,0,56.0806,a8w8_blockscale_1x128x128_256x128x128x128_16x16_32x32_2x2_8x32x1_8x32x1_1x32x1x8_8_1x1_intrawave_v3,624.65,625.79,0.0
gfx942,304,1920,6144,1536,ck,0,0,57.6334,a8w8_blockscale_1x128x128_256x128x128x128_16x16_32x32_2x2_8x32x1_8x32x1_1x32x1x8_8_1x1_intrawave_v3,628.78,624.28,0.0
gfx942,304,1984,6144,1536,ck,0,0,58.698,a8w8_blockscale_1x128x128_256x128x128x128_16x16_32x32_2x2_8x32x1_8x32x1_1x32x1x8_8_1x1_intrawave_v3,637.96,628.03,0.0
gfx942,304,2048,6144,1536,ck,0,0,58.8802,a8w8_blockscale_1x128x128_256x128x128x128_16x16_32x32_2x2_8x32x1_8x32x1_1x32x1x8_8_1x1_intrawave_v3,656.5,641.11,0.0
gfx942,304,2112,6144,1536,ck,0,0,58.2413,a8w8_blockscale_1x128x128_256x128x128x128_16x16_32x32_2x2_8x32x1_8x32x1_1x32x1x8_8_1x1_intrawave_v3,684.44,663.33,0.0
gfx942,304,2176,6144,1536,ck,0,0,60.3234,a8w8_blockscale_1x128x128_256x128x128x128_16x16_32x32_2x2_8x32x1_8x32x1_1x32x1x8_8_1x1_intrawave_v3,680.84,655.11,0.0
gfx942,304,2240,6144,1536,ck,0,0,60.0291,a8w8_blockscale_1x128x128_256x128x128x128_16x16_32x32_2x2_8x32x1_8x32x1_1x32x1x8_8_1x1_intrawave_v3,704.3,673.06,0.0
gfx942,304,2304,6144,1536,ck,0,0,60.7687,a8w8_blockscale_1x128x128_256x128x128x128_16x16_32x32_2x2_8x32x1_8x32x1_1x32x1x8_8_1x1_intrawave_v3,715.61,679.42,0.0
gfx942,304,2368,6144,1536,ck,0,0,61.0599,a8w8_blockscale_1x128x128_256x128x128x128_16x16_32x32_2x2_8x32x1_8x32x1_1x32x1x8_8_1x1_intrawave_v3,731.98,690.67,0.0
gfx942,304,2432,6144,1536,ck,0,0,62.1568,a8w8_blockscale_1x128x128_256x128x128x128_16x16_32x32_2x2_8x32x1_8x32x1_1x32x1x8_8_1x1_intrawave_v3,738.49,692.72,0.0
gfx942,304,2496,6144,1536,ck,0,0,71.4281,a8w8_blockscale_1x128x128_256x128x128x128_16x16_32x32_2x2_8x32x1_8x32x1_1x32x1x8_8_1x1_intrawave_v3,659.55,615.19,0.0
gfx942,304,2560,6144,1536,ck,0,0,69.9897,a8w8_blockscale_1x128x128_256x128x128x128_16x16_32x32_2x2_8x32x1_8x32x1_1x32x1x8_8_1x1_intrawave_v3,690.36,640.47,0.0
gfx942,304,2624,6144,1536,ck,0,0,74.2726,a8w8_blockscale_1x128x128_256x128x128x128_16x16_32x32_2x2_8x32x1_8x32x1_1x32x1x8_8_1x1_intrawave_v3,666.82,615.45,0.0
gfx942,304,2688,6144,1536,ck,0,0,75.6691,a8w8_blockscale_1x128x128_256x128x128x128_16x16_32x32_2x2_8x32x1_8x32x1_1x32x1x8_8_1x1_intrawave_v3,670.48,615.79,0.0
gfx942,304,2752,6144,1536,ck,0,0,76.8478,a8w8_blockscale_1x128x128_256x128x128x128_16x16_32x32_2x2_8x32x1_8x32x1_1x32x1x8_8_1x1_intrawave_v3,675.91,617.86,0.0
gfx942,304,2816,6144,1536,ck,0,0,76.9192,a8w8_blockscale_1x128x128_256x128x128x128_16x16_32x32_2x2_8x32x1_8x32x1_1x32x1x8_8_1x1_intrawave_v3,690.99,628.78,0.0
gfx942,304,2880,6144,1536,ck,0,0,74.2746,a8w8_blockscale_1x128x128_256x128x128x128_16x16_32x32_2x2_8x32x1_8x32x1_1x32x1x8_8_1x1_intrawave_v3,731.85,663.08,0.0
gfx942,304,2944,6144,1536,ck,0,0,76.0784,a8w8_blockscale_1x128x128_256x128x128x128_16x16_32x32_2x2_8x32x1_8x32x1_1x32x1x8_8_1x1_intrawave_v3,730.38,658.99,0.0
gfx942,304,3008,6144,1536,ck,0,0,80.2405,a8w8_blockscale_1x128x128_256x128x128x128_16x16_32x32_2x2_8x32x1_8x32x1_1x32x1x8_8_1x1_intrawave_v3,707.55,635.84,0.0
gfx942,304,3072,6144,1536,ck,0,0,78.4142,a8w8_blockscale_1x128x128_256x128x128x128_16x16_32x32_2x2_8x32x1_8x32x1_1x32x1x8_8_1x1_intrawave_v3,739.43,661.93,0.0
gfx942,304,3136,6144,1536,ck,0,0,79.4274,a8w8_blockscale_1x128x128_256x128x128x128_16x16_32x32_2x2_8x32x1_8x32x1_1x32x1x8_8_1x1_intrawave_v3,745.21,664.62,0.0
gfx942,304,3200,6144,1536,ck,0,0,80.4969,a8w8_blockscale_1x128x128_256x128x128x128_16x16_32x32_2x2_8x32x1_8x32x1_1x32x1x8_8_1x1_intrawave_v3,750.31,666.78,0.0
gfx942,304,3264,6144,1536,ck,0,0,90.5316,a8w8_blockscale_1x128x128_256x128x128x128_16x16_32x32_2x2_8x32x1_8x32x1_1x32x1x8_8_1x1_intrawave_v3,680.49,602.65,0.0
gfx942,304,3328,6144,1536,ck,0,0,87.0721,a8w8_blockscale_1x128x128_256x128x128x128_16x16_32x32_2x2_8x32x1_8x32x1_1x32x1x8_8_1x1_intrawave_v3,721.4,636.75,0.0
gfx942,304,3392,6144,1536,ck,0,0,89.8593,a8w8_blockscale_1x128x128_256x128x128x128_16x16_32x32_2x2_8x32x1_8x32x1_1x32x1x8_8_1x1_intrawave_v3,712.47,626.85,0.0
gfx942,304,3456,6144,1536,ck,0,0,90.9816,a8w8_blockscale_1x128x128_256x128x128x128_16x16_32x32_2x2_8x32x1_8x32x1_1x32x1x8_8_1x1_intrawave_v3,716.96,628.84,0.0
gfx942,304,3520,6144,1536,ck,0,0,91.1869,a8w8_blockscale_1x128x128_256x128x128x128_16x16_32x32_2x2_8x32x1_8x32x1_1x32x1x8_8_1x1_intrawave_v3,728.59,637.13,0.0
gfx942,304,3584,6144,1536,ck,0,0,90.6127,a8w8_blockscale_1x128x128_256x128x128x128_16x16_32x32_2x2_8x32x1_8x32x1_1x32x1x8_8_1x1_intrawave_v3,746.54,650.93,0.0
gfx942,304,3648,6144,1536,ck,0,0,93.752,a8w8_blockscale_1x128x128_256x128x128x128_16x16_32x32_2x2_8x32x1_8x32x1_1x32x1x8_8_1x1_intrawave_v3,734.42,638.57,0.0
gfx942,304,3712,6144,1536,ck,0,0,94.9444,a8w8_blockscale_1x128x128_256x128x128x128_16x16_32x32_2x2_8x32x1_8x32x1_1x32x1x8_8_1x1_intrawave_v3,737.92,639.87,0.0
gfx942,304,3776,6144,1536,ck,0,0,95.7486,a8w8_blockscale_1x128x128_256x128x128x128_16x16_32x32_2x2_8x32x1_8x32x1_1x32x1x8_8_1x1_intrawave_v3,744.34,643.73,0.0
gfx942,304,3840,6144,1536,ck,0,0,93.7648,a8w8_blockscale_1x128x128_256x128x128x128_16x16_32x32_2x2_8x32x1_8x32x1_1x32x1x8_8_1x1_intrawave_v3,772.97,666.79,0.0
gfx942,304,3904,6144,1536,ck,0,0,94.8671,a8w8_blockscale_1x128x128_256x128x128x128_16x16_32x32_2x2_8x32x1_8x32x1_1x32x1x8_8_1x1_intrawave_v3,776.72,668.37,0.0
gfx942,304,3968,6144,1536,ck,0,0,95.378,a8w8_blockscale_1x128x128_256x128x128x128_16x16_32x32_2x2_8x32x1_8x32x1_1x32x1x8_8_1x1_intrawave_v3,785.23,674.06,0.0
gfx942,304,4032,6144,1536,ck,0,0,107.6967,a8w8_blockscale_1x128x128_256x128x128x128_16x16_32x32_2x2_8x32x1_8x32x1_1x32x1x8_8_1x1_intrawave_v3,706.63,605.18,0.0
gfx942,304,4096,6144,1536,ck,0,0,109.2799,a8w8_blockscale_1x128x128_256x128x128x128_16x16_32x32_2x2_8x32x1_8x32x1_1x32x1x8_8_1x1_intrawave_v3,707.44,604.51,0.0
gfx942,304,4224,6144,1536,ck,0,0,109.777,a8w8_blockscale_1x128x128_256x128x128x128_16x16_32x32_2x2_8x32x1_8x32x1_1x32x1x8_8_1x1_intrawave_v3,726.25,617.89,0.0
gfx942,304,4352,6144,1536,ck,0,0,112.1625,a8w8_blockscale_1x128x128_256x128x128x128_16x16_32x32_2x2_8x32x1_8x32x1_1x32x1x8_8_1x1_intrawave_v3,732.34,620.52,0.0
gfx942,304,4480,6144,1536,ck,0,0,110.6008,a8w8_blockscale_1x128x128_256x128x128x128_16x16_32x32_2x2_8x32x1_8x32x1_1x32x1x8_8_1x1_intrawave_v3,764.53,645.28,0.0
gfx942,304,4608,6144,1536,ck,0,0,109.4201,a8w8_blockscale_1x128x128_256x128x128x128_16x16_32x32_2x2_8x32x1_8x32x1_1x32x1x8_8_1x1_intrawave_v3,794.85,668.42,0.0
gfx942,304,4736,6144,1536,ck,0,0,112.4317,a8w8_blockscale_1x128x128_256x128x128x128_16x16_32x32_2x2_8x32x1_8x32x1_1x32x1x8_8_1x1_intrawave_v3,795.05,666.25,0.0
gfx942,304,4864,6144,1536,ck,0,0,121.9641,a8w8_blockscale_1x128x128_256x128x128x128_16x16_32x32_2x2_8x32x1_8x32x1_1x32x1x8_8_1x1_intrawave_v3,752.72,628.69,0.0
gfx942,304,4992,6144,1536,ck,0,0,123.5809,a8w8_blockscale_1x128x128_256x128x128x128_16x16_32x32_2x2_8x32x1_8x32x1_1x32x1x8_8_1x1_intrawave_v3,762.42,634.78,0.0
gfx942,304,5120,6144,1536,ck,0,0,122.7576,a8w8_blockscale_1x128x128_256x128x128x128_16x16_32x32_2x2_8x32x1_8x32x1_1x32x1x8_8_1x1_intrawave_v3,787.22,653.45,0.0
gfx942,304,5248,6144,1536,ck,0,0,126.1022,a8w8_blockscale_1x128x128_256x128x128x128_16x16_32x32_2x2_8x32x1_8x32x1_1x32x1x8_8_1x1_intrawave_v3,785.5,650.15,0.0
gfx942,304,5376,6144,1536,ck,0,0,127.6736,a8w8_blockscale_1x128x128_256x128x128x128_16x16_32x32_2x2_8x32x1_8x32x1_1x32x1x8_8_1x1_intrawave_v3,794.75,656.01,0.0
gfx942,304,5504,6144,1536,ck,0,0,128.2359,a8w8_blockscale_1x128x128_256x128x128x128_16x16_32x32_2x2_8x32x1_8x32x1_1x32x1x8_8_1x1_intrawave_v3,810.1,666.93,0.0
gfx942,304,5632,6144,1536,ck,0,0,129.3071,a8w8_blockscale_1x128x128_256x128x128x128_16x16_32x32_2x2_8x32x1_8x32x1_1x32x1x8_8_1x1_intrawave_v3,822.08,675.09,0.0
gfx942,304,5760,6144,1536,ck,0,0,138.9667,a8w8_blockscale_1x128x128_256x128x128x128_16x16_32x32_2x2_8x32x1_8x32x1_1x32x1x8_8_1x1_intrawave_v3,782.32,640.9,0.0
gfx942,304,5888,6144,1536,ck,0,0,143.0015,a8w8_blockscale_1x128x128_256x128x128x128_16x16_32x32_2x2_8x32x1_8x32x1_1x32x1x8_8_1x1_intrawave_v3,777.14,635.19,0.0
gfx942,304,6016,6144,1536,ck,0,0,143.9239,a8w8_blockscale_1x128x128_256x128x128x128_16x16_32x32_2x2_8x32x1_8x32x1_1x32x1x8_8_1x1_intrawave_v3,788.95,643.41,0.0
gfx942,304,6144,6144,1536,ck,0,0,145.6974,a8w8_blockscale_1x128x128_256x128x128x128_16x16_32x32_2x2_8x32x1_8x32x1_1x32x1x8_8_1x1_intrawave_v3,795.92,647.72,0.0
gfx942,304,6272,6144,1536,ck,0,0,144.608,a8w8_blockscale_1x128x128_256x128x128x128_16x16_32x32_2x2_8x32x1_8x32x1_1x32x1x8_8_1x1_intrawave_v3,818.63,664.84,0.0
gfx942,304,6400,6144,1536,ck,0,0,146.9109,a8w8_blockscale_1x128x128_256x128x128x128_16x16_32x32_2x2_8x32x1_8x32x1_1x32x1x8_8_1x1_intrawave_v3,822.24,666.46,0.0
gfx942,304,6528,6144,1536,ck,0,0,157.3889,a8w8_blockscale_1x128x128_256x128x128x128_16x16_32x32_2x2_8x32x1_8x32x1_1x32x1x8_8_1x1_intrawave_v3,782.85,633.34,0.0
gfx942,304,6656,6144,1536,ck,0,0,159.0385,a8w8_blockscale_1x128x128_256x128x128x128_16x16_32x32_2x2_8x32x1_8x32x1_1x32x1x8_8_1x1_intrawave_v3,789.92,637.89,0.0
gfx942,304,6784,6144,1536,ck,0,0,164.4932,a8w8_blockscale_1x128x128_256x128x128x128_16x16_32x32_2x2_8x32x1_8x32x1_1x32x1x8_8_1x1_intrawave_v3,778.41,627.5,0.0
gfx942,304,6912,6144,1536,ck,0,0,161.8787,a8w8_blockscale_1x128x128_256x128x128x128_16x16_32x32_2x2_8x32x1_8x32x1_1x32x1x8_8_1x1_intrawave_v3,805.91,648.56,0.0
gfx942,304,7040,6144,1536,ck,0,0,160.1851,a8w8_blockscale_1x128x128_256x128x128x128_16x16_32x32_2x2_8x32x1_8x32x1_1x32x1x8_8_1x1_intrawave_v3,829.51,666.47,0.0
gfx942,304,7168,6144,1536,ck,0,0,160.1787,a8w8_blockscale_1x128x128_256x128x128x128_16x16_32x32_2x2_8x32x1_8x32x1_1x32x1x8_8_1x1_intrawave_v3,844.63,677.54,0.0
gfx942,304,7296,6144,1536,ck,0,0,163.333,a8w8_blockscale_1x128x128_256x128x128x128_16x16_32x32_2x2_8x32x1_8x32x1_1x32x1x8_8_1x1_intrawave_v3,843.11,675.29,0.0
gfx942,304,7424,6144,1536,ck,0,0,172.617,a8w8_blockscale_1x128x128_256x128x128x128_16x16_32x32_2x2_8x32x1_8x32x1_1x32x1x8_8_1x1_intrawave_v3,811.76,649.22,0.0
gfx942,304,7552,6144,1536,ck,0,0,173.6446,a8w8_blockscale_1x128x128_256x128x128x128_16x16_32x32_2x2_8x32x1_8x32x1_1x32x1x8_8_1x1_intrawave_v3,820.87,655.57,0.0
gfx942,304,7680,6144,1536,ck,0,0,174.8776,a8w8_blockscale_1x128x128_256x128x128x128_16x16_32x32_2x2_8x32x1_8x32x1_1x32x1x8_8_1x1_intrawave_v3,828.89,661.07,0.0
gfx942,304,7808,6144,1536,ck,0,0,177.285,a8w8_blockscale_1x128x128_256x128x128x128_16x16_32x32_2x2_8x32x1_8x32x1_1x32x1x8_8_1x1_intrawave_v3,831.27,662.07,0.0
gfx942,304,7936,6144,1536,ck,0,0,181.4482,a8w8_blockscale_1x128x128_256x128x128x128_16x16_32x32_2x2_8x32x1_8x32x1_1x32x1x8_8_1x1_intrawave_v3,825.51,656.63,0.0
gfx942,304,8064,6144,1536,ck,0,0,178.6455,a8w8_blockscale_1x128x128_256x128x128x128_16x16_32x32_2x2_8x32x1_8x32x1_1x32x1x8_8_1x1_intrawave_v3,851.98,676.84,0.0
gfx942,304,8192,6144,1536,ck,0,0,188.0262,a8w8_blockscale_1x128x128_256x128x128x128_16x16_32x32_2x2_8x32x1_8x32x1_1x32x1x8_8_1x1_intrawave_v3,822.33,652.48,0.0
gfx942,304,8320,6144,1536,ck,0,0,189.9278,a8w8_blockscale_1x128x128_256x128x128x128_16x16_32x32_2x2_8x32x1_8x32x1_1x32x1x8_8_1x1_intrawave_v3,826.81,655.26,0.0
gfx942,304,8448,6144,1536,ck,0,0,191.0859,a8w8_blockscale_1x128x128_256x128x128x128_16x16_32x32_2x2_8x32x1_8x32x1_1x32x1x8_8_1x1_intrawave_v3,834.44,660.55,0.0
gfx942,304,8576,6144,1536,ck,0,0,191.7572,a8w8_blockscale_1x128x128_256x128x128x128_16x16_32x32_2x2_8x32x1_8x32x1_1x32x1x8_8_1x1_intrawave_v3,844.12,667.47,0.0
gfx942,304,8704,6144,1536,ck,0,0,198.6311,a8w8_blockscale_1x128x128_256x128x128x128_16x16_32x32_2x2_8x32x1_8x32x1_1x32x1x8_8_1x1_intrawave_v3,827.07,653.28,0.0
gfx942,304,8832,6144,1536,ck,0,0,196.2388,a8w8_blockscale_1x128x128_256x128x128x128_16x16_32x32_2x2_8x32x1_8x32x1_1x32x1x8_8_1x1_intrawave_v3,849.47,670.26,0.0
gfx942,304,8960,6144,1536,ck,0,0,206.0729,a8w8_blockscale_1x128x128_256x128x128x128_16x16_32x32_2x2_8x32x1_8x32x1_1x32x1x8_8_1x1_intrawave_v3,820.65,646.86,0.0
gfx942,304,9088,6144,1536,ck,0,0,203.7475,a8w8_blockscale_1x128x128_256x128x128x128_16x16_32x32_2x2_8x32x1_8x32x1_1x32x1x8_8_1x1_intrawave_v3,841.88,662.93,0.0
gfx942,304,9216,6144,1536,ck,0,0,206.9648,a8w8_blockscale_1x128x128_256x128x128x128_16x16_32x32_2x2_8x32x1_8x32x1_1x32x1x8_8_1x1_intrawave_v3,840.46,661.17,0.0
gfx942,304,9344,6144,1536,ck,0,0,207.5063,a8w8_blockscale_1x128x128_256x128x128x128_16x16_32x32_2x2_8x32x1_8x32x1_1x32x1x8_8_1x1_intrawave_v3,849.91,667.97,0.0
gfx942,304,9472,6144,1536,ck,0,0,209.535,a8w8_blockscale_1x128x128_256x128x128x128_16x16_32x32_2x2_8x32x1_8x32x1_1x32x1x8_8_1x1_intrawave_v3,853.21,669.95,0.0
gfx942,304,9600,6144,1536,ck,0,0,210.3259,a8w8_blockscale_1x128x128_256x128x128x128_16x16_32x32_2x2_8x32x1_8x32x1_1x32x1x8_8_1x1_intrawave_v3,861.49,675.84,0.0
gfx942,304,9728,6144,1536,ck,0,0,219.0995,a8w8_blockscale_1x128x128_256x128x128x128_16x16_32x32_2x2_8x32x1_8x32x1_1x32x1x8_8_1x1_intrawave_v3,838.02,656.86,0.0
gfx942,304,9856,6144,1536,ck,0,0,219.661,a8w8_blockscale_1x128x128_256x128x128x128_16x16_32x32_2x2_8x32x1_8x32x1_1x32x1x8_8_1x1_intrawave_v3,846.88,663.23,0.0
gfx942,304,9984,6144,1536,ck,0,0,220.6464,a8w8_blockscale_1x128x128_256x128x128x128_16x16_32x32_2x2_8x32x1_8x32x1_1x32x1x8_8_1x1_intrawave_v3,854.04,668.29,0.0
gfx942,304,10112,6144,1536,ck,0,0,220.4256,a8w8_blockscale_1x128x128_256x128x128x128_16x16_32x32_2x2_8x32x1_8x32x1_1x32x1x8_8_1x1_intrawave_v3,865.86,676.99,0.0
gfx942,304,10240,6144,1536,ck,0,0,227.5882,a8w8_blockscale_1x128x128_256x128x128x128_16x16_32x32_2x2_8x32x1_8x32x1_1x32x1x8_8_1x1_intrawave_v3,849.22,663.46,0.0
gfx942,304,10368,6144,1536,ck,0,0,225.5902,a8w8_blockscale_1x128x128_256x128x128x128_16x16_32x32_2x2_8x32x1_8x32x1_1x32x1x8_8_1x1_intrawave_v3,867.46,677.18,0.0
gfx942,304,10496,6144,1536,ck,0,0,227.1915,a8w8_blockscale_1x128x128_256x128x128x128_16x16_32x32_2x2_8x32x1_8x32x1_1x32x1x8_8_1x1_intrawave_v3,871.98,680.19,0.0
gfx942,304,10624,6144,1536,ck,0,0,235.6063,a8w8_blockscale_1x128x128_256x128x128x128_16x16_32x32_2x2_8x32x1_8x32x1_1x32x1x8_8_1x1_intrawave_v3,851.09,663.41,0.0
gfx942,304,10752,6144,1536,ck,0,0,242.1115,a8w8_blockscale_1x128x128_256x128x128x128_16x16_32x32_2x2_8x32x1_8x32x1_1x32x1x8_8_1x1_intrawave_v3,838.2,652.89,0.0
gfx942,304,10880,6144,1536,ck,0,0,242.7111,a8w8_blockscale_1x128x128_256x128x128x128_16x16_32x32_2x2_8x32x1_8x32x1_1x32x1x8_8_1x1_intrawave_v3,846.08,658.57,0.0
gfx942,304,11008,6144,1536,ck,0,0,240.8575,a8w8_blockscale_1x128x128_256x128x128x128_16x16_32x32_2x2_8x32x1_8x32x1_1x32x1x8_8_1x1_intrawave_v3,862.62,670.99,0.0
gfx942,304,11136,6144,1536,ck,0,0,238.7908,a8w8_blockscale_1x128x128_256x128x128x128_16x16_32x32_2x2_8x32x1_8x32x1_1x32x1x8_8_1x1_intrawave_v3,880.21,684.2,0.0
gfx942,304,11264,6144,1536,ck,0,0,248.0139,a8w8_blockscale_1x128x128_256x128x128x128_16x16_32x32_2x2_8x32x1_8x32x1_1x32x1x8_8_1x1_intrawave_v3,857.21,665.89,0.0
gfx942,304,11392,6144,1536,ck,0,0,248.9543,a8w8_blockscale_1x128x128_256x128x128x128_16x16_32x32_2x2_8x32x1_8x32x1_1x32x1x8_8_1x1_intrawave_v3,863.68,670.49,0.0
gfx942,304,11520,6144,1536,ck,0,0,250.7662,a8w8_blockscale_1x128x128_256x128x128x128_16x16_32x32_2x2_8x32x1_8x32x1_1x32x1x8_8_1x1_intrawave_v3,867.07,672.7,0.0
gfx942,304,11648,6144,1536,ck,0,0,252.7558,a8w8_blockscale_1x128x128_256x128x128x128_16x16_32x32_2x2_8x32x1_8x32x1_1x32x1x8_8_1x1_intrawave_v3,869.81,674.4,0.0
gfx942,304,11776,6144,1536,ck,0,0,259.0593,a8w8_blockscale_1x128x128_256x128x128x128_16x16_32x32_2x2_8x32x1_8x32x1_1x32x1x8_8_1x1_intrawave_v3,857.97,664.82,0.0
gfx942,304,11904,6144,1536,ck,0,0,258.8186,a8w8_blockscale_1x128x128_256x128x128x128_16x16_32x32_2x2_8x32x1_8x32x1_1x32x1x8_8_1x1_intrawave_v3,868.1,672.28,0.0
gfx942,304,12032,6144,1536,ck,0,0,258.5997,a8w8_blockscale_1x128x128_256x128x128x128_16x16_32x32_2x2_8x32x1_8x32x1_1x32x1x8_8_1x1_intrawave_v3,878.18,679.69,0.0
gfx942,304,12160,6144,1536,ck,0,0,260.4172,a8w8_blockscale_1x128x128_256x128x128x128_16x16_32x32_2x2_8x32x1_8x32x1_1x32x1x8_8_1x1_intrawave_v3,881.33,681.74,0.0
gfx942,304,12288,6144,1536,ck,0,0,276.9576,a8w8_blockscale_1x128x128_256x128x128x128_16x16_32x32_2x2_8x32x1_8x32x1_1x32x1x8_8_1x1_intrawave_v3,837.41,647.41,0.0
gfx942,304,12416,6144,1536,ck,0,0,272.812,a8w8_blockscale_1x128x128_256x128x128x128_16x16_32x32_2x2_8x32x1_8x32x1_1x32x1x8_8_1x1_intrawave_v3,859.0,663.74,0.0
gfx942,304,12544,6144,1536,ck,0,0,271.4593,a8w8_blockscale_1x128x128_256x128x128x128_16x16_32x32_2x2_8x32x1_8x32x1_1x32x1x8_8_1x1_intrawave_v3,872.18,673.56,0.0
gfx942,304,12672,6144,1536,ck,0,0,268.694,a8w8_blockscale_1x128x128_256x128x128x128_16x16_32x32_2x2_8x32x1_8x32x1_1x32x1x8_8_1x1_intrawave_v3,890.14,687.08,0.0
gfx942,304,12800,6144,1536,ck,0,0,279.3772,a8w8_blockscale_1x128x128_256x128x128x128_16x16_32x32_2x2_8x32x1_8x32x1_1x32x1x8_8_1x1_intrawave_v3,864.75,667.14,0.0
gfx942,304,12928,6144,1536,ck,0,0,281.6756,a8w8_blockscale_1x128x128_256x128x128x128_16x16_32x32_2x2_8x32x1_8x32x1_1x32x1x8_8_1x1_intrawave_v3,866.27,667.98,0.0
gfx942,304,13056,6144,1536,ck,0,0,286.4604,a8w8_blockscale_1x128x128_256x128x128x128_16x16_32x32_2x2_8x32x1_8x32x1_1x32x1x8_8_1x1_intrawave_v3,860.24,663.0,0.0
gfx942,304,13184,6144,1536,ck,0,0,282.7382,a8w8_blockscale_1x128x128_256x128x128x128_16x16_32x32_2x2_8x32x1_8x32x1_1x32x1x8_8_1x1_intrawave_v3,880.11,677.99,0.0
gfx942,304,13312,6144,1536,ck,0,0,289.0565,a8w8_blockscale_1x128x128_256x128x128x128_16x16_32x32_2x2_8x32x1_8x32x1_1x32x1x8_8_1x1_intrawave_v3,869.23,669.29,0.0
gfx942,304,13440,6144,1536,ck,0,0,289.2936,a8w8_blockscale_1x128x128_256x128x128x128_16x16_32x32_2x2_8x32x1_8x32x1_1x32x1x8_8_1x1_intrawave_v3,876.87,674.86,0.0
gfx942,304,13568,6144,1536,ck,0,0,291.7559,a8w8_blockscale_1x128x128_256x128x128x128_16x16_32x32_2x2_8x32x1_8x32x1_1x32x1x8_8_1x1_intrawave_v3,877.75,675.23,0.0
gfx942,304,13696,6144,1536,ck,0,0,295.4661,a8w8_blockscale_1x128x128_256x128x128x128_16x16_32x32_2x2_8x32x1_8x32x1_1x32x1x8_8_1x1_intrawave_v3,874.9,672.74,0.0
gfx942,304,13824,6144,1536,ck,0,0,300.4948,a8w8_blockscale_1x128x128_256x128x128x128_16x16_32x32_2x2_8x32x1_8x32x1_1x32x1x8_8_1x1_intrawave_v3,868.3,667.37,0.0
gfx942,304,13952,6144,1536,ck,0,0,308.937,a8w8_blockscale_1x128x128_256x128x128x128_16x16_32x32_2x2_8x32x1_8x32x1_1x32x1x8_8_1x1_intrawave_v3,852.39,654.86,0.0
gfx942,304,14080,6144,1536,ck,0,0,302.6904,a8w8_blockscale_1x128x128_256x128x128x128_16x16_32x32_2x2_8x32x1_8x32x1_1x32x1x8_8_1x1_intrawave_v3,877.96,674.22,0.0
gfx942,304,14208,6144,1536,ck,0,0,306.8781,a8w8_blockscale_1x128x128_256x128x128x128_16x16_32x32_2x2_8x32x1_8x32x1_1x32x1x8_8_1x1_intrawave_v3,873.86,670.78,0.0
gfx942,304,14336,6144,1536,ck,0,0,313.8021,a8w8_blockscale_1x128x128_256x128x128x128_16x16_32x32_2x2_8x32x1_8x32x1_1x32x1x8_8_1x1_intrawave_v3,862.27,661.62,0.0
gfx942,304,14464,6144,1536,ck,0,0,322.7674,a8w8_blockscale_1x128x128_256x128x128x128_16x16_32x32_2x2_8x32x1_8x32x1_1x32x1x8_8_1x1_intrawave_v3,845.81,648.73,0.0
gfx942,304,14592,6144,1536,ck,0,0,313.8456,a8w8_blockscale_1x128x128_256x128x128x128_16x16_32x32_2x2_8x32x1_8x32x1_1x32x1x8_8_1x1_intrawave_v3,877.55,672.81,0.0
gfx942,304,14720,6144,1536,ck,0,0,325.7054,a8w8_blockscale_1x128x128_256x128x128x128_16x16_32x32_2x2_8x32x1_8x32x1_1x32x1x8_8_1x1_intrawave_v3,853.01,653.74,0.0
gfx942,304,14848,6144,1536,ck,0,0,325.7293,a8w8_blockscale_1x128x128_256x128x128x128_16x16_32x32_2x2_8x32x1_8x32x1_1x32x1x8_8_1x1_intrawave_v3,860.37,659.12,0.0
gfx942,304,14976,6144,1536,ck,0,0,324.4397,a8w8_blockscale_1x128x128_256x128x128x128_16x16_32x32_2x2_8x32x1_8x32x1_1x32x1x8_8_1x1_intrawave_v3,871.23,667.2,0.0
gfx942,304,15104,6144,1536,ck,0,0,323.3855,a8w8_blockscale_1x128x128_256x128x128x128_16x16_32x32_2x2_8x32x1_8x32x1_1x32x1x8_8_1x1_intrawave_v3,881.54,674.84,0.0
gfx942,304,15232,6144,1536,ck,0,0,330.0257,a8w8_blockscale_1x128x128_256x128x128x128_16x16_32x32_2x2_8x32x1_8x32x1_1x32x1x8_8_1x1_intrawave_v3,871.13,666.63,0.0
gfx942,304,15360,6144,1536,ck,0,0,326.9947,a8w8_blockscale_1x128x128_256x128x128x128_16x16_32x32_2x2_8x32x1_8x32x1_1x32x1x8_8_1x1_intrawave_v3,886.59,678.22,0.0
gfx942,304,15488,6144,1536,ck,0,0,329.9096,a8w8_blockscale_1x128x128_256x128x128x128_16x16_32x32_2x2_8x32x1_8x32x1_1x32x1x8_8_1x1_intrawave_v3,886.08,677.59,0.0
gfx942,304,15616,6144,1536,ck,0,0,333.1058,a8w8_blockscale_1x128x128_256x128x128x128_16x16_32x32_2x2_8x32x1_8x32x1_1x32x1x8_8_1x1_intrawave_v3,884.83,676.4,0.0
gfx942,304,15744,6144,1536,ck,0,0,331.8003,a8w8_blockscale_1x128x128_256x128x128x128_16x16_32x32_2x2_8x32x1_8x32x1_1x32x1x8_8_1x1_intrawave_v3,895.59,684.39,0.0
gfx942,304,15872,6144,1536,ck,0,0,336.7677,a8w8_blockscale_1x128x128_256x128x128x128_16x16_32x32_2x2_8x32x1_8x32x1_1x32x1x8_8_1x1_intrawave_v3,889.56,679.55,0.0
gfx942,304,16000,6144,1536,ck,0,0,342.0642,a8w8_blockscale_1x128x128_256x128x128x128_16x16_32x32_2x2_8x32x1_8x32x1_1x32x1x8_8_1x1_intrawave_v3,882.85,674.2,0.0
gfx942,304,16128,6144,1536,ck,0,0,345.8588,a8w8_blockscale_1x128x128_256x128x128x128_16x16_32x32_2x2_8x32x1_8x32x1_1x32x1x8_8_1x1_intrawave_v3,880.14,671.92,0.0
gfx942,304,16256,6144,1536,ck,0,0,345.6088,a8w8_blockscale_1x128x128_256x128x128x128_16x16_32x32_2x2_8x32x1_8x32x1_1x32x1x8_8_1x1_intrawave_v3,887.77,677.53,0.0
gfx942,304,16384,6144,1536,ck,0,0,359.8117,a8w8_blockscale_1x128x128_256x128x128x128_16x16_32x32_2x2_8x32x1_8x32x1_1x32x1x8_8_1x1_intrawave_v3,859.44,655.7,0.0
gfx942,304,16512,6144,1536,ck,0,0,359.7265,a8w8_blockscale_1x128x128_256x128x128x128_16x16_32x32_2x2_8x32x1_8x32x1_1x32x1x8_8_1x1_intrawave_v3,866.36,660.78,0.0
gfx942,304,1,6144,2048,ck,8,0,8.397,a8w8_blockscale_1x128x128_256x16x64x256_16x16_16x16_1x1_16x16x1_16x16x1_1x16x1x16_4_1x1_intrawave_v1,3.0,1500.21,0.0
gfx942,304,2,6144,2048,ck,8,0,8.4447,a8w8_blockscale_1x128x128_256x16x64x256_16x16_16x16_1x1_16x16x1_16x16x1_1x16x1x16_4_1x1_intrawave_v1,5.96,1493.43,0.0
gfx942,304,4,6144,2048,ck,8,0,8.5233,a8w8_blockscale_1x128x128_256x16x64x256_16x16_16x16_1x1_16x16x1_16x16x1_1x16x1x16_4_1x1_intrawave_v1,11.81,1483.02,0.0
gfx942,304,8,6144,2048,ck,8,0,8.572,a8w8_blockscale_1x128x128_256x16x64x256_16x16_16x16_1x1_16x16x1_16x16x1_1x16x1x16_4_1x1_intrawave_v1,23.49,1481.29,0.0
gfx942,304,16,6144,2048,ck,8,0,8.6747,a8w8_blockscale_1x128x128_256x16x64x256_16x16_16x16_1x1_16x16x1_16x16x1_1x16x1x16_4_1x1_intrawave_v1,46.42,1476.97,0.0
gfx942,304,32,6144,2048,ck,8,0,8.7032,a8w8_blockscale_1x128x128_256x16x64x256_16x16_16x16_1x1_16x16x1_16x16x1_1x16x1x16_4_1x1_intrawave_v1,92.53,1498.49,0.0
gfx942,304,48,6144,2048,ck,8,0,8.7136,a8w8_blockscale_1x128x128_256x16x64x256_16x16_16x16_1x1_16x16x1_16x16x1_1x16x1x16_4_1x1_intrawave_v1,138.63,1523.03,0.0
gfx942,304,64,6144,2048,ck,13,0,11.2986,a8w8_blockscale_1x128x128_256x32x64x256_16x16_16x16_2x1_16x16x1_16x16x1_1x32x1x8_8_2x1_intrawave_v1,142.55,1194.88,0.0
gfx942,304,80,6144,2048,ck,13,0,11.3452,a8w8_blockscale_1x128x128_256x32x64x256_16x16_16x16_2x1_16x16x1_16x16x1_1x32x1x8_8_2x1_intrawave_v1,177.46,1210.19,0.0
gfx942,304,96,6144,2048,ck,13,0,11.0438,a8w8_blockscale_1x128x128_256x32x64x256_16x16_16x16_2x1_16x16x1_16x16x1_1x32x1x8_8_2x1_intrawave_v1,218.76,1263.98,0.0
gfx942,304,112,6144,2048,ck,18,0,11.9765,a8w8_blockscale_1x128x128_256x64x64x256_16x16_32x32_1x1_16x16x1_16x16x1_1x32x1x8_8_1x1_intrawave_v1,235.34,1184.7,0.0
gfx942,304,128,6144,2048,ck,18,0,11.464,a8w8_blockscale_1x128x128_256x64x64x256_16x16_32x32_1x1_16x16x1_16x16x1_1x32x1x8_8_1x1_intrawave_v1,280.99,1257.67,0.0
gfx942,304,144,6144,2048,ck,18,0,12.548,a8w8_blockscale_1x128x128_256x64x64x256_16x16_32x32_1x1_16x16x1_16x16x1_1x32x1x8_8_1x1_intrawave_v1,288.8,1167.3,0.0
gfx942,304,160,6144,2048,ck,18,0,12.46,a8w8_blockscale_1x128x128_256x64x64x256_16x16_32x32_1x1_16x16x1_16x16x1_1x32x1x8_8_1x1_intrawave_v1,323.16,1193.95,0.0
gfx942,304,176,6144,2048,ck,18,0,12.6291,a8w8_blockscale_1x128x128_256x64x64x256_16x16_32x32_1x1_16x16x1_16x16x1_1x32x1x8_8_1x1_intrawave_v1,350.71,1196.13,0.0
gfx942,304,192,6144,2048,ck,18,0,12.1218,a8w8_blockscale_1x128x128_256x64x64x256_16x16_32x32_1x1_16x16x1_16x16x1_1x32x1x8_8_1x1_intrawave_v1,398.61,1265.11,0.0
gfx942,304,208,6144,2048,ck,3,0,19.0423,a8w8_blockscale_1x128x128_256x64x64x128_16x16_32x32_1x1_8x32x1_8x32x1_1x32x1x8_8_1x1_intrawave_v3,274.89,817.38,0.0
gfx942,304,224,6144,2048,ck,3,0,18.8376,a8w8_blockscale_1x128x128_256x64x64x128_16x16_32x32_1x1_8x32x1_8x32x1_1x32x1x8_8_1x1_intrawave_v3,299.25,838.44,0.0
gfx942,304,240,6144,2048,ck,18,0,19.5538,a8w8_blockscale_1x128x128_256x64x64x256_16x16_32x32_1x1_16x16x1_16x16x1_1x32x1x8_8_1x1_intrawave_v1,308.88,819.46,0.0
gfx942,304,256,6144,2048,ck,18,0,19.2972,a8w8_blockscale_1x128x128_256x64x64x256_16x16_32x32_1x1_16x16x1_16x16x1_1x32x1x8_8_1x1_intrawave_v1,333.85,842.24,0.0
gfx942,304,288,6144,2048,ck,18,0,20.1055,a8w8_blockscale_1x128x128_256x64x64x256_16x16_32x32_1x1_16x16x1_16x16x1_1x32x1x8_8_1x1_intrawave_v1,360.49,831.2,0.0
gfx942,304,320,6144,2048,ck,18,0,20.5396,a8w8_blockscale_1x128x128_256x64x64x256_16x16_32x32_1x1_16x16x1_16x16x1_1x32x1x8_8_1x1_intrawave_v1,392.08,835.97,0.0
gfx942,304,352,6144,2048,ck,3,0,21.54,a8w8_blockscale_1x128x128_256x64x64x128_16x16_32x32_1x1_8x32x1_8x32x1_1x32x1x8_8_1x1_intrawave_v3,411.25,818.44,0.0
gfx942,304,384,6144,2048,ck,18,0,20.5161,a8w8_blockscale_1x128x128_256x64x64x256_16x16_32x32_1x1_16x16x1_16x16x1_1x32x1x8_8_1x1_intrawave_v1,471.03,881.65,0.0
gfx942,304,416,6144,2048,ck,0,0,27.2041,a8w8_blockscale_1x128x128_256x128x128x128_16x16_32x32_2x2_8x32x1_8x32x1_1x32x1x8_8_1x1_intrawave_v3,384.83,681.76,0.0
gfx942,304,448,6144,2048,ck,0,0,27.1475,a8w8_blockscale_1x128x128_256x128x128x128_16x16_32x32_2x2_8x32x1_8x32x1_1x32x1x8_8_1x1_intrawave_v3,415.3,700.08,0.0
gfx942,304,480,6144,2048,ck,3,0,28.3093,a8w8_blockscale_1x128x128_256x64x64x128_16x16_32x32_1x1_8x32x1_8x32x1_1x32x1x8_8_1x1_intrawave_v3,426.7,687.55,0.0
gfx942,304,512,6144,2048,ck,18,0,27.8147,a8w8_blockscale_1x128x128_256x64x64x256_16x16_32x32_1x1_16x16x1_16x16x1_1x32x1x8_8_1x1_intrawave_v1,463.24,716.27,0.0
gfx942,304,544,6144,2048,ck,3,0,28.5585,a8w8_blockscale_1x128x128_256x64x64x128_16x16_32x32_1x1_8x32x1_8x32x1_1x32x1x8_8_1x1_intrawave_v3,479.37,713.68,0.0
gfx942,304,576,6144,2048,ck,0,0,29.4426,a8w8_blockscale_1x128x128_256x128x128x128_16x16_32x32_2x2_8x32x1_8x32x1_1x32x1x8_8_1x1_intrawave_v3,492.33,707.83,0.0
gfx942,304,608,6144,2048,ck,0,0,31.0966,a8w8_blockscale_1x128x128_256x128x128x128_16x16_32x32_2x2_8x32x1_8x32x1_1x32x1x8_8_1x1_intrawave_v3,492.04,684.94,0.0
gfx942,304,640,6144,2048,ck,0,0,33.2334,a8w8_blockscale_1x128x128_256x128x128x128_16x16_32x32_2x2_8x32x1_8x32x1_1x32x1x8_8_1x1_intrawave_v3,484.64,654.7,0.0
gfx942,304,672,6144,2048,ck,0,0,29.777,a8w8_blockscale_1x128x128_256x128x128x128_16x16_32x32_2x2_8x32x1_8x32x1_1x32x1x8_8_1x1_intrawave_v3,567.94,746.1,0.0
gfx942,304,704,6144,2048,ck,0,0,30.6337,a8w8_blockscale_1x128x128_256x128x128x128_16x16_32x32_2x2_8x32x1_8x32x1_1x32x1x8_8_1x1_intrawave_v3,578.34,740.21,0.0
gfx942,304,736,6144,2048,ck,0,0,31.7636,a8w8_blockscale_1x128x128_256x128x128x128_16x16_32x32_2x2_8x32x1_8x32x1_1x32x1x8_8_1x1_intrawave_v3,583.12,728.32,0.0
gfx942,304,768,6144,2048,ck,0,0,33.7972,a8w8_blockscale_1x128x128_256x128x128x128_16x16_32x32_2x2_8x32x1_8x32x1_1x32x1x8_8_1x1_intrawave_v3,571.86,698.07,0.0
gfx942,304,800,6144,2048,ck,0,0,41.6532,a8w8_blockscale_1x128x128_256x128x128x128_16x16_32x32_2x2_8x32x1_8x32x1_1x32x1x8_8_1x1_intrawave_v3,483.34,577.43,0.0
gfx942,304,832,6144,2048,ck,0,0,41.9208,a8w8_blockscale_1x128x128_256x128x128x128_16x16_32x32_2x2_8x32x1_8x32x1_1x32x1x8_8_1x1_intrawave_v3,499.46,584.69,0.0
gfx942,304,864,6144,2048,ck,0,0,43.6127,a8w8_blockscale_1x128x128_256x128x128x128_16x16_32x32_2x2_8x32x1_8x32x1_1x32x1x8_8_1x1_intrawave_v3,498.55,572.52,0.0
gfx942,304,896,6144,2048,ck,0,0,44.5136,a8w8_blockscale_1x128x128_256x128x128x128_16x16_32x32_2x2_8x32x1_8x32x1_1x32x1x8_8_1x1_intrawave_v3,506.55,571.24,0.0
gfx942,304,928,6144,2048,ck,0,0,45.7418,a8w8_blockscale_1x128x128_256x128x128x128_16x16_32x32_2x2_8x32x1_8x32x1_1x32x1x8_8_1x1_intrawave_v3,510.56,565.93,0.0
gfx942,304,960,6144,2048,ck,0,0,44.8958,a8w8_blockscale_1x128x128_256x128x128x128_16x16_32x32_2x2_8x32x1_8x32x1_1x32x1x8_8_1x1_intrawave_v3,538.12,586.81,0.0
gfx942,304,992,6144,2048,ck,0,0,45.4209,a8w8_blockscale_1x128x128_256x128x128x128_16x16_32x32_2x2_8x32x1_8x32x1_1x32x1x8_8_1x1_intrawave_v3,549.63,590.13,0.0
gfx942,304,1024,6144,2048,ck,0,0,45.866,a8w8_blockscale_1x128x128_256x128x128x128_16x16_32x32_2x2_8x32x1_8x32x1_1x32x1x8_8_1x1_intrawave_v3,561.85,594.4,0.0
gfx942,304,1088,6144,2048,ck,0,0,48.6827,a8w8_blockscale_1x128x128_256x128x128x128_16x16_32x32_2x2_8x32x1_8x32x1_1x32x1x8_8_1x1_intrawave_v3,562.43,578.86,0.0
gfx942,304,1152,6144,2048,ck,0,0,49.0828,a8w8_blockscale_1x128x128_256x128x128x128_16x16_32x32_2x2_8x32x1_8x32x1_1x32x1x8_8_1x1_intrawave_v3,590.66,592.83,0.0
gfx942,304,1216,6144,2048,ck,0,0,50.2517,a8w8_blockscale_1x128x128_256x128x128x128_16x16_32x32_2x2_8x32x1_8x32x1_1x32x1x8_8_1x1_intrawave_v3,608.97,597.3,0.0
gfx942,304,1280,6144,2048,ck,0,0,50.3622,a8w8_blockscale_1x128x128_256x128x128x128_16x16_32x32_2x2_8x32x1_8x32x1_1x32x1x8_8_1x1_intrawave_v3,639.61,614.21,0.0
gfx942,304,1344,6144,2048,ck,0,0,50.5515,a8w8_blockscale_1x128x128_256x128x128x128_16x16_32x32_2x2_8x32x1_8x32x1_1x32x1x8_8_1x1_intrawave_v3,669.08,630.06,0.0
gfx942,304,1408,6144,2048,ck,0,0,50.6684,a8w8_blockscale_1x128x128_256x128x128x128_16x16_32x32_2x2_8x32x1_8x32x1_1x32x1x8_8_1x1_intrawave_v3,699.32,646.71,0.0
gfx942,304,1472,6144,2048,ck,0,0,52.6195,a8w8_blockscale_1x128x128_256x128x128x128_16x16_32x32_2x2_8x32x1_8x32x1_1x32x1x8_8_1x1_intrawave_v3,704.0,640.17,0.0
gfx942,304,1536,6144,2048,ck,0,0,53.7149,a8w8_blockscale_1x128x128_256x128x128x128_16x16_32x32_2x2_8x32x1_8x32x1_1x32x1x8_8_1x1_intrawave_v3,719.63,644.2,0.0
gfx942,304,1600,6144,2048,ck,2,0,67.7849,a8w8_blockscale_1x128x128_256x64x128x128_16x16_32x32_1x2_8x32x1_8x32x1_1x32x1x8_8_1x1_intrawave_v3,594.02,524.02,0.0
gfx942,304,1664,6144,2048,ck,0,0,71.8684,a8w8_blockscale_1x128x128_256x128x128x128_16x16_32x32_2x2_8x32x1_8x32x1_1x32x1x8_8_1x1_intrawave_v3,582.68,507.01,0.0
gfx942,304,1728,6144,2048,ck,0,0,72.1839,a8w8_blockscale_1x128x128_256x128x128x128_16x16_32x32_2x2_8x32x1_8x32x1_1x32x1x8_8_1x1_intrawave_v3,602.44,517.5,0.0
gfx942,304,1792,6144,2048,ck,0,0,71.8198,a8w8_blockscale_1x128x128_256x128x128x128_16x16_32x32_2x2_8x32x1_8x32x1_1x32x1x8_8_1x1_intrawave_v3,627.92,532.9,0.0
gfx942,304,1856,6144,2048,ck,0,0,70.0226,a8w8_blockscale_1x128x128_256x128x128x128_16x16_32x32_2x2_8x32x1_8x32x1_1x32x1x8_8_1x1_intrawave_v3,667.04,559.68,0.0
gfx942,304,1920,6144,2048,ck,0,0,70.3625,a8w8_blockscale_1x128x128_256x128x128x128_16x16_32x32_2x2_8x32x1_8x32x1_1x32x1x8_8_1x1_intrawave_v3,686.71,570.02,0.0
gfx942,304,1984,6144,2048,ck,0,0,75.2275,a8w8_blockscale_1x128x128_256x128x128x128_16x16_32x32_2x2_8x32x1_8x32x1_1x32x1x8_8_1x1_intrawave_v3,663.71,545.35,0.0
gfx942,304,2048,6144,2048,ck,0,0,76.3017,a8w8_blockscale_1x128x128_256x128x128x128_16x16_32x32_2x2_8x32x1_8x32x1_1x32x1x8_8_1x1_intrawave_v3,675.47,549.7,0.0
gfx942,304,2112,6144,2048,ck,0,0,76.4549,a8w8_blockscale_1x128x128_256x128x128x128_16x16_32x32_2x2_8x32x1_8x32x1_1x32x1x8_8_1x1_intrawave_v3,695.18,560.6,0.0
gfx942,304,2176,6144,2048,ck,0,0,76.6152,a8w8_blockscale_1x128x128_256x128x128x128_16x16_32x32_2x2_8x32x1_8x32x1_1x32x1x8_8_1x1_intrawave_v3,714.75,571.4,0.0
gfx942,304,2240,6144,2048,ck,0,0,79.6218,a8w8_blockscale_1x128x128_256x128x128x128_16x16_32x32_2x2_8x32x1_8x32x1_1x32x1x8_8_1x1_intrawave_v3,707.99,561.35,0.0
gfx942,304,2304,6144,2048,ck,0,0,80.0165,a8w8_blockscale_1x128x128_256x128x128x128_16x16_32x32_2x2_8x32x1_8x32x1_1x32x1x8_8_1x1_intrawave_v3,724.63,570.05,0.0
gfx942,304,2368,6144,2048,ck,0,0,78.5894,a8w8_blockscale_1x128x128_256x128x128x128_16x16_32x32_2x2_8x32x1_8x32x1_1x32x1x8_8_1x1_intrawave_v3,758.28,592.07,0.0
gfx942,304,2432,6144,2048,ck,0,0,81.5067,a8w8_blockscale_1x128x128_256x128x128x128_16x16_32x32_2x2_8x32x1_8x32x1_1x32x1x8_8_1x1_intrawave_v3,750.9,582.14,0.0
gfx942,304,2496,6144,2048,ck,0,0,90.463,a8w8_blockscale_1x128x128_256x128x128x128_16x16_32x32_2x2_8x32x1_8x32x1_1x32x1x8_8_1x1_intrawave_v3,694.36,534.64,0.0
gfx942,304,2560,6144,2048,ck,0,0,92.8887,a8w8_blockscale_1x128x128_256x128x128x128_16x16_32x32_2x2_8x32x1_8x32x1_1x32x1x8_8_1x1_intrawave_v3,693.57,530.56,0.0
gfx942,304,2624,6144,2048,ck,0,0,91.6942,a8w8_blockscale_1x128x128_256x128x128x128_16x16_32x32_2x2_8x32x1_8x32x1_1x32x1x8_8_1x1_intrawave_v3,720.17,547.48,0.0
gfx942,304,2688,6144,2048,ck,0,0,97.8637,a8w8_blockscale_1x128x128_256x128x128x128_16x16_32x32_2x2_8x32x1_8x32x1_1x32x1x8_8_1x1_intrawave_v3,691.22,522.34,0.0
gfx942,304,2752,6144,2048,ck,0,0,94.6736,a8w8_blockscale_1x128x128_256x128x128x128_16x16_32x32_2x2_8x32x1_8x32x1_1x32x1x8_8_1x1_intrawave_v3,731.53,549.63,0.0
gfx942,304,2816,6144,2048,ck,0,0,96.3999,a8w8_blockscale_1x128x128_256x128x128x128_16x16_32x32_2x2_8x32x1_8x32x1_1x32x1x8_8_1x1_intrawave_v3,735.14,549.31,0.0
gfx942,304,2880,6144,2048,ck,0,0,94.8712,a8w8_blockscale_1x128x128_256x128x128x128_16x16_32x32_2x2_8x32x1_8x32x1_1x32x1x8_8_1x1_intrawave_v3,763.96,567.83,0.0
gfx942,304,2944,6144,2048,ck,0,0,94.5494,a8w8_blockscale_1x128x128_256x128x128x128_16x16_32x32_2x2_8x32x1_8x32x1_1x32x1x8_8_1x1_intrawave_v3,783.59,579.47,0.0
gfx942,304,3008,6144,2048,ck,0,0,98.4646,a8w8_blockscale_1x128x128_256x128x128x128_16x16_32x32_2x2_8x32x1_8x32x1_1x32x1x8_8_1x1_intrawave_v3,768.79,565.74,0.0
gfx942,304,3072,6144,2048,ck,0,0,97.3371,a8w8_blockscale_1x128x128_256x128x128x128_16x16_32x32_2x2_8x32x1_8x32x1_1x32x1x8_8_1x1_intrawave_v3,794.24,581.72,0.0
gfx942,304,3136,6144,2048,ck,0,0,101.4625,a8w8_blockscale_1x128x128_256x128x128x128_16x16_32x32_2x2_8x32x1_8x32x1_1x32x1x8_8_1x1_intrawave_v3,777.82,567.11,0.0
gfx942,304,3200,6144,2048,ck,0,0,100.6151,a8w8_blockscale_1x128x128_256x128x128x128_16x16_32x32_2x2_8x32x1_8x32x1_1x32x1x8_8_1x1_intrawave_v3,800.38,581.01,0.0
gfx942,304,3264,6144,2048,ck,0,0,112.7224,a8w8_blockscale_1x128x128_256x128x128x128_16x16_32x32_2x2_8x32x1_8x32x1_1x32x1x8_8_1x1_intrawave_v3,728.7,526.74,0.0
gfx942,304,3328,6144,2048,ck,0,0,114.921,a8w8_blockscale_1x128x128_256x128x128x128_16x16_32x32_2x2_8x32x1_8x32x1_1x32x1x8_8_1x1_intrawave_v3,728.78,524.65,0.0
gfx942,304,3392,6144,2048,ck,0,0,115.5233,a8w8_blockscale_1x128x128_256x128x128x128_16x16_32x32_2x2_8x32x1_8x32x1_1x32x1x8_8_1x1_intrawave_v3,738.92,529.86,0.0
gfx942,304,3456,6144,2048,ck,0,0,113.38,a8w8_blockscale_1x128x128_256x128x128x128_16x16_32x32_2x2_8x32x1_8x32x1_1x32x1x8_8_1x1_intrawave_v3,767.09,547.96,0.0
gfx942,304,3520,6144,2048,ck,0,0,117.9971,a8w8_blockscale_1x128x128_256x128x128x128_16x16_32x32_2x2_8x32x1_8x32x1_1x32x1x8_8_1x1_intrawave_v3,750.73,534.3,0.0
gfx942,304,3584,6144,2048,ck,0,0,116.3356,a8w8_blockscale_1x128x128_256x128x128x128_16x16_32x32_2x2_8x32x1_8x32x1_1x32x1x8_8_1x1_intrawave_v3,775.29,549.82,0.0
gfx942,304,3648,6144,2048,ck,0,0,119.4468,a8w8_blockscale_1x128x128_256x128x128x128_16x16_32x32_2x2_8x32x1_8x32x1_1x32x1x8_8_1x1_intrawave_v3,768.58,543.18,0.0
gfx942,304,3712,6144,2048,ck,0,0,117.5592,a8w8_blockscale_1x128x128_256x128x128x128_16x16_32x32_2x2_8x32x1_8x32x1_1x32x1x8_8_1x1_intrawave_v3,794.63,559.7,0.0
gfx942,304,3776,6144,2048,ck,0,0,123.1844,a8w8_blockscale_1x128x128_256x128x128x128_16x16_32x32_2x2_8x32x1_8x32x1_1x32x1x8_8_1x1_intrawave_v3,771.41,541.59,0.0
gfx942,304,3840,6144,2048,ck,0,0,117.044,a8w8_blockscale_1x128x128_256x128x128x128_16x16_32x32_2x2_8x32x1_8x32x1_1x32x1x8_8_1x1_intrawave_v3,825.64,577.84,0.0
gfx942,304,3904,6144,2048,ck,0,0,120.9416,a8w8_blockscale_1x128x128_256x128x128x128_16x16_32x32_2x2_8x32x1_8x32x1_1x32x1x8_8_1x1_intrawave_v3,812.35,566.81,0.0
gfx942,304,3968,6144,2048,ck,0,0,122.3799,a8w8_blockscale_1x128x128_256x128x128x128_16x16_32x32_2x2_8x32x1_8x32x1_1x32x1x8_8_1x1_intrawave_v3,815.97,567.64,0.0
gfx942,304,4032,6144,2048,ck,0,0,131.2227,a8w8_blockscale_1x128x128_256x128x128x128_16x16_32x32_2x2_8x32x1_8x32x1_1x32x1x8_8_1x1_intrawave_v3,773.25,536.38,0.0
gfx942,304,4096,6144,2048,ck,0,0,130.634,a8w8_blockscale_1x128x128_256x128x128x128_16x16_32x32_2x2_8x32x1_8x32x1_1x32x1x8_8_1x1_intrawave_v3,789.07,545.82,0.0
gfx942,304,4224,6144,2048,ck,0,0,137.4201,a8w8_blockscale_1x128x128_256x128x128x128_16x16_32x32_2x2_8x32x1_8x32x1_1x32x1x8_8_1x1_intrawave_v3,773.54,532.22,0.0
gfx942,304,4352,6144,2048,ck,0,0,136.4342,a8w8_blockscale_1x128x128_256x128x128x128_16x16_32x32_2x2_8x32x1_8x32x1_1x32x1x8_8_1x1_intrawave_v3,802.74,549.52,0.0
gfx942,304,4480,6144,2048,ck,0,0,136.8892,a8w8_blockscale_1x128x128_256x128x128x128_16x16_32x32_2x2_8x32x1_8x32x1_1x32x1x8_8_1x1_intrawave_v3,823.61,561.1,0.0
gfx942,304,4608,6144,2048,ck,0,0,141.2086,a8w8_blockscale_1x128x128_256x128x128x128_16x16_32x32_2x2_8x32x1_8x32x1_1x32x1x8_8_1x1_intrawave_v3,821.23,556.93,0.0
gfx942,304,4736,6144,2048,ck,0,0,145.8582,a8w8_blockscale_1x128x128_256x128x128x128_16x16_32x32_2x2_8x32x1_8x32x1_1x32x1x8_8_1x1_intrawave_v3,817.13,551.76,0.0
gfx942,304,4864,6144,2048,ck,0,0,146.0002,a8w8_blockscale_1x128x128_256x128x128x128_16x16_32x32_2x2_8x32x1_8x32x1_1x32x1x8_8_1x1_intrawave_v3,838.4,563.79,0.0
gfx942,304,4992,6144,2048,ck,0,0,156.4253,a8w8_blockscale_1x128x128_256x128x128x128_16x16_32x32_2x2_8x32x1_8x32x1_1x32x1x8_8_1x1_intrawave_v3,803.12,537.95,0.0
gfx942,304,5120,6144,2048,ck,0,0,158.4332,a8w8_blockscale_1x128x128_256x128x128x128_16x16_32x32_2x2_8x32x1_8x32x1_1x32x1x8_8_1x1_intrawave_v3,813.27,542.71,0.0
gfx942,304,5248,6144,2048,ck,0,0,164.1772,a8w8_blockscale_1x128x128_256x128x128x128_16x16_32x32_2x2_8x32x1_8x32x1_1x32x1x8_8_1x1_intrawave_v3,804.44,534.9,0.0
gfx942,304,5376,6144,2048,ck,0,0,163.5542,a8w8_blockscale_1x128x128_256x128x128x128_16x16_32x32_2x2_8x32x1_8x32x1_1x32x1x8_8_1x1_intrawave_v3,827.2,548.16,0.0
gfx942,304,5504,6144,2048,ck,0,0,164.4446,a8w8_blockscale_1x128x128_256x128x128x128_16x16_32x32_2x2_8x32x1_8x32x1_1x32x1x8_8_1x1_intrawave_v3,842.31,556.35,0.0
gfx942,304,5632,6144,2048,ck,0,0,163.892,a8w8_blockscale_1x128x128_256x128x128x128_16x16_32x32_2x2_8x32x1_8x32x1_1x32x1x8_8_1x1_intrawave_v3,864.8,569.42,0.0
gfx942,304,5760,6144,2048,ck,0,0,178.2529,a8w8_blockscale_1x128x128_256x128x128x128_16x16_32x32_2x2_8x32x1_8x32x1_1x32x1x8_8_1x1_intrawave_v3,813.2,533.84,0.0
gfx942,304,5888,6144,2048,ck,0,0,178.9449,a8w8_blockscale_1x128x128_256x128x128x128_16x16_32x32_2x2_8x32x1_8x32x1_1x32x1x8_8_1x1_intrawave_v3,828.06,542.03,0.0
gfx942,304,6016,6144,2048,ck,0,0,177.0378,a8w8_blockscale_1x128x128_256x128x128x128_16x16_32x32_2x2_8x32x1_8x32x1_1x32x1x8_8_1x1_intrawave_v3,855.17,558.23,0.0
gfx942,304,6144,6144,2048,ck,0,0,181.0944,a8w8_blockscale_1x128x128_256x128x128x128_16x16_32x32_2x2_8x32x1_8x32x1_1x32x1x8_8_1x1_intrawave_v3,853.8,555.86,0.0
gfx942,304,6272,6144,2048,ck,0,0,182.7726,a8w8_blockscale_1x128x128_256x128x128x128_16x16_32x32_2x2_8x32x1_8x32x1_1x32x1x8_8_1x1_intrawave_v3,863.59,560.8,0.0
gfx942,304,6400,6144,2048,ck,0,0,183.7015,a8w8_blockscale_1x128x128_256x128x128x128_16x16_32x32_2x2_8x32x1_8x32x1_1x32x1x8_8_1x1_intrawave_v3,876.76,567.95,0.0
gfx942,304,6528,6144,2048,ck,0,0,194.5982,a8w8_blockscale_1x128x128_256x128x128x128_16x16_32x32_2x2_8x32x1_8x32x1_1x32x1x8_8_1x1_intrawave_v3,844.21,545.58,0.0
gfx942,304,6656,6144,2048,ck,0,0,197.5153,a8w8_blockscale_1x128x128_256x128x128x128_16x16_32x32_2x2_8x32x1_8x32x1_1x32x1x8_8_1x1_intrawave_v3,848.05,546.81,0.0
gfx942,304,6784,6144,2048,ck,0,0,201.1208,a8w8_blockscale_1x128x128_256x128x128x128_16x16_32x32_2x2_8x32x1_8x32x1_1x32x1x8_8_1x1_intrawave_v3,848.87,546.13,0.0
gfx942,304,6912,6144,2048,ck,0,0,202.7404,a8w8_blockscale_1x128x128_256x128x128x128_16x16_32x32_2x2_8x32x1_8x32x1_1x32x1x8_8_1x1_intrawave_v3,857.97,550.82,0.0
gfx942,304,7040,6144,2048,ck,0,0,202.1502,a8w8_blockscale_1x128x128_256x128x128x128_16x16_32x32_2x2_8x32x1_8x32x1_1x32x1x8_8_1x1_intrawave_v3,876.41,561.51,0.0
gfx942,304,7168,6144,2048,ck,0,0,203.639,a8w8_blockscale_1x128x128_256x128x128x128_16x16_32x32_2x2_8x32x1_8x32x1_1x32x1x8_8_1x1_intrawave_v3,885.83,566.41,0.0
gfx942,304,7296,6144,2048,ck,0,0,206.4829,a8w8_blockscale_1x128x128_256x128x128x128_16x16_32x32_2x2_8x32x1_8x32x1_1x32x1x8_8_1x1_intrawave_v3,889.23,567.5,0.0
gfx942,304,7424,6144,2048,ck,0,0,214.559,a8w8_blockscale_1x128x128_256x128x128x128_16x16_32x32_2x2_8x32x1_8x32x1_1x32x1x8_8_1x1_intrawave_v3,870.77,554.69,0.0
gfx942,304,7552,6144,2048,ck,0,0,224.4424,a8w8_blockscale_1x128x128_256x128x128x128_16x16_32x32_2x2_8x32x1_8x32x1_1x32x1x8_8_1x1_intrawave_v3,846.78,538.44,0.0
gfx942,304,7680,6144,2048,ck,0,0,222.0632,a8w8_blockscale_1x128x128_256x128x128x128_16x16_32x32_2x2_8x32x1_8x32x1_1x32x1x8_8_1x1_intrawave_v3,870.35,552.47,0.0
gfx942,304,7808,6144,2048,ck,0,0,224.1959,a8w8_blockscale_1x128x128_256x128x128x128_16x16_32x32_2x2_8x32x1_8x32x1_1x32x1x8_8_1x1_intrawave_v3,876.44,555.4,0.0
gfx942,304,7936,6144,2048,ck,0,0,230.6388,a8w8_blockscale_1x128x128_256x128x128x128_16x16_32x32_2x2_8x32x1_8x32x1_1x32x1x8_8_1x1_intrawave_v3,865.93,547.84,0.0
gfx942,304,8064,6144,2048,ck,0,0,223.4154,a8w8_blockscale_1x128x128_256x128x128x128_16x16_32x32_2x2_8x32x1_8x32x1_1x32x1x8_8_1x1_intrawave_v3,908.34,573.77,0.0
gfx942,304,8192,6144,2048,ck,0,0,236.0245,a8w8_blockscale_1x128x128_256x128x128x128_16x16_32x32_2x2_8x32x1_8x32x1_1x32x1x8_8_1x1_intrawave_v3,873.46,550.89,0.0
gfx942,304,8320,6144,2048,ck,0,0,240.5934,a8w8_blockscale_1x128x128_256x128x128x128_16x16_32x32_2x2_8x32x1_8x32x1_1x32x1x8_8_1x1_intrawave_v3,870.26,548.06,0.0
gfx942,304,8448,6144,2048,ck,0,0,237.9132,a8w8_blockscale_1x128x128_256x128x128x128_16x16_32x32_2x2_8x32x1_8x32x1_1x32x1x8_8_1x1_intrawave_v3,893.61,561.94,0.0
gfx942,304,8576,6144,2048,ck,0,0,240.0816,a8w8_blockscale_1x128x128_256x128x128x128_16x16_32x32_2x2_8x32x1_8x32x1_1x32x1x8_8_1x1_intrawave_v3,898.95,564.51,0.0
gfx942,304,8704,6144,2048,ck,0,0,242.9581,a8w8_blockscale_1x128x128_256x128x128x128_16x16_32x32_2x2_8x32x1_8x32x1_1x32x1x8_8_1x1_intrawave_v3,901.57,565.38,0.0
gfx942,304,8832,6144,2048,ck,0,0,247.0781,a8w8_blockscale_1x128x128_256x128x128x128_16x16_32x32_2x2_8x32x1_8x32x1_1x32x1x8_8_1x1_intrawave_v3,899.57,563.38,0.0
gfx942,304,8960,6144,2048,ck,0,0,262.2789,a8w8_blockscale_1x128x128_256x128x128x128_16x16_32x32_2x2_8x32x1_8x32x1_1x32x1x8_8_1x1_intrawave_v3,859.72,537.72,0.0
gfx942,304,9088,6144,2048,ck,0,0,255.4705,a8w8_blockscale_1x128x128_256x128x128x128_16x16_32x32_2x2_8x32x1_8x32x1_1x32x1x8_8_1x1_intrawave_v3,895.24,559.24,0.0
gfx942,304,9216,6144,2048,ck,0,0,256.0493,a8w8_blockscale_1x128x128_256x128x128x128_16x16_32x32_2x2_8x32x1_8x32x1_1x32x1x8_8_1x1_intrawave_v3,905.8,565.14,0.0
gfx942,304,9344,6144,2048,ck,0,0,260.6471,a8w8_blockscale_1x128x128_256x128x128x128_16x16_32x32_2x2_8x32x1_8x32x1_1x32x1x8_8_1x1_intrawave_v3,902.18,562.21,0.0
gfx942,304,9472,6144,2048,ck,0,0,264.051,a8w8_blockscale_1x128x128_256x128x128x128_16x16_32x32_2x2_8x32x1_8x32x1_1x32x1x8_8_1x1_intrawave_v3,902.74,561.91,0.0
gfx942,304,9600,6144,2048,ck,0,0,259.411,a8w8_blockscale_1x128x128_256x128x128x128_16x16_32x32_2x2_8x32x1_8x32x1_1x32x1x8_8_1x1_intrawave_v3,931.31,579.04,0.0
gfx942,304,9728,6144,2048,ck,0,0,272.7626,a8w8_blockscale_1x128x128_256x128x128x128_16x16_32x32_2x2_8x32x1_8x32x1_1x32x1x8_8_1x1_intrawave_v3,897.53,557.42,0.0
gfx942,304,9856,6144,2048,ck,0,0,278.1367,a8w8_blockscale_1x128x128_256x128x128x128_16x16_32x32_2x2_8x32x1_8x32x1_1x32x1x8_8_1x1_intrawave_v3,891.77,553.25,0.0
gfx942,304,9984,6144,2048,ck,0,0,277.2395,a8w8_blockscale_1x128x128_256x128x128x128_16x16_32x32_2x2_8x32x1_8x32x1_1x32x1x8_8_1x1_intrawave_v3,906.28,561.66,0.0
gfx942,304,10112,6144,2048,ck,0,0,281.1778,a8w8_blockscale_1x128x128_256x128x128x128_16x16_32x32_2x2_8x32x1_8x32x1_1x32x1x8_8_1x1_intrawave_v3,905.04,560.32,0.0
gfx942,304,10240,6144,2048,ck,0,0,283.4223,a8w8_blockscale_1x128x128_256x128x128x128_16x16_32x32_2x2_8x32x1_8x32x1_1x32x1x8_8_1x1_intrawave_v3,909.24,562.35,0.0
gfx942,304,10368,6144,2048,ck,0,0,285.1387,a8w8_blockscale_1x128x128_256x128x128x128_16x16_32x32_2x2_8x32x1_8x32x1_1x32x1x8_8_1x1_intrawave_v3,915.06,565.4,0.0
gfx942,304,10496,6144,2048,ck,0,0,287.2592,a8w8_blockscale_1x128x128_256x128x128x128_16x16_32x32_2x2_8x32x1_8x32x1_1x32x1x8_8_1x1_intrawave_v3,919.52,567.62,0.0
gfx942,304,10624,6144,2048,ck,0,0,297.13,a8w8_blockscale_1x128x128_256x128x128x128_16x16_32x32_2x2_8x32x1_8x32x1_1x32x1x8_8_1x1_intrawave_v3,899.81,554.94,0.0
gfx942,304,10752,6144,2048,ck,0,0,301.708,a8w8_blockscale_1x128x128_256x128x128x128_16x16_32x32_2x2_8x32x1_8x32x1_1x32x1x8_8_1x1_intrawave_v3,896.84,552.6,0.0
gfx942,304,10880,6144,2048,ck,0,0,304.0453,a8w8_blockscale_1x128x128_256x128x128x128_16x16_32x32_2x2_8x32x1_8x32x1_1x32x1x8_8_1x1_intrawave_v3,900.54,554.39,0.0
gfx942,304,11008,6144,2048,ck,0,0,304.5517,a8w8_blockscale_1x128x128_256x128x128x128_16x16_32x32_2x2_8x32x1_8x32x1_1x32x1x8_8_1x1_intrawave_v3,909.62,559.49,0.0
gfx942,304,11136,6144,2048,ck,0,0,309.9009,a8w8_blockscale_1x128x128_256x128x128x128_16x16_32x32_2x2_8x32x1_8x32x1_1x32x1x8_8_1x1_intrawave_v3,904.31,555.75,0.0
gfx942,304,11264,6144,2048,ck,0,0,307.9801,a8w8_blockscale_1x128x128_256x128x128x128_16x16_32x32_2x2_8x32x1_8x32x1_1x32x1x8_8_1x1_intrawave_v3,920.41,565.18,0.0
gfx942,304,11392,6144,2048,ck,0,0,312.9843,a8w8_blockscale_1x128x128_256x128x128x128_16x16_32x32_2x2_8x32x1_8x32x1_1x32x1x8_8_1x1_intrawave_v3,915.99,562.0,0.0
gfx942,304,11520,6144,2048,ck,0,0,315.2002,a8w8_blockscale_1x128x128_256x128x128x128_16x16_32x32_2x2_8x32x1_8x32x1_1x32x1x8_8_1x1_intrawave_v3,919.77,563.88,0.0
gfx942,304,11648,6144,2048,ck,0,0,316.9121,a8w8_blockscale_1x128x128_256x128x128x128_16x16_32x32_2x2_8x32x1_8x32x1_1x32x1x8_8_1x1_intrawave_v3,924.96,566.62,0.0
gfx942,304,11776,6144,2048,ck,0,0,321.2391,a8w8_blockscale_1x128x128_256x128x128x128_16x16_32x32_2x2_8x32x1_8x32x1_1x32x1x8_8_1x1_intrawave_v3,922.53,564.7,0.0
gfx942,304,11904,6144,2048,ck,0,0,331.6632,a8w8_blockscale_1x128x128_256x128x128x128_16x16_32x32_2x2_8x32x1_8x32x1_1x32x1x8_8_1x1_intrawave_v3,903.25,552.48,0.0
gfx942,304,12032,6144,2048,ck,0,0,336.8872,a8w8_blockscale_1x128x128_256x128x128x128_16x16_32x32_2x2_8x32x1_8x32x1_1x32x1x8_8_1x1_intrawave_v3,898.8,549.36,0.0
gfx942,304,12160,6144,2048,ck,0,0,340.2158,a8w8_blockscale_1x128x128_256x128x128x128_16x16_32x32_2x2_8x32x1_8x32x1_1x32x1x8_8_1x1_intrawave_v3,899.48,549.38,0.0
gfx942,304,12288,6144,2048,ck,0,0,351.9394,a8w8_blockscale_1x128x128_256x128x128x128_16x16_32x32_2x2_8x32x1_8x32x1_1x32x1x8_8_1x1_intrawave_v3,878.67,536.3,0.0
gfx942,304,12416,6144,2048,ck,0,0,344.9348,a8w8_blockscale_1x128x128_256x128x128x128_16x16_32x32_2x2_8x32x1_8x32x1_1x32x1x8_8_1x1_intrawave_v3,905.85,552.51,0.0
gfx942,304,12544,6144,2048,ck,0,0,341.1848,a8w8_blockscale_1x128x128_256x128x128x128_16x16_32x32_2x2_8x32x1_8x32x1_1x32x1x8_8_1x1_intrawave_v3,925.25,563.96,0.0
gfx942,304,12672,6144,2048,ck,0,0,342.0486,a8w8_blockscale_1x128x128_256x128x128x128_16x16_32x32_2x2_8x32x1_8x32x1_1x32x1x8_8_1x1_intrawave_v3,932.33,567.9,0.0
gfx942,304,12800,6144,2048,ck,0,0,350.5178,a8w8_blockscale_1x128x128_256x128x128x128_16x16_32x32_2x2_8x32x1_8x32x1_1x32x1x8_8_1x1_intrawave_v3,918.99,559.41,0.0
gfx942,304,12928,6144,2048,ck,0,0,349.5606,a8w8_blockscale_1x128x128_256x128x128x128_16x16_32x32_2x2_8x32x1_8x32x1_1x32x1x8_8_1x1_intrawave_v3,930.72,566.19,0.0
gfx942,304,13056,6144,2048,ck,0,0,356.852,a8w8_blockscale_1x128x128_256x128x128x128_16x16_32x32_2x2_8x32x1_8x32x1_1x32x1x8_8_1x1_intrawave_v3,920.73,559.77,0.0
gfx942,304,13184,6144,2048,ck,0,0,355.5464,a8w8_blockscale_1x128x128_256x128x128x128_16x16_32x32_2x2_8x32x1_8x32x1_1x32x1x8_8_1x1_intrawave_v3,933.17,566.98,0.0
gfx942,304,13312,6144,2048,ck,0,0,359.9288,a8w8_blockscale_1x128x128_256x128x128x128_16x16_32x32_2x2_8x32x1_8x32x1_1x32x1x8_8_1x1_intrawave_v3,930.76,565.18,0.0
gfx942,304,13440,6144,2048,ck,0,0,368.1644,a8w8_blockscale_1x128x128_256x128x128x128_16x16_32x32_2x2_8x32x1_8x32x1_1x32x1x8_8_1x1_intrawave_v3,918.69,557.52,0.0
gfx942,304,13568,6144,2048,ck,0,0,367.034,a8w8_blockscale_1x128x128_256x128x128x128_16x16_32x32_2x2_8x32x1_8x32x1_1x32x1x8_8_1x1_intrawave_v3,930.3,564.24,0.0
gfx942,304,13696,6144,2048,ck,0,0,371.8783,a8w8_blockscale_1x128x128_256x128x128x128_16x16_32x32_2x2_8x32x1_8x32x1_1x32x1x8_8_1x1_intrawave_v3,926.84,561.82,0.0
gfx942,304,13824,6144,2048,ck,0,0,383.3469,a8w8_blockscale_1x128x128_256x128x128x128_16x16_32x32_2x2_8x32x1_8x32x1_1x32x1x8_8_1x1_intrawave_v3,907.51,549.8,0.0
gfx942,304,13952,6144,2048,ck,0,0,377.7531,a8w8_blockscale_1x128x128_256x128x128x128_16x16_32x32_2x2_8x32x1_8x32x1_1x32x1x8_8_1x1_intrawave_v3,929.48,562.8,0.0
gfx942,304,14080,6144,2048,ck,0,0,381.9385,a8w8_blockscale_1x128x128_256x128x128x128_16x16_32x32_2x2_8x32x1_8x32x1_1x32x1x8_8_1x1_intrawave_v3,927.73,561.44,0.0
gfx942,304,14208,6144,2048,ck,0,0,384.9186,a8w8_blockscale_1x128x128_256x128x128x128_16x16_32x32_2x2_8x32x1_8x32x1_1x32x1x8_8_1x1_intrawave_v3,928.91,561.86,0.0
gfx942,304,14336,6144,2048,ck,0,0,383.2107,a8w8_blockscale_1x128x128_256x128x128x128_16x16_32x32_2x2_8x32x1_8x32x1_1x32x1x8_8_1x1_intrawave_v3,941.46,569.15,0.0
gfx942,304,14464,6144,2048,ck,0,0,390.5952,a8w8_blockscale_1x128x128_256x128x128x128_16x16_32x32_2x2_8x32x1_8x32x1_1x32x1x8_8_1x1_intrawave_v3,931.91,563.09,0.0
gfx942,304,14592,6144,2048,ck,0,0,390.5635,a8w8_blockscale_1x128x128_256x128x128x128_16x16_32x32_2x2_8x32x1_8x32x1_1x32x1x8_8_1x1_intrawave_v3,940.23,567.83,0.0
gfx942,304,14720,6144,2048,ck,0,0,400.9069,a8w8_blockscale_1x128x128_256x128x128x128_16x16_32x32_2x2_8x32x1_8x32x1_1x32x1x8_8_1x1_intrawave_v3,924.01,557.76,0.0
gfx942,304,14848,6144,2048,ck,0,0,409.9644,a8w8_blockscale_1x128x128_256x128x128x128_16x16_32x32_2x2_8x32x1_8x32x1_1x32x1x8_8_1x1_intrawave_v3,911.45,549.91,0.0
gfx942,304,14976,6144,2048,ck,0,0,405.5177,a8w8_blockscale_1x128x128_256x128x128x128_16x16_32x32_2x2_8x32x1_8x32x1_1x32x1x8_8_1x1_intrawave_v3,929.39,560.47,0.0
gfx942,304,15104,6144,2048,ck,0,0,405.4208,a8w8_blockscale_1x128x128_256x128x128x128_16x16_32x32_2x2_8x32x1_8x32x1_1x32x1x8_8_1x1_intrawave_v3,937.56,565.13,0.0
gfx942,304,15232,6144,2048,ck,0,0,403.0487,a8w8_blockscale_1x128x128_256x128x128x128_16x16_32x32_2x2_8x32x1_8x32x1_1x32x1x8_8_1x1_intrawave_v3,951.07,573.0,0.0
gfx942,304,15360,6144,2048,ck,0,0,425.7098,a8w8_blockscale_1x128x128_256x128x128x128_16x16_32x32_2x2_8x32x1_8x32x1_1x32x1x8_8_1x1_intrawave_v3,908.01,546.81,0.0
gfx942,304,15488,6144,2048,ck,0,0,423.1741,a8w8_blockscale_1x128x128_256x128x128x128_16x16_32x32_2x2_8x32x1_8x32x1_1x32x1x8_8_1x1_intrawave_v3,921.06,554.43,0.0
gfx942,304,15616,6144,2048,ck,0,0,435.5234,a8w8_blockscale_1x128x128_256x128x128x128_16x16_32x32_2x2_8x32x1_8x32x1_1x32x1x8_8_1x1_intrawave_v3,902.34,542.92,0.0
gfx942,304,15744,6144,2048,ck,0,0,419.834,a8w8_blockscale_1x128x128_256x128x128x128_16x16_32x32_2x2_8x32x1_8x32x1_1x32x1x8_8_1x1_intrawave_v3,943.73,567.58,0.0
gfx942,304,15872,6144,2048,ck,0,0,432.0599,a8w8_blockscale_1x128x128_256x128x128x128_16x16_32x32_2x2_8x32x1_8x32x1_1x32x1x8_8_1x1_intrawave_v3,924.48,555.77,0.0
gfx942,304,16000,6144,2048,ck,0,0,445.3753,a8w8_blockscale_1x128x128_256x128x128x128_16x16_32x32_2x2_8x32x1_8x32x1_1x32x1x8_8_1x1_intrawave_v3,904.08,543.27,0.0
gfx942,304,16128,6144,2048,ck,0,0,430.1012,a8w8_blockscale_1x128x128_256x128x128x128_16x16_32x32_2x2_8x32x1_8x32x1_1x32x1x8_8_1x1_intrawave_v3,943.67,566.83,0.0
gfx942,304,16256,6144,2048,ck,0,0,447.0238,a8w8_blockscale_1x128x128_256x128x128x128_16x16_32x32_2x2_8x32x1_8x32x1_1x32x1x8_8_1x1_intrawave_v3,915.15,549.48,0.0
gfx942,304,16384,6144,2048,ck,0,0,447.0624,a8w8_blockscale_1x128x128_256x128x128x128_16x16_32x32_2x2_8x32x1_8x32x1_1x32x1x8_8_1x1_intrawave_v3,922.28,553.53,0.0
gfx942,304,16512,6144,2048,ck,0,0,452.4789,a8w8_blockscale_1x128x128_256x128x128x128_16x16_32x32_2x2_8x32x1_8x32x1_1x32x1x8_8_1x1_intrawave_v3,918.36,550.96,0.0
