aiter/configs/model_configs/a8w8_blockscale_tuned_gemm_qwen3_vl_235b.csv
gfx,cu_num,M,N,K,libtype,kernelId,splitK,us,kernelName,tflops,bw,errRatio
gfx942,304,16,1280,4096,ck,8,0,14.6646,a8w8_blockscale_1x128x128_256x16x64x256_16x16_16x16_1x1_16x16x1_16x16x1_1x16x1x16_4_1x1_intrawave_v1,11.44,364.78,0.0
gfx942,304,32,1280,4096,ck,8,0,14.6351,a8w8_blockscale_1x128x128_256x16x64x256_16x16_16x16_1x1_16x16x1_16x16x1_1x16x1x16_4_1x1_intrawave_v1,22.93,372.79,0.0
gfx942,304,48,1280,4096,ck,8,0,14.4907,a8w8_blockscale_1x128x128_256x16x64x256_16x16_16x16_1x1_16x16x1_16x16x1_1x16x1x16_4_1x1_intrawave_v1,34.73,383.86,0.0
gfx942,304,64,1280,4096,ck,8,0,14.4837,a8w8_blockscale_1x128x128_256x16x64x256_16x16_16x16_1x1_16x16x1_16x16x1_1x16x1x16_4_1x1_intrawave_v1,46.33,391.4,0.0
gfx942,304,80,1280,4096,ck,8,0,14.4881,a8w8_blockscale_1x128x128_256x16x64x256_16x16_16x16_1x1_16x16x1_16x16x1_1x16x1x16_4_1x1_intrawave_v1,57.9,398.63,0.0
gfx942,304,96,1280,4096,ck,8,0,14.4383,a8w8_blockscale_1x128x128_256x16x64x256_16x16_16x16_1x1_16x16x1_16x16x1_1x16x1x16_4_1x1_intrawave_v1,69.72,407.38,0.0
gfx942,304,112,1280,4096,ck,8,0,14.4133,a8w8_blockscale_1x128x128_256x16x64x256_16x16_16x16_1x1_16x16x1_16x16x1_1x16x1x16_4_1x1_intrawave_v1,81.48,415.47,0.0
gfx942,304,128,1280,4096,ck,8,0,14.4238,a8w8_blockscale_1x128x128_256x16x64x256_16x16_16x16_1x1_16x16x1_16x16x1_1x16x1x16_4_1x1_intrawave_v1,93.05,422.55,0.0
gfx942,304,144,1280,4096,ck,8,0,14.4242,a8w8_blockscale_1x128x128_256x16x64x256_16x16_16x16_1x1_16x16x1_16x16x1_1x16x1x16_4_1x1_intrawave_v1,104.68,429.93,0.0
gfx942,304,160,1280,4096,ck,8,0,14.4914,a8w8_blockscale_1x128x128_256x16x64x256_16x16_16x16_1x1_16x16x1_16x16x1_1x16x1x16_4_1x1_intrawave_v1,115.77,435.28,0.0
gfx942,304,176,1280,4096,ck,8,0,14.4946,a8w8_blockscale_1x128x128_256x16x64x256_16x16_16x16_1x1_16x16x1_16x16x1_1x16x1x16_4_1x1_intrawave_v1,127.32,442.53,0.0
gfx942,304,192,1280,4096,ck,8,0,14.452,a8w8_blockscale_1x128x128_256x16x64x256_16x16_16x16_1x1_16x16x1_16x16x1_1x16x1x16_4_1x1_intrawave_v1,139.31,451.21,0.0
gfx942,304,208,1280,4096,ck,8,0,14.5561,a8w8_blockscale_1x128x128_256x16x64x256_16x16_16x16_1x1_16x16x1_16x16x1_1x16x1x16_4_1x1_intrawave_v1,149.84,455.3,0.0
gfx942,304,224,1280,4096,ck,8,0,14.6069,a8w8_blockscale_1x128x128_256x16x64x256_16x16_16x16_1x1_16x16x1_16x16x1_1x16x1x16_4_1x1_intrawave_v1,160.8,461.0,0.0
gfx942,304,240,1280,4096,ck,8,0,14.5297,a8w8_blockscale_1x128x128_256x16x64x256_16x16_16x16_1x1_16x16x1_16x16x1_1x16x1x16_4_1x1_intrawave_v1,173.2,470.78,0.0
gfx942,304,256,1280,4096,ck,18,0,18.2558,a8w8_blockscale_1x128x128_256x64x64x256_16x16_32x32_1x1_16x16x1_16x16x1_1x32x1x8_8_1x1_intrawave_v1,147.04,380.53,0.0
gfx942,304,288,1280,4096,ck,18,0,19.5389,a8w8_blockscale_1x128x128_256x64x64x256_16x16_32x32_1x1_16x16x1_16x16x1_1x32x1x8_8_1x1_intrawave_v1,154.56,366.44,0.0
gfx942,304,320,1280,4096,ck,18,0,18.4779,a8w8_blockscale_1x128x128_256x64x64x256_16x16_32x32_1x1_16x16x1_16x16x1_1x32x1x8_8_1x1_intrawave_v1,181.59,399.01,0.0
gfx942,304,352,1280,4096,ck,18,0,19.571,a8w8_blockscale_1x128x128_256x64x64x256_16x16_32x32_1x1_16x16x1_16x16x1_1x32x1x8_8_1x1_intrawave_v1,188.59,387.6,0.0
gfx942,304,384,1280,4096,ck,18,0,18.3686,a8w8_blockscale_1x128x128_256x64x64x256_16x16_32x32_1x1_16x16x1_16x16x1_1x32x1x8_8_1x1_intrawave_v1,219.21,424.57,0.0
gfx942,304,416,1280,4096,ck,18,0,19.6943,a8w8_blockscale_1x128x128_256x64x64x256_16x16_32x32_1x1_16x16x1_16x16x1_1x32x1x8_8_1x1_intrawave_v1,221.49,406.81,0.0
gfx942,304,448,1280,4096,ck,18,0,18.4461,a8w8_blockscale_1x128x128_256x64x64x256_16x16_32x32_1x1_16x16x1_16x16x1_1x32x1x8_8_1x1_intrawave_v1,254.67,445.88,0.0
gfx942,304,480,1280,4096,ck,18,0,20.4443,a8w8_blockscale_1x128x128_256x64x64x256_16x16_32x32_1x1_16x16x1_16x16x1_1x32x1x8_8_1x1_intrawave_v1,246.19,412.72,0.0
gfx942,304,512,1280,4096,ck,18,0,18.7053,a8w8_blockscale_1x128x128_256x64x64x256_16x16_32x32_1x1_16x16x1_16x16x1_1x32x1x8_8_1x1_intrawave_v1,287.02,462.48,0.0
gfx942,304,544,1280,4096,ck,18,0,20.135,a8w8_blockscale_1x128x128_256x64x64x256_16x16_32x32_1x1_16x16x1_16x16x1_1x32x1x8_8_1x1_intrawave_v1,283.3,440.22,0.0
gfx942,304,576,1280,4096,ck,18,0,19.4673,a8w8_blockscale_1x128x128_256x64x64x256_16x16_32x32_1x1_16x16x1_16x16x1_1x32x1x8_8_1x1_intrawave_v1,310.25,466.26,0.0
gfx942,304,608,1280,4096,ck,18,0,21.2679,a8w8_blockscale_1x128x128_256x64x64x256_16x16_32x32_1x1_16x16x1_16x16x1_1x32x1x8_8_1x1_intrawave_v1,299.76,436.8,0.0
gfx942,304,640,1280,4096,ck,18,0,20.3045,a8w8_blockscale_1x128x128_256x64x64x256_16x16_32x32_1x1_16x16x1_16x16x1_1x32x1x8_8_1x1_intrawave_v1,330.51,468.01,0.0
gfx942,304,672,1280,4096,ck,18,0,22.7396,a8w8_blockscale_1x128x128_256x64x64x256_16x16_32x32_1x1_16x16x1_16x16x1_1x32x1x8_8_1x1_intrawave_v1,309.87,427.26,0.0
gfx942,304,704,1280,4096,ck,18,0,20.8517,a8w8_blockscale_1x128x128_256x64x64x256_16x16_32x32_1x1_16x16x1_16x16x1_1x32x1x8_8_1x1_intrawave_v1,354.02,476.16,0.0
gfx942,304,736,1280,4096,ck,18,0,24.0449,a8w8_blockscale_1x128x128_256x64x64x256_16x16_32x32_1x1_16x16x1_16x16x1_1x32x1x8_8_1x1_intrawave_v1,320.96,421.78,0.0
gfx942,304,768,1280,4096,ck,18,0,21.9846,a8w8_blockscale_1x128x128_256x64x64x256_16x16_32x32_1x1_16x16x1_16x16x1_1x32x1x8_8_1x1_intrawave_v1,366.3,471.0,0.0
gfx942,304,800,1280,4096,ck,18,0,25.7719,a8w8_blockscale_1x128x128_256x64x64x256_16x16_32x32_1x1_16x16x1_16x16x1_1x32x1x8_8_1x1_intrawave_v1,325.49,410.05,0.0
gfx942,304,832,1280,4096,ck,18,0,24.0195,a8w8_blockscale_1x128x128_256x64x64x256_16x16_32x32_1x1_16x16x1_16x16x1_1x32x1x8_8_1x1_intrawave_v1,363.21,448.83,0.0
gfx942,304,864,1280,4096,ck,18,0,26.6216,a8w8_blockscale_1x128x128_256x64x64x256_16x16_32x32_1x1_16x16x1_16x16x1_1x32x1x8_8_1x1_intrawave_v1,340.31,412.96,0.0
gfx942,304,896,1280,4096,ck,18,0,24.0746,a8w8_blockscale_1x128x128_256x64x64x256_16x16_32x32_1x1_16x16x1_16x16x1_1x32x1x8_8_1x1_intrawave_v1,390.26,465.5,0.0
gfx942,304,928,1280,4096,ck,18,0,26.9324,a8w8_blockscale_1x128x128_256x64x64x256_16x16_32x32_1x1_16x16x1_16x16x1_1x32x1x8_8_1x1_intrawave_v1,361.3,424.01,0.0
gfx942,304,960,1280,4096,ck,18,0,25.1321,a8w8_blockscale_1x128x128_256x64x64x256_16x16_32x32_1x1_16x16x1_16x16x1_1x32x1x8_8_1x1_intrawave_v1,400.54,462.86,0.0
gfx942,304,992,1280,4096,ck,3,0,32.0128,a8w8_blockscale_1x128x128_256x64x64x128_16x16_32x32_1x1_8x32x1_8x32x1_1x32x1x8_8_1x1_intrawave_v3,324.93,370.03,0.0
gfx942,304,1024,1280,4096,ck,3,0,31.8285,a8w8_blockscale_1x128x128_256x64x64x128_16x16_32x32_1x1_8x32x1_8x32x1_1x32x1x8_8_1x1_intrawave_v3,337.35,378.86,0.0
gfx942,304,1088,1280,4096,ck,3,0,33.7642,a8w8_blockscale_1x128x128_256x64x64x128_16x16_32x32_1x1_8x32x1_8x32x1_1x32x1x8_8_1x1_intrawave_v3,337.89,369.76,0.0
gfx942,304,1152,1280,4096,ck,3,0,36.2215,a8w8_blockscale_1x128x128_256x64x64x128_16x16_32x32_1x1_8x32x1_8x32x1_1x32x1x8_8_1x1_intrawave_v3,333.49,356.43,0.0
gfx942,304,1216,1280,4096,ck,3,0,38.5534,a8w8_blockscale_1x128x128_256x64x64x128_16x16_32x32_1x1_8x32x1_8x32x1_1x32x1x8_8_1x1_intrawave_v3,330.73,345.92,0.0
gfx942,304,1280,1280,4096,ck,3,0,37.6051,a8w8_blockscale_1x128x128_256x64x64x128_16x16_32x32_1x1_8x32x1_8x32x1_1x32x1x8_8_1x1_intrawave_v3,356.91,365.98,0.0
gfx942,304,1344,1280,4096,ck,3,0,39.2945,a8w8_blockscale_1x128x128_256x64x64x128_16x16_32x32_1x1_8x32x1_8x32x1_1x32x1x8_8_1x1_intrawave_v3,358.65,361.08,0.0
gfx942,304,1408,1280,4096,ck,3,0,39.1102,a8w8_blockscale_1x128x128_256x64x64x128_16x16_32x32_1x1_8x32x1_8x32x1_1x32x1x8_8_1x1_intrawave_v3,377.5,373.68,0.0
gfx942,304,1472,1280,4096,ck,3,0,38.5562,a8w8_blockscale_1x128x128_256x64x64x128_16x16_32x32_1x1_8x32x1_8x32x1_1x32x1x8_8_1x1_intrawave_v3,400.33,390.09,0.0
gfx942,304,1536,1280,4096,ck,3,0,40.8705,a8w8_blockscale_1x128x128_256x64x64x128_16x16_32x32_1x1_8x32x1_8x32x1_1x32x1x8_8_1x1_intrawave_v3,394.08,378.43,0.0
gfx942,304,1600,1280,4096,ck,3,0,40.7293,a8w8_blockscale_1x128x128_256x64x64x128_16x16_32x32_1x1_8x32x1_8x32x1_1x32x1x8_8_1x1_intrawave_v3,411.92,390.2,0.0
gfx942,304,1664,1280,4096,ck,3,0,40.9151,a8w8_blockscale_1x128x128_256x64x64x128_16x16_32x32_1x1_8x32x1_8x32x1_1x32x1x8_8_1x1_intrawave_v3,426.45,398.84,0.0
gfx942,304,1728,1280,4096,ck,2,0,42.1219,a8w8_blockscale_1x128x128_256x64x128x128_16x16_32x32_1x2_8x32x1_8x32x1_1x32x1x8_8_1x1_intrawave_v3,430.17,397.52,0.0
gfx942,304,1792,1280,4096,ck,2,0,42.4375,a8w8_blockscale_1x128x128_256x64x128x128_16x16_32x32_1x2_8x32x1_8x32x1_1x32x1x8_8_1x1_intrawave_v3,442.78,404.61,0.0
gfx942,304,1856,1280,4096,ck,2,0,43.425,a8w8_blockscale_1x128x128_256x64x128x128_16x16_32x32_1x2_8x32x1_8x32x1_1x32x1x8_8_1x1_intrawave_v3,448.17,405.21,0.0
gfx942,304,1920,1280,4096,ck,2,0,44.5675,a8w8_blockscale_1x128x128_256x64x128x128_16x16_32x32_1x2_8x32x1_8x32x1_1x32x1x8_8_1x1_intrawave_v3,451.73,404.38,0.0
gfx942,304,1984,1280,4096,ck,0,0,51.9566,a8w8_blockscale_1x128x128_256x128x128x128_16x16_32x32_2x2_8x32x1_8x32x1_1x32x1x8_8_1x1_intrawave_v3,400.41,355.07,0.0
gfx942,304,2048,1280,4096,ck,2,0,54.5781,a8w8_blockscale_1x128x128_256x64x128x128_16x16_32x32_1x2_8x32x1_8x32x1_1x32x1x8_8_1x1_intrawave_v3,393.47,345.82,0.0
gfx942,304,2112,1280,4096,ck,0,0,51.7755,a8w8_blockscale_1x128x128_256x128x128x128_16x16_32x32_2x2_8x32x1_8x32x1_1x32x1x8_8_1x1_intrawave_v3,427.73,372.77,0.0
gfx942,304,2176,1280,4096,ck,0,0,56.3331,a8w8_blockscale_1x128x128_256x128x128x128_16x16_32x32_2x2_8x32x1_8x32x1_1x32x1x8_8_1x1_intrawave_v3,405.04,350.17,0.0
gfx942,304,2240,1280,4096,ck,0,0,53.4659,a8w8_blockscale_1x128x128_256x128x128x128_16x16_32x32_2x2_8x32x1_8x32x1_1x32x1x8_8_1x1_intrawave_v3,439.31,376.92,0.0
gfx942,304,2304,1280,4096,ck,2,0,56.9325,a8w8_blockscale_1x128x128_256x64x128x128_16x16_32x32_1x2_8x32x1_8x32x1_1x32x1x8_8_1x1_intrawave_v3,424.35,361.45,0.0
gfx942,304,2368,1280,4096,ck,0,0,52.8948,a8w8_blockscale_1x128x128_256x128x128x128_16x16_32x32_2x2_8x32x1_8x32x1_1x32x1x8_8_1x1_intrawave_v3,469.43,397.1,0.0
gfx942,304,2432,1280,4096,ck,2,0,57.6317,a8w8_blockscale_1x128x128_256x64x128x128_16x16_32x32_1x2_8x32x1_8x32x1_1x32x1x8_8_1x1_intrawave_v3,442.49,371.85,0.0
gfx942,304,2496,1280,4096,ck,0,0,54.9979,a8w8_blockscale_1x128x128_256x128x128x128_16x16_32x32_2x2_8x32x1_8x32x1_1x32x1x8_8_1x1_intrawave_v3,475.88,397.4,0.0
gfx942,304,2560,1280,4096,ck,0,0,58.3357,a8w8_blockscale_1x128x128_256x128x128x128_16x16_32x32_2x2_8x32x1_8x32x1_1x32x1x8_8_1x1_intrawave_v3,460.16,381.97,0.0
gfx942,304,2624,1280,4096,ck,0,0,56.3135,a8w8_blockscale_1x128x128_256x128x128x128_16x16_32x32_2x2_8x32x1_8x32x1_1x32x1x8_8_1x1_intrawave_v3,488.6,403.25,0.0
gfx942,304,2688,1280,4096,ck,2,0,59.0217,a8w8_blockscale_1x128x128_256x64x128x128_16x16_32x32_1x2_8x32x1_8x32x1_1x32x1x8_8_1x1_intrawave_v3,477.55,391.96,0.0
gfx942,304,2752,1280,4096,ck,0,0,56.5819,a8w8_blockscale_1x128x128_256x128x128x128_16x16_32x32_2x2_8x32x1_8x32x1_1x32x1x8_8_1x1_intrawave_v3,510.0,416.39,0.0
gfx942,304,2816,1280,4096,ck,0,0,60.1164,a8w8_blockscale_1x128x128_256x128x128x128_16x16_32x32_2x2_8x32x1_8x32x1_1x32x1x8_8_1x1_intrawave_v3,491.18,399.0,0.0
gfx942,304,2880,1280,4096,ck,0,0,58.6714,a8w8_blockscale_1x128x128_256x128x128x128_16x16_32x32_2x2_8x32x1_8x32x1_1x32x1x8_8_1x1_intrawave_v3,514.71,416.08,0.0
gfx942,304,2944,1280,4096,ck,2,0,60.0218,a8w8_blockscale_1x128x128_256x64x128x128_16x16_32x32_1x2_8x32x1_8x32x1_1x32x1x8_8_1x1_intrawave_v3,514.31,413.82,0.0
gfx942,304,3008,1280,4096,ck,0,0,58.9351,a8w8_blockscale_1x128x128_256x128x128x128_16x16_32x32_2x2_8x32x1_8x32x1_1x32x1x8_8_1x1_intrawave_v3,535.18,428.68,0.0
gfx942,304,3072,1280,4096,ck,2,0,63.4209,a8w8_blockscale_1x128x128_256x64x128x128_16x16_32x32_1x2_8x32x1_8x32x1_1x32x1x8_8_1x1_intrawave_v3,507.91,405.07,0.0
gfx942,304,3136,1280,4096,ck,0,0,60.6246,a8w8_blockscale_1x128x128_256x128x128x128_16x16_32x32_2x2_8x32x1_8x32x1_1x32x1x8_8_1x1_intrawave_v3,542.41,430.78,0.0
gfx942,304,3200,1280,4096,ck,0,0,62.9041,a8w8_blockscale_1x128x128_256x128x128x128_16x16_32x32_2x2_8x32x1_8x32x1_1x32x1x8_8_1x1_intrawave_v3,533.42,421.95,0.0
gfx942,304,3264,1280,4096,ck,0,0,61.5838,a8w8_blockscale_1x128x128_256x128x128x128_16x16_32x32_2x2_8x32x1_8x32x1_1x32x1x8_8_1x1_intrawave_v3,555.76,437.91,0.0
gfx942,304,3328,1280,4096,ck,2,0,63.9888,a8w8_blockscale_1x128x128_256x64x128x128_16x16_32x32_1x2_8x32x1_8x32x1_1x32x1x8_8_1x1_intrawave_v3,545.35,428.11,0.0
gfx942,304,3392,1280,4096,ck,0,0,63.1022,a8w8_blockscale_1x128x128_256x128x128x128_16x16_32x32_2x2_8x32x1_8x32x1_1x32x1x8_8_1x1_intrawave_v3,563.65,440.87,0.0
gfx942,304,3456,1280,4096,ck,0,0,65.2933,a8w8_blockscale_1x128x128_256x128x128x128_16x16_32x32_2x2_8x32x1_8x32x1_1x32x1x8_8_1x1_intrawave_v3,555.02,432.6,0.0
gfx942,304,3520,1280,4096,ck,0,0,63.4724,a8w8_blockscale_1x128x128_256x128x128x128_16x16_32x32_2x2_8x32x1_8x32x1_1x32x1x8_8_1x1_intrawave_v3,581.51,451.72,0.0
gfx942,304,3584,1280,4096,ck,0,0,65.5092,a8w8_blockscale_1x128x128_256x128x128x128_16x16_32x32_2x2_8x32x1_8x32x1_1x32x1x8_8_1x1_intrawave_v3,573.67,444.18,0.0
gfx942,304,3648,1280,4096,ck,0,0,62.3437,a8w8_blockscale_1x128x128_256x128x128x128_16x16_32x32_2x2_8x32x1_8x32x1_1x32x1x8_8_1x1_intrawave_v3,613.57,473.57,0.0
gfx942,304,3712,1280,4096,ck,0,0,66.4425,a8w8_blockscale_1x128x128_256x128x128x128_16x16_32x32_2x2_8x32x1_8x32x1_1x32x1x8_8_1x1_intrawave_v3,585.82,450.76,0.0
gfx942,304,3776,1280,4096,ck,0,0,63.8163,a8w8_blockscale_1x128x128_256x128x128x128_16x16_32x32_2x2_8x32x1_8x32x1_1x32x1x8_8_1x1_intrawave_v3,620.44,475.99,0.0
gfx942,304,3840,1280,4096,ck,0,0,66.3721,a8w8_blockscale_1x128x128_256x128x128x128_16x16_32x32_2x2_8x32x1_8x32x1_1x32x1x8_8_1x1_intrawave_v3,606.66,464.08,0.0
gfx942,304,3904,1280,4096,ck,0,0,85.715,a8w8_blockscale_1x128x128_256x128x128x128_16x16_32x32_2x2_8x32x1_8x32x1_1x32x1x8_8_1x1_intrawave_v3,477.59,364.32,0.0
gfx942,304,3968,1280,4096,ck,0,0,81.5157,a8w8_blockscale_1x128x128_256x128x128x128_16x16_32x32_2x2_8x32x1_8x32x1_1x32x1x8_8_1x1_intrawave_v3,510.42,388.32,0.0
gfx942,304,4032,1280,4096,ck,0,0,80.7641,a8w8_blockscale_1x128x128_256x128x128x128_16x16_32x32_2x2_8x32x1_8x32x1_1x32x1x8_8_1x1_intrawave_v3,523.48,397.2,0.0
gfx942,304,4096,1280,4096,ck,0,0,81.445,a8w8_blockscale_1x128x128_256x128x128x128_16x16_32x32_2x2_8x32x1_8x32x1_1x32x1x8_8_1x1_intrawave_v3,527.35,399.11,0.0
gfx942,304,4224,1280,4096,ck,0,0,85.4302,a8w8_blockscale_1x128x128_256x128x128x128_16x16_32x32_2x2_8x32x1_8x32x1_1x32x1x8_8_1x1_intrawave_v3,518.46,390.47,0.0
gfx942,304,4352,1280,4096,ck,0,0,87.1083,a8w8_blockscale_1x128x128_256x128x128x128_16x16_32x32_2x2_8x32x1_8x32x1_1x32x1x8_8_1x1_intrawave_v3,523.88,392.73,0.0
gfx942,304,4480,1280,4096,ck,0,0,83.9635,a8w8_blockscale_1x128x128_256x128x128x128_16x16_32x32_2x2_8x32x1_8x32x1_1x32x1x8_8_1x1_intrawave_v3,559.48,417.58,0.0
gfx942,304,4608,1280,4096,ck,0,0,85.2826,a8w8_blockscale_1x128x128_256x128x128x128_16x16_32x32_2x2_8x32x1_8x32x1_1x32x1x8_8_1x1_intrawave_v3,566.57,421.11,0.0
gfx942,304,4736,1280,4096,ck,0,0,84.6039,a8w8_blockscale_1x128x128_256x128x128x128_16x16_32x32_2x2_8x32x1_8x32x1_1x32x1x8_8_1x1_intrawave_v3,586.98,434.56,0.0
gfx942,304,4864,1280,4096,ck,0,0,84.5117,a8w8_blockscale_1x128x128_256x128x128x128_16x16_32x32_2x2_8x32x1_8x32x1_1x32x1x8_8_1x1_intrawave_v3,603.5,445.12,0.0
gfx942,304,4992,1280,4096,ck,0,0,88.6505,a8w8_blockscale_1x128x128_256x128x128x128_16x16_32x32_2x2_8x32x1_8x32x1_1x32x1x8_8_1x1_intrawave_v3,590.46,433.95,0.0
gfx942,304,5120,1280,4096,ck,0,0,87.2963,a8w8_blockscale_1x128x128_256x128x128x128_16x16_32x32_2x2_8x32x1_8x32x1_1x32x1x8_8_1x1_intrawave_v3,615.0,450.44,0.0
gfx942,304,5248,1280,4096,ck,0,0,88.9203,a8w8_blockscale_1x128x128_256x128x128x128_16x16_32x32_2x2_8x32x1_8x32x1_1x32x1x8_8_1x1_intrawave_v3,618.86,451.79,0.0
gfx942,304,5376,1280,4096,ck,0,0,90.7707,a8w8_blockscale_1x128x128_256x128x128x128_16x16_32x32_2x2_8x32x1_8x32x1_1x32x1x8_8_1x1_intrawave_v3,621.03,451.97,0.0
gfx942,304,5504,1280,4096,ck,0,0,93.5848,a8w8_blockscale_1x128x128_256x128x128x128_16x16_32x32_2x2_8x32x1_8x32x1_1x32x1x8_8_1x1_intrawave_v3,616.7,447.48,0.0
gfx942,304,5632,1280,4096,ck,0,0,90.6656,a8w8_blockscale_1x128x128_256x128x128x128_16x16_32x32_2x2_8x32x1_8x32x1_1x32x1x8_8_1x1_intrawave_v3,651.36,471.29,0.0
gfx942,304,5760,1280,4096,ck,0,0,97.9141,a8w8_blockscale_1x128x128_256x128x128x128_16x16_32x32_2x2_8x32x1_8x32x1_1x32x1x8_8_1x1_intrawave_v3,616.85,445.1,0.0
gfx942,304,5888,1280,4096,ck,0,0,92.5898,a8w8_blockscale_1x128x128_256x128x128x128_16x16_32x32_2x2_8x32x1_8x32x1_1x32x1x8_8_1x1_intrawave_v3,666.81,479.9,0.0
gfx942,304,6016,1280,4096,ck,0,0,93.5299,a8w8_blockscale_1x128x128_256x128x128x128_16x16_32x32_2x2_8x32x1_8x32x1_1x32x1x8_8_1x1_intrawave_v3,674.46,484.18,0.0
gfx942,304,6144,1280,4096,ck,0,0,94.8305,a8w8_blockscale_1x128x128_256x128x128x128_16x16_32x32_2x2_8x32x1_8x32x1_1x32x1x8_8_1x1_intrawave_v3,679.36,486.52,0.0
gfx942,304,6272,1280,4096,ck,0,0,95.8972,a8w8_blockscale_1x128x128_256x128x128x128_16x16_32x32_2x2_8x32x1_8x32x1_1x32x1x8_8_1x1_intrawave_v3,685.8,490.0,0.0
gfx942,304,6400,1280,4096,ck,0,0,96.126,a8w8_blockscale_1x128x128_256x128x128x128_16x16_32x32_2x2_8x32x1_8x32x1_1x32x1x8_8_1x1_intrawave_v3,698.13,497.69,0.0
gfx942,304,6528,1280,4096,ck,0,0,100.7961,a8w8_blockscale_1x128x128_256x128x128x128_16x16_32x32_2x2_8x32x1_8x32x1_1x32x1x8_8_1x1_intrawave_v3,679.1,483.09,0.0
gfx942,304,6656,1280,4096,ck,0,0,101.0562,a8w8_blockscale_1x128x128_256x128x128x128_16x16_32x32_2x2_8x32x1_8x32x1_1x32x1x8_8_1x1_intrawave_v3,690.64,490.27,0.0
gfx942,304,6784,1280,4096,ck,0,0,98.882,a8w8_blockscale_1x128x128_256x128x128x128_16x16_32x32_2x2_8x32x1_8x32x1_1x32x1x8_8_1x1_intrawave_v3,719.4,509.67,0.0
gfx942,304,6912,1280,4096,ck,0,0,101.0965,a8w8_blockscale_1x128x128_256x128x128x128_16x16_32x32_2x2_8x32x1_8x32x1_1x32x1x8_8_1x1_intrawave_v3,716.91,506.93,0.0
gfx942,304,7040,1280,4096,ck,0,0,101.9025,a8w8_blockscale_1x128x128_256x128x128x128_16x16_32x32_2x2_8x32x1_8x32x1_1x32x1x8_8_1x1_intrawave_v3,724.42,511.28,0.0
gfx942,304,7168,1280,4096,ck,0,0,104.8543,a8w8_blockscale_1x128x128_256x128x128x128_16x16_32x32_2x2_8x32x1_8x32x1_1x32x1x8_8_1x1_intrawave_v3,716.82,505.02,0.0
gfx942,304,7296,1280,4096,ck,0,0,109.1708,a8w8_blockscale_1x128x128_256x128x128x128_16x16_32x32_2x2_8x32x1_8x32x1_1x32x1x8_8_1x1_intrawave_v3,700.77,492.85,0.0
gfx942,304,7424,1280,4096,ck,0,0,108.3831,a8w8_blockscale_1x128x128_256x128x128x128_16x16_32x32_2x2_8x32x1_8x32x1_1x32x1x8_8_1x1_intrawave_v3,718.25,504.29,0.0
gfx942,304,7552,1280,4096,ck,0,0,111.1328,a8w8_blockscale_1x128x128_256x128x128x128_16x16_32x32_2x2_8x32x1_8x32x1_1x32x1x8_8_1x1_intrawave_v3,712.56,499.48,0.0
gfx942,304,7680,1280,4096,ck,0,0,115.8008,a8w8_blockscale_1x128x128_256x128x128x128_16x16_32x32_2x2_8x32x1_8x32x1_1x32x1x8_8_1x1_intrawave_v3,695.42,486.71,0.0
gfx942,304,7808,1280,4096,ck,0,0,143.1649,a8w8_blockscale_1x128x128_256x128x128x128_16x16_32x32_2x2_8x32x1_8x32x1_1x32x1x8_8_1x1_intrawave_v3,571.88,399.63,0.0
gfx942,304,7936,1280,4096,ck,0,0,146.8508,a8w8_blockscale_1x128x128_256x128x128x128_16x16_32x32_2x2_8x32x1_8x32x1_1x32x1x8_8_1x1_intrawave_v3,566.66,395.4,0.0
gfx942,304,8064,1280,4096,ck,0,0,143.5386,a8w8_blockscale_1x128x128_256x128x128x128_16x16_32x32_2x2_8x32x1_8x32x1_1x32x1x8_8_1x1_intrawave_v3,589.09,410.46,0.0
gfx942,304,8192,1280,4096,ck,0,0,142.5796,a8w8_blockscale_1x128x128_256x128x128x128_16x16_32x32_2x2_8x32x1_8x32x1_1x32x1x8_8_1x1_intrawave_v3,602.47,419.2,0.0
gfx942,304,8320,1280,4096,ck,0,0,147.1474,a8w8_blockscale_1x128x128_256x128x128x128_16x16_32x32_2x2_8x32x1_8x32x1_1x32x1x8_8_1x1_intrawave_v3,592.89,411.97,0.0
gfx942,304,8448,1280,4096,ck,0,0,141.2549,a8w8_blockscale_1x128x128_256x128x128x128_16x16_32x32_2x2_8x32x1_8x32x1_1x32x1x8_8_1x1_intrawave_v3,627.12,435.19,0.0
gfx942,304,8576,1280,4096,ck,0,0,140.8142,a8w8_blockscale_1x128x128_256x128x128x128_16x16_32x32_2x2_8x32x1_8x32x1_1x32x1x8_8_1x1_intrawave_v3,638.61,442.6,0.0
gfx942,304,8704,1280,4096,ck,0,0,141.8838,a8w8_blockscale_1x128x128_256x128x128x128_16x16_32x32_2x2_8x32x1_8x32x1_1x32x1x8_8_1x1_intrawave_v3,643.26,445.27,0.0
gfx942,304,8832,1280,4096,ck,0,0,146.8398,a8w8_blockscale_1x128x128_256x128x128x128_16x16_32x32_2x2_8x32x1_8x32x1_1x32x1x8_8_1x1_intrawave_v3,630.69,436.04,0.0
gfx942,304,8960,1280,4096,ck,0,0,142.602,a8w8_blockscale_1x128x128_256x128x128x128_16x16_32x32_2x2_8x32x1_8x32x1_1x32x1x8_8_1x1_intrawave_v3,658.84,454.98,0.0
gfx942,304,9088,1280,4096,ck,0,0,143.0113,a8w8_blockscale_1x128x128_256x128x128x128_16x16_32x32_2x2_8x32x1_8x32x1_1x32x1x8_8_1x1_intrawave_v3,666.34,459.63,0.0
gfx942,304,9216,1280,4096,ck,0,0,142.3599,a8w8_blockscale_1x128x128_256x128x128x128_16x16_32x32_2x2_8x32x1_8x32x1_1x32x1x8_8_1x1_intrawave_v3,678.82,467.72,0.0
gfx942,304,9344,1280,4096,ck,0,0,143.7292,a8w8_blockscale_1x128x128_256x128x128x128_16x16_32x32_2x2_8x32x1_8x32x1_1x32x1x8_8_1x1_intrawave_v3,681.69,469.19,0.0
gfx942,304,9472,1280,4096,ck,0,0,142.0474,a8w8_blockscale_1x128x128_256x128x128x128_16x16_32x32_2x2_8x32x1_8x32x1_1x32x1x8_8_1x1_intrawave_v3,699.21,480.74,0.0
gfx942,304,9600,1280,4096,ck,0,0,143.2039,a8w8_blockscale_1x128x128_256x128x128x128_16x16_32x32_2x2_8x32x1_8x32x1_1x32x1x8_8_1x1_intrawave_v3,702.94,482.81,0.0
gfx942,304,9728,1280,4096,ck,0,0,143.3351,a8w8_blockscale_1x128x128_256x128x128x128_16x16_32x32_2x2_8x32x1_8x32x1_1x32x1x8_8_1x1_intrawave_v3,711.66,488.31,0.0
gfx942,304,9856,1280,4096,ck,0,0,148.7671,a8w8_blockscale_1x128x128_256x128x128x128_16x16_32x32_2x2_8x32x1_8x32x1_1x32x1x8_8_1x1_intrawave_v3,694.69,476.21,0.0
gfx942,304,9984,1280,4096,ck,0,0,147.3584,a8w8_blockscale_1x128x128_256x128x128x128_16x16_32x32_2x2_8x32x1_8x32x1_1x32x1x8_8_1x1_intrawave_v3,710.44,486.54,0.0
gfx942,304,10112,1280,4096,ck,0,0,148.8204,a8w8_blockscale_1x128x128_256x128x128x128_16x16_32x32_2x2_8x32x1_8x32x1_1x32x1x8_8_1x1_intrawave_v3,712.48,487.49,0.0
gfx942,304,10240,1280,4096,ck,0,0,145.146,a8w8_blockscale_1x128x128_256x128x128x128_16x16_32x32_2x2_8x32x1_8x32x1_1x32x1x8_8_1x1_intrawave_v3,739.77,505.7,0.0
gfx942,304,10368,1280,4096,ck,0,0,149.4419,a8w8_blockscale_1x128x128_256x128x128x128_16x16_32x32_2x2_8x32x1_8x32x1_1x32x1x8_8_1x1_intrawave_v3,727.48,496.86,0.0
gfx942,304,10496,1280,4096,ck,0,0,150.0612,a8w8_blockscale_1x128x128_256x128x128x128_16x16_32x32_2x2_8x32x1_8x32x1_1x32x1x8_8_1x1_intrawave_v3,733.42,500.49,0.0
gfx942,304,10624,1280,4096,ck,0,0,152.5741,a8w8_blockscale_1x128x128_256x128x128x128_16x16_32x32_2x2_8x32x1_8x32x1_1x32x1x8_8_1x1_intrawave_v3,730.14,497.83,0.0
gfx942,304,10752,1280,4096,ck,0,0,154.0603,a8w8_blockscale_1x128x128_256x128x128x128_16x16_32x32_2x2_8x32x1_8x32x1_1x32x1x8_8_1x1_intrawave_v3,731.81,498.56,0.0
gfx942,304,10880,1280,4096,ck,0,0,156.123,a8w8_blockscale_1x128x128_256x128x128x128_16x16_32x32_2x2_8x32x1_8x32x1_1x32x1x8_8_1x1_intrawave_v3,730.74,497.43,0.0
gfx942,304,11008,1280,4096,ck,0,0,153.0377,a8w8_blockscale_1x128x128_256x128x128x128_16x16_32x32_2x2_8x32x1_8x32x1_1x32x1x8_8_1x1_intrawave_v3,754.24,513.02,0.0
gfx942,304,11136,1280,4096,ck,0,0,154.8107,a8w8_blockscale_1x128x128_256x128x128x128_16x16_32x32_2x2_8x32x1_8x32x1_1x32x1x8_8_1x1_intrawave_v3,754.27,512.65,0.0
gfx942,304,11264,1280,4096,ck,0,0,162.7917,a8w8_blockscale_1x128x128_256x128x128x128_16x16_32x32_2x2_8x32x1_8x32x1_1x32x1x8_8_1x1_intrawave_v3,725.54,492.75,0.0
gfx942,304,11392,1280,4096,ck,0,0,161.7883,a8w8_blockscale_1x128x128_256x128x128x128_16x16_32x32_2x2_8x32x1_8x32x1_1x32x1x8_8_1x1_intrawave_v3,738.33,501.07,0.0
gfx942,304,11520,1280,4096,ck,0,0,156.8045,a8w8_blockscale_1x128x128_256x128x128x128_16x16_32x32_2x2_8x32x1_8x32x1_1x32x1x8_8_1x1_intrawave_v3,770.36,522.43,0.0
gfx942,304,11648,1280,4096,ck,0,0,166.6871,a8w8_blockscale_1x128x128_256x128x128x128_16x16_32x32_2x2_8x32x1_8x32x1_1x32x1x8_8_1x1_intrawave_v3,732.74,496.57,0.0
gfx942,304,11776,1280,4096,ck,0,0,179.1272,a8w8_blockscale_1x128x128_256x128x128x128_16x16_32x32_2x2_8x32x1_8x32x1_1x32x1x8_8_1x1_intrawave_v3,689.34,466.84,0.0
gfx942,304,11904,1280,4096,ck,0,0,178.9324,a8w8_blockscale_1x128x128_256x128x128x128_16x16_32x32_2x2_8x32x1_8x32x1_1x32x1x8_8_1x1_intrawave_v3,697.6,472.11,0.0
gfx942,304,12032,1280,4096,ck,0,0,184.3794,a8w8_blockscale_1x128x128_256x128x128x128_16x16_32x32_2x2_8x32x1_8x32x1_1x32x1x8_8_1x1_intrawave_v3,684.27,462.78,0.0
gfx942,304,12160,1280,4096,ck,0,0,181.5439,a8w8_blockscale_1x128x128_256x128x128x128_16x16_32x32_2x2_8x32x1_8x32x1_1x32x1x8_8_1x1_intrawave_v3,702.35,474.71,0.0
gfx942,304,12288,1280,4096,ck,0,0,177.0336,a8w8_blockscale_1x128x128_256x128x128x128_16x16_32x32_2x2_8x32x1_8x32x1_1x32x1x8_8_1x1_intrawave_v3,727.82,491.61,0.0
gfx942,304,12416,1280,4096,ck,0,0,179.5244,a8w8_blockscale_1x128x128_256x128x128x128_16x16_32x32_2x2_8x32x1_8x32x1_1x32x1x8_8_1x1_intrawave_v3,725.2,489.54,0.0
gfx942,304,12544,1280,4096,ck,0,0,181.6551,a8w8_blockscale_1x128x128_256x128x128x128_16x16_32x32_2x2_8x32x1_8x32x1_1x32x1x8_8_1x1_intrawave_v3,724.08,488.48,0.0
gfx942,304,12672,1280,4096,ck,0,0,182.9775,a8w8_blockscale_1x128x128_256x128x128x128_16x16_32x32_2x2_8x32x1_8x32x1_1x32x1x8_8_1x1_intrawave_v3,726.19,489.61,0.0
gfx942,304,12800,1280,4096,ck,0,0,182.5072,a8w8_blockscale_1x128x128_256x128x128x128_16x16_32x32_2x2_8x32x1_8x32x1_1x32x1x8_8_1x1_intrawave_v3,735.41,495.54,0.0
gfx942,304,12928,1280,4096,ck,0,0,187.1774,a8w8_blockscale_1x128x128_256x128x128x128_16x16_32x32_2x2_8x32x1_8x32x1_1x32x1x8_8_1x1_intrawave_v3,724.23,487.73,0.0
gfx942,304,13056,1280,4096,ck,0,0,185.5724,a8w8_blockscale_1x128x128_256x128x128x128_16x16_32x32_2x2_8x32x1_8x32x1_1x32x1x8_8_1x1_intrawave_v3,737.73,496.54,0.0
gfx942,304,13184,1280,4096,ck,0,0,191.0816,a8w8_blockscale_1x128x128_256x128x128x128_16x16_32x32_2x2_8x32x1_8x32x1_1x32x1x8_8_1x1_intrawave_v3,723.48,486.68,0.0
gfx942,304,13312,1280,4096,ck,0,0,190.963,a8w8_blockscale_1x128x128_256x128x128x128_16x16_32x32_2x2_8x32x1_8x32x1_1x32x1x8_8_1x1_intrawave_v3,730.96,491.44,0.0
gfx942,304,13440,1280,4096,ck,0,0,189.157,a8w8_blockscale_1x128x128_256x128x128x128_16x16_32x32_2x2_8x32x1_8x32x1_1x32x1x8_8_1x1_intrawave_v3,745.04,500.64,0.0
gfx942,304,13568,1280,4096,ck,0,0,190.6062,a8w8_blockscale_1x128x128_256x128x128x128_16x16_32x32_2x2_8x32x1_8x32x1_1x32x1x8_8_1x1_intrawave_v3,746.41,501.3,0.0
gfx942,304,13696,1280,4096,ck,0,0,193.0752,a8w8_blockscale_1x128x128_256x128x128x128_16x16_32x32_2x2_8x32x1_8x32x1_1x32x1x8_8_1x1_intrawave_v3,743.82,499.31,0.0
gfx942,304,13824,1280,4096,ck,0,0,193.9973,a8w8_blockscale_1x128x128_256x128x128x128_16x16_32x32_2x2_8x32x1_8x32x1_1x32x1x8_8_1x1_intrawave_v3,747.2,501.32,0.0
gfx942,304,13952,1280,4096,ck,0,0,196.2274,a8w8_blockscale_1x128x128_256x128x128x128_16x16_32x32_2x2_8x32x1_8x32x1_1x32x1x8_8_1x1_intrawave_v3,745.55,499.97,0.0
gfx942,304,14080,1280,4096,ck,0,0,196.1161,a8w8_blockscale_1x128x128_256x128x128x128_16x16_32x32_2x2_8x32x1_8x32x1_1x32x1x8_8_1x1_intrawave_v3,752.82,504.6,0.0
gfx942,304,14208,1280,4096,ck,0,0,197.1502,a8w8_blockscale_1x128x128_256x128x128x128_16x16_32x32_2x2_8x32x1_8x32x1_1x32x1x8_8_1x1_intrawave_v3,755.68,506.27,0.0
gfx942,304,14336,1280,4096,ck,0,0,192.1921,a8w8_blockscale_1x128x128_256x128x128x128_16x16_32x32_2x2_8x32x1_8x32x1_1x32x1x8_8_1x1_intrawave_v3,782.15,523.76,0.0
gfx942,304,14464,1280,4096,ck,0,0,202.7789,a8w8_blockscale_1x128x128_256x128x128x128_16x16_32x32_2x2_8x32x1_8x32x1_1x32x1x8_8_1x1_intrawave_v3,747.94,500.62,0.0
gfx942,304,14592,1280,4096,ck,0,0,197.8591,a8w8_blockscale_1x128x128_256x128x128x128_16x16_32x32_2x2_8x32x1_8x32x1_1x32x1x8_8_1x1_intrawave_v3,773.32,517.37,0.0
gfx942,304,14720,1280,4096,ck,0,0,200.2553,a8w8_blockscale_1x128x128_256x128x128x128_16x16_32x32_2x2_8x32x1_8x32x1_1x32x1x8_8_1x1_intrawave_v3,770.77,515.44,0.0
gfx942,304,14848,1280,4096,ck,0,0,206.6423,a8w8_blockscale_1x128x128_256x128x128x128_16x16_32x32_2x2_8x32x1_8x32x1_1x32x1x8_8_1x1_intrawave_v3,753.44,503.63,0.0
gfx942,304,14976,1280,4096,ck,0,0,204.0698,a8w8_blockscale_1x128x128_256x128x128x128_16x16_32x32_2x2_8x32x1_8x32x1_1x32x1x8_8_1x1_intrawave_v3,769.51,514.15,0.0
gfx942,304,15104,1280,4096,ck,0,0,207.2933,a8w8_blockscale_1x128x128_256x128x128x128_16x16_32x32_2x2_8x32x1_8x32x1_1x32x1x8_8_1x1_intrawave_v3,764.02,510.27,0.0
gfx942,304,15232,1280,4096,ck,0,0,206.7628,a8w8_blockscale_1x128x128_256x128x128x128_16x16_32x32_2x2_8x32x1_8x32x1_1x32x1x8_8_1x1_intrawave_v3,772.48,515.7,0.0
gfx942,304,15360,1280,4096,ck,0,0,215.985,a8w8_blockscale_1x128x128_256x128x128x128_16x16_32x32_2x2_8x32x1_8x32x1_1x32x1x8_8_1x1_intrawave_v3,745.71,497.62,0.0
gfx942,304,15488,1280,4096,ck,0,0,213.182,a8w8_blockscale_1x128x128_256x128x128x128_16x16_32x32_2x2_8x32x1_8x32x1_1x32x1x8_8_1x1_intrawave_v3,761.81,508.16,0.0
gfx942,304,15616,1280,4096,ck,0,0,234.4324,a8w8_blockscale_1x128x128_256x128x128x128_16x16_32x32_2x2_8x32x1_8x32x1_1x32x1x8_8_1x1_intrawave_v3,698.48,465.73,0.0
gfx942,304,15744,1280,4096,ck,0,0,231.6799,a8w8_blockscale_1x128x128_256x128x128x128_16x16_32x32_2x2_8x32x1_8x32x1_1x32x1x8_8_1x1_intrawave_v3,712.57,474.94,0.0
gfx942,304,15872,1280,4096,ck,0,0,231.7365,a8w8_blockscale_1x128x128_256x128x128x128_16x16_32x32_2x2_8x32x1_8x32x1_1x32x1x8_8_1x1_intrawave_v3,718.19,478.5,0.0
gfx942,304,16000,1280,4096,ck,0,0,233.0784,a8w8_blockscale_1x128x128_256x128x128x128_16x16_32x32_2x2_8x32x1_8x32x1_1x32x1x8_8_1x1_intrawave_v3,719.81,479.4,0.0
gfx942,304,16128,1280,4096,ck,0,0,233.5358,a8w8_blockscale_1x128x128_256x128x128x128_16x16_32x32_2x2_8x32x1_8x32x1_1x32x1x8_8_1x1_intrawave_v3,724.15,482.11,0.0
gfx942,304,16256,1280,4096,ck,0,0,238.8157,a8w8_blockscale_1x128x128_256x128x128x128_16x16_32x32_2x2_8x32x1_8x32x1_1x32x1x8_8_1x1_intrawave_v3,713.76,475.02,0.0
gfx942,304,16384,1280,4096,ck,0,0,230.969,a8w8_blockscale_1x128x128_256x128x128x128_16x16_32x32_2x2_8x32x1_8x32x1_1x32x1x8_8_1x1_intrawave_v3,743.82,494.85,0.0
gfx942,304,16512,1280,4096,ck,0,0,233.3647,a8w8_blockscale_1x128x128_256x128x128x128_16x16_32x32_2x2_8x32x1_8x32x1_1x32x1x8_8_1x1_intrawave_v3,741.93,493.42,0.0
gfx942,304,16640,1280,4096,ck,0,0,236.2422,a8w8_blockscale_1x128x128_256x128x128x128_16x16_32x32_2x2_8x32x1_8x32x1_1x32x1x8_8_1x1_intrawave_v3,738.58,491.02,0.0
gfx942,304,16768,1280,4096,ck,0,0,238.8131,a8w8_blockscale_1x128x128_256x128x128x128_16x16_32x32_2x2_8x32x1_8x32x1_1x32x1x8_8_1x1_intrawave_v3,736.25,489.3,0.0
gfx942,304,16896,1280,4096,ck,0,0,238.2946,a8w8_blockscale_1x128x128_256x128x128x128_16x16_32x32_2x2_8x32x1_8x32x1_1x32x1x8_8_1x1_intrawave_v3,743.48,493.94,0.0
gfx942,304,17024,1280,4096,ck,0,0,235.9603,a8w8_blockscale_1x128x128_256x128x128x128_16x16_32x32_2x2_8x32x1_8x32x1_1x32x1x8_8_1x1_intrawave_v3,756.52,502.43,0.0
gfx942,304,17152,1280,4096,ck,0,0,243.1236,a8w8_blockscale_1x128x128_256x128x128x128_16x16_32x32_2x2_8x32x1_8x32x1_1x32x1x8_8_1x1_intrawave_v3,739.75,491.14,0.0
gfx942,304,17280,1280,4096,ck,0,0,244.4779,a8w8_blockscale_1x128x128_256x128x128x128_16x16_32x32_2x2_8x32x1_8x32x1_1x32x1x8_8_1x1_intrawave_v3,741.15,491.9,0.0
gfx942,304,17408,1280,4096,ck,0,0,244.9576,a8w8_blockscale_1x128x128_256x128x128x128_16x16_32x32_2x2_8x32x1_8x32x1_1x32x1x8_8_1x1_intrawave_v3,745.17,494.41,0.0
gfx942,304,17536,1280,4096,ck,0,0,245.6249,a8w8_blockscale_1x128x128_256x128x128x128_16x16_32x32_2x2_8x32x1_8x32x1_1x32x1x8_8_1x1_intrawave_v3,748.61,496.54,0.0
gfx942,304,17664,1280,4096,ck,0,0,244.3224,a8w8_blockscale_1x128x128_256x128x128x128_16x16_32x32_2x2_8x32x1_8x32x1_1x32x1x8_8_1x1_intrawave_v3,758.1,502.67,0.0
gfx942,304,17792,1280,4096,ck,0,0,245.8057,a8w8_blockscale_1x128x128_256x128x128x128_16x16_32x32_2x2_8x32x1_8x32x1_1x32x1x8_8_1x1_intrawave_v3,758.98,503.11,0.0
gfx942,304,17920,1280,4096,ck,0,0,251.8569,a8w8_blockscale_1x128x128_256x128x128x128_16x16_32x32_2x2_8x32x1_8x32x1_1x32x1x8_8_1x1_intrawave_v3,746.08,494.4,0.0
gfx942,304,18048,1280,4096,ck,0,0,248.7125,a8w8_blockscale_1x128x128_256x128x128x128_16x16_32x32_2x2_8x32x1_8x32x1_1x32x1x8_8_1x1_intrawave_v3,760.91,504.08,0.0
gfx942,304,18176,1280,4096,ck,0,0,245.471,a8w8_blockscale_1x128x128_256x128x128x128_16x16_32x32_2x2_8x32x1_8x32x1_1x32x1x8_8_1x1_intrawave_v3,776.42,514.2,0.0
gfx942,304,18304,1280,4096,ck,0,0,256.7933,a8w8_blockscale_1x128x128_256x128x128x128_16x16_32x32_2x2_8x32x1_8x32x1_1x32x1x8_8_1x1_intrawave_v3,747.42,494.85,0.0
gfx942,304,18432,1280,4096,ck,0,0,247.4738,a8w8_blockscale_1x128x128_256x128x128x128_16x16_32x32_2x2_8x32x1_8x32x1_1x32x1x8_8_1x1_intrawave_v3,780.99,516.93,0.0
gfx942,304,18560,1280,4096,ck,0,0,256.6748,a8w8_blockscale_1x128x128_256x128x128x128_16x16_32x32_2x2_8x32x1_8x32x1_1x32x1x8_8_1x1_intrawave_v3,758.22,501.72,0.0
gfx942,304,18688,1280,4096,ck,0,0,254.9219,a8w8_blockscale_1x128x128_256x128x128x128_16x16_32x32_2x2_8x32x1_8x32x1_1x32x1x8_8_1x1_intrawave_v3,768.7,508.51,0.0
gfx942,304,18816,1280,4096,ck,0,0,259.2086,a8w8_blockscale_1x128x128_256x128x128x128_16x16_32x32_2x2_8x32x1_8x32x1_1x32x1x8_8_1x1_intrawave_v3,761.16,503.39,0.0
gfx942,304,18944,1280,4096,ck,0,0,265.7706,a8w8_blockscale_1x128x128_256x128x128x128_16x16_32x32_2x2_8x32x1_8x32x1_1x32x1x8_8_1x1_intrawave_v3,747.42,494.16,0.0
gfx942,304,19072,1280,4096,ck,0,0,266.0888,a8w8_blockscale_1x128x128_256x128x128x128_16x16_32x32_2x2_8x32x1_8x32x1_1x32x1x8_8_1x1_intrawave_v3,751.57,496.77,0.0
gfx942,304,19200,1280,4096,ck,0,0,261.6699,a8w8_blockscale_1x128x128_256x128x128x128_16x16_32x32_2x2_8x32x1_8x32x1_1x32x1x8_8_1x1_intrawave_v3,769.39,508.42,0.0
gfx942,304,19328,1280,4096,ck,0,0,268.4519,a8w8_blockscale_1x128x128_256x128x128x128_16x16_32x32_2x2_8x32x1_8x32x1_1x32x1x8_8_1x1_intrawave_v3,754.95,498.75,0.0
gfx942,304,19456,1280,4096,ck,0,0,272.4302,a8w8_blockscale_1x128x128_256x128x128x128_16x16_32x32_2x2_8x32x1_8x32x1_1x32x1x8_8_1x1_intrawave_v3,748.86,494.59,0.0
gfx942,304,19584,1280,4096,ck,0,0,275.0969,a8w8_blockscale_1x128x128_256x128x128x128_16x16_32x32_2x2_8x32x1_8x32x1_1x32x1x8_8_1x1_intrawave_v3,746.48,492.9,0.0
gfx942,304,19712,1280,4096,ck,0,0,275.9529,a8w8_blockscale_1x128x128_256x128x128x128_16x16_32x32_2x2_8x32x1_8x32x1_1x32x1x8_8_1x1_intrawave_v3,749.02,494.45,0.0
gfx942,304,19840,1280,4096,ck,0,0,281.7513,a8w8_blockscale_1x128x128_256x128x128x128_16x16_32x32_2x2_8x32x1_8x32x1_1x32x1x8_8_1x1_intrawave_v3,738.37,487.3,0.0
gfx942,304,19968,1280,4096,ck,0,0,281.2198,a8w8_blockscale_1x128x128_256x128x128x128_16x16_32x32_2x2_8x32x1_8x32x1_1x32x1x8_8_1x1_intrawave_v3,744.54,491.25,0.0
gfx942,304,20096,1280,4096,ck,0,0,290.7919,a8w8_blockscale_1x128x128_256x128x128x128_16x16_32x32_2x2_8x32x1_8x32x1_1x32x1x8_8_1x1_intrawave_v3,724.65,478.01,0.0
gfx942,304,20224,1280,4096,ck,0,0,284.1361,a8w8_blockscale_1x128x128_256x128x128x128_16x16_32x32_2x2_8x32x1_8x32x1_1x32x1x8_8_1x1_intrawave_v3,746.35,492.21,0.0
gfx942,304,20352,1280,4096,ck,0,0,289.6763,a8w8_blockscale_1x128x128_256x128x128x128_16x16_32x32_2x2_8x32x1_8x32x1_1x32x1x8_8_1x1_intrawave_v3,736.71,485.73,0.0
gfx942,304,20480,1280,4096,ck,0,0,282.0059,a8w8_blockscale_1x128x128_256x128x128x128_16x16_32x32_2x2_8x32x1_8x32x1_1x32x1x8_8_1x1_intrawave_v3,761.5,501.97,0.0
gfx942,304,20608,1280,4096,ck,0,0,289.4557,a8w8_blockscale_1x128x128_256x128x128x128_16x16_32x32_2x2_8x32x1_8x32x1_1x32x1x8_8_1x1_intrawave_v3,746.54,491.99,0.0
gfx942,304,20736,1280,4096,ck,0,0,288.0504,a8w8_blockscale_1x128x128_256x128x128x128_16x16_32x32_2x2_8x32x1_8x32x1_1x32x1x8_8_1x1_intrawave_v3,754.84,497.35,0.0
gfx942,304,20864,1280,4096,ck,0,0,293.8366,a8w8_blockscale_1x128x128_256x128x128x128_16x16_32x32_2x2_8x32x1_8x32x1_1x32x1x8_8_1x1_intrawave_v3,744.55,490.46,0.0
gfx942,304,20992,1280,4096,ck,0,0,295.8327,a8w8_blockscale_1x128x128_256x128x128x128_16x16_32x32_2x2_8x32x1_8x32x1_1x32x1x8_8_1x1_intrawave_v3,744.06,490.03,0.0
gfx942,304,21120,1280,4096,ck,0,0,295.5442,a8w8_blockscale_1x128x128_256x128x128x128_16x16_32x32_2x2_8x32x1_8x32x1_1x32x1x8_8_1x1_intrawave_v3,749.33,493.39,0.0
gfx942,304,21248,1280,4096,ck,0,0,295.4504,a8w8_blockscale_1x128x128_256x128x128x128_16x16_32x32_2x2_8x32x1_8x32x1_1x32x1x8_8_1x1_intrawave_v3,754.11,496.43,0.0
gfx942,304,21376,1280,4096,ck,0,0,295.1929,a8w8_blockscale_1x128x128_256x128x128x128_16x16_32x32_2x2_8x32x1_8x32x1_1x32x1x8_8_1x1_intrawave_v3,759.31,499.75,0.0
gfx942,304,21504,1280,4096,ck,0,0,301.7412,a8w8_blockscale_1x128x128_256x128x128x128_16x16_32x32_2x2_8x32x1_8x32x1_1x32x1x8_8_1x1_intrawave_v3,747.28,491.72,0.0
gfx942,304,21632,1280,4096,ck,0,0,306.7793,a8w8_blockscale_1x128x128_256x128x128x128_16x16_32x32_2x2_8x32x1_8x32x1_1x32x1x8_8_1x1_intrawave_v3,739.38,486.43,0.0
gfx942,304,21760,1280,4096,ck,0,0,305.9083,a8w8_blockscale_1x128x128_256x128x128x128_16x16_32x32_2x2_8x32x1_8x32x1_1x32x1x8_8_1x1_intrawave_v3,745.88,490.6,0.0
gfx942,304,21888,1280,4096,ck,0,0,302.1535,a8w8_blockscale_1x128x128_256x128x128x128_16x16_32x32_2x2_8x32x1_8x32x1_1x32x1x8_8_1x1_intrawave_v3,759.59,499.51,0.0
gfx942,304,22016,1280,4096,ck,0,0,304.7015,a8w8_blockscale_1x128x128_256x128x128x128_16x16_32x32_2x2_8x32x1_8x32x1_1x32x1x8_8_1x1_intrawave_v3,757.64,498.13,0.0
gfx942,304,22144,1280,4096,ck,0,0,307.497,a8w8_blockscale_1x128x128_256x128x128x128_16x16_32x32_2x2_8x32x1_8x32x1_1x32x1x8_8_1x1_intrawave_v3,755.12,496.37,0.0
gfx942,304,22272,1280,4096,ck,0,0,310.1005,a8w8_blockscale_1x128x128_256x128x128x128_16x16_32x32_2x2_8x32x1_8x32x1_1x32x1x8_8_1x1_intrawave_v3,753.11,494.95,0.0
gfx942,304,22400,1280,4096,ck,0,0,307.676,a8w8_blockscale_1x128x128_256x128x128x128_16x16_32x32_2x2_8x32x1_8x32x1_1x32x1x8_8_1x1_intrawave_v3,763.4,501.62,0.0
gfx942,304,22528,1280,4096,ck,0,0,307.9151,a8w8_blockscale_1x128x128_256x128x128x128_16x16_32x32_2x2_8x32x1_8x32x1_1x32x1x8_8_1x1_intrawave_v3,767.17,504.0,0.0
gfx942,304,22656,1280,4096,ck,0,0,315.7479,a8w8_blockscale_1x128x128_256x128x128x128_16x16_32x32_2x2_8x32x1_8x32x1_1x32x1x8_8_1x1_intrawave_v3,752.39,494.2,0.0
gfx942,304,22784,1280,4096,ck,0,0,312.9338,a8w8_blockscale_1x128x128_256x128x128x128_16x16_32x32_2x2_8x32x1_8x32x1_1x32x1x8_8_1x1_intrawave_v3,763.44,501.36,0.0
gfx942,304,22912,1280,4096,ck,0,0,310.2223,a8w8_blockscale_1x128x128_256x128x128x128_16x16_32x32_2x2_8x32x1_8x32x1_1x32x1x8_8_1x1_intrawave_v3,774.44,508.49,0.0
gfx942,304,23040,1280,4096,ck,0,0,322.9755,a8w8_blockscale_1x128x128_256x128x128x128_16x16_32x32_2x2_8x32x1_8x32x1_1x32x1x8_8_1x1_intrawave_v3,748.02,491.05,0.0
gfx942,304,23168,1280,4096,ck,0,0,320.2067,a8w8_blockscale_1x128x128_256x128x128x128_16x16_32x32_2x2_8x32x1_8x32x1_1x32x1x8_8_1x1_intrawave_v3,758.68,497.96,0.0
gfx942,304,23296,1280,4096,ck,0,0,324.6987,a8w8_blockscale_1x128x128_256x128x128x128_16x16_32x32_2x2_8x32x1_8x32x1_1x32x1x8_8_1x1_intrawave_v3,752.32,493.69,0.0
gfx942,304,23424,1280,4096,ck,0,0,332.6005,a8w8_blockscale_1x128x128_256x128x128x128_16x16_32x32_2x2_8x32x1_8x32x1_1x32x1x8_8_1x1_intrawave_v3,738.48,484.52,0.0
gfx942,304,23552,1280,4096,ck,0,0,336.8071,a8w8_blockscale_1x128x128_256x128x128x128_16x16_32x32_2x2_8x32x1_8x32x1_1x32x1x8_8_1x1_intrawave_v3,733.24,481.0,0.0
gfx942,304,23680,1280,4096,ck,0,0,342.4884,a8w8_blockscale_1x128x128_256x128x128x128_16x16_32x32_2x2_8x32x1_8x32x1_1x32x1x8_8_1x1_intrawave_v3,725.0,475.51,0.0
gfx942,304,23808,1280,4096,ck,0,0,345.7846,a8w8_blockscale_1x128x128_256x128x128x128_16x16_32x32_2x2_8x32x1_8x32x1_1x32x1x8_8_1x1_intrawave_v3,721.97,473.44,0.0
gfx942,304,23936,1280,4096,ck,0,0,338.2695,a8w8_blockscale_1x128x128_256x128x128x128_16x16_32x32_2x2_8x32x1_8x32x1_1x32x1x8_8_1x1_intrawave_v3,741.97,486.48,0.0
gfx942,304,24064,1280,4096,ck,0,0,340.4411,a8w8_blockscale_1x128x128_256x128x128x128_16x16_32x32_2x2_8x32x1_8x32x1_1x32x1x8_8_1x1_intrawave_v3,741.18,485.88,0.0
gfx942,304,24192,1280,4096,ck,0,0,346.8291,a8w8_blockscale_1x128x128_256x128x128x128_16x16_32x32_2x2_8x32x1_8x32x1_1x32x1x8_8_1x1_intrawave_v3,731.4,479.39,0.0
gfx942,304,24320,1280,4096,ck,0,0,346.0578,a8w8_blockscale_1x128x128_256x128x128x128_16x16_32x32_2x2_8x32x1_8x32x1_1x32x1x8_8_1x1_intrawave_v3,736.91,482.92,0.0
gfx942,304,24448,1280,4096,ck,0,0,345.7684,a8w8_blockscale_1x128x128_256x128x128x128_16x16_32x32_2x2_8x32x1_8x32x1_1x32x1x8_8_1x1_intrawave_v3,741.41,485.78,0.0
gfx942,304,24576,1280,4096,ck,0,0,342.3464,a8w8_blockscale_1x128x128_256x128x128x128_16x16_32x32_2x2_8x32x1_8x32x1_1x32x1x8_8_1x1_intrawave_v3,752.74,493.13,0.0
gfx942,304,24704,1280,4096,ck,0,0,345.232,a8w8_blockscale_1x128x128_256x128x128x128_16x16_32x32_2x2_8x32x1_8x32x1_1x32x1x8_8_1x1_intrawave_v3,750.34,491.47,0.0
gfx942,304,24832,1280,4096,ck,0,0,342.4901,a8w8_blockscale_1x128x128_256x128x128x128_16x16_32x32_2x2_8x32x1_8x32x1_1x32x1x8_8_1x1_intrawave_v3,760.26,497.9,0.0
gfx942,304,24960,1280,4096,ck,0,0,347.118,a8w8_blockscale_1x128x128_256x128x128x128_16x16_32x32_2x2_8x32x1_8x32x1_1x32x1x8_8_1x1_intrawave_v3,753.99,493.71,0.0
gfx942,304,25088,1280,4096,ck,0,0,356.224,a8w8_blockscale_1x128x128_256x128x128x128_16x16_32x32_2x2_8x32x1_8x32x1_1x32x1x8_8_1x1_intrawave_v3,738.49,483.48,0.0
gfx942,304,25216,1280,4096,ck,0,0,355.0129,a8w8_blockscale_1x128x128_256x128x128x128_16x16_32x32_2x2_8x32x1_8x32x1_1x32x1x8_8_1x1_intrawave_v3,744.79,487.53,0.0
gfx942,304,25344,1280,4096,ck,0,0,344.9142,a8w8_blockscale_1x128x128_256x128x128x128_16x16_32x32_2x2_8x32x1_8x32x1_1x32x1x8_8_1x1_intrawave_v3,770.48,504.28,0.0
gfx942,304,25472,1280,4096,ck,0,0,358.0368,a8w8_blockscale_1x128x128_256x128x128x128_16x16_32x32_2x2_8x32x1_8x32x1_1x32x1x8_8_1x1_intrawave_v3,745.99,488.17,0.0
gfx942,304,25600,1280,4096,ck,0,0,356.1205,a8w8_blockscale_1x128x128_256x128x128x128_16x16_32x32_2x2_8x32x1_8x32x1_1x32x1x8_8_1x1_intrawave_v3,753.78,493.19,0.0
gfx942,304,25728,1280,4096,ck,0,0,353.4643,a8w8_blockscale_1x128x128_256x128x128x128_16x16_32x32_2x2_8x32x1_8x32x1_1x32x1x8_8_1x1_intrawave_v3,763.24,499.31,0.0
gfx942,304,25856,1280,4096,ck,0,0,357.8356,a8w8_blockscale_1x128x128_256x128x128x128_16x16_32x32_2x2_8x32x1_8x32x1_1x32x1x8_8_1x1_intrawave_v3,757.67,495.59,0.0
gfx942,304,25984,1280,4096,ck,0,0,359.1233,a8w8_blockscale_1x128x128_256x128x128x128_16x16_32x32_2x2_8x32x1_8x32x1_1x32x1x8_8_1x1_intrawave_v3,758.69,496.19,0.0
gfx942,304,26112,1280,4096,ck,0,0,357.9034,a8w8_blockscale_1x128x128_256x128x128x128_16x16_32x32_2x2_8x32x1_8x32x1_1x32x1x8_8_1x1_intrawave_v3,765.02,500.26,0.0
gfx942,304,26240,1280,4096,ck,0,0,365.5597,a8w8_blockscale_1x128x128_256x128x128x128_16x16_32x32_2x2_8x32x1_8x32x1_1x32x1x8_8_1x1_intrawave_v3,752.67,492.11,0.0
gfx942,304,26368,1280,4096,ck,0,0,368.0954,a8w8_blockscale_1x128x128_256x128x128x128_16x16_32x32_2x2_8x32x1_8x32x1_1x32x1x8_8_1x1_intrawave_v3,751.13,491.04,0.0
gfx942,304,26496,1280,4096,ck,0,0,369.075,a8w8_blockscale_1x128x128_256x128x128x128_16x16_32x32_2x2_8x32x1_8x32x1_1x32x1x8_8_1x1_intrawave_v3,752.78,492.04,0.0
gfx942,304,26624,1280,4096,ck,0,0,364.191,a8w8_blockscale_1x128x128_256x128x128x128_16x16_32x32_2x2_8x32x1_8x32x1_1x32x1x8_8_1x1_intrawave_v3,766.56,500.98,0.0
gfx942,304,26752,1280,4096,ck,0,0,372.5077,a8w8_blockscale_1x128x128_256x128x128x128_16x16_32x32_2x2_8x32x1_8x32x1_1x32x1x8_8_1x1_intrawave_v3,753.04,492.08,0.0
gfx942,304,26880,1280,4096,ck,0,0,373.4595,a8w8_blockscale_1x128x128_256x128x128x128_16x16_32x32_2x2_8x32x1_8x32x1_1x32x1x8_8_1x1_intrawave_v3,754.72,493.11,0.0
gfx942,304,27008,1280,4096,ck,0,0,374.8308,a8w8_blockscale_1x128x128_256x128x128x128_16x16_32x32_2x2_8x32x1_8x32x1_1x32x1x8_8_1x1_intrawave_v3,755.54,493.58,0.0
gfx942,304,27136,1280,4096,ck,0,0,377.3548,a8w8_blockscale_1x128x128_256x128x128x128_16x16_32x32_2x2_8x32x1_8x32x1_1x32x1x8_8_1x1_intrawave_v3,754.04,492.53,0.0
gfx942,304,27264,1280,4096,ck,0,0,380.8772,a8w8_blockscale_1x128x128_256x128x128x128_16x16_32x32_2x2_8x32x1_8x32x1_1x32x1x8_8_1x1_intrawave_v3,750.59,490.22,0.0
gfx942,304,27392,1280,4096,ck,0,0,385.6339,a8w8_blockscale_1x128x128_256x128x128x128_16x16_32x32_2x2_8x32x1_8x32x1_1x32x1x8_8_1x1_intrawave_v3,744.82,486.38,0.0
gfx942,304,27520,1280,4096,ck,0,0,393.0943,a8w8_blockscale_1x128x128_256x128x128x128_16x16_32x32_2x2_8x32x1_8x32x1_1x32x1x8_8_1x1_intrawave_v3,734.09,479.32,0.0
gfx942,304,27648,1280,4096,ck,0,0,386.3222,a8w8_blockscale_1x128x128_256x128x128x128_16x16_32x32_2x2_8x32x1_8x32x1_1x32x1x8_8_1x1_intrawave_v3,750.44,489.92,0.0
gfx942,304,27776,1280,4096,ck,0,0,392.9587,a8w8_blockscale_1x128x128_256x128x128x128_16x16_32x32_2x2_8x32x1_8x32x1_1x32x1x8_8_1x1_intrawave_v3,741.18,483.82,0.0
gfx942,304,27904,1280,4096,ck,0,0,396.8643,a8w8_blockscale_1x128x128_256x128x128x128_16x16_32x32_2x2_8x32x1_8x32x1_1x32x1x8_8_1x1_intrawave_v3,737.27,481.2,0.0
gfx942,304,28032,1280,4096,ck,0,0,393.0853,a8w8_blockscale_1x128x128_256x128x128x128_16x16_32x32_2x2_8x32x1_8x32x1_1x32x1x8_8_1x1_intrawave_v3,747.77,488.0,0.0
gfx942,304,28160,1280,4096,ck,0,0,392.7925,a8w8_blockscale_1x128x128_256x128x128x128_16x16_32x32_2x2_8x32x1_8x32x1_1x32x1x8_8_1x1_intrawave_v3,751.74,490.53,0.0
gfx942,304,28288,1280,4096,ck,0,0,398.2728,a8w8_blockscale_1x128x128_256x128x128x128_16x16_32x32_2x2_8x32x1_8x32x1_1x32x1x8_8_1x1_intrawave_v3,744.77,485.92,0.0
gfx942,304,28416,1280,4096,ck,0,0,391.0828,a8w8_blockscale_1x128x128_256x128x128x128_16x16_32x32_2x2_8x32x1_8x32x1_1x32x1x8_8_1x1_intrawave_v3,761.89,497.03,0.0
gfx942,304,28544,1280,4096,ck,0,0,406.835,a8w8_blockscale_1x128x128_256x128x128x128_16x16_32x32_2x2_8x32x1_8x32x1_1x32x1x8_8_1x1_intrawave_v3,735.69,479.88,0.0
gfx942,304,28672,1280,4096,ck,0,0,396.9196,a8w8_blockscale_1x128x128_256x128x128x128_16x16_32x32_2x2_8x32x1_8x32x1_1x32x1x8_8_1x1_intrawave_v3,757.45,494.01,0.0
gfx942,304,28800,1280,4096,ck,0,0,400.972,a8w8_blockscale_1x128x128_256x128x128x128_16x16_32x32_2x2_8x32x1_8x32x1_1x32x1x8_8_1x1_intrawave_v3,753.14,491.15,0.0
gfx942,304,28928,1280,4096,ck,0,0,399.9747,a8w8_blockscale_1x128x128_256x128x128x128_16x16_32x32_2x2_8x32x1_8x32x1_1x32x1x8_8_1x1_intrawave_v3,758.38,494.5,0.0
gfx942,304,29056,1280,4096,ck,0,0,400.015,a8w8_blockscale_1x128x128_256x128x128x128_16x16_32x32_2x2_8x32x1_8x32x1_1x32x1x8_8_1x1_intrawave_v3,761.66,496.58,0.0
gfx942,304,29184,1280,4096,ck,0,0,406.6666,a8w8_blockscale_1x128x128_256x128x128x128_16x16_32x32_2x2_8x32x1_8x32x1_1x32x1x8_8_1x1_intrawave_v3,752.5,490.55,0.0
gfx942,304,29312,1280,4096,ck,0,0,405.6896,a8w8_blockscale_1x128x128_256x128x128x128_16x16_32x32_2x2_8x32x1_8x32x1_1x32x1x8_8_1x1_intrawave_v3,757.62,493.83,0.0
gfx942,304,29440,1280,4096,ck,0,0,401.5379,a8w8_blockscale_1x128x128_256x128x128x128_16x16_32x32_2x2_8x32x1_8x32x1_1x32x1x8_8_1x1_intrawave_v3,768.8,501.06,0.0
gfx942,304,29568,1280,4096,ck,0,0,405.5135,a8w8_blockscale_1x128x128_256x128x128x128_16x16_32x32_2x2_8x32x1_8x32x1_1x32x1x8_8_1x1_intrawave_v3,764.57,498.25,0.0
gfx942,304,29696,1280,4096,ck,0,0,408.1514,a8w8_blockscale_1x128x128_256x128x128x128_16x16_32x32_2x2_8x32x1_8x32x1_1x32x1x8_8_1x1_intrawave_v3,762.92,497.12,0.0
gfx942,304,29824,1280,4096,ck,0,0,411.0136,a8w8_blockscale_1x128x128_256x128x128x128_16x16_32x32_2x2_8x32x1_8x32x1_1x32x1x8_8_1x1_intrawave_v3,760.87,495.73,0.0
gfx942,304,29952,1280,4096,ck,0,0,412.4341,a8w8_blockscale_1x128x128_256x128x128x128_16x16_32x32_2x2_8x32x1_8x32x1_1x32x1x8_8_1x1_intrawave_v3,761.5,496.09,0.0
gfx942,304,30080,1280,4096,ck,0,0,415.8382,a8w8_blockscale_1x128x128_256x128x128x128_16x16_32x32_2x2_8x32x1_8x32x1_1x32x1x8_8_1x1_intrawave_v3,758.5,494.08,0.0
gfx942,304,30208,1280,4096,ck,0,0,418.4764,a8w8_blockscale_1x128x128_256x128x128x128_16x16_32x32_2x2_8x32x1_8x32x1_1x32x1x8_8_1x1_intrawave_v3,756.92,493.0,0.0
gfx942,304,30336,1280,4096,ck,0,0,415.7038,a8w8_blockscale_1x128x128_256x128x128x128_16x16_32x32_2x2_8x32x1_8x32x1_1x32x1x8_8_1x1_intrawave_v3,765.2,498.33,0.0
gfx942,304,30464,1280,4096,ck,0,0,421.7386,a8w8_blockscale_1x128x128_256x128x128x128_16x16_32x32_2x2_8x32x1_8x32x1_1x32x1x8_8_1x1_intrawave_v3,757.43,493.22,0.0
gfx942,304,30592,1280,4096,ck,0,0,422.5527,a8w8_blockscale_1x128x128_256x128x128x128_16x16_32x32_2x2_8x32x1_8x32x1_1x32x1x8_8_1x1_intrawave_v3,759.15,494.29,0.0
gfx942,304,30720,1280,4096,ck,0,0,425.3564,a8w8_blockscale_1x128x128_256x128x128x128_16x16_32x32_2x2_8x32x1_8x32x1_1x32x1x8_8_1x1_intrawave_v3,757.3,493.03,0.0
gfx942,304,30848,1280,4096,ck,0,0,428.5103,a8w8_blockscale_1x128x128_256x128x128x128_16x16_32x32_2x2_8x32x1_8x32x1_1x32x1x8_8_1x1_intrawave_v3,754.86,491.39,0.0
gfx942,304,30976,1280,4096,ck,0,0,431.2667,a8w8_blockscale_1x128x128_256x128x128x128_16x16_32x32_2x2_8x32x1_8x32x1_1x32x1x8_8_1x1_intrawave_v3,753.15,490.23,0.0
gfx942,304,31104,1280,4096,ck,0,0,428.4836,a8w8_blockscale_1x128x128_256x128x128x128_16x16_32x32_2x2_8x32x1_8x32x1_1x32x1x8_8_1x1_intrawave_v3,761.17,495.4,0.0
gfx942,304,31232,1280,4096,ck,0,0,439.6935,a8w8_blockscale_1x128x128_256x128x128x128_16x16_32x32_2x2_8x32x1_8x32x1_1x32x1x8_8_1x1_intrawave_v3,744.82,484.71,0.0
gfx942,304,31360,1280,4096,ck,0,0,437.7269,a8w8_blockscale_1x128x128_256x128x128x128_16x16_32x32_2x2_8x32x1_8x32x1_1x32x1x8_8_1x1_intrawave_v3,751.23,488.83,0.0
gfx942,304,31488,1280,4096,ck,0,0,438.353,a8w8_blockscale_1x128x128_256x128x128x128_16x16_32x32_2x2_8x32x1_8x32x1_1x32x1x8_8_1x1_intrawave_v3,753.22,490.08,0.0
gfx942,304,31616,1280,4096,ck,0,0,449.9655,a8w8_blockscale_1x128x128_256x128x128x128_16x16_32x32_2x2_8x32x1_8x32x1_1x32x1x8_8_1x1_intrawave_v3,736.76,479.32,0.0
gfx942,304,31744,1280,4096,ck,0,0,447.2117,a8w8_blockscale_1x128x128_256x128x128x128_16x16_32x32_2x2_8x32x1_8x32x1_1x32x1x8_8_1x1_intrawave_v3,744.3,484.18,0.0
gfx942,304,31872,1280,4096,ck,0,0,445.9282,a8w8_blockscale_1x128x128_256x128x128x128_16x16_32x32_2x2_8x32x1_8x32x1_1x32x1x8_8_1x1_intrawave_v3,749.45,487.48,0.0
gfx942,304,32000,1280,4096,ck,0,0,452.3845,a8w8_blockscale_1x128x128_256x128x128x128_16x16_32x32_2x2_8x32x1_8x32x1_1x32x1x8_8_1x1_intrawave_v3,741.72,482.41,0.0
gfx942,304,32128,1280,4096,ck,0,0,450.747,a8w8_blockscale_1x128x128_256x128x128x128_16x16_32x32_2x2_8x32x1_8x32x1_1x32x1x8_8_1x1_intrawave_v3,747.4,486.05,0.0
gfx942,304,32256,1280,4096,ck,0,0,454.7031,a8w8_blockscale_1x128x128_256x128x128x128_16x16_32x32_2x2_8x32x1_8x32x1_1x32x1x8_8_1x1_intrawave_v3,743.85,483.7,0.0
gfx942,304,32384,1280,4096,ck,0,0,451.6274,a8w8_blockscale_1x128x128_256x128x128x128_16x16_32x32_2x2_8x32x1_8x32x1_1x32x1x8_8_1x1_intrawave_v3,751.88,488.88,0.0
gfx942,304,32512,1280,4096,ck,0,0,456.2042,a8w8_blockscale_1x128x128_256x128x128x128_16x16_32x32_2x2_8x32x1_8x32x1_1x32x1x8_8_1x1_intrawave_v3,747.28,485.84,0.0
gfx942,304,32640,1280,4096,ck,0,0,468.162,a8w8_blockscale_1x128x128_256x128x128x128_16x16_32x32_2x2_8x32x1_8x32x1_1x32x1x8_8_1x1_intrawave_v3,731.06,475.25,0.0
gfx942,304,32768,1280,4096,ck,0,0,445.5206,a8w8_blockscale_1x128x128_256x128x128x128_16x16_32x32_2x2_8x32x1_8x32x1_1x32x1x8_8_1x1_intrawave_v3,771.23,501.32,0.0
gfx942,304,32896,1280,4096,ck,0,0,455.0847,a8w8_blockscale_1x128x128_256x128x128x128_16x16_32x32_2x2_8x32x1_8x32x1_1x32x1x8_8_1x1_intrawave_v3,757.97,492.65,0.0
gfx942,304,33024,1280,4096,ck,0,0,455.0206,a8w8_blockscale_1x128x128_256x128x128x128_16x16_32x32_2x2_8x32x1_8x32x1_1x32x1x8_8_1x1_intrawave_v3,761.02,494.59,0.0
gfx942,304,33152,1280,4096,ck,0,0,455.7197,a8w8_blockscale_1x128x128_256x128x128x128_16x16_32x32_2x2_8x32x1_8x32x1_1x32x1x8_8_1x1_intrawave_v3,762.8,495.71,0.0
gfx942,304,33280,1280,4096,ck,0,0,451.9834,a8w8_blockscale_1x128x128_256x128x128x128_16x16_32x32_2x2_8x32x1_8x32x1_1x32x1x8_8_1x1_intrawave_v3,772.08,501.69,0.0
gfx942,304,33408,1280,4096,ck,0,0,460.6282,a8w8_blockscale_1x128x128_256x128x128x128_16x16_32x32_2x2_8x32x1_8x32x1_1x32x1x8_8_1x1_intrawave_v3,760.5,494.12,0.0
gfx942,304,33536,1280,4096,ck,0,0,460.4291,a8w8_blockscale_1x128x128_256x128x128x128_16x16_32x32_2x2_8x32x1_8x32x1_1x32x1x8_8_1x1_intrawave_v3,763.75,496.19,0.0
gfx942,304,33664,1280,4096,ck,0,0,463.2112,a8w8_blockscale_1x128x128_256x128x128x128_16x16_32x32_2x2_8x32x1_8x32x1_1x32x1x8_8_1x1_intrawave_v3,762.06,495.05,0.0
gfx942,304,33792,1280,4096,ck,0,0,466.8796,a8w8_blockscale_1x128x128_256x128x128x128_16x16_32x32_2x2_8x32x1_8x32x1_1x32x1x8_8_1x1_intrawave_v3,758.94,492.98,0.0
gfx942,304,33920,1280,4096,ck,0,0,472.2746,a8w8_blockscale_1x128x128_256x128x128x128_16x16_32x32_2x2_8x32x1_8x32x1_1x32x1x8_8_1x1_intrawave_v3,753.11,489.15,0.0
gfx942,304,34048,1280,4096,ck,0,0,464.2293,a8w8_blockscale_1x128x128_256x128x128x128_16x16_32x32_2x2_8x32x1_8x32x1_1x32x1x8_8_1x1_intrawave_v3,769.06,499.47,0.0
gfx942,304,34176,1280,4096,ck,0,0,476.8298,a8w8_blockscale_1x128x128_256x128x128x128_16x16_32x32_2x2_8x32x1_8x32x1_1x32x1x8_8_1x1_intrawave_v3,751.55,488.05,0.0
gfx942,304,34304,1280,4096,ck,0,0,472.0235,a8w8_blockscale_1x128x128_256x128x128x128_16x16_32x32_2x2_8x32x1_8x32x1_1x32x1x8_8_1x1_intrawave_v3,762.05,494.83,0.0
gfx942,304,34432,1280,4096,ck,0,0,479.5985,a8w8_blockscale_1x128x128_256x128x128x128_16x16_32x32_2x2_8x32x1_8x32x1_1x32x1x8_8_1x1_intrawave_v3,752.81,488.79,0.0
gfx942,304,34560,1280,4096,ck,0,0,481.2811,a8w8_blockscale_1x128x128_256x128x128x128_16x16_32x32_2x2_8x32x1_8x32x1_1x32x1x8_8_1x1_intrawave_v3,752.97,488.85,0.0
gfx942,304,34688,1280,4096,ck,0,0,482.4788,a8w8_blockscale_1x128x128_256x128x128x128_16x16_32x32_2x2_8x32x1_8x32x1_1x32x1x8_8_1x1_intrawave_v3,753.88,489.4,0.0
gfx942,304,34816,1280,4096,ck,0,0,482.6241,a8w8_blockscale_1x128x128_256x128x128x128_16x16_32x32_2x2_8x32x1_8x32x1_1x32x1x8_8_1x1_intrawave_v3,756.43,491.02,0.0
gfx942,304,34944,1280,4096,ck,0,0,486.9383,a8w8_blockscale_1x128x128_256x128x128x128_16x16_32x32_2x2_8x32x1_8x32x1_1x32x1x8_8_1x1_intrawave_v3,752.49,488.42,0.0
gfx942,304,35072,1280,4096,ck,0,0,486.4242,a8w8_blockscale_1x128x128_256x128x128x128_16x16_32x32_2x2_8x32x1_8x32x1_1x32x1x8_8_1x1_intrawave_v3,756.04,490.69,0.0
gfx942,304,35200,1280,4096,ck,0,0,489.3386,a8w8_blockscale_1x128x128_256x128x128x128_16x16_32x32_2x2_8x32x1_8x32x1_1x32x1x8_8_1x1_intrawave_v3,754.28,489.51,0.0
gfx942,304,35328,1280,4096,ck,0,0,499.0272,a8w8_blockscale_1x128x128_256x128x128x128_16x16_32x32_2x2_8x32x1_8x32x1_1x32x1x8_8_1x1_intrawave_v3,742.33,481.71,0.0
gfx942,304,35456,1280,4096,ck,0,0,495.1777,a8w8_blockscale_1x128x128_256x128x128x128_16x16_32x32_2x2_8x32x1_8x32x1_1x32x1x8_8_1x1_intrawave_v3,750.81,487.17,0.0
gfx942,304,35584,1280,4096,ck,0,0,488.9055,a8w8_blockscale_1x128x128_256x128x128x128_16x16_32x32_2x2_8x32x1_8x32x1_1x32x1x8_8_1x1_intrawave_v3,763.18,495.17,0.0
gfx942,304,35712,1280,4096,ck,0,0,499.6243,a8w8_blockscale_1x128x128_256x128x128x128_16x16_32x32_2x2_8x32x1_8x32x1_1x32x1x8_8_1x1_intrawave_v3,749.5,486.25,0.0
gfx942,304,35840,1280,4096,ck,0,0,501.3478,a8w8_blockscale_1x128x128_256x128x128x128_16x16_32x32_2x2_8x32x1_8x32x1_1x32x1x8_8_1x1_intrawave_v3,749.6,486.28,0.0
gfx942,304,35968,1280,4096,ck,0,0,499.2144,a8w8_blockscale_1x128x128_256x128x128x128_16x16_32x32_2x2_8x32x1_8x32x1_1x32x1x8_8_1x1_intrawave_v3,755.49,490.06,0.0
gfx942,304,36096,1280,4096,ck,0,0,501.8204,a8w8_blockscale_1x128x128_256x128x128x128_16x16_32x32_2x2_8x32x1_8x32x1_1x32x1x8_8_1x1_intrawave_v3,754.24,489.21,0.0
gfx942,304,36224,1280,4096,ck,0,0,505.905,a8w8_blockscale_1x128x128_256x128x128x128_16x16_32x32_2x2_8x32x1_8x32x1_1x32x1x8_8_1x1_intrawave_v3,750.81,486.95,0.0
gfx942,304,36352,1280,4096,ck,0,0,500.3358,a8w8_blockscale_1x128x128_256x128x128x128_16x16_32x32_2x2_8x32x1_8x32x1_1x32x1x8_8_1x1_intrawave_v3,761.85,494.07,0.0
gfx942,304,36480,1280,4096,ck,0,0,507.1629,a8w8_blockscale_1x128x128_256x128x128x128_16x16_32x32_2x2_8x32x1_8x32x1_1x32x1x8_8_1x1_intrawave_v3,754.24,489.1,0.0
gfx942,304,36608,1280,4096,ck,0,0,497.883,a8w8_blockscale_1x128x128_256x128x128x128_16x16_32x32_2x2_8x32x1_8x32x1_1x32x1x8_8_1x1_intrawave_v3,770.99,499.93,0.0
gfx942,304,36736,1280,4096,ck,0,0,507.6089,a8w8_blockscale_1x128x128_256x128x128x128_16x16_32x32_2x2_8x32x1_8x32x1_1x32x1x8_8_1x1_intrawave_v3,758.86,492.03,0.0
gfx942,304,36864,1280,4096,ck,0,0,506.7226,a8w8_blockscale_1x128x128_256x128x128x128_16x16_32x32_2x2_8x32x1_8x32x1_1x32x1x8_8_1x1_intrawave_v3,762.84,494.57,0.0
gfx942,304,36992,1280,4096,ck,0,0,513.4289,a8w8_blockscale_1x128x128_256x128x128x128_16x16_32x32_2x2_8x32x1_8x32x1_1x32x1x8_8_1x1_intrawave_v3,755.49,489.77,0.0
gfx942,304,37120,1280,4096,ck,0,0,504.1024,a8w8_blockscale_1x128x128_256x128x128x128_16x16_32x32_2x2_8x32x1_8x32x1_1x32x1x8_8_1x1_intrawave_v3,772.13,500.52,0.0
gfx942,304,37248,1280,4096,ck,0,0,515.8636,a8w8_blockscale_1x128x128_256x128x128x128_16x16_32x32_2x2_8x32x1_8x32x1_1x32x1x8_8_1x1_intrawave_v3,757.13,490.76,0.0
gfx942,304,37376,1280,4096,ck,0,0,516.3261,a8w8_blockscale_1x128x128_256x128x128x128_16x16_32x32_2x2_8x32x1_8x32x1_1x32x1x8_8_1x1_intrawave_v3,759.05,491.97,0.0
gfx942,304,37504,1280,4096,ck,0,0,512.5483,a8w8_blockscale_1x128x128_256x128x128x128_16x16_32x32_2x2_8x32x1_8x32x1_1x32x1x8_8_1x1_intrawave_v3,767.26,497.26,0.0
gfx942,304,37632,1280,4096,ck,0,0,516.8813,a8w8_blockscale_1x128x128_256x128x128x128_16x16_32x32_2x2_8x32x1_8x32x1_1x32x1x8_8_1x1_intrawave_v3,763.43,494.74,0.0
gfx942,304,37760,1280,4096,ck,0,0,518.7795,a8w8_blockscale_1x128x128_256x128x128x128_16x16_32x32_2x2_8x32x1_8x32x1_1x32x1x8_8_1x1_intrawave_v3,763.22,494.57,0.0
gfx942,304,37888,1280,4096,ck,0,0,518.3387,a8w8_blockscale_1x128x128_256x128x128x128_16x16_32x32_2x2_8x32x1_8x32x1_1x32x1x8_8_1x1_intrawave_v3,766.46,496.64,0.0
gfx942,304,38016,1280,4096,ck,0,0,512.4647,a8w8_blockscale_1x128x128_256x128x128x128_16x16_32x32_2x2_8x32x1_8x32x1_1x32x1x8_8_1x1_intrawave_v3,777.86,503.99,0.0
gfx942,304,38144,1280,4096,ck,0,0,520.2802,a8w8_blockscale_1x128x128_256x128x128x128_16x16_32x32_2x2_8x32x1_8x32x1_1x32x1x8_8_1x1_intrawave_v3,768.76,498.06,0.0
gfx942,304,38272,1280,4096,ck,0,0,529.2607,a8w8_blockscale_1x128x128_256x128x128x128_16x16_32x32_2x2_8x32x1_8x32x1_1x32x1x8_8_1x1_intrawave_v3,758.25,491.22,0.0
gfx942,304,38400,1280,4096,ck,0,0,529.8354,a8w8_blockscale_1x128x128_256x128x128x128_16x16_32x32_2x2_8x32x1_8x32x1_1x32x1x8_8_1x1_intrawave_v3,759.96,492.29,0.0
gfx942,304,38528,1280,4096,ck,0,0,533.9386,a8w8_blockscale_1x128x128_256x128x128x128_16x16_32x32_2x2_8x32x1_8x32x1_1x32x1x8_8_1x1_intrawave_v3,756.63,490.1,0.0
gfx942,304,38656,1280,4096,ck,0,0,535.8771,a8w8_blockscale_1x128x128_256x128x128x128_16x16_32x32_2x2_8x32x1_8x32x1_1x32x1x8_8_1x1_intrawave_v3,756.4,489.92,0.0
gfx942,304,38784,1280,4096,ck,0,0,532.4293,a8w8_blockscale_1x128x128_256x128x128x128_16x16_32x32_2x2_8x32x1_8x32x1_1x32x1x8_8_1x1_intrawave_v3,763.82,494.69,0.0
gfx942,304,38912,1280,4096,ck,0,0,532.7933,a8w8_blockscale_1x128x128_256x128x128x128_16x16_32x32_2x2_8x32x1_8x32x1_1x32x1x8_8_1x1_intrawave_v3,765.82,495.95,0.0
gfx942,304,39040,1280,4096,ck,0,0,538.5813,a8w8_blockscale_1x128x128_256x128x128x128_16x16_32x32_2x2_8x32x1_8x32x1_1x32x1x8_8_1x1_intrawave_v3,760.08,492.21,0.0
gfx942,304,39168,1280,4096,ck,0,0,562.2955,a8w8_blockscale_1x128x128_256x128x128x128_16x16_32x32_2x2_8x32x1_8x32x1_1x32x1x8_8_1x1_intrawave_v3,730.41,472.96,0.0
gfx942,304,39296,1280,4096,ck,0,0,541.0052,a8w8_blockscale_1x128x128_256x128x128x128_16x16_32x32_2x2_8x32x1_8x32x1_1x32x1x8_8_1x1_intrawave_v3,761.63,493.15,0.0
gfx942,304,39424,1280,4096,ck,0,0,537.4235,a8w8_blockscale_1x128x128_256x128x128x128_16x16_32x32_2x2_8x32x1_8x32x1_1x32x1x8_8_1x1_intrawave_v3,769.21,498.02,0.0
gfx942,304,39552,1280,4096,ck,0,0,540.5253,a8w8_blockscale_1x128x128_256x128x128x128_16x16_32x32_2x2_8x32x1_8x32x1_1x32x1x8_8_1x1_intrawave_v3,767.28,496.74,0.0
gfx942,304,39680,1280,4096,ck,0,0,543.6023,a8w8_blockscale_1x128x128_256x128x128x128_16x16_32x32_2x2_8x32x1_8x32x1_1x32x1x8_8_1x1_intrawave_v3,765.4,495.5,0.0
gfx942,304,39808,1280,4096,ck,0,0,551.1535,a8w8_blockscale_1x128x128_256x128x128x128_16x16_32x32_2x2_8x32x1_8x32x1_1x32x1x8_8_1x1_intrawave_v3,757.35,490.25,0.0
gfx942,304,39936,1280,4096,ck,0,0,550.4696,a8w8_blockscale_1x128x128_256x128x128x128_16x16_32x32_2x2_8x32x1_8x32x1_1x32x1x8_8_1x1_intrawave_v3,760.73,492.41,0.0
gfx942,304,40064,1280,4096,ck,0,0,559.4314,a8w8_blockscale_1x128x128_256x128x128x128_16x16_32x32_2x2_8x32x1_8x32x1_1x32x1x8_8_1x1_intrawave_v3,750.94,486.05,0.0
gfx942,304,40192,1280,4096,ck,0,0,550.1939,a8w8_blockscale_1x128x128_256x128x128x128_16x16_32x32_2x2_8x32x1_8x32x1_1x32x1x8_8_1x1_intrawave_v3,765.99,495.75,0.0
gfx942,304,40320,1280,4096,ck,0,0,551.7706,a8w8_blockscale_1x128x128_256x128x128x128_16x16_32x32_2x2_8x32x1_8x32x1_1x32x1x8_8_1x1_intrawave_v3,766.23,495.88,0.0
gfx942,304,40448,1280,4096,ck,0,0,560.7394,a8w8_blockscale_1x128x128_256x128x128x128_16x16_32x32_2x2_8x32x1_8x32x1_1x32x1x8_8_1x1_intrawave_v3,756.37,489.47,0.0
gfx942,304,40576,1280,4096,ck,0,0,550.7186,a8w8_blockscale_1x128x128_256x128x128x128_16x16_32x32_2x2_8x32x1_8x32x1_1x32x1x8_8_1x1_intrawave_v3,772.57,499.92,0.0
gfx942,304,40704,1280,4096,ck,0,0,554.2151,a8w8_blockscale_1x128x128_256x128x128x128_16x16_32x32_2x2_8x32x1_8x32x1_1x32x1x8_8_1x1_intrawave_v3,770.12,498.31,0.0
gfx942,304,40832,1280,4096,ck,0,0,556.9002,a8w8_blockscale_1x128x128_256x128x128x128_16x16_32x32_2x2_8x32x1_8x32x1_1x32x1x8_8_1x1_intrawave_v3,768.82,497.43,0.0
gfx942,304,40960,1280,4096,ck,0,0,552.6831,a8w8_blockscale_1x128x128_256x128x128x128_16x16_32x32_2x2_8x32x1_8x32x1_1x32x1x8_8_1x1_intrawave_v3,777.11,502.77,0.0
gfx942,304,41088,1280,4096,ck,0,0,564.2234,a8w8_blockscale_1x128x128_256x128x128x128_16x16_32x32_2x2_8x32x1_8x32x1_1x32x1x8_8_1x1_intrawave_v3,763.6,494.0,0.0
gfx942,304,41216,1280,4096,ck,0,0,570.273,a8w8_blockscale_1x128x128_256x128x128x128_16x16_32x32_2x2_8x32x1_8x32x1_1x32x1x8_8_1x1_intrawave_v3,757.85,490.25,0.0
gfx942,304,41344,1280,4096,ck,0,0,570.0978,a8w8_blockscale_1x128x128_256x128x128x128_16x16_32x32_2x2_8x32x1_8x32x1_1x32x1x8_8_1x1_intrawave_v3,760.44,491.9,0.0
gfx942,304,41472,1280,4096,ck,0,0,569.9702,a8w8_blockscale_1x128x128_256x128x128x128_16x16_32x32_2x2_8x32x1_8x32x1_1x32x1x8_8_1x1_intrawave_v3,762.96,493.5,0.0
gfx942,304,41600,1280,4096,ck,0,0,569.8698,a8w8_blockscale_1x128x128_256x128x128x128_16x16_32x32_2x2_8x32x1_8x32x1_1x32x1x8_8_1x1_intrawave_v3,765.45,495.08,0.0
gfx942,304,41728,1280,4096,ck,0,0,565.7909,a8w8_blockscale_1x128x128_256x128x128x128_16x16_32x32_2x2_8x32x1_8x32x1_1x32x1x8_8_1x1_intrawave_v3,773.34,500.16,0.0
gfx942,304,41856,1280,4096,ck,0,0,563.5334,a8w8_blockscale_1x128x128_256x128x128x128_16x16_32x32_2x2_8x32x1_8x32x1_1x32x1x8_8_1x1_intrawave_v3,778.82,503.67,0.0
gfx942,304,41984,1280,4096,ck,0,0,560.6148,a8w8_blockscale_1x128x128_256x128x128x128_16x16_32x32_2x2_8x32x1_8x32x1_1x32x1x8_8_1x1_intrawave_v3,785.27,507.81,0.0
gfx942,304,42112,1280,4096,ck,0,0,578.4789,a8w8_blockscale_1x128x128_256x128x128x128_16x16_32x32_2x2_8x32x1_8x32x1_1x32x1x8_8_1x1_intrawave_v3,763.34,493.61,0.0
gfx942,304,42240,1280,4096,ck,0,0,579.0374,a8w8_blockscale_1x128x128_256x128x128x128_16x16_32x32_2x2_8x32x1_8x32x1_1x32x1x8_8_1x1_intrawave_v3,764.92,494.6,0.0
gfx942,304,42368,1280,4096,ck,0,0,581.7153,a8w8_blockscale_1x128x128_256x128x128x128_16x16_32x32_2x2_8x32x1_8x32x1_1x32x1x8_8_1x1_intrawave_v3,763.71,493.79,0.0
gfx942,304,42496,1280,4096,ck,0,0,585.9213,a8w8_blockscale_1x128x128_256x128x128x128_16x16_32x32_2x2_8x32x1_8x32x1_1x32x1x8_8_1x1_intrawave_v3,760.52,491.7,0.0
gfx942,304,42624,1280,4096,ck,0,0,590.4118,a8w8_blockscale_1x128x128_256x128x128x128_16x16_32x32_2x2_8x32x1_8x32x1_1x32x1x8_8_1x1_intrawave_v3,757.01,489.4,0.0
gfx942,304,42752,1280,4096,ck,0,0,591.4631,a8w8_blockscale_1x128x128_256x128x128x128_16x16_32x32_2x2_8x32x1_8x32x1_1x32x1x8_8_1x1_intrawave_v3,757.93,489.97,0.0
gfx942,304,42880,1280,4096,ck,0,0,580.5568,a8w8_blockscale_1x128x128_256x128x128x128_16x16_32x32_2x2_8x32x1_8x32x1_1x32x1x8_8_1x1_intrawave_v3,774.48,500.64,0.0
gfx942,304,43008,1280,4096,ck,0,0,583.3114,a8w8_blockscale_1x128x128_256x128x128x128_16x16_32x32_2x2_8x32x1_8x32x1_1x32x1x8_8_1x1_intrawave_v3,773.12,499.74,0.0
gfx942,304,43136,1280,4096,ck,0,0,599.1643,a8w8_blockscale_1x128x128_256x128x128x128_16x16_32x32_2x2_8x32x1_8x32x1_1x32x1x8_8_1x1_intrawave_v3,754.91,487.94,0.0
gfx942,304,43264,1280,4096,ck,0,0,597.4199,a8w8_blockscale_1x128x128_256x128x128x128_16x16_32x32_2x2_8x32x1_8x32x1_1x32x1x8_8_1x1_intrawave_v3,759.36,490.79,0.0
gfx942,304,43392,1280,4096,ck,0,0,600.7975,a8w8_blockscale_1x128x128_256x128x128x128_16x16_32x32_2x2_8x32x1_8x32x1_1x32x1x8_8_1x1_intrawave_v3,757.32,489.45,0.0
gfx942,304,43520,1280,4096,ck,0,0,601.5339,a8w8_blockscale_1x128x128_256x128x128x128_16x16_32x32_2x2_8x32x1_8x32x1_1x32x1x8_8_1x1_intrawave_v3,758.63,490.27,0.0
gfx942,304,43648,1280,4096,ck,0,0,586.3801,a8w8_blockscale_1x128x128_256x128x128x128_16x16_32x32_2x2_8x32x1_8x32x1_1x32x1x8_8_1x1_intrawave_v3,780.52,504.39,0.0
gfx942,304,43776,1280,4096,ck,0,0,599.9069,a8w8_blockscale_1x128x128_256x128x128x128_16x16_32x32_2x2_8x32x1_8x32x1_1x32x1x8_8_1x1_intrawave_v3,765.16,494.44,0.0
gfx942,304,43904,1280,4096,ck,0,0,595.45,a8w8_blockscale_1x128x128_256x128x128x128_16x16_32x32_2x2_8x32x1_8x32x1_1x32x1x8_8_1x1_intrawave_v3,773.14,499.57,0.0
gfx942,304,44032,1280,4096,ck,0,0,611.6247,a8w8_blockscale_1x128x128_256x128x128x128_16x16_32x32_2x2_8x32x1_8x32x1_1x32x1x8_8_1x1_intrawave_v3,754.89,487.75,0.0
gfx942,304,44160,1280,4096,ck,0,0,590.8986,a8w8_blockscale_1x128x128_256x128x128x128_16x16_32x32_2x2_8x32x1_8x32x1_1x32x1x8_8_1x1_intrawave_v3,783.64,506.3,0.0
gfx942,304,44288,1280,4096,ck,0,0,599.8229,a8w8_blockscale_1x128x128_256x128x128x128_16x16_32x32_2x2_8x32x1_8x32x1_1x32x1x8_8_1x1_intrawave_v3,774.22,500.19,0.0
gfx942,304,44416,1280,4096,ck,0,0,610.2026,a8w8_blockscale_1x128x128_256x128x128x128_16x16_32x32_2x2_8x32x1_8x32x1_1x32x1x8_8_1x1_intrawave_v3,763.25,493.08,0.0
gfx942,304,44544,1280,4096,ck,0,0,605.2646,a8w8_blockscale_1x128x128_256x128x128x128_16x16_32x32_2x2_8x32x1_8x32x1_1x32x1x8_8_1x1_intrawave_v3,771.69,498.51,0.0
gfx942,304,44672,1280,4096,ck,0,0,611.874,a8w8_blockscale_1x128x128_256x128x128x128_16x16_32x32_2x2_8x32x1_8x32x1_1x32x1x8_8_1x1_intrawave_v3,765.55,494.51,0.0
gfx942,304,44800,1280,4096,ck,0,0,604.0689,a8w8_blockscale_1x128x128_256x128x128x128_16x16_32x32_2x2_8x32x1_8x32x1_1x32x1x8_8_1x1_intrawave_v3,777.66,502.31,0.0
gfx942,304,44928,1280,4096,ck,0,0,617.7956,a8w8_blockscale_1x128x128_256x128x128x128_16x16_32x32_2x2_8x32x1_8x32x1_1x32x1x8_8_1x1_intrawave_v3,762.56,492.53,0.0
gfx942,304,45056,1280,4096,ck,0,0,599.3745,a8w8_blockscale_1x128x128_256x128x128x128_16x16_32x32_2x2_8x32x1_8x32x1_1x32x1x8_8_1x1_intrawave_v3,788.23,509.09,0.0
gfx942,304,45184,1280,4096,ck,0,0,618.7733,a8w8_blockscale_1x128x128_256x128x128x128_16x16_32x32_2x2_8x32x1_8x32x1_1x32x1x8_8_1x1_intrawave_v3,765.69,494.51,0.0
gfx942,304,45312,1280,4096,ck,0,0,617.5172,a8w8_blockscale_1x128x128_256x128x128x128_16x16_32x32_2x2_8x32x1_8x32x1_1x32x1x8_8_1x1_intrawave_v3,769.42,496.89,0.0
gfx942,304,45440,1280,4096,ck,0,0,616.5915,a8w8_blockscale_1x128x128_256x128x128x128_16x16_32x32_2x2_8x32x1_8x32x1_1x32x1x8_8_1x1_intrawave_v3,772.75,499.02,0.0
gfx942,304,45568,1280,4096,ck,0,0,623.8536,a8w8_blockscale_1x128x128_256x128x128x128_16x16_32x32_2x2_8x32x1_8x32x1_1x32x1x8_8_1x1_intrawave_v3,765.91,494.58,0.0
gfx942,304,45696,1280,4096,ck,0,0,623.7892,a8w8_blockscale_1x128x128_256x128x128x128_16x16_32x32_2x2_8x32x1_8x32x1_1x32x1x8_8_1x1_intrawave_v3,768.14,495.99,0.0
gfx942,304,45824,1280,4096,ck,0,0,615.1632,a8w8_blockscale_1x128x128_256x128x128x128_16x16_32x32_2x2_8x32x1_8x32x1_1x32x1x8_8_1x1_intrawave_v3,781.09,504.33,0.0
gfx942,304,45952,1280,4096,ck,0,0,627.4424,a8w8_blockscale_1x128x128_256x128x128x128_16x16_32x32_2x2_8x32x1_8x32x1_1x32x1x8_8_1x1_intrawave_v3,767.95,495.82,0.0
gfx942,304,46080,1280,4096,ck,0,0,624.5435,a8w8_blockscale_1x128x128_256x128x128x128_16x16_32x32_2x2_8x32x1_8x32x1_1x32x1x8_8_1x1_intrawave_v3,773.66,499.49,0.0
gfx942,304,46208,1280,4096,ck,0,0,631.1475,a8w8_blockscale_1x128x128_256x128x128x128_16x16_32x32_2x2_8x32x1_8x32x1_1x32x1x8_8_1x1_intrawave_v3,767.69,495.61,0.0
gfx942,304,46336,1280,4096,ck,0,0,623.7461,a8w8_blockscale_1x128x128_256x128x128x128_16x16_32x32_2x2_8x32x1_8x32x1_1x32x1x8_8_1x1_intrawave_v3,778.95,502.86,0.0
gfx942,304,46464,1280,4096,ck,0,0,639.5917,a8w8_blockscale_1x128x128_256x128x128x128_16x16_32x32_2x2_8x32x1_8x32x1_1x32x1x8_8_1x1_intrawave_v3,761.75,491.73,0.0
gfx942,304,46592,1280,4096,ck,0,0,639.0785,a8w8_blockscale_1x128x128_256x128x128x128_16x16_32x32_2x2_8x32x1_8x32x1_1x32x1x8_8_1x1_intrawave_v3,764.46,493.46,0.0
gfx942,304,46720,1280,4096,ck,0,0,634.4844,a8w8_blockscale_1x128x128_256x128x128x128_16x16_32x32_2x2_8x32x1_8x32x1_1x32x1x8_8_1x1_intrawave_v3,772.11,498.38,0.0
gfx942,304,46848,1280,4096,ck,0,0,648.3004,a8w8_blockscale_1x128x128_256x128x128x128_16x16_32x32_2x2_8x32x1_8x32x1_1x32x1x8_8_1x1_intrawave_v3,757.73,489.07,0.0
gfx942,304,46976,1280,4096,ck,0,0,644.0003,a8w8_blockscale_1x128x128_256x128x128x128_16x16_32x32_2x2_8x32x1_8x32x1_1x32x1x8_8_1x1_intrawave_v3,764.87,493.66,0.0
gfx942,304,47104,1280,4096,ck,0,0,644.6395,a8w8_blockscale_1x128x128_256x128x128x128_16x16_32x32_2x2_8x32x1_8x32x1_1x32x1x8_8_1x1_intrawave_v3,766.2,494.49,0.0
gfx942,304,47232,1280,4096,ck,0,0,642.6996,a8w8_blockscale_1x128x128_256x128x128x128_16x16_32x32_2x2_8x32x1_8x32x1_1x32x1x8_8_1x1_intrawave_v3,770.6,497.31,0.0
gfx942,304,47360,1280,4096,ck,0,0,642.5708,a8w8_blockscale_1x128x128_256x128x128x128_16x16_32x32_2x2_8x32x1_8x32x1_1x32x1x8_8_1x1_intrawave_v3,772.84,498.73,0.0
gfx942,304,47488,1280,4096,ck,0,0,654.2265,a8w8_blockscale_1x128x128_256x128x128x128_16x16_32x32_2x2_8x32x1_8x32x1_1x32x1x8_8_1x1_intrawave_v3,761.12,491.15,0.0
gfx942,304,47616,1280,4096,ck,0,0,657.6581,a8w8_blockscale_1x128x128_256x128x128x128_16x16_32x32_2x2_8x32x1_8x32x1_1x32x1x8_8_1x1_intrawave_v3,759.19,489.88,0.0
gfx942,304,47744,1280,4096,ck,0,0,643.3442,a8w8_blockscale_1x128x128_256x128x128x128_16x16_32x32_2x2_8x32x1_8x32x1_1x32x1x8_8_1x1_intrawave_v3,778.17,502.11,0.0
gfx942,304,47872,1280,4096,ck,0,0,659.2792,a8w8_blockscale_1x128x128_256x128x128x128_16x16_32x32_2x2_8x32x1_8x32x1_1x32x1x8_8_1x1_intrawave_v3,761.4,491.26,0.0
gfx942,304,48000,1280,4096,ck,0,0,653.628,a8w8_blockscale_1x128x128_256x128x128x128_16x16_32x32_2x2_8x32x1_8x32x1_1x32x1x8_8_1x1_intrawave_v3,770.04,496.81,0.0
gfx942,304,48128,1280,4096,ck,0,0,650.5235,a8w8_blockscale_1x128x128_256x128x128x128_16x16_32x32_2x2_8x32x1_8x32x1_1x32x1x8_8_1x1_intrawave_v3,775.77,500.49,0.0
gfx942,304,48256,1280,4096,ck,0,0,667.8615,a8w8_blockscale_1x128x128_256x128x128x128_16x16_32x32_2x2_8x32x1_8x32x1_1x32x1x8_8_1x1_intrawave_v3,757.64,488.78,0.0
gfx942,304,48384,1280,4096,ck,0,0,649.879,a8w8_blockscale_1x128x128_256x128x128x128_16x16_32x32_2x2_8x32x1_8x32x1_1x32x1x8_8_1x1_intrawave_v3,780.67,503.61,0.0
gfx942,304,48512,1280,4096,ck,0,0,655.2402,a8w8_blockscale_1x128x128_256x128x128x128_16x16_32x32_2x2_8x32x1_8x32x1_1x32x1x8_8_1x1_intrawave_v3,776.33,500.79,0.0
gfx942,304,48640,1280,4096,ck,0,0,664.8766,a8w8_blockscale_1x128x128_256x128x128x128_16x16_32x32_2x2_8x32x1_8x32x1_1x32x1x8_8_1x1_intrawave_v3,767.1,494.81,0.0
gfx942,304,48768,1280,4096,ck,0,0,667.7592,a8w8_blockscale_1x128x128_256x128x128x128_16x16_32x32_2x2_8x32x1_8x32x1_1x32x1x8_8_1x1_intrawave_v3,765.8,493.95,0.0
gfx942,304,48896,1280,4096,ck,0,0,660.1263,a8w8_blockscale_1x128x128_256x128x128x128_16x16_32x32_2x2_8x32x1_8x32x1_1x32x1x8_8_1x1_intrawave_v3,776.69,500.96,0.0
gfx942,304,49024,1280,4096,ck,0,0,667.5597,a8w8_blockscale_1x128x128_256x128x128x128_16x16_32x32_2x2_8x32x1_8x32x1_1x32x1x8_8_1x1_intrawave_v3,770.05,496.65,0.0
gfx942,304,49152,1280,4096,ck,0,0,660.1513,a8w8_blockscale_1x128x128_256x128x128x128_16x16_32x32_2x2_8x32x1_8x32x1_1x32x1x8_8_1x1_intrawave_v3,780.72,503.52,0.0
gfx942,304,49280,1280,4096,ck,0,0,677.4648,a8w8_blockscale_1x128x128_256x128x128x128_16x16_32x32_2x2_8x32x1_8x32x1_1x32x1x8_8_1x1_intrawave_v3,762.75,491.91,0.0
gfx942,304,49408,1280,4096,ck,0,0,666.163,a8w8_blockscale_1x128x128_256x128x128x128_16x16_32x32_2x2_8x32x1_8x32x1_1x32x1x8_8_1x1_intrawave_v3,777.71,501.53,0.0
gfx942,304,49536,1280,4096,ck,0,0,661.9872,a8w8_blockscale_1x128x128_256x128x128x128_16x16_32x32_2x2_8x32x1_8x32x1_1x32x1x8_8_1x1_intrawave_v3,784.64,505.98,0.0
gfx942,304,49664,1280,4096,ck,0,0,680.0738,a8w8_blockscale_1x128x128_256x128x128x128_16x16_32x32_2x2_8x32x1_8x32x1_1x32x1x8_8_1x1_intrawave_v3,765.75,493.78,0.0
gfx942,304,49792,1280,4096,ck,0,0,665.8381,a8w8_blockscale_1x128x128_256x128x128x128_16x16_32x32_2x2_8x32x1_8x32x1_1x32x1x8_8_1x1_intrawave_v3,784.14,505.62,0.0
gfx942,304,49920,1280,4096,ck,0,0,677.8542,a8w8_blockscale_1x128x128_256x128x128x128_16x16_32x32_2x2_8x32x1_8x32x1_1x32x1x8_8_1x1_intrawave_v3,772.21,497.91,0.0
gfx942,304,50048,1280,4096,ck,0,0,685.6431,a8w8_blockscale_1x128x128_256x128x128x128_16x16_32x32_2x2_8x32x1_8x32x1_1x32x1x8_8_1x1_intrawave_v3,765.4,493.5,0.0
gfx942,304,50176,1280,4096,ck,0,0,690.7406,a8w8_blockscale_1x128x128_256x128x128x128_16x16_32x32_2x2_8x32x1_8x32x1_1x32x1x8_8_1x1_intrawave_v3,761.69,491.09,0.0
gfx942,304,50304,1280,4096,ck,0,0,691.9511,a8w8_blockscale_1x128x128_256x128x128x128_16x16_32x32_2x2_8x32x1_8x32x1_1x32x1x8_8_1x1_intrawave_v3,762.3,491.46,0.0
gfx942,304,50432,1280,4096,ck,0,0,691.5971,a8w8_blockscale_1x128x128_256x128x128x128_16x16_32x32_2x2_8x32x1_8x32x1_1x32x1x8_8_1x1_intrawave_v3,764.63,492.94,0.0
gfx942,304,50560,1280,4096,ck,0,0,688.4863,a8w8_blockscale_1x128x128_256x128x128x128_16x16_32x32_2x2_8x32x1_8x32x1_1x32x1x8_8_1x1_intrawave_v3,770.04,496.41,0.0
gfx942,304,50688,1280,4096,ck,0,0,693.1854,a8w8_blockscale_1x128x128_256x128x128x128_16x16_32x32_2x2_8x32x1_8x32x1_1x32x1x8_8_1x1_intrawave_v3,766.75,494.27,0.0
gfx942,304,50816,1280,4096,ck,0,0,688.2485,a8w8_blockscale_1x128x128_256x128x128x128_16x16_32x32_2x2_8x32x1_8x32x1_1x32x1x8_8_1x1_intrawave_v3,774.2,499.06,0.0
gfx942,304,50944,1280,4096,ck,0,0,706.3317,a8w8_blockscale_1x128x128_256x128x128x128_16x16_32x32_2x2_8x32x1_8x32x1_1x32x1x8_8_1x1_intrawave_v3,756.28,487.49,0.0
gfx942,304,51072,1280,4096,ck,0,0,695.5663,a8w8_blockscale_1x128x128_256x128x128x128_16x16_32x32_2x2_8x32x1_8x32x1_1x32x1x8_8_1x1_intrawave_v3,769.92,496.25,0.0
gfx942,304,51200,1280,4096,ck,0,0,688.553,a8w8_blockscale_1x128x128_256x128x128x128_16x16_32x32_2x2_8x32x1_8x32x1_1x32x1x8_8_1x1_intrawave_v3,779.71,502.55,0.0
gfx942,304,51328,1280,4096,ck,0,0,707.2118,a8w8_blockscale_1x128x128_256x128x128x128_16x16_32x32_2x2_8x32x1_8x32x1_1x32x1x8_8_1x1_intrawave_v3,761.04,490.49,0.0
gfx942,304,51456,1280,4096,ck,0,0,703.2175,a8w8_blockscale_1x128x128_256x128x128x128_16x16_32x32_2x2_8x32x1_8x32x1_1x32x1x8_8_1x1_intrawave_v3,767.27,494.49,0.0
gfx942,304,51584,1280,4096,ck,0,0,717.5699,a8w8_blockscale_1x128x128_256x128x128x128_16x16_32x32_2x2_8x32x1_8x32x1_1x32x1x8_8_1x1_intrawave_v3,753.79,485.79,0.0
gfx942,304,51712,1280,4096,ck,0,0,695.2226,a8w8_blockscale_1x128x128_256x128x128x128_16x16_32x32_2x2_8x32x1_8x32x1_1x32x1x8_8_1x1_intrawave_v3,779.95,502.63,0.0
gfx942,304,51840,1280,4096,ck,0,0,710.9351,a8w8_blockscale_1x128x128_256x128x128x128_16x16_32x32_2x2_8x32x1_8x32x1_1x32x1x8_8_1x1_intrawave_v3,764.6,492.72,0.0
gfx942,304,51968,1280,4096,ck,0,0,712.1924,a8w8_blockscale_1x128x128_256x128x128x128_16x16_32x32_2x2_8x32x1_8x32x1_1x32x1x8_8_1x1_intrawave_v3,765.14,493.04,0.0
gfx942,304,52096,1280,4096,ck,0,0,706.4797,a8w8_blockscale_1x128x128_256x128x128x128_16x16_32x32_2x2_8x32x1_8x32x1_1x32x1x8_8_1x1_intrawave_v3,773.22,498.24,0.0
gfx942,304,52224,1280,4096,ck,0,0,697.4068,a8w8_blockscale_1x128x128_256x128x128x128_16x16_32x32_2x2_8x32x1_8x32x1_1x32x1x8_8_1x1_intrawave_v3,785.21,505.94,0.0
gfx942,304,52352,1280,4096,ck,0,0,717.9455,a8w8_blockscale_1x128x128_256x128x128x128_16x16_32x32_2x2_8x32x1_8x32x1_1x32x1x8_8_1x1_intrawave_v3,764.61,492.65,0.0
gfx942,304,52480,1280,4096,ck,0,0,701.9826,a8w8_blockscale_1x128x128_256x128x128x128_16x16_32x32_2x2_8x32x1_8x32x1_1x32x1x8_8_1x1_intrawave_v3,783.91,505.07,0.0
gfx942,304,52608,1280,4096,ck,0,0,723.2766,a8w8_blockscale_1x128x128_256x128x128x128_16x16_32x32_2x2_8x32x1_8x32x1_1x32x1x8_8_1x1_intrawave_v3,762.69,491.38,0.0
gfx942,304,52736,1280,4096,ck,0,0,723.2063,a8w8_blockscale_1x128x128_256x128x128x128_16x16_32x32_2x2_8x32x1_8x32x1_1x32x1x8_8_1x1_intrawave_v3,764.62,492.6,0.0
gfx942,304,52864,1280,4096,ck,0,0,708.5182,a8w8_blockscale_1x128x128_256x128x128x128_16x16_32x32_2x2_8x32x1_8x32x1_1x32x1x8_8_1x1_intrawave_v3,782.36,504.02,0.0
gfx942,304,52992,1280,4096,ck,0,0,713.3841,a8w8_blockscale_1x128x128_256x128x128x128_16x16_32x32_2x2_8x32x1_8x32x1_1x32x1x8_8_1x1_intrawave_v3,778.91,501.77,0.0
gfx942,304,53120,1280,4096,ck,0,0,716.8,a8w8_blockscale_1x128x128_256x128x128x128_16x16_32x32_2x2_8x32x1_8x32x1_1x32x1x8_8_1x1_intrawave_v3,777.07,500.57,0.0
gfx942,304,53248,1280,4096,ck,0,0,711.7096,a8w8_blockscale_1x128x128_256x128x128x128_16x16_32x32_2x2_8x32x1_8x32x1_1x32x1x8_8_1x1_intrawave_v3,784.51,505.35,0.0
gfx942,304,53376,1280,4096,ck,0,0,732.2985,a8w8_blockscale_1x128x128_256x128x128x128_16x16_32x32_2x2_8x32x1_8x32x1_1x32x1x8_8_1x1_intrawave_v3,764.29,492.3,0.0
gfx942,304,53504,1280,4096,ck,0,0,721.4005,a8w8_blockscale_1x128x128_256x128x128x128_16x16_32x32_2x2_8x32x1_8x32x1_1x32x1x8_8_1x1_intrawave_v3,777.7,500.92,0.0
gfx942,304,53632,1280,4096,ck,0,0,717.6259,a8w8_blockscale_1x128x128_256x128x128x128_16x16_32x32_2x2_8x32x1_8x32x1_1x32x1x8_8_1x1_intrawave_v3,783.66,504.74,0.0
gfx942,304,53760,1280,4096,ck,0,0,717.1896,a8w8_blockscale_1x128x128_256x128x128x128_16x16_32x32_2x2_8x32x1_8x32x1_1x32x1x8_8_1x1_intrawave_v3,786.0,506.24,0.0
gfx942,304,53888,1280,4096,ck,0,0,728.5113,a8w8_blockscale_1x128x128_256x128x128x128_16x16_32x32_2x2_8x32x1_8x32x1_1x32x1x8_8_1x1_intrawave_v3,775.63,499.54,0.0
gfx942,304,54016,1280,4096,ck,0,0,732.4189,a8w8_blockscale_1x128x128_256x128x128x128_16x16_32x32_2x2_8x32x1_8x32x1_1x32x1x8_8_1x1_intrawave_v3,773.33,498.04,0.0
gfx942,304,54144,1280,4096,ck,0,0,728.7845,a8w8_blockscale_1x128x128_256x128x128x128_16x16_32x32_2x2_8x32x1_8x32x1_1x32x1x8_8_1x1_intrawave_v3,779.02,501.69,0.0
gfx942,304,54272,1280,4096,ck,0,0,724.6541,a8w8_blockscale_1x128x128_256x128x128x128_16x16_32x32_2x2_8x32x1_8x32x1_1x32x1x8_8_1x1_intrawave_v3,785.32,505.73,0.0
gfx942,304,54400,1280,4096,ck,0,0,729.1802,a8w8_blockscale_1x128x128_256x128x128x128_16x16_32x32_2x2_8x32x1_8x32x1_1x32x1x8_8_1x1_intrawave_v3,782.28,503.76,0.0
gfx942,304,54528,1280,4096,ck,0,0,738.2678,a8w8_blockscale_1x128x128_256x128x128x128_16x16_32x32_2x2_8x32x1_8x32x1_1x32x1x8_8_1x1_intrawave_v3,774.47,498.71,0.0
gfx942,304,54656,1280,4096,ck,0,0,756.6731,a8w8_blockscale_1x128x128_256x128x128x128_16x16_32x32_2x2_8x32x1_8x32x1_1x32x1x8_8_1x1_intrawave_v3,757.41,487.7,0.0
gfx942,304,54784,1280,4096,ck,0,0,748.5763,a8w8_blockscale_1x128x128_256x128x128x128_16x16_32x32_2x2_8x32x1_8x32x1_1x32x1x8_8_1x1_intrawave_v3,767.39,494.12,0.0
gfx942,304,54912,1280,4096,ck,0,0,740.4388,a8w8_blockscale_1x128x128_256x128x128x128_16x16_32x32_2x2_8x32x1_8x32x1_1x32x1x8_8_1x1_intrawave_v3,777.64,500.7,0.0
gfx942,304,55040,1280,4096,ck,0,0,743.3286,a8w8_blockscale_1x128x128_256x128x128x128_16x16_32x32_2x2_8x32x1_8x32x1_1x32x1x8_8_1x1_intrawave_v3,776.42,499.9,0.0
gfx942,304,55168,1280,4096,ck,0,0,752.129,a8w8_blockscale_1x128x128_256x128x128x128_16x16_32x32_2x2_8x32x1_8x32x1_1x32x1x8_8_1x1_intrawave_v3,769.12,495.18,0.0
gfx942,304,55296,1280,4096,ck,0,0,749.2689,a8w8_blockscale_1x128x128_256x128x128x128_16x16_32x32_2x2_8x32x1_8x32x1_1x32x1x8_8_1x1_intrawave_v3,773.85,498.21,0.0
gfx942,304,55424,1280,4096,ck,0,0,754.0492,a8w8_blockscale_1x128x128_256x128x128x128_16x16_32x32_2x2_8x32x1_8x32x1_1x32x1x8_8_1x1_intrawave_v3,770.72,496.18,0.0
gfx942,304,55552,1280,4096,ck,0,0,751.0994,a8w8_blockscale_1x128x128_256x128x128x128_16x16_32x32_2x2_8x32x1_8x32x1_1x32x1x8_8_1x1_intrawave_v3,775.54,499.26,0.0
gfx942,304,55680,1280,4096,ck,0,0,761.841,a8w8_blockscale_1x128x128_256x128x128x128_16x16_32x32_2x2_8x32x1_8x32x1_1x32x1x8_8_1x1_intrawave_v3,766.36,493.34,0.0
gfx942,304,55808,1280,4096,ck,0,0,750.0327,a8w8_blockscale_1x128x128_256x128x128x128_16x16_32x32_2x2_8x32x1_8x32x1_1x32x1x8_8_1x1_intrawave_v3,780.22,502.25,0.0
gfx942,304,55936,1280,4096,ck,0,0,758.2751,a8w8_blockscale_1x128x128_256x128x128x128_16x16_32x32_2x2_8x32x1_8x32x1_1x32x1x8_8_1x1_intrawave_v3,773.51,497.91,0.0
gfx942,304,56064,1280,4096,ck,0,0,749.3111,a8w8_blockscale_1x128x128_256x128x128x128_16x16_32x32_2x2_8x32x1_8x32x1_1x32x1x8_8_1x1_intrawave_v3,784.55,505.0,0.0
gfx942,304,56192,1280,4096,ck,0,0,768.2998,a8w8_blockscale_1x128x128_256x128x128x128_16x16_32x32_2x2_8x32x1_8x32x1_1x32x1x8_8_1x1_intrawave_v3,766.91,493.63,0.0
gfx942,304,56320,1280,4096,ck,0,0,763.1538,a8w8_blockscale_1x128x128_256x128x128x128_16x16_32x32_2x2_8x32x1_8x32x1_1x32x1x8_8_1x1_intrawave_v3,773.84,498.08,0.0
gfx942,304,56448,1280,4096,ck,0,0,759.6901,a8w8_blockscale_1x128x128_256x128x128x128_16x16_32x32_2x2_8x32x1_8x32x1_1x32x1x8_8_1x1_intrawave_v3,779.13,501.47,0.0
gfx942,304,56576,1280,4096,ck,0,0,756.1958,a8w8_blockscale_1x128x128_256x128x128x128_16x16_32x32_2x2_8x32x1_8x32x1_1x32x1x8_8_1x1_intrawave_v3,784.51,504.91,0.0
gfx942,304,56704,1280,4096,ck,0,0,767.4997,a8w8_blockscale_1x128x128_256x128x128x128_16x16_32x32_2x2_8x32x1_8x32x1_1x32x1x8_8_1x1_intrawave_v3,774.7,498.59,0.0
gfx942,304,56832,1280,4096,ck,0,0,767.9606,a8w8_blockscale_1x128x128_256x128x128x128_16x16_32x32_2x2_8x32x1_8x32x1_1x32x1x8_8_1x1_intrawave_v3,775.99,499.4,0.0
gfx942,304,56960,1280,4096,ck,0,0,761.5448,a8w8_blockscale_1x128x128_256x128x128x128_16x16_32x32_2x2_8x32x1_8x32x1_1x32x1x8_8_1x1_intrawave_v3,784.29,504.72,0.0
gfx942,304,57088,1280,4096,ck,0,0,783.2784,a8w8_blockscale_1x128x128_256x128x128x128_16x16_32x32_2x2_8x32x1_8x32x1_1x32x1x8_8_1x1_intrawave_v3,764.24,491.81,0.0
gfx942,304,57216,1280,4096,ck,0,0,772.3094,a8w8_blockscale_1x128x128_256x128x128x128_16x16_32x32_2x2_8x32x1_8x32x1_1x32x1x8_8_1x1_intrawave_v3,776.83,499.89,0.0
gfx942,304,57344,1280,4096,ck,0,0,769.1423,a8w8_blockscale_1x128x128_256x128x128x128_16x16_32x32_2x2_8x32x1_8x32x1_1x32x1x8_8_1x1_intrawave_v3,781.77,503.06,0.0
gfx942,304,57472,1280,4096,ck,0,0,784.7709,a8w8_blockscale_1x128x128_256x128x128x128_16x16_32x32_2x2_8x32x1_8x32x1_1x32x1x8_8_1x1_intrawave_v3,767.92,494.13,0.0
gfx942,304,57600,1280,4096,ck,0,0,784.1099,a8w8_blockscale_1x128x128_256x128x128x128_16x16_32x32_2x2_8x32x1_8x32x1_1x32x1x8_8_1x1_intrawave_v3,770.27,495.63,0.0
gfx942,304,57728,1280,4096,ck,0,0,784.7864,a8w8_blockscale_1x128x128_256x128x128x128_16x16_32x32_2x2_8x32x1_8x32x1_1x32x1x8_8_1x1_intrawave_v3,771.32,496.29,0.0
gfx942,304,57856,1280,4096,ck,0,0,777.1681,a8w8_blockscale_1x128x128_256x128x128x128_16x16_32x32_2x2_8x32x1_8x32x1_1x32x1x8_8_1x1_intrawave_v3,780.61,502.25,0.0
gfx942,304,57984,1280,4096,ck,0,0,784.1225,a8w8_blockscale_1x128x128_256x128x128x128_16x16_32x32_2x2_8x32x1_8x32x1_1x32x1x8_8_1x1_intrawave_v3,775.4,498.88,0.0
gfx942,304,58112,1280,4096,ck,0,0,774.5201,a8w8_blockscale_1x128x128_256x128x128x128_16x16_32x32_2x2_8x32x1_8x32x1_1x32x1x8_8_1x1_intrawave_v3,786.74,506.17,0.0
gfx942,304,58240,1280,4096,ck,0,0,780.3703,a8w8_blockscale_1x128x128_256x128x128x128_16x16_32x32_2x2_8x32x1_8x32x1_1x32x1x8_8_1x1_intrawave_v3,782.57,503.46,0.0
gfx942,304,58368,1280,4096,ck,0,0,778.269,a8w8_blockscale_1x128x128_256x128x128x128_16x16_32x32_2x2_8x32x1_8x32x1_1x32x1x8_8_1x1_intrawave_v3,786.4,505.92,0.0
gfx942,304,58496,1280,4096,ck,0,0,789.9349,a8w8_blockscale_1x128x128_256x128x128x128_16x16_32x32_2x2_8x32x1_8x32x1_1x32x1x8_8_1x1_intrawave_v3,776.49,499.53,0.0
gfx942,304,58624,1280,4096,ck,0,0,796.4498,a8w8_blockscale_1x128x128_256x128x128x128_16x16_32x32_2x2_8x32x1_8x32x1_1x32x1x8_8_1x1_intrawave_v3,771.82,496.51,0.0
gfx942,304,58752,1280,4096,ck,0,0,785.4313,a8w8_blockscale_1x128x128_256x128x128x128_16x16_32x32_2x2_8x32x1_8x32x1_1x32x1x8_8_1x1_intrawave_v3,784.36,504.56,0.0
gfx942,304,58880,1280,4096,ck,0,0,791.6026,a8w8_blockscale_1x128x128_256x128x128x128_16x16_32x32_2x2_8x32x1_8x32x1_1x32x1x8_8_1x1_intrawave_v3,779.94,501.7,0.0
gfx942,304,59008,1280,4096,ck,0,0,802.5028,a8w8_blockscale_1x128x128_256x128x128x128_16x16_32x32_2x2_8x32x1_8x32x1_1x32x1x8_8_1x1_intrawave_v3,771.02,495.95,0.0
gfx942,304,59136,1280,4096,ck,0,0,814.1563,a8w8_blockscale_1x128x128_256x128x128x128_16x16_32x32_2x2_8x32x1_8x32x1_1x32x1x8_8_1x1_intrawave_v3,761.63,489.9,0.0
gfx942,304,59264,1280,4096,ck,0,0,800.0428,a8w8_blockscale_1x128x128_256x128x128x128_16x16_32x32_2x2_8x32x1_8x32x1_1x32x1x8_8_1x1_intrawave_v3,776.74,499.6,0.0
gfx942,304,59392,1280,4096,ck,0,0,785.198,a8w8_blockscale_1x128x128_256x128x128x128_16x16_32x32_2x2_8x32x1_8x32x1_1x32x1x8_8_1x1_intrawave_v3,793.14,510.13,0.0
gfx942,304,59520,1280,4096,ck,0,0,797.5644,a8w8_blockscale_1x128x128_256x128x128x128_16x16_32x32_2x2_8x32x1_8x32x1_1x32x1x8_8_1x1_intrawave_v3,782.52,503.29,0.0
gfx942,304,59648,1280,4096,ck,0,0,801.426,a8w8_blockscale_1x128x128_256x128x128x128_16x16_32x32_2x2_8x32x1_8x32x1_1x32x1x8_8_1x1_intrawave_v3,780.43,501.93,0.0
gfx942,304,59776,1280,4096,ck,0,0,804.5337,a8w8_blockscale_1x128x128_256x128x128x128_16x16_32x32_2x2_8x32x1_8x32x1_1x32x1x8_8_1x1_intrawave_v3,779.08,501.05,0.0
gfx942,304,59904,1280,4096,ck,0,0,812.0813,a8w8_blockscale_1x128x128_256x128x128x128_16x16_32x32_2x2_8x32x1_8x32x1_1x32x1x8_8_1x1_intrawave_v3,773.49,497.44,0.0
gfx942,304,60032,1280,4096,ck,0,0,809.6729,a8w8_blockscale_1x128x128_256x128x128x128_16x16_32x32_2x2_8x32x1_8x32x1_1x32x1x8_8_1x1_intrawave_v3,777.45,499.97,0.0
gfx942,304,60160,1280,4096,ck,0,0,805.5424,a8w8_blockscale_1x128x128_256x128x128x128_16x16_32x32_2x2_8x32x1_8x32x1_1x32x1x8_8_1x1_intrawave_v3,783.1,503.6,0.0
gfx942,304,60288,1280,4096,ck,0,0,816.2799,a8w8_blockscale_1x128x128_256x128x128x128_16x16_32x32_2x2_8x32x1_8x32x1_1x32x1x8_8_1x1_intrawave_v3,774.45,498.02,0.0
gfx942,304,60416,1280,4096,ck,0,0,818.0786,a8w8_blockscale_1x128x128_256x128x128x128_16x16_32x32_2x2_8x32x1_8x32x1_1x32x1x8_8_1x1_intrawave_v3,774.38,497.96,0.0
gfx942,304,60544,1280,4096,ck,0,0,810.4779,a8w8_blockscale_1x128x128_256x128x128x128_16x16_32x32_2x2_8x32x1_8x32x1_1x32x1x8_8_1x1_intrawave_v3,783.3,503.68,0.0
gfx942,304,60672,1280,4096,ck,0,0,826.1373,a8w8_blockscale_1x128x128_256x128x128x128_16x16_32x32_2x2_8x32x1_8x32x1_1x32x1x8_8_1x1_intrawave_v3,770.08,495.17,0.0
gfx942,304,60800,1280,4096,ck,0,0,826.1637,a8w8_blockscale_1x128x128_256x128x128x128_16x16_32x32_2x2_8x32x1_8x32x1_1x32x1x8_8_1x1_intrawave_v3,771.68,496.18,0.0
gfx942,304,60928,1280,4096,ck,0,0,827.3971,a8w8_blockscale_1x128x128_256x128x128x128_16x16_32x32_2x2_8x32x1_8x32x1_1x32x1x8_8_1x1_intrawave_v3,772.15,496.47,0.0
gfx942,304,61056,1280,4096,ck,0,0,820.574,a8w8_blockscale_1x128x128_256x128x128x128_16x16_32x32_2x2_8x32x1_8x32x1_1x32x1x8_8_1x1_intrawave_v3,780.21,501.64,0.0
gfx942,304,61184,1280,4096,ck,0,0,836.957,a8w8_blockscale_1x128x128_256x128x128x128_16x16_32x32_2x2_8x32x1_8x32x1_1x32x1x8_8_1x1_intrawave_v3,766.54,492.84,0.0
gfx942,304,61312,1280,4096,ck,0,0,839.5504,a8w8_blockscale_1x128x128_256x128x128x128_16x16_32x32_2x2_8x32x1_8x32x1_1x32x1x8_8_1x1_intrawave_v3,765.77,492.33,0.0
gfx942,304,61440,1280,4096,ck,0,0,818.8395,a8w8_blockscale_1x128x128_256x128x128x128_16x16_32x32_2x2_8x32x1_8x32x1_1x32x1x8_8_1x1_intrawave_v3,786.78,505.82,0.0
gfx942,304,61568,1280,4096,ck,0,0,830.9637,a8w8_blockscale_1x128x128_256x128x128x128_16x16_32x32_2x2_8x32x1_8x32x1_1x32x1x8_8_1x1_intrawave_v3,776.91,499.47,0.0
gfx942,304,61696,1280,4096,ck,0,0,845.3241,a8w8_blockscale_1x128x128_256x128x128x128_16x16_32x32_2x2_8x32x1_8x32x1_1x32x1x8_8_1x1_intrawave_v3,765.3,491.99,0.0
gfx942,304,61824,1280,4096,ck,0,0,824.9233,a8w8_blockscale_1x128x128_256x128x128x128_16x16_32x32_2x2_8x32x1_8x32x1_1x32x1x8_8_1x1_intrawave_v3,785.86,505.19,0.0
gfx942,304,61952,1280,4096,ck,0,0,846.0728,a8w8_blockscale_1x128x128_256x128x128x128_16x16_32x32_2x2_8x32x1_8x32x1_1x32x1x8_8_1x1_intrawave_v3,767.8,493.57,0.0
gfx942,304,62080,1280,4096,ck,0,0,826.4896,a8w8_blockscale_1x128x128_256x128x128x128_16x16_32x32_2x2_8x32x1_8x32x1_1x32x1x8_8_1x1_intrawave_v3,787.62,506.29,0.0
gfx942,304,62208,1280,4096,ck,0,0,853.8957,a8w8_blockscale_1x128x128_256x128x128x128_16x16_32x32_2x2_8x32x1_8x32x1_1x32x1x8_8_1x1_intrawave_v3,763.91,491.04,0.0
gfx942,304,62336,1280,4096,ck,0,0,854.965,a8w8_blockscale_1x128x128_256x128x128x128_16x16_32x32_2x2_8x32x1_8x32x1_1x32x1x8_8_1x1_intrawave_v3,764.52,491.43,0.0
gfx942,304,62464,1280,4096,ck,0,0,849.8307,a8w8_blockscale_1x128x128_256x128x128x128_16x16_32x32_2x2_8x32x1_8x32x1_1x32x1x8_8_1x1_intrawave_v3,770.72,495.4,0.0
gfx942,304,62592,1280,4096,ck,0,0,836.2662,a8w8_blockscale_1x128x128_256x128x128x128_16x16_32x32_2x2_8x32x1_8x32x1_1x32x1x8_8_1x1_intrawave_v3,784.83,504.45,0.0
gfx942,304,62720,1280,4096,ck,0,0,829.5256,a8w8_blockscale_1x128x128_256x128x128x128_16x16_32x32_2x2_8x32x1_8x32x1_1x32x1x8_8_1x1_intrawave_v3,792.82,509.58,0.0
gfx942,304,62848,1280,4096,ck,0,0,840.3249,a8w8_blockscale_1x128x128_256x128x128x128_16x16_32x32_2x2_8x32x1_8x32x1_1x32x1x8_8_1x1_intrawave_v3,784.23,504.04,0.0
gfx942,304,62976,1280,4096,ck,0,0,842.2013,a8w8_blockscale_1x128x128_256x128x128x128_16x16_32x32_2x2_8x32x1_8x32x1_1x32x1x8_8_1x1_intrawave_v3,784.08,503.93,0.0
gfx942,304,63104,1280,4096,ck,0,0,850.975,a8w8_blockscale_1x128x128_256x128x128x128_16x16_32x32_2x2_8x32x1_8x32x1_1x32x1x8_8_1x1_intrawave_v3,777.57,499.74,0.0
gfx942,304,63232,1280,4096,ck,0,0,861.5757,a8w8_blockscale_1x128x128_256x128x128x128_16x16_32x32_2x2_8x32x1_8x32x1_1x32x1x8_8_1x1_intrawave_v3,769.56,494.58,0.0
gfx942,304,63360,1280,4096,ck,0,0,868.2582,a8w8_blockscale_1x128x128_256x128x128x128_16x16_32x32_2x2_8x32x1_8x32x1_1x32x1x8_8_1x1_intrawave_v3,765.18,491.75,0.0
gfx942,304,63488,1280,4096,ck,0,0,839.6889,a8w8_blockscale_1x128x128_256x128x128x128_16x16_32x32_2x2_8x32x1_8x32x1_1x32x1x8_8_1x1_intrawave_v3,792.82,509.5,0.0
gfx942,304,63616,1280,4096,ck,0,0,852.3064,a8w8_blockscale_1x128x128_256x128x128x128_16x16_32x32_2x2_8x32x1_8x32x1_1x32x1x8_8_1x1_intrawave_v3,782.66,502.95,0.0
gfx942,304,63744,1280,4096,ck,0,0,865.4648,a8w8_blockscale_1x128x128_256x128x128x128_16x16_32x32_2x2_8x32x1_8x32x1_1x32x1x8_8_1x1_intrawave_v3,772.31,496.29,0.0
gfx942,304,63872,1280,4096,ck,0,0,850.056,a8w8_blockscale_1x128x128_256x128x128x128_16x16_32x32_2x2_8x32x1_8x32x1_1x32x1x8_8_1x1_intrawave_v3,787.89,506.29,0.0
gfx942,304,64000,1280,4096,ck,0,0,875.7246,a8w8_blockscale_1x128x128_256x128x128x128_16x16_32x32_2x2_8x32x1_8x32x1_1x32x1x8_8_1x1_intrawave_v3,766.32,492.42,0.0
gfx942,304,64128,1280,4096,ck,0,0,878.8297,a8w8_blockscale_1x128x128_256x128x128x128_16x16_32x32_2x2_8x32x1_8x32x1_1x32x1x8_8_1x1_intrawave_v3,765.14,491.65,0.0
gfx942,304,64256,1280,4096,ck,0,0,858.8573,a8w8_blockscale_1x128x128_256x128x128x128_16x16_32x32_2x2_8x32x1_8x32x1_1x32x1x8_8_1x1_intrawave_v3,784.5,504.08,0.0
gfx942,304,64384,1280,4096,ck,0,0,864.5258,a8w8_blockscale_1x128x128_256x128x128x128_16x16_32x32_2x2_8x32x1_8x32x1_1x32x1x8_8_1x1_intrawave_v3,780.91,501.76,0.0
gfx942,304,64512,1280,4096,ck,0,0,883.755,a8w8_blockscale_1x128x128_256x128x128x128_16x16_32x32_2x2_8x32x1_8x32x1_1x32x1x8_8_1x1_intrawave_v3,765.44,491.8,0.0
gfx942,304,64640,1280,4096,ck,0,0,888.8958,a8w8_blockscale_1x128x128_256x128x128x128_16x16_32x32_2x2_8x32x1_8x32x1_1x32x1x8_8_1x1_intrawave_v3,762.52,489.92,0.0
gfx942,304,64768,1280,4096,ck,0,0,861.2169,a8w8_blockscale_1x128x128_256x128x128x128_16x16_32x32_2x2_8x32x1_8x32x1_1x32x1x8_8_1x1_intrawave_v3,788.58,506.65,0.0
gfx942,304,64896,1280,4096,ck,0,0,882.3141,a8w8_blockscale_1x128x128_256x128x128x128_16x16_32x32_2x2_8x32x1_8x32x1_1x32x1x8_8_1x1_intrawave_v3,771.25,495.5,0.0
gfx942,304,65024,1280,4096,ck,0,0,865.9576,a8w8_blockscale_1x128x128_256x128x128x128_16x16_32x32_2x2_8x32x1_8x32x1_1x32x1x8_8_1x1_intrawave_v3,787.37,505.85,0.0
gfx942,304,65152,1280,4096,ck,0,0,874.6011,a8w8_blockscale_1x128x128_256x128x128x128_16x16_32x32_2x2_8x32x1_8x32x1_1x32x1x8_8_1x1_intrawave_v3,781.12,501.82,0.0
gfx942,304,65280,1280,4096,ck,0,0,871.409,a8w8_blockscale_1x128x128_256x128x128x128_16x16_32x32_2x2_8x32x1_8x32x1_1x32x1x8_8_1x1_intrawave_v3,785.52,504.64,0.0
gfx942,304,65408,1280,4096,ck,0,0,875.8554,a8w8_blockscale_1x128x128_256x128x128x128_16x16_32x32_2x2_8x32x1_8x32x1_1x32x1x8_8_1x1_intrawave_v3,783.07,503.05,0.0
gfx942,304,65536,1280,4096,ck,0,0,869.593,a8w8_blockscale_1x128x128_256x128x128x128_16x16_32x32_2x2_8x32x1_8x32x1_1x32x1x8_8_1x1_intrawave_v3,790.25,507.65,0.0
gfx942,304,65664,1280,4096,ck,0,0,900.8917,a8w8_blockscale_1x128x128_256x128x128x128_16x16_32x32_2x2_8x32x1_8x32x1_1x32x1x8_8_1x1_intrawave_v3,764.28,490.96,0.0
gfx942,304,65792,1280,4096,ck,0,0,893.2512,a8w8_blockscale_1x128x128_256x128x128x128_16x16_32x32_2x2_8x32x1_8x32x1_1x32x1x8_8_1x1_intrawave_v3,772.32,496.11,0.0
gfx942,304,65920,1280,4096,ck,0,0,904.7497,a8w8_blockscale_1x128x128_256x128x128x128_16x16_32x32_2x2_8x32x1_8x32x1_1x32x1x8_8_1x1_intrawave_v3,763.99,490.75,0.0
gfx942,304,66048,1280,4096,ck,0,0,884.4165,a8w8_blockscale_1x128x128_256x128x128x128_16x16_32x32_2x2_8x32x1_8x32x1_1x32x1x8_8_1x1_intrawave_v3,783.07,503.0,0.0
gfx942,304,66176,1280,4096,ck,0,0,900.7901,a8w8_blockscale_1x128x128_256x128x128x128_16x16_32x32_2x2_8x32x1_8x32x1_1x32x1x8_8_1x1_intrawave_v3,770.33,494.8,0.0
gfx942,304,66304,1280,4096,ck,0,0,888.6258,a8w8_blockscale_1x128x128_256x128x128x128_16x16_32x32_2x2_8x32x1_8x32x1_1x32x1x8_8_1x1_intrawave_v3,782.39,502.53,0.0
gfx942,304,66432,1280,4096,ck,0,0,892.2394,a8w8_blockscale_1x128x128_256x128x128x128_16x16_32x32_2x2_8x32x1_8x32x1_1x32x1x8_8_1x1_intrawave_v3,780.72,501.45,0.0
gfx942,304,66560,1280,4096,ck,0,0,885.3845,a8w8_blockscale_1x128x128_256x128x128x128_16x16_32x32_2x2_8x32x1_8x32x1_1x32x1x8_8_1x1_intrawave_v3,788.28,506.3,0.0
gfx942,304,66688,1280,4096,ck,0,0,897.4473,a8w8_blockscale_1x128x128_256x128x128x128_16x16_32x32_2x2_8x32x1_8x32x1_1x32x1x8_8_1x1_intrawave_v3,779.18,500.44,0.0
gfx942,304,66816,1280,4096,ck,0,0,910.7275,a8w8_blockscale_1x128x128_256x128x128x128_16x16_32x32_2x2_8x32x1_8x32x1_1x32x1x8_8_1x1_intrawave_v3,769.29,494.08,0.0
gfx942,304,66944,1280,4096,ck,0,0,904.5469,a8w8_blockscale_1x128x128_256x128x128x128_16x16_32x32_2x2_8x32x1_8x32x1_1x32x1x8_8_1x1_intrawave_v3,776.03,498.4,0.0
gfx942,304,67072,1280,4096,ck,0,0,921.645,a8w8_blockscale_1x128x128_256x128x128x128_16x16_32x32_2x2_8x32x1_8x32x1_1x32x1x8_8_1x1_intrawave_v3,763.09,490.07,0.0
gfx942,304,67200,1280,4096,ck,0,0,901.1397,a8w8_blockscale_1x128x128_256x128x128x128_16x16_32x32_2x2_8x32x1_8x32x1_1x32x1x8_8_1x1_intrawave_v3,781.95,502.17,0.0
gfx942,304,67328,1280,4096,ck,0,0,922.3401,a8w8_blockscale_1x128x128_256x128x128x128_16x16_32x32_2x2_8x32x1_8x32x1_1x32x1x8_8_1x1_intrawave_v3,765.43,491.55,0.0
gfx942,304,67456,1280,4096,ck,0,0,913.9095,a8w8_blockscale_1x128x128_256x128x128x128_16x16_32x32_2x2_8x32x1_8x32x1_1x32x1x8_8_1x1_intrawave_v3,773.96,497.02,0.0
gfx942,304,67584,1280,4096,ck,0,0,899.3875,a8w8_blockscale_1x128x128_256x128x128x128_16x16_32x32_2x2_8x32x1_8x32x1_1x32x1x8_8_1x1_intrawave_v3,787.95,505.99,0.0
gfx942,304,67712,1280,4096,ck,0,0,910.463,a8w8_blockscale_1x128x128_256x128x128x128_16x16_32x32_2x2_8x32x1_8x32x1_1x32x1x8_8_1x1_intrawave_v3,779.84,500.77,0.0
gfx942,304,67840,1280,4096,ck,0,0,929.2591,a8w8_blockscale_1x128x128_256x128x128x128_16x16_32x32_2x2_8x32x1_8x32x1_1x32x1x8_8_1x1_intrawave_v3,765.51,491.56,0.0
gfx942,304,67968,1280,4096,ck,0,0,924.132,a8w8_blockscale_1x128x128_256x128x128x128_16x16_32x32_2x2_8x32x1_8x32x1_1x32x1x8_8_1x1_intrawave_v3,771.21,495.21,0.0
gfx942,304,68096,1280,4096,ck,0,0,904.8822,a8w8_blockscale_1x128x128_256x128x128x128_16x16_32x32_2x2_8x32x1_8x32x1_1x32x1x8_8_1x1_intrawave_v3,789.1,506.68,0.0
gfx942,304,68224,1280,4096,ck,0,0,926.598,a8w8_blockscale_1x128x128_256x128x128x128_16x16_32x32_2x2_8x32x1_8x32x1_1x32x1x8_8_1x1_intrawave_v3,772.05,495.73,0.0
gfx942,304,68352,1280,4096,ck,0,0,935.2611,a8w8_blockscale_1x128x128_256x128x128x128_16x16_32x32_2x2_8x32x1_8x32x1_1x32x1x8_8_1x1_intrawave_v3,766.33,492.05,0.0
gfx942,304,68480,1280,4096,ck,0,0,909.1808,a8w8_blockscale_1x128x128_256x128x128x128_16x16_32x32_2x2_8x32x1_8x32x1_1x32x1x8_8_1x1_intrawave_v3,789.79,507.1,0.0
gfx942,304,68608,1280,4096,ck,0,0,912.7906,a8w8_blockscale_1x128x128_256x128x128x128_16x16_32x32_2x2_8x32x1_8x32x1_1x32x1x8_8_1x1_intrawave_v3,788.14,506.03,0.0
gfx942,304,68736,1280,4096,ck,0,0,919.8932,a8w8_blockscale_1x128x128_256x128x128x128_16x16_32x32_2x2_8x32x1_8x32x1_1x32x1x8_8_1x1_intrawave_v3,783.51,503.05,0.0
gfx942,304,68864,1280,4096,ck,0,0,934.005,a8w8_blockscale_1x128x128_256x128x128x128_16x16_32x32_2x2_8x32x1_8x32x1_1x32x1x8_8_1x1_intrawave_v3,773.11,496.36,0.0
gfx942,304,68992,1280,4096,ck,0,0,950.4834,a8w8_blockscale_1x128x128_256x128x128x128_16x16_32x32_2x2_8x32x1_8x32x1_1x32x1x8_8_1x1_intrawave_v3,761.12,488.65,0.0
gfx942,304,69120,1280,4096,ck,0,0,933.563,a8w8_blockscale_1x128x128_256x128x128x128_16x16_32x32_2x2_8x32x1_8x32x1_1x32x1x8_8_1x1_intrawave_v3,776.35,498.42,0.0
gfx942,304,69248,1280,4096,ck,0,0,934.1549,a8w8_blockscale_1x128x128_256x128x128x128_16x16_32x32_2x2_8x32x1_8x32x1_1x32x1x8_8_1x1_intrawave_v3,777.3,499.02,0.0
gfx942,304,69376,1280,4096,ck,0,0,952.8261,a8w8_blockscale_1x128x128_256x128x128x128_16x16_32x32_2x2_8x32x1_8x32x1_1x32x1x8_8_1x1_intrawave_v3,763.48,490.13,0.0
gfx942,304,69504,1280,4096,ck,0,0,954.4177,a8w8_blockscale_1x128x128_256x128x128x128_16x16_32x32_2x2_8x32x1_8x32x1_1x32x1x8_8_1x1_intrawave_v3,763.61,490.21,0.0
gfx942,304,69632,1280,4096,ck,0,0,953.1338,a8w8_blockscale_1x128x128_256x128x128x128_16x16_32x32_2x2_8x32x1_8x32x1_1x32x1x8_8_1x1_intrawave_v3,766.05,491.76,0.0
gfx942,304,69760,1280,4096,ck,0,0,931.1903,a8w8_blockscale_1x128x128_256x128x128x128_16x16_32x32_2x2_8x32x1_8x32x1_1x32x1x8_8_1x1_intrawave_v3,785.54,504.26,0.0
gfx942,304,69888,1280,4096,ck,0,0,930.708,a8w8_blockscale_1x128x128_256x128x128x128_16x16_32x32_2x2_8x32x1_8x32x1_1x32x1x8_8_1x1_intrawave_v3,787.39,505.44,0.0
gfx942,304,70016,1280,4096,ck,0,0,929.3596,a8w8_blockscale_1x128x128_256x128x128x128_16x16_32x32_2x2_8x32x1_8x32x1_1x32x1x8_8_1x1_intrawave_v3,789.98,507.09,0.0
gfx942,304,70144,1280,4096,ck,0,0,929.4138,a8w8_blockscale_1x128x128_256x128x128x128_16x16_32x32_2x2_8x32x1_8x32x1_1x32x1x8_8_1x1_intrawave_v3,791.37,507.98,0.0
gfx942,304,70272,1280,4096,ck,0,0,945.5258,a8w8_blockscale_1x128x128_256x128x128x128_16x16_32x32_2x2_8x32x1_8x32x1_1x32x1x8_8_1x1_intrawave_v3,779.31,500.22,0.0
gfx942,304,70400,1280,4096,ck,0,0,941.5338,a8w8_blockscale_1x128x128_256x128x128x128_16x16_32x32_2x2_8x32x1_8x32x1_1x32x1x8_8_1x1_intrawave_v3,784.04,503.25,0.0
gfx942,304,70528,1280,4096,ck,0,0,961.5124,a8w8_blockscale_1x128x128_256x128x128x128_16x16_32x32_2x2_8x32x1_8x32x1_1x32x1x8_8_1x1_intrawave_v3,769.14,493.68,0.0
gfx942,304,70656,1280,4096,ck,0,0,960.1937,a8w8_blockscale_1x128x128_256x128x128x128_16x16_32x32_2x2_8x32x1_8x32x1_1x32x1x8_8_1x1_intrawave_v3,771.6,495.24,0.0
gfx942,304,70784,1280,4096,ck,0,0,940.0437,a8w8_blockscale_1x128x128_256x128x128x128_16x16_32x32_2x2_8x32x1_8x32x1_1x32x1x8_8_1x1_intrawave_v3,789.56,506.76,0.0
gfx942,304,70912,1280,4096,ck,0,0,953.5911,a8w8_blockscale_1x128x128_256x128x128x128_16x16_32x32_2x2_8x32x1_8x32x1_1x32x1x8_8_1x1_intrawave_v3,779.75,500.46,0.0
gfx942,304,71040,1280,4096,ck,0,0,940.3782,a8w8_blockscale_1x128x128_256x128x128x128_16x16_32x32_2x2_8x32x1_8x32x1_1x32x1x8_8_1x1_intrawave_v3,792.14,508.4,0.0
gfx942,304,71168,1280,4096,ck,0,0,969.5356,a8w8_blockscale_1x128x128_256x128x128x128_16x16_32x32_2x2_8x32x1_8x32x1_1x32x1x8_8_1x1_intrawave_v3,769.7,493.99,0.0
gfx942,304,71296,1280,4096,ck,0,0,961.9415,a8w8_blockscale_1x128x128_256x128x128x128_16x16_32x32_2x2_8x32x1_8x32x1_1x32x1x8_8_1x1_intrawave_v3,777.17,498.77,0.0
gfx942,304,71424,1280,4096,ck,0,0,953.7963,a8w8_blockscale_1x128x128_256x128x128x128_16x16_32x32_2x2_8x32x1_8x32x1_1x32x1x8_8_1x1_intrawave_v3,785.21,503.92,0.0
gfx942,304,71552,1280,4096,ck,0,0,959.6517,a8w8_blockscale_1x128x128_256x128x128x128_16x16_32x32_2x2_8x32x1_8x32x1_1x32x1x8_8_1x1_intrawave_v3,781.82,501.74,0.0
gfx942,304,71680,1280,4096,ck,0,0,941.207,a8w8_blockscale_1x128x128_256x128x128x128_16x16_32x32_2x2_8x32x1_8x32x1_1x32x1x8_8_1x1_intrawave_v3,798.57,512.47,0.0
gfx942,304,71808,1280,4096,ck,0,0,951.9689,a8w8_blockscale_1x128x128_256x128x128x128_16x16_32x32_2x2_8x32x1_8x32x1_1x32x1x8_8_1x1_intrawave_v3,790.95,507.58,0.0
gfx942,304,71936,1280,4096,ck,0,0,972.854,a8w8_blockscale_1x128x128_256x128x128x128_16x16_32x32_2x2_8x32x1_8x32x1_1x32x1x8_8_1x1_intrawave_v3,775.35,497.56,0.0
gfx942,304,72064,1280,4096,ck,0,0,961.1031,a8w8_blockscale_1x128x128_256x128x128x128_16x16_32x32_2x2_8x32x1_8x32x1_1x32x1x8_8_1x1_intrawave_v3,786.23,504.53,0.0
gfx942,304,72192,1280,4096,ck,0,0,962.4801,a8w8_blockscale_1x128x128_256x128x128x128_16x16_32x32_2x2_8x32x1_8x32x1_1x32x1x8_8_1x1_intrawave_v3,786.5,504.69,0.0
gfx942,304,72320,1280,4096,ck,0,0,964.1968,a8w8_blockscale_1x128x128_256x128x128x128_16x16_32x32_2x2_8x32x1_8x32x1_1x32x1x8_8_1x1_intrawave_v3,786.49,504.67,0.0
gfx942,304,72448,1280,4096,ck,0,0,983.7569,a8w8_blockscale_1x128x128_256x128x128x128_16x16_32x32_2x2_8x32x1_8x32x1_1x32x1x8_8_1x1_intrawave_v3,772.22,495.51,0.0
gfx942,304,72576,1280,4096,ck,0,0,987.4925,a8w8_blockscale_1x128x128_256x128x128x128_16x16_32x32_2x2_8x32x1_8x32x1_1x32x1x8_8_1x1_intrawave_v3,770.65,494.49,0.0
gfx942,304,72704,1280,4096,ck,0,0,964.2152,a8w8_blockscale_1x128x128_256x128x128x128_16x16_32x32_2x2_8x32x1_8x32x1_1x32x1x8_8_1x1_intrawave_v3,790.65,507.31,0.0
gfx942,304,72832,1280,4096,ck,0,0,994.193,a8w8_blockscale_1x128x128_256x128x128x128_16x16_32x32_2x2_8x32x1_8x32x1_1x32x1x8_8_1x1_intrawave_v3,768.16,492.87,0.0
gfx942,304,72960,1280,4096,ck,0,0,984.9085,a8w8_blockscale_1x128x128_256x128x128x128_16x16_32x32_2x2_8x32x1_8x32x1_1x32x1x8_8_1x1_intrawave_v3,776.76,498.39,0.0
gfx942,304,73088,1280,4096,ck,0,0,974.1578,a8w8_blockscale_1x128x128_256x128x128x128_16x16_32x32_2x2_8x32x1_8x32x1_1x32x1x8_8_1x1_intrawave_v3,786.71,504.76,0.0
gfx942,304,73216,1280,4096,ck,0,0,998.5443,a8w8_blockscale_1x128x128_256x128x128x128_16x16_32x32_2x2_8x32x1_8x32x1_1x32x1x8_8_1x1_intrawave_v3,768.84,493.29,0.0
gfx942,304,73344,1280,4096,ck,0,0,982.5755,a8w8_blockscale_1x128x128_256x128x128x128_16x16_32x32_2x2_8x32x1_8x32x1_1x32x1x8_8_1x1_intrawave_v3,782.71,502.17,0.0
gfx942,304,73472,1280,4096,ck,0,0,995.6459,a8w8_blockscale_1x128x128_256x128x128x128_16x16_32x32_2x2_8x32x1_8x32x1_1x32x1x8_8_1x1_intrawave_v3,773.78,496.43,0.0
gfx942,304,73600,1280,4096,ck,0,0,1003.9245,a8w8_blockscale_1x128x128_256x128x128x128_16x16_32x32_2x2_8x32x1_8x32x1_1x32x1x8_8_1x1_intrawave_v3,768.74,493.19,0.0
gfx942,304,73728,1280,4096,ck,0,0,977.7448,a8w8_blockscale_1x128x128_256x128x128x128_16x16_32x32_2x2_8x32x1_8x32x1_1x32x1x8_8_1x1_intrawave_v3,790.69,507.27,0.0
gfx942,304,73856,1280,4096,ck,0,0,1011.7759,a8w8_blockscale_1x128x128_256x128x128x128_16x16_32x32_2x2_8x32x1_8x32x1_1x32x1x8_8_1x1_intrawave_v3,765.42,491.05,0.0
gfx942,304,73984,1280,4096,ck,0,0,1001.5099,a8w8_blockscale_1x128x128_256x128x128x128_16x16_32x32_2x2_8x32x1_8x32x1_1x32x1x8_8_1x1_intrawave_v3,774.61,496.93,0.0
gfx942,304,74112,1280,4096,ck,0,0,1011.8924,a8w8_blockscale_1x128x128_256x128x128x128_16x16_32x32_2x2_8x32x1_8x32x1_1x32x1x8_8_1x1_intrawave_v3,767.99,492.67,0.0
gfx942,304,74240,1280,4096,ck,0,0,1014.4339,a8w8_blockscale_1x128x128_256x128x128x128_16x16_32x32_2x2_8x32x1_8x32x1_1x32x1x8_8_1x1_intrawave_v3,767.39,492.28,0.0
gfx942,304,74368,1280,4096,ck,0,0,1008.3121,a8w8_blockscale_1x128x128_256x128x128x128_16x16_32x32_2x2_8x32x1_8x32x1_1x32x1x8_8_1x1_intrawave_v3,773.38,496.11,0.0
gfx942,304,74496,1280,4096,ck,0,0,1015.8623,a8w8_blockscale_1x128x128_256x128x128x128_16x16_32x32_2x2_8x32x1_8x32x1_1x32x1x8_8_1x1_intrawave_v3,768.95,493.26,0.0
gfx942,304,74624,1280,4096,ck,0,0,995.6368,a8w8_blockscale_1x128x128_256x128x128x128_16x16_32x32_2x2_8x32x1_8x32x1_1x32x1x8_8_1x1_intrawave_v3,785.92,504.14,0.0
gfx942,304,74752,1280,4096,ck,0,0,996.2366,a8w8_blockscale_1x128x128_256x128x128x128_16x16_32x32_2x2_8x32x1_8x32x1_1x32x1x8_8_1x1_intrawave_v3,786.79,504.69,0.0
gfx942,304,74880,1280,4096,ck,0,0,1024.1051,a8w8_blockscale_1x128x128_256x128x128x128_16x16_32x32_2x2_8x32x1_8x32x1_1x32x1x8_8_1x1_intrawave_v3,766.69,491.79,0.0
gfx942,304,75008,1280,4096,ck,0,0,1019.4477,a8w8_blockscale_1x128x128_256x128x128x128_16x16_32x32_2x2_8x32x1_8x32x1_1x32x1x8_8_1x1_intrawave_v3,771.51,494.87,0.0
gfx942,304,75136,1280,4096,ck,0,0,1005.3092,a8w8_blockscale_1x128x128_256x128x128x128_16x16_32x32_2x2_8x32x1_8x32x1_1x32x1x8_8_1x1_intrawave_v3,783.7,502.68,0.0
gfx942,304,75264,1280,4096,ck,0,0,1001.0333,a8w8_blockscale_1x128x128_256x128x128x128_16x16_32x32_2x2_8x32x1_8x32x1_1x32x1x8_8_1x1_intrawave_v3,788.39,505.68,0.0
gfx942,304,75392,1280,4096,ck,0,0,1002.0303,a8w8_blockscale_1x128x128_256x128x128x128_16x16_32x32_2x2_8x32x1_8x32x1_1x32x1x8_8_1x1_intrawave_v3,788.94,506.02,0.0
gfx942,304,75520,1280,4096,ck,0,0,1034.0167,a8w8_blockscale_1x128x128_256x128x128x128_16x16_32x32_2x2_8x32x1_8x32x1_1x32x1x8_8_1x1_intrawave_v3,765.83,491.2,0.0
gfx942,304,75648,1280,4096,ck,0,0,999.7687,a8w8_blockscale_1x128x128_256x128x128x128_16x16_32x32_2x2_8x32x1_8x32x1_1x32x1x8_8_1x1_intrawave_v3,793.41,508.87,0.0
gfx942,304,75776,1280,4096,ck,0,0,1015.9157,a8w8_blockscale_1x128x128_256x128x128x128_16x16_32x32_2x2_8x32x1_8x32x1_1x32x1x8_8_1x1_intrawave_v3,782.12,501.62,0.0
gfx942,304,75904,1280,4096,ck,0,0,1008.8247,a8w8_blockscale_1x128x128_256x128x128x128_16x16_32x32_2x2_8x32x1_8x32x1_1x32x1x8_8_1x1_intrawave_v3,788.95,505.99,0.0
gfx942,304,76032,1280,4096,ck,0,0,1011.0549,a8w8_blockscale_1x128x128_256x128x128x128_16x16_32x32_2x2_8x32x1_8x32x1_1x32x1x8_8_1x1_intrawave_v3,788.54,505.72,0.0
gfx942,304,76160,1280,4096,ck,0,0,1010.6568,a8w8_blockscale_1x128x128_256x128x128x128_16x16_32x32_2x2_8x32x1_8x32x1_1x32x1x8_8_1x1_intrawave_v3,790.17,506.76,0.0
gfx942,304,76288,1280,4096,ck,0,0,1017.9546,a8w8_blockscale_1x128x128_256x128x128x128_16x16_32x32_2x2_8x32x1_8x32x1_1x32x1x8_8_1x1_intrawave_v3,785.83,503.97,0.0
gfx942,304,76416,1280,4096,ck,0,0,1007.7159,a8w8_blockscale_1x128x128_256x128x128x128_16x16_32x32_2x2_8x32x1_8x32x1_1x32x1x8_8_1x1_intrawave_v3,795.14,509.93,0.0
gfx942,304,76544,1280,4096,ck,0,0,1039.6448,a8w8_blockscale_1x128x128_256x128x128x128_16x16_32x32_2x2_8x32x1_8x32x1_1x32x1x8_8_1x1_intrawave_v3,772.02,495.09,0.0
gfx942,304,76672,1280,4096,ck,0,0,1026.645,a8w8_blockscale_1x128x128_256x128x128x128_16x16_32x32_2x2_8x32x1_8x32x1_1x32x1x8_8_1x1_intrawave_v3,783.1,502.19,0.0
gfx942,304,76800,1280,4096,ck,0,0,1043.4299,a8w8_blockscale_1x128x128_256x128x128x128_16x16_32x32_2x2_8x32x1_8x32x1_1x32x1x8_8_1x1_intrawave_v3,771.79,494.93,0.0
gfx942,304,76928,1280,4096,ck,0,0,1034.3763,a8w8_blockscale_1x128x128_256x128x128x128_16x16_32x32_2x2_8x32x1_8x32x1_1x32x1x8_8_1x1_intrawave_v3,779.84,500.08,0.0
gfx942,304,77056,1280,4096,ck,0,0,1016.091,a8w8_blockscale_1x128x128_256x128x128x128_16x16_32x32_2x2_8x32x1_8x32x1_1x32x1x8_8_1x1_intrawave_v3,795.2,509.92,0.0
gfx942,304,77184,1280,4096,ck,0,0,1023.1414,a8w8_blockscale_1x128x128_256x128x128x128_16x16_32x32_2x2_8x32x1_8x32x1_1x32x1x8_8_1x1_intrawave_v3,791.03,507.24,0.0
gfx942,304,77312,1280,4096,ck,0,0,1035.8618,a8w8_blockscale_1x128x128_256x128x128x128_16x16_32x32_2x2_8x32x1_8x32x1_1x32x1x8_8_1x1_intrawave_v3,782.61,501.83,0.0
gfx942,304,77440,1280,4096,ck,0,0,1062.9796,a8w8_blockscale_1x128x128_256x128x128x128_16x16_32x32_2x2_8x32x1_8x32x1_1x32x1x8_8_1x1_intrawave_v3,763.91,489.83,0.0
gfx942,304,77568,1280,4096,ck,0,0,1063.2238,a8w8_blockscale_1x128x128_256x128x128x128_16x16_32x32_2x2_8x32x1_8x32x1_1x32x1x8_8_1x1_intrawave_v3,764.99,490.52,0.0
gfx942,304,77696,1280,4096,ck,0,0,1033.1733,a8w8_blockscale_1x128x128_256x128x128x128_16x16_32x32_2x2_8x32x1_8x32x1_1x32x1x8_8_1x1_intrawave_v3,788.54,505.61,0.0
gfx942,304,77824,1280,4096,ck,0,0,1029.6883,a8w8_blockscale_1x128x128_256x128x128x128_16x16_32x32_2x2_8x32x1_8x32x1_1x32x1x8_8_1x1_intrawave_v3,792.52,508.15,0.0
gfx942,304,77952,1280,4096,ck,0,0,1042.2388,a8w8_blockscale_1x128x128_256x128x128x128_16x16_32x32_2x2_8x32x1_8x32x1_1x32x1x8_8_1x1_intrawave_v3,784.26,502.85,0.0
gfx942,304,78080,1280,4096,ck,0,0,1067.6388,a8w8_blockscale_1x128x128_256x128x128x128_16x16_32x32_2x2_8x32x1_8x32x1_1x32x1x8_8_1x1_intrawave_v3,766.86,491.69,0.0
gfx942,304,78208,1280,4096,ck,0,0,1044.7301,a8w8_blockscale_1x128x128_256x128x128x128_16x16_32x32_2x2_8x32x1_8x32x1_1x32x1x8_8_1x1_intrawave_v3,784.96,503.28,0.0
gfx942,304,78336,1280,4096,ck,0,0,1074.2071,a8w8_blockscale_1x128x128_256x128x128x128_16x16_32x32_2x2_8x32x1_8x32x1_1x32x1x8_8_1x1_intrawave_v3,764.67,490.27,0.0
gfx942,304,78464,1280,4096,ck,0,0,1041.2953,a8w8_blockscale_1x128x128_256x128x128x128_16x16_32x32_2x2_8x32x1_8x32x1_1x32x1x8_8_1x1_intrawave_v3,790.13,506.58,0.0
gfx942,304,78592,1280,4096,ck,0,0,1065.8919,a8w8_blockscale_1x128x128_256x128x128x128_16x16_32x32_2x2_8x32x1_8x32x1_1x32x1x8_8_1x1_intrawave_v3,773.15,495.69,0.0
gfx942,304,78720,1280,4096,ck,0,0,1065.7063,a8w8_blockscale_1x128x128_256x128x128x128_16x16_32x32_2x2_8x32x1_8x32x1_1x32x1x8_8_1x1_intrawave_v3,774.55,496.58,0.0
gfx942,304,78848,1280,4096,ck,0,0,1081.045,a8w8_blockscale_1x128x128_256x128x128x128_16x16_32x32_2x2_8x32x1_8x32x1_1x32x1x8_8_1x1_intrawave_v3,764.8,490.32,0.0
gfx942,304,78976,1280,4096,ck,0,0,1049.6555,a8w8_blockscale_1x128x128_256x128x128x128_16x16_32x32_2x2_8x32x1_8x32x1_1x32x1x8_8_1x1_intrawave_v3,788.95,505.79,0.0
gfx942,304,79104,1280,4096,ck,0,0,1082.0515,a8w8_blockscale_1x128x128_256x128x128x128_16x16_32x32_2x2_8x32x1_8x32x1_1x32x1x8_8_1x1_intrawave_v3,766.57,491.44,0.0
gfx942,304,79232,1280,4096,ck,0,0,1070.6247,a8w8_blockscale_1x128x128_256x128x128x128_16x16_32x32_2x2_8x32x1_8x32x1_1x32x1x8_8_1x1_intrawave_v3,776.0,497.48,0.0
gfx942,304,79360,1280,4096,ck,0,0,1056.0887,a8w8_blockscale_1x128x128_256x128x128x128_16x16_32x32_2x2_8x32x1_8x32x1_1x32x1x8_8_1x1_intrawave_v3,787.95,505.13,0.0
gfx942,304,79488,1280,4096,ck,0,0,1092.9879,a8w8_blockscale_1x128x128_256x128x128x128_16x16_32x32_2x2_8x32x1_8x32x1_1x32x1x8_8_1x1_intrawave_v3,762.58,488.86,0.0
gfx942,304,79616,1280,4096,ck,0,0,1079.6314,a8w8_blockscale_1x128x128_256x128x128x128_16x16_32x32_2x2_8x32x1_8x32x1_1x32x1x8_8_1x1_intrawave_v3,773.26,495.69,0.0
gfx942,304,79744,1280,4096,ck,0,0,1057.3544,a8w8_blockscale_1x128x128_256x128x128x128_16x16_32x32_2x2_8x32x1_8x32x1_1x32x1x8_8_1x1_intrawave_v3,790.82,506.94,0.0
gfx942,304,79872,1280,4096,ck,0,0,1068.9242,a8w8_blockscale_1x128x128_256x128x128x128_16x16_32x32_2x2_8x32x1_8x32x1_1x32x1x8_8_1x1_intrawave_v3,783.52,502.25,0.0
gfx942,304,80000,1280,4096,ck,0,0,1065.7059,a8w8_blockscale_1x128x128_256x128x128x128_16x16_32x32_2x2_8x32x1_8x32x1_1x32x1x8_8_1x1_intrawave_v3,787.14,504.57,0.0
gfx942,304,16,2304,4096,ck,8,0,15.0407,a8w8_blockscale_1x128x128_256x16x64x256_16x16_16x16_1x1_16x16x1_16x16x1_1x16x1x16_4_1x1_intrawave_v1,20.08,636.7,0.0
gfx942,304,32,2304,4096,ck,8,0,15.0376,a8w8_blockscale_1x128x128_256x16x64x256_16x16_16x16_1x1_16x16x1_16x16x1_1x16x1x16_4_1x1_intrawave_v1,40.16,646.09,0.0
gfx942,304,48,2304,4096,ck,8,0,14.8863,a8w8_blockscale_1x128x128_256x16x64x256_16x16_16x16_1x1_16x16x1_16x16x1_1x16x1x16_4_1x1_intrawave_v1,60.86,662.02,0.0
gfx942,304,64,2304,4096,ck,8,0,14.6362,a8w8_blockscale_1x128x128_256x16x64x256_16x16_16x16_1x1_16x16x1_16x16x1_1x16x1x16_4_1x1_intrawave_v1,82.53,682.84,0.0
gfx942,304,80,2304,4096,ck,8,0,14.8649,a8w8_blockscale_1x128x128_256x16x64x256_16x16_16x16_1x1_16x16x1_16x16x1_1x16x1x16_4_1x1_intrawave_v1,101.58,681.71,0.0
gfx942,304,96,2304,4096,ck,8,0,14.7977,a8w8_blockscale_1x128x128_256x16x64x256_16x16_16x16_1x1_16x16x1_16x16x1_1x16x1x16_4_1x1_intrawave_v1,122.45,694.21,0.0
gfx942,304,112,2304,4096,ck,8,0,14.8091,a8w8_blockscale_1x128x128_256x16x64x256_16x16_16x16_1x1_16x16x1_16x16x1_1x16x1x16_4_1x1_intrawave_v1,142.75,703.08,0.0
gfx942,304,128,2304,4096,ck,8,0,15.0141,a8w8_blockscale_1x128x128_256x16x64x256_16x16_16x16_1x1_16x16x1_16x16x1_1x16x1x16_4_1x1_intrawave_v1,160.91,702.76,0.0
gfx942,304,144,2304,4096,ck,18,0,19.7526,a8w8_blockscale_1x128x128_256x64x64x256_16x16_32x32_1x1_16x16x1_16x16x1_1x32x1x8_8_1x1_intrawave_v1,137.6,541.22,0.0
gfx942,304,160,2304,4096,ck,18,0,19.8015,a8w8_blockscale_1x128x128_256x64x64x256_16x16_32x32_1x1_16x16x1_16x16x1_1x32x1x8_8_1x1_intrawave_v1,152.51,546.92,0.0
gfx942,304,176,2304,4096,ck,18,0,19.9156,a8w8_blockscale_1x128x128_256x64x64x256_16x16_32x32_1x1_16x16x1_16x16x1_1x32x1x8_8_1x1_intrawave_v1,166.8,550.78,0.0
gfx942,304,192,2304,4096,ck,18,0,18.7668,a8w8_blockscale_1x128x128_256x64x64x256_16x16_32x32_1x1_16x16x1_16x16x1_1x32x1x8_8_1x1_intrawave_v1,193.1,591.92,0.0
gfx942,304,208,2304,4096,ck,13,0,20.1257,a8w8_blockscale_1x128x128_256x32x64x256_16x16_16x16_2x1_16x16x1_16x16x1_1x32x1x8_8_2x1_intrawave_v1,195.07,558.87,0.0
gfx942,304,224,2304,4096,ck,18,0,19.801,a8w8_blockscale_1x128x128_256x64x64x256_16x16_32x32_1x1_16x16x1_16x16x1_1x32x1x8_8_1x1_intrawave_v1,213.52,575.07,0.0
gfx942,304,240,2304,4096,ck,18,0,20.0049,a8w8_blockscale_1x128x128_256x64x64x256_16x16_32x32_1x1_16x16x1_16x16x1_1x32x1x8_8_1x1_intrawave_v1,226.44,576.17,0.0
gfx942,304,256,2304,4096,ck,18,0,19.0042,a8w8_blockscale_1x128x128_256x64x64x256_16x16_32x32_1x1_16x16x1_16x16x1_1x32x1x8_8_1x1_intrawave_v1,254.25,613.83,0.0
gfx942,304,288,2304,4096,ck,18,0,20.1896,a8w8_blockscale_1x128x128_256x64x64x256_16x16_32x32_1x1_16x16x1_16x16x1_1x32x1x8_8_1x1_intrawave_v1,269.24,591.59,0.0
gfx942,304,320,2304,4096,ck,18,0,19.68,a8w8_blockscale_1x128x128_256x64x64x256_16x16_32x32_1x1_16x16x1_16x16x1_1x32x1x8_8_1x1_intrawave_v1,306.9,621.06,0.0
gfx942,304,352,2304,4096,ck,18,0,23.3923,a8w8_blockscale_1x128x128_256x64x64x256_16x16_32x32_1x1_16x16x1_16x16x1_1x32x1x8_8_1x1_intrawave_v1,284.02,534.41,0.0
gfx942,304,384,2304,4096,ck,18,0,21.7571,a8w8_blockscale_1x128x128_256x64x64x256_16x16_32x32_1x1_16x16x1_16x16x1_1x32x1x8_8_1x1_intrawave_v1,333.12,587.37,0.0
gfx942,304,416,2304,4096,ck,18,0,26.0458,a8w8_blockscale_1x128x128_256x64x64x256_16x16_32x32_1x1_16x16x1_16x16x1_1x32x1x8_8_1x1_intrawave_v1,301.46,501.35,0.0
gfx942,304,448,2304,4096,ck,18,0,23.3659,a8w8_blockscale_1x128x128_256x64x64x256_16x16_32x32_1x1_16x16x1_16x16x1_1x32x1x8_8_1x1_intrawave_v1,361.88,570.77,0.0
gfx942,304,480,2304,4096,ck,18,0,26.515,a8w8_blockscale_1x128x128_256x64x64x256_16x16_32x32_1x1_16x16x1_16x16x1_1x32x1x8_8_1x1_intrawave_v1,341.68,513.49,0.0
gfx942,304,512,2304,4096,ck,18,0,24.7191,a8w8_blockscale_1x128x128_256x64x64x256_16x16_32x32_1x1_16x16x1_16x16x1_1x32x1x8_8_1x1_intrawave_v1,390.94,562.06,0.0
gfx942,304,544,2304,4096,ck,3,0,34.8379,a8w8_blockscale_1x128x128_256x64x64x128_16x16_32x32_1x1_8x32x1_8x32x1_1x32x1x8_8_1x1_intrawave_v3,294.73,406.8,0.0
gfx942,304,576,2304,4096,ck,1,0,38.3277,a8w8_blockscale_1x128x128_256x128x64x128_16x16_32x32_2x1_8x32x1_8x32x1_1x32x1x8_8_1x1_intrawave_v3,283.65,377.03,0.0
gfx942,304,608,2304,4096,ck,2,0,35.274,a8w8_blockscale_1x128x128_256x64x128x128_16x16_32x32_1x2_8x32x1_8x32x1_1x32x1x8_8_1x1_intrawave_v3,325.33,417.57,0.0
gfx942,304,640,2304,4096,ck,3,0,35.5829,a8w8_blockscale_1x128x128_256x64x64x128_16x16_32x32_1x1_8x32x1_8x32x1_1x32x1x8_8_1x1_intrawave_v3,339.48,421.77,0.0
gfx942,304,672,2304,4096,ck,2,0,34.6458,a8w8_blockscale_1x128x128_256x64x128x128_16x16_32x32_1x2_8x32x1_8x32x1_1x32x1x8_8_1x1_intrawave_v3,366.09,441.22,0.0
gfx942,304,704,2304,4096,ck,3,0,38.1391,a8w8_blockscale_1x128x128_256x64x64x128_16x16_32x32_1x1_8x32x1_8x32x1_1x32x1x8_8_1x1_intrawave_v3,348.4,408.11,0.0
gfx942,304,736,2304,4096,ck,2,0,35.4607,a8w8_blockscale_1x128x128_256x64x128x128_16x16_32x32_1x2_8x32x1_8x32x1_1x32x1x8_8_1x1_intrawave_v3,391.74,446.79,0.0
gfx942,304,768,2304,4096,ck,3,0,37.4757,a8w8_blockscale_1x128x128_256x64x64x128_16x16_32x32_1x1_8x32x1_8x32x1_1x32x1x8_8_1x1_intrawave_v3,386.8,430.19,0.0
gfx942,304,800,2304,4096,ck,2,0,38.0501,a8w8_blockscale_1x128x128_256x64x128x128_16x16_32x32_1x2_8x32x1_8x32x1_1x32x1x8_8_1x1_intrawave_v3,396.83,431.02,0.0
gfx942,304,832,2304,4096,ck,2,0,40.0576,a8w8_blockscale_1x128x128_256x64x128x128_16x16_32x32_1x2_8x32x1_8x32x1_1x32x1x8_8_1x1_intrawave_v3,392.02,416.37,0.0
gfx942,304,864,2304,4096,ck,2,0,38.2375,a8w8_blockscale_1x128x128_256x64x128x128_16x16_32x32_1x2_8x32x1_8x32x1_1x32x1x8_8_1x1_intrawave_v3,426.48,443.48,0.0
gfx942,304,896,2304,4096,ck,3,0,40.8908,a8w8_blockscale_1x128x128_256x64x64x128_16x16_32x32_1x1_8x32x1_8x32x1_1x32x1x8_8_1x1_intrawave_v3,413.58,421.51,0.0
gfx942,304,928,2304,4096,ck,2,0,38.8037,a8w8_blockscale_1x128x128_256x64x128x128_16x16_32x32_1x2_8x32x1_8x32x1_1x32x1x8_8_1x1_intrawave_v3,451.39,451.36,0.0
gfx942,304,960,2304,4096,ck,2,0,42.006,a8w8_blockscale_1x128x128_256x64x128x128_16x16_32x32_1x2_8x32x1_8x32x1_1x32x1x8_8_1x1_intrawave_v3,431.35,423.58,0.0
gfx942,304,992,2304,4096,ck,2,0,40.0564,a8w8_blockscale_1x128x128_256x64x128x128_16x16_32x32_1x2_8x32x1_8x32x1_1x32x1x8_8_1x1_intrawave_v3,467.43,451.15,0.0
gfx942,304,1024,2304,4096,ck,2,0,42.8266,a8w8_blockscale_1x128x128_256x64x128x128_16x16_32x32_1x2_8x32x1_8x32x1_1x32x1x8_8_1x1_intrawave_v3,451.29,428.47,0.0
gfx942,304,1088,2304,4096,ck,0,0,50.3802,a8w8_blockscale_1x128x128_256x128x128x128_16x16_32x32_2x2_8x32x1_8x32x1_1x32x1x8_8_1x1_intrawave_v3,407.61,375.29,0.0
gfx942,304,1152,2304,4096,ck,2,0,55.6901,a8w8_blockscale_1x128x128_256x64x128x128_16x16_32x32_1x2_8x32x1_8x32x1_1x32x1x8_8_1x1_intrawave_v3,390.43,349.51,0.0
gfx942,304,1216,2304,4096,ck,0,0,50.8605,a8w8_blockscale_1x128x128_256x128x128x128_16x16_32x32_2x2_8x32x1_8x32x1_1x32x1x8_8_1x1_intrawave_v3,451.26,393.65,0.0
gfx942,304,1280,2304,4096,ck,2,0,57.1291,a8w8_blockscale_1x128x128_256x64x128x128_16x16_32x32_1x2_8x32x1_8x32x1_1x32x1x8_8_1x1_intrawave_v3,422.89,360.21,0.0
gfx942,304,1344,2304,4096,ck,0,0,52.9512,a8w8_blockscale_1x128x128_256x128x128x128_16x16_32x32_2x2_8x32x1_8x32x1_1x32x1x8_8_1x1_intrawave_v3,479.07,399.15,0.0
gfx942,304,1408,2304,4096,ck,2,0,58.6489,a8w8_blockscale_1x128x128_256x64x128x128_16x16_32x32_1x2_8x32x1_8x32x1_1x32x1x8_8_1x1_intrawave_v3,453.12,369.87,0.0
gfx942,304,1472,2304,4096,ck,0,0,54.7194,a8w8_blockscale_1x128x128_256x128x128x128_16x16_32x32_2x2_8x32x1_8x32x1_1x32x1x8_8_1x1_intrawave_v3,507.74,406.61,0.0
gfx942,304,1536,2304,4096,ck,0,0,59.0507,a8w8_blockscale_1x128x128_256x128x128x128_16x16_32x32_2x2_8x32x1_8x32x1_1x32x1x8_8_1x1_intrawave_v3,490.95,386.22,0.0
gfx942,304,1600,2304,4096,ck,0,0,56.0607,a8w8_blockscale_1x128x128_256x128x128x128_16x16_32x32_2x2_8x32x1_8x32x1_1x32x1x8_8_1x1_intrawave_v3,538.68,416.76,0.0
gfx942,304,1664,2304,4096,ck,2,0,62.3685,a8w8_blockscale_1x128x128_256x64x128x128_16x16_32x32_1x2_8x32x1_8x32x1_1x32x1x8_8_1x1_intrawave_v3,503.57,383.54,0.0
gfx942,304,1728,2304,4096,ck,0,0,58.806,a8w8_blockscale_1x128x128_256x128x128x128_16x16_32x32_2x2_8x32x1_8x32x1_1x32x1x8_8_1x1_intrawave_v3,554.62,416.24,0.0
gfx942,304,1792,2304,4096,ck,2,0,62.7747,a8w8_blockscale_1x128x128_256x64x128x128_16x16_32x32_1x2_8x32x1_8x32x1_1x32x1x8_8_1x1_intrawave_v3,538.8,398.8,0.0
gfx942,304,1856,2304,4096,ck,0,0,60.5386,a8w8_blockscale_1x128x128_256x128x128x128_16x16_32x32_2x2_8x32x1_8x32x1_1x32x1x8_8_1x1_intrawave_v3,578.65,422.74,0.0
gfx942,304,1920,2304,4096,ck,0,0,63.2118,a8w8_blockscale_1x128x128_256x128x128x128_16x16_32x32_2x2_8x32x1_8x32x1_1x32x1x8_8_1x1_intrawave_v3,573.29,413.67,0.0
gfx942,304,1984,2304,4096,ck,0,0,60.2617,a8w8_blockscale_1x128x128_256x128x128x128_16x16_32x32_2x2_8x32x1_8x32x1_1x32x1x8_8_1x1_intrawave_v3,621.4,443.17,0.0
gfx942,304,2048,2304,4096,ck,0,0,64.5698,a8w8_blockscale_1x128x128_256x128x128x128_16x16_32x32_2x2_8x32x1_8x32x1_1x32x1x8_8_1x1_intrawave_v3,598.65,422.22,0.0
gfx942,304,2112,2304,4096,ck,2,0,71.3588,a8w8_blockscale_1x128x128_256x64x128x128_16x16_32x32_1x2_8x32x1_8x32x1_1x32x1x8_8_1x1_intrawave_v3,558.62,389.86,0.0
gfx942,304,2176,2304,4096,ck,0,0,81.8193,a8w8_blockscale_1x128x128_256x128x128x128_16x16_32x32_2x2_8x32x1_8x32x1_1x32x1x8_8_1x1_intrawave_v3,501.97,346.83,0.0
gfx942,304,2240,2304,4096,ck,0,0,89.3764,a8w8_blockscale_1x128x128_256x128x128x128_16x16_32x32_2x2_8x32x1_8x32x1_1x32x1x8_8_1x1_intrawave_v3,473.04,323.73,0.0
gfx942,304,2304,2304,4096,ck,0,0,86.8166,a8w8_blockscale_1x128x128_256x128x128x128_16x16_32x32_2x2_8x32x1_8x32x1_1x32x1x8_8_1x1_intrawave_v3,500.9,339.7,0.0
gfx942,304,2368,2304,4096,ck,0,0,87.199,a8w8_blockscale_1x128x128_256x128x128x128_16x16_32x32_2x2_8x32x1_8x32x1_1x32x1x8_8_1x1_intrawave_v3,512.56,344.59,0.0
gfx942,304,2432,2304,4096,ck,0,0,88.6015,a8w8_blockscale_1x128x128_256x128x128x128_16x16_32x32_2x2_8x32x1_8x32x1_1x32x1x8_8_1x1_intrawave_v3,518.08,345.43,0.0
gfx942,304,2496,2304,4096,ck,0,0,86.1532,a8w8_blockscale_1x128x128_256x128x128x128_16x16_32x32_2x2_8x32x1_8x32x1_1x32x1x8_8_1x1_intrawave_v3,546.82,361.71,0.0
gfx942,304,2560,2304,4096,ck,0,0,84.9757,a8w8_blockscale_1x128x128_256x128x128x128_16x16_32x32_2x2_8x32x1_8x32x1_1x32x1x8_8_1x1_intrawave_v3,568.61,373.28,0.0
gfx942,304,2624,2304,4096,ck,0,0,86.9387,a8w8_blockscale_1x128x128_256x128x128x128_16x16_32x32_2x2_8x32x1_8x32x1_1x32x1x8_8_1x1_intrawave_v3,569.67,371.26,0.0
gfx942,304,2688,2304,4096,ck,0,0,87.6756,a8w8_blockscale_1x128x128_256x128x128x128_16x16_32x32_2x2_8x32x1_8x32x1_1x32x1x8_8_1x1_intrawave_v3,578.66,374.49,0.0
gfx942,304,2752,2304,4096,ck,0,0,84.9528,a8w8_blockscale_1x128x128_256x128x128x128_16x16_32x32_2x2_8x32x1_8x32x1_1x32x1x8_8_1x1_intrawave_v3,611.42,393.05,0.0
gfx942,304,2816,2304,4096,ck,0,0,88.2241,a8w8_blockscale_1x128x128_256x128x128x128_16x16_32x32_2x2_8x32x1_8x32x1_1x32x1x8_8_1x1_intrawave_v3,602.45,384.79,0.0
gfx942,304,2880,2304,4096,ck,0,0,86.675,a8w8_blockscale_1x128x128_256x128x128x128_16x16_32x32_2x2_8x32x1_8x32x1_1x32x1x8_8_1x1_intrawave_v3,627.15,398.09,0.0
gfx942,304,2944,2304,4096,ck,0,0,88.7351,a8w8_blockscale_1x128x128_256x128x128x128_16x16_32x32_2x2_8x32x1_8x32x1_1x32x1x8_8_1x1_intrawave_v3,626.2,395.13,0.0
gfx942,304,3008,2304,4096,ck,0,0,89.6448,a8w8_blockscale_1x128x128_256x128x128x128_16x16_32x32_2x2_8x32x1_8x32x1_1x32x1x8_8_1x1_intrawave_v3,633.32,397.33,0.0
gfx942,304,3072,2304,4096,ck,0,0,88.0547,a8w8_blockscale_1x128x128_256x128x128x128_16x16_32x32_2x2_8x32x1_8x32x1_1x32x1x8_8_1x1_intrawave_v3,658.48,410.83,0.0
gfx942,304,3136,2304,4096,ck,0,0,91.1289,a8w8_blockscale_1x128x128_256x128x128x128_16x16_32x32_2x2_8x32x1_8x32x1_1x32x1x8_8_1x1_intrawave_v3,649.52,403.09,0.0
gfx942,304,3200,2304,4096,ck,0,0,91.1252,a8w8_blockscale_1x128x128_256x128x128x128_16x16_32x32_2x2_8x32x1_8x32x1_1x32x1x8_8_1x1_intrawave_v3,662.8,409.22,0.0
gfx942,304,3264,2304,4096,ck,0,0,91.8885,a8w8_blockscale_1x128x128_256x128x128x128_16x16_32x32_2x2_8x32x1_8x32x1_1x32x1x8_8_1x1_intrawave_v3,670.44,411.88,0.0
gfx942,304,3328,2304,4096,ck,0,0,92.4418,a8w8_blockscale_1x128x128_256x128x128x128_16x16_32x32_2x2_8x32x1_8x32x1_1x32x1x8_8_1x1_intrawave_v3,679.5,415.44,0.0
gfx942,304,3392,2304,4096,ck,0,0,94.7075,a8w8_blockscale_1x128x128_256x128x128x128_16x16_32x32_2x2_8x32x1_8x32x1_1x32x1x8_8_1x1_intrawave_v3,676.0,411.38,0.0
gfx942,304,3456,2304,4096,ck,0,0,95.3643,a8w8_blockscale_1x128x128_256x128x128x128_16x16_32x32_2x2_8x32x1_8x32x1_1x32x1x8_8_1x1_intrawave_v3,684.01,414.39,0.0
gfx942,304,3520,2304,4096,ck,0,0,95.3215,a8w8_blockscale_1x128x128_256x128x128x128_16x16_32x32_2x2_8x32x1_8x32x1_1x32x1x8_8_1x1_intrawave_v3,696.99,420.42,0.0
gfx942,304,3584,2304,4096,ck,0,0,94.5513,a8w8_blockscale_1x128x128_256x128x128x128_16x16_32x32_2x2_8x32x1_8x32x1_1x32x1x8_8_1x1_intrawave_v3,715.44,429.74,0.0
gfx942,304,3648,2304,4096,ck,0,0,98.6724,a8w8_blockscale_1x128x128_256x128x128x128_16x16_32x32_2x2_8x32x1_8x32x1_1x32x1x8_8_1x1_intrawave_v3,697.8,417.44,0.0
gfx942,304,3712,2304,4096,ck,0,0,95.4247,a8w8_blockscale_1x128x128_256x128x128x128_16x16_32x32_2x2_8x32x1_8x32x1_1x32x1x8_8_1x1_intrawave_v3,734.21,437.48,0.0
gfx942,304,3776,2304,4096,ck,0,0,100.5379,a8w8_blockscale_1x128x128_256x128x128x128_16x16_32x32_2x2_8x32x1_8x32x1_1x32x1x8_8_1x1_intrawave_v3,708.88,420.77,0.0
gfx942,304,3840,2304,4096,ck,0,0,101.4071,a8w8_blockscale_1x128x128_256x128x128x128_16x16_32x32_2x2_8x32x1_8x32x1_1x32x1x8_8_1x1_intrawave_v3,714.72,422.66,0.0
gfx942,304,3904,2304,4096,ck,0,0,98.6626,a8w8_blockscale_1x128x128_256x128x128x128_16x16_32x32_2x2_8x32x1_8x32x1_1x32x1x8_8_1x1_intrawave_v3,746.84,440.06,0.0
gfx942,304,3968,2304,4096,ck,0,0,102.8856,a8w8_blockscale_1x128x128_256x128x128x128_16x16_32x32_2x2_8x32x1_8x32x1_1x32x1x8_8_1x1_intrawave_v3,727.93,427.41,0.0
gfx942,304,4032,2304,4096,ck,0,0,99.2027,a8w8_blockscale_1x128x128_256x128x128x128_16x16_32x32_2x2_8x32x1_8x32x1_1x32x1x8_8_1x1_intrawave_v3,767.13,448.9,0.0
gfx942,304,4096,2304,4096,ck,0,0,102.2151,a8w8_blockscale_1x128x128_256x128x128x128_16x16_32x32_2x2_8x32x1_8x32x1_1x32x1x8_8_1x1_intrawave_v3,756.34,441.12,0.0
gfx942,304,4224,2304,4096,ck,0,0,105.6526,a8w8_blockscale_1x128x128_256x128x128x128_16x16_32x32_2x2_8x32x1_8x32x1_1x32x1x8_8_1x1_intrawave_v3,754.6,437.31,0.0
gfx942,304,4352,2304,4096,ck,0,0,149.0936,a8w8_blockscale_1x128x128_256x128x128x128_16x16_32x32_2x2_8x32x1_8x32x1_1x32x1x8_8_1x1_intrawave_v3,550.94,317.36,0.0
gfx942,304,4480,2304,4096,ck,0,0,144.6109,a8w8_blockscale_1x128x128_256x128x128x128_16x16_32x32_2x2_8x32x1_8x32x1_1x32x1x8_8_1x1_intrawave_v3,584.72,334.91,0.0
gfx942,304,4608,2304,4096,ck,0,0,143.8005,a8w8_blockscale_1x128x128_256x128x128x128_16x16_32x32_2x2_8x32x1_8x32x1_1x32x1x8_8_1x1_intrawave_v3,604.82,344.54,0.0
gfx942,304,4736,2304,4096,ck,0,0,137.8742,a8w8_blockscale_1x128x128_256x128x128x128_16x16_32x32_2x2_8x32x1_8x32x1_1x32x1x8_8_1x1_intrawave_v3,648.34,367.43,0.0
gfx942,304,4864,2304,4096,ck,0,0,137.2899,a8w8_blockscale_1x128x128_256x128x128x128_16x16_32x32_2x2_8x32x1_8x32x1_1x32x1x8_8_1x1_intrawave_v3,668.69,377.11,0.0
gfx942,304,4992,2304,4096,ck,0,0,137.6016,a8w8_blockscale_1x128x128_256x128x128x128_16x16_32x32_2x2_8x32x1_8x32x1_1x32x1x8_8_1x1_intrawave_v3,684.74,384.35,0.0
gfx942,304,5120,2304,4096,ck,0,0,138.152,a8w8_blockscale_1x128x128_256x128x128x128_16x16_32x32_2x2_8x32x1_8x32x1_1x32x1x8_8_1x1_intrawave_v3,699.5,390.89,0.0
gfx942,304,5248,2304,4096,ck,0,0,142.1154,a8w8_blockscale_1x128x128_256x128x128x128_16x16_32x32_2x2_8x32x1_8x32x1_1x32x1x8_8_1x1_intrawave_v3,696.99,387.82,0.0
gfx942,304,5376,2304,4096,ck,0,0,142.2784,a8w8_blockscale_1x128x128_256x128x128x128_16x16_32x32_2x2_8x32x1_8x32x1_1x32x1x8_8_1x1_intrawave_v3,713.17,395.21,0.0
gfx942,304,5504,2304,4096,ck,0,0,149.4089,a8w8_blockscale_1x128x128_256x128x128x128_16x16_32x32_2x2_8x32x1_8x32x1_1x32x1x8_8_1x1_intrawave_v3,695.3,383.81,0.0
gfx942,304,5632,2304,4096,ck,0,0,143.3653,a8w8_blockscale_1x128x128_256x128x128x128_16x16_32x32_2x2_8x32x1_8x32x1_1x32x1x8_8_1x1_intrawave_v3,741.47,407.76,0.0
gfx942,304,5760,2304,4096,ck,0,0,153.3083,a8w8_blockscale_1x128x128_256x128x128x128_16x16_32x32_2x2_8x32x1_8x32x1_1x32x1x8_8_1x1_intrawave_v3,709.14,388.58,0.0
gfx942,304,5888,2304,4096,ck,0,0,151.4407,a8w8_blockscale_1x128x128_256x128x128x128_16x16_32x32_2x2_8x32x1_8x32x1_1x32x1x8_8_1x1_intrawave_v3,733.83,400.73,0.0
gfx942,304,6016,2304,4096,ck,0,0,151.6985,a8w8_blockscale_1x128x128_256x128x128x128_16x16_32x32_2x2_8x32x1_8x32x1_1x32x1x8_8_1x1_intrawave_v3,748.51,407.39,0.0
gfx942,304,6144,2304,4096,ck,0,0,154.7142,a8w8_blockscale_1x128x128_256x128x128x128_16x16_32x32_2x2_8x32x1_8x32x1_1x32x1x8_8_1x1_intrawave_v3,749.54,406.65,0.0
gfx942,304,6272,2304,4096,ck,0,0,154.5324,a8w8_blockscale_1x128x128_256x128x128x128_16x16_32x32_2x2_8x32x1_8x32x1_1x32x1x8_8_1x1_intrawave_v3,766.05,414.34,0.0
gfx942,304,6400,2304,4096,ck,0,0,162.8262,a8w8_blockscale_1x128x128_256x128x128x128_16x16_32x32_2x2_8x32x1_8x32x1_1x32x1x8_8_1x1_intrawave_v3,741.87,400.08,0.0
gfx942,304,6528,2304,4096,ck,0,0,172.9538,a8w8_blockscale_1x128x128_256x128x128x128_16x16_32x32_2x2_8x32x1_8x32x1_1x32x1x8_8_1x1_intrawave_v3,712.4,383.09,0.0
gfx942,304,6656,2304,4096,ck,0,0,188.3012,a8w8_blockscale_1x128x128_256x128x128x128_16x16_32x32_2x2_8x32x1_8x32x1_1x32x1x8_8_1x1_intrawave_v3,667.16,357.78,0.0
gfx942,304,6784,2304,4096,ck,0,0,178.3983,a8w8_blockscale_1x128x128_256x128x128x128_16x16_32x32_2x2_8x32x1_8x32x1_1x32x1x8_8_1x1_intrawave_v3,717.74,383.89,0.0
gfx942,304,6912,2304,4096,ck,0,0,180.0281,a8w8_blockscale_1x128x128_256x128x128x128_16x16_32x32_2x2_8x32x1_8x32x1_1x32x1x8_8_1x1_intrawave_v3,724.66,386.6,0.0
gfx942,304,7040,2304,4096,ck,0,0,181.5913,a8w8_blockscale_1x128x128_256x128x128x128_16x16_32x32_2x2_8x32x1_8x32x1_1x32x1x8_8_1x1_intrawave_v3,731.73,389.41,0.0
gfx942,304,7168,2304,4096,ck,0,0,183.401,a8w8_blockscale_1x128x128_256x128x128x128_16x16_32x32_2x2_8x32x1_8x32x1_1x32x1x8_8_1x1_intrawave_v3,737.68,391.64,0.0
gfx942,304,7296,2304,4096,ck,0,0,188.3875,a8w8_blockscale_1x128x128_256x128x128x128_16x16_32x32_2x2_8x32x1_8x32x1_1x32x1x8_8_1x1_intrawave_v3,730.98,387.19,0.0
gfx942,304,7424,2304,4096,ck,0,0,192.2406,a8w8_blockscale_1x128x128_256x128x128x128_16x16_32x32_2x2_8x32x1_8x32x1_1x32x1x8_8_1x1_intrawave_v3,728.9,385.22,0.0
gfx942,304,7552,2304,4096,ck,0,0,191.0431,a8w8_blockscale_1x128x128_256x128x128x128_16x16_32x32_2x2_8x32x1_8x32x1_1x32x1x8_8_1x1_intrawave_v3,746.11,393.47,0.0
gfx942,304,7680,2304,4096,ck,0,0,193.1117,a8w8_blockscale_1x128x128_256x128x128x128_16x16_32x32_2x2_8x32x1_8x32x1_1x32x1x8_8_1x1_intrawave_v3,750.63,395.02,0.0
gfx942,304,7808,2304,4096,ck,0,0,192.9304,a8w8_blockscale_1x128x128_256x128x128x128_16x16_32x32_2x2_8x32x1_8x32x1_1x32x1x8_8_1x1_intrawave_v3,763.86,401.17,0.0
gfx942,304,7936,2304,4096,ck,0,0,193.7021,a8w8_blockscale_1x128x128_256x128x128x128_16x16_32x32_2x2_8x32x1_8x32x1_1x32x1x8_8_1x1_intrawave_v3,773.29,405.32,0.0
gfx942,304,8064,2304,4096,ck,0,0,199.021,a8w8_blockscale_1x128x128_256x128x128x128_16x16_32x32_2x2_8x32x1_8x32x1_1x32x1x8_8_1x1_intrawave_v3,764.76,400.09,0.0
gfx942,304,8192,2304,4096,ck,0,0,193.4873,a8w8_blockscale_1x128x128_256x128x128x128_16x16_32x32_2x2_8x32x1_8x32x1_1x32x1x8_8_1x1_intrawave_v3,799.12,417.29,0.0
gfx942,304,8320,2304,4096,ck,0,0,205.3772,a8w8_blockscale_1x128x128_256x128x128x128_16x16_32x32_2x2_8x32x1_8x32x1_1x32x1x8_8_1x1_intrawave_v3,764.62,398.56,0.0
gfx942,304,8448,2304,4096,ck,0,0,207.5995,a8w8_blockscale_1x128x128_256x128x128x128_16x16_32x32_2x2_8x32x1_8x32x1_1x32x1x8_8_1x1_intrawave_v3,768.07,399.66,0.0
gfx942,304,8576,2304,4096,ck,0,0,204.0636,a8w8_blockscale_1x128x128_256x128x128x128_16x16_32x32_2x2_8x32x1_8x32x1_1x32x1x8_8_1x1_intrawave_v3,793.22,412.04,0.0
gfx942,304,8704,2304,4096,ck,0,0,228.2569,a8w8_blockscale_1x128x128_256x128x128x128_16x16_32x32_2x2_8x32x1_8x32x1_1x32x1x8_8_1x1_intrawave_v3,719.73,373.25,0.0
gfx942,304,8832,2304,4096,ck,0,0,231.3036,a8w8_blockscale_1x128x128_256x128x128x128_16x16_32x32_2x2_8x32x1_8x32x1_1x32x1x8_8_1x1_intrawave_v3,720.69,373.15,0.0
gfx942,304,8960,2304,4096,ck,0,0,228.3464,a8w8_blockscale_1x128x128_256x128x128x128_16x16_32x32_2x2_8x32x1_8x32x1_1x32x1x8_8_1x1_intrawave_v3,740.6,382.86,0.0
gfx942,304,9088,2304,4096,ck,0,0,231.8299,a8w8_blockscale_1x128x128_256x128x128x128_16x16_32x32_2x2_8x32x1_8x32x1_1x32x1x8_8_1x1_intrawave_v3,739.9,381.91,0.0
gfx942,304,9216,2304,4096,ck,0,0,232.9391,a8w8_blockscale_1x128x128_256x128x128x128_16x16_32x32_2x2_8x32x1_8x32x1_1x32x1x8_8_1x1_intrawave_v3,746.75,384.88,0.0
gfx942,304,9344,2304,4096,ck,0,0,234.9295,a8w8_blockscale_1x128x128_256x128x128x128_16x16_32x32_2x2_8x32x1_8x32x1_1x32x1x8_8_1x1_intrawave_v3,750.7,386.36,0.0
gfx942,304,9472,2304,4096,ck,0,0,236.9282,a8w8_blockscale_1x128x128_256x128x128x128_16x16_32x32_2x2_8x32x1_8x32x1_1x32x1x8_8_1x1_intrawave_v3,754.57,387.8,0.0
gfx942,304,9600,2304,4096,ck,0,0,235.9872,a8w8_blockscale_1x128x128_256x128x128x128_16x16_32x32_2x2_8x32x1_8x32x1_1x32x1x8_8_1x1_intrawave_v3,767.81,394.07,0.0
gfx942,304,9728,2304,4096,ck,0,0,238.8251,a8w8_blockscale_1x128x128_256x128x128x128_16x16_32x32_2x2_8x32x1_8x32x1_1x32x1x8_8_1x1_intrawave_v3,768.8,394.05,0.0
gfx942,304,9856,2304,4096,ck,0,0,246.6667,a8w8_blockscale_1x128x128_256x128x128x128_16x16_32x32_2x2_8x32x1_8x32x1_1x32x1x8_8_1x1_intrawave_v3,754.16,386.04,0.0
gfx942,304,9984,2304,4096,ck,0,0,241.7431,a8w8_blockscale_1x128x128_256x128x128x128_16x16_32x32_2x2_8x32x1_8x32x1_1x32x1x8_8_1x1_intrawave_v3,779.51,398.51,0.0
gfx942,304,10112,2304,4096,ck,0,0,244.4246,a8w8_blockscale_1x128x128_256x128x128x128_16x16_32x32_2x2_8x32x1_8x32x1_1x32x1x8_8_1x1_intrawave_v3,780.84,398.7,0.0
gfx942,304,10240,2304,4096,ck,0,0,244.1518,a8w8_blockscale_1x128x128_256x128x128x128_16x16_32x32_2x2_8x32x1_8x32x1_1x32x1x8_8_1x1_intrawave_v3,791.61,403.71,0.0
gfx942,304,10368,2304,4096,ck,0,0,252.7934,a8w8_blockscale_1x128x128_256x128x128x128_16x16_32x32_2x2_8x32x1_8x32x1_1x32x1x8_8_1x1_intrawave_v3,774.11,394.32,0.0
gfx942,304,10496,2304,4096,ck,0,0,254.2558,a8w8_blockscale_1x128x128_256x128x128x128_16x16_32x32_2x2_8x32x1_8x32x1_1x32x1x8_8_1x1_intrawave_v3,779.16,396.43,0.0
gfx942,304,10624,2304,4096,ck,0,0,254.4477,a8w8_blockscale_1x128x128_256x128x128x128_16x16_32x32_2x2_8x32x1_8x32x1_1x32x1x8_8_1x1_intrawave_v3,788.06,400.51,0.0
gfx942,304,10752,2304,4096,ck,0,0,257.7604,a8w8_blockscale_1x128x128_256x128x128x128_16x16_32x32_2x2_8x32x1_8x32x1_1x32x1x8_8_1x1_intrawave_v3,787.31,399.68,0.0
gfx942,304,10880,2304,4096,ck,0,0,270.0059,a8w8_blockscale_1x128x128_256x128x128x128_16x16_32x32_2x2_8x32x1_8x32x1_1x32x1x8_8_1x1_intrawave_v3,760.55,385.68,0.0
gfx942,304,11008,2304,4096,ck,0,0,273.0179,a8w8_blockscale_1x128x128_256x128x128x128_16x16_32x32_2x2_8x32x1_8x32x1_1x32x1x8_8_1x1_intrawave_v3,761.01,385.51,0.0
gfx942,304,11136,2304,4096,ck,0,0,274.7319,a8w8_blockscale_1x128x128_256x128x128x128_16x16_32x32_2x2_8x32x1_8x32x1_1x32x1x8_8_1x1_intrawave_v3,765.05,387.16,0.0
gfx942,304,11264,2304,4096,ck,0,0,275.0383,a8w8_blockscale_1x128x128_256x128x128x128_16x16_32x32_2x2_8x32x1_8x32x1_1x32x1x8_8_1x1_intrawave_v3,772.99,390.78,0.0
gfx942,304,11392,2304,4096,ck,0,0,276.999,a8w8_blockscale_1x128x128_256x128x128x128_16x16_32x32_2x2_8x32x1_8x32x1_1x32x1x8_8_1x1_intrawave_v3,776.24,392.03,0.0
gfx942,304,11520,2304,4096,ck,0,0,278.9371,a8w8_blockscale_1x128x128_256x128x128x128_16x16_32x32_2x2_8x32x1_8x32x1_1x32x1x8_8_1x1_intrawave_v3,779.5,393.3,0.0
gfx942,304,11648,2304,4096,ck,0,0,287.9582,a8w8_blockscale_1x128x128_256x128x128x128_16x16_32x32_2x2_8x32x1_8x32x1_1x32x1x8_8_1x1_intrawave_v3,763.47,384.85,0.0
gfx942,304,11776,2304,4096,ck,0,0,283.0787,a8w8_blockscale_1x128x128_256x128x128x128_16x16_32x32_2x2_8x32x1_8x32x1_1x32x1x8_8_1x1_intrawave_v3,785.17,395.42,0.0
gfx942,304,11904,2304,4096,ck,0,0,298.1036,a8w8_blockscale_1x128x128_256x128x128x128_16x16_32x32_2x2_8x32x1_8x32x1_1x32x1x8_8_1x1_intrawave_v3,753.7,379.23,0.0
gfx942,304,12032,2304,4096,ck,0,0,289.2534,a8w8_blockscale_1x128x128_256x128x128x128_16x16_32x32_2x2_8x32x1_8x32x1_1x32x1x8_8_1x1_intrawave_v3,785.11,394.68,0.0
gfx942,304,12160,2304,4096,ck,0,0,294.4267,a8w8_blockscale_1x128x128_256x128x128x128_16x16_32x32_2x2_8x32x1_8x32x1_1x32x1x8_8_1x1_intrawave_v3,779.52,391.53,0.0
gfx942,304,12288,2304,4096,ck,0,0,292.5364,a8w8_blockscale_1x128x128_256x128x128x128_16x16_32x32_2x2_8x32x1_8x32x1_1x32x1x8_8_1x1_intrawave_v3,792.82,397.87,0.0
gfx942,304,12416,2304,4096,ck,0,0,304.8644,a8w8_blockscale_1x128x128_256x128x128x128_16x16_32x32_2x2_8x32x1_8x32x1_1x32x1x8_8_1x1_intrawave_v3,768.68,385.44,0.0
gfx942,304,12544,2304,4096,ck,0,0,298.4845,a8w8_blockscale_1x128x128_256x128x128x128_16x16_32x32_2x2_8x32x1_8x32x1_1x32x1x8_8_1x1_intrawave_v3,793.21,397.41,0.0
gfx942,304,12672,2304,4096,ck,0,0,302.1415,a8w8_blockscale_1x128x128_256x128x128x128_16x16_32x32_2x2_8x32x1_8x32x1_1x32x1x8_8_1x1_intrawave_v3,791.6,396.29,0.0
gfx942,304,12800,2304,4096,ck,0,0,311.8363,a8w8_blockscale_1x128x128_256x128x128x128_16x16_32x32_2x2_8x32x1_8x32x1_1x32x1x8_8_1x1_intrawave_v3,774.74,387.54,0.0
gfx942,304,12928,2304,4096,ck,0,0,311.4475,a8w8_blockscale_1x128x128_256x128x128x128_16x16_32x32_2x2_8x32x1_8x32x1_1x32x1x8_8_1x1_intrawave_v3,783.46,391.6,0.0
gfx942,304,13056,2304,4096,ck,0,0,319.8276,a8w8_blockscale_1x128x128_256x128x128x128_16x16_32x32_2x2_8x32x1_8x32x1_1x32x1x8_8_1x1_intrawave_v3,770.49,384.82,0.0
gfx942,304,13184,2304,4096,ck,0,0,324.7338,a8w8_blockscale_1x128x128_256x128x128x128_16x16_32x32_2x2_8x32x1_8x32x1_1x32x1x8_8_1x1_intrawave_v3,766.29,382.44,0.0
gfx942,304,13312,2304,4096,ck,0,0,323.8683,a8w8_blockscale_1x128x128_256x128x128x128_16x16_32x32_2x2_8x32x1_8x32x1_1x32x1x8_8_1x1_intrawave_v3,775.8,386.9,0.0
gfx942,304,13440,2304,4096,ck,0,0,331.261,a8w8_blockscale_1x128x128_256x128x128x128_16x16_32x32_2x2_8x32x1_8x32x1_1x32x1x8_8_1x1_intrawave_v3,765.78,381.63,0.0
gfx942,304,13568,2304,4096,ck,0,0,332.4163,a8w8_blockscale_1x128x128_256x128x128x128_16x16_32x32_2x2_8x32x1_8x32x1_1x32x1x8_8_1x1_intrawave_v3,770.38,383.65,0.0
gfx942,304,13696,2304,4096,ck,0,0,332.0123,a8w8_blockscale_1x128x128_256x128x128x128_16x16_32x32_2x2_8x32x1_8x32x1_1x32x1x8_8_1x1_intrawave_v3,778.6,387.48,0.0
gfx942,304,13824,2304,4096,ck,0,0,331.6342,a8w8_blockscale_1x128x128_256x128x128x128_16x16_32x32_2x2_8x32x1_8x32x1_1x32x1x8_8_1x1_intrawave_v3,786.77,391.28,0.0
gfx942,304,13952,2304,4096,ck,0,0,340.5171,a8w8_blockscale_1x128x128_256x128x128x128_16x16_32x32_2x2_8x32x1_8x32x1_1x32x1x8_8_1x1_intrawave_v3,773.34,384.34,0.0
gfx942,304,14080,2304,4096,ck,0,0,334.0098,a8w8_blockscale_1x128x128_256x128x128x128_16x16_32x32_2x2_8x32x1_8x32x1_1x32x1x8_8_1x1_intrawave_v3,795.64,395.17,0.0
gfx942,304,14208,2304,4096,ck,0,0,339.8206,a8w8_blockscale_1x128x128_256x128x128x128_16x16_32x32_2x2_8x32x1_8x32x1_1x32x1x8_8_1x1_intrawave_v3,789.14,391.69,0.0
gfx942,304,14336,2304,4096,ck,0,0,333.8242,a8w8_blockscale_1x128x128_256x128x128x128_16x16_32x32_2x2_8x32x1_8x32x1_1x32x1x8_8_1x1_intrawave_v3,810.56,402.06,0.0
gfx942,304,14464,2304,4096,ck,0,0,352.0066,a8w8_blockscale_1x128x128_256x128x128x128_16x16_32x32_2x2_8x32x1_8x32x1_1x32x1x8_8_1x1_intrawave_v3,775.55,384.46,0.0
gfx942,304,14592,2304,4096,ck,0,0,350.8652,a8w8_blockscale_1x128x128_256x128x128x128_16x16_32x32_2x2_8x32x1_8x32x1_1x32x1x8_8_1x1_intrawave_v3,784.96,388.88,0.0
gfx942,304,14720,2304,4096,ck,0,0,353.4486,a8w8_blockscale_1x128x128_256x128x128x128_16x16_32x32_2x2_8x32x1_8x32x1_1x32x1x8_8_1x1_intrawave_v3,786.06,389.19,0.0
gfx942,304,14848,2304,4096,ck,0,0,352.2595,a8w8_blockscale_1x128x128_256x128x128x128_16x16_32x32_2x2_8x32x1_8x32x1_1x32x1x8_8_1x1_intrawave_v3,795.57,393.67,0.0
gfx942,304,14976,2304,4096,ck,0,0,361.1473,a8w8_blockscale_1x128x128_256x128x128x128_16x16_32x32_2x2_8x32x1_8x32x1_1x32x1x8_8_1x1_intrawave_v3,782.68,387.07,0.0
gfx942,304,15104,2304,4096,ck,0,0,361.6199,a8w8_blockscale_1x128x128_256x128x128x128_16x16_32x32_2x2_8x32x1_8x32x1_1x32x1x8_8_1x1_intrawave_v3,788.34,389.64,0.0
gfx942,304,15232,2304,4096,ck,0,0,365.4823,a8w8_blockscale_1x128x128_256x128x128x128_16x16_32x32_2x2_8x32x1_8x32x1_1x32x1x8_8_1x1_intrawave_v3,786.62,388.57,0.0
gfx942,304,15360,2304,4096,ck,0,0,371.5226,a8w8_blockscale_1x128x128_256x128x128x128_16x16_32x32_2x2_8x32x1_8x32x1_1x32x1x8_8_1x1_intrawave_v3,780.33,385.25,0.0
gfx942,304,15488,2304,4096,ck,0,0,382.5337,a8w8_blockscale_1x128x128_256x128x128x128_16x16_32x32_2x2_8x32x1_8x32x1_1x32x1x8_8_1x1_intrawave_v3,764.18,377.08,0.0
gfx942,304,15616,2304,4096,ck,0,0,385.9431,a8w8_blockscale_1x128x128_256x128x128x128_16x16_32x32_2x2_8x32x1_8x32x1_1x32x1x8_8_1x1_intrawave_v3,763.69,376.63,0.0
gfx942,304,15744,2304,4096,ck,0,0,386.9818,a8w8_blockscale_1x128x128_256x128x128x128_16x16_32x32_2x2_8x32x1_8x32x1_1x32x1x8_8_1x1_intrawave_v3,767.89,378.5,0.0
gfx942,304,15872,2304,4096,ck,0,0,381.4747,a8w8_blockscale_1x128x128_256x128x128x128_16x16_32x32_2x2_8x32x1_8x32x1_1x32x1x8_8_1x1_intrawave_v3,785.3,386.89,0.0
gfx942,304,16000,2304,4096,ck,0,0,392.8725,a8w8_blockscale_1x128x128_256x128x128x128_16x16_32x32_2x2_8x32x1_8x32x1_1x32x1x8_8_1x1_intrawave_v3,768.67,378.5,0.0
gfx942,304,16128,2304,4096,ck,0,0,387.9244,a8w8_blockscale_1x128x128_256x128x128x128_16x16_32x32_2x2_8x32x1_8x32x1_1x32x1x8_8_1x1_intrawave_v3,784.7,386.2,0.0
gfx942,304,16256,2304,4096,ck,0,0,389.7921,a8w8_blockscale_1x128x128_256x128x128x128_16x16_32x32_2x2_8x32x1_8x32x1_1x32x1x8_8_1x1_intrawave_v3,787.14,387.2,0.0
gfx942,304,16384,2304,4096,ck,0,0,382.173,a8w8_blockscale_1x128x128_256x128x128x128_16x16_32x32_2x2_8x32x1_8x32x1_1x32x1x8_8_1x1_intrawave_v3,809.16,397.84,0.0
gfx942,304,16512,2304,4096,ck,0,0,390.6167,a8w8_blockscale_1x128x128_256x128x128x128_16x16_32x32_2x2_8x32x1_8x32x1_1x32x1x8_8_1x1_intrawave_v3,797.85,392.09,0.0
gfx942,304,16640,2304,4096,ck,0,0,400.6009,a8w8_blockscale_1x128x128_256x128x128x128_16x16_32x32_2x2_8x32x1_8x32x1_1x32x1x8_8_1x1_intrawave_v3,784.0,385.1,0.0
gfx942,304,16768,2304,4096,ck,0,0,398.8027,a8w8_blockscale_1x128x128_256x128x128x128_16x16_32x32_2x2_8x32x1_8x32x1_1x32x1x8_8_1x1_intrawave_v3,793.59,389.63,0.0
gfx942,304,16896,2304,4096,ck,0,0,396.2072,a8w8_blockscale_1x128x128_256x128x128x128_16x16_32x32_2x2_8x32x1_8x32x1_1x32x1x8_8_1x1_intrawave_v3,804.89,395.0,0.0
gfx942,304,17024,2304,4096,ck,0,0,407.8006,a8w8_blockscale_1x128x128_256x128x128x128_16x16_32x32_2x2_8x32x1_8x32x1_1x32x1x8_8_1x1_intrawave_v3,787.93,386.5,0.0
gfx942,304,17152,2304,4096,ck,0,0,415.092,a8w8_blockscale_1x128x128_256x128x128x128_16x16_32x32_2x2_8x32x1_8x32x1_1x32x1x8_8_1x1_intrawave_v3,779.91,382.39,0.0
gfx942,304,17280,2304,4096,ck,0,0,405.8178,a8w8_blockscale_1x128x128_256x128x128x128_16x16_32x32_2x2_8x32x1_8x32x1_1x32x1x8_8_1x1_intrawave_v3,803.68,393.88,0.0
gfx942,304,17408,2304,4096,ck,0,0,422.8462,a8w8_blockscale_1x128x128_256x128x128x128_16x16_32x32_2x2_8x32x1_8x32x1_1x32x1x8_8_1x1_intrawave_v3,777.03,380.65,0.0
gfx942,304,17536,2304,4096,ck,0,0,432.7406,a8w8_blockscale_1x128x128_256x128x128x128_16x16_32x32_2x2_8x32x1_8x32x1_1x32x1x8_8_1x1_intrawave_v3,764.85,374.52,0.0
gfx942,304,17664,2304,4096,ck,0,0,429.8935,a8w8_blockscale_1x128x128_256x128x128x128_16x16_32x32_2x2_8x32x1_8x32x1_1x32x1x8_8_1x1_intrawave_v3,775.53,379.59,0.0
gfx942,304,17792,2304,4096,ck,0,0,432.0661,a8w8_blockscale_1x128x128_256x128x128x128_16x16_32x32_2x2_8x32x1_8x32x1_1x32x1x8_8_1x1_intrawave_v3,777.23,380.26,0.0
gfx942,304,17920,2304,4096,ck,0,0,427.797,a8w8_blockscale_1x128x128_256x128x128x128_16x16_32x32_2x2_8x32x1_8x32x1_1x32x1x8_8_1x1_intrawave_v3,790.63,386.66,0.0
gfx942,304,18048,2304,4096,ck,0,0,433.9062,a8w8_blockscale_1x128x128_256x128x128x128_16x16_32x32_2x2_8x32x1_8x32x1_1x32x1x8_8_1x1_intrawave_v3,785.07,383.79,0.0
gfx942,304,18176,2304,4096,ck,0,0,429.6046,a8w8_blockscale_1x128x128_256x128x128x128_16x16_32x32_2x2_8x32x1_8x32x1_1x32x1x8_8_1x1_intrawave_v3,798.55,390.22,0.0
gfx942,304,18304,2304,4096,ck,0,0,445.6154,a8w8_blockscale_1x128x128_256x128x128x128_16x16_32x32_2x2_8x32x1_8x32x1_1x32x1x8_8_1x1_intrawave_v3,775.28,378.7,0.0
gfx942,304,18432,2304,4096,ck,0,0,433.7165,a8w8_blockscale_1x128x128_256x128x128x128_16x16_32x32_2x2_8x32x1_8x32x1_1x32x1x8_8_1x1_intrawave_v3,802.12,391.66,0.0
gfx942,304,18560,2304,4096,ck,0,0,439.0794,a8w8_blockscale_1x128x128_256x128x128x128_16x16_32x32_2x2_8x32x1_8x32x1_1x32x1x8_8_1x1_intrawave_v3,797.82,389.41,0.0
gfx942,304,18688,2304,4096,ck,0,0,441.1012,a8w8_blockscale_1x128x128_256x128x128x128_16x16_32x32_2x2_8x32x1_8x32x1_1x32x1x8_8_1x1_intrawave_v3,799.64,390.15,0.0
gfx942,304,18816,2304,4096,ck,0,0,440.9913,a8w8_blockscale_1x128x128_256x128x128x128_16x16_32x32_2x2_8x32x1_8x32x1_1x32x1x8_8_1x1_intrawave_v3,805.32,392.78,0.0
gfx942,304,18944,2304,4096,ck,0,0,450.0312,a8w8_blockscale_1x128x128_256x128x128x128_16x16_32x32_2x2_8x32x1_8x32x1_1x32x1x8_8_1x1_intrawave_v3,794.51,387.36,0.0
gfx942,304,19072,2304,4096,ck,0,0,445.5015,a8w8_blockscale_1x128x128_256x128x128x128_16x16_32x32_2x2_8x32x1_8x32x1_1x32x1x8_8_1x1_intrawave_v3,808.02,393.8,0.0
gfx942,304,19200,2304,4096,ck,0,0,454.3087,a8w8_blockscale_1x128x128_256x128x128x128_16x16_32x32_2x2_8x32x1_8x32x1_1x32x1x8_8_1x1_intrawave_v3,797.67,388.62,0.0
gfx942,304,19328,2304,4096,ck,0,0,457.265,a8w8_blockscale_1x128x128_256x128x128x128_16x16_32x32_2x2_8x32x1_8x32x1_1x32x1x8_8_1x1_intrawave_v3,797.8,388.55,0.0
gfx942,304,19456,2304,4096,ck,0,0,456.9429,a8w8_blockscale_1x128x128_256x128x128x128_16x16_32x32_2x2_8x32x1_8x32x1_1x32x1x8_8_1x1_intrawave_v3,803.64,391.26,0.0
gfx942,304,19584,2304,4096,ck,0,0,479.4698,a8w8_blockscale_1x128x128_256x128x128x128_16x16_32x32_2x2_8x32x1_8x32x1_1x32x1x8_8_1x1_intrawave_v3,770.93,375.2,0.0
gfx942,304,19712,2304,4096,ck,0,0,468.3038,a8w8_blockscale_1x128x128_256x128x128x128_16x16_32x32_2x2_8x32x1_8x32x1_1x32x1x8_8_1x1_intrawave_v3,794.47,386.52,0.0
gfx942,304,19840,2304,4096,ck,0,0,480.7727,a8w8_blockscale_1x128x128_256x128x128x128_16x16_32x32_2x2_8x32x1_8x32x1_1x32x1x8_8_1x1_intrawave_v3,778.89,378.82,0.0
gfx942,304,19968,2304,4096,ck,0,0,471.9746,a8w8_blockscale_1x128x128_256x128x128x128_16x16_32x32_2x2_8x32x1_8x32x1_1x32x1x8_8_1x1_intrawave_v3,798.52,388.24,0.0
gfx942,304,20096,2304,4096,ck,0,0,489.7712,a8w8_blockscale_1x128x128_256x128x128x128_16x16_32x32_2x2_8x32x1_8x32x1_1x32x1x8_8_1x1_intrawave_v3,774.44,376.41,0.0
gfx942,304,20224,2304,4096,ck,0,0,487.709,a8w8_blockscale_1x128x128_256x128x128x128_16x16_32x32_2x2_8x32x1_8x32x1_1x32x1x8_8_1x1_intrawave_v3,782.67,380.28,0.0
gfx942,304,20352,2304,4096,ck,0,0,481.7216,a8w8_blockscale_1x128x128_256x128x128x128_16x16_32x32_2x2_8x32x1_8x32x1_1x32x1x8_8_1x1_intrawave_v3,797.41,387.32,0.0
gfx942,304,20480,2304,4096,ck,0,0,470.8058,a8w8_blockscale_1x128x128_256x128x128x128_16x16_32x32_2x2_8x32x1_8x32x1_1x32x1x8_8_1x1_intrawave_v3,821.03,398.67,0.0
gfx942,304,20608,2304,4096,ck,0,0,492.3048,a8w8_blockscale_1x128x128_256x128x128x128_16x16_32x32_2x2_8x32x1_8x32x1_1x32x1x8_8_1x1_intrawave_v3,790.09,383.52,0.0
gfx942,304,20736,2304,4096,ck,0,0,489.4264,a8w8_blockscale_1x128x128_256x128x128x128_16x16_32x32_2x2_8x32x1_8x32x1_1x32x1x8_8_1x1_intrawave_v3,799.67,388.05,0.0
gfx942,304,20864,2304,4096,ck,0,0,492.7374,a8w8_blockscale_1x128x128_256x128x128x128_16x16_32x32_2x2_8x32x1_8x32x1_1x32x1x8_8_1x1_intrawave_v3,799.2,387.71,0.0
gfx942,304,20992,2304,4096,ck,0,0,494.6839,a8w8_blockscale_1x128x128_256x128x128x128_16x16_32x32_2x2_8x32x1_8x32x1_1x32x1x8_8_1x1_intrawave_v3,800.94,388.43,0.0
gfx942,304,21120,2304,4096,ck,0,0,501.9041,a8w8_blockscale_1x128x128_256x128x128x128_16x16_32x32_2x2_8x32x1_8x32x1_1x32x1x8_8_1x1_intrawave_v3,794.23,385.06,0.0
gfx942,304,21248,2304,4096,ck,0,0,501.6527,a8w8_blockscale_1x128x128_256x128x128x128_16x16_32x32_2x2_8x32x1_8x32x1_1x32x1x8_8_1x1_intrawave_v3,799.44,387.48,0.0
gfx942,304,21376,2304,4096,ck,0,0,502.0754,a8w8_blockscale_1x128x128_256x128x128x128_16x16_32x32_2x2_8x32x1_8x32x1_1x32x1x8_8_1x1_intrawave_v3,803.58,389.37,0.0
gfx942,304,21504,2304,4096,ck,0,0,490.6641,a8w8_blockscale_1x128x128_256x128x128x128_16x16_32x32_2x2_8x32x1_8x32x1_1x32x1x8_8_1x1_intrawave_v3,827.19,400.7,0.0
gfx942,304,21632,2304,4096,ck,0,0,526.3803,a8w8_blockscale_1x128x128_256x128x128x128_16x16_32x32_2x2_8x32x1_8x32x1_1x32x1x8_8_1x1_intrawave_v3,775.66,375.63,0.0
gfx942,304,21760,2304,4096,ck,0,0,524.3548,a8w8_blockscale_1x128x128_256x128x128x128_16x16_32x32_2x2_8x32x1_8x32x1_1x32x1x8_8_1x1_intrawave_v3,783.26,379.2,0.0
gfx942,304,21888,2304,4096,ck,0,0,526.6294,a8w8_blockscale_1x128x128_256x128x128x128_16x16_32x32_2x2_8x32x1_8x32x1_1x32x1x8_8_1x1_intrawave_v3,784.46,379.68,0.0
gfx942,304,22016,2304,4096,ck,0,0,524.8627,a8w8_blockscale_1x128x128_256x128x128x128_16x16_32x32_2x2_8x32x1_8x32x1_1x32x1x8_8_1x1_intrawave_v3,791.71,383.08,0.0
gfx942,304,22144,2304,4096,ck,0,0,535.5026,a8w8_blockscale_1x128x128_256x128x128x128_16x16_32x32_2x2_8x32x1_8x32x1_1x32x1x8_8_1x1_intrawave_v3,780.49,377.55,0.0
gfx942,304,22272,2304,4096,ck,0,0,532.5418,a8w8_blockscale_1x128x128_256x128x128x128_16x16_32x32_2x2_8x32x1_8x32x1_1x32x1x8_8_1x1_intrawave_v3,789.37,381.74,0.0
gfx942,304,22400,2304,4096,ck,0,0,532.4484,a8w8_blockscale_1x128x128_256x128x128x128_16x16_32x32_2x2_8x32x1_8x32x1_1x32x1x8_8_1x1_intrawave_v3,794.04,383.9,0.0
gfx942,304,22528,2304,4096,ck,0,0,519.8544,a8w8_blockscale_1x128x128_256x128x128x128_16x16_32x32_2x2_8x32x1_8x32x1_1x32x1x8_8_1x1_intrawave_v3,817.92,395.34,0.0
gfx942,304,22656,2304,4096,ck,0,0,536.7486,a8w8_blockscale_1x128x128_256x128x128x128_16x16_32x32_2x2_8x32x1_8x32x1_1x32x1x8_8_1x1_intrawave_v3,796.68,384.98,0.0
gfx942,304,22784,2304,4096,ck,0,0,542.9124,a8w8_blockscale_1x128x128_256x128x128x128_16x16_32x32_2x2_8x32x1_8x32x1_1x32x1x8_8_1x1_intrawave_v3,792.09,382.66,0.0
gfx942,304,22912,2304,4096,ck,0,0,535.3553,a8w8_blockscale_1x128x128_256x128x128x128_16x16_32x32_2x2_8x32x1_8x32x1_1x32x1x8_8_1x1_intrawave_v3,807.78,390.14,0.0
gfx942,304,23040,2304,4096,ck,0,0,540.2236,a8w8_blockscale_1x128x128_256x128x128x128_16x16_32x32_2x2_8x32x1_8x32x1_1x32x1x8_8_1x1_intrawave_v3,804.97,388.69,0.0
gfx942,304,23168,2304,4096,ck,0,0,545.1468,a8w8_blockscale_1x128x128_256x128x128x128_16x16_32x32_2x2_8x32x1_8x32x1_1x32x1x8_8_1x1_intrawave_v3,802.14,387.22,0.0
gfx942,304,23296,2304,4096,ck,0,0,549.2282,a8w8_blockscale_1x128x128_256x128x128x128_16x16_32x32_2x2_8x32x1_8x32x1_1x32x1x8_8_1x1_intrawave_v3,800.57,386.37,0.0
gfx942,304,23424,2304,4096,ck,0,0,551.5589,a8w8_blockscale_1x128x128_256x128x128x128_16x16_32x32_2x2_8x32x1_8x32x1_1x32x1x8_8_1x1_intrawave_v3,801.57,386.76,0.0
gfx942,304,23552,2304,4096,ck,0,0,546.5867,a8w8_blockscale_1x128x128_256x128x128x128_16x16_32x32_2x2_8x32x1_8x32x1_1x32x1x8_8_1x1_intrawave_v3,813.28,392.31,0.0
gfx942,304,23680,2304,4096,ck,0,0,559.715,a8w8_blockscale_1x128x128_256x128x128x128_16x16_32x32_2x2_8x32x1_8x32x1_1x32x1x8_8_1x1_intrawave_v3,798.52,385.1,0.0
gfx942,304,23808,2304,4096,ck,0,0,569.9029,a8w8_blockscale_1x128x128_256x128x128x128_16x16_32x32_2x2_8x32x1_8x32x1_1x32x1x8_8_1x1_intrawave_v3,788.49,380.17,0.0
gfx942,304,23936,2304,4096,ck,0,0,577.7025,a8w8_blockscale_1x128x128_256x128x128x128_16x16_32x32_2x2_8x32x1_8x32x1_1x32x1x8_8_1x1_intrawave_v3,782.02,376.97,0.0
gfx942,304,24064,2304,4096,ck,0,0,581.9023,a8w8_blockscale_1x128x128_256x128x128x128_16x16_32x32_2x2_8x32x1_8x32x1_1x32x1x8_8_1x1_intrawave_v3,780.53,376.16,0.0
gfx942,304,24192,2304,4096,ck,0,0,580.9377,a8w8_blockscale_1x128x128_256x128x128x128_16x16_32x32_2x2_8x32x1_8x32x1_1x32x1x8_8_1x1_intrawave_v3,785.99,378.71,0.0
gfx942,304,24320,2304,4096,ck,0,0,586.8061,a8w8_blockscale_1x128x128_256x128x128x128_16x16_32x32_2x2_8x32x1_8x32x1_1x32x1x8_8_1x1_intrawave_v3,782.24,376.82,0.0
gfx942,304,24448,2304,4096,ck,0,0,576.5209,a8w8_blockscale_1x128x128_256x128x128x128_16x16_32x32_2x2_8x32x1_8x32x1_1x32x1x8_8_1x1_intrawave_v3,800.39,385.47,0.0
gfx942,304,24576,2304,4096,ck,0,0,579.5567,a8w8_blockscale_1x128x128_256x128x128x128_16x16_32x32_2x2_8x32x1_8x32x1_1x32x1x8_8_1x1_intrawave_v3,800.36,385.38,0.0
gfx942,304,24704,2304,4096,ck,0,0,590.3564,a8w8_blockscale_1x128x128_256x128x128x128_16x16_32x32_2x2_8x32x1_8x32x1_1x32x1x8_8_1x1_intrawave_v3,789.82,380.21,0.0
gfx942,304,24832,2304,4096,ck,0,0,583.4508,a8w8_blockscale_1x128x128_256x128x128x128_16x16_32x32_2x2_8x32x1_8x32x1_1x32x1x8_8_1x1_intrawave_v3,803.3,386.62,0.0
gfx942,304,24960,2304,4096,ck,0,0,593.9619,a8w8_blockscale_1x128x128_256x128x128x128_16x16_32x32_2x2_8x32x1_8x32x1_1x32x1x8_8_1x1_intrawave_v3,793.16,381.66,0.0
gfx942,304,25088,2304,4096,ck,0,0,581.1713,a8w8_blockscale_1x128x128_256x128x128x128_16x16_32x32_2x2_8x32x1_8x32x1_1x32x1x8_8_1x1_intrawave_v3,814.77,391.97,0.0
gfx942,304,25216,2304,4096,ck,0,0,591.7216,a8w8_blockscale_1x128x128_256x128x128x128_16x16_32x32_2x2_8x32x1_8x32x1_1x32x1x8_8_1x1_intrawave_v3,804.32,386.87,0.0
gfx942,304,25344,2304,4096,ck,0,0,604.4636,a8w8_blockscale_1x128x128_256x128x128x128_16x16_32x32_2x2_8x32x1_8x32x1_1x32x1x8_8_1x1_intrawave_v3,791.37,380.55,0.0
gfx942,304,25472,2304,4096,ck,0,0,589.2265,a8w8_blockscale_1x128x128_256x128x128x128_16x16_32x32_2x2_8x32x1_8x32x1_1x32x1x8_8_1x1_intrawave_v3,815.93,392.29,0.0
gfx942,304,25600,2304,4096,ck,0,0,598.9424,a8w8_blockscale_1x128x128_256x128x128x128_16x16_32x32_2x2_8x32x1_8x32x1_1x32x1x8_8_1x1_intrawave_v3,806.73,387.78,0.0
gfx942,304,25728,2304,4096,ck,0,0,613.066,a8w8_blockscale_1x128x128_256x128x128x128_16x16_32x32_2x2_8x32x1_8x32x1_1x32x1x8_8_1x1_intrawave_v3,792.08,380.67,0.0
gfx942,304,25856,2304,4096,ck,0,0,618.2608,a8w8_blockscale_1x128x128_256x128x128x128_16x16_32x32_2x2_8x32x1_8x32x1_1x32x1x8_8_1x1_intrawave_v3,789.34,379.27,0.0
gfx942,304,25984,2304,4096,ck,0,0,620.5682,a8w8_blockscale_1x128x128_256x128x128x128_16x16_32x32_2x2_8x32x1_8x32x1_1x32x1x8_8_1x1_intrawave_v3,790.29,379.66,0.0
gfx942,304,26112,2304,4096,ck,0,0,621.4593,a8w8_blockscale_1x128x128_256x128x128x128_16x16_32x32_2x2_8x32x1_8x32x1_1x32x1x8_8_1x1_intrawave_v3,793.05,380.9,0.0
gfx942,304,26240,2304,4096,ck,0,0,624.0525,a8w8_blockscale_1x128x128_256x128x128x128_16x16_32x32_2x2_8x32x1_8x32x1_1x32x1x8_8_1x1_intrawave_v3,793.62,381.11,0.0
gfx942,304,26368,2304,4096,ck,0,0,632.8764,a8w8_blockscale_1x128x128_256x128x128x128_16x16_32x32_2x2_8x32x1_8x32x1_1x32x1x8_8_1x1_intrawave_v3,786.38,377.55,0.0
gfx942,304,26496,2304,4096,ck,0,0,633.8172,a8w8_blockscale_1x128x128_256x128x128x128_16x16_32x32_2x2_8x32x1_8x32x1_1x32x1x8_8_1x1_intrawave_v3,789.02,378.75,0.0
gfx942,304,26624,2304,4096,ck,0,0,614.444,a8w8_blockscale_1x128x128_256x128x128x128_16x16_32x32_2x2_8x32x1_8x32x1_1x32x1x8_8_1x1_intrawave_v3,817.83,392.51,0.0
gfx942,304,26752,2304,4096,ck,0,0,634.8238,a8w8_blockscale_1x128x128_256x128x128x128_16x16_32x32_2x2_8x32x1_8x32x1_1x32x1x8_8_1x1_intrawave_v3,795.38,381.66,0.0
gfx942,304,26880,2304,4096,ck,0,0,638.6291,a8w8_blockscale_1x128x128_256x128x128x128_16x16_32x32_2x2_8x32x1_8x32x1_1x32x1x8_8_1x1_intrawave_v3,794.43,381.13,0.0
gfx942,304,27008,2304,4096,ck,0,0,641.5651,a8w8_blockscale_1x128x128_256x128x128x128_16x16_32x32_2x2_8x32x1_8x32x1_1x32x1x8_8_1x1_intrawave_v3,794.56,381.12,0.0
gfx942,304,27136,2304,4096,ck,0,0,632.6352,a8w8_blockscale_1x128x128_256x128x128x128_16x16_32x32_2x2_8x32x1_8x32x1_1x32x1x8_8_1x1_intrawave_v3,809.59,388.26,0.0
gfx942,304,27264,2304,4096,ck,0,0,640.1556,a8w8_blockscale_1x128x128_256x128x128x128_16x16_32x32_2x2_8x32x1_8x32x1_1x32x1x8_8_1x1_intrawave_v3,803.85,385.44,0.0
gfx942,304,27392,2304,4096,ck,0,0,653.3236,a8w8_blockscale_1x128x128_256x128x128x128_16x16_32x32_2x2_8x32x1_8x32x1_1x32x1x8_8_1x1_intrawave_v3,791.35,379.38,0.0
gfx942,304,27520,2304,4096,ck,0,0,651.1645,a8w8_blockscale_1x128x128_256x128x128x128_16x16_32x32_2x2_8x32x1_8x32x1_1x32x1x8_8_1x1_intrawave_v3,797.68,382.35,0.0
gfx942,304,27648,2304,4096,ck,0,0,649.7403,a8w8_blockscale_1x128x128_256x128x128x128_16x16_32x32_2x2_8x32x1_8x32x1_1x32x1x8_8_1x1_intrawave_v3,803.15,384.9,0.0
gfx942,304,27776,2304,4096,ck,0,0,666.2225,a8w8_blockscale_1x128x128_256x128x128x128_16x16_32x32_2x2_8x32x1_8x32x1_1x32x1x8_8_1x1_intrawave_v3,786.91,377.05,0.0
gfx942,304,27904,2304,4096,ck,0,0,652.3532,a8w8_blockscale_1x128x128_256x128x128x128_16x16_32x32_2x2_8x32x1_8x32x1_1x32x1x8_8_1x1_intrawave_v3,807.34,386.77,0.0
gfx942,304,28032,2304,4096,ck,0,0,658.3638,a8w8_blockscale_1x128x128_256x128x128x128_16x16_32x32_2x2_8x32x1_8x32x1_1x32x1x8_8_1x1_intrawave_v3,803.64,384.94,0.0
gfx942,304,28160,2304,4096,ck,0,0,659.0932,a8w8_blockscale_1x128x128_256x128x128x128_16x16_32x32_2x2_8x32x1_8x32x1_1x32x1x8_8_1x1_intrawave_v3,806.41,386.2,0.0
gfx942,304,28288,2304,4096,ck,0,0,673.4998,a8w8_blockscale_1x128x128_256x128x128x128_16x16_32x32_2x2_8x32x1_8x32x1_1x32x1x8_8_1x1_intrawave_v3,792.75,379.59,0.0
gfx942,304,28416,2304,4096,ck,0,0,670.5691,a8w8_blockscale_1x128x128_256x128x128x128_16x16_32x32_2x2_8x32x1_8x32x1_1x32x1x8_8_1x1_intrawave_v3,799.82,382.91,0.0
gfx942,304,28544,2304,4096,ck,0,0,662.1747,a8w8_blockscale_1x128x128_256x128x128x128_16x16_32x32_2x2_8x32x1_8x32x1_1x32x1x8_8_1x1_intrawave_v3,813.61,389.45,0.0
gfx942,304,28672,2304,4096,ck,0,0,657.782,a8w8_blockscale_1x128x128_256x128x128x128_16x16_32x32_2x2_8x32x1_8x32x1_1x32x1x8_8_1x1_intrawave_v3,822.71,393.74,0.0
gfx942,304,28800,2304,4096,ck,0,0,676.031,a8w8_blockscale_1x128x128_256x128x128x128_16x16_32x32_2x2_8x32x1_8x32x1_1x32x1x8_8_1x1_intrawave_v3,804.08,384.76,0.0
gfx942,304,28928,2304,4096,ck,0,0,669.7155,a8w8_blockscale_1x128x128_256x128x128x128_16x16_32x32_2x2_8x32x1_8x32x1_1x32x1x8_8_1x1_intrawave_v3,815.27,390.06,0.0
gfx942,304,29056,2304,4096,ck,0,0,679.4869,a8w8_blockscale_1x128x128_256x128x128x128_16x16_32x32_2x2_8x32x1_8x32x1_1x32x1x8_8_1x1_intrawave_v3,807.1,386.09,0.0
gfx942,304,29184,2304,4096,ck,0,0,681.4688,a8w8_blockscale_1x128x128_256x128x128x128_16x16_32x32_2x2_8x32x1_8x32x1_1x32x1x8_8_1x1_intrawave_v3,808.3,386.6,0.0
gfx942,304,29312,2304,4096,ck,0,0,696.8577,a8w8_blockscale_1x128x128_256x128x128x128_16x16_32x32_2x2_8x32x1_8x32x1_1x32x1x8_8_1x1_intrawave_v3,793.91,379.66,0.0
gfx942,304,29440,2304,4096,ck,0,0,702.9743,a8w8_blockscale_1x128x128_256x128x128x128_16x16_32x32_2x2_8x32x1_8x32x1_1x32x1x8_8_1x1_intrawave_v3,790.44,377.94,0.0
gfx942,304,29568,2304,4096,ck,0,0,695.5274,a8w8_blockscale_1x128x128_256x128x128x128_16x16_32x32_2x2_8x32x1_8x32x1_1x32x1x8_8_1x1_intrawave_v3,802.38,383.59,0.0
gfx942,304,29696,2304,4096,ck,0,0,681.7502,a8w8_blockscale_1x128x128_256x128x128x128_16x16_32x32_2x2_8x32x1_8x32x1_1x32x1x8_8_1x1_intrawave_v3,822.14,392.98,0.0
gfx942,304,29824,2304,4096,ck,0,0,717.8682,a8w8_blockscale_1x128x128_256x128x128x128_16x16_32x32_2x2_8x32x1_8x32x1_1x32x1x8_8_1x1_intrawave_v3,784.14,374.76,0.0
gfx942,304,29952,2304,4096,ck,0,0,710.0743,a8w8_blockscale_1x128x128_256x128x128x128_16x16_32x32_2x2_8x32x1_8x32x1_1x32x1x8_8_1x1_intrawave_v3,796.15,380.44,0.0
gfx942,304,30080,2304,4096,ck,0,0,709.0159,a8w8_blockscale_1x128x128_256x128x128x128_16x16_32x32_2x2_8x32x1_8x32x1_1x32x1x8_8_1x1_intrawave_v3,800.75,382.58,0.0
gfx942,304,30208,2304,4096,ck,0,0,700.8498,a8w8_blockscale_1x128x128_256x128x128x128_16x16_32x32_2x2_8x32x1_8x32x1_1x32x1x8_8_1x1_intrawave_v3,813.52,388.62,0.0
gfx942,304,30336,2304,4096,ck,0,0,731.8612,a8w8_blockscale_1x128x128_256x128x128x128_16x16_32x32_2x2_8x32x1_8x32x1_1x32x1x8_8_1x1_intrawave_v3,782.35,373.68,0.0
gfx942,304,30464,2304,4096,ck,0,0,729.7736,a8w8_blockscale_1x128x128_256x128x128x128_16x16_32x32_2x2_8x32x1_8x32x1_1x32x1x8_8_1x1_intrawave_v3,787.9,376.28,0.0
gfx942,304,30592,2304,4096,ck,0,0,720.0703,a8w8_blockscale_1x128x128_256x128x128x128_16x16_32x32_2x2_8x32x1_8x32x1_1x32x1x8_8_1x1_intrawave_v3,801.87,382.89,0.0
gfx942,304,30720,2304,4096,ck,0,0,704.9966,a8w8_blockscale_1x128x128_256x128x128x128_16x16_32x32_2x2_8x32x1_8x32x1_1x32x1x8_8_1x1_intrawave_v3,822.44,392.66,0.0
gfx942,304,30848,2304,4096,ck,0,0,729.8228,a8w8_blockscale_1x128x128_256x128x128x128_16x16_32x32_2x2_8x32x1_8x32x1_1x32x1x8_8_1x1_intrawave_v3,797.78,380.83,0.0
gfx942,304,30976,2304,4096,ck,0,0,729.2696,a8w8_blockscale_1x128x128_256x128x128x128_16x16_32x32_2x2_8x32x1_8x32x1_1x32x1x8_8_1x1_intrawave_v3,801.7,382.65,0.0
gfx942,304,31104,2304,4096,ck,0,0,742.9605,a8w8_blockscale_1x128x128_256x128x128x128_16x16_32x32_2x2_8x32x1_8x32x1_1x32x1x8_8_1x1_intrawave_v3,790.17,377.09,0.0
gfx942,304,31232,2304,4096,ck,0,0,738.2326,a8w8_blockscale_1x128x128_256x128x128x128_16x16_32x32_2x2_8x32x1_8x32x1_1x32x1x8_8_1x1_intrawave_v3,798.51,381.02,0.0
gfx942,304,31360,2304,4096,ck,0,0,720.7119,a8w8_blockscale_1x128x128_256x128x128x128_16x16_32x32_2x2_8x32x1_8x32x1_1x32x1x8_8_1x1_intrawave_v3,821.27,391.83,0.0
gfx942,304,31488,2304,4096,ck,0,0,735.8741,a8w8_blockscale_1x128x128_256x128x128x128_16x16_32x32_2x2_8x32x1_8x32x1_1x32x1x8_8_1x1_intrawave_v3,807.63,385.27,0.0
gfx942,304,31616,2304,4096,ck,0,0,738.5093,a8w8_blockscale_1x128x128_256x128x128x128_16x16_32x32_2x2_8x32x1_8x32x1_1x32x1x8_8_1x1_intrawave_v3,808.02,385.4,0.0
gfx942,304,31744,2304,4096,ck,0,0,729.0071,a8w8_blockscale_1x128x128_256x128x128x128_16x16_32x32_2x2_8x32x1_8x32x1_1x32x1x8_8_1x1_intrawave_v3,821.87,391.95,0.0
gfx942,304,31872,2304,4096,ck,0,0,735.3451,a8w8_blockscale_1x128x128_256x128x128x128_16x16_32x32_2x2_8x32x1_8x32x1_1x32x1x8_8_1x1_intrawave_v3,818.07,390.09,0.0
gfx942,304,32000,2304,4096,ck,0,0,760.7414,a8w8_blockscale_1x128x128_256x128x128x128_16x16_32x32_2x2_8x32x1_8x32x1_1x32x1x8_8_1x1_intrawave_v3,793.94,378.53,0.0
gfx942,304,32128,2304,4096,ck,0,0,747.3525,a8w8_blockscale_1x128x128_256x128x128x128_16x16_32x32_2x2_8x32x1_8x32x1_1x32x1x8_8_1x1_intrawave_v3,811.39,386.8,0.0
gfx942,304,32256,2304,4096,ck,0,0,761.6632,a8w8_blockscale_1x128x128_256x128x128x128_16x16_32x32_2x2_8x32x1_8x32x1_1x32x1x8_8_1x1_intrawave_v3,799.32,381.0,0.0
gfx942,304,32384,2304,4096,ck,0,0,759.9953,a8w8_blockscale_1x128x128_256x128x128x128_16x16_32x32_2x2_8x32x1_8x32x1_1x32x1x8_8_1x1_intrawave_v3,804.25,383.3,0.0
gfx942,304,32512,2304,4096,ck,0,0,767.2377,a8w8_blockscale_1x128x128_256x128x128x128_16x16_32x32_2x2_8x32x1_8x32x1_1x32x1x8_8_1x1_intrawave_v3,799.81,381.14,0.0
gfx942,304,32640,2304,4096,ck,0,0,760.7739,a8w8_blockscale_1x128x128_256x128x128x128_16x16_32x32_2x2_8x32x1_8x32x1_1x32x1x8_8_1x1_intrawave_v3,809.78,385.84,0.0
gfx942,304,32768,2304,4096,ck,0,0,758.1589,a8w8_blockscale_1x128x128_256x128x128x128_16x16_32x32_2x2_8x32x1_8x32x1_1x32x1x8_8_1x1_intrawave_v3,815.76,388.64,0.0
gfx942,304,32896,2304,4096,ck,0,0,758.6362,a8w8_blockscale_1x128x128_256x128x128x128_16x16_32x32_2x2_8x32x1_8x32x1_1x32x1x8_8_1x1_intrawave_v3,818.43,389.86,0.0
gfx942,304,33024,2304,4096,ck,0,0,766.1716,a8w8_blockscale_1x128x128_256x128x128x128_16x16_32x32_2x2_8x32x1_8x32x1_1x32x1x8_8_1x1_intrawave_v3,813.53,387.48,0.0
gfx942,304,33152,2304,4096,ck,0,0,781.8479,a8w8_blockscale_1x128x128_256x128x128x128_16x16_32x32_2x2_8x32x1_8x32x1_1x32x1x8_8_1x1_intrawave_v3,800.31,381.14,0.0
gfx942,304,33280,2304,4096,ck,0,0,768.8964,a8w8_blockscale_1x128x128_256x128x128x128_16x16_32x32_2x2_8x32x1_8x32x1_1x32x1x8_8_1x1_intrawave_v3,816.94,389.01,0.0
gfx942,304,33408,2304,4096,ck,0,0,772.5227,a8w8_blockscale_1x128x128_256x128x128x128_16x16_32x32_2x2_8x32x1_8x32x1_1x32x1x8_8_1x1_intrawave_v3,816.23,388.62,0.0
gfx942,304,33536,2304,4096,ck,0,0,764.1947,a8w8_blockscale_1x128x128_256x128x128x128_16x16_32x32_2x2_8x32x1_8x32x1_1x32x1x8_8_1x1_intrawave_v3,828.28,394.32,0.0
gfx942,304,33664,2304,4096,ck,0,0,777.7641,a8w8_blockscale_1x128x128_256x128x128x128_16x16_32x32_2x2_8x32x1_8x32x1_1x32x1x8_8_1x1_intrawave_v3,816.94,388.87,0.0
gfx942,304,33792,2304,4096,ck,0,0,771.5985,a8w8_blockscale_1x128x128_256x128x128x128_16x16_32x32_2x2_8x32x1_8x32x1_1x32x1x8_8_1x1_intrawave_v3,826.6,393.42,0.0
gfx942,304,33920,2304,4096,ck,0,0,794.3086,a8w8_blockscale_1x128x128_256x128x128x128_16x16_32x32_2x2_8x32x1_8x32x1_1x32x1x8_8_1x1_intrawave_v3,806.01,383.57,0.0
gfx942,304,34048,2304,4096,ck,0,0,784.3687,a8w8_blockscale_1x128x128_256x128x128x128_16x16_32x32_2x2_8x32x1_8x32x1_1x32x1x8_8_1x1_intrawave_v3,819.3,389.86,0.0
gfx942,304,34176,2304,4096,ck,0,0,790.7808,a8w8_blockscale_1x128x128_256x128x128x128_16x16_32x32_2x2_8x32x1_8x32x1_1x32x1x8_8_1x1_intrawave_v3,815.71,388.1,0.0
gfx942,304,34304,2304,4096,ck,0,0,794.8904,a8w8_blockscale_1x128x128_256x128x128x128_16x16_32x32_2x2_8x32x1_8x32x1_1x32x1x8_8_1x1_intrawave_v3,814.54,387.5,0.0
gfx942,304,34432,2304,4096,ck,0,0,803.4697,a8w8_blockscale_1x128x128_256x128x128x128_16x16_32x32_2x2_8x32x1_8x32x1_1x32x1x8_8_1x1_intrawave_v3,808.84,384.75,0.0
gfx942,304,34560,2304,4096,ck,0,0,796.5755,a8w8_blockscale_1x128x128_256x128x128x128_16x16_32x32_2x2_8x32x1_8x32x1_1x32x1x8_8_1x1_intrawave_v3,818.88,389.48,0.0
gfx942,304,34688,2304,4096,ck,0,0,799.1023,a8w8_blockscale_1x128x128_256x128x128x128_16x16_32x32_2x2_8x32x1_8x32x1_1x32x1x8_8_1x1_intrawave_v3,819.31,389.64,0.0
gfx942,304,34816,2304,4096,ck,0,0,814.22,a8w8_blockscale_1x128x128_256x128x128x128_16x16_32x32_2x2_8x32x1_8x32x1_1x32x1x8_8_1x1_intrawave_v3,807.07,383.77,0.0
gfx942,304,34944,2304,4096,ck,0,0,820.3883,a8w8_blockscale_1x128x128_256x128x128x128_16x16_32x32_2x2_8x32x1_8x32x1_1x32x1x8_8_1x1_intrawave_v3,803.94,382.25,0.0
gfx942,304,35072,2304,4096,ck,0,0,815.1208,a8w8_blockscale_1x128x128_256x128x128x128_16x16_32x32_2x2_8x32x1_8x32x1_1x32x1x8_8_1x1_intrawave_v3,812.1,386.08,0.0
gfx942,304,35200,2304,4096,ck,0,0,827.3048,a8w8_blockscale_1x128x128_256x128x128x128_16x16_32x32_2x2_8x32x1_8x32x1_1x32x1x8_8_1x1_intrawave_v3,803.06,381.74,0.0
gfx942,304,35328,2304,4096,ck,0,0,814.9256,a8w8_blockscale_1x128x128_256x128x128x128_16x16_32x32_2x2_8x32x1_8x32x1_1x32x1x8_8_1x1_intrawave_v3,818.23,388.91,0.0
gfx942,304,35456,2304,4096,ck,0,0,841.2388,a8w8_blockscale_1x128x128_256x128x128x128_16x16_32x32_2x2_8x32x1_8x32x1_1x32x1x8_8_1x1_intrawave_v3,795.5,378.07,0.0
gfx942,304,35584,2304,4096,ck,0,0,822.1671,a8w8_blockscale_1x128x128_256x128x128x128_16x16_32x32_2x2_8x32x1_8x32x1_1x32x1x8_8_1x1_intrawave_v3,816.9,388.19,0.0
gfx942,304,35712,2304,4096,ck,0,0,818.4355,a8w8_blockscale_1x128x128_256x128x128x128_16x16_32x32_2x2_8x32x1_8x32x1_1x32x1x8_8_1x1_intrawave_v3,823.57,391.33,0.0
gfx942,304,35840,2304,4096,ck,0,0,828.8672,a8w8_blockscale_1x128x128_256x128x128x128_16x16_32x32_2x2_8x32x1_8x32x1_1x32x1x8_8_1x1_intrawave_v3,816.12,387.74,0.0
gfx942,304,35968,2304,4096,ck,0,0,848.3982,a8w8_blockscale_1x128x128_256x128x128x128_16x16_32x32_2x2_8x32x1_8x32x1_1x32x1x8_8_1x1_intrawave_v3,800.18,380.13,0.0
gfx942,304,36096,2304,4096,ck,0,0,843.37,a8w8_blockscale_1x128x128_256x128x128x128_16x16_32x32_2x2_8x32x1_8x32x1_1x32x1x8_8_1x1_intrawave_v3,807.82,383.72,0.0
gfx942,304,36224,2304,4096,ck,0,0,853.9338,a8w8_blockscale_1x128x128_256x128x128x128_16x16_32x32_2x2_8x32x1_8x32x1_1x32x1x8_8_1x1_intrawave_v3,800.65,380.28,0.0
gfx942,304,36352,2304,4096,ck,0,0,838.0241,a8w8_blockscale_1x128x128_256x128x128x128_16x16_32x32_2x2_8x32x1_8x32x1_1x32x1x8_8_1x1_intrawave_v3,818.74,388.83,0.0
gfx942,304,36480,2304,4096,ck,0,0,866.2914,a8w8_blockscale_1x128x128_256x128x128x128_16x16_32x32_2x2_8x32x1_8x32x1_1x32x1x8_8_1x1_intrawave_v3,794.81,377.42,0.0
gfx942,304,36608,2304,4096,ck,0,0,852.2095,a8w8_blockscale_1x128x128_256x128x128x128_16x16_32x32_2x2_8x32x1_8x32x1_1x32x1x8_8_1x1_intrawave_v3,810.78,384.97,0.0
gfx942,304,36736,2304,4096,ck,0,0,865.5429,a8w8_blockscale_1x128x128_256x128x128x128_16x16_32x32_2x2_8x32x1_8x32x1_1x32x1x8_8_1x1_intrawave_v3,801.08,380.32,0.0
gfx942,304,36864,2304,4096,ck,0,0,832.1778,a8w8_blockscale_1x128x128_256x128x128x128_16x16_32x32_2x2_8x32x1_8x32x1_1x32x1x8_8_1x1_intrawave_v3,836.1,396.91,0.0
gfx942,304,36992,2304,4096,ck,0,0,859.8451,a8w8_blockscale_1x128x128_256x128x128x128_16x16_32x32_2x2_8x32x1_8x32x1_1x32x1x8_8_1x1_intrawave_v3,812.01,385.44,0.0
gfx942,304,37120,2304,4096,ck,0,0,852.7613,a8w8_blockscale_1x128x128_256x128x128x128_16x16_32x32_2x2_8x32x1_8x32x1_1x32x1x8_8_1x1_intrawave_v3,821.59,389.94,0.0
gfx942,304,37248,2304,4096,ck,0,0,860.2299,a8w8_blockscale_1x128x128_256x128x128x128_16x16_32x32_2x2_8x32x1_8x32x1_1x32x1x8_8_1x1_intrawave_v3,817.26,387.85,0.0
gfx942,304,37376,2304,4096,ck,0,0,858.9803,a8w8_blockscale_1x128x128_256x128x128x128_16x16_32x32_2x2_8x32x1_8x32x1_1x32x1x8_8_1x1_intrawave_v3,821.26,389.72,0.0
gfx942,304,37504,2304,4096,ck,0,0,881.0054,a8w8_blockscale_1x128x128_256x128x128x128_16x16_32x32_2x2_8x32x1_8x32x1_1x32x1x8_8_1x1_intrawave_v3,803.47,381.24,0.0
gfx942,304,37632,2304,4096,ck,0,0,882.1133,a8w8_blockscale_1x128x128_256x128x128x128_16x16_32x32_2x2_8x32x1_8x32x1_1x32x1x8_8_1x1_intrawave_v3,805.2,382.02,0.0
gfx942,304,37760,2304,4096,ck,0,0,869.6661,a8w8_blockscale_1x128x128_256x128x128x128_16x16_32x32_2x2_8x32x1_8x32x1_1x32x1x8_8_1x1_intrawave_v3,819.51,388.77,0.0
gfx942,304,37888,2304,4096,ck,0,0,887.2597,a8w8_blockscale_1x128x128_256x128x128x128_16x16_32x32_2x2_8x32x1_8x32x1_1x32x1x8_8_1x1_intrawave_v3,805.98,382.32,0.0
gfx942,304,38016,2304,4096,ck,0,0,889.0221,a8w8_blockscale_1x128x128_256x128x128x128_16x16_32x32_2x2_8x32x1_8x32x1_1x32x1x8_8_1x1_intrawave_v3,807.1,382.81,0.0
gfx942,304,38144,2304,4096,ck,0,0,893.7252,a8w8_blockscale_1x128x128_256x128x128x128_16x16_32x32_2x2_8x32x1_8x32x1_1x32x1x8_8_1x1_intrawave_v3,805.55,382.04,0.0
gfx942,304,38272,2304,4096,ck,0,0,892.3031,a8w8_blockscale_1x128x128_256x128x128x128_16x16_32x32_2x2_8x32x1_8x32x1_1x32x1x8_8_1x1_intrawave_v3,809.55,383.9,0.0
gfx942,304,38400,2304,4096,ck,0,0,880.2635,a8w8_blockscale_1x128x128_256x128x128x128_16x16_32x32_2x2_8x32x1_8x32x1_1x32x1x8_8_1x1_intrawave_v3,823.36,390.42,0.0
gfx942,304,38528,2304,4096,ck,0,0,897.3199,a8w8_blockscale_1x128x128_256x128x128x128_16x16_32x32_2x2_8x32x1_8x32x1_1x32x1x8_8_1x1_intrawave_v3,810.4,384.24,0.0
gfx942,304,38656,2304,4096,ck,0,0,904.0342,a8w8_blockscale_1x128x128_256x128x128x128_16x16_32x32_2x2_8x32x1_8x32x1_1x32x1x8_8_1x1_intrawave_v3,807.06,382.62,0.0
gfx942,304,38784,2304,4096,ck,0,0,886.414,a8w8_blockscale_1x128x128_256x128x128x128_16x16_32x32_2x2_8x32x1_8x32x1_1x32x1x8_8_1x1_intrawave_v3,825.83,391.48,0.0
gfx942,304,38912,2304,4096,ck,0,0,885.6645,a8w8_blockscale_1x128x128_256x128x128x128_16x16_32x32_2x2_8x32x1_8x32x1_1x32x1x8_8_1x1_intrawave_v3,829.25,393.07,0.0
gfx942,304,39040,2304,4096,ck,0,0,906.5448,a8w8_blockscale_1x128x128_256x128x128x128_16x16_32x32_2x2_8x32x1_8x32x1_1x32x1x8_8_1x1_intrawave_v3,812.82,385.24,0.0
gfx942,304,39168,2304,4096,ck,0,0,916.6295,a8w8_blockscale_1x128x128_256x128x128x128_16x16_32x32_2x2_8x32x1_8x32x1_1x32x1x8_8_1x1_intrawave_v3,806.51,382.22,0.0
gfx942,304,39296,2304,4096,ck,0,0,906.0465,a8w8_blockscale_1x128x128_256x128x128x128_16x16_32x32_2x2_8x32x1_8x32x1_1x32x1x8_8_1x1_intrawave_v3,818.6,387.92,0.0
gfx942,304,39424,2304,4096,ck,0,0,907.0128,a8w8_blockscale_1x128x128_256x128x128x128_16x16_32x32_2x2_8x32x1_8x32x1_1x32x1x8_8_1x1_intrawave_v3,820.39,388.73,0.0
gfx942,304,39552,2304,4096,ck,0,0,912.9092,a8w8_blockscale_1x128x128_256x128x128x128_16x16_32x32_2x2_8x32x1_8x32x1_1x32x1x8_8_1x1_intrawave_v3,817.74,387.44,0.0
gfx942,304,39680,2304,4096,ck,0,0,933.7595,a8w8_blockscale_1x128x128_256x128x128x128_16x16_32x32_2x2_8x32x1_8x32x1_1x32x1x8_8_1x1_intrawave_v3,802.06,379.98,0.0
gfx942,304,39808,2304,4096,ck,0,0,917.0148,a8w8_blockscale_1x128x128_256x128x128x128_16x16_32x32_2x2_8x32x1_8x32x1_1x32x1x8_8_1x1_intrawave_v3,819.34,388.14,0.0
gfx942,304,39936,2304,4096,ck,0,0,940.6088,a8w8_blockscale_1x128x128_256x128x128x128_16x16_32x32_2x2_8x32x1_8x32x1_1x32x1x8_8_1x1_intrawave_v3,801.36,379.58,0.0
gfx942,304,40064,2304,4096,ck,0,0,919.6642,a8w8_blockscale_1x128x128_256x128x128x128_16x16_32x32_2x2_8x32x1_8x32x1_1x32x1x8_8_1x1_intrawave_v3,822.24,389.44,0.0
gfx942,304,40192,2304,4096,ck,0,0,919.8839,a8w8_blockscale_1x128x128_256x128x128x128_16x16_32x32_2x2_8x32x1_8x32x1_1x32x1x8_8_1x1_intrawave_v3,824.67,390.56,0.0
gfx942,304,40320,2304,4096,ck,0,0,954.5614,a8w8_blockscale_1x128x128_256x128x128x128_16x16_32x32_2x2_8x32x1_8x32x1_1x32x1x8_8_1x1_intrawave_v3,797.24,377.54,0.0
gfx942,304,40448,2304,4096,ck,0,0,952.6291,a8w8_blockscale_1x128x128_256x128x128x128_16x16_32x32_2x2_8x32x1_8x32x1_1x32x1x8_8_1x1_intrawave_v3,801.39,379.47,0.0
gfx942,304,40576,2304,4096,ck,0,0,934.0358,a8w8_blockscale_1x128x128_256x128x128x128_16x16_32x32_2x2_8x32x1_8x32x1_1x32x1x8_8_1x1_intrawave_v3,819.93,388.22,0.0
gfx942,304,40704,2304,4096,ck,0,0,929.9255,a8w8_blockscale_1x128x128_256x128x128x128_16x16_32x32_2x2_8x32x1_8x32x1_1x32x1x8_8_1x1_intrawave_v3,826.15,391.13,0.0
gfx942,304,40832,2304,4096,ck,0,0,951.7803,a8w8_blockscale_1x128x128_256x128x128x128_16x16_32x32_2x2_8x32x1_8x32x1_1x32x1x8_8_1x1_intrawave_v3,809.72,383.32,0.0
gfx942,304,40960,2304,4096,ck,0,0,943.5465,a8w8_blockscale_1x128x128_256x128x128x128_16x16_32x32_2x2_8x32x1_8x32x1_1x32x1x8_8_1x1_intrawave_v3,819.35,387.85,0.0
gfx942,304,41088,2304,4096,ck,0,0,961.6143,a8w8_blockscale_1x128x128_256x128x128x128_16x16_32x32_2x2_8x32x1_8x32x1_1x32x1x8_8_1x1_intrawave_v3,806.47,381.72,0.0
gfx942,304,41216,2304,4096,ck,0,0,974.6185,a8w8_blockscale_1x128x128_256x128x128x128_16x16_32x32_2x2_8x32x1_8x32x1_1x32x1x8_8_1x1_intrawave_v3,798.19,377.77,0.0
gfx942,304,41344,2304,4096,ck,0,0,971.4501,a8w8_blockscale_1x128x128_256x128x128x128_16x16_32x32_2x2_8x32x1_8x32x1_1x32x1x8_8_1x1_intrawave_v3,803.28,380.15,0.0
gfx942,304,41472,2304,4096,ck,0,0,955.5868,a8w8_blockscale_1x128x128_256x128x128x128_16x16_32x32_2x2_8x32x1_8x32x1_1x32x1x8_8_1x1_intrawave_v3,819.14,387.63,0.0
gfx942,304,41600,2304,4096,ck,0,0,984.3527,a8w8_blockscale_1x128x128_256x128x128x128_16x16_32x32_2x2_8x32x1_8x32x1_1x32x1x8_8_1x1_intrawave_v3,797.65,377.43,0.0
gfx942,304,41728,2304,4096,ck,0,0,972.3288,a8w8_blockscale_1x128x128_256x128x128x128_16x16_32x32_2x2_8x32x1_8x32x1_1x32x1x8_8_1x1_intrawave_v3,810.0,383.24,0.0
gfx942,304,41856,2304,4096,ck,0,0,978.3897,a8w8_blockscale_1x128x128_256x128x128x128_16x16_32x32_2x2_8x32x1_8x32x1_1x32x1x8_8_1x1_intrawave_v3,807.45,382.01,0.0
gfx942,304,41984,2304,4096,ck,0,0,959.5435,a8w8_blockscale_1x128x128_256x128x128x128_16x16_32x32_2x2_8x32x1_8x32x1_1x32x1x8_8_1x1_intrawave_v3,825.83,390.67,0.0
gfx942,304,42112,2304,4096,ck,0,0,966.6584,a8w8_blockscale_1x128x128_256x128x128x128_16x16_32x32_2x2_8x32x1_8x32x1_1x32x1x8_8_1x1_intrawave_v3,822.25,388.95,0.0
gfx942,304,42240,2304,4096,ck,0,0,986.694,a8w8_blockscale_1x128x128_256x128x128x128_16x16_32x32_2x2_8x32x1_8x32x1_1x32x1x8_8_1x1_intrawave_v3,808.0,382.18,0.0
gfx942,304,42368,2304,4096,ck,0,0,972.6887,a8w8_blockscale_1x128x128_256x128x128x128_16x16_32x32_2x2_8x32x1_8x32x1_1x32x1x8_8_1x1_intrawave_v3,822.12,388.83,0.0
gfx942,304,42496,2304,4096,ck,0,0,1001.1761,a8w8_blockscale_1x128x128_256x128x128x128_16x16_32x32_2x2_8x32x1_8x32x1_1x32x1x8_8_1x1_intrawave_v3,801.14,378.88,0.0
gfx942,304,42624,2304,4096,ck,0,0,977.9112,a8w8_blockscale_1x128x128_256x128x128x128_16x16_32x32_2x2_8x32x1_8x32x1_1x32x1x8_8_1x1_intrawave_v3,822.67,389.03,0.0
gfx942,304,42752,2304,4096,ck,0,0,982.5363,a8w8_blockscale_1x128x128_256x128x128x128_16x16_32x32_2x2_8x32x1_8x32x1_1x32x1x8_8_1x1_intrawave_v3,821.26,388.33,0.0
gfx942,304,42880,2304,4096,ck,0,0,979.1043,a8w8_blockscale_1x128x128_256x128x128x128_16x16_32x32_2x2_8x32x1_8x32x1_1x32x1x8_8_1x1_intrawave_v3,826.61,390.83,0.0
gfx942,304,43008,2304,4096,ck,0,0,1001.6072,a8w8_blockscale_1x128x128_256x128x128x128_16x16_32x32_2x2_8x32x1_8x32x1_1x32x1x8_8_1x1_intrawave_v3,810.45,383.16,0.0
gfx942,304,43136,2304,4096,ck,0,0,991.2805,a8w8_blockscale_1x128x128_256x128x128x128_16x16_32x32_2x2_8x32x1_8x32x1_1x32x1x8_8_1x1_intrawave_v3,821.33,388.28,0.0
gfx942,304,43264,2304,4096,ck,0,0,992.1812,a8w8_blockscale_1x128x128_256x128x128x128_16x16_32x32_2x2_8x32x1_8x32x1_1x32x1x8_8_1x1_intrawave_v3,823.02,389.05,0.0
gfx942,304,43392,2304,4096,ck,0,0,1021.645,a8w8_blockscale_1x128x128_256x128x128x128_16x16_32x32_2x2_8x32x1_8x32x1_1x32x1x8_8_1x1_intrawave_v3,801.64,378.92,0.0
gfx942,304,43520,2304,4096,ck,0,0,1014.7691,a8w8_blockscale_1x128x128_256x128x128x128_16x16_32x32_2x2_8x32x1_8x32x1_1x32x1x8_8_1x1_intrawave_v3,809.46,382.58,0.0
gfx942,304,43648,2304,4096,ck,0,0,1031.2334,a8w8_blockscale_1x128x128_256x128x128x128_16x16_32x32_2x2_8x32x1_8x32x1_1x32x1x8_8_1x1_intrawave_v3,798.88,377.56,0.0
gfx942,304,43776,2304,4096,ck,0,0,1001.8984,a8w8_blockscale_1x128x128_256x128x128x128_16x16_32x32_2x2_8x32x1_8x32x1_1x32x1x8_8_1x1_intrawave_v3,824.68,389.72,0.0
gfx942,304,43904,2304,4096,ck,0,0,1001.0876,a8w8_blockscale_1x128x128_256x128x128x128_16x16_32x32_2x2_8x32x1_8x32x1_1x32x1x8_8_1x1_intrawave_v3,827.76,391.15,0.0
gfx942,304,44032,2304,4096,ck,0,0,1003.8655,a8w8_blockscale_1x128x128_256x128x128x128_16x16_32x32_2x2_8x32x1_8x32x1_1x32x1x8_8_1x1_intrawave_v3,827.88,391.18,0.0
gfx942,304,44160,2304,4096,ck,0,0,1000.2151,a8w8_blockscale_1x128x128_256x128x128x128_16x16_32x32_2x2_8x32x1_8x32x1_1x32x1x8_8_1x1_intrawave_v3,833.31,393.72,0.0
gfx942,304,44288,2304,4096,ck,0,0,1023.2435,a8w8_blockscale_1x128x128_256x128x128x128_16x16_32x32_2x2_8x32x1_8x32x1_1x32x1x8_8_1x1_intrawave_v3,816.92,385.95,0.0
gfx942,304,44416,2304,4096,ck,0,0,1036.9894,a8w8_blockscale_1x128x128_256x128x128x128_16x16_32x32_2x2_8x32x1_8x32x1_1x32x1x8_8_1x1_intrawave_v3,808.42,381.91,0.0
gfx942,304,44544,2304,4096,ck,0,0,1027.4059,a8w8_blockscale_1x128x128_256x128x128x128_16x16_32x32_2x2_8x32x1_8x32x1_1x32x1x8_8_1x1_intrawave_v3,818.31,386.55,0.0
gfx942,304,44672,2304,4096,ck,0,0,1042.4355,a8w8_blockscale_1x128x128_256x128x128x128_16x16_32x32_2x2_8x32x1_8x32x1_1x32x1x8_8_1x1_intrawave_v3,808.83,382.05,0.0
gfx942,304,44800,2304,4096,ck,0,0,1043.69,a8w8_blockscale_1x128x128_256x128x128x128_16x16_32x32_2x2_8x32x1_8x32x1_1x32x1x8_8_1x1_intrawave_v3,810.18,382.66,0.0
gfx942,304,44928,2304,4096,ck,0,0,1016.3381,a8w8_blockscale_1x128x128_256x128x128x128_16x16_32x32_2x2_8x32x1_8x32x1_1x32x1x8_8_1x1_intrawave_v3,834.36,394.05,0.0
gfx942,304,45056,2304,4096,ck,0,0,1008.9482,a8w8_blockscale_1x128x128_256x128x128x128_16x16_32x32_2x2_8x32x1_8x32x1_1x32x1x8_8_1x1_intrawave_v3,842.86,398.04,0.0
gfx942,304,45184,2304,4096,ck,0,0,1027.4983,a8w8_blockscale_1x128x128_256x128x128x128_16x16_32x32_2x2_8x32x1_8x32x1_1x32x1x8_8_1x1_intrawave_v3,830.0,391.94,0.0
gfx942,304,45312,2304,4096,ck,0,0,1030.1812,a8w8_blockscale_1x128x128_256x128x128x128_16x16_32x32_2x2_8x32x1_8x32x1_1x32x1x8_8_1x1_intrawave_v3,830.18,392.0,0.0
gfx942,304,45440,2304,4096,ck,0,0,1049.9617,a8w8_blockscale_1x128x128_256x128x128x128_16x16_32x32_2x2_8x32x1_8x32x1_1x32x1x8_8_1x1_intrawave_v3,816.84,385.68,0.0
gfx942,304,45568,2304,4096,ck,0,0,1062.9866,a8w8_blockscale_1x128x128_256x128x128x128_16x16_32x32_2x2_8x32x1_8x32x1_1x32x1x8_8_1x1_intrawave_v3,809.1,382.0,0.0
gfx942,304,45696,2304,4096,ck,0,0,1058.9567,a8w8_blockscale_1x128x128_256x128x128x128_16x16_32x32_2x2_8x32x1_8x32x1_1x32x1x8_8_1x1_intrawave_v3,814.46,384.51,0.0
gfx942,304,45824,2304,4096,ck,0,0,1039.9114,a8w8_blockscale_1x128x128_256x128x128x128_16x16_32x32_2x2_8x32x1_8x32x1_1x32x1x8_8_1x1_intrawave_v3,831.7,392.62,0.0
gfx942,304,45952,2304,4096,ck,0,0,1070.3563,a8w8_blockscale_1x128x128_256x128x128x128_16x16_32x32_2x2_8x32x1_8x32x1_1x32x1x8_8_1x1_intrawave_v3,810.3,382.49,0.0
gfx942,304,46080,2304,4096,ck,0,0,1047.6284,a8w8_blockscale_1x128x128_256x128x128x128_16x16_32x32_2x2_8x32x1_8x32x1_1x32x1x8_8_1x1_intrawave_v3,830.19,391.85,0.0
gfx942,304,46208,2304,4096,ck,0,0,1060.8245,a8w8_blockscale_1x128x128_256x128x128x128_16x16_32x32_2x2_8x32x1_8x32x1_1x32x1x8_8_1x1_intrawave_v3,822.14,388.03,0.0
gfx942,304,46336,2304,4096,ck,0,0,1051.0724,a8w8_blockscale_1x128x128_256x128x128x128_16x16_32x32_2x2_8x32x1_8x32x1_1x32x1x8_8_1x1_intrawave_v3,832.07,392.69,0.0
gfx942,304,46464,2304,4096,ck,0,0,1075.7965,a8w8_blockscale_1x128x128_256x128x128x128_16x16_32x32_2x2_8x32x1_8x32x1_1x32x1x8_8_1x1_intrawave_v3,815.19,384.7,0.0
gfx942,304,46592,2304,4096,ck,0,0,1080.9756,a8w8_blockscale_1x128x128_256x128x128x128_16x16_32x32_2x2_8x32x1_8x32x1_1x32x1x8_8_1x1_intrawave_v3,813.52,383.89,0.0
gfx942,304,46720,2304,4096,ck,0,0,1073.2552,a8w8_blockscale_1x128x128_256x128x128x128_16x16_32x32_2x2_8x32x1_8x32x1_1x32x1x8_8_1x1_intrawave_v3,821.62,387.69,0.0
gfx942,304,46848,2304,4096,ck,0,0,1053.4403,a8w8_blockscale_1x128x128_256x128x128x128_16x16_32x32_2x2_8x32x1_8x32x1_1x32x1x8_8_1x1_intrawave_v3,839.37,396.04,0.0
gfx942,304,46976,2304,4096,ck,0,0,1091.7189,a8w8_blockscale_1x128x128_256x128x128x128_16x16_32x32_2x2_8x32x1_8x32x1_1x32x1x8_8_1x1_intrawave_v3,812.15,383.17,0.0
gfx942,304,47104,2304,4096,ck,0,0,1094.0287,a8w8_blockscale_1x128x128_256x128x128x128_16x16_32x32_2x2_8x32x1_8x32x1_1x32x1x8_8_1x1_intrawave_v3,812.65,383.38,0.0
gfx942,304,47232,2304,4096,ck,0,0,1090.1095,a8w8_blockscale_1x128x128_256x128x128x128_16x16_32x32_2x2_8x32x1_8x32x1_1x32x1x8_8_1x1_intrawave_v3,817.78,385.78,0.0
gfx942,304,47360,2304,4096,ck,0,0,1095.6671,a8w8_blockscale_1x128x128_256x128x128x128_16x16_32x32_2x2_8x32x1_8x32x1_1x32x1x8_8_1x1_intrawave_v3,815.84,384.84,0.0
gfx942,304,47488,2304,4096,ck,0,0,1095.1458,a8w8_blockscale_1x128x128_256x128x128x128_16x16_32x32_2x2_8x32x1_8x32x1_1x32x1x8_8_1x1_intrawave_v3,818.44,386.04,0.0
gfx942,304,47616,2304,4096,ck,0,0,1079.8138,a8w8_blockscale_1x128x128_256x128x128x128_16x16_32x32_2x2_8x32x1_8x32x1_1x32x1x8_8_1x1_intrawave_v3,832.29,392.56,0.0
gfx942,304,47744,2304,4096,ck,0,0,1096.0705,a8w8_blockscale_1x128x128_256x128x128x128_16x16_32x32_2x2_8x32x1_8x32x1_1x32x1x8_8_1x1_intrawave_v3,822.15,387.75,0.0
gfx942,304,47872,2304,4096,ck,0,0,1121.8486,a8w8_blockscale_1x128x128_256x128x128x128_16x16_32x32_2x2_8x32x1_8x32x1_1x32x1x8_8_1x1_intrawave_v3,805.42,379.83,0.0
gfx942,304,48000,2304,4096,ck,0,0,1092.7343,a8w8_blockscale_1x128x128_256x128x128x128_16x16_32x32_2x2_8x32x1_8x32x1_1x32x1x8_8_1x1_intrawave_v3,829.09,390.97,0.0
gfx942,304,48128,2304,4096,ck,0,0,1094.1598,a8w8_blockscale_1x128x128_256x128x128x128_16x16_32x32_2x2_8x32x1_8x32x1_1x32x1x8_8_1x1_intrawave_v3,830.21,391.48,0.0
gfx942,304,48256,2304,4096,ck,0,0,1093.0873,a8w8_blockscale_1x128x128_256x128x128x128_16x16_32x32_2x2_8x32x1_8x32x1_1x32x1x8_8_1x1_intrawave_v3,833.24,392.88,0.0
gfx942,304,48384,2304,4096,ck,0,0,1119.6111,a8w8_blockscale_1x128x128_256x128x128x128_16x16_32x32_2x2_8x32x1_8x32x1_1x32x1x8_8_1x1_intrawave_v3,815.66,384.57,0.0
gfx942,304,48512,2304,4096,ck,0,0,1130.9223,a8w8_blockscale_1x128x128_256x128x128x128_16x16_32x32_2x2_8x32x1_8x32x1_1x32x1x8_8_1x1_intrawave_v3,809.63,381.71,0.0
gfx942,304,48640,2304,4096,ck,0,0,1140.5081,a8w8_blockscale_1x128x128_256x128x128x128_16x16_32x32_2x2_8x32x1_8x32x1_1x32x1x8_8_1x1_intrawave_v3,804.95,379.48,0.0
gfx942,304,48768,2304,4096,ck,0,0,1132.6539,a8w8_blockscale_1x128x128_256x128x128x128_16x16_32x32_2x2_8x32x1_8x32x1_1x32x1x8_8_1x1_intrawave_v3,812.66,383.09,0.0
gfx942,304,48896,2304,4096,ck,0,0,1130.7426,a8w8_blockscale_1x128x128_256x128x128x128_16x16_32x32_2x2_8x32x1_8x32x1_1x32x1x8_8_1x1_intrawave_v3,816.17,384.73,0.0
gfx942,304,49024,2304,4096,ck,0,0,1116.7701,a8w8_blockscale_1x128x128_256x128x128x128_16x16_32x32_2x2_8x32x1_8x32x1_1x32x1x8_8_1x1_intrawave_v3,828.55,390.54,0.0
gfx942,304,49152,2304,4096,ck,0,0,1105.386,a8w8_blockscale_1x128x128_256x128x128x128_16x16_32x32_2x2_8x32x1_8x32x1_1x32x1x8_8_1x1_intrawave_v3,839.27,395.57,0.0
gfx942,304,49280,2304,4096,ck,0,0,1146.9412,a8w8_blockscale_1x128x128_256x128x128x128_16x16_32x32_2x2_8x32x1_8x32x1_1x32x1x8_8_1x1_intrawave_v3,810.96,382.21,0.0
gfx942,304,49408,2304,4096,ck,0,0,1137.7073,a8w8_blockscale_1x128x128_256x128x128x128_16x16_32x32_2x2_8x32x1_8x32x1_1x32x1x8_8_1x1_intrawave_v3,819.67,386.29,0.0
gfx942,304,49536,2304,4096,ck,0,0,1158.0204,a8w8_blockscale_1x128x128_256x128x128x128_16x16_32x32_2x2_8x32x1_8x32x1_1x32x1x8_8_1x1_intrawave_v3,807.38,380.48,0.0
gfx942,304,49664,2304,4096,ck,0,0,1158.245,a8w8_blockscale_1x128x128_256x128x128x128_16x16_32x32_2x2_8x32x1_8x32x1_1x32x1x8_8_1x1_intrawave_v3,809.31,381.36,0.0
gfx942,304,49792,2304,4096,ck,0,0,1157.6351,a8w8_blockscale_1x128x128_256x128x128x128_16x16_32x32_2x2_8x32x1_8x32x1_1x32x1x8_8_1x1_intrawave_v3,811.82,382.53,0.0
gfx942,304,49920,2304,4096,ck,0,0,1136.7934,a8w8_blockscale_1x128x128_256x128x128x128_16x16_32x32_2x2_8x32x1_8x32x1_1x32x1x8_8_1x1_intrawave_v3,828.83,390.52,0.0
gfx942,304,50048,2304,4096,ck,0,0,1162.2739,a8w8_blockscale_1x128x128_256x128x128x128_16x16_32x32_2x2_8x32x1_8x32x1_1x32x1x8_8_1x1_intrawave_v3,812.74,382.92,0.0
gfx942,304,50176,2304,4096,ck,0,0,1140.9078,a8w8_blockscale_1x128x128_256x128x128x128_16x16_32x32_2x2_8x32x1_8x32x1_1x32x1x8_8_1x1_intrawave_v3,830.08,391.06,0.0
gfx942,304,50304,2304,4096,ck,0,0,1156.1158,a8w8_blockscale_1x128x128_256x128x128x128_16x16_32x32_2x2_8x32x1_8x32x1_1x32x1x8_8_1x1_intrawave_v3,821.25,386.88,0.0
gfx942,304,50432,2304,4096,ck,0,0,1156.3837,a8w8_blockscale_1x128x128_256x128x128x128_16x16_32x32_2x2_8x32x1_8x32x1_1x32x1x8_8_1x1_intrawave_v3,823.15,387.76,0.0
gfx942,304,50560,2304,4096,ck,0,0,1158.4288,a8w8_blockscale_1x128x128_256x128x128x128_16x16_32x32_2x2_8x32x1_8x32x1_1x32x1x8_8_1x1_intrawave_v3,823.78,388.04,0.0
gfx942,304,50688,2304,4096,ck,0,0,1152.7759,a8w8_blockscale_1x128x128_256x128x128x128_16x16_32x32_2x2_8x32x1_8x32x1_1x32x1x8_8_1x1_intrawave_v3,829.91,390.9,0.0
gfx942,304,50816,2304,4096,ck,0,0,1162.1742,a8w8_blockscale_1x128x128_256x128x128x128_16x16_32x32_2x2_8x32x1_8x32x1_1x32x1x8_8_1x1_intrawave_v3,825.28,388.7,0.0
gfx942,304,50944,2304,4096,ck,0,0,1162.2848,a8w8_blockscale_1x128x128_256x128x128x128_16x16_32x32_2x2_8x32x1_8x32x1_1x32x1x8_8_1x1_intrawave_v3,827.28,389.62,0.0
gfx942,304,51072,2304,4096,ck,0,0,1175.6227,a8w8_blockscale_1x128x128_256x128x128x128_16x16_32x32_2x2_8x32x1_8x32x1_1x32x1x8_8_1x1_intrawave_v3,819.95,386.15,0.0
gfx942,304,51200,2304,4096,ck,0,0,1175.9389,a8w8_blockscale_1x128x128_256x128x128x128_16x16_32x32_2x2_8x32x1_8x32x1_1x32x1x8_8_1x1_intrawave_v3,821.78,386.99,0.0
gfx942,304,51328,2304,4096,ck,0,0,1178.3179,a8w8_blockscale_1x128x128_256x128x128x128_16x16_32x32_2x2_8x32x1_8x32x1_1x32x1x8_8_1x1_intrawave_v3,822.18,387.16,0.0
gfx942,304,51456,2304,4096,ck,0,0,1180.3886,a8w8_blockscale_1x128x128_256x128x128x128_16x16_32x32_2x2_8x32x1_8x32x1_1x32x1x8_8_1x1_intrawave_v3,822.78,387.42,0.0
gfx942,304,51584,2304,4096,ck,0,0,1171.7591,a8w8_blockscale_1x128x128_256x128x128x128_16x16_32x32_2x2_8x32x1_8x32x1_1x32x1x8_8_1x1_intrawave_v3,830.9,391.23,0.0
gfx942,304,51712,2304,4096,ck,0,0,1198.1157,a8w8_blockscale_1x128x128_256x128x128x128_16x16_32x32_2x2_8x32x1_8x32x1_1x32x1x8_8_1x1_intrawave_v3,814.64,383.55,0.0
gfx942,304,51840,2304,4096,ck,0,0,1214.2372,a8w8_blockscale_1x128x128_256x128x128x128_16x16_32x32_2x2_8x32x1_8x32x1_1x32x1x8_8_1x1_intrawave_v3,805.81,379.38,0.0
gfx942,304,51968,2304,4096,ck,0,0,1220.6509,a8w8_blockscale_1x128x128_256x128x128x128_16x16_32x32_2x2_8x32x1_8x32x1_1x32x1x8_8_1x1_intrawave_v3,803.56,378.3,0.0
gfx942,304,52096,2304,4096,ck,0,0,1208.3264,a8w8_blockscale_1x128x128_256x128x128x128_16x16_32x32_2x2_8x32x1_8x32x1_1x32x1x8_8_1x1_intrawave_v3,813.75,383.08,0.0
gfx942,304,52224,2304,4096,ck,0,0,1185.1164,a8w8_blockscale_1x128x128_256x128x128x128_16x16_32x32_2x2_8x32x1_8x32x1_1x32x1x8_8_1x1_intrawave_v3,831.73,391.52,0.0
gfx942,304,52352,2304,4096,ck,0,0,1193.867,a8w8_blockscale_1x128x128_256x128x128x128_16x16_32x32_2x2_8x32x1_8x32x1_1x32x1x8_8_1x1_intrawave_v3,827.66,389.58,0.0
gfx942,304,52480,2304,4096,ck,0,0,1201.6798,a8w8_blockscale_1x128x128_256x128x128x128_16x16_32x32_2x2_8x32x1_8x32x1_1x32x1x8_8_1x1_intrawave_v3,824.29,387.98,0.0
gfx942,304,52608,2304,4096,ck,0,0,1199.6159,a8w8_blockscale_1x128x128_256x128x128x128_16x16_32x32_2x2_8x32x1_8x32x1_1x32x1x8_8_1x1_intrawave_v3,827.72,389.57,0.0
gfx942,304,52736,2304,4096,ck,0,0,1205.9022,a8w8_blockscale_1x128x128_256x128x128x128_16x16_32x32_2x2_8x32x1_8x32x1_1x32x1x8_8_1x1_intrawave_v3,825.41,388.47,0.0
gfx942,304,52864,2304,4096,ck,0,0,1223.079,a8w8_blockscale_1x128x128_256x128x128x128_16x16_32x32_2x2_8x32x1_8x32x1_1x32x1x8_8_1x1_intrawave_v3,815.79,383.92,0.0
gfx942,304,52992,2304,4096,ck,0,0,1244.4652,a8w8_blockscale_1x128x128_256x128x128x128_16x16_32x32_2x2_8x32x1_8x32x1_1x32x1x8_8_1x1_intrawave_v3,803.71,378.22,0.0
gfx942,304,53120,2304,4096,ck,0,0,1209.9024,a8w8_blockscale_1x128x128_256x128x128x128_16x16_32x32_2x2_8x32x1_8x32x1_1x32x1x8_8_1x1_intrawave_v3,828.67,389.94,0.0
gfx942,304,53248,2304,4096,ck,0,0,1228.7045,a8w8_blockscale_1x128x128_256x128x128x128_16x16_32x32_2x2_8x32x1_8x32x1_1x32x1x8_8_1x1_intrawave_v3,817.95,384.88,0.0
gfx942,304,53376,2304,4096,ck,0,0,1250.6655,a8w8_blockscale_1x128x128_256x128x128x128_16x16_32x32_2x2_8x32x1_8x32x1_1x32x1x8_8_1x1_intrawave_v3,805.52,379.02,0.0
gfx942,304,53504,2304,4096,ck,0,0,1249.6573,a8w8_blockscale_1x128x128_256x128x128x128_16x16_32x32_2x2_8x32x1_8x32x1_1x32x1x8_8_1x1_intrawave_v3,808.1,380.21,0.0
gfx942,304,53632,2304,4096,ck,0,0,1218.4901,a8w8_blockscale_1x128x128_256x128x128x128_16x16_32x32_2x2_8x32x1_8x32x1_1x32x1x8_8_1x1_intrawave_v3,830.76,390.85,0.0
gfx942,304,53760,2304,4096,ck,0,0,1245.2144,a8w8_blockscale_1x128x128_256x128x128x128_16x16_32x32_2x2_8x32x1_8x32x1_1x32x1x8_8_1x1_intrawave_v3,814.87,383.36,0.0
gfx942,304,53888,2304,4096,ck,0,0,1247.0652,a8w8_blockscale_1x128x128_256x128x128x128_16x16_32x32_2x2_8x32x1_8x32x1_1x32x1x8_8_1x1_intrawave_v3,815.6,383.68,0.0
gfx942,304,54016,2304,4096,ck,0,0,1223.2462,a8w8_blockscale_1x128x128_256x128x128x128_16x16_32x32_2x2_8x32x1_8x32x1_1x32x1x8_8_1x1_intrawave_v3,833.45,392.07,0.0
gfx942,304,54144,2304,4096,ck,0,0,1228.9514,a8w8_blockscale_1x128x128_256x128x128x128_16x16_32x32_2x2_8x32x1_8x32x1_1x32x1x8_8_1x1_intrawave_v3,831.55,391.15,0.0
gfx942,304,54272,2304,4096,ck,0,0,1254.415,a8w8_blockscale_1x128x128_256x128x128x128_16x16_32x32_2x2_8x32x1_8x32x1_1x32x1x8_8_1x1_intrawave_v3,816.6,384.1,0.0
gfx942,304,54400,2304,4096,ck,0,0,1230.511,a8w8_blockscale_1x128x128_256x128x128x128_16x16_32x32_2x2_8x32x1_8x32x1_1x32x1x8_8_1x1_intrawave_v3,834.42,392.47,0.0
gfx942,304,54528,2304,4096,ck,0,0,1258.1149,a8w8_blockscale_1x128x128_256x128x128x128_16x16_32x32_2x2_8x32x1_8x32x1_1x32x1x8_8_1x1_intrawave_v3,818.03,384.74,0.0
gfx942,304,54656,2304,4096,ck,0,0,1249.6773,a8w8_blockscale_1x128x128_256x128x128x128_16x16_32x32_2x2_8x32x1_8x32x1_1x32x1x8_8_1x1_intrawave_v3,825.49,388.23,0.0
gfx942,304,54784,2304,4096,ck,0,0,1238.6446,a8w8_blockscale_1x128x128_256x128x128x128_16x16_32x32_2x2_8x32x1_8x32x1_1x32x1x8_8_1x1_intrawave_v3,834.79,392.59,0.0
gfx942,304,54912,2304,4096,ck,0,0,1276.1806,a8w8_blockscale_1x128x128_256x128x128x128_16x16_32x32_2x2_8x32x1_8x32x1_1x32x1x8_8_1x1_intrawave_v3,812.13,381.91,0.0
gfx942,304,55040,2304,4096,ck,0,0,1277.3424,a8w8_blockscale_1x128x128_256x128x128x128_16x16_32x32_2x2_8x32x1_8x32x1_1x32x1x8_8_1x1_intrawave_v3,813.29,382.44,0.0
gfx942,304,55168,2304,4096,ck,0,0,1291.5314,a8w8_blockscale_1x128x128_256x128x128x128_16x16_32x32_2x2_8x32x1_8x32x1_1x32x1x8_8_1x1_intrawave_v3,806.22,379.1,0.0
gfx942,304,55296,2304,4096,ck,0,0,1233.2056,a8w8_blockscale_1x128x128_256x128x128x128_16x16_32x32_2x2_8x32x1_8x32x1_1x32x1x8_8_1x1_intrawave_v3,846.31,397.93,0.0
gfx942,304,55424,2304,4096,ck,0,0,1259.0213,a8w8_blockscale_1x128x128_256x128x128x128_16x16_32x32_2x2_8x32x1_8x32x1_1x32x1x8_8_1x1_intrawave_v3,830.88,390.66,0.0
gfx942,304,55552,2304,4096,ck,0,0,1300.9826,a8w8_blockscale_1x128x128_256x128x128x128_16x16_32x32_2x2_8x32x1_8x32x1_1x32x1x8_8_1x1_intrawave_v3,805.94,378.91,0.0
gfx942,304,55680,2304,4096,ck,0,0,1307.2712,a8w8_blockscale_1x128x128_256x128x128x128_16x16_32x32_2x2_8x32x1_8x32x1_1x32x1x8_8_1x1_intrawave_v3,803.91,377.94,0.0
gfx942,304,55808,2304,4096,ck,0,0,1273.7027,a8w8_blockscale_1x128x128_256x128x128x128_16x16_32x32_2x2_8x32x1_8x32x1_1x32x1x8_8_1x1_intrawave_v3,826.99,388.78,0.0
gfx942,304,55936,2304,4096,ck,0,0,1301.3874,a8w8_blockscale_1x128x128_256x128x128x128_16x16_32x32_2x2_8x32x1_8x32x1_1x32x1x8_8_1x1_intrawave_v3,811.25,381.37,0.0
gfx942,304,56064,2304,4096,ck,0,0,1276.7068,a8w8_blockscale_1x128x128_256x128x128x128_16x16_32x32_2x2_8x32x1_8x32x1_1x32x1x8_8_1x1_intrawave_v3,828.83,389.61,0.0
gfx942,304,56192,2304,4096,ck,0,0,1287.1256,a8w8_blockscale_1x128x128_256x128x128x128_16x16_32x32_2x2_8x32x1_8x32x1_1x32x1x8_8_1x1_intrawave_v3,824.0,387.32,0.0
gfx942,304,56320,2304,4096,ck,0,0,1283.7256,a8w8_blockscale_1x128x128_256x128x128x128_16x16_32x32_2x2_8x32x1_8x32x1_1x32x1x8_8_1x1_intrawave_v3,828.06,389.22,0.0
gfx942,304,56448,2304,4096,ck,0,0,1287.45,a8w8_blockscale_1x128x128_256x128x128x128_16x16_32x32_2x2_8x32x1_8x32x1_1x32x1x8_8_1x1_intrawave_v3,827.54,388.96,0.0
gfx942,304,56576,2304,4096,ck,0,0,1300.9484,a8w8_blockscale_1x128x128_256x128x128x128_16x16_32x32_2x2_8x32x1_8x32x1_1x32x1x8_8_1x1_intrawave_v3,820.81,385.78,0.0
gfx942,304,56704,2304,4096,ck,0,0,1278.5062,a8w8_blockscale_1x128x128_256x128x128x128_16x16_32x32_2x2_8x32x1_8x32x1_1x32x1x8_8_1x1_intrawave_v3,837.11,393.42,0.0
gfx942,304,56832,2304,4096,ck,0,0,1294.5863,a8w8_blockscale_1x128x128_256x128x128x128_16x16_32x32_2x2_8x32x1_8x32x1_1x32x1x8_8_1x1_intrawave_v3,828.58,389.39,0.0
gfx942,304,56960,2304,4096,ck,0,0,1287.7767,a8w8_blockscale_1x128x128_256x128x128x128_16x16_32x32_2x2_8x32x1_8x32x1_1x32x1x8_8_1x1_intrawave_v3,834.84,392.32,0.0
gfx942,304,57088,2304,4096,ck,0,0,1317.526,a8w8_blockscale_1x128x128_256x128x128x128_16x16_32x32_2x2_8x32x1_8x32x1_1x32x1x8_8_1x1_intrawave_v3,817.82,384.3,0.0
gfx942,304,57216,2304,4096,ck,0,0,1285.4134,a8w8_blockscale_1x128x128_256x128x128x128_16x16_32x32_2x2_8x32x1_8x32x1_1x32x1x8_8_1x1_intrawave_v3,840.13,394.77,0.0
gfx942,304,57344,2304,4096,ck,0,0,1297.417,a8w8_blockscale_1x128x128_256x128x128x128_16x16_32x32_2x2_8x32x1_8x32x1_1x32x1x8_8_1x1_intrawave_v3,834.22,391.98,0.0
gfx942,304,57472,2304,4096,ck,0,0,1302.2879,a8w8_blockscale_1x128x128_256x128x128x128_16x16_32x32_2x2_8x32x1_8x32x1_1x32x1x8_8_1x1_intrawave_v3,832.96,391.37,0.0
gfx942,304,57600,2304,4096,ck,0,0,1294.6595,a8w8_blockscale_1x128x128_256x128x128x128_16x16_32x32_2x2_8x32x1_8x32x1_1x32x1x8_8_1x1_intrawave_v3,839.73,394.53,0.0
gfx942,304,57728,2304,4096,ck,0,0,1310.8295,a8w8_blockscale_1x128x128_256x128x128x128_16x16_32x32_2x2_8x32x1_8x32x1_1x32x1x8_8_1x1_intrawave_v3,831.21,390.52,0.0
gfx942,304,57856,2304,4096,ck,0,0,1322.0967,a8w8_blockscale_1x128x128_256x128x128x128_16x16_32x32_2x2_8x32x1_8x32x1_1x32x1x8_8_1x1_intrawave_v3,825.96,388.03,0.0
gfx942,304,57984,2304,4096,ck,0,0,1348.6232,a8w8_blockscale_1x128x128_256x128x128x128_16x16_32x32_2x2_8x32x1_8x32x1_1x32x1x8_8_1x1_intrawave_v3,811.5,381.23,0.0
gfx942,304,58112,2304,4096,ck,0,0,1327.3003,a8w8_blockscale_1x128x128_256x128x128x128_16x16_32x32_2x2_8x32x1_8x32x1_1x32x1x8_8_1x1_intrawave_v3,826.36,388.19,0.0
gfx942,304,58240,2304,4096,ck,0,0,1315.2216,a8w8_blockscale_1x128x128_256x128x128x128_16x16_32x32_2x2_8x32x1_8x32x1_1x32x1x8_8_1x1_intrawave_v3,835.79,392.6,0.0
gfx942,304,58368,2304,4096,ck,0,0,1316.5026,a8w8_blockscale_1x128x128_256x128x128x128_16x16_32x32_2x2_8x32x1_8x32x1_1x32x1x8_8_1x1_intrawave_v3,836.81,393.07,0.0
gfx942,304,58496,2304,4096,ck,0,0,1359.3476,a8w8_blockscale_1x128x128_256x128x128x128_16x16_32x32_2x2_8x32x1_8x32x1_1x32x1x8_8_1x1_intrawave_v3,812.21,381.5,0.0
gfx942,304,58624,2304,4096,ck,0,0,1330.9064,a8w8_blockscale_1x128x128_256x128x128x128_16x16_32x32_2x2_8x32x1_8x32x1_1x32x1x8_8_1x1_intrawave_v3,831.38,390.49,0.0
gfx942,304,58752,2304,4096,ck,0,0,1364.0538,a8w8_blockscale_1x128x128_256x128x128x128_16x16_32x32_2x2_8x32x1_8x32x1_1x32x1x8_8_1x1_intrawave_v3,812.95,381.81,0.0
gfx942,304,58880,2304,4096,ck,0,0,1363.9582,a8w8_blockscale_1x128x128_256x128x128x128_16x16_32x32_2x2_8x32x1_8x32x1_1x32x1x8_8_1x1_intrawave_v3,814.78,382.66,0.0
gfx942,304,59008,2304,4096,ck,0,0,1328.6313,a8w8_blockscale_1x128x128_256x128x128x128_16x16_32x32_2x2_8x32x1_8x32x1_1x32x1x8_8_1x1_intrawave_v3,838.26,393.67,0.0
gfx942,304,59136,2304,4096,ck,0,0,1335.5671,a8w8_blockscale_1x128x128_256x128x128x128_16x16_32x32_2x2_8x32x1_8x32x1_1x32x1x8_8_1x1_intrawave_v3,835.72,392.46,0.0
gfx942,304,59264,2304,4096,ck,0,0,1373.6023,a8w8_blockscale_1x128x128_256x128x128x128_16x16_32x32_2x2_8x32x1_8x32x1_1x32x1x8_8_1x1_intrawave_v3,814.33,382.4,0.0
gfx942,304,59392,2304,4096,ck,0,0,1356.6043,a8w8_blockscale_1x128x128_256x128x128x128_16x16_32x32_2x2_8x32x1_8x32x1_1x32x1x8_8_1x1_intrawave_v3,826.32,388.02,0.0
gfx942,304,59520,2304,4096,ck,0,0,1334.9301,a8w8_blockscale_1x128x128_256x128x128x128_16x16_32x32_2x2_8x32x1_8x32x1_1x32x1x8_8_1x1_intrawave_v3,841.54,395.15,0.0
gfx942,304,59648,2304,4096,ck,0,0,1358.6687,a8w8_blockscale_1x128x128_256x128x128x128_16x16_32x32_2x2_8x32x1_8x32x1_1x32x1x8_8_1x1_intrawave_v3,828.62,389.07,0.0
gfx942,304,59776,2304,4096,ck,0,0,1356.7512,a8w8_blockscale_1x128x128_256x128x128x128_16x16_32x32_2x2_8x32x1_8x32x1_1x32x1x8_8_1x1_intrawave_v3,831.57,390.44,0.0
gfx942,304,59904,2304,4096,ck,0,0,1357.2925,a8w8_blockscale_1x128x128_256x128x128x128_16x16_32x32_2x2_8x32x1_8x32x1_1x32x1x8_8_1x1_intrawave_v3,833.02,391.1,0.0
gfx942,304,60032,2304,4096,ck,0,0,1381.1013,a8w8_blockscale_1x128x128_256x128x128x128_16x16_32x32_2x2_8x32x1_8x32x1_1x32x1x8_8_1x1_intrawave_v3,820.41,385.17,0.0
gfx942,304,60160,2304,4096,ck,0,0,1356.1896,a8w8_blockscale_1x128x128_256x128x128x128_16x16_32x32_2x2_8x32x1_8x32x1_1x32x1x8_8_1x1_intrawave_v3,837.26,393.06,0.0
gfx942,304,60288,2304,4096,ck,0,0,1362.9702,a8w8_blockscale_1x128x128_256x128x128x128_16x16_32x32_2x2_8x32x1_8x32x1_1x32x1x8_8_1x1_intrawave_v3,834.87,391.93,0.0
gfx942,304,60416,2304,4096,ck,0,0,1372.8282,a8w8_blockscale_1x128x128_256x128x128x128_16x16_32x32_2x2_8x32x1_8x32x1_1x32x1x8_8_1x1_intrawave_v3,830.63,389.92,0.0
gfx942,304,60544,2304,4096,ck,0,0,1368.7387,a8w8_blockscale_1x128x128_256x128x128x128_16x16_32x32_2x2_8x32x1_8x32x1_1x32x1x8_8_1x1_intrawave_v3,834.88,391.9,0.0
gfx942,304,60672,2304,4096,ck,0,0,1404.1816,a8w8_blockscale_1x128x128_256x128x128x128_16x16_32x32_2x2_8x32x1_8x32x1_1x32x1x8_8_1x1_intrawave_v3,815.53,382.8,0.0
gfx942,304,60800,2304,4096,ck,0,0,1376.311,a8w8_blockscale_1x128x128_256x128x128x128_16x16_32x32_2x2_8x32x1_8x32x1_1x32x1x8_8_1x1_intrawave_v3,833.8,391.37,0.0
gfx942,304,60928,2304,4096,ck,0,0,1401.8661,a8w8_blockscale_1x128x128_256x128x128x128_16x16_32x32_2x2_8x32x1_8x32x1_1x32x1x8_8_1x1_intrawave_v3,820.32,385.03,0.0
gfx942,304,61056,2304,4096,ck,0,0,1370.658,a8w8_blockscale_1x128x128_256x128x128x128_16x16_32x32_2x2_8x32x1_8x32x1_1x32x1x8_8_1x1_intrawave_v3,840.76,394.61,0.0
gfx942,304,61184,2304,4096,ck,0,0,1421.7237,a8w8_blockscale_1x128x128_256x128x128x128_16x16_32x32_2x2_8x32x1_8x32x1_1x32x1x8_8_1x1_intrawave_v3,812.26,381.22,0.0
gfx942,304,61312,2304,4096,ck,0,0,1408.8378,a8w8_blockscale_1x128x128_256x128x128x128_16x16_32x32_2x2_8x32x1_8x32x1_1x32x1x8_8_1x1_intrawave_v3,821.4,385.49,0.0
gfx942,304,61440,2304,4096,ck,0,0,1380.9944,a8w8_blockscale_1x128x128_256x128x128x128_16x16_32x32_2x2_8x32x1_8x32x1_1x32x1x8_8_1x1_intrawave_v3,839.71,394.07,0.0
gfx942,304,61568,2304,4096,ck,0,0,1400.254,a8w8_blockscale_1x128x128_256x128x128x128_16x16_32x32_2x2_8x32x1_8x32x1_1x32x1x8_8_1x1_intrawave_v3,829.89,389.45,0.0
gfx942,304,61696,2304,4096,ck,0,0,1406.4064,a8w8_blockscale_1x128x128_256x128x128x128_16x16_32x32_2x2_8x32x1_8x32x1_1x32x1x8_8_1x1_intrawave_v3,827.98,388.54,0.0
gfx942,304,61824,2304,4096,ck,0,0,1401.4169,a8w8_blockscale_1x128x128_256x128x128x128_16x16_32x32_2x2_8x32x1_8x32x1_1x32x1x8_8_1x1_intrawave_v3,832.65,390.71,0.0
gfx942,304,61952,2304,4096,ck,0,0,1415.1551,a8w8_blockscale_1x128x128_256x128x128x128_16x16_32x32_2x2_8x32x1_8x32x1_1x32x1x8_8_1x1_intrawave_v3,826.27,387.71,0.0
gfx942,304,62080,2304,4096,ck,0,0,1454.7696,a8w8_blockscale_1x128x128_256x128x128x128_16x16_32x32_2x2_8x32x1_8x32x1_1x32x1x8_8_1x1_intrawave_v3,805.43,377.92,0.0
gfx942,304,62208,2304,4096,ck,0,0,1443.2594,a8w8_blockscale_1x128x128_256x128x128x128_16x16_32x32_2x2_8x32x1_8x32x1_1x32x1x8_8_1x1_intrawave_v3,813.53,381.7,0.0
gfx942,304,62336,2304,4096,ck,0,0,1402.0324,a8w8_blockscale_1x128x128_256x128x128x128_16x16_32x32_2x2_8x32x1_8x32x1_1x32x1x8_8_1x1_intrawave_v3,839.18,393.72,0.0
gfx942,304,62464,2304,4096,ck,0,0,1410.5973,a8w8_blockscale_1x128x128_256x128x128x128_16x16_32x32_2x2_8x32x1_8x32x1_1x32x1x8_8_1x1_intrawave_v3,835.79,392.12,0.0
gfx942,304,62592,2304,4096,ck,0,0,1430.6695,a8w8_blockscale_1x128x128_256x128x128x128_16x16_32x32_2x2_8x32x1_8x32x1_1x32x1x8_8_1x1_intrawave_v3,825.76,387.4,0.0
gfx942,304,62720,2304,4096,ck,0,0,1415.5623,a8w8_blockscale_1x128x128_256x128x128x128_16x16_32x32_2x2_8x32x1_8x32x1_1x32x1x8_8_1x1_intrawave_v3,836.28,392.32,0.0
gfx942,304,62848,2304,4096,ck,0,0,1457.2008,a8w8_blockscale_1x128x128_256x128x128x128_16x16_32x32_2x2_8x32x1_8x32x1_1x32x1x8_8_1x1_intrawave_v3,814.04,381.87,0.0
gfx942,304,62976,2304,4096,ck,0,0,1417.6284,a8w8_blockscale_1x128x128_256x128x128x128_16x16_32x32_2x2_8x32x1_8x32x1_1x32x1x8_8_1x1_intrawave_v3,838.47,393.32,0.0
gfx942,304,63104,2304,4096,ck,0,0,1428.7203,a8w8_blockscale_1x128x128_256x128x128x128_16x16_32x32_2x2_8x32x1_8x32x1_1x32x1x8_8_1x1_intrawave_v3,833.65,391.05,0.0
gfx942,304,63232,2304,4096,ck,0,0,1432.7668,a8w8_blockscale_1x128x128_256x128x128x128_16x16_32x32_2x2_8x32x1_8x32x1_1x32x1x8_8_1x1_intrawave_v3,832.98,390.72,0.0
gfx942,304,63360,2304,4096,ck,0,0,1479.4534,a8w8_blockscale_1x128x128_256x128x128x128_16x16_32x32_2x2_8x32x1_8x32x1_1x32x1x8_8_1x1_intrawave_v3,808.33,379.14,0.0
gfx942,304,63488,2304,4096,ck,0,0,1441.0455,a8w8_blockscale_1x128x128_256x128x128x128_16x16_32x32_2x2_8x32x1_8x32x1_1x32x1x8_8_1x1_intrawave_v3,831.55,390.02,0.0
gfx942,304,63616,2304,4096,ck,0,0,1444.0426,a8w8_blockscale_1x128x128_256x128x128x128_16x16_32x32_2x2_8x32x1_8x32x1_1x32x1x8_8_1x1_intrawave_v3,831.49,389.98,0.0
gfx942,304,63744,2304,4096,ck,0,0,1438.334,a8w8_blockscale_1x128x128_256x128x128x128_16x16_32x32_2x2_8x32x1_8x32x1_1x32x1x8_8_1x1_intrawave_v3,836.47,392.3,0.0
gfx942,304,63872,2304,4096,ck,0,0,1445.1751,a8w8_blockscale_1x128x128_256x128x128x128_16x16_32x32_2x2_8x32x1_8x32x1_1x32x1x8_8_1x1_intrawave_v3,834.19,391.22,0.0
gfx942,304,64000,2304,4096,ck,0,0,1481.0038,a8w8_blockscale_1x128x128_256x128x128x128_16x16_32x32_2x2_8x32x1_8x32x1_1x32x1x8_8_1x1_intrawave_v3,815.64,382.51,0.0
gfx942,304,64128,2304,4096,ck,0,0,1502.2179,a8w8_blockscale_1x128x128_256x128x128x128_16x16_32x32_2x2_8x32x1_8x32x1_1x32x1x8_8_1x1_intrawave_v3,805.73,377.85,0.0
gfx942,304,64256,2304,4096,ck,0,0,1487.5447,a8w8_blockscale_1x128x128_256x128x128x128_16x16_32x32_2x2_8x32x1_8x32x1_1x32x1x8_8_1x1_intrawave_v3,815.3,382.32,0.0
gfx942,304,64384,2304,4096,ck,0,0,1460.121,a8w8_blockscale_1x128x128_256x128x128x128_16x16_32x32_2x2_8x32x1_8x32x1_1x32x1x8_8_1x1_intrawave_v3,832.26,390.27,0.0
gfx942,304,64512,2304,4096,ck,0,0,1487.1123,a8w8_blockscale_1x128x128_256x128x128x128_16x16_32x32_2x2_8x32x1_8x32x1_1x32x1x8_8_1x1_intrawave_v3,818.78,383.93,0.0
gfx942,304,64640,2304,4096,ck,0,0,1469.7222,a8w8_blockscale_1x128x128_256x128x128x128_16x16_32x32_2x2_8x32x1_8x32x1_1x32x1x8_8_1x1_intrawave_v3,830.12,389.23,0.0
gfx942,304,64768,2304,4096,ck,0,0,1520.3611,a8w8_blockscale_1x128x128_256x128x128x128_16x16_32x32_2x2_8x32x1_8x32x1_1x32x1x8_8_1x1_intrawave_v3,804.06,377.0,0.0
gfx942,304,64896,2304,4096,ck,0,0,1484.5557,a8w8_blockscale_1x128x128_256x128x128x128_16x16_32x32_2x2_8x32x1_8x32x1_1x32x1x8_8_1x1_intrawave_v3,825.08,386.84,0.0
gfx942,304,65024,2304,4096,ck,0,0,1458.7806,a8w8_blockscale_1x128x128_256x128x128x128_16x16_32x32_2x2_8x32x1_8x32x1_1x32x1x8_8_1x1_intrawave_v3,841.31,394.44,0.0
gfx942,304,65152,2304,4096,ck,0,0,1514.1146,a8w8_blockscale_1x128x128_256x128x128x128_16x16_32x32_2x2_8x32x1_8x32x1_1x32x1x8_8_1x1_intrawave_v3,812.16,380.76,0.0
gfx942,304,65280,2304,4096,ck,0,0,1519.8096,a8w8_blockscale_1x128x128_256x128x128x128_16x16_32x32_2x2_8x32x1_8x32x1_1x32x1x8_8_1x1_intrawave_v3,810.71,380.07,0.0
gfx942,304,65408,2304,4096,ck,0,0,1504.0967,a8w8_blockscale_1x128x128_256x128x128x128_16x16_32x32_2x2_8x32x1_8x32x1_1x32x1x8_8_1x1_intrawave_v3,820.78,384.78,0.0
gfx942,304,65536,2304,4096,ck,0,0,1497.793,a8w8_blockscale_1x128x128_256x128x128x128_16x16_32x32_2x2_8x32x1_8x32x1_1x32x1x8_8_1x1_intrawave_v3,825.85,387.14,0.0
gfx942,304,65664,2304,4096,ck,0,0,1494.2477,a8w8_blockscale_1x128x128_256x128x128x128_16x16_32x32_2x2_8x32x1_8x32x1_1x32x1x8_8_1x1_intrawave_v3,829.43,388.81,0.0
gfx942,304,65792,2304,4096,ck,0,0,1509.3041,a8w8_blockscale_1x128x128_256x128x128x128_16x16_32x32_2x2_8x32x1_8x32x1_1x32x1x8_8_1x1_intrawave_v3,822.75,385.67,0.0
gfx942,304,65920,2304,4096,ck,0,0,1502.9485,a8w8_blockscale_1x128x128_256x128x128x128_16x16_32x32_2x2_8x32x1_8x32x1_1x32x1x8_8_1x1_intrawave_v3,827.84,388.04,0.0
gfx942,304,66048,2304,4096,ck,0,0,1502.4554,a8w8_blockscale_1x128x128_256x128x128x128_16x16_32x32_2x2_8x32x1_8x32x1_1x32x1x8_8_1x1_intrawave_v3,829.72,388.91,0.0
gfx942,304,66176,2304,4096,ck,0,0,1493.9377,a8w8_blockscale_1x128x128_256x128x128x128_16x16_32x32_2x2_8x32x1_8x32x1_1x32x1x8_8_1x1_intrawave_v3,836.07,391.87,0.0
gfx942,304,66304,2304,4096,ck,0,0,1493.9114,a8w8_blockscale_1x128x128_256x128x128x128_16x16_32x32_2x2_8x32x1_8x32x1_1x32x1x8_8_1x1_intrawave_v3,837.7,392.63,0.0
gfx942,304,66432,2304,4096,ck,0,0,1535.4368,a8w8_blockscale_1x128x128_256x128x128x128_16x16_32x32_2x2_8x32x1_8x32x1_1x32x1x8_8_1x1_intrawave_v3,816.62,382.73,0.0
gfx942,304,66560,2304,4096,ck,0,0,1536.8673,a8w8_blockscale_1x128x128_256x128x128x128_16x16_32x32_2x2_8x32x1_8x32x1_1x32x1x8_8_1x1_intrawave_v3,817.43,383.1,0.0
gfx942,304,66688,2304,4096,ck,0,0,1539.481,a8w8_blockscale_1x128x128_256x128x128x128_16x16_32x32_2x2_8x32x1_8x32x1_1x32x1x8_8_1x1_intrawave_v3,817.61,383.17,0.0
gfx942,304,66816,2304,4096,ck,0,0,1543.591,a8w8_blockscale_1x128x128_256x128x128x128_16x16_32x32_2x2_8x32x1_8x32x1_1x32x1x8_8_1x1_intrawave_v3,817.0,382.88,0.0
gfx942,304,66944,2304,4096,ck,0,0,1573.2238,a8w8_blockscale_1x128x128_256x128x128x128_16x16_32x32_2x2_8x32x1_8x32x1_1x32x1x8_8_1x1_intrawave_v3,803.14,376.37,0.0
gfx942,304,67072,2304,4096,ck,0,0,1555.4196,a8w8_blockscale_1x128x128_256x128x128x128_16x16_32x32_2x2_8x32x1_8x32x1_1x32x1x8_8_1x1_intrawave_v3,813.89,381.4,0.0
gfx942,304,67200,2304,4096,ck,0,0,1519.6328,a8w8_blockscale_1x128x128_256x128x128x128_16x16_32x32_2x2_8x32x1_8x32x1_1x32x1x8_8_1x1_intrawave_v3,834.65,391.11,0.0
gfx942,304,67328,2304,4096,ck,0,0,1552.6819,a8w8_blockscale_1x128x128_256x128x128x128_16x16_32x32_2x2_8x32x1_8x32x1_1x32x1x8_8_1x1_intrawave_v3,818.44,383.5,0.0
gfx942,304,67456,2304,4096,ck,0,0,1559.6824,a8w8_blockscale_1x128x128_256x128x128x128_16x16_32x32_2x2_8x32x1_8x32x1_1x32x1x8_8_1x1_intrawave_v3,816.31,382.5,0.0
gfx942,304,67584,2304,4096,ck,0,0,1552.6688,a8w8_blockscale_1x128x128_256x128x128x128_16x16_32x32_2x2_8x32x1_8x32x1_1x32x1x8_8_1x1_intrawave_v3,821.56,384.94,0.0
gfx942,304,67712,2304,4096,ck,0,0,1588.1979,a8w8_blockscale_1x128x128_256x128x128x128_16x16_32x32_2x2_8x32x1_8x32x1_1x32x1x8_8_1x1_intrawave_v3,804.7,377.03,0.0
gfx942,304,67840,2304,4096,ck,0,0,1573.4701,a8w8_blockscale_1x128x128_256x128x128x128_16x16_32x32_2x2_8x32x1_8x32x1_1x32x1x8_8_1x1_intrawave_v3,813.77,381.27,0.0
gfx942,304,67968,2304,4096,ck,0,0,1540.1636,a8w8_blockscale_1x128x128_256x128x128x128_16x16_32x32_2x2_8x32x1_8x32x1_1x32x1x8_8_1x1_intrawave_v3,832.93,390.24,0.0
gfx942,304,68096,2304,4096,ck,0,0,1598.3299,a8w8_blockscale_1x128x128_256x128x128x128_16x16_32x32_2x2_8x32x1_8x32x1_1x32x1x8_8_1x1_intrawave_v3,804.13,376.73,0.0
gfx942,304,68224,2304,4096,ck,0,0,1543.3856,a8w8_blockscale_1x128x128_256x128x128x128_16x16_32x32_2x2_8x32x1_8x32x1_1x32x1x8_8_1x1_intrawave_v3,834.32,390.87,0.0
gfx942,304,68352,2304,4096,ck,0,0,1581.2948,a8w8_blockscale_1x128x128_256x128x128x128_16x16_32x32_2x2_8x32x1_8x32x1_1x32x1x8_8_1x1_intrawave_v3,815.85,382.2,0.0
gfx942,304,68480,2304,4096,ck,0,0,1599.1993,a8w8_blockscale_1x128x128_256x128x128x128_16x16_32x32_2x2_8x32x1_8x32x1_1x32x1x8_8_1x1_intrawave_v3,808.23,378.62,0.0
gfx942,304,68608,2304,4096,ck,0,0,1547.1884,a8w8_blockscale_1x128x128_256x128x128x128_16x16_32x32_2x2_8x32x1_8x32x1_1x32x1x8_8_1x1_intrawave_v3,836.96,392.07,0.0
gfx942,304,68736,2304,4096,ck,0,0,1592.0666,a8w8_blockscale_1x128x128_256x128x128x128_16x16_32x32_2x2_8x32x1_8x32x1_1x32x1x8_8_1x1_intrawave_v3,814.88,381.71,0.0
gfx942,304,68864,2304,4096,ck,0,0,1552.3937,a8w8_blockscale_1x128x128_256x128x128x128_16x16_32x32_2x2_8x32x1_8x32x1_1x32x1x8_8_1x1_intrawave_v3,837.26,392.19,0.0
gfx942,304,68992,2304,4096,ck,0,0,1605.0975,a8w8_blockscale_1x128x128_256x128x128x128_16x16_32x32_2x2_8x32x1_8x32x1_1x32x1x8_8_1x1_intrawave_v3,811.28,380.0,0.0
gfx942,304,69120,2304,4096,ck,0,0,1570.1249,a8w8_blockscale_1x128x128_256x128x128x128_16x16_32x32_2x2_8x32x1_8x32x1_1x32x1x8_8_1x1_intrawave_v3,830.89,389.18,0.0
gfx942,304,69248,2304,4096,ck,0,0,1617.8819,a8w8_blockscale_1x128x128_256x128x128x128_16x16_32x32_2x2_8x32x1_8x32x1_1x32x1x8_8_1x1_intrawave_v3,807.85,378.38,0.0
gfx942,304,69376,2304,4096,ck,0,0,1555.7215,a8w8_blockscale_1x128x128_256x128x128x128_16x16_32x32_2x2_8x32x1_8x32x1_1x32x1x8_8_1x1_intrawave_v3,841.69,394.21,0.0
gfx942,304,69504,2304,4096,ck,0,0,1606.2559,a8w8_blockscale_1x128x128_256x128x128x128_16x16_32x32_2x2_8x32x1_8x32x1_1x32x1x8_8_1x1_intrawave_v3,816.71,382.5,0.0
gfx942,304,69632,2304,4096,ck,0,0,1595.0987,a8w8_blockscale_1x128x128_256x128x128x128_16x16_32x32_2x2_8x32x1_8x32x1_1x32x1x8_8_1x1_intrawave_v3,823.94,385.88,0.0
gfx942,304,69760,2304,4096,ck,0,0,1576.2632,a8w8_blockscale_1x128x128_256x128x128x128_16x16_32x32_2x2_8x32x1_8x32x1_1x32x1x8_8_1x1_intrawave_v3,835.31,391.2,0.0
gfx942,304,69888,2304,4096,ck,0,0,1604.9086,a8w8_blockscale_1x128x128_256x128x128x128_16x16_32x32_2x2_8x32x1_8x32x1_1x32x1x8_8_1x1_intrawave_v3,821.91,384.91,0.0
gfx942,304,70016,2304,4096,ck,0,0,1623.3284,a8w8_blockscale_1x128x128_256x128x128x128_16x16_32x32_2x2_8x32x1_8x32x1_1x32x1x8_8_1x1_intrawave_v3,814.07,381.23,0.0
gfx942,304,70144,2304,4096,ck,0,0,1556.0464,a8w8_blockscale_1x128x128_256x128x128x128_16x16_32x32_2x2_8x32x1_8x32x1_1x32x1x8_8_1x1_intrawave_v3,850.83,398.43,0.0
gfx942,304,70272,2304,4096,ck,0,0,1576.1119,a8w8_blockscale_1x128x128_256x128x128x128_16x16_32x32_2x2_8x32x1_8x32x1_1x32x1x8_8_1x1_intrawave_v3,841.53,394.06,0.0
gfx942,304,70400,2304,4096,ck,0,0,1636.2241,a8w8_blockscale_1x128x128_256x128x128x128_16x16_32x32_2x2_8x32x1_8x32x1_1x32x1x8_8_1x1_intrawave_v3,812.09,380.27,0.0
gfx942,304,70528,2304,4096,ck,0,0,1582.4573,a8w8_blockscale_1x128x128_256x128x128x128_16x16_32x32_2x2_8x32x1_8x32x1_1x32x1x8_8_1x1_intrawave_v3,841.21,393.89,0.0
gfx942,304,70656,2304,4096,ck,0,0,1598.545,a8w8_blockscale_1x128x128_256x128x128x128_16x16_32x32_2x2_8x32x1_8x32x1_1x32x1x8_8_1x1_intrawave_v3,834.25,390.62,0.0
gfx942,304,70784,2304,4096,ck,0,0,1624.8834,a8w8_blockscale_1x128x128_256x128x128x128_16x16_32x32_2x2_8x32x1_8x32x1_1x32x1x8_8_1x1_intrawave_v3,822.21,384.98,0.0
gfx942,304,70912,2304,4096,ck,0,0,1605.6513,a8w8_blockscale_1x128x128_256x128x128x128_16x16_32x32_2x2_8x32x1_8x32x1_1x32x1x8_8_1x1_intrawave_v3,833.57,390.28,0.0
gfx942,304,71040,2304,4096,ck,0,0,1641.6011,a8w8_blockscale_1x128x128_256x128x128x128_16x16_32x32_2x2_8x32x1_8x32x1_1x32x1x8_8_1x1_intrawave_v3,816.78,382.41,0.0
gfx942,304,71168,2304,4096,ck,0,0,1660.1409,a8w8_blockscale_1x128x128_256x128x128x128_16x16_32x32_2x2_8x32x1_8x32x1_1x32x1x8_8_1x1_intrawave_v3,809.12,378.81,0.0
gfx942,304,71296,2304,4096,ck,0,0,1650.5099,a8w8_blockscale_1x128x128_256x128x128x128_16x16_32x32_2x2_8x32x1_8x32x1_1x32x1x8_8_1x1_intrawave_v3,815.3,381.7,0.0
gfx942,304,71424,2304,4096,ck,0,0,1611.4223,a8w8_blockscale_1x128x128_256x128x128x128_16x16_32x32_2x2_8x32x1_8x32x1_1x32x1x8_8_1x1_intrawave_v3,836.58,391.65,0.0
gfx942,304,71552,2304,4096,ck,0,0,1620.0955,a8w8_blockscale_1x128x128_256x128x128x128_16x16_32x32_2x2_8x32x1_8x32x1_1x32x1x8_8_1x1_intrawave_v3,833.59,390.24,0.0
gfx942,304,71680,2304,4096,ck,0,0,1602.5211,a8w8_blockscale_1x128x128_256x128x128x128_16x16_32x32_2x2_8x32x1_8x32x1_1x32x1x8_8_1x1_intrawave_v3,844.24,395.21,0.0
gfx942,304,71808,2304,4096,ck,0,0,1614.3044,a8w8_blockscale_1x128x128_256x128x128x128_16x16_32x32_2x2_8x32x1_8x32x1_1x32x1x8_8_1x1_intrawave_v3,839.58,393.02,0.0
gfx942,304,71936,2304,4096,ck,0,0,1628.2958,a8w8_blockscale_1x128x128_256x128x128x128_16x16_32x32_2x2_8x32x1_8x32x1_1x32x1x8_8_1x1_intrawave_v3,833.85,390.33,0.0
gfx942,304,72064,2304,4096,ck,0,0,1659.3212,a8w8_blockscale_1x128x128_256x128x128x128_16x16_32x32_2x2_8x32x1_8x32x1_1x32x1x8_8_1x1_intrawave_v3,819.71,383.7,0.0
gfx942,304,72192,2304,4096,ck,0,0,1665.861,a8w8_blockscale_1x128x128_256x128x128x128_16x16_32x32_2x2_8x32x1_8x32x1_1x32x1x8_8_1x1_intrawave_v3,817.94,382.86,0.0
gfx942,304,72320,2304,4096,ck,0,0,1623.5487,a8w8_blockscale_1x128x128_256x128x128x128_16x16_32x32_2x2_8x32x1_8x32x1_1x32x1x8_8_1x1_intrawave_v3,840.75,393.53,0.0
gfx942,304,72448,2304,4096,ck,0,0,1667.995,a8w8_blockscale_1x128x128_256x128x128x128_16x16_32x32_2x2_8x32x1_8x32x1_1x32x1x8_8_1x1_intrawave_v3,819.79,383.71,0.0
gfx942,304,72576,2304,4096,ck,0,0,1647.8778,a8w8_blockscale_1x128x128_256x128x128x128_16x16_32x32_2x2_8x32x1_8x32x1_1x32x1x8_8_1x1_intrawave_v3,831.27,389.07,0.0
gfx942,304,72704,2304,4096,ck,0,0,1636.3218,a8w8_blockscale_1x128x128_256x128x128x128_16x16_32x32_2x2_8x32x1_8x32x1_1x32x1x8_8_1x1_intrawave_v3,838.61,392.5,0.0
gfx942,304,72832,2304,4096,ck,0,0,1637.3826,a8w8_blockscale_1x128x128_256x128x128x128_16x16_32x32_2x2_8x32x1_8x32x1_1x32x1x8_8_1x1_intrawave_v3,839.55,392.92,0.0
gfx942,304,72960,2304,4096,ck,0,0,1703.7737,a8w8_blockscale_1x128x128_256x128x128x128_16x16_32x32_2x2_8x32x1_8x32x1_1x32x1x8_8_1x1_intrawave_v3,808.25,378.27,0.0
gfx942,304,73088,2304,4096,ck,0,0,1699.3822,a8w8_blockscale_1x128x128_256x128x128x128_16x16_32x32_2x2_8x32x1_8x32x1_1x32x1x8_8_1x1_intrawave_v3,811.76,379.9,0.0
gfx942,304,73216,2304,4096,ck,0,0,1700.0845,a8w8_blockscale_1x128x128_256x128x128x128_16x16_32x32_2x2_8x32x1_8x32x1_1x32x1x8_8_1x1_intrawave_v3,812.85,380.4,0.0
gfx942,304,73344,2304,4096,ck,0,0,1684.298,a8w8_blockscale_1x128x128_256x128x128x128_16x16_32x32_2x2_8x32x1_8x32x1_1x32x1x8_8_1x1_intrawave_v3,821.9,384.63,0.0
gfx942,304,73472,2304,4096,ck,0,0,1690.804,a8w8_blockscale_1x128x128_256x128x128x128_16x16_32x32_2x2_8x32x1_8x32x1_1x32x1x8_8_1x1_intrawave_v3,820.16,383.8,0.0
gfx942,304,73600,2304,4096,ck,0,0,1691.2549,a8w8_blockscale_1x128x128_256x128x128x128_16x16_32x32_2x2_8x32x1_8x32x1_1x32x1x8_8_1x1_intrawave_v3,821.37,384.36,0.0
gfx942,304,73728,2304,4096,ck,0,0,1665.5425,a8w8_blockscale_1x128x128_256x128x128x128_16x16_32x32_2x2_8x32x1_8x32x1_1x32x1x8_8_1x1_intrawave_v3,835.51,390.96,0.0
gfx942,304,73856,2304,4096,ck,0,0,1662.6807,a8w8_blockscale_1x128x128_256x128x128x128_16x16_32x32_2x2_8x32x1_8x32x1_1x32x1x8_8_1x1_intrawave_v3,838.4,392.31,0.0
gfx942,304,73984,2304,4096,ck,0,0,1708.3509,a8w8_blockscale_1x128x128_256x128x128x128_16x16_32x32_2x2_8x32x1_8x32x1_1x32x1x8_8_1x1_intrawave_v3,817.4,382.47,0.0
gfx942,304,74112,2304,4096,ck,0,0,1703.8362,a8w8_blockscale_1x128x128_256x128x128x128_16x16_32x32_2x2_8x32x1_8x32x1_1x32x1x8_8_1x1_intrawave_v3,820.98,384.14,0.0
gfx942,304,74240,2304,4096,ck,0,0,1685.9299,a8w8_blockscale_1x128x128_256x128x128x128_16x16_32x32_2x2_8x32x1_8x32x1_1x32x1x8_8_1x1_intrawave_v3,831.13,388.88,0.0
gfx942,304,74368,2304,4096,ck,0,0,1681.8873,a8w8_blockscale_1x128x128_256x128x128x128_16x16_32x32_2x2_8x32x1_8x32x1_1x32x1x8_8_1x1_intrawave_v3,834.57,390.48,0.0
gfx942,304,74496,2304,4096,ck,0,0,1669.0928,a8w8_blockscale_1x128x128_256x128x128x128_16x16_32x32_2x2_8x32x1_8x32x1_1x32x1x8_8_1x1_intrawave_v3,842.41,394.14,0.0
gfx942,304,74624,2304,4096,ck,0,0,1730.073,a8w8_blockscale_1x128x128_256x128x128x128_16x16_32x32_2x2_8x32x1_8x32x1_1x32x1x8_8_1x1_intrawave_v3,814.12,380.89,0.0
gfx942,304,74752,2304,4096,ck,0,0,1692.1095,a8w8_blockscale_1x128x128_256x128x128x128_16x16_32x32_2x2_8x32x1_8x32x1_1x32x1x8_8_1x1_intrawave_v3,833.81,390.09,0.0
gfx942,304,74880,2304,4096,ck,0,0,1679.013,a8w8_blockscale_1x128x128_256x128x128x128_16x16_32x32_2x2_8x32x1_8x32x1_1x32x1x8_8_1x1_intrawave_v3,841.75,393.8,0.0
gfx942,304,75008,2304,4096,ck,0,0,1757.8427,a8w8_blockscale_1x128x128_256x128x128x128_16x16_32x32_2x2_8x32x1_8x32x1_1x32x1x8_8_1x1_intrawave_v3,805.38,376.77,0.0
gfx942,304,75136,2304,4096,ck,0,0,1741.1821,a8w8_blockscale_1x128x128_256x128x128x128_16x16_32x32_2x2_8x32x1_8x32x1_1x32x1x8_8_1x1_intrawave_v3,814.47,381.02,0.0
gfx942,304,75264,2304,4096,ck,0,0,1692.1449,a8w8_blockscale_1x128x128_256x128x128x128_16x16_32x32_2x2_8x32x1_8x32x1_1x32x1x8_8_1x1_intrawave_v3,839.5,392.72,0.0
gfx942,304,75392,2304,4096,ck,0,0,1698.7028,a8w8_blockscale_1x128x128_256x128x128x128_16x16_32x32_2x2_8x32x1_8x32x1_1x32x1x8_8_1x1_intrawave_v3,837.68,391.86,0.0
gfx942,304,75520,2304,4096,ck,0,0,1746.8798,a8w8_blockscale_1x128x128_256x128x128x128_16x16_32x32_2x2_8x32x1_8x32x1_1x32x1x8_8_1x1_intrawave_v3,815.96,381.69,0.0
gfx942,304,75648,2304,4096,ck,0,0,1748.5057,a8w8_blockscale_1x128x128_256x128x128x128_16x16_32x32_2x2_8x32x1_8x32x1_1x32x1x8_8_1x1_intrawave_v3,816.59,381.97,0.0
gfx942,304,75776,2304,4096,ck,0,0,1688.09,a8w8_blockscale_1x128x128_256x128x128x128_16x16_32x32_2x2_8x32x1_8x32x1_1x32x1x8_8_1x1_intrawave_v3,847.24,396.3,0.0
gfx942,304,75904,2304,4096,ck,0,0,1720.6734,a8w8_blockscale_1x128x128_256x128x128x128_16x16_32x32_2x2_8x32x1_8x32x1_1x32x1x8_8_1x1_intrawave_v3,832.6,389.44,0.0
gfx942,304,76032,2304,4096,ck,0,0,1758.2191,a8w8_blockscale_1x128x128_256x128x128x128_16x16_32x32_2x2_8x32x1_8x32x1_1x32x1x8_8_1x1_intrawave_v3,816.2,381.76,0.0
gfx942,304,76160,2304,4096,ck,0,0,1718.2016,a8w8_blockscale_1x128x128_256x128x128x128_16x16_32x32_2x2_8x32x1_8x32x1_1x32x1x8_8_1x1_intrawave_v3,836.61,391.3,0.0
gfx942,304,76288,2304,4096,ck,0,0,1769.5714,a8w8_blockscale_1x128x128_256x128x128x128_16x16_32x32_2x2_8x32x1_8x32x1_1x32x1x8_8_1x1_intrawave_v3,813.69,380.57,0.0
gfx942,304,76416,2304,4096,ck,0,0,1790.2356,a8w8_blockscale_1x128x128_256x128x128x128_16x16_32x32_2x2_8x32x1_8x32x1_1x32x1x8_8_1x1_intrawave_v3,805.65,376.8,0.0
gfx942,304,76544,2304,4096,ck,0,0,1727.2919,a8w8_blockscale_1x128x128_256x128x128x128_16x16_32x32_2x2_8x32x1_8x32x1_1x32x1x8_8_1x1_intrawave_v3,836.41,391.18,0.0
gfx942,304,76672,2304,4096,ck,0,0,1794.5347,a8w8_blockscale_1x128x128_256x128x128x128_16x16_32x32_2x2_8x32x1_8x32x1_1x32x1x8_8_1x1_intrawave_v3,806.41,377.14,0.0
gfx942,304,76800,2304,4096,ck,0,0,1789.8124,a8w8_blockscale_1x128x128_256x128x128x128_16x16_32x32_2x2_8x32x1_8x32x1_1x32x1x8_8_1x1_intrawave_v3,809.89,378.76,0.0
gfx942,304,76928,2304,4096,ck,0,0,1746.3357,a8w8_blockscale_1x128x128_256x128x128x128_16x16_32x32_2x2_8x32x1_8x32x1_1x32x1x8_8_1x1_intrawave_v3,831.44,388.82,0.0
gfx942,304,77056,2304,4096,ck,0,0,1774.6642,a8w8_blockscale_1x128x128_256x128x128x128_16x16_32x32_2x2_8x32x1_8x32x1_1x32x1x8_8_1x1_intrawave_v3,819.53,383.25,0.0
gfx942,304,77184,2304,4096,ck,0,0,1785.1762,a8w8_blockscale_1x128x128_256x128x128x128_16x16_32x32_2x2_8x32x1_8x32x1_1x32x1x8_8_1x1_intrawave_v3,816.05,381.61,0.0
gfx942,304,77312,2304,4096,ck,0,0,1810.021,a8w8_blockscale_1x128x128_256x128x128x128_16x16_32x32_2x2_8x32x1_8x32x1_1x32x1x8_8_1x1_intrawave_v3,806.19,376.99,0.0
gfx942,304,77440,2304,4096,ck,0,0,1812.2619,a8w8_blockscale_1x128x128_256x128x128x128_16x16_32x32_2x2_8x32x1_8x32x1_1x32x1x8_8_1x1_intrawave_v3,806.52,377.14,0.0
gfx942,304,77568,2304,4096,ck,0,0,1797.3691,a8w8_blockscale_1x128x128_256x128x128x128_16x16_32x32_2x2_8x32x1_8x32x1_1x32x1x8_8_1x1_intrawave_v3,814.55,380.88,0.0
gfx942,304,77696,2304,4096,ck,0,0,1752.8571,a8w8_blockscale_1x128x128_256x128x128x128_16x16_32x32_2x2_8x32x1_8x32x1_1x32x1x8_8_1x1_intrawave_v3,836.61,391.19,0.0
gfx942,304,77824,2304,4096,ck,0,0,1742.051,a8w8_blockscale_1x128x128_256x128x128x128_16x16_32x32_2x2_8x32x1_8x32x1_1x32x1x8_8_1x1_intrawave_v3,843.19,394.26,0.0
gfx942,304,77952,2304,4096,ck,0,0,1832.7847,a8w8_blockscale_1x128x128_256x128x128x128_16x16_32x32_2x2_8x32x1_8x32x1_1x32x1x8_8_1x1_intrawave_v3,802.76,375.35,0.0
gfx942,304,78080,2304,4096,ck,0,0,1755.8408,a8w8_blockscale_1x128x128_256x128x128x128_16x16_32x32_2x2_8x32x1_8x32x1_1x32x1x8_8_1x1_intrawave_v3,839.32,392.43,0.0
gfx942,304,78208,2304,4096,ck,0,0,1817.0378,a8w8_blockscale_1x128x128_256x128x128x128_16x16_32x32_2x2_8x32x1_8x32x1_1x32x1x8_8_1x1_intrawave_v3,812.38,379.83,0.0
gfx942,304,78336,2304,4096,ck,0,0,1771.6472,a8w8_blockscale_1x128x128_256x128x128x128_16x16_32x32_2x2_8x32x1_8x32x1_1x32x1x8_8_1x1_intrawave_v3,834.56,390.19,0.0
gfx942,304,78464,2304,4096,ck,0,0,1764.01,a8w8_blockscale_1x128x128_256x128x128x128_16x16_32x32_2x2_8x32x1_8x32x1_1x32x1x8_8_1x1_intrawave_v3,839.54,392.51,0.0
gfx942,304,78592,2304,4096,ck,0,0,1769.9557,a8w8_blockscale_1x128x128_256x128x128x128_16x16_32x32_2x2_8x32x1_8x32x1_1x32x1x8_8_1x1_intrawave_v3,838.09,391.82,0.0
gfx942,304,78720,2304,4096,ck,0,0,1840.8033,a8w8_blockscale_1x128x128_256x128x128x128_16x16_32x32_2x2_8x32x1_8x32x1_1x32x1x8_8_1x1_intrawave_v3,807.14,377.34,0.0
gfx942,304,78848,2304,4096,ck,0,0,1815.091,a8w8_blockscale_1x128x128_256x128x128x128_16x16_32x32_2x2_8x32x1_8x32x1_1x32x1x8_8_1x1_intrawave_v3,819.91,383.3,0.0
gfx942,304,78976,2304,4096,ck,0,0,1803.0081,a8w8_blockscale_1x128x128_256x128x128x128_16x16_32x32_2x2_8x32x1_8x32x1_1x32x1x8_8_1x1_intrawave_v3,826.74,386.49,0.0
gfx942,304,79104,2304,4096,ck,0,0,1824.9359,a8w8_blockscale_1x128x128_256x128x128x128_16x16_32x32_2x2_8x32x1_8x32x1_1x32x1x8_8_1x1_intrawave_v3,818.13,382.46,0.0
gfx942,304,79232,2304,4096,ck,0,0,1793.6239,a8w8_blockscale_1x128x128_256x128x128x128_16x16_32x32_2x2_8x32x1_8x32x1_1x32x1x8_8_1x1_intrawave_v3,833.76,389.75,0.0
gfx942,304,79360,2304,4096,ck,0,0,1851.7573,a8w8_blockscale_1x128x128_256x128x128x128_16x16_32x32_2x2_8x32x1_8x32x1_1x32x1x8_8_1x1_intrawave_v3,808.89,378.12,0.0
gfx942,304,79488,2304,4096,ck,0,0,1817.5356,a8w8_blockscale_1x128x128_256x128x128x128_16x16_32x32_2x2_8x32x1_8x32x1_1x32x1x8_8_1x1_intrawave_v3,825.45,385.85,0.0
gfx942,304,79616,2304,4096,ck,0,0,1842.3833,a8w8_blockscale_1x128x128_256x128x128x128_16x16_32x32_2x2_8x32x1_8x32x1_1x32x1x8_8_1x1_intrawave_v3,815.63,381.25,0.0
gfx942,304,79744,2304,4096,ck,0,0,1792.5259,a8w8_blockscale_1x128x128_256x128x128x128_16x16_32x32_2x2_8x32x1_8x32x1_1x32x1x8_8_1x1_intrawave_v3,839.66,392.48,0.0
gfx942,304,79872,2304,4096,ck,0,0,1804.9181,a8w8_blockscale_1x128x128_256x128x128x128_16x16_32x32_2x2_8x32x1_8x32x1_1x32x1x8_8_1x1_intrawave_v3,835.24,390.4,0.0
gfx942,304,80000,2304,4096,ck,0,0,1827.5891,a8w8_blockscale_1x128x128_256x128x128x128_16x16_32x32_2x2_8x32x1_8x32x1_1x32x1x8_8_1x1_intrawave_v3,826.2,386.17,0.0
gfx942,304,16,4096,1024,ck,8,0,6.2422,a8w8_blockscale_1x128x128_256x16x64x256_16x16_16x16_1x1_16x16x1_16x16x1_1x16x1x16_4_1x1_intrawave_v1,21.5,695.55,0.0
gfx942,304,32,4096,1024,ck,8,0,5.8672,a8w8_blockscale_1x128x128_256x16x64x256_16x16_16x16_1x1_16x16x1_16x16x1_1x16x1x16_4_1x1_intrawave_v1,45.75,765.14,0.0
gfx942,304,48,4096,1024,ck,8,0,6.4454,a8w8_blockscale_1x128x128_256x16x64x256_16x16_16x16_1x1_16x16x1_16x16x1_1x16x1x16_4_1x1_intrawave_v1,62.47,719.38,0.0
gfx942,304,64,4096,1024,ck,8,0,5.896,a8w8_blockscale_1x128x128_256x16x64x256_16x16_16x16_1x1_16x16x1_16x16x1_1x16x1x16_4_1x1_intrawave_v1,91.06,811.42,0.0
gfx942,304,80,4096,1024,ck,13,0,7.024,a8w8_blockscale_1x128x128_256x32x64x256_16x16_16x16_2x1_16x16x1_16x16x1_1x32x1x8_8_2x1_intrawave_v1,95.54,702.1,0.0
gfx942,304,96,4096,1024,ck,13,0,6.7908,a8w8_blockscale_1x128x128_256x32x64x256_16x16_16x16_2x1_16x16x1_16x16x1_1x32x1x8_8_2x1_intrawave_v1,118.59,747.93,0.0
gfx942,304,112,4096,1024,ck,13,0,7.0157,a8w8_blockscale_1x128x128_256x32x64x256_16x16_16x16_2x1_16x16x1_16x16x1_1x32x1x8_8_2x1_intrawave_v1,133.92,744.97,0.0
gfx942,304,128,4096,1024,ck,13,0,6.7518,a8w8_blockscale_1x128x128_256x32x64x256_16x16_16x16_2x1_16x16x1_16x16x1_1x32x1x8_8_2x1_intrawave_v1,159.03,795.93,0.0
gfx942,304,144,4096,1024,ck,7,0,7.2013,a8w8_blockscale_1x128x128_256x16x128x256_16x16_16x16_1x2_16x16x1_16x16x1_1x16x1x16_8_1x2_intrawave_v1,167.74,766.72,0.0
gfx942,304,160,4096,1024,ck,12,0,8.0397,a8w8_blockscale_1x128x128_256x32x128x256_16x16_32x32_1x1_16x16x1_16x16x1_1x32x1x8_8_1x1_intrawave_v1,166.94,705.11,0.0
gfx942,304,176,4096,1024,ck,18,0,8.0476,a8w8_blockscale_1x128x128_256x64x64x256_16x16_32x32_1x1_16x16x1_16x16x1_1x32x1x8_8_1x1_intrawave_v1,183.46,722.74,0.0
gfx942,304,192,4096,1024,ck,18,0,7.26,a8w8_blockscale_1x128x128_256x64x64x256_16x16_32x32_1x1_16x16x1_16x16x1_1x32x1x8_8_1x1_intrawave_v1,221.85,821.46,0.0
gfx942,304,208,4096,1024,ck,18,0,8.5002,a8w8_blockscale_1x128x128_256x64x64x256_16x16_32x32_1x1_16x16x1_16x16x1_1x32x1x8_8_1x1_intrawave_v1,205.27,718.95,0.0
gfx942,304,224,4096,1024,ck,18,0,8.1275,a8w8_blockscale_1x128x128_256x64x64x256_16x16_32x32_1x1_16x16x1_16x16x1_1x32x1x8_8_1x1_intrawave_v1,231.2,770.06,0.0
gfx942,304,240,4096,1024,ck,18,0,8.2828,a8w8_blockscale_1x128x128_256x64x64x256_16x16_32x32_1x1_16x16x1_16x16x1_1x32x1x8_8_1x1_intrawave_v1,243.07,773.43,0.0
gfx942,304,256,4096,1024,ck,18,0,8.5666,a8w8_blockscale_1x128x128_256x64x64x256_16x16_32x32_1x1_16x16x1_16x16x1_1x32x1x8_8_1x1_intrawave_v1,250.68,765.02,0.0
gfx942,304,288,4096,1024,ck,12,0,10.9508,a8w8_blockscale_1x128x128_256x32x128x256_16x16_32x32_1x1_16x16x1_16x16x1_1x32x1x8_8_1x1_intrawave_v1,220.62,625.39,0.0
gfx942,304,320,4096,1024,ck,3,0,12.6951,a8w8_blockscale_1x128x128_256x64x64x128_16x16_32x32_1x1_8x32x1_8x32x1_1x32x1x8_8_1x1_intrawave_v3,211.45,562.69,0.0
gfx942,304,352,4096,1024,ck,2,0,12.6603,a8w8_blockscale_1x128x128_256x64x128x128_16x16_32x32_1x2_8x32x1_8x32x1_1x32x1x8_8_1x1_intrawave_v3,233.23,587.53,0.0
gfx942,304,384,4096,1024,ck,18,0,13.2788,a8w8_blockscale_1x128x128_256x64x64x256_16x16_32x32_1x1_16x16x1_16x16x1_1x32x1x8_8_1x1_intrawave_v1,242.58,582.38,0.0
gfx942,304,416,4096,1024,ck,2,0,12.9653,a8w8_blockscale_1x128x128_256x64x128x128_16x16_32x32_1x2_8x32x1_8x32x1_1x32x1x8_8_1x1_intrawave_v3,269.15,619.2,0.0
gfx942,304,448,4096,1024,ck,18,0,13.5558,a8w8_blockscale_1x128x128_256x64x64x256_16x16_32x32_1x1_16x16x1_16x16x1_1x32x1x8_8_1x1_intrawave_v1,277.23,613.99,0.0
gfx942,304,480,4096,1024,ck,2,0,14.0924,a8w8_blockscale_1x128x128_256x64x128x128_16x16_32x32_1x2_8x32x1_8x32x1_1x32x1x8_8_1x1_intrawave_v3,285.72,611.53,0.0
gfx942,304,512,4096,1024,ck,18,0,13.6045,a8w8_blockscale_1x128x128_256x64x64x256_16x16_32x32_1x1_16x16x1_16x16x1_1x32x1x8_8_1x1_intrawave_v1,315.7,655.14,0.0
gfx942,304,544,4096,1024,ck,2,0,14.999,a8w8_blockscale_1x128x128_256x64x128x128_16x16_32x32_1x2_8x32x1_8x32x1_1x32x1x8_8_1x1_intrawave_v3,304.25,613.89,0.0
gfx942,304,576,4096,1024,ck,18,0,15.2731,a8w8_blockscale_1x128x128_256x64x64x256_16x16_32x32_1x1_16x16x1_16x16x1_1x32x1x8_8_1x1_intrawave_v1,316.36,622.19,0.0
gfx942,304,608,4096,1024,ck,0,0,18.2821,a8w8_blockscale_1x128x128_256x128x128x128_16x16_32x32_2x2_8x32x1_8x32x1_1x32x1x8_8_1x1_intrawave_v3,278.98,535.91,0.0
gfx942,304,640,4096,1024,ck,18,0,18.7082,a8w8_blockscale_1x128x128_256x64x64x256_16x16_32x32_1x1_16x16x1_16x16x1_1x32x1x8_8_1x1_intrawave_v1,286.97,539.47,0.0
gfx942,304,672,4096,1024,ck,0,0,18.6106,a8w8_blockscale_1x128x128_256x128x128x128_16x16_32x32_2x2_8x32x1_8x32x1_1x32x1x8_8_1x1_intrawave_v3,302.9,558.15,0.0
gfx942,304,704,4096,1024,ck,0,0,18.7733,a8w8_blockscale_1x128x128_256x128x128x128_16x16_32x32_2x2_8x32x1_8x32x1_1x32x1x8_8_1x1_intrawave_v3,314.57,569.02,0.0
gfx942,304,736,4096,1024,ck,0,0,19.2759,a8w8_blockscale_1x128x128_256x128x128x128_16x16_32x32_2x2_8x32x1_8x32x1_1x32x1x8_8_1x1_intrawave_v3,320.3,569.48,0.0
gfx942,304,768,4096,1024,ck,18,0,19.4094,a8w8_blockscale_1x128x128_256x64x64x256_16x16_32x32_1x1_16x16x1_16x16x1_1x32x1x8_8_1x1_intrawave_v1,331.92,580.76,0.0
gfx942,304,800,4096,1024,ck,0,0,19.924,a8w8_blockscale_1x128x128_256x128x128x128_16x16_32x32_2x2_8x32x1_8x32x1_1x32x1x8_8_1x1_intrawave_v3,336.82,580.56,0.0
gfx942,304,832,4096,1024,ck,0,0,20.5028,a8w8_blockscale_1x128x128_256x128x128x128_16x16_32x32_2x2_8x32x1_8x32x1_1x32x1x8_8_1x1_intrawave_v3,340.41,578.56,0.0
gfx942,304,864,4096,1024,ck,0,0,20.8162,a8w8_blockscale_1x128x128_256x128x128x128_16x16_32x32_2x2_8x32x1_8x32x1_1x32x1x8_8_1x1_intrawave_v3,348.18,584.01,0.0
gfx942,304,896,4096,1024,ck,18,0,20.9956,a8w8_blockscale_1x128x128_256x64x64x256_16x16_32x32_1x1_16x16x1_16x16x1_1x32x1x8_8_1x1_intrawave_v1,357.99,593.07,0.0
gfx942,304,928,4096,1024,ck,0,0,21.658,a8w8_blockscale_1x128x128_256x128x128x128_16x16_32x32_2x2_8x32x1_8x32x1_1x32x1x8_8_1x1_intrawave_v3,359.43,588.55,0.0
gfx942,304,960,4096,1024,ck,0,0,21.5728,a8w8_blockscale_1x128x128_256x128x128x128_16x16_32x32_2x2_8x32x1_8x32x1_1x32x1x8_8_1x1_intrawave_v3,373.3,604.54,0.0
gfx942,304,992,4096,1024,ck,0,0,21.7624,a8w8_blockscale_1x128x128_256x128x128x128_16x16_32x32_2x2_8x32x1_8x32x1_1x32x1x8_8_1x1_intrawave_v3,382.38,612.83,0.0
gfx942,304,1024,4096,1024,ck,0,0,22.4666,a8w8_blockscale_1x128x128_256x128x128x128_16x16_32x32_2x2_8x32x1_8x32x1_1x32x1x8_8_1x1_intrawave_v3,382.34,606.74,0.0
gfx942,304,1088,4096,1024,ck,0,0,23.0423,a8w8_blockscale_1x128x128_256x128x128x128_16x16_32x32_2x2_8x32x1_8x32x1_1x32x1x8_8_1x1_intrawave_v3,396.09,617.18,0.0
gfx942,304,1152,4096,1024,ck,0,0,23.5008,a8w8_blockscale_1x128x128_256x128x128x128_16x16_32x32_2x2_8x32x1_8x32x1_1x32x1x8_8_1x1_intrawave_v3,411.21,630.24,0.0
gfx942,304,1216,4096,1024,ck,2,0,25.9722,a8w8_blockscale_1x128x128_256x64x128x128_16x16_32x32_1x2_8x32x1_8x32x1_1x32x1x8_8_1x1_intrawave_v3,392.75,592.98,0.0
gfx942,304,1280,4096,1024,ck,3,0,30.0971,a8w8_blockscale_1x128x128_256x64x64x128_16x16_32x32_1x1_8x32x1_8x32x1_1x32x1x8_8_1x1_intrawave_v3,356.76,531.31,0.0
gfx942,304,1344,4096,1024,ck,3,0,30.6452,a8w8_blockscale_1x128x128_256x64x64x128_16x16_32x32_1x1_8x32x1_8x32x1_1x32x1x8_8_1x1_intrawave_v3,367.9,541.05,0.0
gfx942,304,1408,4096,1024,ck,18,0,30.6067,a8w8_blockscale_1x128x128_256x64x64x256_16x16_32x32_1x1_16x16x1_16x16x1_1x32x1x8_8_1x1_intrawave_v1,385.9,561.0,0.0
gfx942,304,1472,4096,1024,ck,18,0,31.216,a8w8_blockscale_1x128x128_256x64x64x256_16x16_32x32_1x1_16x16x1_16x16x1_1x32x1x8_8_1x1_intrawave_v1,395.57,568.95,0.0
gfx942,304,1536,4096,1024,ck,2,0,31.8584,a8w8_blockscale_1x128x128_256x64x128x128_16x16_32x32_1x2_8x32x1_8x32x1_1x32x1x8_8_1x1_intrawave_v3,404.44,575.99,0.0
gfx942,304,1600,4096,1024,ck,2,0,32.2443,a8w8_blockscale_1x128x128_256x64x128x128_16x16_32x32_1x2_8x32x1_8x32x1_1x32x1x8_8_1x1_intrawave_v3,416.25,587.39,0.0
gfx942,304,1664,4096,1024,ck,0,0,32.9952,a8w8_blockscale_1x128x128_256x128x128x128_16x16_32x32_2x2_8x32x1_8x32x1_1x32x1x8_8_1x1_intrawave_v3,423.05,591.9,0.0
gfx942,304,1728,4096,1024,ck,2,0,33.2983,a8w8_blockscale_1x128x128_256x64x128x128_16x16_32x32_1x2_8x32x1_8x32x1_1x32x1x8_8_1x1_intrawave_v3,435.32,604.22,0.0
gfx942,304,1792,4096,1024,ck,0,0,33.3864,a8w8_blockscale_1x128x128_256x128x128x128_16x16_32x32_2x2_8x32x1_8x32x1_1x32x1x8_8_1x1_intrawave_v3,450.25,620.29,0.0
gfx942,304,1856,4096,1024,ck,0,0,34.0812,a8w8_blockscale_1x128x128_256x128x128x128_16x16_32x32_2x2_8x32x1_8x32x1_1x32x1x8_8_1x1_intrawave_v3,456.83,624.95,0.0
gfx942,304,1920,4096,1024,ck,0,0,34.9189,a8w8_blockscale_1x128x128_256x128x128x128_16x16_32x32_2x2_8x32x1_8x32x1_1x32x1x8_8_1x1_intrawave_v3,461.24,626.85,0.0
gfx942,304,1984,4096,1024,ck,0,0,34.793,a8w8_blockscale_1x128x128_256x128x128x128_16x16_32x32_2x2_8x32x1_8x32x1_1x32x1x8_8_1x1_intrawave_v3,478.34,646.07,0.0
gfx942,304,2048,4096,1024,ck,0,0,35.0746,a8w8_blockscale_1x128x128_256x128x128x128_16x16_32x32_2x2_8x32x1_8x32x1_1x32x1x8_8_1x1_intrawave_v3,489.81,657.7,0.0
gfx942,304,2112,4096,1024,ck,0,0,35.9931,a8w8_blockscale_1x128x128_256x128x128x128_16x16_32x32_2x2_8x32x1_8x32x1_1x32x1x8_8_1x1_intrawave_v3,492.23,657.31,0.0
gfx942,304,2176,4096,1024,ck,0,0,36.0791,a8w8_blockscale_1x128x128_256x128x128x128_16x16_32x32_2x2_8x32x1_8x32x1_1x32x1x8_8_1x1_intrawave_v3,505.93,672.09,0.0
gfx942,304,2240,4096,1024,ck,0,0,37.7541,a8w8_blockscale_1x128x128_256x128x128x128_16x16_32x32_2x2_8x32x1_8x32x1_1x32x1x8_8_1x1_intrawave_v3,497.71,657.89,0.0
gfx942,304,2304,4096,1024,ck,0,0,38.1128,a8w8_blockscale_1x128x128_256x128x128x128_16x16_32x32_2x2_8x32x1_8x32x1_1x32x1x8_8_1x1_intrawave_v3,507.11,667.18,0.0
gfx942,304,2368,4096,1024,ck,0,0,39.346,a8w8_blockscale_1x128x128_256x128x128x128_16x16_32x32_2x2_8x32x1_8x32x1_1x32x1x8_8_1x1_intrawave_v3,504.86,661.26,0.0
gfx942,304,2432,4096,1024,ck,0,0,38.9796,a8w8_blockscale_1x128x128_256x128x128x128_16x16_32x32_2x2_8x32x1_8x32x1_1x32x1x8_8_1x1_intrawave_v3,523.38,682.6,0.0
gfx942,304,2496,4096,1024,ck,0,0,48.6835,a8w8_blockscale_1x128x128_256x128x128x128_16x16_32x32_2x2_8x32x1_8x32x1_1x32x1x8_8_1x1_intrawave_v3,430.08,558.66,0.0
gfx942,304,2560,4096,1024,ck,0,0,48.0841,a8w8_blockscale_1x128x128_256x128x128x128_16x16_32x32_2x2_8x32x1_8x32x1_1x32x1x8_8_1x1_intrawave_v3,446.61,577.89,0.0
gfx942,304,2624,4096,1024,ck,0,0,48.3504,a8w8_blockscale_1x128x128_256x128x128x128_16x16_32x32_2x2_8x32x1_8x32x1_1x32x1x8_8_1x1_intrawave_v3,455.25,586.9,0.0
gfx942,304,2688,4096,1024,ck,0,0,48.463,a8w8_blockscale_1x128x128_256x128x128x128_16x16_32x32_2x2_8x32x1_8x32x1_1x32x1x8_8_1x1_intrawave_v3,465.27,597.71,0.0
gfx942,304,2752,4096,1024,ck,0,0,48.4146,a8w8_blockscale_1x128x128_256x128x128x128_16x16_32x32_2x2_8x32x1_8x32x1_1x32x1x8_8_1x1_intrawave_v3,476.83,610.49,0.0
gfx942,304,2816,4096,1024,ck,0,0,48.1386,a8w8_blockscale_1x128x128_256x128x128x128_16x16_32x32_2x2_8x32x1_8x32x1_1x32x1x8_8_1x1_intrawave_v3,490.71,626.25,0.0
gfx942,304,2880,4096,1024,ck,0,0,48.375,a8w8_blockscale_1x128x128_256x128x128x128_16x16_32x32_2x2_8x32x1_8x32x1_1x32x1x8_8_1x1_intrawave_v3,499.41,635.38,0.0
gfx942,304,2944,4096,1024,ck,0,0,49.2842,a8w8_blockscale_1x128x128_256x128x128x128_16x16_32x32_2x2_8x32x1_8x32x1_1x32x1x8_8_1x1_intrawave_v3,501.09,635.62,0.0
gfx942,304,3008,4096,1024,ck,0,0,50.7285,a8w8_blockscale_1x128x128_256x128x128x128_16x16_32x32_2x2_8x32x1_8x32x1_1x32x1x8_8_1x1_intrawave_v3,497.41,629.15,0.0
gfx942,304,3072,4096,1024,ck,0,0,49.0659,a8w8_blockscale_1x128x128_256x128x128x128_16x16_32x32_2x2_8x32x1_8x32x1_1x32x1x8_8_1x1_intrawave_v3,525.21,662.49,0.0
gfx942,304,3136,4096,1024,ck,0,0,50.019,a8w8_blockscale_1x128x128_256x128x128x128_16x16_32x32_2x2_8x32x1_8x32x1_1x32x1x8_8_1x1_intrawave_v3,525.93,661.66,0.0
gfx942,304,3200,4096,1024,ck,0,0,49.6816,a8w8_blockscale_1x128x128_256x128x128x128_16x16_32x32_2x2_8x32x1_8x32x1_1x32x1x8_8_1x1_intrawave_v3,540.31,678.03,0.0
gfx942,304,3264,4096,1024,ck,0,0,52.4874,a8w8_blockscale_1x128x128_256x128x128x128_16x16_32x32_2x2_8x32x1_8x32x1_1x32x1x8_8_1x1_intrawave_v3,521.66,653.02,0.0
gfx942,304,3328,4096,1024,ck,0,0,51.1326,a8w8_blockscale_1x128x128_256x128x128x128_16x16_32x32_2x2_8x32x1_8x32x1_1x32x1x8_8_1x1_intrawave_v3,545.98,681.86,0.0
gfx942,304,3392,4096,1024,ck,0,0,52.7988,a8w8_blockscale_1x128x128_256x128x128x128_16x16_32x32_2x2_8x32x1_8x32x1_1x32x1x8_8_1x1_intrawave_v3,538.92,671.51,0.0
gfx942,304,3456,4096,1024,ck,0,0,51.7081,a8w8_blockscale_1x128x128_256x128x128x128_16x16_32x32_2x2_8x32x1_8x32x1_1x32x1x8_8_1x1_intrawave_v3,560.67,697.08,0.0
gfx942,304,3520,4096,1024,ck,0,0,52.7463,a8w8_blockscale_1x128x128_256x128x128x128_16x16_32x32_2x2_8x32x1_8x32x1_1x32x1x8_8_1x1_intrawave_v3,559.81,694.54,0.0
gfx942,304,3584,4096,1024,ck,0,0,53.2938,a8w8_blockscale_1x128x128_256x128x128x128_16x16_32x32_2x2_8x32x1_8x32x1_1x32x1x8_8_1x1_intrawave_v3,564.13,698.48,0.0
gfx942,304,3648,4096,1024,ck,0,0,62.1097,a8w8_blockscale_1x128x128_256x128x128x128_16x16_32x32_2x2_8x32x1_8x32x1_1x32x1x8_8_1x1_intrawave_v3,492.7,608.83,0.0
gfx942,304,3712,4096,1024,ck,0,0,63.9132,a8w8_blockscale_1x128x128_256x128x128x128_16x16_32x32_2x2_8x32x1_8x32x1_1x32x1x8_8_1x1_intrawave_v3,487.2,600.88,0.0
gfx942,304,3776,4096,1024,ck,0,0,63.8577,a8w8_blockscale_1x128x128_256x128x128x128_16x16_32x32_2x2_8x32x1_8x32x1_1x32x1x8_8_1x1_intrawave_v3,496.03,610.64,0.0
gfx942,304,3840,4096,1024,ck,0,0,64.0945,a8w8_blockscale_1x128x128_256x128x128x128_16x16_32x32_2x2_8x32x1_8x32x1_1x32x1x8_8_1x1_intrawave_v3,502.57,617.58,0.0
gfx942,304,3904,4096,1024,ck,0,0,62.6455,a8w8_blockscale_1x128x128_256x128x128x128_16x16_32x32_2x2_8x32x1_8x32x1_1x32x1x8_8_1x1_intrawave_v3,522.77,641.28,0.0
gfx942,304,3968,4096,1024,ck,0,0,62.9342,a8w8_blockscale_1x128x128_256x128x128x128_16x16_32x32_2x2_8x32x1_8x32x1_1x32x1x8_8_1x1_intrawave_v3,528.9,647.71,0.0
gfx942,304,4032,4096,1024,ck,0,0,64.0658,a8w8_blockscale_1x128x128_256x128x128x128_16x16_32x32_2x2_8x32x1_8x32x1_1x32x1x8_8_1x1_intrawave_v3,527.94,645.48,0.0
gfx942,304,4096,4096,1024,ck,0,0,62.8318,a8w8_blockscale_1x128x128_256x128x128x128_16x16_32x32_2x2_8x32x1_8x32x1_1x32x1x8_8_1x1_intrawave_v3,546.85,667.54,0.0
gfx942,304,4224,4096,1024,ck,0,0,65.7982,a8w8_blockscale_1x128x128_256x128x128x128_16x16_32x32_2x2_8x32x1_8x32x1_1x32x1x8_8_1x1_intrawave_v3,538.52,655.38,0.0
gfx942,304,4352,4096,1024,ck,0,0,66.6105,a8w8_blockscale_1x128x128_256x128x128x128_16x16_32x32_2x2_8x32x1_8x32x1_1x32x1x8_8_1x1_intrawave_v3,548.07,665.1,0.0
gfx942,304,4480,4096,1024,ck,0,0,65.7012,a8w8_blockscale_1x128x128_256x128x128x128_16x16_32x32_2x2_8x32x1_8x32x1_1x32x1x8_8_1x1_intrawave_v3,572.0,692.25,0.0
gfx942,304,4608,4096,1024,ck,0,0,66.4147,a8w8_blockscale_1x128x128_256x128x128x128_16x16_32x32_2x2_8x32x1_8x32x1_1x32x1x8_8_1x1_intrawave_v3,582.02,702.58,0.0
gfx942,304,4736,4096,1024,ck,0,0,68.5904,a8w8_blockscale_1x128x128_256x128x128x128_16x16_32x32_2x2_8x32x1_8x32x1_1x32x1x8_8_1x1_intrawave_v3,579.21,697.49,0.0
gfx942,304,4864,4096,1024,ck,0,0,69.087,a8w8_blockscale_1x128x128_256x128x128x128_16x16_32x32_2x2_8x32x1_8x32x1_1x32x1x8_8_1x1_intrawave_v3,590.59,709.55,0.0
gfx942,304,4992,4096,1024,ck,0,0,77.7209,a8w8_blockscale_1x128x128_256x128x128x128_16x16_32x32_2x2_8x32x1_8x32x1_1x32x1x8_8_1x1_intrawave_v3,538.8,645.91,0.0
gfx942,304,5120,4096,1024,ck,0,0,78.2934,a8w8_blockscale_1x128x128_256x128x128x128_16x16_32x32_2x2_8x32x1_8x32x1_1x32x1x8_8_1x1_intrawave_v3,548.57,656.25,0.0
gfx942,304,5248,4096,1024,ck,0,0,80.3142,a8w8_blockscale_1x128x128_256x128x128x128_16x16_32x32_2x2_8x32x1_8x32x1_1x32x1x8_8_1x1_intrawave_v3,548.14,654.43,0.0
gfx942,304,5376,4096,1024,ck,0,0,77.5654,a8w8_blockscale_1x128x128_256x128x128x128_16x16_32x32_2x2_8x32x1_8x32x1_1x32x1x8_8_1x1_intrawave_v3,581.41,692.83,0.0
gfx942,304,5504,4096,1024,ck,0,0,79.1088,a8w8_blockscale_1x128x128_256x128x128x128_16x16_32x32_2x2_8x32x1_8x32x1_1x32x1x8_8_1x1_intrawave_v3,583.64,694.22,0.0
gfx942,304,5632,4096,1024,ck,0,0,79.7554,a8w8_blockscale_1x128x128_256x128x128x128_16x16_32x32_2x2_8x32x1_8x32x1_1x32x1x8_8_1x1_intrawave_v3,592.37,703.39,0.0
gfx942,304,5760,4096,1024,ck,0,0,78.9453,a8w8_blockscale_1x128x128_256x128x128x128_16x16_32x32_2x2_8x32x1_8x32x1_1x32x1x8_8_1x1_intrawave_v3,612.05,725.55,0.0
gfx942,304,5888,4096,1024,ck,0,0,81.1865,a8w8_blockscale_1x128x128_256x128x128x128_16x16_32x32_2x2_8x32x1_8x32x1_1x32x1x8_8_1x1_intrawave_v3,608.38,720.05,0.0
gfx942,304,6016,4096,1024,ck,0,0,81.1764,a8w8_blockscale_1x128x128_256x128x128x128_16x16_32x32_2x2_8x32x1_8x32x1_1x32x1x8_8_1x1_intrawave_v3,621.68,734.67,0.0
gfx942,304,6144,4096,1024,ck,0,0,89.4344,a8w8_blockscale_1x128x128_256x128x128x128_16x16_32x32_2x2_8x32x1_8x32x1_1x32x1x8_8_1x1_intrawave_v3,576.28,680.02,0.0
gfx942,304,6272,4096,1024,ck,0,0,92.5828,a8w8_blockscale_1x128x128_256x128x128x128_16x16_32x32_2x2_8x32x1_8x32x1_1x32x1x8_8_1x1_intrawave_v3,568.28,669.64,0.0
gfx942,304,6400,4096,1024,ck,0,0,91.306,a8w8_blockscale_1x128x128_256x128x128x128_16x16_32x32_2x2_8x32x1_8x32x1_1x32x1x8_8_1x1_intrawave_v3,587.99,691.92,0.0
gfx942,304,6528,4096,1024,ck,0,0,89.238,a8w8_blockscale_1x128x128_256x128x128x128_16x16_32x32_2x2_8x32x1_8x32x1_1x32x1x8_8_1x1_intrawave_v3,613.65,721.18,0.0
gfx942,304,6656,4096,1024,ck,0,0,94.1701,a8w8_blockscale_1x128x128_256x128x128x128_16x16_32x32_2x2_8x32x1_8x32x1_1x32x1x8_8_1x1_intrawave_v3,592.91,695.93,0.0
gfx942,304,6784,4096,1024,ck,0,0,95.1726,a8w8_blockscale_1x128x128_256x128x128x128_16x16_32x32_2x2_8x32x1_8x32x1_1x32x1x8_8_1x1_intrawave_v3,597.95,701.0,0.0
gfx942,304,6912,4096,1024,ck,0,0,95.2119,a8w8_blockscale_1x128x128_256x128x128x128_16x16_32x32_2x2_8x32x1_8x32x1_1x32x1x8_8_1x1_intrawave_v3,608.98,713.1,0.0
gfx942,304,7040,4096,1024,ck,0,0,95.5716,a8w8_blockscale_1x128x128_256x128x128x128_16x16_32x32_2x2_8x32x1_8x32x1_1x32x1x8_8_1x1_intrawave_v3,617.92,722.76,0.0
gfx942,304,7168,4096,1024,ck,0,0,97.3317,a8w8_blockscale_1x128x128_256x128x128x128_16x16_32x32_2x2_8x32x1_8x32x1_1x32x1x8_8_1x1_intrawave_v3,617.78,721.81,0.0
gfx942,304,7296,4096,1024,ck,0,0,98.9217,a8w8_blockscale_1x128x128_256x128x128x128_16x16_32x32_2x2_8x32x1_8x32x1_1x32x1x8_8_1x1_intrawave_v3,618.7,722.13,0.0
gfx942,304,7424,4096,1024,ck,0,0,104.4332,a8w8_blockscale_1x128x128_256x128x128x128_16x16_32x32_2x2_8x32x1_8x32x1_1x32x1x8_8_1x1_intrawave_v3,596.33,695.31,0.0
gfx942,304,7552,4096,1024,ck,0,0,106.1638,a8w8_blockscale_1x128x128_256x128x128x128_16x16_32x32_2x2_8x32x1_8x32x1_1x32x1x8_8_1x1_intrawave_v3,596.73,695.09,0.0
gfx942,304,7680,4096,1024,ck,0,0,104.1057,a8w8_blockscale_1x128x128_256x128x128x128_16x16_32x32_2x2_8x32x1_8x32x1_1x32x1x8_8_1x1_intrawave_v3,618.84,720.16,0.0
gfx942,304,7808,4096,1024,ck,0,0,108.5617,a8w8_blockscale_1x128x128_256x128x128x128_16x16_32x32_2x2_8x32x1_8x32x1_1x32x1x8_8_1x1_intrawave_v3,603.33,701.47,0.0
gfx942,304,7936,4096,1024,ck,0,0,109.58,a8w8_blockscale_1x128x128_256x128x128x128_16x16_32x32_2x2_8x32x1_8x32x1_1x32x1x8_8_1x1_intrawave_v3,607.52,705.72,0.0
gfx942,304,8064,4096,1024,ck,0,0,108.855,a8w8_blockscale_1x128x128_256x128x128x128_16x16_32x32_2x2_8x32x1_8x32x1_1x32x1x8_8_1x1_intrawave_v3,621.43,721.25,0.0
gfx942,304,8192,4096,1024,ck,0,0,114.3586,a8w8_blockscale_1x128x128_256x128x128x128_16x16_32x32_2x2_8x32x1_8x32x1_1x32x1x8_8_1x1_intrawave_v3,600.91,696.86,0.0
gfx942,304,8320,4096,1024,ck,0,0,110.1551,a8w8_blockscale_1x128x128_256x128x128x128_16x16_32x32_2x2_8x32x1_8x32x1_1x32x1x8_8_1x1_intrawave_v3,633.59,734.16,0.0
gfx942,304,8448,4096,1024,ck,0,0,111.9901,a8w8_blockscale_1x128x128_256x128x128x128_16x16_32x32_2x2_8x32x1_8x32x1_1x32x1x8_8_1x1_intrawave_v3,632.8,732.66,0.0
gfx942,304,8576,4096,1024,ck,0,0,119.5796,a8w8_blockscale_1x128x128_256x128x128x128_16x16_32x32_2x2_8x32x1_8x32x1_1x32x1x8_8_1x1_intrawave_v3,601.61,696.03,0.0
gfx942,304,8704,4096,1024,ck,0,0,118.5861,a8w8_blockscale_1x128x128_256x128x128x128_16x16_32x32_2x2_8x32x1_8x32x1_1x32x1x8_8_1x1_intrawave_v3,615.71,711.81,0.0
gfx942,304,8832,4096,1024,ck,0,0,118.0039,a8w8_blockscale_1x128x128_256x128x128x128_16x16_32x32_2x2_8x32x1_8x32x1_1x32x1x8_8_1x1_intrawave_v3,627.85,725.32,0.0
gfx942,304,8960,4096,1024,ck,0,0,121.9806,a8w8_blockscale_1x128x128_256x128x128x128_16x16_32x32_2x2_8x32x1_8x32x1_1x32x1x8_8_1x1_intrawave_v3,616.18,711.34,0.0
gfx942,304,9088,4096,1024,ck,0,0,121.3837,a8w8_blockscale_1x128x128_256x128x128x128_16x16_32x32_2x2_8x32x1_8x32x1_1x32x1x8_8_1x1_intrawave_v3,628.06,724.56,0.0
gfx942,304,9216,4096,1024,ck,0,0,124.4618,a8w8_blockscale_1x128x128_256x128x128x128_16x16_32x32_2x2_8x32x1_8x32x1_1x32x1x8_8_1x1_intrawave_v3,621.15,716.11,0.0
gfx942,304,9344,4096,1024,ck,0,0,122.8862,a8w8_blockscale_1x128x128_256x128x128x128_16x16_32x32_2x2_8x32x1_8x32x1_1x32x1x8_8_1x1_intrawave_v3,637.85,734.9,0.0
gfx942,304,9472,4096,1024,ck,0,0,124.8095,a8w8_blockscale_1x128x128_256x128x128x128_16x16_32x32_2x2_8x32x1_8x32x1_1x32x1x8_8_1x1_intrawave_v3,636.63,733.02,0.0
gfx942,304,9600,4096,1024,ck,0,0,126.8558,a8w8_blockscale_1x128x128_256x128x128x128_16x16_32x32_2x2_8x32x1_8x32x1_1x32x1x8_8_1x1_intrawave_v3,634.82,730.5,0.0
gfx942,304,9728,4096,1024,ck,0,0,126.4714,a8w8_blockscale_1x128x128_256x128x128x128_16x16_32x32_2x2_8x32x1_8x32x1_1x32x1x8_8_1x1_intrawave_v3,645.24,742.05,0.0
gfx942,304,9856,4096,1024,ck,0,0,134.5029,a8w8_blockscale_1x128x128_256x128x128x128_16x16_32x32_2x2_8x32x1_8x32x1_1x32x1x8_8_1x1_intrawave_v3,614.69,706.51,0.0
gfx942,304,9984,4096,1024,ck,0,0,138.3707,a8w8_blockscale_1x128x128_256x128x128x128_16x16_32x32_2x2_8x32x1_8x32x1_1x32x1x8_8_1x1_intrawave_v3,605.27,695.28,0.0
gfx942,304,10112,4096,1024,ck,0,0,134.1106,a8w8_blockscale_1x128x128_256x128x128x128_16x16_32x32_2x2_8x32x1_8x32x1_1x32x1x8_8_1x1_intrawave_v3,632.5,726.17,0.0
gfx942,304,10240,4096,1024,ck,0,0,138.9572,a8w8_blockscale_1x128x128_256x128x128x128_16x16_32x32_2x2_8x32x1_8x32x1_1x32x1x8_8_1x1_intrawave_v3,618.17,709.33,0.0
gfx942,304,10368,4096,1024,ck,0,0,137.1137,a8w8_blockscale_1x128x128_256x128x128x128_16x16_32x32_2x2_8x32x1_8x32x1_1x32x1x8_8_1x1_intrawave_v3,634.31,727.47,0.0
gfx942,304,10496,4096,1024,ck,0,0,137.9631,a8w8_blockscale_1x128x128_256x128x128x128_16x16_32x32_2x2_8x32x1_8x32x1_1x32x1x8_8_1x1_intrawave_v3,638.19,731.54,0.0
gfx942,304,10624,4096,1024,ck,0,0,137.6444,a8w8_blockscale_1x128x128_256x128x128x128_16x16_32x32_2x2_8x32x1_8x32x1_1x32x1x8_8_1x1_intrawave_v3,647.47,741.8,0.0
gfx942,304,10752,4096,1024,ck,0,0,137.6851,a8w8_blockscale_1x128x128_256x128x128x128_16x16_32x32_2x2_8x32x1_8x32x1_1x32x1x8_8_1x1_intrawave_v3,655.08,750.15,0.0
gfx942,304,10880,4096,1024,ck,0,0,139.5382,a8w8_blockscale_1x128x128_256x128x128x128_16x16_32x32_2x2_8x32x1_8x32x1_1x32x1x8_8_1x1_intrawave_v3,654.07,748.64,0.0
gfx942,304,11008,4096,1024,ck,0,0,147.0883,a8w8_blockscale_1x128x128_256x128x128x128_16x16_32x32_2x2_8x32x1_8x32x1_1x32x1x8_8_1x1_intrawave_v3,627.8,718.24,0.0
gfx942,304,11136,4096,1024,ck,0,0,145.5702,a8w8_blockscale_1x128x128_256x128x128x128_16x16_32x32_2x2_8x32x1_8x32x1_1x32x1x8_8_1x1_intrawave_v3,641.72,733.83,0.0
gfx942,304,11264,4096,1024,ck,0,0,151.5445,a8w8_blockscale_1x128x128_256x128x128x128_16x16_32x32_2x2_8x32x1_8x32x1_1x32x1x8_8_1x1_intrawave_v3,623.51,712.68,0.0
gfx942,304,11392,4096,1024,ck,0,0,147.2032,a8w8_blockscale_1x128x128_256x128x128x128_16x16_32x32_2x2_8x32x1_8x32x1_1x32x1x8_8_1x1_intrawave_v3,649.19,741.72,0.0
gfx942,304,11520,4096,1024,ck,0,0,152.1773,a8w8_blockscale_1x128x128_256x128x128x128_16x16_32x32_2x2_8x32x1_8x32x1_1x32x1x8_8_1x1_intrawave_v3,635.03,725.22,0.0
gfx942,304,11648,4096,1024,ck,0,0,153.224,a8w8_blockscale_1x128x128_256x128x128x128_16x16_32x32_2x2_8x32x1_8x32x1_1x32x1x8_8_1x1_intrawave_v3,637.7,727.97,0.0
gfx942,304,11776,4096,1024,ck,0,0,154.8967,a8w8_blockscale_1x128x128_256x128x128x128_16x16_32x32_2x2_8x32x1_8x32x1_1x32x1x8_8_1x1_intrawave_v3,637.74,727.72,0.0
gfx942,304,11904,4096,1024,ck,0,0,154.9333,a8w8_blockscale_1x128x128_256x128x128x128_16x16_32x32_2x2_8x32x1_8x32x1_1x32x1x8_8_1x1_intrawave_v3,644.52,735.17,0.0
gfx942,304,12032,4096,1024,ck,0,0,154.6454,a8w8_blockscale_1x128x128_256x128x128x128_16x16_32x32_2x2_8x32x1_8x32x1_1x32x1x8_8_1x1_intrawave_v3,652.67,744.16,0.0
gfx942,304,12160,4096,1024,ck,0,0,161.9221,a8w8_blockscale_1x128x128_256x128x128x128_16x16_32x32_2x2_8x32x1_8x32x1_1x32x1x8_8_1x1_intrawave_v3,629.97,718.0,0.0
gfx942,304,12288,4096,1024,ck,0,0,162.477,a8w8_blockscale_1x128x128_256x128x128x128_16x16_32x32_2x2_8x32x1_8x32x1_1x32x1x8_8_1x1_intrawave_v3,634.42,722.81,0.0
gfx942,304,12416,4096,1024,ck,0,0,161.131,a8w8_blockscale_1x128x128_256x128x128x128_16x16_32x32_2x2_8x32x1_8x32x1_1x32x1x8_8_1x1_intrawave_v3,646.39,736.17,0.0
gfx942,304,12544,4096,1024,ck,0,0,165.2486,a8w8_blockscale_1x128x128_256x128x128x128_16x16_32x32_2x2_8x32x1_8x32x1_1x32x1x8_8_1x1_intrawave_v3,636.78,724.97,0.0
gfx942,304,12672,4096,1024,ck,0,0,162.8506,a8w8_blockscale_1x128x128_256x128x128x128_16x16_32x32_2x2_8x32x1_8x32x1_1x32x1x8_8_1x1_intrawave_v3,652.75,742.89,0.0
gfx942,304,12800,4096,1024,ck,0,0,171.3357,a8w8_blockscale_1x128x128_256x128x128x128_16x16_32x32_2x2_8x32x1_8x32x1_1x32x1x8_8_1x1_intrawave_v3,626.69,712.98,0.0
gfx942,304,12928,4096,1024,ck,0,0,171.7955,a8w8_blockscale_1x128x128_256x128x128x128_16x16_32x32_2x2_8x32x1_8x32x1_1x32x1x8_8_1x1_intrawave_v3,631.26,717.94,0.0
gfx942,304,13056,4096,1024,ck,0,0,168.2224,a8w8_blockscale_1x128x128_256x128x128x128_16x16_32x32_2x2_8x32x1_8x32x1_1x32x1x8_8_1x1_intrawave_v3,651.05,740.2,0.0
gfx942,304,13184,4096,1024,ck,0,0,169.4913,a8w8_blockscale_1x128x128_256x128x128x128_16x16_32x32_2x2_8x32x1_8x32x1_1x32x1x8_8_1x1_intrawave_v3,652.51,741.62,0.0
gfx942,304,13312,4096,1024,ck,0,0,170.9972,a8w8_blockscale_1x128x128_256x128x128x128_16x16_32x32_2x2_8x32x1_8x32x1_1x32x1x8_8_1x1_intrawave_v3,653.05,741.99,0.0
gfx942,304,13440,4096,1024,ck,0,0,178.984,a8w8_blockscale_1x128x128_256x128x128x128_16x16_32x32_2x2_8x32x1_8x32x1_1x32x1x8_8_1x1_intrawave_v3,629.9,715.47,0.0
gfx942,304,13568,4096,1024,ck,0,0,180.8395,a8w8_blockscale_1x128x128_256x128x128x128_16x16_32x32_2x2_8x32x1_8x32x1_1x32x1x8_8_1x1_intrawave_v3,629.38,714.65,0.0
gfx942,304,13696,4096,1024,ck,0,0,179.6718,a8w8_blockscale_1x128x128_256x128x128x128_16x16_32x32_2x2_8x32x1_8x32x1_1x32x1x8_8_1x1_intrawave_v3,639.45,725.86,0.0
gfx942,304,13824,4096,1024,ck,0,0,182.3704,a8w8_blockscale_1x128x128_256x128x128x128_16x16_32x32_2x2_8x32x1_8x32x1_1x32x1x8_8_1x1_intrawave_v3,635.87,721.59,0.0
gfx942,304,13952,4096,1024,ck,0,0,183.5021,a8w8_blockscale_1x128x128_256x128x128x128_16x16_32x32_2x2_8x32x1_8x32x1_1x32x1x8_8_1x1_intrawave_v3,637.8,723.57,0.0
gfx942,304,14080,4096,1024,ck,0,0,180.1982,a8w8_blockscale_1x128x128_256x128x128x128_16x16_32x32_2x2_8x32x1_8x32x1_1x32x1x8_8_1x1_intrawave_v3,655.45,743.38,0.0
gfx942,304,14208,4096,1024,ck,0,0,182.3674,a8w8_blockscale_1x128x128_256x128x128x128_16x16_32x32_2x2_8x32x1_8x32x1_1x32x1x8_8_1x1_intrawave_v3,653.55,741.01,0.0
gfx942,304,14336,4096,1024,ck,0,0,181.4353,a8w8_blockscale_1x128x128_256x128x128x128_16x16_32x32_2x2_8x32x1_8x32x1_1x32x1x8_8_1x1_intrawave_v3,662.82,751.31,0.0
gfx942,304,14464,4096,1024,ck,0,0,185.3462,a8w8_blockscale_1x128x128_256x128x128x128_16x16_32x32_2x2_8x32x1_8x32x1_1x32x1x8_8_1x1_intrawave_v3,654.63,741.83,0.0
gfx942,304,14592,4096,1024,ck,0,0,183.8187,a8w8_blockscale_1x128x128_256x128x128x128_16x16_32x32_2x2_8x32x1_8x32x1_1x32x1x8_8_1x1_intrawave_v3,665.91,754.41,0.0
gfx942,304,14720,4096,1024,ck,0,0,191.3283,a8w8_blockscale_1x128x128_256x128x128x128_16x16_32x32_2x2_8x32x1_8x32x1_1x32x1x8_8_1x1_intrawave_v3,645.38,730.96,0.0
gfx942,304,14848,4096,1024,ck,0,0,188.958,a8w8_blockscale_1x128x128_256x128x128x128_16x16_32x32_2x2_8x32x1_8x32x1_1x32x1x8_8_1x1_intrawave_v3,659.16,746.37,0.0
gfx942,304,14976,4096,1024,ck,0,0,196.1204,a8w8_blockscale_1x128x128_256x128x128x128_16x16_32x32_2x2_8x32x1_8x32x1_1x32x1x8_8_1x1_intrawave_v3,640.56,725.13,0.0
gfx942,304,15104,4096,1024,ck,0,0,191.6334,a8w8_blockscale_1x128x128_256x128x128x128_16x16_32x32_2x2_8x32x1_8x32x1_1x32x1x8_8_1x1_intrawave_v3,661.17,748.27,0.0
gfx942,304,15232,4096,1024,ck,0,0,196.1662,a8w8_blockscale_1x128x128_256x128x128x128_16x16_32x32_2x2_8x32x1_8x32x1_1x32x1x8_8_1x1_intrawave_v3,651.36,736.99,0.0
gfx942,304,15360,4096,1024,ck,0,0,192.3065,a8w8_blockscale_1x128x128_256x128x128x128_16x16_32x32_2x2_8x32x1_8x32x1_1x32x1x8_8_1x1_intrawave_v3,670.02,757.92,0.0
gfx942,304,15488,4096,1024,ck,0,0,198.7662,a8w8_blockscale_1x128x128_256x128x128x128_16x16_32x32_2x2_8x32x1_8x32x1_1x32x1x8_8_1x1_intrawave_v3,653.65,739.22,0.0
gfx942,304,15616,4096,1024,ck,0,0,194.9761,a8w8_blockscale_1x128x128_256x128x128x128_16x16_32x32_2x2_8x32x1_8x32x1_1x32x1x8_8_1x1_intrawave_v3,671.86,759.64,0.0
gfx942,304,15744,4096,1024,ck,0,0,198.1365,a8w8_blockscale_1x128x128_256x128x128x128_16x16_32x32_2x2_8x32x1_8x32x1_1x32x1x8_8_1x1_intrawave_v3,666.56,753.48,0.0
gfx942,304,15872,4096,1024,ck,0,0,206.2756,a8w8_blockscale_1x128x128_256x128x128x128_16x16_32x32_2x2_8x32x1_8x32x1_1x32x1x8_8_1x1_intrawave_v3,645.47,729.46,0.0
gfx942,304,16000,4096,1024,ck,0,0,209.0921,a8w8_blockscale_1x128x128_256x128x128x128_16x16_32x32_2x2_8x32x1_8x32x1_1x32x1x8_8_1x1_intrawave_v3,641.91,725.28,0.0
gfx942,304,16128,4096,1024,ck,0,0,201.7915,a8w8_blockscale_1x128x128_256x128x128x128_16x16_32x32_2x2_8x32x1_8x32x1_1x32x1x8_8_1x1_intrawave_v3,670.45,757.37,0.0
gfx942,304,16256,4096,1024,ck,0,0,206.6014,a8w8_blockscale_1x128x128_256x128x128x128_16x16_32x32_2x2_8x32x1_8x32x1_1x32x1x8_8_1x1_intrawave_v3,660.04,745.44,0.0
gfx942,304,16384,4096,1024,ck,0,0,215.7629,a8w8_blockscale_1x128x128_256x128x128x128_16x16_32x32_2x2_8x32x1_8x32x1_1x32x1x8_8_1x1_intrawave_v3,636.99,719.26,0.0
gfx942,304,16512,4096,1024,ck,0,0,213.6098,a8w8_blockscale_1x128x128_256x128x128x128_16x16_32x32_2x2_8x32x1_8x32x1_1x32x1x8_8_1x1_intrawave_v3,648.44,732.03,0.0
gfx942,304,16640,4096,1024,ck,0,0,211.9341,a8w8_blockscale_1x128x128_256x128x128x128_16x16_32x32_2x2_8x32x1_8x32x1_1x32x1x8_8_1x1_intrawave_v3,658.63,743.38,0.0
gfx942,304,16768,4096,1024,ck,0,0,207.9518,a8w8_blockscale_1x128x128_256x128x128x128_16x16_32x32_2x2_8x32x1_8x32x1_1x32x1x8_8_1x1_intrawave_v3,676.41,763.29,0.0
gfx942,304,16896,4096,1024,ck,0,0,209.1412,a8w8_blockscale_1x128x128_256x128x128x128_16x16_32x32_2x2_8x32x1_8x32x1_1x32x1x8_8_1x1_intrawave_v3,677.69,764.59,0.0
gfx942,304,17024,4096,1024,ck,0,0,211.9297,a8w8_blockscale_1x128x128_256x128x128x128_16x16_32x32_2x2_8x32x1_8x32x1_1x32x1x8_8_1x1_intrawave_v3,673.84,760.1,0.0
gfx942,304,17152,4096,1024,ck,0,0,221.8576,a8w8_blockscale_1x128x128_256x128x128x128_16x16_32x32_2x2_8x32x1_8x32x1_1x32x1x8_8_1x1_intrawave_v3,648.53,731.4,0.0
gfx942,304,17280,4096,1024,ck,0,0,220.0969,a8w8_blockscale_1x128x128_256x128x128x128_16x16_32x32_2x2_8x32x1_8x32x1_1x32x1x8_8_1x1_intrawave_v3,658.6,742.61,0.0
gfx942,304,17408,4096,1024,ck,0,0,216.5437,a8w8_blockscale_1x128x128_256x128x128x128_16x16_32x32_2x2_8x32x1_8x32x1_1x32x1x8_8_1x1_intrawave_v3,674.36,760.25,0.0
gfx942,304,17536,4096,1024,ck,0,0,219.7246,a8w8_blockscale_1x128x128_256x128x128x128_16x16_32x32_2x2_8x32x1_8x32x1_1x32x1x8_8_1x1_intrawave_v3,669.49,754.61,0.0
gfx942,304,17664,4096,1024,ck,0,0,224.6314,a8w8_blockscale_1x128x128_256x128x128x128_16x16_32x32_2x2_8x32x1_8x32x1_1x32x1x8_8_1x1_intrawave_v3,659.64,743.38,0.0
gfx942,304,17792,4096,1024,ck,0,0,222.4929,a8w8_blockscale_1x128x128_256x128x128x128_16x16_32x32_2x2_8x32x1_8x32x1_1x32x1x8_8_1x1_intrawave_v3,670.81,755.82,0.0
gfx942,304,17920,4096,1024,ck,0,0,225.2829,a8w8_blockscale_1x128x128_256x128x128x128_16x16_32x32_2x2_8x32x1_8x32x1_1x32x1x8_8_1x1_intrawave_v3,667.27,751.7,0.0
gfx942,304,18048,4096,1024,ck,0,0,223.5543,a8w8_blockscale_1x128x128_256x128x128x128_16x16_32x32_2x2_8x32x1_8x32x1_1x32x1x8_8_1x1_intrawave_v3,677.23,762.79,0.0
gfx942,304,18176,4096,1024,ck,0,0,230.1375,a8w8_blockscale_1x128x128_256x128x128x128_16x16_32x32_2x2_8x32x1_8x32x1_1x32x1x8_8_1x1_intrawave_v3,662.52,746.09,0.0
gfx942,304,18304,4096,1024,ck,0,0,236.4542,a8w8_blockscale_1x128x128_256x128x128x128_16x16_32x32_2x2_8x32x1_8x32x1_1x32x1x8_8_1x1_intrawave_v3,649.36,731.15,0.0
gfx942,304,18432,4096,1024,ck,0,0,235.2569,a8w8_blockscale_1x128x128_256x128x128x128_16x16_32x32_2x2_8x32x1_8x32x1_1x32x1x8_8_1x1_intrawave_v3,657.23,739.89,0.0
gfx942,304,18560,4096,1024,ck,0,0,236.5559,a8w8_blockscale_1x128x128_256x128x128x128_16x16_32x32_2x2_8x32x1_8x32x1_1x32x1x8_8_1x1_intrawave_v3,658.16,740.81,0.0
gfx942,304,18688,4096,1024,ck,0,0,237.1341,a8w8_blockscale_1x128x128_256x128x128x128_16x16_32x32_2x2_8x32x1_8x32x1_1x32x1x8_8_1x1_intrawave_v3,661.09,743.98,0.0
gfx942,304,18816,4096,1024,ck,0,0,235.747,a8w8_blockscale_1x128x128_256x128x128x128_16x16_32x32_2x2_8x32x1_8x32x1_1x32x1x8_8_1x1_intrawave_v3,669.53,753.36,0.0
gfx942,304,18944,4096,1024,ck,0,0,238.4282,a8w8_blockscale_1x128x128_256x128x128x128_16x16_32x32_2x2_8x32x1_8x32x1_1x32x1x8_8_1x1_intrawave_v3,666.51,749.84,0.0
gfx942,304,19072,4096,1024,ck,0,0,236.6474,a8w8_blockscale_1x128x128_256x128x128x128_16x16_32x32_2x2_8x32x1_8x32x1_1x32x1x8_8_1x1_intrawave_v3,676.06,760.46,0.0
gfx942,304,19200,4096,1024,ck,0,0,239.2331,a8w8_blockscale_1x128x128_256x128x128x128_16x16_32x32_2x2_8x32x1_8x32x1_1x32x1x8_8_1x1_intrawave_v3,673.24,757.18,0.0
gfx942,304,19328,4096,1024,ck,0,0,242.7524,a8w8_blockscale_1x128x128_256x128x128x128_16x16_32x32_2x2_8x32x1_8x32x1_1x32x1x8_8_1x1_intrawave_v3,667.9,751.06,0.0
gfx942,304,19456,4096,1024,ck,0,0,241.4921,a8w8_blockscale_1x128x128_256x128x128x128_16x16_32x32_2x2_8x32x1_8x32x1_1x32x1x8_8_1x1_intrawave_v3,675.83,759.86,0.0
gfx942,304,19584,4096,1024,ck,0,0,247.7008,a8w8_blockscale_1x128x128_256x128x128x128_16x16_32x32_2x2_8x32x1_8x32x1_1x32x1x8_8_1x1_intrawave_v3,663.23,745.58,0.0
gfx942,304,19712,4096,1024,ck,0,0,250.8953,a8w8_blockscale_1x128x128_256x128x128x128_16x16_32x32_2x2_8x32x1_8x32x1_1x32x1x8_8_1x1_intrawave_v3,659.06,740.79,0.0
gfx942,304,19840,4096,1024,ck,0,0,246.1314,a8w8_blockscale_1x128x128_256x128x128x128_16x16_32x32_2x2_8x32x1_8x32x1_1x32x1x8_8_1x1_intrawave_v3,676.18,759.92,0.0
gfx942,304,19968,4096,1024,ck,0,0,253.0471,a8w8_blockscale_1x128x128_256x128x128x128_16x16_32x32_2x2_8x32x1_8x32x1_1x32x1x8_8_1x1_intrawave_v3,661.95,743.81,0.0
gfx942,304,20096,4096,1024,ck,0,0,248.0117,a8w8_blockscale_1x128x128_256x128x128x128_16x16_32x32_2x2_8x32x1_8x32x1_1x32x1x8_8_1x1_intrawave_v3,679.72,763.67,0.0
gfx942,304,20224,4096,1024,ck,0,0,253.2529,a8w8_blockscale_1x128x128_256x128x128x128_16x16_32x32_2x2_8x32x1_8x32x1_1x32x1x8_8_1x1_intrawave_v3,669.89,752.52,0.0
gfx942,304,20352,4096,1024,ck,0,0,257.7669,a8w8_blockscale_1x128x128_256x128x128x128_16x16_32x32_2x2_8x32x1_8x32x1_1x32x1x8_8_1x1_intrawave_v3,662.32,743.92,0.0
gfx942,304,20480,4096,1024,ck,0,0,255.1335,a8w8_blockscale_1x128x128_256x128x128x128_16x16_32x32_2x2_8x32x1_8x32x1_1x32x1x8_8_1x1_intrawave_v3,673.37,756.22,0.0
gfx942,304,20608,4096,1024,ck,0,0,259.6639,a8w8_blockscale_1x128x128_256x128x128x128_16x16_32x32_2x2_8x32x1_8x32x1_1x32x1x8_8_1x1_intrawave_v3,665.75,747.57,0.0
gfx942,304,20736,4096,1024,ck,0,0,265.1831,a8w8_blockscale_1x128x128_256x128x128x128_16x16_32x32_2x2_8x32x1_8x32x1_1x32x1x8_8_1x1_intrawave_v3,655.95,736.46,0.0
gfx942,304,20864,4096,1024,ck,0,0,265.4848,a8w8_blockscale_1x128x128_256x128x128x128_16x16_32x32_2x2_8x32x1_8x32x1_1x32x1x8_8_1x1_intrawave_v3,659.25,740.07,0.0
gfx942,304,20992,4096,1024,ck,0,0,264.3277,a8w8_blockscale_1x128x128_256x128x128x128_16x16_32x32_2x2_8x32x1_8x32x1_1x32x1x8_8_1x1_intrawave_v3,666.19,747.77,0.0
gfx942,304,21120,4096,1024,ck,0,0,267.6236,a8w8_blockscale_1x128x128_256x128x128x128_16x16_32x32_2x2_8x32x1_8x32x1_1x32x1x8_8_1x1_intrawave_v3,662.0,742.97,0.0
gfx942,304,21248,4096,1024,ck,0,0,269.6074,a8w8_blockscale_1x128x128_256x128x128x128_16x16_32x32_2x2_8x32x1_8x32x1_1x32x1x8_8_1x1_intrawave_v3,661.11,741.88,0.0
gfx942,304,21376,4096,1024,ck,0,0,265.9272,a8w8_blockscale_1x128x128_256x128x128x128_16x16_32x32_2x2_8x32x1_8x32x1_1x32x1x8_8_1x1_intrawave_v3,674.3,756.58,0.0
gfx942,304,21504,4096,1024,ck,0,0,273.9662,a8w8_blockscale_1x128x128_256x128x128x128_16x16_32x32_2x2_8x32x1_8x32x1_1x32x1x8_8_1x1_intrawave_v3,658.43,738.69,0.0
gfx942,304,21632,4096,1024,ck,0,0,271.6568,a8w8_blockscale_1x128x128_256x128x128x128_16x16_32x32_2x2_8x32x1_8x32x1_1x32x1x8_8_1x1_intrawave_v3,667.98,749.31,0.0
gfx942,304,21760,4096,1024,ck,0,0,269.1194,a8w8_blockscale_1x128x128_256x128x128x128_16x16_32x32_2x2_8x32x1_8x32x1_1x32x1x8_8_1x1_intrawave_v3,678.27,760.76,0.0
gfx942,304,21888,4096,1024,ck,0,0,275.0017,a8w8_blockscale_1x128x128_256x128x128x128_16x16_32x32_2x2_8x32x1_8x32x1_1x32x1x8_8_1x1_intrawave_v3,667.67,748.77,0.0
gfx942,304,22016,4096,1024,ck,0,0,285.5716,a8w8_blockscale_1x128x128_256x128x128x128_16x16_32x32_2x2_8x32x1_8x32x1_1x32x1x8_8_1x1_intrawave_v3,646.72,725.19,0.0
gfx942,304,22144,4096,1024,ck,0,0,279.1854,a8w8_blockscale_1x128x128_256x128x128x128_16x16_32x32_2x2_8x32x1_8x32x1_1x32x1x8_8_1x1_intrawave_v3,665.35,746.0,0.0
gfx942,304,22272,4096,1024,ck,0,0,279.1682,a8w8_blockscale_1x128x128_256x128x128x128_16x16_32x32_2x2_8x32x1_8x32x1_1x32x1x8_8_1x1_intrawave_v3,669.24,750.28,0.0
gfx942,304,22400,4096,1024,ck,0,0,278.2111,a8w8_blockscale_1x128x128_256x128x128x128_16x16_32x32_2x2_8x32x1_8x32x1_1x32x1x8_8_1x1_intrawave_v3,675.4,757.1,0.0
gfx942,304,22528,4096,1024,ck,0,0,278.9786,a8w8_blockscale_1x128x128_256x128x128x128_16x16_32x32_2x2_8x32x1_8x32x1_1x32x1x8_8_1x1_intrawave_v3,677.39,759.24,0.0
gfx942,304,22656,4096,1024,ck,0,0,279.3932,a8w8_blockscale_1x128x128_256x128x128x128_16x16_32x32_2x2_8x32x1_8x32x1_1x32x1x8_8_1x1_intrawave_v3,680.23,762.34,0.0
