aiter/configs/model_configs/dsv3_fp4_tuned_fmoe.csv
cu_num,token,model_dim,inter_dim,expert,topk,act_type,dtype,q_dtype_a,q_dtype_w,q_type,use_g1u1,doweight_stage1,block_m,ksplit,us1,kernelName1,err1,us2,kernelName2,err2,us,run_1stage,tflops,bw,_tag
256,1,7168,256,257,9,ActivationType.Silu,torch.bfloat16,torch.float4_e2m1fn_x2,torch.float4_e2m1fn_x2,QuantType.per_1x32,1,0,32,0,11.3537,flydsl_moe1_afp4_wfp4_bf16_t32x32x256_w4_kw4_fp4,0.5%,7.5406,moe_ck2stages_gemm2_64x32x32x128_1x1_MulABScaleExpertWeightShuffled_v1_Nswizzle0_Quant3_MulRoutedWeight1_FP4X2_FP4X2_B16,1.5%,18.8943,0,5.24,74880.4,
256,2,7168,256,257,9,ActivationType.Silu,torch.bfloat16,torch.float4_e2m1fn_x2,torch.float4_e2m1fn_x2,QuantType.per_1x32,1,0,32,0,15.5646,flydsl_moe1_afp4_wfp4_bf16_t32x32x256_w4_bnt0_kw4,0.0%,8.7063,moe_ck2stages_gemm2_256x32x128x128_1x4_MulABScaleExpertWeightShuffled_v3_Nswizzle0_Quant3_MulRoutedWeight1_FP4X2_FP4X2_B16,1.3%,24.2709,0,8.17,58293.44,
256,4,7168,256,257,9,ActivationType.Silu,torch.bfloat16,torch.float4_e2m1fn_x2,torch.float4_e2m1fn_x2,QuantType.per_1x32,1,0,32,0,17.9903,flydsl_moe1_afp4_wfp4_bf16_t32x32x256_w4_bnt0_kw2_fp4,0.6%,12.7431,flydsl_moe2_afp4_wfp4_bf16_t32x128x256_reduce_bnt2,0.0%,30.7334,0,12.9,46037.12,
256,8,7168,256,257,9,ActivationType.Silu,torch.bfloat16,torch.float4_e2m1fn_x2,torch.float4_e2m1fn_x2,QuantType.per_1x32,1,0,32,0,27.7397,flydsl_moe1_afp4_wfp4_bf16_t32x32x256_w3_xcd4_kw2_fp4,0.8%,17.7291,flydsl_moe2_afp4_wfp4_bf16_t32x128x256_reduce,0.1%,45.4688,0,17.43,31119.43,
256,16,7168,256,257,9,ActivationType.Silu,torch.bfloat16,torch.float4_e2m1fn_x2,torch.float4_e2m1fn_x2,QuantType.per_1x32,1,0,32,0,40.5338,flydsl_moe1_afp4_wfp4_bf16_t32x128x256_w3,0.0%,24.9519,flydsl_moe2_afp4_wfp4_bf16_t32x128x256_reduce,0.1%,65.4857,0,24.21,21609.84,
256,32,7168,256,257,9,ActivationType.Silu,torch.bfloat16,torch.float4_e2m1fn_x2,torch.float4_e2m1fn_x2,QuantType.per_1x32,1,0,32,0,58.9403,flydsl_moe1_afp4_wfp4_bf16_t32x64x256_w4,0.0%,36.7406,flydsl_moe2_afp4_wfp4_bf16_t16x256x256_atomic_bnt2_sbm32,1.4%,95.6809,0,33.14,14793.75,
256,64,7168,256,257,9,ActivationType.Silu,torch.bfloat16,torch.float4_e2m1fn_x2,torch.float4_e2m1fn_x2,QuantType.per_1x32,1,0,32,0,86.9658,flydsl_moe1_afp4_wfp4_bf16_t32x32x256_w3,0.0%,50.2012,moe_ck2stages_gemm2_64x32x32x128_1x1_MulABScaleExpertWeightShuffled_v1_Nswizzle0_Quant3_MulRoutedWeight1_FP4X2_FP4X2_B16,1.2%,137.167,0,46.23,10324.4,
256,128,7168,256,257,9,ActivationType.Silu,torch.bfloat16,torch.float4_e2m1fn_x2,torch.float4_e2m1fn_x2,QuantType.per_1x32,1,0,32,0,87.5346,flydsl_moe1_afp4_wfp4_bf16_t32x32x256_w3,0.0%,54.4124,moe_ck2stages_gemm2_64x32x32x128_1x1_MulABScaleExpertWeightShuffled_v1_Nswizzle0_Quant3_MulRoutedWeight1_FP4X2_FP4X2_B16,1.2%,141.947,0,89.35,9986.43,
256,256,7168,256,257,9,ActivationType.Silu,torch.bfloat16,torch.float4_e2m1fn_x2,torch.float4_e2m1fn_x2,QuantType.per_1x32,1,0,32,0,87.99549999999999,flydsl_moe1_afp4_wfp4_bf16_t32x32x256_w3,0.0%,57.677,flydsl_moe2_afp4_wfp4_bf16_t16x256x256_atomic_sbm32,1.2%,145.6725,0,174.14,9749.93,
256,512,7168,256,257,9,ActivationType.Silu,torch.bfloat16,torch.float4_e2m1fn_x2,torch.float4_e2m1fn_x2,QuantType.per_1x32,1,0,32,0,91.2564,flydsl_moe1_afp4_wfp4_bf16_t32x32x256_w3,0.0%,70.2575,flydsl_moe2_afp4_wfp4_bf16_t32x256x256_atomic,1.2%,161.5139,0,314.12,8827.73,
256,1024,7168,256,257,9,ActivationType.Silu,torch.bfloat16,torch.float4_e2m1fn_x2,torch.float4_e2m1fn_x2,QuantType.per_1x32,1,0,64,0,106.2571,flydsl_moe1_afp4_wfp4_bf16_t64x64x256_w4,0.0%,107.529,flydsl_moe2_afp4_wfp4_bf16_t64x256x256_reduce,0.0%,213.7861,0,474.63,6720.79,
256,2048,7168,256,257,9,ActivationType.Silu,torch.bfloat16,torch.float4_e2m1fn_x2,torch.float4_e2m1fn_x2,QuantType.per_1x32,1,0,128,0,129.5561,flydsl_moe1_afp4_wfp4_bf16_t128x64x256_w3,0.0%,168.9543,flydsl_moe2_afp4_wfp4_bf16_t64x256x256_reduce_sbm128,0.0%,298.5104,0,679.83,4887.04,
256,4096,7168,256,257,9,ActivationType.Silu,torch.bfloat16,torch.float4_e2m1fn_x2,torch.float4_e2m1fn_x2,QuantType.per_1x32,1,0,128,0,191.9986,moe_ck2stages_gemm1_256x128x128x128_1x4_MulABScaleShuffled_v3_Nswizzle0_Quant3_MulRoutedWeight0_silu_FP4X2_FP4X2_B16,0.0%,283.9092,flydsl_moe2_afp4_wfp4_bf16_t64x256x256_reduce_persist_sbm128,0.0%,475.9078,0,852.84,3157.9,
256,8192,7168,256,257,9,ActivationType.Silu,torch.bfloat16,torch.float4_e2m1fn_x2,torch.float4_e2m1fn_x2,QuantType.per_1x32,1,0,64,0,273.7589,flydsl_moe1_afp4_wfp4_bf16_t64x64x256_w4_bnt0,0.0%,515.3227,flydsl_moe2_afp4_wfp4_bf16_t64x256x256_reduce_persist,0.0%,789.0816,0,1028.73,2016.21,
256,16384,7168,256,257,9,ActivationType.Silu,torch.bfloat16,torch.float4_e2m1fn_x2,torch.float4_e2m1fn_x2,QuantType.per_1x32,1,0,128,0,425.3491,moe_ck2stages_gemm1_256x128x128x128_1x4_MulABScaleShuffled_v3_Nswizzle0_Quant3_MulRoutedWeight0_silu_FP4X2_FP4X2_B16,0.0%,1027.5233,flydsl_moe2_afp4_wfp4_bf16_t64x256x256_reduce_persist_sbm128,0.0%,1452.8724,0,1117.44,1216.29,
256,32768,7168,256,257,9,ActivationType.Silu,torch.bfloat16,torch.float4_e2m1fn_x2,torch.float4_e2m1fn_x2,QuantType.per_1x32,1,0,128,0,669.5871999999999,moe_ck2stages_gemm1_256x128x128x128_1x4_MulABScaleShuffled_v3_Nswizzle0_Quant3_MulRoutedWeight0_silu_FP4X2_FP4X2_B16,0.0%,2017.8465,flydsl_moe2_afp4_wfp4_bf16_t64x256x256_reduce_sbm128,0.0%,2687.4337,0,1208.21,788.65,
256,1,7168,512,257,9,ActivationType.Silu,torch.bfloat16,torch.float4_e2m1fn_x2,torch.float4_e2m1fn_x2,QuantType.per_1x32,1,0,32,0,12.1428,flydsl_moe1_afp4_wfp4_bf16_t32x32x256_w2_kw4_fp4,0.7%,8.0303,moe_ck2stages_gemm2_256x32x128x128_1x4_MulABScaleExpertWeightShuffled_v3_Nswizzle0_Quant3_MulRoutedWeight1_FP4X2_FP4X2_B16,3.2%,20.1731,0,9.82,140266.19,
256,2,7168,512,257,9,ActivationType.Silu,torch.bfloat16,torch.float4_e2m1fn_x2,torch.float4_e2m1fn_x2,QuantType.per_1x32,1,0,32,0,13.2791,flydsl_moe1_afp4_wfp4_bf16_t32x64x256_w3_bnt0_kw2_fp4,0.6%,12.8927,flydsl_moe2_afp4_wfp4_bf16_t32x256x256_reduce_bnt2,0.2%,26.1718,0,15.14,108117.34,
256,4,7168,512,257,9,ActivationType.Silu,torch.bfloat16,torch.float4_e2m1fn_x2,torch.float4_e2m1fn_x2,QuantType.per_1x32,1,0,32,0,21.8046,flydsl_moe1_afp4_wfp4_bf16_t32x64x256_w2_bnt0_fp4,0.5%,18.3272,flydsl_moe2_afp4_wfp4_bf16_t32x256x256_reduce_xcd4,0.3%,40.1318,0,19.75,70509.38,
256,8,7168,512,257,9,ActivationType.Silu,torch.bfloat16,torch.float4_e2m1fn_x2,torch.float4_e2m1fn_x2,QuantType.per_1x32,1,0,64,0,43.5152,flydsl_moe1_afp4_wfp4_bf16_t64x128x256_w3_fp4,0.8%,30.3587,flydsl_moe2_afp4_wfp4_bf16_t32x256x256_reduce_bnt2_sbm64,0.3%,73.8739,0,21.46,38305.2,
256,16,7168,512,257,9,ActivationType.Silu,torch.bfloat16,torch.float4_e2m1fn_x2,torch.float4_e2m1fn_x2,QuantType.per_1x32,1,0,32,0,69.8082,flydsl_moe1_afp4_wfp4_bf16_t32x128x256_w4_fp4,0.7%,43.6106,flydsl_moe2_afp4_wfp4_bf16_t16x128x256_atomic_bnt2_persist_sbm32,3.2%,113.4188,0,27.96,24951.12,
256,32,7168,512,257,9,ActivationType.Silu,torch.bfloat16,torch.float4_e2m1fn_x2,torch.float4_e2m1fn_x2,QuantType.per_1x32,1,0,32,0,110.4072,flydsl_moe1_afp4_wfp4_bf16_t32x128x256_w4,0.0%,63.8052,flydsl_moe2_afp4_wfp4_bf16_t16x128x256_atomic_sbm32,3.1%,174.2124,0,36.4,16246.09,
256,64,7168,512,257,9,ActivationType.Silu,torch.bfloat16,torch.float4_e2m1fn_x2,torch.float4_e2m1fn_x2,QuantType.per_1x32,1,0,32,0,161.46699999999998,flydsl_moe1_afp4_wfp4_bf16_t32x64x256_w3,0.0%,90.7529,flydsl_moe2_afp4_wfp4_bf16_t32x256x256_atomic_persist,2.8%,252.2199,0,50.29,11224.17,
256,128,7168,512,257,9,ActivationType.Silu,torch.bfloat16,torch.float4_e2m1fn_x2,torch.float4_e2m1fn_x2,QuantType.per_1x32,1,0,32,0,164.0521,flydsl_moe1_afp4_wfp4_bf16_t32x64x256_w3,0.0%,93.291,flydsl_moe2_afp4_wfp4_bf16_t32x256x256_atomic,2.8%,257.3431,0,98.57,11006.06,
256,256,7168,512,257,9,ActivationType.Silu,torch.bfloat16,torch.float4_e2m1fn_x2,torch.float4_e2m1fn_x2,QuantType.per_1x32,1,0,32,0,166.8846,flydsl_moe1_afp4_wfp4_bf16_t32x64x256_w3,0.0%,97.1827,flydsl_moe2_afp4_wfp4_bf16_t32x256x256_atomic_persist,2.9%,264.0673,0,192.13,10736.23,
256,512,7168,512,257,9,ActivationType.Silu,torch.bfloat16,torch.float4_e2m1fn_x2,torch.float4_e2m1fn_x2,QuantType.per_1x32,1,0,32,0,170.0333,flydsl_moe1_afp4_wfp4_bf16_t32x64x256_w3,0.0%,106.3422,flydsl_moe2_afp4_wfp4_bf16_t32x256x256_atomic,2.9%,276.3755,0,367.14,10278.02,
256,1024,7168,512,257,9,ActivationType.Silu,torch.bfloat16,torch.float4_e2m1fn_x2,torch.float4_e2m1fn_x2,QuantType.per_1x32,1,0,64,0,180.1543,flydsl_moe1_afp4_wfp4_bf16_t64x64x256_w3,0.0%,137.7076,flydsl_moe2_afp4_wfp4_bf16_t64x256x256_atomic_persist,2.8%,317.8619,0,638.44,8971.2,
256,2048,7168,512,257,9,ActivationType.Silu,torch.bfloat16,torch.float4_e2m1fn_x2,torch.float4_e2m1fn_x2,QuantType.per_1x32,1,0,128,0,222.5561,flydsl_moe1_afp4_wfp4_bf16_t128x128x256_w4,0.0%,240.4672,flydsl_moe2_afp4_wfp4_bf16_t64x256x256_reduce_persist_sbm128,0.2%,463.0233,0,876.57,6206.22,
256,4096,7168,512,257,9,ActivationType.Silu,torch.bfloat16,torch.float4_e2m1fn_x2,torch.float4_e2m1fn_x2,QuantType.per_1x32,1,0,64,0,324.7556,flydsl_moe1_afp4_wfp4_bf16_t64x64x256_w4_bnt0,0.0%,384.1046,flydsl_moe2_afp4_wfp4_bf16_t64x128x256_reduce_persist,0.3%,708.8602,0,1145.15,4115.99,
256,8192,7168,512,257,9,ActivationType.Silu,torch.bfloat16,torch.float4_e2m1fn_x2,torch.float4_e2m1fn_x2,QuantType.per_1x32,1,0,64,0,480.6866,flydsl_moe1_afp4_wfp4_bf16_t64x128x256_w3_bnt0,0.0%,689.6039,flydsl_moe2_afp4_wfp4_bf16_t64x128x256_reduce,0.2%,1170.2905,0,1387.26,2568.37,
256,16384,7168,512,257,9,ActivationType.Silu,torch.bfloat16,torch.float4_e2m1fn_x2,torch.float4_e2m1fn_x2,QuantType.per_1x32,1,0,64,0,787.1499,flydsl_moe1_afp4_wfp4_bf16_t64x128x256_w3_bnt0,0.0%,1304.7952,flydsl_moe2_afp4_wfp4_bf16_t64x128x256_reduce_persist,0.2%,2091.9451,0,1552.14,1521.03,
256,32768,7168,512,257,9,ActivationType.Silu,torch.bfloat16,torch.float4_e2m1fn_x2,torch.float4_e2m1fn_x2,QuantType.per_1x32,1,0,128,0,1344.8576,moe_ck2stages_gemm1_256x128x128x128_1x4_MulABScaleShuffled_v3_Nswizzle0_Quant3_MulRoutedWeight0_silu_FP4X2_FP4X2_B16,0.0%,2440.2438,flydsl_moe2_afp4_wfp4_bf16_t64x256x256_reduce_xcd4_sbm128,0.3%,3785.1014,0,1715.67,933.72,
256,32768,7168,2048,64,8,ActivationType.Silu,torch.bfloat16,torch.float4_e2m1fn_x2,torch.float4_e2m1fn_x2,QuantType.per_1x32,1,0,128,0,4655.916200000001,moe_ck2stages_gemm1_256x128x128x128_1x4_MulABScaleShuffled_v3_Nswizzle0_Quant3_MulRoutedWeight0_silu_FP4X2_FP4X2_B16,0.0%,4252.6419,flydsl_moe2_afp4_wfp4_bf16_t128x128x256_atomic_persist,6.8%,8908.5581,0,2591.86,395.49,
256,1,7168,2048,32,8,ActivationType.Silu,torch.bfloat16,torch.float4_e2m1fn_x2,torch.float4_e2m1fn_x2,QuantType.per_1x32,1,0,32,0,26.8074,flydsl_moe1_afp4_wfp4_bf16_t32x64x256_fp4,0.7%,17.7858,moe_ck2stages_gemm2_256x32x128x128_1x4_MulABScaleExpertWeightShuffled_v3_Nswizzle0_Quant3_MulRoutedWeight1_FP4X2_FP4X2_B16,6.9%,44.5932,0,15.8,31603.64,
256,2,7168,2048,32,8,ActivationType.Silu,torch.bfloat16,torch.float4_e2m1fn_x2,torch.float4_e2m1fn_x2,QuantType.per_1x32,1,0,32,0,33.8457,flydsl_moe1_afp4_wfp4_bf16_t32x128x256_w4_fp4,0.9%,23.9086,flydsl_moe2_afp4_wfp4_bf16_t32x128x256_reduce,2.4%,57.7543,0,24.4,24402.15,
256,4,7168,2048,32,8,ActivationType.Silu,torch.bfloat16,torch.float4_e2m1fn_x2,torch.float4_e2m1fn_x2,QuantType.per_1x32,1,0,32,0,52.869600000000005,flydsl_moe1_afp4_wfp4_bf16_t32x64x256_w3,0.0%,33.2092,flydsl_moe2_afp4_wfp4_bf16_t32x128x256_reduce_bnt2,1.9%,86.0788,0,32.74,16373.05,
256,8,7168,2048,32,8,ActivationType.Silu,torch.bfloat16,torch.float4_e2m1fn_x2,torch.float4_e2m1fn_x2,QuantType.per_1x32,1,0,32,0,68.02659999999999,flydsl_moe1_afp4_wfp4_bf16_t32x128x256_w4,0.0%,41.2142,flydsl_moe2_afp4_wfp4_bf16_t32x128x256_reduce_bnt2,2.0%,109.2408,0,51.6,12902.31,
256,16,7168,2048,32,8,ActivationType.Silu,torch.bfloat16,torch.float4_e2m1fn_x2,torch.float4_e2m1fn_x2,QuantType.per_1x32,1,0,32,0,74.2951,flydsl_moe1_afp4_wfp4_bf16_t32x128x256_w2_fp4,0.8%,47.8225,flydsl_moe2_afp4_wfp4_bf16_t32x128x256_reduce_bnt2,2.1%,122.1176,0,92.32,11543.22,
256,32,7168,2048,32,8,ActivationType.Silu,torch.bfloat16,torch.float4_e2m1fn_x2,torch.float4_e2m1fn_x2,QuantType.per_1x32,1,0,32,0,80.2395,flydsl_moe1_afp4_wfp4_bf16_t32x128x256_w4,0.0%,49.0071,flydsl_moe2_afp4_wfp4_bf16_t32x128x256_reduce_bnt2,2.1%,129.2466,0,174.46,10909.18,
256,64,7168,2048,32,8,ActivationType.Silu,torch.bfloat16,torch.float4_e2m1fn_x2,torch.float4_e2m1fn_x2,QuantType.per_1x32,1,0,32,0,77.8085,flydsl_moe1_afp4_wfp4_bf16_t32x128x256_w4_fp4,0.8%,51.3074,flydsl_moe2_afp4_wfp4_bf16_t32x128x256_reduce_bnt2,2.1%,129.1159,0,349.28,10925.55,
256,128,7168,2048,32,8,ActivationType.Silu,torch.bfloat16,torch.float4_e2m1fn_x2,torch.float4_e2m1fn_x2,QuantType.per_1x32,1,0,64,0,85.0064,flydsl_moe1_afp4_wfp4_bf16_t64x128x256_w4,0.0%,56.8714,flydsl_moe2_afp4_wfp4_bf16_t64x128x256_reduce_bnt2,2.1%,141.8778,0,635.72,9952.5,
256,256,7168,2048,32,8,ActivationType.Silu,torch.bfloat16,torch.float4_e2m1fn_x2,torch.float4_e2m1fn_x2,QuantType.per_1x32,1,0,128,0,92.7498,flydsl_moe1_afp4_wfp4_bf16_t128x128x256_w3,0.0%,68.5403,flydsl_moe2_afp4_wfp4_bf16_t128x128x256_reduce_bnt2,2.1%,161.2901,0,1118.41,8771.72,
256,512,7168,2048,32,8,ActivationType.Silu,torch.bfloat16,torch.float4_e2m1fn_x2,torch.float4_e2m1fn_x2,QuantType.per_1x32,1,0,64,0,122.358,flydsl_moe1_afp4_wfp4_bf16_t64x128x256_w2_bnt0_fp4,0.8%,98.7092,flydsl_moe2_afp4_wfp4_bf16_t64x128x256_reduce,2.1%,221.0672,0,1631.98,6424.73,
256,1024,7168,2048,32,8,ActivationType.Silu,torch.bfloat16,torch.float4_e2m1fn_x2,torch.float4_e2m1fn_x2,QuantType.per_1x32,1,0,128,0,192.0355,flydsl_moe1_afp4_wfp4_bf16_t128x128x256_w3_bnt0,0.0%,149.1769,flydsl_moe2_afp4_wfp4_bf16_t64x256x256_reduce_sbm128,2.1%,341.2124,0,2114.68,4194.77,
256,2048,7168,2048,32,8,ActivationType.Silu,torch.bfloat16,torch.float4_e2m1fn_x2,torch.float4_e2m1fn_x2,QuantType.per_1x32,1,0,64,0,315.76,flydsl_moe1_afp4_wfp4_bf16_t64x128x256_w3_bnt0_fp4,0.8%,274.6333,flydsl_moe2_afp4_wfp4_bf16_t64x128x256_atomic,6.7%,590.3933,0,2444.32,2461.62,
256,16384,7168,2048,32,8,ActivationType.Silu,torch.bfloat16,torch.float4_e2m1fn_x2,torch.float4_e2m1fn_x2,QuantType.per_1x32,1,0,128,0,2133.3433,moe_ck2stages_gemm1_256x128x128x128_1x4_MulABScaleShuffled_v3_Nswizzle0_Quant3_MulRoutedWeight0_silu_FP4X2_FP4X2_B16,0.0%,1911.0694,flydsl_moe2_afp4_wfp4_bf16_t64x128x256_atomic_persist_sbm128,6.7%,4044.4127,0,2854.52,435.57,
256,32768,7168,2048,32,8,ActivationType.Silu,torch.bfloat16,torch.float4_e2m1fn_x2,torch.float4_e2m1fn_x2,QuantType.per_1x32,1,0,128,0,4180.4737000000005,moe_ck2stages_gemm1_256x128x128x128_1x4_MulABScaleShuffled_v3_Nswizzle0_Quant3_MulRoutedWeight0_silu_FP4X2_FP4X2_B16,0.0%,3905.8948,flydsl_moe2_afp4_wfp4_bf16_t64x128x256_atomic_persist_sbm128,6.7%,8086.3685,0,2855.39,261.42,
256,1,7168,256,256,8,ActivationType.Silu,torch.bfloat16,torch.float4_e2m1fn_x2,torch.float4_e2m1fn_x2,QuantType.per_1x32,1,0,32,0,11.3537,flydsl_moe1_afp4_wfp4_bf16_t32x32x256_w4_kw4_fp4,0.5%,7.5406,moe_ck2stages_gemm2_64x32x32x128_1x1_MulABScaleExpertWeightShuffled_v1_Nswizzle0_Quant3_MulRoutedWeight1_FP4X2_FP4X2_B16,1.5%,18.8943,0,5.24,74880.4,
256,2,7168,256,256,8,ActivationType.Silu,torch.bfloat16,torch.float4_e2m1fn_x2,torch.float4_e2m1fn_x2,QuantType.per_1x32,1,0,32,0,15.5646,flydsl_moe1_afp4_wfp4_bf16_t32x32x256_w4_bnt0_kw4,0.0%,8.7063,moe_ck2stages_gemm2_256x32x128x128_1x4_MulABScaleExpertWeightShuffled_v3_Nswizzle0_Quant3_MulRoutedWeight1_FP4X2_FP4X2_B16,1.3%,24.2709,0,8.17,58293.44,
256,4,7168,256,256,8,ActivationType.Silu,torch.bfloat16,torch.float4_e2m1fn_x2,torch.float4_e2m1fn_x2,QuantType.per_1x32,1,0,32,0,17.9903,flydsl_moe1_afp4_wfp4_bf16_t32x32x256_w4_bnt0_kw2_fp4,0.6%,12.7431,flydsl_moe2_afp4_wfp4_bf16_t32x128x256_reduce_bnt2,0.0%,30.7334,0,12.9,46037.12,
256,8,7168,256,256,8,ActivationType.Silu,torch.bfloat16,torch.float4_e2m1fn_x2,torch.float4_e2m1fn_x2,QuantType.per_1x32,1,0,32,0,27.7397,flydsl_moe1_afp4_wfp4_bf16_t32x32x256_w3_xcd4_kw2_fp4,0.8%,17.7291,flydsl_moe2_afp4_wfp4_bf16_t32x128x256_reduce,0.1%,45.4688,0,17.43,31119.43,
256,16,7168,256,256,8,ActivationType.Silu,torch.bfloat16,torch.float4_e2m1fn_x2,torch.float4_e2m1fn_x2,QuantType.per_1x32,1,0,32,0,40.5338,flydsl_moe1_afp4_wfp4_bf16_t32x128x256_w3,0.0%,24.9519,flydsl_moe2_afp4_wfp4_bf16_t32x128x256_reduce,0.1%,65.4857,0,24.21,21609.84,
256,32,7168,256,256,8,ActivationType.Silu,torch.bfloat16,torch.float4_e2m1fn_x2,torch.float4_e2m1fn_x2,QuantType.per_1x32,1,0,32,0,58.9403,flydsl_moe1_afp4_wfp4_bf16_t32x64x256_w4,0.0%,36.7406,flydsl_moe2_afp4_wfp4_bf16_t16x256x256_atomic_bnt2_sbm32,1.4%,95.6809,0,33.14,14793.75,
256,64,7168,256,256,8,ActivationType.Silu,torch.bfloat16,torch.float4_e2m1fn_x2,torch.float4_e2m1fn_x2,QuantType.per_1x32,1,0,32,0,86.9658,flydsl_moe1_afp4_wfp4_bf16_t32x32x256_w3,0.0%,50.2012,moe_ck2stages_gemm2_64x32x32x128_1x1_MulABScaleExpertWeightShuffled_v1_Nswizzle0_Quant3_MulRoutedWeight1_FP4X2_FP4X2_B16,1.2%,137.167,0,46.23,10324.4,
256,128,7168,256,256,8,ActivationType.Silu,torch.bfloat16,torch.float4_e2m1fn_x2,torch.float4_e2m1fn_x2,QuantType.per_1x32,1,0,32,0,87.5346,flydsl_moe1_afp4_wfp4_bf16_t32x32x256_w3,0.0%,54.4124,moe_ck2stages_gemm2_64x32x32x128_1x1_MulABScaleExpertWeightShuffled_v1_Nswizzle0_Quant3_MulRoutedWeight1_FP4X2_FP4X2_B16,1.2%,141.947,0,89.35,9986.43,
256,256,7168,256,256,8,ActivationType.Silu,torch.bfloat16,torch.float4_e2m1fn_x2,torch.float4_e2m1fn_x2,QuantType.per_1x32,1,0,32,0,87.99549999999999,flydsl_moe1_afp4_wfp4_bf16_t32x32x256_w3,0.0%,57.677,flydsl_moe2_afp4_wfp4_bf16_t16x256x256_atomic_sbm32,1.2%,145.6725,0,174.14,9749.93,
256,512,7168,256,256,8,ActivationType.Silu,torch.bfloat16,torch.float4_e2m1fn_x2,torch.float4_e2m1fn_x2,QuantType.per_1x32,1,0,32,0,91.2564,flydsl_moe1_afp4_wfp4_bf16_t32x32x256_w3,0.0%,70.2575,flydsl_moe2_afp4_wfp4_bf16_t32x256x256_atomic,1.2%,161.5139,0,314.12,8827.73,
256,1024,7168,256,256,8,ActivationType.Silu,torch.bfloat16,torch.float4_e2m1fn_x2,torch.float4_e2m1fn_x2,QuantType.per_1x32,1,0,64,0,106.2571,flydsl_moe1_afp4_wfp4_bf16_t64x64x256_w4,0.0%,107.529,flydsl_moe2_afp4_wfp4_bf16_t64x256x256_reduce,0.0%,213.7861,0,474.63,6720.79,
256,2048,7168,256,256,8,ActivationType.Silu,torch.bfloat16,torch.float4_e2m1fn_x2,torch.float4_e2m1fn_x2,QuantType.per_1x32,1,0,128,0,129.5561,flydsl_moe1_afp4_wfp4_bf16_t128x64x256_w3,0.0%,168.9543,flydsl_moe2_afp4_wfp4_bf16_t64x256x256_reduce_sbm128,0.0%,298.5104,0,679.83,4887.04,
256,4096,7168,256,256,8,ActivationType.Silu,torch.bfloat16,torch.float4_e2m1fn_x2,torch.float4_e2m1fn_x2,QuantType.per_1x32,1,0,128,0,191.9986,moe_ck2stages_gemm1_256x128x128x128_1x4_MulABScaleShuffled_v3_Nswizzle0_Quant3_MulRoutedWeight0_silu_FP4X2_FP4X2_B16,0.0%,283.9092,flydsl_moe2_afp4_wfp4_bf16_t64x256x256_reduce_persist_sbm128,0.0%,475.9078,0,852.84,3157.9,
256,8192,7168,256,256,8,ActivationType.Silu,torch.bfloat16,torch.float4_e2m1fn_x2,torch.float4_e2m1fn_x2,QuantType.per_1x32,1,0,64,0,273.7589,flydsl_moe1_afp4_wfp4_bf16_t64x64x256_w4_bnt0,0.0%,515.3227,flydsl_moe2_afp4_wfp4_bf16_t64x256x256_reduce_persist,0.0%,789.0816,0,1028.73,2016.21,
256,16384,7168,256,256,8,ActivationType.Silu,torch.bfloat16,torch.float4_e2m1fn_x2,torch.float4_e2m1fn_x2,QuantType.per_1x32,1,0,128,0,425.3491,moe_ck2stages_gemm1_256x128x128x128_1x4_MulABScaleShuffled_v3_Nswizzle0_Quant3_MulRoutedWeight0_silu_FP4X2_FP4X2_B16,0.0%,1027.5233,flydsl_moe2_afp4_wfp4_bf16_t64x256x256_reduce_persist_sbm128,0.0%,1452.8724,0,1117.44,1216.29,
256,32768,7168,256,256,8,ActivationType.Silu,torch.bfloat16,torch.float4_e2m1fn_x2,torch.float4_e2m1fn_x2,QuantType.per_1x32,1,0,128,0,669.5871999999999,moe_ck2stages_gemm1_256x128x128x128_1x4_MulABScaleShuffled_v3_Nswizzle0_Quant3_MulRoutedWeight0_silu_FP4X2_FP4X2_B16,0.0%,2017.8465,flydsl_moe2_afp4_wfp4_bf16_t64x256x256_reduce_sbm128,0.0%,2687.4337,0,1208.21,788.65,
256,1,7168,512,256,8,ActivationType.Silu,torch.bfloat16,torch.float4_e2m1fn_x2,torch.float4_e2m1fn_x2,QuantType.per_1x32,1,0,32,0,12.1428,flydsl_moe1_afp4_wfp4_bf16_t32x32x256_w2_kw4_fp4,0.7%,8.0303,moe_ck2stages_gemm2_256x32x128x128_1x4_MulABScaleExpertWeightShuffled_v3_Nswizzle0_Quant3_MulRoutedWeight1_FP4X2_FP4X2_B16,3.2%,20.1731,0,9.82,140266.19,
256,2,7168,512,256,8,ActivationType.Silu,torch.bfloat16,torch.float4_e2m1fn_x2,torch.float4_e2m1fn_x2,QuantType.per_1x32,1,0,32,0,13.2791,flydsl_moe1_afp4_wfp4_bf16_t32x64x256_w3_bnt0_kw2_fp4,0.6%,12.8927,flydsl_moe2_afp4_wfp4_bf16_t32x256x256_reduce_bnt2,0.2%,26.1718,0,15.14,108117.34,
256,4,7168,512,256,8,ActivationType.Silu,torch.bfloat16,torch.float4_e2m1fn_x2,torch.float4_e2m1fn_x2,QuantType.per_1x32,1,0,32,0,21.8046,flydsl_moe1_afp4_wfp4_bf16_t32x64x256_w2_bnt0_fp4,0.5%,18.3272,flydsl_moe2_afp4_wfp4_bf16_t32x256x256_reduce_xcd4,0.3%,40.1318,0,19.75,70509.38,
256,8,7168,512,256,8,ActivationType.Silu,torch.bfloat16,torch.float4_e2m1fn_x2,torch.float4_e2m1fn_x2,QuantType.per_1x32,1,0,64,0,43.5152,flydsl_moe1_afp4_wfp4_bf16_t64x128x256_w3_fp4,0.8%,30.3587,flydsl_moe2_afp4_wfp4_bf16_t32x256x256_reduce_bnt2_sbm64,0.3%,73.8739,0,21.46,38305.2,
256,16,7168,512,256,8,ActivationType.Silu,torch.bfloat16,torch.float4_e2m1fn_x2,torch.float4_e2m1fn_x2,QuantType.per_1x32,1,0,32,0,69.8082,flydsl_moe1_afp4_wfp4_bf16_t32x128x256_w4_fp4,0.7%,43.6106,flydsl_moe2_afp4_wfp4_bf16_t16x128x256_atomic_bnt2_persist_sbm32,3.2%,113.4188,0,27.96,24951.12,
256,32,7168,512,256,8,ActivationType.Silu,torch.bfloat16,torch.float4_e2m1fn_x2,torch.float4_e2m1fn_x2,QuantType.per_1x32,1,0,32,0,110.4072,flydsl_moe1_afp4_wfp4_bf16_t32x128x256_w4,0.0%,63.8052,flydsl_moe2_afp4_wfp4_bf16_t16x128x256_atomic_sbm32,3.1%,174.2124,0,36.4,16246.09,
256,64,7168,512,256,8,ActivationType.Silu,torch.bfloat16,torch.float4_e2m1fn_x2,torch.float4_e2m1fn_x2,QuantType.per_1x32,1,0,32,0,161.46699999999998,flydsl_moe1_afp4_wfp4_bf16_t32x64x256_w3,0.0%,90.7529,flydsl_moe2_afp4_wfp4_bf16_t32x256x256_atomic_persist,2.8%,252.2199,0,50.29,11224.17,
256,128,7168,512,256,8,ActivationType.Silu,torch.bfloat16,torch.float4_e2m1fn_x2,torch.float4_e2m1fn_x2,QuantType.per_1x32,1,0,32,0,164.0521,flydsl_moe1_afp4_wfp4_bf16_t32x64x256_w3,0.0%,93.291,flydsl_moe2_afp4_wfp4_bf16_t32x256x256_atomic,2.8%,257.3431,0,98.57,11006.06,
256,256,7168,512,256,8,ActivationType.Silu,torch.bfloat16,torch.float4_e2m1fn_x2,torch.float4_e2m1fn_x2,QuantType.per_1x32,1,0,32,0,166.8846,flydsl_moe1_afp4_wfp4_bf16_t32x64x256_w3,0.0%,97.1827,flydsl_moe2_afp4_wfp4_bf16_t32x256x256_atomic_persist,2.9%,264.0673,0,192.13,10736.23,
256,512,7168,512,256,8,ActivationType.Silu,torch.bfloat16,torch.float4_e2m1fn_x2,torch.float4_e2m1fn_x2,QuantType.per_1x32,1,0,32,0,170.0333,flydsl_moe1_afp4_wfp4_bf16_t32x64x256_w3,0.0%,106.3422,flydsl_moe2_afp4_wfp4_bf16_t32x256x256_atomic,2.9%,276.3755,0,367.14,10278.02,
256,1024,7168,512,256,8,ActivationType.Silu,torch.bfloat16,torch.float4_e2m1fn_x2,torch.float4_e2m1fn_x2,QuantType.per_1x32,1,0,64,0,180.1543,flydsl_moe1_afp4_wfp4_bf16_t64x64x256_w3,0.0%,137.7076,flydsl_moe2_afp4_wfp4_bf16_t64x256x256_atomic_persist,2.8%,317.8619,0,638.44,8971.2,
256,2048,7168,512,256,8,ActivationType.Silu,torch.bfloat16,torch.float4_e2m1fn_x2,torch.float4_e2m1fn_x2,QuantType.per_1x32,1,0,128,0,222.5561,flydsl_moe1_afp4_wfp4_bf16_t128x128x256_w4,0.0%,240.4672,flydsl_moe2_afp4_wfp4_bf16_t64x256x256_reduce_persist_sbm128,0.2%,463.0233,0,876.57,6206.22,
256,4096,7168,512,256,8,ActivationType.Silu,torch.bfloat16,torch.float4_e2m1fn_x2,torch.float4_e2m1fn_x2,QuantType.per_1x32,1,0,64,0,324.7556,flydsl_moe1_afp4_wfp4_bf16_t64x64x256_w4_bnt0,0.0%,384.1046,flydsl_moe2_afp4_wfp4_bf16_t64x128x256_reduce_persist,0.3%,708.8602,0,1145.15,4115.99,
256,8192,7168,512,256,8,ActivationType.Silu,torch.bfloat16,torch.float4_e2m1fn_x2,torch.float4_e2m1fn_x2,QuantType.per_1x32,1,0,64,0,480.6866,flydsl_moe1_afp4_wfp4_bf16_t64x128x256_w3_bnt0,0.0%,689.6039,flydsl_moe2_afp4_wfp4_bf16_t64x128x256_reduce,0.2%,1170.2905,0,1387.26,2568.37,
256,16384,7168,512,256,8,ActivationType.Silu,torch.bfloat16,torch.float4_e2m1fn_x2,torch.float4_e2m1fn_x2,QuantType.per_1x32,1,0,64,0,787.1499,flydsl_moe1_afp4_wfp4_bf16_t64x128x256_w3_bnt0,0.0%,1304.7952,flydsl_moe2_afp4_wfp4_bf16_t64x128x256_reduce_persist,0.2%,2091.9451,0,1552.14,1521.03,
256,32768,7168,512,256,8,ActivationType.Silu,torch.bfloat16,torch.float4_e2m1fn_x2,torch.float4_e2m1fn_x2,QuantType.per_1x32,1,0,128,0,1344.8576,moe_ck2stages_gemm1_256x128x128x128_1x4_MulABScaleShuffled_v3_Nswizzle0_Quant3_MulRoutedWeight0_silu_FP4X2_FP4X2_B16,0.0%,2440.2438,flydsl_moe2_afp4_wfp4_bf16_t64x256x256_reduce_xcd4_sbm128,0.3%,3785.1014,0,1715.67,933.72,
