aiter/configs/model_configs/dsv3_a8w8_bpreshuffle_tuned_gemm.csv
gfx,cu_num,M,N,K,q_dtype_w,libtype,kernelId,splitK,us,kernelName,tflops,bw,errRatio
gfx942,80,1,64,7168,torch.float8_e4m3fnuz,ck,10,0,10.109,a8w8_bpreshuffle_128x16x32x512_16x16_16x16_32x4x1_32x4x1_1x16x1x8_4x4x1_1x1_intrawave_v1,0.09,46.1,0.0
gfx942,80,2,64,7168,torch.float8_e4m3fnuz,ck,10,0,10.1816,a8w8_bpreshuffle_128x16x32x512_16x16_16x16_32x4x1_32x4x1_1x16x1x8_4x4x1_1x1_intrawave_v1,0.18,46.49,0.0
gfx942,80,4,64,7168,torch.float8_e4m3fnuz,ck,10,0,10.1737,a8w8_bpreshuffle_128x16x32x512_16x16_16x16_32x4x1_32x4x1_1x16x1x8_4x4x1_1x1_intrawave_v1,0.36,47.96,0.0
gfx942,80,8,64,7168,torch.float8_e4m3fnuz,ck,10,0,10.4092,a8w8_bpreshuffle_128x16x32x512_16x16_16x16_32x4x1_32x4x1_1x16x1x8_4x4x1_1x1_intrawave_v1,0.71,49.68,0.0
gfx942,80,16,64,7168,torch.float8_e4m3fnuz,ck,24,0,8.826,a8w8_bpreshuffle_128x16x32x512_16x16_16x16_32x4x1_32x4x1_1x16x1x8_4x4x1_1x1_intrawave_v2,1.66,65.2,0.0
gfx942,80,32,64,7168,torch.float8_e4m3fnuz,ck,24,0,9.4134,a8w8_bpreshuffle_128x16x32x512_16x16_16x16_32x4x1_32x4x1_1x16x1x8_4x4x1_1x1_intrawave_v2,3.12,73.54,0.0
gfx942,80,64,64,7168,torch.float8_e4m3fnuz,ck,24,0,9.3656,a8w8_bpreshuffle_128x16x32x512_16x16_16x16_32x4x1_32x4x1_1x16x1x8_4x4x1_1x1_intrawave_v2,6.27,98.84,0.0
gfx942,80,96,64,7168,torch.float8_e4m3fnuz,ck,24,0,9.3563,a8w8_bpreshuffle_128x16x32x512_16x16_16x16_32x4x1_32x4x1_1x16x1x8_4x4x1_1x1_intrawave_v2,9.41,123.89,0.0
gfx942,80,128,64,7168,torch.float8_e4m3fnuz,ck,24,0,9.4481,a8w8_bpreshuffle_128x16x32x512_16x16_16x16_32x4x1_32x4x1_1x16x1x8_4x4x1_1x1_intrawave_v2,12.43,147.4,0.0
gfx942,80,160,64,7168,torch.float8_e4m3fnuz,ck,24,0,9.4711,a8w8_bpreshuffle_128x16x32x512_16x16_16x16_32x4x1_32x4x1_1x16x1x8_4x4x1_1x1_intrawave_v2,15.5,171.69,0.0
gfx942,80,192,64,7168,torch.float8_e4m3fnuz,ck,24,0,9.4734,a8w8_bpreshuffle_128x16x32x512_16x16_16x16_32x4x1_32x4x1_1x16x1x8_4x4x1_1x1_intrawave_v2,18.6,196.3,0.0
gfx942,80,224,64,7168,torch.float8_e4m3fnuz,ck,10,0,9.6924,a8w8_bpreshuffle_128x16x32x512_16x16_16x16_32x4x1_32x4x1_1x16x1x8_4x4x1_1x1_intrawave_v1,21.2,215.95,0.0
gfx942,80,256,64,7168,torch.float8_e4m3fnuz,ck,10,0,9.9464,a8w8_bpreshuffle_128x16x32x512_16x16_16x16_32x4x1_32x4x1_1x16x1x8_4x4x1_1x1_intrawave_v1,23.61,233.91,0.0
gfx942,80,288,64,7168,torch.float8_e4m3fnuz,ck,24,0,10.0283,a8w8_bpreshuffle_128x16x32x512_16x16_16x16_32x4x1_32x4x1_1x16x1x8_4x4x1_1x1_intrawave_v2,26.35,255.28,0.0
gfx942,80,320,64,7168,torch.float8_e4m3fnuz,ck,24,0,10.6767,a8w8_bpreshuffle_128x16x32x512_16x16_16x16_32x4x1_32x4x1_1x16x1x8_4x4x1_1x1_intrawave_v2,27.5,261.64,0.0
gfx942,80,352,64,7168,torch.float8_e4m3fnuz,ck,24,0,10.7355,a8w8_bpreshuffle_128x16x32x512_16x16_16x16_32x4x1_32x4x1_1x16x1x8_4x4x1_1x1_intrawave_v2,30.08,281.96,0.0
gfx942,80,384,64,7168,torch.float8_e4m3fnuz,ck,24,0,10.7324,a8w8_bpreshuffle_128x16x32x512_16x16_16x16_32x4x1_32x4x1_1x16x1x8_4x4x1_1x1_intrawave_v2,32.83,303.79,0.0
gfx942,80,416,64,7168,torch.float8_e4m3fnuz,ck,10,0,10.8957,a8w8_bpreshuffle_128x16x32x512_16x16_16x16_32x4x1_32x4x1_1x16x1x8_4x4x1_1x1_intrawave_v1,35.03,320.67,0.0
gfx942,80,448,64,7168,torch.float8_e4m3fnuz,ck,24,0,10.9127,a8w8_bpreshuffle_128x16x32x512_16x16_16x16_32x4x1_32x4x1_1x16x1x8_4x4x1_1x1_intrawave_v2,37.67,341.56,0.0
gfx942,80,480,64,7168,torch.float8_e4m3fnuz,ck,24,0,10.9898,a8w8_bpreshuffle_128x16x32x512_16x16_16x16_32x4x1_32x4x1_1x16x1x8_4x4x1_1x1_intrawave_v2,40.07,360.41,0.0
gfx942,80,512,64,7168,torch.float8_e4m3fnuz,ck,24,0,11.1383,a8w8_bpreshuffle_128x16x32x512_16x16_16x16_32x4x1_32x4x1_1x16x1x8_4x4x1_1x1_intrawave_v2,42.18,376.57,0.0
gfx942,80,1024,64,7168,torch.float8_e4m3fnuz,ck,5,0,12.4536,a8w8_bpreshuffle_256x16x64x512_16x16_16x16_32x8x1_32x8x1_1x16x1x16_4x4x1_1x1_intrawave_v1,75.44,636.75,0.0
gfx942,80,2048,64,7168,torch.float8_e4m3fnuz,ck,12,0,18.011,a8w8_bpreshuffle_256x32x64x512_16x16_16x16_32x8x1_32x8x1_1x32x1x8_8x8x1_1x2_intrawave_v1,104.33,855.09,0.0
gfx942,80,4096,64,7168,torch.float8_e4m3fnuz,ck,114,0,24.9271,a8w8_bpreshuffle_256x64x64x256_16x16_16x16_16x16x1_16x16x1_1x32x1x8_8x8x1_2x1_intrawave_v3,150.76,1217.28,0.0
gfx942,80,6144,64,7168,torch.float8_e4m3fnuz,ck,115,0,32.8306,a8w8_bpreshuffle_256x80x64x256_16x16_16x16_16x16x1_16x16x1_1x16x1x16_4x4x1_1x1_intrawave_v3,171.7,1379.36,0.0
gfx942,80,8192,64,7168,torch.float8_e4m3fnuz,ck,114,0,41.1456,a8w8_bpreshuffle_256x64x64x256_16x16_16x16_16x16x1_16x16x1_1x32x1x8_8x8x1_2x1_intrawave_v3,182.67,1463.77,0.0
gfx942,80,10240,64,7168,torch.float8_e4m3fnuz,ck,144,0,42.9825,a8w8_bpreshuffle_256x128x64x256_16x16_16x16_16x16x1_16x16x1_1x32x1x8_8x8x1_2x1_intrawave_v3,218.58,1748.85,0.0
gfx942,80,12288,64,7168,torch.float8_e4m3fnuz,ck,114,0,61.5548,a8w8_bpreshuffle_256x64x64x256_16x16_16x16_16x16x1_16x16x1_1x32x1x8_8x8x1_2x1_intrawave_v3,183.16,1463.93,0.0
gfx942,80,14336,64,7168,torch.float8_e4m3fnuz,ck,114,0,62.6178,a8w8_bpreshuffle_256x64x64x256_16x16_16x16_16x16x1_16x16x1_1x32x1x8_8x8x1_2x1_intrawave_v3,210.06,1677.71,0.0
gfx942,80,16384,64,7168,torch.float8_e4m3fnuz,ck,114,0,78.1928,a8w8_bpreshuffle_256x64x64x256_16x16_16x16_16x16x1_16x16x1_1x32x1x8_8x8x1_2x1_intrawave_v3,192.25,1534.62,0.0
gfx942,80,32768,64,7168,torch.float8_e4m3fnuz,ck,114,0,137.0183,a8w8_bpreshuffle_256x64x64x256_16x16_16x16_16x16x1_16x16x1_1x32x1x8_8x8x1_2x1_intrawave_v3,219.42,1748.19,0.0
gfx942,80,65536,64,7168,torch.float8_e4m3fnuz,ck,114,0,263.1602,a8w8_bpreshuffle_256x64x64x256_16x16_16x16_16x16x1_16x16x1_1x32x1x8_8x8x1_2x1_intrawave_v3,228.49,1818.7,0.0
gfx942,80,98304,64,7168,torch.float8_e4m3fnuz,ck,114,0,397.9789,a8w8_bpreshuffle_256x64x64x256_16x16_16x16_16x16x1_16x16x1_1x32x1x8_8x8x1_2x1_intrawave_v3,226.63,1803.32,0.0
gfx942,80,1,128,7168,torch.float8_e4m3fnuz,ck,25,0,10.735,a8w8_bpreshuffle_256x16x64x512_16x16_16x16_32x8x1_32x8x1_1x16x1x16_4x4x1_1x1_intrawave_v2,0.0,0.0,0.0
gfx942,80,2,128,7168,torch.float8_e4m3fnuz,ck,10,0,10.1434,a8w8_bpreshuffle_128x16x32x512_16x16_16x16_32x4x1_32x4x1_1x16x1x8_4x4x1_1x1_intrawave_v1,0.0,0.0,0.0
gfx942,80,4,128,7168,torch.float8_e4m3fnuz,ck,10,0,10.0606,a8w8_bpreshuffle_128x16x32x512_16x16_16x16_32x4x1_32x4x1_1x16x1x8_4x4x1_1x1_intrawave_v1,0.0,0.0,0.0
gfx942,80,8,128,7168,torch.float8_e4m3fnuz,ck,10,0,10.4198,a8w8_bpreshuffle_128x16x32x512_16x16_16x16_32x4x1_32x4x1_1x16x1x8_4x4x1_1x1_intrawave_v1,0.0,0.0,0.0
gfx942,80,16,128,7168,torch.float8_e4m3fnuz,ck,19,0,10.0946,a8w8_bpreshuffle_256x16x64x512_16x16_16x16_32x8x1_32x8x1_1x16x1x16_4x4x1_1x1_intrawave_v2,0.0,0.0,0.0
gfx942,80,32,128,7168,torch.float8_e4m3fnuz,ck,10,0,10.0298,a8w8_bpreshuffle_128x16x32x512_16x16_16x16_32x4x1_32x4x1_1x16x1x8_4x4x1_1x1_intrawave_v1,0.0,0.0,0.0
gfx942,80,64,128,7168,torch.float8_e4m3fnuz,ck,24,0,9.9198,a8w8_bpreshuffle_128x16x32x512_16x16_16x16_32x4x1_32x4x1_1x16x1x8_4x4x1_1x1_intrawave_v2,0.0,0.0,0.0
gfx942,80,96,128,7168,torch.float8_e4m3fnuz,ck,25,0,10.3566,a8w8_bpreshuffle_256x16x64x512_16x16_16x16_32x8x1_32x8x1_1x16x1x16_4x4x1_1x1_intrawave_v2,0.0,0.0,0.0
gfx942,80,128,128,7168,torch.float8_e4m3fnuz,ck,10,0,9.909,a8w8_bpreshuffle_128x16x32x512_16x16_16x16_32x4x1_32x4x1_1x16x1x8_4x4x1_1x1_intrawave_v1,0.0,0.0,0.0
gfx942,80,160,128,7168,torch.float8_e4m3fnuz,ck,10,0,10.2346,a8w8_bpreshuffle_128x16x32x512_16x16_16x16_32x4x1_32x4x1_1x16x1x8_4x4x1_1x1_intrawave_v1,0.0,0.0,0.0
gfx942,80,192,128,7168,torch.float8_e4m3fnuz,ck,10,0,10.2034,a8w8_bpreshuffle_128x16x32x512_16x16_16x16_32x4x1_32x4x1_1x16x1x8_4x4x1_1x1_intrawave_v1,0.0,0.0,0.0
gfx942,80,224,128,7168,torch.float8_e4m3fnuz,ck,24,0,10.2858,a8w8_bpreshuffle_128x16x32x512_16x16_16x16_32x4x1_32x4x1_1x16x1x8_4x4x1_1x1_intrawave_v2,0.0,0.0,0.0
gfx942,80,256,128,7168,torch.float8_e4m3fnuz,ck,10,0,10.8778,a8w8_bpreshuffle_128x16x32x512_16x16_16x16_32x4x1_32x4x1_1x16x1x8_4x4x1_1x1_intrawave_v1,0.0,0.0,0.0
gfx942,80,288,128,7168,torch.float8_e4m3fnuz,ck,10,0,10.7298,a8w8_bpreshuffle_128x16x32x512_16x16_16x16_32x4x1_32x4x1_1x16x1x8_4x4x1_1x1_intrawave_v1,0.0,0.0,0.0
gfx942,80,320,128,7168,torch.float8_e4m3fnuz,ck,24,0,10.9094,a8w8_bpreshuffle_128x16x32x512_16x16_16x16_32x4x1_32x4x1_1x16x1x8_4x4x1_1x1_intrawave_v2,0.0,0.0,0.0
gfx942,80,352,128,7168,torch.float8_e4m3fnuz,ck,10,0,11.2254,a8w8_bpreshuffle_128x16x32x512_16x16_16x16_32x4x1_32x4x1_1x16x1x8_4x4x1_1x1_intrawave_v1,0.0,0.0,0.0
gfx942,80,384,128,7168,torch.float8_e4m3fnuz,ck,10,0,11.3822,a8w8_bpreshuffle_128x16x32x512_16x16_16x16_32x4x1_32x4x1_1x16x1x8_4x4x1_1x1_intrawave_v1,0.0,0.0,0.0
gfx942,80,416,128,7168,torch.float8_e4m3fnuz,ck,24,0,11.6798,a8w8_bpreshuffle_128x16x32x512_16x16_16x16_32x4x1_32x4x1_1x16x1x8_4x4x1_1x1_intrawave_v2,0.0,0.0,0.0
gfx942,80,448,128,7168,torch.float8_e4m3fnuz,ck,10,0,11.523,a8w8_bpreshuffle_128x16x32x512_16x16_16x16_32x4x1_32x4x1_1x16x1x8_4x4x1_1x1_intrawave_v1,0.0,0.0,0.0
gfx942,80,480,128,7168,torch.float8_e4m3fnuz,ck,10,0,11.607,a8w8_bpreshuffle_128x16x32x512_16x16_16x16_32x4x1_32x4x1_1x16x1x8_4x4x1_1x1_intrawave_v1,0.0,0.0,0.0
gfx942,80,512,128,7168,torch.float8_e4m3fnuz,ck,11,0,12.1131,a8w8_bpreshuffle_256x16x64x512_16x16_16x16_32x8x1_32x8x1_1x16x1x16_4x4x1_1x1_intrawave_v1,0.0,0.0,0.0
gfx942,80,1024,128,7168,torch.float8_e4m3fnuz,ck,6,0,17.8979,a8w8_bpreshuffle_256x16x128x512_16x16_16x16_32x8x1_32x8x1_1x16x1x16_8x8x1_1x2_intrawave_v1,0.0,0.0,0.0
gfx942,80,2048,128,7168,torch.float8_e4m3fnuz,ck,119,0,24.0187,a8w8_bpreshuffle_256x32x128x256_16x16_16x16_16x16x1_16x16x1_1x16x1x16_8x8x1_1x2_intrawave_v1,0.0,0.0,0.0
gfx942,80,4096,128,7168,torch.float8_e4m3fnuz,ck,121,0,38.9415,a8w8_bpreshuffle_256x64x128x256_16x16_16x16_16x16x1_16x16x1_1x16x1x16_8x8x1_1x2_intrawave_v3,0.0,0.0,0.0
gfx942,80,6144,128,7168,torch.float8_e4m3fnuz,ck,123,0,49.1848,a8w8_bpreshuffle_256x96x128x256_16x16_16x16_16x16x1_16x16x1_1x16x1x16_8x8x1_1x2_intrawave_v3,0.0,0.0,0.0
gfx942,80,8192,128,7168,torch.float8_e4m3fnuz,ck,124,0,61.8924,a8w8_bpreshuffle_256x112x128x256_16x16_16x16_16x16x1_16x16x1_1x16x1x16_8x8x1_1x2_intrawave_v3,0.0,0.0,0.0
gfx942,80,10240,128,7168,torch.float8_e4m3fnuz,ck,121,0,63.2764,a8w8_bpreshuffle_256x64x128x256_16x16_16x16_16x16x1_16x16x1_1x16x1x16_8x8x1_1x2_intrawave_v3,0.0,0.0,0.0
gfx942,80,12288,128,7168,torch.float8_e4m3fnuz,ck,141,0,84.5069,a8w8_bpreshuffle_256x160x128x128_16x16_16x16_8x32x1_8x32x1_1x16x1x16_8x8x1_1x2_intrawave_v3,0.0,0.0,0.0
gfx942,80,14336,128,7168,torch.float8_e4m3fnuz,ck,86,0,91.5501,a8w8_bpreshuffle_256x96x128x128_16x16_16x16_8x32x1_8x32x1_1x32x1x8_8x8x1_2x1_intrawave_v3,0.0,0.0,0.0
gfx942,80,16384,128,7168,torch.float8_e4m3fnuz,ck,0,0,114.6838,a8w8_bpreshuffle_256x128x128x128_16x16_16x16_8x32x1_8x32x1_1x32x1x8_8x8x1_2x1_intrawave_v3,0.0,0.0,0.0
gfx942,80,32768,128,7168,torch.float8_e4m3fnuz,ck,121,0,208.4886,a8w8_bpreshuffle_256x64x128x256_16x16_16x16_16x16x1_16x16x1_1x16x1x16_8x8x1_1x2_intrawave_v3,0.0,0.0,0.0
gfx942,80,65536,128,7168,torch.float8_e4m3fnuz,ck,121,0,383.2232,a8w8_bpreshuffle_256x64x128x256_16x16_16x16_16x16x1_16x16x1_1x16x1x16_8x8x1_1x2_intrawave_v3,0.0,0.0,0.0
gfx942,80,98304,128,7168,torch.float8_e4m3fnuz,ck,87,0,561.5334,a8w8_bpreshuffle_256x128x128x128_16x16_16x16_8x32x1_8x32x1_1x16x1x16_4x4x1_1x1_intrawave_v3,0.0,0.0,0.0
gfx942,80,131072,128,7168,torch.float8_e4m3fnuz,ck,0,0,719.3472,a8w8_bpreshuffle_256x128x128x128_16x16_16x16_8x32x1_8x32x1_1x32x1x8_8x8x1_2x1_intrawave_v3,0.0,0.0,0.0
gfx942,80,1,256,7168,torch.float8_e4m3fnuz,ck,10,0,10.212,a8w8_bpreshuffle_128x16x32x512_16x16_16x16_32x4x1_32x4x1_1x16x1x8_4x4x1_1x1_intrawave_v1,0.36,180.44,0.0
gfx942,80,2,256,7168,torch.float8_e4m3fnuz,ck,10,0,10.52,a8w8_bpreshuffle_128x16x32x512_16x16_16x16_32x4x1_32x4x1_1x16x1x8_4x4x1_1x1_intrawave_v1,0.7,175.89,0.0
gfx942,80,4,256,7168,torch.float8_e4m3fnuz,ck,10,0,10.571,a8w8_bpreshuffle_128x16x32x512_16x16_16x16_32x4x1_32x4x1_1x16x1x8_4x4x1_1x1_intrawave_v1,1.39,176.49,0.0
gfx942,80,8,256,7168,torch.float8_e4m3fnuz,ck,10,0,10.72,a8w8_bpreshuffle_128x16x32x512_16x16_16x16_32x4x1_32x4x1_1x16x1x8_4x4x1_1x1_intrawave_v1,2.74,176.91,0.0
gfx942,80,16,256,7168,torch.float8_e4m3fnuz,ck,24,0,9.298,a8w8_bpreshuffle_128x16x32x512_16x16_16x16_32x4x1_32x4x1_1x16x1x8_4x4x1_1x1_intrawave_v2,6.32,210.57,0.0
gfx942,80,32,256,7168,torch.float8_e4m3fnuz,ck,24,0,9.6449,a8w8_bpreshuffle_128x16x32x512_16x16_16x16_32x4x1_32x4x1_1x16x1x8_4x4x1_1x1_intrawave_v2,12.18,215.74,0.0
gfx942,80,64,256,7168,torch.float8_e4m3fnuz,ck,10,0,10.023,a8w8_bpreshuffle_128x16x32x512_16x16_16x16_32x4x1_32x4x1_1x16x1x8_4x4x1_1x1_intrawave_v1,23.43,232.12,0.0
gfx942,80,96,256,7168,torch.float8_e4m3fnuz,ck,24,0,10.2032,a8w8_bpreshuffle_128x16x32x512_16x16_16x16_32x4x1_32x4x1_1x16x1x8_4x4x1_1x1_intrawave_v2,34.53,252.11,0.0
gfx942,80,128,256,7168,torch.float8_e4m3fnuz,ck,10,0,10.6508,a8w8_bpreshuffle_128x16x32x512_16x16_16x16_32x4x1_32x4x1_1x16x1x8_4x4x1_1x1_intrawave_v1,44.11,264.59,0.0
gfx942,80,160,256,7168,torch.float8_e4m3fnuz,ck,10,0,10.9094,a8w8_bpreshuffle_128x16x32x512_16x16_16x16_32x4x1_32x4x1_1x16x1x8_4x4x1_1x1_intrawave_v1,53.83,280.84,0.0
gfx942,80,192,256,7168,torch.float8_e4m3fnuz,ck,11,0,11.7012,a8w8_bpreshuffle_256x16x64x512_16x16_16x16_32x8x1_32x8x1_1x16x1x16_4x4x1_1x1_intrawave_v1,60.22,282.84,0.0
gfx942,80,224,256,7168,torch.float8_e4m3fnuz,ck,10,0,11.9205,a8w8_bpreshuffle_128x16x32x512_16x16_16x16_32x4x1_32x4x1_1x16x1x8_4x4x1_1x1_intrawave_v1,68.96,298.25,0.0
gfx942,80,256,256,7168,torch.float8_e4m3fnuz,ck,5,0,11.9933,a8w8_bpreshuffle_256x16x64x512_16x16_16x16_32x8x1_32x8x1_1x16x1x16_4x4x1_1x1_intrawave_v1,78.34,316.93,0.0
gfx942,80,288,256,7168,torch.float8_e4m3fnuz,ck,25,0,11.9972,a8w8_bpreshuffle_256x16x64x512_16x16_16x16_32x8x1_32x8x1_1x16x1x16_4x4x1_1x1_intrawave_v2,88.1,337.32,0.0
gfx942,80,320,256,7168,torch.float8_e4m3fnuz,ck,11,0,12.2086,a8w8_bpreshuffle_256x16x64x512_16x16_16x16_32x8x1_32x8x1_1x16x1x16_4x4x1_1x1_intrawave_v1,96.19,351.61,0.0
gfx942,80,352,256,7168,torch.float8_e4m3fnuz,ck,10,0,16.2524,a8w8_bpreshuffle_128x16x32x512_16x16_16x16_32x4x1_32x4x1_1x16x1x8_4x4x1_1x1_intrawave_v1,79.49,279.24,0.0
gfx942,80,384,256,7168,torch.float8_e4m3fnuz,ck,24,0,16.3243,a8w8_bpreshuffle_128x16x32x512_16x16_16x16_32x4x1_32x4x1_1x16x1x8_4x4x1_1x1_intrawave_v2,86.33,293.07,0.0
gfx942,80,416,256,7168,torch.float8_e4m3fnuz,ck,10,0,16.4786,a8w8_bpreshuffle_128x16x32x512_16x16_16x16_32x4x1_32x4x1_1x16x1x8_4x4x1_1x1_intrawave_v1,92.65,305.24,0.0
gfx942,80,448,256,7168,torch.float8_e4m3fnuz,ck,24,0,16.7118,a8w8_bpreshuffle_128x16x32x512_16x16_16x16_32x4x1_32x4x1_1x16x1x8_4x4x1_1x1_intrawave_v2,98.38,315.68,0.0
gfx942,80,480,256,7168,torch.float8_e4m3fnuz,ck,19,0,17.129,a8w8_bpreshuffle_256x16x64x512_16x16_16x16_32x8x1_32x8x1_1x16x1x16_4x4x1_1x1_intrawave_v2,102.84,322.34,0.0
gfx942,80,512,256,7168,torch.float8_e4m3fnuz,ck,6,0,17.9831,a8w8_bpreshuffle_256x16x128x512_16x16_16x16_32x8x1_32x8x1_1x16x1x16_8x8x1_1x2_intrawave_v1,104.49,320.7,0.0
gfx942,80,1024,256,7168,torch.float8_e4m3fnuz,ck,119,0,23.9594,a8w8_bpreshuffle_256x32x128x256_16x16_16x16_16x16x1_16x16x1_1x16x1x16_8x8x1_1x2_intrawave_v1,156.85,404.82,0.0
gfx942,80,2048,256,7168,torch.float8_e4m3fnuz,ck,114,0,37.6676,a8w8_bpreshuffle_256x64x64x256_16x16_16x16_16x16x1_16x16x1_1x32x1x8_8x8x1_2x1_intrawave_v3,199.54,466.28,0.0
gfx942,80,4096,256,7168,torch.float8_e4m3fnuz,ck,121,0,63.1504,a8w8_bpreshuffle_256x64x128x256_16x16_16x16_16x16x1_16x16x1_1x16x1x16_8x8x1_1x2_intrawave_v3,238.04,527.19,0.0
gfx942,80,6144,256,7168,torch.float8_e4m3fnuz,ck,136,0,77.3912,a8w8_bpreshuffle_256x80x256x256_16x16_16x16_16x16x1_16x16x1_1x16x1x16_8x8x1_1x2_intrawave_v3,291.36,633.42,0.0
gfx942,80,8192,256,7168,torch.float8_e4m3fnuz,ck,138,0,106.0081,a8w8_bpreshuffle_256x112x256x256_16x16_16x16_16x16x1_16x16x1_1x16x1x16_8x8x1_1x2_intrawave_v3,283.61,610.8,0.0
gfx942,80,10240,256,7168,torch.float8_e4m3fnuz,ck,0,0,113.4228,a8w8_bpreshuffle_256x128x128x128_16x16_16x16_8x32x1_8x32x1_1x32x1x8_8x8x1_2x1_intrawave_v3,331.34,709.54,0.0
gfx942,80,12288,256,7168,torch.float8_e4m3fnuz,ck,136,0,152.8106,a8w8_bpreshuffle_256x80x256x256_16x16_16x16_16x16x1_16x16x1_1x16x1x16_8x8x1_1x2_intrawave_v3,295.12,629.58,0.0
gfx942,80,14336,256,7168,torch.float8_e4m3fnuz,ck,102,0,161.1134,a8w8_bpreshuffle_256x96x256x128_16x16_16x16_8x32x1_8x32x1_1x32x1x8_8x8x1_2x1_intrawave_v3,326.56,694.76,0.0
gfx942,80,16384,256,7168,torch.float8_e4m3fnuz,ck,85,0,207.4081,a8w8_bpreshuffle_256x64x128x128_16x16_16x16_8x32x1_8x32x1_1x32x1x8_8x8x1_2x1_intrawave_v3,289.91,615.52,0.0
gfx942,80,32768,256,7168,torch.float8_e4m3fnuz,ck,0,0,379.1653,a8w8_bpreshuffle_256x128x128x128_16x16_16x16_8x32x1_8x32x1_1x32x1x8_8x8x1_2x1_intrawave_v3,317.17,668.56,0.0
gfx942,80,65536,256,7168,torch.float8_e4m3fnuz,ck,102,0,699.9897,a8w8_bpreshuffle_256x96x256x128_16x16_16x16_8x32x1_8x32x1_1x32x1x8_8x8x1_2x1_intrawave_v3,343.6,721.66,0.0
gfx942,80,98304,256,7168,torch.float8_e4m3fnuz,ck,102,0,973.4779,a8w8_bpreshuffle_256x96x256x128_16x16_16x16_8x32x1_8x32x1_1x32x1x8_8x8x1_2x1_intrawave_v3,370.61,777.43,0.0
gfx942,80,131072,256,7168,torch.float8_e4m3fnuz,ck,102,0,1385.804,a8w8_bpreshuffle_256x96x256x128_16x16_16x16_8x32x1_8x32x1_1x32x1x8_8x8x1_2x1_intrawave_v3,347.12,727.71,0.0
gfx942,80,1,512,7168,torch.float8_e4m3fnuz,ck,10,0,11.7317,a8w8_bpreshuffle_128x16x32x512_16x16_16x16_32x4x1_32x4x1_1x16x1x8_4x4x1_1x1_intrawave_v1,0.63,313.53,0.0
gfx942,80,2,512,7168,torch.float8_e4m3fnuz,ck,10,0,11.2907,a8w8_bpreshuffle_128x16x32x512_16x16_16x16_32x4x1_32x4x1_1x16x1x8_4x4x1_1x1_intrawave_v1,0.0,0.0,0.0
gfx942,80,4,512,7168,torch.float8_e4m3fnuz,ck,10,0,11.6471,a8w8_bpreshuffle_128x16x32x512_16x16_16x16_32x4x1_32x4x1_1x16x1x8_4x4x1_1x1_intrawave_v1,0.0,0.0,0.0
gfx942,80,8,512,7168,torch.float8_e4m3fnuz,ck,10,0,11.7575,a8w8_bpreshuffle_128x16x32x512_16x16_16x16_32x4x1_32x4x1_1x16x1x8_4x4x1_1x1_intrawave_v1,0.0,0.0,0.0
gfx942,80,16,512,7168,torch.float8_e4m3fnuz,ck,24,0,10.7923,a8w8_bpreshuffle_128x16x32x512_16x16_16x16_32x4x1_32x4x1_1x16x1x8_4x4x1_1x1_intrawave_v2,108.82,352.2,0.0
gfx942,80,32,512,7168,torch.float8_e4m3fnuz,ck,10,0,11.1022,a8w8_bpreshuffle_128x16x32x512_16x16_16x16_32x4x1_32x4x1_1x16x1x8_4x4x1_1x1_intrawave_v1,211.56,354.18,0.0
gfx942,80,48,512,7168,torch.float8_e4m3fnuz,ck,10,0,11.2279,a8w8_bpreshuffle_128x16x32x512_16x16_16x16_32x4x1_32x4x1_1x16x1x8_4x4x1_1x1_intrawave_v1,313.79,361.89,0.0
gfx942,80,64,512,7168,torch.float8_e4m3fnuz,ck,10,0,11.1263,a8w8_bpreshuffle_128x16x32x512_16x16_16x16_32x4x1_32x4x1_1x16x1x8_4x4x1_1x1_intrawave_v1,422.21,376.97,0.0
gfx942,80,80,512,7168,torch.float8_e4m3fnuz,ck,24,0,11.2303,a8w8_bpreshuffle_128x16x32x512_16x16_16x16_32x4x1_32x4x1_1x16x1x8_4x4x1_1x1_intrawave_v2,522.87,385.15,0.0
gfx942,80,96,512,7168,torch.float8_e4m3fnuz,ck,10,0,11.6635,a8w8_bpreshuffle_128x16x32x512_16x16_16x16_32x4x1_32x4x1_1x16x1x8_4x4x1_1x1_intrawave_v1,604.14,382.08,0.0
gfx942,80,112,512,7168,torch.float8_e4m3fnuz,ck,10,0,11.9903,a8w8_bpreshuffle_128x16x32x512_16x16_16x16_32x4x1_32x4x1_1x16x1x8_4x4x1_1x1_intrawave_v1,685.62,382.6,0.0
gfx942,80,128,512,7168,torch.float8_e4m3fnuz,ck,19,0,12.3367,a8w8_bpreshuffle_256x16x64x512_16x16_16x16_32x8x1_32x8x1_1x16x1x16_4x4x1_1x1_intrawave_v2,761.57,382.48,0.0
gfx942,80,160,512,7168,torch.float8_e4m3fnuz,ck,25,0,12.1467,a8w8_bpreshuffle_256x16x64x512_16x16_16x16_32x8x1_32x8x1_1x16x1x16_4x4x1_1x1_intrawave_v2,0.0,0.0,0.0
gfx942,80,192,512,7168,torch.float8_e4m3fnuz,ck,10,0,16.0911,a8w8_bpreshuffle_128x16x32x512_16x16_16x16_32x4x1_32x4x1_1x16x1x8_4x4x1_1x1_intrawave_v1,0.0,0.0,0.0
gfx942,80,224,512,7168,torch.float8_e4m3fnuz,ck,19,0,17.1051,a8w8_bpreshuffle_256x16x64x512_16x16_16x16_32x8x1_32x8x1_1x16x1x16_4x4x1_1x1_intrawave_v2,0.0,0.0,0.0
gfx942,80,256,512,7168,torch.float8_e4m3fnuz,ck,6,0,17.5859,a8w8_bpreshuffle_256x16x128x512_16x16_16x16_32x8x1_32x8x1_1x16x1x16_8x8x1_1x2_intrawave_v1,1068.5,327.94,0.0
gfx942,80,288,512,7168,torch.float8_e4m3fnuz,ck,6,0,17.6475,a8w8_bpreshuffle_256x16x128x512_16x16_16x16_32x8x1_32x8x1_1x16x1x16_8x8x1_1x2_intrawave_v1,0.0,0.0,0.0
gfx942,80,320,512,7168,torch.float8_e4m3fnuz,ck,6,0,17.8315,a8w8_bpreshuffle_256x16x128x512_16x16_16x16_32x8x1_32x8x1_1x16x1x16_8x8x1_1x2_intrawave_v1,0.0,0.0,0.0
gfx942,80,352,512,7168,torch.float8_e4m3fnuz,ck,112,0,22.2763,a8w8_bpreshuffle_256x32x64x256_16x16_16x16_16x16x1_16x16x1_1x32x1x8_8x8x1_2x1_intrawave_v1,0.0,0.0,0.0
gfx942,80,384,512,7168,torch.float8_e4m3fnuz,ck,113,0,21.2655,a8w8_bpreshuffle_256x48x64x256_16x16_16x16_16x16x1_16x16x1_1x16x1x16_4x4x1_1x1_intrawave_v1,0.0,0.0,0.0
gfx942,80,416,512,7168,torch.float8_e4m3fnuz,ck,112,0,22.5591,a8w8_bpreshuffle_256x32x64x256_16x16_16x16_16x16x1_16x16x1_1x32x1x8_8x8x1_2x1_intrawave_v1,0.0,0.0,0.0
gfx942,80,448,512,7168,torch.float8_e4m3fnuz,ck,112,0,22.7188,a8w8_bpreshuffle_256x32x64x256_16x16_16x16_16x16x1_16x16x1_1x32x1x8_8x8x1_2x1_intrawave_v1,0.0,0.0,0.0
gfx942,80,480,512,7168,torch.float8_e4m3fnuz,ck,113,0,21.5703,a8w8_bpreshuffle_256x48x64x256_16x16_16x16_16x16x1_16x16x1_1x16x1x16_4x4x1_1x1_intrawave_v1,0.0,0.0,0.0
gfx942,80,512,512,7168,torch.float8_e4m3fnuz,ck,119,0,23.6639,a8w8_bpreshuffle_256x32x128x256_16x16_16x16_16x16x1_16x16x1_1x16x1x16_8x8x1_1x2_intrawave_v1,1588.11,332.33,0.0
gfx942,80,1024,512,7168,torch.float8_e4m3fnuz,ck,114,0,36.6616,a8w8_bpreshuffle_256x64x64x256_16x16_16x16_16x16x1_16x16x1_1x32x1x8_8x8x1_2x1_intrawave_v3,2050.15,328.92,0.0
gfx942,80,1536,512,7168,torch.float8_e4m3fnuz,ck,120,0,48.0728,a8w8_bpreshuffle_256x48x128x256_16x16_16x16_16x16x1_16x16x1_1x16x1x16_8x8x1_1x2_intrawave_v1,2345.25,338.09,0.0
gfx942,80,2048,512,7168,torch.float8_e4m3fnuz,ck,85,0,58.1113,a8w8_bpreshuffle_256x64x128x128_16x16_16x16_8x32x1_8x32x1_1x32x1x8_8x8x1_2x1_intrawave_v3,2586.83,351.86,0.0
gfx942,80,4096,512,7168,torch.float8_e4m3fnuz,ck,85,0,101.7067,a8w8_bpreshuffle_256x64x128x128_16x16_16x16_8x32x1_8x32x1_1x32x1x8_8x8x1_2x1_intrawave_v3,2956.03,366.0,0.0
gfx942,80,6144,512,7168,torch.float8_e4m3fnuz,ck,85,0,143.4871,a8w8_bpreshuffle_256x64x128x128_16x16_16x16_8x32x1_8x32x1_1x32x1x8_8x8x1_2x1_intrawave_v3,0.0,0.0,0.0
gfx942,80,8192,512,7168,torch.float8_e4m3fnuz,ck,85,0,195.7643,a8w8_bpreshuffle_256x64x128x128_16x16_16x16_8x32x1_8x32x1_1x32x1x8_8x8x1_2x1_intrawave_v3,3071.53,361.55,0.0
gfx942,80,10240,512,7168,torch.float8_e4m3fnuz,ck,0,0,211.3264,a8w8_bpreshuffle_256x128x128x128_16x16_16x16_8x32x1_8x32x1_1x32x1x8_8x8x1_2x1_intrawave_v3,0.0,0.0,0.0
gfx942,80,12288,512,7168,torch.float8_e4m3fnuz,ck,0,0,262.6171,a8w8_bpreshuffle_256x128x128x128_16x16_16x16_8x32x1_8x32x1_1x32x1x8_8x8x1_2x1_intrawave_v3,0.0,0.0,0.0
gfx942,80,14336,512,7168,torch.float8_e4m3fnuz,ck,102,0,306.9194,a8w8_bpreshuffle_256x96x256x128_16x16_16x16_8x32x1_8x32x1_1x32x1x8_8x8x1_2x1_intrawave_v3,0.0,0.0,0.0
gfx942,80,16384,512,7168,torch.float8_e4m3fnuz,ck,85,0,354.1062,a8w8_bpreshuffle_256x64x128x128_16x16_16x16_8x32x1_8x32x1_1x32x1x8_8x8x1_2x1_intrawave_v3,3396.13,389.4,0.0
gfx942,80,20480,512,7168,torch.float8_e4m3fnuz,ck,70,0,411.9813,a8w8_bpreshuffle_256x128x128x128_16x16_16x16_8x32x1_8x32x1_1x32x1x8_8x8x1_2x1_intrawave_v3,3648.8,416.14,0.0
gfx942,80,32768,512,7168,torch.float8_e4m3fnuz,ck,70,0,664.7692,a8w8_bpreshuffle_256x128x128x128_16x16_16x16_8x32x1_8x32x1_1x32x1x8_8x8x1_2x1_intrawave_v3,3618.07,409.32,0.0
gfx942,80,65536,512,7168,torch.float8_e4m3fnuz,ck,70,0,1327.0618,a8w8_bpreshuffle_256x128x128x128_16x16_16x16_8x32x1_8x32x1_1x32x1x8_8x8x1_2x1_intrawave_v3,0.0,0.0,0.0
gfx942,80,98304,512,7168,torch.float8_e4m3fnuz,ck,102,0,1866.4062,a8w8_bpreshuffle_256x96x256x128_16x16_16x16_8x32x1_8x32x1_1x32x1x8_8x8x1_2x1_intrawave_v3,0.0,0.0,0.0
gfx942,80,131072,512,7168,torch.float8_e4m3fnuz,ck,102,0,2615.157,a8w8_bpreshuffle_256x96x256x128_16x16_16x16_8x32x1_8x32x1_1x32x1x8_8x8x1_2x1_intrawave_v3,0.0,0.0,0.0
gfx942,80,1,576,7168,torch.float8_e4m3fnuz,ck,10,0,11.2398,a8w8_bpreshuffle_128x16x32x512_16x16_16x16_32x4x1_32x4x1_1x16x1x8_4x4x1_1x1_intrawave_v1,0.0,0.0,0.0
gfx942,80,2,576,7168,torch.float8_e4m3fnuz,ck,10,0,11.5102,a8w8_bpreshuffle_128x16x32x512_16x16_16x16_32x4x1_32x4x1_1x16x1x8_4x4x1_1x1_intrawave_v1,0.0,0.0,0.0
gfx942,80,4,576,7168,torch.float8_e4m3fnuz,ck,10,0,11.6411,a8w8_bpreshuffle_128x16x32x512_16x16_16x16_32x4x1_32x4x1_1x16x1x8_4x4x1_1x1_intrawave_v1,0.0,0.0,0.0
gfx942,80,8,576,7168,torch.float8_e4m3fnuz,ck,10,0,11.871,a8w8_bpreshuffle_128x16x32x512_16x16_16x16_32x4x1_32x4x1_1x16x1x8_4x4x1_1x1_intrawave_v1,0.0,0.0,0.0
gfx942,80,16,576,7168,torch.float8_e4m3fnuz,ck,10,0,10.7303,a8w8_bpreshuffle_128x16x32x512_16x16_16x16_32x4x1_32x4x1_1x16x1x8_4x4x1_1x1_intrawave_v1,12.31,397.18,0.0
gfx942,80,32,576,7168,torch.float8_e4m3fnuz,ck,10,0,11.199,a8w8_bpreshuffle_128x16x32x512_16x16_16x16_32x4x1_32x4x1_1x16x1x8_4x4x1_1x1_intrawave_v1,235.95,392.45,0.0
gfx942,80,64,576,7168,torch.float8_e4m3fnuz,ck,24,0,11.163,a8w8_bpreshuffle_128x16x32x512_16x16_16x16_32x4x1_32x4x1_1x16x1x8_4x4x1_1x1_intrawave_v2,473.42,417.56,0.0
gfx942,80,96,576,7168,torch.float8_e4m3fnuz,ck,10,0,12.065,a8w8_bpreshuffle_128x16x32x512_16x16_16x16_32x4x1_32x4x1_1x16x1x8_4x4x1_1x1_intrawave_v1,0.0,0.0,0.0
gfx942,80,128,576,7168,torch.float8_e4m3fnuz,ck,25,0,12.3755,a8w8_bpreshuffle_256x16x64x512_16x16_16x16_32x8x1_32x8x1_1x16x1x16_4x4x1_1x1_intrawave_v2,854.08,419.68,0.0
gfx942,80,160,576,7168,torch.float8_e4m3fnuz,ck,10,0,16.0783,a8w8_bpreshuffle_128x16x32x512_16x16_16x16_32x4x1_32x4x1_1x16x1x8_4x4x1_1x1_intrawave_v1,0.0,0.0,0.0
gfx942,80,192,576,7168,torch.float8_e4m3fnuz,ck,10,0,17.0079,a8w8_bpreshuffle_128x16x32x512_16x16_16x16_32x4x1_32x4x1_1x16x1x8_4x4x1_1x1_intrawave_v1,0.0,0.0,0.0
gfx942,80,224,576,7168,torch.float8_e4m3fnuz,ck,25,0,17.1379,a8w8_bpreshuffle_256x16x64x512_16x16_16x16_32x8x1_32x8x1_1x16x1x16_4x4x1_1x1_intrawave_v2,0.0,0.0,0.0
gfx942,80,256,576,7168,torch.float8_e4m3fnuz,ck,112,0,18.3779,a8w8_bpreshuffle_256x32x64x256_16x16_16x16_16x16x1_16x16x1_1x32x1x8_8x8x1_2x1_intrawave_v1,1150.26,340.56,0.0
gfx942,80,288,576,7168,torch.float8_e4m3fnuz,ck,113,0,21.2123,a8w8_bpreshuffle_256x48x64x256_16x16_16x16_16x16x1_16x16x1_1x16x1x16_4x4x1_1x1_intrawave_v1,0.0,0.0,0.0
gfx942,80,320,576,7168,torch.float8_e4m3fnuz,ck,112,0,22.5067,a8w8_bpreshuffle_256x32x64x256_16x16_16x16_16x16x1_16x16x1_1x32x1x8_8x8x1_2x1_intrawave_v1,0.0,0.0,0.0
gfx942,80,352,576,7168,torch.float8_e4m3fnuz,ck,112,0,22.5607,a8w8_bpreshuffle_256x32x64x256_16x16_16x16_16x16x1_16x16x1_1x32x1x8_8x8x1_2x1_intrawave_v1,0.0,0.0,0.0
gfx942,80,384,576,7168,torch.float8_e4m3fnuz,ck,113,0,21.2619,a8w8_bpreshuffle_256x48x64x256_16x16_16x16_16x16x1_16x16x1_1x16x1x16_4x4x1_1x1_intrawave_v1,0.0,0.0,0.0
gfx942,80,416,576,7168,torch.float8_e4m3fnuz,ck,112,0,22.8351,a8w8_bpreshuffle_256x32x64x256_16x16_16x16_16x16x1_16x16x1_1x32x1x8_8x8x1_2x1_intrawave_v1,0.0,0.0,0.0
gfx942,80,448,576,7168,torch.float8_e4m3fnuz,ck,112,0,22.8423,a8w8_bpreshuffle_256x32x64x256_16x16_16x16_16x16x1_16x16x1_1x32x1x8_8x8x1_2x1_intrawave_v1,0.0,0.0,0.0
gfx942,80,480,576,7168,torch.float8_e4m3fnuz,ck,112,0,24.5819,a8w8_bpreshuffle_256x32x64x256_16x16_16x16_16x16x1_16x16x1_1x32x1x8_8x8x1_2x1_intrawave_v1,0.0,0.0,0.0
gfx942,80,512,576,7168,torch.float8_e4m3fnuz,ck,114,0,23.9199,a8w8_bpreshuffle_256x64x64x256_16x16_16x16_16x16x1_16x16x1_1x32x1x8_8x8x1_2x1_intrawave_v3,1767.51,350.7,0.0
gfx942,80,1024,576,7168,torch.float8_e4m3fnuz,ck,114,0,37.1872,a8w8_bpreshuffle_256x64x64x256_16x16_16x16_16x16x1_16x16x1_1x32x1x8_8x8x1_2x1_intrawave_v3,2273.82,340.13,0.0
gfx942,80,1536,576,7168,torch.float8_e4m3fnuz,ck,128,0,47.2304,a8w8_bpreshuffle_256x64x192x256_16x16_16x16_16x16x1_16x16x1_1x32x1x8_8x8x1_2x1_intrawave_v3,2685.47,358.0,0.0
gfx942,80,2048,576,7168,torch.float8_e4m3fnuz,ck,129,0,60.7837,a8w8_bpreshuffle_256x80x192x256_16x16_16x16_16x16x1_16x16x1_1x16x1x16_4x4x1_1x1_intrawave_v3,2782.23,348.25,0.0
gfx942,80,4096,576,7168,torch.float8_e4m3fnuz,ck,93,0,113.3711,a8w8_bpreshuffle_256x64x192x128_16x16_16x16_8x32x1_8x32x1_1x32x1x8_8x8x1_2x1_intrawave_v3,2983.38,337.01,0.0
gfx942,80,6144,576,7168,torch.float8_e4m3fnuz,ck,68,0,151.638,a8w8_bpreshuffle_256x128x192x128_16x16_16x16_8x32x1_8x32x1_1x32x1x8_8x8x1_2x1_intrawave_v3,0.0,0.0,0.0
gfx942,80,8192,576,7168,torch.float8_e4m3fnuz,ck,93,0,191.4823,a8w8_bpreshuffle_256x64x192x128_16x16_16x16_8x32x1_8x32x1_1x32x1x8_8x8x1_2x1_intrawave_v3,3532.74,377.51,0.0
gfx942,80,10240,576,7168,torch.float8_e4m3fnuz,ck,68,0,230.3376,a8w8_bpreshuffle_256x128x192x128_16x16_16x16_8x32x1_8x32x1_1x32x1x8_8x8x1_2x1_intrawave_v3,0.0,0.0,0.0
gfx942,80,12288,576,7168,torch.float8_e4m3fnuz,ck,94,0,285.6522,a8w8_bpreshuffle_256x96x192x128_16x16_16x16_8x32x1_8x32x1_1x32x1x8_8x8x1_2x1_intrawave_v3,0.0,0.0,0.0
gfx942,80,14336,576,7168,torch.float8_e4m3fnuz,ck,93,0,341.468,a8w8_bpreshuffle_256x64x192x128_16x16_16x16_8x32x1_8x32x1_1x32x1x8_8x8x1_2x1_intrawave_v3,0.0,0.0,0.0
gfx942,80,16384,576,7168,torch.float8_e4m3fnuz,ck,68,0,372.1747,a8w8_bpreshuffle_256x128x192x128_16x16_16x16_8x32x1_8x32x1_1x32x1x8_8x8x1_2x1_intrawave_v3,3635.16,377.36,0.0
gfx942,80,20480,576,7168,torch.float8_e4m3fnuz,ck,68,0,439.759,a8w8_bpreshuffle_256x128x192x128_16x16_16x16_8x32x1_8x32x1_1x32x1x8_8x8x1_2x1_intrawave_v3,3845.61,396.86,0.0
gfx942,80,32768,576,7168,torch.float8_e4m3fnuz,ck,68,0,729.7961,a8w8_bpreshuffle_256x128x192x128_16x16_16x16_8x32x1_8x32x1_1x32x1x8_8x8x1_2x1_intrawave_v3,0.0,0.0,0.0
gfx942,80,65536,576,7168,torch.float8_e4m3fnuz,ck,93,0,1429.9239,a8w8_bpreshuffle_256x64x192x128_16x16_16x16_8x32x1_8x32x1_1x32x1x8_8x8x1_2x1_intrawave_v3,0.0,0.0,0.0
gfx942,80,98304,576,7168,torch.float8_e4m3fnuz,ck,95,0,2112.9835,a8w8_bpreshuffle_256x128x192x128_16x16_16x16_8x32x1_8x32x1_1x16x1x16_4x4x1_1x1_intrawave_v3,0.0,0.0,0.0
gfx942,80,131072,576,7168,torch.float8_e4m3fnuz,ck,93,0,2822.5197,a8w8_bpreshuffle_256x64x192x128_16x16_16x16_8x32x1_8x32x1_1x32x1x8_8x8x1_2x1_intrawave_v3,0.0,0.0,0.0
gfx942,80,1,1024,7168,torch.float8_e4m3fnuz,ck,10,0,12.1282,a8w8_bpreshuffle_128x16x32x512_16x16_16x16_32x4x1_32x4x1_1x16x1x8_4x4x1_1x1_intrawave_v1,1.21,605.96,0.0
gfx942,80,2,1024,7168,torch.float8_e4m3fnuz,ck,10,0,12.0277,a8w8_bpreshuffle_128x16x32x512_16x16_16x16_32x4x1_32x4x1_1x16x1x8_4x4x1_1x1_intrawave_v1,2.44,611.79,0.0
gfx942,80,4,1024,7168,torch.float8_e4m3fnuz,ck,10,0,12.1184,a8w8_bpreshuffle_128x16x32x512_16x16_16x16_32x4x1_32x4x1_1x16x1x8_4x4x1_1x1_intrawave_v1,4.85,608.74,0.0
gfx942,80,8,1024,7168,torch.float8_e4m3fnuz,ck,10,0,12.2066,a8w8_bpreshuffle_128x16x32x512_16x16_16x16_32x4x1_32x4x1_1x16x1x8_4x4x1_1x1_intrawave_v1,9.62,607.36,0.0
gfx942,80,16,1024,7168,torch.float8_e4m3fnuz,ck,10,0,11.306,a8w8_bpreshuffle_128x16x32x512_16x16_16x16_32x4x1_32x4x1_1x16x1x8_4x4x1_1x1_intrawave_v1,20.77,662.26,0.0
gfx942,80,32,1024,7168,torch.float8_e4m3fnuz,ck,10,0,11.4004,a8w8_bpreshuffle_128x16x32x512_16x16_16x16_32x4x1_32x4x1_1x16x1x8_4x4x1_1x1_intrawave_v1,41.21,669.71,0.0
gfx942,80,64,1024,7168,torch.float8_e4m3fnuz,ck,11,0,12.7183,a8w8_bpreshuffle_256x16x64x512_16x16_16x16_32x8x1_32x8x1_1x16x1x16_4x4x1_1x1_intrawave_v1,73.87,623.5,0.0
gfx942,80,96,1024,7168,torch.float8_e4m3fnuz,ck,19,0,17.1761,a8w8_bpreshuffle_256x16x64x512_16x16_16x16_32x8x1_32x8x1_1x16x1x16_4x4x1_1x1_intrawave_v2,82.05,478.85,0.0
gfx942,80,128,1024,7168,torch.float8_e4m3fnuz,ck,6,0,18.5394,a8w8_bpreshuffle_256x16x128x512_16x16_16x16_32x8x1_32x8x1_1x16x1x16_8x8x1_1x2_intrawave_v1,101.35,459.54,0.0
gfx942,80,160,1024,7168,torch.float8_e4m3fnuz,ck,6,0,18.3958,a8w8_bpreshuffle_256x16x128x512_16x16_16x16_32x8x1_32x8x1_1x16x1x16_8x8x1_1x2_intrawave_v1,127.68,479.16,0.0
gfx942,80,192,1024,7168,torch.float8_e4m3fnuz,ck,113,0,21.6602,a8w8_bpreshuffle_256x48x64x256_16x16_16x16_16x16x1_16x16x1_1x16x1x16_4x4x1_1x1_intrawave_v1,130.13,420.56,0.0
gfx942,80,224,1024,7168,torch.float8_e4m3fnuz,ck,113,0,24.174,a8w8_bpreshuffle_256x48x64x256_16x16_16x16_16x16x1_16x16x1_1x16x1x16_4x4x1_1x1_intrawave_v1,136.03,389.03,0.0
gfx942,80,256,1024,7168,torch.float8_e4m3fnuz,ck,114,0,24.24,a8w8_bpreshuffle_256x64x64x256_16x16_16x16_16x16x1_16x16x1_1x32x1x8_8x8x1_2x1_intrawave_v3,155.04,400.14,0.0
gfx942,80,288,1024,7168,torch.float8_e4m3fnuz,ck,119,0,24.2463,a8w8_bpreshuffle_256x32x128x256_16x16_16x16_16x16x1_16x16x1_1x16x1x16_8x8x1_1x2_intrawave_v1,174.37,412.2,0.0
gfx942,80,320,1024,7168,torch.float8_e4m3fnuz,ck,114,0,24.291,a8w8_bpreshuffle_256x64x64x256_16x16_16x16_16x16x1_16x16x1_1x32x1x8_8x8x1_2x1_intrawave_v3,193.39,423.58,0.0
gfx942,80,352,1024,7168,torch.float8_e4m3fnuz,ck,120,0,31.8392,a8w8_bpreshuffle_256x48x128x256_16x16_16x16_16x16x1_16x16x1_1x16x1x16_8x8x1_1x2_intrawave_v1,162.3,332.42,0.0
gfx942,80,384,1024,7168,torch.float8_e4m3fnuz,ck,120,0,29.8956,a8w8_bpreshuffle_256x48x128x256_16x16_16x16_16x16x1_16x16x1_1x16x1x16_8x8x1_1x2_intrawave_v1,188.56,363.9,0.0
gfx942,80,416,1024,7168,torch.float8_e4m3fnuz,ck,120,0,31.629,a8w8_bpreshuffle_256x48x128x256_16x16_16x16_16x16x1_16x16x1_1x16x1x16_8x8x1_1x2_intrawave_v1,193.08,353.28,0.0
gfx942,80,448,1024,7168,torch.float8_e4m3fnuz,ck,120,0,31.7988,a8w8_bpreshuffle_256x48x128x256_16x16_16x16_16x16x1_16x16x1_1x16x1x16_8x8x1_1x2_intrawave_v1,206.82,360.67,0.0
gfx942,80,480,1024,7168,torch.float8_e4m3fnuz,ck,120,0,29.9502,a8w8_bpreshuffle_256x48x128x256_16x16_16x16_16x16x1_16x16x1_1x16x1x16_8x8x1_1x2_intrawave_v1,235.27,392.78,0.0
gfx942,80,512,1024,7168,torch.float8_e4m3fnuz,ck,119,0,37.7242,a8w8_bpreshuffle_256x32x128x256_16x16_16x16_16x16x1_16x16x1_1x16x1x16_8x8x1_1x2_intrawave_v1,199.24,319.65,0.0
gfx942,80,1024,1024,7168,torch.float8_e4m3fnuz,ck,85,0,59.714,a8w8_bpreshuffle_256x64x128x128_16x16_16x16_8x32x1_8x32x1_1x32x1x8_8x8x1_2x1_intrawave_v3,251.74,280.96,0.0
gfx942,80,2048,1024,7168,torch.float8_e4m3fnuz,ck,85,0,105.1832,a8w8_bpreshuffle_256x64x128x128_16x16_16x16_8x32x1_8x32x1_1x32x1x8_8x8x1_2x1_intrawave_v3,285.83,249.23,0.0
gfx942,80,4096,1024,7168,torch.float8_e4m3fnuz,ck,85,0,187.4655,a8w8_bpreshuffle_256x64x128x128_16x16_16x16_8x32x1_8x32x1_1x32x1x8_8x8x1_2x1_intrawave_v3,320.75,240.52,0.0
gfx942,80,6144,1024,7168,torch.float8_e4m3fnuz,ck,85,0,267.9814,a8w8_bpreshuffle_256x64x128x128_16x16_16x16_8x32x1_8x32x1_1x32x1x8_8x8x1_2x1_intrawave_v3,336.57,238.68,0.0
gfx942,80,8192,1024,7168,torch.float8_e4m3fnuz,ck,85,0,349.6474,a8w8_bpreshuffle_256x64x128x128_16x16_16x16_8x32x1_8x32x1_1x32x1x8_8x8x1_2x1_intrawave_v3,343.94,236.92,0.0
gfx942,80,10240,1024,7168,torch.float8_e4m3fnuz,ck,70,0,424.2224,a8w8_bpreshuffle_256x128x128x128_16x16_16x16_8x32x1_8x32x1_1x32x1x8_8x8x1_2x1_intrawave_v3,354.35,239.76,0.0
gfx942,80,12288,1024,7168,torch.float8_e4m3fnuz,ck,85,0,519.3639,a8w8_bpreshuffle_256x64x128x128_16x16_16x16_8x32x1_8x32x1_1x32x1x8_8x8x1_2x1_intrawave_v3,347.33,232.18,0.0
gfx942,80,14336,1024,7168,torch.float8_e4m3fnuz,ck,85,0,598.3138,a8w8_bpreshuffle_256x64x128x128_16x16_16x16_8x32x1_8x32x1_1x32x1x8_8x8x1_2x1_intrawave_v3,351.74,233.09,0.0
gfx942,80,16384,1024,7168,torch.float8_e4m3fnuz,ck,70,0,681.6293,a8w8_bpreshuffle_256x128x128x128_16x16_16x16_8x32x1_8x32x1_1x32x1x8_8x8x1_2x1_intrawave_v3,352.86,232.29,0.0
gfx942,80,32768,1024,7168,torch.float8_e4m3fnuz,ck,85,0,1338.2851,a8w8_bpreshuffle_256x64x128x128_16x16_16x16_8x32x1_8x32x1_1x32x1x8_8x8x1_2x1_intrawave_v3,359.44,231.14,0.0
gfx942,80,65536,1024,7168,torch.float8_e4m3fnuz,ck,85,0,2666.7419,a8w8_bpreshuffle_256x64x128x128_16x16_16x16_8x32x1_8x32x1_1x32x1x8_8x8x1_2x1_intrawave_v3,360.77,229.24,0.0
gfx942,80,98304,1024,7168,torch.float8_e4m3fnuz,ck,102,0,3838.9675,a8w8_bpreshuffle_256x96x256x128_16x16_16x16_8x32x1_8x32x1_1x32x1x8_8x8x1_2x1_intrawave_v3,375.91,237.91,0.0
gfx942,80,1,1280,8192,torch.float8_e4m3fnuz,ck,10,0,13.1036,a8w8_bpreshuffle_128x16x32x512_16x16_16x16_32x4x1_32x4x1_1x16x1x8_4x4x1_1x1_intrawave_v1,1.6,801.04,0.0
gfx942,80,32,1280,8192,torch.float8_e4m3fnuz,ck,10,0,12.0442,a8w8_bpreshuffle_128x16x32x512_16x16_16x16_32x4x1_32x4x1_1x16x1x8_4x4x1_1x1_intrawave_v1,55.72,899.17,0.0
gfx942,80,64,1280,8192,torch.float8_e4m3fnuz,ck,19,0,13.7807,a8w8_bpreshuffle_256x16x64x512_16x16_16x16_32x8x1_32x8x1_1x16x1x16_4x4x1_1x1_intrawave_v2,973.95,810.84,0.0
gfx942,80,128,1280,8192,torch.float8_e4m3fnuz,ck,6,0,20.4871,a8w8_bpreshuffle_256x16x128x512_16x16_16x16_32x8x1_32x8x1_1x16x1x16_8x8x1_1x2_intrawave_v1,1310.27,579.0,0.0
gfx942,80,192,1280,8192,torch.float8_e4m3fnuz,ck,113,0,23.6583,a8w8_bpreshuffle_256x48x64x256_16x16_16x16_16x16x1_16x16x1_1x16x1x16_4x4x1_1x1_intrawave_v1,170.2,530.48,0.0
gfx942,80,256,1280,8192,torch.float8_e4m3fnuz,ck,114,0,26.0071,a8w8_bpreshuffle_256x64x64x256_16x16_16x16_16x16x1_16x16x1_1x32x1x8_8x8x1_2x1_intrawave_v3,206.43,509.03,0.0
gfx942,80,320,1280,8192,torch.float8_e4m3fnuz,ck,115,0,32.2959,a8w8_bpreshuffle_256x80x64x256_16x16_16x16_16x16x1_16x16x1_1x16x1x16_4x4x1_1x1_intrawave_v3,2077.94,431.21,0.0
gfx942,80,512,1280,8192,torch.float8_e4m3fnuz,ck,114,0,42.3216,a8w8_bpreshuffle_256x64x64x256_16x16_16x16_16x16x1_16x16x1_1x32x1x8_8x8x1_2x1_intrawave_v3,2537.1,377.84,0.0
gfx942,80,1024,1280,8192,torch.float8_e4m3fnuz,ck,85,0,68.1209,a8w8_bpreshuffle_256x64x128x128_16x16_16x16_8x32x1_8x32x1_1x32x1x8_8x8x1_2x1_intrawave_v3,3152.46,315.55,0.0
gfx942,80,2048,1280,8192,torch.float8_e4m3fnuz,ck,0,0,119.2848,a8w8_bpreshuffle_256x128x128x128_16x16_16x16_8x32x1_8x32x1_1x32x1x8_8x8x1_2x1_intrawave_v3,3600.6,272.51,0.0
gfx942,80,4096,1280,8192,torch.float8_e4m3fnuz,ck,71,0,234.5689,a8w8_bpreshuffle_256x128x128x64_16x16_16x16_4x64x1_4x64x1_1x32x1x8_8x8x1_2x1_intrawave_v3,3662.01,232.45,0.0
gfx942,80,8192,1280,8192,torch.float8_e4m3fnuz,ck,71,0,452.4299,a8w8_bpreshuffle_256x128x128x64_16x16_16x16_4x64x1_4x64x1_1x32x1x8_8x8x1_2x1_intrawave_v3,3797.24,217.86,0.0
gfx942,80,16384,1280,8192,torch.float8_e4m3fnuz,ck,71,0,902.6619,a8w8_bpreshuffle_256x128x128x64_16x16_16x16_4x64x1_4x64x1_1x32x1x8_8x8x1_2x1_intrawave_v3,3806.49,206.77,0.0
gfx942,80,1,1536,7168,torch.float8_e4m3fnuz,ck,10,0,11.721,a8w8_bpreshuffle_128x16x32x512_16x16_16x16_32x4x1_32x4x1_1x16x1x8_4x4x1_1x1_intrawave_v1,0.0,0.0,0.0
gfx942,80,2,1536,7168,torch.float8_e4m3fnuz,ck,10,0,12.1679,a8w8_bpreshuffle_128x16x32x512_16x16_16x16_32x4x1_32x4x1_1x16x1x8_4x4x1_1x1_intrawave_v1,0.0,0.0,0.0
gfx942,80,4,1536,7168,torch.float8_e4m3fnuz,ck,10,0,12.2579,a8w8_bpreshuffle_128x16x32x512_16x16_16x16_32x4x1_32x4x1_1x16x1x8_4x4x1_1x1_intrawave_v1,0.0,0.0,0.0
gfx942,80,8,1536,7168,torch.float8_e4m3fnuz,ck,10,0,12.559,a8w8_bpreshuffle_128x16x32x512_16x16_16x16_32x4x1_32x4x1_1x16x1x8_4x4x1_1x1_intrawave_v1,0.0,0.0,0.0
gfx942,80,16,1536,7168,torch.float8_e4m3fnuz,ck,10,0,10.6831,a8w8_bpreshuffle_128x16x32x512_16x16_16x16_32x4x1_32x4x1_1x16x1x8_4x4x1_1x1_intrawave_v1,32.98,1045.94,0.0
gfx942,80,32,1536,7168,torch.float8_e4m3fnuz,ck,11,0,12.4632,a8w8_bpreshuffle_256x16x64x512_16x16_16x16_32x8x1_32x8x1_1x16x1x16_4x4x1_1x1_intrawave_v1,56.54,909.7,0.0
gfx942,80,64,1536,7168,torch.float8_e4m3fnuz,ck,19,0,16.9363,a8w8_bpreshuffle_256x16x64x512_16x16_16x16_32x8x1_32x8x1_1x16x1x16_4x4x1_1x1_intrawave_v2,832.11,688.78,0.0
gfx942,80,96,1536,7168,torch.float8_e4m3fnuz,ck,6,0,18.0262,a8w8_bpreshuffle_256x16x128x512_16x16_16x16_32x8x1_32x8x1_1x16x1x16_8x8x1_1x2_intrawave_v1,0.0,0.0,0.0
gfx942,80,128,1536,7168,torch.float8_e4m3fnuz,ck,112,0,22.8955,a8w8_bpreshuffle_256x32x64x256_16x16_16x16_16x16x1_16x16x1_1x32x1x8_8x8x1_2x1_intrawave_v1,1231.06,538.13,0.0
gfx942,80,160,1536,7168,torch.float8_e4m3fnuz,ck,119,0,24.4126,a8w8_bpreshuffle_256x32x128x256_16x16_16x16_16x16x1_16x16x1_1x16x1x16_8x8x1_1x2_intrawave_v1,0.0,0.0,0.0
gfx942,80,192,1536,7168,torch.float8_e4m3fnuz,ck,114,0,24.0194,a8w8_bpreshuffle_256x64x64x256_16x16_16x16_16x16x1_16x16x1_1x32x1x8_8x8x1_2x1_intrawave_v3,0.0,0.0,0.0
gfx942,80,224,1536,7168,torch.float8_e4m3fnuz,ck,115,0,31.7078,a8w8_bpreshuffle_256x80x64x256_16x16_16x16_16x16x1_16x16x1_1x16x1x16_4x4x1_1x1_intrawave_v3,0.0,0.0,0.0
gfx942,80,256,1536,7168,torch.float8_e4m3fnuz,ck,120,0,31.1851,a8w8_bpreshuffle_256x48x128x256_16x16_16x16_16x16x1_16x16x1_1x16x1x16_8x8x1_1x2_intrawave_v1,1807.64,437.12,0.0
gfx942,80,288,1536,7168,torch.float8_e4m3fnuz,ck,120,0,29.6846,a8w8_bpreshuffle_256x48x128x256_16x16_16x16_16x16x1_16x16x1_1x16x1x16_8x8x1_1x2_intrawave_v1,0.0,0.0,0.0
gfx942,80,320,1536,7168,torch.float8_e4m3fnuz,ck,126,0,32.1157,a8w8_bpreshuffle_256x32x192x256_16x16_16x16_16x16x1_16x16x1_1x32x1x8_8x8x1_2x1_intrawave_v1,0.0,0.0,0.0
gfx942,80,352,1536,7168,torch.float8_e4m3fnuz,ck,133,0,39.9737,a8w8_bpreshuffle_256x32x256x256_16x16_16x16_16x16x1_16x16x1_1x16x1x16_8x8x1_1x2_intrawave_v1,0.0,0.0,0.0
gfx942,80,384,1536,7168,torch.float8_e4m3fnuz,ck,114,0,37.6905,a8w8_bpreshuffle_256x64x64x256_16x16_16x16_16x16x1_16x16x1_1x32x1x8_8x8x1_2x1_intrawave_v3,0.0,0.0,0.0
gfx942,80,416,1536,7168,torch.float8_e4m3fnuz,ck,119,0,38.3401,a8w8_bpreshuffle_256x32x128x256_16x16_16x16_16x16x1_16x16x1_1x16x1x16_8x8x1_1x2_intrawave_v1,0.0,0.0,0.0
gfx942,80,448,1536,7168,torch.float8_e4m3fnuz,ck,113,0,46.246,a8w8_bpreshuffle_256x48x64x256_16x16_16x16_16x16x1_16x16x1_1x16x1x16_4x4x1_1x1_intrawave_v1,0.0,0.0,0.0
gfx942,80,480,1536,7168,torch.float8_e4m3fnuz,ck,113,0,45.4048,a8w8_bpreshuffle_256x48x64x256_16x16_16x16_16x16x1_16x16x1_1x16x1x16_4x4x1_1x1_intrawave_v1,0.0,0.0,0.0
gfx942,80,512,1536,7168,torch.float8_e4m3fnuz,ck,128,0,47.65,a8w8_bpreshuffle_256x64x192x256_16x16_16x16_16x16x1_16x16x1_1x32x1x8_8x8x1_2x1_intrawave_v3,2366.06,341.09,0.0
gfx942,80,1024,1536,7168,torch.float8_e4m3fnuz,ck,136,0,74.0965,a8w8_bpreshuffle_256x80x256x256_16x16_16x16_16x16x1_16x16x1_1x16x1x16_8x8x1_1x2_intrawave_v3,3043.14,290.11,0.0
gfx942,80,1536,1536,7168,torch.float8_e4m3fnuz,ck,0,0,105.4423,a8w8_bpreshuffle_256x128x128x128_16x16_16x16_8x32x1_8x32x1_1x32x1x8_8x8x1_2x1_intrawave_v3,3207.71,253.59,0.0
gfx942,80,2048,1536,7168,torch.float8_e4m3fnuz,ck,85,0,138.8692,a8w8_bpreshuffle_256x64x128x128_16x16_16x16_8x32x1_8x32x1_1x32x1x8_8x8x1_2x1_intrawave_v3,3247.46,230.3,0.0
gfx942,80,4096,1536,7168,torch.float8_e4m3fnuz,ck,85,0,256.917,a8w8_bpreshuffle_256x64x128x128_16x16_16x16_8x32x1_8x32x1_1x32x1x8_8x8x1_2x1_intrawave_v3,3510.64,206.11,0.0
gfx942,80,6144,1536,7168,torch.float8_e4m3fnuz,ck,93,0,368.8956,a8w8_bpreshuffle_256x64x192x128_16x16_16x16_8x32x1_8x32x1_1x32x1x8_8x8x1_2x1_intrawave_v3,0.0,0.0,0.0
gfx942,80,8192,1536,7168,torch.float8_e4m3fnuz,ck,72,0,501.1581,a8w8_bpreshuffle_256x64x256x64_16x16_16x16_4x64x1_4x64x1_1x16x1x16_8x8x1_1x2_intrawave_v1,3599.44,189.35,0.0
gfx942,80,10240,1536,7168,torch.float8_e4m3fnuz,ck,68,0,583.4998,a8w8_bpreshuffle_256x128x192x128_16x16_16x16_8x32x1_8x32x1_1x32x1x8_8x8x1_2x1_intrawave_v3,0.0,0.0,0.0
gfx942,80,12288,1536,7168,torch.float8_e4m3fnuz,ck,94,0,718.7933,a8w8_bpreshuffle_256x96x192x128_16x16_16x16_8x32x1_8x32x1_1x32x1x8_8x8x1_2x1_intrawave_v3,0.0,0.0,0.0
gfx942,80,14336,1536,7168,torch.float8_e4m3fnuz,ck,93,0,830.4984,a8w8_bpreshuffle_256x64x192x128_16x16_16x16_8x32x1_8x32x1_1x32x1x8_8x8x1_2x1_intrawave_v3,0.0,0.0,0.0
gfx942,80,16384,1536,7168,torch.float8_e4m3fnuz,ck,68,0,940.0969,a8w8_bpreshuffle_256x128x192x128_16x16_16x16_8x32x1_8x32x1_1x32x1x8_8x8x1_2x1_intrawave_v3,3837.66,190.17,0.0
gfx942,80,20480,1536,7168,torch.float8_e4m3fnuz,ck,93,0,1157.9543,a8w8_bpreshuffle_256x64x192x128_16x16_16x16_8x32x1_8x32x1_1x32x1x8_8x8x1_2x1_intrawave_v3,3894.55,190.62,0.0
gfx942,80,32768,1536,7168,torch.float8_e4m3fnuz,ck,68,0,1872.4274,a8w8_bpreshuffle_256x128x192x128_16x16_16x16_8x32x1_8x32x1_1x32x1x8_8x8x1_2x1_intrawave_v3,0.0,0.0,0.0
gfx942,80,65536,1536,7168,torch.float8_e4m3fnuz,ck,93,0,3736.9156,a8w8_bpreshuffle_256x64x192x128_16x16_16x16_8x32x1_8x32x1_1x32x1x8_8x8x1_2x1_intrawave_v3,0.0,0.0,0.0
gfx942,80,98304,1536,7168,torch.float8_e4m3fnuz,ck,102,0,5497.497,a8w8_bpreshuffle_256x96x256x128_16x16_16x16_8x32x1_8x32x1_1x32x1x8_8x8x1_2x1_intrawave_v3,0.0,0.0,0.0
gfx942,80,131072,1536,7168,torch.float8_e4m3fnuz,ck,68,0,7429.8789,a8w8_bpreshuffle_256x128x192x128_16x16_16x16_8x32x1_8x32x1_1x32x1x8_8x8x1_2x1_intrawave_v3,0.0,0.0,0.0
gfx942,80,1,2048,7168,torch.float8_e4m3fnuz,ck,10,0,12.1709,a8w8_bpreshuffle_128x16x32x512_16x16_16x16_32x4x1_32x4x1_1x16x1x8_4x4x1_1x1_intrawave_v1,2.41,1207.09,0.0
gfx942,80,2,2048,7168,torch.float8_e4m3fnuz,ck,10,0,11.7272,a8w8_bpreshuffle_128x16x32x512_16x16_16x16_32x4x1_32x4x1_1x16x1x8_4x4x1_1x1_intrawave_v1,5.01,1253.72,0.0
gfx942,80,4,2048,7168,torch.float8_e4m3fnuz,ck,10,0,12.2432,a8w8_bpreshuffle_128x16x32x512_16x16_16x16_32x4x1_32x4x1_1x16x1x8_4x4x1_1x1_intrawave_v1,9.59,1202.72,0.0
gfx942,80,8,2048,7168,torch.float8_e4m3fnuz,ck,10,0,12.4565,a8w8_bpreshuffle_128x16x32x512_16x16_16x16_32x4x1_32x4x1_1x16x1x8_4x4x1_1x1_intrawave_v1,18.86,1185.74,0.0
gfx942,80,16,2048,7168,torch.float8_e4m3fnuz,ck,10,0,11.2137,a8w8_bpreshuffle_128x16x32x512_16x16_16x16_32x4x1_32x4x1_1x16x1x8_4x4x1_1x1_intrawave_v1,41.89,1325.19,0.0
gfx942,80,32,2048,7168,torch.float8_e4m3fnuz,ck,11,0,12.645,a8w8_bpreshuffle_256x16x64x512_16x16_16x16_32x8x1_32x8x1_1x16x1x16_4x4x1_1x1_intrawave_v1,74.3,1189.44,0.0
gfx942,80,64,2048,7168,torch.float8_e4m3fnuz,ck,6,0,18.2067,a8w8_bpreshuffle_256x16x128x512_16x16_16x16_32x8x1_32x8x1_1x16x1x16_8x8x1_1x2_intrawave_v1,103.21,845.9,0.0
gfx942,80,96,2048,7168,torch.float8_e4m3fnuz,ck,113,0,21.5433,a8w8_bpreshuffle_256x48x64x256_16x16_16x16_16x16x1_16x16x1_1x16x1x16_4x4x1_1x1_intrawave_v1,130.83,731.62,0.0
gfx942,80,128,2048,7168,torch.float8_e4m3fnuz,ck,114,0,24.2173,a8w8_bpreshuffle_256x64x64x256_16x16_16x16_16x16x1_16x16x1_1x32x1x8_8x8x1_2x1_intrawave_v3,155.18,665.72,0.0
gfx942,80,160,2048,7168,torch.float8_e4m3fnuz,ck,119,0,24.4219,a8w8_bpreshuffle_256x32x128x256_16x16_16x16_16x16x1_16x16x1_1x16x1x16_8x8x1_1x2_intrawave_v1,192.35,674.9,0.0
gfx942,80,192,2048,7168,torch.float8_e4m3fnuz,ck,120,0,29.915,a8w8_bpreshuffle_256x48x128x256_16x16_16x16_16x16x1_16x16x1_1x16x1x16_8x8x1_1x2_intrawave_v1,188.44,563.02,0.0
gfx942,80,224,2048,7168,torch.float8_e4m3fnuz,ck,120,0,31.6736,a8w8_bpreshuffle_256x48x128x256_16x16_16x16_16x16x1_16x16x1_1x16x1x16_8x8x1_1x2_intrawave_v1,207.64,543.14,0.0
gfx942,80,256,2048,7168,torch.float8_e4m3fnuz,ck,114,0,38.2291,a8w8_bpreshuffle_256x64x64x256_16x16_16x16_16x16x1_16x16x1_1x32x1x8_8x8x1_2x1_intrawave_v3,196.61,459.43,0.0
gfx942,80,288,2048,7168,torch.float8_e4m3fnuz,ck,119,0,38.7116,a8w8_bpreshuffle_256x32x128x256_16x16_16x16_16x16x1_16x16x1_1x16x1x16_8x8x1_1x2_intrawave_v1,218.43,463.02,0.0
gfx942,80,320,2048,7168,torch.float8_e4m3fnuz,ck,114,0,38.5684,a8w8_bpreshuffle_256x64x64x256_16x16_16x16_16x16x1_16x16x1_1x32x1x8_8x8x1_2x1_intrawave_v3,243.6,474.08,0.0
gfx942,80,352,2048,7168,torch.float8_e4m3fnuz,ck,122,0,50.8883,a8w8_bpreshuffle_256x80x128x256_16x16_16x16_16x16x1_16x16x1_1x16x1x16_8x8x1_1x2_intrawave_v3,203.09,366.39,0.0
gfx942,80,384,2048,7168,torch.float8_e4m3fnuz,ck,123,0,50.7212,a8w8_bpreshuffle_256x96x128x256_16x16_16x16_16x16x1_16x16x1_1x16x1x16_8x8x1_1x2_intrawave_v3,222.28,374.7,0.0
gfx942,80,416,2048,7168,torch.float8_e4m3fnuz,ck,120,0,52.9749,a8w8_bpreshuffle_256x48x128x256_16x16_16x16_16x16x1_16x16x1_1x16x1x16_8x8x1_1x2_intrawave_v1,230.56,365.57,0.0
gfx942,80,448,2048,7168,torch.float8_e4m3fnuz,ck,123,0,53.8786,a8w8_bpreshuffle_256x96x128x256_16x16_16x16_16x16x1_16x16x1_1x16x1x16_8x8x1_1x2_intrawave_v3,244.13,366.13,0.0
gfx942,80,480,2048,7168,torch.float8_e4m3fnuz,ck,123,0,51.3534,a8w8_bpreshuffle_256x96x128x256_16x16_16x16_16x16x1_16x16x1_1x16x1x16_8x8x1_1x2_intrawave_v3,274.43,391.15,0.0
gfx942,80,512,2048,7168,torch.float8_e4m3fnuz,ck,85,0,60.8768,a8w8_bpreshuffle_256x64x128x128_16x16_16x16_8x32x1_8x32x1_1x32x1x8_8x8x1_2x1_intrawave_v3,246.93,335.88,0.0
gfx942,80,1024,2048,7168,torch.float8_e4m3fnuz,ck,85,0,105.0089,a8w8_bpreshuffle_256x64x128x128_16x16_16x16_8x32x1_8x32x1_1x32x1x8_8x8x1_2x1_intrawave_v3,286.31,249.64,0.0
gfx942,80,2048,2048,7168,torch.float8_e4m3fnuz,ck,85,0,184.1052,a8w8_bpreshuffle_256x64x128x128_16x16_16x16_8x32x1_8x32x1_1x32x1x8_8x8x1_2x1_intrawave_v3,326.6,205.04,0.0
gfx942,80,4096,2048,7168,torch.float8_e4m3fnuz,ck,85,0,340.0794,a8w8_bpreshuffle_256x64x128x128_16x16_16x16_8x32x1_8x32x1_1x32x1x8_8x8x1_2x1_intrawave_v3,353.62,178.83,0.0
gfx942,80,6144,2048,7168,torch.float8_e4m3fnuz,ck,85,0,507.8765,a8w8_bpreshuffle_256x64x128x128_16x16_16x16_8x32x1_8x32x1_1x32x1x8_8x8x1_2x1_intrawave_v3,355.18,165.17,0.0
gfx942,80,8192,2048,7168,torch.float8_e4m3fnuz,ck,71,0,664.0129,a8w8_bpreshuffle_256x128x128x64_16x16_16x16_4x64x1_4x64x1_1x32x1x8_8x8x1_2x1_intrawave_v3,362.22,161.07,0.0
gfx942,80,10240,2048,7168,torch.float8_e4m3fnuz,ck,85,0,828.0104,a8w8_bpreshuffle_256x64x128x128_16x16_16x16_8x32x1_8x32x1_1x32x1x8_8x8x1_2x1_intrawave_v3,363.1,157.03,0.0
gfx942,80,12288,2048,7168,torch.float8_e4m3fnuz,ck,102,0,976.0123,a8w8_bpreshuffle_256x96x256x128_16x16_16x16_8x32x1_8x32x1_1x32x1x8_8x8x1_2x1_intrawave_v3,369.64,156.85,0.0
gfx942,80,14336,2048,7168,torch.float8_e4m3fnuz,ck,102,0,1150.9875,a8w8_bpreshuffle_256x96x256x128_16x16_16x16_8x32x1_8x32x1_1x32x1x8_8x8x1_2x1_intrawave_v3,365.69,153.05,0.0
gfx942,80,16384,2048,7168,torch.float8_e4m3fnuz,ck,85,0,1318.349,a8w8_bpreshuffle_256x64x128x128_16x16_16x16_8x32x1_8x32x1_1x32x1x8_8x8x1_2x1_intrawave_v3,364.88,151.12,0.0
gfx942,80,32768,2048,7168,torch.float8_e4m3fnuz,ck,85,0,2600.154,a8w8_bpreshuffle_256x64x128x128_16x16_16x16_8x32x1_8x32x1_1x32x1x8_8x8x1_2x1_intrawave_v3,370.01,147.6,0.0
gfx942,80,65536,2048,7168,torch.float8_e4m3fnuz,ck,85,0,5214.9027,a8w8_bpreshuffle_256x64x128x128_16x16_16x16_8x32x1_8x32x1_1x32x1x8_8x8x1_2x1_intrawave_v3,368.97,144.37,0.0
gfx942,80,98304,2048,7168,torch.float8_e4m3fnuz,ck,102,0,7585.8107,a8w8_bpreshuffle_256x96x256x128_16x16_16x16_8x32x1_8x32x1_1x32x1x8_8x8x1_2x1_intrawave_v3,380.48,147.9,0.0
gfx942,80,1,2112,7168,torch.float8_e4m3fnuz,ck,10,0,11.7937,a8w8_bpreshuffle_128x16x32x512_16x16_16x16_32x4x1_32x4x1_1x16x1x8_4x4x1_1x1_intrawave_v1,2.57,1284.6,0.0
gfx942,80,16,2112,7168,torch.float8_e4m3fnuz,ck,10,0,10.8571,a8w8_bpreshuffle_128x16x32x512_16x16_16x16_32x4x1_32x4x1_1x16x1x8_4x4x1_1x1_intrawave_v1,44.62,1411.16,0.0
gfx942,80,32,2112,7168,torch.float8_e4m3fnuz,ck,11,0,12.5633,a8w8_bpreshuffle_256x16x64x512_16x16_16x16_32x8x1_32x8x1_1x16x1x16_4x4x1_1x1_intrawave_v1,77.12,1234.02,0.0
gfx942,80,48,2112,7168,torch.float8_e4m3fnuz,ck,10,0,18.4707,a8w8_bpreshuffle_128x16x32x512_16x16_16x16_32x4x1_32x4x1_1x16x1x8_4x4x1_1x1_intrawave_v1,786.83,849.22,0.0
gfx942,80,64,2112,7168,torch.float8_e4m3fnuz,ck,12,0,18.5595,a8w8_bpreshuffle_256x32x64x512_16x16_16x16_32x8x1_32x8x1_1x32x1x8_8x8x1_1x2_intrawave_v1,104.41,854.97,0.0
gfx942,80,80,2112,7168,torch.float8_e4m3fnuz,ck,113,0,23.5729,a8w8_bpreshuffle_256x48x64x256_16x16_16x16_16x16x1_16x16x1_1x16x1x16_4x4x1_1x1_intrawave_v1,102.75,680.87,0.0
gfx942,80,96,2112,7168,torch.float8_e4m3fnuz,ck,113,0,21.5242,a8w8_bpreshuffle_256x48x64x256_16x16_16x16_16x16x1_16x16x1_1x16x1x16_4x4x1_1x1_intrawave_v1,135.04,754.15,0.0
gfx942,80,112,2112,7168,torch.float8_e4m3fnuz,ck,112,0,25.9619,a8w8_bpreshuffle_256x32x64x256_16x16_16x16_16x16x1_16x16x1_1x32x1x8_8x8x1_2x1_intrawave_v1,1306.18,632.26,0.0
gfx942,80,128,2112,7168,torch.float8_e4m3fnuz,ck,114,0,23.6699,a8w8_bpreshuffle_256x64x64x256_16x16_16x16_16x16x1_16x16x1_1x32x1x8_8x8x1_2x1_intrawave_v3,163.73,701.19,0.0
gfx942,80,160,2112,7168,torch.float8_e4m3fnuz,ck,115,0,28.9398,a8w8_bpreshuffle_256x80x64x256_16x16_16x16_16x16x1_16x16x1_1x16x1x16_4x4x1_1x1_intrawave_v3,1673.96,586.1,0.0
gfx942,80,192,2112,7168,torch.float8_e4m3fnuz,ck,126,0,32.1086,a8w8_bpreshuffle_256x32x192x256_16x16_16x16_16x16x1_16x16x1_1x32x1x8_8x8x1_2x1_intrawave_v1,1810.51,539.61,0.0
gfx942,80,224,2112,7168,torch.float8_e4m3fnuz,ck,126,0,32.5198,a8w8_bpreshuffle_256x32x192x256_16x16_16x16_16x16x1_16x16x1_1x32x1x8_8x8x1_2x1_intrawave_v1,2085.56,544.0,0.0
gfx942,80,256,2112,7168,torch.float8_e4m3fnuz,ck,114,0,37.3908,a8w8_bpreshuffle_256x64x64x256_16x16_16x16_16x16x1_16x16x1_1x32x1x8_8x8x1_2x1_intrawave_v3,2072.99,482.88,0.0
gfx942,80,288,2112,7168,torch.float8_e4m3fnuz,ck,113,0,44.2402,a8w8_bpreshuffle_256x48x64x256_16x16_16x16_16x16x1_16x16x1_1x16x1x16_4x4x1_1x1_intrawave_v1,1971.05,416.36,0.0
gfx942,80,320,2112,7168,torch.float8_e4m3fnuz,ck,113,0,45.9122,a8w8_bpreshuffle_256x48x64x256_16x16_16x16_16x16x1_16x16x1_1x16x1x16_4x4x1_1x1_intrawave_v1,2110.3,409.13,0.0
gfx942,80,352,2112,7168,torch.float8_e4m3fnuz,ck,128,0,49.7251,a8w8_bpreshuffle_256x64x192x256_16x16_16x16_16x16x1_16x16x1_1x32x1x8_8x8x1_2x1_intrawave_v3,2143.33,385.09,0.0
gfx942,80,384,2112,7168,torch.float8_e4m3fnuz,ck,128,0,47.5375,a8w8_bpreshuffle_256x64x192x256_16x16_16x16_16x16x1_16x16x1_1x32x1x8_8x8x1_2x1_intrawave_v3,2445.78,410.48,0.0
gfx942,80,512,2112,7168,torch.float8_e4m3fnuz,ck,129,0,60.4509,a8w8_bpreshuffle_256x80x192x256_16x16_16x16_16x16x1_16x16x1_1x16x1x16_4x4x1_1x1_intrawave_v3,2564.42,346.92,0.0
gfx942,80,1024,2112,7168,torch.float8_e4m3fnuz,ck,93,0,115.8099,a8w8_bpreshuffle_256x64x192x128_16x16_16x16_8x32x1_8x32x1_1x32x1x8_8x8x1_2x1_intrawave_v3,2677.17,231.45,0.0
gfx942,80,1536,2112,7168,torch.float8_e4m3fnuz,ck,68,0,148.9129,a8w8_bpreshuffle_256x128x192x128_16x16_16x16_8x32x1_8x32x1_1x32x1x8_8x8x1_2x1_intrawave_v3,3123.06,219.17,0.0
gfx942,80,2048,2112,7168,torch.float8_e4m3fnuz,ck,93,0,186.5271,a8w8_bpreshuffle_256x64x192x128_16x16_16x16_8x32x1_8x32x1_1x32x1x8_8x8x1_2x1_intrawave_v3,3324.37,206.24,0.0
gfx942,80,4096,2112,7168,torch.float8_e4m3fnuz,ck,93,0,329.2957,a8w8_bpreshuffle_256x64x192x128_16x16_16x16_8x32x1_8x32x1_1x32x1x8_8x8x1_2x1_intrawave_v3,3766.13,187.67,0.0
gfx942,80,8192,2112,7168,torch.float8_e4m3fnuz,ck,68,0,649.3748,a8w8_bpreshuffle_256x128x192x128_16x16_16x16_8x32x1_8x32x1_1x32x1x8_8x8x1_2x1_intrawave_v3,3819.59,167.03,0.0
gfx942,80,16384,2112,7168,torch.float8_e4m3fnuz,ck,93,0,1284.8613,a8w8_bpreshuffle_256x64x192x128_16x16_16x16_8x32x1_8x32x1_1x32x1x8_8x8x1_2x1_intrawave_v3,3860.87,157.05,0.0
gfx942,80,32768,2112,7168,torch.float8_e4m3fnuz,ck,93,0,2566.2639,a8w8_bpreshuffle_256x64x192x128_16x16_16x16_8x32x1_8x32x1_1x32x1x8_8x8x1_2x1_intrawave_v3,3866.08,151.36,0.0
gfx942,80,49152,2112,7168,torch.float8_e4m3fnuz,ck,93,0,3805.7733,a8w8_bpreshuffle_256x64x192x128_16x16_16x16_8x32x1_8x32x1_1x32x1x8_8x8x1_2x1_intrawave_v3,3910.39,151.11,0.0
gfx942,80,65536,2112,7168,torch.float8_e4m3fnuz,ck,93,0,5062.5452,a8w8_bpreshuffle_256x64x192x128_16x16_16x16_8x32x1_8x32x1_1x32x1x8_8x8x1_2x1_intrawave_v3,3919.52,150.46,0.0
gfx942,80,73728,2112,7168,torch.float8_e4m3fnuz,ck,93,0,5700.3689,a8w8_bpreshuffle_256x64x192x128_16x16_16x16_8x32x1_8x32x1_1x32x1x8_8x8x1_2x1_intrawave_v3,3916.08,150.0,0.0
gfx942,80,98304,2112,7168,torch.float8_e4m3fnuz,ck,95,0,7892.5471,a8w8_bpreshuffle_256x128x192x128_16x16_16x16_8x32x1_8x32x1_1x16x1x16_4x4x1_1x1_intrawave_v3,377.12,143.81,0.0
gfx942,80,131072,2112,7168,torch.float8_e4m3fnuz,ck,93,0,10093.2233,a8w8_bpreshuffle_256x64x192x128_16x16_16x16_8x32x1_8x32x1_1x32x1x8_8x8x1_2x1_intrawave_v3,3931.9,149.44,0.0
gfx942,80,1,2240,7168,torch.float8_e4m3fnuz,ck,10,0,11.693,a8w8_bpreshuffle_128x16x32x512_16x16_16x16_32x4x1_32x4x1_1x16x1x8_4x4x1_1x1_intrawave_v1,2.75,1374.15,0.0
gfx942,80,2,2240,7168,torch.float8_e4m3fnuz,ck,10,0,11.9922,a8w8_bpreshuffle_128x16x32x512_16x16_16x16_32x4x1_32x4x1_1x16x1x8_4x4x1_1x1_intrawave_v1,5.36,1340.84,0.0
gfx942,80,4,2240,7168,torch.float8_e4m3fnuz,ck,10,0,11.9683,a8w8_bpreshuffle_128x16x32x512_16x16_16x16_32x4x1_32x4x1_1x16x1x8_4x4x1_1x1_intrawave_v1,10.73,1345.46,0.0
gfx942,80,8,2240,7168,torch.float8_e4m3fnuz,ck,10,0,12.2626,a8w8_bpreshuffle_128x16x32x512_16x16_16x16_32x4x1_32x4x1_1x16x1x8_4x4x1_1x1_intrawave_v1,20.95,1316.97,0.0
gfx942,80,16,2240,7168,torch.float8_e4m3fnuz,ck,10,0,11.1279,a8w8_bpreshuffle_128x16x32x512_16x16_16x16_32x4x1_32x4x1_1x16x1x8_4x4x1_1x1_intrawave_v1,461.72,1459.64,0.0
gfx942,80,32,2240,7168,torch.float8_e4m3fnuz,ck,11,0,12.5136,a8w8_bpreshuffle_256x16x64x512_16x16_16x16_32x8x1_32x8x1_1x16x1x16_4x4x1_1x1_intrawave_v1,82.12,1312.9,0.0
gfx942,80,48,2240,7168,torch.float8_e4m3fnuz,ck,10,0,18.3626,a8w8_bpreshuffle_128x16x32x512_16x16_16x16_32x4x1_32x4x1_1x16x1x8_4x4x1_1x1_intrawave_v1,839.43,904.85,0.0
gfx942,80,64,2240,7168,torch.float8_e4m3fnuz,ck,12,0,18.5811,a8w8_bpreshuffle_256x32x64x512_16x16_16x16_32x8x1_32x8x1_1x32x1x8_8x8x1_1x2_intrawave_v1,110.61,904.24,0.0
gfx942,80,80,2240,7168,torch.float8_e4m3fnuz,ck,113,0,23.5984,a8w8_bpreshuffle_256x48x64x256_16x16_16x16_16x16x1_16x16x1_1x16x1x16_4x4x1_1x1_intrawave_v1,1088.64,719.89,0.0
gfx942,80,96,2240,7168,torch.float8_e4m3fnuz,ck,113,0,21.5933,a8w8_bpreshuffle_256x48x64x256_16x16_16x16_16x16x1_16x16x1_1x16x1x16_4x4x1_1x1_intrawave_v1,142.77,795.36,0.0
gfx942,80,112,2240,7168,torch.float8_e4m3fnuz,ck,112,0,26.1124,a8w8_bpreshuffle_256x32x64x256_16x16_16x16_16x16x1_16x16x1_1x32x1x8_8x8x1_2x1_intrawave_v1,1377.36,664.85,0.0
gfx942,80,128,2240,7168,torch.float8_e4m3fnuz,ck,114,0,23.9804,a8w8_bpreshuffle_256x64x64x256_16x16_16x16_16x16x1_16x16x1_1x32x1x8_8x8x1_2x1_intrawave_v3,1714.07,731.73,0.0
gfx942,80,160,2240,7168,torch.float8_e4m3fnuz,ck,115,0,28.9759,a8w8_bpreshuffle_256x80x64x256_16x16_16x16_16x16x1_16x16x1_1x16x1x16_4x4x1_1x1_intrawave_v3,0.0,0.0,0.0
gfx942,80,192,2240,7168,torch.float8_e4m3fnuz,ck,113,0,32.2862,a8w8_bpreshuffle_256x48x64x256_16x16_16x16_16x16x1_16x16x1_1x16x1x16_4x4x1_1x1_intrawave_v1,1909.68,566.58,0.0
gfx942,80,224,2240,7168,torch.float8_e4m3fnuz,ck,117,0,37.5099,a8w8_bpreshuffle_256x112x64x256_16x16_16x16_16x16x1_16x16x1_1x16x1x16_4x4x1_1x1_intrawave_v3,0.0,0.0,0.0
gfx942,80,256,2240,7168,torch.float8_e4m3fnuz,ck,114,0,37.1525,a8w8_bpreshuffle_256x64x64x256_16x16_16x16_16x16x1_16x16x1_1x32x1x8_8x8x1_2x1_intrawave_v3,2212.73,512.43,0.0
gfx942,80,288,2240,7168,torch.float8_e4m3fnuz,ck,113,0,44.5,a8w8_bpreshuffle_256x48x64x256_16x16_16x16_16x16x1_16x16x1_1x16x1x16_4x4x1_1x1_intrawave_v1,0.0,0.0,0.0
gfx942,80,320,2240,7168,torch.float8_e4m3fnuz,ck,112,0,53.8671,a8w8_bpreshuffle_256x32x64x256_16x16_16x16_16x16x1_16x16x1_1x32x1x8_8x8x1_2x1_intrawave_v1,190.77,367.27,0.0
gfx942,80,352,2240,7168,torch.float8_e4m3fnuz,ck,78,0,54.0168,a8w8_bpreshuffle_256x96x64x128_16x16_16x16_8x32x1_8x32x1_1x32x1x8_8x8x1_2x1_intrawave_v3,0.0,0.0,0.0
gfx942,80,384,2240,7168,torch.float8_e4m3fnuz,ck,78,0,53.062,a8w8_bpreshuffle_256x96x64x128_16x16_16x16_8x32x1_8x32x1_1x32x1x8_8x8x1_2x1_intrawave_v3,0.0,0.0,0.0
gfx942,80,416,2240,7168,torch.float8_e4m3fnuz,ck,113,0,62.1588,a8w8_bpreshuffle_256x48x64x256_16x16_16x16_16x16x1_16x16x1_1x16x1x16_4x4x1_1x1_intrawave_v1,0.0,0.0,0.0
gfx942,80,448,2240,7168,torch.float8_e4m3fnuz,ck,114,0,70.1253,a8w8_bpreshuffle_256x64x64x256_16x16_16x16_16x16x1_16x16x1_1x32x1x8_8x8x1_2x1_intrawave_v3,0.0,0.0,0.0
gfx942,80,480,2240,7168,torch.float8_e4m3fnuz,ck,62,0,70.4585,a8w8_bpreshuffle_256x128x64x128_16x16_16x16_8x32x1_8x32x1_1x32x1x8_8x8x1_2x1_intrawave_v3,0.0,0.0,0.0
gfx942,80,512,2240,7168,torch.float8_e4m3fnuz,ck,62,0,66.3638,a8w8_bpreshuffle_256x128x64x128_16x16_16x16_8x32x1_8x32x1_1x32x1x8_8x8x1_2x1_intrawave_v3,2477.51,331.81,0.0
gfx942,80,1024,2240,7168,torch.float8_e4m3fnuz,ck,114,0,120.7469,a8w8_bpreshuffle_256x64x64x256_16x16_16x16_16x16x1_16x16x1_1x32x1x8_8x8x1_2x1_intrawave_v3,2723.33,231.76,0.0
gfx942,80,1536,2240,7168,torch.float8_e4m3fnuz,ck,48,0,177.0619,a8w8_bpreshuffle_256x192x224x128_16x16_16x16_8x32x1_8x32x1_1x64x1x4_8x8x1_2x1_intrawave_v3,2785.75,191.73,0.0
gfx942,80,2048,2240,7168,torch.float8_e4m3fnuz,ck,79,0,230.9106,a8w8_bpreshuffle_256x128x64x128_16x16_16x16_8x32x1_8x32x1_1x16x1x16_4x4x1_1x1_intrawave_v3,2848.14,172.84,0.0
gfx942,80,4096,2240,7168,torch.float8_e4m3fnuz,ck,69,0,437.1832,a8w8_bpreshuffle_256x128x160x128_16x16_16x16_8x32x1_8x32x1_1x64x1x4_8x8x1_2x1_intrawave_v3,3008.66,145.86,0.0
gfx942,80,6144,2240,7168,torch.float8_e4m3fnuz,ck,69,0,662.2802,a8w8_bpreshuffle_256x128x160x128_16x16_16x16_8x32x1_8x32x1_1x64x1x4_8x8x1_2x1_intrawave_v3,0.0,0.0,0.0
gfx942,80,8192,2240,7168,torch.float8_e4m3fnuz,ck,69,0,857.9718,a8w8_bpreshuffle_256x128x160x128_16x16_16x16_8x32x1_8x32x1_1x64x1x4_8x8x1_2x1_intrawave_v3,3066.15,129.93,0.0
gfx942,80,10240,2240,7168,torch.float8_e4m3fnuz,ck,69,0,1018.0438,a8w8_bpreshuffle_256x128x160x128_16x16_16x16_8x32x1_8x32x1_1x64x1x4_8x8x1_2x1_intrawave_v3,0.0,0.0,0.0
gfx942,80,12288,2240,7168,torch.float8_e4m3fnuz,ck,69,0,1231.0498,a8w8_bpreshuffle_256x128x160x128_16x16_16x16_8x32x1_8x32x1_1x64x1x4_8x8x1_2x1_intrawave_v3,0.0,0.0,0.0
gfx942,80,14336,2240,7168,torch.float8_e4m3fnuz,ck,69,0,1461.7946,a8w8_bpreshuffle_256x128x160x128_16x16_16x16_8x32x1_8x32x1_1x64x1x4_8x8x1_2x1_intrawave_v3,0.0,0.0,0.0
gfx942,80,16384,2240,7168,torch.float8_e4m3fnuz,ck,69,0,1644.8521,a8w8_bpreshuffle_256x128x160x128_16x16_16x16_8x32x1_8x32x1_1x64x1x4_8x8x1_2x1_intrawave_v3,3198.67,125.78,0.0
gfx942,80,32768,2240,7168,torch.float8_e4m3fnuz,ck,69,0,3196.032,a8w8_bpreshuffle_256x128x160x128_16x16_16x16_8x32x1_8x32x1_1x64x1x4_8x8x1_2x1_intrawave_v3,3292.42,124.45,0.0
gfx942,80,49152,2240,7168,torch.float8_e4m3fnuz,ck,69,0,4812.8899,a8w8_bpreshuffle_256x128x160x128_16x16_16x16_8x32x1_8x32x1_1x64x1x4_8x8x1_2x1_intrawave_v3,3279.53,122.29,0.0
gfx942,80,65536,2240,7168,torch.float8_e4m3fnuz,ck,69,0,6365.1402,a8w8_bpreshuffle_256x128x160x128_16x16_16x16_8x32x1_8x32x1_1x64x1x4_8x8x1_2x1_intrawave_v3,3306.34,122.45,0.0
gfx942,80,73728,2240,7168,torch.float8_e4m3fnuz,ck,69,0,7155.8623,a8w8_bpreshuffle_256x128x160x128_16x16_16x16_8x32x1_8x32x1_1x64x1x4_8x8x1_2x1_intrawave_v3,3308.62,122.26,0.0
gfx942,80,98304,2240,7168,torch.float8_e4m3fnuz,ck,69,0,9755.5399,a8w8_bpreshuffle_256x128x160x128_16x16_16x16_8x32x1_8x32x1_1x64x1x4_8x8x1_2x1_intrawave_v3,0.0,0.0,0.0
gfx942,80,131072,2240,7168,torch.float8_e4m3fnuz,ck,69,0,12728.0402,a8w8_bpreshuffle_256x128x160x128_16x16_16x16_8x32x1_8x32x1_1x64x1x4_8x8x1_2x1_intrawave_v3,3306.93,121.21,0.0
gfx942,80,1,3072,1536,torch.float8_e4m3fnuz,ck,5,0,5.6562,a8w8_bpreshuffle_256x16x64x512_16x16_16x16_32x8x1_32x8x1_1x16x1x16_4x4x1_1x1_intrawave_v1,0.0,0.0,0.0
gfx942,80,2,3072,1536,torch.float8_e4m3fnuz,ck,11,0,5.911,a8w8_bpreshuffle_256x16x64x512_16x16_16x16_32x8x1_32x8x1_1x16x1x16_4x4x1_1x1_intrawave_v1,0.0,0.0,0.0
gfx942,80,4,3072,1536,torch.float8_e4m3fnuz,ck,11,0,5.8834,a8w8_bpreshuffle_256x16x64x512_16x16_16x16_32x8x1_32x8x1_1x16x1x16_4x4x1_1x1_intrawave_v1,0.0,0.0,0.0
gfx942,80,8,3072,1536,torch.float8_e4m3fnuz,ck,10,0,5.8254,a8w8_bpreshuffle_128x16x32x512_16x16_16x16_32x4x1_32x4x1_1x16x1x8_4x4x1_1x1_intrawave_v1,0.0,0.0,0.0
gfx942,80,16,3072,1536,torch.float8_e4m3fnuz,ck,11,0,5.8974,a8w8_bpreshuffle_256x16x64x512_16x16_16x16_32x8x1_32x8x1_1x16x1x16_4x4x1_1x1_intrawave_v1,256.04,820.95,0.0
gfx942,80,32,3072,1536,torch.float8_e4m3fnuz,ck,112,0,6.9922,a8w8_bpreshuffle_256x32x64x256_16x16_16x16_16x16x1_16x16x1_1x32x1x8_8x8x1_2x1_intrawave_v1,431.9,709.98,0.0
gfx942,80,64,3072,1536,torch.float8_e4m3fnuz,ck,114,0,9.0146,a8w8_bpreshuffle_256x64x64x256_16x16_16x16_16x16x1_16x16x1_1x32x1x8_8x8x1_2x1_intrawave_v3,670.0,577.96,0.0
gfx942,80,96,3072,1536,torch.float8_e4m3fnuz,ck,112,0,9.6664,a8w8_bpreshuffle_256x32x64x256_16x16_16x16_16x16x1_16x16x1_1x32x1x8_8x8x1_2x1_intrawave_v1,937.24,564.42,0.0
gfx942,80,128,3072,1536,torch.float8_e4m3fnuz,ck,112,0,11.1838,a8w8_bpreshuffle_256x32x64x256_16x16_16x16_16x16x1_16x16x1_1x32x1x8_8x8x1_2x1_intrawave_v1,1080.1,509.81,0.0
gfx942,80,160,3072,1536,torch.float8_e4m3fnuz,ck,112,0,11.4913,a8w8_bpreshuffle_256x32x64x256_16x16_16x16_16x16x1_16x16x1_1x32x1x8_8x8x1_2x1_intrawave_v1,1313.99,517.56,0.0
gfx942,80,192,3072,1536,torch.float8_e4m3fnuz,ck,119,0,12.4325,a8w8_bpreshuffle_256x32x128x256_16x16_16x16_16x16x1_16x16x1_1x16x1x16_8x8x1_1x2_intrawave_v1,1457.42,498.14,0.0
gfx942,80,224,3072,1536,torch.float8_e4m3fnuz,ck,113,0,14.6673,a8w8_bpreshuffle_256x48x64x256_16x16_16x16_16x16x1_16x16x1_1x16x1x16_4x4x1_1x1_intrawave_v1,1441.25,439.0,0.0
gfx942,80,256,3072,1536,torch.float8_e4m3fnuz,ck,120,0,16.0983,a8w8_bpreshuffle_256x48x128x256_16x16_16x16_16x16x1_16x16x1_1x16x1x16_8x8x1_1x2_intrawave_v1,1500.73,415.24,0.0
gfx942,80,288,3072,1536,torch.float8_e4m3fnuz,ck,120,0,16.2173,a8w8_bpreshuffle_256x48x128x256_16x16_16x16_16x16x1_16x16x1_1x16x1x16_8x8x1_1x2_intrawave_v1,1675.93,427.35,0.0
gfx942,80,320,3072,1536,torch.float8_e4m3fnuz,ck,119,0,16.7997,a8w8_bpreshuffle_256x32x128x256_16x16_16x16_16x16x1_16x16x1_1x16x1x16_8x8x1_1x2_intrawave_v1,1797.59,427.16,0.0
gfx942,80,352,3072,1536,torch.float8_e4m3fnuz,ck,85,0,18.9609,a8w8_bpreshuffle_256x64x128x128_16x16_16x16_8x32x1_8x32x1_1x32x1x8_8x8x1_2x1_intrawave_v3,1751.97,391.43,0.0
gfx942,80,384,3072,1536,torch.float8_e4m3fnuz,ck,85,0,18.7893,a8w8_bpreshuffle_256x64x128x128_16x16_16x16_8x32x1_8x32x1_1x32x1x8_8x8x1_2x1_intrawave_v3,1928.69,408.09,0.0
gfx942,80,416,3072,1536,torch.float8_e4m3fnuz,ck,100,0,20.7247,a8w8_bpreshuffle_256x32x256x128_16x16_16x16_8x32x1_8x32x1_1x32x1x8_8x8x1_2x1_intrawave_v1,0.0,0.0,0.0
gfx942,80,448,3072,1536,torch.float8_e4m3fnuz,ck,92,0,22.3115,a8w8_bpreshuffle_256x32x192x128_16x16_16x16_8x32x1_8x32x1_1x32x1x8_8x8x1_2x1_intrawave_v1,0.0,0.0,0.0
gfx942,80,480,3072,1536,torch.float8_e4m3fnuz,ck,94,0,22.3915,a8w8_bpreshuffle_256x96x192x128_16x16_16x16_8x32x1_8x32x1_1x32x1x8_8x8x1_2x1_intrawave_v3,0.0,0.0,0.0
gfx942,80,512,3072,1536,torch.float8_e4m3fnuz,ck,85,0,24.3751,a8w8_bpreshuffle_256x64x128x128_16x16_16x16_8x32x1_8x32x1_1x32x1x8_8x8x1_2x1_intrawave_v3,1982.28,354.9,0.0
gfx942,80,1024,3072,1536,torch.float8_e4m3fnuz,ck,85,0,38.8336,a8w8_bpreshuffle_256x64x128x128_16x16_16x16_8x32x1_8x32x1_1x32x1x8_8x8x1_2x1_intrawave_v3,2488.48,324.02,0.0
gfx942,80,1536,3072,1536,torch.float8_e4m3fnuz,ck,93,0,51.4668,a8w8_bpreshuffle_256x64x192x128_16x16_16x16_8x32x1_8x32x1_1x32x1x8_8x8x1_2x1_intrawave_v3,2816.48,320.89,0.0
gfx942,80,2048,3072,1536,torch.float8_e4m3fnuz,ck,72,0,69.8541,a8w8_bpreshuffle_256x64x256x64_16x16_16x16_4x64x1_4x64x1_1x16x1x16_8x8x1_1x2_intrawave_v1,2766.82,292.71,0.0
gfx942,80,4096,3072,1536,torch.float8_e4m3fnuz,ck,93,0,123.6652,a8w8_bpreshuffle_256x64x192x128_16x16_16x16_8x32x1_8x32x1_1x32x1x8_8x8x1_2x1_intrawave_v3,3125.75,292.53,0.0
gfx942,80,6144,3072,1536,torch.float8_e4m3fnuz,ck,85,0,183.0209,a8w8_bpreshuffle_256x64x128x128_16x16_16x16_8x32x1_8x32x1_1x32x1x8_8x8x1_2x1_intrawave_v3,0.0,0.0,0.0
gfx942,80,8192,3072,1536,torch.float8_e4m3fnuz,ck,71,0,235.4545,a8w8_bpreshuffle_256x128x128x64_16x16_16x16_4x64x1_4x64x1_1x32x1x8_8x8x1_2x1_intrawave_v3,3283.41,287.25,0.0
gfx942,80,10240,3072,1536,torch.float8_e4m3fnuz,ck,71,0,290.0173,a8w8_bpreshuffle_256x128x128x64_16x16_16x16_4x64x1_4x64x1_1x32x1x8_8x8x1_2x1_intrawave_v3,0.0,0.0,0.0
gfx942,80,12288,3072,1536,torch.float8_e4m3fnuz,ck,72,0,352.0628,a8w8_bpreshuffle_256x64x256x64_16x16_16x16_4x64x1_4x64x1_1x16x1x16_8x8x1_1x2_intrawave_v1,0.0,0.0,0.0
gfx942,80,14336,3072,1536,torch.float8_e4m3fnuz,ck,93,0,405.8954,a8w8_bpreshuffle_256x64x192x128_16x16_16x16_8x32x1_8x32x1_1x32x1x8_8x8x1_2x1_intrawave_v3,0.0,0.0,0.0
gfx942,80,16384,3072,1536,torch.float8_e4m3fnuz,ck,71,0,450.9699,a8w8_bpreshuffle_256x128x128x64_16x16_16x16_4x64x1_4x64x1_1x32x1x8_8x8x1_2x1_intrawave_v3,3428.58,289.48,0.0
gfx942,80,20480,3072,1536,torch.float8_e4m3fnuz,ck,71,0,557.954,a8w8_bpreshuffle_256x128x128x64_16x16_16x16_4x64x1_4x64x1_1x32x1x8_8x8x1_2x1_intrawave_v3,3463.97,290.36,0.0
gfx942,80,32768,3072,1536,torch.float8_e4m3fnuz,ck,71,0,909.865,a8w8_bpreshuffle_256x128x128x64_16x16_16x16_4x64x1_4x64x1_1x32x1x8_8x8x1_2x1_intrawave_v3,0.0,0.0,0.0
gfx942,80,65536,3072,1536,torch.float8_e4m3fnuz,ck,71,0,1787.3796,a8w8_bpreshuffle_256x128x128x64_16x16_16x16_4x64x1_4x64x1_1x32x1x8_8x8x1_2x1_intrawave_v3,0.0,0.0,0.0
gfx942,80,98304,3072,1536,torch.float8_e4m3fnuz,ck,102,0,2698.4705,a8w8_bpreshuffle_256x96x256x128_16x16_16x16_8x32x1_8x32x1_1x32x1x8_8x8x1_2x1_intrawave_v3,0.0,0.0,0.0
gfx942,80,131072,3072,1536,torch.float8_e4m3fnuz,ck,71,0,3559.9187,a8w8_bpreshuffle_256x128x128x64_16x16_16x16_4x64x1_4x64x1_1x32x1x8_8x8x1_2x1_intrawave_v3,0.0,0.0,0.0
gfx942,80,1,4096,512,torch.float8_e4m3fnuz,ck,9,0,4.2138,a8w8_bpreshuffle_128x16x32x128_16x16_16x16_8x16x1_8x16x1_1x16x1x8_4x4x1_1x1_intrawave_v1,9.95,499.75,0.0
gfx942,80,1,4096,7168,torch.float8_e4m3fnuz,ck,11,0,13.4343,a8w8_bpreshuffle_256x16x64x512_16x16_16x16_32x8x1_32x8x1_1x16x1x16_4x4x1_1x1_intrawave_v1,0.0,0.0,0.0
gfx942,80,2,4096,512,torch.float8_e4m3fnuz,ck,23,0,4.4526,a8w8_bpreshuffle_128x16x32x128_16x16_16x16_8x16x1_8x16x1_1x16x1x8_4x4x1_1x1_intrawave_v2,0.0,0.0,0.0
gfx942,80,2,4096,7168,torch.float8_e4m3fnuz,ck,11,0,13.2939,a8w8_bpreshuffle_256x16x64x512_16x16_16x16_32x8x1_32x8x1_1x16x1x16_4x4x1_1x1_intrawave_v1,0.0,0.0,0.0
gfx942,80,4,4096,512,torch.float8_e4m3fnuz,ck,23,0,4.5342,a8w8_bpreshuffle_128x16x32x128_16x16_16x16_8x16x1_8x16x1_1x16x1x8_4x4x1_1x1_intrawave_v2,0.0,0.0,0.0
gfx942,80,4,4096,7168,torch.float8_e4m3fnuz,ck,5,0,13.5363,a8w8_bpreshuffle_256x16x64x512_16x16_16x16_32x8x1_32x8x1_1x16x1x16_4x4x1_1x1_intrawave_v1,0.0,0.0,0.0
gfx942,80,8,4096,512,torch.float8_e4m3fnuz,ck,9,0,4.1858,a8w8_bpreshuffle_128x16x32x128_16x16_16x16_8x16x1_8x16x1_1x16x1x8_4x4x1_1x1_intrawave_v1,0.0,0.0,0.0
gfx942,80,8,4096,7168,torch.float8_e4m3fnuz,ck,11,0,13.6103,a8w8_bpreshuffle_256x16x64x512_16x16_16x16_32x8x1_32x8x1_1x16x1x16_4x4x1_1x1_intrawave_v1,0.0,0.0,0.0
gfx942,80,16,4096,512,torch.float8_e4m3fnuz,ck,9,0,4.2875,a8w8_bpreshuffle_128x16x32x128_16x16_16x16_8x16x1_8x16x1_1x16x1x8_4x4x1_1x1_intrawave_v1,15.65,521.61,0.0
gfx942,80,16,4096,7168,torch.float8_e4m3fnuz,ck,11,0,13.1683,a8w8_bpreshuffle_256x16x64x512_16x16_16x16_32x8x1_32x8x1_1x16x1x16_4x4x1_1x1_intrawave_v1,0.0,0.0,0.0
gfx942,80,32,4096,512,torch.float8_e4m3fnuz,ck,9,0,4.8822,a8w8_bpreshuffle_128x16x32x128_16x16_16x16_8x16x1_8x16x1_1x16x1x8_4x4x1_1x1_intrawave_v1,274.91,486.6,0.0
gfx942,80,32,4096,7168,torch.float8_e4m3fnuz,ck,12,0,18.5983,a8w8_bpreshuffle_256x32x64x512_16x16_16x16_32x8x1_32x8x1_1x32x1x8_8x8x1_1x2_intrawave_v1,0.0,0.0,0.0
gfx942,80,48,4096,512,torch.float8_e4m3fnuz,ck,9,0,5.3534,a8w8_bpreshuffle_128x16x32x128_16x16_16x16_8x16x1_8x16x1_1x16x1x8_4x4x1_1x1_intrawave_v1,376.07,469.78,0.0
gfx942,80,64,4096,512,torch.float8_e4m3fnuz,ck,77,0,5.8414,a8w8_bpreshuffle_256x64x64x128_16x16_16x16_8x32x1_8x32x1_1x32x1x8_8x8x1_2x1_intrawave_v3,459.54,454.38,0.0
gfx942,80,64,4096,7168,torch.float8_e4m3fnuz,ck,114,0,23.8807,a8w8_bpreshuffle_256x64x64x256_16x16_16x16_16x16x1_16x16x1_1x32x1x8_8x8x1_2x1_intrawave_v3,0.0,0.0,0.0
gfx942,80,80,4096,512,torch.float8_e4m3fnuz,ck,76,0,6.8102,a8w8_bpreshuffle_256x32x64x128_16x16_16x16_8x32x1_8x32x1_1x32x1x8_8x8x1_2x1_intrawave_v1,492.71,410.19,0.0
gfx942,80,96,4096,512,torch.float8_e4m3fnuz,ck,76,0,6.6322,a8w8_bpreshuffle_256x32x64x128_16x16_16x16_8x32x1_8x32x1_1x32x1x8_8x8x1_2x1_intrawave_v1,607.12,442.2,0.0
gfx942,80,96,4096,7168,torch.float8_e4m3fnuz,ck,120,0,29.6988,a8w8_bpreshuffle_256x48x128x256_16x16_16x16_16x16x1_16x16x1_1x16x1x16_8x8x1_1x2_intrawave_v1,0.0,0.0,0.0
gfx942,80,112,4096,512,torch.float8_e4m3fnuz,ck,76,0,7.3154,a8w8_bpreshuffle_256x32x64x128_16x16_16x16_8x32x1_8x32x1_1x32x1x8_8x8x1_2x1_intrawave_v1,642.15,419.94,0.0
gfx942,80,128,4096,512,torch.float8_e4m3fnuz,ck,76,0,7.2018,a8w8_bpreshuffle_256x32x64x128_16x16_16x16_8x32x1_8x32x1_1x32x1x8_8x8x1_2x1_intrawave_v1,745.47,445.9,0.0
gfx942,80,128,4096,7168,torch.float8_e4m3fnuz,ck,121,0,38.8588,a8w8_bpreshuffle_256x64x128x256_16x16_16x16_16x16x1_16x16x1_1x16x1x16_8x8x1_1x2_intrawave_v3,0.0,0.0,0.0
gfx942,80,160,4096,512,torch.float8_e4m3fnuz,ck,84,0,7.7118,a8w8_bpreshuffle_256x32x128x128_16x16_16x16_8x32x1_8x32x1_1x32x1x8_8x8x1_2x1_intrawave_v1,0.0,0.0,0.0
gfx942,80,160,4096,7168,torch.float8_e4m3fnuz,ck,119,0,40.6369,a8w8_bpreshuffle_256x32x128x256_16x16_16x16_16x16x1_16x16x1_1x16x1x16_8x8x1_1x2_intrawave_v1,0.0,0.0,0.0
gfx942,80,192,4096,512,torch.float8_e4m3fnuz,ck,84,0,9.9422,a8w8_bpreshuffle_256x32x128x128_16x16_16x16_8x32x1_8x32x1_1x32x1x8_8x8x1_2x1_intrawave_v1,0.0,0.0,0.0
gfx942,80,192,4096,7168,torch.float8_e4m3fnuz,ck,123,0,49.1457,a8w8_bpreshuffle_256x96x128x256_16x16_16x16_16x16x1_16x16x1_1x16x1x16_8x8x1_1x2_intrawave_v3,0.0,0.0,0.0
gfx942,80,224,4096,512,torch.float8_e4m3fnuz,ck,76,0,10.187,a8w8_bpreshuffle_256x32x64x128_16x16_16x16_8x32x1_8x32x1_1x32x1x8_8x8x1_2x1_intrawave_v1,0.0,0.0,0.0
gfx942,80,224,4096,7168,torch.float8_e4m3fnuz,ck,120,0,52.8765,a8w8_bpreshuffle_256x48x128x256_16x16_16x16_16x16x1_16x16x1_1x16x1x16_8x8x1_1x2_intrawave_v1,0.0,0.0,0.0
gfx942,80,256,4096,512,torch.float8_e4m3fnuz,ck,76,0,10.9814,a8w8_bpreshuffle_256x32x64x128_16x16_16x16_8x32x1_8x32x1_1x32x1x8_8x8x1_2x1_intrawave_v1,977.78,393.88,0.0
gfx942,80,256,4096,7168,torch.float8_e4m3fnuz,ck,85,0,60.0334,a8w8_bpreshuffle_256x64x128x128_16x16_16x16_8x32x1_8x32x1_1x32x1x8_8x8x1_2x1_intrawave_v3,0.0,0.0,0.0
gfx942,80,288,4096,512,torch.float8_e4m3fnuz,ck,85,0,10.8502,a8w8_bpreshuffle_256x64x128x128_16x16_16x16_8x32x1_8x32x1_1x32x1x8_8x8x1_2x1_intrawave_v3,0.0,0.0,0.0
gfx942,80,288,4096,7168,torch.float8_e4m3fnuz,ck,85,0,62.9998,a8w8_bpreshuffle_256x64x128x128_16x16_16x16_8x32x1_8x32x1_1x32x1x8_8x8x1_2x1_intrawave_v3,0.0,0.0,0.0
gfx942,80,320,4096,512,torch.float8_e4m3fnuz,ck,84,0,10.783,a8w8_bpreshuffle_256x32x128x128_16x16_16x16_8x32x1_8x32x1_1x32x1x8_8x8x1_2x1_intrawave_v1,0.0,0.0,0.0
gfx942,80,320,4096,7168,torch.float8_e4m3fnuz,ck,121,0,63.2822,a8w8_bpreshuffle_256x64x128x256_16x16_16x16_16x16x1_16x16x1_1x16x1x16_8x8x1_1x2_intrawave_v3,0.0,0.0,0.0
gfx942,80,352,4096,512,torch.float8_e4m3fnuz,ck,84,0,12.0603,a8w8_bpreshuffle_256x32x128x128_16x16_16x16_8x32x1_8x32x1_1x32x1x8_8x8x1_2x1_intrawave_v1,0.0,0.0,0.0
gfx942,80,352,4096,7168,torch.float8_e4m3fnuz,ck,136,0,74.9351,a8w8_bpreshuffle_256x80x256x256_16x16_16x16_16x16x1_16x16x1_1x16x1x16_8x8x1_1x2_intrawave_v3,0.0,0.0,0.0
gfx942,80,384,4096,512,torch.float8_e4m3fnuz,ck,84,0,12.2599,a8w8_bpreshuffle_256x32x128x128_16x16_16x16_8x32x1_8x32x1_1x32x1x8_8x8x1_2x1_intrawave_v1,0.0,0.0,0.0
gfx942,80,384,4096,7168,torch.float8_e4m3fnuz,ck,86,0,81.866,a8w8_bpreshuffle_256x96x128x128_16x16_16x16_8x32x1_8x32x1_1x32x1x8_8x8x1_2x1_intrawave_v3,0.0,0.0,0.0
gfx942,80,416,4096,512,torch.float8_e4m3fnuz,ck,85,0,13.5035,a8w8_bpreshuffle_256x64x128x128_16x16_16x16_8x32x1_8x32x1_1x32x1x8_8x8x1_2x1_intrawave_v3,0.0,0.0,0.0
gfx942,80,416,4096,7168,torch.float8_e4m3fnuz,ck,85,0,86.134,a8w8_bpreshuffle_256x64x128x128_16x16_16x16_8x32x1_8x32x1_1x32x1x8_8x8x1_2x1_intrawave_v3,0.0,0.0,0.0
gfx942,80,448,4096,512,torch.float8_e4m3fnuz,ck,85,0,13.3723,a8w8_bpreshuffle_256x64x128x128_16x16_16x16_8x32x1_8x32x1_1x32x1x8_8x8x1_2x1_intrawave_v3,0.0,0.0,0.0
gfx942,80,448,4096,7168,torch.float8_e4m3fnuz,ck,85,0,84.5872,a8w8_bpreshuffle_256x64x128x128_16x16_16x16_8x32x1_8x32x1_1x32x1x8_8x8x1_2x1_intrawave_v3,0.0,0.0,0.0
gfx942,80,480,4096,512,torch.float8_e4m3fnuz,ck,86,0,14.0771,a8w8_bpreshuffle_256x96x128x128_16x16_16x16_8x32x1_8x32x1_1x32x1x8_8x8x1_2x1_intrawave_v3,0.0,0.0,0.0
gfx942,80,480,4096,7168,torch.float8_e4m3fnuz,ck,86,0,82.8028,a8w8_bpreshuffle_256x96x128x128_16x16_16x16_8x32x1_8x32x1_1x32x1x8_8x8x1_2x1_intrawave_v3,0.0,0.0,0.0
gfx942,80,512,4096,512,torch.float8_e4m3fnuz,ck,85,0,15.7231,a8w8_bpreshuffle_256x64x128x128_16x16_16x16_8x32x1_8x32x1_1x32x1x8_8x8x1_2x1_intrawave_v3,1365.81,416.81,0.0
gfx942,80,512,4096,7168,torch.float8_e4m3fnuz,ck,138,0,102.7541,a8w8_bpreshuffle_256x112x256x256_16x16_16x16_16x16x1_16x16x1_1x16x1x16_8x8x1_1x2_intrawave_v3,0.0,0.0,0.0
gfx942,80,1024,4096,512,torch.float8_e4m3fnuz,ck,85,0,24.9039,a8w8_bpreshuffle_256x64x128x128_16x16_16x16_8x32x1_8x32x1_1x32x1x8_8x8x1_2x1_intrawave_v3,1724.62,442.1,0.0
gfx942,80,1024,4096,7168,torch.float8_e4m3fnuz,ck,85,0,179.0322,a8w8_bpreshuffle_256x64x128x128_16x16_16x16_8x32x1_8x32x1_1x32x1x8_8x8x1_2x1_intrawave_v3,0.0,0.0,0.0
gfx942,80,1536,4096,512,torch.float8_e4m3fnuz,ck,85,0,33.2015,a8w8_bpreshuffle_256x64x128x128_16x16_16x16_8x32x1_8x32x1_1x32x1x8_8x8x1_2x1_intrawave_v3,1940.41,465.84,0.0
gfx942,80,2048,4096,512,torch.float8_e4m3fnuz,ck,71,0,43.6672,a8w8_bpreshuffle_256x128x128x64_16x16_16x16_4x64x1_4x64x1_1x32x1x8_8x8x1_2x1_intrawave_v3,1967.14,456.25,0.0
gfx942,80,2048,4096,7168,torch.float8_e4m3fnuz,ck,85,0,328.802,a8w8_bpreshuffle_256x64x128x128_16x16_16x16_8x32x1_8x32x1_1x32x1x8_8x8x1_2x1_intrawave_v3,0.0,0.0,0.0
gfx942,80,4096,4096,512,torch.float8_e4m3fnuz,ck,71,0,75.7421,a8w8_bpreshuffle_256x128x128x64_16x16_16x16_4x64x1_4x64x1_1x32x1x8_8x8x1_2x1_intrawave_v3,2268.21,498.39,0.0
gfx942,80,4096,4096,7168,torch.float8_e4m3fnuz,ck,85,0,645.3373,a8w8_bpreshuffle_256x64x128x128_16x16_16x16_8x32x1_8x32x1_1x32x1x8_8x8x1_2x1_intrawave_v3,0.0,0.0,0.0
gfx942,80,6144,4096,512,torch.float8_e4m3fnuz,ck,71,0,109.7738,a8w8_bpreshuffle_256x128x128x64_16x16_16x16_4x64x1_4x64x1_1x32x1x8_8x8x1_2x1_intrawave_v3,0.0,0.0,0.0
gfx942,80,6144,4096,7168,torch.float8_e4m3fnuz,ck,102,0,937.0884,a8w8_bpreshuffle_256x96x256x128_16x16_16x16_8x32x1_8x32x1_1x32x1x8_8x8x1_2x1_intrawave_v3,0.0,0.0,0.0
gfx942,80,8192,4096,512,torch.float8_e4m3fnuz,ck,71,0,140.1016,a8w8_bpreshuffle_256x128x128x64_16x16_16x16_4x64x1_4x64x1_1x32x1x8_8x8x1_2x1_intrawave_v3,2452.49,523.91,0.0
gfx942,80,8192,4096,7168,torch.float8_e4m3fnuz,ck,85,0,1259.5274,a8w8_bpreshuffle_256x64x128x128_16x16_16x16_8x32x1_8x32x1_1x32x1x8_8x8x1_2x1_intrawave_v3,0.0,0.0,0.0
gfx942,80,10240,4096,512,torch.float8_e4m3fnuz,ck,71,0,173.8713,a8w8_bpreshuffle_256x128x128x64_16x16_16x16_4x64x1_4x64x1_1x32x1x8_8x8x1_2x1_intrawave_v3,0.0,0.0,0.0
gfx942,80,10240,4096,7168,torch.float8_e4m3fnuz,ck,85,0,1574.2695,a8w8_bpreshuffle_256x64x128x128_16x16_16x16_8x32x1_8x32x1_1x32x1x8_8x8x1_2x1_intrawave_v3,0.0,0.0,0.0
gfx942,80,12288,4096,512,torch.float8_e4m3fnuz,ck,71,0,207.219,a8w8_bpreshuffle_256x128x128x64_16x16_16x16_4x64x1_4x64x1_1x32x1x8_8x8x1_2x1_intrawave_v3,0.0,0.0,0.0
gfx942,80,12288,4096,7168,torch.float8_e4m3fnuz,ck,102,0,1858.9016,a8w8_bpreshuffle_256x96x256x128_16x16_16x16_8x32x1_8x32x1_1x32x1x8_8x8x1_2x1_intrawave_v3,0.0,0.0,0.0
gfx942,80,14336,4096,512,torch.float8_e4m3fnuz,ck,71,0,239.3595,a8w8_bpreshuffle_256x128x128x64_16x16_16x16_4x64x1_4x64x1_1x32x1x8_8x8x1_2x1_intrawave_v3,0.0,0.0,0.0
gfx942,80,14336,4096,7168,torch.float8_e4m3fnuz,ck,85,0,2197.8676,a8w8_bpreshuffle_256x64x128x128_16x16_16x16_8x32x1_8x32x1_1x32x1x8_8x8x1_2x1_intrawave_v3,0.0,0.0,0.0
gfx942,80,16384,4096,512,torch.float8_e4m3fnuz,ck,71,0,268.2002,a8w8_bpreshuffle_256x128x128x64_16x16_16x16_4x64x1_4x64x1_1x32x1x8_8x8x1_2x1_intrawave_v3,2562.25,539.54,0.0
gfx942,80,16384,4096,7168,torch.float8_e4m3fnuz,ck,85,0,2498.7773,a8w8_bpreshuffle_256x64x128x128_16x16_16x16_8x32x1_8x32x1_1x32x1x8_8x8x1_2x1_intrawave_v3,0.0,0.0,0.0
gfx942,80,20480,4096,512,torch.float8_e4m3fnuz,ck,71,0,331.5621,a8w8_bpreshuffle_256x128x128x64_16x16_16x16_4x64x1_4x64x1_1x32x1x8_8x8x1_2x1_intrawave_v3,2590.75,543.96,0.0
gfx942,80,32768,4096,512,torch.float8_e4m3fnuz,ck,71,0,523.3298,a8w8_bpreshuffle_256x128x128x64_16x16_16x16_4x64x1_4x64x1_1x32x1x8_8x8x1_2x1_intrawave_v3,2626.24,549.0,0.0
gfx942,80,32768,4096,7168,torch.float8_e4m3fnuz,ck,74,0,5016.1101,a8w8_bpreshuffle_256x64x256x64_16x16_16x16_4x64x1_4x64x1_1x32x1x8_8x8x1_2x1_intrawave_v1,0.0,0.0,0.0
gfx942,80,65536,4096,512,torch.float8_e4m3fnuz,ck,71,0,1055.1661,a8w8_bpreshuffle_256x128x128x64_16x16_16x16_4x64x1_4x64x1_1x32x1x8_8x8x1_2x1_intrawave_v3,0.0,0.0,0.0
gfx942,80,65536,4096,7168,torch.float8_e4m3fnuz,ck,85,0,9976.6212,a8w8_bpreshuffle_256x64x128x128_16x16_16x16_8x32x1_8x32x1_1x32x1x8_8x8x1_2x1_intrawave_v3,0.0,0.0,0.0
gfx942,80,98304,4096,512,torch.float8_e4m3fnuz,ck,71,0,1607.6098,a8w8_bpreshuffle_256x128x128x64_16x16_16x16_4x64x1_4x64x1_1x32x1x8_8x8x1_2x1_intrawave_v3,0.0,0.0,0.0
gfx942,80,98304,4096,7168,torch.float8_e4m3fnuz,ck,102,0,14573.0079,a8w8_bpreshuffle_256x96x256x128_16x16_16x16_8x32x1_8x32x1_1x32x1x8_8x8x1_2x1_intrawave_v3,0.0,0.0,0.0
gfx942,80,131072,4096,512,torch.float8_e4m3fnuz,ck,71,0,2125.6078,a8w8_bpreshuffle_256x128x128x64_16x16_16x16_4x64x1_4x64x1_1x32x1x8_8x8x1_2x1_intrawave_v3,0.0,0.0,0.0
gfx942,80,131072,4096,7168,torch.float8_e4m3fnuz,ck,85,0,19941.3998,a8w8_bpreshuffle_256x64x128x128_16x16_16x16_8x32x1_8x32x1_1x32x1x8_8x8x1_2x1_intrawave_v3,0.0,0.0,0.0
gfx942,80,1,4608,4096,torch.float8_e4m3fnuz,ck,5,0,9.6645,a8w8_bpreshuffle_256x16x64x512_16x16_16x16_32x8x1_32x8x1_1x16x1x16_4x4x1_1x1_intrawave_v1,3.91,1954.34,0.0
gfx942,80,1,4608,7168,torch.float8_e4m3fnuz,ck,5,0,13.8515,a8w8_bpreshuffle_256x16x64x512_16x16_16x16_32x8x1_32x8x1_1x16x1x16_4x4x1_1x1_intrawave_v1,47.69,2385.77,0.0
gfx942,80,2,4608,4096,torch.float8_e4m3fnuz,ck,11,0,9.5889,a8w8_bpreshuffle_256x16x64x512_16x16_16x16_32x8x1_32x8x1_1x16x1x16_4x4x1_1x1_intrawave_v1,7.87,1971.13,0.0
gfx942,80,2,4608,7168,torch.float8_e4m3fnuz,ck,5,0,13.597,a8w8_bpreshuffle_256x16x64x512_16x16_16x16_32x8x1_32x8x1_1x16x1x16_4x4x1_1x1_intrawave_v1,0.0,0.0,0.0
gfx942,80,4,4608,4096,torch.float8_e4m3fnuz,ck,11,0,9.7763,a8w8_bpreshuffle_256x16x64x512_16x16_16x16_32x8x1_32x8x1_1x16x1x16_4x4x1_1x1_intrawave_v1,15.44,1936.07,0.0
gfx942,80,4,4608,7168,torch.float8_e4m3fnuz,ck,5,0,13.6563,a8w8_bpreshuffle_256x16x64x512_16x16_16x16_32x8x1_32x8x1_1x16x1x16_4x4x1_1x1_intrawave_v1,0.0,0.0,0.0
gfx942,80,8,4608,4096,torch.float8_e4m3fnuz,ck,10,0,9.6358,a8w8_bpreshuffle_128x16x32x512_16x16_16x16_32x4x1_32x4x1_1x16x1x8_4x4x1_1x1_intrawave_v1,31.34,1969.83,0.0
gfx942,80,8,4608,7168,torch.float8_e4m3fnuz,ck,5,0,13.8099,a8w8_bpreshuffle_256x16x64x512_16x16_16x16_32x8x1_32x8x1_1x16x1x16_4x4x1_1x1_intrawave_v1,0.0,0.0,0.0
gfx942,80,16,4608,4096,torch.float8_e4m3fnuz,ck,10,0,9.4967,a8w8_bpreshuffle_128x16x32x512_16x16_16x16_32x4x1_32x4x1_1x16x1x8_4x4x1_1x1_intrawave_v1,63.6,2009.89,0.0
gfx942,80,16,4608,7168,torch.float8_e4m3fnuz,ck,11,0,13.1327,a8w8_bpreshuffle_256x16x64x512_16x16_16x16_32x8x1_32x8x1_1x16x1x16_4x4x1_1x1_intrawave_v1,80.48,2535.07,0.0
gfx942,80,32,4608,4096,torch.float8_e4m3fnuz,ck,12,0,12.9381,a8w8_bpreshuffle_256x32x64x512_16x16_16x16_32x8x1_32x8x1_1x32x1x8_8x8x1_1x2_intrawave_v1,93.36,1491.75,0.0
gfx942,80,32,4608,7168,torch.float8_e4m3fnuz,ck,12,0,19.2855,a8w8_bpreshuffle_256x32x64x512_16x16_16x16_32x8x1_32x8x1_1x32x1x8_8x8x1_1x2_intrawave_v1,109.61,1739.88,0.0
gfx942,80,48,4608,7168,torch.float8_e4m3fnuz,ck,113,0,21.7204,a8w8_bpreshuffle_256x48x64x256_16x16_16x16_16x16x1_16x16x1_1x16x1x16_4x4x1_1x1_intrawave_v1,145.99,1556.9,0.0
gfx942,80,64,4608,4096,torch.float8_e4m3fnuz,ck,114,0,16.3715,a8w8_bpreshuffle_256x64x64x256_16x16_16x16_16x16x1_16x16x1_1x32x1x8_8x8x1_2x1_intrawave_v3,1475.69,1204.92,0.0
gfx942,80,64,4608,7168,torch.float8_e4m3fnuz,ck,114,0,23.8378,a8w8_bpreshuffle_256x64x64x256_16x16_16x16_16x16x1_16x16x1_1x32x1x8_8x8x1_2x1_intrawave_v3,177.36,1429.61,0.0
gfx942,80,80,4608,7168,torch.float8_e4m3fnuz,ck,115,0,28.763,a8w8_bpreshuffle_256x80x64x256_16x16_16x16_16x16x1_16x16x1_1x16x1x16_4x4x1_1x1_intrawave_v3,183.74,1193.92,0.0
gfx942,80,96,4608,7168,torch.float8_e4m3fnuz,ck,120,0,29.4707,a8w8_bpreshuffle_256x48x128x256_16x16_16x16_16x16x1_16x16x1_1x16x1x16_8x8x1_1x2_intrawave_v1,2151.9,1174.15,0.0
gfx942,80,112,4608,7168,torch.float8_e4m3fnuz,ck,117,0,37.2568,a8w8_bpreshuffle_256x112x64x256_16x16_16x16_16x16x1_16x16x1_1x16x1x16_4x4x1_1x1_intrawave_v3,1985.88,935.81,0.0
gfx942,80,128,4608,4096,torch.float8_e4m3fnuz,ck,114,0,24.38,a8w8_bpreshuffle_256x64x64x256_16x16_16x16_16x16x1_16x16x1_1x32x1x8_8x8x1_2x1_intrawave_v3,198.19,844.06,0.0
gfx942,80,128,4608,7168,torch.float8_e4m3fnuz,ck,114,0,38.4671,a8w8_bpreshuffle_256x64x64x256_16x16_16x16_16x16x1_16x16x1_1x32x1x8_8x8x1_2x1_intrawave_v3,219.82,913.18,0.0
gfx942,80,160,4608,7168,torch.float8_e4m3fnuz,ck,122,0,46.244,a8w8_bpreshuffle_256x80x128x256_16x16_16x16_16x16x1_16x16x1_1x16x1x16_8x8x1_1x2_intrawave_v3,0.0,0.0,0.0
gfx942,80,192,4608,7168,torch.float8_e4m3fnuz,ck,128,0,47.9264,a8w8_bpreshuffle_256x64x192x256_16x16_16x16_16x16x1_16x16x1_1x32x1x8_8x8x1_2x1_intrawave_v3,0.0,0.0,0.0
gfx942,80,224,4608,7168,torch.float8_e4m3fnuz,ck,124,0,56.3824,a8w8_bpreshuffle_256x112x128x256_16x16_16x16_16x16x1_16x16x1_1x16x1x16_8x8x1_1x2_intrawave_v3,0.0,0.0,0.0
gfx942,80,256,4608,4096,torch.float8_e4m3fnuz,ck,85,0,37.982,a8w8_bpreshuffle_256x64x128x128_16x16_16x16_8x32x1_8x32x1_1x32x1x8_8x8x1_2x1_intrawave_v3,2544.28,586.65,0.0
gfx942,80,256,4608,7168,torch.float8_e4m3fnuz,ck,121,0,62.2609,a8w8_bpreshuffle_256x64x128x256_16x16_16x16_16x16x1_16x16x1_1x16x1x16_8x8x1_1x2_intrawave_v3,2716.22,597.88,0.0
gfx942,80,288,4608,7168,torch.float8_e4m3fnuz,ck,130,0,66.7012,a8w8_bpreshuffle_256x96x192x256_16x16_16x16_16x16x1_16x16x1_1x32x1x8_8x8x1_2x1_intrawave_v3,0.0,0.0,0.0
gfx942,80,320,4608,7168,torch.float8_e4m3fnuz,ck,136,0,72.1189,a8w8_bpreshuffle_256x80x256x256_16x16_16x16_16x16x1_16x16x1_1x16x1x16_8x8x1_1x2_intrawave_v3,0.0,0.0,0.0
gfx942,80,352,4608,7168,torch.float8_e4m3fnuz,ck,128,0,84.2541,a8w8_bpreshuffle_256x64x192x256_16x16_16x16_16x16x1_16x16x1_1x32x1x8_8x8x1_2x1_intrawave_v3,0.0,0.0,0.0
gfx942,80,384,4608,7168,torch.float8_e4m3fnuz,ck,93,0,81.9457,a8w8_bpreshuffle_256x64x192x128_16x16_16x16_8x32x1_8x32x1_1x32x1x8_8x8x1_2x1_intrawave_v3,0.0,0.0,0.0
gfx942,80,416,4608,7168,torch.float8_e4m3fnuz,ck,138,0,101.4186,a8w8_bpreshuffle_256x112x256x256_16x16_16x16_16x16x1_16x16x1_1x16x1x16_8x8x1_1x2_intrawave_v3,0.0,0.0,0.0
gfx942,80,448,4608,7168,torch.float8_e4m3fnuz,ck,138,0,97.0854,a8w8_bpreshuffle_256x112x256x256_16x16_16x16_16x16x1_16x16x1_1x16x1x16_8x8x1_1x2_intrawave_v3,0.0,0.0,0.0
gfx942,80,480,4608,7168,torch.float8_e4m3fnuz,ck,56,0,105.9346,a8w8_bpreshuffle_256x160x192x128_16x16_16x16_8x32x1_8x32x1_1x32x1x8_8x8x1_2x1_intrawave_v3,0.0,0.0,0.0
gfx942,80,512,4608,7168,torch.float8_e4m3fnuz,ck,70,0,105.5819,a8w8_bpreshuffle_256x128x128x128_16x16_16x16_8x32x1_8x32x1_1x32x1x8_8x8x1_2x1_intrawave_v3,3203.47,392.29,0.0
gfx942,80,1024,4608,4096,torch.float8_e4m3fnuz,ck,71,0,120.44,a8w8_bpreshuffle_256x128x128x64_16x16_16x16_4x64x1_4x64x1_1x32x1x8_8x8x1_2x1_intrawave_v3,3209.46,269.89,0.0
gfx942,80,1024,4608,7168,torch.float8_e4m3fnuz,ck,93,0,189.1551,a8w8_bpreshuffle_256x64x192x128_16x16_16x16_8x32x1_8x32x1_1x32x1x8_8x8x1_2x1_intrawave_v3,3576.2,263.31,0.0
gfx942,80,1536,4608,7168,torch.float8_e4m3fnuz,ck,85,0,279.9019,a8w8_bpreshuffle_256x64x128x128_16x16_16x16_8x32x1_8x32x1_1x32x1x8_8x8x1_2x1_intrawave_v3,3625.15,207.92,0.0
gfx942,80,2048,4608,4096,torch.float8_e4m3fnuz,ck,68,0,218.9032,a8w8_bpreshuffle_256x128x192x128_16x16_16x16_8x32x1_8x32x1_1x32x1x8_8x8x1_2x1_intrawave_v3,3531.67,210.77,0.0
gfx942,80,2048,4608,7168,torch.float8_e4m3fnuz,ck,93,0,366.0791,a8w8_bpreshuffle_256x64x192x128_16x16_16x16_8x32x1_8x32x1_1x32x1x8_8x8x1_2x1_intrawave_v3,3695.69,181.89,0.0
gfx942,80,4096,4608,4096,torch.float8_e4m3fnuz,ck,85,0,420.6946,a8w8_bpreshuffle_256x64x128x128_16x16_16x16_8x32x1_8x32x1_1x32x1x8_8x8x1_2x1_intrawave_v3,3675.32,174.47,0.0
gfx942,80,4096,4608,7168,torch.float8_e4m3fnuz,ck,85,0,715.7879,a8w8_bpreshuffle_256x64x128x128_16x16_16x16_8x32x1_8x32x1_1x32x1x8_8x8x1_2x1_intrawave_v3,3780.21,139.9,0.0
gfx942,80,6144,4608,7168,torch.float8_e4m3fnuz,ck,102,0,1071.1237,a8w8_bpreshuffle_256x96x256x128_16x16_16x16_8x32x1_8x32x1_1x32x1x8_8x8x1_2x1_intrawave_v3,0.0,0.0,0.0
gfx942,80,8192,4608,7168,torch.float8_e4m3fnuz,ck,93,0,1405.0902,a8w8_bpreshuffle_256x64x192x128_16x16_16x16_8x32x1_8x32x1_1x32x1x8_8x8x1_2x1_intrawave_v3,3851.47,119.03,0.0
gfx942,80,10240,4608,7168,torch.float8_e4m3fnuz,ck,93,0,1722.172,a8w8_bpreshuffle_256x64x192x128_16x16_16x16_8x32x1_8x32x1_1x32x1x8_8x8x1_2x1_intrawave_v3,0.0,0.0,0.0
gfx942,80,12288,4608,7168,torch.float8_e4m3fnuz,ck,68,0,2079.1883,a8w8_bpreshuffle_256x128x192x128_16x16_16x16_8x32x1_8x32x1_1x32x1x8_8x8x1_2x1_intrawave_v3,0.0,0.0,0.0
gfx942,80,14336,4608,7168,torch.float8_e4m3fnuz,ck,93,0,2431.1066,a8w8_bpreshuffle_256x64x192x128_16x16_16x16_8x32x1_8x32x1_1x32x1x8_8x8x1_2x1_intrawave_v3,0.0,0.0,0.0
gfx942,80,16384,4608,4096,torch.float8_e4m3fnuz,ck,93,0,1613.6388,a8w8_bpreshuffle_256x64x192x128_16x16_16x16_8x32x1_8x32x1_1x32x1x8_8x8x1_2x1_intrawave_v3,3832.8,146.86,0.0
gfx942,80,16384,4608,7168,torch.float8_e4m3fnuz,ck,93,0,2770.8265,a8w8_bpreshuffle_256x64x192x128_16x16_16x16_8x32x1_8x32x1_1x32x1x8_8x8x1_2x1_intrawave_v3,3906.17,108.8,0.0
gfx942,80,20480,4608,7168,torch.float8_e4m3fnuz,ck,68,0,3421.2891,a8w8_bpreshuffle_256x128x192x128_16x16_16x16_8x32x1_8x32x1_1x32x1x8_8x8x1_2x1_intrawave_v3,3954.4,107.73,0.0
gfx942,80,32768,4608,4096,torch.float8_e4m3fnuz,ck,93,0,3207.2182,a8w8_bpreshuffle_256x64x192x128_16x16_16x16_8x32x1_8x32x1_1x32x1x8_8x8x1_2x1_intrawave_v3,3856.77,141.89,0.0
gfx942,80,32768,4608,7168,torch.float8_e4m3fnuz,ck,68,0,5527.6346,a8w8_bpreshuffle_256x128x192x128_16x16_16x16_8x32x1_8x32x1_1x32x1x8_8x8x1_2x1_intrawave_v3,3916.08,103.1,0.0
gfx942,80,65536,4608,7168,torch.float8_e4m3fnuz,ck,68,0,11016.6648,a8w8_bpreshuffle_256x128x192x128_16x16_16x16_8x32x1_8x32x1_1x32x1x8_8x8x1_2x1_intrawave_v3,0.0,0.0,0.0
gfx942,80,98304,4608,7168,torch.float8_e4m3fnuz,ck,102,0,16377.2032,a8w8_bpreshuffle_256x96x256x128_16x16_16x16_8x32x1_8x32x1_1x32x1x8_8x8x1_2x1_intrawave_v3,0.0,0.0,0.0
gfx942,80,131072,4608,7168,torch.float8_e4m3fnuz,ck,93,0,21987.1209,a8w8_bpreshuffle_256x64x192x128_16x16_16x16_8x32x1_8x32x1_1x32x1x8_8x8x1_2x1_intrawave_v3,0.0,0.0,0.0
gfx942,80,4,6144,1536,torch.float8_e4m3fnuz,ck,10,0,7.5748,a8w8_bpreshuffle_128x16x32x512_16x16_16x16_32x4x1_32x4x1_1x16x1x8_4x4x1_1x1_intrawave_v1,9.97,1253.17,0.0
gfx942,80,96,6144,1536,torch.float8_e4m3fnuz,ck,119,0,13.368,a8w8_bpreshuffle_256x32x128x256_16x16_16x16_16x16x1_16x16x1_1x16x1x16_8x8x1_1x2_intrawave_v1,135.54,805.23,0.0
gfx942,80,160,6144,1536,torch.float8_e4m3fnuz,ck,119,0,17.7021,a8w8_bpreshuffle_256x32x128x256_16x16_16x16_16x16x1_16x16x1_1x16x1x16_8x8x1_1x2_intrawave_v1,170.6,658.06,0.0
gfx942,80,192,6144,1536,torch.float8_e4m3fnuz,ck,121,0,20.6837,a8w8_bpreshuffle_256x64x128x256_16x16_16x16_16x16x1_16x16x1_1x16x1x16_8x8x1_1x2_intrawave_v3,175.2,584.59,0.0
gfx942,80,224,6144,1536,torch.float8_e4m3fnuz,ck,92,0,24.1353,a8w8_bpreshuffle_256x32x192x128_16x16_16x16_8x32x1_8x32x1_1x32x1x8_8x8x1_2x1_intrawave_v1,175.17,519.31,0.0
gfx942,80,288,6144,1536,torch.float8_e4m3fnuz,ck,86,0,27.4257,a8w8_bpreshuffle_256x96x128x128_16x16_16x16_8x32x1_8x32x1_1x32x1x8_8x8x1_2x1_intrawave_v3,198.2,489.27,0.0
gfx942,80,320,6144,1536,torch.float8_e4m3fnuz,ck,93,0,28.1164,a8w8_bpreshuffle_256x64x192x128_16x16_16x16_8x32x1_8x32x1_1x32x1x8_8x8x1_2x1_intrawave_v3,214.81,492.98,0.0
gfx942,80,352,6144,1536,torch.float8_e4m3fnuz,ck,85,0,33.8656,a8w8_bpreshuffle_256x64x128x128_16x16_16x16_8x32x1_8x32x1_1x32x1x8_8x8x1_2x1_intrawave_v3,196.18,422.35,0.0
gfx942,80,416,6144,1536,torch.float8_e4m3fnuz,ck,93,0,37.9824,a8w8_bpreshuffle_256x64x192x128_16x16_16x16_8x32x1_8x32x1_1x32x1x8_8x8x1_2x1_intrawave_v3,206.72,399.87,0.0
gfx942,80,448,6144,1536,torch.float8_e4m3fnuz,ck,93,0,37.7868,a8w8_bpreshuffle_256x64x192x128_16x16_16x16_8x32x1_8x32x1_1x32x1x8_8x8x1_2x1_intrawave_v3,223.77,413.65,0.0
gfx942,80,480,6144,1536,torch.float8_e4m3fnuz,ck,94,0,38.3828,a8w8_bpreshuffle_256x96x192x128_16x16_16x16_8x32x1_8x32x1_1x32x1x8_8x8x1_2x1_intrawave_v3,236.04,418.75,0.0
gfx942,80,512,6144,1536,torch.float8_e4m3fnuz,ck,85,0,42.8776,a8w8_bpreshuffle_256x64x128x128_16x16_16x16_8x32x1_8x32x1_1x32x1x8_8x8x1_2x1_intrawave_v3,225.38,385.17,0.0
gfx942,80,1024,6144,1536,torch.float8_e4m3fnuz,ck,85,0,74.8161,a8w8_bpreshuffle_256x64x128x128_16x16_16x16_8x32x1_8x32x1_1x32x1x8_8x8x1_2x1_intrawave_v3,258.33,315.35,0.0
gfx942,80,6144,6144,1536,torch.float8_e4m3fnuz,ck,71,0,375.4724,a8w8_bpreshuffle_256x128x128x64_16x16_16x16_4x64x1_4x64x1_1x32x1x8_8x8x1_2x1_intrawave_v3,308.85,251.34,0.0
gfx942,80,10240,6144,1536,torch.float8_e4m3fnuz,ck,71,0,617.2362,a8w8_bpreshuffle_256x128x128x64_16x16_16x16_4x64x1_4x64x1_1x32x1x8_8x8x1_2x1_intrawave_v3,313.13,244.63,0.0
gfx942,80,12288,6144,1536,torch.float8_e4m3fnuz,ck,71,0,738.7716,a8w8_bpreshuffle_256x128x128x64_16x16_16x16_4x64x1_4x64x1_1x32x1x8_8x8x1_2x1_intrawave_v3,313.94,242.71,0.0
gfx942,80,14336,6144,1536,torch.float8_e4m3fnuz,ck,71,0,860.2231,a8w8_bpreshuffle_256x128x128x64_16x16_16x16_4x64x1_4x64x1_1x32x1x8_8x8x1_2x1_intrawave_v3,314.55,241.35,0.0
gfx942,80,65536,6144,1536,torch.float8_e4m3fnuz,ck,71,0,3873.7845,a8w8_bpreshuffle_256x128x128x64_16x16_16x16_4x64x1_4x64x1_1x32x1x8_8x8x1_2x1_intrawave_v3,319.31,236.31,0.0
gfx942,80,98304,6144,1536,torch.float8_e4m3fnuz,ck,71,0,5774.5261,a8w8_bpreshuffle_256x128x128x64_16x16_16x16_4x64x1_4x64x1_1x32x1x8_8x8x1_2x1_intrawave_v3,321.31,236.97,0.0
gfx942,80,1,7168,256,torch.float8_e4m3fnuz,ck,75,0,6.4606,a8w8_bpreshuffle_128x16x256x64_16x16_16x16_4x16x1_4x32x1_1x16x1x8_8x8x1_1x2_intrawave_v1,5.68,286.29,0.0
gfx942,80,1,7168,512,torch.float8_e4m3fnuz,ck,9,0,5.6245,a8w8_bpreshuffle_128x16x32x128_16x16_16x16_8x16x1_8x16x1_1x16x1x8_4x4x1_1x1_intrawave_v1,1.31,655.15,0.0
gfx942,80,1,7168,1024,torch.float8_e4m3fnuz,ck,15,0,6.6648,a8w8_bpreshuffle_256x16x64x256_16x16_16x16_16x16x1_16x16x1_1x16x1x16_4x4x1_1x1_intrawave_v1,2.2,1103.62,0.0
gfx942,80,1,7168,2048,torch.float8_e4m3fnuz,ck,10,0,9.1526,a8w8_bpreshuffle_128x16x32x512_16x16_16x16_32x4x1_32x4x1_1x16x1x8_4x4x1_1x1_intrawave_v1,0.0,0.0,0.0
gfx942,80,1,7168,2304,torch.float8_e4m3fnuz,ck,108,0,9.2341,a8w8_bpreshuffle_256x16x64x256_16x16_16x16_16x16x1_16x16x1_1x16x1x16_4x4x1_1x1_intrawave_v1,3.58,1790.29,0.0
gfx942,80,1,7168,4096,torch.float8_e4m3fnuz,ck,10,0,11.7478,a8w8_bpreshuffle_128x16x32x512_16x16_16x16_32x4x1_32x4x1_1x16x1x8_4x4x1_1x1_intrawave_v1,5.0,2500.77,0.0
gfx942,80,1,7168,4608,torch.float8_e4m3fnuz,ck,24,0,13.6306,a8w8_bpreshuffle_128x16x32x512_16x16_16x16_32x4x1_32x4x1_1x16x1x8_4x4x1_1x1_intrawave_v2,4.85,2424.62,0.0
gfx942,80,1,7168,8192,torch.float8_e4m3fnuz,ck,10,0,20.2876,a8w8_bpreshuffle_128x16x32x512_16x16_16x16_32x4x1_32x4x1_1x16x1x8_4x4x1_1x1_intrawave_v1,5.79,2895.5,0.0
gfx942,80,1,7168,9216,torch.float8_e4m3fnuz,ck,10,0,22.841,a8w8_bpreshuffle_128x16x32x512_16x16_16x16_32x4x1_32x4x1_1x16x1x8_4x4x1_1x1_intrawave_v1,5.78,2893.21,0.0
gfx942,80,1,7168,16384,torch.float8_e4m3fnuz,ck,24,0,39.678,a8w8_bpreshuffle_128x16x32x512_16x16_16x16_32x4x1_32x4x1_1x16x1x8_4x4x1_1x1_intrawave_v2,0.0,0.0,0.0
gfx942,80,1,7168,18432,torch.float8_e4m3fnuz,ck,10,0,42.556,a8w8_bpreshuffle_128x16x32x512_16x16_16x16_32x4x1_32x4x1_1x16x1x8_4x4x1_1x1_intrawave_v1,0.0,0.0,0.0
gfx942,80,2,7168,256,torch.float8_e4m3fnuz,ck,75,0,6.3266,a8w8_bpreshuffle_128x16x256x64_16x16_16x16_4x16x1_4x32x1_1x16x1x8_8x8x1_1x2_intrawave_v1,0.0,0.0,0.0
gfx942,80,2,7168,512,torch.float8_e4m3fnuz,ck,9,0,5.6086,a8w8_bpreshuffle_128x16x32x128_16x16_16x16_8x16x1_8x16x1_1x16x1x8_4x4x1_1x1_intrawave_v1,2.62,659.65,0.0
gfx942,80,2,7168,1024,torch.float8_e4m3fnuz,ck,15,0,6.7221,a8w8_bpreshuffle_256x16x64x256_16x16_16x16_16x16x1_16x16x1_1x16x1x16_4x4x1_1x1_intrawave_v1,4.37,1096.5,0.0
gfx942,80,2,7168,2048,torch.float8_e4m3fnuz,ck,5,0,8.5166,a8w8_bpreshuffle_256x16x64x512_16x16_16x16_32x8x1_32x8x1_1x16x1x16_4x4x1_1x1_intrawave_v1,0.0,0.0,0.0
gfx942,80,2,7168,2304,torch.float8_e4m3fnuz,ck,29,0,9.905,a8w8_bpreshuffle_256x16x64x256_16x16_16x16_16x16x1_16x16x1_1x16x1x16_4x4x1_1x1_intrawave_v2,0.0,0.0,0.0
gfx942,80,2,7168,4096,torch.float8_e4m3fnuz,ck,10,0,11.8135,a8w8_bpreshuffle_128x16x32x512_16x16_16x16_32x4x1_32x4x1_1x16x1x8_4x4x1_1x1_intrawave_v1,9.94,2488.42,0.0
gfx942,80,2,7168,4608,torch.float8_e4m3fnuz,ck,10,0,13.4089,a8w8_bpreshuffle_128x16x32x512_16x16_16x16_32x4x1_32x4x1_1x16x1x8_4x4x1_1x1_intrawave_v1,9.85,2466.13,0.0
gfx942,80,2,7168,8192,torch.float8_e4m3fnuz,ck,10,0,20.503,a8w8_bpreshuffle_128x16x32x512_16x16_16x16_32x4x1_32x4x1_1x16x1x8_4x4x1_1x1_intrawave_v1,11.46,2866.18,0.0
gfx942,80,2,7168,9216,torch.float8_e4m3fnuz,ck,10,0,22.8918,a8w8_bpreshuffle_128x16x32x512_16x16_16x16_32x4x1_32x4x1_1x16x1x8_4x4x1_1x1_intrawave_v1,11.54,2887.82,0.0
gfx942,80,2,7168,16384,torch.float8_e4m3fnuz,ck,10,0,37.3783,a8w8_bpreshuffle_128x16x32x512_16x16_16x16_32x4x1_32x4x1_1x16x1x8_4x4x1_1x1_intrawave_v1,0.0,0.0,0.0
gfx942,80,2,7168,18432,torch.float8_e4m3fnuz,ck,10,0,42.2924,a8w8_bpreshuffle_128x16x32x512_16x16_16x16_32x4x1_32x4x1_1x16x1x8_4x4x1_1x1_intrawave_v1,0.0,0.0,0.0
gfx942,80,4,7168,256,torch.float8_e4m3fnuz,ck,73,0,6.9558,a8w8_bpreshuffle_256x32x256x64_16x16_16x16_4x32x1_4x64x1_1x32x1x8_8x8x1_2x1_intrawave_v1,0.0,0.0,0.0
gfx942,80,4,7168,512,torch.float8_e4m3fnuz,ck,9,0,5.6728,a8w8_bpreshuffle_128x16x32x128_16x16_16x16_8x16x1_8x16x1_1x16x1x8_4x4x1_1x1_intrawave_v1,5.18,657.42,0.0
gfx942,80,4,7168,1024,torch.float8_e4m3fnuz,ck,108,0,6.7173,a8w8_bpreshuffle_256x16x64x256_16x16_16x16_16x16x1_16x16x1_1x16x1x16_4x4x1_1x1_intrawave_v1,8.74,1101.85,0.0
gfx942,80,4,7168,2048,torch.float8_e4m3fnuz,ck,108,0,8.5722,a8w8_bpreshuffle_256x16x64x256_16x16_16x16_16x16x1_16x16x1_1x16x1x16_4x4x1_1x1_intrawave_v1,0.0,0.0,0.0
gfx942,80,4,7168,2304,torch.float8_e4m3fnuz,ck,108,0,9.9551,a8w8_bpreshuffle_256x16x64x256_16x16_16x16_16x16x1_16x16x1_1x16x1x16_4x4x1_1x1_intrawave_v1,0.0,0.0,0.0
gfx942,80,4,7168,4096,torch.float8_e4m3fnuz,ck,10,0,11.9762,a8w8_bpreshuffle_128x16x32x512_16x16_16x16_32x4x1_32x4x1_1x16x1x8_4x4x1_1x1_intrawave_v1,19.61,2457.7,0.0
gfx942,80,4,7168,4608,torch.float8_e4m3fnuz,ck,24,0,13.4779,a8w8_bpreshuffle_128x16x32x512_16x16_16x16_32x4x1_32x4x1_1x16x1x8_4x4x1_1x1_intrawave_v2,19.61,2456.31,0.0
gfx942,80,4,7168,8192,torch.float8_e4m3fnuz,ck,10,0,20.5581,a8w8_bpreshuffle_128x16x32x512_16x16_16x16_32x4x1_32x4x1_1x16x1x8_4x4x1_1x1_intrawave_v1,22.85,2860.69,0.0
gfx942,80,4,7168,9216,torch.float8_e4m3fnuz,ck,10,0,23.1344,a8w8_bpreshuffle_128x16x32x512_16x16_16x16_32x4x1_32x4x1_1x16x1x8_4x4x1_1x1_intrawave_v1,22.84,2859.57,0.0
gfx942,80,4,7168,16384,torch.float8_e4m3fnuz,ck,10,0,37.6428,a8w8_bpreshuffle_128x16x32x512_16x16_16x16_32x4x1_32x4x1_1x16x1x8_4x4x1_1x1_intrawave_v1,0.0,0.0,0.0
gfx942,80,4,7168,18432,torch.float8_e4m3fnuz,ck,10,0,42.1052,a8w8_bpreshuffle_128x16x32x512_16x16_16x16_32x4x1_32x4x1_1x16x1x8_4x4x1_1x1_intrawave_v1,0.0,0.0,0.0
gfx942,80,8,7168,256,torch.float8_e4m3fnuz,ck,75,0,6.2842,a8w8_bpreshuffle_128x16x256x64_16x16_16x16_4x16x1_4x32x1_1x16x1x8_8x8x1_1x2_intrawave_v1,0.0,0.0,0.0
gfx942,80,8,7168,512,torch.float8_e4m3fnuz,ck,9,0,5.6701,a8w8_bpreshuffle_128x16x32x128_16x16_16x16_8x16x1_8x16x1_1x16x1x8_4x4x1_1x1_intrawave_v1,10.36,668.21,0.0
gfx942,80,8,7168,1024,torch.float8_e4m3fnuz,ck,15,0,6.6192,a8w8_bpreshuffle_256x16x64x256_16x16_16x16_16x16x1_16x16x1_1x16x1x16_4x4x1_1x1_intrawave_v1,17.74,1127.46,0.0
gfx942,80,8,7168,2048,torch.float8_e4m3fnuz,ck,24,0,8.685,a8w8_bpreshuffle_128x16x32x512_16x16_16x16_32x4x1_32x4x1_1x16x1x8_4x4x1_1x1_intrawave_v2,0.0,0.0,0.0
gfx942,80,8,7168,2304,torch.float8_e4m3fnuz,ck,108,0,10.0038,a8w8_bpreshuffle_256x16x64x256_16x16_16x16_16x16x1_16x16x1_1x16x1x16_4x4x1_1x1_intrawave_v1,0.0,0.0,0.0
gfx942,80,8,7168,4096,torch.float8_e4m3fnuz,ck,10,0,11.8869,a8w8_bpreshuffle_128x16x32x512_16x16_16x16_32x4x1_32x4x1_1x16x1x8_4x4x1_1x1_intrawave_v1,39.52,2482.36,0.0
gfx942,80,8,7168,4608,torch.float8_e4m3fnuz,ck,24,0,13.8728,a8w8_bpreshuffle_128x16x32x512_16x16_16x16_32x4x1_32x4x1_1x16x1x8_4x4x1_1x1_intrawave_v2,38.09,2391.85,0.0
gfx942,80,8,7168,8192,torch.float8_e4m3fnuz,ck,10,0,20.8381,a8w8_bpreshuffle_128x16x32x512_16x16_16x16_32x4x1_32x4x1_1x16x1x8_4x4x1_1x1_intrawave_v1,45.09,2826.58,0.0
gfx942,80,8,7168,9216,torch.float8_e4m3fnuz,ck,24,0,24.049,a8w8_bpreshuffle_128x16x32x512_16x16_16x16_32x4x1_32x4x1_1x16x1x8_4x4x1_1x1_intrawave_v2,43.95,2754.74,0.0
gfx942,80,8,7168,16384,torch.float8_e4m3fnuz,ck,10,0,39.2255,a8w8_bpreshuffle_128x16x32x512_16x16_16x16_32x4x1_32x4x1_1x16x1x8_4x4x1_1x1_intrawave_v1,0.0,0.0,0.0
gfx942,80,8,7168,18432,torch.float8_e4m3fnuz,ck,24,0,45.0508,a8w8_bpreshuffle_128x16x32x512_16x16_16x16_32x4x1_32x4x1_1x16x1x8_4x4x1_1x1_intrawave_v2,0.0,0.0,0.0
gfx942,80,16,7168,256,torch.float8_e4m3fnuz,ck,75,0,6.629,a8w8_bpreshuffle_128x16x256x64_16x16_16x16_4x16x1_4x32x1_1x16x1x8_8x8x1_1x2_intrawave_v1,88.58,312.03,0.0
gfx942,80,16,7168,512,torch.float8_e4m3fnuz,ck,9,0,5.4877,a8w8_bpreshuffle_128x16x32x128_16x16_16x16_8x16x1_8x16x1_1x16x1x8_4x4x1_1x1_intrawave_v1,21.4,712.06,0.0
gfx942,80,16,7168,1024,torch.float8_e4m3fnuz,ck,15,0,6.8597,a8w8_bpreshuffle_256x16x64x256_16x16_16x16_16x16x1_16x16x1_1x16x1x16_4x4x1_1x1_intrawave_v1,34.24,1105.85,0.0
gfx942,80,16,7168,2048,torch.float8_e4m3fnuz,ck,10,0,8.3657,a8w8_bpreshuffle_128x16x32x512_16x16_16x16_32x4x1_32x4x1_1x16x1x8_4x4x1_1x1_intrawave_v1,56.15,1786.13,0.0
gfx942,80,16,7168,2304,torch.float8_e4m3fnuz,ck,108,0,9.9995,a8w8_bpreshuffle_256x16x64x256_16x16_16x16_16x16x1_16x16x1_1x16x1x16_4x4x1_1x1_intrawave_v1,52.85,1678.22,0.0
gfx942,80,16,7168,4096,torch.float8_e4m3fnuz,ck,10,0,12.6967,a8w8_bpreshuffle_128x16x32x512_16x16_16x16_32x4x1_32x4x1_1x16x1x8_4x4x1_1x1_intrawave_v1,74.0,2335.65,0.0
gfx942,80,16,7168,4608,torch.float8_e4m3fnuz,ck,20,0,15.3599,a8w8_bpreshuffle_256x16x128x512_16x16_16x16_32x8x1_32x8x1_1x16x1x16_8x8x1_1x2_intrawave_v2,68.81,2170.15,0.0
gfx942,80,16,7168,8192,torch.float8_e4m3fnuz,ck,10,0,22.3668,a8w8_bpreshuffle_128x16x32x512_16x16_16x16_32x4x1_32x4x1_1x16x1x8_4x4x1_1x1_intrawave_v1,84.01,2641.45,0.0
gfx942,80,16,7168,9216,torch.float8_e4m3fnuz,ck,6,0,24.8784,a8w8_bpreshuffle_256x16x128x512_16x16_16x16_32x8x1_32x8x1_1x16x1x16_8x8x1_1x2_intrawave_v1,84.97,2670.47,0.0
gfx942,80,16,7168,16384,torch.float8_e4m3fnuz,ck,6,0,42.1056,a8w8_bpreshuffle_256x16x128x512_16x16_16x16_32x8x1_32x8x1_1x16x1x16_8x8x1_1x2_intrawave_v1,0.0,0.0,0.0
gfx942,80,16,7168,18432,torch.float8_e4m3fnuz,ck,6,0,45.8424,a8w8_bpreshuffle_256x16x128x512_16x16_16x16_32x8x1_32x8x1_1x16x1x16_8x8x1_1x2_intrawave_v1,0.0,0.0,0.0
gfx942,80,32,7168,256,torch.float8_e4m3fnuz,ck,75,0,6.8302,a8w8_bpreshuffle_128x16x256x64_16x16_16x16_4x16x1_4x32x1_1x16x1x8_8x8x1_1x2_intrawave_v1,171.94,337.03,0.0
gfx942,80,32,7168,512,torch.float8_e4m3fnuz,ck,76,0,6.5317,a8w8_bpreshuffle_256x32x64x128_16x16_16x16_8x32x1_8x32x1_1x32x1x8_8x8x1_2x1_intrawave_v1,35.96,634.62,0.0
gfx942,80,32,7168,1024,torch.float8_e4m3fnuz,ck,112,0,8.1404,a8w8_bpreshuffle_256x32x64x256_16x16_16x16_16x16x1_16x16x1_1x32x1x8_8x8x1_2x1_intrawave_v1,57.71,962.06,0.0
gfx942,80,32,7168,2048,torch.float8_e4m3fnuz,ck,119,0,10.94,a8w8_bpreshuffle_256x32x128x256_16x16_16x16_16x16x1_16x16x1_1x16x1x16_8x8x1_1x2_intrawave_v1,85.88,1389.79,0.0
gfx942,80,32,7168,2304,torch.float8_e4m3fnuz,ck,119,0,11.6614,a8w8_bpreshuffle_256x32x128x256_16x16_16x16_16x16x1_16x16x1_1x16x1x16_8x8x1_1x2_intrawave_v1,906.38,1461.88,0.0
gfx942,80,32,7168,4096,torch.float8_e4m3fnuz,ck,119,0,17.0986,a8w8_bpreshuffle_256x32x128x256_16x16_16x16_16x16x1_16x16x1_1x16x1x16_8x8x1_1x2_intrawave_v1,109.89,1751.6,0.0
gfx942,80,32,7168,4608,torch.float8_e4m3fnuz,ck,119,0,17.923,a8w8_bpreshuffle_256x32x128x256_16x16_16x16_16x16x1_16x16x1_1x16x1x16_8x8x1_1x2_intrawave_v1,117.95,1876.71,0.0
gfx942,80,32,7168,8192,torch.float8_e4m3fnuz,ck,119,0,29.6463,a8w8_bpreshuffle_256x32x128x256_16x16_16x16_16x16x1_16x16x1_1x16x1x16_8x8x1_1x2_intrawave_v1,126.76,2005.01,0.0
gfx942,80,32,7168,9216,torch.float8_e4m3fnuz,ck,119,0,31.763,a8w8_bpreshuffle_256x32x128x256_16x16_16x16_16x16x1_16x16x1_1x16x1x16_8x8x1_1x2_intrawave_v1,133.11,2103.52,0.0
gfx942,80,32,7168,16384,torch.float8_e4m3fnuz,ck,119,0,53.2367,a8w8_bpreshuffle_256x32x128x256_16x16_16x16_16x16x1_16x16x1_1x16x1x16_8x8x1_1x2_intrawave_v1,1411.84,2224.47,0.0
gfx942,80,32,7168,18432,torch.float8_e4m3fnuz,ck,119,0,58.5048,a8w8_bpreshuffle_256x32x128x256_16x16_16x16_16x16x1_16x16x1_1x16x1x16_8x8x1_1x2_intrawave_v1,0.0,0.0,0.0
gfx942,80,48,7168,256,torch.float8_e4m3fnuz,ck,75,0,7.0126,a8w8_bpreshuffle_128x16x256x64_16x16_16x16_4x16x1_4x32x1_1x16x1x8_8x8x1_1x2_intrawave_v1,251.21,361.55,0.0
gfx942,80,48,7168,2304,torch.float8_e4m3fnuz,ck,113,0,13.6727,a8w8_bpreshuffle_256x48x64x256_16x16_16x16_16x16x1_16x16x1_1x16x1x16_4x4x1_1x1_intrawave_v1,1159.57,1266.3,0.0
gfx942,80,64,7168,256,torch.float8_e4m3fnuz,ck,75,0,7.6886,a8w8_bpreshuffle_128x16x256x64_16x16_16x16_4x16x1_4x32x1_1x16x1x8_8x8x1_1x2_intrawave_v1,305.49,360.13,0.0
gfx942,80,64,7168,512,torch.float8_e4m3fnuz,ck,76,0,8.1001,a8w8_bpreshuffle_256x32x64x128_16x16_16x16_8x32x1_8x32x1_1x32x1x8_8x8x1_2x1_intrawave_v1,57.99,570.4,0.0
gfx942,80,64,7168,1024,torch.float8_e4m3fnuz,ck,112,0,10.2444,a8w8_bpreshuffle_256x32x64x256_16x16_16x16_16x16x1_16x16x1_1x32x1x8_8x8x1_2x1_intrawave_v1,91.71,812.45,0.0
gfx942,80,64,7168,2048,torch.float8_e4m3fnuz,ck,112,0,14.2819,a8w8_bpreshuffle_256x32x64x256_16x16_16x16_16x16x1_16x16x1_1x32x1x8_8x8x1_2x1_intrawave_v1,1315.69,1101.3,0.0
gfx942,80,64,7168,2304,torch.float8_e4m3fnuz,ck,112,0,15.5151,a8w8_bpreshuffle_256x32x64x256_16x16_16x16_16x16x1_16x16x1_1x32x1x8_8x8x1_2x1_intrawave_v1,1362.5,1133.09,0.0
gfx942,80,64,7168,4096,torch.float8_e4m3fnuz,ck,112,0,24.3757,a8w8_bpreshuffle_256x32x64x256_16x16_16x16_16x16x1_16x16x1_1x32x1x8_8x8x1_2x1_intrawave_v1,154.17,1252.88,0.0
gfx942,80,64,7168,4608,torch.float8_e4m3fnuz,ck,112,0,27.0894,a8w8_bpreshuffle_256x32x64x256_16x16_16x16_16x16x1_16x16x1_1x32x1x8_8x8x1_2x1_intrawave_v1,156.07,1264.06,0.0
gfx942,80,64,7168,8192,torch.float8_e4m3fnuz,ck,112,0,43.5233,a8w8_bpreshuffle_256x32x64x256_16x16_16x16_16x16x1_16x16x1_1x32x1x8_8x8x1_2x1_intrawave_v1,172.69,1382.3,0.0
gfx942,80,64,7168,9216,torch.float8_e4m3fnuz,ck,121,0,48.7661,a8w8_bpreshuffle_256x64x128x256_16x16_16x16_16x16x1_16x16x1_1x16x1x16_8x8x1_1x2_intrawave_v3,173.39,1385.54,0.0
gfx942,80,64,7168,16384,torch.float8_e4m3fnuz,ck,121,0,81.4496,a8w8_bpreshuffle_256x64x128x256_16x16_16x16_16x16x1_16x16x1_1x16x1x16_8x8x1_1x2_intrawave_v3,1845.61,1466.02,0.0
gfx942,80,64,7168,18432,torch.float8_e4m3fnuz,ck,121,0,89.7754,a8w8_bpreshuffle_256x64x128x256_16x16_16x16_16x16x1_16x16x1_1x16x1x16_8x8x1_1x2_intrawave_v3,0.0,0.0,0.0
gfx942,80,80,7168,256,torch.float8_e4m3fnuz,ck,75,0,8.2998,a8w8_bpreshuffle_128x16x256x64_16x16_16x16_4x16x1_4x32x1_1x16x1x8_8x8x1_1x2_intrawave_v1,353.75,361.74,0.0
gfx942,80,80,7168,2304,torch.float8_e4m3fnuz,ck,113,0,18.9055,a8w8_bpreshuffle_256x48x64x256_16x16_16x16_16x16x1_16x16x1_1x16x1x16_4x4x1_1x1_intrawave_v1,1397.69,943.97,0.0
gfx942,80,96,7168,256,torch.float8_e4m3fnuz,ck,75,0,8.6194,a8w8_bpreshuffle_128x16x256x64_16x16_16x16_4x16x1_4x32x1_1x16x1x8_8x8x1_1x2_intrawave_v1,408.75,375.41,0.0
gfx942,80,96,7168,512,torch.float8_e4m3fnuz,ck,76,0,9.4912,a8w8_bpreshuffle_256x32x64x128_16x16_16x16_8x32x1_8x32x1_1x32x1x8_8x8x1_2x1_intrawave_v1,74.24,536.86,0.0
gfx942,80,96,7168,1024,torch.float8_e4m3fnuz,ck,113,0,12.4833,a8w8_bpreshuffle_256x48x64x256_16x16_16x16_16x16x1_16x16x1_1x16x1x16_4x4x1_1x1_intrawave_v1,112.89,706.11,0.0
gfx942,80,96,7168,2048,torch.float8_e4m3fnuz,ck,113,0,17.6925,a8w8_bpreshuffle_256x48x64x256_16x16_16x16_16x16x1_16x16x1_1x16x1x16_4x4x1_1x1_intrawave_v1,1593.09,918.63,0.0
gfx942,80,96,7168,2304,torch.float8_e4m3fnuz,ck,84,0,19.1495,a8w8_bpreshuffle_256x32x128x128_16x16_16x16_8x32x1_8x32x1_1x32x1x8_8x8x1_2x1_intrawave_v1,1655.86,945.85,0.0
gfx942,80,96,7168,4096,torch.float8_e4m3fnuz,ck,113,0,29.9117,a8w8_bpreshuffle_256x48x64x256_16x16_16x16_16x16x1_16x16x1_1x16x1x16_4x4x1_1x1_intrawave_v1,188.46,1040.72,0.0
gfx942,80,96,7168,4608,torch.float8_e4m3fnuz,ck,113,0,33.003,a8w8_bpreshuffle_256x48x64x256_16x16_16x16_16x16x1_16x16x1_1x16x1x16_4x4x1_1x1_intrawave_v1,192.16,1055.93,0.0
gfx942,80,96,7168,8192,torch.float8_e4m3fnuz,ck,113,0,53.0736,a8w8_bpreshuffle_256x48x64x256_16x16_16x16_16x16x1_16x16x1_1x16x1x16_4x4x1_1x1_intrawave_v1,212.43,1147.14,0.0
gfx942,80,96,7168,9216,torch.float8_e4m3fnuz,ck,113,0,59.3348,a8w8_bpreshuffle_256x48x64x256_16x16_16x16_16x16x1_16x16x1_1x16x1x16_4x4x1_1x1_intrawave_v1,213.76,1151.45,0.0
gfx942,80,96,7168,16384,torch.float8_e4m3fnuz,ck,113,0,98.4525,a8w8_bpreshuffle_256x48x64x256_16x16_16x16_16x16x1_16x16x1_1x16x1x16_4x4x1_1x1_intrawave_v1,2290.3,1222.82,0.0
gfx942,80,96,7168,18432,torch.float8_e4m3fnuz,ck,113,0,109.8187,a8w8_bpreshuffle_256x48x64x256_16x16_16x16_16x16x1_16x16x1_1x16x1x16_4x4x1_1x1_intrawave_v1,0.0,0.0,0.0
gfx942,80,112,7168,256,torch.float8_e4m3fnuz,ck,75,0,9.207,a8w8_bpreshuffle_128x16x256x64_16x16_16x16_4x16x1_4x32x1_1x16x1x8_8x8x1_1x2_intrawave_v1,446.44,376.81,0.0
gfx942,80,112,7168,2304,torch.float8_e4m3fnuz,ck,119,0,21.7835,a8w8_bpreshuffle_256x32x128x256_16x16_16x16_16x16x1_16x16x1_1x16x1x16_8x8x1_1x2_intrawave_v1,1698.25,843.7,0.0
gfx942,80,128,7168,256,torch.float8_e4m3fnuz,ck,73,0,10.1406,a8w8_bpreshuffle_256x32x256x64_16x16_16x16_4x32x1_4x64x1_1x32x1x8_8x8x1_2x1_intrawave_v1,463.25,365.14,0.0
gfx942,80,128,7168,512,torch.float8_e4m3fnuz,ck,84,0,10.7725,a8w8_bpreshuffle_256x32x128x128_16x16_16x16_8x32x1_8x32x1_1x32x1x8_8x8x1_2x1_intrawave_v1,87.22,517.11,0.0
gfx942,80,128,7168,1024,torch.float8_e4m3fnuz,ck,119,0,14.7575,a8w8_bpreshuffle_256x32x128x256_16x16_16x16_16x16x1_16x16x1_1x16x1x16_8x8x1_1x2_intrawave_v1,127.33,630.6,0.0
gfx942,80,128,7168,2048,torch.float8_e4m3fnuz,ck,119,0,20.5111,a8w8_bpreshuffle_256x32x128x256_16x16_16x16_16x16x1_16x16x1_1x16x1x16_8x8x1_1x2_intrawave_v1,1832.23,817.96,0.0
gfx942,80,128,7168,2304,torch.float8_e4m3fnuz,ck,84,0,21.9275,a8w8_bpreshuffle_256x32x128x128_16x16_16x16_8x32x1_8x32x1_1x32x1x8_8x8x1_2x1_intrawave_v1,1928.11,850.3,0.0
gfx942,80,128,7168,4096,torch.float8_e4m3fnuz,ck,119,0,35.2197,a8w8_bpreshuffle_256x32x128x256_16x16_16x16_16x16x1_16x16x1_1x16x1x16_8x8x1_1x2_intrawave_v1,213.41,900.62,0.0
gfx942,80,128,7168,4608,torch.float8_e4m3fnuz,ck,119,0,39.2577,a8w8_bpreshuffle_256x32x128x256_16x16_16x16_16x16x1_16x16x1_1x16x1x16_8x8x1_1x2_intrawave_v1,215.39,903.13,0.0
gfx942,80,128,7168,8192,torch.float8_e4m3fnuz,ck,119,0,63.878,a8w8_bpreshuffle_256x32x128x256_16x16_16x16_16x16x1_16x16x1_1x16x1x16_8x8x1_1x2_intrawave_v1,235.33,964.4,0.0
gfx942,80,128,7168,9216,torch.float8_e4m3fnuz,ck,119,0,71.9358,a8w8_bpreshuffle_256x32x128x256_16x16_16x16_16x16x1_16x16x1_1x16x1x16_8x8x1_1x2_intrawave_v1,235.09,960.23,0.0
gfx942,80,128,7168,16384,torch.float8_e4m3fnuz,ck,114,0,119.9291,a8w8_bpreshuffle_256x64x64x256_16x16_16x16_16x16x1_16x16x1_1x32x1x8_8x8x1_2x1_intrawave_v3,2506.88,1012.04,0.0
gfx942,80,128,7168,18432,torch.float8_e4m3fnuz,ck,114,0,133.6804,a8w8_bpreshuffle_256x64x64x256_16x16_16x16_16x16x1_16x16x1_1x32x1x8_8x8x1_2x1_intrawave_v3,0.0,0.0,0.0
gfx942,80,160,7168,256,torch.float8_e4m3fnuz,ck,75,0,10.251,a8w8_bpreshuffle_128x16x256x64_16x16_16x16_4x16x1_4x32x1_1x16x1x8_8x8x1_1x2_intrawave_v1,0.0,0.0,0.0
gfx942,80,160,7168,512,torch.float8_e4m3fnuz,ck,76,0,12.0125,a8w8_bpreshuffle_256x32x64x128_16x16_16x16_8x32x1_8x32x1_1x32x1x8_8x8x1_2x1_intrawave_v1,97.77,503.28,0.0
gfx942,80,160,7168,1024,torch.float8_e4m3fnuz,ck,112,0,17.3598,a8w8_bpreshuffle_256x32x64x256_16x16_16x16_16x16x1_16x16x1_1x32x1x8_8x8x1_2x1_intrawave_v1,135.3,564.39,0.0
gfx942,80,160,7168,2048,torch.float8_e4m3fnuz,ck,119,0,25.3574,a8w8_bpreshuffle_256x32x128x256_16x16_16x16_16x16x1_16x16x1_1x16x1x16_8x8x1_1x2_intrawave_v1,1852.56,682.31,0.0
gfx942,80,160,7168,2304,torch.float8_e4m3fnuz,ck,119,0,27.2747,a8w8_bpreshuffle_256x32x128x256_16x16_16x16_16x16x1_16x16x1_1x16x1x16_8x8x1_1x2_intrawave_v1,0.0,0.0,0.0
gfx942,80,160,7168,4096,torch.float8_e4m3fnuz,ck,133,0,44.638,a8w8_bpreshuffle_256x32x256x256_16x16_16x16_16x16x1_16x16x1_1x16x1x16_8x8x1_1x2_intrawave_v1,210.48,723.81,0.0
gfx942,80,160,7168,4608,torch.float8_e4m3fnuz,ck,133,0,49.6981,a8w8_bpreshuffle_256x32x256x256_16x16_16x16_16x16x1_16x16x1_1x16x1x16_8x8x1_1x2_intrawave_v1,212.68,725.6,0.0
gfx942,80,160,7168,8192,torch.float8_e4m3fnuz,ck,133,0,81.2116,a8w8_bpreshuffle_256x32x256x256_16x16_16x16_16x16x1_16x16x1_1x16x1x16_8x8x1_1x2_intrawave_v1,231.38,767.44,0.0
gfx942,80,160,7168,9216,torch.float8_e4m3fnuz,ck,133,0,90.3778,a8w8_bpreshuffle_256x32x256x256_16x16_16x16_16x16x1_16x16x1_1x16x1x16_8x8x1_1x2_intrawave_v1,233.9,772.63,0.0
gfx942,80,160,7168,16384,torch.float8_e4m3fnuz,ck,136,0,150.746,a8w8_bpreshuffle_256x80x256x256_16x16_16x16_16x16x1_16x16x1_1x16x1x16_8x8x1_1x2_intrawave_v3,2493.0,811.67,0.0
gfx942,80,160,7168,18432,torch.float8_e4m3fnuz,ck,136,0,168.4653,a8w8_bpreshuffle_256x80x256x256_16x16_16x16_16x16x1_16x16x1_1x16x1x16_8x8x1_1x2_intrawave_v3,0.0,0.0,0.0
gfx942,80,192,7168,256,torch.float8_e4m3fnuz,ck,73,0,10.5659,a8w8_bpreshuffle_256x32x256x64_16x16_16x16_4x32x1_4x64x1_1x32x1x8_8x8x1_2x1_intrawave_v1,0.0,0.0,0.0
gfx942,80,192,7168,512,torch.float8_e4m3fnuz,ck,84,0,13.4126,a8w8_bpreshuffle_256x32x128x128_16x16_16x16_8x32x1_8x32x1_1x32x1x8_8x8x1_2x1_intrawave_v1,105.07,486.17,0.0
gfx942,80,192,7168,1024,torch.float8_e4m3fnuz,ck,84,0,19.8942,a8w8_bpreshuffle_256x32x128x128_16x16_16x16_8x32x1_8x32x1_1x32x1x8_8x8x1_2x1_intrawave_v1,141.68,517.19,0.0
gfx942,80,192,7168,2048,torch.float8_e4m3fnuz,ck,120,0,28.1354,a8w8_bpreshuffle_256x48x128x256_16x16_16x16_16x16x1_16x16x1_1x16x1x16_8x8x1_1x2_intrawave_v1,2003.58,633.57,0.0
gfx942,80,192,7168,2304,torch.float8_e4m3fnuz,ck,120,0,29.5015,a8w8_bpreshuffle_256x48x128x256_16x16_16x16_16x16x1_16x16x1_1x16x1x16_8x8x1_1x2_intrawave_v1,0.0,0.0,0.0
gfx942,80,192,7168,4096,torch.float8_e4m3fnuz,ck,120,0,48.3634,a8w8_bpreshuffle_256x48x128x256_16x16_16x16_16x16x1_16x16x1_1x16x1x16_8x8x1_1x2_intrawave_v1,233.12,680.25,0.0
gfx942,80,192,7168,4608,torch.float8_e4m3fnuz,ck,120,0,53.0886,a8w8_bpreshuffle_256x48x128x256_16x16_16x16_16x16x1_16x16x1_1x16x1x16_8x8x1_1x2_intrawave_v1,238.91,690.68,0.0
gfx942,80,192,7168,8192,torch.float8_e4m3fnuz,ck,120,0,87.1718,a8w8_bpreshuffle_256x48x128x256_16x16_16x16_16x16x1_16x16x1_1x16x1x16_8x8x1_1x2_intrawave_v1,258.67,723.23,0.0
gfx942,80,192,7168,9216,torch.float8_e4m3fnuz,ck,120,0,96.3409,a8w8_bpreshuffle_256x48x128x256_16x16_16x16_16x16x1_16x16x1_1x16x1x16_8x8x1_1x2_intrawave_v1,263.31,732.63,0.0
gfx942,80,192,7168,16384,torch.float8_e4m3fnuz,ck,120,0,162.2601,a8w8_bpreshuffle_256x48x128x256_16x16_16x16_16x16x1_16x16x1_1x16x1x16_8x8x1_1x2_intrawave_v1,2779.31,760.13,0.0
gfx942,80,192,7168,18432,torch.float8_e4m3fnuz,ck,120,0,181.5802,a8w8_bpreshuffle_256x48x128x256_16x16_16x16_16x16x1_16x16x1_1x16x1x16_8x8x1_1x2_intrawave_v1,0.0,0.0,0.0
gfx942,80,224,7168,256,torch.float8_e4m3fnuz,ck,73,0,10.9003,a8w8_bpreshuffle_256x32x256x64_16x16_16x16_4x32x1_4x64x1_1x32x1x8_8x8x1_2x1_intrawave_v1,0.0,0.0,0.0
gfx942,80,224,7168,512,torch.float8_e4m3fnuz,ck,84,0,14.9991,a8w8_bpreshuffle_256x32x128x128_16x16_16x16_8x32x1_8x32x1_1x32x1x8_8x8x1_2x1_intrawave_v1,109.62,466.43,0.0
gfx942,80,224,7168,1024,torch.float8_e4m3fnuz,ck,84,0,20.7816,a8w8_bpreshuffle_256x32x128x128_16x16_16x16_8x32x1_8x32x1_1x32x1x8_8x8x1_2x1_intrawave_v1,158.23,518.76,0.0
gfx942,80,224,7168,2048,torch.float8_e4m3fnuz,ck,85,0,30.5218,a8w8_bpreshuffle_256x64x128x128_16x16_16x16_8x32x1_8x32x1_1x32x1x8_8x8x1_2x1_intrawave_v3,2154.74,601.21,0.0
gfx942,80,224,7168,2304,torch.float8_e4m3fnuz,ck,85,0,32.8835,a8w8_bpreshuffle_256x64x128x128_16x16_16x16_8x32x1_8x32x1_1x32x1x8_8x8x1_2x1_intrawave_v3,0.0,0.0,0.0
gfx942,80,224,7168,4096,torch.float8_e4m3fnuz,ck,85,0,54.7818,a8w8_bpreshuffle_256x64x128x128_16x16_16x16_8x32x1_8x32x1_1x32x1x8_8x8x1_2x1_intrawave_v3,240.1,611.31,0.0
gfx942,80,224,7168,4608,torch.float8_e4m3fnuz,ck,85,0,60.3092,a8w8_bpreshuffle_256x64x128x128_16x16_16x16_8x32x1_8x32x1_1x32x1x8_8x8x1_2x1_intrawave_v3,245.36,618.04,0.0
gfx942,80,224,7168,8192,torch.float8_e4m3fnuz,ck,85,0,98.7952,a8w8_bpreshuffle_256x64x128x128_16x16_16x16_8x32x1_8x32x1_1x32x1x8_8x8x1_2x1_intrawave_v3,266.27,645.44,0.0
gfx942,80,224,7168,9216,torch.float8_e4m3fnuz,ck,85,0,110.1364,a8w8_bpreshuffle_256x64x128x128_16x16_16x16_8x32x1_8x32x1_1x32x1x8_8x8x1_2x1_intrawave_v3,268.71,647.71,0.0
gfx942,80,224,7168,16384,torch.float8_e4m3fnuz,ck,85,0,185.5598,a8w8_bpreshuffle_256x64x128x128_16x16_16x16_8x32x1_8x32x1_1x32x1x8_8x8x1_2x1_intrawave_v3,2835.39,669.98,0.0
gfx942,80,224,7168,18432,torch.float8_e4m3fnuz,ck,85,0,207.6011,a8w8_bpreshuffle_256x64x128x128_16x16_16x16_8x32x1_8x32x1_1x32x1x8_8x8x1_2x1_intrawave_v3,0.0,0.0,0.0
gfx942,80,256,7168,256,torch.float8_e4m3fnuz,ck,73,0,11.5078,a8w8_bpreshuffle_256x32x256x64_16x16_16x16_4x32x1_4x64x1_1x32x1x8_8x8x1_2x1_intrawave_v1,816.42,484.07,0.0
gfx942,80,256,7168,512,torch.float8_e4m3fnuz,ck,85,0,16.1374,a8w8_bpreshuffle_256x64x128x128_16x16_16x16_8x32x1_8x32x1_1x32x1x8_8x8x1_2x1_intrawave_v3,116.44,462.97,0.0
gfx942,80,256,7168,1024,torch.float8_e4m3fnuz,ck,85,0,21.584,a8w8_bpreshuffle_256x64x128x128_16x16_16x16_8x32x1_8x32x1_1x32x1x8_8x8x1_2x1_intrawave_v3,174.11,522.25,0.0
gfx942,80,256,7168,2048,torch.float8_e4m3fnuz,ck,85,0,30.5235,a8w8_bpreshuffle_256x64x128x128_16x16_16x16_8x32x1_8x32x1_1x32x1x8_8x8x1_2x1_intrawave_v3,2462.43,618.36,0.0
gfx942,80,256,7168,2304,torch.float8_e4m3fnuz,ck,85,0,32.0436,a8w8_bpreshuffle_256x64x128x128_16x16_16x16_8x32x1_8x32x1_1x32x1x8_8x8x1_2x1_intrawave_v3,2638.82,648.33,0.0
gfx942,80,256,7168,4096,torch.float8_e4m3fnuz,ck,85,0,54.0567,a8w8_bpreshuffle_256x64x128x128_16x16_16x16_8x32x1_8x32x1_1x32x1x8_8x8x1_2x1_intrawave_v3,278.09,630.43,0.0
gfx942,80,256,7168,4608,torch.float8_e4m3fnuz,ck,85,0,60.5172,a8w8_bpreshuffle_256x64x128x128_16x16_16x16_8x32x1_8x32x1_1x32x1x8_8x8x1_2x1_intrawave_v3,279.45,625.93,0.0
gfx942,80,256,7168,8192,torch.float8_e4m3fnuz,ck,85,0,98.4777,a8w8_bpreshuffle_256x64x128x128_16x16_16x16_8x32x1_8x32x1_1x32x1x8_8x8x1_2x1_intrawave_v3,305.3,654.84,0.0
gfx942,80,256,7168,9216,torch.float8_e4m3fnuz,ck,85,0,109.9894,a8w8_bpreshuffle_256x64x128x128_16x16_16x16_8x32x1_8x32x1_1x32x1x8_8x8x1_2x1_intrawave_v3,307.51,655.42,0.0
gfx942,80,256,7168,16384,torch.float8_e4m3fnuz,ck,85,0,186.0958,a8w8_bpreshuffle_256x64x128x128_16x16_16x16_8x32x1_8x32x1_1x32x1x8_8x8x1_2x1_intrawave_v3,3231.11,673.34,0.0
gfx942,80,256,7168,18432,torch.float8_e4m3fnuz,ck,85,0,209.5107,a8w8_bpreshuffle_256x64x128x128_16x16_16x16_8x32x1_8x32x1_1x32x1x8_8x8x1_2x1_intrawave_v3,0.0,0.0,0.0
gfx942,80,288,7168,256,torch.float8_e4m3fnuz,ck,72,0,12.7115,a8w8_bpreshuffle_256x64x256x64_16x16_16x16_4x64x1_4x64x1_1x16x1x16_8x8x1_1x2_intrawave_v1,0.0,0.0,0.0
gfx942,80,288,7168,512,torch.float8_e4m3fnuz,ck,76,0,17.9905,a8w8_bpreshuffle_256x32x64x128_16x16_16x16_8x32x1_8x32x1_1x32x1x8_8x8x1_2x1_intrawave_v1,117.5,441.69,0.0
gfx942,80,288,7168,1024,torch.float8_e4m3fnuz,ck,84,0,26.2028,a8w8_bpreshuffle_256x32x128x128_16x16_16x16_8x32x1_8x32x1_1x32x1x8_8x8x1_2x1_intrawave_v1,161.35,448.95,0.0
gfx942,80,288,7168,2048,torch.float8_e4m3fnuz,ck,85,0,38.1402,a8w8_bpreshuffle_256x64x128x128_16x16_16x16_8x32x1_8x32x1_1x32x1x8_8x8x1_2x1_intrawave_v3,2217.01,508.61,0.0
gfx942,80,288,7168,2304,torch.float8_e4m3fnuz,ck,85,0,40.9768,a8w8_bpreshuffle_256x64x128x128_16x16_16x16_8x32x1_8x32x1_1x32x1x8_8x8x1_2x1_intrawave_v3,0.0,0.0,0.0
gfx942,80,288,7168,4096,torch.float8_e4m3fnuz,ck,85,0,69.139,a8w8_bpreshuffle_256x64x128x128_16x16_16x16_8x32x1_8x32x1_1x32x1x8_8x8x1_2x1_intrawave_v3,244.6,501.43,0.0
gfx942,80,288,7168,4608,torch.float8_e4m3fnuz,ck,85,0,76.8637,a8w8_bpreshuffle_256x64x128x128_16x16_16x16_8x32x1_8x32x1_1x32x1x8_8x8x1_2x1_intrawave_v3,247.52,500.7,0.0
gfx942,80,288,7168,8192,torch.float8_e4m3fnuz,ck,85,0,127.535,a8w8_bpreshuffle_256x64x128x128_16x16_16x16_8x32x1_8x32x1_1x32x1x8_8x8x1_2x1_intrawave_v3,265.2,511.3,0.0
gfx942,80,288,7168,9216,torch.float8_e4m3fnuz,ck,85,0,142.1807,a8w8_bpreshuffle_256x64x128x128_16x16_16x16_8x32x1_8x32x1_1x32x1x8_8x8x1_2x1_intrawave_v3,267.62,512.33,0.0
gfx942,80,288,7168,16384,torch.float8_e4m3fnuz,ck,85,0,243.1421,a8w8_bpreshuffle_256x64x128x128_16x16_16x16_8x32x1_8x32x1_1x32x1x8_8x8x1_2x1_intrawave_v3,2782.15,519.4,0.0
gfx942,80,288,7168,18432,torch.float8_e4m3fnuz,ck,85,0,272.1414,a8w8_bpreshuffle_256x64x128x128_16x16_16x16_8x32x1_8x32x1_1x32x1x8_8x8x1_2x1_intrawave_v3,0.0,0.0,0.0
gfx942,80,320,7168,256,torch.float8_e4m3fnuz,ck,74,0,13.0231,a8w8_bpreshuffle_256x64x256x64_16x16_16x16_4x64x1_4x64x1_1x32x1x8_8x8x1_2x1_intrawave_v1,0.0,0.0,0.0
gfx942,80,320,7168,512,torch.float8_e4m3fnuz,ck,84,0,19.0693,a8w8_bpreshuffle_256x32x128x128_16x16_16x16_8x32x1_8x32x1_1x32x1x8_8x8x1_2x1_intrawave_v1,123.17,441.62,0.0
gfx942,80,320,7168,1024,torch.float8_e4m3fnuz,ck,85,0,26.7558,a8w8_bpreshuffle_256x64x128x128_16x16_16x16_8x32x1_8x32x1_1x32x1x8_8x8x1_2x1_intrawave_v3,175.57,458.04,0.0
gfx942,80,320,7168,2048,torch.float8_e4m3fnuz,ck,85,0,38.8094,a8w8_bpreshuffle_256x64x128x128_16x16_16x16_8x32x1_8x32x1_1x32x1x8_8x8x1_2x1_intrawave_v3,2420.87,513.35,0.0
gfx942,80,320,7168,2304,torch.float8_e4m3fnuz,ck,85,0,40.2392,a8w8_bpreshuffle_256x64x128x128_16x16_16x16_8x32x1_8x32x1_1x32x1x8_8x8x1_2x1_intrawave_v3,0.0,0.0,0.0
gfx942,80,320,7168,4096,torch.float8_e4m3fnuz,ck,85,0,70.3183,a8w8_bpreshuffle_256x64x128x128_16x16_16x16_8x32x1_8x32x1_1x32x1x8_8x8x1_2x1_intrawave_v3,267.22,501.41,0.0
gfx942,80,320,7168,4608,torch.float8_e4m3fnuz,ck,85,0,79.5688,a8w8_bpreshuffle_256x64x128x128_16x16_16x16_8x32x1_8x32x1_1x32x1x8_8x8x1_2x1_intrawave_v3,265.67,491.3,0.0
gfx942,80,320,7168,8192,torch.float8_e4m3fnuz,ck,85,0,131.2114,a8w8_bpreshuffle_256x64x128x128_16x16_16x16_8x32x1_8x32x1_1x32x1x8_8x8x1_2x1_intrawave_v3,286.42,502.47,0.0
gfx942,80,320,7168,9216,torch.float8_e4m3fnuz,ck,85,0,146.2403,a8w8_bpreshuffle_256x64x128x128_16x16_16x16_8x32x1_8x32x1_1x32x1x8_8x8x1_2x1_intrawave_v3,289.1,503.26,0.0
gfx942,80,320,7168,16384,torch.float8_e4m3fnuz,ck,101,0,239.9889,a8w8_bpreshuffle_256x64x256x128_16x16_16x16_8x32x1_8x32x1_1x32x1x8_8x8x1_2x1_intrawave_v3,3131.89,530.32,0.0
gfx942,80,320,7168,18432,torch.float8_e4m3fnuz,ck,101,0,270.4958,a8w8_bpreshuffle_256x64x256x128_16x16_16x16_8x32x1_8x32x1_1x32x1x8_8x8x1_2x1_intrawave_v3,0.0,0.0,0.0
gfx942,80,352,7168,256,torch.float8_e4m3fnuz,ck,75,0,15.1695,a8w8_bpreshuffle_128x16x256x64_16x16_16x16_4x16x1_4x32x1_1x16x1x8_8x8x1_1x2_intrawave_v1,0.0,0.0,0.0
gfx942,80,352,7168,512,torch.float8_e4m3fnuz,ck,84,0,20.5103,a8w8_bpreshuffle_256x32x128x128_16x16_16x16_8x32x1_8x32x1_1x32x1x8_8x8x1_2x1_intrawave_v1,125.97,433.76,0.0
gfx942,80,352,7168,1024,torch.float8_e4m3fnuz,ck,84,0,30.2515,a8w8_bpreshuffle_256x32x128x128_16x16_16x16_8x32x1_8x32x1_1x32x1x8_8x8x1_2x1_intrawave_v1,170.81,421.36,0.0
gfx942,80,352,7168,2048,torch.float8_e4m3fnuz,ck,100,0,45.5887,a8w8_bpreshuffle_256x32x256x128_16x16_16x16_8x32x1_8x32x1_1x32x1x8_8x8x1_2x1_intrawave_v1,2266.96,448.52,0.0
gfx942,80,352,7168,2304,torch.float8_e4m3fnuz,ck,100,0,49.1372,a8w8_bpreshuffle_256x32x256x128_16x16_16x16_8x32x1_8x32x1_1x32x1x8_8x8x1_2x1_intrawave_v1,0.0,0.0,0.0
gfx942,80,352,7168,4096,torch.float8_e4m3fnuz,ck,133,0,83.0217,a8w8_bpreshuffle_256x32x256x256_16x16_16x16_16x16x1_16x16x1_1x16x1x16_8x8x1_1x2_intrawave_v1,248.97,431.79,0.0
gfx942,80,352,7168,4608,torch.float8_e4m3fnuz,ck,133,0,92.2196,a8w8_bpreshuffle_256x32x256x256_16x16_16x16_16x16x1_16x16x1_1x16x1x16_8x8x1_1x2_intrawave_v1,252.15,430.48,0.0
gfx942,80,352,7168,8192,torch.float8_e4m3fnuz,ck,86,0,154.334,a8w8_bpreshuffle_256x96x128x128_16x16_16x16_8x32x1_8x32x1_1x32x1x8_8x8x1_2x1_intrawave_v3,267.85,431.86,0.0
gfx942,80,352,7168,9216,torch.float8_e4m3fnuz,ck,133,0,171.5389,a8w8_bpreshuffle_256x32x256x256_16x16_16x16_16x16x1_16x16x1_1x16x1x16_8x8x1_1x2_intrawave_v1,271.11,433.43,0.0
gfx942,80,352,7168,16384,torch.float8_e4m3fnuz,ck,86,0,289.7112,a8w8_bpreshuffle_256x96x128x128_16x16_16x16_8x32x1_8x32x1_1x32x1x8_8x8x1_2x1_intrawave_v3,2853.81,442.7,0.0
gfx942,80,352,7168,18432,torch.float8_e4m3fnuz,ck,86,0,324.6944,a8w8_bpreshuffle_256x96x128x128_16x16_16x16_8x32x1_8x32x1_1x32x1x8_8x8x1_2x1_intrawave_v3,0.0,0.0,0.0
gfx942,80,384,7168,256,torch.float8_e4m3fnuz,ck,72,0,15.1515,a8w8_bpreshuffle_256x64x256x64_16x16_16x16_4x64x1_4x64x1_1x16x1x16_8x8x1_1x2_intrawave_v1,0.0,0.0,0.0
gfx942,80,384,7168,512,torch.float8_e4m3fnuz,ck,84,0,21.3082,a8w8_bpreshuffle_256x32x128x128_16x16_16x16_8x32x1_8x32x1_1x32x1x8_8x8x1_2x1_intrawave_v1,132.28,439.81,0.0
gfx942,80,384,7168,1024,torch.float8_e4m3fnuz,ck,84,0,31.9035,a8w8_bpreshuffle_256x32x128x128_16x16_16x16_8x32x1_8x32x1_1x32x1x8_8x8x1_2x1_intrawave_v1,176.69,414.95,0.0
gfx942,80,384,7168,2048,torch.float8_e4m3fnuz,ck,86,0,45.0074,a8w8_bpreshuffle_256x96x128x128_16x16_16x16_8x32x1_8x32x1_1x32x1x8_8x8x1_2x1_intrawave_v3,2504.99,465.96,0.0
gfx942,80,384,7168,2304,torch.float8_e4m3fnuz,ck,86,0,48.0036,a8w8_bpreshuffle_256x96x128x128_16x16_16x16_8x32x1_8x32x1_1x32x1x8_8x8x1_2x1_intrawave_v3,0.0,0.0,0.0
gfx942,80,384,7168,4096,torch.float8_e4m3fnuz,ck,86,0,80.811,a8w8_bpreshuffle_256x96x128x128_16x16_16x16_8x32x1_8x32x1_1x32x1x8_8x8x1_2x1_intrawave_v3,279.03,450.9,0.0
gfx942,80,384,7168,4608,torch.float8_e4m3fnuz,ck,86,0,88.8226,a8w8_bpreshuffle_256x96x128x128_16x16_16x16_8x32x1_8x32x1_1x32x1x8_8x8x1_2x1_intrawave_v3,285.59,453.77,0.0
gfx942,80,384,7168,8192,torch.float8_e4m3fnuz,ck,86,0,144.2396,a8w8_bpreshuffle_256x96x128x128_16x16_16x16_8x32x1_8x32x1_1x32x1x8_8x8x1_2x1_intrawave_v3,312.65,467.08,0.0
gfx942,80,384,7168,9216,torch.float8_e4m3fnuz,ck,86,0,160.4438,a8w8_bpreshuffle_256x96x128x128_16x16_16x16_8x32x1_8x32x1_1x32x1x8_8x8x1_2x1_intrawave_v3,316.21,468.1,0.0
gfx942,80,384,7168,16384,torch.float8_e4m3fnuz,ck,86,0,268.8438,a8w8_bpreshuffle_256x96x128x128_16x16_16x16_8x32x1_8x32x1_1x32x1x8_8x8x1_2x1_intrawave_v3,3354.9,480.71,0.0
gfx942,80,384,7168,18432,torch.float8_e4m3fnuz,ck,86,0,300.0663,a8w8_bpreshuffle_256x96x128x128_16x16_16x16_8x32x1_8x32x1_1x32x1x8_8x8x1_2x1_intrawave_v3,0.0,0.0,0.0
gfx942,80,416,7168,256,torch.float8_e4m3fnuz,ck,74,0,15.9059,a8w8_bpreshuffle_256x64x256x64_16x16_16x16_4x64x1_4x64x1_1x32x1x8_8x8x1_2x1_intrawave_v1,0.0,0.0,0.0
gfx942,80,416,7168,512,torch.float8_e4m3fnuz,ck,84,0,22.965,a8w8_bpreshuffle_256x32x128x128_16x16_16x16_8x32x1_8x32x1_1x32x1x8_8x8x1_2x1_intrawave_v1,132.96,428.77,0.0
gfx942,80,416,7168,1024,torch.float8_e4m3fnuz,ck,85,0,32.8392,a8w8_bpreshuffle_256x64x128x128_16x16_16x16_8x32x1_8x32x1_1x32x1x8_8x8x1_2x1_intrawave_v3,185.96,418.09,0.0
gfx942,80,416,7168,2048,torch.float8_e4m3fnuz,ck,85,0,48.1552,a8w8_bpreshuffle_256x64x128x128_16x16_16x16_8x32x1_8x32x1_1x32x1x8_8x8x1_2x1_intrawave_v3,0.0,0.0,0.0
gfx942,80,416,7168,2304,torch.float8_e4m3fnuz,ck,85,0,51.2564,a8w8_bpreshuffle_256x64x128x128_16x16_16x16_8x32x1_8x32x1_1x32x1x8_8x8x1_2x1_intrawave_v3,0.0,0.0,0.0
gfx942,80,416,7168,4096,torch.float8_e4m3fnuz,ck,85,0,88.4594,a8w8_bpreshuffle_256x64x128x128_16x16_16x16_8x32x1_8x32x1_1x32x1x8_8x8x1_2x1_intrawave_v3,276.15,418.59,0.0
gfx942,80,416,7168,4608,torch.float8_e4m3fnuz,ck,85,0,99.396,a8w8_bpreshuffle_256x64x128x128_16x16_16x16_8x32x1_8x32x1_1x32x1x8_8x8x1_2x1_intrawave_v3,276.48,411.59,0.0
gfx942,80,416,7168,8192,torch.float8_e4m3fnuz,ck,85,0,163.693,a8w8_bpreshuffle_256x64x128x128_16x16_16x16_8x32x1_8x32x1_1x32x1x8_8x8x1_2x1_intrawave_v3,298.46,415.97,0.0
gfx942,80,416,7168,9216,torch.float8_e4m3fnuz,ck,85,0,183.5982,a8w8_bpreshuffle_256x64x128x128_16x16_16x16_8x32x1_8x32x1_1x32x1x8_8x8x1_2x1_intrawave_v3,299.36,413.17,0.0
gfx942,80,416,7168,16384,torch.float8_e4m3fnuz,ck,85,0,310.2738,a8w8_bpreshuffle_256x64x128x128_16x16_16x16_8x32x1_8x32x1_1x32x1x8_8x8x1_2x1_intrawave_v3,0.0,0.0,0.0
gfx942,80,416,7168,18432,torch.float8_e4m3fnuz,ck,85,0,352.9218,a8w8_bpreshuffle_256x64x128x128_16x16_16x16_8x32x1_8x32x1_1x32x1x8_8x8x1_2x1_intrawave_v3,0.0,0.0,0.0
gfx942,80,448,7168,256,torch.float8_e4m3fnuz,ck,72,0,15.6539,a8w8_bpreshuffle_256x64x256x64_16x16_16x16_4x64x1_4x64x1_1x16x1x16_8x8x1_1x2_intrawave_v1,0.0,0.0,0.0
gfx942,80,448,7168,512,torch.float8_e4m3fnuz,ck,84,0,23.4146,a8w8_bpreshuffle_256x32x128x128_16x16_16x16_8x32x1_8x32x1_1x32x1x8_8x8x1_2x1_intrawave_v1,140.44,440.83,0.0
gfx942,80,448,7168,1024,torch.float8_e4m3fnuz,ck,85,0,32.9498,a8w8_bpreshuffle_256x64x128x128_16x16_16x16_8x32x1_8x32x1_1x32x1x8_8x8x1_2x1_intrawave_v3,199.6,431.61,0.0
gfx942,80,448,7168,2048,torch.float8_e4m3fnuz,ck,85,0,47.8488,a8w8_bpreshuffle_256x64x128x128_16x16_16x16_8x32x1_8x32x1_1x32x1x8_8x8x1_2x1_intrawave_v3,0.0,0.0,0.0
gfx942,80,448,7168,2304,torch.float8_e4m3fnuz,ck,85,0,49.72,a8w8_bpreshuffle_256x64x128x128_16x16_16x16_8x32x1_8x32x1_1x32x1x8_8x8x1_2x1_intrawave_v3,0.0,0.0,0.0
gfx942,80,448,7168,4096,torch.float8_e4m3fnuz,ck,85,0,89.2889,a8w8_bpreshuffle_256x64x128x128_16x16_16x16_8x32x1_8x32x1_1x32x1x8_8x8x1_2x1_intrawave_v3,294.62,421.3,0.0
gfx942,80,448,7168,4608,torch.float8_e4m3fnuz,ck,85,0,99.4928,a8w8_bpreshuffle_256x64x128x128_16x16_16x16_8x32x1_8x32x1_1x32x1x8_8x8x1_2x1_intrawave_v3,297.46,417.29,0.0
gfx942,80,448,7168,8192,torch.float8_e4m3fnuz,ck,85,0,164.1085,a8w8_bpreshuffle_256x64x128x128_16x16_16x16_8x32x1_8x32x1_1x32x1x8_8x8x1_2x1_intrawave_v3,320.6,419.31,0.0
gfx942,80,448,7168,9216,torch.float8_e4m3fnuz,ck,85,0,183.9126,a8w8_bpreshuffle_256x64x128x128_16x16_16x16_8x32x1_8x32x1_1x32x1x8_8x8x1_2x1_intrawave_v3,321.84,416.57,0.0
gfx942,80,448,7168,16384,torch.float8_e4m3fnuz,ck,85,0,316.355,a8w8_bpreshuffle_256x64x128x128_16x16_16x16_8x32x1_8x32x1_1x32x1x8_8x8x1_2x1_intrawave_v3,0.0,0.0,0.0
gfx942,80,448,7168,18432,torch.float8_e4m3fnuz,ck,85,0,356.7658,a8w8_bpreshuffle_256x64x128x128_16x16_16x16_8x32x1_8x32x1_1x32x1x8_8x8x1_2x1_intrawave_v3,0.0,0.0,0.0
gfx942,80,480,7168,256,torch.float8_e4m3fnuz,ck,72,0,16.1387,a8w8_bpreshuffle_256x64x256x64_16x16_16x16_4x64x1_4x64x1_1x16x1x16_8x8x1_1x2_intrawave_v1,0.0,0.0,0.0
gfx942,80,480,7168,512,torch.float8_e4m3fnuz,ck,72,0,25.9264,a8w8_bpreshuffle_256x64x256x64_16x16_16x16_4x64x1_4x64x1_1x16x1x16_8x8x1_1x2_intrawave_v1,135.89,416.45,0.0
gfx942,80,480,7168,1024,torch.float8_e4m3fnuz,ck,72,0,36.9129,a8w8_bpreshuffle_256x64x256x64_16x16_16x16_4x64x1_4x64x1_1x16x1x16_8x8x1_1x2_intrawave_v1,190.89,398.58,0.0
gfx942,80,480,7168,2048,torch.float8_e4m3fnuz,ck,102,0,52.4824,a8w8_bpreshuffle_256x96x256x128_16x16_16x16_8x32x1_8x32x1_1x32x1x8_8x8x1_2x1_intrawave_v3,0.0,0.0,0.0
gfx942,80,480,7168,2304,torch.float8_e4m3fnuz,ck,102,0,56.9516,a8w8_bpreshuffle_256x96x256x128_16x16_16x16_8x32x1_8x32x1_1x32x1x8_8x8x1_2x1_intrawave_v3,0.0,0.0,0.0
gfx942,80,480,7168,4096,torch.float8_e4m3fnuz,ck,102,0,96.7743,a8w8_bpreshuffle_256x96x256x128_16x16_16x16_8x32x1_8x32x1_1x32x1x8_8x8x1_2x1_intrawave_v3,291.25,394.81,0.0
gfx942,80,480,7168,4608,torch.float8_e4m3fnuz,ck,102,0,106.4225,a8w8_bpreshuffle_256x96x256x128_16x16_16x16_8x32x1_8x32x1_1x32x1x8_8x8x1_2x1_intrawave_v3,297.95,395.81,0.0
gfx942,80,480,7168,8192,torch.float8_e4m3fnuz,ck,102,0,176.1263,a8w8_bpreshuffle_256x96x256x128_16x16_16x16_8x32x1_8x32x1_1x32x1x8_8x8x1_2x1_intrawave_v3,320.06,394.79,0.0
gfx942,80,480,7168,9216,torch.float8_e4m3fnuz,ck,102,0,194.8844,a8w8_bpreshuffle_256x96x256x128_16x16_16x16_8x32x1_8x32x1_1x32x1x8_8x8x1_2x1_intrawave_v3,325.41,396.98,0.0
gfx942,80,480,7168,16384,torch.float8_e4m3fnuz,ck,86,0,346.0471,a8w8_bpreshuffle_256x96x128x128_16x16_16x16_8x32x1_8x32x1_1x32x1x8_8x8x1_2x1_intrawave_v3,0.0,0.0,0.0
gfx942,80,480,7168,18432,torch.float8_e4m3fnuz,ck,102,0,379.6631,a8w8_bpreshuffle_256x96x256x128_16x16_16x16_8x32x1_8x32x1_1x32x1x8_8x8x1_2x1_intrawave_v3,0.0,0.0,0.0
gfx942,80,512,7168,256,torch.float8_e4m3fnuz,ck,72,0,16.1951,a8w8_bpreshuffle_256x64x256x64_16x16_16x16_4x64x1_4x64x1_1x16x1x16_8x8x1_1x2_intrawave_v1,1160.26,574.63,0.0
gfx942,80,512,7168,512,torch.float8_e4m3fnuz,ck,72,0,26.2156,a8w8_bpreshuffle_256x64x256x64_16x16_16x16_4x64x1_4x64x1_1x16x1x16_8x8x1_1x2_intrawave_v1,143.35,429.98,0.0
gfx942,80,512,7168,1024,torch.float8_e4m3fnuz,ck,71,0,37.0911,a8w8_bpreshuffle_256x128x128x64_16x16_16x16_4x64x1_4x64x1_1x32x1x8_8x8x1_2x1_intrawave_v3,202.64,409.92,0.0
gfx942,80,512,7168,2048,torch.float8_e4m3fnuz,ck,71,0,53.438,a8w8_bpreshuffle_256x128x128x64_16x16_16x16_4x64x1_4x64x1_1x32x1x8_8x8x1_2x1_intrawave_v3,2813.05,431.69,0.0
gfx942,80,512,7168,2304,torch.float8_e4m3fnuz,ck,72,0,57.4769,a8w8_bpreshuffle_256x64x256x64_16x16_16x16_4x64x1_4x64x1_1x16x1x16_8x8x1_1x2_intrawave_v1,2942.3,435.56,0.0
gfx942,80,512,7168,4096,torch.float8_e4m3fnuz,ck,71,0,99.0962,a8w8_bpreshuffle_256x128x128x64_16x16_16x16_4x64x1_4x64x1_1x32x1x8_8x8x1_2x1_intrawave_v3,303.39,391.51,0.0
gfx942,80,512,7168,4608,torch.float8_e4m3fnuz,ck,71,0,109.7596,a8w8_bpreshuffle_256x128x128x64_16x16_16x16_4x64x1_4x64x1_1x32x1x8_8x8x1_2x1_intrawave_v3,308.15,389.3,0.0
gfx942,80,512,7168,8192,torch.float8_e4m3fnuz,ck,71,0,182.1732,a8w8_bpreshuffle_256x128x128x64_16x16_16x16_4x64x1_4x64x1_1x32x1x8_8x8x1_2x1_intrawave_v3,330.07,385.65,0.0
gfx942,80,512,7168,9216,torch.float8_e4m3fnuz,ck,71,0,204.5549,a8w8_bpreshuffle_256x128x128x64_16x16_16x16_4x64x1_4x64x1_1x32x1x8_8x8x1_2x1_intrawave_v3,330.7,381.9,0.0
gfx942,80,512,7168,16384,torch.float8_e4m3fnuz,ck,71,0,346.2792,a8w8_bpreshuffle_256x128x128x64_16x16_16x16_4x64x1_4x64x1_1x32x1x8_8x8x1_2x1_intrawave_v3,0.0,0.0,0.0
gfx942,80,512,7168,18432,torch.float8_e4m3fnuz,ck,70,0,389.6687,a8w8_bpreshuffle_256x128x128x128_16x16_16x16_8x32x1_8x32x1_1x32x1x8_8x8x1_2x1_intrawave_v3,0.0,0.0,0.0
gfx942,80,1024,7168,256,torch.float8_e4m3fnuz,ck,71,0,27.7779,a8w8_bpreshuffle_256x128x128x64_16x16_16x16_4x64x1_4x64x1_1x32x1x8_8x8x1_2x1_intrawave_v3,1352.91,603.98,0.0
gfx942,80,1024,7168,512,torch.float8_e4m3fnuz,ck,71,0,46.6251,a8w8_bpreshuffle_256x128x128x64_16x16_16x16_4x64x1_4x64x1_1x32x1x8_8x8x1_2x1_intrawave_v3,161.2,404.81,0.0
gfx942,80,1024,7168,1024,torch.float8_e4m3fnuz,ck,71,0,66.699,a8w8_bpreshuffle_256x128x128x64_16x16_16x16_4x64x1_4x64x1_1x32x1x8_8x8x1_2x1_intrawave_v3,225.38,345.86,0.0
gfx942,80,1024,7168,2048,torch.float8_e4m3fnuz,ck,71,0,98.0567,a8w8_bpreshuffle_256x128x128x64_16x16_16x16_4x64x1_4x64x1_1x32x1x8_8x8x1_2x1_intrawave_v3,3066.06,320.81,0.0
gfx942,80,1024,7168,2304,torch.float8_e4m3fnuz,ck,85,0,107.3839,a8w8_bpreshuffle_256x64x128x128_16x16_16x16_8x32x1_8x32x1_1x32x1x8_8x8x1_2x1_intrawave_v3,3149.71,312.47,0.0
gfx942,80,1024,7168,4096,torch.float8_e4m3fnuz,ck,71,0,186.692,a8w8_bpreshuffle_256x128x128x64_16x16_16x16_4x64x1_4x64x1_1x32x1x8_8x8x1_2x1_intrawave_v3,322.08,258.36,0.0
gfx942,80,1024,7168,4608,torch.float8_e4m3fnuz,ck,71,0,208.1557,a8w8_bpreshuffle_256x128x128x64_16x16_16x16_4x64x1_4x64x1_1x32x1x8_8x8x1_2x1_intrawave_v3,324.98,251.87,0.0
gfx942,80,1024,7168,8192,torch.float8_e4m3fnuz,ck,85,0,349.1505,a8w8_bpreshuffle_256x64x128x128_16x16_16x16_8x32x1_8x32x1_1x32x1x8_8x8x1_2x1_intrawave_v3,344.43,234.25,0.0
gfx942,80,1024,7168,9216,torch.float8_e4m3fnuz,ck,85,0,390.4976,a8w8_bpreshuffle_256x64x128x128_16x16_16x16_8x32x1_8x32x1_1x32x1x8_8x8x1_2x1_intrawave_v3,346.46,230.93,0.0
gfx942,80,1024,7168,16384,torch.float8_e4m3fnuz,ck,85,0,661.406,a8w8_bpreshuffle_256x64x128x128_16x16_16x16_8x32x1_8x32x1_1x32x1x8_8x8x1_2x1_intrawave_v3,0.0,0.0,0.0
gfx942,80,1024,7168,18432,torch.float8_e4m3fnuz,ck,85,0,745.9611,a8w8_bpreshuffle_256x64x128x128_16x16_16x16_8x32x1_8x32x1_1x32x1x8_8x8x1_2x1_intrawave_v3,0.0,0.0,0.0
gfx942,80,1536,7168,256,torch.float8_e4m3fnuz,ck,71,0,37.3284,a8w8_bpreshuffle_256x128x128x64_16x16_16x16_4x64x1_4x64x1_1x32x1x8_8x8x1_2x1_intrawave_v3,1510.15,649.59,0.0
gfx942,80,1536,7168,2048,torch.float8_e4m3fnuz,ck,85,0,138.0452,a8w8_bpreshuffle_256x64x128x128_16x16_16x16_8x32x1_8x32x1_1x32x1x8_8x8x1_2x1_intrawave_v3,3266.84,288.64,0.0
gfx942,80,1536,7168,2304,torch.float8_e4m3fnuz,ck,85,0,150.2725,a8w8_bpreshuffle_256x64x128x128_16x16_16x16_8x32x1_8x32x1_1x32x1x8_8x8x1_2x1_intrawave_v3,3376.15,279.99,0.0
gfx942,80,2048,7168,256,torch.float8_e4m3fnuz,ck,71,0,48.0096,a8w8_bpreshuffle_256x128x128x64_16x16_16x16_4x64x1_4x64x1_1x32x1x8_8x8x1_2x1_intrawave_v3,1565.56,660.69,0.0
gfx942,80,2048,7168,512,torch.float8_e4m3fnuz,ck,71,0,82.6364,a8w8_bpreshuffle_256x128x128x64_16x16_16x16_4x64x1_4x64x1_1x32x1x8_8x8x1_2x1_intrawave_v3,181.91,412.39,0.0
gfx942,80,2048,7168,1024,torch.float8_e4m3fnuz,ck,85,0,122.5939,a8w8_bpreshuffle_256x64x128x128_16x16_16x16_8x32x1_8x32x1_1x32x1x8_8x8x1_2x1_intrawave_v3,245.24,316.47,0.0
gfx942,80,2048,7168,2048,torch.float8_e4m3fnuz,ck,85,0,186.7051,a8w8_bpreshuffle_256x64x128x128_16x16_16x16_8x32x1_8x32x1_1x32x1x8_8x8x1_2x1_intrawave_v3,3220.56,258.35,0.0
gfx942,80,2048,7168,2304,torch.float8_e4m3fnuz,ck,85,0,199.0359,a8w8_bpreshuffle_256x64x128x128_16x16_16x16_8x32x1_8x32x1_1x32x1x8_8x8x1_2x1_intrawave_v3,3398.67,254.19,0.0
gfx942,80,2048,7168,4096,torch.float8_e4m3fnuz,ck,85,0,351.1592,a8w8_bpreshuffle_256x64x128x128_16x16_16x16_8x32x1_8x32x1_1x32x1x8_8x8x1_2x1_intrawave_v3,342.46,191.11,0.0
gfx942,80,2048,7168,4608,torch.float8_e4m3fnuz,ck,85,0,390.2145,a8w8_bpreshuffle_256x64x128x128_16x16_16x16_8x32x1_8x32x1_1x32x1x8_8x8x1_2x1_intrawave_v3,346.71,184.07,0.0
gfx942,80,2048,7168,8192,torch.float8_e4m3fnuz,ck,85,0,657.8671,a8w8_bpreshuffle_256x64x128x128_16x16_16x16_8x32x1_8x32x1_1x32x1x8_8x8x1_2x1_intrawave_v3,365.6,159.39,0.0
gfx942,80,2048,7168,9216,torch.float8_e4m3fnuz,ck,85,0,738.9236,a8w8_bpreshuffle_256x64x128x128_16x16_16x16_8x32x1_8x32x1_1x32x1x8_8x8x1_2x1_intrawave_v3,366.19,154.68,0.0
gfx942,80,2048,7168,16384,torch.float8_e4m3fnuz,ck,85,0,1256.6524,a8w8_bpreshuffle_256x64x128x128_16x16_16x16_8x32x1_8x32x1_1x32x1x8_8x8x1_2x1_intrawave_v3,0.0,0.0,0.0
gfx942,80,2048,7168,18432,torch.float8_e4m3fnuz,ck,85,0,1411.2909,a8w8_bpreshuffle_256x64x128x128_16x16_16x16_8x32x1_8x32x1_1x32x1x8_8x8x1_2x1_intrawave_v3,0.0,0.0,0.0
gfx942,80,4096,7168,256,torch.float8_e4m3fnuz,ck,71,0,85.7258,a8w8_bpreshuffle_256x128x128x64_16x16_16x16_4x64x1_4x64x1_1x32x1x8_8x8x1_2x1_intrawave_v3,1753.54,718.61,0.0
gfx942,80,4096,7168,512,torch.float8_e4m3fnuz,ck,71,0,151.6161,a8w8_bpreshuffle_256x128x128x64_16x16_16x16_4x64x1_4x64x1_1x32x1x8_8x8x1_2x1_intrawave_v3,198.3,425.33,0.0
gfx942,80,4096,7168,1024,torch.float8_e4m3fnuz,ck,71,0,228.1081,a8w8_bpreshuffle_256x128x128x64_16x16_16x16_4x64x1_4x64x1_1x32x1x8_8x8x1_2x1_intrawave_v3,263.6,307.99,0.0
gfx942,80,4096,7168,2048,torch.float8_e4m3fnuz,ck,71,0,345.3094,a8w8_bpreshuffle_256x128x128x64_16x16_16x16_4x64x1_4x64x1_1x32x1x8_8x8x1_2x1_intrawave_v3,3482.65,236.86,0.0
gfx942,80,4096,7168,2304,torch.float8_e4m3fnuz,ck,71,0,379.4759,a8w8_bpreshuffle_256x128x128x64_16x16_16x16_4x64x1_4x64x1_1x32x1x8_8x8x1_2x1_intrawave_v3,3565.22,223.13,0.0
gfx942,80,4096,7168,4096,torch.float8_e4m3fnuz,ck,85,0,678.039,a8w8_bpreshuffle_256x64x128x128_16x16_16x16_8x32x1_8x32x1_1x32x1x8_8x8x1_2x1_intrawave_v3,354.73,154.65,0.0
gfx942,80,4096,7168,4608,torch.float8_e4m3fnuz,ck,85,0,756.3913,a8w8_bpreshuffle_256x64x128x128_16x16_16x16_8x32x1_8x32x1_1x32x1x8_8x8x1_2x1_intrawave_v3,357.73,146.25,0.0
gfx942,80,4096,7168,8192,torch.float8_e4m3fnuz,ck,85,0,1274.608,a8w8_bpreshuffle_256x64x128x128_16x16_16x16_8x32x1_8x32x1_1x32x1x8_8x8x1_2x1_intrawave_v3,377.4,118.46,0.0
gfx942,80,4096,7168,9216,torch.float8_e4m3fnuz,ck,85,0,1433.1369,a8w8_bpreshuffle_256x64x128x128_16x16_16x16_8x32x1_8x32x1_1x32x1x8_8x8x1_2x1_intrawave_v3,377.61,113.41,0.0
gfx942,80,4096,7168,16384,torch.float8_e4m3fnuz,ck,85,0,2443.998,a8w8_bpreshuffle_256x64x128x128_16x16_16x16_8x32x1_8x32x1_1x32x1x8_8x8x1_2x1_intrawave_v3,0.0,0.0,0.0
gfx942,80,4096,7168,18432,torch.float8_e4m3fnuz,ck,85,0,2773.2274,a8w8_bpreshuffle_256x64x128x128_16x16_16x16_8x32x1_8x32x1_1x32x1x8_8x8x1_2x1_intrawave_v3,0.0,0.0,0.0
gfx942,80,6144,7168,256,torch.float8_e4m3fnuz,ck,71,0,123.4161,a8w8_bpreshuffle_256x128x128x64_16x16_16x16_4x64x1_4x64x1_1x32x1x8_8x8x1_2x1_intrawave_v3,0.0,0.0,0.0
gfx942,80,6144,7168,512,torch.float8_e4m3fnuz,ck,71,0,215.2661,a8w8_bpreshuffle_256x128x128x64_16x16_16x16_4x64x1_4x64x1_1x32x1x8_8x8x1_2x1_intrawave_v3,209.49,440.83,0.0
gfx942,80,6144,7168,1024,torch.float8_e4m3fnuz,ck,71,0,327.7242,a8w8_bpreshuffle_256x128x128x64_16x16_16x16_4x64x1_4x64x1_1x32x1x8_8x8x1_2x1_intrawave_v3,275.21,310.36,0.0
gfx942,80,6144,7168,2048,torch.float8_e4m3fnuz,ck,71,0,509.0789,a8w8_bpreshuffle_256x128x128x64_16x16_16x16_4x64x1_4x64x1_1x32x1x8_8x8x1_2x1_intrawave_v3,0.0,0.0,0.0
gfx942,80,6144,7168,2304,torch.float8_e4m3fnuz,ck,71,0,560.4929,a8w8_bpreshuffle_256x128x128x64_16x16_16x16_4x64x1_4x64x1_1x32x1x8_8x8x1_2x1_intrawave_v3,0.0,0.0,0.0
gfx942,80,6144,7168,4096,torch.float8_e4m3fnuz,ck,71,0,996.6903,a8w8_bpreshuffle_256x128x128x64_16x16_16x16_4x64x1_4x64x1_1x32x1x8_8x8x1_2x1_intrawave_v3,361.98,143.08,0.0
gfx942,80,6144,7168,4608,torch.float8_e4m3fnuz,ck,71,0,1121.7892,a8w8_bpreshuffle_256x128x128x64_16x16_16x16_4x64x1_4x64x1_1x32x1x8_8x8x1_2x1_intrawave_v3,361.81,133.2,0.0
gfx942,80,6144,7168,8192,torch.float8_e4m3fnuz,ck,71,0,1890.6064,a8w8_bpreshuffle_256x128x128x64_16x16_16x16_4x64x1_4x64x1_1x32x1x8_8x8x1_2x1_intrawave_v3,381.65,104.27,0.0
gfx942,80,6144,7168,9216,torch.float8_e4m3fnuz,ck,71,0,2131.2878,a8w8_bpreshuffle_256x128x128x64_16x16_16x16_4x64x1_4x64x1_1x32x1x8_8x8x1_2x1_intrawave_v3,380.87,98.89,0.0
gfx942,80,6144,7168,16384,torch.float8_e4m3fnuz,ck,85,0,3671.969,a8w8_bpreshuffle_256x64x128x128_16x16_16x16_8x32x1_8x32x1_1x32x1x8_8x8x1_2x1_intrawave_v3,0.0,0.0,0.0
gfx942,80,6144,7168,18432,torch.float8_e4m3fnuz,ck,85,0,4139.4899,a8w8_bpreshuffle_256x64x128x128_16x16_16x16_8x32x1_8x32x1_1x32x1x8_8x8x1_2x1_intrawave_v3,0.0,0.0,0.0
gfx942,80,8192,7168,256,torch.float8_e4m3fnuz,ck,71,0,158.8437,a8w8_bpreshuffle_256x128x128x64_16x16_16x16_4x64x1_4x64x1_1x32x1x8_8x8x1_2x1_intrawave_v3,1892.73,764.1,0.0
gfx942,80,8192,7168,512,torch.float8_e4m3fnuz,ck,71,0,284.9791,a8w8_bpreshuffle_256x128x128x64_16x16_16x16_4x64x1_4x64x1_1x32x1x8_8x8x1_2x1_intrawave_v3,211.0,439.7,0.0
gfx942,80,8192,7168,1024,torch.float8_e4m3fnuz,ck,71,0,434.723,a8w8_bpreshuffle_256x128x128x64_16x16_16x16_4x64x1_4x64x1_1x32x1x8_8x8x1_2x1_intrawave_v3,276.63,306.33,0.0
gfx942,80,8192,7168,2048,torch.float8_e4m3fnuz,ck,71,0,665.8308,a8w8_bpreshuffle_256x128x128x64_16x16_16x16_4x64x1_4x64x1_1x32x1x8_8x8x1_2x1_intrawave_v3,3612.3,223.63,0.0
gfx942,80,8192,7168,2304,torch.float8_e4m3fnuz,ck,71,0,736.4592,a8w8_bpreshuffle_256x128x128x64_16x16_16x16_4x64x1_4x64x1_1x32x1x8_8x8x1_2x1_intrawave_v3,3674.11,207.52,0.0
gfx942,80,8192,7168,4096,torch.float8_e4m3fnuz,ck,71,0,1320.5151,a8w8_bpreshuffle_256x128x128x64_16x16_16x16_4x64x1_4x64x1_1x32x1x8_8x8x1_2x1_intrawave_v3,364.28,136.58,0.0
gfx942,80,8192,7168,4608,torch.float8_e4m3fnuz,ck,71,0,1479.7426,a8w8_bpreshuffle_256x128x128x64_16x16_16x16_4x64x1_4x64x1_1x32x1x8_8x8x1_2x1_intrawave_v3,365.72,127.2,0.0
gfx942,80,8192,7168,8192,torch.float8_e4m3fnuz,ck,71,0,2510.9482,a8w8_bpreshuffle_256x128x128x64_16x16_16x16_4x64x1_4x64x1_1x32x1x8_8x8x1_2x1_intrawave_v3,383.15,96.88,0.0
gfx942,80,8192,7168,9216,torch.float8_e4m3fnuz,ck,71,0,2849.736,a8w8_bpreshuffle_256x128x128x64_16x16_16x16_4x64x1_4x64x1_1x32x1x8_8x8x1_2x1_intrawave_v3,379.8,90.89,0.0
gfx942,80,8192,7168,16384,torch.float8_e4m3fnuz,ck,85,0,4942.7227,a8w8_bpreshuffle_256x64x128x128_16x16_16x16_8x32x1_8x32x1_1x32x1x8_8x8x1_2x1_intrawave_v3,0.0,0.0,0.0
gfx942,80,8192,7168,18432,torch.float8_e4m3fnuz,ck,85,0,5501.8021,a8w8_bpreshuffle_256x64x128x128_16x16_16x16_8x32x1_8x32x1_1x32x1x8_8x8x1_2x1_intrawave_v3,0.0,0.0,0.0
gfx942,80,10240,7168,256,torch.float8_e4m3fnuz,ck,71,0,199.187,a8w8_bpreshuffle_256x128x128x64_16x16_16x16_4x64x1_4x64x1_1x32x1x8_8x8x1_2x1_intrawave_v3,0.0,0.0,0.0
gfx942,80,10240,7168,512,torch.float8_e4m3fnuz,ck,71,0,352.3613,a8w8_bpreshuffle_256x128x128x64_16x16_16x16_4x64x1_4x64x1_1x32x1x8_8x8x1_2x1_intrawave_v3,213.31,441.91,0.0
gfx942,80,10240,7168,1024,torch.float8_e4m3fnuz,ck,71,0,534.3848,a8w8_bpreshuffle_256x128x128x64_16x16_16x16_4x64x1_4x64x1_1x32x1x8_8x8x1_2x1_intrawave_v3,281.3,308.07,0.0
gfx942,80,10240,7168,2048,torch.float8_e4m3fnuz,ck,71,0,843.0746,a8w8_bpreshuffle_256x128x128x64_16x16_16x16_4x64x1_4x64x1_1x32x1x8_8x8x1_2x1_intrawave_v3,0.0,0.0,0.0
gfx942,80,10240,7168,2304,torch.float8_e4m3fnuz,ck,71,0,913.7132,a8w8_bpreshuffle_256x128x128x64_16x16_16x16_4x64x1_4x64x1_1x32x1x8_8x8x1_2x1_intrawave_v3,0.0,0.0,0.0
gfx942,80,10240,7168,4096,torch.float8_e4m3fnuz,ck,71,0,1650.4804,a8w8_bpreshuffle_256x128x128x64_16x16_16x16_4x64x1_4x64x1_1x32x1x8_8x8x1_2x1_intrawave_v3,364.32,132.15,0.0
gfx942,80,10240,7168,4608,torch.float8_e4m3fnuz,ck,71,0,1837.7562,a8w8_bpreshuffle_256x128x128x64_16x16_16x16_4x64x1_4x64x1_1x32x1x8_8x8x1_2x1_intrawave_v3,368.09,123.53,0.0
gfx942,80,10240,7168,8192,torch.float8_e4m3fnuz,ck,85,0,3170.8672,a8w8_bpreshuffle_256x64x128x128_16x16_16x16_8x32x1_8x32x1_1x32x1x8_8x8x1_2x1_intrawave_v3,379.26,91.27,0.0
gfx942,80,10240,7168,9216,torch.float8_e4m3fnuz,ck,85,0,3555.6005,a8w8_bpreshuffle_256x64x128x128_16x16_16x16_8x32x1_8x32x1_1x32x1x8_8x8x1_2x1_intrawave_v3,380.5,86.41,0.0
gfx942,80,10240,7168,16384,torch.float8_e4m3fnuz,ck,85,0,6072.4257,a8w8_bpreshuffle_256x64x128x128_16x16_16x16_8x32x1_8x32x1_1x32x1x8_8x8x1_2x1_intrawave_v3,0.0,0.0,0.0
gfx942,80,10240,7168,18432,torch.float8_e4m3fnuz,ck,85,0,6834.6666,a8w8_bpreshuffle_256x64x128x128_16x16_16x16_8x32x1_8x32x1_1x32x1x8_8x8x1_2x1_intrawave_v3,0.0,0.0,0.0
gfx942,80,12288,7168,256,torch.float8_e4m3fnuz,ck,71,0,243.398,a8w8_bpreshuffle_256x128x128x64_16x16_16x16_4x64x1_4x64x1_1x32x1x8_8x8x1_2x1_intrawave_v3,0.0,0.0,0.0
gfx942,80,12288,7168,512,torch.float8_e4m3fnuz,ck,71,0,420.7005,a8w8_bpreshuffle_256x128x128x64_16x16_16x16_4x64x1_4x64x1_1x32x1x8_8x8x1_2x1_intrawave_v3,214.39,442.41,0.0
gfx942,80,12288,7168,1024,torch.float8_e4m3fnuz,ck,71,0,642.9593,a8w8_bpreshuffle_256x128x128x64_16x16_16x16_4x64x1_4x64x1_1x32x1x8_8x8x1_2x1_intrawave_v3,280.56,304.97,0.0
gfx942,80,12288,7168,2048,torch.float8_e4m3fnuz,ck,71,0,1001.5776,a8w8_bpreshuffle_256x128x128x64_16x16_16x16_4x64x1_4x64x1_1x32x1x8_8x8x1_2x1_intrawave_v3,0.0,0.0,0.0
gfx942,80,12288,7168,2304,torch.float8_e4m3fnuz,ck,72,0,1134.7441,a8w8_bpreshuffle_256x64x256x64_16x16_16x16_4x64x1_4x64x1_1x16x1x16_8x8x1_1x2_intrawave_v1,0.0,0.0,0.0
gfx942,80,12288,7168,4096,torch.float8_e4m3fnuz,ck,71,0,1986.0405,a8w8_bpreshuffle_256x128x128x64_16x16_16x16_4x64x1_4x64x1_1x32x1x8_8x8x1_2x1_intrawave_v3,363.31,128.83,0.0
gfx942,80,12288,7168,4608,torch.float8_e4m3fnuz,ck,102,0,2231.5819,a8w8_bpreshuffle_256x96x256x128_16x16_16x16_8x32x1_8x32x1_1x32x1x8_8x8x1_2x1_intrawave_v3,363.75,119.11,0.0
gfx942,80,12288,7168,8192,torch.float8_e4m3fnuz,ck,102,0,3769.9628,a8w8_bpreshuffle_256x96x256x128_16x16_16x16_8x32x1_8x32x1_1x32x1x8_8x8x1_2x1_intrawave_v3,382.79,89.0,0.0
gfx942,80,12288,7168,9216,torch.float8_e4m3fnuz,ck,102,0,4210.5442,a8w8_bpreshuffle_256x96x256x128_16x16_16x16_8x32x1_8x32x1_1x32x1x8_8x8x1_2x1_intrawave_v3,385.58,84.42,0.0
gfx942,80,12288,7168,16384,torch.float8_e4m3fnuz,ck,102,0,7272.8109,a8w8_bpreshuffle_256x96x256x128_16x16_16x16_8x32x1_8x32x1_1x32x1x8_8x8x1_2x1_intrawave_v3,0.0,0.0,0.0
gfx942,80,12288,7168,18432,torch.float8_e4m3fnuz,ck,102,0,8054.046,a8w8_bpreshuffle_256x96x256x128_16x16_16x16_8x32x1_8x32x1_1x32x1x8_8x8x1_2x1_intrawave_v3,0.0,0.0,0.0
gfx942,80,14336,7168,256,torch.float8_e4m3fnuz,ck,72,0,297.7928,a8w8_bpreshuffle_256x64x256x64_16x16_16x16_4x64x1_4x64x1_1x16x1x16_8x8x1_1x2_intrawave_v1,0.0,0.0,0.0
gfx942,80,14336,7168,512,torch.float8_e4m3fnuz,ck,71,0,486.4844,a8w8_bpreshuffle_256x128x128x64_16x16_16x16_4x64x1_4x64x1_1x32x1x8_8x8x1_2x1_intrawave_v3,216.3,445.09,0.0
gfx942,80,14336,7168,1024,torch.float8_e4m3fnuz,ck,71,0,743.1281,a8w8_bpreshuffle_256x128x128x64_16x16_16x16_4x64x1_4x64x1_1x32x1x8_8x8x1_2x1_intrawave_v3,283.2,306.19,0.0
gfx942,80,14336,7168,2048,torch.float8_e4m3fnuz,ck,74,0,1199.9511,a8w8_bpreshuffle_256x64x256x64_16x16_16x16_4x64x1_4x64x1_1x32x1x8_8x8x1_2x1_intrawave_v1,0.0,0.0,0.0
gfx942,80,14336,7168,2304,torch.float8_e4m3fnuz,ck,71,0,1310.3925,a8w8_bpreshuffle_256x128x128x64_16x16_16x16_4x64x1_4x64x1_1x32x1x8_8x8x1_2x1_intrawave_v3,0.0,0.0,0.0
gfx942,80,14336,7168,4096,torch.float8_e4m3fnuz,ck,71,0,2319.2645,a8w8_bpreshuffle_256x128x128x64_16x16_16x16_4x64x1_4x64x1_1x32x1x8_8x8x1_2x1_intrawave_v3,362.97,126.59,0.0
gfx942,80,14336,7168,4608,torch.float8_e4m3fnuz,ck,71,0,2586.1715,a8w8_bpreshuffle_256x128x128x64_16x16_16x16_4x64x1_4x64x1_1x32x1x8_8x8x1_2x1_intrawave_v3,366.19,117.78,0.0
gfx942,80,14336,7168,8192,torch.float8_e4m3fnuz,ck,85,0,4407.5338,a8w8_bpreshuffle_256x64x128x128_16x16_16x16_8x32x1_8x32x1_1x32x1x8_8x8x1_2x1_intrawave_v3,381.99,86.6,0.0
gfx942,80,14336,7168,9216,torch.float8_e4m3fnuz,ck,85,0,4962.8544,a8w8_bpreshuffle_256x64x128x128_16x16_16x16_8x32x1_8x32x1_1x32x1x8_8x8x1_2x1_intrawave_v3,381.65,81.34,0.0
gfx942,80,14336,7168,16384,torch.float8_e4m3fnuz,ck,85,0,8455.8581,a8w8_bpreshuffle_256x64x128x128_16x16_16x16_8x32x1_8x32x1_1x32x1x8_8x8x1_2x1_intrawave_v3,0.0,0.0,0.0
gfx942,80,14336,7168,18432,torch.float8_e4m3fnuz,ck,85,0,9585.3754,a8w8_bpreshuffle_256x64x128x128_16x16_16x16_8x32x1_8x32x1_1x32x1x8_8x8x1_2x1_intrawave_v3,0.0,0.0,0.0
gfx942,80,16384,7168,256,torch.float8_e4m3fnuz,ck,71,0,306.2344,a8w8_bpreshuffle_256x128x128x64_16x16_16x16_4x64x1_4x64x1_1x32x1x8_8x8x1_2x1_intrawave_v3,1963.51,786.69,0.0
gfx942,80,16384,7168,512,torch.float8_e4m3fnuz,ck,71,0,558.1976,a8w8_bpreshuffle_256x128x128x64_16x16_16x16_4x64x1_4x64x1_1x32x1x8_8x8x1_2x1_intrawave_v3,215.44,442.39,0.0
gfx942,80,16384,7168,1024,torch.float8_e4m3fnuz,ck,71,0,852.9241,a8w8_bpreshuffle_256x128x128x64_16x16_16x16_4x64x1_4x64x1_1x32x1x8_8x8x1_2x1_intrawave_v3,281.99,303.66,0.0
gfx942,80,16384,7168,2048,torch.float8_e4m3fnuz,ck,71,0,1322.9659,a8w8_bpreshuffle_256x128x128x64_16x16_16x16_4x64x1_4x64x1_1x32x1x8_8x8x1_2x1_intrawave_v3,3636.04,214.0,0.0
gfx942,80,16384,7168,2304,torch.float8_e4m3fnuz,ck,71,0,1464.8949,a8w8_bpreshuffle_256x128x128x64_16x16_16x16_4x64x1_4x64x1_1x32x1x8_8x8x1_2x1_intrawave_v3,3694.23,197.38,0.0
gfx942,80,16384,7168,4096,torch.float8_e4m3fnuz,ck,71,0,2629.6553,a8w8_bpreshuffle_256x128x128x64_16x16_16x16_4x64x1_4x64x1_1x32x1x8_8x8x1_2x1_intrawave_v3,365.86,126.01,0.0
gfx942,80,16384,7168,4608,torch.float8_e4m3fnuz,ck,71,0,2948.8372,a8w8_bpreshuffle_256x128x128x64_16x16_16x16_4x64x1_4x64x1_1x32x1x8_8x8x1_2x1_intrawave_v3,367.04,116.46,0.0
gfx942,80,16384,7168,8192,torch.float8_e4m3fnuz,ck,71,0,5047.6593,a8w8_bpreshuffle_256x128x128x64_16x16_16x16_4x64x1_4x64x1_1x32x1x8_8x8x1_2x1_intrawave_v3,381.2,84.76,0.0
gfx942,80,16384,7168,9216,torch.float8_e4m3fnuz,ck,85,0,5684.8825,a8w8_bpreshuffle_256x64x128x128_16x16_16x16_8x32x1_8x32x1_1x32x1x8_8x8x1_2x1_intrawave_v3,380.78,79.5,0.0
gfx942,80,16384,7168,16384,torch.float8_e4m3fnuz,ck,85,0,9679.208,a8w8_bpreshuffle_256x64x128x128_16x16_16x16_8x32x1_8x32x1_1x32x1x8_8x8x1_2x1_intrawave_v3,0.0,0.0,0.0
gfx942,80,16384,7168,18432,torch.float8_e4m3fnuz,ck,85,0,10922.6859,a8w8_bpreshuffle_256x64x128x128_16x16_16x16_8x32x1_8x32x1_1x32x1x8_8x8x1_2x1_intrawave_v3,0.0,0.0,0.0
gfx942,80,20480,7168,256,torch.float8_e4m3fnuz,ck,71,0,381.5807,a8w8_bpreshuffle_256x128x128x64_16x16_16x16_4x64x1_4x64x1_1x32x1x8_8x8x1_2x1_intrawave_v3,1969.75,787.98,0.0
gfx942,80,20480,7168,2048,torch.float8_e4m3fnuz,ck,71,0,1639.9077,a8w8_bpreshuffle_256x128x128x64_16x16_16x16_4x64x1_4x64x1_1x32x1x8_8x8x1_2x1_intrawave_v3,3666.64,213.56,0.0
gfx942,80,20480,7168,2304,torch.float8_e4m3fnuz,ck,71,0,1805.4245,a8w8_bpreshuffle_256x128x128x64_16x16_16x16_4x64x1_4x64x1_1x32x1x8_8x8x1_2x1_intrawave_v3,3746.8,197.9,0.0
gfx942,80,32768,7168,256,torch.float8_e4m3fnuz,ck,71,0,600.9077,a8w8_bpreshuffle_256x128x128x64_16x16_16x16_4x64x1_4x64x1_1x32x1x8_8x8x1_2x1_intrawave_v3,2001.29,798.77,0.0
gfx942,80,32768,7168,512,torch.float8_e4m3fnuz,ck,71,0,1096.744,a8w8_bpreshuffle_256x128x128x64_16x16_16x16_4x64x1_4x64x1_1x32x1x8_8x8x1_2x1_intrawave_v3,219.3,446.97,0.0
gfx942,80,32768,7168,1024,torch.float8_e4m3fnuz,ck,71,0,1682.4154,a8w8_bpreshuffle_256x128x128x64_16x16_16x16_4x64x1_4x64x1_1x32x1x8_8x8x1_2x1_intrawave_v3,285.92,303.53,0.0
gfx942,80,32768,7168,2048,torch.float8_e4m3fnuz,ck,72,0,2704.1764,a8w8_bpreshuffle_256x64x256x64_16x16_16x16_4x64x1_4x64x1_1x16x1x16_8x8x1_1x2_intrawave_v1,0.0,0.0,0.0
gfx942,80,32768,7168,2304,torch.float8_e4m3fnuz,ck,71,0,2907.7206,a8w8_bpreshuffle_256x128x128x64_16x16_16x16_4x64x1_4x64x1_1x32x1x8_8x8x1_2x1_intrawave_v3,3722.27,193.2,0.0
gfx942,80,32768,7168,4096,torch.float8_e4m3fnuz,ck,71,0,5253.8807,a8w8_bpreshuffle_256x128x128x64_16x16_16x16_4x64x1_4x64x1_1x32x1x8_8x8x1_2x1_intrawave_v3,366.23,120.55,0.0
gfx942,80,32768,7168,4608,torch.float8_e4m3fnuz,ck,71,0,5865.1077,a8w8_bpreshuffle_256x128x128x64_16x16_16x16_4x64x1_4x64x1_1x32x1x8_8x8x1_2x1_intrawave_v3,369.07,111.47,0.0
gfx942,80,32768,7168,8192,torch.float8_e4m3fnuz,ck,71,0,10111.3215,a8w8_bpreshuffle_256x128x128x64_16x16_16x16_4x64x1_4x64x1_1x32x1x8_8x8x1_2x1_intrawave_v3,380.59,78.81,0.0
gfx942,80,32768,7168,9216,torch.float8_e4m3fnuz,ck,85,0,11337.9808,a8w8_bpreshuffle_256x64x128x128_16x16_16x16_8x32x1_8x32x1_1x32x1x8_8x8x1_2x1_intrawave_v3,381.84,73.89,0.0
gfx942,80,32768,7168,16384,torch.float8_e4m3fnuz,ck,85,0,19294.1288,a8w8_bpreshuffle_256x64x128x128_16x16_16x16_8x32x1_8x32x1_1x32x1x8_8x8x1_2x1_intrawave_v3,0.0,0.0,0.0
gfx942,80,32768,7168,18432,torch.float8_e4m3fnuz,ck,85,0,21856.5731,a8w8_bpreshuffle_256x64x128x128_16x16_16x16_8x32x1_8x32x1_1x32x1x8_8x8x1_2x1_intrawave_v3,0.0,0.0,0.0
gfx942,80,65536,7168,256,torch.float8_e4m3fnuz,ck,71,0,1212.7558,a8w8_bpreshuffle_256x128x128x64_16x16_16x16_4x64x1_4x64x1_1x32x1x8_8x8x1_2x1_intrawave_v3,0.0,0.0,0.0
gfx942,80,65536,7168,512,torch.float8_e4m3fnuz,ck,71,0,2167.8734,a8w8_bpreshuffle_256x128x128x64_16x16_16x16_4x64x1_4x64x1_1x32x1x8_8x8x1_2x1_intrawave_v3,221.89,450.56,0.0
gfx942,80,65536,7168,1024,torch.float8_e4m3fnuz,ck,71,0,3378.6011,a8w8_bpreshuffle_256x128x128x64_16x16_16x16_4x64x1_4x64x1_1x32x1x8_8x8x1_2x1_intrawave_v3,284.75,300.12,0.0
gfx942,80,65536,7168,2048,torch.float8_e4m3fnuz,ck,71,0,5287.9696,a8w8_bpreshuffle_256x128x128x64_16x16_16x16_4x64x1_4x64x1_1x32x1x8_8x8x1_2x1_intrawave_v3,0.0,0.0,0.0
gfx942,80,65536,7168,2304,torch.float8_e4m3fnuz,ck,71,0,5871.5636,a8w8_bpreshuffle_256x128x128x64_16x16_16x16_4x64x1_4x64x1_1x32x1x8_8x8x1_2x1_intrawave_v3,0.0,0.0,0.0
gfx942,80,65536,7168,4096,torch.float8_e4m3fnuz,ck,71,0,10540.0481,a8w8_bpreshuffle_256x128x128x64_16x16_16x16_4x64x1_4x64x1_1x32x1x8_8x8x1_2x1_intrawave_v3,365.11,117.39,0.0
gfx942,80,65536,7168,4608,torch.float8_e4m3fnuz,ck,71,0,11720.6642,a8w8_bpreshuffle_256x128x128x64_16x16_16x16_4x64x1_4x64x1_1x32x1x8_8x8x1_2x1_intrawave_v3,369.38,108.74,0.0
gfx942,80,65536,7168,8192,torch.float8_e4m3fnuz,ck,85,0,20110.6143,a8w8_bpreshuffle_256x64x128x128_16x16_16x16_8x32x1_8x32x1_1x32x1x8_8x8x1_2x1_intrawave_v3,382.71,76.33,0.0
gfx942,80,65536,7168,9216,torch.float8_e4m3fnuz,ck,85,0,22625.9524,a8w8_bpreshuffle_256x64x128x128_16x16_16x16_8x32x1_8x32x1_1x32x1x8_8x8x1_2x1_intrawave_v3,382.69,71.14,0.0
gfx942,80,65536,7168,16384,torch.float8_e4m3fnuz,ck,85,0,38748.1812,a8w8_bpreshuffle_256x64x128x128_16x16_16x16_8x32x1_8x32x1_1x32x1x8_8x8x1_2x1_intrawave_v3,0.0,0.0,0.0
gfx942,80,65536,7168,18432,torch.float8_e4m3fnuz,ck,85,0,43467.0784,a8w8_bpreshuffle_256x64x128x128_16x16_16x16_8x32x1_8x32x1_1x32x1x8_8x8x1_2x1_intrawave_v3,0.0,0.0,0.0
gfx942,80,98304,7168,256,torch.float8_e4m3fnuz,ck,72,0,1997.5301,a8w8_bpreshuffle_256x64x256x64_16x16_16x16_4x64x1_4x64x1_1x16x1x16_8x8x1_1x2_intrawave_v1,0.0,0.0,0.0
gfx942,80,98304,7168,512,torch.float8_e4m3fnuz,ck,71,0,3241.0898,a8w8_bpreshuffle_256x128x128x64_16x16_16x16_4x64x1_4x64x1_1x32x1x8_8x8x1_2x1_intrawave_v3,222.63,451.48,0.0
gfx942,80,98304,7168,1024,torch.float8_e4m3fnuz,ck,71,0,5048.0903,a8w8_bpreshuffle_256x128x128x64_16x16_16x16_4x64x1_4x64x1_1x32x1x8_8x8x1_2x1_intrawave_v3,285.87,300.57,0.0
gfx942,80,98304,7168,2048,torch.float8_e4m3fnuz,ck,72,0,8086.5215,a8w8_bpreshuffle_256x64x256x64_16x16_16x16_4x64x1_4x64x1_1x16x1x16_8x8x1_1x2_intrawave_v1,0.0,0.0,0.0
gfx942,80,98304,7168,2304,torch.float8_e4m3fnuz,ck,71,0,8879.3992,a8w8_bpreshuffle_256x128x128x64_16x16_16x16_4x64x1_4x64x1_1x32x1x8_8x8x1_2x1_intrawave_v3,0.0,0.0,0.0
gfx942,80,98304,7168,4096,torch.float8_e4m3fnuz,ck,71,0,15801.8859,a8w8_bpreshuffle_256x128x128x64_16x16_16x16_4x64x1_4x64x1_1x32x1x8_8x8x1_2x1_intrawave_v3,365.3,116.52,0.0
gfx942,80,98304,7168,4608,torch.float8_e4m3fnuz,ck,71,0,17582.8246,a8w8_bpreshuffle_256x128x128x64_16x16_16x16_4x64x1_4x64x1_1x32x1x8_8x8x1_2x1_intrawave_v3,369.34,107.79,0.0
gfx942,80,98304,7168,8192,torch.float8_e4m3fnuz,ck,102,0,29902.9106,a8w8_bpreshuffle_256x96x256x128_16x16_16x16_8x32x1_8x32x1_1x32x1x8_8x8x1_2x1_intrawave_v3,386.08,76.02,0.0
gfx942,80,98304,7168,9216,torch.float8_e4m3fnuz,ck,102,0,33489.9388,a8w8_bpreshuffle_256x96x256x128_16x16_16x16_8x32x1_8x32x1_1x32x1x8_8x8x1_2x1_intrawave_v3,387.82,71.11,0.0
gfx942,80,98304,7168,16384,torch.float8_e4m3fnuz,ck,102,0,57025.1637,a8w8_bpreshuffle_256x96x256x128_16x16_16x16_8x32x1_8x32x1_1x32x1x8_8x8x1_2x1_intrawave_v3,0.0,0.0,0.0
gfx942,80,98304,7168,18432,torch.float8_e4m3fnuz,ck,102,0,63990.1906,a8w8_bpreshuffle_256x96x256x128_16x16_16x16_8x32x1_8x32x1_1x32x1x8_8x8x1_2x1_intrawave_v3,0.0,0.0,0.0
gfx942,80,131072,7168,256,torch.float8_e4m3fnuz,ck,71,0,2444.3347,a8w8_bpreshuffle_256x128x128x64_16x16_16x16_4x64x1_4x64x1_1x32x1x8_8x8x1_2x1_intrawave_v3,0.0,0.0,0.0
gfx942,80,131072,7168,2048,torch.float8_e4m3fnuz,ck,71,0,10519.7293,a8w8_bpreshuffle_256x128x128x64_16x16_16x16_4x64x1_4x64x1_1x32x1x8_8x8x1_2x1_intrawave_v3,0.0,0.0,0.0
gfx942,80,131072,7168,2304,torch.float8_e4m3fnuz,ck,71,0,11621.1373,a8w8_bpreshuffle_256x128x128x64_16x16_16x16_4x64x1_4x64x1_1x32x1x8_8x8x1_2x1_intrawave_v3,0.0,0.0,0.0
gfx942,80,131072,7168,8192,torch.float8_e4m3fnuz,ck,85,0,40106.8483,a8w8_bpreshuffle_256x64x128x128_16x16_16x16_8x32x1_8x32x1_1x32x1x8_8x8x1_2x1_intrawave_v3,383.8,75.09,0.0
gfx942,80,131072,7168,16384,torch.float8_e4m3fnuz,ck,85,0,77358.0635,a8w8_bpreshuffle_256x64x128x128_16x16_16x16_8x32x1_8x32x1_1x32x1x8_8x8x1_2x1_intrawave_v3,0.0,0.0,0.0
gfx942,80,131072,7168,18432,torch.float8_e4m3fnuz,ck,85,0,87126.4572,a8w8_bpreshuffle_256x64x128x128_16x16_16x16_8x32x1_8x32x1_1x32x1x8_8x8x1_2x1_intrawave_v3,0.0,0.0,0.0
gfx942,80,1,8192,512,torch.float8_e4m3fnuz,ck,9,0,5.7689,a8w8_bpreshuffle_128x16x32x128_16x16_16x16_8x16x1_8x16x1_1x16x1x8_4x4x1_1x1_intrawave_v1,1.45,729.98,0.0
gfx942,80,1,8192,1024,torch.float8_e4m3fnuz,ck,15,0,6.4482,a8w8_bpreshuffle_256x16x64x256_16x16_16x16_16x16x1_16x16x1_1x16x1x16_4x4x1_1x1_intrawave_v1,26.02,1303.62,0.0
gfx942,80,1,8192,1536,torch.float8_e4m3fnuz,ck,11,0,7.6538,a8w8_bpreshuffle_256x16x64x512_16x16_16x16_32x8x1_32x8x1_1x16x1x16_4x4x1_1x1_intrawave_v1,0.0,0.0,0.0
gfx942,80,2,8192,512,torch.float8_e4m3fnuz,ck,9,0,5.8077,a8w8_bpreshuffle_128x16x32x128_16x16_16x16_8x16x1_8x16x1_1x16x1x8_4x4x1_1x1_intrawave_v1,2.89,728.02,0.0
gfx942,80,2,8192,1536,torch.float8_e4m3fnuz,ck,11,0,7.5144,a8w8_bpreshuffle_256x16x64x512_16x16_16x16_32x8x1_32x8x1_1x16x1x16_4x4x1_1x1_intrawave_v1,6.7,1679.28,0.0
gfx942,80,4,8192,512,torch.float8_e4m3fnuz,ck,9,0,5.8024,a8w8_bpreshuffle_128x16x32x128_16x16_16x16_8x16x1_8x16x1_1x16x1x8_4x4x1_1x1_intrawave_v1,5.78,734.5,0.0
gfx942,80,4,8192,1536,torch.float8_e4m3fnuz,ck,6,0,7.6354,a8w8_bpreshuffle_256x16x128x512_16x16_16x16_32x8x1_32x8x1_1x16x1x16_8x8x1_1x2_intrawave_v1,13.18,1657.36,0.0
gfx942,80,8,8192,512,torch.float8_e4m3fnuz,ck,9,0,5.8225,a8w8_bpreshuffle_128x16x32x128_16x16_16x16_8x16x1_8x16x1_1x16x1x8_4x4x1_1x1_intrawave_v1,11.53,743.58,0.0
gfx942,80,8,8192,1536,torch.float8_e4m3fnuz,ck,108,0,7.9074,a8w8_bpreshuffle_256x16x64x256_16x16_16x16_16x16x1_16x16x1_1x16x1x16_4x4x1_1x1_intrawave_v1,25.46,1609.41,0.0
gfx942,80,16,8192,512,torch.float8_e4m3fnuz,ck,9,0,5.7209,a8w8_bpreshuffle_128x16x32x128_16x16_16x16_8x16x1_8x16x1_1x16x1x8_4x4x1_1x1_intrawave_v1,23.46,780.41,0.0
gfx942,80,16,8192,1536,torch.float8_e4m3fnuz,ck,108,0,7.8973,a8w8_bpreshuffle_256x16x64x256_16x16_16x16_16x16x1_16x16x1_1x16x1x16_4x4x1_1x1_intrawave_v1,50.99,1629.62,0.0
gfx942,80,32,8192,512,torch.float8_e4m3fnuz,ck,76,0,6.5249,a8w8_bpreshuffle_256x32x64x128_16x16_16x16_8x32x1_8x32x1_1x32x1x8_8x8x1_2x1_intrawave_v1,41.14,725.68,0.0
gfx942,80,32,8192,1024,torch.float8_e4m3fnuz,ck,119,0,7.4863,a8w8_bpreshuffle_256x32x128x256_16x16_16x16_16x16x1_16x16x1_1x16x1x16_8x8x1_1x2_intrawave_v1,717.14,1194.94,0.0
gfx942,80,32,8192,1536,torch.float8_e4m3fnuz,ck,112,0,9.686,a8w8_bpreshuffle_256x32x64x256_16x16_16x16_16x16x1_16x16x1_1x32x1x8_8x8x1_2x1_intrawave_v1,83.14,1358.29,0.0
gfx942,80,64,8192,512,torch.float8_e4m3fnuz,ck,76,0,8.7017,a8w8_bpreshuffle_256x32x64x128_16x16_16x16_8x32x1_8x32x1_1x32x1x8_8x8x1_2x1_intrawave_v1,61.7,606.28,0.0
gfx942,80,64,8192,1024,torch.float8_e4m3fnuz,ck,114,0,10.9842,a8w8_bpreshuffle_256x64x64x256_16x16_16x16_16x16x1_16x16x1_1x32x1x8_8x8x1_2x1_intrawave_v3,977.53,865.13,0.0
gfx942,80,64,8192,1536,torch.float8_e4m3fnuz,ck,114,0,12.7978,a8w8_bpreshuffle_256x64x64x256_16x16_16x16_16x16x1_16x16x1_1x32x1x8_8x8x1_2x1_intrawave_v3,0.0,0.0,0.0
gfx942,80,96,8192,512,torch.float8_e4m3fnuz,ck,76,0,9.814,a8w8_bpreshuffle_256x32x64x128_16x16_16x16_8x32x1_8x32x1_1x32x1x8_8x8x1_2x1_intrawave_v1,82.06,592.66,0.0
gfx942,80,96,8192,1536,torch.float8_e4m3fnuz,ck,120,0,16.253,a8w8_bpreshuffle_256x48x128x256_16x16_16x16_16x16x1_16x16x1_1x16x1x16_8x8x1_1x2_intrawave_v1,0.0,0.0,0.0
gfx942,80,128,8192,512,torch.float8_e4m3fnuz,ck,76,0,11.8488,a8w8_bpreshuffle_256x32x64x128_16x16_16x16_8x32x1_8x32x1_1x32x1x8_8x8x1_2x1_intrawave_v1,90.62,536.51,0.0
gfx942,80,128,8192,1024,torch.float8_e4m3fnuz,ck,121,0,14.9703,a8w8_bpreshuffle_256x64x128x256_16x16_16x16_16x16x1_16x16x1_1x16x1x16_8x8x1_1x2_intrawave_v3,1434.5,709.19,0.0
gfx942,80,128,8192,1536,torch.float8_e4m3fnuz,ck,121,0,19.1559,a8w8_bpreshuffle_256x64x128x256_16x16_16x16_16x16x1_16x16x1_1x16x1x16_8x8x1_1x2_intrawave_v3,0.0,0.0,0.0
gfx942,80,160,8192,512,torch.float8_e4m3fnuz,ck,84,0,12.6363,a8w8_bpreshuffle_256x32x128x128_16x16_16x16_8x32x1_8x32x1_1x32x1x8_8x8x1_2x1_intrawave_v1,106.22,545.86,0.0
gfx942,80,160,8192,1536,torch.float8_e4m3fnuz,ck,100,0,21.719,a8w8_bpreshuffle_256x32x256x128_16x16_16x16_8x32x1_8x32x1_1x32x1x8_8x8x1_2x1_intrawave_v1,0.0,0.0,0.0
gfx942,80,192,8192,512,torch.float8_e4m3fnuz,ck,84,0,14.7407,a8w8_bpreshuffle_256x32x128x128_16x16_16x16_8x32x1_8x32x1_1x32x1x8_8x8x1_2x1_intrawave_v1,109.26,504.61,0.0
gfx942,80,192,8192,1024,torch.float8_e4m3fnuz,ck,85,0,18.7963,a8w8_bpreshuffle_256x64x128x128_16x16_16x16_8x32x1_8x32x1_1x32x1x8_8x8x1_2x1_intrawave_v3,1713.76,624.11,0.0
gfx942,80,192,8192,1536,torch.float8_e4m3fnuz,ck,86,0,24.7435,a8w8_bpreshuffle_256x96x128x128_16x16_16x16_8x32x1_8x32x1_1x32x1x8_8x8x1_2x1_intrawave_v3,0.0,0.0,0.0
gfx942,80,224,8192,512,torch.float8_e4m3fnuz,ck,76,0,16.6705,a8w8_bpreshuffle_256x32x64x128_16x16_16x16_8x32x1_8x32x1_1x32x1x8_8x8x1_2x1_intrawave_v1,112.72,478.63,0.0
gfx942,80,224,8192,1536,torch.float8_e4m3fnuz,ck,100,0,28.8459,a8w8_bpreshuffle_256x32x256x128_16x16_16x16_8x32x1_8x32x1_1x32x1x8_8x8x1_2x1_intrawave_v1,0.0,0.0,0.0
gfx942,80,256,8192,512,torch.float8_e4m3fnuz,ck,76,0,18.1586,a8w8_bpreshuffle_256x32x64x128_16x16_16x16_8x32x1_8x32x1_1x32x1x8_8x8x1_2x1_intrawave_v1,118.26,469.18,0.0
gfx942,80,256,8192,1024,torch.float8_e4m3fnuz,ck,70,0,23.9267,a8w8_bpreshuffle_256x128x128x128_16x16_16x16_8x32x1_8x32x1_1x32x1x8_8x8x1_2x1_intrawave_v3,1795.05,536.85,0.0
gfx942,80,256,8192,1536,torch.float8_e4m3fnuz,ck,85,0,30.3059,a8w8_bpreshuffle_256x64x128x128_16x16_16x16_8x32x1_8x32x1_1x32x1x8_8x8x1_2x1_intrawave_v3,0.0,0.0,0.0
gfx942,80,288,8192,512,torch.float8_e4m3fnuz,ck,85,0,19.4782,a8w8_bpreshuffle_256x64x128x128_16x16_16x16_8x32x1_8x32x1_1x32x1x8_8x8x1_2x1_intrawave_v3,124.03,465.15,0.0
gfx942,80,288,8192,1536,torch.float8_e4m3fnuz,ck,85,0,32.0963,a8w8_bpreshuffle_256x64x128x128_16x16_16x16_8x32x1_8x32x1_1x32x1x8_8x8x1_2x1_intrawave_v3,0.0,0.0,0.0
gfx942,80,320,8192,512,torch.float8_e4m3fnuz,ck,85,0,19.6127,a8w8_bpreshuffle_256x64x128x128_16x16_16x16_8x32x1_8x32x1_1x32x1x8_8x8x1_2x1_intrawave_v3,136.87,489.53,0.0
gfx942,80,320,8192,1024,torch.float8_e4m3fnuz,ck,85,0,24.7583,a8w8_bpreshuffle_256x64x128x128_16x16_16x16_8x32x1_8x32x1_1x32x1x8_8x8x1_2x1_intrawave_v3,2168.45,563.82,0.0
gfx942,80,320,8192,1536,torch.float8_e4m3fnuz,ck,101,0,32.6299,a8w8_bpreshuffle_256x64x256x128_16x16_16x16_8x32x1_8x32x1_1x32x1x8_8x8x1_2x1_intrawave_v3,0.0,0.0,0.0
gfx942,80,352,8192,512,torch.float8_e4m3fnuz,ck,84,0,22.5512,a8w8_bpreshuffle_256x32x128x128_16x16_16x16_8x32x1_8x32x1_1x32x1x8_8x8x1_2x1_intrawave_v1,130.94,449.72,0.0
gfx942,80,352,8192,1536,torch.float8_e4m3fnuz,ck,85,0,38.7583,a8w8_bpreshuffle_256x64x128x128_16x16_16x16_8x32x1_8x32x1_1x32x1x8_8x8x1_2x1_intrawave_v3,0.0,0.0,0.0
gfx942,80,384,8192,512,torch.float8_e4m3fnuz,ck,84,0,23.7469,a8w8_bpreshuffle_256x32x128x128_16x16_16x16_8x32x1_8x32x1_1x32x1x8_8x8x1_2x1_intrawave_v1,135.65,449.84,0.0
gfx942,80,384,8192,1536,torch.float8_e4m3fnuz,ck,85,0,38.4623,a8w8_bpreshuffle_256x64x128x128_16x16_16x16_8x32x1_8x32x1_1x32x1x8_8x8x1_2x1_intrawave_v3,0.0,0.0,0.0
gfx942,80,416,8192,512,torch.float8_e4m3fnuz,ck,84,0,25.8591,a8w8_bpreshuffle_256x32x128x128_16x16_16x16_8x32x1_8x32x1_1x32x1x8_8x8x1_2x1_intrawave_v1,134.95,434.01,0.0
gfx942,80,416,8192,1536,torch.float8_e4m3fnuz,ck,72,0,43.8675,a8w8_bpreshuffle_256x64x256x64_16x16_16x16_4x64x1_4x64x1_1x16x1x16_8x8x1_1x2_intrawave_v1,0.0,0.0,0.0
gfx942,80,448,8192,512,torch.float8_e4m3fnuz,ck,72,0,26.0849,a8w8_bpreshuffle_256x64x256x64_16x16_16x16_4x64x1_4x64x1_1x16x1x16_8x8x1_1x2_intrawave_v1,144.07,450.98,0.0
gfx942,80,448,8192,1536,torch.float8_e4m3fnuz,ck,72,0,43.8247,a8w8_bpreshuffle_256x64x256x64_16x16_16x16_4x64x1_4x64x1_1x16x1x16_8x8x1_1x2_intrawave_v1,0.0,0.0,0.0
gfx942,80,480,8192,512,torch.float8_e4m3fnuz,ck,102,0,28.9604,a8w8_bpreshuffle_256x96x256x128_16x16_16x16_8x32x1_8x32x1_1x32x1x8_8x8x1_2x1_intrawave_v3,139.04,424.87,0.0
gfx942,80,480,8192,1536,torch.float8_e4m3fnuz,ck,102,0,43.0079,a8w8_bpreshuffle_256x96x256x128_16x16_16x16_8x32x1_8x32x1_1x32x1x8_8x8x1_2x1_intrawave_v3,0.0,0.0,0.0
gfx942,80,512,8192,512,torch.float8_e4m3fnuz,ck,85,0,29.9571,a8w8_bpreshuffle_256x64x128x128_16x16_16x16_8x32x1_8x32x1_1x32x1x8_8x8x1_2x1_intrawave_v3,143.37,428.78,0.0
gfx942,80,512,8192,1024,torch.float8_e4m3fnuz,ck,85,0,37.882,a8w8_bpreshuffle_256x64x128x128_16x16_16x16_8x32x1_8x32x1_1x32x1x8_8x8x1_2x1_intrawave_v3,2267.55,456.72,0.0
gfx942,80,512,8192,1536,torch.float8_e4m3fnuz,ck,85,0,50.0471,a8w8_bpreshuffle_256x64x128x128_16x16_16x16_8x32x1_8x32x1_1x32x1x8_8x8x1_2x1_intrawave_v3,0.0,0.0,0.0
gfx942,80,1024,8192,512,torch.float8_e4m3fnuz,ck,85,0,50.608,a8w8_bpreshuffle_256x64x128x128_16x16_16x16_8x32x1_8x32x1_1x32x1x8_8x8x1_2x1_intrawave_v3,169.73,424.75,0.0
gfx942,80,1024,8192,1024,torch.float8_e4m3fnuz,ck,71,0,67.0889,a8w8_bpreshuffle_256x128x128x64_16x16_16x16_4x64x1_4x64x1_1x32x1x8_8x8x1_2x1_intrawave_v3,2560.76,390.74,0.0
gfx942,80,1024,8192,1536,torch.float8_e4m3fnuz,ck,71,0,90.3089,a8w8_bpreshuffle_256x128x128x64_16x16_16x16_4x64x1_4x64x1_1x32x1x8_8x8x1_2x1_intrawave_v3,0.0,0.0,0.0
gfx942,80,2048,8192,512,torch.float8_e4m3fnuz,ck,71,0,91.3476,a8w8_bpreshuffle_256x128x128x64_16x16_16x16_4x64x1_4x64x1_1x32x1x8_8x8x1_2x1_intrawave_v3,188.07,424.72,0.0
gfx942,80,2048,8192,1024,torch.float8_e4m3fnuz,ck,71,0,120.4715,a8w8_bpreshuffle_256x128x128x64_16x16_16x16_4x64x1_4x64x1_1x32x1x8_8x8x1_2x1_intrawave_v3,2852.11,365.57,0.0
gfx942,80,2048,8192,1536,torch.float8_e4m3fnuz,ck,71,0,160.9323,a8w8_bpreshuffle_256x128x128x64_16x16_16x16_4x64x1_4x64x1_1x32x1x8_8x8x1_2x1_intrawave_v3,0.0,0.0,0.0
gfx942,80,4096,8192,512,torch.float8_e4m3fnuz,ck,71,0,171.3964,a8w8_bpreshuffle_256x128x128x64_16x16_16x16_4x64x1_4x64x1_1x32x1x8_8x8x1_2x1_intrawave_v3,200.47,428.25,0.0
gfx942,80,4096,8192,1024,torch.float8_e4m3fnuz,ck,71,0,227.2969,a8w8_bpreshuffle_256x128x128x64_16x16_16x16_4x64x1_4x64x1_1x32x1x8_8x8x1_2x1_intrawave_v3,3023.34,350.61,0.0
gfx942,80,4096,8192,1536,torch.float8_e4m3fnuz,ck,71,0,307.3715,a8w8_bpreshuffle_256x128x128x64_16x16_16x16_4x64x1_4x64x1_1x32x1x8_8x8x1_2x1_intrawave_v3,0.0,0.0,0.0
gfx942,80,6144,8192,512,torch.float8_e4m3fnuz,ck,71,0,246.4712,a8w8_bpreshuffle_256x128x128x64_16x16_16x16_4x64x1_4x64x1_1x32x1x8_8x8x1_2x1_intrawave_v3,209.11,438.2,0.0
gfx942,80,6144,8192,1536,torch.float8_e4m3fnuz,ck,71,0,455.0275,a8w8_bpreshuffle_256x128x128x64_16x16_16x16_4x64x1_4x64x1_1x32x1x8_8x8x1_2x1_intrawave_v3,0.0,0.0,0.0
gfx942,80,8192,8192,512,torch.float8_e4m3fnuz,ck,71,0,326.6613,a8w8_bpreshuffle_256x128x128x64_16x16_16x16_4x64x1_4x64x1_1x32x1x8_8x8x1_2x1_intrawave_v3,210.37,436.56,0.0
gfx942,80,8192,8192,1024,torch.float8_e4m3fnuz,ck,71,0,434.801,a8w8_bpreshuffle_256x128x128x64_16x16_16x16_4x64x1_4x64x1_1x32x1x8_8x8x1_2x1_intrawave_v3,3160.96,347.27,0.0
gfx942,80,8192,8192,1536,torch.float8_e4m3fnuz,ck,72,0,621.3308,a8w8_bpreshuffle_256x64x256x64_16x16_16x16_4x64x1_4x64x1_1x16x1x16_8x8x1_1x2_intrawave_v1,0.0,0.0,0.0
gfx942,80,10240,8192,512,torch.float8_e4m3fnuz,ck,71,0,399.9462,a8w8_bpreshuffle_256x128x128x64_16x16_16x16_4x64x1_4x64x1_1x32x1x8_8x8x1_2x1_intrawave_v3,214.78,443.08,0.0
gfx942,80,10240,8192,1536,torch.float8_e4m3fnuz,ck,71,0,754.6592,a8w8_bpreshuffle_256x128x128x64_16x16_16x16_4x64x1_4x64x1_1x32x1x8_8x8x1_2x1_intrawave_v3,0.0,0.0,0.0
gfx942,80,12288,8192,512,torch.float8_e4m3fnuz,ck,71,0,479.0689,a8w8_bpreshuffle_256x128x128x64_16x16_16x16_4x64x1_4x64x1_1x32x1x8_8x8x1_2x1_intrawave_v3,215.17,442.13,0.0
gfx942,80,12288,8192,1536,torch.float8_e4m3fnuz,ck,102,0,912.1361,a8w8_bpreshuffle_256x96x256x128_16x16_16x16_8x32x1_8x32x1_1x32x1x8_8x8x1_2x1_intrawave_v3,0.0,0.0,0.0
gfx942,80,14336,8192,512,torch.float8_e4m3fnuz,ck,71,0,553.8975,a8w8_bpreshuffle_256x128x128x64_16x16_16x16_4x64x1_4x64x1_1x32x1x8_8x8x1_2x1_intrawave_v3,217.11,444.88,0.0
gfx942,80,14336,8192,1536,torch.float8_e4m3fnuz,ck,71,0,1039.5469,a8w8_bpreshuffle_256x128x128x64_16x16_16x16_4x64x1_4x64x1_1x32x1x8_8x8x1_2x1_intrawave_v3,0.0,0.0,0.0
gfx942,80,16384,8192,512,torch.float8_e4m3fnuz,ck,71,0,634.9591,a8w8_bpreshuffle_256x128x128x64_16x16_16x16_4x64x1_4x64x1_1x32x1x8_8x8x1_2x1_intrawave_v3,216.45,442.58,0.0
gfx942,80,16384,8192,1024,torch.float8_e4m3fnuz,ck,71,0,849.5169,a8w8_bpreshuffle_256x128x128x64_16x16_16x16_4x64x1_4x64x1_1x32x1x8_8x8x1_2x1_intrawave_v3,3235.7,345.61,0.0
gfx942,80,16384,8192,1536,torch.float8_e4m3fnuz,ck,71,0,1182.4869,a8w8_bpreshuffle_256x128x128x64_16x16_16x16_4x64x1_4x64x1_1x32x1x8_8x8x1_2x1_intrawave_v3,0.0,0.0,0.0
gfx942,80,32768,8192,512,torch.float8_e4m3fnuz,ck,71,0,1248.4259,a8w8_bpreshuffle_256x128x128x64_16x16_16x16_4x64x1_4x64x1_1x32x1x8_8x8x1_2x1_intrawave_v3,220.18,446.84,0.0
gfx942,80,32768,8192,1536,torch.float8_e4m3fnuz,ck,71,0,2344.2068,a8w8_bpreshuffle_256x128x128x64_16x16_16x16_4x64x1_4x64x1_1x32x1x8_8x8x1_2x1_intrawave_v3,0.0,0.0,0.0
gfx942,80,65536,8192,512,torch.float8_e4m3fnuz,ck,71,0,2486.4287,a8w8_bpreshuffle_256x128x128x64_16x16_16x16_4x64x1_4x64x1_1x32x1x8_8x8x1_2x1_intrawave_v3,221.1,447.02,0.0
gfx942,80,65536,8192,1536,torch.float8_e4m3fnuz,ck,71,0,4684.7126,a8w8_bpreshuffle_256x128x128x64_16x16_16x16_4x64x1_4x64x1_1x32x1x8_8x8x1_2x1_intrawave_v3,0.0,0.0,0.0
gfx942,80,98304,8192,512,torch.float8_e4m3fnuz,ck,71,0,3733.0179,a8w8_bpreshuffle_256x128x128x64_16x16_16x16_4x64x1_4x64x1_1x32x1x8_8x8x1_2x1_intrawave_v3,220.9,446.06,0.0
gfx942,80,98304,8192,1536,torch.float8_e4m3fnuz,ck,71,0,7034.6763,a8w8_bpreshuffle_256x128x128x64_16x16_16x16_4x64x1_4x64x1_1x32x1x8_8x8x1_2x1_intrawave_v3,0.0,0.0,0.0
gfx942,80,131072,8192,1536,torch.float8_e4m3fnuz,ck,71,0,9394.7156,a8w8_bpreshuffle_256x128x128x64_16x16_16x16_4x64x1_4x64x1_1x32x1x8_8x8x1_2x1_intrawave_v3,0.0,0.0,0.0
gfx942,80,1,9216,4096,torch.float8_e4m3fnuz,ck,11,0,13.8467,a8w8_bpreshuffle_256x16x64x512_16x16_16x16_32x8x1_32x8x1_1x16x1x16_4x4x1_1x1_intrawave_v1,5.45,2727.82,0.0
gfx942,80,1,9216,7168,torch.float8_e4m3fnuz,ck,5,0,20.4394,a8w8_bpreshuffle_256x16x64x512_16x16_16x16_32x8x1_32x8x1_1x16x1x16_4x4x1_1x1_intrawave_v1,6.46,3233.26,0.0
gfx942,80,2,9216,4096,torch.float8_e4m3fnuz,ck,11,0,13.2579,a8w8_bpreshuffle_256x16x64x512_16x16_16x16_32x8x1_32x8x1_1x16x1x16_4x4x1_1x1_intrawave_v1,11.39,2850.66,0.0
gfx942,80,2,9216,7168,torch.float8_e4m3fnuz,ck,5,0,20.6094,a8w8_bpreshuffle_256x16x64x512_16x16_16x16_32x8x1_32x8x1_1x16x1x16_4x4x1_1x1_intrawave_v1,12.82,3207.83,0.0
gfx942,80,4,9216,4096,torch.float8_e4m3fnuz,ck,5,0,13.3531,a8w8_bpreshuffle_256x16x64x512_16x16_16x16_32x8x1_32x8x1_1x16x1x16_4x4x1_1x1_intrawave_v1,22.62,2833.71,0.0
gfx942,80,4,9216,7168,torch.float8_e4m3fnuz,ck,6,0,20.7042,a8w8_bpreshuffle_256x16x128x512_16x16_16x16_32x8x1_32x8x1_1x16x1x16_8x8x1_1x2_intrawave_v1,25.53,3195.62,0.0
gfx942,80,8,9216,4096,torch.float8_e4m3fnuz,ck,11,0,14.0931,a8w8_bpreshuffle_256x16x64x512_16x16_16x16_32x8x1_32x8x1_1x16x1x16_4x4x1_1x1_intrawave_v1,42.86,2691.31,0.0
gfx942,80,8,9216,7168,torch.float8_e4m3fnuz,ck,6,0,20.7785,a8w8_bpreshuffle_256x16x128x512_16x16_16x16_32x8x1_32x8x1_1x16x1x16_8x8x1_1x2_intrawave_v1,50.87,3189.12,0.0
gfx942,80,16,9216,4096,torch.float8_e4m3fnuz,ck,5,0,14.7532,a8w8_bpreshuffle_256x16x64x512_16x16_16x16_32x8x1_32x8x1_1x16x1x16_4x4x1_1x1_intrawave_v1,81.88,2583.11,0.0
gfx942,80,16,9216,7168,torch.float8_e4m3fnuz,ck,6,0,21.4925,a8w8_bpreshuffle_256x16x128x512_16x16_16x16_32x8x1_32x8x1_1x16x1x16_8x8x1_1x2_intrawave_v1,98.36,3092.7,0.0
gfx942,80,32,9216,4096,torch.float8_e4m3fnuz,ck,119,0,18.4783,a8w8_bpreshuffle_256x32x128x256_16x16_16x16_16x16x1_16x16x1_1x16x1x16_8x8x1_1x2_intrawave_v1,1307.44,2081.88,0.0
gfx942,80,32,9216,7168,torch.float8_e4m3fnuz,ck,119,0,26.6078,a8w8_bpreshuffle_256x32x128x256_16x16_16x16_16x16x1_16x16x1_1x16x1x16_8x8x1_1x2_intrawave_v1,158.9,2513.53,0.0
gfx942,80,64,9216,4096,torch.float8_e4m3fnuz,ck,114,0,25.0703,a8w8_bpreshuffle_256x64x64x256_16x16_16x16_16x16x1_16x16x1_1x32x1x8_8x8x1_2x1_intrawave_v3,1927.32,1563.23,0.0
gfx942,80,64,9216,7168,torch.float8_e4m3fnuz,ck,121,0,39.8294,a8w8_bpreshuffle_256x64x128x256_16x16_16x16_16x16x1_16x16x1_1x16x1x16_8x8x1_1x2_intrawave_v3,212.3,1699.72,0.0
gfx942,80,96,9216,7168,torch.float8_e4m3fnuz,ck,123,0,50.9032,a8w8_bpreshuffle_256x96x128x256_16x16_16x16_16x16x1_16x16x1_1x16x1x16_8x8x1_1x2_intrawave_v3,249.17,1346.04,0.0
gfx942,80,128,9216,4096,torch.float8_e4m3fnuz,ck,121,0,39.1328,a8w8_bpreshuffle_256x64x128x256_16x16_16x16_16x16x1_16x16x1_1x16x1x16_8x8x1_1x2_intrawave_v3,2469.46,1038.32,0.0
gfx942,80,128,9216,7168,torch.float8_e4m3fnuz,ck,121,0,64.3726,a8w8_bpreshuffle_256x64x128x256_16x16_16x16_16x16x1_16x16x1_1x16x1x16_8x8x1_1x2_intrawave_v3,262.71,1077.12,0.0
gfx942,80,160,9216,7168,torch.float8_e4m3fnuz,ck,136,0,75.0573,a8w8_bpreshuffle_256x80x256x256_16x16_16x16_16x16x1_16x16x1_1x16x1x16_8x8x1_1x2_intrawave_v3,281.64,934.7,0.0
gfx942,80,192,9216,7168,torch.float8_e4m3fnuz,ck,86,0,85.7848,a8w8_bpreshuffle_256x96x128x128_16x16_16x16_8x32x1_8x32x1_1x32x1x8_8x8x1_2x1_intrawave_v3,295.71,827.37,0.0
gfx942,80,224,9216,7168,torch.float8_e4m3fnuz,ck,138,0,101.9633,a8w8_bpreshuffle_256x112x256x256_16x16_16x16_16x16x1_16x16x1_1x16x1x16_8x8x1_1x2_intrawave_v3,290.25,704.12,0.0
gfx942,80,256,9216,4096,torch.float8_e4m3fnuz,ck,70,0,64.6741,a8w8_bpreshuffle_256x128x128x128_16x16_16x16_8x32x1_8x32x1_1x32x1x8_8x8x1_2x1_intrawave_v3,2988.42,672.85,0.0
gfx942,80,256,9216,7168,torch.float8_e4m3fnuz,ck,0,0,109.2884,a8w8_bpreshuffle_256x128x128x128_16x16_16x16_8x32x1_8x32x1_1x32x1x8_8x8x1_2x1_intrawave_v3,309.48,664.42,0.0
gfx942,80,288,9216,7168,torch.float8_e4m3fnuz,ck,94,0,120.3302,a8w8_bpreshuffle_256x96x192x128_16x16_16x16_8x32x1_8x32x1_1x32x1x8_8x8x1_2x1_intrawave_v3,316.22,610.26,0.0
gfx942,80,320,9216,7168,torch.float8_e4m3fnuz,ck,93,0,125.6795,a8w8_bpreshuffle_256x64x192x128_16x16_16x16_8x32x1_8x32x1_1x32x1x8_8x8x1_2x1_intrawave_v3,336.4,590.81,0.0
gfx942,80,352,9216,7168,torch.float8_e4m3fnuz,ck,102,0,159.5041,a8w8_bpreshuffle_256x96x256x128_16x16_16x16_8x32x1_8x32x1_1x32x1x8_8x8x1_2x1_intrawave_v3,291.57,470.66,0.0
gfx942,80,384,9216,7168,torch.float8_e4m3fnuz,ck,102,0,155.4479,a8w8_bpreshuffle_256x96x256x128_16x16_16x16_8x32x1_8x32x1_1x32x1x8_8x8x1_2x1_intrawave_v3,326.37,488.21,0.0
gfx942,80,416,9216,7168,torch.float8_e4m3fnuz,ck,85,0,192.6714,a8w8_bpreshuffle_256x64x128x128_16x16_16x16_8x32x1_8x32x1_1x32x1x8_8x8x1_2x1_intrawave_v3,285.26,398.14,0.0
gfx942,80,448,9216,7168,torch.float8_e4m3fnuz,ck,85,0,189.2582,a8w8_bpreshuffle_256x64x128x128_16x16_16x16_8x32x1_8x32x1_1x32x1x8_8x8x1_2x1_intrawave_v3,312.75,409.65,0.0
gfx942,80,480,9216,7168,torch.float8_e4m3fnuz,ck,94,0,183.3908,a8w8_bpreshuffle_256x96x192x128_16x16_16x16_8x32x1_8x32x1_1x32x1x8_8x8x1_2x1_intrawave_v3,345.81,427.22,0.0
gfx942,80,512,9216,7168,torch.float8_e4m3fnuz,ck,93,0,197.136,a8w8_bpreshuffle_256x64x192x128_16x16_16x16_8x32x1_8x32x1_1x32x1x8_8x8x1_2x1_intrawave_v3,343.14,401.59,0.0
gfx942,80,1024,9216,4096,torch.float8_e4m3fnuz,ck,93,0,219.0276,a8w8_bpreshuffle_256x64x192x128_16x16_16x16_8x32x1_8x32x1_1x32x1x8_8x8x1_2x1_intrawave_v3,3529.67,277.67,0.0
gfx942,80,1024,9216,7168,torch.float8_e4m3fnuz,ck,93,0,383.3589,a8w8_bpreshuffle_256x64x192x128_16x16_16x16_8x32x1_8x32x1_1x32x1x8_8x8x1_2x1_intrawave_v3,352.91,240.7,0.0
gfx942,80,2048,9216,4096,torch.float8_e4m3fnuz,ck,68,0,425.2314,a8w8_bpreshuffle_256x128x192x128_16x16_16x16_8x32x1_8x32x1_1x32x1x8_8x8x1_2x1_intrawave_v3,3636.11,197.27,0.0
gfx942,80,2048,9216,7168,torch.float8_e4m3fnuz,ck,85,0,734.0056,a8w8_bpreshuffle_256x64x128x128_16x16_16x16_8x32x1_8x32x1_1x32x1x8_8x8x1_2x1_intrawave_v3,368.64,161.43,0.0
gfx942,80,4096,9216,4096,torch.float8_e4m3fnuz,ck,71,0,812.5832,a8w8_bpreshuffle_256x128x128x64_16x16_16x16_4x64x1_4x64x1_1x32x1x8_8x8x1_2x1_intrawave_v3,3805.61,160.01,0.0
gfx942,80,4096,9216,7168,torch.float8_e4m3fnuz,ck,71,0,1429.0113,a8w8_bpreshuffle_256x128x128x64_16x16_16x16_4x64x1_4x64x1_1x32x1x8_8x8x1_2x1_intrawave_v3,378.7,119.61,0.0
gfx942,80,4240,9216,4096,torch.float8_e4m3fnuz,ck,93,0,903.6056,a8w8_bpreshuffle_256x64x192x128_16x16_16x16_8x32x1_8x32x1_1x32x1x8_8x8x1_2x1_intrawave_v3,3542.58,147.48,0.0
gfx942,80,6144,9216,7168,torch.float8_e4m3fnuz,ck,102,0,2153.3558,a8w8_bpreshuffle_256x96x256x128_16x16_16x16_8x32x1_8x32x1_1x32x1x8_8x8x1_2x1_intrawave_v3,376.97,103.72,0.0
gfx942,80,8192,9216,7168,torch.float8_e4m3fnuz,ck,71,0,2870.3304,a8w8_bpreshuffle_256x128x128x64_16x16_16x16_4x64x1_4x64x1_1x32x1x8_8x8x1_2x1_intrawave_v3,377.08,96.08,0.0
gfx942,80,10240,9216,7168,torch.float8_e4m3fnuz,ck,93,0,3582.8927,a8w8_bpreshuffle_256x64x192x128_16x16_16x16_8x32x1_8x32x1_1x32x1x8_8x8x1_2x1_intrawave_v3,377.6,91.6,0.0
gfx942,80,12288,9216,7168,torch.float8_e4m3fnuz,ck,102,0,4297.9231,a8w8_bpreshuffle_256x96x256x128_16x16_16x16_8x32x1_8x32x1_1x32x1x8_8x8x1_2x1_intrawave_v3,377.74,88.56,0.0
gfx942,80,14336,9216,7168,torch.float8_e4m3fnuz,ck,93,0,5014.6828,a8w8_bpreshuffle_256x64x192x128_16x16_16x16_8x32x1_8x32x1_1x32x1x8_8x8x1_2x1_intrawave_v3,377.71,86.36,0.0
gfx942,80,16384,9216,4096,torch.float8_e4m3fnuz,ck,71,0,3218.0651,a8w8_bpreshuffle_256x128x128x64_16x16_16x16_4x64x1_4x64x1_1x32x1x8_8x8x1_2x1_intrawave_v3,3843.77,126.43,0.0
gfx942,80,16384,9216,7168,torch.float8_e4m3fnuz,ck,93,0,5708.7709,a8w8_bpreshuffle_256x64x192x128_16x16_16x16_8x32x1_8x32x1_1x32x1x8_8x8x1_2x1_intrawave_v3,379.18,85.04,0.0
gfx942,80,32768,9216,4096,torch.float8_e4m3fnuz,ck,68,0,6437.3643,a8w8_bpreshuffle_256x128x192x128_16x16_16x16_8x32x1_8x32x1_1x32x1x8_8x8x1_2x1_intrawave_v3,3843.03,120.54,0.0
gfx942,80,32768,9216,7168,torch.float8_e4m3fnuz,ck,85,0,11449.253,a8w8_bpreshuffle_256x64x128x128_16x16_16x16_8x32x1_8x32x1_1x32x1x8_8x8x1_2x1_intrawave_v3,378.13,79.04,0.0
gfx942,80,65536,9216,7168,torch.float8_e4m3fnuz,ck,85,0,22829.8274,a8w8_bpreshuffle_256x64x128x128_16x16_16x16_8x32x1_8x32x1_1x32x1x8_8x8x1_2x1_intrawave_v3,379.27,76.38,0.0
gfx942,80,98304,9216,7168,torch.float8_e4m3fnuz,ck,102,0,34028.5473,a8w8_bpreshuffle_256x96x256x128_16x16_16x16_8x32x1_8x32x1_1x32x1x8_8x8x1_2x1_intrawave_v3,381.68,75.9,0.0
gfx942,80,1,11264,1536,torch.float8_e4m3fnuz,ck,108,0,9.3388,a8w8_bpreshuffle_256x16x64x256_16x16_16x16_16x16x1_16x16x1_1x16x1x16_4x4x1_1x1_intrawave_v1,37.05,1855.22,0.0
gfx942,80,2,11264,1536,torch.float8_e4m3fnuz,ck,15,0,9.4898,a8w8_bpreshuffle_256x16x64x256_16x16_16x16_16x16x1_16x16x1_1x16x1x16_4x4x1_1x1_intrawave_v1,0.0,0.0,0.0
gfx942,80,4,11264,1536,torch.float8_e4m3fnuz,ck,10,0,9.667,a8w8_bpreshuffle_128x16x32x512_16x16_16x16_32x4x1_32x4x1_1x16x1x8_4x4x1_1x1_intrawave_v1,0.0,0.0,0.0
gfx942,80,8,11264,1536,torch.float8_e4m3fnuz,ck,10,0,10.0366,a8w8_bpreshuffle_128x16x32x512_16x16_16x16_32x4x1_32x4x1_1x16x1x8_4x4x1_1x1_intrawave_v1,0.0,0.0,0.0
gfx942,80,16,11264,1536,torch.float8_e4m3fnuz,ck,10,0,9.7876,a8w8_bpreshuffle_128x16x32x512_16x16_16x16_32x4x1_32x4x1_1x16x1x8_4x4x1_1x1_intrawave_v1,565.66,1807.03,0.0
gfx942,80,32,11264,1536,torch.float8_e4m3fnuz,ck,76,0,12.5451,a8w8_bpreshuffle_256x32x64x128_16x16_16x16_8x32x1_8x32x1_1x32x1x8_8x8x1_2x1_intrawave_v1,882.65,1440.53,0.0
gfx942,80,48,11264,1536,torch.float8_e4m3fnuz,ck,113,0,15.2534,a8w8_bpreshuffle_256x48x64x256_16x16_16x16_16x16x1_16x16x1_1x16x1x16_4x4x1_1x1_intrawave_v1,1088.9,1210.0,0.0
gfx942,80,64,11264,1536,torch.float8_e4m3fnuz,ck,112,0,17.4734,a8w8_bpreshuffle_256x32x64x256_16x16_16x16_16x16x1_16x16x1_1x32x1x8_8x8x1_2x1_intrawave_v1,1267.41,1078.3,0.0
gfx942,80,80,11264,1536,torch.float8_e4m3fnuz,ck,100,0,21.6601,a8w8_bpreshuffle_256x32x256x128_16x16_16x16_8x32x1_8x32x1_1x32x1x8_8x8x1_2x1_intrawave_v1,1278.04,887.65,0.0
gfx942,80,96,11264,1536,torch.float8_e4m3fnuz,ck,119,0,21.7177,a8w8_bpreshuffle_256x32x128x256_16x16_16x16_16x16x1_16x16x1_1x16x1x16_8x8x1_1x2_intrawave_v1,1529.58,903.03,0.0
gfx942,80,112,11264,1536,torch.float8_e4m3fnuz,ck,85,0,25.6868,a8w8_bpreshuffle_256x64x128x128_16x16_16x16_8x32x1_8x32x1_1x32x1x8_8x8x1_2x1_intrawave_v3,1508.77,778.48,0.0
gfx942,80,128,11264,1536,torch.float8_e4m3fnuz,ck,85,0,26.4316,a8w8_bpreshuffle_256x64x128x128_16x16_16x16_8x32x1_8x32x1_1x32x1x8_8x8x1_2x1_intrawave_v3,1675.72,771.11,0.0
gfx942,80,160,11264,1536,torch.float8_e4m3fnuz,ck,100,0,30.1239,a8w8_bpreshuffle_256x32x256x128_16x16_16x16_8x32x1_8x32x1_1x32x1x8_8x8x1_2x1_intrawave_v1,0.0,0.0,0.0
gfx942,80,192,11264,1536,torch.float8_e4m3fnuz,ck,85,0,31.3634,a8w8_bpreshuffle_256x64x128x128_16x16_16x16_8x32x1_8x32x1_1x32x1x8_8x8x1_2x1_intrawave_v3,2118.32,698.96,0.0
gfx942,80,224,11264,1536,torch.float8_e4m3fnuz,ck,100,0,37.6656,a8w8_bpreshuffle_256x32x256x128_16x16_16x16_8x32x1_8x32x1_1x32x1x8_8x8x1_2x1_intrawave_v1,0.0,0.0,0.0
gfx942,80,256,11264,1536,torch.float8_e4m3fnuz,ck,85,0,41.1,a8w8_bpreshuffle_256x64x128x128_16x16_16x16_8x32x1_8x32x1_1x32x1x8_8x8x1_2x1_intrawave_v3,2155.32,570.85,0.0
gfx942,80,288,11264,1536,torch.float8_e4m3fnuz,ck,102,0,42.7952,a8w8_bpreshuffle_256x96x256x128_16x16_16x16_8x32x1_8x32x1_1x32x1x8_8x8x1_2x1_intrawave_v3,0.0,0.0,0.0
gfx942,80,320,11264,1536,torch.float8_e4m3fnuz,ck,85,0,45.0808,a8w8_bpreshuffle_256x64x128x128_16x16_16x16_8x32x1_8x32x1_1x32x1x8_8x8x1_2x1_intrawave_v3,0.0,0.0,0.0
gfx942,80,352,11264,1536,torch.float8_e4m3fnuz,ck,85,0,51.422,a8w8_bpreshuffle_256x64x128x128_16x16_16x16_8x32x1_8x32x1_1x32x1x8_8x8x1_2x1_intrawave_v3,0.0,0.0,0.0
gfx942,80,384,11264,1536,torch.float8_e4m3fnuz,ck,85,0,51.3588,a8w8_bpreshuffle_256x64x128x128_16x16_16x16_8x32x1_8x32x1_1x32x1x8_8x8x1_2x1_intrawave_v3,0.0,0.0,0.0
gfx942,80,416,11264,1536,torch.float8_e4m3fnuz,ck,85,0,58.2264,a8w8_bpreshuffle_256x64x128x128_16x16_16x16_8x32x1_8x32x1_1x32x1x8_8x8x1_2x1_intrawave_v3,0.0,0.0,0.0
gfx942,80,448,11264,1536,torch.float8_e4m3fnuz,ck,85,0,57.7888,a8w8_bpreshuffle_256x64x128x128_16x16_16x16_8x32x1_8x32x1_1x32x1x8_8x8x1_2x1_intrawave_v3,0.0,0.0,0.0
gfx942,80,480,11264,1536,torch.float8_e4m3fnuz,ck,102,0,64.1117,a8w8_bpreshuffle_256x96x256x128_16x16_16x16_8x32x1_8x32x1_1x32x1x8_8x8x1_2x1_intrawave_v3,0.0,0.0,0.0
gfx942,80,512,11264,1536,torch.float8_e4m3fnuz,ck,85,0,63.9678,a8w8_bpreshuffle_256x64x128x128_16x16_16x16_8x32x1_8x32x1_1x32x1x8_8x8x1_2x1_intrawave_v3,2769.63,463.08,0.0
gfx942,80,1024,11264,1536,torch.float8_e4m3fnuz,ck,85,0,116.8538,a8w8_bpreshuffle_256x64x128x128_16x16_16x16_8x32x1_8x32x1_1x32x1x8_8x8x1_2x1_intrawave_v3,3032.29,358.94,0.0
gfx942,80,1536,11264,1536,torch.float8_e4m3fnuz,ck,85,0,168.9501,a8w8_bpreshuffle_256x64x128x128_16x16_16x16_8x32x1_8x32x1_1x32x1x8_8x8x1_2x1_intrawave_v3,3145.91,321.18,0.0
gfx942,80,2048,11264,1536,torch.float8_e4m3fnuz,ck,71,0,217.6677,a8w8_bpreshuffle_256x128x128x64_16x16_16x16_4x64x1_4x64x1_1x32x1x8_8x8x1_2x1_intrawave_v3,3255.74,305.9,0.0
gfx942,80,4096,11264,1536,torch.float8_e4m3fnuz,ck,71,0,417.0421,a8w8_bpreshuffle_256x128x128x64_16x16_16x16_4x64x1_4x64x1_1x32x1x8_8x8x1_2x1_intrawave_v3,3398.55,277.83,0.0
gfx942,80,6144,11264,1536,torch.float8_e4m3fnuz,ck,71,0,614.8496,a8w8_bpreshuffle_256x128x128x64_16x16_16x16_4x64x1_4x64x1_1x32x1x8_8x8x1_2x1_intrawave_v3,0.0,0.0,0.0
gfx942,80,8192,11264,1536,torch.float8_e4m3fnuz,ck,71,0,818.2792,a8w8_bpreshuffle_256x128x128x64_16x16_16x16_4x64x1_4x64x1_1x32x1x8_8x8x1_2x1_intrawave_v3,3464.19,262.05,0.0
gfx942,80,10240,11264,1536,torch.float8_e4m3fnuz,ck,71,0,1039.4493,a8w8_bpreshuffle_256x128x128x64_16x16_16x16_4x64x1_4x64x1_1x32x1x8_8x8x1_2x1_intrawave_v3,0.0,0.0,0.0
gfx942,80,12288,11264,1536,torch.float8_e4m3fnuz,ck,71,0,1221.6133,a8w8_bpreshuffle_256x128x128x64_16x16_16x16_4x64x1_4x64x1_1x32x1x8_8x8x1_2x1_intrawave_v3,0.0,0.0,0.0
gfx942,80,14336,11264,1536,torch.float8_e4m3fnuz,ck,71,0,1422.2274,a8w8_bpreshuffle_256x128x128x64_16x16_16x16_4x64x1_4x64x1_1x32x1x8_8x8x1_2x1_intrawave_v3,0.0,0.0,0.0
gfx942,80,16384,11264,1536,torch.float8_e4m3fnuz,ck,72,0,1650.9527,a8w8_bpreshuffle_256x64x256x64_16x16_16x16_4x64x1_4x64x1_1x16x1x16_8x8x1_1x2_intrawave_v1,3433.99,249.29,0.0
gfx942,80,32768,11264,1536,torch.float8_e4m3fnuz,ck,72,0,3296.9348,a8w8_bpreshuffle_256x64x256x64_16x16_16x16_4x64x1_4x64x1_1x16x1x16_8x8x1_1x2_intrawave_v1,3439.17,244.42,0.0
gfx942,80,49152,11264,1536,torch.float8_e4m3fnuz,ck,71,0,4796.016,a8w8_bpreshuffle_256x128x128x64_16x16_16x16_4x64x1_4x64x1_1x32x1x8_8x8x1_2x1_intrawave_v3,3546.29,250.23,0.0
gfx942,80,65536,11264,1536,torch.float8_e4m3fnuz,ck,71,0,6394.7949,a8w8_bpreshuffle_256x128x128x64_16x16_16x16_4x64x1_4x64x1_1x32x1x8_8x8x1_2x1_intrawave_v3,3546.23,249.32,0.0
gfx942,80,73728,11264,1536,torch.float8_e4m3fnuz,ck,71,0,7197.2388,a8w8_bpreshuffle_256x128x128x64_16x16_16x16_4x64x1_4x64x1_1x32x1x8_8x8x1_2x1_intrawave_v3,3544.71,248.91,0.0
gfx942,80,98304,11264,1536,torch.float8_e4m3fnuz,ck,71,0,9673.3902,a8w8_bpreshuffle_256x128x128x64_16x16_16x16_4x64x1_4x64x1_1x32x1x8_8x8x1_2x1_intrawave_v3,0.0,0.0,0.0
gfx942,80,131072,11264,1536,torch.float8_e4m3fnuz,ck,71,0,12851.8716,a8w8_bpreshuffle_256x128x128x64_16x16_16x16_4x64x1_4x64x1_1x32x1x8_8x8x1_2x1_intrawave_v3,3529.05,246.77,0.0
gfx942,80,1,12288,1536,torch.float8_e4m3fnuz,ck,15,0,8.8721,a8w8_bpreshuffle_256x16x64x256_16x16_16x16_16x16x1_16x16x1_1x16x1x16_4x4x1_1x1_intrawave_v1,4.25,2130.33,0.0
gfx942,80,2,12288,1536,torch.float8_e4m3fnuz,ck,15,0,9.1519,a8w8_bpreshuffle_256x16x64x256_16x16_16x16_16x16x1_16x16x1_1x16x1x16_4x4x1_1x1_intrawave_v1,8.25,2068.05,0.0
gfx942,80,4,12288,1536,torch.float8_e4m3fnuz,ck,108,0,9.0818,a8w8_bpreshuffle_256x16x64x256_16x16_16x16_16x16x1_16x16x1_1x16x1x16_4x4x1_1x1_intrawave_v1,16.63,2089.76,0.0
gfx942,80,8,12288,1536,torch.float8_e4m3fnuz,ck,108,0,9.4892,a8w8_bpreshuffle_256x16x64x256_16x16_16x16_16x16x1_16x16x1_1x16x1x16_4x4x1_1x1_intrawave_v1,31.82,2011.05,0.0
gfx942,80,16,12288,1536,torch.float8_e4m3fnuz,ck,10,0,10.1361,a8w8_bpreshuffle_128x16x32x512_16x16_16x16_32x4x1_32x4x1_1x16x1x8_4x4x1_1x1_intrawave_v1,59.59,1903.31,0.0
gfx942,80,32,12288,1536,torch.float8_e4m3fnuz,ck,112,0,12.5215,a8w8_bpreshuffle_256x32x64x256_16x16_16x16_16x16x1_16x16x1_1x32x1x8_8x8x1_2x1_intrawave_v1,96.47,1574.09,0.0
gfx942,80,64,12288,1536,torch.float8_e4m3fnuz,ck,112,0,17.7365,a8w8_bpreshuffle_256x32x64x256_16x16_16x16_16x16x1_16x16x1_1x32x1x8_8x8x1_2x1_intrawave_v1,136.21,1158.38,0.0
gfx942,80,96,12288,1536,torch.float8_e4m3fnuz,ck,133,0,22.9216,a8w8_bpreshuffle_256x32x256x256_16x16_16x16_16x16x1_16x16x1_1x16x1x16_8x8x1_1x2_intrawave_v1,158.1,932.79,0.0
gfx942,80,128,12288,1536,torch.float8_e4m3fnuz,ck,119,0,27.07,a8w8_bpreshuffle_256x32x128x256_16x16_16x16_16x16x1_16x16x1_1x16x1x16_8x8x1_1x2_intrawave_v1,178.49,820.71,0.0
gfx942,80,160,12288,1536,torch.float8_e4m3fnuz,ck,119,0,31.5739,a8w8_bpreshuffle_256x32x128x256_16x16_16x16_16x16x1_16x16x1_1x16x1x16_8x8x1_1x2_intrawave_v1,191.29,730.11,0.0
gfx942,80,192,12288,1536,torch.float8_e4m3fnuz,ck,85,0,34.1912,a8w8_bpreshuffle_256x64x128x128_16x16_16x16_8x32x1_8x32x1_1x32x1x8_8x8x1_2x1_intrawave_v3,211.98,698.66,0.0
gfx942,80,224,12288,1536,torch.float8_e4m3fnuz,ck,85,0,42.2156,a8w8_bpreshuffle_256x64x128x128_16x16_16x16_8x32x1_8x32x1_1x32x1x8_8x8x1_2x1_intrawave_v3,200.3,585.65,0.0
gfx942,80,256,12288,1536,torch.float8_e4m3fnuz,ck,85,0,43.4262,a8w8_bpreshuffle_256x64x128x128_16x16_16x16_8x32x1_8x32x1_1x32x1x8_8x8x1_2x1_intrawave_v3,222.53,588.56,0.0
gfx942,80,288,12288,1536,torch.float8_e4m3fnuz,ck,102,0,48.4492,a8w8_bpreshuffle_256x96x256x128_16x16_16x16_8x32x1_8x32x1_1x32x1x8_8x8x1_2x1_intrawave_v3,224.39,544.79,0.0
gfx942,80,320,12288,1536,torch.float8_e4m3fnuz,ck,93,0,51.1407,a8w8_bpreshuffle_256x64x192x128_16x16_16x16_8x32x1_8x32x1_1x32x1x8_8x8x1_2x1_intrawave_v3,236.2,532.46,0.0
gfx942,80,352,12288,1536,torch.float8_e4m3fnuz,ck,93,0,60.7878,a8w8_bpreshuffle_256x64x192x128_16x16_16x16_8x32x1_8x32x1_1x32x1x8_8x8x1_2x1_intrawave_v3,218.59,461.7,0.0
gfx942,80,384,12288,1536,torch.float8_e4m3fnuz,ck,71,0,59.7854,a8w8_bpreshuffle_256x128x128x64_16x16_16x16_4x64x1_4x64x1_1x32x1x8_8x8x1_2x1_intrawave_v3,242.46,483.42,0.0
gfx942,80,416,12288,1536,torch.float8_e4m3fnuz,ck,85,0,69.8237,a8w8_bpreshuffle_256x64x128x128_16x16_16x16_8x32x1_8x32x1_1x32x1x8_8x8x1_2x1_intrawave_v3,224.9,425.89,0.0
gfx942,80,448,12288,1536,torch.float8_e4m3fnuz,ck,85,0,69.2979,a8w8_bpreshuffle_256x64x128x128_16x16_16x16_8x32x1_8x32x1_1x32x1x8_8x8x1_2x1_intrawave_v3,244.04,441.18,0.0
gfx942,80,480,12288,1536,torch.float8_e4m3fnuz,ck,94,0,71.9873,a8w8_bpreshuffle_256x96x192x128_16x16_16x16_8x32x1_8x32x1_1x32x1x8_8x8x1_2x1_intrawave_v3,251.7,436.3,0.0
gfx942,80,512,12288,1536,torch.float8_e4m3fnuz,ck,85,0,75.8898,a8w8_bpreshuffle_256x64x128x128_16x16_16x16_8x32x1_8x32x1_1x32x1x8_8x8x1_2x1_intrawave_v3,254.68,424.88,0.0
gfx942,80,1024,12288,1536,torch.float8_e4m3fnuz,ck,71,0,138.0326,a8w8_bpreshuffle_256x128x128x64_16x16_16x16_4x64x1_4x64x1_1x32x1x8_8x8x1_2x1_intrawave_v3,280.04,330.45,0.0
gfx942,80,2048,12288,1536,torch.float8_e4m3fnuz,ck,71,0,263.7876,a8w8_bpreshuffle_256x128x128x64_16x16_16x16_4x64x1_4x64x1_1x32x1x8_8x8x1_2x1_intrawave_v3,293.07,274.28,0.0
gfx942,80,4096,12288,1536,torch.float8_e4m3fnuz,ck,71,0,499.9388,a8w8_bpreshuffle_256x128x128x64_16x16_16x16_4x64x1_4x64x1_1x32x1x8_8x8x1_2x1_intrawave_v3,309.28,251.69,0.0
gfx942,80,6144,12288,1536,torch.float8_e4m3fnuz,ck,71,0,739.7506,a8w8_bpreshuffle_256x128x128x64_16x16_16x16_4x64x1_4x64x1_1x32x1x8_8x8x1_2x1_intrawave_v3,313.52,242.39,0.0
gfx942,80,8192,12288,1536,torch.float8_e4m3fnuz,ck,71,0,970.833,a8w8_bpreshuffle_256x128x128x64_16x16_16x16_4x64x1_4x64x1_1x32x1x8_8x8x1_2x1_intrawave_v3,318.53,239.78,0.0
gfx942,80,10240,12288,1536,torch.float8_e4m3fnuz,ck,71,0,1218.8252,a8w8_bpreshuffle_256x128x128x64_16x16_16x16_4x64x1_4x64x1_1x32x1x8_8x8x1_2x1_intrawave_v3,317.15,234.87,0.0
gfx942,80,12288,12288,1536,torch.float8_e4m3fnuz,ck,71,0,1456.9262,a8w8_bpreshuffle_256x128x128x64_16x16_16x16_4x64x1_4x64x1_1x32x1x8_8x8x1_2x1_intrawave_v3,318.38,233.19,0.0
gfx942,80,14336,12288,1536,torch.float8_e4m3fnuz,ck,71,0,1687.663,a8w8_bpreshuffle_256x128x128x64_16x16_16x16_4x64x1_4x64x1_1x32x1x8_8x8x1_2x1_intrawave_v3,320.66,232.99,0.0
gfx942,80,16384,12288,1536,torch.float8_e4m3fnuz,ck,71,0,1931.9974,a8w8_bpreshuffle_256x128x128x64_16x16_16x16_4x64x1_4x64x1_1x32x1x8_8x8x1_2x1_intrawave_v3,320.12,231.21,0.0
gfx942,80,32768,12288,1536,torch.float8_e4m3fnuz,ck,71,0,3848.4946,a8w8_bpreshuffle_256x128x128x64_16x16_16x16_4x64x1_4x64x1_1x32x1x8_8x8x1_2x1_intrawave_v3,321.41,227.23,0.0
gfx942,80,65536,12288,1536,torch.float8_e4m3fnuz,ck,71,0,7676.2381,a8w8_bpreshuffle_256x128x128x64_16x16_16x16_4x64x1_4x64x1_1x32x1x8_8x8x1_2x1_intrawave_v3,322.28,225.39,0.0
gfx942,80,98304,12288,1536,torch.float8_e4m3fnuz,ck,71,0,11500.3768,a8w8_bpreshuffle_256x128x128x64_16x16_16x16_4x64x1_4x64x1_1x32x1x8_8x8x1_2x1_intrawave_v3,322.67,224.84,0.0
gfx942,80,131072,12288,1536,torch.float8_e4m3fnuz,ck,71,0,15314.1682,a8w8_bpreshuffle_256x128x128x64_16x16_16x16_4x64x1_4x64x1_1x32x1x8_8x8x1_2x1_intrawave_v3,323.09,224.72,0.0
gfx942,80,1,14336,1536,torch.float8_e4m3fnuz,ck,108,0,9.3708,a8w8_bpreshuffle_256x16x64x256_16x16_16x16_16x16x1_16x16x1_1x16x1x16_4x4x1_1x1_intrawave_v1,4.7,2353.09,0.0
gfx942,80,2,14336,1536,torch.float8_e4m3fnuz,ck,108,0,9.4408,a8w8_bpreshuffle_256x16x64x256_16x16_16x16_16x16x1_16x16x1_1x16x1x16_4x4x1_1x1_intrawave_v1,9.33,2338.84,0.0
gfx942,80,4,14336,1536,torch.float8_e4m3fnuz,ck,15,0,9.4788,a8w8_bpreshuffle_256x16x64x256_16x16_16x16_16x16x1_16x16x1_1x16x1x16_4x4x1_1x1_intrawave_v1,18.58,2335.84,0.0
gfx942,80,8,14336,1536,torch.float8_e4m3fnuz,ck,108,0,9.4769,a8w8_bpreshuffle_256x16x64x256_16x16_16x16_16x16x1_16x16x1_1x16x1x16_4x4x1_1x1_intrawave_v1,37.18,2349.06,0.0
gfx942,80,16,14336,1536,torch.float8_e4m3fnuz,ck,15,0,10.5152,a8w8_bpreshuffle_256x16x64x256_16x16_16x16_16x16x1_16x16x1_1x16x1x16_4x4x1_1x1_intrawave_v1,67.01,2140.09,0.0
gfx942,80,32,14336,1536,torch.float8_e4m3fnuz,ck,112,0,12.7846,a8w8_bpreshuffle_256x32x64x256_16x16_16x16_16x16x1_16x16x1_1x32x1x8_8x8x1_2x1_intrawave_v1,110.23,1798.0,0.0
gfx942,80,64,14336,1536,torch.float8_e4m3fnuz,ck,119,0,18.1404,a8w8_bpreshuffle_256x32x128x256_16x16_16x16_16x16x1_16x16x1_1x16x1x16_8x8x1_1x2_intrawave_v1,155.38,1320.45,0.0
gfx942,80,96,14336,1536,torch.float8_e4m3fnuz,ck,120,0,25.9487,a8w8_bpreshuffle_256x48x128x256_16x16_16x16_16x16x1_16x16x1_1x16x1x16_8x8x1_1x2_intrawave_v1,162.93,960.36,0.0
gfx942,80,128,14336,1536,torch.float8_e4m3fnuz,ck,85,0,27.8617,a8w8_bpreshuffle_256x64x128x128_16x16_16x16_8x32x1_8x32x1_1x32x1x8_8x8x1_2x1_intrawave_v3,202.33,929.11,0.0
gfx942,80,160,14336,1536,torch.float8_e4m3fnuz,ck,119,0,36.4462,a8w8_bpreshuffle_256x32x128x256_16x16_16x16_16x16x1_16x16x1_1x16x1x16_8x8x1_1x2_intrawave_v1,193.34,736.79,0.0
gfx942,80,192,14336,1536,torch.float8_e4m3fnuz,ck,86,0,41.4702,a8w8_bpreshuffle_256x96x128x128_16x16_16x16_8x32x1_8x32x1_1x32x1x8_8x8x1_2x1_intrawave_v3,203.9,670.84,0.0
gfx942,80,224,14336,1536,torch.float8_e4m3fnuz,ck,72,0,47.9425,a8w8_bpreshuffle_256x64x256x64_16x16_16x16_4x64x1_4x64x1_1x16x1x16_8x8x1_1x2_intrawave_v1,205.77,600.44,0.0
gfx942,80,256,14336,1536,torch.float8_e4m3fnuz,ck,72,0,48.7805,a8w8_bpreshuffle_256x64x256x64_16x16_16x16_4x64x1_4x64x1_1x16x1x16_8x8x1_1x2_intrawave_v1,231.12,609.94,0.0
gfx942,80,288,14336,1536,torch.float8_e4m3fnuz,ck,85,0,56.6988,a8w8_bpreshuffle_256x64x128x128_16x16_16x16_8x32x1_8x32x1_1x32x1x8_8x8x1_2x1_intrawave_v3,223.7,541.81,0.0
gfx942,80,320,14336,1536,torch.float8_e4m3fnuz,ck,85,0,57.1533,a8w8_bpreshuffle_256x64x128x128_16x16_16x16_8x32x1_8x32x1_1x32x1x8_8x8x1_2x1_intrawave_v3,246.58,554.42,0.0
gfx942,80,352,14336,1536,torch.float8_e4m3fnuz,ck,85,0,69.3423,a8w8_bpreshuffle_256x64x128x128_16x16_16x16_8x32x1_8x32x1_1x32x1x8_8x8x1_2x1_intrawave_v3,223.56,470.9,0.0
gfx942,80,384,14336,1536,torch.float8_e4m3fnuz,ck,85,0,69.3265,a8w8_bpreshuffle_256x64x128x128_16x16_16x16_8x32x1_8x32x1_1x32x1x8_8x8x1_2x1_intrawave_v3,243.94,484.95,0.0
gfx942,80,416,14336,1536,torch.float8_e4m3fnuz,ck,85,0,77.2118,a8w8_bpreshuffle_256x64x128x128_16x16_16x16_8x32x1_8x32x1_1x32x1x8_8x8x1_2x1_intrawave_v3,237.28,447.94,0.0
gfx942,80,448,14336,1536,torch.float8_e4m3fnuz,ck,85,0,76.7227,a8w8_bpreshuffle_256x64x128x128_16x16_16x16_8x32x1_8x32x1_1x32x1x8_8x8x1_2x1_intrawave_v3,257.16,463.4,0.0
gfx942,80,480,14336,1536,torch.float8_e4m3fnuz,ck,86,0,86.6195,a8w8_bpreshuffle_256x96x128x128_16x16_16x16_8x32x1_8x32x1_1x32x1x8_8x8x1_2x1_intrawave_v3,244.05,421.61,0.0
gfx942,80,512,14336,1536,torch.float8_e4m3fnuz,ck,71,0,87.7988,a8w8_bpreshuffle_256x128x128x64_16x16_16x16_4x64x1_4x64x1_1x32x1x8_8x8x1_2x1_intrawave_v3,256.82,426.96,0.0
gfx942,80,1024,14336,1536,torch.float8_e4m3fnuz,ck,85,0,161.5909,a8w8_bpreshuffle_256x64x128x128_16x16_16x16_8x32x1_8x32x1_1x32x1x8_8x8x1_2x1_intrawave_v3,279.08,327.7,0.0
gfx942,80,2048,14336,1536,torch.float8_e4m3fnuz,ck,71,0,300.1671,a8w8_bpreshuffle_256x128x128x64_16x16_16x16_4x64x1_4x64x1_1x32x1x8_8x8x1_2x1_intrawave_v3,300.48,279.46,0.0
gfx942,80,4096,14336,1536,torch.float8_e4m3fnuz,ck,71,0,574.396,a8w8_bpreshuffle_256x128x128x64_16x16_16x16_4x64x1_4x64x1_1x32x1x8_8x8x1_2x1_intrawave_v3,314.05,253.75,0.0
gfx942,80,6144,14336,1536,torch.float8_e4m3fnuz,ck,71,0,860.7529,a8w8_bpreshuffle_256x128x128x64_16x16_16x16_4x64x1_4x64x1_1x32x1x8_8x8x1_2x1_intrawave_v3,314.36,241.21,0.0
gfx942,80,8192,14336,1536,torch.float8_e4m3fnuz,ck,71,0,1133.1069,a8w8_bpreshuffle_256x128x128x64_16x16_16x16_4x64x1_4x64x1_1x32x1x8_8x8x1_2x1_intrawave_v3,318.4,237.83,0.0
gfx942,80,10240,14336,1536,torch.float8_e4m3fnuz,ck,71,0,1419.1055,a8w8_bpreshuffle_256x128x128x64_16x16_16x16_4x64x1_4x64x1_1x32x1x8_8x8x1_2x1_intrawave_v3,317.79,233.49,0.0
gfx942,80,12288,14336,1536,torch.float8_e4m3fnuz,ck,71,0,1690.3277,a8w8_bpreshuffle_256x128x128x64_16x16_16x16_4x64x1_4x64x1_1x32x1x8_8x8x1_2x1_intrawave_v3,320.15,232.63,0.0
gfx942,80,14336,14336,1536,torch.float8_e4m3fnuz,ck,71,0,1974.9354,a8w8_bpreshuffle_256x128x128x64_16x16_16x16_4x64x1_4x64x1_1x32x1x8_8x8x1_2x1_intrawave_v3,319.69,230.43,0.0
gfx942,80,16384,14336,1536,torch.float8_e4m3fnuz,ck,71,0,2260.0129,a8w8_bpreshuffle_256x128x128x64_16x16_16x16_4x64x1_4x64x1_1x32x1x8_8x8x1_2x1_intrawave_v3,319.27,228.74,0.0
gfx942,80,32768,14336,1536,torch.float8_e4m3fnuz,ck,71,0,4486.7553,a8w8_bpreshuffle_256x128x128x64_16x16_16x16_4x64x1_4x64x1_1x32x1x8_8x8x1_2x1_intrawave_v3,321.64,225.53,0.0
gfx942,80,65536,14336,1536,torch.float8_e4m3fnuz,ck,71,0,8920.3186,a8w8_bpreshuffle_256x128x128x64_16x16_16x16_4x64x1_4x64x1_1x32x1x8_8x8x1_2x1_intrawave_v3,323.56,224.4,0.0
gfx942,80,98304,14336,1536,torch.float8_e4m3fnuz,ck,71,0,13408.709,a8w8_bpreshuffle_256x128x128x64_16x16_16x16_4x64x1_4x64x1_1x32x1x8_8x8x1_2x1_intrawave_v3,322.87,223.11,0.0
gfx942,80,1,16384,512,torch.float8_e4m3fnuz,ck,9,0,6.8396,a8w8_bpreshuffle_128x16x32x128_16x16_16x16_8x16x1_8x16x1_1x16x1x8_4x4x1_1x1_intrawave_v1,2.45,1231.34,0.0
gfx942,80,2,16384,512,torch.float8_e4m3fnuz,ck,9,0,6.6785,a8w8_bpreshuffle_128x16x32x128_16x16_16x16_8x16x1_8x16x1_1x16x1x8_4x4x1_1x1_intrawave_v1,5.02,1266.03,0.0
gfx942,80,4,16384,512,torch.float8_e4m3fnuz,ck,9,0,6.9405,a8w8_bpreshuffle_128x16x32x128_16x16_16x16_8x16x1_8x16x1_1x16x1x8_4x4x1_1x1_intrawave_v1,9.67,1227.83,0.0
gfx942,80,8,16384,512,torch.float8_e4m3fnuz,ck,9,0,6.7881,a8w8_bpreshuffle_128x16x32x128_16x16_16x16_8x16x1_8x16x1_1x16x1x8_4x4x1_1x1_intrawave_v1,19.77,1275.0,0.0
gfx942,80,16,16384,512,torch.float8_e4m3fnuz,ck,9,0,7.1281,a8w8_bpreshuffle_128x16x32x128_16x16_16x16_8x16x1_8x16x1_1x16x1x8_4x4x1_1x1_intrawave_v1,37.66,1251.54,0.0
gfx942,80,32,16384,512,torch.float8_e4m3fnuz,ck,76,0,8.5341,a8w8_bpreshuffle_256x32x64x128_16x16_16x16_8x32x1_8x32x1_1x32x1x8_8x8x1_2x1_intrawave_v1,62.91,1107.74,0.0
gfx942,80,64,16384,512,torch.float8_e4m3fnuz,ck,76,0,11.9905,a8w8_bpreshuffle_256x32x64x128_16x16_16x16_8x32x1_8x32x1_1x32x1x8_8x8x1_2x1_intrawave_v1,89.55,877.24,0.0
gfx942,80,96,16384,512,torch.float8_e4m3fnuz,ck,84,0,15.4745,a8w8_bpreshuffle_256x32x128x128_16x16_16x16_8x32x1_8x32x1_1x32x1x8_8x8x1_2x1_intrawave_v1,104.08,748.55,0.0
gfx942,80,128,16384,512,torch.float8_e4m3fnuz,ck,76,0,18.6149,a8w8_bpreshuffle_256x32x64x128_16x16_16x16_8x32x1_8x32x1_1x32x1x8_8x8x1_2x1_intrawave_v1,115.36,679.48,0.0
gfx942,80,160,16384,512,torch.float8_e4m3fnuz,ck,84,0,21.486,a8w8_bpreshuffle_256x32x128x128_16x16_16x16_8x32x1_8x32x1_1x32x1x8_8x8x1_2x1_intrawave_v1,124.94,638.25,0.0
gfx942,80,192,16384,512,torch.float8_e4m3fnuz,ck,84,0,24.2394,a8w8_bpreshuffle_256x32x128x128_16x16_16x16_8x32x1_8x32x1_1x32x1x8_8x8x1_2x1_intrawave_v1,132.89,609.68,0.0
gfx942,80,224,16384,512,torch.float8_e4m3fnuz,ck,84,0,28.1282,a8w8_bpreshuffle_256x32x128x128_16x16_16x16_8x32x1_8x32x1_1x32x1x8_8x8x1_2x1_intrawave_v1,133.61,563.25,0.0
gfx942,80,256,16384,512,torch.float8_e4m3fnuz,ck,85,0,30.4715,a8w8_bpreshuffle_256x64x128x128_16x16_16x16_8x32x1_8x32x1_1x32x1x8_8x8x1_2x1_intrawave_v3,140.95,554.89,0.0
gfx942,80,288,16384,512,torch.float8_e4m3fnuz,ck,84,0,33.0464,a8w8_bpreshuffle_256x32x128x128_16x16_16x16_8x32x1_8x32x1_1x32x1x8_8x8x1_2x1_intrawave_v1,146.21,543.88,0.0
gfx942,80,320,16384,512,torch.float8_e4m3fnuz,ck,85,0,34.1726,a8w8_bpreshuffle_256x64x128x128_16x16_16x16_8x32x1_8x32x1_1x32x1x8_8x8x1_2x1_intrawave_v3,157.11,557.12,0.0
gfx942,80,352,16384,512,torch.float8_e4m3fnuz,ck,84,0,39.9477,a8w8_bpreshuffle_256x32x128x128_16x16_16x16_8x32x1_8x32x1_1x32x1x8_8x8x1_2x1_intrawave_v1,147.83,503.24,0.0
gfx942,80,384,16384,512,torch.float8_e4m3fnuz,ck,85,0,40.3333,a8w8_bpreshuffle_256x64x128x128_16x16_16x16_8x32x1_8x32x1_1x32x1x8_8x8x1_2x1_intrawave_v3,159.73,524.83,0.0
gfx942,80,416,16384,512,torch.float8_e4m3fnuz,ck,84,0,45.0184,a8w8_bpreshuffle_256x32x128x128_16x16_16x16_8x32x1_8x32x1_1x32x1x8_8x8x1_2x1_intrawave_v1,155.03,493.87,0.0
gfx942,80,448,16384,512,torch.float8_e4m3fnuz,ck,85,0,47.0283,a8w8_bpreshuffle_256x64x128x128_16x16_16x16_8x32x1_8x32x1_1x32x1x8_8x8x1_2x1_intrawave_v3,159.82,495.4,0.0
gfx942,80,480,16384,512,torch.float8_e4m3fnuz,ck,84,0,51.972,a8w8_bpreshuffle_256x32x128x128_16x16_16x16_8x32x1_8x32x1_1x32x1x8_8x8x1_2x1_intrawave_v1,154.95,468.77,0.0
gfx942,80,512,16384,512,torch.float8_e4m3fnuz,ck,85,0,51.7738,a8w8_bpreshuffle_256x64x128x128_16x16_16x16_8x32x1_8x32x1_1x32x1x8_8x8x1_2x1_intrawave_v3,165.91,491.14,0.0
gfx942,80,1024,16384,512,torch.float8_e4m3fnuz,ck,71,0,93.0854,a8w8_bpreshuffle_256x128x128x64_16x16_16x16_4x64x1_4x64x1_1x32x1x8_8x8x1_2x1_intrawave_v3,184.56,456.22,0.0
gfx942,80,2048,16384,512,torch.float8_e4m3fnuz,ck,71,0,172.6344,a8w8_bpreshuffle_256x128x128x64_16x16_16x16_4x64x1_4x64x1_1x32x1x8_8x8x1_2x1_intrawave_v3,199.03,443.4,0.0
gfx942,80,4096,16384,512,torch.float8_e4m3fnuz,ck,71,0,331.3938,a8w8_bpreshuffle_256x128x128x64_16x16_16x16_4x64x1_4x64x1_1x32x1x8_8x8x1_2x1_intrawave_v3,207.37,436.65,0.0
gfx942,80,6144,16384,512,torch.float8_e4m3fnuz,ck,71,0,477.6551,a8w8_bpreshuffle_256x128x128x64_16x16_16x16_4x64x1_4x64x1_1x32x1x8_8x8x1_2x1_intrawave_v3,215.8,445.64,0.0
gfx942,80,8192,16384,512,torch.float8_e4m3fnuz,ck,71,0,637.0735,a8w8_bpreshuffle_256x128x128x64_16x16_16x16_4x64x1_4x64x1_1x32x1x8_8x8x1_2x1_intrawave_v3,215.73,441.11,0.0
gfx942,80,10240,16384,512,torch.float8_e4m3fnuz,ck,71,0,784.9988,a8w8_bpreshuffle_256x128x128x64_16x16_16x16_4x64x1_4x64x1_1x32x1x8_8x8x1_2x1_intrawave_v3,218.85,444.81,0.0
gfx942,80,12288,16384,512,torch.float8_e4m3fnuz,ck,71,0,942.3456,a8w8_bpreshuffle_256x128x128x64_16x16_16x16_4x64x1_4x64x1_1x32x1x8_8x8x1_2x1_intrawave_v3,218.77,442.87,0.0
gfx942,80,14336,16384,512,torch.float8_e4m3fnuz,ck,71,0,1094.9387,a8w8_bpreshuffle_256x128x128x64_16x16_16x16_4x64x1_4x64x1_1x32x1x8_8x8x1_2x1_intrawave_v3,219.66,443.4,0.0
gfx942,80,16384,16384,512,torch.float8_e4m3fnuz,ck,71,0,1252.4903,a8w8_bpreshuffle_256x128x128x64_16x16_16x16_4x64x1_4x64x1_1x32x1x8_8x8x1_2x1_intrawave_v3,219.47,442.04,0.0
gfx942,80,32768,16384,512,torch.float8_e4m3fnuz,ck,71,0,2494.7808,a8w8_bpreshuffle_256x128x128x64_16x16_16x16_4x64x1_4x64x1_1x32x1x8_8x8x1_2x1_intrawave_v3,220.36,440.48,0.0
gfx942,80,65536,16384,512,torch.float8_e4m3fnuz,ck,71,0,4931.7756,a8w8_bpreshuffle_256x128x128x64_16x16_16x16_4x64x1_4x64x1_1x32x1x8_8x8x1_2x1_intrawave_v3,222.94,443.94,0.0
gfx942,80,98304,16384,512,torch.float8_e4m3fnuz,ck,71,0,7420.0505,a8w8_bpreshuffle_256x128x128x64_16x16_16x16_4x64x1_4x64x1_1x32x1x8_8x8x1_2x1_intrawave_v3,222.27,442.04,0.0
gfx942,80,131072,16384,512,torch.float8_e4m3fnuz,ck,9,0,18530.1837,a8w8_bpreshuffle_128x16x32x128_16x16_16x16_8x16x1_8x16x1_1x16x1x8_4x4x1_1x1_intrawave_v1,118.67,235.86,0.0
gfx942,80,1,18432,7168,torch.float8_e4m3fnuz,ck,118,0,37.4132,a8w8_bpreshuffle_256x16x128x256_16x16_16x16_16x16x1_16x16x1_1x16x1x16_8x8x1_1x2_intrawave_v1,7.06,3532.57,0.0
gfx942,80,2,18432,7168,torch.float8_e4m3fnuz,ck,16,0,37.7738,a8w8_bpreshuffle_256x16x128x256_16x16_16x16_16x16x1_16x16x1_1x16x1x16_8x8x1_1x2_intrawave_v1,13.99,3500.01,0.0
gfx942,80,4,18432,7168,torch.float8_e4m3fnuz,ck,109,0,38.1876,a8w8_bpreshuffle_256x16x128x256_16x16_16x16_16x16x1_16x16x1_1x16x1x16_8x8x1_1x2_intrawave_v1,27.68,3464.39,0.0
gfx942,80,8,18432,7168,torch.float8_e4m3fnuz,ck,109,0,39.4871,a8w8_bpreshuffle_256x16x128x256_16x16_16x16_16x16x1_16x16x1_1x16x1x16_8x8x1_1x2_intrawave_v1,53.53,3354.84,0.0
gfx942,80,16,18432,7168,torch.float8_e4m3fnuz,ck,7,0,40.5749,a8w8_bpreshuffle_256x16x256x512_16x16_16x16_32x8x1_32x8x1_1x16x1x16_8x8x1_1x2_intrawave_v1,104.2,3273.58,0.0
gfx942,80,32,18432,7168,torch.float8_e4m3fnuz,ck,133,0,46.9286,a8w8_bpreshuffle_256x32x256x256_16x16_16x16_16x16x1_16x16x1_1x16x1x16_8x8x1_1x2_intrawave_v1,180.18,2845.38,0.0
gfx942,80,64,18432,7168,torch.float8_e4m3fnuz,ck,121,0,68.3333,a8w8_bpreshuffle_256x64x128x256_16x16_16x16_16x16x1_16x16x1_1x16x1x16_8x8x1_1x2_intrawave_v3,247.48,1974.71,0.0
gfx942,80,96,18432,7168,torch.float8_e4m3fnuz,ck,86,0,88.3315,a8w8_bpreshuffle_256x96x128x128_16x16_16x16_8x32x1_8x32x1_1x32x1x8_8x8x1_2x1_intrawave_v3,287.18,1543.59,0.0
gfx942,80,128,18432,7168,torch.float8_e4m3fnuz,ck,0,0,110.5497,a8w8_bpreshuffle_256x128x128x128_16x16_16x16_8x32x1_8x32x1_1x32x1x8_8x8x1_2x1_intrawave_v3,305.95,1246.11,0.0
gfx942,80,160,18432,7168,torch.float8_e4m3fnuz,ck,156,0,141.951,a8w8_bpreshuffle_256x160x256x128_16x16_16x16_8x32x1_8x32x1_1x16x1x16_8x8x1_1x2_intrawave_v3,297.84,980.38,0.0
gfx942,80,192,18432,7168,torch.float8_e4m3fnuz,ck,102,0,155.4518,a8w8_bpreshuffle_256x96x256x128_16x16_16x16_8x32x1_8x32x1_1x32x1x8_8x8x1_2x1_intrawave_v3,326.37,904.3,0.0
gfx942,80,224,18432,7168,torch.float8_e4m3fnuz,ck,40,0,199.1076,a8w8_bpreshuffle_256x224x256x128_16x16_16x16_8x32x1_8x32x1_1x32x1x8_8x8x1_2x1_intrawave_v3,297.28,713.1,0.0
gfx942,80,256,18432,7168,torch.float8_e4m3fnuz,ck,93,0,200.0228,a8w8_bpreshuffle_256x64x192x128_16x16_16x16_8x32x1_8x32x1_1x32x1x8_8x8x1_2x1_intrawave_v3,338.19,716.88,0.0
gfx942,80,288,18432,7168,torch.float8_e4m3fnuz,ck,94,0,236.0343,a8w8_bpreshuffle_256x96x192x128_16x16_16x16_8x32x1_8x32x1_1x32x1x8_8x8x1_2x1_intrawave_v3,322.42,613.48,0.0
gfx942,80,320,18432,7168,torch.float8_e4m3fnuz,ck,93,0,243.2446,a8w8_bpreshuffle_256x64x192x128_16x16_16x16_8x32x1_8x32x1_1x32x1x8_8x8x1_2x1_intrawave_v3,347.62,601.09,0.0
gfx942,80,352,18432,7168,torch.float8_e4m3fnuz,ck,85,0,301.0235,a8w8_bpreshuffle_256x64x128x128_16x16_16x16_8x32x1_8x32x1_1x32x1x8_8x8x1_2x1_intrawave_v3,308.99,490.39,0.0
gfx942,80,384,18432,7168,torch.float8_e4m3fnuz,ck,94,0,294.9271,a8w8_bpreshuffle_256x96x192x128_16x16_16x16_8x32x1_8x32x1_1x32x1x8_8x8x1_2x1_intrawave_v3,344.05,505.31,0.0
gfx942,80,416,18432,7168,torch.float8_e4m3fnuz,ck,85,0,357.1532,a8w8_bpreshuffle_256x64x128x128_16x16_16x16_8x32x1_8x32x1_1x32x1x8_8x8x1_2x1_intrawave_v3,307.78,421.21,0.0
gfx942,80,448,18432,7168,torch.float8_e4m3fnuz,ck,93,0,351.2371,a8w8_bpreshuffle_256x64x192x128_16x16_16x16_8x32x1_8x32x1_1x32x1x8_8x8x1_2x1_intrawave_v3,337.04,432.32,0.0
gfx942,80,480,18432,7168,torch.float8_e4m3fnuz,ck,94,0,352.3586,a8w8_bpreshuffle_256x96x192x128_16x16_16x16_8x32x1_8x32x1_1x32x1x8_8x8x1_2x1_intrawave_v3,359.96,434.94,0.0
gfx942,80,512,18432,7168,torch.float8_e4m3fnuz,ck,68,0,388.5432,a8w8_bpreshuffle_256x128x192x128_16x16_16x16_8x32x1_8x32x1_1x32x1x8_8x8x1_2x1_intrawave_v3,348.2,398.06,0.0
gfx942,80,1024,18432,7168,torch.float8_e4m3fnuz,ck,85,0,742.4427,a8w8_bpreshuffle_256x64x128x128_16x16_16x16_8x32x1_8x32x1_1x32x1x8_8x8x1_2x1_intrawave_v3,364.45,238.68,0.0
gfx942,80,2048,18432,7168,torch.float8_e4m3fnuz,ck,71,0,1441.3783,a8w8_bpreshuffle_256x128x128x64_16x16_16x16_4x64x1_4x64x1_1x32x1x8_8x8x1_2x1_intrawave_v3,375.45,154.23,0.0
gfx942,80,4096,18432,7168,torch.float8_e4m3fnuz,ck,71,0,2836.9828,a8w8_bpreshuffle_256x128x128x64_16x16_16x16_4x64x1_4x64x1_1x32x1x8_8x8x1_2x1_intrawave_v3,381.51,110.14,0.0
gfx942,80,6144,18432,7168,torch.float8_e4m3fnuz,ck,102,0,4288.8669,a8w8_bpreshuffle_256x96x256x128_16x16_16x16_8x32x1_8x32x1_1x32x1x8_8x8x1_2x1_intrawave_v3,378.54,93.88,0.0
gfx942,80,8192,18432,7168,torch.float8_e4m3fnuz,ck,68,0,5709.0564,a8w8_bpreshuffle_256x128x192x128_16x16_16x16_8x32x1_8x32x1_1x32x1x8_8x8x1_2x1_intrawave_v3,379.16,86.32,0.0
gfx942,80,10240,18432,7168,torch.float8_e4m3fnuz,ck,68,0,7143.9568,a8w8_bpreshuffle_256x128x192x128_16x16_16x16_8x32x1_8x32x1_1x32x1x8_8x8x1_2x1_intrawave_v3,378.76,81.61,0.0
gfx942,80,12288,18432,7168,torch.float8_e4m3fnuz,ck,85,0,8555.9295,a8w8_bpreshuffle_256x64x128x128_16x16_16x16_8x32x1_8x32x1_1x32x1x8_8x8x1_2x1_intrawave_v3,379.5,78.68,0.0
gfx942,80,14336,18432,7168,torch.float8_e4m3fnuz,ck,85,0,9992.1813,a8w8_bpreshuffle_256x64x128x128_16x16_16x16_8x32x1_8x32x1_1x32x1x8_8x8x1_2x1_intrawave_v3,379.11,76.4,0.0
gfx942,80,16384,18432,7168,torch.float8_e4m3fnuz,ck,93,0,11413.8848,a8w8_bpreshuffle_256x64x192x128_16x16_16x16_8x32x1_8x32x1_1x32x1x8_8x8x1_2x1_intrawave_v3,379.3,74.78,0.0
gfx942,80,32768,18432,7168,torch.float8_e4m3fnuz,ck,85,0,22842.7493,a8w8_bpreshuffle_256x64x128x128_16x16_16x16_8x32x1_8x32x1_1x32x1x8_8x8x1_2x1_intrawave_v3,379.05,68.95,0.0
gfx942,80,65536,18432,7168,torch.float8_e4m3fnuz,ck,93,0,45613.8859,a8w8_bpreshuffle_256x64x192x128_16x16_16x16_8x32x1_8x32x1_1x32x1x8_8x8x1_2x1_intrawave_v3,379.65,66.16,0.0
gfx942,80,98304,18432,7168,torch.float8_e4m3fnuz,ck,102,0,68165.4052,a8w8_bpreshuffle_256x96x256x128_16x16_16x16_8x32x1_8x32x1_1x32x1x8_8x8x1_2x1_intrawave_v3,381.07,65.44,0.0
gfx942,80,1,20480,1536,torch.float8_e4m3fnuz,ck,16,0,11.0968,a8w8_bpreshuffle_256x16x128x256_16x16_16x16_16x16x1_16x16x1_1x16x1x16_8x8x1_1x2_intrawave_v1,5.67,2838.64,0.0
gfx942,80,2,20480,1536,torch.float8_e4m3fnuz,ck,118,0,11.2695,a8w8_bpreshuffle_256x16x128x256_16x16_16x16_16x16x1_16x16x1_1x16x1x16_8x8x1_1x2_intrawave_v1,11.17,2798.91,0.0
gfx942,80,4,20480,1536,torch.float8_e4m3fnuz,ck,16,0,11.25,a8w8_bpreshuffle_256x16x128x256_16x16_16x16_16x16x1_16x16x1_1x16x1x16_8x8x1_1x2_intrawave_v1,22.37,2811.31,0.0
gfx942,80,8,20480,1536,torch.float8_e4m3fnuz,ck,118,0,11.572,a8w8_bpreshuffle_256x16x128x256_16x16_16x16_16x16x1_16x16x1_1x16x1x16_8x8x1_1x2_intrawave_v1,43.49,2747.77,0.0
gfx942,80,16,20480,1536,torch.float8_e4m3fnuz,ck,109,0,12.6053,a8w8_bpreshuffle_256x16x128x256_16x16_16x16_16x16x1_16x16x1_1x16x1x16_8x8x1_1x2_intrawave_v1,79.86,2549.5,0.0
gfx942,80,32,20480,1536,torch.float8_e4m3fnuz,ck,112,0,16.0124,a8w8_bpreshuffle_256x32x64x256_16x16_16x16_16x16x1_16x16x1_1x32x1x8_8x8x1_2x1_intrawave_v1,125.73,2049.48,0.0
gfx942,80,64,20480,1536,torch.float8_e4m3fnuz,ck,121,0,21.6428,a8w8_bpreshuffle_256x64x128x256_16x16_16x16_16x16x1_16x16x1_1x16x1x16_8x8x1_1x2_intrawave_v3,186.04,1579.14,0.0
gfx942,80,96,20480,1536,torch.float8_e4m3fnuz,ck,86,0,28.314,a8w8_bpreshuffle_256x96x128x128_16x16_16x16_8x32x1_8x32x1_1x32x1x8_8x8x1_2x1_intrawave_v3,213.31,1255.1,0.0
gfx942,80,128,20480,1536,torch.float8_e4m3fnuz,ck,70,0,35.7174,a8w8_bpreshuffle_256x128x128x128_16x16_16x16_8x32x1_8x32x1_1x32x1x8_8x8x1_2x1_intrawave_v3,225.47,1033.02,0.0
gfx942,80,160,20480,1536,torch.float8_e4m3fnuz,ck,156,0,47.001,a8w8_bpreshuffle_256x160x256x128_16x16_16x16_8x32x1_8x32x1_1x16x1x16_8x8x1_1x2_intrawave_v3,214.17,813.95,0.0
gfx942,80,192,20480,1536,torch.float8_e4m3fnuz,ck,102,0,49.299,a8w8_bpreshuffle_256x96x256x128_16x16_16x16_8x32x1_8x32x1_1x32x1x8_8x8x1_2x1_intrawave_v3,245.03,803.6,0.0
gfx942,80,224,20480,1536,torch.float8_e4m3fnuz,ck,71,0,61.5138,a8w8_bpreshuffle_256x128x128x64_16x16_16x16_4x64x1_4x64x1_1x32x1x8_8x8x1_2x1_intrawave_v3,229.1,666.13,0.0
gfx942,80,256,20480,1536,torch.float8_e4m3fnuz,ck,85,0,63.3795,a8w8_bpreshuffle_256x64x128x128_16x16_16x16_8x32x1_8x32x1_1x32x1x8_8x8x1_2x1_intrawave_v3,254.12,667.98,0.0
gfx942,80,288,20480,1536,torch.float8_e4m3fnuz,ck,102,0,74.1212,a8w8_bpreshuffle_256x96x256x128_16x16_16x16_8x32x1_8x32x1_1x32x1x8_8x8x1_2x1_intrawave_v3,244.46,589.52,0.0
gfx942,80,320,20480,1536,torch.float8_e4m3fnuz,ck,85,0,81.5229,a8w8_bpreshuffle_256x64x128x128_16x16_16x16_8x32x1_8x32x1_1x32x1x8_8x8x1_2x1_intrawave_v3,246.96,552.68,0.0
gfx942,80,352,20480,1536,torch.float8_e4m3fnuz,ck,71,0,90.9179,a8w8_bpreshuffle_256x128x128x64_16x16_16x16_4x64x1_4x64x1_1x32x1x8_8x8x1_2x1_intrawave_v3,243.58,510.53,0.0
gfx942,80,384,20480,1536,torch.float8_e4m3fnuz,ck,85,0,90.8301,a8w8_bpreshuffle_256x64x128x128_16x16_16x16_8x32x1_8x32x1_1x32x1x8_8x8x1_2x1_intrawave_v3,265.98,525.99,0.0
gfx942,80,416,20480,1536,torch.float8_e4m3fnuz,ck,85,0,106.3525,a8w8_bpreshuffle_256x64x128x128_16x16_16x16_8x32x1_8x32x1_1x32x1x8_8x8x1_2x1_intrawave_v3,246.09,462.01,0.0
gfx942,80,448,20480,1536,torch.float8_e4m3fnuz,ck,85,0,107.2447,a8w8_bpreshuffle_256x64x128x128_16x16_16x16_8x32x1_8x32x1_1x32x1x8_8x8x1_2x1_intrawave_v3,262.82,470.84,0.0
gfx942,80,480,20480,1536,torch.float8_e4m3fnuz,ck,102,0,116.0509,a8w8_bpreshuffle_256x96x256x128_16x16_16x16_8x32x1_8x32x1_1x32x1x8_8x8x1_2x1_intrawave_v3,260.22,446.83,0.0
gfx942,80,512,20480,1536,torch.float8_e4m3fnuz,ck,71,0,115.4031,a8w8_bpreshuffle_256x128x128x64_16x16_16x16_4x64x1_4x64x1_1x32x1x8_8x8x1_2x1_intrawave_v3,279.13,461.12,0.0
gfx942,80,1024,20480,1536,torch.float8_e4m3fnuz,ck,71,0,217.3761,a8w8_bpreshuffle_256x128x128x64_16x16_16x16_4x64x1_4x64x1_1x32x1x8_8x8x1_2x1_intrawave_v3,296.37,344.9,0.0
gfx942,80,2048,20480,1536,torch.float8_e4m3fnuz,ck,71,0,416.8111,a8w8_bpreshuffle_256x128x128x64_16x16_16x16_4x64x1_4x64x1_1x32x1x8_8x8x1_2x1_intrawave_v3,309.13,284.28,0.0
gfx942,80,4096,20480,1536,torch.float8_e4m3fnuz,ck,71,0,813.4964,a8w8_bpreshuffle_256x128x128x64_16x16_16x16_4x64x1_4x64x1_1x32x1x8_8x8x1_2x1_intrawave_v3,316.78,252.64,0.0
gfx942,80,6144,20480,1536,torch.float8_e4m3fnuz,ck,71,0,1212.4912,a8w8_bpreshuffle_256x128x128x64_16x16_16x16_4x64x1_4x64x1_1x32x1x8_8x8x1_2x1_intrawave_v3,318.8,241.28,0.0
gfx942,80,8192,20480,1536,torch.float8_e4m3fnuz,ck,71,0,1603.169,a8w8_bpreshuffle_256x128x128x64_16x16_16x16_4x64x1_4x64x1_1x32x1x8_8x8x1_2x1_intrawave_v3,321.49,236.77,0.0
gfx942,80,10240,20480,1536,torch.float8_e4m3fnuz,ck,71,0,2006.1017,a8w8_bpreshuffle_256x128x128x64_16x16_16x16_4x64x1_4x64x1_1x32x1x8_8x8x1_2x1_intrawave_v3,321.14,232.6,0.0
gfx942,80,12288,20480,1536,torch.float8_e4m3fnuz,ck,71,0,2403.8234,a8w8_bpreshuffle_256x128x128x64_16x16_16x16_4x64x1_4x64x1_1x32x1x8_8x8x1_2x1_intrawave_v3,321.61,230.32,0.0
gfx942,80,14336,20480,1536,torch.float8_e4m3fnuz,ck,71,0,2816.6224,a8w8_bpreshuffle_256x128x128x64_16x16_16x16_4x64x1_4x64x1_1x32x1x8_8x8x1_2x1_intrawave_v3,320.22,227.46,0.0
gfx942,80,16384,20480,1536,torch.float8_e4m3fnuz,ck,71,0,3191.8526,a8w8_bpreshuffle_256x128x128x64_16x16_16x16_4x64x1_4x64x1_1x32x1x8_8x8x1_2x1_intrawave_v3,322.94,227.99,0.0
gfx942,80,32768,20480,1536,torch.float8_e4m3fnuz,ck,71,0,6375.7739,a8w8_bpreshuffle_256x128x128x64_16x16_16x16_4x64x1_4x64x1_1x32x1x8_8x8x1_2x1_intrawave_v3,323.35,223.34,0.0
gfx942,80,65536,20480,1536,torch.float8_e4m3fnuz,ck,71,0,12758.9582,a8w8_bpreshuffle_256x128x128x64_16x16_16x16_4x64x1_4x64x1_1x32x1x8_8x8x1_2x1_intrawave_v3,323.16,220.74,0.0
gfx942,80,98304,20480,1536,torch.float8_e4m3fnuz,ck,71,0,19087.7671,a8w8_bpreshuffle_256x128x128x64_16x16_16x16_4x64x1_4x64x1_1x32x1x8_8x8x1_2x1_intrawave_v3,324.02,220.51,0.0
gfx942,80,1,24576,1536,torch.float8_e4m3fnuz,ck,15,0,13.5093,a8w8_bpreshuffle_256x16x64x256_16x16_16x16_16x16x1_16x16x1_1x16x1x16_4x4x1_1x1_intrawave_v1,0.0,0.0,0.0
gfx942,80,2,24576,1536,torch.float8_e4m3fnuz,ck,108,0,13.6777,a8w8_bpreshuffle_256x16x64x256_16x16_16x16_16x16x1_16x16x1_1x16x1x16_4x4x1_1x1_intrawave_v1,0.0,0.0,0.0
gfx942,80,4,24576,1536,torch.float8_e4m3fnuz,ck,15,0,13.9333,a8w8_bpreshuffle_256x16x64x256_16x16_16x16_16x16x1_16x16x1_1x16x1x16_4x4x1_1x1_intrawave_v1,0.0,0.0,0.0
gfx942,80,8,24576,1536,torch.float8_e4m3fnuz,ck,9,0,14.5085,a8w8_bpreshuffle_128x16x32x128_16x16_16x16_8x16x1_8x16x1_1x16x1x8_4x4x1_1x1_intrawave_v1,0.0,0.0,0.0
gfx942,80,16,24576,1536,torch.float8_e4m3fnuz,ck,5,0,15.7929,a8w8_bpreshuffle_256x16x64x512_16x16_16x16_32x8x1_32x8x1_1x16x1x16_4x4x1_1x1_intrawave_v1,0.0,0.0,0.0
gfx942,80,32,24576,1536,torch.float8_e4m3fnuz,ck,112,0,19.3781,a8w8_bpreshuffle_256x32x64x256_16x16_16x16_16x16x1_16x16x1_1x32x1x8_8x8x1_2x1_intrawave_v1,1246.73,2031.71,0.0
gfx942,80,64,24576,1536,torch.float8_e4m3fnuz,ck,93,0,27.4074,a8w8_bpreshuffle_256x64x192x128_16x16_16x16_8x32x1_8x32x1_1x32x1x8_8x8x1_2x1_intrawave_v3,1762.97,1495.68,0.0
gfx942,80,96,24576,1536,torch.float8_e4m3fnuz,ck,94,0,34.225,a8w8_bpreshuffle_256x96x192x128_16x16_16x16_8x32x1_8x32x1_1x32x1x8_8x8x1_2x1_intrawave_v3,2117.68,1245.14,0.0
gfx942,80,128,24576,1536,torch.float8_e4m3fnuz,ck,85,0,42.5762,a8w8_bpreshuffle_256x64x128x128_16x16_16x16_8x32x1_8x32x1_1x32x1x8_8x8x1_2x1_intrawave_v3,2269.74,1039.0,0.0
gfx942,80,160,24576,1536,torch.float8_e4m3fnuz,ck,93,0,55.5159,a8w8_bpreshuffle_256x64x192x128_16x16_16x16_8x32x1_8x32x1_1x32x1x8_8x8x1_2x1_intrawave_v3,2175.88,826.05,0.0
gfx942,80,192,24576,1536,torch.float8_e4m3fnuz,ck,93,0,55.8139,a8w8_bpreshuffle_256x64x192x128_16x16_16x16_8x32x1_8x32x1_1x32x1x8_8x8x1_2x1_intrawave_v3,2597.12,850.7,0.0
gfx942,80,224,24576,1536,torch.float8_e4m3fnuz,ck,85,0,71.3416,a8w8_bpreshuffle_256x64x128x128_16x16_16x16_8x32x1_8x32x1_1x32x1x8_8x8x1_2x1_intrawave_v3,2370.49,688.28,0.0
gfx942,80,256,24576,1536,torch.float8_e4m3fnuz,ck,85,0,72.5312,a8w8_bpreshuffle_256x64x128x128_16x16_16x16_8x32x1_8x32x1_1x32x1x8_8x8x1_2x1_intrawave_v3,2664.7,699.35,0.0
gfx942,80,288,24576,1536,torch.float8_e4m3fnuz,ck,94,0,79.4368,a8w8_bpreshuffle_256x96x192x128_16x16_16x16_8x32x1_8x32x1_1x32x1x8_8x8x1_2x1_intrawave_v3,2737.18,658.98,0.0
gfx942,80,320,24576,1536,torch.float8_e4m3fnuz,ck,93,0,84.1633,a8w8_bpreshuffle_256x64x192x128_16x16_16x16_8x32x1_8x32x1_1x32x1x8_8x8x1_2x1_intrawave_v3,2870.51,641.24,0.0
gfx942,80,352,24576,1536,torch.float8_e4m3fnuz,ck,93,0,101.4118,a8w8_bpreshuffle_256x64x192x128_16x16_16x16_8x32x1_8x32x1_1x32x1x8_8x8x1_2x1_intrawave_v3,2620.51,548.17,0.0
gfx942,80,384,24576,1536,torch.float8_e4m3fnuz,ck,93,0,99.8625,a8w8_bpreshuffle_256x64x192x128_16x16_16x16_8x32x1_8x32x1_1x32x1x8_8x8x1_2x1_intrawave_v3,2903.09,572.92,0.0
gfx942,80,416,24576,1536,torch.float8_e4m3fnuz,ck,102,0,122.5387,a8w8_bpreshuffle_256x96x256x128_16x16_16x16_8x32x1_8x32x1_1x32x1x8_8x8x1_2x1_intrawave_v3,0.0,0.0,0.0
gfx942,80,448,24576,1536,torch.float8_e4m3fnuz,ck,93,0,117.3539,a8w8_bpreshuffle_256x64x192x128_16x16_16x16_8x32x1_8x32x1_1x32x1x8_8x8x1_2x1_intrawave_v3,0.0,0.0,0.0
gfx942,80,480,24576,1536,torch.float8_e4m3fnuz,ck,102,0,119.4687,a8w8_bpreshuffle_256x96x256x128_16x16_16x16_8x32x1_8x32x1_1x32x1x8_8x8x1_2x1_intrawave_v3,0.0,0.0,0.0
gfx942,80,512,24576,1536,torch.float8_e4m3fnuz,ck,93,0,126.7363,a8w8_bpreshuffle_256x64x192x128_16x16_16x16_8x32x1_8x32x1_1x32x1x8_8x8x1_2x1_intrawave_v3,0.0,0.0,0.0
gfx942,80,1024,24576,1536,torch.float8_e4m3fnuz,ck,68,0,241.8128,a8w8_bpreshuffle_256x128x192x128_16x16_16x16_8x32x1_8x32x1_1x32x1x8_8x8x1_2x1_intrawave_v3,0.0,0.0,0.0
gfx942,80,2048,24576,1536,torch.float8_e4m3fnuz,ck,71,0,459.7917,a8w8_bpreshuffle_256x128x128x64_16x16_16x16_4x64x1_4x64x1_1x32x1x8_8x8x1_2x1_intrawave_v3,0.0,0.0,0.0
gfx942,80,4096,24576,1536,torch.float8_e4m3fnuz,ck,72,0,920.9012,a8w8_bpreshuffle_256x64x256x64_16x16_16x16_4x64x1_4x64x1_1x16x1x16_8x8x1_1x2_intrawave_v1,0.0,0.0,0.0
gfx942,80,6144,24576,1536,torch.float8_e4m3fnuz,ck,71,0,1348.8178,a8w8_bpreshuffle_256x128x128x64_16x16_16x16_4x64x1_4x64x1_1x32x1x8_8x8x1_2x1_intrawave_v3,0.0,0.0,0.0
gfx942,80,8192,24576,1536,torch.float8_e4m3fnuz,ck,71,0,1786.9965,a8w8_bpreshuffle_256x128x128x64_16x16_16x16_4x64x1_4x64x1_1x32x1x8_8x8x1_2x1_intrawave_v3,0.0,0.0,0.0
gfx942,80,10240,24576,1536,torch.float8_e4m3fnuz,ck,71,0,2209.3759,a8w8_bpreshuffle_256x128x128x64_16x16_16x16_4x64x1_4x64x1_1x32x1x8_8x8x1_2x1_intrawave_v3,0.0,0.0,0.0
gfx942,80,12288,24576,1536,torch.float8_e4m3fnuz,ck,71,0,2656.0688,a8w8_bpreshuffle_256x128x128x64_16x16_16x16_4x64x1_4x64x1_1x32x1x8_8x8x1_2x1_intrawave_v3,0.0,0.0,0.0
gfx942,80,14336,24576,1536,torch.float8_e4m3fnuz,ck,71,0,3089.1315,a8w8_bpreshuffle_256x128x128x64_16x16_16x16_4x64x1_4x64x1_1x32x1x8_8x8x1_2x1_intrawave_v3,0.0,0.0,0.0
gfx942,80,16384,24576,1536,torch.float8_e4m3fnuz,ck,71,0,3536.4999,a8w8_bpreshuffle_256x128x128x64_16x16_16x16_4x64x1_4x64x1_1x32x1x8_8x8x1_2x1_intrawave_v3,0.0,0.0,0.0
gfx942,80,32768,24576,1536,torch.float8_e4m3fnuz,ck,71,0,7017.8836,a8w8_bpreshuffle_256x128x128x64_16x16_16x16_4x64x1_4x64x1_1x32x1x8_8x8x1_2x1_intrawave_v3,0.0,0.0,0.0
gfx942,80,65536,24576,1536,torch.float8_e4m3fnuz,ck,0,0,inf,a8w8_bpreshuffle_256x128x128x128_16x16_16x16_8x32x1_8x32x1_1x32x1x8_8x8x1_2x1_intrawave_v3,0.0,0.0,0.0
gfx942,80,98304,24576,1536,torch.float8_e4m3fnuz,ck,0,0,1.0,a8w8_bpreshuffle_256x128x128x128_16x16_16x16_8x32x1_8x32x1_1x32x1x8_8x8x1_2x1_intrawave_v3,0.0,0.0,0.0
gfx942,80,131072,24576,1536,torch.float8_e4m3fnuz,ck,0,0,1.0,a8w8_bpreshuffle_256x128x128x128_16x16_16x16_8x32x1_8x32x1_1x32x1x8_8x8x1_2x1_intrawave_v3,0.0,0.0,0.0
gfx942,80,1,32768,512,torch.float8_e4m3fnuz,ck,9,0,9.7066,a8w8_bpreshuffle_128x16x32x128_16x16_16x16_8x16x1_8x16x1_1x16x1x8_4x4x1_1x1_intrawave_v1,0.0,0.0,0.0
gfx942,80,1,32768,1536,torch.float8_e4m3fnuz,ck,15,0,17.5611,a8w8_bpreshuffle_256x16x64x256_16x16_16x16_16x16x1_16x16x1_1x16x1x16_4x4x1_1x1_intrawave_v1,0.0,0.0,0.0
gfx942,80,2,32768,512,torch.float8_e4m3fnuz,ck,9,0,9.513,a8w8_bpreshuffle_128x16x32x128_16x16_16x16_8x16x1_8x16x1_1x16x1x8_4x4x1_1x1_intrawave_v1,0.0,0.0,0.0
gfx942,80,2,32768,1536,torch.float8_e4m3fnuz,ck,108,0,17.4059,a8w8_bpreshuffle_256x16x64x256_16x16_16x16_16x16x1_16x16x1_1x16x1x16_4x4x1_1x1_intrawave_v1,0.0,0.0,0.0
gfx942,80,4,32768,512,torch.float8_e4m3fnuz,ck,23,0,9.1702,a8w8_bpreshuffle_128x16x32x128_16x16_16x16_8x16x1_8x16x1_1x16x1x8_4x4x1_1x1_intrawave_v2,0.0,0.0,0.0
gfx942,80,4,32768,1536,torch.float8_e4m3fnuz,ck,109,0,18.3707,a8w8_bpreshuffle_256x16x128x256_16x16_16x16_16x16x1_16x16x1_1x16x1x16_8x8x1_1x2_intrawave_v1,0.0,0.0,0.0
gfx942,80,8,32768,512,torch.float8_e4m3fnuz,ck,9,0,9.9258,a8w8_bpreshuffle_128x16x32x128_16x16_16x16_8x16x1_8x16x1_1x16x1x8_4x4x1_1x1_intrawave_v1,0.0,0.0,0.0
gfx942,80,8,32768,1536,torch.float8_e4m3fnuz,ck,5,0,18.2531,a8w8_bpreshuffle_256x16x64x512_16x16_16x16_32x8x1_32x8x1_1x16x1x16_4x4x1_1x1_intrawave_v1,0.0,0.0,0.0
gfx942,80,16,32768,512,torch.float8_e4m3fnuz,ck,9,0,10.2342,a8w8_bpreshuffle_128x16x32x128_16x16_16x16_8x16x1_8x16x1_1x16x1x8_4x4x1_1x1_intrawave_v1,0.0,0.0,0.0
gfx942,80,16,32768,1536,torch.float8_e4m3fnuz,ck,5,0,19.2975,a8w8_bpreshuffle_256x16x64x512_16x16_16x16_32x8x1_32x8x1_1x16x1x16_4x4x1_1x1_intrawave_v1,0.0,0.0,0.0
gfx942,80,32,32768,512,torch.float8_e4m3fnuz,ck,76,0,12.0918,a8w8_bpreshuffle_256x32x64x128_16x16_16x16_8x32x1_8x32x1_1x32x1x8_8x8x1_2x1_intrawave_v1,0.0,0.0,0.0
gfx942,80,32,32768,1536,torch.float8_e4m3fnuz,ck,119,0,24.3999,a8w8_bpreshuffle_256x32x128x256_16x16_16x16_16x16x1_16x16x1_1x16x1x16_8x8x1_1x2_intrawave_v1,0.0,0.0,0.0
gfx942,80,64,32768,512,torch.float8_e4m3fnuz,ck,85,0,18.7478,a8w8_bpreshuffle_256x64x128x128_16x16_16x16_8x32x1_8x32x1_1x32x1x8_8x8x1_2x1_intrawave_v3,0.0,0.0,0.0
gfx942,80,64,32768,1536,torch.float8_e4m3fnuz,ck,101,0,34.2699,a8w8_bpreshuffle_256x64x256x128_16x16_16x16_8x32x1_8x32x1_1x32x1x8_8x8x1_2x1_intrawave_v3,0.0,0.0,0.0
gfx942,80,96,32768,512,torch.float8_e4m3fnuz,ck,84,0,23.8023,a8w8_bpreshuffle_256x32x128x128_16x16_16x16_8x32x1_8x32x1_1x32x1x8_8x8x1_2x1_intrawave_v1,0.0,0.0,0.0
gfx942,80,96,32768,1536,torch.float8_e4m3fnuz,ck,102,0,43.5312,a8w8_bpreshuffle_256x96x256x128_16x16_16x16_8x32x1_8x32x1_1x32x1x8_8x8x1_2x1_intrawave_v3,0.0,0.0,0.0
gfx942,80,128,32768,512,torch.float8_e4m3fnuz,ck,85,0,28.3083,a8w8_bpreshuffle_256x64x128x128_16x16_16x16_8x32x1_8x32x1_1x32x1x8_8x8x1_2x1_intrawave_v3,0.0,0.0,0.0
gfx942,80,128,32768,1536,torch.float8_e4m3fnuz,ck,85,0,54.7332,a8w8_bpreshuffle_256x64x128x128_16x16_16x16_8x32x1_8x32x1_1x32x1x8_8x8x1_2x1_intrawave_v3,0.0,0.0,0.0
gfx942,80,160,32768,512,torch.float8_e4m3fnuz,ck,84,0,34.3591,a8w8_bpreshuffle_256x32x128x128_16x16_16x16_8x32x1_8x32x1_1x32x1x8_8x8x1_2x1_intrawave_v1,0.0,0.0,0.0
gfx942,80,160,32768,1536,torch.float8_e4m3fnuz,ck,100,0,73.0357,a8w8_bpreshuffle_256x32x256x128_16x16_16x16_8x32x1_8x32x1_1x32x1x8_8x8x1_2x1_intrawave_v1,0.0,0.0,0.0
gfx942,80,192,32768,512,torch.float8_e4m3fnuz,ck,85,0,37.0759,a8w8_bpreshuffle_256x64x128x128_16x16_16x16_8x32x1_8x32x1_1x32x1x8_8x8x1_2x1_intrawave_v3,0.0,0.0,0.0
gfx942,80,192,32768,1536,torch.float8_e4m3fnuz,ck,85,0,73.3389,a8w8_bpreshuffle_256x64x128x128_16x16_16x16_8x32x1_8x32x1_1x32x1x8_8x8x1_2x1_intrawave_v3,0.0,0.0,0.0
gfx942,80,224,32768,512,torch.float8_e4m3fnuz,ck,84,0,45.0439,a8w8_bpreshuffle_256x32x128x128_16x16_16x16_8x32x1_8x32x1_1x32x1x8_8x8x1_2x1_intrawave_v1,0.0,0.0,0.0
gfx942,80,224,32768,1536,torch.float8_e4m3fnuz,ck,85,0,91.0766,a8w8_bpreshuffle_256x64x128x128_16x16_16x16_8x32x1_8x32x1_1x32x1x8_8x8x1_2x1_intrawave_v3,0.0,0.0,0.0
gfx942,80,256,32768,512,torch.float8_e4m3fnuz,ck,85,0,46.3119,a8w8_bpreshuffle_256x64x128x128_16x16_16x16_8x32x1_8x32x1_1x32x1x8_8x8x1_2x1_intrawave_v3,0.0,0.0,0.0
gfx942,80,256,32768,1536,torch.float8_e4m3fnuz,ck,85,0,92.2438,a8w8_bpreshuffle_256x64x128x128_16x16_16x16_8x32x1_8x32x1_1x32x1x8_8x8x1_2x1_intrawave_v3,0.0,0.0,0.0
gfx942,80,288,32768,512,torch.float8_e4m3fnuz,ck,84,0,53.506,a8w8_bpreshuffle_256x32x128x128_16x16_16x16_8x32x1_8x32x1_1x32x1x8_8x8x1_2x1_intrawave_v1,0.0,0.0,0.0
gfx942,80,288,32768,1536,torch.float8_e4m3fnuz,ck,102,0,101.9306,a8w8_bpreshuffle_256x96x256x128_16x16_16x16_8x32x1_8x32x1_1x32x1x8_8x8x1_2x1_intrawave_v3,0.0,0.0,0.0
gfx942,80,320,32768,512,torch.float8_e4m3fnuz,ck,85,0,55.0543,a8w8_bpreshuffle_256x64x128x128_16x16_16x16_8x32x1_8x32x1_1x32x1x8_8x8x1_2x1_intrawave_v3,0.0,0.0,0.0
gfx942,80,320,32768,1536,torch.float8_e4m3fnuz,ck,85,0,114.3911,a8w8_bpreshuffle_256x64x128x128_16x16_16x16_8x32x1_8x32x1_1x32x1x8_8x8x1_2x1_intrawave_v3,0.0,0.0,0.0
gfx942,80,352,32768,512,torch.float8_e4m3fnuz,ck,72,0,64.3624,a8w8_bpreshuffle_256x64x256x64_16x16_16x16_4x64x1_4x64x1_1x16x1x16_8x8x1_1x2_intrawave_v1,0.0,0.0,0.0
gfx942,80,352,32768,1536,torch.float8_e4m3fnuz,ck,71,0,132.552,a8w8_bpreshuffle_256x128x128x64_16x16_16x16_4x64x1_4x64x1_1x32x1x8_8x8x1_2x1_intrawave_v3,0.0,0.0,0.0
gfx942,80,384,32768,512,torch.float8_e4m3fnuz,ck,85,0,63.438,a8w8_bpreshuffle_256x64x128x128_16x16_16x16_8x32x1_8x32x1_1x32x1x8_8x8x1_2x1_intrawave_v3,0.0,0.0,0.0
gfx942,80,384,32768,1536,torch.float8_e4m3fnuz,ck,71,0,132.9488,a8w8_bpreshuffle_256x128x128x64_16x16_16x16_4x64x1_4x64x1_1x32x1x8_8x8x1_2x1_intrawave_v3,0.0,0.0,0.0
gfx942,80,416,32768,512,torch.float8_e4m3fnuz,ck,84,0,73.9008,a8w8_bpreshuffle_256x32x128x128_16x16_16x16_8x32x1_8x32x1_1x32x1x8_8x8x1_2x1_intrawave_v1,0.0,0.0,0.0
gfx942,80,416,32768,1536,torch.float8_e4m3fnuz,ck,85,0,155.3704,a8w8_bpreshuffle_256x64x128x128_16x16_16x16_8x32x1_8x32x1_1x32x1x8_8x8x1_2x1_intrawave_v3,0.0,0.0,0.0
gfx942,80,448,32768,512,torch.float8_e4m3fnuz,ck,85,0,72.2692,a8w8_bpreshuffle_256x64x128x128_16x16_16x16_8x32x1_8x32x1_1x32x1x8_8x8x1_2x1_intrawave_v3,0.0,0.0,0.0
gfx942,80,448,32768,1536,torch.float8_e4m3fnuz,ck,85,0,153.3388,a8w8_bpreshuffle_256x64x128x128_16x16_16x16_8x32x1_8x32x1_1x32x1x8_8x8x1_2x1_intrawave_v3,0.0,0.0,0.0
gfx942,80,480,32768,512,torch.float8_e4m3fnuz,ck,102,0,81.2012,a8w8_bpreshuffle_256x96x256x128_16x16_16x16_8x32x1_8x32x1_1x32x1x8_8x8x1_2x1_intrawave_v3,0.0,0.0,0.0
gfx942,80,480,32768,1536,torch.float8_e4m3fnuz,ck,102,0,155.1241,a8w8_bpreshuffle_256x96x256x128_16x16_16x16_8x32x1_8x32x1_1x32x1x8_8x8x1_2x1_intrawave_v3,0.0,0.0,0.0
gfx942,80,512,32768,512,torch.float8_e4m3fnuz,ck,85,0,82.7804,a8w8_bpreshuffle_256x64x128x128_16x16_16x16_8x32x1_8x32x1_1x32x1x8_8x8x1_2x1_intrawave_v3,0.0,0.0,0.0
gfx942,80,512,32768,1536,torch.float8_e4m3fnuz,ck,71,0,167.8113,a8w8_bpreshuffle_256x128x128x64_16x16_16x16_4x64x1_4x64x1_1x32x1x8_8x8x1_2x1_intrawave_v3,0.0,0.0,0.0
gfx942,80,1024,32768,512,torch.float8_e4m3fnuz,ck,71,0,148.0686,a8w8_bpreshuffle_256x128x128x64_16x16_16x16_4x64x1_4x64x1_1x32x1x8_8x8x1_2x1_intrawave_v3,0.0,0.0,0.0
gfx942,80,1024,32768,1536,torch.float8_e4m3fnuz,ck,71,0,317.4319,a8w8_bpreshuffle_256x128x128x64_16x16_16x16_4x64x1_4x64x1_1x32x1x8_8x8x1_2x1_intrawave_v3,0.0,0.0,0.0
gfx942,80,2048,32768,512,torch.float8_e4m3fnuz,ck,71,0,283.8954,a8w8_bpreshuffle_256x128x128x64_16x16_16x16_4x64x1_4x64x1_1x32x1x8_8x8x1_2x1_intrawave_v3,0.0,0.0,0.0
gfx942,80,2048,32768,1536,torch.float8_e4m3fnuz,ck,71,0,610.8983,a8w8_bpreshuffle_256x128x128x64_16x16_16x16_4x64x1_4x64x1_1x32x1x8_8x8x1_2x1_intrawave_v3,0.0,0.0,0.0
gfx942,80,4096,32768,512,torch.float8_e4m3fnuz,ck,71,0,554.3222,a8w8_bpreshuffle_256x128x128x64_16x16_16x16_4x64x1_4x64x1_1x32x1x8_8x8x1_2x1_intrawave_v3,0.0,0.0,0.0
gfx942,80,4096,32768,1536,torch.float8_e4m3fnuz,ck,71,0,1193.686,a8w8_bpreshuffle_256x128x128x64_16x16_16x16_4x64x1_4x64x1_1x32x1x8_8x8x1_2x1_intrawave_v3,0.0,0.0,0.0
gfx942,80,6144,32768,512,torch.float8_e4m3fnuz,ck,71,0,793.4262,a8w8_bpreshuffle_256x128x128x64_16x16_16x16_4x64x1_4x64x1_1x32x1x8_8x8x1_2x1_intrawave_v3,0.0,0.0,0.0
gfx942,80,6144,32768,1536,torch.float8_e4m3fnuz,ck,102,0,1794.6908,a8w8_bpreshuffle_256x96x256x128_16x16_16x16_8x32x1_8x32x1_1x32x1x8_8x8x1_2x1_intrawave_v3,0.0,0.0,0.0
gfx942,80,8192,32768,512,torch.float8_e4m3fnuz,ck,71,0,1053.245,a8w8_bpreshuffle_256x128x128x64_16x16_16x16_4x64x1_4x64x1_1x32x1x8_8x8x1_2x1_intrawave_v3,0.0,0.0,0.0
gfx942,80,8192,32768,1536,torch.float8_e4m3fnuz,ck,71,0,2345.8711,a8w8_bpreshuffle_256x128x128x64_16x16_16x16_4x64x1_4x64x1_1x32x1x8_8x8x1_2x1_intrawave_v3,0.0,0.0,0.0
gfx942,80,10240,32768,512,torch.float8_e4m3fnuz,ck,72,0,1357.7711,a8w8_bpreshuffle_256x64x256x64_16x16_16x16_4x64x1_4x64x1_1x16x1x16_8x8x1_1x2_intrawave_v1,0.0,0.0,0.0
gfx942,80,10240,32768,1536,torch.float8_e4m3fnuz,ck,71,0,2923.8951,a8w8_bpreshuffle_256x128x128x64_16x16_16x16_4x64x1_4x64x1_1x32x1x8_8x8x1_2x1_intrawave_v3,0.0,0.0,0.0
gfx942,80,12288,32768,512,torch.float8_e4m3fnuz,ck,71,0,1573.8691,a8w8_bpreshuffle_256x128x128x64_16x16_16x16_4x64x1_4x64x1_1x32x1x8_8x8x1_2x1_intrawave_v3,0.0,0.0,0.0
gfx942,80,12288,32768,1536,torch.float8_e4m3fnuz,ck,71,0,3526.7572,a8w8_bpreshuffle_256x128x128x64_16x16_16x16_4x64x1_4x64x1_1x32x1x8_8x8x1_2x1_intrawave_v3,0.0,0.0,0.0
gfx942,80,14336,32768,512,torch.float8_e4m3fnuz,ck,71,0,1827.3845,a8w8_bpreshuffle_256x128x128x64_16x16_16x16_4x64x1_4x64x1_1x32x1x8_8x8x1_2x1_intrawave_v3,0.0,0.0,0.0
gfx942,80,14336,32768,1536,torch.float8_e4m3fnuz,ck,71,0,4108.8811,a8w8_bpreshuffle_256x128x128x64_16x16_16x16_4x64x1_4x64x1_1x32x1x8_8x8x1_2x1_intrawave_v3,0.0,0.0,0.0
gfx942,80,16384,32768,512,torch.float8_e4m3fnuz,ck,71,0,2090.8366,a8w8_bpreshuffle_256x128x128x64_16x16_16x16_4x64x1_4x64x1_1x32x1x8_8x8x1_2x1_intrawave_v3,0.0,0.0,0.0
gfx942,80,16384,32768,1536,torch.float8_e4m3fnuz,ck,71,0,4672.9569,a8w8_bpreshuffle_256x128x128x64_16x16_16x16_4x64x1_4x64x1_1x32x1x8_8x8x1_2x1_intrawave_v3,0.0,0.0,0.0
gfx942,80,32768,32768,512,torch.float8_e4m3fnuz,ck,71,0,4165.6734,a8w8_bpreshuffle_256x128x128x64_16x16_16x16_4x64x1_4x64x1_1x32x1x8_8x8x1_2x1_intrawave_v3,0.0,0.0,0.0
gfx942,80,32768,32768,1536,torch.float8_e4m3fnuz,ck,71,0,9432.9791,a8w8_bpreshuffle_256x128x128x64_16x16_16x16_4x64x1_4x64x1_1x32x1x8_8x8x1_2x1_intrawave_v3,0.0,0.0,0.0
gfx942,80,65536,32768,512,torch.float8_e4m3fnuz,ck,74,0,1.0,a8w8_bpreshuffle_256x64x256x64_16x16_16x16_4x64x1_4x64x1_1x32x1x8_8x8x1_2x1_intrawave_v1,0.0,0.0,0.0
gfx942,80,65536,32768,1536,torch.float8_e4m3fnuz,ck,0,0,1.0,a8w8_bpreshuffle_256x128x128x128_16x16_16x16_8x32x1_8x32x1_1x32x1x8_8x8x1_2x1_intrawave_v3,0.0,0.0,0.0
gfx942,80,98304,32768,1536,torch.float8_e4m3fnuz,ck,0,0,1.0,a8w8_bpreshuffle_256x128x128x128_16x16_16x16_8x32x1_8x32x1_1x32x1x8_8x8x1_2x1_intrawave_v3,0.0,0.0,0.0
gfx942,80,1,36864,7168,torch.float8_e4m3fnuz,ck,6,0,76.2189,a8w8_bpreshuffle_256x16x128x512_16x16_16x16_32x8x1_32x8x1_1x16x1x16_8x8x1_1x2_intrawave_v1,0.0,0.0,0.0
gfx942,80,2,36864,7168,torch.float8_e4m3fnuz,ck,20,0,78.3165,a8w8_bpreshuffle_256x16x128x512_16x16_16x16_32x8x1_32x8x1_1x16x1x16_8x8x1_1x2_intrawave_v2,0.0,0.0,0.0
gfx942,80,4,36864,7168,torch.float8_e4m3fnuz,ck,32,0,78.8657,a8w8_bpreshuffle_256x16x512x256_16x16_16x16_16x16x1_16x16x1_1x16x1x16_8x8x1_1x2_intrawave_v2,0.0,0.0,0.0
gfx942,80,8,36864,7168,torch.float8_e4m3fnuz,ck,111,0,79.5469,a8w8_bpreshuffle_256x16x512x256_16x16_16x16_16x16x1_16x16x1_1x16x1x16_8x8x1_1x2_intrawave_v1,0.0,0.0,0.0
gfx942,80,16,36864,7168,torch.float8_e4m3fnuz,ck,6,0,80.7001,a8w8_bpreshuffle_256x16x128x512_16x16_16x16_32x8x1_32x8x1_1x16x1x16_8x8x1_1x2_intrawave_v1,0.0,0.0,0.0
gfx942,80,32,36864,7168,torch.float8_e4m3fnuz,ck,133,0,93.517,a8w8_bpreshuffle_256x32x256x256_16x16_16x16_16x16x1_16x16x1_1x16x1x16_8x8x1_1x2_intrawave_v1,0.0,0.0,0.0
gfx942,80,64,36864,7168,torch.float8_e4m3fnuz,ck,121,0,129.978,a8w8_bpreshuffle_256x64x128x256_16x16_16x16_16x16x1_16x16x1_1x16x1x16_8x8x1_1x2_intrawave_v3,0.0,0.0,0.0
gfx942,80,96,36864,7168,torch.float8_e4m3fnuz,ck,102,0,155.5081,a8w8_bpreshuffle_256x96x256x128_16x16_16x16_8x32x1_8x32x1_1x32x1x8_8x8x1_2x1_intrawave_v3,0.0,0.0,0.0
gfx942,80,128,36864,7168,torch.float8_e4m3fnuz,ck,93,0,201.1007,a8w8_bpreshuffle_256x64x192x128_16x16_16x16_8x32x1_8x32x1_1x32x1x8_8x8x1_2x1_intrawave_v3,0.0,0.0,0.0
gfx942,80,160,36864,7168,torch.float8_e4m3fnuz,ck,156,0,267.3258,a8w8_bpreshuffle_256x160x256x128_16x16_16x16_8x32x1_8x32x1_1x16x1x16_8x8x1_1x2_intrawave_v3,0.0,0.0,0.0
gfx942,80,192,36864,7168,torch.float8_e4m3fnuz,ck,94,0,286.0543,a8w8_bpreshuffle_256x96x192x128_16x16_16x16_8x32x1_8x32x1_1x32x1x8_8x8x1_2x1_intrawave_v3,0.0,0.0,0.0
gfx942,80,224,36864,7168,torch.float8_e4m3fnuz,ck,40,0,377.2671,a8w8_bpreshuffle_256x224x256x128_16x16_16x16_8x32x1_8x32x1_1x32x1x8_8x8x1_2x1_intrawave_v3,0.0,0.0,0.0
gfx942,80,256,36864,7168,torch.float8_e4m3fnuz,ck,68,0,371.2046,a8w8_bpreshuffle_256x128x192x128_16x16_16x16_8x32x1_8x32x1_1x32x1x8_8x8x1_2x1_intrawave_v3,0.0,0.0,0.0
gfx942,80,288,36864,7168,torch.float8_e4m3fnuz,ck,102,0,437.3066,a8w8_bpreshuffle_256x96x256x128_16x16_16x16_8x32x1_8x32x1_1x32x1x8_8x8x1_2x1_intrawave_v3,0.0,0.0,0.0
gfx942,80,320,36864,7168,torch.float8_e4m3fnuz,ck,128,0,476.2091,a8w8_bpreshuffle_256x64x192x256_16x16_16x16_16x16x1_16x16x1_1x32x1x8_8x8x1_2x1_intrawave_v3,0.0,0.0,0.0
gfx942,80,352,36864,7168,torch.float8_e4m3fnuz,ck,71,0,568.6663,a8w8_bpreshuffle_256x128x128x64_16x16_16x16_4x64x1_4x64x1_1x32x1x8_8x8x1_2x1_intrawave_v3,0.0,0.0,0.0
gfx942,80,384,36864,7168,torch.float8_e4m3fnuz,ck,94,0,555.2415,a8w8_bpreshuffle_256x96x192x128_16x16_16x16_8x32x1_8x32x1_1x32x1x8_8x8x1_2x1_intrawave_v3,0.0,0.0,0.0
gfx942,80,416,36864,7168,torch.float8_e4m3fnuz,ck,93,0,649.7863,a8w8_bpreshuffle_256x64x192x128_16x16_16x16_8x32x1_8x32x1_1x32x1x8_8x8x1_2x1_intrawave_v3,0.0,0.0,0.0
gfx942,80,448,36864,7168,torch.float8_e4m3fnuz,ck,93,0,631.7091,a8w8_bpreshuffle_256x64x192x128_16x16_16x16_8x32x1_8x32x1_1x32x1x8_8x8x1_2x1_intrawave_v3,0.0,0.0,0.0
gfx942,80,480,36864,7168,torch.float8_e4m3fnuz,ck,102,0,655.0492,a8w8_bpreshuffle_256x96x256x128_16x16_16x16_8x32x1_8x32x1_1x32x1x8_8x8x1_2x1_intrawave_v3,0.0,0.0,0.0
gfx942,80,512,36864,7168,torch.float8_e4m3fnuz,ck,68,0,726.0635,a8w8_bpreshuffle_256x128x192x128_16x16_16x16_8x32x1_8x32x1_1x32x1x8_8x8x1_2x1_intrawave_v3,0.0,0.0,0.0
gfx942,80,1024,36864,7168,torch.float8_e4m3fnuz,ck,93,0,1406.3674,a8w8_bpreshuffle_256x64x192x128_16x16_16x16_8x32x1_8x32x1_1x32x1x8_8x8x1_2x1_intrawave_v3,0.0,0.0,0.0
gfx942,80,2048,36864,7168,torch.float8_e4m3fnuz,ck,93,0,2759.912,a8w8_bpreshuffle_256x64x192x128_16x16_16x16_8x32x1_8x32x1_1x32x1x8_8x8x1_2x1_intrawave_v3,0.0,0.0,0.0
gfx942,80,4096,36864,7168,torch.float8_e4m3fnuz,ck,93,0,5492.6804,a8w8_bpreshuffle_256x64x192x128_16x16_16x16_8x32x1_8x32x1_1x32x1x8_8x8x1_2x1_intrawave_v3,0.0,0.0,0.0
gfx942,80,6144,36864,7168,torch.float8_e4m3fnuz,ck,93,0,8229.8778,a8w8_bpreshuffle_256x64x192x128_16x16_16x16_8x32x1_8x32x1_1x32x1x8_8x8x1_2x1_intrawave_v3,0.0,0.0,0.0
gfx942,80,8192,36864,7168,torch.float8_e4m3fnuz,ck,93,0,10983.7146,a8w8_bpreshuffle_256x64x192x128_16x16_16x16_8x32x1_8x32x1_1x32x1x8_8x8x1_2x1_intrawave_v3,0.0,0.0,0.0
gfx942,80,10240,36864,7168,torch.float8_e4m3fnuz,ck,93,0,13738.3404,a8w8_bpreshuffle_256x64x192x128_16x16_16x16_8x32x1_8x32x1_1x32x1x8_8x8x1_2x1_intrawave_v3,0.0,0.0,0.0
gfx942,80,12288,36864,7168,torch.float8_e4m3fnuz,ck,93,0,16426.5845,a8w8_bpreshuffle_256x64x192x128_16x16_16x16_8x32x1_8x32x1_1x32x1x8_8x8x1_2x1_intrawave_v3,0.0,0.0,0.0
gfx942,80,14336,36864,7168,torch.float8_e4m3fnuz,ck,93,0,19165.8682,a8w8_bpreshuffle_256x64x192x128_16x16_16x16_8x32x1_8x32x1_1x32x1x8_8x8x1_2x1_intrawave_v3,0.0,0.0,0.0
gfx942,80,16384,36864,7168,torch.float8_e4m3fnuz,ck,71,0,21975.6028,a8w8_bpreshuffle_256x128x128x64_16x16_16x16_4x64x1_4x64x1_1x32x1x8_8x8x1_2x1_intrawave_v3,0.0,0.0,0.0
gfx942,80,32768,36864,7168,torch.float8_e4m3fnuz,ck,93,0,43711.479,a8w8_bpreshuffle_256x64x192x128_16x16_16x16_8x32x1_8x32x1_1x32x1x8_8x8x1_2x1_intrawave_v3,0.0,0.0,0.0
gfx942,80,65536,36864,7168,torch.float8_e4m3fnuz,ck,0,0,1.0,a8w8_bpreshuffle_256x128x128x128_16x16_16x16_8x32x1_8x32x1_1x32x1x8_8x8x1_2x1_intrawave_v3,0.0,0.0,0.0
gfx950,256,1,256,7168,torch.float8_e4m3fn,flydsl,849,0,6.7986,flydsl_bpreshuflle_16x64x512_F8_F8_B16_1x3x0x2_default,0.54,271.04,0.0
gfx950,256,2,256,7168,torch.float8_e4m3fn,flydsl,125,0,6.8443,flydsl_bpreshuflle_16x64x512_F8_F8_B16_1x0x0x2_default,1.07,270.35,0.0
gfx950,256,4,256,7168,torch.float8_e4m3fn,flydsl,373,0,6.9033,flydsl_bpreshuflle_16x64x512_F8_F8_B16_1x1x0x2_default,2.13,270.27,0.0
gfx950,256,8,256,7168,torch.float8_e4m3fn,flydsl,125,0,6.9106,flydsl_bpreshuflle_16x64x512_F8_F8_B16_1x0x0x2_default,4.25,274.43,0.0
gfx950,256,16,256,7168,torch.float8_e4m3fn,flydsl,1059,0,6.9994,flydsl_bpreshuflle_16x64x512_F8_F8_B16_1x4x0x2_default,8.39,279.72,0.0
gfx950,256,32,256,7168,torch.float8_e4m3fn,ck,10,0,6.5923,a8w8_bpreshuffle_128x16x32x512_16x16_16x16_32x4x1_32x4x1_1x16x1x8_4x4x1_1x1_intrawave_v1,17.81,315.64,0.0
gfx950,256,64,256,7168,torch.float8_e4m3fn,flydsl,677,0,8.336,flydsl_bpreshuflle_16x64x512_F8_F8_B16_1x2x4x2_default,28.18,279.09,0.0
gfx950,256,128,256,7168,torch.float8_e4m3fn,ck,8,0,9.6997,a8w8_bpreshuffle_128x32x16x512_16x16_16x16_32x4x1_32x4x1_1x32x1x4_4x4x1_1x1_intrawave_v1,48.43,290.53,0.0
gfx950,256,256,256,7168,torch.float8_e4m3fn,ck,10,0,10.2056,a8w8_bpreshuffle_128x16x32x512_16x16_16x16_32x4x1_32x4x1_1x16x1x8_4x4x1_1x1_intrawave_v1,92.06,372.45,0.0
gfx950,256,512,256,7168,torch.float8_e4m3fn,ck,10,0,10.4502,a8w8_bpreshuffle_128x16x32x512_16x16_16x16_32x4x1_32x4x1_1x16x1x8_4x4x1_1x1_intrawave_v1,179.81,551.87,0.0
gfx950,256,1024,256,7168,torch.float8_e4m3fn,flydsl,849,0,11.5947,flydsl_bpreshuflle_16x64x512_F8_F8_B16_1x3x0x2_default,324.12,836.53,0.0
gfx950,256,2048,256,7168,torch.float8_e4m3fn,flydsl,134,0,12.8261,flydsl_bpreshuflle_32x64x512_F8_F8_B16_1x0x0x2_default,586.01,1369.37,0.0
gfx950,256,4096,256,7168,torch.float8_e4m3fn,ck,114,0,20.7918,a8w8_bpreshuffle_256x64x64x256_16x16_16x16_16x16x1_16x16x1_1x32x1x8_8x8x1_2x1_intrawave_v3,723.0,1601.22,0.0
gfx950,256,8192,256,7168,torch.float8_e4m3fn,flydsl,872,0,26.8278,flydsl_bpreshuflle_64x128x256_F8_F8_B16_1x3x0x2_default,1120.66,2413.53,0.0
gfx950,256,16384,256,7168,torch.float8_e4m3fn,flydsl,1152,0,43.3141,flydsl_bpreshuflle_128x128x256_F8_F8_B16_1x4x4x2_default,1388.22,2947.4,0.0
gfx950,256,32768,256,7168,torch.float8_e4m3fn,flydsl,175,0,68.3212,flydsl_bpreshuflle_128x256x128_F8_F8_B16_1x0x0x2_default,1760.2,3710.32,0.0
gfx950,256,1,2112,7168,torch.float8_e4m3fn,flydsl,737,0,11.2132,flydsl_bpreshuflle_16x64x512_F8_F8_B16_0x3x0x2_default,2.7,1351.1,0.0
gfx950,256,2,2112,7168,torch.float8_e4m3fn,flydsl,1059,0,11.2082,flydsl_bpreshuflle_16x64x512_F8_F8_B16_1x4x0x2_default,5.4,1352.72,0.0
gfx950,256,4,2112,7168,torch.float8_e4m3fn,flydsl,1059,0,11.1888,flydsl_bpreshuflle_16x64x512_F8_F8_B16_1x4x0x2_default,10.82,1357.11,0.0
gfx950,256,8,2112,7168,torch.float8_e4m3fn,flydsl,1,0,11.4583,flydsl_bpreshuflle_16x64x512_F8_F8_B16_0x0x0x2_default,21.14,1329.16,0.0
gfx950,256,16,2112,7168,torch.float8_e4m3fn,ck,24,0,11.552,a8w8_bpreshuffle_128x16x32x512_16x16_16x16_32x4x1_32x4x1_1x16x1x8_4x4x1_1x1_intrawave_v2,41.94,1326.27,0.0
gfx950,256,32,2112,7168,torch.float8_e4m3fn,flydsl,1157,0,11.7147,flydsl_bpreshuflle_16x64x512_F8_F8_B16_0x0x0x1_default,82.71,1323.41,0.0
gfx950,256,64,2112,7168,torch.float8_e4m3fn,ck,10,0,10.6857,a8w8_bpreshuffle_128x16x32x512_16x16_16x16_32x4x1_32x4x1_1x16x1x8_4x4x1_1x1_intrawave_v1,181.34,1484.97,0.0
gfx950,256,96,2112,7168,torch.float8_e4m3fn,ck,11,0,11.5132,a8w8_bpreshuffle_256x16x64x512_16x16_16x16_32x8x1_32x8x1_1x16x1x16_4x4x1_1x1_intrawave_v1,252.46,1409.9,0.0
gfx950,256,128,2112,7168,torch.float8_e4m3fn,flydsl,566,0,12.5191,flydsl_bpreshuflle_32x64x512_F8_F8_B16_0x2x4x2_default,309.57,1325.73,0.0
gfx950,256,256,2112,7168,torch.float8_e4m3fn,flydsl,1476,0,15.9831,flydsl_bpreshuflle_32x64x512_F8_F8_B16_0x1x4x1_default,484.95,1129.64,0.0
gfx950,256,512,2112,7168,torch.float8_e4m3fn,cktile,179,0,22.6088,a8w8_bpreshuffle_cktile_0x0x8x4x1x0x0x0x0x4_64x64x256_1x4x1_16x16x128_default,685.67,927.58,0.0
gfx950,256,1024,2112,7168,torch.float8_e4m3fn,cktile,117,0,32.0104,a8w8_bpreshuffle_cktile_0x0x8x4x1x0x0x0x0x2_80x64x256_1x4x1_16x16x128_default,968.57,837.36,0.0
gfx950,256,2048,2112,7168,torch.float8_e4m3fn,cktile,98,0,44.7165,a8w8_bpreshuffle_cktile_0x0x8x4x1x0x0x0x0x1_96x192x256_1x4x1_16x16x128_default,1386.7,860.3,0.0
gfx950,256,4096,2112,7168,torch.float8_e4m3fn,cktile,76,0,70.1267,a8w8_bpreshuffle_cktile_0x0x8x4x1x0x0x0x0x1_96x192x128_1x4x1_16x16x128_default,1768.47,881.27,0.0
gfx950,256,8192,2112,7168,torch.float8_e4m3fn,flydsl,665,0,120.3037,flydsl_bpreshuflle_128x192x128_F8_F8_B16_1x2x0x2_default,2061.74,901.57,0.0
gfx950,256,16384,2112,7168,torch.float8_e4m3fn,cktile,55,0,220.9904,a8w8_bpreshuffle_cktile_0x0x8x4x1x0x0x0x0x2_128x192x128_1x4x1_16x16x128_default,2244.75,913.1,0.0
gfx950,256,32768,2112,7168,torch.float8_e4m3fn,cktile,121,0,403.1259,a8w8_bpreshuffle_cktile_0x0x8x4x1x0x0x0x0x2_160x192x128_1x4x1_16x16x128_default,2461.11,963.55,0.0
gfx950,256,1,3072,1536,torch.float8_e4m3fn,flydsl,961,0,4.6878,flydsl_bpreshuflle_16x64x512_F8_F8_B16_0x4x0x2_default,2.01,1008.21,0.0
gfx950,256,2,3072,1536,torch.float8_e4m3fn,flydsl,249,0,4.7058,flydsl_bpreshuflle_16x64x512_F8_F8_B16_0x1x0x2_default,4.01,1005.98,0.0
gfx950,256,4,3072,1536,torch.float8_e4m3fn,flydsl,497,0,4.7174,flydsl_bpreshuflle_16x64x512_F8_F8_B16_0x2x0x2_default,8.0,1006.76,0.0
gfx950,256,8,3072,1536,torch.float8_e4m3fn,flydsl,249,0,4.7306,flydsl_bpreshuflle_16x64x512_F8_F8_B16_0x1x0x2_default,15.96,1010.45,0.0
gfx950,256,16,3072,1536,torch.float8_e4m3fn,flydsl,1,0,4.7716,flydsl_bpreshuflle_16x64x512_F8_F8_B16_0x0x0x2_default,31.64,1014.64,0.0
gfx950,256,32,3072,1536,torch.float8_e4m3fn,flydsl,497,0,4.6911,flydsl_bpreshuflle_16x64x512_F8_F8_B16_0x2x0x2_default,64.38,1058.25,0.0
gfx950,256,64,3072,1536,torch.float8_e4m3fn,flydsl,435,0,4.9291,flydsl_bpreshuflle_16x64x512_F8_F8_B16_1x1x4x2_default,122.53,1057.01,0.0
gfx950,256,96,3072,1536,torch.float8_e4m3fn,flydsl,746,0,5.2066,flydsl_bpreshuflle_32x64x512_F8_F8_B16_0x3x0x2_default,174.0,1047.88,0.0
gfx950,256,128,3072,1536,torch.float8_e4m3fn,flydsl,320,0,5.3654,flydsl_bpreshuflle_32x64x512_F8_F8_B16_0x1x4x2_default,225.14,1062.67,0.0
gfx950,256,256,3072,1536,torch.float8_e4m3fn,flydsl,566,0,6.6839,flydsl_bpreshuflle_32x64x512_F8_F8_B16_0x2x4x2_default,361.45,1000.12,0.0
gfx950,256,512,3072,1536,torch.float8_e4m3fn,flydsl,698,0,8.4565,flydsl_bpreshuflle_64x64x256_F8_F8_B16_1x2x4x2_default,571.38,1022.97,0.0
gfx950,256,1024,3072,1536,torch.float8_e4m3fn,flydsl,702,0,10.9907,flydsl_bpreshuflle_64x192x256_F8_F8_B16_1x2x4x2_default,879.26,1144.87,0.0
gfx950,256,2048,3072,1536,torch.float8_e4m3fn,flydsl,1430,0,16.4338,flydsl_bpreshuflle_64x192x256_F8_F8_B16_0x1x0x1_default,1176.07,1244.22,0.0
gfx950,256,4096,3072,1536,torch.float8_e4m3fn,flydsl,1453,0,24.8524,flydsl_bpreshuflle_128x192x128_F8_F8_B16_0x1x0x1_default,1555.37,1455.63,0.0
gfx950,256,8192,3072,1536,torch.float8_e4m3fn,flydsl,727,0,47.393,flydsl_bpreshuflle_128x256x128_F8_F8_B16_1x2x4x2_default,1631.24,1427.07,0.0
gfx950,256,16384,3072,1536,torch.float8_e4m3fn,flydsl,727,0,86.4829,flydsl_bpreshuflle_128x256x128_F8_F8_B16_1x2x4x2_default,1787.85,1509.52,0.0
gfx950,256,20480,3072,1536,torch.float8_e4m3fn,flydsl,1269,0,106.2946,flydsl_bpreshuflle_128x256x128_F8_F8_B16_0x0x4x1_default,1818.28,1524.11,0.0
gfx950,256,32768,3072,1536,torch.float8_e4m3fn,flydsl,1393,0,161.1234,flydsl_bpreshuflle_128x256x128_F8_F8_B16_1x0x4x1_default,1919.26,1591.18,0.0
gfx950,256,1,4096,512,torch.float8_e4m3fn,cktile,2,0,2.754,a8w8_bpreshuffle_cktile_0x0x8x4x1x0x0x0x0x1_16x64x512_1x4x1_16x16x128_default,1.52,764.65,0.0
gfx950,256,2,4096,512,torch.float8_e4m3fn,flydsl,737,0,2.9178,flydsl_bpreshuflle_16x64x512_F8_F8_B16_0x3x0x2_default,2.87,724.71,0.0
gfx950,256,4,4096,512,torch.float8_e4m3fn,flydsl,1893,0,2.9074,flydsl_bpreshuflle_16x64x512_F8_F8_B16_0x3x0x1_default,5.77,733.29,0.0
gfx950,256,8,4096,512,torch.float8_e4m3fn,flydsl,2117,0,2.9346,flydsl_bpreshuflle_16x64x512_F8_F8_B16_0x4x0x1_default,11.43,738.36,0.0
gfx950,256,16,4096,512,torch.float8_e4m3fn,flydsl,737,0,2.9999,flydsl_bpreshuflle_16x64x512_F8_F8_B16_0x3x0x2_default,22.37,745.5,0.0
gfx950,256,32,4096,512,torch.float8_e4m3fn,flydsl,249,0,3.0607,flydsl_bpreshuflle_16x64x512_F8_F8_B16_0x1x0x2_default,43.85,776.19,0.0
gfx950,256,64,4096,512,torch.float8_e4m3fn,flydsl,793,0,3.3033,flydsl_bpreshuflle_16x64x512_F8_F8_B16_0x3x4x2_default,81.26,803.5,0.0
gfx950,256,128,4096,512,torch.float8_e4m3fn,flydsl,745,0,3.7488,flydsl_bpreshuflle_32x64x256_F8_F8_B16_0x3x0x2_default,143.21,856.61,0.0
gfx950,256,256,4096,512,torch.float8_e4m3fn,flydsl,270,0,4.2092,flydsl_bpreshuflle_64x64x256_F8_F8_B16_0x1x0x2_default,255.09,1027.6,0.0
gfx950,256,512,4096,512,torch.float8_e4m3fn,flydsl,816,0,5.2486,flydsl_bpreshuflle_64x128x256_F8_F8_B16_0x3x4x2_default,409.15,1248.64,0.0
gfx950,256,1024,4096,512,torch.float8_e4m3fn,flydsl,28,0,7.3929,flydsl_bpreshuflle_64x256x256_F8_F8_B16_0x0x0x2_default,580.96,1489.27,0.0
gfx950,256,2048,4096,512,torch.float8_e4m3fn,flydsl,361,0,10.7486,flydsl_bpreshuflle_128x256x128_F8_F8_B16_0x1x4x2_default,799.17,1853.54,0.0
gfx950,256,4096,4096,512,torch.float8_e4m3fn,flydsl,1455,0,17.2933,flydsl_bpreshuflle_128x256x128_F8_F8_B16_0x1x0x1_default,993.44,2182.85,0.0
gfx950,256,8192,4096,512,torch.float8_e4m3fn,flydsl,667,0,33.4487,flydsl_bpreshuflle_128x256x128_F8_F8_B16_1x2x0x2_default,1027.24,2194.41,0.0
gfx950,256,16384,4096,512,torch.float8_e4m3fn,flydsl,727,0,65.9208,flydsl_bpreshuflle_128x256x128_F8_F8_B16_1x2x4x2_default,1042.46,2195.11,0.0
gfx950,256,20480,4096,512,torch.float8_e4m3fn,flydsl,218,0,79.1366,flydsl_bpreshuflle_80x256x256_F8_F8_B16_1x0x4x2_default,1085.46,2279.03,0.0
gfx950,256,32768,4096,512,torch.float8_e4m3fn,flydsl,727,0,123.3444,flydsl_bpreshuflle_128x256x128_F8_F8_B16_1x2x4x2_default,1114.27,2329.33,0.0
gfx950,256,1,6144,1536,torch.float8_e4m3fn,flydsl,1,0,4.9798,flydsl_bpreshuflle_16x64x512_F8_F8_B16_0x0x0x2_default,3.79,1897.87,0.0
gfx950,256,2,6144,1536,torch.float8_e4m3fn,flydsl,1,0,4.9974,flydsl_bpreshuflle_16x64x512_F8_F8_B16_0x0x0x2_default,7.55,1893.95,0.0
gfx950,256,4,6144,1536,torch.float8_e4m3fn,flydsl,1653,0,5.3519,flydsl_bpreshuflle_16x64x512_F8_F8_B16_0x2x0x1_default,14.11,1773.67,0.0
gfx950,256,8,6144,1536,torch.float8_e4m3fn,flydsl,905,0,5.1854,flydsl_bpreshuflle_16x64x512_F8_F8_B16_1x3x4x2_default,29.12,1841.28,0.0
gfx950,256,16,6144,1536,torch.float8_e4m3fn,flydsl,737,0,5.1243,flydsl_bpreshuflle_16x64x512_F8_F8_B16_0x3x0x2_default,58.93,1884.82,0.0
gfx950,256,32,6144,1536,torch.float8_e4m3fn,flydsl,905,0,5.261,flydsl_bpreshuflle_16x64x512_F8_F8_B16_1x3x4x2_default,114.8,1877.88,0.0
gfx950,256,64,6144,1536,torch.float8_e4m3fn,flydsl,970,0,5.6702,flydsl_bpreshuflle_32x64x512_F8_F8_B16_0x4x0x2_default,213.04,1820.38,0.0
gfx950,256,128,6144,1536,torch.float8_e4m3fn,flydsl,698,0,6.8202,flydsl_bpreshuflle_64x64x256_F8_F8_B16_1x2x4x2_default,354.23,1643.16,0.0
gfx950,256,256,6144,1536,torch.float8_e4m3fn,flydsl,458,0,8.3931,flydsl_bpreshuflle_64x128x256_F8_F8_B16_1x1x4x2_default,575.69,1546.05,0.0
gfx950,256,512,6144,1536,torch.float8_e4m3fn,flydsl,212,0,10.9061,flydsl_bpreshuflle_64x192x256_F8_F8_B16_1x0x4x2_default,886.08,1514.3,0.0
gfx950,256,1024,6144,1536,torch.float8_e4m3fn,flydsl,1492,0,16.6242,flydsl_bpreshuflle_64x192x256_F8_F8_B16_0x1x4x1_default,1162.6,1419.19,0.0
gfx950,256,2048,6144,1536,torch.float8_e4m3fn,flydsl,1882,0,25.3904,flydsl_bpreshuflle_128x192x256_F8_F8_B16_1x2x4x1_default,1522.41,1486.73,0.0
gfx950,256,4096,6144,1536,torch.float8_e4m3fn,flydsl,727,0,49.563,flydsl_bpreshuflle_128x256x128_F8_F8_B16_1x2x4x2_default,1559.82,1332.85,0.0
gfx950,256,8192,6144,1536,torch.float8_e4m3fn,flydsl,1883,0,85.9723,flydsl_bpreshuflle_128x256x128_F8_F8_B16_1x2x4x1_default,1798.47,1427.01,0.0
gfx950,256,16384,6144,1536,torch.float8_e4m3fn,flydsl,1269,0,160.6344,flydsl_bpreshuflle_128x256x128_F8_F8_B16_0x0x4x1_default,1925.1,1468.74,0.0
gfx950,256,1,7168,2048,torch.float8_e4m3fn,flydsl,737,0,5.4448,flydsl_bpreshuflle_16x64x512_F8_F8_B16_0x3x0x2_default,5.39,2699.17,0.0
gfx950,256,1,7168,4096,torch.float8_e4m3fn,flydsl,677,0,8.303,flydsl_bpreshuflle_16x64x512_F8_F8_B16_1x2x4x2_default,7.07,3538.31,0.0
gfx950,256,2,7168,2048,torch.float8_e4m3fn,flydsl,497,0,5.4256,flydsl_bpreshuflle_16x64x512_F8_F8_B16_0x2x0x2_default,10.82,2711.74,0.0
gfx950,256,2,7168,4096,torch.float8_e4m3fn,flydsl,1108,0,8.366,flydsl_bpreshuflle_16x64x512_F8_F8_B16_1x4x4x2_default,14.04,3513.86,0.0
gfx950,256,4,7168,2048,torch.float8_e4m3fn,flydsl,1,0,5.4222,flydsl_bpreshuflle_16x64x512_F8_F8_B16_0x0x0x2_default,21.66,2719.49,0.0
gfx950,256,4,7168,4096,torch.float8_e4m3fn,flydsl,187,0,8.3932,flydsl_bpreshuflle_16x64x512_F8_F8_B16_1x0x4x2_default,27.98,3506.87,0.0
gfx950,256,8,7168,2048,torch.float8_e4m3fn,flydsl,1,0,5.4024,flydsl_bpreshuflle_16x64x512_F8_F8_B16_0x0x0x2_default,43.48,2741.58,0.0
gfx950,256,8,7168,4096,torch.float8_e4m3fn,flydsl,677,0,8.5656,flydsl_bpreshuflle_16x64x512_F8_F8_B16_1x2x4x2_default,54.84,3444.89,0.0
gfx950,256,16,7168,2048,torch.float8_e4m3fn,flydsl,497,0,5.5562,flydsl_bpreshuflle_16x64x512_F8_F8_B16_0x2x0x2_default,84.55,2689.29,0.0
gfx950,256,16,7168,4096,torch.float8_e4m3fn,flydsl,961,0,8.7382,flydsl_bpreshuflle_16x64x512_F8_F8_B16_0x4x0x2_default,107.52,3393.72,0.0
gfx950,256,32,7168,2048,torch.float8_e4m3fn,flydsl,793,0,5.7595,flydsl_bpreshuflle_16x64x512_F8_F8_B16_0x3x4x2_default,163.13,2639.87,0.0
gfx950,256,32,7168,4096,torch.float8_e4m3fn,flydsl,187,0,8.8829,flydsl_bpreshuflle_16x64x512_F8_F8_B16_1x0x4x2_default,211.54,3371.64,0.0
gfx950,256,64,7168,2048,torch.float8_e4m3fn,flydsl,1019,0,6.2988,flydsl_bpreshuflle_32x64x512_F8_F8_B16_0x4x4x2_default,298.32,2497.09,0.0
gfx950,256,64,7168,4096,torch.float8_e4m3fn,flydsl,2175,0,9.7353,flydsl_bpreshuflle_32x64x512_F8_F8_B16_0x4x4x1_default,386.03,3137.01,0.0
gfx950,256,96,7168,2048,torch.float8_e4m3fn,flydsl,693,0,7.7257,flydsl_bpreshuflle_48x64x256_F8_F8_B16_1x2x4x2_default,364.83,2103.75,0.0
gfx950,256,128,7168,2048,torch.float8_e4m3fn,flydsl,926,0,8.051,flydsl_bpreshuflle_64x64x256_F8_F8_B16_1x3x4x2_default,466.79,2083.87,0.0
gfx950,256,128,7168,4096,torch.float8_e4m3fn,flydsl,208,0,12.5125,flydsl_bpreshuflle_64x64x256_F8_F8_B16_1x0x4x2_default,600.69,2535.02,0.0
gfx950,256,256,7168,2048,torch.float8_e4m3fn,flydsl,700,0,9.8521,flydsl_bpreshuflle_64x128x256_F8_F8_B16_1x2x4x2_default,762.9,1915.77,0.0
gfx950,256,256,7168,4096,torch.float8_e4m3fn,flydsl,458,0,16.4472,flydsl_bpreshuflle_64x128x256_F8_F8_B16_1x1x4x2_default,913.98,2072.01,0.0
gfx950,256,512,7168,2048,torch.float8_e4m3fn,flydsl,952,0,12.988,flydsl_bpreshuflle_128x128x256_F8_F8_B16_1x3x4x2_default,1157.41,1776.15,0.0
gfx950,256,512,7168,4096,torch.float8_e4m3fn,flydsl,234,0,22.8248,flydsl_bpreshuflle_128x128x256_F8_F8_B16_1x0x4x2_default,1317.2,1699.79,0.0
gfx950,256,1024,7168,2048,torch.float8_e4m3fn,flydsl,952,0,20.3255,flydsl_bpreshuflle_128x128x256_F8_F8_B16_1x3x4x2_default,1479.17,1547.68,0.0
gfx950,256,1024,7168,4096,torch.float8_e4m3fn,flydsl,727,0,36.3171,flydsl_bpreshuflle_128x256x128_F8_F8_B16_1x2x4x2_default,1655.68,1328.15,0.0
gfx950,256,2048,7168,2048,torch.float8_e4m3fn,flydsl,727,0,35.6949,flydsl_bpreshuflle_128x256x128_F8_F8_B16_1x2x4x2_default,1684.54,1351.3,0.0
gfx950,256,2048,7168,4096,torch.float8_e4m3fn,flydsl,727,0,63.138,flydsl_bpreshuflle_128x256x128_F8_F8_B16_1x2x4x2_default,1904.7,1062.89,0.0
gfx950,256,4096,7168,2048,torch.float8_e4m3fn,flydsl,1763,0,66.4243,flydsl_bpreshuflle_128x256x128_F8_F8_B16_0x2x4x1_default,1810.47,1231.31,0.0
gfx950,256,4096,7168,4096,torch.float8_e4m3fn,flydsl,727,0,114.6883,flydsl_bpreshuflle_128x256x128_F8_F8_B16_1x2x4x2_default,2097.15,914.28,0.0
gfx950,256,8192,7168,2048,torch.float8_e4m3fn,flydsl,1763,0,118.3221,flydsl_bpreshuflle_128x256x128_F8_F8_B16_0x2x4x1_default,2032.74,1258.41,0.0
gfx950,256,8192,7168,4096,torch.float8_e4m3fn,flydsl,727,0,196.3809,flydsl_bpreshuflle_128x256x128_F8_F8_B16_1x2x4x2_default,2449.51,918.39,0.0
gfx950,256,16384,7168,2048,torch.float8_e4m3fn,flydsl,727,0,222.0885,flydsl_bpreshuflle_128x256x128_F8_F8_B16_1x2x4x2_default,2165.97,1274.79,0.0
gfx950,256,16384,7168,4096,torch.float8_e4m3fn,flydsl,1883,0,395.7263,flydsl_bpreshuflle_128x256x128_F8_F8_B16_1x2x4x1_default,2431.16,837.32,0.0
gfx950,256,20480,7168,2048,torch.float8_e4m3fn,flydsl,727,0,268.9023,flydsl_bpreshuflle_128x256x128_F8_F8_B16_1x2x4x2_default,2236.11,1302.42,0.0
gfx950,256,32768,7168,2048,torch.float8_e4m3fn,flydsl,1641,0,429.3262,flydsl_bpreshuflle_128x256x128_F8_F8_B16_1x1x4x1_default,2240.89,1284.69,0.0
gfx950,256,1,8192,512,torch.float8_e4m3fn,cktile,138,0,3.3822,a8w8_bpreshuffle_cktile_0x0x8x4x1x0x0x0x0x4_16x64x512_1x4x1_16x16x128_default,2.48,1245.11,0.0
gfx950,256,2,8192,512,torch.float8_e4m3fn,flydsl,249,0,3.5259,flydsl_bpreshuflle_16x64x512_F8_F8_B16_0x1x0x2_default,4.76,1199.15,0.0
gfx950,256,4,8192,512,torch.float8_e4m3fn,cktile,30,0,3.4351,a8w8_bpreshuffle_cktile_0x0x8x4x1x0x0x0x0x2_16x64x512_1x4x1_16x16x128_default,9.77,1240.69,0.0
gfx950,256,8,8192,512,torch.float8_e4m3fn,flydsl,2005,0,3.4912,flydsl_bpreshuflle_16x64x512_F8_F8_B16_1x3x0x1_default,19.22,1240.11,0.0
gfx950,256,16,8192,512,torch.float8_e4m3fn,flydsl,1,0,3.5226,flydsl_bpreshuflle_16x64x512_F8_F8_B16_0x0x0x2_default,38.1,1267.43,0.0
gfx950,256,32,8192,512,torch.float8_e4m3fn,flydsl,249,0,3.7146,flydsl_bpreshuflle_16x64x512_F8_F8_B16_0x1x0x2_default,72.26,1274.69,0.0
gfx950,256,64,8192,512,torch.float8_e4m3fn,flydsl,969,0,3.8623,flydsl_bpreshuflle_32x64x256_F8_F8_B16_0x4x0x2_default,139.0,1365.93,0.0
gfx950,256,128,8192,512,torch.float8_e4m3fn,flydsl,2138,0,4.3015,flydsl_bpreshuflle_64x64x256_F8_F8_B16_0x4x0x1_default,249.62,1477.85,0.0
gfx950,256,256,8192,512,torch.float8_e4m3fn,flydsl,816,0,5.3599,flydsl_bpreshuflle_64x128x256_F8_F8_B16_0x3x4x2_default,400.66,1589.52,0.0
gfx950,256,512,8192,512,torch.float8_e4m3fn,flydsl,90,0,7.5308,flydsl_bpreshuflle_64x256x256_F8_F8_B16_0x0x4x2_default,570.32,1705.67,0.0
gfx950,256,1024,8192,512,torch.float8_e4m3fn,flydsl,1638,0,11.2076,flydsl_bpreshuflle_128x128x256_F8_F8_B16_1x1x4x1_default,766.44,1917.97,0.0
gfx950,256,2048,8192,512,torch.float8_e4m3fn,flydsl,727,0,17.1078,flydsl_bpreshuflle_128x256x128_F8_F8_B16_1x2x4x2_default,1004.21,2267.81,0.0
gfx950,256,4096,8192,512,torch.float8_e4m3fn,flydsl,727,0,33.0516,flydsl_bpreshuflle_128x256x128_F8_F8_B16_1x2x4x2_default,1039.58,2220.78,0.0
gfx950,256,8192,8192,512,torch.float8_e4m3fn,flydsl,727,0,62.5066,flydsl_bpreshuflle_128x256x128_F8_F8_B16_1x2x4x2_default,1099.4,2281.46,0.0
gfx950,256,16384,8192,512,torch.float8_e4m3fn,flydsl,493,0,114.8288,flydsl_bpreshuflle_256x128x128_F8_F8_B16_1x1x4x2_default,1196.9,2447.28,0.0
