aiter/configs/model_configs/dsv4_fp8fp4_tuned_fmoe.csv
gfx,cu_num,token,model_dim,inter_dim,expert,topk,act_type,dtype,q_dtype_a,q_dtype_w,q_type,use_g1u1,doweight_stage1,block_m,ksplit,us1,kernelName1,err1,us2,kernelName2,err2,us,run_1stage,xbf16,flat,tflops,bw,_tag
gfx950,256,1,7168,512,384,6,ActivationType.Silu,torch.bfloat16,torch.float8_e4m3fn,torch.float4_e2m1fn_x2,QuantType.per_1x32,1,0,32,0,12.0719,flydsl_moe1_afp8_wfp4_bf16_t32x64x256_w4_gui_kw4_fp8,0.0%,8.8572,flydsl_moe2_afp8_wfp4_bf16_t32x256x256_reduce_bnt2_persist,0.0%,20.9291,0,0,0,6.31,202009.64,
gfx950,256,2,7168,512,384,6,ActivationType.Silu,torch.bfloat16,torch.float8_e4m3fn,torch.float4_e2m1fn_x2,QuantType.per_1x32,1,0,32,0,13.1756,flydsl_moe1_afp8_wfp4_bf16_t32x64x256_w4_gui_kw4_fp8,0.0%,11.2677,flydsl_moe2_afp8_wfp4_bf16_t32x128x256_reduce_bnt2,0.0%,24.4433,0,0,0,10.81,172967.7,
gfx950,256,4,7168,512,384,6,ActivationType.Silu,torch.bfloat16,torch.float8_e4m3fn,torch.float4_e2m1fn_x2,QuantType.per_1x32,1,0,32,0,19.1182,flydsl_moe1_afp8_wfp4_bf16_t32x64x256_w4_gui_xcd4_kw2_fp8,0.0%,14.5564,flydsl_moe2_afp8_wfp4_bf16_t32x256x256_reduce,0.0%,33.6746,0,0,0,15.69,125552.92,
gfx950,256,8,7168,512,384,6,ActivationType.Silu,torch.bfloat16,torch.float8_e4m3fn,torch.float4_e2m1fn_x2,QuantType.per_1x32,1,0,32,0,31.838,flydsl_moe1_afp8_wfp4_bf16_t32x64x256_w4_gui_fp8,0.0%,22.5319,flydsl_moe2_afp8_wfp4_bf16_t32x256x256_reduce_bnt2_persist,0.0%,54.3699,0,0,0,19.44,77764.18,
gfx950,256,16,7168,512,384,6,ActivationType.Silu,torch.bfloat16,torch.float8_e4m3fn,torch.float4_e2m1fn_x2,QuantType.per_1x32,1,0,32,0,57.1637,flydsl_moe1_afp8_wfp4_bf16_t32x128x256_w4_gui_fp8,0.0%,35.2367,flydsl_moe2_afp8_wfp4_bf16_t32x256x256_reduce_bnt2_persist,0.0%,92.4004,0,0,0,22.88,45759.57,
gfx950,256,32,7168,512,384,6,ActivationType.Silu,torch.bfloat16,torch.float8_e4m3fn,torch.float4_e2m1fn_x2,QuantType.per_1x32,1,0,32,0,115.8571,flydsl_moe1_afp8_wfp4_bf16_t32x128x256_w4_gui_fp8,0.0%,62.9204,flydsl_moe2_afp8_wfp4_bf16_t32x256x256_atomic_bnt2_xcd4,0.0%,178.7775,0,0,0,23.65,23652.57,
gfx950,256,64,7168,512,384,6,ActivationType.Silu,torch.bfloat16,torch.float8_e4m3fn,torch.float4_e2m1fn_x2,QuantType.per_1x32,1,0,32,0,227.1174,flydsl_moe1_afp8_wfp4_bf16_t32x128x256_w3_gui_fp8,0.0%,117.4534,flydsl_moe2_afp8_wfp4_bf16_t32x256x256_atomic_bnt2_xcd4_persist,0.0%,344.5708,0,0,0,24.54,12273.92,
gfx950,256,128,7168,512,384,6,ActivationType.Silu,torch.bfloat16,torch.float8_e4m3fn,torch.float4_e2m1fn_x2,QuantType.per_1x32,1,0,64,0,227.2285,flydsl_moe1_afp8_wfp4_bf16_t64x128x256_w2_gui_fp8,0.0%,117.4355,opus_moe2_afp8_wfp4_fp8_t64x256x256_sbm64_rbn3584,0.0%,344.664,0,0,49.07,12274.59,
gfx950,256,256,7168,512,384,6,ActivationType.Silu,torch.bfloat16,torch.float8_e4m3fn,torch.float4_e2m1fn_x2,QuantType.per_1x32,1,0,32,0,226.7966,flydsl_moe1_afp8_wfp4_bf16_t32x128x256_w3_gui_fp8,0.0%,125.8372,flydsl_moe2_afp8_wfp4_bf16_t16x128x256_atomic_bnt2_sbm32,0.0%,352.6338,0,0,0,95.91,12004.98,
gfx950,256,512,7168,512,384,6,ActivationType.Silu,torch.bfloat16,torch.float8_e4m3fn,torch.float4_e2m1fn_x2,QuantType.per_1x32,1,0,32,0,222.705,flydsl_moe1_afp8_wfp4_bf16_t32x128x256_w4_gui_fp8,0.0%,118.3831,opus_moe2_afp8_wfp4_fp8_t32x256x256_sbm32_occ5_rbn2304,0.0%,341.0881,0,0,198.32,12427.49,
gfx950,256,1024,7168,512,384,6,ActivationType.Silu,torch.bfloat16,torch.float8_e4m3fn,torch.float4_e2m1fn_x2,QuantType.per_1x32,1,0,32,0,227.2105,flydsl_moe1_afp8_wfp4_bf16_t32x128x256_w3_gui_fp8,0.0%,127.8035,opus_moe2_afp8_wfp4_fp8_t32x256x256_sbm32_occ4_rbn2240,0.0%,355.014,0,0,381.09,11971.02,
gfx950,256,2048,7168,512,384,6,ActivationType.Silu,torch.bfloat16,torch.float8_e4m3fn,torch.float4_e2m1fn_x2,QuantType.per_1x32,1,0,32,0,239.578,flydsl_moe1_afp8_wfp4_bf16_t32x128x256_w2_gui_fp8,0.0%,146.1037,opus_moe2_afp8_wfp4_fp8_t32x256x256_sbm32_occ4_rbn2240,0.0%,385.6817,0,0,701.57,11076.23,
gfx950,256,4096,7168,512,384,6,ActivationType.Silu,torch.bfloat16,torch.float8_e4m3fn,torch.float4_e2m1fn_x2,QuantType.per_1x32,1,0,64,0,264.4657,flydsl_moe1_afp8_wfp4_bf16_t64x256x256_w3_gui_fp8,0.0%,200.2585,opus_moe2_afp8_wfp4_fp8_t64x256x256_sbm64_rbn3072,0.0%,464.7242,0,0,1164.49,9287.1,
gfx950,256,8192,7168,512,384,6,ActivationType.Silu,torch.bfloat16,torch.float8_e4m3fn,torch.float4_e2m1fn_x2,QuantType.per_1x32,1,0,64,0,436.164,flydsl_moe1_afp8_wfp4_bf16_t64x128x256_w4_bnt0_gui_fp8,0.0%,381.7505,opus_moe2_afp8_wfp4_fp8_t64x256x256_sbm64_rbn3584,0.0%,817.9145,0,0,1323.28,5384.45,
gfx950,256,16384,7168,512,384,6,ActivationType.Silu,torch.bfloat16,torch.float8_e4m3fn,torch.float4_e2m1fn_x2,QuantType.per_1x32,1,0,64,0,707.5686,flydsl_moe1_afp8_wfp4_bf16_t64x256x256_w2_bnt0_gui_fp8,0.0%,744.0072,opus_moe2_afp8_wfp4_fp8_t64x256x256_sbm64_rbn3072,0.0%,1451.5758,0,0,1491.25,3155.32,
gfx950,256,32768,7168,512,384,6,ActivationType.Silu,torch.bfloat16,torch.float8_e4m3fn,torch.float4_e2m1fn_x2,QuantType.per_1x32,1,0,64,0,1303.7752,flydsl_moe1_afp8_wfp4_bf16_t64x256x256_w4_bnt0_gui_fp8,0.0%,1497.3664,opus_moe2_afp8_wfp4_fp8_t64x256x256_sbm64_rbn3584,0.0%,2801.1416,0,0,1545.56,1760.89,
gfx950,256,1,7168,768,384,6,ActivationType.Silu,torch.bfloat16,torch.float8_e4m3fn,torch.float4_e2m1fn_x2,QuantType.per_1x32,1,0,32,0,18.7827,flydsl_moe1_afp8_wfp4_bf16_t32x128x256_w4_gui_xcd4_fp8,0.0%,9.3533,flydsl_moe2_afp8_wfp4_bf16_t32x128x256_atomic_bnt2_persist,0.0%,28.136,0,0,0,7.04,225398.39,
gfx950,256,2,7168,768,384,6,ActivationType.Silu,torch.bfloat16,torch.float8_e4m3fn,torch.float4_e2m1fn_x2,QuantType.per_1x32,1,0,32,0,21.1768,flydsl_moe1_afp8_wfp4_bf16_t32x128x256_w4_gui_fp8,0.0%,13.128,flydsl_moe2_afp8_wfp4_bf16_t32x128x256_atomic_bnt2_persist,0.0%,34.3048,0,0,0,11.55,184867.15,
gfx950,256,4,7168,768,384,6,ActivationType.Silu,torch.bfloat16,torch.float8_e4m3fn,torch.float4_e2m1fn_x2,QuantType.per_1x32,1,0,32,0,25.4114,flydsl_moe1_afp8_wfp4_bf16_t32x64x256_w4_gui_fp8,0.0%,18.2156,flydsl_moe2_afp8_wfp4_bf16_t32x256x256_atomic_bnt2_persist,0.0%,43.627,0,0,0,18.17,145365.8,
gfx950,256,8,7168,768,384,6,ActivationType.Silu,torch.bfloat16,torch.float8_e4m3fn,torch.float4_e2m1fn_x2,QuantType.per_1x32,1,0,32,0,51.6497,flydsl_moe1_afp8_wfp4_bf16_t32x128x256_w4_gui_fp8,0.0%,29.1281,flydsl_moe2_afp8_wfp4_bf16_t32x256x256_atomic_bnt2_persist,0.0%,80.7778,0,0,0,19.63,78511.17,
gfx950,256,16,7168,768,384,6,ActivationType.Silu,torch.bfloat16,torch.float8_e4m3fn,torch.float4_e2m1fn_x2,QuantType.per_1x32,1,0,32,0,88.9169,flydsl_moe1_afp8_wfp4_bf16_t32x128x256_w4_gui_fp8,0.0%,49.6872,flydsl_moe2_afp8_wfp4_bf16_t32x128x256_atomic_bnt2_persist,0.0%,138.6041,0,0,0,22.88,45757.17,
gfx950,256,32,7168,768,384,6,ActivationType.Silu,torch.bfloat16,torch.float8_e4m3fn,torch.float4_e2m1fn_x2,QuantType.per_1x32,1,0,32,0,170.2974,flydsl_moe1_afp8_wfp4_bf16_t32x128x256_w3_gui_fp8,0.0%,91.4564,flydsl_moe2_afp8_wfp4_bf16_t32x128x256_atomic_bnt2_xcd4,0.0%,261.7538,0,0,0,24.23,24230.69,
gfx950,256,64,7168,768,384,6,ActivationType.Silu,torch.bfloat16,torch.float8_e4m3fn,torch.float4_e2m1fn_x2,QuantType.per_1x32,1,0,32,0,336.9403,flydsl_moe1_afp8_wfp4_bf16_t32x128x256_w4_gui_fp8,0.0%,171.6227,flydsl_moe2_afp8_wfp4_bf16_t32x128x256_atomic_bnt2_xcd4_persist,0.0%,508.563,0,0,0,24.94,12472.72,
gfx950,256,128,7168,768,384,6,ActivationType.Silu,torch.bfloat16,torch.float8_e4m3fn,torch.float4_e2m1fn_x2,QuantType.per_1x32,1,0,32,0,338.3001,flydsl_moe1_afp8_wfp4_bf16_t32x128x256_w3_gui_fp8,0.0%,173.9982,flydsl_moe2_afp8_wfp4_bf16_t32x128x256_atomic_bnt2_persist,0.0%,512.2983,0,0,0,49.52,12384.46,
gfx950,256,256,7168,768,384,6,ActivationType.Silu,torch.bfloat16,torch.float8_e4m3fn,torch.float4_e2m1fn_x2,QuantType.per_1x32,1,0,32,0,337.8278,flydsl_moe1_afp8_wfp4_bf16_t32x128x256_w4_gui_fp8,0.0%,181.1126,flydsl_moe2_afp8_wfp4_bf16_t32x128x256_atomic_bnt2,0.0%,518.9404,0,0,0,97.77,12231.26,
gfx950,256,512,7168,768,384,6,ActivationType.Silu,torch.bfloat16,torch.float8_e4m3fn,torch.float4_e2m1fn_x2,QuantType.per_1x32,1,0,32,0,340.4637,flydsl_moe1_afp8_wfp4_bf16_t32x128x256_w3_gui_fp8,0.0%,189.2583,flydsl_moe2_afp8_wfp4_bf16_t32x128x256_atomic_bnt2_persist,0.0%,529.722,0,0,0,191.55,11992.7,
gfx950,256,1024,7168,768,384,6,ActivationType.Silu,torch.bfloat16,torch.float8_e4m3fn,torch.float4_e2m1fn_x2,QuantType.per_1x32,1,0,32,0,344.8534,flydsl_moe1_afp8_wfp4_bf16_t32x128x256_w4_gui_fp8,0.0%,206.3373,flydsl_moe2_afp8_wfp4_bf16_t32x256x256_atomic_bnt2,0.0%,551.1907,0,0,0,368.18,11545.56,
gfx950,256,2048,7168,768,384,6,ActivationType.Silu,torch.bfloat16,torch.float8_e4m3fn,torch.float4_e2m1fn_x2,QuantType.per_1x32,1,0,32,0,361.5763,flydsl_moe1_afp8_wfp4_bf16_t32x128x256_w3_gui_fp8,0.0%,227.7138,flydsl_moe2_afp8_wfp4_bf16_t32x256x256_atomic_bnt2_persist,0.0%,589.2901,0,0,0,688.75,10836.48,
gfx950,256,4096,7168,768,384,6,ActivationType.Silu,torch.bfloat16,torch.float8_e4m3fn,torch.float4_e2m1fn_x2,QuantType.per_1x32,1,0,64,0,386.6537,flydsl_moe1_afp8_wfp4_bf16_t64x256x256_w3_gui_fp8,0.0%,312.8577,flydsl_moe2_afp8_wfp4_bf16_t64x256x256_atomic_bnt2,0.0%,699.5114,0,0,0,1160.45,9191.94,
gfx950,256,8192,7168,768,384,6,ActivationType.Silu,torch.bfloat16,torch.float8_e4m3fn,torch.float4_e2m1fn_x2,QuantType.per_1x32,1,0,128,0,511.3611,flydsl_moe1_afp8_wfp4_bf16_t128x256x256_w3_gui_fp8,0.0%,585.9543,flydsl_moe2_afp8_wfp4_bf16_t64x128x256_atomic_persist_sbm128,0.0%,1097.3154,0,0,0,1479.52,5939.9,
gfx950,256,16384,7168,768,384,6,ActivationType.Silu,torch.bfloat16,torch.float8_e4m3fn,torch.float4_e2m1fn_x2,QuantType.per_1x32,1,0,128,0,948.5525,flydsl_moe1_afp8_wfp4_bf16_t128x256x256_bnt0_gui_fp8,0.0%,1042.6409,flydsl_moe2_afp8_wfp4_bf16_t64x256x256_reduce_sbm128,0.0%,1991.1934,0,0,0,1630.68,3361.86,
gfx950,256,32768,7168,768,384,6,ActivationType.Silu,torch.bfloat16,torch.float8_e4m3fn,torch.float4_e2m1fn_x2,QuantType.per_1x32,1,0,128,0,1816.5035,flydsl_moe1_afp8_wfp4_bf16_t128x256x256_w2_bnt0_gui_fp8,0.0%,2029.9637,flydsl_moe2_afp8_wfp4_bf16_t64x256x256_reduce_sbm128,0.0%,3846.4672,0,0,0,1688.3,1831.92,
gfx950,256,1,7168,1536,384,6,ActivationType.Silu,torch.bfloat16,torch.float8_e4m3fn,torch.float4_e2m1fn_x2,QuantType.per_1x32,1,0,32,0,20.4073,flydsl_moe1_afp8_wfp4_bf16_t32x128x256_w4_bnt0_gui_fp8,0.0%,13.8181,flydsl_moe2_afp8_wfp4_bf16_t32x128x256_atomic_bnt2_persist,0.0%,34.2254,0,0,0,11.58,370590.17,
gfx950,256,2,7168,1536,384,6,ActivationType.Silu,torch.bfloat16,torch.float8_e4m3fn,torch.float4_e2m1fn_x2,QuantType.per_1x32,1,0,32,0,25.2827,flydsl_moe1_afp8_wfp4_bf16_t32x64x256_w3_gui_fp8,0.0%,17.86,flydsl_moe2_afp8_wfp4_bf16_t32x128x256_atomic_bnt2_persist,0.0%,43.1427,0,0,0,18.37,293992.22,
gfx950,256,4,7168,1536,384,6,ActivationType.Silu,torch.bfloat16,torch.float8_e4m3fn,torch.float4_e2m1fn_x2,QuantType.per_1x32,1,0,32,0,50.5369,flydsl_moe1_afp8_wfp4_bf16_t32x64x256_w3_gui_fp8,0.0%,28.9978,flydsl_moe2_afp8_wfp4_bf16_t32x256x256_atomic_bnt2_persist,0.0%,79.5347,0,0,0,19.93,159473.3,
gfx950,256,8,7168,1536,384,6,ActivationType.Silu,torch.bfloat16,torch.float8_e4m3fn,torch.float4_e2m1fn_x2,QuantType.per_1x32,1,0,32,0,86.816,flydsl_moe1_afp8_wfp4_bf16_t32x128x256_w3_gui_fp8,0.0%,49.1865,flydsl_moe2_afp8_wfp4_bf16_t32x128x256_atomic_bnt2_persist,0.0%,136.0025,0,0,0,23.31,93261.13,
gfx950,256,16,7168,1536,384,6,ActivationType.Silu,torch.bfloat16,torch.float8_e4m3fn,torch.float4_e2m1fn_x2,QuantType.per_1x32,1,0,32,0,171.0799,flydsl_moe1_afp8_wfp4_bf16_t32x128x256_w4_gui_fp8,0.0%,90.8206,flydsl_moe2_afp8_wfp4_bf16_t32x256x256_atomic_bnt2_xcd4,0.0%,261.9005,0,0,0,24.21,48430.3,
gfx950,256,32,7168,1536,384,6,ActivationType.Silu,torch.bfloat16,torch.float8_e4m3fn,torch.float4_e2m1fn_x2,QuantType.per_1x32,1,0,32,0,336.3454,flydsl_moe1_afp8_wfp4_bf16_t32x128x256_w4_gui_xcd4_fp8,0.0%,173.2903,flydsl_moe2_afp8_wfp4_bf16_t32x256x256_atomic_bnt2_xcd4,0.0%,509.6357,0,0,0,24.89,24888.88,
gfx950,256,64,7168,1536,384,6,ActivationType.Silu,torch.bfloat16,torch.float8_e4m3fn,torch.float4_e2m1fn_x2,QuantType.per_1x32,1,0,32,0,673.3172,flydsl_moe1_afp8_wfp4_bf16_t32x64x256_w4_gui_fp8,0.0%,335.4652,flydsl_moe2_afp8_wfp4_bf16_t32x128x256_atomic_bnt2,0.0%,1008.7824,0,0,0,25.15,12574.52,
gfx950,256,128,7168,1536,384,6,ActivationType.Silu,torch.bfloat16,torch.float8_e4m3fn,torch.float4_e2m1fn_x2,QuantType.per_1x32,1,0,32,0,690.1582,flydsl_moe1_afp8_wfp4_bf16_t32x128x256_w3_gui_xcd4_fp8,0.0%,342.4631,flydsl_moe2_afp8_wfp4_bf16_t32x256x256_atomic_bnt2_xcd4_persist,0.0%,1032.6213,0,0,0,49.13,12285.56,
gfx950,256,1,7168,512,385,7,ActivationType.Silu,torch.bfloat16,torch.float8_e4m3fn,torch.float4_e2m1fn_x2,QuantType.per_1x32,1,0,32,0,18.3042,flydsl_moe1_afp8_wfp4_bf16_t32x128x256_w4_gui_fp8,0.0%,8.7352,flydsl_moe2_afp8_wfp4_bf16_t32x256x256_atomic,0.0%,27.0394,0,0,0,5.7,156767.16,
gfx950,256,2,7168,512,385,7,ActivationType.Silu,torch.bfloat16,torch.float8_e4m3fn,torch.float4_e2m1fn_x2,QuantType.per_1x32,1,0,32,0,20.2251,flydsl_moe1_afp8_wfp4_bf16_t32x128x256_w2_gui_fp8,0.0%,12.4074,flydsl_moe2_afp8_wfp4_bf16_t32x256x256_atomic_xcd4,0.0%,32.6325,0,0,0,9.45,129898.46,
gfx950,256,4,7168,512,385,7,ActivationType.Silu,torch.bfloat16,torch.float8_e4m3fn,torch.float4_e2m1fn_x2,QuantType.per_1x32,1,0,32,0,21.9888,flydsl_moe1_afp8_wfp4_bf16_t32x128x256_gui_fp8,0.0%,17.2479,flydsl_moe2_afp8_wfp4_bf16_t32x256x256_atomic_bnt2_xcd4,0.0%,39.2367,0,0,0,15.71,108035.45,
gfx950,256,8,7168,512,385,7,ActivationType.Silu,torch.bfloat16,torch.float8_e4m3fn,torch.float4_e2m1fn_x2,QuantType.per_1x32,1,0,32,0,37.0281,flydsl_moe1_afp8_wfp4_bf16_t32x128x256_w2_gui_fp8,0.0%,25.8309,flydsl_moe2_afp8_wfp4_bf16_t32x128x256_atomic_bnt2_persist,0.0%,62.859,0,0,0,19.62,67437.29,
gfx950,256,16,7168,512,385,7,ActivationType.Silu,torch.bfloat16,torch.float8_e4m3fn,torch.float4_e2m1fn_x2,QuantType.per_1x32,1,0,32,0,71.2231,flydsl_moe1_afp8_wfp4_bf16_t32x128x256_w2_gui_fp8,0.0%,41.8664,flydsl_moe2_afp8_wfp4_bf16_t32x128x256_atomic_bnt2,0.0%,113.0895,0,0,0,21.81,37485.47,
gfx950,256,32,7168,512,385,7,ActivationType.Silu,torch.bfloat16,torch.float8_e4m3fn,torch.float4_e2m1fn_x2,QuantType.per_1x32,1,0,32,0,134.8852,flydsl_moe1_afp8_wfp4_bf16_t32x128x256_w3_gui_xcd4_fp8,0.0%,71.8893,flydsl_moe2_afp8_wfp4_bf16_t32x256x256_atomic_bnt2_xcd4_persist,0.0%,206.7745,0,0,0,23.85,20503.29,
gfx950,256,64,7168,512,385,7,ActivationType.Silu,torch.bfloat16,torch.float8_e4m3fn,torch.float4_e2m1fn_x2,QuantType.per_1x32,1,0,32,0,232.2826,flydsl_moe1_afp8_wfp4_bf16_t32x128x256_w3_gui_xcd4_fp8,0.0%,119.2028,flydsl_moe2_afp8_wfp4_bf16_t32x256x256_atomic_bnt2_xcd4,0.0%,351.4854,0,0,0,28.07,12063.79,
gfx950,256,128,7168,512,385,7,ActivationType.Silu,torch.bfloat16,torch.float8_e4m3fn,torch.float4_e2m1fn_x2,QuantType.per_1x32,1,0,32,0,233.1225,flydsl_moe1_afp8_wfp4_bf16_t32x128x256_w3_gui_fp8,0.0%,121.6478,flydsl_moe2_afp8_wfp4_bf16_t32x256x256_atomic_bnt2_xcd4,0.0%,354.7703,0,0,0,55.61,11955.96,
gfx950,256,256,7168,512,385,7,ActivationType.Silu,torch.bfloat16,torch.float8_e4m3fn,torch.float4_e2m1fn_x2,QuantType.per_1x32,1,0,32,0,233.9255,flydsl_moe1_afp8_wfp4_bf16_t32x128x256_w4_gui_fp8,0.0%,127.8476,flydsl_moe2_afp8_wfp4_bf16_t32x256x256_atomic_bnt2_xcd4,0.0%,361.7731,0,0,0,109.07,11732.14,
gfx950,256,512,7168,512,385,7,ActivationType.Silu,torch.bfloat16,torch.float8_e4m3fn,torch.float4_e2m1fn_x2,QuantType.per_1x32,1,0,32,0,236.6982,flydsl_moe1_afp8_wfp4_bf16_t32x128x256_w3_gui_fp8,0.0%,136.2029,flydsl_moe2_afp8_wfp4_bf16_t32x256x256_atomic_bnt2_persist,0.0%,372.9011,0,0,0,211.64,11396.8,
gfx950,256,1024,7168,512,385,7,ActivationType.Silu,torch.bfloat16,torch.float8_e4m3fn,torch.float4_e2m1fn_x2,QuantType.per_1x32,1,0,32,0,242.7851,flydsl_moe1_afp8_wfp4_bf16_t32x128x256_w3_gui_fp8,0.0%,150.589,flydsl_moe2_afp8_wfp4_bf16_t32x256x256_atomic_bnt2_persist,0.0%,393.3741,0,0,0,401.25,10831.64,
gfx950,256,2048,7168,512,385,7,ActivationType.Silu,torch.bfloat16,torch.float8_e4m3fn,torch.float4_e2m1fn_x2,QuantType.per_1x32,1,0,64,0,263.9999,flydsl_moe1_afp8_wfp4_bf16_t64x128x256_w4_gui_fp8,0.0%,194.4444,flydsl_moe2_afp8_wfp4_bf16_t64x256x256_atomic_bnt2,0.0%,458.4443,0,0,0,688.59,9342.27,
gfx950,256,4096,7168,512,385,7,ActivationType.Silu,torch.bfloat16,torch.float8_e4m3fn,torch.float4_e2m1fn_x2,QuantType.per_1x32,1,0,128,0,334.0629,flydsl_moe1_afp8_wfp4_bf16_t128x256x256_w4_gui_fp8,0.0%,366.4308,flydsl_moe2_afp8_wfp4_bf16_t64x256x256_reduce_persist_sbm128,0.0%,700.4937,0,0,0,901.31,6177.0,
gfx950,256,8192,7168,512,385,7,ActivationType.Silu,torch.bfloat16,torch.float8_e4m3fn,torch.float4_e2m1fn_x2,QuantType.per_1x32,1,0,64,0,561.1524,flydsl_moe1_afp8_wfp4_bf16_t64x256x256_w3_bnt0_gui_xcd4_fp8,0.0%,568.0007,flydsl_moe2_afp8_wfp4_bf16_t64x256x256_reduce_persist,0.0%,1129.1531,0,0,0,1118.29,3910.04,
gfx950,256,16384,7168,512,385,7,ActivationType.Silu,torch.bfloat16,torch.float8_e4m3fn,torch.float4_e2m1fn_x2,QuantType.per_1x32,1,0,128,0,853.1494,flydsl_moe1_afp8_wfp4_bf16_t128x256x256_bnt0_gui_fp8,0.0%,1021.9686,flydsl_moe2_afp8_wfp4_bf16_t64x256x256_reduce_persist_sbm128,0.0%,1875.118,0,0,0,1346.82,2448.48,
gfx950,256,32768,7168,512,385,7,ActivationType.Silu,torch.bfloat16,torch.float8_e4m3fn,torch.float4_e2m1fn_x2,QuantType.per_1x32,1,0,64,0,1534.5119,flydsl_moe1_afp8_wfp4_bf16_t64x256x256_w3_bnt0_gui_fp8,0.0%,1942.4954,flydsl_moe2_afp8_wfp4_bf16_t64x256x256_reduce_xcd4_persist,0.0%,3477.0073,0,0,0,1452.65,1421.77,
gfx950,256,1,7168,768,385,7,ActivationType.Silu,torch.bfloat16,torch.float8_e4m3fn,torch.float4_e2m1fn_x2,QuantType.per_1x32,1,0,32,0,18.8043,flydsl_moe1_afp8_wfp4_bf16_t32x128x256_gui_fp8,0.0%,9.4455,flydsl_moe2_afp8_wfp4_bf16_t32x256x256_atomic_bnt2,0.0%,28.2498,0,0,0,8.18,225075.02,
gfx950,256,2,7168,768,385,7,ActivationType.Silu,torch.bfloat16,torch.float8_e4m3fn,torch.float4_e2m1fn_x2,QuantType.per_1x32,1,0,32,0,21.5087,flydsl_moe1_afp8_wfp4_bf16_t32x128x256_gui_fp8,0.0%,14.1321,flydsl_moe2_afp8_wfp4_bf16_t32x256x256_atomic_bnt2,0.0%,35.6408,0,0,0,12.97,178400.76,
gfx950,256,4,7168,768,385,7,ActivationType.Silu,torch.bfloat16,torch.float8_e4m3fn,torch.float4_e2m1fn_x2,QuantType.per_1x32,1,0,32,0,28.1243,flydsl_moe1_afp8_wfp4_bf16_t32x64x256_w4_gui_fp8,0.0%,21.5717,flydsl_moe2_afp8_wfp4_bf16_t32x256x256_atomic_bnt2,0.0%,49.696,0,0,0,18.61,127945.68,
gfx950,256,8,7168,768,385,7,ActivationType.Silu,torch.bfloat16,torch.float8_e4m3fn,torch.float4_e2m1fn_x2,QuantType.per_1x32,1,0,32,0,55.3463,flydsl_moe1_afp8_wfp4_bf16_t32x128x256_w4_gui_fp8,0.0%,34.1503,flydsl_moe2_afp8_wfp4_bf16_t32x256x256_atomic_bnt2_persist,0.0%,89.4966,0,0,0,20.67,71047.11,
gfx950,256,16,7168,768,385,7,ActivationType.Silu,torch.bfloat16,torch.float8_e4m3fn,torch.float4_e2m1fn_x2,QuantType.per_1x32,1,0,32,0,107.2338,flydsl_moe1_afp8_wfp4_bf16_t32x128x256_w2_gui_fp8,0.0%,56.6137,flydsl_moe2_afp8_wfp4_bf16_t32x128x256_atomic_bnt2,0.0%,163.8475,0,0,0,22.58,38808.32,
gfx950,256,32,7168,768,385,7,ActivationType.Silu,torch.bfloat16,torch.float8_e4m3fn,torch.float4_e2m1fn_x2,QuantType.per_1x32,1,0,32,0,202.4158,flydsl_moe1_afp8_wfp4_bf16_t32x128x256_w4_gui_fp8,0.0%,104.4152,flydsl_moe2_afp8_wfp4_bf16_t32x128x256_atomic_bnt2_persist,0.0%,306.831,0,0,0,24.11,20724.73,
gfx950,256,64,7168,768,385,7,ActivationType.Silu,torch.bfloat16,torch.float8_e4m3fn,torch.float4_e2m1fn_x2,QuantType.per_1x32,1,0,32,0,343.4994,flydsl_moe1_afp8_wfp4_bf16_t32x128x256_w4_gui_xcd4_fp8,0.0%,174.0693,flydsl_moe2_afp8_wfp4_bf16_t32x128x256_atomic_bnt2_persist,0.0%,517.5687,0,0,0,28.59,12287.6,
gfx950,256,128,7168,768,385,7,ActivationType.Silu,torch.bfloat16,torch.float8_e4m3fn,torch.float4_e2m1fn_x2,QuantType.per_1x32,1,0,32,0,341.3169,flydsl_moe1_afp8_wfp4_bf16_t32x128x256_w3_gui_fp8,0.0%,176.7186,flydsl_moe2_afp8_wfp4_bf16_t32x128x256_atomic_bnt2_persist,0.0%,518.0355,0,0,0,57.13,12279.19,
gfx950,256,256,7168,768,385,7,ActivationType.Silu,torch.bfloat16,torch.float8_e4m3fn,torch.float4_e2m1fn_x2,QuantType.per_1x32,1,0,32,0,345.9027,flydsl_moe1_afp8_wfp4_bf16_t32x128x256_w4_gui_fp8,0.0%,181.9902,flydsl_moe2_afp8_wfp4_bf16_t32x128x256_atomic_bnt2,0.0%,527.8929,0,0,0,112.13,12055.11,
gfx950,256,512,7168,768,385,7,ActivationType.Silu,torch.bfloat16,torch.float8_e4m3fn,torch.float4_e2m1fn_x2,QuantType.per_1x32,1,0,32,0,344.7409,flydsl_moe1_afp8_wfp4_bf16_t32x128x256_w3_gui_fp8,0.0%,193.824,flydsl_moe2_afp8_wfp4_bf16_t32x256x256_atomic_bnt2_persist,0.0%,538.5649,0,0,0,219.81,11826.45,
gfx950,256,1024,7168,768,385,7,ActivationType.Silu,torch.bfloat16,torch.float8_e4m3fn,torch.float4_e2m1fn_x2,QuantType.per_1x32,1,0,32,0,347.7917,flydsl_moe1_afp8_wfp4_bf16_t32x128x256_w4_gui_fp8,0.0%,208.5205,flydsl_moe2_afp8_wfp4_bf16_t32x256x256_atomic_bnt2,0.0%,556.3122,0,0,0,425.59,11468.96,
gfx950,256,2048,7168,768,385,7,ActivationType.Silu,torch.bfloat16,torch.float8_e4m3fn,torch.float4_e2m1fn_x2,QuantType.per_1x32,1,0,64,0,383.8945,flydsl_moe1_afp8_wfp4_bf16_t64x128x256_w3_gui_fp8,0.0%,251.7792,flydsl_moe2_afp8_wfp4_bf16_t64x256x256_atomic_bnt2,0.0%,635.6737,0,0,0,744.91,10071.74,
gfx950,256,4096,7168,768,385,7,ActivationType.Silu,torch.bfloat16,torch.float8_e4m3fn,torch.float4_e2m1fn_x2,QuantType.per_1x32,1,0,128,0,494.4527,flydsl_moe1_afp8_wfp4_bf16_t128x256x256_w4_gui_fp8,0.0%,441.3236,flydsl_moe2_afp8_wfp4_bf16_t128x256x256_atomic_persist_sbm128,0.0%,935.7763,0,0,0,1012.04,6888.81,
gfx950,256,8192,7168,768,385,7,ActivationType.Silu,torch.bfloat16,torch.float8_e4m3fn,torch.float4_e2m1fn_x2,QuantType.per_1x32,1,0,64,0,834.5119,flydsl_moe1_afp8_wfp4_bf16_t64x256x256_w4_bnt0_gui_xcd4_fp8,0.0%,686.6355,flydsl_moe2_afp8_wfp4_bf16_t64x256x256_atomic,0.0%,1521.1474,0,0,0,1245.17,4295.75,
gfx950,256,16384,7168,768,385,7,ActivationType.Silu,torch.bfloat16,torch.float8_e4m3fn,torch.float4_e2m1fn_x2,QuantType.per_1x32,1,0,128,0,1303.9038,flydsl_moe1_afp8_wfp4_bf16_t128x256x256_w4_bnt0_gui_xcd4_fp8,0.0%,1243.4266,flydsl_moe2_afp8_wfp4_bf16_t64x256x256_reduce_persist_sbm128,0.0%,2547.3304,0,0,0,1487.11,2634.38,
gfx950,256,32768,7168,768,385,7,ActivationType.Silu,torch.bfloat16,torch.float8_e4m3fn,torch.float4_e2m1fn_x2,QuantType.per_1x32,1,0,128,0,2193.2573,flydsl_moe1_afp8_wfp4_bf16_t128x256x256_bnt0_gui_xcd4_fp8,0.0%,2438.3465,flydsl_moe2_afp8_wfp4_bf16_t64x256x256_reduce_sbm128,0.0%,4631.6038,0,0,0,1635.79,1524.95,
gfx950,256,1,7168,1536,385,7,ActivationType.Silu,torch.bfloat16,torch.float8_e4m3fn,torch.float4_e2m1fn_x2,QuantType.per_1x32,1,0,32,0,20.2248,flydsl_moe1_afp8_wfp4_bf16_t32x128x256_w3_gui_fp8,0.0%,14.3302,flydsl_moe2_afp8_wfp4_bf16_t32x128x256_atomic_bnt2,0.0%,34.555,0,0,0,13.38,368011.2,
gfx950,256,2,7168,1536,385,7,ActivationType.Silu,torch.bfloat16,torch.float8_e4m3fn,torch.float4_e2m1fn_x2,QuantType.per_1x32,1,0,32,0,27.6152,flydsl_moe1_afp8_wfp4_bf16_t32x64x256_w3_gui_fp8,0.0%,20.7686,flydsl_moe2_afp8_wfp4_bf16_t32x128x256_atomic_bnt2_persist,0.0%,48.3838,0,0,0,19.11,262828.64,
gfx950,256,4,7168,1536,385,7,ActivationType.Silu,torch.bfloat16,torch.float8_e4m3fn,torch.float4_e2m1fn_x2,QuantType.per_1x32,1,0,32,0,53.3444,flydsl_moe1_afp8_wfp4_bf16_t32x128x256_w4_gui_fp8,0.0%,32.9763,flydsl_moe2_afp8_wfp4_bf16_t32x128x256_atomic_bnt2,0.0%,86.3207,0,0,0,21.43,147319.14,
gfx950,256,8,7168,1536,385,7,ActivationType.Silu,torch.bfloat16,torch.float8_e4m3fn,torch.float4_e2m1fn_x2,QuantType.per_1x32,1,0,32,0,105.7927,flydsl_moe1_afp8_wfp4_bf16_t32x128x256_w2_gui_xcd4_fp8,0.0%,56.8737,flydsl_moe2_afp8_wfp4_bf16_t32x128x256_atomic_bnt2,0.0%,162.6664,0,0,0,22.74,78177.04,
gfx950,256,16,7168,1536,385,7,ActivationType.Silu,torch.bfloat16,torch.float8_e4m3fn,torch.float4_e2m1fn_x2,QuantType.per_1x32,1,0,32,0,201.4304,flydsl_moe1_afp8_wfp4_bf16_t32x128x256_w4_gui_xcd4_fp8,0.0%,105.3636,flydsl_moe2_afp8_wfp4_bf16_t32x128x256_atomic_bnt2,0.0%,306.794,0,0,0,24.12,41451.1,
gfx950,256,32,7168,1536,385,7,ActivationType.Silu,torch.bfloat16,torch.float8_e4m3fn,torch.float4_e2m1fn_x2,QuantType.per_1x32,1,0,32,0,393.6657,flydsl_moe1_afp8_wfp4_bf16_t32x128x256_w3_gui_fp8,0.0%,205.1997,flydsl_moe2_afp8_wfp4_bf16_t32x256x256_reduce_bnt2_xcd4,0.0%,598.8654,0,0,0,24.71,21235.65,
gfx950,256,64,7168,1536,385,7,ActivationType.Silu,torch.bfloat16,torch.float8_e4m3fn,torch.float4_e2m1fn_x2,QuantType.per_1x32,1,0,32,0,688.169,flydsl_moe1_afp8_wfp4_bf16_t32x128x256_w2_gui_fp8,0.0%,342.3677,flydsl_moe2_afp8_wfp4_bf16_t32x256x256_atomic_bnt2_persist,0.0%,1030.5367,0,0,0,28.72,12341.12,
gfx950,256,128,7168,1536,385,7,ActivationType.Silu,torch.bfloat16,torch.float8_e4m3fn,torch.float4_e2m1fn_x2,QuantType.per_1x32,1,0,32,0,671.6014,flydsl_moe1_afp8_wfp4_bf16_t32x128x256_w4_gui_fp8,0.0%,341.9041,flydsl_moe2_afp8_wfp4_bf16_t32x256x256_atomic_bnt2_persist,0.0%,1013.5055,0,0,0,58.4,12549.87,
gfx950,256,256,7168,1536,385,7,ActivationType.Silu,torch.bfloat16,torch.float8_e4m3fn,torch.float4_e2m1fn_x2,QuantType.per_1x32,1,0,32,0,689.1255,flydsl_moe1_afp8_wfp4_bf16_t32x128x256_w4_gui_fp8,0.0%,350.3777,flydsl_moe2_afp8_wfp4_bf16_t32x128x256_atomic_bnt2,0.0%,1039.5032,0,0,0,113.88,12238.64,
gfx950,256,512,7168,1536,385,7,ActivationType.Silu,torch.bfloat16,torch.float8_e4m3fn,torch.float4_e2m1fn_x2,QuantType.per_1x32,1,0,64,0,739.0288,flydsl_moe1_afp8_wfp4_bf16_t64x128x256_w2_bnt0_gui_fp8,0.0%,372.5039,flydsl_moe2_afp8_wfp4_bf16_t32x128x256_atomic_bnt2_sbm64,0.0%,1111.5327,0,0,0,213.0,11450.51,
gfx950,256,1024,7168,1536,385,7,ActivationType.Silu,torch.bfloat16,torch.float8_e4m3fn,torch.float4_e2m1fn_x2,QuantType.per_1x32,1,0,64,0,740.9017,flydsl_moe1_afp8_wfp4_bf16_t64x128x256_w4_gui_fp8,0.0%,415.121,flydsl_moe2_afp8_wfp4_bf16_t64x128x256_atomic_bnt2,0.0%,1156.0227,0,0,0,409.61,11019.36,
gfx950,256,2048,7168,1536,385,7,ActivationType.Silu,torch.bfloat16,torch.float8_e4m3fn,torch.float4_e2m1fn_x2,QuantType.per_1x32,1,0,64,0,742.4175,flydsl_moe1_afp8_wfp4_bf16_t64x256x256_w4_gui_fp8,0.0%,465.5302,flydsl_moe2_afp8_wfp4_bf16_t64x128x256_atomic_bnt2_persist,0.0%,1207.9477,0,0,0,784.01,10563.91,
gfx950,256,4096,7168,1536,385,7,ActivationType.Silu,torch.bfloat16,torch.float8_e4m3fn,torch.float4_e2m1fn_x2,QuantType.per_1x32,1,0,128,0,936.8038,flydsl_moe1_afp8_wfp4_bf16_t128x256x256_w4_gui_fp8,0.0%,782.2681,flydsl_moe2_afp8_wfp4_bf16_t128x128x256_reduce_bnt2_persist,0.0%,1719.0719,0,0,0,1101.8,7448.6,
gfx950,256,8192,7168,1536,385,7,ActivationType.Silu,torch.bfloat16,torch.float8_e4m3fn,torch.float4_e2m1fn_x2,QuantType.per_1x32,1,0,64,0,1611.7256,flydsl_moe1_afp8_wfp4_bf16_t64x128x256_w2_bnt0_gui_fp8,0.0%,1069.8835,flydsl_moe2_afp8_wfp4_bf16_t64x128x256_atomic,0.0%,2681.6091,0,0,0,1412.64,4807.85,
gfx950,256,16384,7168,1536,385,7,ActivationType.Silu,torch.bfloat16,torch.float8_e4m3fn,torch.float4_e2m1fn_x2,QuantType.per_1x32,1,0,64,0,2477.6596,flydsl_moe1_afp8_wfp4_bf16_t64x256x256_w3_bnt0_gui_fp8,0.0%,1945.4029,flydsl_moe2_afp8_wfp4_bf16_t64x256x256_reduce,0.0%,4423.0625,0,0,0,1712.91,2954.72,
gfx950,256,32768,7168,1536,385,7,ActivationType.Silu,torch.bfloat16,torch.float8_e4m3fn,torch.float4_e2m1fn_x2,QuantType.per_1x32,1,0,128,0,4779.4725,flydsl_moe1_afp8_wfp4_bf16_t128x256x256_w3_gui_fp8,0.0%,3812.3245,flydsl_moe2_afp8_wfp4_bf16_t64x128x256_atomic_bnt2_sbm128,0.0%,8591.797,0,0,0,1763.62,1562.1,
gfx950,256,1,7168,3072,48,6,ActivationType.Silu,torch.bfloat16,torch.float8_e4m3fn,torch.float4_e2m1fn_x2,QuantType.per_1x32,1,0,32,0,26.743,flydsl_moe1_afp8_wfp4_bf16_t32x64x256_w3_bnt0_gui_fp8,0.0%,22.107,flydsl_moe2_afp8_wfp4_bf16_t16x128x256_reduce_persist_sbm32,0.0%,48.85,0,0,0,16.23,64911.27,
gfx950,256,2,7168,3072,48,6,ActivationType.Silu,torch.bfloat16,torch.float8_e4m3fn,torch.float4_e2m1fn_x2,QuantType.per_1x32,1,0,32,0,51.7932,flydsl_moe1_afp8_wfp4_bf16_t32x128x256_w4_gui_fp8,0.0%,30.3311,flydsl_moe2_afp8_wfp4_bf16_t32x128x256_reduce,0.0%,82.1243,0,0,0,19.31,38611.43,
gfx950,256,4,7168,3072,48,6,ActivationType.Silu,torch.bfloat16,torch.float8_e4m3fn,torch.float4_e2m1fn_x2,QuantType.per_1x32,1,0,32,0,86.3189,flydsl_moe1_afp8_wfp4_bf16_t32x128x256_w4_gui_fp8,0.0%,49.8749,flydsl_moe2_afp8_wfp4_bf16_t32x256x256_reduce_bnt2_persist,0.0%,136.1938,0,0,0,23.28,23282.85,
gfx950,256,8,7168,3072,48,6,ActivationType.Silu,torch.bfloat16,torch.float8_e4m3fn,torch.float4_e2m1fn_x2,QuantType.per_1x32,1,0,32,0,173.7883,flydsl_moe1_afp8_wfp4_bf16_t32x128x256_w3_gui_xcd4,0.0%,90.9395,flydsl_moe2_afp8_wfp4_bf16_t32x128x256_reduce_bnt2_persist,0.0%,264.7278,0,0,0,23.96,11978.59,
gfx950,256,16,7168,3072,48,6,ActivationType.Silu,torch.bfloat16,torch.float8_e4m3fn,torch.float4_e2m1fn_x2,QuantType.per_1x32,1,0,32,0,174.135,flydsl_moe1_afp8_wfp4_bf16_t32x128x256_w4_gui,0.0%,91.9132,flydsl_moe2_afp8_wfp4_bf16_t32x128x256_reduce_bnt2,0.0%,266.0482,0,0,0,47.67,11919.79,
gfx950,256,32,7168,3072,48,6,ActivationType.Silu,torch.bfloat16,torch.float8_e4m3fn,torch.float4_e2m1fn_x2,QuantType.per_1x32,1,0,32,0,175.642,flydsl_moe1_afp8_wfp4_bf16_t32x128x256_w4_gui,0.0%,94.7373,flydsl_moe2_afp8_wfp4_bf16_t32x128x256_reduce_bnt2,0.0%,270.3793,0,0,0,93.82,11730.12,
gfx950,256,64,7168,3072,48,6,ActivationType.Silu,torch.bfloat16,torch.float8_e4m3fn,torch.float4_e2m1fn_x2,QuantType.per_1x32,1,0,32,0,167.3185,flydsl_moe1_afp8_wfp4_bf16_t32x128x256_w3_gui_fp8,0.0%,97.9936,flydsl_moe2_afp8_wfp4_bf16_t32x128x256_reduce_bnt2,0.0%,265.3121,0,0,0,191.22,11956.75,
gfx950,256,128,7168,3072,48,6,ActivationType.Silu,torch.bfloat16,torch.float8_e4m3fn,torch.float4_e2m1fn_x2,QuantType.per_1x32,1,0,32,0,171.4439,flydsl_moe1_afp8_wfp4_bf16_t32x128x256_w4_gui_fp8,0.0%,99.0948,cktile_a8w4_bm32,0.0%,270.5387,0,0,0,375.06,11730.84,
gfx950,256,256,7168,3072,48,6,ActivationType.Silu,torch.bfloat16,torch.float8_e4m3fn,torch.float4_e2m1fn_x2,QuantType.per_1x32,1,0,32,0,181.2802,flydsl_moe1_afp8_wfp4_bf16_t32x128x256_w4_gui_fp8,0.0%,104.1853,cktile_a8w4_bm32,0.0%,285.4655,0,0,0,710.9,11127.08,
gfx950,256,512,7168,3072,48,6,ActivationType.Silu,torch.bfloat16,torch.float8_e4m3fn,torch.float4_e2m1fn_x2,QuantType.per_1x32,1,0,64,0,198.7476,flydsl_moe1_afp8_wfp4_bf16_t64x256x256_w3_gui_fp8,0.0%,125.1627,flydsl_moe2_afp8_wfp4_bf16_t64x256x256_atomic_bnt2_persist,0.0%,323.9103,0,0,0,1253.05,9823.41,
gfx950,256,1024,7168,3072,48,6,ActivationType.Silu,torch.bfloat16,torch.float8_e4m3fn,torch.float4_e2m1fn_x2,QuantType.per_1x32,1,0,128,0,269.0452,flydsl_moe1_afp8_wfp4_bf16_t128x256x256_gui_fp8,0.0%,197.4776,flydsl_moe2_afp8_wfp4_bf16_t64x128x256_atomic_persist_sbm128,0.0%,466.5228,0,0,0,1740.0,6844.07,
gfx950,256,2048,7168,3072,48,6,ActivationType.Silu,torch.bfloat16,torch.float8_e4m3fn,torch.float4_e2m1fn_x2,QuantType.per_1x32,1,0,128,0,452.3338,flydsl_moe1_afp8_wfp4_bf16_t128x256x256_w3_gui_fp8,0.0%,312.2701,flydsl_moe2_afp8_wfp4_bf16_t64x256x256_atomic_sbm128,0.0%,764.6039,0,0,0,2123.32,4204.71,
gfx950,256,4096,7168,3072,48,6,ActivationType.Silu,torch.bfloat16,torch.float8_e4m3fn,torch.float4_e2m1fn_x2,QuantType.per_1x32,1,0,128,0,822.0717,flydsl_moe1_afp8_wfp4_bf16_t128x256x256_gui_fp8,0.0%,542.1583,flydsl_moe2_afp8_wfp4_bf16_t64x256x256_atomic_sbm128,0.0%,1364.23,0,0,0,2380.09,2388.87,
gfx950,256,8192,7168,3072,48,6,ActivationType.Silu,torch.bfloat16,torch.float8_e4m3fn,torch.float4_e2m1fn_x2,QuantType.per_1x32,1,0,128,0,1578.2158,flydsl_moe1_afp8_wfp4_bf16_t128x256x256_w3_bnt0_gui_fp8,0.0%,1028.1551,flydsl_moe2_afp8_wfp4_bf16_t64x256x256_atomic_persist_sbm128,0.0%,2606.3709,0,0,0,2491.58,1284.18,
gfx950,256,16384,7168,3072,48,6,ActivationType.Silu,torch.bfloat16,torch.float8_e4m3fn,torch.float4_e2m1fn_x2,QuantType.per_1x32,1,0,128,0,3126.0795,flydsl_moe1_afp8_wfp4_bf16_t128x256x256_bnt0_gui_fp8,0.0%,2089.1799,flydsl_moe2_afp8_wfp4_bf16_t64x256x256_atomic_xcd4_persist_sbm128,0.0%,5215.2594,0,0,0,2490.38,675.56,
gfx950,256,1,4096,256,256,6,ActivationType.Silu,torch.bfloat16,torch.float8_e4m3fn,torch.float4_e2m1fn_x2,QuantType.per_1x32,1,0,32,0,8.7279,flydsl_moe1_afp8_wfp4_bf16_t32x64x256_w4_gui_kw4_fp8,0.0%,5.9242,flydsl_moe2_afp8_wfp4_bf16_t32x128x256_atomic_bnt2,0.0%,14.6521,0,0,0,2.58,54962.68,
gfx950,256,2,4096,256,256,6,ActivationType.Silu,torch.bfloat16,torch.float8_e4m3fn,torch.float4_e2m1fn_x2,QuantType.per_1x32,1,0,32,0,9.1761,flydsl_moe1_afp8_wfp4_bf16_t32x64x256_w2_gui_kw4_fp8,0.0%,7.9392,flydsl_moe2_afp8_wfp4_bf16_t32x256x256_reduce_persist,0.0%,17.1153,0,0,0,4.41,47053.28,
gfx950,256,4,4096,256,256,6,ActivationType.Silu,torch.bfloat16,torch.float8_e4m3fn,torch.float4_e2m1fn_x2,QuantType.per_1x32,1,0,32,0,10.4126,flydsl_moe1_afp8_wfp4_bf16_t32x64x256_w2_gui_kw4_fp8,0.0%,9.2818,flydsl_moe2_afp8_wfp4_bf16_t32x128x256_reduce_bnt2_persist,0.0%,19.6944,0,0,0,7.67,40892.62,
gfx950,256,8,4096,256,256,6,ActivationType.Silu,torch.bfloat16,torch.float8_e4m3fn,torch.float4_e2m1fn_x2,QuantType.per_1x32,1,0,32,0,14.0888,flydsl_moe1_afp8_wfp4_bf16_t32x64x256_w4_bnt0_gui_kw2_fp8,0.0%,10.8381,flydsl_moe2_afp8_wfp4_bf16_t32x128x256_reduce,0.0%,24.9269,0,0,0,12.12,32310.66,
gfx950,256,16,4096,256,256,6,ActivationType.Silu,torch.bfloat16,torch.float8_e4m3fn,torch.float4_e2m1fn_x2,QuantType.per_1x32,1,0,32,0,18.185,flydsl_moe1_afp8_wfp4_bf16_t32x64x256_w4_bnt0_gui_fp8,0.0%,13.7403,flydsl_moe2_afp8_wfp4_bf16_t32x256x256_reduce,0.0%,31.9253,0,0,0,18.92,25230.87,
gfx950,256,32,4096,256,256,6,ActivationType.Silu,torch.bfloat16,torch.float8_e4m3fn,torch.float4_e2m1fn_x2,QuantType.per_1x32,1,0,32,0,33.7587,flydsl_moe1_afp8_wfp4_bf16_t32x128x256_w4_bnt0_gui_fp8,0.0%,22.2507,flydsl_moe2_afp8_wfp4_bf16_t32x256x256_reduce_persist,0.0%,56.0094,0,0,0,21.57,14385.08,
gfx950,256,64,4096,256,256,6,ActivationType.Silu,torch.bfloat16,torch.float8_e4m3fn,torch.float4_e2m1fn_x2,QuantType.per_1x32,1,0,32,0,43.3979,flydsl_moe1_afp8_wfp4_bf16_t32x64x256_w4_gui_fp8,0.0%,29.0143,flydsl_moe2_afp8_wfp4_bf16_t32x256x256_reduce,0.0%,72.4122,0,0,0,33.36,11132.0,
gfx950,256,128,4096,256,256,6,ActivationType.Silu,torch.bfloat16,torch.float8_e4m3fn,torch.float4_e2m1fn_x2,QuantType.per_1x32,1,0,32,0,48.7587,flydsl_moe1_afp8_wfp4_bf16_t32x64x256_w4_gui_fp8,0.0%,34.1859,flydsl_moe2_afp8_wfp4_bf16_t32x256x256_reduce_bnt2_persist,0.0%,82.9446,0,0,0,58.25,9727.93,
gfx950,256,256,4096,256,256,6,ActivationType.Silu,torch.bfloat16,torch.float8_e4m3fn,torch.float4_e2m1fn_x2,QuantType.per_1x32,1,0,32,0,50.8344,flydsl_moe1_afp8_wfp4_bf16_t32x64x256_w4_gui_fp8,0.0%,37.1553,flydsl_moe2_afp8_wfp4_bf16_t32x256x256_reduce_bnt2_persist,0.0%,87.9897,0,0,0,109.83,9188.03,
gfx950,256,512,4096,256,256,6,ActivationType.Silu,torch.bfloat16,torch.float8_e4m3fn,torch.float4_e2m1fn_x2,QuantType.per_1x32,1,0,32,0,52.7784,flydsl_moe1_afp8_wfp4_bf16_t32x64x256_w4_gui_fp8,0.0%,41.83,flydsl_moe2_afp8_wfp4_bf16_t32x256x256_atomic_bnt2,0.0%,94.6084,0,0,0,204.29,8578.5,
gfx950,256,1024,4096,256,256,6,ActivationType.Silu,torch.bfloat16,torch.float8_e4m3fn,torch.float4_e2m1fn_x2,QuantType.per_1x32,1,0,32,0,60.6665,flydsl_moe1_afp8_wfp4_bf16_t32x128x256_w3_gui_fp8,0.0%,52.6596,flydsl_moe2_afp8_wfp4_bf16_t32x128x256_reduce_bnt2_persist,0.0%,113.3261,0,0,0,341.09,7217.13,
gfx950,256,2048,4096,256,256,6,ActivationType.Silu,torch.bfloat16,torch.float8_e4m3fn,torch.float4_e2m1fn_x2,QuantType.per_1x32,1,0,32,0,75.032,flydsl_moe1_afp8_wfp4_bf16_t32x128x256_w4_bnt0_gui_xcd4_fp8,0.0%,81.9673,flydsl_moe2_afp8_wfp4_bf16_t32x256x256_reduce,0.0%,156.9993,0,0,0,492.42,5289.66,
gfx950,256,4096,4096,256,256,6,ActivationType.Silu,torch.bfloat16,torch.float8_e4m3fn,torch.float4_e2m1fn_x2,QuantType.per_1x32,1,0,128,0,98.4044,flydsl_moe1_afp8_wfp4_bf16_t128x256x256_w4_gui_fp8,0.0%,154.0103,flydsl_moe2_afp8_wfp4_bf16_t128x256x256_reduce_bnt2_persist,0.0%,252.4147,0,0,0,612.56,3389.81,
gfx950,256,8192,4096,256,256,6,ActivationType.Silu,torch.bfloat16,torch.float8_e4m3fn,torch.float4_e2m1fn_x2,QuantType.per_1x32,1,0,64,0,166.1665,flydsl_moe1_afp8_wfp4_bf16_t64x256x256_gui_xcd4_fp8,0.0%,276.2316,flydsl_moe2_afp8_wfp4_bf16_t64x256x256_reduce,0.0%,442.3981,0,0,0,699.0,2047.86,
gfx950,256,16384,4096,256,256,6,ActivationType.Silu,torch.bfloat16,torch.float8_e4m3fn,torch.float4_e2m1fn_x2,QuantType.per_1x32,1,0,128,0,269.1305,flydsl_moe1_afp8_wfp4_bf16_t128x256x256_w2_bnt0_gui_xcd4_fp8,0.0%,513.319,flydsl_moe2_afp8_wfp4_bf16_t128x256x256_reduce,0.0%,782.4495,0,0,0,790.43,1286.51,
gfx950,256,32768,4096,256,256,6,ActivationType.Silu,torch.bfloat16,torch.float8_e4m3fn,torch.float4_e2m1fn_x2,QuantType.per_1x32,1,0,128,0,479.2326,flydsl_moe1_afp8_wfp4_bf16_t128x256x256_w2_bnt0_gui_xcd4_fp8,0.0%,994.8845,flydsl_moe2_afp8_wfp4_bf16_t128x256x256_reduce,0.0%,1474.1171,0,0,0,839.11,819.45,
gfx950,256,131072,4096,256,256,6,ActivationType.Silu,torch.bfloat16,torch.float8_e4m3fn,torch.float4_e2m1fn_x2,QuantType.per_1x32,1,0,128,0,1822.4995,flydsl_moe1_afp8_wfp4_bf16_t128x256x256_bnt0_gui_xcd4_fp8,0.0%,3856.5018,flydsl_moe2_afp8_wfp4_bf16_t64x256x256_reduce_xcd4_persist_sbm128,0.0%,5679.0013,0,0,0,871.25,425.41,
gfx950,256,1,4096,2048,256,6,ActivationType.Silu,torch.bfloat16,torch.float8_e4m3fn,torch.float4_e2m1fn_x2,QuantType.per_1x32,1,0,32,0,13.1954,flydsl_moe1_afp8_wfp4_bf16_t32x64x256_w2_gui_kw2_fp8,0.0%,11.3628,flydsl_moe2_afp8_wfp4_bf16_t32x128x256_reduce_bnt2,0.0%,24.5582,0,0,0,12.3,262334.5,
gfx950,256,2,4096,2048,256,6,ActivationType.Silu,torch.bfloat16,torch.float8_e4m3fn,torch.float4_e2m1fn_x2,QuantType.per_1x32,1,0,32,0,20.1426,flydsl_moe1_afp8_wfp4_bf16_t32x64x256_w3_gui_fp8,0.0%,14.7358,flydsl_moe2_afp8_wfp4_bf16_t32x128x256_reduce_persist,0.0%,34.8784,0,0,0,17.32,184712.47,
gfx950,256,4,4096,2048,256,6,ActivationType.Silu,torch.bfloat16,torch.float8_e4m3fn,torch.float4_e2m1fn_x2,QuantType.per_1x32,1,0,32,0,35.6444,flydsl_moe1_afp8_wfp4_bf16_t32x64x256_w3_gui_fp8,0.0%,22.9261,flydsl_moe2_afp8_wfp4_bf16_t32x128x256_reduce_bnt2_persist,0.0%,58.5705,0,0,0,20.62,109995.65,
gfx950,256,8,4096,2048,256,6,ActivationType.Silu,torch.bfloat16,torch.float8_e4m3fn,torch.float4_e2m1fn_x2,QuantType.per_1x32,1,0,32,0,66.3011,flydsl_moe1_afp8_wfp4_bf16_t32x64x256_w4_gui_fp8,0.0%,39.381,flydsl_moe2_afp8_wfp4_bf16_t32x128x256_reduce_persist,0.0%,105.6821,0,0,0,22.86,60961.59,
gfx950,256,16,4096,2048,256,6,ActivationType.Silu,torch.bfloat16,torch.float8_e4m3fn,torch.float4_e2m1fn_x2,QuantType.per_1x32,1,0,32,0,124.9989,flydsl_moe1_afp8_wfp4_bf16_t32x64x256_w3_gui_kw2_fp8,0.0%,72.1626,cktile_a8w4_bm32,0.0%,197.1615,0,0,0,24.51,32677.01,
gfx950,256,32,4096,2048,256,6,ActivationType.Silu,torch.bfloat16,torch.float8_e4m3fn,torch.float4_e2m1fn_x2,QuantType.per_1x32,1,0,32,0,201.2978,flydsl_moe1_afp8_wfp4_bf16_t32x64x256_w3_gui_kw2_fp8,0.0%,110.8525,flydsl_moe2_afp8_wfp4_bf16_t32x128x128_reduce_bnt2_persist,0.0%,312.1503,0,0,0,30.96,20640.2,
gfx950,256,64,4096,2048,256,6,ActivationType.Silu,torch.bfloat16,torch.float8_e4m3fn,torch.float4_e2m1fn_x2,QuantType.per_1x32,1,0,32,0,274.0652,flydsl_moe1_afp8_wfp4_bf16_t32x64x256_w3_gui_kw2_fp8,0.0%,151.599,flydsl_moe2_afp8_wfp4_bf16_t32x128x256_atomic_persist,0.0%,425.6642,0,0,0,45.41,15136.9,
gfx950,256,128,4096,2048,256,6,ActivationType.Silu,torch.bfloat16,torch.float8_e4m3fn,torch.float4_e2m1fn_x2,QuantType.per_1x32,1,0,32,0,321.1872,flydsl_moe1_afp8_wfp4_bf16_t32x64x256_w4_gui_kw2_fp8,0.0%,178.1048,cktile_a8w4_bm32,0.0%,499.292,0,0,0,77.42,12906.32,
gfx950,256,256,4096,2048,256,6,ActivationType.Silu,torch.bfloat16,torch.float8_e4m3fn,torch.float4_e2m1fn_x2,QuantType.per_1x32,1,0,32,0,345.4854,flydsl_moe1_afp8_wfp4_bf16_t32x64x256_w4_gui_kw2_fp8,0.0%,193.9367,flydsl_moe2_afp8_wfp4_bf16_t32x128x128_atomic_bnt2_persist,0.0%,539.4221,0,0,0,143.32,11949.08,
gfx950,256,512,4096,2048,256,6,ActivationType.Silu,torch.bfloat16,torch.float8_e4m3fn,torch.float4_e2m1fn_x2,QuantType.per_1x32,1,0,32,0,356.8284,flydsl_moe1_afp8_wfp4_bf16_t32x64x256_w4_gui_kw2_fp8,0.0%,197.886,flydsl_moe2_afp8_wfp4_bf16_t32x128x256_atomic,0.0%,554.7144,0,0,0,278.74,11625.34,
gfx950,256,1024,4096,2048,256,6,ActivationType.Silu,torch.bfloat16,torch.float8_e4m3fn,torch.float4_e2m1fn_x2,QuantType.per_1x32,1,0,32,0,392.833,flydsl_moe1_afp8_wfp4_bf16_t32x128x256_w3_gui_fp8,0.0%,210.1492,flydsl_moe2_afp8_wfp4_bf16_t32x128x256_atomic,0.0%,602.9822,0,0,0,512.85,10705.18,
gfx950,256,2048,4096,2048,256,6,ActivationType.Silu,torch.bfloat16,torch.float8_e4m3fn,torch.float4_e2m1fn_x2,QuantType.per_1x32,1,0,64,0,419.4653,flydsl_moe1_afp8_wfp4_bf16_t64x128x256_w3_gui_fp8,0.0%,246.9579,flydsl_moe2_afp8_wfp4_bf16_t64x128x256_atomic_bnt2_persist,0.0%,666.4232,0,0,0,928.05,9704.97,
gfx950,256,4096,4096,2048,256,6,ActivationType.Silu,torch.bfloat16,torch.float8_e4m3fn,torch.float4_e2m1fn_x2,QuantType.per_1x32,1,0,128,0,563.2488,flydsl_moe1_afp8_wfp4_bf16_t128x256x256_w4_gui_fp8,0.0%,356.8566,flydsl_moe2_afp8_wfp4_bf16_t64x256x256_reduce_bnt2_persist_sbm128,0.0%,920.1054,0,0,0,1344.36,7056.56,
gfx950,256,8192,4096,2048,256,6,ActivationType.Silu,torch.bfloat16,torch.float8_e4m3fn,torch.float4_e2m1fn_x2,QuantType.per_1x32,1,0,64,0,1000.4671,flydsl_moe1_afp8_wfp4_bf16_t64x256x256_w4_bnt0_gui,0.0%,573.6539,flydsl_moe2_afp8_wfp4_bf16_t64x256x256_reduce_bnt2,0.0%,1574.121,0,0,0,1571.61,4156.68,
gfx950,256,16384,4096,2048,256,6,ActivationType.Silu,torch.bfloat16,torch.float8_e4m3fn,torch.float4_e2m1fn_x2,QuantType.per_1x32,1,0,128,0,1590.7982,flydsl_moe1_afp8_wfp4_bf16_t128x256x256_bnt0_gui_fp8,0.0%,1045.6778,flydsl_moe2_afp8_wfp4_bf16_t64x256x128_atomic_sbm128,0.0%,2636.476,0,0,0,1876.67,2519.95,
gfx950,256,32768,4096,2048,256,6,ActivationType.Silu,torch.bfloat16,torch.float8_e4m3fn,torch.float4_e2m1fn_x2,QuantType.per_1x32,1,0,128,0,2915.7859,flydsl_moe1_afp8_wfp4_bf16_t128x256x256_w2_bnt0_gui_fp8,0.0%,1991.2871,flydsl_moe2_afp8_wfp4_bf16_t64x256x128_atomic_bnt2_sbm128,0.0%,4907.073,0,0,0,2016.6,1394.95,
gfx950,256,1,7168,384,384,6,ActivationType.Silu,torch.bfloat16,torch.float8_e4m3fn,torch.float4_e2m1fn_x2,QuantType.per_1x32,1,0,32,0,12.0779,flydsl_moe1_afp8_wfp4_bf16_t32x64x256_w4_gui_kw4_fp8,0.0%,7.719,opus_moe2_afp8_wfp4_atomic_t32x128x256_sbm32_occ1_cache_b3_ws2,0.0%,19.7969,0,0,0,5.01,80086.7,
gfx950,256,2,7168,384,384,6,ActivationType.Silu,torch.bfloat16,torch.float8_e4m3fn,torch.float4_e2m1fn_x2,QuantType.per_1x32,1,0,32,0,12.7987,flydsl_moe1_afp8_wfp4_bf16_t32x64x256_w2_gui_kw4_fp8,0.0%,10.2316,flydsl_moe2_afp8_wfp4_bf16_t32x128x128_reduce_bnt2,0.0%,23.0303,0,0,0,8.61,68843.65,
gfx950,256,4,7168,384,384,6,ActivationType.Silu,torch.bfloat16,torch.float8_e4m3fn,torch.float4_e2m1fn_x2,QuantType.per_1x32,1,0,32,0,17.8494,flydsl_moe1_afp8_wfp4_bf16_t32x64x256_w3_gui_kw2_fp8,0.0%,12.4988,flydsl_moe2_afp8_wfp4_bf16_t32x128x128_reduce_persist,0.0%,30.3482,0,0,0,13.06,52244.71,
gfx950,256,8,7168,384,384,6,ActivationType.Silu,torch.bfloat16,torch.float8_e4m3fn,torch.float4_e2m1fn_x2,QuantType.per_1x32,1,0,32,0,26.1206,flydsl_moe1_afp8_wfp4_bf16_t32x64x256_w3_gui_fp8,0.0%,18.2246,flydsl_moe2_afp8_wfp4_bf16_t32x128x128_reduce_bnt2,0.0%,44.3452,0,0,0,17.88,35756.27,
gfx950,256,16,7168,384,384,6,ActivationType.Silu,torch.bfloat16,torch.float8_e4m3fn,torch.float4_e2m1fn_x2,QuantType.per_1x32,1,0,32,0,41.7119,flydsl_moe1_afp8_wfp4_bf16_t32x128x256_w2_gui_fp8,0.0%,28.3484,opus_moe2_afp8_wfp4_atomic_t32x128x256_sbm32_occ1_cache_b3_ws2,0.0%,70.0603,0,0,0,22.63,22634.66,
gfx950,256,32,7168,384,384,6,ActivationType.Silu,torch.bfloat16,torch.float8_e4m3fn,torch.float4_e2m1fn_x2,QuantType.per_1x32,1,0,32,0,71.3996,flydsl_moe1_afp8_wfp4_bf16_t32x128x256_w2_gui_fp8,0.0%,42.0984,opus_moe2_afp8_wfp4_atomic_t32x128x256_sbm32_occ1_cache_b3_ws2,0.0%,113.498,0,0,0,27.94,13975.0,
gfx950,256,64,7168,384,384,6,ActivationType.Silu,torch.bfloat16,torch.float8_e4m3fn,torch.float4_e2m1fn_x2,QuantType.per_1x32,1,0,32,0,110.7845,flydsl_moe1_afp8_wfp4_bf16_t32x128x256_w2_gui_fp8,0.0%,61.2529,opus_moe2_afp8_wfp4_atomic_t32x128x256_sbm32_occ1_cache_b3_ws2,0.0%,172.0374,0,0,0,36.86,9223.71,
gfx950,256,128,7168,384,384,6,ActivationType.Silu,torch.bfloat16,torch.float8_e4m3fn,torch.float4_e2m1fn_x2,QuantType.per_1x32,1,0,32,0,152.588,flydsl_moe1_afp8_wfp4_bf16_t32x128x256_w4_gui_fp8,0.0%,86.5595,opus_moe2_afp8_wfp4_atomic_t32x128x256_sbm32_occ1_cache_b3_ws2,0.0%,239.1475,0,0,0,53.04,6641.09,
gfx950,256,256,7168,384,384,6,ActivationType.Silu,torch.bfloat16,torch.float8_e4m3fn,torch.float4_e2m1fn_x2,QuantType.per_1x32,1,0,32,0,170.384,flydsl_moe1_afp8_wfp4_bf16_t32x128x256_w3_gui_fp8,0.0%,98.6119,opus_moe2_afp8_wfp4_atomic_t32x128x256_sbm32_occ1_cache_b3_ws2,0.0%,268.9959,0,0,0,94.3,5914.41,
gfx950,256,512,7168,384,384,6,ActivationType.Silu,torch.bfloat16,torch.float8_e4m3fn,torch.float4_e2m1fn_x2,QuantType.per_1x32,1,0,32,0,176.0559,flydsl_moe1_afp8_wfp4_bf16_t32x128x256_w3_gui_fp8,0.0%,107.6261,opus_moe2_afp8_wfp4_atomic_t32x128x256_sbm32_occ1_cache_b3_ws2,0.0%,283.682,0,0,0,178.84,5627.63,
gfx950,256,1024,7168,384,384,6,ActivationType.Silu,torch.bfloat16,torch.float8_e4m3fn,torch.float4_e2m1fn_x2,QuantType.per_1x32,1,0,32,0,188.1073,flydsl_moe1_afp8_wfp4_bf16_t32x128x256_w4_gui_fp8,0.0%,118.8376,opus_moe2_afp8_wfp4_atomic_t32x128x256_sbm32_occ1_cache_b3_ws2,0.0%,306.9449,0,0,0,330.58,5236.99,
gfx950,256,2048,7168,384,384,6,ActivationType.Silu,torch.bfloat16,torch.float8_e4m3fn,torch.float4_e2m1fn_x2,QuantType.per_1x32,1,0,64,0,206.1881,flydsl_moe1_afp8_wfp4_bf16_t64x256x256_gui_fp8,0.0%,151.3264,opus_moe2_afp8_wfp4_fp8_t64x256x256_sbm64_rbn3072,0.1%,357.5145,0,0,0,567.63,4557.82,
gfx950,256,4096,7168,384,384,6,ActivationType.Silu,torch.bfloat16,torch.float8_e4m3fn,torch.float4_e2m1fn_x2,QuantType.per_1x32,1,0,64,0,297.0045,flydsl_moe1_afp8_wfp4_bf16_t64x256x256_w3_bnt0_gui_fp8,0.0%,217.5489,opus_moe2_afp8_wfp4_fp8_t64x256x256_sbm64_rbn3584,0.1%,514.5534,0,0,0,788.79,3252.39,
gfx950,256,8192,7168,384,384,6,ActivationType.Silu,torch.bfloat16,torch.float8_e4m3fn,torch.float4_e2m1fn_x2,QuantType.per_1x32,1,0,64,0,412.7111,flydsl_moe1_afp8_wfp4_bf16_t64x256x256_bnt0_gui_xcd4_fp8,0.0%,362.191,opus_moe2_afp8_wfp4_fp8_t64x256x256_sbm64_rbn3584,0.0%,774.9021,0,0,0,1047.55,4319.33,
gfx950,256,16384,7168,384,384,6,ActivationType.Silu,torch.bfloat16,torch.float8_e4m3fn,torch.float4_e2m1fn_x2,QuantType.per_1x32,1,0,64,0,640.2585,flydsl_moe1_afp8_wfp4_bf16_t64x256x256_w3_bnt0_gui_xcd4_fp8,0.0%,669.946,opus_moe2_afp8_wfp4_fp8_t64x256x256_sbm64_rbn3072,0.0%,1310.2045,0,0,0,1239.12,2689.06,
gfx950,256,32768,7168,384,384,6,ActivationType.Silu,torch.bfloat16,torch.float8_e4m3fn,torch.float4_e2m1fn_x2,QuantType.per_1x32,1,0,64,0,1081.1583,flydsl_moe1_afp8_wfp4_bf16_t64x256x256_w2_bnt0_gui_xcd4_fp8,0.0%,1282.4537,opus_moe2_afp8_wfp4_fp8_t64x256x256_sbm64_rbn3072,0.0%,2363.612,0,0,0,1373.74,1639.67,
