aiter/configs/model_configs/dsv4_a8w8_blockscale_bpreshuffle_tuned_gemm.csv
gfx,cu_num,M,N,K,libtype,kernelId,splitK,us,kernelName,tflops,bw,errRatio
gfx942,80,1,1536,4096,ck,7,0,13.4091,a8w8_blockscale_bpreshuffle_1x128x128_256x16x64x256_16x16_16x16_16x16x1_16x16x1_1x16x1x16_4_1x1_intrawave_v1,0.94,0.46973,0.0
gfx942,80,2,1536,4096,ck,7,0,13.4042,a8w8_blockscale_bpreshuffle_1x128x128_256x16x64x256_16x16_16x16_16x16x1_16x16x1_1x16x1x16_4_1x1_intrawave_v1,1.88,0.47043,0.0
gfx942,80,4,1536,4096,ck,7,0,13.4322,a8w8_blockscale_bpreshuffle_1x128x128_256x16x64x256_16x16_16x16_16x16x1_16x16x1_1x16x1x16_4_1x1_intrawave_v1,3.75,0.47052,0.0
gfx942,80,8,1536,4096,ck,7,0,13.5011,a8w8_blockscale_bpreshuffle_1x128x128_256x16x64x256_16x16_16x16_16x16x1_16x16x1_1x16x1x16_4_1x1_intrawave_v1,7.46,0.47024,0.0
gfx942,80,16,1536,4096,ck,7,0,12.0155,a8w8_blockscale_bpreshuffle_1x128x128_256x16x64x256_16x16_16x16_16x16x1_16x16x1_1x16x1x16_4_1x1_intrawave_v1,16.76,0.53316,0.0
gfx942,80,32,1536,4096,ck,7,0,12.2919,a8w8_blockscale_bpreshuffle_1x128x128_256x16x64x256_16x16_16x16_16x16x1_16x16x1_1x16x1x16_4_1x1_intrawave_v1,32.76,0.5305,0.0
gfx942,80,48,1536,4096,ck,7,0,12.2615,a8w8_blockscale_bpreshuffle_1x128x128_256x16x64x256_16x16_16x16_16x16x1_16x16x1_1x16x1x16_4_1x1_intrawave_v1,49.26,0.54117,0.0
gfx942,80,64,1536,4096,ck,7,0,14.2278,a8w8_blockscale_bpreshuffle_1x128x128_256x16x64x256_16x16_16x16_16x16x1_16x16x1_1x16x1x16_4_1x1_intrawave_v1,56.6,0.47444,0.0
gfx942,80,128,1536,4096,asm,0,1,19.048,_ZN5aiter42fp8gemm_bf16_blockscale_BpreShuffle_32x128E,84.56,0.37846,0.0
gfx942,80,256,1536,4096,asm,1,1,20.665,_ZN5aiter42fp8gemm_bf16_blockscale_BpreShuffle_48x128E,155.88,0.39325,0.0
gfx942,80,384,1536,4096,asm,2,1,25.1312,_ZN5aiter42fp8gemm_bf16_blockscale_BpreShuffle_64x128E,192.26,0.35987,0.0
gfx942,80,512,1536,4096,asm,4,1,33.029,_ZN5aiter42fp8gemm_bf16_blockscale_BpreShuffle_96x128E,195.05,0.3016,0.0
gfx942,80,640,1536,4096,asm,5,1,42.0192,_ZN5aiter43fp8gemm_bf16_blockscale_BpreShuffle_128x128E,191.65,0.2589,0.0
gfx942,80,768,1536,4096,asm,5,1,42.2965,_ZN5aiter43fp8gemm_bf16_blockscale_BpreShuffle_128x128E,228.47,0.2789,0.0
gfx942,80,896,1536,4096,asm,3,1,54.9308,_ZN5aiter42fp8gemm_bf16_blockscale_BpreShuffle_80x128E,205.25,0.23145,0.0
gfx942,80,1024,1536,4096,asm,3,1,55.3197,_ZN5aiter42fp8gemm_bf16_blockscale_BpreShuffle_80x128E,232.92,0.24641,0.0
gfx942,80,1152,1536,4096,asm,4,1,63.8699,_ZN5aiter42fp8gemm_bf16_blockscale_BpreShuffle_96x128E,226.95,0.22779,0.0
gfx942,80,1280,1536,4096,ck,14,0,67.2363,a8w8_blockscale_bpreshuffle_1x128x128_256x64x128x128_16x16_16x16_8x32x1_8x32x1_1x32x1x8_8_2x1_intrawave_v1,239.55,0.23003,0.0
gfx942,80,1408,1536,4096,opus,11000,0,77.2207,opus_gemm_gfx942_a8w8_bs_bpreshuf_sb_tailm_v16_512x128x128x128_4x2_16x16x32_1x128x128,229.43,0.21217,0.002053
gfx942,80,1536,1536,4096,opus,11000,0,77.4084,opus_gemm_gfx942_a8w8_bs_bpreshuf_sb_tailm_v16_512x128x128x128_4x2_16x16x32_1x128x128,249.68,0.22351,0.002205
gfx942,80,1664,1536,4096,opus,11000,0,77.5835,opus_gemm_gfx942_a8w8_bs_bpreshuf_sb_tailm_v16_512x128x128x128_4x2_16x16x32_1x128x128,269.88,0.23483,0.001986
gfx942,80,1792,1536,4096,asm,4,1,95.0012,_ZN5aiter42fp8gemm_bf16_blockscale_BpreShuffle_96x128E,237.35,0.20143,0.0
gfx942,80,1920,1536,4096,asm,4,1,95.3951,_ZN5aiter42fp8gemm_bf16_blockscale_BpreShuffle_96x128E,253.25,0.21022,0.0
gfx942,80,2048,1536,4096,ck,14,0,107.4475,a8w8_blockscale_bpreshuffle_1x128x128_256x64x128x128_16x16_16x16_8x32x1_8x32x1_1x32x1x8_8_2x1_intrawave_v1,239.84,0.19518,0.0
gfx942,80,2304,1536,4096,asm,5,1,121.231,_ZN5aiter43fp8gemm_bf16_blockscale_BpreShuffle_128x128E,239.14,0.18812,0.0
gfx942,80,2560,1536,4096,asm,5,1,121.8246,_ZN5aiter43fp8gemm_bf16_blockscale_BpreShuffle_128x128E,264.42,0.20227,0.0
gfx942,80,2816,1536,4096,ck,14,0,146.6915,a8w8_blockscale_bpreshuffle_1x128x128_256x64x128x128_16x16_16x16_8x32x1_8x32x1_1x32x1x8_8_2x1_intrawave_v1,241.55,0.18049,0.0
gfx942,80,3072,1536,4096,opus,11000,0,151.2555,opus_gemm_gfx942_a8w8_bs_bpreshuf_sb_tailm_v16_512x128x128x128_4x2_16x16x32_1x128x128,255.56,0.18718,0.002344
gfx942,80,3328,1536,4096,opus,11000,0,152.4549,opus_gemm_gfx942_a8w8_bs_bpreshuf_sb_tailm_v16_512x128x128x128_4x2_16x16x32_1x128x128,274.68,0.19774,0.002761
gfx942,80,3584,1536,4096,ck,14,0,183.09,a8w8_blockscale_bpreshuffle_1x128x128_256x64x128x128_16x16_16x16_8x32x1_8x32x1_1x32x1x8_8_2x1_intrawave_v1,246.31,0.17468,0.0
gfx942,80,3840,1536,4096,ck,14,0,187.1509,a8w8_blockscale_bpreshuffle_1x128x128_256x64x128x128_16x16_16x16_8x32x1_8x32x1_1x32x1x8_8_2x1_intrawave_v1,258.18,0.18069,0.0
gfx942,80,7296,1536,4096,opus,11000,0,341.1646,opus_gemm_gfx942_a8w8_bs_bpreshuf_sb_tailm_v16_512x128x128x128_4x2_16x16x32_1x128x128,269.09,0.17173,0.002842
gfx942,80,7680,1536,4096,opus,11000,0,342.9308,opus_gemm_gfx942_a8w8_bs_bpreshuf_sb_tailm_v16_512x128x128x128_4x2_16x16x32_1x128x128,281.8,0.17887,0.002705
gfx942,80,15360,1536,4096,opus,11000,0,671.2028,opus_gemm_gfx942_a8w8_bs_bpreshuf_sb_tailm_v16_512x128x128x128_4x2_16x16x32_1x128x128,287.95,0.17341,0.002959
gfx942,80,1,4096,1024,ck,7,0,6.1022,a8w8_blockscale_bpreshuffle_1x128x128_256x16x64x256_16x16_16x16_16x16x1_16x16x1_1x16x1x16_4_1x1_intrawave_v1,1.37,0.68885,0.0
gfx942,80,2,4096,1024,ck,7,0,5.8646,a8w8_blockscale_bpreshuffle_1x128x128_256x16x64x256_16x16_16x16_16x16x1_16x16x1_1x16x1x16_4_1x1_intrawave_v1,2.86,0.71833,0.0
gfx942,80,4,4096,1024,ck,7,0,5.8422,a8w8_blockscale_bpreshuffle_1x128x128_256x16x64x256_16x16_16x16_16x16x1_16x16x1_1x16x1x16_4_1x1_intrawave_v1,5.74,0.72424,0.0
gfx942,80,8,4096,1024,ck,7,0,6.1025,a8w8_blockscale_bpreshuffle_1x128x128_256x16x64x256_16x16_16x16_16x16x1_16x16x1_1x16x1x16_4_1x1_intrawave_v1,11.0,0.69939,0.0
gfx942,80,16,4096,1024,ck,7,0,5.9728,a8w8_blockscale_bpreshuffle_1x128x128_256x16x64x256_16x16_16x16_16x16x1_16x16x1_1x16x1x16_4_1x1_intrawave_v1,22.47,0.72692,0.0
gfx942,80,32,4096,1024,ck,12,0,6.963,a8w8_blockscale_bpreshuffle_1x128x128_256x32x64x256_16x16_16x16_16x16x1_16x16x1_1x32x1x8_8_2x1_intrawave_v1,38.55,0.64472,0.0
gfx942,80,48,4096,1024,ck,7,0,7.9138,a8w8_blockscale_bpreshuffle_1x128x128_256x16x64x256_16x16_16x16_16x16x1_16x16x1_1x16x1x16_4_1x1_intrawave_v1,50.88,0.5859,0.0
gfx942,80,64,4096,1024,asm,0,1,8.631,_ZN5aiter42fp8gemm_bf16_blockscale_BpreShuffle_32x128E,62.2,0.5543,0.0
gfx942,80,128,4096,1024,asm,2,1,11.3466,_ZN5aiter42fp8gemm_bf16_blockscale_BpreShuffle_64x128E,94.63,0.47362,0.0
gfx942,80,256,4096,1024,asm,5,1,17.7933,_ZN5aiter43fp8gemm_bf16_blockscale_BpreShuffle_128x128E,120.69,0.36832,0.0
gfx942,80,512,4096,1024,opus,11000,0,25.3276,opus_gemm_gfx942_a8w8_bs_bpreshuf_sb_tailm_v16_512x128x128x128_4x2_16x16x32_1x128x128,169.58,0.3519,0.0026
gfx942,80,768,4096,1024,ck,14,0,38.6102,a8w8_blockscale_bpreshuffle_1x128x128_256x64x128x128_16x16_16x16_8x32x1_8x32x1_1x32x1x8_8_2x1_intrawave_v1,166.86,0.29195,0.0
gfx942,80,1024,4096,1024,opus,11000,0,47.0599,opus_gemm_gfx942_a8w8_bs_bpreshuf_sb_tailm_v16_512x128x128x128_4x2_16x16x32_1x128x128,182.53,0.28966,0.002
gfx942,80,1280,4096,1024,opus,11000,0,48.3104,opus_gemm_gfx942_a8w8_bs_bpreshuf_sb_tailm_v16_512x128x128x128_4x2_16x16x32_1x128x128,222.26,0.331,0.004
gfx942,80,1536,4096,1024,opus,11000,0,61.6251,opus_gemm_gfx942_a8w8_bs_bpreshuf_sb_tailm_v16_512x128x128x128_4x2_16x16x32_1x128x128,209.09,0.29777,0.0027
gfx942,80,1792,4096,1024,opus,11000,0,69.6357,opus_gemm_gfx942_a8w8_bs_bpreshuf_sb_tailm_v16_512x128x128x128_4x2_16x16x32_1x128x128,215.87,0.2974,0.0036
gfx942,80,2048,4096,1024,opus,11000,0,82.0366,opus_gemm_gfx942_a8w8_bs_bpreshuf_sb_tailm_v16_512x128x128x128_4x2_16x16x32_1x128x128,209.42,0.2812,0.0038
gfx942,80,2304,4096,1024,opus,11000,0,90.7454,opus_gemm_gfx942_a8w8_bs_bpreshuf_sb_tailm_v16_512x128x128x128_4x2_16x16x32_1x128x128,212.98,0.28021,0.0046
gfx942,80,2560,4096,1024,opus,11000,0,93.0663,opus_gemm_gfx942_a8w8_bs_bpreshuf_sb_tailm_v16_512x128x128x128_4x2_16x16x32_1x128x128,230.75,0.29857,0.0043
gfx942,80,2816,4096,1024,opus,11000,0,104.2206,opus_gemm_gfx942_a8w8_bs_bpreshuf_sb_tailm_v16_512x128x128x128_4x2_16x16x32_1x128x128,226.66,0.28926,0.0038
gfx942,80,3072,4096,1024,opus,11000,0,114.0565,opus_gemm_gfx942_a8w8_bs_bpreshuf_sb_tailm_v16_512x128x128x128_4x2_16x16x32_1x128x128,225.94,0.285,0.0048
gfx942,80,3328,4096,1024,opus,11000,0,125.2813,opus_gemm_gfx942_a8w8_bs_bpreshuf_sb_tailm_v16_512x128x128x128_4x2_16x16x32_1x128x128,222.84,0.27829,0.0046
gfx942,80,3584,4096,1024,opus,11000,0,135.0876,opus_gemm_gfx942_a8w8_bs_bpreshuf_sb_tailm_v16_512x128x128x128_4x2_16x16x32_1x128x128,222.56,0.27556,0.0053
gfx942,80,3840,4096,1024,opus,11000,0,137.1743,opus_gemm_gfx942_a8w8_bs_bpreshuf_sb_tailm_v16_512x128x128x128_4x2_16x16x32_1x128x128,234.83,0.28857,0.0052
gfx942,80,15360,4096,1024,opus,11000,0,538.2172,opus_gemm_gfx942_a8w8_bs_bpreshuf_sb_tailm_v16_512x128x128x128_4x2_16x16x32_1x128x128,239.4,0.27081,0.007
gfx942,80,48,4096,2048,asm,0,1,11.9734,_ZN5aiter42fp8gemm_bf16_blockscale_BpreShuffle_32x128E,67.26,0.74165,0.0
gfx942,80,640,4096,2048,opus,11000,0,43.7904,opus_gemm_gfx942_a8w8_bs_bpreshuf_sb_tailm_v16_512x128x128x128_4x2_16x16x32_1x128x128,245.2,0.34122,0.0024
gfx942,80,768,4096,2048,ck,14,0,61.1251,a8w8_blockscale_bpreshuffle_1x128x128_256x64x128x128_16x16_16x16_8x32x1_8x32x1_1x32x1x8_8_2x1_intrawave_v1,210.8,0.2659,0.0
gfx942,80,896,4096,2048,opus,11000,0,71.4763,opus_gemm_gfx942_a8w8_bs_bpreshuf_sb_tailm_v16_512x128x128x128_4x2_16x16x32_1x128x128,210.31,0.24573,0.0019
gfx942,80,1152,4096,2048,opus,11000,0,83.0592,opus_gemm_gfx942_a8w8_bs_bpreshuf_sb_tailm_v16_512x128x128x128_4x2_16x16x32_1x128x128,232.69,0.24302,0.0038
gfx942,80,1280,4096,2048,opus,11000,0,83.8157,opus_gemm_gfx942_a8w8_bs_bpreshuf_sb_tailm_v16_512x128x128x128_4x2_16x16x32_1x128x128,256.21,0.25647,0.0029
gfx942,80,1408,4096,2048,ck,14,0,103.96,a8w8_blockscale_bpreshuffle_1x128x128_256x64x128x128_16x16_16x16_8x32x1_8x32x1_1x32x1x8_8_2x1_intrawave_v1,227.23,0.21938,0.0
gfx942,80,1664,4096,2048,opus,11000,0,121.3695,opus_gemm_gfx942_a8w8_bs_bpreshuf_sb_tailm_v16_512x128x128x128_4x2_16x16x32_1x128x128,230.02,0.20951,0.003
gfx942,80,1792,4096,2048,opus,11000,0,122.7678,opus_gemm_gfx942_a8w8_bs_bpreshuf_sb_tailm_v16_512x128x128x128_4x2_16x16x32_1x128x128,244.89,0.2178,0.0042
gfx942,80,1920,4096,2048,opus,11000,0,123.8401,opus_gemm_gfx942_a8w8_bs_bpreshuf_sb_tailm_v16_512x128x128x128_4x2_16x16x32_1x128x128,260.11,0.2265,0.0037
gfx942,80,7296,4096,2048,opus,11000,0,462.0239,opus_gemm_gfx942_a8w8_bs_bpreshuf_sb_tailm_v16_512x128x128x128_4x2_16x16x32_1x128x128,264.94,0.17986,0.0053
gfx942,80,7680,4096,2048,opus,11000,0,482.6771,opus_gemm_gfx942_a8w8_bs_bpreshuf_sb_tailm_v16_512x128x128x128_4x2_16x16x32_1x128x128,266.95,0.18031,0.0052
gfx942,80,1,8192,1024,ck,7,0,7.229,a8w8_blockscale_bpreshuffle_1x128x128_256x16x64x256_16x16_16x16_16x16x1_16x16x1_1x16x1x16_4_1x1_intrawave_v1,2.32,1.16282,0.0
gfx942,80,2,8192,1024,ck,7,0,7.2683,a8w8_blockscale_bpreshuffle_1x128x128_256x16x64x256_16x16_16x16_16x16x1_16x16x1_1x16x1x16_4_1x1_intrawave_v1,4.62,1.15893,0.0
gfx942,80,4,8192,1024,ck,7,0,7.2474,a8w8_blockscale_bpreshuffle_1x128x128_256x16x64x256_16x16_16x16_16x16x1_16x16x1_1x16x1x16_4_1x1_intrawave_v1,9.26,1.16707,0.0
gfx942,80,8,8192,1024,ck,7,0,7.3482,a8w8_blockscale_bpreshuffle_1x128x128_256x16x64x256_16x16_16x16_16x16x1_16x16x1_1x16x1x16_4_1x1_intrawave_v1,18.27,1.16054,0.0
gfx942,80,16,8192,1024,ck,7,0,7.0098,a8w8_blockscale_bpreshuffle_1x128x128_256x16x64x256_16x16_16x16_16x16x1_16x16x1_1x16x1x16_4_1x1_intrawave_v1,38.29,1.23643,0.0
gfx942,80,32,8192,1024,ck,12,0,8.9039,a8w8_blockscale_bpreshuffle_1x128x128_256x32x64x256_16x16_16x16_16x16x1_16x16x1_1x32x1x8_8_2x1_intrawave_v1,60.3,1.00469,0.0
gfx942,80,48,8192,1024,asm,1,1,10.1267,_ZN5aiter42fp8gemm_bf16_blockscale_BpreShuffle_48x128E,79.52,0.91088,0.0
gfx942,80,64,8192,1024,asm,2,1,11.6546,_ZN5aiter42fp8gemm_bf16_blockscale_BpreShuffle_64x128E,92.13,0.81536,0.0
gfx942,80,128,8192,1024,asm,5,1,18.3647,_ZN5aiter43fp8gemm_bf16_blockscale_BpreShuffle_128x128E,116.94,0.57811,0.0
gfx942,80,256,8192,1024,opus,11000,0,25.4408,opus_gemm_gfx942_a8w8_bs_bpreshuf_sb_tailm_v16_512x128x128x128_4x2_16x16x32_1x128x128,168.82,0.5049,0.0043
gfx942,80,384,8192,1024,opus,11000,0,38.656,opus_gemm_gfx942_a8w8_bs_bpreshuf_sb_tailm_v16_512x128x128x128_4x2_16x16x32_1x128x128,166.66,0.38993,0.0016
gfx942,80,512,8192,1024,opus,11000,0,46.5585,opus_gemm_gfx942_a8w8_bs_bpreshuf_sb_tailm_v16_512x128x128x128_4x2_16x16x32_1x128x128,184.5,0.37161,0.0021
gfx942,80,640,8192,1024,opus,11000,0,48.1669,opus_gemm_gfx942_a8w8_bs_bpreshuf_sb_tailm_v16_512x128x128x128_4x2_16x16x32_1x128x128,222.92,0.40546,0.0037
gfx942,80,768,8192,1024,opus,11000,0,61.2057,opus_gemm_gfx942_a8w8_bs_bpreshuf_sb_tailm_v16_512x128x128x128_4x2_16x16x32_1x128x128,210.52,0.35549,0.0034
gfx942,80,896,8192,1024,opus,11000,0,69.375,opus_gemm_gfx942_a8w8_bs_bpreshuf_sb_tailm_v16_512x128x128x128_4x2_16x16x32_1x128x128,216.68,0.34575,0.0049
gfx942,80,1024,8192,1024,opus,11000,0,81.4635,opus_gemm_gfx942_a8w8_bs_bpreshuf_sb_tailm_v16_512x128x128x128_4x2_16x16x32_1x128x128,210.89,0.32179,0.0046
gfx942,80,1152,8192,1024,opus,11000,0,89.9389,opus_gemm_gfx942_a8w8_bs_bpreshuf_sb_tailm_v16_512x128x128x128_4x2_16x16x32_1x128x128,214.89,0.31624,0.0052
gfx942,80,1280,8192,1024,opus,11000,0,92.4815,opus_gemm_gfx942_a8w8_bs_bpreshuf_sb_tailm_v16_512x128x128x128_4x2_16x16x32_1x128x128,232.21,0.33164,0.0049
gfx942,80,1408,8192,1024,opus,11000,0,103.7567,opus_gemm_gfx942_a8w8_bs_bpreshuf_sb_tailm_v16_512x128x128x128_4x2_16x16x32_1x128x128,227.67,0.31708,0.006
gfx942,80,1536,8192,1024,opus,11000,0,112.9001,opus_gemm_gfx942_a8w8_bs_bpreshuf_sb_tailm_v16_512x128x128x128_4x2_16x16x32_1x128x128,228.25,0.31114,0.0061
gfx942,80,1664,8192,1024,opus,11000,0,124.6619,opus_gemm_gfx942_a8w8_bs_bpreshuf_sb_tailm_v16_512x128x128x128_4x2_16x16x32_1x128x128,223.94,0.29965,0.0061
gfx942,80,1792,8192,1024,opus,11000,0,134.1835,opus_gemm_gfx942_a8w8_bs_bpreshuf_sb_tailm_v16_512x128x128x128_4x2_16x16x32_1x128x128,224.06,0.295,0.0059
gfx942,80,1920,8192,1024,opus,11000,0,136.6258,opus_gemm_gfx942_a8w8_bs_bpreshuf_sb_tailm_v16_512x128x128x128_4x2_16x16x32_1x128x128,235.77,0.30603,0.0062
gfx942,80,2048,8192,1024,opus,11000,0,148.4647,opus_gemm_gfx942_a8w8_bs_bpreshuf_sb_tailm_v16_512x128x128x128_4x2_16x16x32_1x128x128,231.43,0.29664,0.0058
gfx942,80,2304,8192,1024,opus,11000,0,169.1542,opus_gemm_gfx942_a8w8_bs_bpreshuf_sb_tailm_v16_512x128x128x128_4x2_16x16x32_1x128x128,228.52,0.2867,0.0061
gfx942,80,2560,8192,1024,opus,11000,0,180.9656,opus_gemm_gfx942_a8w8_bs_bpreshuf_sb_tailm_v16_512x128x128x128_4x2_16x16x32_1x128x128,237.34,0.29261,0.0057
gfx942,80,2816,8192,1024,opus,11000,0,202.2272,opus_gemm_gfx942_a8w8_bs_bpreshuf_sb_tailm_v16_512x128x128x128_4x2_16x16x32_1x128x128,233.62,0.28389,0.0065
gfx942,80,3072,8192,1024,opus,11000,0,222.4291,opus_gemm_gfx942_a8w8_bs_bpreshuf_sb_tailm_v16_512x128x128x128_4x2_16x16x32_1x128x128,231.71,0.27814,0.0068
gfx942,80,3328,8192,1024,opus,11000,0,235.7755,opus_gemm_gfx942_a8w8_bs_bpreshuf_sb_tailm_v16_512x128x128x128_4x2_16x16x32_1x128x128,236.81,0.28129,0.0069
gfx942,80,3584,8192,1024,opus,11000,0,256.3819,opus_gemm_gfx942_a8w8_bs_bpreshuf_sb_tailm_v16_512x128x128x128_4x2_16x16x32_1x128x128,234.53,0.27607,0.0067
gfx942,80,3840,8192,1024,opus,11000,0,269.2245,opus_gemm_gfx942_a8w8_bs_bpreshuf_sb_tailm_v16_512x128x128x128_4x2_16x16x32_1x128x128,239.3,0.27945,0.0065
gfx942,80,7296,8192,1024,opus,11000,0,510.0916,opus_gemm_gfx942_a8w8_bs_bpreshuf_sb_tailm_v16_512x128x128x128_4x2_16x16x32_1x128x128,239.97,0.26544,0.0067
gfx942,80,7680,8192,1024,opus,11000,0,533.9325,opus_gemm_gfx942_a8w8_bs_bpreshuf_sb_tailm_v16_512x128x128x128_4x2_16x16x32_1x128x128,241.32,0.2661,0.0071
gfx942,80,15360,8192,1024,opus,11000,0,1057.1878,opus_gemm_gfx942_a8w8_bs_bpreshuf_sb_tailm_v16_512x128x128x128_4x2_16x16x32_1x128x128,243.76,0.26086,0.0076
gfx950,256,1,768,7168,asm,5,6,8.8256,_ZN5aiter42fp8gemm_bf16_blockscale_BpreShuffle_32x128E,1.25,0.62474,0.0013
gfx950,256,2,768,7168,asm,30,7,8.9844,_ZN5aiter42fp8gemm_bf16_blockscale_BpreShuffle_80x128E,2.45,0.61467,0.0052
gfx950,256,4,768,7168,asm,7,8,10.171,_ZN5aiter42fp8gemm_bf16_blockscale_BpreShuffle_32x128E,4.33,0.54467,0.0117
gfx950,256,8,768,7168,asm,31,8,10.8073,_ZN5aiter42fp8gemm_bf16_blockscale_BpreShuffle_80x128E,8.15,0.51582,0.0104
gfx950,256,16,768,7168,asm,14,7,10.1285,_ZN5aiter42fp8gemm_bf16_blockscale_BpreShuffle_48x128E,17.39,0.55727,0.0042
gfx950,256,32,768,7168,asm,15,8,9.8549,_ZN5aiter42fp8gemm_bf16_blockscale_BpreShuffle_48x128E,35.75,0.58687,0.0089
gfx950,256,48,768,7168,asm,31,8,10.5365,_ZN5aiter42fp8gemm_bf16_blockscale_BpreShuffle_80x128E,50.16,0.56212,0.0109
gfx950,256,64,768,7168,asm,15,8,9.3817,_ZN5aiter42fp8gemm_bf16_blockscale_BpreShuffle_48x128E,75.11,0.64616,0.0098
gfx950,256,80,768,7168,asm,22,7,10.4599,_ZN5aiter42fp8gemm_bf16_blockscale_BpreShuffle_64x128E,84.21,0.59287,0.0057
gfx950,256,96,768,7168,asm,7,8,9.4429,_ZN5aiter42fp8gemm_bf16_blockscale_BpreShuffle_32x128E,111.93,0.67147,0.0098
gfx950,256,112,768,7168,asm,7,8,9.2873,_ZN5aiter42fp8gemm_bf16_blockscale_BpreShuffle_32x128E,132.78,0.69771,0.0107
gfx950,256,128,768,7168,asm,7,8,9.3831,_ZN5aiter42fp8gemm_bf16_blockscale_BpreShuffle_32x128E,150.19,0.70543,0.0096
gfx950,256,144,768,7168,asm,21,6,10.3695,_ZN5aiter42fp8gemm_bf16_blockscale_BpreShuffle_64x128E,152.9,0.65176,0.0041
gfx950,256,160,768,7168,asm,13,6,10.9385,_ZN5aiter42fp8gemm_bf16_blockscale_BpreShuffle_48x128E,161.05,0.63059,0.0039
gfx950,256,176,768,7168,asm,14,7,9.7451,_ZN5aiter42fp8gemm_bf16_blockscale_BpreShuffle_48x128E,198.85,0.7221,0.0048
gfx950,256,192,768,7168,asm,15,8,9.096,_ZN5aiter42fp8gemm_bf16_blockscale_BpreShuffle_48x128E,232.4,0.78894,0.0091
gfx950,256,208,768,7168,asm,5,6,9.4424,_ZN5aiter42fp8gemm_bf16_blockscale_BpreShuffle_32x128E,242.53,0.77475,0.0041
gfx950,256,224,768,7168,asm,15,8,9.2572,_ZN5aiter42fp8gemm_bf16_blockscale_BpreShuffle_48x128E,266.41,0.80529,0.0068
gfx950,256,240,768,7168,asm,31,8,10.8125,_ZN5aiter42fp8gemm_bf16_blockscale_BpreShuffle_80x128E,244.38,0.70233,0.006
gfx950,256,256,768,7168,asm,23,8,10.9153,_ZN5aiter42fp8gemm_bf16_blockscale_BpreShuffle_64x128E,258.22,0.70848,0.0088
gfx950,256,288,768,7168,asm,23,8,11.3761,_ZN5aiter42fp8gemm_bf16_blockscale_BpreShuffle_64x128E,278.73,0.70426,0.0075
gfx950,256,320,768,7168,ck,7,0,17.2727,a8w8_blockscale_bpreshuffle_1x128x128_256x16x64x256_16x16_16x16_16x16x1_16x16x1_1x16x1x16_4_1x1_intrawave_v1,203.98,0.47997,0.0
gfx950,256,352,768,7168,ck,7,0,17.6303,a8w8_blockscale_bpreshuffle_1x128x128_256x16x64x256_16x16_16x16_16x16x1_16x16x1_1x16x1x16_4_1x1_intrawave_v1,219.82,0.48603,0.0
gfx950,256,384,768,7168,ck,7,0,17.5131,a8w8_blockscale_bpreshuffle_1x128x128_256x16x64x256_16x16_16x16_16x16x1_16x16x1_1x16x1x16_4_1x1_intrawave_v1,241.41,0.50519,0.0
gfx950,256,416,768,7168,ck,7,0,17.9933,a8w8_blockscale_bpreshuffle_1x128x128_256x16x64x256_16x16_16x16_16x16x1_16x16x1_1x16x1x16_4_1x1_intrawave_v1,254.55,0.50718,0.0
gfx950,256,448,768,7168,ck,7,0,17.7769,a8w8_blockscale_bpreshuffle_1x128x128_256x16x64x256_16x16_16x16_16x16x1_16x16x1_1x16x1x16_4_1x1_intrawave_v1,277.47,0.52902,0.0
gfx950,256,480,768,7168,ck,12,0,18.4399,a8w8_blockscale_bpreshuffle_1x128x128_256x32x64x256_16x16_16x16_16x16x1_16x16x1_1x32x1x8_8_2x1_intrawave_v1,286.6,0.52511,0.0
gfx950,256,512,768,7168,ck,12,0,18.4448,a8w8_blockscale_bpreshuffle_1x128x128_256x32x64x256_16x16_16x16_16x16x1_16x16x1_1x32x1x8_8_2x1_intrawave_v1,305.62,0.54007,0.0
gfx950,256,544,768,7168,ck,12,0,18.4836,a8w8_blockscale_bpreshuffle_1x128x128_256x32x64x256_16x16_16x16_16x16x1_16x16x1_1x32x1x8_8_2x1_intrawave_v1,324.04,0.554,0.0
gfx950,256,576,768,7168,ck,7,0,18.5259,a8w8_blockscale_bpreshuffle_1x128x128_256x16x64x256_16x16_16x16_16x16x1_16x16x1_1x16x1x16_4_1x1_intrawave_v1,342.32,0.56777,0.0
gfx950,256,608,768,7168,ck,12,0,18.8067,a8w8_blockscale_bpreshuffle_1x128x128_256x32x64x256_16x16_16x16_16x16x1_16x16x1_1x32x1x8_8_2x1_intrawave_v1,355.94,0.57411,0.0
gfx950,256,640,768,7168,ck,12,0,18.7839,a8w8_blockscale_bpreshuffle_1x128x128_256x32x64x256_16x16_16x16_16x16x1_16x16x1_1x32x1x8_8_2x1_intrawave_v1,375.13,0.58963,0.0
gfx950,256,672,768,7168,ck,12,0,18.8503,a8w8_blockscale_bpreshuffle_1x128x128_256x32x64x256_16x16_16x16_16x16x1_16x16x1_1x32x1x8_8_2x1_intrawave_v1,392.5,0.60233,0.0
gfx950,256,704,768,7168,ck,12,0,19.5508,a8w8_blockscale_bpreshuffle_1x128x128_256x32x64x256_16x16_16x16_16x16x1_16x16x1_1x32x1x8_8_2x1_intrawave_v1,396.46,0.595,0.0
gfx950,256,736,768,7168,ck,12,0,20.0064,a8w8_blockscale_bpreshuffle_1x128x128_256x32x64x256_16x16_16x16_16x16x1_16x16x1_1x32x1x8_8_2x1_intrawave_v1,405.04,0.59537,0.0
gfx950,256,768,768,7168,ck,12,0,19.2396,a8w8_blockscale_bpreshuffle_1x128x128_256x32x64x256_16x16_16x16_16x16x1_16x16x1_1x32x1x8_8_2x1_intrawave_v1,439.5,0.63357,0.0
gfx950,256,800,768,7168,ck,12,0,19.6412,a8w8_blockscale_bpreshuffle_1x128x128_256x32x64x256_16x16_16x16_16x16x1_16x16x1_1x32x1x8_8_2x1_intrawave_v1,448.45,0.6348,0.0
gfx950,256,832,768,7168,ck,12,0,19.5136,a8w8_blockscale_bpreshuffle_1x128x128_256x32x64x256_16x16_16x16_16x16x1_16x16x1_1x32x1x8_8_2x1_intrawave_v1,469.43,0.65322,0.0
gfx950,256,864,768,7168,ck,12,0,19.8179,a8w8_blockscale_bpreshuffle_1x128x128_256x32x64x256_16x16_16x16_16x16x1_16x16x1_1x32x1x8_8_2x1_intrawave_v1,480.0,0.65725,0.0
gfx950,256,896,768,7168,ck,12,0,19.7766,a8w8_blockscale_bpreshuffle_1x128x128_256x32x64x256_16x16_16x16_16x16x1_16x16x1_1x32x1x8_8_2x1_intrawave_v1,498.82,0.6727,0.0
gfx950,256,928,768,7168,ck,12,0,20.1133,a8w8_blockscale_bpreshuffle_1x128x128_256x32x64x256_16x16_16x16_16x16x1_16x16x1_1x32x1x8_8_2x1_intrawave_v1,507.99,0.67529,0.0
gfx950,256,960,768,7168,ck,17,0,21.0451,a8w8_blockscale_bpreshuffle_1x128x128_256x64x64x256_16x16_16x16_16x16x1_16x16x1_1x32x1x8_8_2x1_intrawave_v1,502.24,0.65863,0.0
gfx950,256,992,768,7168,asm,9,2,18.5298,_ZN5aiter42fp8gemm_bf16_blockscale_BpreShuffle_48x128E,589.43,0.76306,0.0
gfx950,256,1024,768,7168,ck,17,0,21.0256,a8w8_blockscale_bpreshuffle_1x128x128_256x64x64x256_16x16_16x16_16x16x1_16x16x1_1x32x1x8_8_2x1_intrawave_v1,536.22,0.68573,0.0
gfx950,256,1088,768,7168,ck,17,0,21.2531,a8w8_blockscale_bpreshuffle_1x128x128_256x64x64x256_16x16_16x16_16x16x1_16x16x1_1x32x1x8_8_2x1_intrawave_v1,563.63,0.7046,0.0
gfx950,256,1152,768,7168,ck,12,0,21.1225,a8w8_blockscale_bpreshuffle_1x128x128_256x32x64x256_16x16_16x16_16x16x1_16x16x1_1x32x1x8_8_2x1_intrawave_v1,600.48,0.73533,0.0
gfx950,256,1216,768,7168,ck,17,0,21.9912,a8w8_blockscale_bpreshuffle_1x128x128_256x64x64x256_16x16_16x16_16x16x1_16x16x1_1x32x1x8_8_2x1_intrawave_v1,608.8,0.73161,0.0
gfx950,256,1280,768,7168,ck,17,0,21.6302,a8w8_blockscale_bpreshuffle_1x128x128_256x64x64x256_16x16_16x16_16x16x1_16x16x1_1x32x1x8_8_2x1_intrawave_v1,651.54,0.76958,0.0
gfx950,256,1344,768,7168,ck,17,0,21.6757,a8w8_blockscale_bpreshuffle_1x128x128_256x64x64x256_16x16_16x16_16x16x1_16x16x1_1x32x1x8_8_2x1_intrawave_v1,682.68,0.79366,0.0
gfx950,256,1408,768,7168,ck,11,0,28.2316,a8w8_blockscale_bpreshuffle_1x128x128_256x32x128x256_16x16_16x16_16x16x1_16x16x1_1x32x1x8_8_2x1_intrawave_v1,549.11,0.62909,0.0
gfx950,256,1472,768,7168,ck,17,0,28.5916,a8w8_blockscale_bpreshuffle_1x128x128_256x64x64x256_16x16_16x16_16x16x1_16x16x1_1x32x1x8_8_2x1_intrawave_v1,566.84,0.64065,0.0
gfx950,256,1536,768,7168,ck,11,0,28.4924,a8w8_blockscale_bpreshuffle_1x128x128_256x32x128x256_16x16_16x16_16x16x1_16x16x1_1x32x1x8_8_2x1_intrawave_v1,593.54,0.66244,0.0
gfx950,256,1600,768,7168,ck,11,0,28.9544,a8w8_blockscale_bpreshuffle_1x128x128_256x32x128x256_16x16_16x16_16x16x1_16x16x1_1x32x1x8_8_2x1_intrawave_v1,608.41,0.6711,0.0
gfx950,256,1664,768,7168,ck,11,0,28.9792,a8w8_blockscale_bpreshuffle_1x128x128_256x32x128x256_16x16_16x16_16x16x1_16x16x1_1x32x1x8_8_2x1_intrawave_v1,632.2,0.68975,0.0
gfx950,256,1728,768,7168,ck,11,0,28.8859,a8w8_blockscale_bpreshuffle_1x128x128_256x32x128x256_16x16_16x16_16x16x1_16x16x1_1x32x1x8_8_2x1_intrawave_v1,658.64,0.71127,0.0
gfx950,256,1792,768,7168,ck,11,0,29.2369,a8w8_blockscale_bpreshuffle_1x128x128_256x32x128x256_16x16_16x16_16x16x1_16x16x1_1x32x1x8_8_2x1_intrawave_v1,674.83,0.72178,0.0
gfx950,256,1856,768,7168,ck,17,0,29.5228,a8w8_blockscale_bpreshuffle_1x128x128_256x64x64x256_16x16_16x16_16x16x1_16x16x1_1x32x1x8_8_2x1_intrawave_v1,692.17,0.73366,0.0
gfx950,256,1920,768,7168,asm,1,1,29.8089,_ZN5aiter42fp8gemm_bf16_blockscale_BpreShuffle_48x128E,709.16,0.7453,0.0
gfx950,256,1984,768,7168,asm,1,1,30.0462,_ZN5aiter42fp8gemm_bf16_blockscale_BpreShuffle_48x128E,727.01,0.75796,0.0
gfx950,256,2048,768,7168,asm,2,1,30.9433,_ZN5aiter42fp8gemm_bf16_blockscale_BpreShuffle_64x128E,728.71,0.75399,0.0
gfx950,256,4096,768,7168,ck,14,0,44.8557,a8w8_blockscale_bpreshuffle_1x128x128_256x64x128x128_16x16_16x16_8x32x1_8x32x1_1x32x1x8_8_2x1_intrawave_v1,1005.38,0.91753,0.0001
gfx950,256,6144,768,7168,ck,14,0,61.348,a8w8_blockscale_bpreshuffle_1x128x128_256x64x128x128_16x16_16x16_8x32x1_8x32x1_1x32x1x8_8_2x1_intrawave_v1,1102.66,0.96144,0.0001
gfx950,256,8192,768,7168,ck,14,0,70.1503,a8w8_blockscale_bpreshuffle_1x128x128_256x64x128x128_16x16_16x16_8x32x1_8x32x1_1x32x1x8_8_2x1_intrawave_v1,1285.73,1.09491,0.0002
gfx950,256,10240,768,7168,ck,13,1,76.7087,a8w8_blockscale_bpreshuffle_1x128x128_256x64x256x128_16x16_16x16_8x32x1_8x32x1_1x32x1x8_8_2x1_intrawave_v1,1469.75,1.23368,0.0
gfx950,256,12288,768,7168,cktile,29,0,91.8604,a8w8_blockscale_cktile_192x256x128_4x2x1_16x16x128_intrawave_0x1x0_4,1472.79,1.22425,0.0
gfx950,256,14336,768,7168,cktile,28,0,94.252,a8w8_blockscale_cktile_192x256x128_4x2x1_16x16x128_intrawave_0x1x0_3,1674.66,1.38231,0.0
gfx950,256,16384,768,7168,ck,13,2,117.3184,a8w8_blockscale_bpreshuffle_1x128x128_256x64x256x128_16x16_16x16_8x32x1_8x32x1_1x32x1x8_8_2x1_intrawave_v1,1537.6,1.26247,0.0
gfx950,256,32768,768,7168,ck,13,2,216.586,a8w8_blockscale_bpreshuffle_1x128x128_256x64x256x128_16x16_16x16_8x32x1_8x32x1_1x32x1x8_8_2x1_intrawave_v1,1665.75,1.34227,0.0
gfx950,256,1,2048,7168,triton,0,0,9.6,triton,3.06,1.53,0.0
gfx950,256,2,2048,7168,triton,0,0,9.8,triton,5.99,1.5,0.0
gfx950,256,4,2048,7168,triton,0,0,9.8,triton,11.98,1.5,0.0
gfx950,256,8,2048,7168,triton,0,0,10.0,triton,23.49,1.48,0.0
gfx950,256,16,2048,7168,triton,0,0,10.3,triton,45.61,1.44,0.0
gfx950,256,32,2048,7168,triton,0,0,11.0,triton,85.41,1.37,0.0
gfx950,256,48,2048,7168,triton,0,0,11.7,triton,120.45,1.3,0.0
gfx950,256,64,2048,7168,triton,0,0,12.0,triton,156.59,1.28,0.0
gfx950,256,80,2048,7168,triton,0,0,13.5,triton,173.99,1.15,0.0
gfx950,256,96,2048,7168,asm,15,8,10.2348,_ZN5aiter42fp8gemm_bf16_blockscale_BpreShuffle_48x128E,275.39,1.53998,0.008
gfx950,256,112,2048,7168,asm,22,7,11.0851,_ZN5aiter42fp8gemm_bf16_blockscale_BpreShuffle_64x128E,296.64,1.43811,0.0064
gfx950,256,128,2048,7168,triton,0,0,15.4,triton,244.03,1.05,0.0
gfx950,256,144,2048,7168,ck,7,0,17.5557,a8w8_blockscale_bpreshuffle_1x128x128_256x16x64x256_16x16_16x16_16x16x1_16x16x1_1x16x1x16_4_1x1_intrawave_v1,240.83,0.92859,0.0
gfx950,256,160,2048,7168,ck,12,0,18.3143,a8w8_blockscale_bpreshuffle_1x128x128_256x32x64x256_16x16_16x16_16x16x1_16x16x1_1x32x1x8_8_2x1_intrawave_v1,256.5,0.89997,0.0
gfx950,256,176,2048,7168,ck,7,0,19.3451,a8w8_blockscale_bpreshuffle_1x128x128_256x16x64x256_16x16_16x16_16x16x1_16x16x1_1x16x1x16_4_1x1_intrawave_v1,267.12,0.86133,0.0
gfx950,256,192,2048,7168,ck,7,0,18.0822,a8w8_blockscale_bpreshuffle_1x128x128_256x16x64x256_16x16_16x16_16x16x1_16x16x1_1x16x1x16_4_1x1_intrawave_v1,311.75,0.93145,0.0
gfx950,256,208,2048,7168,ck,7,0,19.7053,a8w8_blockscale_bpreshuffle_1x128x128_256x16x64x256_16x16_16x16_16x16x1_16x16x1_1x16x1x16_4_1x1_intrawave_v1,309.91,0.86388,0.0
gfx950,256,224,2048,7168,ck,12,0,18.2391,a8w8_blockscale_bpreshuffle_1x128x128_256x32x64x256_16x16_16x16_16x16x1_16x16x1_1x32x1x8_8_2x1_intrawave_v1,360.58,0.9432,0.0
gfx950,256,240,2048,7168,ck,7,0,20.1157,a8w8_blockscale_bpreshuffle_1x128x128_256x16x64x256_16x16_16x16_16x16x1_16x16x1_1x16x1x16_4_1x1_intrawave_v1,350.3,0.86417,0.0
gfx950,256,256,2048,7168,ck,12,0,18.1473,a8w8_blockscale_bpreshuffle_1x128x128_256x32x64x256_16x16_16x16_16x16x1_16x16x1_1x32x1x8_8_2x1_intrawave_v1,414.18,0.96784,0.0
gfx950,256,288,2048,7168,ck,12,0,19.7809,a8w8_blockscale_bpreshuffle_1x128x128_256x32x64x256_16x16_16x16_16x16x1_16x16x1_1x32x1x8_8_2x1_intrawave_v1,427.47,0.90613,0.0
gfx950,256,320,2048,7168,ck,17,0,21.2286,a8w8_blockscale_bpreshuffle_1x128x128_256x64x64x256_16x16_16x16_16x16x1_16x16x1_1x32x1x8_8_2x1_intrawave_v1,442.57,0.86132,0.0
gfx950,256,352,2048,7168,asm,26,3,17.261,_ZN5aiter42fp8gemm_bf16_blockscale_BpreShuffle_80x128E,598.74,1.08018,0.0004
gfx950,256,384,2048,7168,ck,12,0,20.0287,a8w8_blockscale_bpreshuffle_1x128x128_256x32x64x256_16x16_16x16_16x16x1_16x16x1_1x32x1x8_8_2x1_intrawave_v1,562.91,0.94891,0.0
gfx950,256,448,2048,7168,ck,17,0,21.426,a8w8_blockscale_bpreshuffle_1x128x128_256x64x64x256_16x16_16x16_16x16x1_16x16x1_1x32x1x8_8_2x1_intrawave_v1,613.9,0.92067,0.0
gfx950,256,480,2048,7168,asm,17,2,20.811,_ZN5aiter42fp8gemm_bf16_blockscale_BpreShuffle_64x128E,677.18,0.9652,0.0
gfx950,256,512,2048,7168,ck,17,0,21.5277,a8w8_blockscale_bpreshuffle_1x128x128_256x64x64x256_16x16_16x16_16x16x1_16x16x1_1x32x1x8_8_2x1_intrawave_v1,698.28,0.94981,0.0
gfx950,256,576,2048,7168,asm,1,1,28.1725,_ZN5aiter42fp8gemm_bf16_blockscale_BpreShuffle_48x128E,600.28,0.75138,0.0
gfx950,256,608,2048,7168,asm,1,1,28.4078,_ZN5aiter42fp8gemm_bf16_blockscale_BpreShuffle_48x128E,628.38,0.75784,0.0
gfx950,256,640,2048,7168,asm,1,1,28.3564,_ZN5aiter42fp8gemm_bf16_blockscale_BpreShuffle_48x128E,662.65,0.77193,0.0
gfx950,256,672,2048,7168,asm,1,1,28.8011,_ZN5aiter42fp8gemm_bf16_blockscale_BpreShuffle_48x128E,685.04,0.77252,0.0
gfx950,256,704,2048,7168,asm,1,1,28.6853,_ZN5aiter42fp8gemm_bf16_blockscale_BpreShuffle_48x128E,720.56,0.78821,0.0
gfx950,256,768,2048,7168,asm,1,1,29.2753,_ZN5aiter42fp8gemm_bf16_blockscale_BpreShuffle_48x128E,770.23,0.79695,0.0
gfx950,256,800,2048,7168,asm,2,1,29.7216,_ZN5aiter42fp8gemm_bf16_blockscale_BpreShuffle_64x128E,790.27,0.79711,0.0
gfx950,256,832,2048,7168,asm,2,1,30.5083,_ZN5aiter42fp8gemm_bf16_blockscale_BpreShuffle_64x128E,800.69,0.78837,0.0
gfx950,256,864,2048,7168,asm,2,1,30.518,_ZN5aiter42fp8gemm_bf16_blockscale_BpreShuffle_64x128E,831.22,0.79993,0.0
gfx950,256,896,2048,7168,asm,2,1,30.6425,_ZN5aiter42fp8gemm_bf16_blockscale_BpreShuffle_64x128E,858.5,0.80844,0.0
gfx950,256,928,2048,7168,asm,2,1,31.6357,_ZN5aiter42fp8gemm_bf16_blockscale_BpreShuffle_64x128E,861.25,0.79445,0.0
gfx950,256,960,2048,7168,asm,2,1,31.0177,_ZN5aiter42fp8gemm_bf16_blockscale_BpreShuffle_64x128E,908.7,0.8219,0.0
gfx950,256,992,2048,7168,asm,2,1,31.4917,_ZN5aiter42fp8gemm_bf16_blockscale_BpreShuffle_64x128E,924.85,0.82098,0.0
gfx950,256,1024,2048,7168,asm,2,1,32.0753,_ZN5aiter42fp8gemm_bf16_blockscale_BpreShuffle_64x128E,937.32,0.81728,0.0
gfx950,256,1088,2048,7168,asm,3,1,33.9358,_ZN5aiter42fp8gemm_bf16_blockscale_BpreShuffle_80x128E,941.3,0.79371,0.0
gfx950,256,1152,2048,7168,asm,3,1,34.5233,_ZN5aiter42fp8gemm_bf16_blockscale_BpreShuffle_80x128E,979.71,0.80109,0.0
gfx950,256,1216,2048,7168,asm,3,1,35.2966,_ZN5aiter42fp8gemm_bf16_blockscale_BpreShuffle_80x128E,1011.48,0.80396,0.0
gfx950,256,1280,2048,7168,asm,3,1,35.5694,_ZN5aiter42fp8gemm_bf16_blockscale_BpreShuffle_80x128E,1056.55,0.81806,0.0
gfx950,256,1344,2048,7168,asm,4,1,38.7934,_ZN5aiter42fp8gemm_bf16_blockscale_BpreShuffle_96x128E,1017.18,0.76866,0.0
gfx950,256,1472,2048,7168,asm,4,1,40.8826,_ZN5aiter42fp8gemm_bf16_blockscale_BpreShuffle_96x128E,1057.13,0.76464,0.0
gfx950,256,1536,2048,7168,asm,4,1,40.293,_ZN5aiter42fp8gemm_bf16_blockscale_BpreShuffle_96x128E,1119.23,0.79373,0.0
gfx950,256,1600,2048,7168,ck,14,0,45.3446,a8w8_blockscale_bpreshuffle_1x128x128_256x64x128x128_16x16_16x16_8x32x1_8x32x1_1x32x1x8_8_2x1_intrawave_v1,1035.98,0.7212,0.0001
gfx950,256,1664,2048,7168,ck,14,0,45.6554,a8w8_blockscale_bpreshuffle_1x128x128_256x64x128x128_16x16_16x16_8x32x1_8x32x1_1x32x1x8_8_2x1_intrawave_v1,1070.09,0.73208,0.0001
gfx950,256,1728,2048,7168,ck,14,0,44.3914,a8w8_blockscale_bpreshuffle_1x128x128_256x64x128x128_16x16_16x16_8x32x1_8x32x1_1x32x1x8_8_2x1_intrawave_v1,1142.89,0.76916,0.0001
gfx950,256,1792,2048,7168,ck,14,0,45.0226,a8w8_blockscale_bpreshuffle_1x128x128_256x64x128x128_16x16_16x16_8x32x1_8x32x1_1x32x1x8_8_2x1_intrawave_v1,1168.6,0.77439,0.0001
gfx950,256,1920,2048,7168,ck,14,0,48.5047,a8w8_blockscale_bpreshuffle_1x128x128_256x64x128x128_16x16_16x16_8x32x1_8x32x1_1x32x1x8_8_2x1_intrawave_v1,1162.19,0.74852,0.0001
gfx950,256,2048,2048,7168,ck,13,0,50.1298,a8w8_blockscale_bpreshuffle_1x128x128_256x64x256x128_16x16_16x16_8x32x1_8x32x1_1x32x1x8_8_2x1_intrawave_v1,1199.48,0.75302,0.0
gfx950,256,4096,2048,7168,ck,13,0,79.0202,a8w8_blockscale_bpreshuffle_1x128x128_256x64x256x128_16x16_16x16_8x32x1_8x32x1_1x32x1x8_8_2x1_intrawave_v1,1521.88,0.76964,0.0
gfx950,256,6144,2048,7168,cktile,29,0,95.4626,a8w8_blockscale_cktile_192x256x128_4x2x1_16x16x128_intrawave_0x1x0_4,1889.63,0.87873,0.0
gfx950,256,8192,2048,7168,ck,13,0,145.3655,a8w8_blockscale_bpreshuffle_1x128x128_256x64x256x128_16x16_16x16_8x32x1_8x32x1_1x32x1x8_8_2x1_intrawave_v1,1654.58,0.73576,0.0
gfx950,256,10240,2048,7168,cktile,28,0,176.7076,a8w8_blockscale_cktile_192x256x128_4x2x1_16x16x128_intrawave_0x1x0_3,1701.39,0.73581,0.0
gfx950,256,12288,2048,7168,cktile,27,0,184.0324,a8w8_blockscale_cktile_192x256x128_4x2x1_16x16x128_intrawave_0x1x0_2,1960.4,0.83188,0.0
gfx950,256,14336,2048,7168,ck,13,0,240.0047,a8w8_blockscale_bpreshuffle_1x128x128_256x64x256x128_16x16_16x16_8x32x1_8x32x1_1x32x1x8_8_2x1_intrawave_v1,1753.74,0.73399,0.0
gfx950,256,16384,2048,7168,cktile,28,0,263.6644,a8w8_blockscale_cktile_192x256x128_4x2x1_16x16x128_intrawave_0x1x0_3,1824.43,0.75562,0.0
gfx950,256,32768,2048,7168,cktile,11,0,521.6939,a8w8_blockscale_cktile_192x256x128_4x2x1_16x16x128_intrawave_0x1x0_1,1844.13,0.73564,0.0
gfx950,256,1,6144,7168,asm,4,5,12.1066,_ZN5aiter42fp8gemm_bf16_blockscale_BpreShuffle_32x128E,7.28,3.63931,0.0052
gfx950,256,2,6144,7168,asm,4,5,13.6415,_ZN5aiter42fp8gemm_bf16_blockscale_BpreShuffle_32x128E,12.91,3.23125,0.004
gfx950,256,4,6144,7168,asm,19,4,13.2827,_ZN5aiter42fp8gemm_bf16_blockscale_BpreShuffle_64x128E,26.52,3.32146,0.0016
gfx950,256,8,6144,7168,asm,4,5,14.1563,_ZN5aiter42fp8gemm_bf16_blockscale_BpreShuffle_32x128E,49.78,3.12199,0.0022
gfx950,256,16,6144,7168,asm,3,4,13.7668,_ZN5aiter42fp8gemm_bf16_blockscale_BpreShuffle_32x128E,102.37,3.22163,0.002
gfx950,256,32,6144,7168,asm,12,5,14.8058,_ZN5aiter42fp8gemm_bf16_blockscale_BpreShuffle_48x128E,190.37,3.01657,0.0024
gfx950,256,48,6144,7168,asm,36,5,16.0527,_ZN5aiter42fp8gemm_bf16_blockscale_BpreShuffle_96x128E,263.37,2.80165,0.0027
gfx950,256,64,6144,7168,asm,20,5,14.9877,_ZN5aiter42fp8gemm_bf16_blockscale_BpreShuffle_64x128E,376.12,3.0215,0.0027
gfx950,256,80,6144,7168,asm,27,4,17.9025,_ZN5aiter42fp8gemm_bf16_blockscale_BpreShuffle_80x128E,393.6,2.54694,0.0016
gfx950,256,96,6144,7168,asm,36,5,19.9946,_ZN5aiter42fp8gemm_bf16_blockscale_BpreShuffle_96x128E,422.9,2.29602,0.0026
gfx950,256,112,6144,7168,asm,20,5,21.3762,_ZN5aiter42fp8gemm_bf16_blockscale_BpreShuffle_64x128E,461.49,2.16218,0.0027
gfx950,256,128,6144,7168,asm,44,5,19.1896,_ZN5aiter43fp8gemm_bf16_blockscale_BpreShuffle_128x128E,587.52,2.42478,0.0027
gfx950,256,144,6144,7168,asm,25,2,24.0492,_ZN5aiter42fp8gemm_bf16_blockscale_BpreShuffle_80x128E,527.4,1.94775,0.0
gfx950,256,160,6144,7168,ck,11,0,24.717,a8w8_blockscale_bpreshuffle_1x128x128_256x32x128x256_16x16_16x16_16x16x1_16x16x1_1x32x1x8_8_2x1_intrawave_v1,570.17,1.90772,0.0
gfx950,256,176,6144,7168,asm,33,2,27.3793,_ZN5aiter42fp8gemm_bf16_blockscale_BpreShuffle_96x128E,566.2,1.73359,0.0
gfx950,256,192,6144,7168,asm,33,2,27.5859,_ZN5aiter42fp8gemm_bf16_blockscale_BpreShuffle_96x128E,613.05,1.73189,0.0
gfx950,256,208,6144,7168,asm,8,1,28.5755,_ZN5aiter42fp8gemm_bf16_blockscale_BpreShuffle_48x128E,641.13,1.68281,0.0
gfx950,256,224,6144,7168,asm,8,1,28.7748,_ZN5aiter42fp8gemm_bf16_blockscale_BpreShuffle_48x128E,685.67,1.68197,0.0
gfx950,256,240,6144,7168,asm,8,1,29.296,_ZN5aiter42fp8gemm_bf16_blockscale_BpreShuffle_48x128E,721.58,1.66267,0.0
gfx950,256,256,6144,7168,asm,16,1,30.6157,_ZN5aiter42fp8gemm_bf16_blockscale_BpreShuffle_64x128E,736.5,1.60117,0.0
gfx950,256,288,6144,7168,asm,16,1,31.3014,_ZN5aiter42fp8gemm_bf16_blockscale_BpreShuffle_64x128E,810.42,1.58598,0.0
gfx950,256,320,6144,7168,asm,16,1,31.8919,_ZN5aiter42fp8gemm_bf16_blockscale_BpreShuffle_64x128E,883.79,1.57614,0.0
gfx950,256,352,6144,7168,asm,24,1,34.4828,_ZN5aiter42fp8gemm_bf16_blockscale_BpreShuffle_80x128E,899.12,1.47577,0.0
gfx950,256,384,6144,7168,asm,24,1,34.5225,_ZN5aiter42fp8gemm_bf16_blockscale_BpreShuffle_80x128E,979.73,1.49211,0.0
gfx950,256,416,6144,7168,asm,32,1,39.9528,_ZN5aiter42fp8gemm_bf16_blockscale_BpreShuffle_96x128E,917.12,1.30489,0.0
gfx950,256,448,6144,7168,asm,32,1,38.5212,_ZN5aiter42fp8gemm_bf16_blockscale_BpreShuffle_96x128E,1024.37,1.36954,0.0
gfx950,256,480,6144,7168,asm,32,1,41.5772,_ZN5aiter42fp8gemm_bf16_blockscale_BpreShuffle_96x128E,1016.87,1.28385,0.0
gfx950,256,512,6144,7168,ck,14,0,47.3122,a8w8_blockscale_bpreshuffle_1x128x128_256x64x128x128_16x16_16x16_8x32x1_8x32x1_1x32x1x8_8_2x1_intrawave_v1,953.18,1.14139,0.0001
gfx950,256,576,6144,7168,ck,14,0,48.4454,a8w8_blockscale_bpreshuffle_1x128x128_256x64x128x128_16x16_16x16_8x32x1_8x32x1_1x32x1x8_8_2x1_intrawave_v1,1047.25,1.14039,0.0001
gfx950,256,608,6144,7168,ck,14,0,50.0905,a8w8_blockscale_bpreshuffle_1x128x128_256x64x128x128_16x16_16x16_8x32x1_8x32x1_1x32x1x8_8_2x1_intrawave_v1,1069.12,1.11537,0.0001
gfx950,256,672,6144,7168,ck,13,0,61.9257,a8w8_blockscale_bpreshuffle_1x128x128_256x64x256x128_16x16_16x16_8x32x1_8x32x1_1x32x1x8_8_2x1_intrawave_v1,955.82,0.92231,0.0
gfx950,256,704,6144,7168,ck,13,0,61.0642,a8w8_blockscale_bpreshuffle_1x128x128_256x64x256x128_16x16_16x16_8x32x1_8x32x1_1x32x1x8_8_2x1_intrawave_v1,1015.47,0.94552,0.0
gfx950,256,736,6144,7168,ck,13,0,62.3918,a8w8_blockscale_bpreshuffle_1x128x128_256x64x256x128_16x16_16x16_8x32x1_8x32x1_1x32x1x8_8_2x1_intrawave_v1,1039.03,0.93538,0.0
gfx950,256,768,6144,7168,ck,13,0,61.7775,a8w8_blockscale_bpreshuffle_1x128x128_256x64x256x128_16x16_16x16_8x32x1_8x32x1_1x32x1x8_8_2x1_intrawave_v1,1094.99,0.95476,0.0
gfx950,256,800,6144,7168,ck,13,0,66.1904,a8w8_blockscale_bpreshuffle_1x128x128_256x64x256x128_16x16_16x16_8x32x1_8x32x1_1x32x1x8_8_2x1_intrawave_v1,1064.57,0.90051,0.0
gfx950,256,832,6144,7168,ck,13,0,67.0061,a8w8_blockscale_bpreshuffle_1x128x128_256x64x256x128_16x16_16x16_8x32x1_8x32x1_1x32x1x8_8_2x1_intrawave_v1,1093.67,0.89884,0.0
gfx950,256,864,6144,7168,ck,13,0,65.6668,a8w8_blockscale_bpreshuffle_1x128x128_256x64x256x128_16x16_16x16_8x32x1_8x32x1_1x32x1x8_8_2x1_intrawave_v1,1158.9,0.92665,0.0
gfx950,256,896,6144,7168,ck,13,0,64.0993,a8w8_blockscale_bpreshuffle_1x128x128_256x64x256x128_16x16_16x16_8x32x1_8x32x1_1x32x1x8_8_2x1_intrawave_v1,1231.22,0.95902,0.0
gfx950,256,928,6144,7168,ck,14,0,70.3214,a8w8_blockscale_bpreshuffle_1x128x128_256x64x128x128_16x16_16x16_8x32x1_8x32x1_1x32x1x8_8_2x1_intrawave_v1,1162.36,0.88302,0.0001
gfx950,256,960,6144,7168,ck,14,0,71.9294,a8w8_blockscale_bpreshuffle_1x128x128_256x64x128x128_16x16_16x16_8x32x1_8x32x1_1x32x1x8_8_2x1_intrawave_v1,1175.56,0.87194,0.0002
gfx950,256,992,6144,7168,ck,14,0,72.1971,a8w8_blockscale_bpreshuffle_1x128x128_256x64x128x128_16x16_16x16_8x32x1_8x32x1_1x32x1x8_8_2x1_intrawave_v1,1210.24,0.87733,0.0001
gfx950,256,1024,6144,7168,ck,13,0,73.7129,a8w8_blockscale_bpreshuffle_1x128x128_256x64x256x128_16x16_16x16_8x32x1_8x32x1_1x32x1x8_8_2x1_intrawave_v1,1223.59,0.86773,0.0
gfx950,256,1088,6144,7168,ck,13,0,76.2455,a8w8_blockscale_bpreshuffle_1x128x128_256x64x256x128_16x16_16x16_8x32x1_8x32x1_1x32x1x8_8_2x1_intrawave_v1,1256.88,0.85524,0.0
gfx950,256,1152,6144,7168,ck,13,0,76.1546,a8w8_blockscale_bpreshuffle_1x128x128_256x64x256x128_16x16_16x16_8x32x1_8x32x1_1x32x1x8_8_2x1_intrawave_v1,1332.4,0.87261,0.0
gfx950,256,1216,6144,7168,ck,13,0,79.511,a8w8_blockscale_bpreshuffle_1x128x128_256x64x256x128_16x16_16x16_8x32x1_8x32x1_1x32x1x8_8_2x1_intrawave_v1,1347.06,0.85144,0.0
gfx950,256,1280,6144,7168,ck,13,0,77.2334,a8w8_blockscale_bpreshuffle_1x128x128_256x64x256x128_16x16_16x16_8x32x1_8x32x1_1x32x1x8_8_2x1_intrawave_v1,1459.77,0.89267,0.0
gfx950,256,1344,6144,7168,ck,13,0,82.2982,a8w8_blockscale_bpreshuffle_1x128x128_256x64x256x128_16x16_16x16_8x32x1_8x32x1_1x32x1x8_8_2x1_intrawave_v1,1438.43,0.85286,0.0
gfx950,256,1408,6144,7168,cktile,28,0,87.0945,a8w8_blockscale_cktile_192x256x128_4x2x1_16x16x128_intrawave_0x1x0_3,1423.94,0.82019,0.0
gfx950,256,1472,6144,7168,cktile,29,0,87.2862,a8w8_blockscale_cktile_192x256x128_4x2x1_16x16x128_intrawave_0x1x0_4,1485.39,0.83266,0.0
gfx950,256,1536,6144,7168,cktile,29,0,87.2706,a8w8_blockscale_cktile_192x256x128_4x2x1_16x16x128_intrawave_0x1x0_4,1550.25,0.84707,0.0
gfx950,256,1600,6144,7168,cktile,11,0,88.2254,a8w8_blockscale_cktile_192x256x128_4x2x1_16x16x128_intrawave_0x1x0_1,1597.37,0.85202,0.0
gfx950,256,1664,6144,7168,cktile,11,0,88.895,a8w8_blockscale_cktile_192x256x128_4x2x1_16x16x128_intrawave_0x1x0_1,1648.75,0.85961,0.0
gfx950,256,1728,6144,7168,cktile,29,0,89.5599,a8w8_blockscale_cktile_192x256x128_4x2x1_16x16x128_intrawave_0x1x0_4,1699.45,0.86713,0.0
gfx950,256,1792,6144,7168,cktile,27,0,90.2277,a8w8_blockscale_cktile_192x256x128_4x2x1_16x16x128_intrawave_0x1x0_2,1749.35,0.87451,0.0
gfx950,256,1856,6144,7168,cktile,11,0,91.1191,a8w8_blockscale_cktile_192x256x128_4x2x1_16x16x128_intrawave_0x1x0_1,1794.1,0.87962,0.0
gfx950,256,1920,6144,7168,cktile,28,0,90.924,a8w8_blockscale_cktile_192x256x128_4x2x1_16x16x128_intrawave_0x1x0_3,1859.95,0.89521,0.0
gfx950,256,1984,6144,7168,ck,13,0,121.8121,a8w8_blockscale_bpreshuffle_1x128x128_256x64x256x128_16x16_16x16_8x32x1_8x32x1_1x32x1x8_8_2x1_intrawave_v1,1434.6,0.67843,0.0
gfx950,256,2048,6144,7168,ck,13,0,121.1249,a8w8_blockscale_bpreshuffle_1x128x128_256x64x256x128_16x16_16x16_8x32x1_8x32x1_1x32x1x8_8_2x1_intrawave_v1,1489.28,0.69256,0.0
gfx950,256,4096,6144,7168,ck,13,0,208.2576,a8w8_blockscale_bpreshuffle_1x128x128_256x64x256x128_16x16_16x16_8x32x1_8x32x1_1x32x1x8_8_2x1_intrawave_v1,1732.36,0.59413,0.0
gfx950,256,6144,6144,7168,cktile,28,0,261.7996,a8w8_blockscale_cktile_192x256x128_4x2x1_16x16x128_intrawave_0x1x0_3,2067.1,0.62482,0.0
gfx950,256,8192,6144,7168,cktile,29,0,363.7742,a8w8_blockscale_cktile_192x256x128_4x2x1_16x16x128_intrawave_0x1x0_4,1983.52,0.5592,0.0
gfx950,256,10240,6144,7168,cktile,28,0,450.2533,a8w8_blockscale_cktile_192x256x128_4x2x1_16x16x128_intrawave_0x1x0_3,2003.19,0.5403,0.0
gfx950,256,12288,6144,7168,cktile,29,0,514.1811,a8w8_blockscale_cktile_192x256x128_4x2x1_16x16x128_intrawave_0x1x0_4,2104.96,0.55061,0.0
gfx950,256,14336,6144,7168,cktile,27,0,602.1856,a8w8_blockscale_cktile_192x256x128_4x2x1_16x16x128_intrawave_0x1x0_2,2096.9,0.53632,0.0
gfx950,256,16384,6144,7168,cktile,27,0,685.7402,a8w8_blockscale_cktile_192x256x128_4x2x1_16x16x128_intrawave_0x1x0_2,2104.45,0.52907,0.0
gfx950,256,20480,6144,7168,cktile,28,0,855.8253,a8w8_blockscale_cktile_192x256x128_4x2x1_16x16x128_intrawave_0x1x0_3,2107.77,0.51704,0.0
gfx950,256,24576,6144,7168,cktile,11,0,1029.0566,a8w8_blockscale_cktile_192x256x128_4x2x1_16x16x128_intrawave_0x1x0_1,2103.54,0.50745,0.0
gfx950,256,28672,6144,7168,cktile,28,0,1195.3275,a8w8_blockscale_cktile_192x256x128_4x2x1_16x16x128_intrawave_0x1x0_3,2112.76,0.50353,0.0
gfx950,256,32768,6144,7168,cktile,11,0,1368.1245,a8w8_blockscale_cktile_192x256x128_4x2x1_16x16x128_intrawave_0x1x0_1,2109.62,0.49818,0.0
gfx950,256,40960,6144,7168,cktile,11,0,1709.468,a8w8_blockscale_cktile_192x256x128_4x2x1_16x16x128_intrawave_0x1x0_1,2110.47,0.49194,0.0
gfx950,256,49152,6144,7168,cktile,27,0,2053.1356,a8w8_blockscale_cktile_192x256x128_4x2x1_16x16x128_intrawave_0x1x0_2,2108.64,0.48723,0.0
gfx950,256,57344,6144,7168,cktile,27,0,2389.4546,a8w8_blockscale_cktile_192x256x128_4x2x1_16x16x128_intrawave_0x1x0_2,2113.82,0.48535,0.0
gfx950,256,65536,6144,7168,cktile,29,0,2727.8049,a8w8_blockscale_cktile_192x256x128_4x2x1_16x16x128_intrawave_0x1x0_4,2116.15,0.48358,0.0
gfx950,256,1,7168,384,ck,10,0,4.4519,a8w8_blockscale_bpreshuffle_1x128x128_256x32x64x128_16x16_16x16_8x32x1_8x32x1_1x32x1x8_8_2x1_intrawave_v1,1.24,0.62158,0.0
gfx950,256,1,7168,3072,asm,2,3,8.0549,_ZN5aiter42fp8gemm_bf16_blockscale_BpreShuffle_32x128E,5.47,2.73591,0.0
gfx950,256,1,7168,7168,ck,7,0,21.0136,a8w8_blockscale_bpreshuffle_1x128x128_256x16x64x256_16x16_16x16_16x16x1_16x16x1_1x16x1x16_4_1x1_intrawave_v1,4.89,2.44612,0.0
gfx950,256,1,7168,16384,triton,0,0,22.6,triton,10.39,5.2,0.0
gfx950,256,2,7168,384,ck,5,0,4.9124,a8w8_blockscale_bpreshuffle_1x128x128_256x16x64x128_8x16_16x16_16x16x1_8x32x1_1x16x1x16_4_1x1_intrawave_v1,2.24,0.56631,0.0
gfx950,256,2,7168,7168,ck,7,0,20.807,a8w8_blockscale_bpreshuffle_1x128x128_256x16x64x256_16x16_16x16_16x16x1_16x16x1_1x16x1x16_4_1x1_intrawave_v1,9.88,2.47144,0.0
gfx950,256,2,7168,16384,triton,0,0,22.6,triton,20.79,5.2,0.0
gfx950,256,4,7168,384,ck,5,0,4.3595,a8w8_blockscale_bpreshuffle_1x128x128_256x16x64x128_8x16_16x16_16x16x1_8x32x1_1x16x1x16_4_1x1_intrawave_v1,5.05,0.64489,0.0
gfx950,256,4,7168,7168,ck,7,0,20.8785,a8w8_blockscale_bpreshuffle_1x128x128_256x16x64x256_16x16_16x16_16x16x1_16x16x1_1x16x1x16_4_1x1_intrawave_v1,19.69,2.46504,0.0
gfx950,256,4,7168,16384,triton,0,0,22.6,triton,41.57,5.2,0.0
gfx950,256,8,7168,384,ck,10,0,4.5093,a8w8_blockscale_bpreshuffle_1x128x128_256x32x64x128_16x16_16x16_8x32x1_8x32x1_1x32x1x8_8_2x1_intrawave_v1,9.77,0.63652,0.0
gfx950,256,8,7168,3072,ck,7,0,10.1419,a8w8_blockscale_bpreshuffle_1x128x128_256x16x64x256_16x16_16x16_16x16x1_16x16x1_1x16x1x16_4_1x1_intrawave_v1,34.74,2.18493,0.0
gfx950,256,8,7168,7168,ck,7,0,20.9046,a8w8_blockscale_bpreshuffle_1x128x128_256x16x64x256_16x16_16x16_16x16x1_16x16x1_1x16x1x16_4_1x1_intrawave_v1,39.33,2.46607,0.0
gfx950,256,8,7168,16384,triton,0,0,22.9,triton,82.05,5.14,0.0
gfx950,256,16,7168,384,ck,5,0,4.9415,a8w8_blockscale_bpreshuffle_1x128x128_256x16x64x128_8x16_16x16_16x16x1_8x32x1_1x16x1x16_4_1x1_intrawave_v1,17.82,0.60468,0.0
gfx950,256,16,7168,3072,ck,7,0,10.0172,a8w8_blockscale_bpreshuffle_1x128x128_256x16x64x256_16x16_16x16_16x16x1_16x16x1_1x16x1x16_4_1x1_intrawave_v1,70.34,2.22603,0.0
gfx950,256,16,7168,7168,ck,7,0,18.626,a8w8_blockscale_bpreshuffle_1x128x128_256x16x64x256_16x16_16x16_16x16x1_16x16x1_1x16x1x16_4_1x1_intrawave_v1,88.27,2.77699,0.0
gfx950,256,16,7168,16384,triton,0,0,25.63,triton,146.63,4.6,0.0
gfx950,256,32,7168,384,ck,10,0,4.5334,a8w8_blockscale_bpreshuffle_1x128x128_256x32x64x128_16x16_16x16_8x32x1_8x32x1_1x32x1x8_8_2x1_intrawave_v1,38.86,0.71107,0.0
gfx950,256,32,7168,3072,ck,7,0,9.8372,a8w8_blockscale_bpreshuffle_1x128x128_256x16x64x256_16x16_16x16_16x16x1_16x16x1_1x16x1x16_4_1x1_intrawave_v1,143.26,2.29508,0.0
gfx950,256,32,7168,7168,ck,7,0,18.7345,a8w8_blockscale_bpreshuffle_1x128x128_256x16x64x256_16x16_16x16_16x16x1_16x16x1_1x16x1x16_4_1x1_intrawave_v1,175.52,2.77928,0.0
gfx950,256,32,7168,16384,triton,0,0,27.56,triton,272.72,4.3,0.0
gfx950,256,48,7168,384,ck,5,0,4.7591,a8w8_blockscale_bpreshuffle_1x128x128_256x16x64x128_8x16_16x16_16x16x1_8x32x1_1x16x1x16_4_1x1_intrawave_v1,55.52,0.72683,0.0
gfx950,256,48,7168,3072,ck,6,0,10.825,a8w8_blockscale_bpreshuffle_1x128x128_256x16x128x256_16x16_16x16_16x16x1_16x16x1_1x16x1x16_8_1x2_intrawave_v1,195.28,2.11138,0.0
gfx950,256,48,7168,7168,ck,6,0,21.4511,a8w8_blockscale_bpreshuffle_1x128x128_256x16x128x256_16x16_16x16_16x16x1_16x16x1_1x16x1x16_8_1x2_intrawave_v1,229.94,2.44334,0.0
gfx950,256,48,7168,16384,asm,11,4,30.5746,_ZN5aiter42fp8gemm_bf16_blockscale_BpreShuffle_48x128E,368.75,3.88934,0.0071
gfx950,256,64,7168,384,ck,10,0,4.7549,a8w8_blockscale_bpreshuffle_1x128x128_256x32x64x128_16x16_16x16_8x32x1_8x32x1_1x32x1x8_8_2x1_intrawave_v1,74.1,0.77701,0.0
gfx950,256,64,7168,3072,ck,12,0,10.3433,a8w8_blockscale_bpreshuffle_1x128x128_256x32x64x256_16x16_16x16_16x16x1_16x16x1_1x32x1x8_8_2x1_intrawave_v1,272.5,2.23664,0.0
gfx950,256,64,7168,7168,ck,12,0,19.9679,a8w8_blockscale_bpreshuffle_1x128x128_256x32x64x256_16x16_16x16_16x16x1_16x16x1_1x32x1x8_8_2x1_intrawave_v1,329.36,2.64206,0.0
gfx950,256,64,7168,16384,triton,0,0,32.87,triton,457.33,3.63,0.0
gfx950,256,80,7168,384,ck,10,0,5.0686,a8w8_blockscale_bpreshuffle_1x128x128_256x32x64x128_16x16_16x16_8x32x1_8x32x1_1x32x1x8_8_2x1_intrawave_v1,86.89,0.77538,0.0
gfx950,256,80,7168,3072,ck,17,0,12.1563,a8w8_blockscale_bpreshuffle_1x128x128_256x64x64x256_16x16_16x16_16x16x1_16x16x1_1x32x1x8_8_2x1_intrawave_v1,289.83,1.92598,0.0
gfx950,256,80,7168,7168,ck,17,0,23.5989,a8w8_blockscale_bpreshuffle_1x128x128_256x64x64x256_16x16_16x16_16x16x1_16x16x1_1x32x1x8_8_2x1_intrawave_v1,348.36,2.25013,0.0
gfx950,256,80,7168,16384,asm,27,4,32.6454,_ZN5aiter42fp8gemm_bf16_blockscale_BpreShuffle_80x128E,575.59,3.67274,0.0078
gfx950,256,96,7168,3072,ck,17,0,12.1977,a8w8_blockscale_bpreshuffle_1x128x128_256x64x64x256_16x16_16x16_16x16x1_16x16x1_1x32x1x8_8_2x1_intrawave_v1,346.61,1.94227,0.0
gfx950,256,96,7168,7168,ck,17,0,23.2427,a8w8_blockscale_bpreshuffle_1x128x128_256x64x64x256_16x16_16x16_16x16x1_16x16x1_1x32x1x8_8_2x1_intrawave_v1,424.43,2.29941,0.0
gfx950,256,96,7168,16384,asm,35,4,34.2026,_ZN5aiter42fp8gemm_bf16_blockscale_BpreShuffle_96x128E,659.27,3.5199,0.0077
gfx950,256,112,7168,384,ck,4,0,5.2778,a8w8_blockscale_bpreshuffle_1x128x128_256x16x128x128_8x16_16x16_16x16x1_8x32x1_1x16x1x16_8_1x2_intrawave_v1,116.82,0.8339,0.0
gfx950,256,112,7168,3072,ck,17,0,12.1297,a8w8_blockscale_bpreshuffle_1x128x128_256x64x64x256_16x16_16x16_16x16x1_16x16x1_1x32x1x8_8_2x1_intrawave_v1,406.65,1.97612,0.0
gfx950,256,112,7168,7168,ck,17,0,23.798,a8w8_blockscale_bpreshuffle_1x128x128_256x64x64x256_16x16_16x16_16x16x1_16x16x1_1x32x1x8_8_2x1_intrawave_v1,483.62,2.26022,0.0
gfx950,256,112,7168,16384,asm,43,4,39.8582,_ZN5aiter43fp8gemm_bf16_blockscale_BpreShuffle_128x128E,660.01,3.03278,0.0075
gfx950,256,128,7168,384,ck,4,0,5.0215,a8w8_blockscale_bpreshuffle_1x128x128_256x16x128x128_8x16_16x16_16x16x1_8x32x1_1x16x1x16_8_1x2_intrawave_v1,140.33,0.92336,0.0
gfx950,256,128,7168,3072,ck,17,0,12.0869,a8w8_blockscale_bpreshuffle_1x128x128_256x64x64x256_16x16_16x16_16x16x1_16x16x1_1x32x1x8_8_2x1_intrawave_v1,466.38,2.00617,0.0
gfx950,256,128,7168,7168,ck,17,0,22.9222,a8w8_blockscale_bpreshuffle_1x128x128_256x64x64x256_16x16_16x16_16x16x1_16x16x1_1x32x1x8_8_2x1_intrawave_v1,573.83,2.36159,0.0
gfx950,256,128,7168,16384,asm,43,4,39.6992,_ZN5aiter43fp8gemm_bf16_blockscale_BpreShuffle_128x128E,757.31,3.05731,0.0077
gfx950,256,144,7168,384,ck,4,0,5.2391,a8w8_blockscale_bpreshuffle_1x128x128_256x16x128x128_8x16_16x16_16x16x1_8x32x1_1x16x1x16_8_1x2_intrawave_v1,151.31,0.92997,0.0
gfx950,256,144,7168,3072,asm,7,1,14.5281,_ZN5aiter42fp8gemm_bf16_blockscale_BpreShuffle_48x128E,436.52,1.68824,0.0
gfx950,256,144,7168,7168,asm,1,1,28.547,_ZN5aiter42fp8gemm_bf16_blockscale_BpreShuffle_48x128E,518.36,1.90832,0.0
gfx950,256,144,7168,16384,asm,25,2,44.2498,_ZN5aiter42fp8gemm_bf16_blockscale_BpreShuffle_80x128E,764.36,2.75401,0.0
gfx950,256,160,7168,384,ck,4,0,5.6828,a8w8_blockscale_bpreshuffle_1x128x128_256x16x128x128_8x16_16x16_16x16x1_8x32x1_1x16x1x16_8_1x2_intrawave_v1,154.99,0.8988,0.0
gfx950,256,160,7168,3072,asm,7,1,14.7027,_ZN5aiter42fp8gemm_bf16_blockscale_BpreShuffle_48x128E,479.26,1.68713,0.0
gfx950,256,160,7168,7168,asm,1,1,29.0974,_ZN5aiter42fp8gemm_bf16_blockscale_BpreShuffle_48x128E,565.06,1.88405,0.0
gfx950,256,160,7168,16384,asm,25,2,44.5438,_ZN5aiter42fp8gemm_bf16_blockscale_BpreShuffle_80x128E,843.69,2.74686,0.0
gfx950,256,176,7168,384,ck,10,0,5.5692,a8w8_blockscale_bpreshuffle_1x128x128_256x32x64x128_16x16_16x16_8x32x1_8x32x1_1x32x1x8_8_2x1_intrawave_v1,173.97,0.95943,0.0001
gfx950,256,176,7168,3072,asm,7,1,14.8842,_ZN5aiter42fp8gemm_bf16_blockscale_BpreShuffle_48x128E,520.76,1.68527,0.0
gfx950,256,176,7168,7168,asm,1,1,29.1359,_ZN5aiter42fp8gemm_bf16_blockscale_BpreShuffle_48x128E,620.74,1.89337,0.0
gfx950,256,176,7168,16384,asm,33,2,48.5542,_ZN5aiter42fp8gemm_bf16_blockscale_BpreShuffle_96x128E,851.4,2.53011,0.0
gfx950,256,192,7168,384,ck,10,0,5.583,a8w8_blockscale_bpreshuffle_1x128x128_256x32x64x128_16x16_16x16_8x32x1_8x32x1_1x32x1x8_8_2x1_intrawave_v1,189.32,0.99924,0.0
gfx950,256,192,7168,3072,asm,7,1,14.6504,_ZN5aiter42fp8gemm_bf16_blockscale_BpreShuffle_48x128E,577.17,1.73118,0.0
gfx950,256,192,7168,7168,asm,1,1,29.4402,_ZN5aiter42fp8gemm_bf16_blockscale_BpreShuffle_48x128E,670.17,1.88548,0.0
gfx950,256,192,7168,16384,asm,33,2,48.5354,_ZN5aiter42fp8gemm_bf16_blockscale_BpreShuffle_96x128E,929.16,2.54121,0.0
gfx950,256,208,7168,384,ck,4,0,6.0222,a8w8_blockscale_bpreshuffle_1x128x128_256x16x128x128_8x16_16x16_16x16x1_8x32x1_1x16x1x16_8_1x2_intrawave_v1,190.14,0.96547,0.0
gfx950,256,208,7168,3072,asm,14,1,15.6859,_ZN5aiter42fp8gemm_bf16_blockscale_BpreShuffle_64x128E,583.99,1.63465,0.0
gfx950,256,208,7168,7168,asm,2,1,31.0722,_ZN5aiter42fp8gemm_bf16_blockscale_BpreShuffle_64x128E,687.89,1.79752,0.0
gfx950,256,208,7168,16384,asm,41,2,59.9879,_ZN5aiter43fp8gemm_bf16_blockscale_BpreShuffle_128x128E,814.42,2.06425,0.0
gfx950,256,224,7168,384,ck,2,0,5.9902,a8w8_blockscale_bpreshuffle_1x128x128_256x64x64x128_16x16_16x16_8x32x1_8x32x1_1x32x1x8_8_2x1_intrawave_v3,205.86,1.00995,0.0
gfx950,256,224,7168,3072,asm,14,1,15.5859,_ZN5aiter42fp8gemm_bf16_blockscale_BpreShuffle_64x128E,632.94,1.66301,0.0
gfx950,256,224,7168,7168,asm,2,1,31.2014,_ZN5aiter42fp8gemm_bf16_blockscale_BpreShuffle_64x128E,737.73,1.80111,0.0
gfx950,256,224,7168,16384,asm,41,2,59.3959,_ZN5aiter43fp8gemm_bf16_blockscale_BpreShuffle_128x128E,885.81,2.0931,0.0
gfx950,256,240,7168,384,ck,10,0,6.1141,a8w8_blockscale_bpreshuffle_1x128x128_256x32x64x128_16x16_16x16_8x32x1_8x32x1_1x32x1x8_8_2x1_intrawave_v1,216.09,1.028,0.0005
gfx950,256,240,7168,3072,asm,14,1,16.1235,_ZN5aiter42fp8gemm_bf16_blockscale_BpreShuffle_64x128E,655.54,1.62483,0.0
gfx950,256,240,7168,7168,asm,2,1,31.2656,_ZN5aiter42fp8gemm_bf16_blockscale_BpreShuffle_64x128E,788.81,1.80842,0.0
gfx950,256,240,7168,16384,asm,26,3,61.0439,_ZN5aiter42fp8gemm_bf16_blockscale_BpreShuffle_80x128E,923.46,2.04465,0.0011
gfx950,256,256,7168,384,ck,4,0,5.8007,a8w8_blockscale_bpreshuffle_1x128x128_256x16x128x128_8x16_16x16_16x16x1_8x32x1_1x16x1x16_8_1x2_intrawave_v1,242.95,1.12415,0.0
gfx950,256,256,7168,3072,asm,14,1,16.3648,_ZN5aiter42fp8gemm_bf16_blockscale_BpreShuffle_64x128E,688.94,1.6179,0.0
gfx950,256,256,7168,7168,asm,2,1,30.8956,_ZN5aiter42fp8gemm_bf16_blockscale_BpreShuffle_64x128E,851.47,1.84121,0.0
gfx950,256,256,7168,16384,asm,41,2,61.9231,_ZN5aiter43fp8gemm_bf16_blockscale_BpreShuffle_128x128E,971.04,2.02356,0.0
gfx950,256,288,7168,384,ck,8,0,6.3655,a8w8_blockscale_bpreshuffle_1x128x128_256x32x256x128_16x16_16x16_8x32x1_8x32x1_1x32x1x8_8_2x1_intrawave_v1,249.07,1.0984,0.0
gfx950,256,288,7168,3072,asm,21,1,17.3917,_ZN5aiter42fp8gemm_bf16_blockscale_BpreShuffle_80x128E,729.29,1.5544,0.0
gfx950,256,288,7168,7168,asm,3,1,33.4059,_ZN5aiter42fp8gemm_bf16_blockscale_BpreShuffle_80x128E,885.92,1.72345,0.0
gfx950,256,288,7168,16384,asm,34,3,69.4003,_ZN5aiter42fp8gemm_bf16_blockscale_BpreShuffle_96x128E,974.72,1.8197,0.001
gfx950,256,320,7168,384,ck,9,0,6.4468,a8w8_blockscale_bpreshuffle_1x128x128_256x32x128x128_16x16_16x16_8x32x1_8x32x1_1x32x1x8_8_2x1_intrawave_v1,273.25,1.15761,0.0
gfx950,256,320,7168,3072,asm,21,1,17.2359,_ZN5aiter42fp8gemm_bf16_blockscale_BpreShuffle_80x128E,817.65,1.60077,0.0
gfx950,256,320,7168,7168,asm,3,1,34.0678,_ZN5aiter42fp8gemm_bf16_blockscale_BpreShuffle_80x128E,965.23,1.71016,0.0
gfx950,256,320,7168,16384,asm,24,1,71.8858,_ZN5aiter42fp8gemm_bf16_blockscale_BpreShuffle_80x128E,1045.57,1.77046,0.0
gfx950,256,352,7168,384,ck,15,0,6.8424,a8w8_blockscale_bpreshuffle_1x128x128_256x64x64x128_16x16_16x16_8x32x1_8x32x1_1x32x1x8_8_2x1_intrawave_v1,283.2,1.15953,0.0007
gfx950,256,352,7168,3072,asm,28,1,19.9287,_ZN5aiter42fp8gemm_bf16_blockscale_BpreShuffle_96x128E,777.88,1.41242,0.0
gfx950,256,352,7168,7168,asm,4,1,38.5304,_ZN5aiter42fp8gemm_bf16_blockscale_BpreShuffle_96x128E,938.78,1.52995,0.0
gfx950,256,352,7168,16384,asm,32,1,78.4826,_ZN5aiter42fp8gemm_bf16_blockscale_BpreShuffle_96x128E,1053.46,1.63417,0.0
gfx950,256,384,7168,384,ck,9,0,6.5405,a8w8_blockscale_bpreshuffle_1x128x128_256x32x128x128_16x16_16x16_8x32x1_8x32x1_1x32x1x8_8_2x1_intrawave_v1,323.21,1.28507,0.0
gfx950,256,384,7168,3072,asm,28,1,19.3973,_ZN5aiter42fp8gemm_bf16_blockscale_BpreShuffle_96x128E,871.84,1.47983,0.0
gfx950,256,384,7168,7168,asm,4,1,40.1326,_ZN5aiter42fp8gemm_bf16_blockscale_BpreShuffle_96x128E,983.24,1.48602,0.0
gfx950,256,384,7168,16384,asm,32,1,77.9566,_ZN5aiter42fp8gemm_bf16_blockscale_BpreShuffle_96x128E,1156.98,1.65781,0.0
gfx950,256,416,7168,384,ck,9,0,7.7057,a8w8_blockscale_bpreshuffle_1x128x128_256x32x128x128_16x16_16x16_8x32x1_8x32x1_1x32x1x8_8_2x1_intrawave_v1,297.19,1.15188,0.0
gfx950,256,416,7168,3072,ck,14,0,23.3761,a8w8_blockscale_bpreshuffle_1x128x128_256x64x128x128_16x16_16x16_8x32x1_8x32x1_1x32x1x8_8_2x1_intrawave_v1,783.74,1.25178,0.0001
gfx950,256,416,7168,16384,asm,40,1,94.9783,_ZN5aiter43fp8gemm_bf16_blockscale_BpreShuffle_128x128E,1028.77,1.37105,0.0
gfx950,256,448,7168,384,ck,9,0,7.8193,a8w8_blockscale_bpreshuffle_1x128x128_256x32x128x128_16x16_16x16_8x32x1_8x32x1_1x32x1x8_8_2x1_intrawave_v1,315.41,1.19538,0.0
gfx950,256,448,7168,3072,ck,14,0,23.9363,a8w8_blockscale_bpreshuffle_1x128x128_256x64x128x128_16x16_16x16_8x32x1_8x32x1_1x32x1x8_8_2x1_intrawave_v1,824.27,1.24576,0.0001
gfx950,256,448,7168,7168,ck,14,0,46.9169,a8w8_blockscale_bpreshuffle_1x128x128_256x64x128x128_16x16_16x16_8x32x1_8x32x1_1x32x1x8_8_2x1_intrawave_v1,981.24,1.30047,0.0001
gfx950,256,448,7168,16384,ck,14,0,99.1679,a8w8_blockscale_bpreshuffle_1x128x128_256x64x128x128_16x16_16x16_8x32x1_8x32x1_1x32x1x8_8_2x1_intrawave_v1,1061.1,1.32304,0.0001
gfx950,256,480,7168,384,ck,14,0,8.1762,a8w8_blockscale_bpreshuffle_1x128x128_256x64x128x128_16x16_16x16_8x32x1_8x32x1_1x32x1x8_8_2x1_intrawave_v1,323.18,1.20082,0.0
gfx950,256,480,7168,3072,ck,14,0,24.0859,a8w8_blockscale_bpreshuffle_1x128x128_256x64x128x128_16x16_16x16_8x32x1_8x32x1_1x32x1x8_8_2x1_intrawave_v1,877.66,1.26115,0.0001
gfx950,256,480,7168,7168,ck,14,0,48.4232,a8w8_blockscale_bpreshuffle_1x128x128_256x64x128x128_16x16_16x16_8x32x1_8x32x1_1x32x1x8_8_2x1_intrawave_v1,1018.62,1.27423,0.0001
gfx950,256,512,7168,384,ck,14,0,7.8651,a8w8_blockscale_bpreshuffle_1x128x128_256x64x128x128_16x16_16x16_8x32x1_8x32x1_1x32x1x8_8_2x1_intrawave_v1,358.36,1.3082,0.0
gfx950,256,512,7168,3072,ck,14,0,24.0417,a8w8_blockscale_bpreshuffle_1x128x128_256x64x128x128_16x16_16x16_8x32x1_8x32x1_1x32x1x8_8_2x1_intrawave_v1,937.89,1.28664,0.0002
gfx950,256,512,7168,7168,ck,13,0,48.9252,a8w8_blockscale_bpreshuffle_1x128x128_256x64x256x128_16x16_16x16_8x32x1_8x32x1_1x32x1x8_8_2x1_intrawave_v1,1075.38,1.27522,0.0
gfx950,256,512,7168,16384,ck,14,0,98.3706,a8w8_blockscale_bpreshuffle_1x128x128_256x64x128x128_16x16_16x16_8x32x1_8x32x1_1x32x1x8_8_2x1_intrawave_v1,1222.51,1.35375,0.0001
gfx950,256,544,7168,384,ck,9,0,8.3895,a8w8_blockscale_bpreshuffle_1x128x128_256x32x128x128_16x16_16x16_8x32x1_8x32x1_1x32x1x8_8_2x1_intrawave_v1,356.96,1.28258,0.0
gfx950,256,544,7168,3072,ck,14,0,25.4623,a8w8_blockscale_bpreshuffle_1x128x128_256x64x128x128_16x16_16x16_8x32x1_8x32x1_1x32x1x8_8_2x1_intrawave_v1,940.92,1.23673,0.0001
gfx950,256,544,7168,7168,ck,14,0,51.3141,a8w8_blockscale_bpreshuffle_1x128x128_256x64x128x128_16x16_16x16_8x32x1_8x32x1_1x32x1x8_8_2x1_intrawave_v1,1089.4,1.22926,0.0001
gfx950,256,544,7168,16384,ck,14,0,107.4367,a8w8_blockscale_bpreshuffle_1x128x128_256x64x128x128_16x16_16x16_8x32x1_8x32x1_1x32x1x8_8_2x1_intrawave_v1,1189.31,1.24866,0.0
gfx950,256,576,7168,384,ck,13,0,8.9716,a8w8_blockscale_bpreshuffle_1x128x128_256x64x256x128_16x16_16x16_8x32x1_8x32x1_1x32x1x8_8_2x1_intrawave_v1,353.44,1.25186,0.0
gfx950,256,576,7168,3072,ck,14,0,24.9911,a8w8_blockscale_bpreshuffle_1x128x128_256x64x128x128_16x16_16x16_8x32x1_8x32x1_1x32x1x8_8_2x1_intrawave_v1,1015.05,1.28234,0.0002
gfx950,256,576,7168,7168,ck,14,0,50.4894,a8w8_blockscale_bpreshuffle_1x128x128_256x64x128x128_16x16_16x16_8x32x1_8x32x1_1x32x1x8_8_2x1_intrawave_v1,1172.33,1.26297,0.0001
gfx950,256,576,7168,16384,ck,14,0,104.4563,a8w8_blockscale_bpreshuffle_1x128x128_256x64x128x128_16x16_16x16_8x32x1_8x32x1_1x32x1x8_8_2x1_intrawave_v1,1295.2,1.2937,0.0
gfx950,256,608,7168,384,ck,10,0,9.8199,a8w8_blockscale_bpreshuffle_1x128x128_256x32x64x128_16x16_16x16_8x32x1_8x32x1_1x32x1x8_8_2x1_intrawave_v1,340.84,1.19169,0.0014
gfx950,256,608,7168,3072,ck,14,0,31.0992,a8w8_blockscale_bpreshuffle_1x128x128_256x64x128x128_16x16_16x16_8x32x1_8x32x1_1x32x1x8_8_2x1_intrawave_v1,861.0,1.04839,0.0001
gfx950,256,608,7168,7168,ck,14,0,62.2214,a8w8_blockscale_bpreshuffle_1x128x128_256x64x128x128_16x16_16x16_8x32x1_8x32x1_1x32x1x8_8_2x1_intrawave_v1,1004.13,1.03589,0.0001
gfx950,256,640,7168,384,ck,10,0,9.9283,a8w8_blockscale_bpreshuffle_1x128x128_256x32x64x128_16x16_16x16_8x32x1_8x32x1_1x32x1x8_8_2x1_intrawave_v1,354.87,1.22612,0.0012
gfx950,256,640,7168,3072,ck,14,0,31.3519,a8w8_blockscale_bpreshuffle_1x128x128_256x64x128x128_16x16_16x16_8x32x1_8x32x1_1x32x1x8_8_2x1_intrawave_v1,899.01,1.05771,0.0002
gfx950,256,640,7168,7168,ck,14,0,62.2407,a8w8_blockscale_bpreshuffle_1x128x128_256x64x128x128_16x16_16x16_8x32x1_8x32x1_1x32x1x8_8_2x1_intrawave_v1,1056.65,1.04663,0.0001
gfx950,256,640,7168,16384,ck,14,0,129.4033,a8w8_blockscale_bpreshuffle_1x128x128_256x64x128x128_16x16_16x16_8x32x1_8x32x1_1x32x1x8_8_2x1_intrawave_v1,1161.67,1.05949,0.0
gfx950,256,672,7168,384,ck,9,0,9.8369,a8w8_blockscale_bpreshuffle_1x128x128_256x32x128x128_16x16_16x16_8x32x1_8x32x1_1x32x1x8_8_2x1_intrawave_v1,376.07,1.2854,0.0
gfx950,256,672,7168,3072,ck,14,0,31.6323,a8w8_blockscale_bpreshuffle_1x128x128_256x64x128x128_16x16_16x16_8x32x1_8x32x1_1x32x1x8_8_2x1_intrawave_v1,935.59,1.06594,0.0001
gfx950,256,672,7168,7168,ck,13,0,65.2683,a8w8_blockscale_bpreshuffle_1x128x128_256x64x256x128_16x16_16x16_8x32x1_8x32x1_1x32x1x8_8_2x1_intrawave_v1,1058.02,1.00862,0.0
gfx950,256,672,7168,16384,asm,24,1,133.3989,_ZN5aiter42fp8gemm_bf16_blockscale_BpreShuffle_80x128E,1183.22,1.03512,0.0
gfx950,256,704,7168,384,ck,9,0,9.789,a8w8_blockscale_bpreshuffle_1x128x128_256x32x128x128_16x16_16x16_8x32x1_8x32x1_1x32x1x8_8_2x1_intrawave_v1,395.91,1.33981,0.0
gfx950,256,704,7168,3072,ck,14,0,31.5824,a8w8_blockscale_bpreshuffle_1x128x128_256x64x128x128_16x16_16x16_8x32x1_8x32x1_1x32x1x8_8_2x1_intrawave_v1,981.7,1.08527,0.0002
gfx950,256,704,7168,7168,ck,13,0,64.8418,a8w8_blockscale_bpreshuffle_1x128x128_256x64x256x128_16x16_16x16_8x32x1_8x32x1_1x32x1x8_8_2x1_intrawave_v1,1115.69,1.02587,0.0
gfx950,256,736,7168,384,ck,9,1,11.2632,a8w8_blockscale_bpreshuffle_1x128x128_256x32x128x128_16x16_16x16_8x32x1_8x32x1_1x32x1x8_8_2x1_intrawave_v1,359.73,1.20627,0.0
gfx950,256,736,7168,3072,ck,14,0,32.7148,a8w8_blockscale_bpreshuffle_1x128x128_256x64x128x128_16x16_16x16_8x32x1_8x32x1_1x32x1x8_8_2x1_intrawave_v1,990.79,1.06473,0.0002
gfx950,256,736,7168,7168,ck,13,0,67.6229,a8w8_blockscale_bpreshuffle_1x128x128_256x64x256x128_16x16_16x16_8x32x1_8x32x1_1x32x1x8_8_2x1_intrawave_v1,1118.43,0.99385,0.0
gfx950,256,736,7168,16384,ck,13,0,138.4289,a8w8_blockscale_bpreshuffle_1x128x128_256x64x256x128_16x16_16x16_8x32x1_8x32x1_1x32x1x8_8_2x1_intrawave_v1,1248.82,1.01171,0.0
gfx950,256,768,7168,384,ck,14,0,10.633,a8w8_blockscale_bpreshuffle_1x128x128_256x64x128x128_16x16_16x16_8x32x1_8x32x1_1x32x1x8_8_2x1_intrawave_v1,397.62,1.32206,0.0
gfx950,256,768,7168,3072,ck,14,0,32.7716,a8w8_blockscale_bpreshuffle_1x128x128_256x64x128x128_16x16_16x16_8x32x1_8x32x1_1x32x1x8_8_2x1_intrawave_v1,1032.08,1.07988,0.0002
gfx950,256,768,7168,7168,ck,13,0,64.1411,a8w8_blockscale_bpreshuffle_1x128x128_256x64x256x128_16x16_16x16_8x32x1_8x32x1_1x32x1x8_8_2x1_intrawave_v1,1230.41,1.05853,0.0
gfx950,256,768,7168,16384,ck,13,0,133.7547,a8w8_blockscale_bpreshuffle_1x128x128_256x64x256x128_16x16_16x16_8x32x1_8x32x1_1x32x1x8_8_2x1_intrawave_v1,1348.65,1.05442,0.0
gfx950,256,800,7168,384,ck,9,0,10.783,a8w8_blockscale_bpreshuffle_1x128x128_256x32x128x128_16x16_16x16_8x32x1_8x32x1_1x32x1x8_8_2x1_intrawave_v1,408.42,1.34735,0.0
gfx950,256,800,7168,3072,ck,13,0,33.2583,a8w8_blockscale_bpreshuffle_1x128x128_256x64x256x128_16x16_16x16_8x32x1_8x32x1_1x32x1x8_8_2x1_intrawave_v1,1059.35,1.08083,0.0
gfx950,256,800,7168,7168,ck,13,0,69.0192,a8w8_blockscale_bpreshuffle_1x128x128_256x64x256x128_16x16_16x16_8x32x1_8x32x1_1x32x1x8_8_2x1_intrawave_v1,1191.09,0.99369,0.0
gfx950,256,800,7168,16384,ck,13,0,141.3488,a8w8_blockscale_bpreshuffle_1x128x128_256x64x256x128_16x16_16x16_8x32x1_8x32x1_1x32x1x8_8_2x1_intrawave_v1,1329.37,1.00472,0.0
gfx950,256,832,7168,384,ck,14,0,10.7452,a8w8_blockscale_bpreshuffle_1x128x128_256x64x128x128_16x16_16x16_8x32x1_8x32x1_1x32x1x8_8_2x1_intrawave_v1,426.25,1.39593,0.0
gfx950,256,832,7168,3072,ck,13,0,32.327,a8w8_blockscale_bpreshuffle_1x128x128_256x64x256x128_16x16_16x16_8x32x1_8x32x1_1x32x1x8_8_2x1_intrawave_v1,1133.46,1.1292,0.0
gfx950,256,832,7168,7168,ck,13,0,70.1573,a8w8_blockscale_bpreshuffle_1x128x128_256x64x256x128_16x16_16x16_8x32x1_8x32x1_1x32x1x8_8_2x1_intrawave_v1,1218.64,0.98737,0.0
gfx950,256,832,7168,16384,ck,13,0,141.4845,a8w8_blockscale_bpreshuffle_1x128x128_256x64x256x128_16x16_16x16_8x32x1_8x32x1_1x32x1x8_8_2x1_intrawave_v1,1381.22,1.01071,0.0
gfx950,256,864,7168,384,ck,9,0,10.9624,a8w8_blockscale_bpreshuffle_1x128x128_256x32x128x128_16x16_16x16_8x32x1_8x32x1_1x32x1x8_8_2x1_intrawave_v1,433.88,1.41124,0.0
gfx950,256,864,7168,3072,ck,13,0,35.2642,a8w8_blockscale_bpreshuffle_1x128x128_256x64x256x128_16x16_16x16_8x32x1_8x32x1_1x32x1x8_8_2x1_intrawave_v1,1079.02,1.05094,0.0
gfx950,256,864,7168,7168,ck,13,0,75.8732,a8w8_blockscale_bpreshuffle_1x128x128_256x64x256x128_16x16_16x16_8x32x1_8x32x1_1x32x1x8_8_2x1_intrawave_v1,1170.18,0.92206,0.0
gfx950,256,864,7168,16384,asm,32,1,151.4096,_ZN5aiter42fp8gemm_bf16_blockscale_BpreShuffle_96x128E,1340.32,0.95095,0.0
gfx950,256,896,7168,384,ck,9,0,11.3587,a8w8_blockscale_bpreshuffle_1x128x128_256x32x128x128_16x16_16x16_8x32x1_8x32x1_1x32x1x8_8_2x1_intrawave_v1,434.25,1.40347,0.0
gfx950,256,896,7168,3072,ck,13,0,34.2653,a8w8_blockscale_bpreshuffle_1x128x128_256x64x256x128_16x16_16x16_8x32x1_8x32x1_1x32x1x8_8_2x1_intrawave_v1,1151.6,1.09784,0.0
gfx950,256,896,7168,7168,ck,13,0,72.8489,a8w8_blockscale_bpreshuffle_1x128x128_256x64x256x128_16x16_16x16_8x32x1_8x32x1_1x32x1x8_8_2x1_intrawave_v1,1263.9,0.96979,0.0
gfx950,256,896,7168,16384,ck,13,0,153.3112,a8w8_blockscale_bpreshuffle_1x128x128_256x64x256x128_16x16_16x16_8x32x1_8x32x1_1x32x1x8_8_2x1_intrawave_v1,1372.72,0.94556,0.0
gfx950,256,928,7168,384,ck,9,0,11.4791,a8w8_blockscale_bpreshuffle_1x128x128_256x32x128x128_16x16_16x16_8x32x1_8x32x1_1x32x1x8_8_2x1_intrawave_v1,445.04,1.42979,0.0
gfx950,256,928,7168,3072,ck,13,0,38.5288,a8w8_blockscale_bpreshuffle_1x128x128_256x64x256x128_16x16_16x16_8x32x1_8x32x1_1x32x1x8_8_2x1_intrawave_v1,1060.75,0.99081,0.0
gfx950,256,928,7168,7168,ck,0,0,76.3922,a8w8_blockscale_bpreshuffle_1x128x128_256x128x128x128_16x16_16x16_8x32x1_8x32x1_1x32x1x8_8_2x1_intrawave_v3,1248.32,0.93381,0.0
gfx950,256,928,7168,16384,ck,0,0,158.9736,a8w8_blockscale_bpreshuffle_1x128x128_256x128x128x128_16x16_16x16_8x32x1_8x32x1_1x32x1x8_8_2x1_intrawave_v3,1371.11,0.91807,0.0
gfx950,256,960,7168,384,ck,9,0,11.8232,a8w8_blockscale_bpreshuffle_1x128x128_256x32x128x128_16x16_16x16_8x32x1_8x32x1_1x32x1x8_8_2x1_intrawave_v1,446.99,1.42802,0.0
gfx950,256,960,7168,3072,ck,13,0,38.1392,a8w8_blockscale_bpreshuffle_1x128x128_256x64x256x128_16x16_16x16_8x32x1_8x32x1_1x32x1x8_8_2x1_intrawave_v1,1108.53,1.01554,0.0
gfx950,256,960,7168,7168,ck,13,0,75.3989,a8w8_blockscale_bpreshuffle_1x128x128_256x64x256x128_16x16_16x16_8x32x1_8x32x1_1x32x1x8_8_2x1_intrawave_v1,1308.37,0.95524,0.0
gfx950,256,960,7168,16384,ck,13,0,157.0398,a8w8_blockscale_bpreshuffle_1x128x128_256x64x256x128_16x16_16x16_8x32x1_8x32x1_1x32x1x8_8_2x1_intrawave_v1,1435.85,0.93563,0.0
gfx950,256,992,7168,384,ck,9,0,13.3779,a8w8_blockscale_bpreshuffle_1x128x128_256x32x128x128_16x16_16x16_8x32x1_8x32x1_1x32x1x8_8_2x1_intrawave_v1,408.21,1.29727,0.0
gfx950,256,992,7168,3072,ck,13,0,38.328,a8w8_blockscale_bpreshuffle_1x128x128_256x64x256x128_16x16_16x16_8x32x1_8x32x1_1x32x1x8_8_2x1_intrawave_v1,1139.84,1.02507,0.0
gfx950,256,992,7168,7168,ck,13,0,76.8077,a8w8_blockscale_bpreshuffle_1x128x128_256x64x256x128_16x16_16x16_8x32x1_8x32x1_1x32x1x8_8_2x1_intrawave_v1,1327.19,0.94668,0.0
gfx950,256,992,7168,16384,ck,0,0,156.4214,a8w8_blockscale_bpreshuffle_1x128x128_256x128x128x128_16x16_16x16_8x32x1_8x32x1_1x32x1x8_8_2x1_intrawave_v3,1489.58,0.94562,0.0
gfx950,256,1024,7168,384,ck,13,0,12.9508,a8w8_blockscale_bpreshuffle_1x128x128_256x64x256x128_16x16_16x16_8x32x1_8x32x1_1x32x1x8_8_2x1_intrawave_v1,435.27,1.37642,0.0
gfx950,256,1024,7168,3072,ck,13,0,38.2496,a8w8_blockscale_bpreshuffle_1x128x128_256x64x256x128_16x16_16x16_8x32x1_8x32x1_1x32x1x8_8_2x1_intrawave_v1,1179.02,1.04173,0.0
gfx950,256,1024,7168,7168,ck,13,0,76.9649,a8w8_blockscale_bpreshuffle_1x128x128_256x64x256x128_16x16_16x16_8x32x1_8x32x1_1x32x1x8_8_2x1_intrawave_v1,1367.2,0.95369,0.0
gfx950,256,1024,7168,16384,ck,0,0,159.2855,a8w8_blockscale_bpreshuffle_1x128x128_256x128x128x128_16x16_16x16_8x32x1_8x32x1_1x32x1x8_8_2x1_intrawave_v3,1509.98,0.93479,0.0
gfx950,256,1088,7168,384,ck,9,0,12.4426,a8w8_blockscale_bpreshuffle_1x128x128_256x32x128x128_16x16_16x16_8x32x1_8x32x1_1x32x1x8_8_2x1_intrawave_v1,481.37,1.50836,0.0
gfx950,256,1088,7168,3072,ck,13,0,38.3276,a8w8_blockscale_bpreshuffle_1x128x128_256x64x256x128_16x16_16x16_8x32x1_8x32x1_1x32x1x8_8_2x1_intrawave_v1,1250.16,1.06868,0.0
gfx950,256,1088,7168,7168,ck,13,0,78.3802,a8w8_blockscale_bpreshuffle_1x128x128_256x64x256x128_16x16_16x16_8x32x1_8x32x1_1x32x1x8_8_2x1_intrawave_v1,1426.42,0.95402,0.0
gfx950,256,1088,7168,16384,ck,13,0,165.3111,a8w8_blockscale_bpreshuffle_1x128x128_256x64x256x128_16x16_16x16_8x32x1_8x32x1_1x32x1x8_8_2x1_intrawave_v1,1545.88,0.91261,0.0
gfx950,256,1152,7168,384,ck,9,0,12.5595,a8w8_blockscale_bpreshuffle_1x128x128_256x32x128x128_16x16_16x16_8x32x1_8x32x1_1x32x1x8_8_2x1_intrawave_v1,504.94,1.56933,0.0
gfx950,256,1152,7168,3072,ck,13,0,41.1468,a8w8_blockscale_bpreshuffle_1x128x128_256x64x256x128_16x16_16x16_8x32x1_8x32x1_1x32x1x8_8_2x1_intrawave_v1,1233.01,1.02254,0.0
gfx950,256,1152,7168,7168,ck,13,0,80.7938,a8w8_blockscale_bpreshuffle_1x128x128_256x64x256x128_16x16_16x16_8x32x1_8x32x1_1x32x1x8_8_2x1_intrawave_v1,1465.21,0.94256,0.0
gfx950,256,1152,7168,16384,ck,0,0,168.6731,a8w8_blockscale_bpreshuffle_1x128x128_256x128x128x128_16x16_16x16_8x32x1_8x32x1_1x32x1x8_8_2x1_intrawave_v3,1604.19,0.90607,0.0
gfx950,256,1216,7168,384,ck,9,0,13.4297,a8w8_blockscale_bpreshuffle_1x128x128_256x32x128x128_16x16_16x16_8x32x1_8x32x1_1x32x1x8_8_2x1_intrawave_v1,498.46,1.53779,0.0
gfx950,256,1216,7168,3072,cktile,27,0,46.8037,a8w8_blockscale_cktile_192x256x128_4x2x1_16x16x128_intrawave_0x1x0_2,1144.2,0.92275,0.0
gfx950,256,1216,7168,7168,cktile,28,0,87.0523,a8w8_blockscale_cktile_192x256x128_4x2x1_16x16x128_intrawave_0x1x0_3,1435.42,0.8906,0.0
gfx950,256,1216,7168,16384,cktile,27,0,177.3028,a8w8_blockscale_cktile_192x256x128_4x2x1_16x16x128_intrawave_0x1x0_2,1610.89,0.87306,0.0
gfx950,256,1280,7168,384,ck,9,0,13.8774,a8w8_blockscale_bpreshuffle_1x128x128_256x32x128x128_16x16_16x16_8x32x1_8x32x1_1x32x1x8_8_2x1_intrawave_v1,507.76,1.55606,0.0
gfx950,256,1280,7168,3072,cktile,29,0,47.2069,a8w8_blockscale_cktile_192x256x128_4x2x1_16x16x128_intrawave_0x1x0_4,1194.14,0.93847,0.0
gfx950,256,1280,7168,7168,cktile,27,0,87.9119,a8w8_blockscale_cktile_192x256x128_4x2x1_16x16x128_intrawave_0x1x0_2,1496.2,0.89755,0.0
gfx950,256,1280,7168,16384,cktile,11,0,178.156,a8w8_blockscale_cktile_192x256x128_4x2x1_16x16x128_intrawave_0x1x0_1,1687.55,0.87991,0.0
gfx950,256,1344,7168,384,ck,9,0,14.2723,a8w8_blockscale_bpreshuffle_1x128x128_256x32x128x128_16x16_16x16_8x32x1_8x32x1_1x32x1x8_8_2x1_intrawave_v1,518.4,1.57902,0.0
gfx950,256,1344,7168,3072,cktile,28,0,47.3643,a8w8_blockscale_cktile_192x256x128_4x2x1_16x16x128_intrawave_0x1x0_3,1249.68,0.95888,0.0
gfx950,256,1344,7168,7168,cktile,28,0,88.0382,a8w8_blockscale_cktile_192x256x128_4x2x1_16x16x128_intrawave_0x1x0_3,1568.75,0.9119,0.0
gfx950,256,1344,7168,16384,cktile,28,0,177.456,a8w8_blockscale_cktile_192x256x128_4x2x1_16x16x128_intrawave_0x1x0_3,1778.92,0.89447,0.0
gfx950,256,1408,7168,384,ck,9,0,14.6469,a8w8_blockscale_bpreshuffle_1x128x128_256x32x128x128_16x16_16x16_8x32x1_8x32x1_1x32x1x8_8_2x1_intrawave_v1,529.2,1.60295,0.0
gfx950,256,1408,7168,3072,cktile,29,0,48.7357,a8w8_blockscale_cktile_192x256x128_4x2x1_16x16x128_intrawave_0x1x0_4,1272.34,0.95475,0.0
gfx950,256,1408,7168,7168,cktile,28,0,89.9503,a8w8_blockscale_cktile_192x256x128_4x2x1_16x16x128_intrawave_0x1x0_3,1608.52,0.90781,0.0
gfx950,256,1408,7168,16384,cktile,11,0,179.7188,a8w8_blockscale_cktile_192x256x128_4x2x1_16x16x128_intrawave_0x1x0_1,1840.17,0.89414,0.0
gfx950,256,1472,7168,384,ck,9,0,15.1377,a8w8_blockscale_bpreshuffle_1x128x128_256x32x128x128_16x16_16x16_8x32x1_8x32x1_1x32x1x8_8_2x1_intrawave_v1,535.31,1.61321,0.0
gfx950,256,1472,7168,3072,cktile,28,0,48.5541,a8w8_blockscale_cktile_192x256x128_4x2x1_16x16x128_intrawave_0x1x0_3,1335.15,0.98127,0.0
gfx950,256,1472,7168,7168,cktile,29,0,89.6557,a8w8_blockscale_cktile_192x256x128_4x2x1_16x16x128_intrawave_0x1x0_4,1687.16,0.92614,0.0
gfx950,256,1472,7168,16384,cktile,28,0,179.5078,a8w8_blockscale_cktile_192x256x128_4x2x1_16x16x128_intrawave_0x1x0_3,1926.07,0.90615,0.0
gfx950,256,1536,7168,384,ck,9,0,15.7955,a8w8_blockscale_bpreshuffle_1x128x128_256x32x128x128_16x16_16x16_8x32x1_8x32x1_1x32x1x8_8_2x1_intrawave_v1,535.32,1.60567,0.0
gfx950,256,1536,7168,3072,cktile,28,0,48.3445,a8w8_blockscale_cktile_192x256x128_4x2x1_16x16x128_intrawave_0x1x0_3,1399.24,1.00857,0.0
gfx950,256,1536,7168,7168,cktile,11,0,89.8275,a8w8_blockscale_cktile_192x256x128_4x2x1_16x16x128_intrawave_0x1x0_1,1757.15,0.93969,0.0
gfx950,256,1536,7168,16384,cktile,11,0,180.0393,a8w8_blockscale_cktile_192x256x128_4x2x1_16x16x128_intrawave_0x1x0_1,2003.88,0.91439,0.0
gfx950,256,1600,7168,384,ck,9,0,16.0454,a8w8_blockscale_bpreshuffle_1x128x128_256x32x128x128_16x16_16x16_8x32x1_8x32x1_1x32x1x8_8_2x1_intrawave_v1,548.94,1.63938,0.0
gfx950,256,1600,7168,3072,cktile,28,0,49.5047,a8w8_blockscale_cktile_192x256x128_4x2x1_16x16x128_intrawave_0x1x0_3,1423.39,1.00744,0.0
gfx950,256,1600,7168,7168,cktile,29,0,92.4801,a8w8_blockscale_cktile_192x256x128_4x2x1_16x16x128_intrawave_0x1x0_4,1777.86,0.92762,0.0
gfx950,256,1600,7168,16384,cktile,27,0,182.6633,a8w8_blockscale_cktile_192x256x128_4x2x1_16x16x128_intrawave_0x1x0_2,2057.39,0.91202,0.0
gfx950,256,1664,7168,384,ck,9,0,16.4508,a8w8_blockscale_bpreshuffle_1x128x128_256x32x128x128_16x16_16x16_8x32x1_8x32x1_1x32x1x8_8_2x1_intrawave_v1,556.83,1.65625,0.0
gfx950,256,1664,7168,3072,cktile,27,0,49.5209,a8w8_blockscale_cktile_192x256x128_4x2x1_16x16x128_intrawave_0x1x0_2,1479.84,1.02961,0.0
gfx950,256,1664,7168,7168,cktile,27,0,91.9074,a8w8_blockscale_cktile_192x256x128_4x2x1_16x16x128_intrawave_0x1x0_2,1860.5,0.94838,0.0
gfx950,256,1664,7168,16384,cktile,11,0,183.5933,a8w8_blockscale_cktile_192x256x128_4x2x1_16x16x128_intrawave_0x1x0_1,2128.85,0.91811,0.0
gfx950,256,1728,7168,384,ck,9,0,16.71,a8w8_blockscale_bpreshuffle_1x128x128_256x32x128x128_16x16_16x16_8x32x1_8x32x1_1x32x1x8_8_2x1_intrawave_v1,569.28,1.68693,0.0
gfx950,256,1728,7168,3072,cktile,27,0,50.1365,a8w8_blockscale_cktile_192x256x128_4x2x1_16x16x128_intrawave_0x1x0_2,1517.89,1.03919,0.0
gfx950,256,1728,7168,7168,cktile,28,0,91.8376,a8w8_blockscale_cktile_192x256x128_4x2x1_16x16x128_intrawave_0x1x0_3,1933.52,0.96408,0.0
gfx950,256,1728,7168,16384,cktile,29,0,183.7145,a8w8_blockscale_cktile_192x256x128_4x2x1_16x16x128_intrawave_0x1x0_4,2209.27,0.9282,0.0
gfx950,256,1792,7168,384,ck,9,0,17.4433,a8w8_blockscale_bpreshuffle_1x128x128_256x32x128x128_16x16_16x16_8x32x1_8x32x1_1x32x1x8_8_2x1_intrawave_v1,565.55,1.67003,0.0
gfx950,256,1792,7168,3072,ck,13,0,64.0662,a8w8_blockscale_bpreshuffle_1x128x128_256x64x256x128_16x16_16x16_8x32x1_8x32x1_1x32x1x8_8_2x1_intrawave_v1,1231.85,0.83063,0.0
gfx950,256,1792,7168,7168,ck,13,0,127.9586,a8w8_blockscale_bpreshuffle_1x128x128_256x64x256x128_16x16_16x16_8x32x1_8x32x1_1x32x1x8_8_2x1_intrawave_v1,1439.11,0.70269,0.0
gfx950,256,1792,7168,16384,ck,13,0,273.2903,a8w8_blockscale_bpreshuffle_1x128x128_256x64x256x128_16x16_16x16_8x32x1_8x32x1_1x32x1x8_8_2x1_intrawave_v1,1540.15,0.63116,0.0
gfx950,256,1856,7168,384,ck,9,0,17.56,a8w8_blockscale_bpreshuffle_1x128x128_256x32x128x128_16x16_16x16_8x32x1_8x32x1_1x32x1x8_8_2x1_intrawave_v1,581.85,1.71258,0.0
gfx950,256,1856,7168,3072,ck,14,0,65.4214,a8w8_blockscale_bpreshuffle_1x128x128_256x64x128x128_16x16_16x16_8x32x1_8x32x1_1x32x1x8_8_2x1_intrawave_v1,1249.42,0.83045,0.0003
gfx950,256,1856,7168,7168,ck,14,0,138.8947,a8w8_blockscale_bpreshuffle_1x128x128_256x64x128x128_16x16_16x16_8x32x1_8x32x1_1x32x1x8_8_2x1_intrawave_v1,1373.15,0.65727,0.0002
gfx950,256,1856,7168,16384,ck,0,0,283.6719,a8w8_blockscale_bpreshuffle_1x128x128_256x128x128x128_16x16_16x16_8x32x1_8x32x1_1x32x1x8_8_2x1_intrawave_v3,1536.77,0.615,0.0
gfx950,256,1920,7168,384,ck,9,0,18.6074,a8w8_blockscale_bpreshuffle_1x128x128_256x32x128x128_16x16_16x16_8x32x1_8x32x1_1x32x1x8_8_2x1_intrawave_v1,568.03,1.66681,0.0
gfx950,256,1920,7168,3072,ck,13,0,66.0434,a8w8_blockscale_bpreshuffle_1x128x128_256x64x256x128_16x16_16x16_8x32x1_8x32x1_1x32x1x8_8_2x1_intrawave_v1,1280.33,0.8395,0.0
gfx950,256,1920,7168,7168,ck,0,0,137.9438,a8w8_blockscale_bpreshuffle_1x128x128_256x128x128x128_16x16_16x16_8x32x1_8x32x1_1x32x1x8_8_2x1_intrawave_v3,1430.29,0.67178,0.0
gfx950,256,1920,7168,16384,ck,13,0,287.7806,a8w8_blockscale_bpreshuffle_1x128x128_256x64x256x128_16x16_16x16_8x32x1_8x32x1_1x32x1x8_8_2x1_intrawave_v1,1567.07,0.61305,0.0
gfx950,256,1984,7168,384,ck,9,0,19.0684,a8w8_blockscale_bpreshuffle_1x128x128_256x32x128x128_16x16_16x16_8x32x1_8x32x1_1x32x1x8_8_2x1_intrawave_v1,572.78,1.67591,0.0
gfx950,256,1984,7168,3072,ck,13,0,68.9374,a8w8_blockscale_bpreshuffle_1x128x128_256x64x256x128_16x16_16x16_8x32x1_8x32x1_1x32x1x8_8_2x1_intrawave_v1,1267.46,0.82042,0.0
gfx950,256,1984,7168,7168,ck,13,0,137.5165,a8w8_blockscale_bpreshuffle_1x128x128_256x64x256x128_16x16_16x16_8x32x1_8x32x1_1x32x1x8_8_2x1_intrawave_v1,1482.56,0.68388,0.0
gfx950,256,1984,7168,16384,ck,13,0,282.1276,a8w8_blockscale_bpreshuffle_1x128x128_256x64x256x128_16x16_16x16_8x32x1_8x32x1_1x32x1x8_8_2x1_intrawave_v1,1651.75,0.6323,0.0
gfx950,256,2048,7168,384,ck,8,0,20.428,a8w8_blockscale_bpreshuffle_1x128x128_256x32x256x128_16x16_16x16_8x32x1_8x32x1_1x32x1x8_8_2x1_intrawave_v1,551.9,1.61049,0.0
gfx950,256,2048,7168,3072,ck,13,0,68.7097,a8w8_blockscale_bpreshuffle_1x128x128_256x64x256x128_16x16_16x16_8x32x1_8x32x1_1x32x1x8_8_2x1_intrawave_v1,1312.69,0.83935,0.0
gfx950,256,2048,7168,7168,ck,13,0,140.9867,a8w8_blockscale_bpreshuffle_1x128x128_256x64x256x128_16x16_16x16_8x32x1_8x32x1_1x32x1x8_8_2x1_intrawave_v1,1492.72,0.6768,0.0
gfx950,256,2048,7168,16384,ck,0,0,288.9947,a8w8_blockscale_bpreshuffle_1x128x128_256x128x128x128_16x16_16x16_8x32x1_8x32x1_1x32x1x8_8_2x1_intrawave_v3,1664.52,0.62408,0.0
gfx950,256,4096,7168,384,ck,13,0,35.046,a8w8_blockscale_bpreshuffle_1x128x128_256x64x256x128_16x16_16x16_8x32x1_8x32x1_1x32x1x8_8_2x1_intrawave_v1,643.4,1.79894,0.0
gfx950,256,4096,7168,3072,ck,13,0,120.225,a8w8_blockscale_bpreshuffle_1x128x128_256x64x256x128_16x16_16x16_8x32x1_8x32x1_1x32x1x8_8_2x1_intrawave_v1,1500.43,0.77624,0.0
gfx950,256,4096,7168,7168,ck,13,0,235.8502,a8w8_blockscale_bpreshuffle_1x128x128_256x64x256x128_16x16_16x16_8x32x1_8x32x1_1x32x1x8_8_2x1_intrawave_v1,1784.64,0.59131,0.0
gfx950,256,4096,7168,16384,cktile,28,0,516.216,a8w8_blockscale_cktile_192x256x128_4x2x1_16x16x128_intrawave_0x1x0_3,1863.7,0.47126,0.0
gfx950,256,6144,7168,384,ck,14,0,48.1595,a8w8_blockscale_bpreshuffle_1x128x128_256x64x128x128_16x16_16x16_8x32x1_8x32x1_1x32x1x8_8_2x1_intrawave_v1,702.31,1.93507,0.0
gfx950,256,6144,7168,3072,ck,13,0,178.7687,a8w8_blockscale_bpreshuffle_1x128x128_256x64x256x128_16x16_16x16_8x32x1_8x32x1_1x32x1x8_8_2x1_intrawave_v1,1513.59,0.72146,0.0
gfx950,256,6144,7168,7168,cktile,11,0,339.9621,a8w8_blockscale_cktile_192x256x128_4x2x1_16x16x128_intrawave_0x1x0_1,1857.15,0.53977,0.0
gfx950,256,6144,7168,16384,cktile,11,0,700.4577,a8w8_blockscale_cktile_192x256x128_4x2x1_16x16x128_intrawave_0x1x0_1,2060.24,0.43712,0.0
gfx950,256,8192,7168,384,ck,14,0,62.5092,a8w8_blockscale_bpreshuffle_1x128x128_256x64x128x128_16x16_16x16_8x32x1_8x32x1_1x32x1x8_8_2x1_intrawave_v1,721.45,1.97313,0.0
gfx950,256,8192,7168,3072,ck,13,0,217.9024,a8w8_blockscale_bpreshuffle_1x128x128_256x64x256x128_16x16_16x16_8x32x1_8x32x1_1x32x1x8_8_2x1_intrawave_v1,1655.68,0.75551,0.0
gfx950,256,8192,7168,7168,cktile,28,0,424.7753,a8w8_blockscale_cktile_192x256x128_4x2x1_16x16x128_intrawave_0x1x0_3,1981.79,0.53567,0.0
gfx950,256,8192,7168,16384,cktile,29,0,881.6464,a8w8_blockscale_cktile_192x256x128_4x2x1_16x16x128_intrawave_0x1x0_4,2182.45,0.41865,0.0
gfx950,256,10240,7168,384,ck,13,0,75.3559,a8w8_blockscale_bpreshuffle_1x128x128_256x64x256x128_16x16_16x16_8x32x1_8x32x1_1x32x1x8_8_2x1_intrawave_v1,748.07,2.03681,0.0
gfx950,256,10240,7168,3072,ck,13,0,268.5386,a8w8_blockscale_bpreshuffle_1x128x128_256x64x256x128_16x16_16x16_8x32x1_8x32x1_1x32x1x8_8_2x1_intrawave_v1,1679.35,0.74581,0.0
gfx950,256,10240,7168,7168,cktile,27,0,513.3196,a8w8_blockscale_cktile_192x256x128_4x2x1_16x16x128_intrawave_0x1x0_2,2049.93,0.52907,0.0
gfx950,256,10240,7168,16384,cktile,29,0,1072.2898,a8w8_blockscale_cktile_192x256x128_4x2x1_16x16x128_intrawave_0x1x0_4,2243.03,0.40289,0.0
gfx950,256,12288,7168,384,ck,13,0,88.2037,a8w8_blockscale_bpreshuffle_1x128x128_256x64x256x128_16x16_16x16_8x32x1_8x32x1_1x32x1x8_8_2x1_intrawave_v1,766.93,2.08191,0.0
gfx950,256,12288,7168,3072,ck,13,0,316.7107,a8w8_blockscale_bpreshuffle_1x128x128_256x64x256x128_16x16_16x16_8x32x1_8x32x1_1x32x1x8_8_2x1_intrawave_v1,1708.71,0.74494,0.0
gfx950,256,12288,7168,7168,cktile,27,0,601.0522,a8w8_blockscale_cktile_192x256x128_4x2x1_16x16x128_intrawave_0x1x0_2,2100.85,0.52511,0.0
gfx950,256,12288,7168,16384,cktile,27,0,1254.5032,a8w8_blockscale_cktile_192x256x128_4x2x1_16x16x128_intrawave_0x1x0_2,2300.69,0.39452,0.0
gfx950,256,14336,7168,384,ck,13,0,101.9592,a8w8_blockscale_bpreshuffle_1x128x128_256x64x256x128_16x16_16x16_8x32x1_8x32x1_1x32x1x8_8_2x1_intrawave_v1,774.04,2.09671,0.0
gfx950,256,14336,7168,3072,ck,13,0,363.4115,a8w8_blockscale_bpreshuffle_1x128x128_256x64x256x128_16x16_16x16_8x32x1_8x32x1_1x32x1x8_8_2x1_intrawave_v1,1737.31,0.74731,0.0
gfx950,256,14336,7168,7168,cktile,11,0,693.3656,a8w8_blockscale_cktile_192x256x128_4x2x1_16x16x128_intrawave_0x1x0_1,2124.67,0.51872,0.0
gfx950,256,14336,7168,16384,cktile,28,0,1448.6582,a8w8_blockscale_cktile_192x256x128_4x2x1_16x16x128_intrawave_0x1x0_3,2324.4,0.38508,0.0
gfx950,256,16384,7168,384,ck,13,0,114.589,a8w8_blockscale_bpreshuffle_1x128x128_256x64x256x128_16x16_16x16_8x32x1_8x32x1_1x32x1x8_8_2x1_intrawave_v1,787.11,2.12869,0.0
gfx950,256,16384,7168,3072,ck,13,0,403.9253,a8w8_blockscale_bpreshuffle_1x128x128_256x64x256x128_16x16_16x16_8x32x1_8x32x1_1x32x1x8_8_2x1_intrawave_v1,1786.36,0.76062,0.0
gfx950,256,16384,7168,7168,cktile,28,0,782.4701,a8w8_blockscale_cktile_192x256x128_4x2x1_16x16x128_intrawave_0x1x0_3,2151.68,0.51593,0.0
gfx950,256,16384,7168,16384,cktile,11,0,1644.6866,a8w8_blockscale_cktile_192x256x128_4x2x1_16x16x128_intrawave_0x1x0_1,2339.83,0.37743,0.0
gfx950,256,20480,7168,3072,ck,13,0,507.2496,a8w8_blockscale_bpreshuffle_1x128x128_256x64x256x128_16x16_16x16_8x32x1_8x32x1_1x32x1x8_8_2x1_intrawave_v1,1778.11,0.74625,0.0
gfx950,256,20480,7168,7168,cktile,27,0,977.8092,a8w8_blockscale_cktile_192x256x128_4x2x1_16x16x128_intrawave_0x1x0_2,2152.3,0.50294,0.0
gfx950,256,20480,7168,16384,cktile,27,0,2090.2055,a8w8_blockscale_cktile_192x256x128_4x2x1_16x16x128_intrawave_0x1x0_2,2301.38,0.35718,0.0
gfx950,256,24576,7168,3072,cktile,29,0,619.3494,a8w8_blockscale_cktile_192x256x128_4x2x1_16x16x128_intrawave_0x1x0_4,1747.53,0.72631,0.0
gfx950,256,24576,7168,7168,cktile,11,0,1183.2929,a8w8_blockscale_cktile_192x256x128_4x2x1_16x16x128_intrawave_0x1x0_1,2134.25,0.49004,0.0
gfx950,256,24576,7168,16384,cktile,11,0,2519.7634,a8w8_blockscale_cktile_192x256x128_4x2x1_16x16x128_intrawave_0x1x0_1,2290.86,0.34623,0.0
gfx950,256,28672,7168,3072,cktile,28,0,732.4157,a8w8_blockscale_cktile_192x256x128_4x2x1_16x16x128_intrawave_0x1x0_3,1724.05,0.71154,0.0
gfx950,256,28672,7168,7168,cktile,27,0,1374.3422,a8w8_blockscale_cktile_192x256x128_4x2x1_16x16x128_intrawave_0x1x0_2,2143.82,0.48601,0.0
gfx950,256,28672,7168,16384,cktile,28,0,2949.2446,a8w8_blockscale_cktile_192x256x128_4x2x1_16x16x128_intrawave_0x1x0_3,2283.47,0.33847,0.0
gfx950,256,32768,7168,384,ck,13,0,219.0743,a8w8_blockscale_bpreshuffle_1x128x128_256x64x256x128_16x16_16x16_8x32x1_8x32x1_1x32x1x8_8_2x1_intrawave_v1,823.41,2.21431,0.0
gfx950,256,32768,7168,3072,ck,13,0,798.8939,a8w8_blockscale_bpreshuffle_1x128x128_256x64x256x128_16x16_16x16_8x32x1_8x32x1_1x32x1x8_8_2x1_intrawave_v1,1806.38,0.74158,0.0
gfx950,256,32768,7168,7168,cktile,29,0,1546.2136,a8w8_blockscale_cktile_192x256x128_4x2x1_16x16x128_intrawave_0x1x0_4,2177.74,0.48895,0.0
gfx950,256,32768,7168,16384,cktile,11,0,3341.5664,a8w8_blockscale_cktile_192x256x128_4x2x1_16x16x128_intrawave_0x1x0_1,2303.29,0.33639,0.0
gfx950,256,40960,7168,3072,ck,13,0,1004.5016,a8w8_blockscale_bpreshuffle_1x128x128_256x64x256x128_16x16_16x16_8x32x1_8x32x1_1x32x1x8_8_2x1_intrawave_v1,1795.8,0.73176,0.0
gfx950,256,40960,7168,7168,cktile,27,0,1915.2094,a8w8_blockscale_cktile_192x256x128_4x2x1_16x16x128_intrawave_0x1x0_2,2197.71,0.48673,0.0
gfx950,256,40960,7168,16384,cktile,11,0,4182.5138,a8w8_blockscale_cktile_192x256x128_4x2x1_16x16x128_intrawave_0x1x0_1,2300.23,0.32892,0.0
gfx950,256,49152,7168,3072,cktile,11,0,1205.1682,a8w8_blockscale_cktile_192x256x128_4x2x1_16x16x128_intrawave_0x1x0_1,1796.15,0.72825,0.0
gfx950,256,49152,7168,7168,cktile,11,0,2310.8287,a8w8_blockscale_cktile_192x256x128_4x2x1_16x16x128_intrawave_0x1x0_1,2185.74,0.47963,0.0
gfx950,256,49152,7168,16384,cktile,28,0,5061.2319,a8w8_blockscale_cktile_192x256x128_4x2x1_16x16x128_intrawave_0x1x0_3,2281.04,0.32154,0.0
gfx950,256,57344,7168,3072,ck,13,0,1394.5495,a8w8_blockscale_bpreshuffle_1x128x128_256x64x256x128_16x16_16x16_8x32x1_8x32x1_1x32x1x8_8_2x1_intrawave_v1,1810.94,0.73161,0.0
gfx950,256,57344,7168,7168,cktile,29,0,2679.8626,a8w8_blockscale_cktile_192x256x128_4x2x1_16x16x128_intrawave_0x1x0_4,2198.88,0.47932,0.0
gfx950,256,57344,7168,16384,cktile,11,0,5898.9638,a8w8_blockscale_cktile_192x256x128_4x2x1_16x16x128_intrawave_0x1x0_1,2283.29,0.31854,0.0
gfx950,256,65536,7168,3072,cktile,29,0,1590.6561,a8w8_blockscale_cktile_192x256x128_4x2x1_16x16x128_intrawave_0x1x0_4,1814.48,0.73106,0.0
gfx950,256,65536,7168,7168,cktile,11,0,3042.0038,a8w8_blockscale_cktile_192x256x128_4x2x1_16x16x128_intrawave_0x1x0_1,2213.84,0.48017,0.0
gfx950,256,65536,7168,16384,cktile,11,0,6861.8887,a8w8_blockscale_cktile_192x256x128_4x2x1_16x16x128_intrawave_0x1x0_1,2243.28,0.31051,0.0
gfx950,256,1,65536,1536,triton,0,0,15.1533,triton,13.29,6.65,0.0
gfx950,256,2,65536,1536,triton,0,0,14.9805,triton,26.88,6.74,0.0
gfx950,256,4,65536,1536,triton,0,0,15.855,triton,50.79,6.38,0.0
gfx950,256,8,65536,1536,triton,0,0,16.0049,triton,100.63,6.36,0.0
gfx950,256,16,65536,1536,ck,6,0,18.7797,a8w8_blockscale_bpreshuffle_1x128x128_256x16x128x256_16x16_16x16_16x16x1_16x16x1_1x16x1x16_8_1x2_intrawave_v1,171.53,5.4732,0.0
gfx950,256,32,65536,1536,ck,11,0,19.6744,a8w8_blockscale_bpreshuffle_1x128x128_256x32x128x256_16x16_16x16_16x16x1_16x16x1_1x32x1x8_8_2x1_intrawave_v1,327.45,5.33214,0.0
gfx950,256,48,65536,1536,ck,1,0,22.5881,a8w8_blockscale_bpreshuffle_1x128x128_256x64x128x128_16x16_16x16_8x32x1_8x32x1_1x32x1x8_8_2x1_intrawave_v3,427.82,4.73827,0.0
gfx950,256,64,65536,1536,ck,1,0,23.2278,a8w8_blockscale_bpreshuffle_1x128x128_256x64x128x128_16x16_16x16_8x32x1_8x32x1_1x32x1x8_8_2x1_intrawave_v3,554.72,4.69912,0.0
gfx950,256,80,65536,1536,asm,15,1,27.1551,_ZN5aiter42fp8gemm_bf16_blockscale_BpreShuffle_80x128E,593.12,4.09764,0.0
gfx950,256,96,65536,1536,ck,13,0,28.6977,a8w8_blockscale_bpreshuffle_1x128x128_256x64x256x128_16x16_16x16_8x32x1_8x32x1_1x32x1x8_8_2x1_intrawave_v1,673.48,3.95132,0.0
gfx950,256,112,65536,1536,ck,13,0,29.2416,a8w8_blockscale_bpreshuffle_1x128x128_256x64x256x128_16x16_16x16_8x32x1_8x32x1_1x32x1x8_8_2x1_intrawave_v1,771.11,3.95038,0.0
gfx950,256,128,65536,1536,ck,13,0,29.2925,a8w8_blockscale_bpreshuffle_1x128x128_256x64x256x128_16x16_16x16_8x32x1_8x32x1_1x32x1x8_8_2x1_intrawave_v1,879.74,4.01595,0.0
gfx950,256,144,65536,1536,cktile,27,0,37.8192,a8w8_blockscale_cktile_192x256x128_4x2x1_16x16x128_intrawave_0x1x0_2,766.57,3.16662,0.0
gfx950,256,160,65536,1536,ck,13,0,38.6723,a8w8_blockscale_bpreshuffle_1x128x128_256x64x256x128_16x16_16x16_8x32x1_8x32x1_1x32x1x8_8_2x1_intrawave_v1,832.95,3.15162,0.0
gfx950,256,176,65536,1536,cktile,29,0,38.8504,a8w8_blockscale_cktile_192x256x128_4x2x1_16x16x128_intrawave_0x1x0_4,912.05,3.19179,0.0
gfx950,256,192,65536,1536,cktile,27,0,39.5712,a8w8_blockscale_cktile_192x256x128_4x2x1_16x16x128_intrawave_0x1x0_2,976.84,3.18727,0.0
gfx950,256,208,65536,1536,ck,13,0,45.9437,a8w8_blockscale_bpreshuffle_1x128x128_256x64x256x128_16x16_16x16_8x32x1_8x32x1_1x32x1x8_8_2x1_intrawave_v1,911.46,2.79137,0.0
gfx950,256,224,65536,1536,ck,13,0,46.3055,a8w8_blockscale_bpreshuffle_1x128x128_256x64x256x128_16x16_16x16_8x32x1_8x32x1_1x32x1x8_8_2x1_intrawave_v1,973.9,2.81538,0.0
gfx950,256,240,65536,1536,ck,13,0,47.3996,a8w8_blockscale_bpreshuffle_1x128x128_256x64x256x128_16x16_16x16_8x32x1_8x32x1_1x32x1x8_8_2x1_intrawave_v1,1019.38,2.79515,0.0
gfx950,256,256,65536,1536,ck,13,0,48.1176,a8w8_blockscale_bpreshuffle_1x128x128_256x64x256x128_16x16_16x16_8x32x1_8x32x1_1x32x1x8_8_2x1_intrawave_v1,1071.12,2.79754,0.0
gfx950,256,288,65536,1536,ck,13,0,62.6117,a8w8_blockscale_bpreshuffle_1x128x128_256x64x256x128_16x16_16x16_8x32x1_8x32x1_1x32x1x8_8_2x1_intrawave_v1,926.06,2.21771,0.0
gfx950,256,320,65536,1536,ck,13,0,63.4152,a8w8_blockscale_bpreshuffle_1x128x128_256x64x256x128_16x16_16x16_8x32x1_8x32x1_1x32x1x8_8_2x1_intrawave_v1,1015.92,2.25652,0.0
gfx950,256,352,65536,1536,ck,13,0,65.9397,a8w8_blockscale_bpreshuffle_1x128x128_256x64x256x128_16x16_16x16_8x32x1_8x32x1_1x32x1x8_8_2x1_intrawave_v1,1074.72,2.23449,0.0
gfx950,256,384,65536,1536,ck,13,0,67.7869,a8w8_blockscale_bpreshuffle_1x128x128_256x64x256x128_16x16_16x16_8x32x1_8x32x1_1x32x1x8_8_2x1_intrawave_v1,1140.48,2.2362,0.0
gfx950,256,416,65536,1536,ck,13,0,76.6538,a8w8_blockscale_bpreshuffle_1x128x128_256x64x256x128_16x16_16x16_8x32x1_8x32x1_1x32x1x8_8_2x1_intrawave_v1,1092.6,2.03288,0.0
gfx950,256,448,65536,1536,ck,13,0,77.5902,a8w8_blockscale_bpreshuffle_1x128x128_256x64x256x128_16x16_16x16_8x32x1_8x32x1_1x32x1x8_8_2x1_intrawave_v1,1162.44,2.06304,0.0
gfx950,256,480,65536,1536,ck,13,0,83.7332,a8w8_blockscale_bpreshuffle_1x128x128_256x64x256x128_16x16_16x16_8x32x1_8x32x1_1x32x1x8_8_2x1_intrawave_v1,1154.1,1.96237,0.0
gfx950,256,512,65536,1536,ck,13,0,85.239,a8w8_blockscale_bpreshuffle_1x128x128_256x64x256x128_16x16_16x16_8x32x1_8x32x1_1x32x1x8_8_2x1_intrawave_v1,1209.3,1.97748,0.0
gfx950,256,544,65536,1536,ck,13,0,96.6316,a8w8_blockscale_bpreshuffle_1x128x128_256x64x256x128_16x16_16x16_8x32x1_8x32x1_1x32x1x8_8_2x1_intrawave_v1,1133.39,1.78826,0.0
gfx950,256,576,65536,1536,ck,13,0,99.5671,a8w8_blockscale_bpreshuffle_1x128x128_256x64x256x128_16x16_16x16_8x32x1_8x32x1_1x32x1x8_8_2x1_intrawave_v1,1164.68,1.77815,0.0
gfx950,256,608,65536,1536,ck,13,0,102.9427,a8w8_blockscale_bpreshuffle_1x128x128_256x64x256x128_16x16_16x16_8x32x1_8x32x1_1x32x1x8_8_2x1_intrawave_v1,1189.07,1.76107,0.0
gfx950,256,640,65536,1536,ck,13,0,107.4219,a8w8_blockscale_bpreshuffle_1x128x128_256x64x256x128_16x16_16x16_8x32x1_8x32x1_1x32x1x8_8_2x1_intrawave_v1,1199.47,1.72714,0.0
gfx950,256,672,65536,1536,ck,13,0,114.1332,a8w8_blockscale_bpreshuffle_1x128x128_256x64x256x128_16x16_16x16_8x32x1_8x32x1_1x32x1x8_8_2x1_intrawave_v1,1185.38,1.66276,0.0
gfx950,256,704,65536,1536,ck,13,0,113.2512,a8w8_blockscale_bpreshuffle_1x128x128_256x64x256x128_16x16_16x16_8x32x1_8x32x1_1x32x1x8_8_2x1_intrawave_v1,1251.5,1.71318,0.0
gfx950,256,736,65536,1536,ck,13,0,113.275,a8w8_blockscale_bpreshuffle_1x128x128_256x64x256x128_16x16_16x16_8x32x1_8x32x1_1x32x1x8_8_2x1_intrawave_v1,1308.11,1.75028,0.0
gfx950,256,768,65536,1536,ck,13,0,113.7736,a8w8_blockscale_bpreshuffle_1x128x128_256x64x256x128_16x16_16x16_8x32x1_8x32x1_1x32x1x8_8_2x1_intrawave_v1,1359.0,1.77991,0.0
gfx950,256,800,65536,1536,ck,13,0,133.2173,a8w8_blockscale_bpreshuffle_1x128x128_256x64x256x128_16x16_16x16_8x32x1_8x32x1_1x32x1x8_8_2x1_intrawave_v1,1209.01,1.55197,0.0
gfx950,256,832,65536,1536,ck,13,0,136.4445,a8w8_blockscale_bpreshuffle_1x128x128_256x64x256x128_16x16_16x16_8x32x1_8x32x1_1x32x1x8_8_2x1_intrawave_v1,1227.63,1.54637,0.0
gfx950,256,864,65536,1536,ck,13,0,133.2341,a8w8_blockscale_bpreshuffle_1x128x128_256x64x256x128_16x16_16x16_8x32x1_8x32x1_1x32x1x8_8_2x1_intrawave_v1,1305.57,1.61548,0.0
gfx950,256,896,65536,1536,ck,13,0,136.8969,a8w8_blockscale_bpreshuffle_1x128x128_256x64x256x128_16x16_16x16_8x32x1_8x32x1_1x32x1x8_8_2x1_intrawave_v1,1317.7,1.60325,0.0
gfx950,256,928,65536,1536,ck,13,0,150.2074,a8w8_blockscale_bpreshuffle_1x128x128_256x64x256x128_16x16_16x16_8x32x1_8x32x1_1x32x1x8_8_2x1_intrawave_v1,1243.82,1.48943,0.0
gfx950,256,960,65536,1536,ck,13,0,151.3766,a8w8_blockscale_bpreshuffle_1x128x128_256x64x256x128_16x16_16x16_8x32x1_8x32x1_1x32x1x8_8_2x1_intrawave_v1,1276.77,1.50596,0.0
gfx950,256,992,65536,1536,ck,13,0,163.1771,a8w8_blockscale_bpreshuffle_1x128x128_256x64x256x128_16x16_16x16_8x32x1_8x32x1_1x32x1x8_8_2x1_intrawave_v1,1223.92,1.42306,0.0
gfx950,256,1024,65536,1536,ck,13,0,165.9951,a8w8_blockscale_bpreshuffle_1x128x128_256x64x256x128_16x16_16x16_8x32x1_8x32x1_1x32x1x8_8_2x1_intrawave_v1,1241.95,1.42446,0.0
gfx950,256,1088,65536,1536,ck,13,0,182.0016,a8w8_blockscale_bpreshuffle_1x128x128_256x64x256x128_16x16_16x16_8x32x1_8x32x1_1x32x1x8_8_2x1_intrawave_v1,1203.52,1.34582,0.0
gfx950,256,1152,65536,1536,ck,13,0,162.6169,a8w8_blockscale_bpreshuffle_1x128x128_256x64x256x128_16x16_16x16_8x32x1_8x32x1_1x32x1x8_8_2x1_intrawave_v1,1426.22,1.55843,0.0
gfx950,256,1216,65536,1536,ck,13,0,176.0535,a8w8_blockscale_bpreshuffle_1x128x128_256x64x256x128_16x16_16x16_8x32x1_8x32x1_1x32x1x8_8_2x1_intrawave_v1,1390.56,1.4877,0.0
gfx950,256,1280,65536,1536,ck,13,0,180.0387,a8w8_blockscale_bpreshuffle_1x128x128_256x64x256x128_16x16_16x16_8x32x1_8x32x1_1x32x1x8_8_2x1_intrawave_v1,1431.35,1.50191,0.0
gfx950,256,1344,65536,1536,ck,13,0,201.4057,a8w8_blockscale_bpreshuffle_1x128x128_256x64x256x128_16x16_16x16_8x32x1_8x32x1_1x32x1x8_8_2x1_intrawave_v1,1343.47,1.38471,0.0
gfx950,256,1408,65536,1536,ck,13,0,201.7593,a8w8_blockscale_bpreshuffle_1x128x128_256x64x256x128_16x16_16x16_8x32x1_8x32x1_1x32x1x8_8_2x1_intrawave_v1,1404.98,1.42435,0.0
gfx950,256,1472,65536,1536,ck,13,0,208.785,a8w8_blockscale_bpreshuffle_1x128x128_256x64x256x128_16x16_16x16_8x32x1_8x32x1_1x32x1x8_8_2x1_intrawave_v1,1419.42,1.41707,0.0
gfx950,256,1536,65536,1536,ck,13,0,211.5295,a8w8_blockscale_bpreshuffle_1x128x128_256x64x256x128_16x16_16x16_8x32x1_8x32x1_1x32x1x8_8_2x1_intrawave_v1,1461.91,1.4388,0.0
gfx950,256,1600,65536,1536,ck,13,0,226.4383,a8w8_blockscale_bpreshuffle_1x128x128_256x64x256x128_16x16_16x16_8x32x1_8x32x1_1x32x1x8_8_2x1_intrawave_v1,1422.56,1.38155,0.0
gfx950,256,1664,65536,1536,ck,13,0,227.4956,a8w8_blockscale_bpreshuffle_1x128x128_256x64x256x128_16x16_16x16_8x32x1_8x32x1_1x32x1x8_8_2x1_intrawave_v1,1472.59,1.41244,0.0
gfx950,256,1728,65536,1536,ck,13,0,235.3912,a8w8_blockscale_bpreshuffle_1x128x128_256x64x256x128_16x16_16x16_8x32x1_8x32x1_1x32x1x8_8_2x1_intrawave_v1,1477.93,1.40111,0.0
gfx950,256,1792,65536,1536,ck,13,0,245.9946,a8w8_blockscale_bpreshuffle_1x128x128_256x64x256x128_16x16_16x16_8x32x1_8x32x1_1x32x1x8_8_2x1_intrawave_v1,1466.61,1.37522,0.0
gfx950,256,1856,65536,1536,ck,13,0,263.9332,a8w8_blockscale_bpreshuffle_1x128x128_256x64x256x128_16x16_16x16_8x32x1_8x32x1_1x32x1x8_8_2x1_intrawave_v1,1415.75,1.31391,0.0
gfx950,256,1920,65536,1536,ck,13,0,278.5861,a8w8_blockscale_bpreshuffle_1x128x128_256x64x256x128_16x16_16x16_8x32x1_8x32x1_1x32x1x8_8_2x1_intrawave_v1,1387.53,1.27526,0.0
gfx950,256,1984,65536,1536,ck,13,0,286.1291,a8w8_blockscale_bpreshuffle_1x128x128_256x64x256x128_16x16_16x16_8x32x1_8x32x1_1x32x1x8_8_2x1_intrawave_v1,1395.99,1.27131,0.0
gfx950,256,2048,65536,1536,ck,13,0,329.7442,a8w8_blockscale_bpreshuffle_1x128x128_256x64x256x128_16x16_16x16_8x32x1_8x32x1_1x32x1x8_8_2x1_intrawave_v1,1250.41,1.12889,0.0
gfx950,256,4096,65536,1536,ck,13,0,629.476,a8w8_blockscale_bpreshuffle_1x128x128_256x64x256x128_16x16_16x16_8x32x1_8x32x1_1x32x1x8_8_2x1_intrawave_v1,1310.03,1.0228,0.0
gfx950,256,6144,65536,1536,ck,13,0,897.5112,a8w8_blockscale_bpreshuffle_1x128x128_256x64x256x128_16x16_16x16_8x32x1_8x32x1_1x32x1x8_8_2x1_intrawave_v1,1378.2,1.01994,0.0
gfx950,256,8192,65536,1536,ck,13,0,1209.3381,a8w8_blockscale_bpreshuffle_1x128x128_256x64x256x128_16x16_16x16_8x32x1_8x32x1_1x32x1x8_8_2x1_intrawave_v1,1363.78,0.98152,0.0
gfx950,256,10240,65536,1536,ck,13,0,1489.8037,a8w8_blockscale_bpreshuffle_1x128x128_256x64x256x128_16x16_16x16_8x32x1_8x32x1_1x32x1x8_8_2x1_intrawave_v1,1383.8,0.97903,0.0
gfx950,256,12288,65536,1536,ck,13,0,1779.6911,a8w8_blockscale_bpreshuffle_1x128x128_256x64x256x128_16x16_16x16_8x32x1_8x32x1_1x32x1x8_8_2x1_intrawave_v1,1390.07,0.97216,0.0
gfx950,256,14336,65536,1536,ck,13,0,2073.5881,a8w8_blockscale_bpreshuffle_1x128x128_256x64x256x128_16x16_16x16_8x32x1_8x32x1_1x32x1x8_8_2x1_intrawave_v1,1391.9,0.96535,0.0
gfx950,256,16384,65536,1536,ck,13,0,2346.8341,a8w8_blockscale_bpreshuffle_1x128x128_256x64x256x128_16x16_16x16_8x32x1_8x32x1_1x32x1x8_8_2x1_intrawave_v1,1405.53,0.96867,0.0
gfx950,256,20480,65536,1536,ck,13,0,2945.765,a8w8_blockscale_bpreshuffle_1x128x128_256x64x256x128_16x16_16x16_8x32x1_8x32x1_1x32x1x8_8_2x1_intrawave_v1,1399.69,0.95611,0.0
gfx950,256,24576,65536,1536,ck,13,0,3539.3591,a8w8_blockscale_bpreshuffle_1x128x128_256x64x256x128_16x16_16x16_8x32x1_8x32x1_1x32x1x8_8_2x1_intrawave_v1,1397.94,0.94922,0.0
gfx950,256,28672,65536,1536,ck,13,0,4134.3781,a8w8_blockscale_bpreshuffle_1x128x128_256x64x256x128_16x16_16x16_8x32x1_8x32x1_1x32x1x8_8_2x1_intrawave_v1,1396.2,0.94399,0.0
gfx950,256,32768,65536,1536,asm,25,1,6555.4539,_ZN5aiter43fp8gemm_bf16_blockscale_BpreShuffle_128x128E,1006.35,0.67821,0.0
gfx950,256,40960,65536,1536,asm,25,1,8297.9034,_ZN5aiter43fp8gemm_bf16_blockscale_BpreShuffle_128x128E,993.79,0.66671,0.0
gfx950,256,49152,65536,1536,asm,25,1,9802.4377,_ZN5aiter43fp8gemm_bf16_blockscale_BpreShuffle_128x128E,1009.5,0.6752,0.0
gfx950,256,57344,65536,1536,asm,25,1,11610.4829,_ZN5aiter43fp8gemm_bf16_blockscale_BpreShuffle_128x128E,994.35,0.66362,0.0
gfx950,256,65536,65536,1536,asm,25,1,13048.6293,_ZN5aiter43fp8gemm_bf16_blockscale_BpreShuffle_128x128E,1011.15,0.67373,0.0
gfx950,256,1,16384,1536,triton,0,0,5.3326,triton,9.44,4.73,0.0
gfx950,256,2,16384,1536,ck,7,0,7.7995,a8w8_blockscale_bpreshuffle_1x128x128_256x16x64x256_16x16_16x16_16x16x1_16x16x1_1x16x1x16_4_1x1_intrawave_v1,12.91,3235.39,0.0
gfx950,256,4,16384,1536,triton,0,0,5.2574,triton,38.29,4.81,0.0
gfx950,256,8,16384,1536,triton,0,0,5.9758,triton,67.38,4.26,0.0
gfx950,256,16,16384,1536,triton,0,0,5.8646,triton,137.32,4.38,0.0
gfx950,256,32,16384,1536,ck,7,0,8.0692,a8w8_blockscale_bpreshuffle_1x128x128_256x16x64x256_16x16_16x16_16x16x1_16x16x1_1x16x1x16_4_1x1_intrawave_v1,199.6,3254.79,0.0
gfx950,256,48,16384,1536,ck,17,0,9.3578,a8w8_blockscale_bpreshuffle_1x128x128_256x64x64x256_16x16_16x16_16x16x1_16x16x1_1x32x1x8_8_2x1_intrawave_v1,258.17,2865.25,0.0
gfx950,256,64,16384,1536,ck,12,0,9.3526,a8w8_blockscale_bpreshuffle_1x128x128_256x32x64x256_16x16_16x16_16x16x1_16x16x1_1x32x1x8_8_2x1_intrawave_v1,344.42,2925.53,0.0
gfx950,256,112,16384,1536,ck,17,0,11.5661,a8w8_blockscale_bpreshuffle_1x128x128_256x64x64x256_16x16_16x16_16x16x1_16x16x1_1x32x1x8_8_2x1_intrawave_v1,487.39,2508.01,0.0
gfx950,256,128,16384,1536,ck,17,0,11.6817,a8w8_blockscale_bpreshuffle_1x128x128_256x64x64x256_16x16_16x16_16x16x1_16x16x1_1x32x1x8_8_2x1_intrawave_v1,551.5,2530.17,0.0
gfx950,256,144,16384,1536,asm,3,1,12.636,_ZN5aiter42fp8gemm_bf16_blockscale_BpreShuffle_80x128E,573.58,2382.53,0.0
gfx950,256,160,16384,1536,asm,3,1,12.933,_ZN5aiter42fp8gemm_bf16_blockscale_BpreShuffle_80x128E,622.68,2370.25,0.0
gfx950,256,176,16384,1536,asm,4,1,13.3199,_ZN5aiter42fp8gemm_bf16_blockscale_BpreShuffle_96x128E,665.05,2342.61,0.0
gfx950,256,192,16384,1536,asm,4,1,13.3881,_ZN5aiter42fp8gemm_bf16_blockscale_BpreShuffle_96x128E,721.81,2371.67,0.0
gfx950,256,208,16384,1536,ck,14,0,15.3122,a8w8_blockscale_bpreshuffle_1x128x128_256x64x128x128_16x16_16x16_8x32x1_8x32x1_1x32x1x8_8_2x1_intrawave_v1,683.7,2109.5,0.0
gfx950,256,240,16384,1536,ck,14,0,15.8521,a8w8_blockscale_bpreshuffle_1x128x128_256x64x128x128_16x16_16x16_8x32x1_8x32x1_1x32x1x8_8_2x1_intrawave_v1,762.02,2106.9,0.0
gfx950,256,288,16384,1536,ck,14,0,20.2636,a8w8_blockscale_bpreshuffle_1x128x128_256x64x128x128_16x16_16x16_8x32x1_8x32x1_1x32x1x8_8_2x1_intrawave_v1,715.35,1729.47,0.0002
gfx950,256,352,16384,1536,ck,14,0,20.8953,a8w8_blockscale_bpreshuffle_1x128x128_256x64x128x128_16x16_16x16_8x32x1_8x32x1_1x32x1x8_8_2x1_intrawave_v1,847.88,1782.26,0.0002
gfx950,256,384,16384,1536,ck,14,0,21.5591,a8w8_blockscale_bpreshuffle_1x128x128_256x64x128x128_16x16_16x16_8x32x1_8x32x1_1x32x1x8_8_2x1_intrawave_v1,896.48,1778.3,0.0002
gfx950,256,416,16384,1536,ck,13,0,24.3787,a8w8_blockscale_bpreshuffle_1x128x128_256x64x256x128_16x16_16x16_8x32x1_8x32x1_1x32x1x8_8_2x1_intrawave_v1,858.86,1617.65,0.0
gfx950,256,448,16384,1536,ck,13,0,24.3187,a8w8_blockscale_bpreshuffle_1x128x128_256x64x256x128_16x16_16x16_8x32x1_8x32x1_1x32x1x8_8_2x1_intrawave_v1,927.21,1666.78,0.0
gfx950,256,480,16384,1536,ck,13,0,24.3916,a8w8_blockscale_bpreshuffle_1x128x128_256x64x256x128_16x16_16x16_8x32x1_8x32x1_1x32x1x8_8_2x1_intrawave_v1,990.47,1706.81,0.0
gfx950,256,512,16384,1536,ck,13,0,24.378,a8w8_blockscale_bpreshuffle_1x128x128_256x64x256x128_16x16_16x16_8x32x1_8x32x1_1x32x1x8_8_2x1_intrawave_v1,1057.09,1752.79,0.0
gfx950,256,544,16384,1536,ck,14,0,29.7753,a8w8_blockscale_bpreshuffle_1x128x128_256x64x128x128_16x16_16x16_8x32x1_8x32x1_1x32x1x8_8_2x1_intrawave_v1,919.57,1471.93,0.0002
gfx950,256,576,16384,1536,ck,14,0,30.7591,a8w8_blockscale_bpreshuffle_1x128x128_256x64x128x128_16x16_16x16_8x32x1_8x32x1_1x32x1x8_8_2x1_intrawave_v1,942.52,1460.54,0.0002
gfx950,256,608,16384,1536,ck,13,0,31.8658,a8w8_blockscale_bpreshuffle_1x128x128_256x64x256x128_16x16_16x16_8x32x1_8x32x1_1x32x1x8_8_2x1_intrawave_v1,960.33,1444.26,0.0
gfx950,256,640,16384,1536,cktile,28,0,32.277,a8w8_blockscale_cktile_192x256x128_4x2x1_16x16x128_intrawave_0x1x0_3,997.99,1459.87,0.0
gfx950,256,672,16384,1536,cktile,29,0,32.5487,a8w8_blockscale_cktile_192x256x128_4x2x1_16x16x128_intrawave_0x1x0_4,1039.15,1481.41,0.0
gfx950,256,704,16384,1536,cktile,28,0,32.4783,a8w8_blockscale_cktile_192x256x128_4x2x1_16x16x128_intrawave_0x1x0_3,1090.99,1518.42,0.0
gfx950,256,736,16384,1536,cktile,27,0,32.6278,a8w8_blockscale_cktile_192x256x128_4x2x1_16x16x128_intrawave_0x1x0_2,1135.35,1545.11,0.0
gfx950,256,768,16384,1536,cktile,11,0,32.7015,a8w8_blockscale_cktile_192x256x128_4x2x1_16x16x128_intrawave_0x1x0_1,1182.05,1575.2,0.0
gfx950,256,800,16384,1536,ck,14,0,41.0136,a8w8_blockscale_bpreshuffle_1x128x128_256x64x128x128_16x16_16x16_8x32x1_8x32x1_1x32x1x8_8_2x1_intrawave_v1,981.76,1282.72,0.0002
gfx950,256,832,16384,1536,ck,14,0,40.8596,a8w8_blockscale_bpreshuffle_1x128x128_256x64x128x128_16x16_16x16_8x32x1_8x32x1_1x32x1x8_8_2x1_intrawave_v1,1024.87,1314.42,0.0002
gfx950,256,864,16384,1536,ck,13,0,41.8664,a8w8_blockscale_bpreshuffle_1x128x128_256x64x256x128_16x16_16x16_8x32x1_8x32x1_1x32x1x8_8_2x1_intrawave_v1,1038.7,1309.03,0.0
gfx950,256,896,16384,1536,ck,13,0,41.894,a8w8_blockscale_bpreshuffle_1x128x128_256x64x256x128_16x16_16x16_8x32x1_8x32x1_1x32x1x8_8_2x1_intrawave_v1,1076.46,1334.37,0.0
gfx950,256,928,16384,1536,ck,13,0,43.8328,a8w8_blockscale_bpreshuffle_1x128x128_256x64x256x128_16x16_16x16_8x32x1_8x32x1_1x32x1x8_8_2x1_intrawave_v1,1065.59,1300.39,0.0
gfx950,256,960,16384,1536,ck,13,0,44.0133,a8w8_blockscale_bpreshuffle_1x128x128_256x64x256x128_16x16_16x16_8x32x1_8x32x1_1x32x1x8_8_2x1_intrawave_v1,1097.81,1320.0,0.0
gfx950,256,992,16384,1536,ck,13,0,45.6396,a8w8_blockscale_bpreshuffle_1x128x128_256x64x256x128_16x16_16x16_8x32x1_8x32x1_1x32x1x8_8_2x1_intrawave_v1,1093.98,1297.02,0.0
gfx950,256,1024,16384,1536,ck,13,0,45.9016,a8w8_blockscale_bpreshuffle_1x128x128_256x64x256x128_16x16_16x16_8x32x1_8x32x1_1x32x1x8_8_2x1_intrawave_v1,1122.83,1313.53,0.0
gfx950,256,1088,16384,1536,ck,14,0,52.609,a8w8_blockscale_bpreshuffle_1x128x128_256x64x128x128_16x16_16x16_8x32x1_8x32x1_1x32x1x8_8_2x1_intrawave_v1,1040.9,1187.79,0.0002
gfx950,256,1152,16384,1536,ck,13,0,50.792,a8w8_blockscale_bpreshuffle_1x128x128_256x64x256x128_16x16_16x16_8x32x1_8x32x1_1x32x1x8_8_2x1_intrawave_v1,1141.56,1273.51,0.0
gfx950,256,1216,16384,1536,ck,13,0,51.3704,a8w8_blockscale_bpreshuffle_1x128x128_256x64x256x128_16x16_16x16_8x32x1_8x32x1_1x32x1x8_8_2x1_intrawave_v1,1191.41,1301.91,0.0
gfx950,256,1280,16384,1536,ck,13,0,52.3368,a8w8_blockscale_bpreshuffle_1x128x128_256x64x256x128_16x16_16x16_8x32x1_8x32x1_1x32x1x8_8_2x1_intrawave_v1,1230.96,1319.82,0.0
gfx950,256,1344,16384,1536,ck,13,0,59.4049,a8w8_blockscale_bpreshuffle_1x128x128_256x64x256x128_16x16_16x16_8x32x1_8x32x1_1x32x1x8_8_2x1_intrawave_v1,1138.72,1199.74,0.0
gfx950,256,1408,16384,1536,ck,13,0,59.0425,a8w8_blockscale_bpreshuffle_1x128x128_256x64x256x128_16x16_16x16_8x32x1_8x32x1_1x32x1x8_8_2x1_intrawave_v1,1200.27,1244.29,0.0
gfx950,256,1472,16384,1536,ck,13,0,60.5053,a8w8_blockscale_bpreshuffle_1x128x128_256x64x256x128_16x16_16x16_8x32x1_8x32x1_1x32x1x8_8_2x1_intrawave_v1,1224.49,1250.49,0.0
gfx950,256,1536,16384,1536,ck,13,0,60.8237,a8w8_blockscale_bpreshuffle_1x128x128_256x64x256x128_16x16_16x16_8x32x1_8x32x1_1x32x1x8_8_2x1_intrawave_v1,1271.04,1280.04,0.0
gfx950,256,1600,16384,1536,ck,13,0,67.0545,a8w8_blockscale_bpreshuffle_1x128x128_256x64x256x128_16x16_16x16_8x32x1_8x32x1_1x32x1x8_8_2x1_intrawave_v1,1200.97,1193.84,0.0
gfx950,256,1664,16384,1536,ck,13,0,70.8589,a8w8_blockscale_bpreshuffle_1x128x128_256x64x256x128_16x16_16x16_8x32x1_8x32x1_1x32x1x8_8_2x1_intrawave_v1,1181.95,1160.72,0.0
gfx950,256,1728,16384,1536,ck,13,0,68.6741,a8w8_blockscale_bpreshuffle_1x128x128_256x64x256x128_16x16_16x16_8x32x1_8x32x1_1x32x1x8_8_2x1_intrawave_v1,1266.46,1229.62,0.0
gfx950,256,1792,16384,1536,ck,13,0,72.5701,a8w8_blockscale_bpreshuffle_1x128x128_256x64x256x128_16x16_16x16_8x32x1_8x32x1_1x32x1x8_8_2x1_intrawave_v1,1242.86,1193.86,0.0
gfx950,256,1856,16384,1536,ck,13,0,77.0142,a8w8_blockscale_bpreshuffle_1x128x128_256x64x256x128_16x16_16x16_8x32x1_8x32x1_1x32x1x8_8_2x1_intrawave_v1,1212.97,1153.48,0.0
gfx950,256,1920,16384,1536,ck,13,0,78.7266,a8w8_blockscale_bpreshuffle_1x128x128_256x64x256x128_16x16_16x16_8x32x1_8x32x1_1x32x1x8_8_2x1_intrawave_v1,1227.5,1156.27,0.0
gfx950,256,1984,16384,1536,ck,13,0,81.509,a8w8_blockscale_bpreshuffle_1x128x128_256x64x256x128_16x16_16x16_8x32x1_8x32x1_1x32x1x8_8_2x1_intrawave_v1,1225.12,1143.74,0.0
gfx950,256,2048,16384,1536,ck,13,0,86.4358,a8w8_blockscale_bpreshuffle_1x128x128_256x64x256x128_16x16_16x16_8x32x1_8x32x1_1x32x1x8_8_2x1_intrawave_v1,1192.55,1103.95,0.0
gfx950,256,4096,16384,1536,ck,13,0,152.6885,a8w8_blockscale_bpreshuffle_1x128x128_256x64x256x128_16x16_16x16_8x32x1_8x32x1_1x32x1x8_8_2x1_intrawave_v1,1350.19,1085.05,0.0
gfx950,256,6144,16384,1536,ck,13,0,217.7308,a8w8_blockscale_bpreshuffle_1x128x128_256x64x256x128_16x16_16x16_8x32x1_8x32x1_1x32x1x8_8_2x1_intrawave_v1,1420.28,1083.58,0.0
gfx950,256,8192,16384,1536,ck,13,0,270.9851,a8w8_blockscale_bpreshuffle_1x128x128_256x64x256x128_16x16_16x16_8x32x1_8x32x1_1x32x1x8_8_2x1_intrawave_v1,1521.55,1129.89,0.0
gfx950,256,10240,16384,1536,ck,13,0,336.1288,a8w8_blockscale_bpreshuffle_1x128x128_256x64x256x128_16x16_16x16_8x32x1_8x32x1_1x32x1x8_8_2x1_intrawave_v1,1533.33,1119.92,0.0
gfx950,256,12288,16384,1536,ck,13,0,414.6855,a8w8_blockscale_bpreshuffle_1x128x128_256x64x256x128_16x16_16x16_8x32x1_8x32x1_1x32x1x8_8_2x1_intrawave_v1,1491.43,1077.19,0.0
gfx950,256,14336,16384,1536,ck,13,0,458.0437,a8w8_blockscale_bpreshuffle_1x128x128_256x64x256x128_16x16_16x16_8x32x1_8x32x1_1x32x1x8_8_2x1_intrawave_v1,1575.3,1128.6,0.0
gfx950,256,16384,16384,1536,ck,13,0,519.4684,a8w8_blockscale_bpreshuffle_1x128x128_256x64x256x128_16x16_16x16_8x32x1_8x32x1_1x32x1x8_8_2x1_intrawave_v1,1587.46,1130.39,0.0
gfx950,256,20480,16384,1536,ck,13,0,645.8342,a8w8_blockscale_bpreshuffle_1x128x128_256x64x256x128_16x16_16x16_8x32x1_8x32x1_1x32x1x8_8_2x1_intrawave_v1,1596.06,1126.78,0.0
gfx950,256,24576,16384,1536,ck,13,0,763.445,a8w8_blockscale_bpreshuffle_1x128x128_256x64x256x128_16x16_16x16_8x32x1_8x32x1_1x32x1x8_8_2x1_intrawave_v1,1620.22,1137.24,0.0
gfx950,256,28672,16384,1536,ck,14,0,1048.1797,a8w8_blockscale_bpreshuffle_1x128x128_256x64x128x128_16x16_16x16_8x32x1_8x32x1_1x32x1x8_8_2x1_intrawave_v1,1376.78,962.36,0.0003
gfx950,256,32768,16384,1536,ck,13,0,1041.9095,a8w8_blockscale_bpreshuffle_1x128x128_256x64x256x128_16x16_16x16_8x32x1_8x32x1_1x32x1x8_8_2x1_intrawave_v1,1582.93,1103.01,0.0
gfx950,256,40960,16384,1536,ck,14,0,1521.6986,a8w8_blockscale_bpreshuffle_1x128x128_256x64x128x128_16x16_16x16_8x32x1_8x32x1_1x32x1x8_8_2x1_intrawave_v1,1354.79,939.91,0.0004
gfx950,256,49152,16384,1536,ck,14,0,1844.3829,a8w8_blockscale_bpreshuffle_1x128x128_256x64x128x128_16x16_16x16_8x32x1_8x32x1_1x32x1x8_8_2x1_intrawave_v1,1341.32,927.83,0.0002
gfx950,256,57344,16384,1536,ck,14,0,2162.1206,a8w8_blockscale_bpreshuffle_1x128x128_256x64x128x128_16x16_16x16_8x32x1_8x32x1_1x32x1x8_8_2x1_intrawave_v1,1334.9,921.45,0.0004
gfx950,256,65536,16384,1536,ck,14,0,2428.3128,a8w8_blockscale_bpreshuffle_1x128x128_256x64x128x128_16x16_16x16_8x32x1_8x32x1_1x32x1x8_8_2x1_intrawave_v1,1358.36,936.17,0.0003
gfx950,256,1,7168,768,ck,7,0,5.9231,a8w8_blockscale_bpreshuffle_1x128x128_256x16x64x256_16x16_16x16_16x16x1_16x16x1_1x16x1x16_4_1x1_intrawave_v1,1.86,931.97,0.0
gfx950,256,2,7168,768,ck,7,0,5.8395,a8w8_blockscale_bpreshuffle_1x128x128_256x16x64x256_16x16_16x16_16x16x1_16x16x1_1x16x1x16_4_1x1_intrawave_v1,3.77,947.89,0.0
gfx950,256,4,7168,768,ck,12,0,5.1554,a8w8_blockscale_bpreshuffle_1x128x128_256x32x64x256_16x16_16x16_16x16x1_16x16x1_1x32x1x8_8_2x1_intrawave_v1,8.54,1079.54,0.0
gfx950,256,8,7168,768,ck,12,0,5.135,a8w8_blockscale_bpreshuffle_1x128x128_256x32x64x256_16x16_16x16_16x16x1_16x16x1_1x32x1x8_8_2x1_intrawave_v1,17.15,1095.59,0.0
gfx950,256,16,7168,768,ck,12,0,5.1774,a8w8_blockscale_bpreshuffle_1x128x128_256x32x64x256_16x16_16x16_16x16x1_16x16x1_1x32x1x8_8_2x1_intrawave_v1,34.02,1109.96,0.0
gfx950,256,32,7168,768,ck,7,0,5.0468,a8w8_blockscale_bpreshuffle_1x128x128_256x16x64x256_16x16_16x16_16x16x1_16x16x1_1x16x1x16_4_1x1_intrawave_v1,69.81,1186.56,0.0
gfx950,256,48,7168,768,ck,12,0,5.4483,a8w8_blockscale_bpreshuffle_1x128x128_256x32x64x256_16x16_16x16_16x16x1_16x16x1_1x32x1x8_8_2x1_intrawave_v1,97.0,1143.48,0.0
gfx950,256,64,7168,768,ck,7,0,5.3675,a8w8_blockscale_bpreshuffle_1x128x128_256x16x64x256_16x16_16x16_16x16x1_16x16x1_1x16x1x16_4_1x1_intrawave_v1,131.28,1205.72,0.0
gfx950,256,80,7168,768,ck,7,0,5.9227,a8w8_blockscale_bpreshuffle_1x128x128_256x16x64x256_16x16_16x16_16x16x1_16x16x1_1x16x1x16_4_1x1_intrawave_v1,148.72,1133.49,0.0
gfx950,256,96,7168,768,ck,7,0,6.0471,a8w8_blockscale_bpreshuffle_1x128x128_256x16x64x256_16x16_16x16_16x16x1_16x16x1_1x16x1x16_4_1x1_intrawave_v1,174.79,1150.14,0.0
gfx950,256,112,7168,768,ck,4,0,6.3523,a8w8_blockscale_bpreshuffle_1x128x128_256x16x128x128_8x16_16x16_16x16x1_8x32x1_1x16x1x16_8_1x2_intrawave_v1,194.12,1132.92,0.0
gfx950,256,128,7168,768,ck,12,0,6.227,a8w8_blockscale_bpreshuffle_1x128x128_256x32x64x256_16x16_16x16_16x16x1_16x16x1_1x32x1x8_8_2x1_intrawave_v1,226.32,1194.53,0.0
gfx950,256,144,7168,768,ck,11,0,6.5078,a8w8_blockscale_bpreshuffle_1x128x128_256x32x128x256_16x16_16x16_16x16x1_16x16x1_1x32x1x8_8_2x1_intrawave_v1,243.62,1180.12,0.0
gfx950,256,160,7168,768,ck,11,0,6.576,a8w8_blockscale_bpreshuffle_1x128x128_256x32x128x256_16x16_16x16_16x16x1_16x16x1_1x32x1x8_8_2x1_intrawave_v1,267.88,1204.63,0.0
gfx950,256,192,7168,768,cktile,15,0,11.1981,a8w8_blockscale_cktile_16x128x256_1x4x1_16x16x64_intrawave_0x1x0_3,188.78,750.57,0.0
gfx950,256,208,7168,768,ck,11,0,8.0513,a8w8_blockscale_bpreshuffle_1x128x128_256x32x128x256_16x16_16x16_16x16x1_16x16x1_1x32x1x8_8_2x1_intrawave_v1,284.44,1073.95,0.0
gfx950,256,224,7168,768,ck,11,0,7.9534,a8w8_blockscale_bpreshuffle_1x128x128_256x32x128x256_16x16_16x16_16x16x1_16x16x1_1x32x1x8_8_2x1_intrawave_v1,310.09,1117.55,0.0
gfx950,256,240,7168,768,ck,1,0,11.0381,a8w8_blockscale_bpreshuffle_1x128x128_256x64x128x128_16x16_16x16_8x32x1_8x32x1_1x32x1x8_8_2x1_intrawave_v3,239.39,827.13,0.0
gfx950,256,256,7168,768,ck,14,0,8.4123,a8w8_blockscale_bpreshuffle_1x128x128_256x64x128x128_16x16_16x16_8x32x1_8x32x1_1x32x1x8_8_2x1_intrawave_v1,335.05,1114.04,0.0
gfx950,256,288,7168,768,ck,16,0,10.287,a8w8_blockscale_bpreshuffle_1x128x128_256x64x128x256_16x16_16x16_16x16x1_16x16x1_1x32x1x8_8_2x1_intrawave_v1,308.24,958.0,0.0
gfx950,256,320,7168,768,ck,11,0,11.1079,a8w8_blockscale_bpreshuffle_1x128x128_256x32x128x256_16x16_16x16_16x16x1_16x16x1_1x32x1x8_8_2x1_intrawave_v1,317.18,930.72,0.0
gfx950,256,352,7168,768,ck,2,0,9.4462,a8w8_blockscale_bpreshuffle_1x128x128_256x64x64x128_16x16_16x16_8x32x1_8x32x1_1x32x1x8_8_2x1_intrawave_v3,410.27,1145.61,0.0
gfx950,256,416,7168,768,ck,9,0,9.3788,a8w8_blockscale_bpreshuffle_1x128x128_256x32x128x128_16x16_16x16_8x32x1_8x32x1_1x32x1x8_8_2x1_intrawave_v1,488.35,1256.91,0.0
gfx950,256,448,7168,768,ck,1,0,13.0623,a8w8_blockscale_bpreshuffle_1x128x128_256x64x128x128_16x16_16x16_8x32x1_8x32x1_1x32x1x8_8_2x1_intrawave_v3,377.61,939.47,0.0
gfx950,256,512,7168,768,ck,1,0,10.7069,a8w8_blockscale_bpreshuffle_1x128x128_256x64x128x128_16x16_16x16_8x32x1_8x32x1_1x32x1x8_8_2x1_intrawave_v3,526.5,1236.42,0.0
gfx950,256,544,7168,768,ck,1,0,15.3322,a8w8_blockscale_bpreshuffle_1x128x128_256x64x128x128_16x16_16x16_8x32x1_8x32x1_1x32x1x8_8_2x1_intrawave_v3,390.65,894.95,0.0
gfx950,256,576,7168,768,ck,1,0,15.3238,a8w8_blockscale_bpreshuffle_1x128x128_256x64x128x128_16x16_16x16_8x32x1_8x32x1_1x32x1x8_8_2x1_intrawave_v3,413.85,926.98,0.0
gfx950,256,608,7168,768,ck,16,0,36.0123,a8w8_blockscale_bpreshuffle_1x128x128_256x64x128x256_16x16_16x16_16x16x1_16x16x1_1x32x1x8_8_2x1_intrawave_v1,185.88,407.87,0.0
gfx950,256,640,7168,768,ck,11,0,13.3016,a8w8_blockscale_bpreshuffle_1x128x128_256x32x128x256_16x16_16x16_16x16x1_16x16x1_1x32x1x8_8_2x1_intrawave_v1,529.74,1140.58,0.0
gfx950,256,672,7168,768,ck,2,0,16.7314,a8w8_blockscale_bpreshuffle_1x128x128_256x64x64x128_16x16_16x16_8x32x1_8x32x1_1x32x1x8_8_2x1_intrawave_v3,442.21,935.66,0.0
gfx950,256,704,7168,768,ck,1,0,17.1993,a8w8_blockscale_bpreshuffle_1x128x128_256x64x128x128_16x16_16x16_8x32x1_8x32x1_1x32x1x8_8_2x1_intrawave_v3,450.66,938.31,0.0
gfx950,256,736,7168,768,ck,1,0,18.1625,a8w8_blockscale_bpreshuffle_1x128x128_256x64x128x128_16x16_16x16_8x32x1_8x32x1_1x32x1x8_8_2x1_intrawave_v3,446.16,915.16,0.0
gfx950,256,768,7168,768,ck,8,0,15.7144,a8w8_blockscale_bpreshuffle_1x128x128_256x32x256x128_16x16_16x16_8x32x1_8x32x1_1x32x1x8_8_2x1_intrawave_v1,538.09,1088.49,0.0
gfx950,256,832,7168,768,ck,13,0,34.4008,a8w8_blockscale_bpreshuffle_1x128x128_256x64x256x128_16x16_16x16_8x32x1_8x32x1_1x32x1x8_8_2x1_intrawave_v1,266.28,525.32,0.0
gfx950,256,864,7168,768,ck,13,0,23.7853,a8w8_blockscale_bpreshuffle_1x128x128_256x64x256x128_16x16_16x16_8x32x1_8x32x1_1x32x1x8_8_2x1_intrawave_v1,399.94,780.1,0.0
gfx950,256,896,7168,768,ck,14,0,20.5641,a8w8_blockscale_bpreshuffle_1x128x128_256x64x128x128_16x16_16x16_8x32x1_8x32x1_1x32x1x8_8_2x1_intrawave_v1,479.72,925.8,0.0001
gfx950,256,928,7168,768,ck,14,0,22.2793,a8w8_blockscale_bpreshuffle_1x128x128_256x64x128x128_16x16_16x16_8x32x1_8x32x1_1x32x1x8_8_2x1_intrawave_v1,458.6,876.22,0.0001
gfx950,256,960,7168,768,ck,14,0,22.4022,a8w8_blockscale_bpreshuffle_1x128x128_256x64x128x128_16x16_16x16_8x32x1_8x32x1_1x32x1x8_8_2x1_intrawave_v1,471.81,892.99,0.0
gfx950,256,992,7168,768,ck,15,0,18.8014,a8w8_blockscale_bpreshuffle_1x128x128_256x64x64x128_16x16_16x16_8x32x1_8x32x1_1x32x1x8_8_2x1_intrawave_v1,580.91,1089.72,0.0115
gfx950,256,1024,7168,768,ck,8,0,22.9911,a8w8_blockscale_bpreshuffle_1x128x128_256x32x256x128_16x16_16x16_8x32x1_8x32x1_1x32x1x8_8_2x1_intrawave_v1,490.38,912.16,0.0
gfx950,256,1088,7168,768,ck,13,0,33.1991,a8w8_blockscale_bpreshuffle_1x128x128_256x64x256x128_16x16_16x16_8x32x1_8x32x1_1x32x1x8_8_2x1_intrawave_v1,360.82,660.81,0.0
gfx950,256,1152,7168,768,cktile,5,0,33.1885,a8w8_blockscale_cktile_32x128x128_1x4x1_16x16x128_intrawave_0x1x0_2,382.17,690.14,0.0
gfx950,256,1216,7168,768,ck,1,0,23.806,a8w8_blockscale_bpreshuffle_1x128x128_256x64x128x128_16x16_16x16_8x32x1_8x32x1_1x32x1x8_8_2x1_intrawave_v3,562.39,1002.75,0.0
gfx950,256,1280,7168,768,cktile,29,0,46.5862,a8w8_blockscale_cktile_192x256x128_4x2x1_16x16x128_intrawave_0x1x0_4,302.51,533.17,0.0
gfx950,256,1344,7168,768,cktile,19,0,30.6609,a8w8_blockscale_cktile_32x128x128_1x4x1_16x16x64_intrawave_0x1x0_3,482.62,841.62,0.0
gfx950,256,1408,7168,768,ck,1,0,19.8266,a8w8_blockscale_bpreshuffle_1x128x128_256x64x128x128_16x16_16x16_8x32x1_8x32x1_1x32x1x8_8_2x1_intrawave_v3,781.89,1350.28,0.0
gfx950,256,1472,7168,768,ck,1,0,27.2818,a8w8_blockscale_bpreshuffle_1x128x128_256x64x128x128_16x16_16x16_8x32x1_8x32x1_1x32x1x8_8_2x1_intrawave_v3,594.05,1016.73,0.0
gfx950,256,1536,7168,768,ck,1,0,28.7322,a8w8_blockscale_bpreshuffle_1x128x128_256x64x128x128_16x16_16x16_8x32x1_8x32x1_1x32x1x8_8_2x1_intrawave_v3,588.59,999.05,0.0
gfx950,256,1600,7168,768,ck,15,0,31.8309,a8w8_blockscale_bpreshuffle_1x128x128_256x64x64x128_16x16_16x16_8x32x1_8x32x1_1x32x1x8_8_2x1_intrawave_v1,553.43,932.16,0.0116
gfx950,256,1664,7168,768,ck,9,0,28.2892,a8w8_blockscale_bpreshuffle_1x128x128_256x32x128x128_16x16_16x16_8x32x1_8x32x1_1x32x1x8_8_2x1_intrawave_v1,647.62,1083.03,0.0005
gfx950,256,1728,7168,768,ck,0,0,48.6788,a8w8_blockscale_bpreshuffle_1x128x128_256x128x128x128_16x16_16x16_8x32x1_8x32x1_1x32x1x8_8_2x1_intrawave_v3,390.83,649.25,0.0
gfx950,256,1792,7168,768,cktile,17,0,42.9228,a8w8_blockscale_cktile_32x128x128_1x4x1_16x16x128_intrawave_0x1x0_3,459.66,758.84,0.0
gfx950,256,1856,7168,768,ck,1,0,30.3423,a8w8_blockscale_bpreshuffle_1x128x128_256x64x128x128_16x16_16x16_8x32x1_8x32x1_1x32x1x8_8_2x1_intrawave_v3,673.47,1105.32,0.0
gfx950,256,1920,7168,768,ck,1,0,51.3832,a8w8_blockscale_bpreshuffle_1x128x128_256x64x128x128_16x16_16x16_8x32x1_8x32x1_1x32x1x8_8_2x1_intrawave_v3,411.4,671.52,0.0
gfx950,256,1984,7168,768,cktile,20,0,46.7271,a8w8_blockscale_cktile_32x128x128_1x4x1_16x16x64_intrawave_0x1x0_4,467.48,759.12,0.0
gfx950,256,2048,7168,768,ck,1,0,39.6203,a8w8_blockscale_bpreshuffle_1x128x128_256x64x128x128_16x16_16x16_8x32x1_8x32x1_1x32x1x8_8_2x1_intrawave_v3,569.12,919.68,0.0
gfx950,256,4096,7168,768,ck,13,0,57.8936,a8w8_blockscale_bpreshuffle_1x128x128_256x64x256x128_16x16_16x16_8x32x1_8x32x1_1x32x1x8_8_2x1_intrawave_v1,778.97,1163.7,0.0
gfx950,256,6144,7168,768,ck,1,0,82.8855,a8w8_blockscale_bpreshuffle_1x128x128_256x64x128x128_16x16_16x16_8x32x1_8x32x1_1x32x1x8_8_2x1_intrawave_v3,816.13,1186.02,0.0
gfx950,256,8192,7168,768,cktile,29,0,116.0275,a8w8_blockscale_cktile_192x256x128_4x2x1_16x16x128_intrawave_0x1x0_4,777.35,1113.85,0.0
gfx950,256,10240,7168,768,ck,8,0,141.9449,a8w8_blockscale_bpreshuffle_1x128x128_256x32x256x128_16x16_16x16_8x32x1_8x32x1_1x32x1x8_8_2x1_intrawave_v1,794.27,1128.4,0.0
gfx950,256,12288,7168,768,ck,13,0,155.4989,a8w8_blockscale_bpreshuffle_1x128x128_256x64x256x128_16x16_16x16_8x32x1_8x32x1_1x32x1x8_8_2x1_intrawave_v1,870.05,1228.97,0.0
gfx950,256,14336,7168,768,ck,14,0,179.94,a8w8_blockscale_bpreshuffle_1x128x128_256x64x128x128_16x16_16x16_8x32x1_8x32x1_1x32x1x8_8_2x1_intrawave_v1,877.18,1233.94,0.0002
gfx950,256,16384,7168,768,ck,1,0,197.2607,a8w8_blockscale_bpreshuffle_1x128x128_256x64x128x128_16x16_16x16_8x32x1_8x32x1_1x32x1x8_8_2x1_intrawave_v3,914.47,1282.41,0.0
gfx950,256,20480,7168,768,ck,1,0,235.4991,a8w8_blockscale_bpreshuffle_1x128x128_256x64x128x128_16x16_16x16_8x32x1_8x32x1_1x32x1x8_8_2x1_intrawave_v3,957.48,1336.88,0.0
gfx950,256,24576,7168,768,ck,13,0,273.9704,a8w8_blockscale_bpreshuffle_1x128x128_256x64x256x128_16x16_16x16_8x32x1_8x32x1_1x32x1x8_8_2x1_intrawave_v1,987.64,1374.97,0.0
gfx950,256,28672,7168,768,ck,14,0,331.9985,a8w8_blockscale_bpreshuffle_1x128x128_256x64x128x128_16x16_16x16_8x32x1_8x32x1_1x32x1x8_8_2x1_intrawave_v1,950.85,1320.99,0.0004
gfx950,256,32768,7168,768,ck,14,0,328.7294,a8w8_blockscale_bpreshuffle_1x128x128_256x64x128x128_16x16_16x16_8x32x1_8x32x1_1x32x1x8_8_2x1_intrawave_v1,1097.49,1522.32,0.0003
gfx950,256,40960,7168,768,ck,14,0,429.2321,a8w8_blockscale_bpreshuffle_1x128x128_256x64x128x128_16x16_16x16_8x32x1_8x32x1_1x32x1x8_8_2x1_intrawave_v1,1050.65,1454.14,0.0004
gfx950,256,49152,7168,768,ck,14,0,499.8681,a8w8_blockscale_bpreshuffle_1x128x128_256x64x128x128_16x16_16x16_8x32x1_8x32x1_1x32x1x8_8_2x1_intrawave_v1,1082.62,1496.19,0.0004
gfx950,256,57344,7168,768,ck,13,0,574.3362,a8w8_blockscale_bpreshuffle_1x128x128_256x64x256x128_16x16_16x16_8x32x1_8x32x1_1x32x1x8_8_2x1_intrawave_v1,1099.29,1517.63,0.0
gfx950,256,65536,7168,768,ck,14,0,648.456,a8w8_blockscale_bpreshuffle_1x128x128_256x64x128x128_16x16_16x16_8x32x1_8x32x1_1x32x1x8_8_2x1_intrawave_v1,1112.73,1534.97,0.0003
gfx950,256,416,2048,7168,ck,17,0,22.2149,a8w8_blockscale_bpreshuffle_1x128x128_256x64x64x256_16x16_16x16_16x16x1_16x16x1_1x32x1x8_8_2x1_intrawave_v1,549.8,871.75,0.0
gfx950,256,544,2048,7168,ck,11,0,28.729,a8w8_blockscale_bpreshuffle_1x128x128_256x32x128x256_16x16_16x16_16x16x1_16x16x1_1x32x1x8_8_2x1_intrawave_v1,555.95,724.27,0.0
gfx950,256,736,2048,7168,ck,11,0,30.0713,a8w8_blockscale_bpreshuffle_1x128x128_256x32x128x256_16x16_16x16_16x16x1_16x16x1_1x32x1x8_8_2x1_intrawave_v1,718.59,763.86,0.0
gfx950,256,1408,2048,7168,ck,14,0,41.4402,a8w8_blockscale_bpreshuffle_1x128x128_256x64x128x128_16x16_16x16_8x32x1_8x32x1_1x32x1x8_8_2x1_intrawave_v1,997.56,736.96,0.0001
gfx950,256,1856,2048,7168,ck,14,0,48.0195,a8w8_blockscale_bpreshuffle_1x128x128_256x64x128x128_16x16_16x16_8x32x1_8x32x1_1x32x1x8_8_2x1_intrawave_v1,1134.8,741.07,0.0002
gfx950,256,1984,2048,7168,ck,13,0,50.3715,a8w8_blockscale_bpreshuffle_1x128x128_256x64x256x128_16x16_16x16_8x32x1_8x32x1_1x32x1x8_8_2x1_intrawave_v1,1156.42,735.1,0.0
gfx950,256,544,6144,7168,ck,14,0,48.8213,a8w8_blockscale_bpreshuffle_1x128x128_256x64x128x128_16x16_16x16_8x32x1_8x32x1_1x32x1x8_8_2x1_intrawave_v1,981.45,1118.86,0.0
gfx950,256,640,6144,7168,ck,14,0,50.1327,a8w8_blockscale_bpreshuffle_1x128x128_256x64x128x128_16x16_16x16_8x32x1_8x32x1_1x32x1x8_8_2x1_intrawave_v1,1124.44,1126.85,0.0001
gfx950,256,2,7168,3072,ck,7,0,10.0305,a8w8_blockscale_bpreshuffle_1x128x128_256x16x64x256_16x16_16x16_16x16x1_16x16x1_1x16x1x16_4_1x1_intrawave_v1,8.78,2198.78,0.0
gfx950,256,4,7168,3072,ck,12,0,10.687,a8w8_blockscale_bpreshuffle_1x128x128_256x32x64x256_16x16_16x16_16x16x1_16x16x1_1x32x1x8_8_2x1_intrawave_v1,16.48,2066.97,0.0
gfx950,256,96,7168,384,ck,5,0,4.9995,a8w8_blockscale_bpreshuffle_1x128x128_256x16x64x128_8x16_16x16_16x16x1_8x32x1_1x16x1x16_4_1x1_intrawave_v1,105.71,833.21,0.0
gfx950,256,176,7168,768,ck,10,0,6.4639,a8w8_blockscale_bpreshuffle_1x128x128_256x32x64x128_16x16_16x16_8x32x1_8x32x1_1x32x1x8_8_2x1_intrawave_v1,299.78,1262.91,0.0217
gfx950,256,384,7168,768,ck,15,0,9.4707,a8w8_blockscale_bpreshuffle_1x128x128_256x64x64x128_16x16_16x16_8x32x1_8x32x1_1x32x1x8_8_2x1_intrawave_v1,446.41,1193.68,0.0123
gfx950,256,416,7168,7168,ck,14,0,46.9308,a8w8_blockscale_bpreshuffle_1x128x128_256x64x128x128_16x16_16x16_8x32x1_8x32x1_1x32x1x8_8_2x1_intrawave_v1,910.88,1285.42,0.0001
gfx950,256,480,7168,768,ck,14,0,10.6105,a8w8_blockscale_bpreshuffle_1x128x128_256x64x128x128_16x16_16x16_8x32x1_8x32x1_1x32x1x8_8_2x1_intrawave_v1,498.07,1202.11,0.0
gfx950,256,480,7168,16384,ck,14,0,99.0223,a8w8_blockscale_bpreshuffle_1x128x128_256x64x128x128_16x16_16x16_8x32x1_8x32x1_1x32x1x8_8_2x1_intrawave_v1,1138.56,1334.91,0.0001
gfx950,256,608,7168,16384,ck,14,0,130.1702,a8w8_blockscale_bpreshuffle_1x128x128_256x64x128x128_16x16_16x16_8x32x1_8x32x1_1x32x1x8_8_2x1_intrawave_v1,1097.08,1045.69,0.0001
gfx950,256,704,7168,16384,ck,13,0,133.4882,a8w8_blockscale_bpreshuffle_1x128x128_256x64x256x128_16x16_16x16_8x32x1_8x32x1_1x32x1x8_8_2x1_intrawave_v1,1238.73,1041.8,0.0
gfx950,256,800,7168,768,ck,14,0,14.0485,a8w8_blockscale_bpreshuffle_1x128x128_256x64x128x128_16x16_16x16_8x32x1_8x32x1_1x32x1x8_8_2x1_intrawave_v1,626.97,1251.96,0.0001
gfx950,256,80,16384,1536,ck,17,0,11.0887,a8w8_blockscale_bpreshuffle_1x128x128_256x64x64x256_16x16_16x16_16x16x1_16x16x1_1x32x1x8_8_2x1_intrawave_v1,363.12,2516.99,0.0
gfx950,256,96,16384,1536,ck,12,0,11.0782,a8w8_blockscale_bpreshuffle_1x128x128_256x32x64x256_16x16_16x16_16x16x1_16x16x1_1x32x1x8_8_2x1_intrawave_v1,436.16,2568.92,0.0
gfx950,256,224,16384,1536,ck,14,0,15.708,a8w8_blockscale_bpreshuffle_1x128x128_256x64x128x128_16x16_16x16_8x32x1_8x32x1_1x32x1x8_8_2x1_intrawave_v1,717.74,2091.29,0.0
gfx950,256,256,16384,1536,ck,14,0,16.1579,a8w8_blockscale_bpreshuffle_1x128x128_256x64x128x128_16x16_16x16_8x32x1_8x32x1_1x32x1x8_8_2x1_intrawave_v1,797.44,2100.99,0.0
gfx950,256,320,16384,1536,ck,14,0,20.6973,a8w8_blockscale_bpreshuffle_1x128x128_256x64x128x128_16x16_16x16_8x32x1_8x32x1_1x32x1x8_8_2x1_intrawave_v1,778.18,1746.27,0.0001
