aiter/configs/model_configs/glm5_a8w8_bpreshuffle_tuned_gemm.csv
gfx,cu_num,M,N,K,q_dtype_w,libtype,kernelId,splitK,us,kernelName,tflops,bw,errRatio
gfx942,80,1,2048,2048,torch.float8_e4m3fnuz,cktile,2,0,5.3358,a8w8_bpreshuffle_cktile_0x0x8x4x1x0x0x0x0x1_16x64x512_1x4x1_16x16x64_default,1.57,787.22,0.0
gfx942,80,2,2048,2048,torch.float8_e4m3fnuz,cktile,2,0,5.3846,a8w8_bpreshuffle_cktile_0x0x8x4x1x0x0x0x0x1_16x64x512_1x4x1_16x16x64_default,3.12,781.23,0.0
gfx942,80,4,2048,2048,torch.float8_e4m3fnuz,cktile,2,0,5.4106,a8w8_bpreshuffle_cktile_0x0x8x4x1x0x0x0x0x1_16x64x512_1x4x1_16x16x64_default,6.2,779.74,0.0
gfx942,80,8,2048,2048,torch.float8_e4m3fnuz,cktile,144,0,5.4958,a8w8_bpreshuffle_cktile_0x0x8x4x1x0x0x0x0x4_16x64x512_1x4x1_16x16x64_default,12.21,772.13,0.0
gfx942,80,16,2048,2048,torch.float8_e4m3fnuz,ck,11,0,5.1194,a8w8_bpreshuffle_256x16x64x512_16x16_16x16_32x8x1_32x8x1_1x16x1x16_4x4x1_1x1_intrawave_v1,26.22,838.5,0.0
gfx942,80,24,2048,2048,torch.float8_e4m3fnuz,ck,25,0,5.9958,a8w8_bpreshuffle_256x16x64x512_16x16_16x16_32x8x1_32x8x1_1x16x1x16_4x4x1_1x1_intrawave_v2,33.58,724.13,0.0
gfx942,80,32,2048,2048,torch.float8_e4m3fnuz,ck,11,0,5.4066,a8w8_bpreshuffle_256x16x64x512_16x16_16x16_32x8x1_32x8x1_1x16x1x16_4x4x1_1x1_intrawave_v1,49.65,812.14,0.0
gfx942,80,48,2048,2048,torch.float8_e4m3fnuz,cktile,157,0,6.671,a8w8_bpreshuffle_cktile_0x0x8x4x1x0x0x0x0x3_32x64x512_1x4x1_16x16x64_default,60.36,672.94,0.0
gfx942,80,64,2048,2048,torch.float8_e4m3fnuz,cktile,37,0,6.7982,a8w8_bpreshuffle_cktile_0x0x8x4x1x0x0x0x0x2_32x64x512_1x4x1_16x16x64_default,78.97,674.81,0.0
gfx942,80,96,2048,2048,torch.float8_e4m3fnuz,cktile,9,0,7.9176,a8w8_bpreshuffle_cktile_0x0x8x4x1x0x0x0x0x1_32x64x512_1x4x1_16x16x64_default,101.71,604.24,0.0
gfx942,80,128,2048,2048,torch.float8_e4m3fnuz,ck,112,0,8.7846,a8w8_bpreshuffle_256x32x64x256_16x16_16x16_16x16x1_16x16x1_1x32x1x8_8x8x1_2x1_intrawave_v1,122.23,566.98,0.0
gfx942,80,192,2048,2048,torch.float8_e4m3fnuz,cktile,116,0,11.0742,a8w8_bpreshuffle_cktile_0x0x8x4x1x0x0x0x0x2_48x64x256_1x4x1_16x16x64_default,145.44,485.27,0.0
gfx942,80,256,2048,2048,torch.float8_e4m3fnuz,ck,114,0,12.417,a8w8_bpreshuffle_256x64x64x256_16x16_16x16_16x16x1_16x16x1_1x32x1x8_8x8x1_2x1_intrawave_v3,172.95,464.46,0.0
gfx942,80,384,2048,2048,torch.float8_e4m3fnuz,ck,123,0,15.6386,a8w8_bpreshuffle_256x96x128x256_16x16_16x16_16x16x1_16x16x1_1x16x1x16_8x8x1_1x2_intrawave_v3,205.98,419.07,0.0
gfx942,80,512,2048,2048,torch.float8_e4m3fnuz,ck,121,0,18.1754,a8w8_bpreshuffle_256x64x128x256_16x16_16x16_16x16x1_16x16x1_1x16x1x16_8x8x1_1x2_intrawave_v3,236.31,403.84,0.0
gfx942,80,768,2048,2048,torch.float8_e4m3fnuz,ck,136,0,24.0702,a8w8_bpreshuffle_256x80x256x256_16x16_16x16_16x16x1_16x16x1_1x16x1x16_8x8x1_1x2_intrawave_v3,267.65,370.29,0.0
gfx942,80,1024,2048,2048,torch.float8_e4m3fnuz,ck,70,0,31.1304,a8w8_bpreshuffle_256x128x128x128_16x16_16x16_8x32x1_8x32x1_1x32x1x8_8x8x1_2x1_intrawave_v3,275.93,336.83,0.0
gfx942,80,1536,2048,2048,torch.float8_e4m3fnuz,ck,85,0,39.6437,a8w8_bpreshuffle_256x64x128x128_16x16_16x16_8x32x1_8x32x1_1x32x1x8_8x8x1_2x1_intrawave_v3,325.02,343.85,0.0
gfx942,80,2048,2048,2048,torch.float8_e4m3fnuz,ck,85,0,54.1244,a8w8_bpreshuffle_256x64x128x128_16x16_16x16_8x32x1_8x32x1_1x32x1x8_8x8x1_2x1_intrawave_v3,317.41,309.98,0.0
gfx942,80,3072,2048,2048,torch.float8_e4m3fnuz,ck,85,0,69.9818,a8w8_bpreshuffle_256x64x128x128_16x16_16x16_8x32x1_8x32x1_1x32x1x8_8x8x1_2x1_intrawave_v3,368.24,329.64,0.0
gfx942,80,4096,2048,2048,torch.float8_e4m3fnuz,cktile,18,0,92.6586,a8w8_bpreshuffle_cktile_0x0x8x4x1x0x0x0x0x1_64x128x128_1x4x1_16x16x64_default,370.82,316.86,0.0
gfx942,80,8192,2048,2048,torch.float8_e4m3fnuz,cktile,48,0,168.1505,a8w8_bpreshuffle_cktile_0x0x8x4x1x0x0x0x0x2_64x256x128_1x4x1_16x16x64_default,408.68,324.27,0.0
gfx942,80,16384,2048,2048,torch.float8_e4m3fnuz,cktile,48,0,324.1177,a8w8_bpreshuffle_cktile_0x0x8x4x1x0x0x0x0x2_64x256x128_1x4x1_16x16x64_default,424.04,323.52,0.0
gfx942,80,32768,2048,2048,torch.float8_e4m3fnuz,cktile,48,0,638.0837,a8w8_bpreshuffle_cktile_0x0x8x4x1x0x0x0x0x2_64x256x128_1x4x1_16x16x64_default,430.79,322.09,0.0
gfx942,80,1,2624,6144,torch.float8_e4m3fnuz,cktile,144,0,9.9255,a8w8_bpreshuffle_cktile_0x0x8x4x1x0x0x0x0x4_16x64x512_1x4x1_16x16x64_default,3.25,1625.43,0.0
gfx942,80,2,2624,6144,torch.float8_e4m3fnuz,cktile,143,0,9.9265,a8w8_bpreshuffle_cktile_0x0x8x4x1x0x0x0x0x3_16x64x512_1x4x1_16x16x64_default,6.5,1626.42,0.0
gfx942,80,4,2624,6144,torch.float8_e4m3fnuz,cktile,2,0,10.2925,a8w8_bpreshuffle_cktile_0x0x8x4x1x0x0x0x0x1_16x64x512_1x4x1_16x16x64_default,12.53,1570.8,0.0
gfx942,80,8,2624,6144,torch.float8_e4m3fnuz,cktile,144,0,9.9765,a8w8_bpreshuffle_cktile_0x0x8x4x1x0x0x0x0x4_16x64x512_1x4x1_16x16x64_default,25.86,1625.12,0.0
gfx942,80,16,2624,6144,torch.float8_e4m3fnuz,ck,11,0,9.3862,a8w8_bpreshuffle_256x16x64x512_16x16_16x16_32x8x1_32x8x1_1x16x1x16_4x4x1_1x1_intrawave_v1,54.96,1737.03,0.0
gfx942,80,24,2624,6144,torch.float8_e4m3fnuz,cktile,9,0,11.0295,a8w8_bpreshuffle_cktile_0x0x8x4x1x0x0x0x0x1_32x64x512_1x4x1_16x16x64_default,70.16,1486.49,0.0
gfx942,80,32,2624,6144,torch.float8_e4m3fnuz,cktile,157,0,11.2386,a8w8_bpreshuffle_cktile_0x0x8x4x1x0x0x0x0x3_32x64x512_1x4x1_16x16x64_default,91.81,1466.94,0.0
gfx942,80,48,2624,6144,torch.float8_e4m3fnuz,cktile,2,0,14.5864,a8w8_bpreshuffle_cktile_0x0x8x4x1x0x0x0x0x1_16x64x512_1x4x1_16x16x64_default,106.11,1142.75,0.0
gfx942,80,64,2624,6144,torch.float8_e4m3fnuz,cktile,5,0,17.2865,a8w8_bpreshuffle_cktile_0x0x8x4x1x0x0x0x0x1_16x64x256_1x4x1_16x16x64_default,119.38,974.8,0.0
gfx942,80,96,2624,6144,torch.float8_e4m3fnuz,cktile,158,0,17.7424,a8w8_bpreshuffle_cktile_0x0x8x4x1x0x0x0x0x4_32x64x512_1x4x1_16x16x64_default,174.46,970.3,0.0
gfx942,80,128,2624,6144,torch.float8_e4m3fnuz,cktile,110,0,23.2679,a8w8_bpreshuffle_cktile_0x0x8x4x1x0x0x0x0x2_48x64x256_1x4x1_16x16x64_default,177.38,755.55,0.0
gfx942,80,192,2624,6144,torch.float8_e4m3fnuz,ck,114,0,26.8759,a8w8_bpreshuffle_256x64x64x256_16x16_16x16_16x16x1_16x16x1_1x32x1x8_8x8x1_2x1_intrawave_v3,230.35,681.25,0.0
gfx942,80,256,2624,6144,torch.float8_e4m3fnuz,ck,112,0,37.7824,a8w8_bpreshuffle_256x32x64x256_16x16_16x16_16x16x1_16x16x1_1x32x1x8_8x8x1_2x1_intrawave_v1,218.47,503.89,0.0
gfx942,80,384,2624,6144,torch.float8_e4m3fnuz,ck,113,0,48.9128,a8w8_bpreshuffle_256x48x64x256_16x16_16x16_16x16x1_16x16x1_1x16x1x16_4x4x1_1x1_intrawave_v1,253.14,419.04,0.0
gfx942,80,512,2624,6144,torch.float8_e4m3fnuz,ck,114,0,60.5151,a8w8_bpreshuffle_256x64x64x256_16x16_16x16_16x16x1_16x16x1_1x32x1x8_8x8x1_2x1_intrawave_v3,272.8,362.79,0.0
gfx942,80,768,2624,6144,torch.float8_e4m3fnuz,ck,114,0,84.4207,a8w8_bpreshuffle_256x64x64x256_16x16_16x16_16x16x1_16x16x1_1x32x1x8_8x8x1_2x1_intrawave_v3,293.33,294.61,0.0
gfx942,80,1024,2624,6144,torch.float8_e4m3fnuz,ck,114,0,107.2522,a8w8_bpreshuffle_256x64x64x256_16x16_16x16_16x16x1_16x16x1_1x32x1x8_8x8x1_2x1_intrawave_v3,307.85,259.08,0.0
gfx942,80,1536,2624,6144,torch.float8_e4m3fnuz,ck,114,0,154.0032,a8w8_bpreshuffle_256x64x64x256_16x16_16x16_16x16x1_16x16x1_1x32x1x8_8x8x1_2x1_intrawave_v3,321.59,218.31,0.0
gfx942,80,2048,2624,6144,torch.float8_e4m3fnuz,ck,114,0,199.896,a8w8_bpreshuffle_256x64x64x256_16x16_16x16_16x16x1_16x16x1_1x32x1x8_8x8x1_2x1_intrawave_v3,330.35,197.37,0.0
gfx942,80,3072,2624,6144,torch.float8_e4m3fnuz,ck,114,0,292.2542,a8w8_bpreshuffle_256x64x64x256_16x16_16x16_16x16x1_16x16x1_1x32x1x8_8x8x1_2x1_intrawave_v3,338.93,174.91,0.0
gfx942,80,4096,2624,6144,torch.float8_e4m3fnuz,ck,114,0,383.2246,a8w8_bpreshuffle_256x64x64x256_16x16_16x16_16x16x1_16x16x1_1x32x1x8_8x8x1_2x1_intrawave_v3,344.63,163.83,0.0
gfx942,80,8192,2624,6144,torch.float8_e4m3fnuz,ck,114,0,760.182,a8w8_bpreshuffle_256x64x64x256_16x16_16x16_16x16x1_16x16x1_1x32x1x8_8x8x1_2x1_intrawave_v3,347.47,143.97,0.0
gfx942,80,16384,2624,6144,torch.float8_e4m3fnuz,ck,114,0,1504.5302,a8w8_bpreshuffle_256x64x64x256_16x16_16x16_16x16x1_16x16x1_1x32x1x8_8x8x1_2x1_intrawave_v3,351.13,134.77,0.0
gfx942,80,32768,2624,6144,torch.float8_e4m3fnuz,ck,114,0,3007.1842,a8w8_bpreshuffle_256x64x64x256_16x16_16x16_16x16x1_16x16x1_1x32x1x8_8x8x1_2x1_intrawave_v3,351.35,129.49,0.0
gfx942,80,1,3072,6144,torch.float8_e4m3fnuz,cktile,143,0,10.1457,a8w8_bpreshuffle_cktile_0x0x8x4x1x0x0x0x0x3_16x64x512_1x4x1_16x16x64_default,3.72,1861.54,0.0
gfx942,80,2,3072,6144,torch.float8_e4m3fnuz,cktile,30,0,10.0478,a8w8_bpreshuffle_cktile_0x0x8x4x1x0x0x0x0x2_16x64x512_1x4x1_16x16x64_default,7.51,1880.9,0.0
gfx942,80,4,3072,6144,torch.float8_e4m3fnuz,cktile,144,0,10.3492,a8w8_bpreshuffle_cktile_0x0x8x4x1x0x0x0x0x4_16x64x512_1x4x1_16x16x64_default,14.59,1828.5,0.0
gfx942,80,8,3072,6144,torch.float8_e4m3fnuz,cktile,144,0,9.8481,a8w8_bpreshuffle_cktile_0x0x8x4x1x0x0x0x0x4_16x64x512_1x4x1_16x16x64_default,30.66,1926.53,0.0
gfx942,80,16,3072,6144,torch.float8_e4m3fnuz,ck,11,0,9.5213,a8w8_bpreshuffle_256x16x64x512_16x16_16x16_32x8x1_32x8x1_1x16x1x16_4x4x1_1x1_intrawave_v1,63.43,2002.98,0.0
gfx942,80,24,3072,6144,torch.float8_e4m3fnuz,cktile,9,0,11.2198,a8w8_bpreshuffle_cktile_0x0x8x4x1x0x0x0x0x1_32x64x512_1x4x1_16x16x64_default,80.75,1708.52,0.0
gfx942,80,32,3072,6144,torch.float8_e4m3fnuz,cktile,9,0,11.42,a8w8_bpreshuffle_cktile_0x0x8x4x1x0x0x0x0x1_32x64x512_1x4x1_16x16x64_default,105.78,1687.18,0.0
gfx942,80,48,3072,6144,torch.float8_e4m3fnuz,ck,6,0,14.2418,a8w8_bpreshuffle_256x16x128x512_16x16_16x16_32x8x1_32x8x1_1x16x1x16_8x8x1_1x2_intrawave_v1,127.23,1366.69,0.0
gfx942,80,64,3072,6144,torch.float8_e4m3fnuz,ck,114,0,17.6556,a8w8_bpreshuffle_256x64x64x256_16x16_16x16_16x16x1_16x16x1_1x32x1x8_8x8x1_2x1_intrawave_v3,136.84,1113.57,0.0
gfx942,80,96,3072,6144,torch.float8_e4m3fnuz,cktile,157,0,17.9554,a8w8_bpreshuffle_cktile_0x0x8x4x1x0x0x0x0x3_32x64x512_1x4x1_16x16x64_default,201.83,1116.88,0.0
gfx942,80,128,3072,6144,torch.float8_e4m3fnuz,cktile,75,0,22.2418,a8w8_bpreshuffle_cktile_0x0x8x4x1x0x0x0x0x1_48x128x256_1x4x1_16x16x64_default,217.24,919.32,0.0
gfx942,80,192,3072,6144,torch.float8_e4m3fnuz,ck,121,0,26.3443,a8w8_bpreshuffle_256x64x128x256_16x16_16x16_16x16x1_16x16x1_1x16x1x16_8x8x1_1x2_intrawave_v3,275.12,806.01,0.0
gfx942,80,256,3072,6144,torch.float8_e4m3fnuz,ck,128,0,33.4036,a8w8_bpreshuffle_256x64x192x256_16x16_16x16_16x16x1_16x16x1_1x32x1x8_8x8x1_2x1_intrawave_v3,289.3,659.21,0.0
gfx942,80,384,3072,6144,torch.float8_e4m3fnuz,ck,139,0,42.9846,a8w8_bpreshuffle_256x128x128x256_16x16_16x16_16x16x1_16x16x1_1x16x1x16_8x8x1_1x2_intrawave_v3,337.23,548.87,0.0
gfx942,80,512,3072,6144,torch.float8_e4m3fnuz,ck,128,0,56.4315,a8w8_bpreshuffle_256x64x192x256_16x16_16x16_16x16x1_16x16x1_1x32x1x8_8x8x1_2x1_intrawave_v3,342.49,445.95,0.0
gfx942,80,768,3072,6144,torch.float8_e4m3fnuz,ck,70,0,75.8205,a8w8_bpreshuffle_256x128x128x128_16x16_16x16_8x32x1_8x32x1_1x32x1x8_8x8x1_2x1_intrawave_v3,382.36,373.4,0.0
gfx942,80,1024,3072,6144,torch.float8_e4m3fnuz,cktile,187,0,99.7756,a8w8_bpreshuffle_cktile_0x0x8x4x1x0x0x0x0x3_64x128x256_1x4x1_16x16x64_default,387.42,315.28,0.0
gfx942,80,1536,3072,6144,torch.float8_e4m3fnuz,cktile,200,0,135.6755,a8w8_bpreshuffle_cktile_0x0x8x4x1x0x0x0x0x4_64x192x256_1x4x1_16x16x64_default,427.36,278.23,0.0
gfx942,80,2048,3072,6144,torch.float8_e4m3fnuz,cktile,68,0,177.4532,a8w8_bpreshuffle_cktile_0x0x8x4x1x0x0x0x0x2_64x256x256_1x4x1_16x16x64_default,435.66,248.18,0.0
gfx942,80,3072,3072,6144,torch.float8_e4m3fnuz,ck,102,0,247.3536,a8w8_bpreshuffle_256x96x256x128_16x16_16x16_8x32x1_8x32x1_1x32x1x8_8x8x1_2x1_intrawave_v3,468.82,228.92,0.0
gfx942,80,4096,3072,6144,torch.float8_e4m3fnuz,cktile,48,0,337.4216,a8w8_bpreshuffle_cktile_0x0x8x4x1x0x0x0x0x2_64x256x128_1x4x1_16x16x64_default,458.24,205.1,0.0
gfx942,80,8192,3072,6144,torch.float8_e4m3fnuz,ck,68,0,643.8193,a8w8_bpreshuffle_256x128x192x128_16x16_16x16_8x32x1_8x32x1_1x32x1x8_8x8x1_2x1_intrawave_v3,480.32,185.67,0.0
gfx942,80,16384,3072,6144,torch.float8_e4m3fnuz,ck,68,0,1284.2511,a8w8_bpreshuffle_256x128x192x128_16x16_16x16_8x32x1_8x32x1_1x32x1x8_8x8x1_2x1_intrawave_v3,481.58,171.46,0.0
gfx942,80,32768,3072,6144,torch.float8_e4m3fnuz,cktile,42,0,2571.5212,a8w8_bpreshuffle_cktile_0x0x8x4x1x0x0x0x0x2_128x256x128_1x4x1_16x16x64_default,481.02,163.92,0.0
gfx942,80,1,4096,2048,torch.float8_e4m3fnuz,cktile,143,0,5.8706,a8w8_bpreshuffle_cktile_0x0x8x4x1x0x0x0x0x3_16x64x512_1x4x1_16x16x64_default,2.86,1430.66,0.0
gfx942,80,2,4096,2048,torch.float8_e4m3fnuz,cktile,30,0,5.9494,a8w8_bpreshuffle_cktile_0x0x8x4x1x0x0x0x0x2_16x64x512_1x4x1_16x16x64_default,5.64,1413.43,0.0
gfx942,80,4,4096,2048,torch.float8_e4m3fnuz,cktile,144,0,5.8834,a8w8_bpreshuffle_cktile_0x0x8x4x1x0x0x0x0x4_16x64x512_1x4x1_16x16x64_default,11.41,1432.77,0.0
gfx942,80,8,4096,2048,torch.float8_e4m3fnuz,cktile,144,0,5.913,a8w8_bpreshuffle_cktile_0x0x8x4x1x0x0x0x0x4_16x64x512_1x4x1_16x16x64_default,22.7,1432.53,0.0
gfx942,80,16,4096,2048,torch.float8_e4m3fnuz,ck,11,0,5.6082,a8w8_bpreshuffle_256x16x64x512_16x16_16x16_32x8x1_32x8x1_1x16x1x16_4x4x1_1x1_intrawave_v1,47.86,1524.99,0.0
gfx942,80,24,4096,2048,torch.float8_e4m3fnuz,cktile,9,0,6.594,a8w8_bpreshuffle_cktile_0x0x8x4x1x0x0x0x0x1_32x64x512_1x4x1_16x16x64_default,61.06,1309.43,0.0
gfx942,80,32,4096,2048,torch.float8_e4m3fnuz,cktile,37,0,6.8928,a8w8_bpreshuffle_cktile_0x0x8x4x1x0x0x0x0x2_32x64x512_1x4x1_16x16x64_default,77.89,1264.55,0.0
gfx942,80,48,4096,2048,torch.float8_e4m3fnuz,ck,113,0,8.5582,a8w8_bpreshuffle_256x48x64x256_16x16_16x16_16x16x1_16x16x1_1x16x1x16_4x4x1_1x1_intrawave_v1,94.1,1037.62,0.0
gfx942,80,64,4096,2048,torch.float8_e4m3fnuz,ck,114,0,9.085,a8w8_bpreshuffle_256x64x64x256_16x16_16x16_16x16x1_16x16x1_1x32x1x8_8x8x1_2x1_intrawave_v3,118.19,995.48,0.0
gfx942,80,96,4096,2048,torch.float8_e4m3fnuz,ck,116,0,11.1434,a8w8_bpreshuffle_256x96x64x256_16x16_16x16_16x16x1_16x16x1_1x32x1x8_8x8x1_2x1_intrawave_v3,144.54,841.0,0.0
gfx942,80,128,4096,2048,torch.float8_e4m3fnuz,ck,121,0,12.5639,a8w8_bpreshuffle_256x64x128x256_16x16_16x16_16x16x1_16x16x1_1x16x1x16_8x8x1_1x2_intrawave_v3,170.92,772.0,0.0
gfx942,80,192,4096,2048,torch.float8_e4m3fnuz,ck,123,0,16.0047,a8w8_bpreshuffle_256x96x128x256_16x16_16x16_16x16x1_16x16x1_1x16x1x16_8x8x1_1x2_intrawave_v3,201.27,646.98,0.0
gfx942,80,256,4096,2048,torch.float8_e4m3fnuz,ck,121,0,18.8633,a8w8_bpreshuffle_256x64x128x256_16x16_16x16_16x16x1_16x16x1_1x16x1x16_8x8x1_1x2_intrawave_v3,227.69,583.68,0.0
gfx942,80,384,4096,2048,torch.float8_e4m3fnuz,ck,136,0,24.0811,a8w8_bpreshuffle_256x80x256x256_16x16_16x16_16x16x1_16x16x1_1x16x1x16_8x8x1_1x2_intrawave_v3,267.53,511.64,0.0
gfx942,80,512,4096,2048,torch.float8_e4m3fnuz,ck,70,0,31.3167,a8w8_bpreshuffle_256x128x128x128_16x16_16x16_8x32x1_8x32x1_1x32x1x8_8x8x1_2x1_intrawave_v3,274.29,435.28,0.0
gfx942,80,768,4096,2048,torch.float8_e4m3fnuz,ck,85,0,39.6729,a8w8_bpreshuffle_256x64x128x128_16x16_16x16_8x32x1_8x32x1_1x32x1x8_8x8x1_2x1_intrawave_v3,324.78,409.67,0.0
gfx942,80,1024,4096,2048,torch.float8_e4m3fnuz,ck,85,0,54.1331,a8w8_bpreshuffle_256x64x128x128_16x16_16x16_8x32x1_8x32x1_1x32x1x8_8x8x1_2x1_intrawave_v3,317.36,348.67,0.0
gfx942,80,1536,4096,2048,torch.float8_e4m3fnuz,cktile,48,0,70.0865,a8w8_bpreshuffle_cktile_0x0x8x4x1x0x0x0x0x2_64x256x128_1x4x1_16x16x64_default,367.69,344.11,0.0
gfx942,80,2048,4096,2048,torch.float8_e4m3fnuz,cktile,48,0,94.7334,a8w8_bpreshuffle_cktile_0x0x8x4x1x0x0x0x0x2_64x256x128_1x4x1_16x16x64_default,362.7,309.92,0.0
gfx942,80,3072,4096,2048,torch.float8_e4m3fnuz,cktile,48,0,129.4589,a8w8_bpreshuffle_cktile_0x0x8x4x1x0x0x0x0x2_64x256x128_1x4x1_16x16x64_default,398.12,307.79,0.0
gfx942,80,4096,4096,2048,torch.float8_e4m3fnuz,cktile,48,0,167.4301,a8w8_bpreshuffle_cktile_0x0x8x4x1x0x0x0x0x2_64x256x128_1x4x1_16x16x64_default,410.44,300.61,0.0
gfx942,80,8192,4096,2048,torch.float8_e4m3fnuz,cktile,48,0,318.7108,a8w8_bpreshuffle_cktile_0x0x8x4x1x0x0x0x0x2_64x256x128_1x4x1_16x16x64_default,431.23,289.52,0.0
gfx942,80,16384,4096,2048,torch.float8_e4m3fnuz,cktile,48,0,618.1425,a8w8_bpreshuffle_cktile_0x0x8x4x1x0x0x0x0x2_64x256x128_1x4x1_16x16x64_default,444.68,284.98,0.0
gfx942,80,32768,4096,2048,torch.float8_e4m3fnuz,cktile,48,0,1225.3982,a8w8_bpreshuffle_cktile_0x0x8x4x1x0x0x0x0x2_64x256x128_1x4x1_16x16x64_default,448.63,280.67,0.0
gfx942,80,1,6144,1536,torch.float8_e4m3fnuz,cktile,2,0,6.5943,a8w8_bpreshuffle_cktile_0x0x8x4x1x0x0x0x0x1_16x64x512_1x4x1_16x16x64_default,2.86,1433.21,0.0
gfx942,80,1,6144,2048,torch.float8_e4m3fnuz,ck,108,0,7.2339,a8w8_bpreshuffle_256x16x64x256_16x16_16x16_16x16x1_16x16x1_1x16x1x16_4x4x1_1x1_intrawave_v1,3.48,1741.42,0.0
gfx942,80,2,6144,1536,torch.float8_e4m3fnuz,ck,11,0,6.887,a8w8_bpreshuffle_256x16x64x512_16x16_16x16_32x8x1_32x8x1_1x16x1x16_4x4x1_1x1_intrawave_v1,5.48,1374.3,0.0
gfx942,80,2,6144,2048,torch.float8_e4m3fnuz,ck,15,0,7.1515,a8w8_bpreshuffle_256x16x64x256_16x16_16x16_16x16x1_16x16x1_1x16x1x16_4x4x1_1x1_intrawave_v1,7.04,1763.49,0.0
gfx942,80,4,6144,2048,torch.float8_e4m3fnuz,ck,15,0,7.2233,a8w8_bpreshuffle_256x16x64x256_16x16_16x16_16x16x1_16x16x1_1x16x1x16_4x4x1_1x1_intrawave_v1,13.94,1749.93,0.0
gfx942,80,8,6144,1536,torch.float8_e4m3fnuz,ck,15,0,6.7874,a8w8_bpreshuffle_256x16x64x256_16x16_16x16_16x16x1_16x16x1_1x16x1x16_4x4x1_1x1_intrawave_v1,22.25,1406.69,0.0
gfx942,80,8,6144,2048,torch.float8_e4m3fnuz,ck,10,0,7.2185,a8w8_bpreshuffle_128x16x32x512_16x16_16x16_32x4x1_32x4x1_1x16x1x8_4x4x1_1x1_intrawave_v1,27.89,1759.04,0.0
gfx942,80,16,6144,1536,torch.float8_e4m3fnuz,ck,15,0,6.8626,a8w8_bpreshuffle_256x16x64x256_16x16_16x16_16x16x1_16x16x1_1x16x1x16_4x4x1_1x1_intrawave_v1,44.01,1407.39,0.0
gfx942,80,16,6144,2048,torch.float8_e4m3fnuz,ck,10,0,7.1325,a8w8_bpreshuffle_128x16x32x512_16x16_16x16_32x4x1_32x4x1_1x16x1x8_4x4x1_1x1_intrawave_v1,56.45,1796.32,0.0
gfx942,80,24,6144,1536,torch.float8_e4m3fnuz,ck,112,0,7.9822,a8w8_bpreshuffle_256x32x64x256_16x16_16x16_16x16x1_16x16x1_1x32x1x8_8x8x1_2x1_intrawave_v1,56.75,1223.84,0.0
gfx942,80,24,6144,2048,torch.float8_e4m3fnuz,ck,112,0,9.602,a8w8_bpreshuffle_256x32x64x256_16x16_16x16_16x16x1_16x16x1_1x32x1x8_8x8x1_2x1_intrawave_v1,62.9,1346.28,0.0
gfx942,80,32,6144,1536,torch.float8_e4m3fnuz,cktile,9,0,8.5006,a8w8_bpreshuffle_cktile_0x0x8x4x1x0x0x0x0x1_32x64x512_1x4x1_16x16x64_default,71.05,1162.22,0.0
gfx942,80,32,6144,2048,torch.float8_e4m3fnuz,ck,11,0,9.3699,a8w8_bpreshuffle_256x16x64x512_16x16_16x16_32x8x1_32x8x1_1x16x1x16_4x4x1_1x1_intrawave_v1,85.95,1391.87,0.0
gfx942,80,48,6144,1536,torch.float8_e4m3fnuz,ck,118,0,9.3954,a8w8_bpreshuffle_256x16x128x256_16x16_16x16_16x16x1_16x16x1_1x16x1x16_8x8x1_1x2_intrawave_v1,96.43,1075.07,0.0
gfx942,80,48,6144,2048,torch.float8_e4m3fnuz,ck,120,0,10.612,a8w8_bpreshuffle_256x48x128x256_16x16_16x16_16x16x1_16x16x1_1x16x1x16_8x8x1_1x2_intrawave_v1,113.83,1250.57,0.0
gfx942,80,64,6144,1536,torch.float8_e4m3fnuz,ck,126,0,10.8678,a8w8_bpreshuffle_256x32x192x256_16x16_16x16_16x16x1_16x16x1_1x32x1x8_8x8x1_2x1_intrawave_v1,111.15,949.77,0.0
gfx942,80,64,6144,2048,torch.float8_e4m3fnuz,ck,126,0,11.864,a8w8_bpreshuffle_256x32x192x256_16x16_16x16_16x16x1_16x16x1_1x32x1x8_8x8x1_2x1_intrawave_v1,135.76,1137.93,0.0
gfx942,80,96,6144,2048,torch.float8_e4m3fnuz,ck,119,0,13.4719,a8w8_bpreshuffle_256x32x128x256_16x16_16x16_16x16x1_16x16x1_1x16x1x16_8x8x1_1x2_intrawave_v1,179.33,1036.17,0.0
gfx942,80,128,6144,1536,torch.float8_e4m3fnuz,ck,120,0,13.8361,a8w8_bpreshuffle_256x48x128x256_16x16_16x16_16x16x1_16x16x1_1x16x1x16_8x8x1_1x2_intrawave_v1,174.61,809.96,0.0
gfx942,80,128,6144,2048,torch.float8_e4m3fnuz,ck,120,0,15.8529,a8w8_bpreshuffle_256x48x128x256_16x16_16x16_16x16x1_16x16x1_1x16x1x16_8x8x1_1x2_intrawave_v1,203.19,909.48,0.0
gfx942,80,192,6144,2048,torch.float8_e4m3fnuz,ck,121,0,18.651,a8w8_bpreshuffle_256x64x128x256_16x16_16x16_16x16x1_16x16x1_1x16x1x16_8x8x1_1x2_intrawave_v3,259.07,822.23,0.0
gfx942,80,256,6144,1536,torch.float8_e4m3fnuz,ck,86,0,21.3925,a8w8_bpreshuffle_256x96x128x128_16x16_16x16_8x32x1_8x32x1_1x32x1x8_8x8x1_2x1_intrawave_v3,225.87,606.57,0.0
gfx942,80,256,6144,2048,torch.float8_e4m3fnuz,ck,128,0,25.2544,a8w8_bpreshuffle_256x64x192x256_16x16_16x16_16x16x1_16x16x1_1x32x1x8_8x8x1_2x1_intrawave_v3,255.1,643.57,0.0
gfx942,80,384,6144,1536,torch.float8_e4m3fnuz,ck,70,0,27.0949,a8w8_bpreshuffle_256x128x128x128_16x16_16x16_8x32x1_8x32x1_1x32x1x8_8x8x1_2x1_intrawave_v3,267.5,544.22,0.0
gfx942,80,384,6144,2048,torch.float8_e4m3fnuz,ck,70,0,31.8749,a8w8_bpreshuffle_256x128x128x128_16x16_16x16_8x32x1_8x32x1_1x32x1x8_8x8x1_2x1_intrawave_v3,303.18,567.47,0.0
gfx942,80,512,6144,2048,torch.float8_e4m3fnuz,ck,85,0,41.1373,a8w8_bpreshuffle_256x64x128x128_16x16_16x16_8x32x1_8x32x1_1x32x1x8_8x8x1_2x1_intrawave_v3,313.22,484.3,0.0
gfx942,80,768,6144,1536,torch.float8_e4m3fnuz,ck,93,0,46.3911,a8w8_bpreshuffle_256x64x192x128_16x16_16x16_8x32x1_8x32x1_1x32x1x8_8x8x1_2x1_intrawave_v3,312.46,432.28,0.0
gfx942,80,768,6144,2048,torch.float8_e4m3fnuz,ck,93,0,55.3332,a8w8_bpreshuffle_256x64x192x128_16x16_16x16_8x32x1_8x32x1_1x32x1x8_8x8x1_2x1_intrawave_v3,349.29,426.38,0.0
gfx942,80,1024,6144,2048,torch.float8_e4m3fnuz,ck,0,0,72.1268,a8w8_bpreshuffle_256x128x128x128_16x16_16x16_8x32x1_8x32x1_1x32x1x8_8x8x1_2x1_intrawave_v3,357.28,377.99,0.0
gfx942,80,1536,6144,1536,torch.float8_e4m3fnuz,cktile,54,0,82.4849,a8w8_bpreshuffle_cktile_0x0x8x4x1x0x0x0x0x2_64x192x128_1x4x1_16x16x64_default,351.47,371.84,0.0
gfx942,80,1536,6144,2048,torch.float8_e4m3fnuz,cktile,54,0,99.0178,a8w8_bpreshuffle_cktile_0x0x8x4x1x0x0x0x0x2_64x192x128_1x4x1_16x16x64_default,390.38,349.46,0.0
gfx942,80,2048,6144,1536,torch.float8_e4m3fnuz,ck,93,0,107.9766,a8w8_bpreshuffle_256x64x192x128_16x16_16x16_8x32x1_8x32x1_1x32x1x8_8x8x1_2x1_intrawave_v3,357.99,349.6,0.0
gfx942,80,2048,6144,2048,torch.float8_e4m3fnuz,cktile,48,0,131.1212,a8w8_bpreshuffle_cktile_0x0x8x4x1x0x0x0x0x2_64x256x128_1x4x1_16x16x64_default,393.07,319.88,0.0
gfx942,80,3072,6144,1536,torch.float8_e4m3fnuz,cktile,48,0,151.2664,a8w8_bpreshuffle_cktile_0x0x8x4x1x0x0x0x0x2_64x256x128_1x4x1_16x16x64_default,383.31,343.13,0.0
gfx942,80,3072,6144,2048,torch.float8_e4m3fnuz,cktile,48,0,185.4206,a8w8_bpreshuffle_cktile_0x0x8x4x1x0x0x0x0x2_64x256x128_1x4x1_16x16x64_default,416.94,305.38,0.0
gfx942,80,4096,6144,1536,torch.float8_e4m3fnuz,cktile,48,0,197.0198,a8w8_bpreshuffle_cktile_0x0x8x4x1x0x0x0x0x2_64x256x128_1x4x1_16x16x64_default,392.39,335.3,0.0
gfx942,80,4096,6144,2048,torch.float8_e4m3fnuz,ck,68,0,239.3494,a8w8_bpreshuffle_256x128x192x128_16x16_16x16_8x32x1_8x32x1_1x32x1x8_8x8x1_2x1_intrawave_v3,430.66,297.9,0.0
gfx942,80,8192,6144,1536,torch.float8_e4m3fnuz,cktile,48,0,376.6401,a8w8_bpreshuffle_cktile_0x0x8x4x1x0x0x0x0x2_64x256x128_1x4x1_16x16x64_default,410.52,325.73,0.0
gfx942,80,8192,6144,2048,torch.float8_e4m3fnuz,cktile,48,0,471.813,a8w8_bpreshuffle_cktile_0x0x8x4x1x0x0x0x0x2_64x256x128_1x4x1_16x16x64_default,436.95,275.58,0.0
gfx942,80,16384,6144,1536,torch.float8_e4m3fnuz,cktile,165,0,747.4159,a8w8_bpreshuffle_cktile_0x0x8x4x1x0x0x0x0x3_128x128x64_1x4x1_16x16x64_default,413.74,315.66,0.0
gfx942,80,16384,6144,2048,torch.float8_e4m3fnuz,cktile,48,0,913.9696,a8w8_bpreshuffle_cktile_0x0x8x4x1x0x0x0x0x2_64x256x128_1x4x1_16x16x64_default,451.13,270.76,0.0
gfx942,80,32768,6144,1536,torch.float8_e4m3fnuz,cktile,41,0,1465.8982,a8w8_bpreshuffle_cktile_0x0x8x4x1x0x0x0x0x2_128x128x64_1x4x1_16x16x64_default,421.91,315.45,0.0
gfx942,80,32768,6144,2048,torch.float8_e4m3fnuz,cktile,48,0,1852.0319,a8w8_bpreshuffle_cktile_0x0x8x4x1x0x0x0x0x2_64x256x128_1x4x1_16x16x64_default,445.26,260.44,0.0
