aiter/configs/model_configs/gptoss_fp8fp4_tuned_fmoe.csv
gfx,cu_num,token,model_dim,inter_dim,expert,topk,act_type,dtype,q_dtype_a,q_dtype_w,q_type,use_g1u1,doweight_stage1,block_m,ksplit,us1,kernelName1,err1,us2,kernelName2,err2,us,run_1stage,xbf16,flat,tflops,bw,_tag
gfx950,256,512,3072,3072,128,4,ActivationType.Swiglu,torch.bfloat16,torch.float8_e4m3fn,torch.float4_e2m1fn_x2,QuantType.per_1x32,1,0,32,0,214.3544,flydsl_moe1_afp8_wfp4_bf16_t32x128x256_w2_gui_fp8,0.0%,111.631,flydsl_moe2_afp8_wfp4_bf16_t32x256x256_atomic_bnt2_persist,0.0%,325.9854,0,0,0,355.73,11131.16,
gfx950,256,1024,3072,3072,128,4,ActivationType.Swiglu,torch.bfloat16,torch.float8_e4m3fn,torch.float4_e2m1fn_x2,QuantType.per_1x32,1,0,64,0,235.2077,flydsl_moe1_afp8_wfp4_bf16_t64x256x256_gui_fp8,0.0%,125.5088,flydsl_moe2_afp8_wfp4_bf16_t64x256x256_atomic_bnt2,0.0%,360.7165,0,0,0,642.97,10072.5,
gfx950,256,2048,3072,3072,128,4,ActivationType.Swiglu,torch.bfloat16,torch.float8_e4m3fn,torch.float4_e2m1fn_x2,QuantType.per_1x32,1,0,64,0,312.5584,flydsl_moe1_afp8_wfp4_bf16_t64x256x256_w2_bnt0_gui_fp8,0.0%,172.1029,flydsl_moe2_afp8_wfp4_bf16_t64x128x256_atomic_persist,0.0%,484.6613,0,0,0,957.07,7516.08,
gfx950,256,4096,3072,3072,128,4,ActivationType.Swiglu,torch.bfloat16,torch.float8_e4m3fn,torch.float4_e2m1fn_x2,QuantType.per_1x32,1,0,128,0,442.3352,flydsl_moe1_afp8_wfp4_bf16_t128x256x256_w2_bnt0_gui_fp8,0.0%,256.1523,flydsl_moe2_afp8_wfp4_bf16_t64x128x256_atomic_persist_sbm128,0.0%,698.4875,0,0,0,1328.17,5242.22,
gfx950,256,8192,3072,3072,128,4,ActivationType.Swiglu,torch.bfloat16,torch.float8_e4m3fn,torch.float4_e2m1fn_x2,QuantType.per_1x32,1,0,128,0,714.6281,flydsl_moe1_afp8_wfp4_bf16_t128x256x256_bnt0_gui_fp8,0.0%,413.5452,flydsl_moe2_afp8_wfp4_bf16_t64x256x256_atomic_persist_sbm128,0.0%,1128.1733,0,0,0,1644.63,3279.08,
gfx950,256,16384,3072,3072,128,4,ActivationType.Swiglu,torch.bfloat16,torch.float8_e4m3fn,torch.float4_e2m1fn_x2,QuantType.per_1x32,1,0,128,0,1356.5778,flydsl_moe1_afp8_wfp4_bf16_t128x256x256_w2_bnt0_gui_fp8,0.0%,731.3886,flydsl_moe2_afp8_wfp4_bf16_t64x256x256_atomic_sbm128,0.0%,2087.9664,0,0,0,1777.26,1807.92,
gfx950,256,32768,3072,3072,128,4,ActivationType.Swiglu,torch.bfloat16,torch.float8_e4m3fn,torch.float4_e2m1fn_x2,QuantType.per_1x32,1,0,64,0,2474.7814,flydsl_moe1_afp8_wfp4_bf16_t64x256x256_w2_bnt0_gui_fp8,0.0%,1348.5732,flydsl_moe2_afp8_wfp4_bf16_t64x256x256_atomic_xcd4_persist,0.0%,3823.3546,0,0,0,1941.15,1026.81,
gfx950,256,1,3072,3072,128,4,ActivationType.Swiglu,torch.bfloat16,torch.float8_e4m3fn,torch.float4_e2m1fn_x2,QuantType.per_1x32,1,0,32,0,12.2584,flydsl_moe1_afp8_wfp4_bf16_t32x128x256_gui_fp8,0.0%,13.2317,flydsl_moe2_afp8_wfp4_bf16_t16x128x256_reduce_bnt2_sbm32,0.0%,25.4901,0,0,0,8.89,142168.44,
gfx950,256,2,3072,3072,128,4,ActivationType.Swiglu,torch.bfloat16,torch.float8_e4m3fn,torch.float4_e2m1fn_x2,QuantType.per_1x32,1,0,32,0,17.1967,flydsl_moe1_afp8_wfp4_bf16_t32x64x256_w3_gui_kw2_fp8,0.0%,16.0847,flydsl_moe2_afp8_wfp4_bf16_t16x128x256_reduce_sbm32,0.0%,33.2814,0,0,0,13.61,108886.56,
gfx950,256,4,3072,3072,128,4,ActivationType.Swiglu,torch.bfloat16,torch.float8_e4m3fn,torch.float4_e2m1fn_x2,QuantType.per_1x32,1,0,32,0,29.1166,flydsl_moe1_afp8_wfp4_bf16_t32x128x256_w3_gui_fp8,0.0%,20.1652,flydsl_moe2_afp8_wfp4_bf16_t16x128x256_reduce_bnt2_persist_sbm32,0.0%,49.2818,0,0,0,18.38,73534.56,
gfx950,256,8,3072,3072,128,4,ActivationType.Swiglu,torch.bfloat16,torch.float8_e4m3fn,torch.float4_e2m1fn_x2,QuantType.per_1x32,1,0,32,0,51.064,flydsl_moe1_afp8_wfp4_bf16_t32x128x256_w3_gui_xcd4_fp8,0.0%,33.1317,flydsl_moe2_afp8_wfp4_bf16_t32x128x128_reduce,0.0%,84.1957,0,0,0,21.52,43042.01,
gfx950,256,16,3072,3072,128,4,ActivationType.Swiglu,torch.bfloat16,torch.float8_e4m3fn,torch.float4_e2m1fn_x2,QuantType.per_1x32,1,0,32,0,83.5682,flydsl_moe1_afp8_wfp4_bf16_t32x128x256_w4_gui_fp8,0.0%,52.9328,flydsl_moe2_afp8_wfp4_bf16_t32x128x128_atomic_bnt2,0.0%,136.501,0,0,0,26.55,26549.45,
gfx950,256,32,3072,3072,128,4,ActivationType.Swiglu,torch.bfloat16,torch.float8_e4m3fn,torch.float4_e2m1fn_x2,QuantType.per_1x32,1,0,32,0,135.4245,flydsl_moe1_afp8_wfp4_bf16_t32x128x256_w4_gui_fp8,0.0%,81.1886,flydsl_moe2_afp8_wfp4_bf16_t32x128x128_reduce,0.0%,216.6131,0,0,0,33.46,16731.09,
gfx950,256,64,3072,3072,128,4,ActivationType.Swiglu,torch.bfloat16,torch.float8_e4m3fn,torch.float4_e2m1fn_x2,QuantType.per_1x32,1,0,32,0,174.9165,flydsl_moe1_afp8_wfp4_bf16_t32x128x256_w3_gui_fp8,0.0%,102.9172,flydsl_moe2_afp8_wfp4_bf16_t32x128x256_reduce_bnt2,0.0%,277.8337,0,0,0,52.17,13045.46,
gfx950,256,128,3072,3072,128,4,ActivationType.Swiglu,torch.bfloat16,torch.float8_e4m3fn,torch.float4_e2m1fn_x2,QuantType.per_1x32,1,0,32,0,190.2662,flydsl_moe1_afp8_wfp4_bf16_t32x128x256_w4_gui_fp8,0.0%,104.2409,cktile_a8w4_bm32,0.0%,294.5071,0,0,0,98.44,12308.9,
gfx950,256,256,3072,3072,128,4,ActivationType.Swiglu,torch.bfloat16,torch.float8_e4m3fn,torch.float4_e2m1fn_x2,QuantType.per_1x32,1,0,32,0,196.6964,flydsl_moe1_afp8_wfp4_bf16_t32x128x256_w4_gui_fp8,0.0%,109.2654,cktile_a8w4_bm32,0.0%,305.9618,0,0,0,189.51,11851.93,
gfx950,256,1,3072,3072,128,4,ActivationType.Swiglu,torch.bfloat16,torch.float8_e4m3fn,torch.float4_e2m1fn_x2,QuantType.per_1x32,1,0,32,0,22.9503,cktile_a8w4_bm32,0.0,18.0189,cktile_a8w4_bm32,0.0,40.9692,0,0,0,0.0,0.0,flydsl_fallback
gfx950,256,2,3072,3072,128,4,ActivationType.Swiglu,torch.bfloat16,torch.float8_e4m3fn,torch.float4_e2m1fn_x2,QuantType.per_1x32,1,0,32,0,27.827,cktile_a8w4_bm32,0.0,18.756,cktile_a8w4_bm32,0.0,46.583,0,0,0,0.0,0.0,flydsl_fallback
gfx950,256,4,3072,3072,128,4,ActivationType.Swiglu,torch.bfloat16,torch.float8_e4m3fn,torch.float4_e2m1fn_x2,QuantType.per_1x32,1,0,32,0,40.0191,cktile_a8w4_bm32,0.0,21.31,cktile_a8w4_bm32,0.0,61.3291,0,0,0,0.0,0.0,flydsl_fallback
gfx950,256,8,3072,3072,128,4,ActivationType.Swiglu,torch.bfloat16,torch.float8_e4m3fn,torch.float4_e2m1fn_x2,QuantType.per_1x32,1,0,32,0,62.7513,cktile_a8w4_bm32,0.0,33.3959,cktile_a8w4_bm32,0.0,96.1472,0,0,0,0.0,0.0,flydsl_fallback
gfx950,256,32,3072,3072,128,4,ActivationType.Swiglu,torch.bfloat16,torch.float8_e4m3fn,torch.float4_e2m1fn_x2,QuantType.per_1x32,1,0,32,0,152.40320000000003,cktile_a8w4_bm32,0.0,83.0501,cktile_a8w4_bm32,0.0,235.4533,0,0,0,0.0,0.0,flydsl_fallback
gfx950,256,128,3072,3072,128,4,ActivationType.Swiglu,torch.bfloat16,torch.float8_e4m3fn,torch.float4_e2m1fn_x2,QuantType.per_1x32,1,0,32,0,206.5581,cktile_a8w4_bm32,0.0,104.2409,cktile_a8w4_bm32,0.0,310.799,0,0,0,0.0,0.0,flydsl_fallback
gfx950,256,256,3072,3072,128,4,ActivationType.Swiglu,torch.bfloat16,torch.float8_e4m3fn,torch.float4_e2m1fn_x2,QuantType.per_1x32,1,0,32,0,218.0959,cktile_a8w4_bm32,0.0,109.2654,cktile_a8w4_bm32,0.0,327.3613,0,0,0,0.0,0.0,flydsl_fallback
gfx950,256,512,3072,3072,128,4,ActivationType.Swiglu,torch.bfloat16,torch.float8_e4m3fn,torch.float4_e2m1fn_x2,QuantType.per_1x32,1,0,32,0,527.0715,cktile_a8w4_bm32,0.0,117.3402,cktile_a8w4_bm32,0.0,644.4117,0,0,0,0.0,0.0,flydsl_fallback
gfx950,256,1024,3072,3072,128,4,ActivationType.Swiglu,torch.bfloat16,torch.float8_e4m3fn,torch.float4_e2m1fn_x2,QuantType.per_1x32,1,0,32,0,286.4048,cktile_a8w4_bm32,0.0,142.6674,cktile_a8w4_bm32,0.0,429.0722,0,0,0,0.0,0.0,flydsl_fallback
gfx950,256,2048,3072,3072,128,4,ActivationType.Swiglu,torch.bfloat16,torch.float8_e4m3fn,torch.float4_e2m1fn_x2,QuantType.per_1x32,1,0,32,0,446.6267,cktile_a8w4_bm32,0.0,181.4069,cktile_a8w4_bm32,0.0,628.0336,0,0,0,0.0,0.0,flydsl_fallback
gfx950,256,4096,3072,3072,128,4,ActivationType.Swiglu,torch.bfloat16,torch.float8_e4m3fn,torch.float4_e2m1fn_x2,QuantType.per_1x32,1,0,32,0,786.0193,cktile_a8w4_bm32,0.0,275.9191,cktile_a8w4_bm32,0.0,1061.9384,0,0,0,0.0,0.0,flydsl_fallback
gfx950,256,8192,3072,3072,128,4,ActivationType.Swiglu,torch.bfloat16,torch.float8_e4m3fn,torch.float4_e2m1fn_x2,QuantType.per_1x32,1,0,32,0,1478.4233,cktile_a8w4_bm32,0.0,480.9397,cktile_a8w4_bm32,0.0,1959.363,0,0,0,0.0,0.0,flydsl_fallback
gfx950,256,16384,3072,3072,128,4,ActivationType.Swiglu,torch.bfloat16,torch.float8_e4m3fn,torch.float4_e2m1fn_x2,QuantType.per_1x32,1,0,32,0,2752.7649,cktile_a8w4_bm32,0.0,908.23,cktile_a8w4_bm32,0.0,3660.9949,0,0,0,0.0,0.0,flydsl_fallback
gfx950,256,32768,3072,3072,128,4,ActivationType.Swiglu,torch.bfloat16,torch.float8_e4m3fn,torch.float4_e2m1fn_x2,QuantType.per_1x32,1,0,32,0,5411.816400000001,cktile_a8w4_bm32,0.0,1750.1288,cktile_a8w4_bm32,0.0,7161.9452,0,0,0,0.0,0.0,flydsl_fallback
