aiter/ops/triton/configs/gfx950-GMM.json
{
    "gmm": {
        "default": {
            "BLOCK_SIZE_M": 256,
            "BLOCK_SIZE_K": 64,
            "BLOCK_SIZE_N": 256,
            "GROUP_SIZE": 4,
            "GRID_DIM": 256,
            "num_warps": 4,
            "num_stages": 2
        }
    },
    "ptgmm": {
        "default": {
            "BLOCK_SIZE_M": 64,
            "BLOCK_SIZE_K": 256,
            "BLOCK_SIZE_N": 256,
            "GROUP_SIZE": 1,
            "GRID_DIM": 256,
            "num_warps": 8,
            "num_stages": 1
        },
        "accumulate": {
            "BLOCK_SIZE_M": 64,
            "BLOCK_SIZE_K": 128,
            "BLOCK_SIZE_N": 128,
            "GROUP_SIZE": 1,
            "GRID_DIM": 256,
            "num_warps": 8,
            "num_stages": 1
        }
    },
    "nptgmm": {
        "default": {
            "BLOCK_SIZE_M": 64,
            "BLOCK_SIZE_K": 256,
            "BLOCK_SIZE_N": 256,
            "GROUP_SIZE": 1,
            "num_warps": 8,
            "num_stages": 1
        },
        "accumulate": {
            "BLOCK_SIZE_M": 64,
            "BLOCK_SIZE_K": 128,
            "BLOCK_SIZE_N": 128,
            "GROUP_SIZE": 1,
            "num_warps": 8,
            "num_stages": 1
        }
    }
}